created_utc,id,num_comments,score,selftext,subreddit,title,created,d_
2016-02-01 08:38:01,43nmbr,15,0,[removed],trans,Hyper sensitivity,1454341081.0,"{'created_utc': 1454315881, 'id': '43nmbr', 'num_comments': 15, 'score': 0, 'selftext': '[removed]', 'subreddit': 'trans', 'title': 'Hyper sensitivity', 'created': 1454341081.0}"
2016-02-01 15:09:21,43otz9,1,0,[removed],trans,Crossdressing daddy gift ideas!!,1454364561.0,"{'created_utc': 1454339361, 'id': '43otz9', 'num_comments': 1, 'score': 0, 'selftext': '[removed]', 'subreddit': 'trans', 'title': 'Crossdressing daddy gift ideas!!', 'created': 1454364561.0}"
2016-02-01 19:07:24,43q0q1,19,15,"I have worked with young people since I was 16, in all capacities. I've cared and cried and been to funerals which never should have happened, and walk into work each day wanting to stop another.

Right now I have three trans youth I deal with day to day (2 post, 1 pre). They hate and reject anything I might say based solely on my race, and sexual preference. In three and a half weeks, I have not finished a sentence, let alone a session of counselling (which is done individually). I'm white and hetero, what can I ever help with?

How do I breach this barrier with them? You all know we cannot change who we are. I AM ME---I know this does not devalue the love and effort I have/will give. I want them to understand that the person beneath my skin and my sexual preference has nothing to do with my skills, dedication and love for my job. I sure ain't doing this for the money-I'm doing this 'cause it's fucking right.

Help me break this wall. I'll tell you, it's a goddamn strong one, thought. I've been around the block before with all manner of issues, and come out with young adults I am so goddamn proud of.

Here though-- I cannot finish a sentence without ""white"", ""white guy"", ""privilege"" or something along the lines of ""hetero-shit"" interrupting what I'm trying to say. I currently live in a small community, but cut my social service teeth in Vancouver, BC.

I'm gonna win them over, because I've done it many times before. But I want your help with how to best do it from an approach I am not part of, and do not (*personally) understand. I am here for humans. I am here for compassion, and I return day in day out to my work because I believe love and understanding will smooth over and then/conquer all.
Your help is greatly appreciated, and immediately applied.",trans,"How do I help post&amp;pre-op trans youth as a white, hetero male? (caring and experienced youth worker experiencing hateful backlash b/c of orientation and race).",1454378844.0,"{'created_utc': 1454353644, 'id': '43q0q1', 'num_comments': 19, 'score': 15, 'selftext': 'I have worked with young people since I was 16, in all capacities. I\'ve cared and cried and been to funerals which never should have happened, and walk into work each day wanting to stop another.\n\nRight now I have three trans youth I deal with day to day (2 post, 1 pre). They hate and reject anything I might say based solely on my race, and sexual preference. In three and a half weeks, I have not finished a sentence, let alone a session of counselling (which is done individually). I\'m white and hetero, what can I ever help with?\n\nHow do I breach this barrier with them? You all know we cannot change who we are. I AM ME---I know this does not devalue the love and effort I have/will give. I want them to understand that the person beneath my skin and my sexual preference has nothing to do with my skills, dedication and love for my job. I sure ain\'t doing this for the money-I\'m doing this \'cause it\'s fucking right.\n\nHelp me break this wall. I\'ll tell you, it\'s a goddamn strong one, thought. I\'ve been around the block before with all manner of issues, and come out with young adults I am so goddamn proud of.\n\nHere though-- I cannot finish a sentence without ""white"", ""white guy"", ""privilege"" or something along the lines of ""hetero-shit"" interrupting what I\'m trying to say. I currently live in a small community, but cut my social service teeth in Vancouver, BC.\n\nI\'m gonna win them over, because I\'ve done it many times before. But I want your help with how to best do it from an approach I am not part of, and do not (*personally) understand. I am here for humans. I am here for compassion, and I return day in day out to my work because I believe love and understanding will smooth over and then/conquer all.\nYour help is greatly appreciated, and immediately applied.', 'subreddit': 'trans', 'title': 'How do I help post&amp;pre-op trans youth as a white, hetero male? (caring and experienced youth worker experiencing hateful backlash b/c of orientation and race).', 'created': 1454378844.0}"
2016-02-03 00:33:56,43x8sg,5,9,"My uni recently announced that Caitlyn Jenner is speaking during our week-long queer celebration this month. The vitriol in the comments section is overwhelming. They may not even be students at our school (anyone can leave a comment), but they're making the trans/GQ students feel unsafe on campus. Ideas, advice, or support?

(Content warning for the comments section)

http://www.thedp.com/article/2016/01/spec-connaissance-announces-speaker
",trans,Need help with transphobic comments,1454484836.0,"{'created_utc': 1454459636, 'id': '43x8sg', 'num_comments': 5, 'score': 9, 'selftext': ""My uni recently announced that Caitlyn Jenner is speaking during our week-long queer celebration this month. The vitriol in the comments section is overwhelming. They may not even be students at our school (anyone can leave a comment), but they're making the trans/GQ students feel unsafe on campus. Ideas, advice, or support?\n\n(Content warning for the comments section)\n\nhttp://www.thedp.com/article/2016/01/spec-connaissance-announces-speaker\n"", 'subreddit': 'trans', 'title': 'Need help with transphobic comments', 'created': 1454484836.0}"
2016-02-03 19:15:02,441cke,6,2,"I just asked a person that looked male why their name was a female form rather than a male form.

I really meant no offense and you won't let me apologise so I'll apologise here instead.

I was thinking maybe it was a cultural thing, like French men being called Michelle rather than Michael or something. Sorry about that.

Trans people here I'd love to read about your experiences, perspectives, and how you deal with unfortunate questions.",trans,Asked a too personal question apparently,1454552102.0,"{'created_utc': 1454526902, 'id': '441cke', 'num_comments': 6, 'score': 2, 'selftext': ""I just asked a person that looked male why their name was a female form rather than a male form.\n\nI really meant no offense and you won't let me apologise so I'll apologise here instead.\n\nI was thinking maybe it was a cultural thing, like French men being called Michelle rather than Michael or something. Sorry about that.\n\nTrans people here I'd love to read about your experiences, perspectives, and how you deal with unfortunate questions."", 'subreddit': 'trans', 'title': 'Asked a too personal question apparently', 'created': 1454552102.0}"
2016-02-03 22:09:54,4426fs,7,30,,trans,My University is piloting gender neutral washrooms! A step in the right direction.,1454562594.0,"{'created_utc': 1454537394, 'id': '4426fs', 'num_comments': 7, 'score': 30, 'selftext': '', 'subreddit': 'trans', 'title': 'My University is piloting gender neutral washrooms! A step in the right direction.', 'created': 1454562594.0}"
2016-02-04 01:31:11,44326m,9,5,"I am possibly going to start HRT soon, but I'm getting worried about the price and such. I am currently on my parents insurance, but only for another 6 months or so and I can't really afford health insurance on my own. I know it's super important to go to the doctor regularly for blood tests and such so I'm worried about being able to afford everything after the first 6 months. So if anyone knows a ballpark on seeing an endocrinologist and prescription costs for estrogen and hopefully perestrogen. I know it's asking for a lot and the endocrinologist can probably answer a lot of the questions, but it would make me feel better to know now.

Thanks in advance.",trans,Cost of MTF HRT,1454574671.0,"{'created_utc': 1454549471, 'id': '44326m', 'num_comments': 9, 'score': 5, 'selftext': ""I am possibly going to start HRT soon, but I'm getting worried about the price and such. I am currently on my parents insurance, but only for another 6 months or so and I can't really afford health insurance on my own. I know it's super important to go to the doctor regularly for blood tests and such so I'm worried about being able to afford everything after the first 6 months. So if anyone knows a ballpark on seeing an endocrinologist and prescription costs for estrogen and hopefully perestrogen. I know it's asking for a lot and the endocrinologist can probably answer a lot of the questions, but it would make me feel better to know now.\n\nThanks in advance."", 'subreddit': 'trans', 'title': 'Cost of MTF HRT', 'created': 1454574671.0}"
2016-02-04 02:54:22,443ekb,0,7,,trans,sam zine (art zine focused on gender in an lgbt+ context by trans artists) has opened its second call for submissions,1454579662.0,"{'created_utc': 1454554462, 'id': '443ekb', 'num_comments': 0, 'score': 7, 'selftext': '', 'subreddit': 'trans', 'title': 'sam zine (art zine focused on gender in an lgbt+ context by trans artists) has opened its second call for submissions', 'created': 1454579662.0}"
2016-02-04 23:02:49,447w5x,6,12,"Before I fall asleep, I often put on a random movie from NetFlix without reading its description... just some noise to fall asleep to. Last night's title was the New Girlfriend, which turned out to be a movie about a trans woman acceptance of self. At first, I thought it was going to completely suck because it started out with crossdressing (I expect it to become a fetishesque-based movie)... but then pleasantly turned into much more of a story. It's a French movie, but if you haven't seen it, I recommend watching it... it has a bit of cheese, but what a great little story. :)",trans,Movie: The New Girlfriend,1454652169.0,"{'created_utc': 1454626969, 'id': '447w5x', 'num_comments': 6, 'score': 12, 'selftext': ""Before I fall asleep, I often put on a random movie from NetFlix without reading its description... just some noise to fall asleep to. Last night's title was the New Girlfriend, which turned out to be a movie about a trans woman acceptance of self. At first, I thought it was going to completely suck because it started out with crossdressing (I expect it to become a fetishesque-based movie)... but then pleasantly turned into much more of a story. It's a French movie, but if you haven't seen it, I recommend watching it... it has a bit of cheese, but what a great little story. :)"", 'subreddit': 'trans', 'title': 'Movie: The New Girlfriend', 'created': 1454652169.0}"
2016-02-05 06:45:00,449ot4,1,1,[deleted],trans,Trans Ally Video,1454679900.0,"{'created_utc': 1454654700, 'id': '449ot4', 'num_comments': 1, 'score': 1, 'selftext': '[deleted]', 'subreddit': 'trans', 'title': 'Trans Ally Video', 'created': 1454679900.0}"
2016-02-05 07:06:56,449r4w,1,0,,trans,Trans Ally Video,1454681216.0,"{'created_utc': 1454656016, 'id': '449r4w', 'num_comments': 1, 'score': 0, 'selftext': '', 'subreddit': 'trans', 'title': 'Trans Ally Video', 'created': 1454681216.0}"
2016-02-05 08:29:46,449z0r,2,11,,trans,"Danish study shows that MtF have to wait approx. 8 years to get permission for surgery. Damn, thats a long time!",1454686186.0,"{'created_utc': 1454660986, 'id': '449z0r', 'num_comments': 2, 'score': 11, 'selftext': '', 'subreddit': 'trans', 'title': 'Danish study shows that MtF have to wait approx. 8 years to get permission for surgery. Damn, thats a long time!', 'created': 1454686186.0}"
2016-02-05 20:06:41,44cld5,12,55,,trans,"Damned if you do, damned if you don't: School suspends trans boy for using boys’ restroom — after girls complained he was using theirs",1454728001.0,"{'created_utc': 1454702801, 'id': '44cld5', 'num_comments': 12, 'score': 55, 'selftext': '', 'subreddit': 'trans', 'title': ""Damned if you do, damned if you don't: School suspends trans boy for using boys’ restroom — after girls complained he was using theirs"", 'created': 1454728001.0}"
2016-02-06 04:38:12,44ept8,1,3,"(Wall of text inc.)

I'm (currently) a 24-year-old man with a wife and a 6-month-old son. I've fantasized about being a woman since junior high, but I've had little opportunity to indulge my fantasies, growing up in a conservative Christian household (I'm now Pagan). My wife knows, and she's bi, but I'm pretty sure she would have a hard time if I chose to go consistently feminine even part-time. I'm also concerned about the impact on my son if I switch around or fully transition. Obviously, there's potential for discrimination, loss of friends and family, and issues with work in store for me too (currently unemployed).

To make matters more difficult, I've got a bass voice, stick-like figure, masculine arms and legs, and a desire to keep my original sex organs. I'm not even sure if I want to grow my hair out and/or shave my limbs, because I don't know how much of the time I want to be which gender. I have a wig and makeup, plus some clothes, but I rarely get to use any of it. I regret to admit that the vast majority of trans women disgust me--including myself--because I've got a really high bar for ""passing""... which I feel terrible about. I know a few other trans people, but it always seems like they have an easier time than me. Cis women are worse; I get turned on *and* jealous. In any case, I can't help but find my original self, as a man, ugly.

I've been dealing with serious mental health issues over the past year, but my treatment is finally proving successful. Unfortunately, that's left me with a lot more time to dwell on my gender. I'm really just not sure what to do. My wife's made it clear that she doesn't want to deal with this curveball right now, what with our baby and her school and my (lack of) work, but I don't know how much longer I can handle the confusion and self-loathing.

So. Any advice?",trans,Seeking Advice,1454758692.0,"{'created_utc': 1454733492, 'id': '44ept8', 'num_comments': 1, 'score': 3, 'selftext': '(Wall of text inc.)\n\nI\'m (currently) a 24-year-old man with a wife and a 6-month-old son. I\'ve fantasized about being a woman since junior high, but I\'ve had little opportunity to indulge my fantasies, growing up in a conservative Christian household (I\'m now Pagan). My wife knows, and she\'s bi, but I\'m pretty sure she would have a hard time if I chose to go consistently feminine even part-time. I\'m also concerned about the impact on my son if I switch around or fully transition. Obviously, there\'s potential for discrimination, loss of friends and family, and issues with work in store for me too (currently unemployed).\n\nTo make matters more difficult, I\'ve got a bass voice, stick-like figure, masculine arms and legs, and a desire to keep my original sex organs. I\'m not even sure if I want to grow my hair out and/or shave my limbs, because I don\'t know how much of the time I want to be which gender. I have a wig and makeup, plus some clothes, but I rarely get to use any of it. I regret to admit that the vast majority of trans women disgust me--including myself--because I\'ve got a really high bar for ""passing""... which I feel terrible about. I know a few other trans people, but it always seems like they have an easier time than me. Cis women are worse; I get turned on *and* jealous. In any case, I can\'t help but find my original self, as a man, ugly.\n\nI\'ve been dealing with serious mental health issues over the past year, but my treatment is finally proving successful. Unfortunately, that\'s left me with a lot more time to dwell on my gender. I\'m really just not sure what to do. My wife\'s made it clear that she doesn\'t want to deal with this curveball right now, what with our baby and her school and my (lack of) work, but I don\'t know how much longer I can handle the confusion and self-loathing.\n\nSo. Any advice?', 'subreddit': 'trans', 'title': 'Seeking Advice', 'created': 1454758692.0}"
2016-02-06 06:52:33,44f5rj,1,6,,trans,Noted trans activist attacked on NYC subway; Attacker being sought,1454766753.0,"{'created_utc': 1454741553, 'id': '44f5rj', 'num_comments': 1, 'score': 6, 'selftext': '', 'subreddit': 'trans', 'title': 'Noted trans activist attacked on NYC subway; Attacker being sought', 'created': 1454766753.0}"
2016-02-06 15:56:41,44gq6e,16,14,"Tl; dr - Then being with a trans-man is not gay.

Without stepping into the mind-fuck that is social constructs, or the fact that this sentiment (X makes you gay) already has homophobic underpinnings that shouldn't be there in the first place, the opinion of men on trans-girls has a huge impact on (straight/pan/bi/+) trans-women's dating lives.

So when a guy says 'being with a trans-girl is gay', he's basically forced to say that being with a trans-man is not gay.  And I think most trans-men would not take too kindly to that :)

I think more people should be aware that being trans is not a choice, and that on the inside, that person is as much as the gender they are presenting as everyone else of that gender.  They just happen to have a mismatched equipment and a mismatched body-type (both controlled by unstable differentiation processes at birth based on hormonal levels)  I think there's a lot of 'acceptance' going around but without realization of this fact, that 'acceptance' is nothing more than a polite 'I totally support you doing you... Just like people that wear funny hats'",trans,'Being with a trans-girl makes you gay',1454799401.0,"{'created_utc': 1454774201, 'id': '44gq6e', 'num_comments': 16, 'score': 14, 'selftext': ""Tl; dr - Then being with a trans-man is not gay.\n\nWithout stepping into the mind-fuck that is social constructs, or the fact that this sentiment (X makes you gay) already has homophobic underpinnings that shouldn't be there in the first place, the opinion of men on trans-girls has a huge impact on (straight/pan/bi/+) trans-women's dating lives.\n\nSo when a guy says 'being with a trans-girl is gay', he's basically forced to say that being with a trans-man is not gay.  And I think most trans-men would not take too kindly to that :)\n\nI think more people should be aware that being trans is not a choice, and that on the inside, that person is as much as the gender they are presenting as everyone else of that gender.  They just happen to have a mismatched equipment and a mismatched body-type (both controlled by unstable differentiation processes at birth based on hormonal levels)  I think there's a lot of 'acceptance' going around but without realization of this fact, that 'acceptance' is nothing more than a polite 'I totally support you doing you... Just like people that wear funny hats'"", 'subreddit': 'trans', 'title': ""'Being with a trans-girl makes you gay'"", 'created': 1454799401.0}"
2016-02-07 10:48:23,44l4rq,11,18, ,trans,"Coming out in a little bit, wish me luck.",1454867303.0,"{'created_utc': 1454842103, 'id': '44l4rq', 'num_comments': 11, 'score': 18, 'selftext': ' ', 'subreddit': 'trans', 'title': 'Coming out in a little bit, wish me luck.', 'created': 1454867303.0}"
2016-02-07 22:05:36,44nuu1,6,3,,trans,Can a cis guy who wants to look more feminine/androgynous do estrogen therapy without fully transitioning?,1454907936.0,"{'created_utc': 1454882736, 'id': '44nuu1', 'num_comments': 6, 'score': 3, 'selftext': '', 'subreddit': 'trans', 'title': 'Can a cis guy who wants to look more feminine/androgynous do estrogen therapy without fully transitioning?', 'created': 1454907936.0}"
2016-02-07 22:36:53,44o0cw,2,16,,trans,Why does trans still have to be so tragic?,1454909813.0,"{'created_utc': 1454884613, 'id': '44o0cw', 'num_comments': 2, 'score': 16, 'selftext': '', 'subreddit': 'trans', 'title': 'Why does trans still have to be so tragic?', 'created': 1454909813.0}"
2016-02-08 15:27:40,44rd94,9,13,"I work at a school, though im not an actual teacher. I got clocked this morning by some kid in the hallways, not one of my students. He followed me around saying something to the effect of ""Hey lady, oh wait, no, it ain't a lady, its a (n-slur). That's somebody son. Thats a (n-slur)."" It kinda hurt a bit. I didnt know how to react so I just took selfies afterwards. I'm fabulous. God loves me. This is how They made me.
At least the kids aren't calling me fat anymore. 

My own students respect me though. They know me. I hope when they leave here and they meet others like me they understand us as people.",trans,Dealing with transphobic at work.,1454970460.0,"{'created_utc': 1454945260, 'id': '44rd94', 'num_comments': 9, 'score': 13, 'selftext': 'I work at a school, though im not an actual teacher. I got clocked this morning by some kid in the hallways, not one of my students. He followed me around saying something to the effect of ""Hey lady, oh wait, no, it ain\'t a lady, its a (n-slur). That\'s somebody son. Thats a (n-slur)."" It kinda hurt a bit. I didnt know how to react so I just took selfies afterwards. I\'m fabulous. God loves me. This is how They made me.\nAt least the kids aren\'t calling me fat anymore. \n\nMy own students respect me though. They know me. I hope when they leave here and they meet others like me they understand us as people.', 'subreddit': 'trans', 'title': 'Dealing with transphobic at work.', 'created': 1454970460.0}"
2016-02-09 10:44:24,44w3ze,0,1,,trans,Huge bаzze of lonelly girlz5 x,1455039864.0,"{'created_utc': 1455014664, 'id': '44w3ze', 'num_comments': 0, 'score': 1, 'selftext': '', 'subreddit': 'trans', 'title': 'Huge bаzze of lonelly girlz5 x', 'created': 1455039864.0}"
2016-02-09 15:49:00,44x9b1,8,8,[deleted],trans,Dating a transgender (FTM),1455058140.0,"{'created_utc': 1455032940, 'id': '44x9b1', 'num_comments': 8, 'score': 8, 'selftext': '[deleted]', 'subreddit': 'trans', 'title': 'Dating a transgender (FTM)', 'created': 1455058140.0}"
