created_utc,id,num_comments,score,selftext,subreddit,title,created,d_
2016-02-09 19:11:27,44ybvb,0,12,"Hello, I'm Kate.
I can help you to feminize your voice.

- I am using my own methodology which is based on approach that is personal. 
  It means that I do not stick to one method with everybody, but rather try to figure out what works for you personally.

- I am sure that anybody can feminize their voice.
  Depending on skill and diligence the process can take from month to half a year.

- And it is affordable.
  Any other voice feminization tutor will charge you twice as much. And will try for as long as he can - to keep you paying.

I ask for 11$ per lesson. One lesson lasts for 45 minutes. The best schedule is three lessons per week, but we can arrange any routine that suits you best.

First lesson is free and you pay only after the lessons.

I am available from 8am till 8pm UTC+0.

Here are my posts on transvoice subreddit when I did it for free: [here](https://www.reddit.com/r/transvoice/comments/3qu91b/voice_feminization_help/) and [here](https://www.reddit.com/r/transvoice/comments/3kds9k/voice_feminization_help/)

My skype is: **genkisgenki**

[My voice example](https://clyp.it/grs0lcpx)

Students' examples:

Student #1, examples recorded 22/12/2014 - 05/01/2016
[Before](https://clyp.it/1vgut4ln?token=ab4d15986ce20fd4cc4a99bc4a501556);
[After](https://clyp.it/niz4wc4q?token=5a6c2457f1a6cdc315c2e543fa31742b)

Student #2, examples recorded 13/09/2015 - 10/11/2015
[Before](https://clyp.it/v3kl3ruo?token=4369fc98fa70c8c61c09e71e460b1622);
[After](https://clyp.it/5uroywyo?token=caaac2af9d1c1bd3998c094ecdbe80fe);
[After(2)](https://clyp.it/4l43hf2q?token=00b557253d313b4313ea4aca93bfe66b)

Student #3, examples recorded 15/11/2015 - 07/01/2016
[Before](https://clyp.it/cfr3k0lg?token=32d9bc30bc820a3911647646600fe855);
[After](https://clyp.it/13cdeahl?token=0130afe00aed84950338a6af37428410)",trans,Voice Feminization Help,1455070287.0,"{'created_utc': 1455045087, 'id': '44ybvb', 'num_comments': 0, 'score': 12, 'selftext': ""Hello, I'm Kate.\nI can help you to feminize your voice.\n\n- I am using my own methodology which is based on approach that is personal. \n  It means that I do not stick to one method with everybody, but rather try to figure out what works for you personally.\n\n- I am sure that anybody can feminize their voice.\n  Depending on skill and diligence the process can take from month to half a year.\n\n- And it is affordable.\n  Any other voice feminization tutor will charge you twice as much. And will try for as long as he can - to keep you paying.\n\nI ask for 11$ per lesson. One lesson lasts for 45 minutes. The best schedule is three lessons per week, but we can arrange any routine that suits you best.\n\nFirst lesson is free and you pay only after the lessons.\n\nI am available from 8am till 8pm UTC+0.\n\nHere are my posts on transvoice subreddit when I did it for free: [here](https://www.reddit.com/r/transvoice/comments/3qu91b/voice_feminization_help/) and [here](https://www.reddit.com/r/transvoice/comments/3kds9k/voice_feminization_help/)\n\nMy skype is: **genkisgenki**\n\n[My voice example](https://clyp.it/grs0lcpx)\n\nStudents' examples:\n\nStudent #1, examples recorded 22/12/2014 - 05/01/2016\n[Before](https://clyp.it/1vgut4ln?token=ab4d15986ce20fd4cc4a99bc4a501556);\n[After](https://clyp.it/niz4wc4q?token=5a6c2457f1a6cdc315c2e543fa31742b)\n\nStudent #2, examples recorded 13/09/2015 - 10/11/2015\n[Before](https://clyp.it/v3kl3ruo?token=4369fc98fa70c8c61c09e71e460b1622);\n[After](https://clyp.it/5uroywyo?token=caaac2af9d1c1bd3998c094ecdbe80fe);\n[After(2)](https://clyp.it/4l43hf2q?token=00b557253d313b4313ea4aca93bfe66b)\n\nStudent #3, examples recorded 15/11/2015 - 07/01/2016\n[Before](https://clyp.it/cfr3k0lg?token=32d9bc30bc820a3911647646600fe855);\n[After](https://clyp.it/13cdeahl?token=0130afe00aed84950338a6af37428410)"", 'subreddit': 'trans', 'title': 'Voice Feminization Help', 'created': 1455070287.0}"
2016-02-11 01:54:38,456e3f,15,13,"So lately I've been trying to acquire some new female clothing (MtF). I had been finding it difficult to really do so due to the nerves of actually picking out/purchasing said clothes. Online ordering was also out of the question due to the fact that I live with my parents who occasionally open my mail. I had tried going to goodwill/thrift shops and telling myself that people don't care, but I still couldn't beat the nerves. I was quite bummed about the whole situation.

This week, however, I had a revelation. In. Store. Pickup. I went to Target.com and ordered some tops and skirts that I liked for in-store pickup. When it asked for a name for the order, I put a fake female name, then listed my name as an alt pick up. Then I just went in, asked to pick up ""Fake Female Name's"" order, and was sent on my way with my new wardrobe with  none the wiser.

TL;DR In-store Pickup",trans,Quick tip for my brothers and sisters who are apprehensive about purchasing new clothes,1455180878.0,"{'created_utc': 1455155678, 'id': '456e3f', 'num_comments': 15, 'score': 13, 'selftext': 'So lately I\'ve been trying to acquire some new female clothing (MtF). I had been finding it difficult to really do so due to the nerves of actually picking out/purchasing said clothes. Online ordering was also out of the question due to the fact that I live with my parents who occasionally open my mail. I had tried going to goodwill/thrift shops and telling myself that people don\'t care, but I still couldn\'t beat the nerves. I was quite bummed about the whole situation.\n\nThis week, however, I had a revelation. In. Store. Pickup. I went to Target.com and ordered some tops and skirts that I liked for in-store pickup. When it asked for a name for the order, I put a fake female name, then listed my name as an alt pick up. Then I just went in, asked to pick up ""Fake Female Name\'s"" order, and was sent on my way with my new wardrobe with  none the wiser.\n\nTL;DR In-store Pickup', 'subreddit': 'trans', 'title': 'Quick tip for my brothers and sisters who are apprehensive about purchasing new clothes', 'created': 1455180878.0}"
2016-02-11 02:46:53,456mhn,5,4,"I'm new to being a trans, mtf, and I'm having difficulty figuring out clothe sizes. I do most buying online, but when u thought I put down a good size, my under ware and pants were way too tight. Is their a chart that helps trans people configure sizes? 
Thanks for all your help.",trans,Male to female sizes?,1455184013.0,"{'created_utc': 1455158813, 'id': '456mhn', 'num_comments': 5, 'score': 4, 'selftext': ""I'm new to being a trans, mtf, and I'm having difficulty figuring out clothe sizes. I do most buying online, but when u thought I put down a good size, my under ware and pants were way too tight. Is their a chart that helps trans people configure sizes? \nThanks for all your help."", 'subreddit': 'trans', 'title': 'Male to female sizes?', 'created': 1455184013.0}"
2016-02-11 14:16:48,458y3l,0,32,,trans,Trans activists protesting after Bush's re-election and the assault on Falluja (2004),1455225408.0,"{'created_utc': 1455200208, 'id': '458y3l', 'num_comments': 0, 'score': 32, 'selftext': '', 'subreddit': 'trans', 'title': ""Trans activists protesting after Bush's re-election and the assault on Falluja (2004)"", 'created': 1455225408.0}"
2016-02-11 21:01:46,45b2ax,5,5,"Obvious throwaway account is obvious.

I am ftm, having only just mustered the confidence to live as I wish to and speak my mind. I have not told anybody, due to family attitudes (they played the ""freak of nature"" card just the other day talking about someone else, hell if I'm mentioning anything), etc. 
Recently, I had a friend who identified similarly. I was overjoyed and thought that I'd found the person who I could talk to and let this all out to. Timeskip a few months forward, and they say it was ""only a silly phase"" and deny it ever happened, despite having had supportive parents whom I could only dream of. They immediately became, ironically, very transphobic and judgemental - I feel I have lost something that I can't quite identify, and have decided against telling them. They still own a binder and everything else that I would lose my right arm for, but I don't say anything because it's not really my business or, more importantly, my place to say, at all.

Christ on a bike, I sound so selfish. I see jealousy as being counterproductive and damaging, but I just can't help myself sometimes and wish I could. Reaching out to you Redditors, I'm sorry that I had to put this rant here. I just didn't expect to find myself feeling alone again.",trans,"A vent post without any shouting. I'm sorry, I just needed somewhere with people who understood.",1455249706.0,"{'created_utc': 1455224506, 'id': '45b2ax', 'num_comments': 5, 'score': 5, 'selftext': 'Obvious throwaway account is obvious.\n\nI am ftm, having only just mustered the confidence to live as I wish to and speak my mind. I have not told anybody, due to family attitudes (they played the ""freak of nature"" card just the other day talking about someone else, hell if I\'m mentioning anything), etc. \nRecently, I had a friend who identified similarly. I was overjoyed and thought that I\'d found the person who I could talk to and let this all out to. Timeskip a few months forward, and they say it was ""only a silly phase"" and deny it ever happened, despite having had supportive parents whom I could only dream of. They immediately became, ironically, very transphobic and judgemental - I feel I have lost something that I can\'t quite identify, and have decided against telling them. They still own a binder and everything else that I would lose my right arm for, but I don\'t say anything because it\'s not really my business or, more importantly, my place to say, at all.\n\nChrist on a bike, I sound so selfish. I see jealousy as being counterproductive and damaging, but I just can\'t help myself sometimes and wish I could. Reaching out to you Redditors, I\'m sorry that I had to put this rant here. I just didn\'t expect to find myself feeling alone again.', 'subreddit': 'trans', 'title': ""A vent post without any shouting. I'm sorry, I just needed somewhere with people who understood."", 'created': 1455249706.0}"
2016-02-13 06:06:18,45j1cn,21,12,"I'm a trans babe, and coming on two years ago, I had GRS. It didn't go well. A significant amount of erectile tissue remained as did some very odd positioning/orientation of my clitoris, in addition to extreme lingering pain. Without going into a huge amount of detail (as retelling it is very traumatic), suffice to say that my performing surgeon catagorically denied that I had issues and insinuated on more than one occasion that I was mentally unstable. After being shut out by a number of other surgeons due to not wanting to get involved with another surgeons work, I was finally able to convince my original surgeon to take action. One year after my initial surgery,  my surgeon performed a revision, but failed to address all of my concerns, and outright refused to address certain ones, such as the orientation of my clitoris. Once it became apparent that I continued to have problems, I again agitated for redress, but this time they simply terminated the doctor patient relationship. For months, I searched for a surgeon willing to help me, all the while being in considerable physical discomfort and experiencing the mental ramifications of the lineage of trauma I was subjected to. Finally, I found Dr. Reed, who validated my problems and agreed to help me. Four days ago, I underwent a third surgery and while he is optimistic that he addressed my problems, I remain cautious about the results, as everything is still quite raw. I am in lots of pain, very uncomfortable, nauseas, and have absolutely no support network outside of my parents, as the lengthy perpetuation of my struggle has proved to much for the vast majority of my friends to cope with. 

This ordeal has ultimately cost me my romantic relationships, my friends, my financial independence, my physical comfort, my mental stability, even my sense of self. I believe that I endured abusive treatment by my former surgeon.

I don't really know what I am looking for by posting this here. Encouragement? Friends? Idk. Just something that isn't the horror my life has become.",trans,Need Support; Venting GRS Trauma,1455368778.0,"{'created_utc': 1455343578, 'id': '45j1cn', 'num_comments': 21, 'score': 12, 'selftext': ""I'm a trans babe, and coming on two years ago, I had GRS. It didn't go well. A significant amount of erectile tissue remained as did some very odd positioning/orientation of my clitoris, in addition to extreme lingering pain. Without going into a huge amount of detail (as retelling it is very traumatic), suffice to say that my performing surgeon catagorically denied that I had issues and insinuated on more than one occasion that I was mentally unstable. After being shut out by a number of other surgeons due to not wanting to get involved with another surgeons work, I was finally able to convince my original surgeon to take action. One year after my initial surgery,  my surgeon performed a revision, but failed to address all of my concerns, and outright refused to address certain ones, such as the orientation of my clitoris. Once it became apparent that I continued to have problems, I again agitated for redress, but this time they simply terminated the doctor patient relationship. For months, I searched for a surgeon willing to help me, all the while being in considerable physical discomfort and experiencing the mental ramifications of the lineage of trauma I was subjected to. Finally, I found Dr. Reed, who validated my problems and agreed to help me. Four days ago, I underwent a third surgery and while he is optimistic that he addressed my problems, I remain cautious about the results, as everything is still quite raw. I am in lots of pain, very uncomfortable, nauseas, and have absolutely no support network outside of my parents, as the lengthy perpetuation of my struggle has proved to much for the vast majority of my friends to cope with. \n\nThis ordeal has ultimately cost me my romantic relationships, my friends, my financial independence, my physical comfort, my mental stability, even my sense of self. I believe that I endured abusive treatment by my former surgeon.\n\nI don't really know what I am looking for by posting this here. Encouragement? Friends? Idk. Just something that isn't the horror my life has become."", 'subreddit': 'trans', 'title': 'Need Support; Venting GRS Trauma', 'created': 1455368778.0}"
2016-02-13 16:57:52,45let2,0,1,,trans,Hots women for hot sex here j_3T_Ae4m9R_,1455407872.0,"{'created_utc': 1455382672, 'id': '45let2', 'num_comments': 0, 'score': 1, 'selftext': '', 'subreddit': 'trans', 'title': 'Hots women for hot sex here j_3T_Ae4m9R_', 'created': 1455407872.0}"
2016-02-14 04:15:26,45oipa,5,3,Just seeing if there's anyone our there willing to talk and share some info.,trans,Transition Guidance/Advice/Help?,1455448526.0,"{'created_utc': 1455423326, 'id': '45oipa', 'num_comments': 5, 'score': 3, 'selftext': ""Just seeing if there's anyone our there willing to talk and share some info."", 'subreddit': 'trans', 'title': 'Transition Guidance/Advice/Help?', 'created': 1455448526.0}"
2016-02-14 08:22:08,45pcc4,4,22,,trans,Justice Antonin Scalia is dead; Our long national nightmare is over!,1455463328.0,"{'created_utc': 1455438128, 'id': '45pcc4', 'num_comments': 4, 'score': 22, 'selftext': '', 'subreddit': 'trans', 'title': 'Justice Antonin Scalia is dead; Our long national nightmare is over!', 'created': 1455463328.0}"
2016-02-14 09:51:07,45pmig,0,1,,trans,You want hot sex? Here girls t_7C2S_zB_,1455468667.0,"{'created_utc': 1455443467, 'id': '45pmig', 'num_comments': 0, 'score': 1, 'selftext': '', 'subreddit': 'trans', 'title': 'You want hot sex? Here girls t_7C2S_zB_', 'created': 1455468667.0}"
2016-02-14 14:42:14,45qyq3,0,0,,trans,Sex with hot Girls? Yes?! Here P_q68K_cGn7_,1455486134.0,"{'created_utc': 1455460934, 'id': '45qyq3', 'num_comments': 0, 'score': 0, 'selftext': '', 'subreddit': 'trans', 'title': 'Sex with hot Girls? Yes?! Here P_q68K_cGn7_', 'created': 1455486134.0}"
2016-02-16 00:54:14,45zva9,28,1,"So I'm a Cis male with Aspergers (Now considered Autism) and for about a year I've been dating a Trans Female who has an odd quirk of avoiding this question with non-commital humor. So in hopes of getting some straight answers I've come here.

So while I've primarily identified as a Straight Cis male, my girlfriend and quite a few others have been joking about my sexuality, which I'm pretty firm on. But the amount of times it's been joked about, makes me wonder if I can still be classified as straight since I date and am attracted to a trans female. 

This is a question of Technicality. Am I Technically bi since I love and am sexually attracted to her? Or does my confidence in my sexuality dictate this?",trans,So I have an outside question of quiet internal conflict regarding a trans-cis relationship and straight/bi/homosexual identification.,1455609254.0,"{'created_utc': 1455584054, 'id': '45zva9', 'num_comments': 28, 'score': 1, 'selftext': ""So I'm a Cis male with Aspergers (Now considered Autism) and for about a year I've been dating a Trans Female who has an odd quirk of avoiding this question with non-commital humor. So in hopes of getting some straight answers I've come here.\n\nSo while I've primarily identified as a Straight Cis male, my girlfriend and quite a few others have been joking about my sexuality, which I'm pretty firm on. But the amount of times it's been joked about, makes me wonder if I can still be classified as straight since I date and am attracted to a trans female. \n\nThis is a question of Technicality. Am I Technically bi since I love and am sexually attracted to her? Or does my confidence in my sexuality dictate this?"", 'subreddit': 'trans', 'title': 'So I have an outside question of quiet internal conflict regarding a trans-cis relationship and straight/bi/homosexual identification.', 'created': 1455609254.0}"
2016-02-16 10:47:51,461y79,6,0,,trans,My selection for the Democrat presidential nominee in 2016 is . . .,1455644871.0,"{'created_utc': 1455619671, 'id': '461y79', 'num_comments': 6, 'score': 0, 'selftext': '', 'subreddit': 'trans', 'title': 'My selection for the Democrat presidential nominee in 2016 is . . .', 'created': 1455644871.0}"
2016-02-17 02:11:37,465yf5,5,3,"(I have copied this from another post of mine just thought I'd say)

I don't want to overcomplicate things, so I'll keep it short.
Basically I am kinda pretty sure that I am a woman trapped in a mans body, but I don't know how to find out. I often fantasize about just being a girl and I feel like I'm uncomfortable with the sex I have because of my role in it as a man.
Basically what I want is to find some ways to test and experiment so that I can find out things about my gender.
I dream about getting hormones and some day passing as a girl, but I'm just afraid that these feelings are not genuine and that I will regret it.
It also feels like I don't seem like someone who's trans. I know that's a bullshit statement, but that's the reaction I seem to get from the people I've talked with.
I've tried having my ex give me all kinds of make-up on and it felt pretty good, but I have a hard time taking it seriously, because then I just look like a man with makeup on my face.
The uncertanty is killing me, it's like this whole existential crisis.
Thanks for reading. I hope you could understand it all I don't feel like I made it clear, but ask me anything:)",trans,Hey friends I'm in great distress,1455700297.0,"{'created_utc': 1455675097, 'id': '465yf5', 'num_comments': 5, 'score': 3, 'selftext': ""(I have copied this from another post of mine just thought I'd say)\n\nI don't want to overcomplicate things, so I'll keep it short.\nBasically I am kinda pretty sure that I am a woman trapped in a mans body, but I don't know how to find out. I often fantasize about just being a girl and I feel like I'm uncomfortable with the sex I have because of my role in it as a man.\nBasically what I want is to find some ways to test and experiment so that I can find out things about my gender.\nI dream about getting hormones and some day passing as a girl, but I'm just afraid that these feelings are not genuine and that I will regret it.\nIt also feels like I don't seem like someone who's trans. I know that's a bullshit statement, but that's the reaction I seem to get from the people I've talked with.\nI've tried having my ex give me all kinds of make-up on and it felt pretty good, but I have a hard time taking it seriously, because then I just look like a man with makeup on my face.\nThe uncertanty is killing me, it's like this whole existential crisis.\nThanks for reading. I hope you could understand it all I don't feel like I made it clear, but ask me anything:)"", 'subreddit': 'trans', 'title': ""Hey friends I'm in great distress"", 'created': 1455700297.0}"
2016-02-17 10:07:45,467nyt,0,1,,trans,"Sex with girls without interruption. Young, Big, Alien here qR_6L_4y_gN2G3f",1455728865.0,"{'created_utc': 1455703665, 'id': '467nyt', 'num_comments': 0, 'score': 1, 'selftext': '', 'subreddit': 'trans', 'title': 'Sex with girls without interruption. Young, Big, Alien here qR_6L_4y_gN2G3f', 'created': 1455728865.0}"
2016-02-17 13:06:02,468e0i,0,1,,trans,I Made $12 000 in 26 Days without spending a Dime. How? kN_9Q4x__D8,1455739562.0,"{'created_utc': 1455714362, 'id': '468e0i', 'num_comments': 0, 'score': 1, 'selftext': '', 'subreddit': 'trans', 'title': 'I Made $12 000 in 26 Days without spending a Dime. How? kN_9Q4x__D8', 'created': 1455739562.0}"
2016-02-17 17:54:30,469yij,14,7,,trans,Conservatives in Washington are so opposed to trans access they are now actually staging false flag invasions of women's locker rooms to become the problem that never existed in the first place. New low.,1455756870.0,"{'created_utc': 1455731670, 'id': '469yij', 'num_comments': 14, 'score': 7, 'selftext': '', 'subreddit': 'trans', 'title': ""Conservatives in Washington are so opposed to trans access they are now actually staging false flag invasions of women's locker rooms to become the problem that never existed in the first place. New low."", 'created': 1455756870.0}"
2016-02-17 19:20:55,46afyp,0,1,,trans,HOW I Made 12 365 in 26 days without spending a Dime??? cQ_2Y9n_mF_58,1455762055.0,"{'created_utc': 1455736855, 'id': '46afyp', 'num_comments': 0, 'score': 1, 'selftext': '', 'subreddit': 'trans', 'title': 'HOW I Made 12 365 in 26 days without spending a Dime??? cQ_2Y9n_mF_58', 'created': 1455762055.0}"
2016-02-18 01:01:57,46c4sc,2,6,,trans,Governor to decide on anti-trans 'Show Us Your Genitals' police force,1455782517.0,"{'created_utc': 1455757317, 'id': '46c4sc', 'num_comments': 2, 'score': 6, 'selftext': '', 'subreddit': 'trans', 'title': ""Governor to decide on anti-trans 'Show Us Your Genitals' police force"", 'created': 1455782517.0}"
2016-02-18 04:17:30,46cy9i,1,7,,trans,Conservative Trolls Have Been Suggesting Men Go into Women's Restrooms to Help Legislators Discriminate Against Trans People,1455794250.0,"{'created_utc': 1455769050, 'id': '46cy9i', 'num_comments': 1, 'score': 7, 'selftext': '', 'subreddit': 'trans', 'title': ""Conservative Trolls Have Been Suggesting Men Go into Women's Restrooms to Help Legislators Discriminate Against Trans People"", 'created': 1455794250.0}"
