created_utc,id,num_comments,score,selftext,subreddit,title,created,d_
2016-02-29 06:04:58,488rck,6,8,"I'm currently seeing a therapist at school (the cost is already included with my registration fees and because I'm trying to avoid using my health insurance plan that may involve my parents)

What I want to to know is what I need to ask my therapist to start HRT the fastest way possible.

I had my first appointment last week and I have my next appointment tomorrow.

should I just tell him I have a desire to start HRT?

What are your experiences with therapists?",trans,What's the fastest way to start HRT?!,1456751098.0,"{'created_utc': 1456725898, 'id': '488rck', 'num_comments': 6, 'score': 8, 'selftext': ""I'm currently seeing a therapist at school (the cost is already included with my registration fees and because I'm trying to avoid using my health insurance plan that may involve my parents)\n\nWhat I want to to know is what I need to ask my therapist to start HRT the fastest way possible.\n\nI had my first appointment last week and I have my next appointment tomorrow.\n\nshould I just tell him I have a desire to start HRT?\n\nWhat are your experiences with therapists?"", 'subreddit': 'trans', 'title': ""What's the fastest way to start HRT?!"", 'created': 1456751098.0}"
2016-02-29 07:20:36,48912p,1,7,,trans,Trans positive parents equates to positive trans kids says UW study,1456755636.0,"{'created_utc': 1456730436, 'id': '48912p', 'num_comments': 1, 'score': 7, 'selftext': '', 'subreddit': 'trans', 'title': 'Trans positive parents equates to positive trans kids says UW study', 'created': 1456755636.0}"
2016-02-29 19:48:28,48c0l3,5,9,"Hi all, I just wanted to share my good news: I am officially headed to South Korea.  As of this afternoon, I am booked to depart from Los Angeles International airport on June 13, en route to Seoul.  The surgery will take place at the Yeson Voice Center on June 15.

The next 4 months can't pass fast enough.",trans,I just booked my trip to Yeson for vocal feminization surgery!!,1456800508.0,"{'created_utc': 1456775308, 'id': '48c0l3', 'num_comments': 5, 'score': 9, 'selftext': ""Hi all, I just wanted to share my good news: I am officially headed to South Korea.  As of this afternoon, I am booked to depart from Los Angeles International airport on June 13, en route to Seoul.  The surgery will take place at the Yeson Voice Center on June 15.\n\nThe next 4 months can't pass fast enough."", 'subreddit': 'trans', 'title': 'I just booked my trip to Yeson for vocal feminization surgery!!', 'created': 1456800508.0}"
