created_utc,id,num_comments,score,selftext,subreddit,title,created,d_
2016-02-18 04:58:21,46d47n,0,1,"I never quite got around to fixing my legal name. Im not out with most of my friends, especially ones I'm getting to know. I've never once had any issue whatsoever with the name on cards, noone ever notices, until tonight....
Went out with a girl friend to a bar tonight, bartender checked ids, no problems, actually fully examines friends card (she just moved from out of state)... 

Evening goes on things are great, bartender even joins our convo and is nice, so at the end we pay the tab, both use our cards.... This has never once been an issue ever before, so when she asks who blank is (my friend) and she takes her check, i figure, ok, she will just hand me mine. Nope. She asks where guyname came from, if it was my dads, brothers, or bfs card.... 

I just responded ""dont worry about it"", and the bartender laughed and i think things where ok. Ive not ever been this mortified, or found something so hysterical. I don't know whether to laugh or lock myself away at home until i get my legal name fixed.... I don't think i even filled the tip out properly i was so freaked... Im ever so slightly tempted to return, explain the situation, and make sure i paid the tip right...

Just felt like sharing, hope all of you are doing great!",trans,Need to get on with the name correction...,1455796701.0,"{'created_utc': 1455771501, 'id': '46d47n', 'num_comments': 0, 'score': 1, 'selftext': 'I never quite got around to fixing my legal name. Im not out with most of my friends, especially ones I\'m getting to know. I\'ve never once had any issue whatsoever with the name on cards, noone ever notices, until tonight....\nWent out with a girl friend to a bar tonight, bartender checked ids, no problems, actually fully examines friends card (she just moved from out of state)... \n\nEvening goes on things are great, bartender even joins our convo and is nice, so at the end we pay the tab, both use our cards.... This has never once been an issue ever before, so when she asks who blank is (my friend) and she takes her check, i figure, ok, she will just hand me mine. Nope. She asks where guyname came from, if it was my dads, brothers, or bfs card.... \n\nI just responded ""dont worry about it"", and the bartender laughed and i think things where ok. Ive not ever been this mortified, or found something so hysterical. I don\'t know whether to laugh or lock myself away at home until i get my legal name fixed.... I don\'t think i even filled the tip out properly i was so freaked... Im ever so slightly tempted to return, explain the situation, and make sure i paid the tip right...\n\nJust felt like sharing, hope all of you are doing great!', 'subreddit': 'trans', 'title': 'Need to get on with the name correction...', 'created': 1455796701.0}"
2016-02-18 07:20:34,46dlqq,5,8,"Hey, I'm wondering if there's anywhere I could upload a picture that people could photoshop to look post-HRT? It would be a huge boon to me to have an idea of how I will probably look after this long process. Looking at my face is really difficult and having a picture of a positive future would do wonders for fighting the depression, impatience, negative self-image.

If this doesn't already exist, I would be more than happy to create and moderate a sub for it (/r/HRTme perhaps?), but I would need volunteers because I have no photoshop skills at all. I'm sure I'm not the only trans caterpillar who could use a picture of themselves as a butterfly.",trans,[Request]HRT me via photoshop?,1455805234.0,"{'created_utc': 1455780034, 'id': '46dlqq', 'num_comments': 5, 'score': 8, 'selftext': ""Hey, I'm wondering if there's anywhere I could upload a picture that people could photoshop to look post-HRT? It would be a huge boon to me to have an idea of how I will probably look after this long process. Looking at my face is really difficult and having a picture of a positive future would do wonders for fighting the depression, impatience, negative self-image.\n\nIf this doesn't already exist, I would be more than happy to create and moderate a sub for it (/r/HRTme perhaps?), but I would need volunteers because I have no photoshop skills at all. I'm sure I'm not the only trans caterpillar who could use a picture of themselves as a butterfly."", 'subreddit': 'trans', 'title': '[Request]HRT me via photoshop?', 'created': 1455805234.0}"
2016-02-18 18:17:14,46g439,13,75,,trans,"The first time i've been brave enough to go out and try on a dress in a store, what do you think?",1455844634.0,"{'created_utc': 1455819434, 'id': '46g439', 'num_comments': 13, 'score': 75, 'selftext': '', 'subreddit': 'trans', 'title': ""The first time i've been brave enough to go out and try on a dress in a store, what do you think?"", 'created': 1455844634.0}"
2016-02-19 06:38:12,46jdea,1,2,,trans,The TransAdvocate | Eavesdrop on a right wing anti-trans training camp: teaching fear mongering and lies,1455889092.0,"{'created_utc': 1455863892, 'id': '46jdea', 'num_comments': 1, 'score': 2, 'selftext': '', 'subreddit': 'trans', 'title': 'The TransAdvocate | Eavesdrop on a right wing anti-trans training camp: teaching fear mongering and lies', 'created': 1455889092.0}"
2016-02-19 11:34:33,46k7rw,0,1,,trans,HEY! THOUSANDS OF MEMBERS ARE LOOKING FOR CASUAL SEX IN YOUR NEIGHBOURHOOD! G9pgKs,1455906873.0,"{'created_utc': 1455881673, 'id': '46k7rw', 'num_comments': 0, 'score': 1, 'selftext': '', 'subreddit': 'trans', 'title': 'HEY! THOUSANDS OF MEMBERS ARE LOOKING FOR CASUAL SEX IN YOUR NEIGHBOURHOOD! G9pgKs', 'created': 1455906873.0}"
2016-02-19 21:27:54,46mwur,23,0,,trans,Alleged transgender woman brutally beaten &amp; kicked by Muslims,1455942474.0,"{'created_utc': 1455917274, 'id': '46mwur', 'num_comments': 23, 'score': 0, 'selftext': '', 'subreddit': 'trans', 'title': 'Alleged transgender woman brutally beaten &amp; kicked by Muslims', 'created': 1455942474.0}"
2016-02-20 15:26:20,46qhyv,11,23,,trans,28 M2F - Looking for honest feedback after 9 months HRT,1456007180.0,"{'created_utc': 1455981980, 'id': '46qhyv', 'num_comments': 11, 'score': 23, 'selftext': '', 'subreddit': 'trans', 'title': '28 M2F - Looking for honest feedback after 9 months HRT', 'created': 1456007180.0}"
2016-02-20 16:39:02,46qsp4,3,6,,trans,'No Pride in Prisons' Protesters Bring Pride Parade to a Halt,1456011542.0,"{'created_utc': 1455986342, 'id': '46qsp4', 'num_comments': 3, 'score': 6, 'selftext': '', 'subreddit': 'trans', 'title': ""'No Pride in Prisons' Protesters Bring Pride Parade to a Halt"", 'created': 1456011542.0}"
2016-02-20 22:51:53,46seua,0,0,,trans,Gogo Graham Calls Attention to Trans Violence with Final Girl-Inspired Collection,1456033913.0,"{'created_utc': 1456008713, 'id': '46seua', 'num_comments': 0, 'score': 0, 'selftext': '', 'subreddit': 'trans', 'title': 'Gogo Graham Calls Attention to Trans Violence with Final Girl-Inspired Collection', 'created': 1456033913.0}"
2016-02-22 18:45:42,4729vp,1,0,[deleted],trans,Matched with the most breathtaking girl on tinder and after only a short conversation I am completely smitten. Out of my league for sure in so many ways but I'm going to try like crazy to take her out. I feel all nervous in my guts about her wtf is going on?!,1456191942.0,"{'created_utc': 1456166742, 'id': '4729vp', 'num_comments': 1, 'score': 0, 'selftext': '[deleted]', 'subreddit': 'trans', 'title': ""Matched with the most breathtaking girl on tinder and after only a short conversation I am completely smitten. Out of my league for sure in so many ways but I'm going to try like crazy to take her out. I feel all nervous in my guts about her wtf is going on?!"", 'created': 1456191942.0}"
2016-02-23 01:56:07,474byp,0,4,,trans,Transitioning 101: The Full Package,1456217767.0,"{'created_utc': 1456192567, 'id': '474byp', 'num_comments': 0, 'score': 4, 'selftext': '', 'subreddit': 'trans', 'title': 'Transitioning 101: The Full Package', 'created': 1456217767.0}"
2016-02-23 18:03:16,477uuc,6,9,"Since I've been happier with my body (1 yr hrt) I've been enjoying showing off myself. 
Anyone else do this or am I narsasistic?",trans,Anyone else like showing off?,1456275796.0,"{'created_utc': 1456250596, 'id': '477uuc', 'num_comments': 6, 'score': 9, 'selftext': ""Since I've been happier with my body (1 yr hrt) I've been enjoying showing off myself. \nAnyone else do this or am I narsasistic?"", 'subreddit': 'trans', 'title': 'Anyone else like showing off?', 'created': 1456275796.0}"
2016-02-23 23:31:23,479i53,5,5,"Sooo, I've accepted myself as transgender and been happier as a person, but to continue pursuing happiness I need to feel free to express myself wherever including at home.
Currently I live with my parents, but am planning on moving out in August of this year.

A little background:
My parents have always expressed their dissatisfaction towards homosexuality through their heavily Catholic views.
I don't think my parents understand the difference between gender identity and sexual orientation.
Regardless, I identify as transgender and pansexual (which my parents will more than likely just think of me as a homosexual abomination).
When I was younger, they often questioned me about being gay and told me they would get me ""help"" if I needed it, I.e. Send me to some sort Catholic retreat/school or whatever.

Of course I always too afraid to tell them how I really inside.

I'm a 23 years old now and would like to my live my life how I want for once.
How should I approach my parents about being transgender?
Or should I just wait until I move out?

TL;DR
How do I come out as transgender to my Catholic AF parents?!?",trans,Coming out as transgender to family help pls,1456295483.0,"{'created_utc': 1456270283, 'id': '479i53', 'num_comments': 5, 'score': 5, 'selftext': 'Sooo, I\'ve accepted myself as transgender and been happier as a person, but to continue pursuing happiness I need to feel free to express myself wherever including at home.\nCurrently I live with my parents, but am planning on moving out in August of this year.\n\nA little background:\nMy parents have always expressed their dissatisfaction towards homosexuality through their heavily Catholic views.\nI don\'t think my parents understand the difference between gender identity and sexual orientation.\nRegardless, I identify as transgender and pansexual (which my parents will more than likely just think of me as a homosexual abomination).\nWhen I was younger, they often questioned me about being gay and told me they would get me ""help"" if I needed it, I.e. Send me to some sort Catholic retreat/school or whatever.\n\nOf course I always too afraid to tell them how I really inside.\n\nI\'m a 23 years old now and would like to my live my life how I want for once.\nHow should I approach my parents about being transgender?\nOr should I just wait until I move out?\n\nTL;DR\nHow do I come out as transgender to my Catholic AF parents?!?', 'subreddit': 'trans', 'title': 'Coming out as transgender to family help pls', 'created': 1456295483.0}"
2016-02-24 20:59:27,47evbt,0,1,,trans,Free webcam show with me here! pE70DYY,1456372767.0,"{'created_utc': 1456347567, 'id': '47evbt', 'num_comments': 0, 'score': 1, 'selftext': '', 'subreddit': 'trans', 'title': 'Free webcam show with me here! pE70DYY', 'created': 1456372767.0}"
2016-02-24 21:22:17,47f0ku,24,10,"Hey, all, 21F here. 
All my life I've been pretty tomboyish as far as hobbies (wrestling and baseball with brothers as a kid, archery,) go, and then in high school I would rather build set pieces than spend my summer at girl friends' houses or swimming or wherever. Dressing up for dances or ceremonies was always awkward because I think suits look more appealing than dresses, which always make me feel self conscious. 

At one point in high school I believe I had depression and developed anxiety issues. I still have the anxiety, but the depression-like feelings went away when I felt better about myself. When I lost a lot of weight (not being hungry, only eating Ramen, and always being busy helped) and gained noticeable biceps from doing technical theater I felt great. 

Now that I'm older and out of my religious mother's house, I've been able to buy men's clothes and it feels so good to wear baggy cargo pants or a v-neck, even though my bosom is DD in size. I'm still okay with dressing more feminine (like jean styles or cute cardigans), but really dislike my body image in girly clothes, identifying as more of a frumpy mom stylistically. Often when I look in the mirror, I try to stand in such a way that hides my generous chest, or just ignore my chest and look at the rest of me, determining whether I am passable or wondering how I would look as a male. 

For the last two years I've kept my hair short or shaved on at least one side and I liked that contrast for a while; it reflected how I feel. Last night though, I shaved all of it down to the same length again and came to a conclusion I've had before- 

This isn't the first time I knew I looked like a boy (due to my hair). I don't mind being mistaken for one; it's kind of exciting.  Looking in the mirror though, I do have a cute fem face. I like my face. It's not that I'm disappointed exactly, but I can't stop wondering how I would feel about myself if I were male with the broader jawline and more pronounced, hardened features. 

Sorry I can't think of a way to cut this down, and thanks so much for reading all of it for those who do. Any feedback is welcome.",trans,Is this dysphoria?,1456374137.0,"{'created_utc': 1456348937, 'id': '47f0ku', 'num_comments': 24, 'score': 10, 'selftext': ""Hey, all, 21F here. \nAll my life I've been pretty tomboyish as far as hobbies (wrestling and baseball with brothers as a kid, archery,) go, and then in high school I would rather build set pieces than spend my summer at girl friends' houses or swimming or wherever. Dressing up for dances or ceremonies was always awkward because I think suits look more appealing than dresses, which always make me feel self conscious. \n\nAt one point in high school I believe I had depression and developed anxiety issues. I still have the anxiety, but the depression-like feelings went away when I felt better about myself. When I lost a lot of weight (not being hungry, only eating Ramen, and always being busy helped) and gained noticeable biceps from doing technical theater I felt great. \n\nNow that I'm older and out of my religious mother's house, I've been able to buy men's clothes and it feels so good to wear baggy cargo pants or a v-neck, even though my bosom is DD in size. I'm still okay with dressing more feminine (like jean styles or cute cardigans), but really dislike my body image in girly clothes, identifying as more of a frumpy mom stylistically. Often when I look in the mirror, I try to stand in such a way that hides my generous chest, or just ignore my chest and look at the rest of me, determining whether I am passable or wondering how I would look as a male. \n\nFor the last two years I've kept my hair short or shaved on at least one side and I liked that contrast for a while; it reflected how I feel. Last night though, I shaved all of it down to the same length again and came to a conclusion I've had before- \n\nThis isn't the first time I knew I looked like a boy (due to my hair). I don't mind being mistaken for one; it's kind of exciting.  Looking in the mirror though, I do have a cute fem face. I like my face. It's not that I'm disappointed exactly, but I can't stop wondering how I would feel about myself if I were male with the broader jawline and more pronounced, hardened features. \n\nSorry I can't think of a way to cut this down, and thanks so much for reading all of it for those who do. Any feedback is welcome."", 'subreddit': 'trans', 'title': 'Is this dysphoria?', 'created': 1456374137.0}"
2016-02-25 19:53:48,47kyav,0,1,[deleted],trans,Dear Mom and Dad,1456455228.0,"{'created_utc': 1456430028, 'id': '47kyav', 'num_comments': 0, 'score': 1, 'selftext': '[deleted]', 'subreddit': 'trans', 'title': 'Dear Mom and Dad', 'created': 1456455228.0}"
2016-02-25 20:16:51,47l4r6,0,1,,trans,HI! Y..o...u lOOve s_ee__x! EmNox83,1456456611.0,"{'created_utc': 1456431411, 'id': '47l4r6', 'num_comments': 0, 'score': 1, 'selftext': '', 'subreddit': 'trans', 'title': 'HI! Y..o...u lOOve s_ee__x! EmNox83', 'created': 1456456611.0}"
2016-02-26 09:37:27,47obr2,8,21,,trans,"It's official, the GOP's new trans policy: Lift Up Your Skirt And Show Us Your Genitals!",1456504647.0,"{'created_utc': 1456479447, 'id': '47obr2', 'num_comments': 8, 'score': 21, 'selftext': '', 'subreddit': 'trans', 'title': ""It's official, the GOP's new trans policy: Lift Up Your Skirt And Show Us Your Genitals!"", 'created': 1456504647.0}"
2016-02-26 23:27:54,47s6f2,0,0,,trans,acquaintances and virtual striptease uBT1fH1cuhF,1456554474.0,"{'created_utc': 1456529274, 'id': '47s6f2', 'num_comments': 0, 'score': 0, 'selftext': '', 'subreddit': 'trans', 'title': 'acquaintances and virtual striptease uBT1fH1cuhF', 'created': 1456554474.0}"
2016-02-26 23:55:28,47saov,0,10,,trans,"Human Rights Commission: Guy Entering Women's Bathroom in Seattle Was ""Absolutely Not Protected Under the Law""",1456556128.0,"{'created_utc': 1456530928, 'id': '47saov', 'num_comments': 0, 'score': 10, 'selftext': '', 'subreddit': 'trans', 'title': 'Human Rights Commission: Guy Entering Women\'s Bathroom in Seattle Was ""Absolutely Not Protected Under the Law""', 'created': 1456556128.0}"
2016-02-27 05:54:37,47tlcu,1,21,,trans,Cleveland Clinc performs Uterus Transplant,1456577677.0,"{'created_utc': 1456552477, 'id': '47tlcu', 'num_comments': 1, 'score': 21, 'selftext': '', 'subreddit': 'trans', 'title': 'Cleveland Clinc performs Uterus Transplant', 'created': 1456577677.0}"
2016-02-27 15:19:06,47vj7y,0,0,,trans,I've found the perfect girl - the love of my life T2hlCqc5S,1456611546.0,"{'created_utc': 1456586346, 'id': '47vj7y', 'num_comments': 0, 'score': 0, 'selftext': '', 'subreddit': 'trans', 'title': ""I've found the perfect girl - the love of my life T2hlCqc5S"", 'created': 1456611546.0}"
2016-02-27 15:57:12,47vs93,0,1,,trans,i enjoyed the site and meet some lovely people. I have now found my match Ezzf8vBhIlt,1456613832.0,"{'created_utc': 1456588632, 'id': '47vs93', 'num_comments': 0, 'score': 1, 'selftext': '', 'subreddit': 'trans', 'title': 'i enjoyed the site and meet some lovely people. I have now found my match Ezzf8vBhIlt', 'created': 1456613832.0}"
2016-02-27 16:12:49,47vwvb,0,1,,trans,I didn't join in anticipation that internet dating would work and then unexpectedly found the perfect partner and am very very happy issVIo,1456614769.0,"{'created_utc': 1456589569, 'id': '47vwvb', 'num_comments': 0, 'score': 1, 'selftext': '', 'subreddit': 'trans', 'title': ""I didn't join in anticipation that internet dating would work and then unexpectedly found the perfect partner and am very very happy issVIo"", 'created': 1456614769.0}"
2016-02-27 17:22:59,47wjsz,0,1,,trans,"Thank you, I have found my perfect match, early days but head over hills and very happy PxRGHxHF",1456618979.0,"{'created_utc': 1456593779, 'id': '47wjsz', 'num_comments': 0, 'score': 1, 'selftext': '', 'subreddit': 'trans', 'title': 'Thank you, I have found my perfect match, early days but head over hills and very happy PxRGHxHF', 'created': 1456618979.0}"
2016-02-27 17:39:53,47wqq9,0,1,,trans,I have really enjoyed your site and I have met a new lady and things are going well Nu8T2Hd,1456619993.0,"{'created_utc': 1456594793, 'id': '47wqq9', 'num_comments': 0, 'score': 1, 'selftext': '', 'subreddit': 'trans', 'title': 'I have really enjoyed your site and I have met a new lady and things are going well Nu8T2Hd', 'created': 1456619993.0}"
2016-02-27 21:49:45,47yatv,0,1,,trans,Super weekend with beautiful chiks YwPxeSnf,1456634985.0,"{'created_utc': 1456609785, 'id': '47yatv', 'num_comments': 0, 'score': 1, 'selftext': '', 'subreddit': 'trans', 'title': 'Super weekend with beautiful chiks YwPxeSnf', 'created': 1456634985.0}"
2016-02-28 02:29:33,47zq1f,8,0,"I am a skinny twink, no full chest of hair, boyish facial features, skinny at 5'9 and 130lbs. In my 20s.  I admire strong gym bodies and am most attracted to husky, muscular, and large build guys.  I know I can't change my build.  But maybe I could become a gym bro and take on that look.  I would love to.  In this day and age of complete gender transformations,  can't a twink change into something more masculine?",trans,Is it possible for a twink to change into a gym-bro stud?,1456651773.0,"{'created_utc': 1456626573, 'id': '47zq1f', 'num_comments': 8, 'score': 0, 'selftext': ""I am a skinny twink, no full chest of hair, boyish facial features, skinny at 5'9 and 130lbs. In my 20s.  I admire strong gym bodies and am most attracted to husky, muscular, and large build guys.  I know I can't change my build.  But maybe I could become a gym bro and take on that look.  I would love to.  In this day and age of complete gender transformations,  can't a twink change into something more masculine?"", 'subreddit': 'trans', 'title': 'Is it possible for a twink to change into a gym-bro stud?', 'created': 1456651773.0}"
2016-02-28 12:01:49,481hwt,8,14,"I'm currently 17 days on HRT (started Feb 11th), and I'm starting to feel breast tenderness. When I realized that that was going on, I freaked out and messaged a bunch of friends. This is the first sign that the HRT is working other than the increased need to pee from the spironolactone. I could cry, I'm so happy that growth is going to be starting. ",trans,17 days on HRT and my boobs already hurt!,1456686109.0,"{'created_utc': 1456660909, 'id': '481hwt', 'num_comments': 8, 'score': 14, 'selftext': ""I'm currently 17 days on HRT (started Feb 11th), and I'm starting to feel breast tenderness. When I realized that that was going on, I freaked out and messaged a bunch of friends. This is the first sign that the HRT is working other than the increased need to pee from the spironolactone. I could cry, I'm so happy that growth is going to be starting. "", 'subreddit': 'trans', 'title': '17 days on HRT and my boobs already hurt!', 'created': 1456686109.0}"
2016-02-28 14:11:28,482axi,0,0,,trans,"My ex-whore nickname BunnyHoney, only registred and here.. jLJlJNHnxoB",1456693888.0,"{'created_utc': 1456668688, 'id': '482axi', 'num_comments': 0, 'score': 0, 'selftext': '', 'subreddit': 'trans', 'title': 'My ex-whore nickname BunnyHoney, only registred and here.. jLJlJNHnxoB', 'created': 1456693888.0}"
2016-02-28 14:32:35,482hho,0,1,,trans,"Not busy? No cards, just sign.up and enjoy my show here, ofc uAhgP10ToLz",1456695155.0,"{'created_utc': 1456669955, 'id': '482hho', 'num_comments': 0, 'score': 1, 'selftext': '', 'subreddit': 'trans', 'title': 'Not busy? No cards, just sign.up and enjoy my show here, ofc uAhgP10ToLz', 'created': 1456695155.0}"
2016-02-28 14:51:52,482ome,0,1,,trans,"Very boring :( I'll have fun here, but for registred and only.. D3sX256U6KZ",1456696312.0,"{'created_utc': 1456671112, 'id': '482ome', 'num_comments': 0, 'score': 1, 'selftext': '', 'subreddit': 'trans', 'title': ""Very boring :( I'll have fun here, but for registred and only.. D3sX256U6KZ"", 'created': 1456696312.0}"
2016-02-28 15:29:42,4831lj,0,1,,trans,"Are you bored and lonely? Come on in, I'm not against fun. dDTxjRFI",1456698582.0,"{'created_utc': 1456673382, 'id': '4831lj', 'num_comments': 0, 'score': 1, 'selftext': '', 'subreddit': 'trans', 'title': ""Are you bored and lonely? Come on in, I'm not against fun. dDTxjRFI"", 'created': 1456698582.0}"
2016-02-28 16:02:15,483ekw,0,1,,trans,Get free webcam show! Just for registered users. spvxgeFM,1456700535.0,"{'created_utc': 1456675335, 'id': '483ekw', 'num_comments': 0, 'score': 1, 'selftext': '', 'subreddit': 'trans', 'title': 'Get free webcam show! Just for registered users. spvxgeFM', 'created': 1456700535.0}"
2016-02-28 16:36:58,483lsc,0,1,,trans,Here lonely girl looking for fun with the guys pq95U9A,1456702618.0,"{'created_utc': 1456677418, 'id': '483lsc', 'num_comments': 0, 'score': 1, 'selftext': '', 'subreddit': 'trans', 'title': 'Here lonely girl looking for fun with the guys pq95U9A', 'created': 1456702618.0}"
2016-02-28 20:44:48,485els,0,1,,trans,"Get free webcam show! Only for registered users, and be 6w4zwiiq",1456717488.0,"{'created_utc': 1456692288, 'id': '485els', 'num_comments': 0, 'score': 1, 'selftext': '', 'subreddit': 'trans', 'title': 'Get free webcam show! Only for registered users, and be 6w4zwiiq', 'created': 1456717488.0}"
2016-02-28 22:06:27,4865aa,0,0,,trans,It continues since i lost my virginity! Lets find me and ill show you all. Virg111 uUlQXgaP,1456722387.0,"{'created_utc': 1456697187, 'id': '4865aa', 'num_comments': 0, 'score': 0, 'selftext': '', 'subreddit': 'trans', 'title': 'It continues since i lost my virginity! Lets find me and ill show you all. Virg111 uUlQXgaP', 'created': 1456722387.0}"
2016-02-28 23:36:02,486xwo,0,1,,trans,Milf dating young german boy to fuck her HqtuQzZi3,1456727762.0,"{'created_utc': 1456702562, 'id': '486xwo', 'num_comments': 0, 'score': 1, 'selftext': '', 'subreddit': 'trans', 'title': 'Milf dating young german boy to fuck her HqtuQzZi3', 'created': 1456727762.0}"
