created_utc,id,num_comments,score,selftext,subreddit,title,created,d_
2015-05-25 07:17:23,376gfz,1,2,,trans,"Michelle Duggar, a transgender-hating hypocrite of the highest order",1432563443.0,"{'created_utc': 1432538243, 'id': '376gfz', 'num_comments': 1, 'score': 2, 'selftext': '', 'subreddit': 'trans', 'title': 'Michelle Duggar, a transgender-hating hypocrite of the highest order', 'created': 1432563443.0}"
2015-05-26 05:00:23,37ajxt,4,10,"Hello, it's very nice to meet all of you! This is my first post on Reddit, and I was hoping to ask for a bit of advice. A friend pointed me to this site, and mentioned how supportive the community was here? Um, to give you a bit of context, I'm a 25 year old student, and moved away from my home country to attend college. I'm visiting my parents for summer vacations, and wish to come out to them. I wrote a letter that I plan to read out loud to them, and was wondering if it would be possible to ask the people here for their opinion on what I'm telling them, and whether I should add something else to it...I'm honestly terrified, my hands have been shaking just writing the letter, and I would really appreciate any suggestions or reassurance you might be able to offer? Thank you, so so much, for taking the time to read through this!

---------------------------------------------------------------------
[Names of my family],
I want to start by telling you that I love you. Your support and approval throughout my life have been important to me beyond words, and the bond we share as a family spending time together, caring for each other, is very precious to me. You might feel worried, confused, or upset by this, and I want to reassure you, before continuing, that I'm okay; I'm not sick, and I'm not in legal trouble. I'm really, really sorry if I worried you with this letter; I just want to tell you how I feel about certain things in my life, and help you understand my feelings a little better? Reading this to you is very difficult for me, so, I'd like to ask you for a bit of patience if it takes me some time to go on at any moment.

I've always been a very introverted person. You've all commented on it at some point; asked why I don't spend time with friends, or go out more often over weekends. Why I don't seem to meet a lot of new people, or keep my feelings to myself. Mom, you've asked me a hundred times if I was okay, to let you in, to tell you how I felt, and...I couldn't, for the same reason I can't tell other people the same, or talk about myself. I find it hard to show my feelings to others, because I'm afraid of being ridiculized, judged, or made fun of. Every conversation I have with people involves me showing my accomplishments to others; grades, titles, black belts, aspirations, trying to earn their approval because I feel, deep down, that they would never approve of me or love me if I didn't have any of those. I've felt depressed for a very long time, but thought I was supposed to bear it and carry on; that life was supposed to be hard, and it was like that for everyone. It has been difficult, made doubly so because I kept pushing away anyone who tried to get close to me, hid all of my feelings away from even you, my family. 

Throughout my entire life, I never felt like I fit in around the people I was expected to spend time with; that's not to say that I didn't have fun sometimes, but there was always something that didn't quite fit, something that felt wrong. I think you know that school was a difficult time for me, and I was bullied a lot; if not, I'm very sorry I hid that from you, too. I tried my best to adapt and fit in, and by high school, things were tolerable; I was never fully part of ""the group"", but at least I had a few people I spent time with, if never relaxed 100% around. I dedicated myself to my studies and my career, to become the best I could be in my field, leaving aside personal relationships and friendships, because it was easier to ignore them, to live alone, to find validation in being good at what I work on and bury my feelings inside. However, it has gotten to the point where I can't bottle this up any longer, where I can't keep going without confronting what I have locked away within myself. I want to share this with you, and be honest with you.

I'm transgender. I've felt I should have been born female for a very long time, wished I could be a normal girl at birthdays silently, even used to pray for it when I still prayed. There is a very negative image of what being transgender means in popular media, and just in case you have that impression, I want to make sure I'm being clear enough for you, so that you can understand; this doesn't mean I want to dress up because of some kind of sexual reason, or to put on an act. This has nothing to do with my sexuality, actually, or who I like, which is something I've never known because I'm completely unable to imagine myself with someone, male or female, while I'm expected to be male. This just means that I'm a woman, like half the population of the planet, and wish to be myself and live happily without having to hide who I am. I'm tired of filtering every thought I have, every word I want to say, to make sure it's something a boy would say. I'm tired of imitating people around me to try to find out how I'm supposed to act, and I'm tired of being scared all the time that someone will find out what I feel. I'm tired of hating my body, my appearance, and of having to hide that hatred.

I mentioned seeing a therapist this semester when we talked while I was away; she has been helping me come to terms with who I am, with the feelings I've hidden, but I want you to know that this is something I've come to realize on my own. It's not something I've chosen; I've hoped my entire life for it to go away, and life would certainly be a lot easier if it had, if I hadn't been born this way, but it's been on the back of my mind through both good times and bad times. I've come to accept that it's not going away. This is who I am, and it's not going away. The choice I do have, however, is whether to do something about it. Whether to continue living in hiding, or try to do something to help myself.

I'm not changing who I am. I'm still the same person, I'm still the child you raised. I still love you with all my heart, and want to make you proud. I still want to be a great engineer, and use my career to help others. I have wanted to tell you this for so long, but was terrified of losing you, of hurting you, of upsetting you. I hope you can forgive me. I'm sure we will have many conversations about this soon, and maybe you might feel upset or confused; I want you to know that I understand that this is difficult for you, too, and I'll try to be as open as I can, to be here for you as much as possible. You don't have to do anything right now, and if you need some time to process and understand this, that is okay too. 

I love you, more than I can express with words, and will never stop loving you,
[My name]
",trans,Coming out to my parents about being trans,1432641623.0,"{'created_utc': 1432616423, 'id': '37ajxt', 'num_comments': 4, 'score': 10, 'selftext': 'Hello, it\'s very nice to meet all of you! This is my first post on Reddit, and I was hoping to ask for a bit of advice. A friend pointed me to this site, and mentioned how supportive the community was here? Um, to give you a bit of context, I\'m a 25 year old student, and moved away from my home country to attend college. I\'m visiting my parents for summer vacations, and wish to come out to them. I wrote a letter that I plan to read out loud to them, and was wondering if it would be possible to ask the people here for their opinion on what I\'m telling them, and whether I should add something else to it...I\'m honestly terrified, my hands have been shaking just writing the letter, and I would really appreciate any suggestions or reassurance you might be able to offer? Thank you, so so much, for taking the time to read through this!\n\n---------------------------------------------------------------------\n[Names of my family],\nI want to start by telling you that I love you. Your support and approval throughout my life have been important to me beyond words, and the bond we share as a family spending time together, caring for each other, is very precious to me. You might feel worried, confused, or upset by this, and I want to reassure you, before continuing, that I\'m okay; I\'m not sick, and I\'m not in legal trouble. I\'m really, really sorry if I worried you with this letter; I just want to tell you how I feel about certain things in my life, and help you understand my feelings a little better? Reading this to you is very difficult for me, so, I\'d like to ask you for a bit of patience if it takes me some time to go on at any moment.\n\nI\'ve always been a very introverted person. You\'ve all commented on it at some point; asked why I don\'t spend time with friends, or go out more often over weekends. Why I don\'t seem to meet a lot of new people, or keep my feelings to myself. Mom, you\'ve asked me a hundred times if I was okay, to let you in, to tell you how I felt, and...I couldn\'t, for the same reason I can\'t tell other people the same, or talk about myself. I find it hard to show my feelings to others, because I\'m afraid of being ridiculized, judged, or made fun of. Every conversation I have with people involves me showing my accomplishments to others; grades, titles, black belts, aspirations, trying to earn their approval because I feel, deep down, that they would never approve of me or love me if I didn\'t have any of those. I\'ve felt depressed for a very long time, but thought I was supposed to bear it and carry on; that life was supposed to be hard, and it was like that for everyone. It has been difficult, made doubly so because I kept pushing away anyone who tried to get close to me, hid all of my feelings away from even you, my family. \n\nThroughout my entire life, I never felt like I fit in around the people I was expected to spend time with; that\'s not to say that I didn\'t have fun sometimes, but there was always something that didn\'t quite fit, something that felt wrong. I think you know that school was a difficult time for me, and I was bullied a lot; if not, I\'m very sorry I hid that from you, too. I tried my best to adapt and fit in, and by high school, things were tolerable; I was never fully part of ""the group"", but at least I had a few people I spent time with, if never relaxed 100% around. I dedicated myself to my studies and my career, to become the best I could be in my field, leaving aside personal relationships and friendships, because it was easier to ignore them, to live alone, to find validation in being good at what I work on and bury my feelings inside. However, it has gotten to the point where I can\'t bottle this up any longer, where I can\'t keep going without confronting what I have locked away within myself. I want to share this with you, and be honest with you.\n\nI\'m transgender. I\'ve felt I should have been born female for a very long time, wished I could be a normal girl at birthdays silently, even used to pray for it when I still prayed. There is a very negative image of what being transgender means in popular media, and just in case you have that impression, I want to make sure I\'m being clear enough for you, so that you can understand; this doesn\'t mean I want to dress up because of some kind of sexual reason, or to put on an act. This has nothing to do with my sexuality, actually, or who I like, which is something I\'ve never known because I\'m completely unable to imagine myself with someone, male or female, while I\'m expected to be male. This just means that I\'m a woman, like half the population of the planet, and wish to be myself and live happily without having to hide who I am. I\'m tired of filtering every thought I have, every word I want to say, to make sure it\'s something a boy would say. I\'m tired of imitating people around me to try to find out how I\'m supposed to act, and I\'m tired of being scared all the time that someone will find out what I feel. I\'m tired of hating my body, my appearance, and of having to hide that hatred.\n\nI mentioned seeing a therapist this semester when we talked while I was away; she has been helping me come to terms with who I am, with the feelings I\'ve hidden, but I want you to know that this is something I\'ve come to realize on my own. It\'s not something I\'ve chosen; I\'ve hoped my entire life for it to go away, and life would certainly be a lot easier if it had, if I hadn\'t been born this way, but it\'s been on the back of my mind through both good times and bad times. I\'ve come to accept that it\'s not going away. This is who I am, and it\'s not going away. The choice I do have, however, is whether to do something about it. Whether to continue living in hiding, or try to do something to help myself.\n\nI\'m not changing who I am. I\'m still the same person, I\'m still the child you raised. I still love you with all my heart, and want to make you proud. I still want to be a great engineer, and use my career to help others. I have wanted to tell you this for so long, but was terrified of losing you, of hurting you, of upsetting you. I hope you can forgive me. I\'m sure we will have many conversations about this soon, and maybe you might feel upset or confused; I want you to know that I understand that this is difficult for you, too, and I\'ll try to be as open as I can, to be here for you as much as possible. You don\'t have to do anything right now, and if you need some time to process and understand this, that is okay too. \n\nI love you, more than I can express with words, and will never stop loving you,\n[My name]\n', 'subreddit': 'trans', 'title': 'Coming out to my parents about being trans', 'created': 1432641623.0}"
2015-05-27 06:51:37,37fjpb,15,4,,trans,"This is the most horrific anti-trans blog I've ever read.I'm not quite sure how to comprehend the hate and slander here. Not only does she spew ignorance, but she outs people she's never met for them.",1432734697.0,"{'created_utc': 1432709497, 'id': '37fjpb', 'num_comments': 15, 'score': 4, 'selftext': '', 'subreddit': 'trans', 'title': ""This is the most horrific anti-trans blog I've ever read.I'm not quite sure how to comprehend the hate and slander here. Not only does she spew ignorance, but she outs people she's never met for them."", 'created': 1432734697.0}"
2015-05-27 07:16:07,37flnn,0,0,"This might be a bit long, sorry in advance.

So, I am a teenager who, for my entire life, has identified as a male. Lately, though, I've started to wonder if that's how I really want to identify. I have not told anyone, even my therapist, about any of these feelings, and, for a long time, figured they'd just go away. While I did not always hate the idea of being a boy, I did always hate the idea of becoming a man. The facial hair, the deepening of my voice, you name it. Hell, when I was thirteen, I once got so nervous in public that I ran into a bathroom and literally tried to rip off my sideburns with my fingers.

I keep finding myself lurking on trans forums and googling questions about the whole ""transitioning"" thing, and I have to say, I feel right at home in the company of so many people who feel very similar to the way I do. Of course, I feel like I am in such a situation that transitioning or even so much as telling anyone would basically ruin my life. Because of this, I sometimes wonder if killing myself would relieve some of these feelings, seeing as I have no other way to do so.

**TL;DR: Identify as male, starting to feel like I should be female.**

Half of me wants to delete this post right now, but the other half is demanding that I post it so that somebody, anybody, can hear my confession. Who knows? Maybe someday I'll be back here as a more regular user.",trans,"Well, time to get something off my chest.",1432736167.0,"{'created_utc': 1432710967, 'id': '37flnn', 'num_comments': 0, 'score': 0, 'selftext': 'This might be a bit long, sorry in advance.\n\nSo, I am a teenager who, for my entire life, has identified as a male. Lately, though, I\'ve started to wonder if that\'s how I really want to identify. I have not told anyone, even my therapist, about any of these feelings, and, for a long time, figured they\'d just go away. While I did not always hate the idea of being a boy, I did always hate the idea of becoming a man. The facial hair, the deepening of my voice, you name it. Hell, when I was thirteen, I once got so nervous in public that I ran into a bathroom and literally tried to rip off my sideburns with my fingers.\n\nI keep finding myself lurking on trans forums and googling questions about the whole ""transitioning"" thing, and I have to say, I feel right at home in the company of so many people who feel very similar to the way I do. Of course, I feel like I am in such a situation that transitioning or even so much as telling anyone would basically ruin my life. Because of this, I sometimes wonder if killing myself would relieve some of these feelings, seeing as I have no other way to do so.\n\n**TL;DR: Identify as male, starting to feel like I should be female.**\n\nHalf of me wants to delete this post right now, but the other half is demanding that I post it so that somebody, anybody, can hear my confession. Who knows? Maybe someday I\'ll be back here as a more regular user.', 'subreddit': 'trans', 'title': 'Well, time to get something off my chest.', 'created': 1432736167.0}"
2015-05-27 08:12:39,37fpo8,4,15,,trans,"Louisiana Girl Scout council cites loophole, bans transgender kids",1432739559.0,"{'created_utc': 1432714359, 'id': '37fpo8', 'num_comments': 4, 'score': 15, 'selftext': '', 'subreddit': 'trans', 'title': 'Louisiana Girl Scout council cites loophole, bans transgender kids', 'created': 1432739559.0}"
2015-05-28 02:31:35,37jlkk,3,4,"I've been trying to explain to my parents and my family that I want to be called by my male name, instead of my birth name, but I don't know exactly how to go about it. I've already come out, and I've already been talking to my therapist, who has tried to explain it to them. I don't exactly know what to do, because whenever they ask me why I am the way i am the best answer I can give is ""Because I don't feel like the body I am in is who i am, and I'm having Dysphoria, and this is just who I am. Can i have some advice?",trans,Talking to my family about pronouns.,1432805495.0,"{'created_utc': 1432780295, 'id': '37jlkk', 'num_comments': 3, 'score': 4, 'selftext': 'I\'ve been trying to explain to my parents and my family that I want to be called by my male name, instead of my birth name, but I don\'t know exactly how to go about it. I\'ve already come out, and I\'ve already been talking to my therapist, who has tried to explain it to them. I don\'t exactly know what to do, because whenever they ask me why I am the way i am the best answer I can give is ""Because I don\'t feel like the body I am in is who i am, and I\'m having Dysphoria, and this is just who I am. Can i have some advice?', 'subreddit': 'trans', 'title': 'Talking to my family about pronouns.', 'created': 1432805495.0}"
2015-05-30 17:58:16,37v7ur,2,1,"I'm out at one job but not out at the other yet, at least to management and people I never talk to. Today one of those people comes over to my department, says:

Me: Hey, how's it going?

Him: Bullshit, I'm working with a couple women, they don't know nothing!

Me: Fucking women, they ruin everything! *turn around quick so he doesn't see my smirk*

I'm not offended really, just endlessly amused at things like this... He's in for a surprise. And he'll get **zero** favors from me in the future.

Does anybody else have a misogyny or misandry list they keep mentally? Any interesting stories explaining why they're on that list?

I command you Reddit, entertain me! ^Just ^kidding ^please ^don't ^hurt ^me.
",trans,Who else still in the closet at work gets these interactions?,1433033896.0,"{'created_utc': 1433008696, 'id': '37v7ur', 'num_comments': 2, 'score': 1, 'selftext': ""I'm out at one job but not out at the other yet, at least to management and people I never talk to. Today one of those people comes over to my department, says:\n\nMe: Hey, how's it going?\n\nHim: Bullshit, I'm working with a couple women, they don't know nothing!\n\nMe: Fucking women, they ruin everything! *turn around quick so he doesn't see my smirk*\n\nI'm not offended really, just endlessly amused at things like this... He's in for a surprise. And he'll get **zero** favors from me in the future.\n\nDoes anybody else have a misogyny or misandry list they keep mentally? Any interesting stories explaining why they're on that list?\n\nI command you Reddit, entertain me! ^Just ^kidding ^please ^don't ^hurt ^me.\n"", 'subreddit': 'trans', 'title': 'Who else still in the closet at work gets these interactions?', 'created': 1433033896.0}"
2015-05-31 06:26:45,37xm0r,10,4,"I'm 20 going on 21 in Seattle, born male, sometimes feel strongly like a woman. I want to experiment with clothing. How do I go about buying it? I just moved in, and I don't have any close female friends in town. I'm also not sure how padded bras work, exactly. I'd like to see what I look like with a B cup, but I'm fairly certain if you measured my ""breasts"" right now they'd be AAA.

Thank you so much for any help. I'm quite clueless and a bit nervous.",trans,[MtF] What's the best way to buy clothes?,1433078805.0,"{'created_utc': 1433053605, 'id': '37xm0r', 'num_comments': 10, 'score': 4, 'selftext': 'I\'m 20 going on 21 in Seattle, born male, sometimes feel strongly like a woman. I want to experiment with clothing. How do I go about buying it? I just moved in, and I don\'t have any close female friends in town. I\'m also not sure how padded bras work, exactly. I\'d like to see what I look like with a B cup, but I\'m fairly certain if you measured my ""breasts"" right now they\'d be AAA.\n\nThank you so much for any help. I\'m quite clueless and a bit nervous.', 'subreddit': 'trans', 'title': ""[MtF] What's the best way to buy clothes?"", 'created': 1433078805.0}"
2015-05-31 09:38:00,37xymc,1,4,,trans,Rising star breaks gender stereotypes in the modeling industry,1433090280.0,"{'created_utc': 1433065080, 'id': '37xymc', 'num_comments': 1, 'score': 4, 'selftext': '', 'subreddit': 'trans', 'title': 'Rising star breaks gender stereotypes in the modeling industry', 'created': 1433090280.0}"
2015-05-31 12:27:19,37ya4u,13,4,I started HRT on Cinco de Mayo. My prescription is 2mg of Estrogen in the morning and 2 at night. I'm noticing that I'm growing new hairs on my chest and legs. Is this normal? Should I contact my endocrinologist to change my prescription?,trans,MTF Hormone Help,1433100439.0,"{'created_utc': 1433075239, 'id': '37ya4u', 'num_comments': 13, 'score': 4, 'selftext': ""I started HRT on Cinco de Mayo. My prescription is 2mg of Estrogen in the morning and 2 at night. I'm noticing that I'm growing new hairs on my chest and legs. Is this normal? Should I contact my endocrinologist to change my prescription?"", 'subreddit': 'trans', 'title': 'MTF Hormone Help', 'created': 1433100439.0}"
