created_utc,id,num_comments,score,selftext,subreddit,title,created,d_
2015-05-01 03:36:40,34hawt,8,19,"So I'm conflicted here; I've always been in favor of lgbt rights,  my best friend is Gay,  as is my brother.  However, I was just matched on tinder with a Trans woman,  and am not sure how to proceed. She's cute, and I think I like the idea of meeting and maybe dating her,  but am worried about what others will think. 

And if I don't care what others think,  how do I address it on the date?  I wouldn't want to to be insensitive,  but I need error have met a Trans woman before. I wouldn't want her to think she's just some novelty thing. In the same breath,  what it be especially wrong to just have a one night stand like I would with a cis woman?  So many thoughts in my head.  What say you reddit? ",trans,Should I date a Trans woman?,1430476600.0,"{'created_utc': 1430451400, 'id': '34hawt', 'num_comments': 8, 'score': 19, 'selftext': ""So I'm conflicted here; I've always been in favor of lgbt rights,  my best friend is Gay,  as is my brother.  However, I was just matched on tinder with a Trans woman,  and am not sure how to proceed. She's cute, and I think I like the idea of meeting and maybe dating her,  but am worried about what others will think. \n\nAnd if I don't care what others think,  how do I address it on the date?  I wouldn't want to to be insensitive,  but I need error have met a Trans woman before. I wouldn't want her to think she's just some novelty thing. In the same breath,  what it be especially wrong to just have a one night stand like I would with a cis woman?  So many thoughts in my head.  What say you reddit? "", 'subreddit': 'trans', 'title': 'Should I date a Trans woman?', 'created': 1430476600.0}"
2015-05-01 06:47:49,34hr0p,5,2,"Hey, im new around here, but had some questions for some girls/whoever else is in here.

I have been attracted to trans women for a bit and brought it up to my girlfriend recently. I was so excited she didnt judge that I was attracted,  but she was a bit concerned about what that 'meant'.

Now, I in no way mean to be disrespectful of anybody, and want to point out that I dont like that trans girls get objectified in porn,  but thats what porn is about... and I guess who am I to judge the fine line between power and attention or whatever porn is.... but, I had sex with my girlfriend tonight with trans related porn and transition videos.

I wanted to share my experience with my girlfriend, she didnt judge me, and would consider maybe experimenting with more things like this.  She was concerned I may be gay or want to transition myself, which is not what I want.

Once again, I dont want to objectify anybody. . But honestly is there any hope in making a trans friend or finding a community or swingerss/trans party without objectifying the 3rd wheel?

What are your thoughts on transsexual prostitution?  Is that morally better or worse (better possibly because we dont want a poly relationship necessarily)



Edit: i guess i havent succeeded in being non offensive. Seriously i want to learn without being an ass",trans,"Male here.. in a relationship with a cis girl, interested in trans culture",1430488069.0,"{'created_utc': 1430462869, 'id': '34hr0p', 'num_comments': 5, 'score': 2, 'selftext': ""Hey, im new around here, but had some questions for some girls/whoever else is in here.\n\nI have been attracted to trans women for a bit and brought it up to my girlfriend recently. I was so excited she didnt judge that I was attracted,  but she was a bit concerned about what that 'meant'.\n\nNow, I in no way mean to be disrespectful of anybody, and want to point out that I dont like that trans girls get objectified in porn,  but thats what porn is about... and I guess who am I to judge the fine line between power and attention or whatever porn is.... but, I had sex with my girlfriend tonight with trans related porn and transition videos.\n\nI wanted to share my experience with my girlfriend, she didnt judge me, and would consider maybe experimenting with more things like this.  She was concerned I may be gay or want to transition myself, which is not what I want.\n\nOnce again, I dont want to objectify anybody. . But honestly is there any hope in making a trans friend or finding a community or swingerss/trans party without objectifying the 3rd wheel?\n\nWhat are your thoughts on transsexual prostitution?  Is that morally better or worse (better possibly because we dont want a poly relationship necessarily)\n\n\n\nEdit: i guess i havent succeeded in being non offensive. Seriously i want to learn without being an ass"", 'subreddit': 'trans', 'title': 'Male here.. in a relationship with a cis girl, interested in trans culture', 'created': 1430488069.0}"
2015-05-02 10:25:59,34m082,0,1,"My Dearest Samantha,

       I'm sorry to have locked you away for so long, I did not know how important you were to me. I only now realize how vital you are to my happiness. I was wrong, so wrong to keep you from spreading your wings. I will have to live with that for the rest of my life, and it's such a terrible feeling. I just want you to know that I love you more than anything on this Earth. I feel so miserable, so guilty, so ashamed for what I've done. I've taken so much time away from you. Nearly a quarter of a century has passed, and nearly the entirety of that time you've spent locked away, imprisoned, inside that birdcage. I thought about setting you free a couple of times, but as soon as you were about to spread your wings, I always shoved you back inside in shame. For this, I am truly sorry. You will be free soon, my love, I promise; just give me a little more time, and I will await your loving embrace.

Love as always,
Your other half",trans,A poem from the heart,1430587559.0,"{'created_utc': 1430562359, 'id': '34m082', 'num_comments': 0, 'score': 1, 'selftext': ""My Dearest Samantha,\n\n       I'm sorry to have locked you away for so long, I did not know how important you were to me. I only now realize how vital you are to my happiness. I was wrong, so wrong to keep you from spreading your wings. I will have to live with that for the rest of my life, and it's such a terrible feeling. I just want you to know that I love you more than anything on this Earth. I feel so miserable, so guilty, so ashamed for what I've done. I've taken so much time away from you. Nearly a quarter of a century has passed, and nearly the entirety of that time you've spent locked away, imprisoned, inside that birdcage. I thought about setting you free a couple of times, but as soon as you were about to spread your wings, I always shoved you back inside in shame. For this, I am truly sorry. You will be free soon, my love, I promise; just give me a little more time, and I will await your loving embrace.\n\nLove as always,\nYour other half"", 'subreddit': 'trans', 'title': 'A poem from the heart', 'created': 1430587559.0}"
2015-05-03 03:20:03,34oq2d,0,1,,trans,Question to all trans women.,1430648403.0,"{'created_utc': 1430623203, 'id': '34oq2d', 'num_comments': 0, 'score': 1, 'selftext': '', 'subreddit': 'trans', 'title': 'Question to all trans women.', 'created': 1430648403.0}"
2015-05-03 03:37:04,34orgi,19,8,"I had a bit of an argument with a friend of mine concerning whether or not I'd date a trans woman. I told her no simply because I was not attracted to penises. She accused me of being transphobic and I don't understand why. I fully support EVERY member of the LGBT community and I view every trans person as what they are. 

My question is, if a cis male told you that he wouldn't date you only because of your penis and the sole fact he is not attracted would you feel that he is transphobic or he doesn't view you as a woman? ",trans,Question to all trans women,1430649424.0,"{'created_utc': 1430624224, 'id': '34orgi', 'num_comments': 19, 'score': 8, 'selftext': ""I had a bit of an argument with a friend of mine concerning whether or not I'd date a trans woman. I told her no simply because I was not attracted to penises. She accused me of being transphobic and I don't understand why. I fully support EVERY member of the LGBT community and I view every trans person as what they are. \n\nMy question is, if a cis male told you that he wouldn't date you only because of your penis and the sole fact he is not attracted would you feel that he is transphobic or he doesn't view you as a woman? "", 'subreddit': 'trans', 'title': 'Question to all trans women', 'created': 1430649424.0}"
2015-05-03 15:26:26,34q29q,4,21,"Transition is starting off well for me and so far, it just keeps getting better! :) I'm at about 2.5 months in, but not even close to passable. I went out shopping yesterday for a sports bra at VS. I needed something for an upcoming hiking trip I have planned. :) I was in total boy mode not even thinking about trying to pass.

The sales girl was super nice. She must have know right away, b/c she never called me sir or asked what size 'she' wears or anything like that. After a few moments, she asked if it was for me! Even better, she then asked if I'd ever been measured and then took my measurement! Woo hoo!! I was on cloud 9 for basically the rest of the day.

I wouldn't say it was a full on boy-mode failure, but it seems like it was enough of a failure to out me as visibly trans. I'll take that as a good sign! It was strangely validating, especially from a place like VS. :)",trans,Visibly Trans,1430691986.0,"{'created_utc': 1430666786, 'id': '34q29q', 'num_comments': 4, 'score': 21, 'selftext': ""Transition is starting off well for me and so far, it just keeps getting better! :) I'm at about 2.5 months in, but not even close to passable. I went out shopping yesterday for a sports bra at VS. I needed something for an upcoming hiking trip I have planned. :) I was in total boy mode not even thinking about trying to pass.\n\nThe sales girl was super nice. She must have know right away, b/c she never called me sir or asked what size 'she' wears or anything like that. After a few moments, she asked if it was for me! Even better, she then asked if I'd ever been measured and then took my measurement! Woo hoo!! I was on cloud 9 for basically the rest of the day.\n\nI wouldn't say it was a full on boy-mode failure, but it seems like it was enough of a failure to out me as visibly trans. I'll take that as a good sign! It was strangely validating, especially from a place like VS. :)"", 'subreddit': 'trans', 'title': 'Visibly Trans', 'created': 1430691986.0}"
2015-05-04 00:53:46,34rv4x,3,24,"So Im gay and I just started dating a trans man. He is wonderful and I think I love him already. God I hope he doesn't frequent here. Anyway, in my past I wasn't a huge proponent of trans anything, I dated a trans girl in highschool and Jesus was she a terrible human being, still to this day she is actively trying to ruin my reputation among our peers. Anyway time, and this guy, and some sensitivity training have really changed my view. I recently found [this video](https://youtu.be/Lkn06Y8prDU) it makes me cry. Im not even sure if its supposed to but it does. I thought you all might enjoy it.",trans,I found this and now I'm crying.,1430726026.0,"{'created_utc': 1430700826, 'id': '34rv4x', 'num_comments': 3, 'score': 24, 'selftext': ""So Im gay and I just started dating a trans man. He is wonderful and I think I love him already. God I hope he doesn't frequent here. Anyway, in my past I wasn't a huge proponent of trans anything, I dated a trans girl in highschool and Jesus was she a terrible human being, still to this day she is actively trying to ruin my reputation among our peers. Anyway time, and this guy, and some sensitivity training have really changed my view. I recently found [this video](https://youtu.be/Lkn06Y8prDU) it makes me cry. Im not even sure if its supposed to but it does. I thought you all might enjoy it."", 'subreddit': 'trans', 'title': ""I found this and now I'm crying."", 'created': 1430726026.0}"
2015-05-05 06:10:16,34wwzx,3,0,,trans,I sexually Identify as an Attack Helicopter.,1430831416.0,"{'created_utc': 1430806216, 'id': '34wwzx', 'num_comments': 3, 'score': 0, 'selftext': '', 'subreddit': 'trans', 'title': 'I sexually Identify as an Attack Helicopter.', 'created': 1430831416.0}"
2015-05-05 06:53:11,34x04n,6,2,,trans,"It's over, no SRS for Michelle Kosilek as U.S. Supreme Court declines to hear case",1430833991.0,"{'created_utc': 1430808791, 'id': '34x04n', 'num_comments': 6, 'score': 2, 'selftext': '', 'subreddit': 'trans', 'title': ""It's over, no SRS for Michelle Kosilek as U.S. Supreme Court declines to hear case"", 'created': 1430833991.0}"
2015-05-05 06:55:59,34x0b2,10,15,"IOkay, let's imagine a society. It's exactly the same as  the one we live in, except that as children, all left-handed people are lit on fire. Usually the parents do it, or the school system does as soon as the children start picking up pencils. Nobody really knows why, it's just something that you do. Something that has to be done. Because of reasons.

A lot of them die because of it, and suffer terribly. For some reason, the fact that left-handed children have a drastically shorter life expectancy is all the more reason to make sure they are lit on fire. This is something so normal that it would be downright *absurd* to ask why it's done. Of course it's necessary to light the kid on fire, look, she's writing with the wrong hand!

But you weren't. Maybe your parents didn't mind. Maybe nobody at school saw you write, maybe you were ambidextrous enough to just never get caught. And you just realise one day that writing with your left hand is *that* much easier. And then someone notices, and asks you

""But if you're left-handed, why don't you have burn marks?""

As if he homestly thought that left-handed kids simply spontaneously combust. You ask a clarifying question, and it turns out that yes, yes he did.

I got asked a while ago, that if I'm *really* trans, why I don't get triggered by things. Like PTSD is just a standard, normal part of being GSM.

I hope y'all are doing ok.",trans,insane troll logic,1430834159.0,"{'created_utc': 1430808959, 'id': '34x0b2', 'num_comments': 10, 'score': 15, 'selftext': 'IOkay, let\'s imagine a society. It\'s exactly the same as  the one we live in, except that as children, all left-handed people are lit on fire. Usually the parents do it, or the school system does as soon as the children start picking up pencils. Nobody really knows why, it\'s just something that you do. Something that has to be done. Because of reasons.\n\nA lot of them die because of it, and suffer terribly. For some reason, the fact that left-handed children have a drastically shorter life expectancy is all the more reason to make sure they are lit on fire. This is something so normal that it would be downright *absurd* to ask why it\'s done. Of course it\'s necessary to light the kid on fire, look, she\'s writing with the wrong hand!\n\nBut you weren\'t. Maybe your parents didn\'t mind. Maybe nobody at school saw you write, maybe you were ambidextrous enough to just never get caught. And you just realise one day that writing with your left hand is *that* much easier. And then someone notices, and asks you\n\n""But if you\'re left-handed, why don\'t you have burn marks?""\n\nAs if he homestly thought that left-handed kids simply spontaneously combust. You ask a clarifying question, and it turns out that yes, yes he did.\n\nI got asked a while ago, that if I\'m *really* trans, why I don\'t get triggered by things. Like PTSD is just a standard, normal part of being GSM.\n\nI hope y\'all are doing ok.', 'subreddit': 'trans', 'title': 'insane troll logic', 'created': 1430834159.0}"
2015-05-05 23:55:55,3502br,1,2,"I got accepted into a UK university and recently started transitioning. The university is in a small town so I already figure that I'll have to travel to get the care I need. I'm used to costs of care in the US, and I have no idea what insurance and medical costs are like in the UK for someone from another country seeking this sort of care.

I can do a bit of digging as needed. Just need a little bit of help figuring out where to look... who I should be talking to... etc etc.

Thank you ♥",trans,Suggestions for transitioning as an international student in UK?,1430895355.0,"{'created_utc': 1430870155, 'id': '3502br', 'num_comments': 1, 'score': 2, 'selftext': ""I got accepted into a UK university and recently started transitioning. The university is in a small town so I already figure that I'll have to travel to get the care I need. I'm used to costs of care in the US, and I have no idea what insurance and medical costs are like in the UK for someone from another country seeking this sort of care.\n\nI can do a bit of digging as needed. Just need a little bit of help figuring out where to look... who I should be talking to... etc etc.\n\nThank you ♥"", 'subreddit': 'trans', 'title': 'Suggestions for transitioning as an international student in UK?', 'created': 1430895355.0}"
2015-05-06 04:56:37,350z2j,4,42,"I grew up in a very rural area in the bible belt. For as long as I can remember Ive always wanted to dress like a woman. I always fantasized about how it would feel to put on pretty clothes and some makeup. I never did though, and always kept my feeling on that issue to myself because beng from the bible belt, it would cause a lot of issues as you would imagine. About 1 year ago I moved away to a much more accepting state.

Earlier today I cross dressed for the first time. Bought a wig, makeup, and some womens clothes then got home and got all dressed up. I can't even begin to describe how happy it made me, and how natural it felt. I ended up posing in front of the mirrior for about 10 minutes just smiling. It was probably one of the best moments in my life, and I actually felt comfotable and confident with myself for the first time. So much so that I went outside and walked around for a while. In public!

Anyway, I was just so excited I wanted to share the story. This will be something Ill be doing often now. :)",trans,I tried crossdressing today...,1430913397.0,"{'created_utc': 1430888197, 'id': '350z2j', 'num_comments': 4, 'score': 42, 'selftext': ""I grew up in a very rural area in the bible belt. For as long as I can remember Ive always wanted to dress like a woman. I always fantasized about how it would feel to put on pretty clothes and some makeup. I never did though, and always kept my feeling on that issue to myself because beng from the bible belt, it would cause a lot of issues as you would imagine. About 1 year ago I moved away to a much more accepting state.\n\nEarlier today I cross dressed for the first time. Bought a wig, makeup, and some womens clothes then got home and got all dressed up. I can't even begin to describe how happy it made me, and how natural it felt. I ended up posing in front of the mirrior for about 10 minutes just smiling. It was probably one of the best moments in my life, and I actually felt comfotable and confident with myself for the first time. So much so that I went outside and walked around for a while. In public!\n\nAnyway, I was just so excited I wanted to share the story. This will be something Ill be doing often now. :)"", 'subreddit': 'trans', 'title': 'I tried crossdressing today...', 'created': 1430913397.0}"
2015-05-06 23:38:26,354834,9,7,"Some of you may remeber me. Anyway my name is zoey I'm female even though I'm stuck in a mans body. I've come out to anyone that really matters to me. And I've had the pain I'm about to cause made painfully obvious to me. 

I'm lost alone and extremely suicidal. I had been bouncing from boy mode to me mode. For the past 4 days I've been in me mode in boys clothes. And I've actually been happy when I've been able to forget that its not just me this will effect. I booked myself an appointment to see a doctor I asked for a female. I just can't talk to men about it. I work in security and I see how judgemental they can be. I'm paranoid about being able to pass I hate my body I don't want to be in any sort of spot light. But I feel like I am even with the few people I've told. I did tell my dad and he broke down and cried he empathised with me then told me how much I'm going to hurt the people I love. He is hurt and a stupid selfish human.

I can't help the way I am. I feel like I've been offered the chance to either crawl though broken glass, razor blades and needles. Or do the same for the rest of my life with no hope at the end of it. 

I just want to be me. Without all the judgement and hate. Why would I chose this. I don't want to hurt anyone.

Phantom tits wtf????",trans,Update two weeks out. My name is zoey I need lots of you go girls.,1430980706.0,"{'created_utc': 1430955506, 'id': '354834', 'num_comments': 9, 'score': 7, 'selftext': ""Some of you may remeber me. Anyway my name is zoey I'm female even though I'm stuck in a mans body. I've come out to anyone that really matters to me. And I've had the pain I'm about to cause made painfully obvious to me. \n\nI'm lost alone and extremely suicidal. I had been bouncing from boy mode to me mode. For the past 4 days I've been in me mode in boys clothes. And I've actually been happy when I've been able to forget that its not just me this will effect. I booked myself an appointment to see a doctor I asked for a female. I just can't talk to men about it. I work in security and I see how judgemental they can be. I'm paranoid about being able to pass I hate my body I don't want to be in any sort of spot light. But I feel like I am even with the few people I've told. I did tell my dad and he broke down and cried he empathised with me then told me how much I'm going to hurt the people I love. He is hurt and a stupid selfish human.\n\nI can't help the way I am. I feel like I've been offered the chance to either crawl though broken glass, razor blades and needles. Or do the same for the rest of my life with no hope at the end of it. \n\nI just want to be me. Without all the judgement and hate. Why would I chose this. I don't want to hurt anyone.\n\nPhantom tits wtf????"", 'subreddit': 'trans', 'title': 'Update two weeks out. My name is zoey I need lots of you go girls.', 'created': 1430980706.0}"
2015-05-07 12:11:58,35618l,0,9,,trans,The higher education college which doesn’t know what transgender means,1431025918.0,"{'created_utc': 1431000718, 'id': '35618l', 'num_comments': 0, 'score': 9, 'selftext': '', 'subreddit': 'trans', 'title': 'The higher education college which doesn’t know what transgender means', 'created': 1431025918.0}"
2015-05-07 17:36:28,3574c1,2,11,,trans,"The Journal Times, Racine, WI- I need to vent",1431045388.0,"{'created_utc': 1431020188, 'id': '3574c1', 'num_comments': 2, 'score': 11, 'selftext': '', 'subreddit': 'trans', 'title': 'The Journal Times, Racine, WI- I need to vent', 'created': 1431045388.0}"
2015-05-08 04:54:49,359cy7,0,1,,trans,"r/trans, We need your help. Friend sent to ""Conversion Camp"", can't get home.",1431086089.0,"{'created_utc': 1431060889, 'id': '359cy7', 'num_comments': 0, 'score': 1, 'selftext': '', 'subreddit': 'trans', 'title': 'r/trans, We need your help. Friend sent to ""Conversion Camp"", can\'t get home.', 'created': 1431086089.0}"
2015-05-09 09:00:52,35doiy,1,16,,trans,U.S.'s only LGBT governor expected to sign conversion therapy ban,1431187252.0,"{'created_utc': 1431162052, 'id': '35doiy', 'num_comments': 1, 'score': 16, 'selftext': '', 'subreddit': 'trans', 'title': ""U.S.'s only LGBT governor expected to sign conversion therapy ban"", 'created': 1431187252.0}"
2015-05-10 14:14:39,35hqa2,2,14,"I have a friend who has been unhappy with her body for some time and eventually realized it was gender dysphoria and came out. However, due to a combination of health issues and insurance crap, she cannot begin transitioning, not even hormonal treatments. She feels very uncomfortable with her body. A few of her other friends have made her feel better by teaching her how to use makeup and style her hair and pick out flattering clothes. I'm not good at any of these things, so what is something that I can do to help my friend? ",trans,What's the best way to support a friend (mtf) who cannot begin transitioning and is suffering from gender dysphoria?,1431292479.0,"{'created_utc': 1431267279, 'id': '35hqa2', 'num_comments': 2, 'score': 14, 'selftext': ""I have a friend who has been unhappy with her body for some time and eventually realized it was gender dysphoria and came out. However, due to a combination of health issues and insurance crap, she cannot begin transitioning, not even hormonal treatments. She feels very uncomfortable with her body. A few of her other friends have made her feel better by teaching her how to use makeup and style her hair and pick out flattering clothes. I'm not good at any of these things, so what is something that I can do to help my friend? "", 'subreddit': 'trans', 'title': ""What's the best way to support a friend (mtf) who cannot begin transitioning and is suffering from gender dysphoria?"", 'created': 1431292479.0}"
