created_utc,id,num_comments,score,selftext,subreddit,title,created,d_
2015-01-30 06:44:05,2u6a7o,3,7,,trans,Transgender-hate monger Bryan Fischer FIRED!,1422625445.0,"{'created_utc': 1422600245, 'id': '2u6a7o', 'num_comments': 3, 'score': 7, 'selftext': '', 'subreddit': 'trans', 'title': 'Transgender-hate monger Bryan Fischer FIRED!', 'created': 1422625445.0}"
2015-01-31 02:16:17,2u9kc8,3,6,"tl;dr at the TOP!: if anyone just has some ideas for coming out to my parents, that'd be swell.

The actual post:



So I actually started a post before doing a bunch of computer related shenanigans and closed chrome (with the in progress post).

Totally forgot cause I usually use Firefox and hey, what could chrome be running for right now, yeah? (Dumb)

So...

Okay, I'm 19.
19 and like 3 months-ish. I'm a guy, or at least that's what everyone tells me. (Except for my friends who joke about my long hair and call me a woman.. which both irks and doesn't irk me causeeeee..)

Okay so since I was about 12 or 10, y'know something around there-- (My memory is absolute garbage pardon, also lots of parenthesis with me going blah and stuff and words, sorry about that too)

-- I realized I wanted to be a girl. Or at least felt that way. At the time I was well versed in the use of the internet due to having one in the house for quite a while.

At the time I was pretty religious, mostly cause it was kinda shoved into my head by my parents (or at least mother) and prayed pretty daily. So I often.. prayed for some changes.

Obviously that did absolute diddly. I've long since abandoned religion (which is unrelated! but y'know it's a thing).

So for long as I could remember I've hated getting haircuts too. Parents say I kicked and fought when I was even younger than I can remember about them as well.

But well, didn't really have a choice for quite a while. Once high school started I got to keep it a little longer but the school itself was against boys having long hair and so... yeah.

Actually I got pretty horribly emotional over having to cut my hair near the end of senior year and just didn't know why.

When I was 10-12, something (sorry that this story is absolutely everywhere) made me google up body altering sorts of things. I was young, I believed in magic. 
I quickly stopped believing in magic once the internet threw proof at me. Good internet, teaching kids to not be dumb.

Annnnnyway.

Some combination of search keywords later and I ended up at a... transgender webcomic.

And I was absolutely confused.

Google against assisted in defining transgender.
And I was...  well, relieved. I think I understood what was up with me.


Let's fast forward to the present and stay there. (because the god awful memory does not lend itself to clear stories)

So for the past couple of months I've been in a serious rut.
I dunno why.

Well maybe I do, bad relationship, that could be why!
I told one of my best friends, who I've known for years (let's call him Ross) that I was bi (well really pan but explaining why I have a love of cookware just would be awkward jkbadjokeseverywhere) and trans.

And y'know, he seemed cool about it. (also the first person I ever told that I actually knew, not including random internet strangers that literally can't figure out who I am and therefore I felt safe at the time)
And then he totally changed his lifestyle, threw all of my secrets at my girlfriend of about 2 weeks... which ruined a lot.

Not at first, she seemed... okay with knowing everything (not that I wanted someone I just basically got close to to know absolutely EVERYTHING ABOUT MY LIFEanwaysorry..)
Ended up breaking up in part because of the whole.. trans thing. She thought it was something that could be cured, or that I could forget about (y'know technically I did for quite a while so maybe she's right..)

Anyway.

Lately I've been confrontational with my dad. I yell at him a lot for no reason (and promptly apologize because what the hell am I doing).

I don't really feel much of anything anymore.
Did share that in addition to being bi (explaining pan to a parent is probably less difficult than trans, but still), he seemed to think I was depressed (but took the bi thing pretty well!) and I kinda think i agree with him.

I'm really blank. I dunno.
Also dysphoria is actually becoming a problem. I realized that I've basically just been running on instinct and not thinking about anything at all. Which is probably why I was able to push aside the trans thing, I thought I had time. I mean I knew the earlier you transition the better to like offset ""natural"" puberty and all that jazz, but still... y'know, time.

I'm 19 now.
I've said that, and I realize I'm running out of time for a ""successful"" transition.
While I've previously said I don't really feel anymore, I just kinda.. know I'm fed up with all the pretending. I despise the stupid beard that gives away in like .1 seconds that I'm a guy. My hair's quite long now because... college, no one can tell me what to do in that regard anymore. Kinda feel like I could pass if I could just like train my voice (been trying, no success. as it stands my normal speaking voice is kinda odd too really so hey maybe it's a personal problem) and make the beard GTFO. (shaving sucks for me, I bleed a lot, oh well dx)


Anyway..

I want to come out to my parents. I need help with the actual transitioning and well.. parents are supposed to be supportive, right?

I mean my dad's actually really amazing and I hate myself for being such a dick when I was younger to him. He'd probably help if he took it well..

My mom's an absolute religious nut. While I love her, I highly doubt she'd accept me.


To anyone who's gonna say ""move out and do it yourself!""
I've thought about it.
I've got a job, however it's part time because college and I can barely manage to keep my grades together with the rediculous amount of sleep I get (2 hours a night for the previous semester), trying to get more but still.

Also I'm from fairly big city, and everything is expensive. 
So from healthcare (I have none, still on the parents plan and that is a blessing if I ever did see one) to school to... transitioning. I don't think I can do it on my own.

Not for a while.

And I want to get this done before it's gonna be half assed.

Not saying people having had successful transitions in their later years, I've seen a lot and you guys are absolutely amazing. (also when I say guys it's like the general ""all you guys"" sorta thing I don't mean you're all dudes sorry sorry words)

I just uh, I don't know if I can wait.
I mean I could but.


I'm a mess. I accept that.
I don't talk to people much about anything or my feelings(hah what feelings) or how I think but..

This is I guess the balancing out. Tell the internet! Try to get some help, ey?

So if anyone could give me ideas to coming out to my parents (or at least my dad) that'd be.. fantastic.

Or, if you'd like to talk about anything else, feel free to say.. anything else. Really I'm uh... I think I'm lonely.

Also this is a throwaway and the most interesting thing you'll find in my profile is... this post. And any subsequent replies. I think. Yes.


Okay.",trans,Coming out help? (+ a story for anyone bored enough to read it),1422695777.0,"{'created_utc': 1422670577, 'id': '2u9kc8', 'num_comments': 3, 'score': 6, 'selftext': 'tl;dr at the TOP!: if anyone just has some ideas for coming out to my parents, that\'d be swell.\n\nThe actual post:\n\n\n\nSo I actually started a post before doing a bunch of computer related shenanigans and closed chrome (with the in progress post).\n\nTotally forgot cause I usually use Firefox and hey, what could chrome be running for right now, yeah? (Dumb)\n\nSo...\n\nOkay, I\'m 19.\n19 and like 3 months-ish. I\'m a guy, or at least that\'s what everyone tells me. (Except for my friends who joke about my long hair and call me a woman.. which both irks and doesn\'t irk me causeeeee..)\n\nOkay so since I was about 12 or 10, y\'know something around there-- (My memory is absolute garbage pardon, also lots of parenthesis with me going blah and stuff and words, sorry about that too)\n\n-- I realized I wanted to be a girl. Or at least felt that way. At the time I was well versed in the use of the internet due to having one in the house for quite a while.\n\nAt the time I was pretty religious, mostly cause it was kinda shoved into my head by my parents (or at least mother) and prayed pretty daily. So I often.. prayed for some changes.\n\nObviously that did absolute diddly. I\'ve long since abandoned religion (which is unrelated! but y\'know it\'s a thing).\n\nSo for long as I could remember I\'ve hated getting haircuts too. Parents say I kicked and fought when I was even younger than I can remember about them as well.\n\nBut well, didn\'t really have a choice for quite a while. Once high school started I got to keep it a little longer but the school itself was against boys having long hair and so... yeah.\n\nActually I got pretty horribly emotional over having to cut my hair near the end of senior year and just didn\'t know why.\n\nWhen I was 10-12, something (sorry that this story is absolutely everywhere) made me google up body altering sorts of things. I was young, I believed in magic. \nI quickly stopped believing in magic once the internet threw proof at me. Good internet, teaching kids to not be dumb.\n\nAnnnnnyway.\n\nSome combination of search keywords later and I ended up at a... transgender webcomic.\n\nAnd I was absolutely confused.\n\nGoogle against assisted in defining transgender.\nAnd I was...  well, relieved. I think I understood what was up with me.\n\n\nLet\'s fast forward to the present and stay there. (because the god awful memory does not lend itself to clear stories)\n\nSo for the past couple of months I\'ve been in a serious rut.\nI dunno why.\n\nWell maybe I do, bad relationship, that could be why!\nI told one of my best friends, who I\'ve known for years (let\'s call him Ross) that I was bi (well really pan but explaining why I have a love of cookware just would be awkward jkbadjokeseverywhere) and trans.\n\nAnd y\'know, he seemed cool about it. (also the first person I ever told that I actually knew, not including random internet strangers that literally can\'t figure out who I am and therefore I felt safe at the time)\nAnd then he totally changed his lifestyle, threw all of my secrets at my girlfriend of about 2 weeks... which ruined a lot.\n\nNot at first, she seemed... okay with knowing everything (not that I wanted someone I just basically got close to to know absolutely EVERYTHING ABOUT MY LIFEanwaysorry..)\nEnded up breaking up in part because of the whole.. trans thing. She thought it was something that could be cured, or that I could forget about (y\'know technically I did for quite a while so maybe she\'s right..)\n\nAnyway.\n\nLately I\'ve been confrontational with my dad. I yell at him a lot for no reason (and promptly apologize because what the hell am I doing).\n\nI don\'t really feel much of anything anymore.\nDid share that in addition to being bi (explaining pan to a parent is probably less difficult than trans, but still), he seemed to think I was depressed (but took the bi thing pretty well!) and I kinda think i agree with him.\n\nI\'m really blank. I dunno.\nAlso dysphoria is actually becoming a problem. I realized that I\'ve basically just been running on instinct and not thinking about anything at all. Which is probably why I was able to push aside the trans thing, I thought I had time. I mean I knew the earlier you transition the better to like offset ""natural"" puberty and all that jazz, but still... y\'know, time.\n\nI\'m 19 now.\nI\'ve said that, and I realize I\'m running out of time for a ""successful"" transition.\nWhile I\'ve previously said I don\'t really feel anymore, I just kinda.. know I\'m fed up with all the pretending. I despise the stupid beard that gives away in like .1 seconds that I\'m a guy. My hair\'s quite long now because... college, no one can tell me what to do in that regard anymore. Kinda feel like I could pass if I could just like train my voice (been trying, no success. as it stands my normal speaking voice is kinda odd too really so hey maybe it\'s a personal problem) and make the beard GTFO. (shaving sucks for me, I bleed a lot, oh well dx)\n\n\nAnyway..\n\nI want to come out to my parents. I need help with the actual transitioning and well.. parents are supposed to be supportive, right?\n\nI mean my dad\'s actually really amazing and I hate myself for being such a dick when I was younger to him. He\'d probably help if he took it well..\n\nMy mom\'s an absolute religious nut. While I love her, I highly doubt she\'d accept me.\n\n\nTo anyone who\'s gonna say ""move out and do it yourself!""\nI\'ve thought about it.\nI\'ve got a job, however it\'s part time because college and I can barely manage to keep my grades together with the rediculous amount of sleep I get (2 hours a night for the previous semester), trying to get more but still.\n\nAlso I\'m from fairly big city, and everything is expensive. \nSo from healthcare (I have none, still on the parents plan and that is a blessing if I ever did see one) to school to... transitioning. I don\'t think I can do it on my own.\n\nNot for a while.\n\nAnd I want to get this done before it\'s gonna be half assed.\n\nNot saying people having had successful transitions in their later years, I\'ve seen a lot and you guys are absolutely amazing. (also when I say guys it\'s like the general ""all you guys"" sorta thing I don\'t mean you\'re all dudes sorry sorry words)\n\nI just uh, I don\'t know if I can wait.\nI mean I could but.\n\n\nI\'m a mess. I accept that.\nI don\'t talk to people much about anything or my feelings(hah what feelings) or how I think but..\n\nThis is I guess the balancing out. Tell the internet! Try to get some help, ey?\n\nSo if anyone could give me ideas to coming out to my parents (or at least my dad) that\'d be.. fantastic.\n\nOr, if you\'d like to talk about anything else, feel free to say.. anything else. Really I\'m uh... I think I\'m lonely.\n\nAlso this is a throwaway and the most interesting thing you\'ll find in my profile is... this post. And any subsequent replies. I think. Yes.\n\n\nOkay.', 'subreddit': 'trans', 'title': 'Coming out help? (+ a story for anyone bored enough to read it)', 'created': 1422695777.0}"
2015-01-31 18:18:22,2ubp6a,3,16,,trans,Study: Transgender kids show consistent gender identity across measures,1422753502.0,"{'created_utc': 1422728302, 'id': '2ubp6a', 'num_comments': 3, 'score': 16, 'selftext': '', 'subreddit': 'trans', 'title': 'Study: Transgender kids show consistent gender identity across measures', 'created': 1422753502.0}"
