created_utc,id,num_comments,score,selftext,subreddit,title,created,d_
2015-01-22 07:56:45,2t9q1e,1,13,,trans,Trans candidate insulted by opponent during state Democrat forum,1421938605.0,"{'created_utc': 1421913405, 'id': '2t9q1e', 'num_comments': 1, 'score': 13, 'selftext': '', 'subreddit': 'trans', 'title': 'Trans candidate insulted by opponent during state Democrat forum', 'created': 1421938605.0}"
2015-01-23 04:19:40,2tdc2t,2,2,"I have a few questions and would really appreciate any help.

1. I tried taping my chest to give the illusion of breasts but a piece of skin folds up between my ""boobs"", so far I've only found complaints of this happening but haven't seen anything that has fixed the problem. Any advice?

2. I haven't purchased a bra yet... considering I haven't started HRT what bras should I look for? I assume I should be like any other girl and just assume the cup size is going to be the size I can imitate the best.

3. When did you find yourself having more confidence? I bought makeup for the first time with a friend and was shaking the whole time. Does it get better the more often I go? I've only purchased clothes online.

Sorry if these questions seem silly. Though I've known who I am for a while now, I've only recently come out.

Thanks. :)",trans,A few questions from a newly out trans woman...,1422011980.0,"{'created_utc': 1421986780, 'id': '2tdc2t', 'num_comments': 2, 'score': 2, 'selftext': 'I have a few questions and would really appreciate any help.\n\n1. I tried taping my chest to give the illusion of breasts but a piece of skin folds up between my ""boobs"", so far I\'ve only found complaints of this happening but haven\'t seen anything that has fixed the problem. Any advice?\n\n2. I haven\'t purchased a bra yet... considering I haven\'t started HRT what bras should I look for? I assume I should be like any other girl and just assume the cup size is going to be the size I can imitate the best.\n\n3. When did you find yourself having more confidence? I bought makeup for the first time with a friend and was shaking the whole time. Does it get better the more often I go? I\'ve only purchased clothes online.\n\nSorry if these questions seem silly. Though I\'ve known who I am for a while now, I\'ve only recently come out.\n\nThanks. :)', 'subreddit': 'trans', 'title': 'A few questions from a newly out trans woman...', 'created': 1422011980.0}"
2015-01-25 09:57:31,2tlpxp,9,7,Would it be okay if an FTM person was a surrogate parent for the MTF/non-binary/infertile person's child?,trans,Would it be okay to be available in carrying a baby to term for a MTF while being an FTM?,1422205051.0,"{'created_utc': 1422179851, 'id': '2tlpxp', 'num_comments': 9, 'score': 7, 'selftext': ""Would it be okay if an FTM person was a surrogate parent for the MTF/non-binary/infertile person's child?"", 'subreddit': 'trans', 'title': 'Would it be okay to be available in carrying a baby to term for a MTF while being an FTM?', 'created': 1422205051.0}"
2015-01-27 07:30:11,2ttiqj,1,5,,trans,"Arizona trans woman Monica Jones' conviction vacated, may get new trial",1422369011.0,"{'created_utc': 1422343811, 'id': '2ttiqj', 'num_comments': 1, 'score': 5, 'selftext': '', 'subreddit': 'trans', 'title': ""Arizona trans woman Monica Jones' conviction vacated, may get new trial"", 'created': 1422369011.0}"
2015-01-27 21:29:42,2tvwzf,0,1,,trans,Gender is decided by nature not by the person.,1422419382.0,"{'created_utc': 1422394182, 'id': '2tvwzf', 'num_comments': 0, 'score': 1, 'selftext': '', 'subreddit': 'trans', 'title': 'Gender is decided by nature not by the person.', 'created': 1422419382.0}"
2015-01-28 03:25:45,2tx89b,7,3,"The advice is not for me directly, but for my child.  Alex is only 5 years old, and recently he has been saying that he wants to change into a girl.  He sometimes wears his sisters dresses, and if he wears them in public and people call him a girl, he said today that he likes that.  However, he's very stereotypically boyish in other ways-- always playing guns and sword battles, plays with the boys at preschool, etc.  

The confounding factor here is that our live-in nanny is FTM and recently transitioned.  Alex got to see the whole process, from fully female in appearance and using female pronouns to growing facial hair and finally having top surgery and switching names and pronouns. 

I want to get some idea of what I can do at this early age to support him/her finding his identity accurately without making it any harder than it has to be socially and without getting any confusion from him possibly just wanting to mimic an adult role model.  I don't really have much experience with this sort of thing, and I don't want to make any changes when he's so young until I'm sure it's really what's best.It doesn't really help that he doesn't really have a standard male role model in the house-- I'm a single mom, his dad doesn't speak to us, the nanny is FTM, and the nanny's boyfriend who also lives with us is not very engaged with the kids and really hasn't bonded much with them.

I'd just appreciate any advice you could give to the mother of a possible MTF who currently has no idea of all the baloney society will put him through if he is.",trans,Looking for some advice from those of you who have been through it,1422440745.0,"{'created_utc': 1422415545, 'id': '2tx89b', 'num_comments': 7, 'score': 3, 'selftext': ""The advice is not for me directly, but for my child.  Alex is only 5 years old, and recently he has been saying that he wants to change into a girl.  He sometimes wears his sisters dresses, and if he wears them in public and people call him a girl, he said today that he likes that.  However, he's very stereotypically boyish in other ways-- always playing guns and sword battles, plays with the boys at preschool, etc.  \n\nThe confounding factor here is that our live-in nanny is FTM and recently transitioned.  Alex got to see the whole process, from fully female in appearance and using female pronouns to growing facial hair and finally having top surgery and switching names and pronouns. \n\nI want to get some idea of what I can do at this early age to support him/her finding his identity accurately without making it any harder than it has to be socially and without getting any confusion from him possibly just wanting to mimic an adult role model.  I don't really have much experience with this sort of thing, and I don't want to make any changes when he's so young until I'm sure it's really what's best.It doesn't really help that he doesn't really have a standard male role model in the house-- I'm a single mom, his dad doesn't speak to us, the nanny is FTM, and the nanny's boyfriend who also lives with us is not very engaged with the kids and really hasn't bonded much with them.\n\nI'd just appreciate any advice you could give to the mother of a possible MTF who currently has no idea of all the baloney society will put him through if he is."", 'subreddit': 'trans', 'title': 'Looking for some advice from those of you who have been through it', 'created': 1422440745.0}"
2015-01-28 07:21:54,2txwdt,1,0,,trans,Three transgender women murdered in nine days,1422454914.0,"{'created_utc': 1422429714, 'id': '2txwdt', 'num_comments': 1, 'score': 0, 'selftext': '', 'subreddit': 'trans', 'title': 'Three transgender women murdered in nine days', 'created': 1422454914.0}"
2015-01-28 12:24:14,2tyfq4,1,5,"I feel I'm at an impasse.  I'm broke, I'm jobless, I'm 28, and I'm about to lose my apartment, and all that just makes this so much worse.  I've wanted to be a girl for as long as I can remember.  I remember being 2 or 3 and my mom was cutting my hair.  She was real rough when she did that and it hurt and I was cold and I started to complain.  Her reaction was to ask me if I wanted to be a girl, as if it were a bad thing.  I said no, but even then, I wanted to say yes.  


At night, I used to pretend that me and my stuffed animals were a family and while I was ""Daddy"" occassionally, more often than not, I would be ""Mommy.""  I've known this whole time and yet, this whole time, I've been completely in the closet, hoping it would just go away.  My first time dressing as a girl, I was 4 years old.  I found that I liked it and for many nights thereafter, my mother would put me to bed and she would go watch TV in the living room.  I would then creep out of bed, go into her room, and find something I thought looked pretty and pretend I was a pretty lady at a dinner party or some such like that.  Then one night, she caught me.  She hit me and yelled as she made me strip out of her clothes and back into my pajamas and the next day, punished me by taking away privileges, for a week or a month, I don't remember, never again mentioning what had transpired the night before.  She kind of acted like she was doing me a favor that next day.  She never again mentioned that incidence, nor did she ever catch me again, but here and there, as I got older, she would make comments like ""oh, I wouldn't mind if you were gay but if you were transgender, I would be heartbroken.""  She would give different reasons for her heartbrokenness when the topic would come up, sometimes saying that life would be much harder for me as a transgirl than as a gay man.  


Not that I ever came out as gay, or ever even really thought of myself as gay.  As a man, I like women.  I sometimes feel as though my relations with women have been a way for me to live as a girl vicariously.  I have, however, had fantasies, many fantasies, of myself being a girl with a man, but never as a man with another man.  I used to tell myself that my sexual fantasies involving men and me as a girl, they were just a fetish.  That I could never *really love* a man.  But maybe I could.  I've had quite a few nonsexual fantasies involving myself as a girl with a man, more and more as the years have dragged on.  


My mother's scolding that night when I was a little boy who only wanted to be a little girl, of course, did nothing to help rid me of the desire to be pretty and girly but I think the effects of that night, as well as the way my mother and my peers referred to trans individuals, have probably helped a lot to keep these desires tucked far away all these years.  I can't fight the urge to dress up here and there--to at least feel a little like a woman, at least some of the time, but I've never come out to anyone, other than a few select strangers on the internet who I'd talk to once, maybe 2 or 3 times, and then never again.  I've never told a friend, a loved one, a girlfriend, nobody.  And now I'm getting older and broker and homelesser and I try to be hopeful.  I'll get a call about a job tomorrow, I tell myself, but even if I do, then what?  I'm still a boy.  


It's taken me a long time and I have to admit, sometimes I do still feel a tinge of shame when the desire seems to get too great, but the desire seems to come more and more often, and more and more, I feel like nothing I do from here on out matters that much because, as long as I have to be a boy, as long as I don't have the support that would enable me to enter a life of femininity, I'm not really myself.  I still feel the shame sometimes, though I know there is nothing to be ashamed about.  Of the few friends and loved ones I have left, I don't think any of them would have issue if I were to come out but I'm still not ready for that.  I need someone who at least somewhat understands what this is like.  I need someone to gain guidance from.  


I'm not just too broke, but too scared, too beaten and broken to embrace my femininity on my own.  I've tried a couple times in the past (online) but mostly I've just come across creeps, flakes, and jerks, and after a while, I just kind of gave up.  But as times have gotten worse for me in other areas of my life, the desire just comes back that much stronger.  My ideal situation?  My prince charming comes along, says ""hey, I know you're going through some rough times and I just want to help.  I'll buy you some clothes, help you with your makeup, give you a place to crash, and help you ease into this life as comfortably as possible.  Oh, and you know what?  I know of a trans-friendly business who's looking for some extra help and I can help you get an interview for next week so while we're at it, let's get you an interview outfit.""  Ideal circumstance.  I know that probably won't ever happen and maybe I won't even ever work up the courage to take the steps I need to to come out or embrace such a life.  Posting here, I guess the best I can hope for is a kind voice, a kind ear.  Venting helps when all else fails.  


I see girls when I go out, on the train, at my school, in stores and on the streets and I just want to be them so bad.  I want to dress like them, I want to walk like them, talk like them, move like them, and do girly things.  I see the way other guys look at them and I wish more so bad that a man would look at me like that, with me looking like she does.  I want it to stop more than I want to embrace it, but after almost three decades, I'm starting to realize that it won't stop until I'm dead.  Sometimes though, when I'm overly tired or my neurons are aligned just right, I'll be on my way home and I'll get it in my head that ""tonight, I'm gonna figure it out and I'm gonna go for it!""  Then I get home and use the bathroom and as I wash my hands, I see my face in the mirror and see that it's already matured into a somewhat manly shape.  And I have a slight Adam's apple.  And I have nice legs but my hands.  They're all big and veiny and oh, I could never be a woman.  And then I lose momentum and I'm sad until I go to sleep.  Then I wake up and look in the mirror and think to myself ""maybe I could pull it off, but better to not even try.  Mom was right.  It would be a hard life and life is hard enough as it is,"" and I push the thoughts, the feelings, the desires, I push all of it down as far as it will go but it always bounces back hard a few weeks later, a few days later.  


The world is harsh to us (and I don't mean just trans individuals, but everybody, in one way or another, but still, especially those who struggle with something like gender dysphoria, and, as the coward I am, I can't even begin to fathom the struggles of those who have embraced their dysphoria), but even moreso, we are harsh to ourselves.  I'm harsh to myself.  I've had thoughts of suicide throughout the years, almost attempted with pills a few years ago (threw them up immediately after ingesting).  I've had a hard life all around but sometimes I catch myself thinking ""if I could just have, at some point, rid myself of this shameful secret, this curse, would I have ever considered attempting suicide?  Would life have been as hard?""  


Sometimes, though, I wonder what my life would have been like had I been able to come out when I was younger.  Better maybe.  I would have built a base of friends within the trans community, and without, get a job writing for a magazine or periodical with a focus on trans issues or maybe get a job at a trans book store, meet a caring, sweet, and gentle man whom I loved and who loved me, save up money, freeze some sperm (so I could be a mommy!), and start on HRT, and somewhere throughout, go to school as a girl, be able to feel like a woman as I bought a squash and a roast beef to cook for dinner or just nail polish and cough medicine at the drug store or as I rode the bus home or as I rode the train to work.  Maybe it would have been just like that--a fairy tale.  Or maybe I'd have just had to deal with more shit and my mentality might have just stayed the same.  I'll never know what my life could have been like and maybe I won't ever know.  Maybe I should see a therapist.  Either way, I just wanted to get some of this off my chest.  Wasn't sure where exactly to post this but this sub seemed like a good enough place.  Thanks if you read this far...",trans,new user. just want to vent.,1422473054.0,"{'created_utc': 1422447854, 'id': '2tyfq4', 'num_comments': 1, 'score': 5, 'selftext': 'I feel I\'m at an impasse.  I\'m broke, I\'m jobless, I\'m 28, and I\'m about to lose my apartment, and all that just makes this so much worse.  I\'ve wanted to be a girl for as long as I can remember.  I remember being 2 or 3 and my mom was cutting my hair.  She was real rough when she did that and it hurt and I was cold and I started to complain.  Her reaction was to ask me if I wanted to be a girl, as if it were a bad thing.  I said no, but even then, I wanted to say yes.  \n\n\nAt night, I used to pretend that me and my stuffed animals were a family and while I was ""Daddy"" occassionally, more often than not, I would be ""Mommy.""  I\'ve known this whole time and yet, this whole time, I\'ve been completely in the closet, hoping it would just go away.  My first time dressing as a girl, I was 4 years old.  I found that I liked it and for many nights thereafter, my mother would put me to bed and she would go watch TV in the living room.  I would then creep out of bed, go into her room, and find something I thought looked pretty and pretend I was a pretty lady at a dinner party or some such like that.  Then one night, she caught me.  She hit me and yelled as she made me strip out of her clothes and back into my pajamas and the next day, punished me by taking away privileges, for a week or a month, I don\'t remember, never again mentioning what had transpired the night before.  She kind of acted like she was doing me a favor that next day.  She never again mentioned that incidence, nor did she ever catch me again, but here and there, as I got older, she would make comments like ""oh, I wouldn\'t mind if you were gay but if you were transgender, I would be heartbroken.""  She would give different reasons for her heartbrokenness when the topic would come up, sometimes saying that life would be much harder for me as a transgirl than as a gay man.  \n\n\nNot that I ever came out as gay, or ever even really thought of myself as gay.  As a man, I like women.  I sometimes feel as though my relations with women have been a way for me to live as a girl vicariously.  I have, however, had fantasies, many fantasies, of myself being a girl with a man, but never as a man with another man.  I used to tell myself that my sexual fantasies involving men and me as a girl, they were just a fetish.  That I could never *really love* a man.  But maybe I could.  I\'ve had quite a few nonsexual fantasies involving myself as a girl with a man, more and more as the years have dragged on.  \n\n\nMy mother\'s scolding that night when I was a little boy who only wanted to be a little girl, of course, did nothing to help rid me of the desire to be pretty and girly but I think the effects of that night, as well as the way my mother and my peers referred to trans individuals, have probably helped a lot to keep these desires tucked far away all these years.  I can\'t fight the urge to dress up here and there--to at least feel a little like a woman, at least some of the time, but I\'ve never come out to anyone, other than a few select strangers on the internet who I\'d talk to once, maybe 2 or 3 times, and then never again.  I\'ve never told a friend, a loved one, a girlfriend, nobody.  And now I\'m getting older and broker and homelesser and I try to be hopeful.  I\'ll get a call about a job tomorrow, I tell myself, but even if I do, then what?  I\'m still a boy.  \n\n\nIt\'s taken me a long time and I have to admit, sometimes I do still feel a tinge of shame when the desire seems to get too great, but the desire seems to come more and more often, and more and more, I feel like nothing I do from here on out matters that much because, as long as I have to be a boy, as long as I don\'t have the support that would enable me to enter a life of femininity, I\'m not really myself.  I still feel the shame sometimes, though I know there is nothing to be ashamed about.  Of the few friends and loved ones I have left, I don\'t think any of them would have issue if I were to come out but I\'m still not ready for that.  I need someone who at least somewhat understands what this is like.  I need someone to gain guidance from.  \n\n\nI\'m not just too broke, but too scared, too beaten and broken to embrace my femininity on my own.  I\'ve tried a couple times in the past (online) but mostly I\'ve just come across creeps, flakes, and jerks, and after a while, I just kind of gave up.  But as times have gotten worse for me in other areas of my life, the desire just comes back that much stronger.  My ideal situation?  My prince charming comes along, says ""hey, I know you\'re going through some rough times and I just want to help.  I\'ll buy you some clothes, help you with your makeup, give you a place to crash, and help you ease into this life as comfortably as possible.  Oh, and you know what?  I know of a trans-friendly business who\'s looking for some extra help and I can help you get an interview for next week so while we\'re at it, let\'s get you an interview outfit.""  Ideal circumstance.  I know that probably won\'t ever happen and maybe I won\'t even ever work up the courage to take the steps I need to to come out or embrace such a life.  Posting here, I guess the best I can hope for is a kind voice, a kind ear.  Venting helps when all else fails.  \n\n\nI see girls when I go out, on the train, at my school, in stores and on the streets and I just want to be them so bad.  I want to dress like them, I want to walk like them, talk like them, move like them, and do girly things.  I see the way other guys look at them and I wish more so bad that a man would look at me like that, with me looking like she does.  I want it to stop more than I want to embrace it, but after almost three decades, I\'m starting to realize that it won\'t stop until I\'m dead.  Sometimes though, when I\'m overly tired or my neurons are aligned just right, I\'ll be on my way home and I\'ll get it in my head that ""tonight, I\'m gonna figure it out and I\'m gonna go for it!""  Then I get home and use the bathroom and as I wash my hands, I see my face in the mirror and see that it\'s already matured into a somewhat manly shape.  And I have a slight Adam\'s apple.  And I have nice legs but my hands.  They\'re all big and veiny and oh, I could never be a woman.  And then I lose momentum and I\'m sad until I go to sleep.  Then I wake up and look in the mirror and think to myself ""maybe I could pull it off, but better to not even try.  Mom was right.  It would be a hard life and life is hard enough as it is,"" and I push the thoughts, the feelings, the desires, I push all of it down as far as it will go but it always bounces back hard a few weeks later, a few days later.  \n\n\nThe world is harsh to us (and I don\'t mean just trans individuals, but everybody, in one way or another, but still, especially those who struggle with something like gender dysphoria, and, as the coward I am, I can\'t even begin to fathom the struggles of those who have embraced their dysphoria), but even moreso, we are harsh to ourselves.  I\'m harsh to myself.  I\'ve had thoughts of suicide throughout the years, almost attempted with pills a few years ago (threw them up immediately after ingesting).  I\'ve had a hard life all around but sometimes I catch myself thinking ""if I could just have, at some point, rid myself of this shameful secret, this curse, would I have ever considered attempting suicide?  Would life have been as hard?""  \n\n\nSometimes, though, I wonder what my life would have been like had I been able to come out when I was younger.  Better maybe.  I would have built a base of friends within the trans community, and without, get a job writing for a magazine or periodical with a focus on trans issues or maybe get a job at a trans book store, meet a caring, sweet, and gentle man whom I loved and who loved me, save up money, freeze some sperm (so I could be a mommy!), and start on HRT, and somewhere throughout, go to school as a girl, be able to feel like a woman as I bought a squash and a roast beef to cook for dinner or just nail polish and cough medicine at the drug store or as I rode the bus home or as I rode the train to work.  Maybe it would have been just like that--a fairy tale.  Or maybe I\'d have just had to deal with more shit and my mentality might have just stayed the same.  I\'ll never know what my life could have been like and maybe I won\'t ever know.  Maybe I should see a therapist.  Either way, I just wanted to get some of this off my chest.  Wasn\'t sure where exactly to post this but this sub seemed like a good enough place.  Thanks if you read this far...', 'subreddit': 'trans', 'title': 'new user. just want to vent.', 'created': 1422473054.0}"
2015-01-28 19:11:45,2tzqwp,4,24,,trans,Wizards of the Coast continues to be one of my favorite companies. (Flavor article for M:TG with a trans protagonist),1422497505.0,"{'created_utc': 1422472305, 'id': '2tzqwp', 'num_comments': 4, 'score': 24, 'selftext': '', 'subreddit': 'trans', 'title': 'Wizards of the Coast continues to be one of my favorite companies. (Flavor article for M:TG with a trans protagonist)', 'created': 1422497505.0}"
2015-01-29 08:29:03,2u2amn,1,13,,trans,Two more trans murders reported since yesterday -- Kentucky and Austria,1422545343.0,"{'created_utc': 1422520143, 'id': '2u2amn', 'num_comments': 1, 'score': 13, 'selftext': '', 'subreddit': 'trans', 'title': 'Two more trans murders reported since yesterday -- Kentucky and Austria', 'created': 1422545343.0}"
2015-01-29 19:19:39,2u40yc,2,0,,trans,Casting Call: Same-sex families,1422584379.0,"{'created_utc': 1422559179, 'id': '2u40yc', 'num_comments': 2, 'score': 0, 'selftext': '', 'subreddit': 'trans', 'title': 'Casting Call: Same-sex families', 'created': 1422584379.0}"
