created_utc,id,num_comments,score,selftext,subreddit,title,created,d_
2015-01-01 10:26:17,2qzzf1,1,11,,trans,Transgender murders continue unabated pace post-TDOR 2014,1420133177.0,"{'created_utc': 1420107977, 'id': '2qzzf1', 'num_comments': 1, 'score': 11, 'selftext': '', 'subreddit': 'trans', 'title': 'Transgender murders continue unabated pace post-TDOR 2014', 'created': 1420133177.0}"
2015-01-01 13:01:43,2r069h,6,2,"My girlfriend is moving from San Diego up here in Tacoma with me and I know there are trans resources in Seattle, but neither of us have cars and public transport isn't the most reliable, so I was hoping this sub knew of resources we could go to. 

This would be for me too because I've not been comfortable going alone to the place in Seattle. 

Thanks for any and all help, you guys are awesome!",trans,"Where can I find trans resources in Tacoma, WA?",1420142503.0,"{'created_utc': 1420117303, 'id': '2r069h', 'num_comments': 6, 'score': 2, 'selftext': ""My girlfriend is moving from San Diego up here in Tacoma with me and I know there are trans resources in Seattle, but neither of us have cars and public transport isn't the most reliable, so I was hoping this sub knew of resources we could go to. \n\nThis would be for me too because I've not been comfortable going alone to the place in Seattle. \n\nThanks for any and all help, you guys are awesome!"", 'subreddit': 'trans', 'title': 'Where can I find trans resources in Tacoma, WA?', 'created': 1420142503.0}"
2015-01-03 03:29:53,2r63si,2,0,,trans,"(Update-2, Erasure begins) Conservative Christian parents triggers suicide of transgender teen",1420280993.0,"{'created_utc': 1420255793, 'id': '2r63si', 'num_comments': 2, 'score': 0, 'selftext': '', 'subreddit': 'trans', 'title': '(Update-2, Erasure begins) Conservative Christian parents triggers suicide of transgender teen', 'created': 1420280993.0}"
2015-01-03 05:05:04,2r6d8v,1,71,,trans,I work in a children's library. Today I came across a book I thought this sub would appreciate.,1420286704.0,"{'created_utc': 1420261504, 'id': '2r6d8v', 'num_comments': 1, 'score': 71, 'selftext': '', 'subreddit': 'trans', 'title': ""I work in a children's library. Today I came across a book I thought this sub would appreciate."", 'created': 1420286704.0}"
2015-01-05 02:09:10,2rcwc9,0,8,,trans,Two weeks post-op (Periareolar),1420448950.0,"{'created_utc': 1420423750, 'id': '2rcwc9', 'num_comments': 0, 'score': 8, 'selftext': '', 'subreddit': 'trans', 'title': 'Two weeks post-op (Periareolar)', 'created': 1420448950.0}"
2015-01-05 06:30:27,2rdn47,1,0,,trans,SF trans couple targeted by violent behaving man armed with steak knife,1420464627.0,"{'created_utc': 1420439427, 'id': '2rdn47', 'num_comments': 1, 'score': 0, 'selftext': '', 'subreddit': 'trans', 'title': 'SF trans couple targeted by violent behaving man armed with steak knife', 'created': 1420464627.0}"
2015-01-05 08:48:57,2rdwzu,0,37,,trans,India elects it's first transgender mayor.,1420472937.0,"{'created_utc': 1420447737, 'id': '2rdwzu', 'num_comments': 0, 'score': 37, 'selftext': '', 'subreddit': 'trans', 'title': ""India elects it's first transgender mayor."", 'created': 1420472937.0}"
2015-01-08 05:41:22,2rps7r,4,3,"I'm kinda....stuck. I have three younger siblings aged 9, 7, and 5. My youngest has always shown some very feminine tendencies and I decided to finally talk to them about it. They've pretty much communicated as well as a five year old can that they want to be a girl when they grow up. I've made sure they weren't just kidding around in the way that kids that age do and I'm quite certain they're serious. I want to support them but I'm stuck as how to introduce this to my parents? My mother would be okay but I'm not sure how my step father would take to it so....I'm just not too sure what to do. I want something to happen before my sibling starts being pushed to conform to masculine ways and grows up being uncomfortable with themselves. 

I have dressed them up in female clothes and I've never seen them happier, I just don't know what to do about the usually conservative parents. Any suggestions?

*Correction* They're actually 6, I forgot their birthday had passed.",trans,I need help.,1420720882.0,"{'created_utc': 1420695682, 'id': '2rps7r', 'num_comments': 4, 'score': 3, 'selftext': ""I'm kinda....stuck. I have three younger siblings aged 9, 7, and 5. My youngest has always shown some very feminine tendencies and I decided to finally talk to them about it. They've pretty much communicated as well as a five year old can that they want to be a girl when they grow up. I've made sure they weren't just kidding around in the way that kids that age do and I'm quite certain they're serious. I want to support them but I'm stuck as how to introduce this to my parents? My mother would be okay but I'm not sure how my step father would take to it so....I'm just not too sure what to do. I want something to happen before my sibling starts being pushed to conform to masculine ways and grows up being uncomfortable with themselves. \n\nI have dressed them up in female clothes and I've never seen them happier, I just don't know what to do about the usually conservative parents. Any suggestions?\n\n*Correction* They're actually 6, I forgot their birthday had passed."", 'subreddit': 'trans', 'title': 'I need help.', 'created': 1420720882.0}"
2015-01-08 07:44:07,2rq2nk,5,4,,trans,"Christian writer says we're members of the ""sexual anarchy movement"" with a ""tyrannical agenda""",1420728247.0,"{'created_utc': 1420703047, 'id': '2rq2nk', 'num_comments': 5, 'score': 4, 'selftext': '', 'subreddit': 'trans', 'title': 'Christian writer says we\'re members of the ""sexual anarchy movement"" with a ""tyrannical agenda""', 'created': 1420728247.0}"
2015-01-08 20:58:26,2rs682,3,7,,trans,a cis women trying to become more educated about trans* Labels -ashley mardel,1420775906.0,"{'created_utc': 1420750706, 'id': '2rs682', 'num_comments': 3, 'score': 7, 'selftext': '', 'subreddit': 'trans', 'title': 'a cis women trying to become more educated about trans* Labels -ashley mardel', 'created': 1420775906.0}"
2015-01-09 05:48:53,2rtwqm,0,1,,trans,Jen 30 M2F My story.,1420807733.0,"{'created_utc': 1420782533, 'id': '2rtwqm', 'num_comments': 0, 'score': 1, 'selftext': '', 'subreddit': 'trans', 'title': 'Jen 30 M2F My story.', 'created': 1420807733.0}"
2015-01-09 09:54:33,2ruedt,0,17,,trans,A Few Alleviations For Dysphoria,1420822473.0,"{'created_utc': 1420797273, 'id': '2ruedt', 'num_comments': 0, 'score': 17, 'selftext': '', 'subreddit': 'trans', 'title': 'A Few Alleviations For Dysphoria', 'created': 1420822473.0}"
2015-01-09 19:16:56,2rvw8e,5,21,,trans,"""Saks Claims a Legal Right to Discriminate Against Trans Employees"" :(",1420856216.0,"{'created_utc': 1420831016, 'id': '2rvw8e', 'num_comments': 5, 'score': 21, 'selftext': '', 'subreddit': 'trans', 'title': '""Saks Claims a Legal Right to Discriminate Against Trans Employees"" :(', 'created': 1420856216.0}"
2015-01-09 20:10:00,2rw31u,0,6,,trans,Trans* people no longer allowed to apply for a driving licence in Russia,1420859400.0,"{'created_utc': 1420834200, 'id': '2rw31u', 'num_comments': 0, 'score': 6, 'selftext': '', 'subreddit': 'trans', 'title': 'Trans* people no longer allowed to apply for a driving licence in Russia', 'created': 1420859400.0}"
2015-01-10 08:57:44,2ry7bm,3,4,,trans,New Russian law: Transgender people mentally unfit to drive,1420905464.0,"{'created_utc': 1420880264, 'id': '2ry7bm', 'num_comments': 3, 'score': 4, 'selftext': '', 'subreddit': 'trans', 'title': 'New Russian law: Transgender people mentally unfit to drive', 'created': 1420905464.0}"
2015-01-10 16:40:17,2rz1od,1,5,,trans,Why we as a trans community need to put the mistakes Stonewall made in the past,1420933217.0,"{'created_utc': 1420908017, 'id': '2rz1od', 'num_comments': 1, 'score': 5, 'selftext': '', 'subreddit': 'trans', 'title': 'Why we as a trans community need to put the mistakes Stonewall made in the past', 'created': 1420933217.0}"
2015-01-10 19:21:19,2rzjs3,0,12,,trans,Breaking News: Vanderbilt Launches Trans Buddy Program,1420942879.0,"{'created_utc': 1420917679, 'id': '2rzjs3', 'num_comments': 0, 'score': 12, 'selftext': '', 'subreddit': 'trans', 'title': 'Breaking News: Vanderbilt Launches Trans Buddy Program', 'created': 1420942879.0}"
2015-01-12 06:06:59,2s51iy,1,21,,trans,"""Transparent"" Golden Globe winners thanks trans community; dedicates award to Leelah Alcorn",1421068019.0,"{'created_utc': 1421042819, 'id': '2s51iy', 'num_comments': 1, 'score': 21, 'selftext': '', 'subreddit': 'trans', 'title': '""Transparent"" Golden Globe winners thanks trans community; dedicates award to Leelah Alcorn', 'created': 1421068019.0}"
2015-01-13 22:09:40,2sbvv0,4,8,"Ok, I have tried several times by now and for some reason I just can't get good results from applying eyeliner and lipstick.
I look quite good naturally and my face passes without issues, but the moment I apply make up, I look older and like a guy, who's wearing make up.

I'm not necessarily complaining, I mean for most part this is incredibly convenient, however this strikes me as odd as make up is supposed to make you look better, yet for some reason, no matter how I apply it It always brings up my less feminine features, even if I apply too little or too much... I always look better without it.

 
Does anyone else get this? Looking better and more feminine without make up?",trans,Issues with make up MTF,1421212180.0,"{'created_utc': 1421186980, 'id': '2sbvv0', 'num_comments': 4, 'score': 8, 'selftext': ""Ok, I have tried several times by now and for some reason I just can't get good results from applying eyeliner and lipstick.\nI look quite good naturally and my face passes without issues, but the moment I apply make up, I look older and like a guy, who's wearing make up.\n\nI'm not necessarily complaining, I mean for most part this is incredibly convenient, however this strikes me as odd as make up is supposed to make you look better, yet for some reason, no matter how I apply it It always brings up my less feminine features, even if I apply too little or too much... I always look better without it.\n\n \nDoes anyone else get this? Looking better and more feminine without make up?"", 'subreddit': 'trans', 'title': 'Issues with make up MTF', 'created': 1421212180.0}"
2015-01-14 05:32:36,2sden8,4,3,I feel like I'm going to go crazy(er) if I don't get something done soon. I've worked so hard to get my life together and get away from my abusive family. I have a great job and a great partner but it still feels like basic contentment is so far off. Any ideas? ,trans,How to pay for surgery?,1421238756.0,"{'created_utc': 1421213556, 'id': '2sden8', 'num_comments': 4, 'score': 3, 'selftext': ""I feel like I'm going to go crazy(er) if I don't get something done soon. I've worked so hard to get my life together and get away from my abusive family. I have a great job and a great partner but it still feels like basic contentment is so far off. Any ideas? "", 'subreddit': 'trans', 'title': 'How to pay for surgery?', 'created': 1421238756.0}"
2015-01-15 10:13:53,2si41h,2,6,,trans,(Update -- Kremlin changes mind?) New Russian law: Transgender people mentally unfit to drive,1421342033.0,"{'created_utc': 1421316833, 'id': '2si41h', 'num_comments': 2, 'score': 6, 'selftext': '', 'subreddit': 'trans', 'title': '(Update -- Kremlin changes mind?) New Russian law: Transgender people mentally unfit to drive', 'created': 1421342033.0}"
2015-01-16 17:50:38,2snd8j,13,5,,trans,How did you realise you where Transgender?,1421455838.0,"{'created_utc': 1421430638, 'id': '2snd8j', 'num_comments': 13, 'score': 5, 'selftext': '', 'subreddit': 'trans', 'title': 'How did you realise you where Transgender?', 'created': 1421455838.0}"
2015-01-17 08:35:25,2spwos,1,6,,trans,"Another Bathroom Cop surfaces, this time with a perverse twist",1421508925.0,"{'created_utc': 1421483725, 'id': '2spwos', 'num_comments': 1, 'score': 6, 'selftext': '', 'subreddit': 'trans', 'title': 'Another Bathroom Cop surfaces, this time with a perverse twist', 'created': 1421508925.0}"
2015-01-18 08:46:56,2stfqv,3,5,,trans,"Bruce Jenner trans? Don't know, don't care, but tabloids' exploitation should cease",1421596016.0,"{'created_utc': 1421570816, 'id': '2stfqv', 'num_comments': 3, 'score': 5, 'selftext': '', 'subreddit': 'trans', 'title': ""Bruce Jenner trans? Don't know, don't care, but tabloids' exploitation should cease"", 'created': 1421596016.0}"
2015-01-20 02:08:22,2t0733,14,1,"I'm a pansexual cis guy (please no ""die cis scum"" comments, I'm an ally!) and I'm interested in dating a trans* person because I find androgyny and unconventional gender expression in general attractive. I know that sounds like fetishizing, but honestly trans* people (FtM or MtF or genderqueer or anything really, I couldn't care less what genitals they have) are just more attractive and interesting to me than cis guys or girls. I've had a lot of trouble on OKCupid because many trans people there get lots of creepers and stupid/insulting questions (""do you still have a dick/pussy?"" etc) and so they assume that a guy interested in trans* people is just a fetishist. I don't deny that my interest is sexual, but I'm pan so to me basically everyone is a potential partner and that doesn't stop me from having normal friendships/professional relationships/etc.",trans,Is there a non-creepy way for a cis guy to express interest in trans* people?,1421744902.0,"{'created_utc': 1421719702, 'id': '2t0733', 'num_comments': 14, 'score': 1, 'selftext': 'I\'m a pansexual cis guy (please no ""die cis scum"" comments, I\'m an ally!) and I\'m interested in dating a trans* person because I find androgyny and unconventional gender expression in general attractive. I know that sounds like fetishizing, but honestly trans* people (FtM or MtF or genderqueer or anything really, I couldn\'t care less what genitals they have) are just more attractive and interesting to me than cis guys or girls. I\'ve had a lot of trouble on OKCupid because many trans people there get lots of creepers and stupid/insulting questions (""do you still have a dick/pussy?"" etc) and so they assume that a guy interested in trans* people is just a fetishist. I don\'t deny that my interest is sexual, but I\'m pan so to me basically everyone is a potential partner and that doesn\'t stop me from having normal friendships/professional relationships/etc.', 'subreddit': 'trans', 'title': 'Is there a non-creepy way for a cis guy to express interest in trans* people?', 'created': 1421744902.0}"
2015-01-20 04:59:53,2t0qag,2,3,"You've probably gotten this type of post before, but I think I may be transsexual. I was born in a male body, I've done some research, watch youtubers, etc. but I'm still not sure. How can I know? I'm 23, live on my own 2 hours from my parents, and am somewhat financially independent. I know if I told them they would die. What's my next move? Thanks folks.",trans,I think I may be trans...,1421755193.0,"{'created_utc': 1421729993, 'id': '2t0qag', 'num_comments': 2, 'score': 3, 'selftext': ""You've probably gotten this type of post before, but I think I may be transsexual. I was born in a male body, I've done some research, watch youtubers, etc. but I'm still not sure. How can I know? I'm 23, live on my own 2 hours from my parents, and am somewhat financially independent. I know if I told them they would die. What's my next move? Thanks folks."", 'subreddit': 'trans', 'title': 'I think I may be trans...', 'created': 1421755193.0}"
2015-01-20 10:39:00,2t1ffy,4,7,"I live with conservative christians, so I don't really feel like I can transition, or really even express my genderqueerness at home, or any real outward way. Oh, also I'm overweight and physically male. Femme clothing that fits a 6' tall frame with a 60"" waist is hard to come by.

But, today a friend and I went to Torrid so I could look around, and I got some panties so I could at least feel like I'm expressing my gender identity, even if only I know it.

You know what'd be awesome with these? Not external testes.

(yes yes, tucking. I have no medical tape.)",trans,Know what'd be awesome right now?,1421775540.0,"{'created_utc': 1421750340, 'id': '2t1ffy', 'num_comments': 4, 'score': 7, 'selftext': 'I live with conservative christians, so I don\'t really feel like I can transition, or really even express my genderqueerness at home, or any real outward way. Oh, also I\'m overweight and physically male. Femme clothing that fits a 6\' tall frame with a 60"" waist is hard to come by.\n\nBut, today a friend and I went to Torrid so I could look around, and I got some panties so I could at least feel like I\'m expressing my gender identity, even if only I know it.\n\nYou know what\'d be awesome with these? Not external testes.\n\n(yes yes, tucking. I have no medical tape.)', 'subreddit': 'trans', 'title': ""Know what'd be awesome right now?"", 'created': 1421775540.0}"
2015-01-20 21:27:28,2t3eyw,6,20,,trans,"""My Transition, My Story and what it means to me""",1421814448.0,"{'created_utc': 1421789248, 'id': '2t3eyw', 'num_comments': 6, 'score': 20, 'selftext': '', 'subreddit': 'trans', 'title': '""My Transition, My Story and what it means to me""', 'created': 1421814448.0}"
2015-01-21 00:19:39,2t4310,0,1,"Be part of a sexuality studies research project!

• Do you identify as a lesbian?
• Have you spent a minimum of five years living in a non-urban setting?

If you answered yes to these questions, you may be eligible to participate in this study.

The purposes of the study are to look at the experiences of lesbians living in Canadian society and to challenge the way that LGBTQ identities and communities are centered around urban spaces. 

Participants will be asked to participate in one semi-structured
interview lasting between forty-five minutes to an hour. Participants must be at least 18 years of age.

This study is being conducted as part of an M.A. Thesis at the University of Ottawa.

Please contact Dayna Prest at dpres017@uottawa.ca for more information.",trans,Lesbian and Canadian? An invitation to participate in a research study!,1421824779.0,"{'created_utc': 1421799579, 'id': '2t4310', 'num_comments': 0, 'score': 1, 'selftext': 'Be part of a sexuality studies research project!\n\n• Do you identify as a lesbian?\n• Have you spent a minimum of five years living in a non-urban setting?\n\nIf you answered yes to these questions, you may be eligible to participate in this study.\n\nThe purposes of the study are to look at the experiences of lesbians living in Canadian society and to challenge the way that LGBTQ identities and communities are centered around urban spaces. \n\nParticipants will be asked to participate in one semi-structured\ninterview lasting between forty-five minutes to an hour. Participants must be at least 18 years of age.\n\nThis study is being conducted as part of an M.A. Thesis at the University of Ottawa.\n\nPlease contact Dayna Prest at dpres017@uottawa.ca for more information.', 'subreddit': 'trans', 'title': 'Lesbian and Canadian? An invitation to participate in a research study!', 'created': 1421824779.0}"
2015-01-21 01:29:48,2t4brl,0,0,,trans,"Trans Gameing at its best. My lovely friend Trisha is streaming her cute self playing world of warcraft on twitch, hit up her channel and support her, make her feel welcomed :) Stop by and say I to her and I :)",1421828988.0,"{'created_utc': 1421803788, 'id': '2t4brl', 'num_comments': 0, 'score': 0, 'selftext': '', 'subreddit': 'trans', 'title': 'Trans Gameing at its best. My lovely friend Trisha is streaming her cute self playing world of warcraft on twitch, hit up her channel and support her, make her feel welcomed :) Stop by and say I to her and I :)', 'created': 1421828988.0}"
2015-01-21 15:07:58,2t6cbz,2,9,"I've always wondered if other women/people have experienced the same thing I have.

When I hit puberty, my body was absolutely raging with hormones, and my clitoris grew a little faster than average I think..The result being that it's now above average in both size and sensitivity. It isn't quite what I understand can happen from HRT or steroids, but it's large and potently sensitive to be sure.

I'm not sure if it caused my feelings or if the physical and mental aspects came about together, but I've always felt a little ""in-between"" as a result.

Not quite female, not quite male..I just kind of think of myself as a person with a body, somewhere in the middle, and I wonder if other people have experienced similar things?",trans,"20 and Female...but have always felt a little ""in-between""",1421878078.0,"{'created_utc': 1421852878, 'id': '2t6cbz', 'num_comments': 2, 'score': 9, 'selftext': 'I\'ve always wondered if other women/people have experienced the same thing I have.\n\nWhen I hit puberty, my body was absolutely raging with hormones, and my clitoris grew a little faster than average I think..The result being that it\'s now above average in both size and sensitivity. It isn\'t quite what I understand can happen from HRT or steroids, but it\'s large and potently sensitive to be sure.\n\nI\'m not sure if it caused my feelings or if the physical and mental aspects came about together, but I\'ve always felt a little ""in-between"" as a result.\n\nNot quite female, not quite male..I just kind of think of myself as a person with a body, somewhere in the middle, and I wonder if other people have experienced similar things?', 'subreddit': 'trans', 'title': '20 and Female...but have always felt a little ""in-between""', 'created': 1421878078.0}"
2015-01-22 05:28:55,2t9drl,9,19,"So tonight I was with my best friend Marcus who is a trans man. He recently turned 21 and also recently had top surgery and has been on T for a year and a half. However, his drivers license has his birth name and female gender marker. So tonight when we were at the store and he was buying wine for our wine/AHS night, the manager refused to sell to him because she didn't believe his ID was his. This happens to him from time to time, but as soon as he mentions that he is trans, they usually understand. This lady, however, said ""that's not a real thing. Pick a better lie"" and walked off without another word. I have never been more furious. I wanted to chase  her down and give her a piece of my mind, but my friend was obviously embarrassed and so we left quickly. I just needed to vent to others who might understand and maybe get some advice for my friend on what he can do next time this happebs.",trans,My best friend is trans and what happened tonight has never made me angrier.,1421929735.0,"{'created_utc': 1421904535, 'id': '2t9drl', 'num_comments': 9, 'score': 19, 'selftext': 'So tonight I was with my best friend Marcus who is a trans man. He recently turned 21 and also recently had top surgery and has been on T for a year and a half. However, his drivers license has his birth name and female gender marker. So tonight when we were at the store and he was buying wine for our wine/AHS night, the manager refused to sell to him because she didn\'t believe his ID was his. This happens to him from time to time, but as soon as he mentions that he is trans, they usually understand. This lady, however, said ""that\'s not a real thing. Pick a better lie"" and walked off without another word. I have never been more furious. I wanted to chase  her down and give her a piece of my mind, but my friend was obviously embarrassed and so we left quickly. I just needed to vent to others who might understand and maybe get some advice for my friend on what he can do next time this happebs.', 'subreddit': 'trans', 'title': 'My best friend is trans and what happened tonight has never made me angrier.', 'created': 1421929735.0}"
2015-01-22 05:33:32,2t9e7j,4,1,"Ok, so after 2 or 3 years of dealing with gender problems and only coming to terms with them 7 months ago, I think I'm headed in the right direction. I had a long-due talk with my mother, as to address my only-worsening dysphoria, about what to do from here. Ok, so she's gonna start finding me a gender therapist so I can go through and be legally diagnosed with gender dysphoria and hopefully I can begin transition (MtF). While this is great, I still however am suffering from continued stress and depression from feeling so out of body and I wanted to know if there were any ways someone could help me alleviate these things just a little. Thought I'd share the happy status of my life but also would appreciate any suggestions for helping myself feel better in the meantime. Thank you.",trans,So I think I'm headed in the right direction,1421930012.0,"{'created_utc': 1421904812, 'id': '2t9e7j', 'num_comments': 4, 'score': 1, 'selftext': ""Ok, so after 2 or 3 years of dealing with gender problems and only coming to terms with them 7 months ago, I think I'm headed in the right direction. I had a long-due talk with my mother, as to address my only-worsening dysphoria, about what to do from here. Ok, so she's gonna start finding me a gender therapist so I can go through and be legally diagnosed with gender dysphoria and hopefully I can begin transition (MtF). While this is great, I still however am suffering from continued stress and depression from feeling so out of body and I wanted to know if there were any ways someone could help me alleviate these things just a little. Thought I'd share the happy status of my life but also would appreciate any suggestions for helping myself feel better in the meantime. Thank you."", 'subreddit': 'trans', 'title': ""So I think I'm headed in the right direction"", 'created': 1421930012.0}"
