created_utc,id,num_comments,score,selftext,subreddit,title,created,d_
2015-05-12 01:59:44,35o1r4,6,8,"Accepting that I was trans has been one of the hardest processes of my life and for a long time I was in denial of how I felt and was very uncomfortable. I'm still unsure as to how I feel about myself and my gender but I do know how I want my body to reflect my identity. I'm currently in touch with a gender therapist and have my first appointment soon so I thought I'd take the plunge and go on my first shopping trip. I'm not out so I was in boy mode very nervous of anyone saying something but my fears were unfounded as nobody was fazed by my presence in the slightest. Just being able to look how I want to in a public setting was one of the best feelings ever and I'm still ecstatic now that I'm home. Though the road ahead is long right now as in addition to the prospect of HRT I'm looking to grow out my hair and improve my diet and exercise as well as other goal so I can be proud of my body rather than uncomfortable in my own skin. I wanted to share my positivity and how I feel I'm on the right path for me.

tl;dr: I went shopping and feel much better!    

[A couple of snaps I took](http://imgur.com/a/RrwYh)

I know I'm not passable and I'm still learning about what I think looks nice on me so please be nice.",trans,My first non-online shopping trip [My first post after a long time lurking],1431421184.0,"{'created_utc': 1431395984, 'id': '35o1r4', 'num_comments': 6, 'score': 8, 'selftext': ""Accepting that I was trans has been one of the hardest processes of my life and for a long time I was in denial of how I felt and was very uncomfortable. I'm still unsure as to how I feel about myself and my gender but I do know how I want my body to reflect my identity. I'm currently in touch with a gender therapist and have my first appointment soon so I thought I'd take the plunge and go on my first shopping trip. I'm not out so I was in boy mode very nervous of anyone saying something but my fears were unfounded as nobody was fazed by my presence in the slightest. Just being able to look how I want to in a public setting was one of the best feelings ever and I'm still ecstatic now that I'm home. Though the road ahead is long right now as in addition to the prospect of HRT I'm looking to grow out my hair and improve my diet and exercise as well as other goal so I can be proud of my body rather than uncomfortable in my own skin. I wanted to share my positivity and how I feel I'm on the right path for me.\n\ntl;dr: I went shopping and feel much better!    \n\n[A couple of snaps I took](http://imgur.com/a/RrwYh)\n\nI know I'm not passable and I'm still learning about what I think looks nice on me so please be nice."", 'subreddit': 'trans', 'title': 'My first non-online shopping trip [My first post after a long time lurking]', 'created': 1431421184.0}"
2015-05-12 07:50:26,35oskz,4,13,,trans,Miley Cyrus; Not a book to judge by its cover!,1431442226.0,"{'created_utc': 1431417026, 'id': '35oskz', 'num_comments': 4, 'score': 13, 'selftext': '', 'subreddit': 'trans', 'title': 'Miley Cyrus; Not a book to judge by its cover!', 'created': 1431442226.0}"
2015-05-13 02:15:45,35saat,0,15,,trans,What does a transgender brain look like?,1431508545.0,"{'created_utc': 1431483345, 'id': '35saat', 'num_comments': 0, 'score': 15, 'selftext': '', 'subreddit': 'trans', 'title': 'What does a transgender brain look like?', 'created': 1431508545.0}"
2015-05-13 08:25:34,35t6ea,7,8,,trans,sometimes I like to think I might pass! (first time posting pics),1431530734.0,"{'created_utc': 1431505534, 'id': '35t6ea', 'num_comments': 7, 'score': 8, 'selftext': '', 'subreddit': 'trans', 'title': 'sometimes I like to think I might pass! (first time posting pics)', 'created': 1431530734.0}"
2015-05-15 05:10:32,3612xb,1,6,,trans,"Trans woman reportedly stoned to death in Cuba; In Pakistan, trans killings continue: 4 dead",1431691832.0,"{'created_utc': 1431666632, 'id': '3612xb', 'num_comments': 1, 'score': 6, 'selftext': '', 'subreddit': 'trans', 'title': 'Trans woman reportedly stoned to death in Cuba; In Pakistan, trans killings continue: 4 dead', 'created': 1431691832.0}"
2015-05-15 07:42:32,361egb,2,9,"if there were new shows about trans people coming out, what kinds of things would people want to see addressed?",trans,trans visibility,1431700952.0,"{'created_utc': 1431675752, 'id': '361egb', 'num_comments': 2, 'score': 9, 'selftext': 'if there were new shows about trans people coming out, what kinds of things would people want to see addressed?', 'subreddit': 'trans', 'title': 'trans visibility', 'created': 1431700952.0}"
2015-05-16 19:19:04,366x4c,5,4,"Hey people. I just started dating, or well I mean like sort of seeing a trans guy and I have no idea what's up. I'm a gay guy and look I really really freaking like this guy and I want to make him happy and I want to never make him feel uncomfortable, but I don't know how and Google is not a great resource. Can any of you help me? What do I do with a vagina? Will he even want me to do anything to it? What are questions i shouldn't ask and maybe what are the answers to those questions I shouldn't ask? I just want to make him happy, please help with that. And also is there a better place for this?",trans,Title card here,1431829144.0,"{'created_utc': 1431803944, 'id': '366x4c', 'num_comments': 5, 'score': 4, 'selftext': ""Hey people. I just started dating, or well I mean like sort of seeing a trans guy and I have no idea what's up. I'm a gay guy and look I really really freaking like this guy and I want to make him happy and I want to never make him feel uncomfortable, but I don't know how and Google is not a great resource. Can any of you help me? What do I do with a vagina? Will he even want me to do anything to it? What are questions i shouldn't ask and maybe what are the answers to those questions I shouldn't ask? I just want to make him happy, please help with that. And also is there a better place for this?"", 'subreddit': 'trans', 'title': 'Title card here', 'created': 1431829144.0}"
2015-05-16 23:32:25,367ojy,2,4,"While I always appreciate new listeners, I promise this isn't a blatant plug for anything. I'd really like to know if I made any cringey, terrible mistakes during my latest podcast episode.

[You can listen to my latest podcast episode here.](http://smalltownpodcast.com/episode-list/episode-4-ollie-renee-schminkey/) Sorry, I'm not on iTunes/Stitcher yet.

I interviewed Ollie Schminkey, a nonbinary, genderqueer poet, activist, writer, musician and so much more who is located in the Twin Cities in Minnesota. I'm a big fan of their slam poetry, so it was a dream to be able to interview them and include some of that slam poetry within the podcast.

Although I feel like I'm a pretty open and understanding person, I also realize that I'm not transgender, am new to even talking about this, and am very prone to making mistakes.

Any critiques and advice is appreciated.

The podcast focuses on different small-town-related things each episode, so I might not have another transgender guest for a while, but it's always nice to learn for the future. And if I've made any terrible mistakes, of course, I would like to add a note to the podcast show notes and apologize.

Thanks to anyone who takes the time to listen, respond, and help me out!",trans,"Did I handle this podcast episode/guest in a respectful, informative and interesting manner?",1431844345.0,"{'created_utc': 1431819145, 'id': '367ojy', 'num_comments': 2, 'score': 4, 'selftext': ""While I always appreciate new listeners, I promise this isn't a blatant plug for anything. I'd really like to know if I made any cringey, terrible mistakes during my latest podcast episode.\n\n[You can listen to my latest podcast episode here.](http://smalltownpodcast.com/episode-list/episode-4-ollie-renee-schminkey/) Sorry, I'm not on iTunes/Stitcher yet.\n\nI interviewed Ollie Schminkey, a nonbinary, genderqueer poet, activist, writer, musician and so much more who is located in the Twin Cities in Minnesota. I'm a big fan of their slam poetry, so it was a dream to be able to interview them and include some of that slam poetry within the podcast.\n\nAlthough I feel like I'm a pretty open and understanding person, I also realize that I'm not transgender, am new to even talking about this, and am very prone to making mistakes.\n\nAny critiques and advice is appreciated.\n\nThe podcast focuses on different small-town-related things each episode, so I might not have another transgender guest for a while, but it's always nice to learn for the future. And if I've made any terrible mistakes, of course, I would like to add a note to the podcast show notes and apologize.\n\nThanks to anyone who takes the time to listen, respond, and help me out!"", 'subreddit': 'trans', 'title': 'Did I handle this podcast episode/guest in a respectful, informative and interesting manner?', 'created': 1431844345.0}"
2015-05-17 00:26:40,367u19,3,8,,trans,CALL FOR SUBMISSIONS: SHORT SPECULATIVE FICTION BY TRANSGENDER WRITERS,1431847600.0,"{'created_utc': 1431822400, 'id': '367u19', 'num_comments': 3, 'score': 8, 'selftext': '', 'subreddit': 'trans', 'title': 'CALL FOR SUBMISSIONS: SHORT SPECULATIVE FICTION BY TRANSGENDER WRITERS', 'created': 1431847600.0}"
2015-05-18 07:41:27,36chpz,1,8,,trans,"European transgender tracking organization reports 1,700+ trans murders in 7 years",1431960087.0,"{'created_utc': 1431934887, 'id': '36chpz', 'num_comments': 1, 'score': 8, 'selftext': '', 'subreddit': 'trans', 'title': 'European transgender tracking organization reports 1,700+ trans murders in 7 years', 'created': 1431960087.0}"
2015-05-18 17:02:03,36dy48,7,11,"I want to get something for my friend, its her 18th birthday soon and she just came out as transgender so some of us are throwing her a big sort of 'girl' party so she feels a bit more comfortable, everyone else is being really smart about it and buying her really useful stuff like clothes and makeup. I am a straight guy with no experience of anything feminine, she's been a good mate for years but honestly don't have a clue what to get her, its not like shopping for another girl because although we do all think of her that way she doesn't have all the things a girl normally would. her party is a surprise so i can't ask and they've put me in charge of music because frankly i am useless at anything else. sorry for the bible but any help would be appreciated with 'Traniversary' ideas or gift ideas.
Thanks a Ton, Much Appreciated
hetro and useless life long best mate of a trangender girl",trans,Gift Ideas For Transgender Girl,1431993723.0,"{'created_utc': 1431968523, 'id': '36dy48', 'num_comments': 7, 'score': 11, 'selftext': ""I want to get something for my friend, its her 18th birthday soon and she just came out as transgender so some of us are throwing her a big sort of 'girl' party so she feels a bit more comfortable, everyone else is being really smart about it and buying her really useful stuff like clothes and makeup. I am a straight guy with no experience of anything feminine, she's been a good mate for years but honestly don't have a clue what to get her, its not like shopping for another girl because although we do all think of her that way she doesn't have all the things a girl normally would. her party is a surprise so i can't ask and they've put me in charge of music because frankly i am useless at anything else. sorry for the bible but any help would be appreciated with 'Traniversary' ideas or gift ideas.\nThanks a Ton, Much Appreciated\nhetro and useless life long best mate of a trangender girl"", 'subreddit': 'trans', 'title': 'Gift Ideas For Transgender Girl', 'created': 1431993723.0}"
2015-05-18 22:12:15,36f4ee,13,9,"A group of my friends here in Scotland are throwing my best friend who I have known for years a 'Traniversary'.  She's turning 18 and that is the word she used to describe her birthday as it's the first year she is going to be a girl.  I must say considering I had absolutely no idea my pretty masculine mate was transgender, it's been insanely refreshing to see her so happy.  She looks stunning.   In a very attractive group of female friends she holds her own without an issue so don't get me wrong this is no pity party.  we want her to know we accept the shit out of her and don't see her as anything other than one of the girls. The girls have tons of presents for her, us guys are ordering music and food, we are ordering a huge cake and hope to have a real traditional scottish piss up for her with a pretty resounding feminine theme because thats what she likes.  Is it wrong for us to invite a ton of people on the basis this is a 'Traniversary'? Does that seriously offend trans* people considering its regarding her transition and its results.  we have such good sentiment behind that word now, its about being who you are and being happy, all of us totally support that.  ",trans,"Hay r/trans I just received a message regarding my use of the word Tranniversary, being a straight cis guy I'm in no position to judge but wondered how trans* people feel about it?",1432012335.0,"{'created_utc': 1431987135, 'id': '36f4ee', 'num_comments': 13, 'score': 9, 'selftext': ""A group of my friends here in Scotland are throwing my best friend who I have known for years a 'Traniversary'.  She's turning 18 and that is the word she used to describe her birthday as it's the first year she is going to be a girl.  I must say considering I had absolutely no idea my pretty masculine mate was transgender, it's been insanely refreshing to see her so happy.  She looks stunning.   In a very attractive group of female friends she holds her own without an issue so don't get me wrong this is no pity party.  we want her to know we accept the shit out of her and don't see her as anything other than one of the girls. The girls have tons of presents for her, us guys are ordering music and food, we are ordering a huge cake and hope to have a real traditional scottish piss up for her with a pretty resounding feminine theme because thats what she likes.  Is it wrong for us to invite a ton of people on the basis this is a 'Traniversary'? Does that seriously offend trans* people considering its regarding her transition and its results.  we have such good sentiment behind that word now, its about being who you are and being happy, all of us totally support that.  "", 'subreddit': 'trans', 'title': ""Hay r/trans I just received a message regarding my use of the word Tranniversary, being a straight cis guy I'm in no position to judge but wondered how trans* people feel about it?"", 'created': 1432012335.0}"
2015-05-19 06:09:52,36gmje,4,3,,trans,Another trans woman of color murdered in the U.S. -- this time in Philadelphia,1432040992.0,"{'created_utc': 1432015792, 'id': '36gmje', 'num_comments': 4, 'score': 3, 'selftext': '', 'subreddit': 'trans', 'title': 'Another trans woman of color murdered in the U.S. -- this time in Philadelphia', 'created': 1432040992.0}"
2015-05-19 19:16:11,36j0yg,1,4,,trans,Is there a specific reddit where people can post 'safe spaces' for transgender people in different places around the world(or their experiences with places people should avoid)? If not how would I go about creating one and would it be useful for people?,1432088171.0,"{'created_utc': 1432062971, 'id': '36j0yg', 'num_comments': 1, 'score': 4, 'selftext': '', 'subreddit': 'trans', 'title': ""Is there a specific reddit where people can post 'safe spaces' for transgender people in different places around the world(or their experiences with places people should avoid)? If not how would I go about creating one and would it be useful for people?"", 'created': 1432088171.0}"
2015-05-19 23:16:17,36k0h4,0,6,"I'm an mtf college senior who is looking for roommates for a beach house in Milford. The house is wonderful and if the right amount of people move in, the rent is pretty cheap at $500/mo. Here's a link to the house posting:

http://www.trulia.com/rental/3033564326-193-Kings-Hwy-Milford-CT-06460#photo-1

If you would like to know more information about the house, feel free to send me a message!",trans,Looking for LGBTQ-positive roommates in CT,1432102577.0,"{'created_utc': 1432077377, 'id': '36k0h4', 'num_comments': 0, 'score': 6, 'selftext': ""I'm an mtf college senior who is looking for roommates for a beach house in Milford. The house is wonderful and if the right amount of people move in, the rent is pretty cheap at $500/mo. Here's a link to the house posting:\n\nhttp://www.trulia.com/rental/3033564326-193-Kings-Hwy-Milford-CT-06460#photo-1\n\nIf you would like to know more information about the house, feel free to send me a message!"", 'subreddit': 'trans', 'title': 'Looking for LGBTQ-positive roommates in CT', 'created': 1432102577.0}"
2015-05-20 08:49:31,36lp9r,9,22,"So, throwaway for reasons.

I am attracted to trans women. The idea of a woman with a penis excites me. I am attracted to them in the same way that I am attracted to a woman without a penis.

This is the part where I get into the ""I'm not racist cause"" part of the post. I have been an advocate for rights for all my entire life. I grew up in a small town, where using the word ""fag"" meant that someone was ""stupid"". I used it in that sense. 

When I hit college, and actually met some gay people, I stopped using it. I don't want a word that I use casually to ruin someone's day. I talked to my friends about it, and they have stopped using it, at least in front of me.

I identify as a straight male. I am attracted to women, not men. The masculine form does nothing for me. That being said, a penis on a woman DOES do it for me, as much as a vagina does.

I don't know how to go forward. I don't want to make ANYONE a sexual object. I don't want anyone to be more or less of a person because of a thing they have. I work hard in my life to make sure that every person gets the same treatment from me.

I guess the question that I am asking in this rambling post is, does me being attracted to a trans woman make it a fetish?

Apologies to people offended, this question is sincere.",trans,"How I don't want being attracted to trans women to be a fetish, but am afraid to talk about it.",1432136971.0,"{'created_utc': 1432111771, 'id': '36lp9r', 'num_comments': 9, 'score': 22, 'selftext': 'So, throwaway for reasons.\n\nI am attracted to trans women. The idea of a woman with a penis excites me. I am attracted to them in the same way that I am attracted to a woman without a penis.\n\nThis is the part where I get into the ""I\'m not racist cause"" part of the post. I have been an advocate for rights for all my entire life. I grew up in a small town, where using the word ""fag"" meant that someone was ""stupid"". I used it in that sense. \n\nWhen I hit college, and actually met some gay people, I stopped using it. I don\'t want a word that I use casually to ruin someone\'s day. I talked to my friends about it, and they have stopped using it, at least in front of me.\n\nI identify as a straight male. I am attracted to women, not men. The masculine form does nothing for me. That being said, a penis on a woman DOES do it for me, as much as a vagina does.\n\nI don\'t know how to go forward. I don\'t want to make ANYONE a sexual object. I don\'t want anyone to be more or less of a person because of a thing they have. I work hard in my life to make sure that every person gets the same treatment from me.\n\nI guess the question that I am asking in this rambling post is, does me being attracted to a trans woman make it a fetish?\n\nApologies to people offended, this question is sincere.', 'subreddit': 'trans', 'title': ""How I don't want being attracted to trans women to be a fetish, but am afraid to talk about it."", 'created': 1432136971.0}"
2015-05-21 22:34:38,36t697,6,8,"My friend came out as F to M trans tonight, I love him like a younger sibling and want to be as supportive as possible. I'm pretty terrible when it comes to expressing emotion, but I want to be here for him. Anything I could do to be supportive? ",trans,"A good friend came out as trans today, how can I be as supportive as possible?",1432272878.0,"{'created_utc': 1432247678, 'id': '36t697', 'num_comments': 6, 'score': 8, 'selftext': ""My friend came out as F to M trans tonight, I love him like a younger sibling and want to be as supportive as possible. I'm pretty terrible when it comes to expressing emotion, but I want to be here for him. Anything I could do to be supportive? "", 'subreddit': 'trans', 'title': 'A good friend came out as trans today, how can I be as supportive as possible?', 'created': 1432272878.0}"
2015-05-22 07:08:33,36unu4,1,1,,trans,Trans teen role model Nicole Maines wins another award,1432303713.0,"{'created_utc': 1432278513, 'id': '36unu4', 'num_comments': 1, 'score': 1, 'selftext': '', 'subreddit': 'trans', 'title': 'Trans teen role model Nicole Maines wins another award', 'created': 1432303713.0}"
2015-05-22 16:28:38,36w2d4,2,13,"Hi all,

Gendered Intelligence are a UK Charity helping to support trans* youth and they run an annual camping trip for young people identifying as trans*, genderqueer, non-binary and gender questioning. 

This year they are taking 40 young people and 12 workers, for 3 nights, to our own little gender celebrating haven camping retreat...

Please see details of how you can support either with... OR WITHOUT MONEY. They just need you to vote for our funding application to Aviva Community Fund, if they get enough votes they give Gendered Intelligence £5,000!


**Vote**

Gendered Intelligence's camping trip could win £5,000 from Aviva's Community Fund, but they need your help! Only the project that gets the most votes will be awarded the money. Winning would get them much closer to the £13,000 fundraising goal. It's free and quick to vote, you just need to sign up.
https://community-fund.aviva.co.uk/voting/project/view/2111/?AspxAutoDetectCookieSupport=1


**Donate** 

For those that wish to and can donate something to the fundraiser please use their crowd funding site: http://www.crowdfunder.co.uk/gi-goes-camping-2015.
",trans,Help 40 Trans and NB Young People go camping!,1432337318.0,"{'created_utc': 1432312118, 'id': '36w2d4', 'num_comments': 2, 'score': 13, 'selftext': ""Hi all,\n\nGendered Intelligence are a UK Charity helping to support trans* youth and they run an annual camping trip for young people identifying as trans*, genderqueer, non-binary and gender questioning. \n\nThis year they are taking 40 young people and 12 workers, for 3 nights, to our own little gender celebrating haven camping retreat...\n\nPlease see details of how you can support either with... OR WITHOUT MONEY. They just need you to vote for our funding application to Aviva Community Fund, if they get enough votes they give Gendered Intelligence £5,000!\n\n\n**Vote**\n\nGendered Intelligence's camping trip could win £5,000 from Aviva's Community Fund, but they need your help! Only the project that gets the most votes will be awarded the money. Winning would get them much closer to the £13,000 fundraising goal. It's free and quick to vote, you just need to sign up.\nhttps://community-fund.aviva.co.uk/voting/project/view/2111/?AspxAutoDetectCookieSupport=1\n\n\n**Donate** \n\nFor those that wish to and can donate something to the fundraiser please use their crowd funding site: http://www.crowdfunder.co.uk/gi-goes-camping-2015.\n"", 'subreddit': 'trans', 'title': 'Help 40 Trans and NB Young People go camping!', 'created': 1432337318.0}"
2015-05-24 02:21:33,371w8x,2,23,"Went shopping with my cis friend, bought a super cute midi skirt at tj maxx. I am so fucking happy, its a cute floral print sorta thing. Tried it on and it felt right. It was all i could afford, now to find a much cheaper cute top to go with it haha :)",trans,Bought my first article of fem clothing ever :D,1432459293.0,"{'created_utc': 1432434093, 'id': '371w8x', 'num_comments': 2, 'score': 23, 'selftext': 'Went shopping with my cis friend, bought a super cute midi skirt at tj maxx. I am so fucking happy, its a cute floral print sorta thing. Tried it on and it felt right. It was all i could afford, now to find a much cheaper cute top to go with it haha :)', 'subreddit': 'trans', 'title': 'Bought my first article of fem clothing ever :D', 'created': 1432459293.0}"
2015-05-24 08:37:14,372plz,3,3,,trans,8 months HRT and nothing slightly feminine about my body.... is this right? Do i even have the right body type for this?,1432481834.0,"{'created_utc': 1432456634, 'id': '372plz', 'num_comments': 3, 'score': 3, 'selftext': '', 'subreddit': 'trans', 'title': '8 months HRT and nothing slightly feminine about my body.... is this right? Do i even have the right body type for this?', 'created': 1432481834.0}"
2015-05-25 03:54:45,375xiu,6,42,"""Some day one of my daughters will say 'Dad, I'm really a guy,' and I'll be like 'Alright well, let's get you a dick. Let's get you a dick, honey. I'm gonna get you the nicest dick in town. Nothing's too nice for my little girl.'"" -Louie",trans,If Louie CK's daughter wanted to transition,1432551285.0,"{'created_utc': 1432526085, 'id': '375xiu', 'num_comments': 6, 'score': 42, 'selftext': '""Some day one of my daughters will say \'Dad, I\'m really a guy,\' and I\'ll be like \'Alright well, let\'s get you a dick. Let\'s get you a dick, honey. I\'m gonna get you the nicest dick in town. Nothing\'s too nice for my little girl.\'"" -Louie', 'subreddit': 'trans', 'title': ""If Louie CK's daughter wanted to transition"", 'created': 1432551285.0}"
