created_utc,id,num_comments,score,selftext,subreddit,title,created,d_
2013-11-21 06:29:06,1r4g4k,0,3,,transgender,West Hollywood to Recognize Transgender Day of Remembrance,1385040546.0,"{'created_utc': 1385015346, 'id': '1r4g4k', 'num_comments': 0, 'score': 3, 'selftext': '', 'subreddit': 'transgender', 'title': 'West Hollywood to Recognize Transgender Day of Remembrance', 'created': 1385040546.0}"
2013-11-21 06:49:21,1r4hby,1,0,,transgender,TDOR - Wildflowers webcomic,1385041761.0,"{'created_utc': 1385016561, 'id': '1r4hby', 'num_comments': 1, 'score': 0, 'selftext': '', 'subreddit': 'transgender', 'title': 'TDOR - Wildflowers webcomic', 'created': 1385041761.0}"
2013-11-21 07:22:13,1r4j2k,14,28,,transgender,Trans Woman Commits Suicide on TDOR,1385043733.0,"{'created_utc': 1385018533, 'id': '1r4j2k', 'num_comments': 14, 'score': 28, 'selftext': '', 'subreddit': 'transgender', 'title': 'Trans Woman Commits Suicide on TDOR', 'created': 1385043733.0}"
2013-11-21 07:28:10,1r4jck,0,7,,transgender,16 Beautiful Portraits Of Humans Who Happen to Be Trans,1385044090.0,"{'created_utc': 1385018890, 'id': '1r4jck', 'num_comments': 0, 'score': 7, 'selftext': '', 'subreddit': 'transgender', 'title': '16 Beautiful Portraits Of Humans Who Happen to Be Trans', 'created': 1385044090.0}"
2013-11-21 10:48:48,1r4r72,2,5,,transgender,Transsexualism,1385056128.0,"{'created_utc': 1385030928, 'id': '1r4r72', 'num_comments': 2, 'score': 5, 'selftext': '', 'subreddit': 'transgender', 'title': 'Transsexualism', 'created': 1385056128.0}"
2013-11-21 15:35:46,1r56qk,8,15,,transgender,In honour of yesterday's Transgender Day of Remembrance I wanted to be a great ally and inform myself about the correct transgender terminology,1385073346.0,"{'created_utc': 1385048146, 'id': '1r56qk', 'num_comments': 8, 'score': 15, 'selftext': '', 'subreddit': 'transgender', 'title': ""In honour of yesterday's Transgender Day of Remembrance I wanted to be a great ally and inform myself about the correct transgender terminology"", 'created': 1385073346.0}"
2013-11-21 18:52:29,1r5o3t,5,17,,transgender,The (Non) Problem with Men in Dresses,1385085149.0,"{'created_utc': 1385059949, 'id': '1r5o3t', 'num_comments': 5, 'score': 17, 'selftext': '', 'subreddit': 'transgender', 'title': 'The (Non) Problem with Men in Dresses', 'created': 1385085149.0}"
2013-11-21 19:41:57,1r5smo,0,3,,transgender,TransActive: a Haven and a Voice for Transgender Kids,1385088117.0,"{'created_utc': 1385062917, 'id': '1r5smo', 'num_comments': 0, 'score': 3, 'selftext': '', 'subreddit': 'transgender', 'title': 'TransActive: a Haven and a Voice for Transgender Kids', 'created': 1385088117.0}"
2013-11-21 20:00:56,1r5udz,0,1,,transgender,"This Month, Get Informed and Get Active for Transgender Awareness",1385089256.0,"{'created_utc': 1385064056, 'id': '1r5udz', 'num_comments': 0, 'score': 1, 'selftext': '', 'subreddit': 'transgender', 'title': 'This Month, Get Informed and Get Active for Transgender Awareness', 'created': 1385089256.0}"
2013-11-21 20:27:43,1r5wv5,18,35,,transgender,USA: Why sex reassignment surgery is excluded from most plans,1385090863.0,"{'created_utc': 1385065663, 'id': '1r5wv5', 'num_comments': 18, 'score': 35, 'selftext': '', 'subreddit': 'transgender', 'title': 'USA: Why sex reassignment surgery is excluded from most plans', 'created': 1385090863.0}"
2013-11-21 21:18:25,1r61r8,1,29,,transgender,Tesco launches inquiry into employees posting online photos and videos abusing trans customers,1385093905.0,"{'created_utc': 1385068705, 'id': '1r61r8', 'num_comments': 1, 'score': 29, 'selftext': '', 'subreddit': 'transgender', 'title': 'Tesco launches inquiry into employees posting online photos and videos abusing trans customers', 'created': 1385093905.0}"
2013-11-22 05:03:42,1r74p3,0,5,,transgender,"Running a half-marathon to support API Equality-Northern California, a group advocating for LGBTQIA acceptance and legislation, especially in Asian and Pacific Islander communities. We're close to reaching our fundraising goal but could use reddit's help! (x-post r/lgbt)",1385121822.0,"{'created_utc': 1385096622, 'id': '1r74p3', 'num_comments': 0, 'score': 5, 'selftext': '', 'subreddit': 'transgender', 'title': ""Running a half-marathon to support API Equality-Northern California, a group advocating for LGBTQIA acceptance and legislation, especially in Asian and Pacific Islander communities. We're close to reaching our fundraising goal but could use reddit's help! (x-post r/lgbt)"", 'created': 1385121822.0}"
2013-11-22 08:55:37,1r7gv4,1,0,,transgender,Finding transexual women looking to date is one of the toughest things to do. This site is going to be a huge help in that job.,1385135737.0,"{'created_utc': 1385110537, 'id': '1r7gv4', 'num_comments': 1, 'score': 0, 'selftext': '', 'subreddit': 'transgender', 'title': 'Finding transexual women looking to date is one of the toughest things to do. This site is going to be a huge help in that job.', 'created': 1385135737.0}"
2013-11-22 09:00:07,1r7h1i,0,5,,transgender,Tesco caught in a hypocritical pickle as employees mock trans customers online,1385136007.0,"{'created_utc': 1385110807, 'id': '1r7h1i', 'num_comments': 0, 'score': 5, 'selftext': '', 'subreddit': 'transgender', 'title': 'Tesco caught in a hypocritical pickle as employees mock trans customers online', 'created': 1385136007.0}"
2013-11-22 09:03:50,1r7h74,0,14,,transgender,Activists March To Bring Attention To Violence Against Transgender New Yorkers,1385136230.0,"{'created_utc': 1385111030, 'id': '1r7h74', 'num_comments': 0, 'score': 14, 'selftext': '', 'subreddit': 'transgender', 'title': 'Activists March To Bring Attention To Violence Against Transgender New Yorkers', 'created': 1385136230.0}"
2013-11-22 14:56:23,1r7wtu,0,4,,transgender,"Trans Bodies, Trans Selves Book Indie Go Go campaign",1385157383.0,"{'created_utc': 1385132183, 'id': '1r7wtu', 'num_comments': 0, 'score': 4, 'selftext': '', 'subreddit': 'transgender', 'title': 'Trans Bodies, Trans Selves Book Indie Go Go campaign', 'created': 1385157383.0}"
2013-11-22 15:26:45,1r7yyw,0,47,,transgender,What's the problem if a boy wants to put on a dress or girls act masculine? | Jill Filipovic,1385159205.0,"{'created_utc': 1385134005, 'id': '1r7yyw', 'num_comments': 0, 'score': 47, 'selftext': '', 'subreddit': 'transgender', 'title': ""What's the problem if a boy wants to put on a dress or girls act masculine? | Jill Filipovic"", 'created': 1385159205.0}"
2013-11-22 15:58:14,1r81ha,1,9,,transgender,"Delta, Colo: Transgender Comments Spark Controversy In School District",1385161094.0,"{'created_utc': 1385135894, 'id': '1r81ha', 'num_comments': 1, 'score': 9, 'selftext': '', 'subreddit': 'transgender', 'title': 'Delta, Colo: Transgender Comments Spark Controversy In School District', 'created': 1385161094.0}"
2013-11-22 18:03:15,1r8c3k,13,34,,transgender,What its like to be transgender in comic form.,1385168595.0,"{'created_utc': 1385143395, 'id': '1r8c3k', 'num_comments': 13, 'score': 34, 'selftext': '', 'subreddit': 'transgender', 'title': 'What its like to be transgender in comic form.', 'created': 1385168595.0}"
2013-11-22 21:27:00,1r8tft,0,11,,transgender,I Am A Woman Now,1385180820.0,"{'created_utc': 1385155620, 'id': '1r8tft', 'num_comments': 0, 'score': 11, 'selftext': '', 'subreddit': 'transgender', 'title': 'I Am A Woman Now', 'created': 1385180820.0}"
2013-11-23 03:32:39,1r9khe,1,29,,transgender,"Southern Poverty Law Center: Monitor Gender Identity Watch as a Hate Group | Petition by Secular Woman, Skepchick &amp; Stop Abuse Online",1385202759.0,"{'created_utc': 1385177559, 'id': '1r9khe', 'num_comments': 1, 'score': 29, 'selftext': '', 'subreddit': 'transgender', 'title': 'Southern Poverty Law Center: Monitor Gender Identity Watch as a Hate Group | Petition by Secular Woman, Skepchick &amp; Stop Abuse Online', 'created': 1385202759.0}"
2013-11-23 04:02:43,1r9mi3,0,1,,transgender,Can a Transwoman do something like this to finance SRS?,1385204563.0,"{'created_utc': 1385179363, 'id': '1r9mi3', 'num_comments': 0, 'score': 1, 'selftext': '', 'subreddit': 'transgender', 'title': 'Can a Transwoman do something like this to finance SRS?', 'created': 1385204563.0}"
2013-11-23 04:11:33,1r9n2k,7,10,,transgender,"AB1266 Referendum Drive: So Far, NOT So Good For Privacy For Hate Group Targeting Trans Kids!",1385205093.0,"{'created_utc': 1385179893, 'id': '1r9n2k', 'num_comments': 7, 'score': 10, 'selftext': '', 'subreddit': 'transgender', 'title': 'AB1266 Referendum Drive: So Far, NOT So Good For Privacy For Hate Group Targeting Trans Kids!', 'created': 1385205093.0}"
2013-11-23 08:39:54,1ra0a4,1,0,,transgender,Colorado school board member: castration before transgender student equality,1385221194.0,"{'created_utc': 1385195994, 'id': '1ra0a4', 'num_comments': 1, 'score': 0, 'selftext': '', 'subreddit': 'transgender', 'title': 'Colorado school board member: castration before transgender student equality', 'created': 1385221194.0}"
2013-11-23 08:42:18,1ra0cq,8,14,,transgender,Statement by Secretary Kerry: Transgender Day of Remembrance,1385221338.0,"{'created_utc': 1385196138, 'id': '1ra0cq', 'num_comments': 8, 'score': 14, 'selftext': '', 'subreddit': 'transgender', 'title': 'Statement by Secretary Kerry: Transgender Day of Remembrance', 'created': 1385221338.0}"
2013-11-23 10:08:28,1ra303,1,0,,transgender,What's the problem if a boy wants to put on a dress or girls act masculine?,1385226508.0,"{'created_utc': 1385201308, 'id': '1ra303', 'num_comments': 1, 'score': 0, 'selftext': '', 'subreddit': 'transgender', 'title': ""What's the problem if a boy wants to put on a dress or girls act masculine?"", 'created': 1385226508.0}"
2013-11-23 13:52:13,1raaas,0,1,,transgender,Transgender Forum • View topic - Coronation Street Storylines Transsexual and Crossdresser. Hayley designs a wedding dress Simon assaulted forced to crossdress!,1385239933.0,"{'created_utc': 1385214733, 'id': '1raaas', 'num_comments': 0, 'score': 1, 'selftext': '', 'subreddit': 'transgender', 'title': 'Transgender Forum • View topic - Coronation Street Storylines Transsexual and Crossdresser. Hayley designs a wedding dress Simon assaulted forced to crossdress!', 'created': 1385239933.0}"
2013-11-23 15:40:31,1rafpa,1,30,,transgender,Transgender Police Officer Files Harassment Complaint Against Middletown Department,1385246431.0,"{'created_utc': 1385221231, 'id': '1rafpa', 'num_comments': 1, 'score': 30, 'selftext': '', 'subreddit': 'transgender', 'title': 'Transgender Police Officer Files Harassment Complaint Against Middletown Department', 'created': 1385246431.0}"
2013-11-23 16:30:43,1raiuh,15,13,,transgender,Its like people have no idea they are being transphobic... sigh.,1385249443.0,"{'created_utc': 1385224243, 'id': '1raiuh', 'num_comments': 15, 'score': 13, 'selftext': '', 'subreddit': 'transgender', 'title': 'Its like people have no idea they are being transphobic... sigh.', 'created': 1385249443.0}"
2013-11-23 17:37:29,1ranjp,0,15,,transgender,"FedEx is not as great a company for a trans person to work for as you may think, per one employee there",1385253449.0,"{'created_utc': 1385228249, 'id': '1ranjp', 'num_comments': 0, 'score': 15, 'selftext': '', 'subreddit': 'transgender', 'title': 'FedEx is not as great a company for a trans person to work for as you may think, per one employee there', 'created': 1385253449.0}"
2013-11-23 18:47:38,1rasqh,2,0,,transgender,I am doing some light research on the trans* community and made a short survey. It's only 7 questions with a comment section. Please fill out! Allies and non-trans responses welcome!!! THX!,1385257658.0,"{'created_utc': 1385232458, 'id': '1rasqh', 'num_comments': 2, 'score': 0, 'selftext': '', 'subreddit': 'transgender', 'title': ""I am doing some light research on the trans* community and made a short survey. It's only 7 questions with a comment section. Please fill out! Allies and non-trans responses welcome!!! THX!"", 'created': 1385257658.0}"
2013-11-23 19:00:35,1ratpf,16,9,,transgender,Class Privilege and Sex Reassignment Surgery,1385258435.0,"{'created_utc': 1385233235, 'id': '1ratpf', 'num_comments': 16, 'score': 9, 'selftext': '', 'subreddit': 'transgender', 'title': 'Class Privilege and Sex Reassignment Surgery', 'created': 1385258435.0}"
2013-11-23 20:40:12,1rb16h,0,1,,transgender,Transsexual Couple,1385264412.0,"{'created_utc': 1385239212, 'id': '1rb16h', 'num_comments': 0, 'score': 1, 'selftext': '', 'subreddit': 'transgender', 'title': 'Transsexual Couple', 'created': 1385264412.0}"
2013-11-23 21:38:21,1rb5j7,0,3,,transgender,"Twas The Night Before GRS... so, so hungry...",1385267901.0,"{'created_utc': 1385242701, 'id': '1rb5j7', 'num_comments': 0, 'score': 3, 'selftext': '', 'subreddit': 'transgender', 'title': 'Twas The Night Before GRS... so, so hungry...', 'created': 1385267901.0}"
2013-11-23 21:47:33,1rb67g,2,3,,transgender,"Colo. School Board Member: No Trans Bathroom Access ""Until the Plumbing's Changed""",1385268453.0,"{'created_utc': 1385243253, 'id': '1rb67g', 'num_comments': 2, 'score': 3, 'selftext': '', 'subreddit': 'transgender', 'title': 'Colo. School Board Member: No Trans Bathroom Access ""Until the Plumbing\'s Changed""', 'created': 1385268453.0}"
2013-11-23 22:14:00,1rb857,18,103,,transgender,"Found on a grade 8 Health test in Toronto. Not perfect, but a huge step forward even from my time (ten years ago).",1385270040.0,"{'created_utc': 1385244840, 'id': '1rb857', 'num_comments': 18, 'score': 103, 'selftext': '', 'subreddit': 'transgender', 'title': 'Found on a grade 8 Health test in Toronto. Not perfect, but a huge step forward even from my time (ten years ago).', 'created': 1385270040.0}"
2013-11-24 00:20:38,1rbha6,1,10,,transgender,TransGriot: Why The Trans Community Hates Dr. Janice G. Raymond,1385277638.0,"{'created_utc': 1385252438, 'id': '1rbha6', 'num_comments': 1, 'score': 10, 'selftext': '', 'subreddit': 'transgender', 'title': 'TransGriot: Why The Trans Community Hates Dr. Janice G. Raymond', 'created': 1385277638.0}"
2013-11-24 01:34:29,1rbmb3,0,3,,transgender,"Transgender, Dead, and Forgotten (TW) (""In the face of a world that erases us, remembering this violence is more than just an obligation — it is an act of resistance."") (Samantha Allen, PhD, Jacobin)",1385282069.0,"{'created_utc': 1385256869, 'id': '1rbmb3', 'num_comments': 0, 'score': 3, 'selftext': '', 'subreddit': 'transgender', 'title': 'Transgender, Dead, and Forgotten (TW) (""In the face of a world that erases us, remembering this violence is more than just an obligation — it is an act of resistance."") (Samantha Allen, PhD, Jacobin)', 'created': 1385282069.0}"
2013-11-24 07:31:08,1rc785,0,0,,transgender,And I met a transgender on street!,1385303468.0,"{'created_utc': 1385278268, 'id': '1rc785', 'num_comments': 0, 'score': 0, 'selftext': '', 'subreddit': 'transgender', 'title': 'And I met a transgender on street!', 'created': 1385303468.0}"
2013-11-24 07:32:08,1rc79p,2,10,,transgender,My successful TDOR event - Pics!,1385303528.0,"{'created_utc': 1385278328, 'id': '1rc79p', 'num_comments': 2, 'score': 10, 'selftext': '', 'subreddit': 'transgender', 'title': 'My successful TDOR event - Pics!', 'created': 1385303528.0}"
2013-11-24 07:34:29,1rc7dk,4,9,,transgender,"""What It's Really Like to be Transgender""",1385303669.0,"{'created_utc': 1385278469, 'id': '1rc7dk', 'num_comments': 4, 'score': 9, 'selftext': '', 'subreddit': 'transgender', 'title': '""What It\'s Really Like to be Transgender""', 'created': 1385303669.0}"
2013-11-24 08:25:48,1rc9bq,2,28,,transgender,Against Me! Turns Pain into Triumph at the Troubador,1385306748.0,"{'created_utc': 1385281548, 'id': '1rc9bq', 'num_comments': 2, 'score': 28, 'selftext': '', 'subreddit': 'transgender', 'title': 'Against Me! Turns Pain into Triumph at the Troubador', 'created': 1385306748.0}"
2013-11-24 08:49:16,1rca4g,0,1,,transgender,My new blog,1385308156.0,"{'created_utc': 1385282956, 'id': '1rca4g', 'num_comments': 0, 'score': 1, 'selftext': '', 'subreddit': 'transgender', 'title': 'My new blog', 'created': 1385308156.0}"
2013-11-24 20:06:29,1rd7sv,3,49,,transgender,Why I Wear Nail Polish,1385348789.0,"{'created_utc': 1385323589, 'id': '1rd7sv', 'num_comments': 3, 'score': 49, 'selftext': '', 'subreddit': 'transgender', 'title': 'Why I Wear Nail Polish', 'created': 1385348789.0}"
2013-11-24 20:17:53,1rd8qj,0,0,,transgender,Missive: a Transfeminist Journal. Call for Submissions!,1385349473.0,"{'created_utc': 1385324273, 'id': '1rd8qj', 'num_comments': 0, 'score': 0, 'selftext': '', 'subreddit': 'transgender', 'title': 'Missive: a Transfeminist Journal. Call for Submissions!', 'created': 1385349473.0}"
2013-11-25 07:28:00,1rel3h,5,10,,transgender,"Interview with Delta county ""castration"" school board member: turns out she's linked to anti-LGBT groups",1385389680.0,"{'created_utc': 1385364480, 'id': '1rel3h', 'num_comments': 5, 'score': 10, 'selftext': '', 'subreddit': 'transgender', 'title': 'Interview with Delta county ""castration"" school board member: turns out she\'s linked to anti-LGBT groups', 'created': 1385389680.0}"
2013-11-25 08:36:23,1renxf,0,0,,transgender,"Trans women found dead in the UK, Detroit",1385393783.0,"{'created_utc': 1385368583, 'id': '1renxf', 'num_comments': 0, 'score': 0, 'selftext': '', 'subreddit': 'transgender', 'title': 'Trans women found dead in the UK, Detroit', 'created': 1385393783.0}"
2013-11-25 08:39:10,1reo0t,0,9,,transgender,Why A Transgender Woman Got Fined After Presenting Train Ticket,1385393950.0,"{'created_utc': 1385368750, 'id': '1reo0t', 'num_comments': 0, 'score': 9, 'selftext': '', 'subreddit': 'transgender', 'title': 'Why A Transgender Woman Got Fined After Presenting Train Ticket', 'created': 1385393950.0}"
2013-11-25 10:10:18,1rerev,0,2,,transgender,Lawyer gets naked for trans rights in Russia,1385399418.0,"{'created_utc': 1385374218, 'id': '1rerev', 'num_comments': 0, 'score': 2, 'selftext': '', 'subreddit': 'transgender', 'title': 'Lawyer gets naked for trans rights in Russia', 'created': 1385399418.0}"
2013-11-25 13:31:13,1rez3e,0,1,,transgender,Transgender Forum • View topic - This Morning ITV1 - MEP Nikki Sinclaire - 25/11/13,1385411473.0,"{'created_utc': 1385386273, 'id': '1rez3e', 'num_comments': 0, 'score': 1, 'selftext': '', 'subreddit': 'transgender', 'title': 'Transgender Forum • View topic - This Morning ITV1 - MEP Nikki Sinclaire - 25/11/13', 'created': 1385411473.0}"
2013-11-25 14:22:43,1rf1u1,2,41,,transgender,Stand with Secular Woman in Asking SPLC to Monitor Gender Identity Watch as a Hate Group,1385414563.0,"{'created_utc': 1385389363, 'id': '1rf1u1', 'num_comments': 2, 'score': 41, 'selftext': '', 'subreddit': 'transgender', 'title': 'Stand with Secular Woman in Asking SPLC to Monitor Gender Identity Watch as a Hate Group', 'created': 1385414563.0}"
2013-11-25 14:23:55,1rf1wc,0,1,,transgender,Transgender • Join us on Mondays for Live Streaming TV Transgender Support! Live from 9.30pm,1385414635.0,"{'created_utc': 1385389435, 'id': '1rf1wc', 'num_comments': 0, 'score': 1, 'selftext': '', 'subreddit': 'transgender', 'title': 'Transgender • Join us on Mondays for Live Streaming TV Transgender Support! Live from 9.30pm', 'created': 1385414635.0}"
2013-11-25 17:00:45,1rfdq4,0,2,,transgender,Out of the Fog,1385424045.0,"{'created_utc': 1385398845, 'id': '1rfdq4', 'num_comments': 0, 'score': 2, 'selftext': '', 'subreddit': 'transgender', 'title': 'Out of the Fog', 'created': 1385424045.0}"
2013-11-25 19:39:49,1rfrv9,13,34,,transgender,Being transgender and transitioning doesn't make me brave or courageous,1385433589.0,"{'created_utc': 1385408389, 'id': '1rfrv9', 'num_comments': 13, 'score': 34, 'selftext': '', 'subreddit': 'transgender', 'title': ""Being transgender and transitioning doesn't make me brave or courageous"", 'created': 1385433589.0}"
2013-11-25 19:57:36,1rftjf,1,3,,transgender,Different gene expression in male and female brains helps explain differences in brain disorders,1385434656.0,"{'created_utc': 1385409456, 'id': '1rftjf', 'num_comments': 1, 'score': 3, 'selftext': '', 'subreddit': 'transgender', 'title': 'Different gene expression in male and female brains helps explain differences in brain disorders', 'created': 1385434656.0}"
2013-11-25 20:21:08,1rfvpy,0,3,,transgender,Notes from a Transgender Day of Remembrance Ceremony,1385436068.0,"{'created_utc': 1385410868, 'id': '1rfvpy', 'num_comments': 0, 'score': 3, 'selftext': '', 'subreddit': 'transgender', 'title': 'Notes from a Transgender Day of Remembrance Ceremony', 'created': 1385436068.0}"
2013-11-25 22:31:30,1rg7uk,1,1,,transgender,The Transgender Handbook - Lulu.com,1385443890.0,"{'created_utc': 1385418690, 'id': '1rg7uk', 'num_comments': 1, 'score': 1, 'selftext': '', 'subreddit': 'transgender', 'title': 'The Transgender Handbook - Lulu.com', 'created': 1385443890.0}"
2013-11-26 01:33:01,1rgnrw,18,15,,transgender,Alternative to transgender women who want to afford surgery? Weird but possible?,1385454781.0,"{'created_utc': 1385429581, 'id': '1rgnrw', 'num_comments': 18, 'score': 15, 'selftext': '', 'subreddit': 'transgender', 'title': 'Alternative to transgender women who want to afford surgery? Weird but possible?', 'created': 1385454781.0}"
2013-11-26 01:55:48,1rgpnk,0,3,,transgender,Video of me transforming 15 years old,1385456148.0,"{'created_utc': 1385430948, 'id': '1rgpnk', 'num_comments': 0, 'score': 3, 'selftext': '', 'subreddit': 'transgender', 'title': 'Video of me transforming 15 years old', 'created': 1385456148.0}"
2013-11-26 04:30:34,1rh238,8,28,,transgender,Saw this in /r/AskWomen and thought transwomen would love to know a lot of ciswomen won't freak out if you use the ladies room,1385465434.0,"{'created_utc': 1385440234, 'id': '1rh238', 'num_comments': 8, 'score': 28, 'selftext': '', 'subreddit': 'transgender', 'title': ""Saw this in /r/AskWomen and thought transwomen would love to know a lot of ciswomen won't freak out if you use the ladies room"", 'created': 1385465434.0}"
2013-11-26 05:26:59,1rh67a,0,16,,transgender,"Right Wing Activists ""Unlikely"" to Qualify Trans Student Law for Repeal",1385468819.0,"{'created_utc': 1385443619, 'id': '1rh67a', 'num_comments': 0, 'score': 16, 'selftext': '', 'subreddit': 'transgender', 'title': 'Right Wing Activists ""Unlikely"" to Qualify Trans Student Law for Repeal', 'created': 1385468819.0}"
2013-11-26 05:49:32,1rh7pa,0,0,,transgender,just thought i should share this to you all,1385470172.0,"{'created_utc': 1385444972, 'id': '1rh7pa', 'num_comments': 0, 'score': 0, 'selftext': '', 'subreddit': 'transgender', 'title': 'just thought i should share this to you all', 'created': 1385470172.0}"
2013-11-26 07:39:50,1rhe0f,0,3,,transgender,Victory! Transgender Man Wins Right to Work as Authentic Self,1385476790.0,"{'created_utc': 1385451590, 'id': '1rhe0f', 'num_comments': 0, 'score': 3, 'selftext': '', 'subreddit': 'transgender', 'title': 'Victory! Transgender Man Wins Right to Work as Authentic Self', 'created': 1385476790.0}"
2013-11-26 13:21:20,1rhrjd,0,7,,transgender,I Love the Smell of Anesthesia in the Morning - GRS cont...,1385497280.0,"{'created_utc': 1385472080, 'id': '1rhrjd', 'num_comments': 0, 'score': 7, 'selftext': '', 'subreddit': 'transgender', 'title': 'I Love the Smell of Anesthesia in the Morning - GRS cont...', 'created': 1385497280.0}"
2013-11-26 16:00:37,1ri1y2,0,6,,transgender,Transgender Engagement: Happy Couple Plan For The Future,1385506837.0,"{'created_utc': 1385481637, 'id': '1ri1y2', 'num_comments': 0, 'score': 6, 'selftext': '', 'subreddit': 'transgender', 'title': 'Transgender Engagement: Happy Couple Plan For The Future', 'created': 1385506837.0}"
2013-11-26 16:21:26,1ri3m9,5,15,,transgender,Traveling for the holidays? Know your rights! You should never be asked to reveal or remove your prosthetic devices.,1385508086.0,"{'created_utc': 1385482886, 'id': '1ri3m9', 'num_comments': 5, 'score': 15, 'selftext': '', 'subreddit': 'transgender', 'title': 'Traveling for the holidays? Know your rights! You should never be asked to reveal or remove your prosthetic devices.', 'created': 1385508086.0}"
2013-11-26 20:02:19,1rin4c,0,5,,transgender,"A Case Study in Transphobia: Rolling Stone's ""About a Girl: Coy Mathis's Fight to Change Gender""",1385521339.0,"{'created_utc': 1385496139, 'id': '1rin4c', 'num_comments': 0, 'score': 5, 'selftext': '', 'subreddit': 'transgender', 'title': 'A Case Study in Transphobia: Rolling Stone\'s ""About a Girl: Coy Mathis\'s Fight to Change Gender""', 'created': 1385521339.0}"
2013-11-26 20:08:38,1rinov,4,9,,transgender,Tumbling through the looking glass: Unravelling myself from the false life I created,1385521718.0,"{'created_utc': 1385496518, 'id': '1rinov', 'num_comments': 4, 'score': 9, 'selftext': '', 'subreddit': 'transgender', 'title': 'Tumbling through the looking glass: Unravelling myself from the false life I created', 'created': 1385521718.0}"
2013-11-26 21:34:10,1rivn5,4,24,,transgender,Important clarification from Natalie Reed,1385526850.0,"{'created_utc': 1385501650, 'id': '1rivn5', 'num_comments': 4, 'score': 24, 'selftext': '', 'subreddit': 'transgender', 'title': 'Important clarification from Natalie Reed', 'created': 1385526850.0}"
2013-11-26 22:01:17,1riy5y,0,2,,transgender,CAP Releases LGBT Detainee Report: Immigration experts share insights on particular challenges for undocumented LGBT immigrants: News section: Metro Weekly,1385528477.0,"{'created_utc': 1385503277, 'id': '1riy5y', 'num_comments': 0, 'score': 2, 'selftext': '', 'subreddit': 'transgender', 'title': 'CAP Releases LGBT Detainee Report: Immigration experts share insights on particular challenges for undocumented LGBT immigrants: News section: Metro Weekly', 'created': 1385528477.0}"
