created_utc,id,num_comments,score,selftext,subreddit,title,created,d_
2013-11-01 03:15:50,1pnywx,1,18,,transgender,Unpacking TERF arguments – nothing more than conspiracy theorist bunkum,1383300950.0,"{'created_utc': 1383275750, 'id': '1pnywx', 'num_comments': 1, 'score': 18, 'selftext': '', 'subreddit': 'transgender', 'title': 'Unpacking TERF arguments – nothing more than conspiracy theorist bunkum', 'created': 1383300950.0}"
2013-11-01 04:32:23,1po3r9,16,95,,transgender,Hope you all are having a great and safe Halloween! :-),1383305543.0,"{'created_utc': 1383280343, 'id': '1po3r9', 'num_comments': 16, 'score': 95, 'selftext': '', 'subreddit': 'transgender', 'title': 'Hope you all are having a great and safe Halloween! :-)', 'created': 1383305543.0}"
2013-11-01 04:33:19,1po3t2,0,3,,transgender,Transgender Day of Remembrance 2013: A Reporter's List,1383305599.0,"{'created_utc': 1383280399, 'id': '1po3t2', 'num_comments': 0, 'score': 3, 'selftext': '', 'subreddit': 'transgender', 'title': ""Transgender Day of Remembrance 2013: A Reporter's List"", 'created': 1383305599.0}"
2013-11-01 05:00:38,1po57z,0,4,,transgender,The fallacy that there is no cis-privilege,1383307238.0,"{'created_utc': 1383282038, 'id': '1po57z', 'num_comments': 0, 'score': 4, 'selftext': '', 'subreddit': 'transgender', 'title': 'The fallacy that there is no cis-privilege', 'created': 1383307238.0}"
2013-11-01 07:05:27,1poajx,0,1,,transgender,Photos of 29 trans people to remember on TDOR 2013,1383314727.0,"{'created_utc': 1383289527, 'id': '1poajx', 'num_comments': 0, 'score': 1, 'selftext': '', 'subreddit': 'transgender', 'title': 'Photos of 29 trans people to remember on TDOR 2013', 'created': 1383314727.0}"
2013-11-01 12:19:36,1poku5,10,95,,transgender,Germany allows 'indeterminate' gender at birth - Babies with characteristics of both sexes to be registered as neither male nor female.,1383333576.0,"{'created_utc': 1383308376, 'id': '1poku5', 'num_comments': 10, 'score': 95, 'selftext': '', 'subreddit': 'transgender', 'title': ""Germany allows 'indeterminate' gender at birth - Babies with characteristics of both sexes to be registered as neither male nor female."", 'created': 1383333576.0}"
2013-11-01 22:17:31,1ppt2q,3,31,,transgender,Intersex activist Hida Viloria - Why Intersex Germans Oppose Germany’s Third Gender Law,1383369451.0,"{'created_utc': 1383344251, 'id': '1ppt2q', 'num_comments': 3, 'score': 31, 'selftext': '', 'subreddit': 'transgender', 'title': 'Intersex activist Hida Viloria - Why Intersex Germans Oppose Germany’s Third Gender Law', 'created': 1383369451.0}"
2013-11-01 23:12:42,1ppwzq,2,32,,transgender,Florida Teen Found Guilty of Trying to Murder Transgender Woman,1383372762.0,"{'created_utc': 1383347562, 'id': '1ppwzq', 'num_comments': 2, 'score': 32, 'selftext': '', 'subreddit': 'transgender', 'title': 'Florida Teen Found Guilty of Trying to Murder Transgender Woman', 'created': 1383372762.0}"
2013-11-02 20:09:36,1prn2y,40,25,,transgender,Stephen Colbert promoting transphobia on the Colbert Report,1383448176.0,"{'created_utc': 1383422976, 'id': '1prn2y', 'num_comments': 40, 'score': 25, 'selftext': '', 'subreddit': 'transgender', 'title': 'Stephen Colbert promoting transphobia on the Colbert Report', 'created': 1383448176.0}"
2013-11-02 21:01:24,1prqre,13,0,,transgender,Transphobic Garbage - Signal Boosting in /r/transspace Too,1383451284.0,"{'created_utc': 1383426084, 'id': '1prqre', 'num_comments': 13, 'score': 0, 'selftext': '', 'subreddit': 'transgender', 'title': 'Transphobic Garbage - Signal Boosting in /r/transspace Too', 'created': 1383451284.0}"
2013-11-03 03:30:43,1psgj6,0,40,,transgender,Spot anti-trans signature gatherers in California? Report it at 866-377-0578!,1383474643.0,"{'created_utc': 1383449443, 'id': '1psgj6', 'num_comments': 0, 'score': 40, 'selftext': '', 'subreddit': 'transgender', 'title': 'Spot anti-trans signature gatherers in California? Report it at 866-377-0578!', 'created': 1383474643.0}"
2013-11-03 03:31:46,1psglj,2,3,,transgender,[Survey] Transgender women smokers in Chicago. My class is doing a survey!,1383474706.0,"{'created_utc': 1383449506, 'id': '1psglj', 'num_comments': 2, 'score': 3, 'selftext': '', 'subreddit': 'transgender', 'title': '[Survey] Transgender women smokers in Chicago. My class is doing a survey!', 'created': 1383474706.0}"
2013-11-03 04:25:31,1psjqp,2,6,,transgender,"The TERF brigade attempt to change the meaning of the word ""consent"".",1383477931.0,"{'created_utc': 1383452731, 'id': '1psjqp', 'num_comments': 2, 'score': 6, 'selftext': '', 'subreddit': 'transgender', 'title': 'The TERF brigade attempt to change the meaning of the word ""consent"".', 'created': 1383477931.0}"
2013-11-03 05:59:06,1psobj,11,60,,transgender,I was so stupid and desperate in the 90s,1383483546.0,"{'created_utc': 1383458346, 'id': '1psobj', 'num_comments': 11, 'score': 60, 'selftext': '', 'subreddit': 'transgender', 'title': 'I was so stupid and desperate in the 90s', 'created': 1383483546.0}"
2013-11-03 09:08:17,1psujn,0,0,,transgender,Third gender option for German birth certificates? Not so fast,1383494897.0,"{'created_utc': 1383469697, 'id': '1psujn', 'num_comments': 0, 'score': 0, 'selftext': '', 'subreddit': 'transgender', 'title': 'Third gender option for German birth certificates? Not so fast', 'created': 1383494897.0}"
2013-11-03 09:09:53,1psukq,1,9,,transgender,How Obamacare Will Affect Trans Folks and Families,1383494993.0,"{'created_utc': 1383469793, 'id': '1psukq', 'num_comments': 1, 'score': 9, 'selftext': '', 'subreddit': 'transgender', 'title': 'How Obamacare Will Affect Trans Folks and Families', 'created': 1383494993.0}"
2013-11-03 14:18:19,1pt40h,1,8,,transgender,The Fundamentals of Transphobia | Dana Beyer,1383513499.0,"{'created_utc': 1383488299, 'id': '1pt40h', 'num_comments': 1, 'score': 8, 'selftext': '', 'subreddit': 'transgender', 'title': 'The Fundamentals of Transphobia | Dana Beyer', 'created': 1383513499.0}"
2013-11-03 14:31:07,1pt4n3,1,1,,transgender,Do you have a hard time dating? We have a support group for that!,1383514267.0,"{'created_utc': 1383489067, 'id': '1pt4n3', 'num_comments': 1, 'score': 1, 'selftext': '', 'subreddit': 'transgender', 'title': 'Do you have a hard time dating? We have a support group for that!', 'created': 1383514267.0}"
2013-11-03 15:17:55,1pt73q,0,12,,transgender,Positively wild: Lou Reed and transgender visibility,1383517075.0,"{'created_utc': 1383491875, 'id': '1pt73q', 'num_comments': 0, 'score': 12, 'selftext': '', 'subreddit': 'transgender', 'title': 'Positively wild: Lou Reed and transgender visibility', 'created': 1383517075.0}"
2013-11-03 17:26:36,1ptfkz,1,2,,transgender,"Out2Enroll - a collaborative effort to educate the lesbian, gay, bisexual, and transgender community about their options under the ACA. (just wanted to share this find).",1383524796.0,"{'created_utc': 1383499596, 'id': '1ptfkz', 'num_comments': 1, 'score': 2, 'selftext': '', 'subreddit': 'transgender', 'title': 'Out2Enroll - a collaborative effort to educate the lesbian, gay, bisexual, and transgender community about their options under the ACA. (just wanted to share this find).', 'created': 1383524796.0}"
2013-11-03 17:50:08,1pth9m,0,1,,transgender,Dare to Live . . . Katie McKinney Fox,1383526208.0,"{'created_utc': 1383501008, 'id': '1pth9m', 'num_comments': 0, 'score': 1, 'selftext': '', 'subreddit': 'transgender', 'title': 'Dare to Live . . . Katie McKinney Fox', 'created': 1383526208.0}"
2013-11-03 19:09:23,1ptn2v,73,110,,transgender,"Disclosure? Pfft, disclose this.",1383530963.0,"{'created_utc': 1383505763, 'id': '1ptn2v', 'num_comments': 73, 'score': 110, 'selftext': '', 'subreddit': 'transgender', 'title': 'Disclosure? Pfft, disclose this.', 'created': 1383530963.0}"
2013-11-03 21:50:28,1ptzoo,2,10,,transgender,Religious right counting on transgender horror stories to stop ENDA,1383540628.0,"{'created_utc': 1383515428, 'id': '1ptzoo', 'num_comments': 2, 'score': 10, 'selftext': '', 'subreddit': 'transgender', 'title': 'Religious right counting on transgender horror stories to stop ENDA', 'created': 1383540628.0}"
2013-11-04 03:32:00,1pupk6,4,10,,transgender,Does the story of David Reimer give insights into the lived experiences of the trans* community?,1383561120.0,"{'created_utc': 1383535920, 'id': '1pupk6', 'num_comments': 4, 'score': 10, 'selftext': '', 'subreddit': 'transgender', 'title': 'Does the story of David Reimer give insights into the lived experiences of the trans* community?', 'created': 1383561120.0}"
2013-11-04 12:58:32,1pveg2,32,22,,transgender,Rape-resistant underwear.,1383595112.0,"{'created_utc': 1383569912, 'id': '1pveg2', 'num_comments': 32, 'score': 22, 'selftext': '', 'subreddit': 'transgender', 'title': 'Rape-resistant underwear.', 'created': 1383595112.0}"
2013-11-04 15:21:54,1pvmoi,10,5,,transgender,Somebody please give him a non-ragey retort because I can't not me mad.,1383603714.0,"{'created_utc': 1383578514, 'id': '1pvmoi', 'num_comments': 10, 'score': 5, 'selftext': '', 'subreddit': 'transgender', 'title': ""Somebody please give him a non-ragey retort because I can't not me mad."", 'created': 1383603714.0}"
2013-11-04 16:40:07,1pvspa,0,1,,transgender,Transgender Forum • View topic - Join us on Mondays for Live Skype Support! Live from 9.30pm - News and this weeks Topicical BIG QUESTION is 'LABELS!',1383608407.0,"{'created_utc': 1383583207, 'id': '1pvspa', 'num_comments': 0, 'score': 1, 'selftext': '', 'subreddit': 'transgender', 'title': ""Transgender Forum • View topic - Join us on Mondays for Live Skype Support! Live from 9.30pm - News and this weeks Topicical BIG QUESTION is 'LABELS!'"", 'created': 1383608407.0}"
2013-11-04 19:24:03,1pw6he,13,105,,transgender,The importance of ENDA for trans employees' lives.,1383618243.0,"{'created_utc': 1383593043, 'id': '1pw6he', 'num_comments': 13, 'score': 105, 'selftext': '', 'subreddit': 'transgender', 'title': ""The importance of ENDA for trans employees' lives."", 'created': 1383618243.0}"
2013-11-04 19:38:53,1pw7s4,1,3,,transgender,Where's Michelle?,1383619133.0,"{'created_utc': 1383593933, 'id': '1pw7s4', 'num_comments': 1, 'score': 3, 'selftext': '', 'subreddit': 'transgender', 'title': ""Where's Michelle?"", 'created': 1383619133.0}"
2013-11-04 23:14:54,1pwqvb,1,3,,transgender,"A Case Study in Transmisogyny: Vanity Fair's ""Last Night at the Viper Room""",1383632094.0,"{'created_utc': 1383606894, 'id': '1pwqvb', 'num_comments': 1, 'score': 3, 'selftext': '', 'subreddit': 'transgender', 'title': 'A Case Study in Transmisogyny: Vanity Fair\'s ""Last Night at the Viper Room""', 'created': 1383632094.0}"
2013-11-05 01:18:30,1px1f3,1,4,,transgender,Did Barney Frank ever say “It doesn’t bother me if she wants to commit suicide” re: Kosilek (trans prisoner) or is this right wing BS?,1383639510.0,"{'created_utc': 1383614310, 'id': '1px1f3', 'num_comments': 1, 'score': 4, 'selftext': '', 'subreddit': 'transgender', 'title': 'Did Barney Frank ever say “It doesn’t bother me if she wants to commit suicide” re: Kosilek (trans prisoner) or is this right wing BS?', 'created': 1383639510.0}"
2013-11-05 03:31:13,1pxccx,1,12,,transgender,PJI's Attorneys Sexualizing Trans Female Preteens And Teens | Connecting the dots &amp; outing the Pacific Justice Institute: Turns out the PJI is just a mouthpiece for known hate group and bigot,1383647473.0,"{'created_utc': 1383622273, 'id': '1pxccx', 'num_comments': 1, 'score': 12, 'selftext': '', 'subreddit': 'transgender', 'title': ""PJI's Attorneys Sexualizing Trans Female Preteens And Teens | Connecting the dots &amp; outing the Pacific Justice Institute: Turns out the PJI is just a mouthpiece for known hate group and bigot"", 'created': 1383647473.0}"
2013-11-05 03:45:42,1pxdhc,2,4,,transgender,Apple CEO Tim Cook Writes Op-Ed in Support of U.S. Employment Nondiscrimination Act,1383648342.0,"{'created_utc': 1383623142, 'id': '1pxdhc', 'num_comments': 2, 'score': 4, 'selftext': '', 'subreddit': 'transgender', 'title': 'Apple CEO Tim Cook Writes Op-Ed in Support of U.S. Employment Nondiscrimination Act', 'created': 1383648342.0}"
2013-11-05 05:58:09,1pxmo5,1,27,,transgender,Help support transgender equality by asking for the ACA to cover Gender Reassignment Surgery,1383656289.0,"{'created_utc': 1383631089, 'id': '1pxmo5', 'num_comments': 1, 'score': 27, 'selftext': '', 'subreddit': 'transgender', 'title': 'Help support transgender equality by asking for the ACA to cover Gender Reassignment Surgery', 'created': 1383656289.0}"
2013-11-05 16:44:59,1pyinv,0,1,,transgender,"Transgender Forum • View topic - Skype Support and Discussion Group Show Notes 4th Nov 2013 - Watch the Video Now! Rebecca guides us through labels, and all the latest Transgender News!",1383695099.0,"{'created_utc': 1383669899, 'id': '1pyinv', 'num_comments': 0, 'score': 1, 'selftext': '', 'subreddit': 'transgender', 'title': 'Transgender Forum • View topic - Skype Support and Discussion Group Show Notes 4th Nov 2013 - Watch the Video Now! Rebecca guides us through labels, and all the latest Transgender News!', 'created': 1383695099.0}"
2013-11-05 17:22:06,1pylus,16,22,,transgender,"Christian Love: Parents Sue For Right To Torture Child With ""Ex-trans Therapy""",1383697326.0,"{'created_utc': 1383672126, 'id': '1pylus', 'num_comments': 16, 'score': 22, 'selftext': '', 'subreddit': 'transgender', 'title': 'Christian Love: Parents Sue For Right To Torture Child With ""Ex-trans Therapy""', 'created': 1383697326.0}"
2013-11-05 18:23:20,1pyr9l,10,7,,transgender,"If you're MAAB trans, please fill out this one question survey on your chest's band size.",1383701000.0,"{'created_utc': 1383675800, 'id': '1pyr9l', 'num_comments': 10, 'score': 7, 'selftext': '', 'subreddit': 'transgender', 'title': ""If you're MAAB trans, please fill out this one question survey on your chest's band size."", 'created': 1383701000.0}"
2013-11-05 19:23:59,1pywpv,27,120,,transgender,It's settled - Andrej Pejic prefers female pronouns!,1383704639.0,"{'created_utc': 1383679439, 'id': '1pywpv', 'num_comments': 27, 'score': 120, 'selftext': '', 'subreddit': 'transgender', 'title': ""It's settled - Andrej Pejic prefers female pronouns!"", 'created': 1383704639.0}"
2013-11-05 23:43:40,1pzjhj,2,0,,transgender,Transphobia,1383720220.0,"{'created_utc': 1383695020, 'id': '1pzjhj', 'num_comments': 2, 'score': 0, 'selftext': '', 'subreddit': 'transgender', 'title': 'Transphobia', 'created': 1383720220.0}"
2013-11-06 01:24:46,1pzs2h,0,0,,transgender,The Transgender Agenda,1383726286.0,"{'created_utc': 1383701086, 'id': '1pzs2h', 'num_comments': 0, 'score': 0, 'selftext': '', 'subreddit': 'transgender', 'title': 'The Transgender Agenda', 'created': 1383726286.0}"
2013-11-06 02:10:26,1pzw1y,63,46,,transgender,HELP! PJI has made a YT video targeting the trans kid they have already pushed to the brink of suicide. Please flag this as what it is: bullying.,1383729026.0,"{'created_utc': 1383703826, 'id': '1pzw1y', 'num_comments': 63, 'score': 46, 'selftext': '', 'subreddit': 'transgender', 'title': 'HELP! PJI has made a YT video targeting the trans kid they have already pushed to the brink of suicide. Please flag this as what it is: bullying.', 'created': 1383729026.0}"
2013-11-06 02:47:07,1pzz5o,0,7,,transgender,What Marriage Equality in Illinois Means to Transgender Individuals,1383731227.0,"{'created_utc': 1383706027, 'id': '1pzz5o', 'num_comments': 0, 'score': 7, 'selftext': '', 'subreddit': 'transgender', 'title': 'What Marriage Equality in Illinois Means to Transgender Individuals', 'created': 1383731227.0}"
2013-11-06 02:55:21,1pzztv,6,5,,transgender,"3 years ago, the world's second successful voice box transplant was reported successful. What could this mean for future trans* people who want to change their voices (without training their old voice) ?",1383731721.0,"{'created_utc': 1383706521, 'id': '1pzztv', 'num_comments': 6, 'score': 5, 'selftext': '', 'subreddit': 'transgender', 'title': ""3 years ago, the world's second successful voice box transplant was reported successful. What could this mean for future trans* people who want to change their voices (without training their old voice) ?"", 'created': 1383731721.0}"
2013-11-06 04:57:41,1q099h,1,1,,transgender,"""NOISE"" -- An anthem for equality. Written by Gavin Creel and performed by Findlay First Edition show choir. [lyrics in comments + more]",1383739061.0,"{'created_utc': 1383713861, 'id': '1q099h', 'num_comments': 1, 'score': 1, 'selftext': '', 'subreddit': 'transgender', 'title': '""NOISE"" -- An anthem for equality. Written by Gavin Creel and performed by Findlay First Edition show choir. [lyrics in comments + more]', 'created': 1383739061.0}"
2013-11-06 16:57:29,1q19rm,8,102,,transgender,Victoria's Secret is petitioned to hire Carmen Carrera as first transgender supermodel,1383782249.0,"{'created_utc': 1383757049, 'id': '1q19rm', 'num_comments': 8, 'score': 102, 'selftext': '', 'subreddit': 'transgender', 'title': ""Victoria's Secret is petitioned to hire Carmen Carrera as first transgender supermodel"", 'created': 1383782249.0}"
2013-11-06 20:19:28,1q1r4e,0,2,,transgender,"Interview with Alex Newell, who plays transgender songbird ""Unique"" on Glee",1383794368.0,"{'created_utc': 1383769168, 'id': '1q1r4e', 'num_comments': 0, 'score': 2, 'selftext': '', 'subreddit': 'transgender', 'title': 'Interview with Alex Newell, who plays transgender songbird ""Unique"" on Glee', 'created': 1383794368.0}"
2013-11-06 20:20:31,1q1r7c,0,1,,transgender,"Interview with Alex Newell, who plays transgender songbird ""Unique"" on Glee",1383794431.0,"{'created_utc': 1383769231, 'id': '1q1r7c', 'num_comments': 0, 'score': 1, 'selftext': '', 'subreddit': 'transgender', 'title': 'Interview with Alex Newell, who plays transgender songbird ""Unique"" on Glee', 'created': 1383794431.0}"
2013-11-06 21:06:19,1q1vdz,3,2,,transgender,"Coming out, and out, and out again.",1383797179.0,"{'created_utc': 1383771979, 'id': '1q1vdz', 'num_comments': 3, 'score': 2, 'selftext': '', 'subreddit': 'transgender', 'title': 'Coming out, and out, and out again.', 'created': 1383797179.0}"
2013-11-06 23:07:15,1q25z3,0,0,,transgender,Interview with Michelle Spicer on Transitionradio.net,1383804435.0,"{'created_utc': 1383779235, 'id': '1q25z3', 'num_comments': 0, 'score': 0, 'selftext': '', 'subreddit': 'transgender', 'title': 'Interview with Michelle Spicer on Transitionradio.net', 'created': 1383804435.0}"
2013-11-07 01:13:24,1q2g6x,1,10,,transgender,Petition Launches to Make Carmen Carrera First Trans Victoria’s Secret Model,1383812004.0,"{'created_utc': 1383786804, 'id': '1q2g6x', 'num_comments': 1, 'score': 10, 'selftext': '', 'subreddit': 'transgender', 'title': 'Petition Launches to Make Carmen Carrera First Trans Victoria’s Secret Model', 'created': 1383812004.0}"
2013-11-07 08:12:00,1q387c,4,0,,transgender,Transsexual Mormon hopes church will accept her,1383837120.0,"{'created_utc': 1383811920, 'id': '1q387c', 'num_comments': 4, 'score': 0, 'selftext': '', 'subreddit': 'transgender', 'title': 'Transsexual Mormon hopes church will accept her', 'created': 1383837120.0}"
2013-11-07 09:31:54,1q3b5u,5,14,,transgender,Face recognition technology: dangerous implications for trans people?,1383841914.0,"{'created_utc': 1383816714, 'id': '1q3b5u', 'num_comments': 5, 'score': 14, 'selftext': '', 'subreddit': 'transgender', 'title': 'Face recognition technology: dangerous implications for trans people?', 'created': 1383841914.0}"
2013-11-07 09:33:08,1q3b7g,0,1,,transgender,Need to Know: San Francisco Transgender Film Festival,1383841988.0,"{'created_utc': 1383816788, 'id': '1q3b7g', 'num_comments': 0, 'score': 1, 'selftext': '', 'subreddit': 'transgender', 'title': 'Need to Know: San Francisco Transgender Film Festival', 'created': 1383841988.0}"
2013-11-07 15:06:32,1q3qyd,0,3,,transgender,HRC Lambda Legal Publishes 'Best Practices' Guide for Treating Trans Patients,1383861992.0,"{'created_utc': 1383836792, 'id': '1q3qyd', 'num_comments': 0, 'score': 3, 'selftext': '', 'subreddit': 'transgender', 'title': ""HRC Lambda Legal Publishes 'Best Practices' Guide for Treating Trans Patients"", 'created': 1383861992.0}"
2013-11-07 18:50:37,1q4a34,0,1,,transgender,Is ‘Self-Promotion’ and the ‘Selfie’ at risk of crushing the quiet hardworking transgender activist?,1383875437.0,"{'created_utc': 1383850237, 'id': '1q4a34', 'num_comments': 0, 'score': 1, 'selftext': '', 'subreddit': 'transgender', 'title': 'Is ‘Self-Promotion’ and the ‘Selfie’ at risk of crushing the quiet hardworking transgender activist?', 'created': 1383875437.0}"
2013-11-07 19:56:05,1q4g39,7,5,,transgender,QuestionableContent | Claire is about to tell Emily something!,1383879365.0,"{'created_utc': 1383854165, 'id': '1q4g39', 'num_comments': 7, 'score': 5, 'selftext': '', 'subreddit': 'transgender', 'title': 'QuestionableContent | Claire is about to tell Emily something!', 'created': 1383879365.0}"
2013-11-07 20:21:22,1q4ieg,7,64,,transgender,"Senate Approves ENDA, Adding Sexual Orientation To Work Protections : The Two-Way : NPR",1383880882.0,"{'created_utc': 1383855682, 'id': '1q4ieg', 'num_comments': 7, 'score': 64, 'selftext': '', 'subreddit': 'transgender', 'title': 'Senate Approves ENDA, Adding Sexual Orientation To Work Protections : The Two-Way : NPR', 'created': 1383880882.0}"
2013-11-07 20:42:49,1q4kda,1,3,,transgender,Transgenderism: Injustice at every turn,1383882169.0,"{'created_utc': 1383856969, 'id': '1q4kda', 'num_comments': 1, 'score': 3, 'selftext': '', 'subreddit': 'transgender', 'title': 'Transgenderism: Injustice at every turn', 'created': 1383882169.0}"
2013-11-07 20:53:24,1q4lbw,0,4,,transgender,Study finds that testosterone type does not affect skin changes during hormone therapy,1383882804.0,"{'created_utc': 1383857604, 'id': '1q4lbw', 'num_comments': 0, 'score': 4, 'selftext': '', 'subreddit': 'transgender', 'title': 'Study finds that testosterone type does not affect skin changes during hormone therapy', 'created': 1383882804.0}"
2013-11-07 22:30:26,1q4u5u,2,16,,transgender,"Response Video: PJI's ""Boy Allowed in Girls' School Bathroom""",1383888626.0,"{'created_utc': 1383863426, 'id': '1q4u5u', 'num_comments': 2, 'score': 16, 'selftext': '', 'subreddit': 'transgender', 'title': 'Response Video: PJI\'s ""Boy Allowed in Girls\' School Bathroom""', 'created': 1383888626.0}"
2013-11-08 01:21:38,1q582s,1,13,,transgender,PJI fundraising video targeting suicidal trans kid goes viral | People who were under police investigation for cyber bullying trans kid featured in PJI YT video,1383898898.0,"{'created_utc': 1383873698, 'id': '1q582s', 'num_comments': 1, 'score': 13, 'selftext': '', 'subreddit': 'transgender', 'title': 'PJI fundraising video targeting suicidal trans kid goes viral | People who were under police investigation for cyber bullying trans kid featured in PJI YT video', 'created': 1383898898.0}"
2013-11-08 03:45:55,1q5j6n,0,1,,transgender,Victoria's Secret petitioned to make Carmen Carrera first transgender model | TheCelebrityCafe.com,1383907555.0,"{'created_utc': 1383882355, 'id': '1q5j6n', 'num_comments': 0, 'score': 1, 'selftext': '', 'subreddit': 'transgender', 'title': ""Victoria's Secret petitioned to make Carmen Carrera first transgender model | TheCelebrityCafe.com"", 'created': 1383907555.0}"
2013-11-08 07:41:01,1q5xws,1,0,,transgender,U.S. Sen. Merkley of Oregon key to passage of trans/LGBT protection bill ENDA,1383921661.0,"{'created_utc': 1383896461, 'id': '1q5xws', 'num_comments': 1, 'score': 0, 'selftext': '', 'subreddit': 'transgender', 'title': 'U.S. Sen. Merkley of Oregon key to passage of trans/LGBT protection bill ENDA', 'created': 1383921661.0}"
2013-11-08 07:42:35,1q5xz7,0,0,,transgender,X Factor judge attacks trans singer: She sings back ‘Words can’t bring me down’,1383921755.0,"{'created_utc': 1383896555, 'id': '1q5xz7', 'num_comments': 0, 'score': 0, 'selftext': '', 'subreddit': 'transgender', 'title': 'X Factor judge attacks trans singer: She sings back ‘Words can’t bring me down’', 'created': 1383921755.0}"
2013-11-08 09:57:14,1q62z6,0,1,,transgender,Transgender Education: Teaching the Teachers,1383929834.0,"{'created_utc': 1383904634, 'id': '1q62z6', 'num_comments': 0, 'score': 1, 'selftext': '', 'subreddit': 'transgender', 'title': 'Transgender Education: Teaching the Teachers', 'created': 1383929834.0}"
2013-11-08 15:21:00,1q6htl,11,21,,transgender,I know some people struggle with choosing their name so here's how I came up with mine,1383949260.0,"{'created_utc': 1383924060, 'id': '1q6htl', 'num_comments': 11, 'score': 21, 'selftext': '', 'subreddit': 'transgender', 'title': ""I know some people struggle with choosing their name so here's how I came up with mine"", 'created': 1383949260.0}"
2013-11-08 17:37:02,1q6t5y,0,1,,transgender,"Ash Beckham on closets: We all have them, come on out.",1383957422.0,"{'created_utc': 1383932222, 'id': '1q6t5y', 'num_comments': 0, 'score': 1, 'selftext': '', 'subreddit': 'transgender', 'title': 'Ash Beckham on closets: We all have them, come on out.', 'created': 1383957422.0}"
2013-11-08 18:00:32,1q6v5e,3,15,,transgender,"Ash Beckham on closets: We all have them, come on out.",1383958832.0,"{'created_utc': 1383933632, 'id': '1q6v5e', 'num_comments': 3, 'score': 15, 'selftext': '', 'subreddit': 'transgender', 'title': 'Ash Beckham on closets: We all have them, come on out.', 'created': 1383958832.0}"
2013-11-08 18:59:09,1q708w,74,76,,transgender,Autogynophilia pathologizes normal female behavior,1383962349.0,"{'created_utc': 1383937149, 'id': '1q708w', 'num_comments': 74, 'score': 76, 'selftext': '', 'subreddit': 'transgender', 'title': 'Autogynophilia pathologizes normal female behavior', 'created': 1383962349.0}"
