created_utc,id,num_comments,score,selftext,subreddit,title,created,d_
2013-11-14 18:28:46,1qmpgu,0,3,,transgender,"Wanted to share this Kickstarter for a graphic novel about trans oppression as a political tool. The artists have been working to promote SF's Transgender Law Center, raising funds and awareness while promoting the book",1384478926.0,"{'created_utc': 1384453726, 'id': '1qmpgu', 'num_comments': 0, 'score': 3, 'selftext': '', 'subreddit': 'transgender', 'title': ""Wanted to share this Kickstarter for a graphic novel about trans oppression as a political tool. The artists have been working to promote SF's Transgender Law Center, raising funds and awareness while promoting the book"", 'created': 1384478926.0}"
2013-11-14 22:20:27,1qnazg,0,2,,transgender,Help make it happen for TransFocus: A Trans* Film Festival,1384492827.0,"{'created_utc': 1384467627, 'id': '1qnazg', 'num_comments': 0, 'score': 2, 'selftext': '', 'subreddit': 'transgender', 'title': 'Help make it happen for TransFocus: A Trans* Film Festival', 'created': 1384492827.0}"
2013-11-15 01:13:44,1qnpv2,14,19,,transgender,Miss Universe: Trans Women Should Have Their Own Beauty Pageants,1384503224.0,"{'created_utc': 1384478024, 'id': '1qnpv2', 'num_comments': 14, 'score': 19, 'selftext': '', 'subreddit': 'transgender', 'title': 'Miss Universe: Trans Women Should Have Their Own Beauty Pageants', 'created': 1384503224.0}"
2013-11-15 01:15:44,1qnq0u,2,14,,transgender,"Jared Leto &amp; the ""T"" Word",1384503344.0,"{'created_utc': 1384478144, 'id': '1qnq0u', 'num_comments': 2, 'score': 14, 'selftext': '', 'subreddit': 'transgender', 'title': 'Jared Leto &amp; the ""T"" Word', 'created': 1384503344.0}"
2013-11-15 01:36:23,1qnros,0,8,,transgender,Texas High School Denies Trans Teen's Right to Wear Tuxedo in Yearbook Photo,1384504583.0,"{'created_utc': 1384479383, 'id': '1qnros', 'num_comments': 0, 'score': 8, 'selftext': '', 'subreddit': 'transgender', 'title': ""Texas High School Denies Trans Teen's Right to Wear Tuxedo in Yearbook Photo"", 'created': 1384504583.0}"
2013-11-15 02:11:04,1qnuj3,0,2,,transgender,TDOR Unite! :: Online TDOR service on November 17,1384506664.0,"{'created_utc': 1384481464, 'id': '1qnuj3', 'num_comments': 0, 'score': 2, 'selftext': '', 'subreddit': 'transgender', 'title': 'TDOR Unite! :: Online TDOR service on November 17', 'created': 1384506664.0}"
2013-11-15 02:23:24,1qnvkg,0,2,,transgender,School Investigates Possible Hate Crime After Hercules High Brawl,1384507404.0,"{'created_utc': 1384482204, 'id': '1qnvkg', 'num_comments': 0, 'score': 2, 'selftext': '', 'subreddit': 'transgender', 'title': 'School Investigates Possible Hate Crime After Hercules High Brawl', 'created': 1384507404.0}"
2013-11-15 03:11:08,1qnzdb,2,7,,transgender,Transgender HS Student Verbally Abused Before Fight,1384510268.0,"{'created_utc': 1384485068, 'id': '1qnzdb', 'num_comments': 2, 'score': 7, 'selftext': '', 'subreddit': 'transgender', 'title': 'Transgender HS Student Verbally Abused Before Fight', 'created': 1384510268.0}"
2013-11-15 04:40:24,1qo67n,14,24,,transgender,go suck a fat one Cook County IL (Namechange Woes),1384515624.0,"{'created_utc': 1384490424, 'id': '1qo67n', 'num_comments': 14, 'score': 24, 'selftext': '', 'subreddit': 'transgender', 'title': 'go suck a fat one Cook County IL (Namechange Woes)', 'created': 1384515624.0}"
2013-11-15 05:56:35,1qob7j,14,1,,transgender,Does curiosity kill the ciswoman? - Questions about the relationship between ciswomen and transwomen.,1384520195.0,"{'created_utc': 1384494995, 'id': '1qob7j', 'num_comments': 14, 'score': 1, 'selftext': '', 'subreddit': 'transgender', 'title': 'Does curiosity kill the ciswoman? - Questions about the relationship between ciswomen and transwomen.', 'created': 1384520195.0}"
2013-11-15 10:35:40,1qon38,1,1,,transgender,"Paola’s story: marriage, transsexuality and being a foster mum",1384536940.0,"{'created_utc': 1384511740, 'id': '1qon38', 'num_comments': 1, 'score': 1, 'selftext': '', 'subreddit': 'transgender', 'title': 'Paola’s story: marriage, transsexuality and being a foster mum', 'created': 1384536940.0}"
2013-11-15 10:47:13,1qongj,4,42,,transgender,School removes transgendered teen's photo from yearbook,1384537633.0,"{'created_utc': 1384512433, 'id': '1qongj', 'num_comments': 4, 'score': 42, 'selftext': '', 'subreddit': 'transgender', 'title': ""School removes transgendered teen's photo from yearbook"", 'created': 1384537633.0}"
2013-11-15 14:38:54,1qoy0h,1,2,,transgender,One of these boys thought I was a real girl,1384551534.0,"{'created_utc': 1384526334, 'id': '1qoy0h', 'num_comments': 1, 'score': 2, 'selftext': '', 'subreddit': 'transgender', 'title': 'One of these boys thought I was a real girl', 'created': 1384551534.0}"
2013-11-15 18:54:06,1qpig7,0,1,,transgender,The Dysphoria and the Depression,1384566846.0,"{'created_utc': 1384541646, 'id': '1qpig7', 'num_comments': 0, 'score': 1, 'selftext': '', 'subreddit': 'transgender', 'title': 'The Dysphoria and the Depression', 'created': 1384566846.0}"
2013-11-15 21:03:27,1qptj1,7,53,,transgender,TERF front group is fake,1384574607.0,"{'created_utc': 1384549407, 'id': '1qptj1', 'num_comments': 7, 'score': 53, 'selftext': '', 'subreddit': 'transgender', 'title': 'TERF front group is fake', 'created': 1384574607.0}"
2013-11-15 22:08:11,1qpz1e,0,1,,transgender,Transgender Texas student's tuxedo photo banned,1384578491.0,"{'created_utc': 1384553291, 'id': '1qpz1e', 'num_comments': 0, 'score': 1, 'selftext': '', 'subreddit': 'transgender', 'title': ""Transgender Texas student's tuxedo photo banned"", 'created': 1384578491.0}"
2013-11-15 23:24:05,1qq5b6,1,39,,transgender,Life Sentence for Murderer of Cleveland Transwoman,1384583045.0,"{'created_utc': 1384557845, 'id': '1qq5b6', 'num_comments': 1, 'score': 39, 'selftext': '', 'subreddit': 'transgender', 'title': 'Life Sentence for Murderer of Cleveland Transwoman', 'created': 1384583045.0}"
2013-11-16 00:03:29,1qq8ab,2,10,,transgender,GLAAD Urges NY Gov. to Help Trans New Yorkers Get Health Care,1384585409.0,"{'created_utc': 1384560209, 'id': '1qq8ab', 'num_comments': 2, 'score': 10, 'selftext': '', 'subreddit': 'transgender', 'title': 'GLAAD Urges NY Gov. to Help Trans New Yorkers Get Health Care', 'created': 1384585409.0}"
2013-11-16 00:10:50,1qq8u4,9,64,,transgender,Another victory for trans rights!!! School thinks twice and will now allow transboy to appear in yearbook in tux.,1384585850.0,"{'created_utc': 1384560650, 'id': '1qq8u4', 'num_comments': 9, 'score': 64, 'selftext': '', 'subreddit': 'transgender', 'title': 'Another victory for trans rights!!! School thinks twice and will now allow transboy to appear in yearbook in tux.', 'created': 1384585850.0}"
2013-11-16 02:30:34,1qqidl,1,8,,transgender,They know we've won!!! Anti-trans advocates recognizing denying bathroom access is illegal even in Arkansas. TRIGGER WARNING - this is an anti-trans website that misgenders and advocates agaisnt trans equality in a viciously unkind manner.,1384594234.0,"{'created_utc': 1384569034, 'id': '1qqidl', 'num_comments': 1, 'score': 8, 'selftext': '', 'subreddit': 'transgender', 'title': ""They know we've won!!! Anti-trans advocates recognizing denying bathroom access is illegal even in Arkansas. TRIGGER WARNING - this is an anti-trans website that misgenders and advocates agaisnt trans equality in a viciously unkind manner."", 'created': 1384594234.0}"
2013-11-16 02:49:58,1qqjnk,0,25,,transgender,'Because We Can': How Society Justifies Anti-Transgender Discrimination,1384595398.0,"{'created_utc': 1384570198, 'id': '1qqjnk', 'num_comments': 0, 'score': 25, 'selftext': '', 'subreddit': 'transgender', 'title': ""'Because We Can': How Society Justifies Anti-Transgender Discrimination"", 'created': 1384595398.0}"
2013-11-16 04:04:03,1qqof6,1,0,,transgender,Super Cool Ski Instructor,1384599843.0,"{'created_utc': 1384574643, 'id': '1qqof6', 'num_comments': 1, 'score': 0, 'selftext': '', 'subreddit': 'transgender', 'title': 'Super Cool Ski Instructor', 'created': 1384599843.0}"
2013-11-16 06:16:45,1qqw3i,0,5,,transgender,Let's do this! Judgement Day: Protesting PJI's Hate,1384607805.0,"{'created_utc': 1384582605, 'id': '1qqw3i', 'num_comments': 0, 'score': 5, 'selftext': '', 'subreddit': 'transgender', 'title': ""Let's do this! Judgement Day: Protesting PJI's Hate"", 'created': 1384607805.0}"
2013-11-16 14:27:29,1qrdqf,1,2,,transgender,The Dysphoria and the Depression,1384637249.0,"{'created_utc': 1384612049, 'id': '1qrdqf', 'num_comments': 1, 'score': 2, 'selftext': '', 'subreddit': 'transgender', 'title': 'The Dysphoria and the Depression', 'created': 1384637249.0}"
2013-11-16 14:50:23,1qresz,0,2,,transgender,TRANSMUSEPLANET: It's Transgender Awarness Week Nov. 15-20,1384638623.0,"{'created_utc': 1384613423, 'id': '1qresz', 'num_comments': 0, 'score': 2, 'selftext': '', 'subreddit': 'transgender', 'title': ""TRANSMUSEPLANET: It's Transgender Awarness Week Nov. 15-20"", 'created': 1384638623.0}"
2013-11-16 16:19:10,1qrk05,1,33,,transgender,My Transgender Uncle: A Family Secret Hidden For Decades,1384643950.0,"{'created_utc': 1384618750, 'id': '1qrk05', 'num_comments': 1, 'score': 33, 'selftext': '', 'subreddit': 'transgender', 'title': 'My Transgender Uncle: A Family Secret Hidden For Decades', 'created': 1384643950.0}"
2013-11-16 18:36:35,1qrtqg,9,36,,transgender,The 5 Genders of Bugis Society,1384652195.0,"{'created_utc': 1384626995, 'id': '1qrtqg', 'num_comments': 9, 'score': 36, 'selftext': '', 'subreddit': 'transgender', 'title': 'The 5 Genders of Bugis Society', 'created': 1384652195.0}"
2013-11-16 23:11:12,1qsf0z,6,5,,transgender,drowning mermaid: Dränkt-drowning mermaid number 01,1384668672.0,"{'created_utc': 1384643472, 'id': '1qsf0z', 'num_comments': 6, 'score': 5, 'selftext': '', 'subreddit': 'transgender', 'title': 'drowning mermaid: Dränkt-drowning mermaid number 01', 'created': 1384668672.0}"
2013-11-16 23:55:37,1qsi8d,0,1,,transgender,11 Transgender Stars Weigh In on Trans Images in Entertainment,1384671337.0,"{'created_utc': 1384646137, 'id': '1qsi8d', 'num_comments': 0, 'score': 1, 'selftext': '', 'subreddit': 'transgender', 'title': '11 Transgender Stars Weigh In on Trans Images in Entertainment', 'created': 1384671337.0}"
2013-11-17 08:56:04,1qtdah,5,4,,transgender,Anyone else disgusted by the comments made recently by Bill O'Reily towards trans issues,1384703764.0,"{'created_utc': 1384678564, 'id': '1qtdah', 'num_comments': 5, 'score': 4, 'selftext': '', 'subreddit': 'transgender', 'title': ""Anyone else disgusted by the comments made recently by Bill O'Reily towards trans issues"", 'created': 1384703764.0}"
2013-11-17 12:16:20,1qtjf0,3,11,,transgender,Tumbling through the looking glass: What life is like with gender dysphoria and depression controlling it,1384715780.0,"{'created_utc': 1384690580, 'id': '1qtjf0', 'num_comments': 3, 'score': 11, 'selftext': '', 'subreddit': 'transgender', 'title': 'Tumbling through the looking glass: What life is like with gender dysphoria and depression controlling it', 'created': 1384715780.0}"
2013-11-17 14:50:12,1qtp6g,6,139,,transgender,Dress,1384725012.0,"{'created_utc': 1384699812, 'id': '1qtp6g', 'num_comments': 6, 'score': 139, 'selftext': '', 'subreddit': 'transgender', 'title': 'Dress', 'created': 1384725012.0}"
2013-11-17 17:37:31,1qtzr6,4,0,,transgender,Stealth or openness,1384735051.0,"{'created_utc': 1384709851, 'id': '1qtzr6', 'num_comments': 4, 'score': 0, 'selftext': '', 'subreddit': 'transgender', 'title': 'Stealth or openness', 'created': 1384735051.0}"
2013-11-17 21:19:55,1qui1h,14,49,,transgender,"MEP Nikki Sinclaire reveals she had a sex change more than 20 years ago: Miss Sinclaire, 45, writes for the first time about her ""great secret"" of growing up as a boy, and how she is Britain's first ""sex change parliamentarian""!!!",1384748395.0,"{'created_utc': 1384723195, 'id': '1qui1h', 'num_comments': 14, 'score': 49, 'selftext': '', 'subreddit': 'transgender', 'title': 'MEP Nikki Sinclaire reveals she had a sex change more than 20 years ago: Miss Sinclaire, 45, writes for the first time about her ""great secret"" of growing up as a boy, and how she is Britain\'s first ""sex change parliamentarian""!!!', 'created': 1384748395.0}"
2013-11-18 03:20:31,1qvbgl,0,5,,transgender,MtF transgender with striking resemblance to Patti labelle seeks help in taking a photo with her at upcoming concert,1384770031.0,"{'created_utc': 1384744831, 'id': '1qvbgl', 'num_comments': 0, 'score': 5, 'selftext': '', 'subreddit': 'transgender', 'title': 'MtF transgender with striking resemblance to Patti labelle seeks help in taking a photo with her at upcoming concert', 'created': 1384770031.0}"
2013-11-18 07:28:46,1qvslo,0,8,,transgender,I started a blog and kicked it off by going into my past. I hope you all find it informative and entertaining.,1384784926.0,"{'created_utc': 1384759726, 'id': '1qvslo', 'num_comments': 0, 'score': 8, 'selftext': '', 'subreddit': 'transgender', 'title': 'I started a blog and kicked it off by going into my past. I hope you all find it informative and entertaining.', 'created': 1384784926.0}"
2013-11-18 08:12:31,1qvugw,0,5,,transgender,Southern Poverty Law Center forces Texas school district to yield to transgender student,1384787551.0,"{'created_utc': 1384762351, 'id': '1qvugw', 'num_comments': 0, 'score': 5, 'selftext': '', 'subreddit': 'transgender', 'title': 'Southern Poverty Law Center forces Texas school district to yield to transgender student', 'created': 1384787551.0}"
2013-11-18 09:57:20,1qvyh3,1,0,,transgender,Iconic transgender pioneer Vicki Marlane gets multi-media exhibit at SF museum,1384793840.0,"{'created_utc': 1384768640, 'id': '1qvyh3', 'num_comments': 1, 'score': 0, 'selftext': '', 'subreddit': 'transgender', 'title': 'Iconic transgender pioneer Vicki Marlane gets multi-media exhibit at SF museum', 'created': 1384793840.0}"
2013-11-18 10:40:40,1qw048,6,1,,transgender,"Does anyone have advice for a transperson living in the ACT? This place sucks for me, I need help ;_;",1384796440.0,"{'created_utc': 1384771240, 'id': '1qw048', 'num_comments': 6, 'score': 1, 'selftext': '', 'subreddit': 'transgender', 'title': 'Does anyone have advice for a transperson living in the ACT? This place sucks for me, I need help ;_;', 'created': 1384796440.0}"
2013-11-18 15:03:46,1qwcrh,0,1,,transgender,Transgender Day of Remembrance 2013 Virtual Vigil 1 Minute Silence - Tra...,1384812226.0,"{'created_utc': 1384787026, 'id': '1qwcrh', 'num_comments': 0, 'score': 1, 'selftext': '', 'subreddit': 'transgender', 'title': 'Transgender Day of Remembrance 2013 Virtual Vigil 1 Minute Silence - Tra...', 'created': 1384812226.0}"
2013-11-18 16:05:43,1qwhg4,31,23,,transgender,Being Transgender in America,1384815943.0,"{'created_utc': 1384790743, 'id': '1qwhg4', 'num_comments': 31, 'score': 23, 'selftext': '', 'subreddit': 'transgender', 'title': 'Being Transgender in America', 'created': 1384815943.0}"
2013-11-18 17:25:47,1qwock,0,1,,transgender,Transgender woman raising money for SRS online. How do you feel about crowd-sourcing?,1384820747.0,"{'created_utc': 1384795547, 'id': '1qwock', 'num_comments': 0, 'score': 1, 'selftext': '', 'subreddit': 'transgender', 'title': 'Transgender woman raising money for SRS online. How do you feel about crowd-sourcing?', 'created': 1384820747.0}"
2013-11-18 17:36:54,1qwpcz,2,0,,transgender,Transgender woman raising money for GRS online. How do you feel about crowd-sourcing?,1384821414.0,"{'created_utc': 1384796214, 'id': '1qwpcz', 'num_comments': 2, 'score': 0, 'selftext': '', 'subreddit': 'transgender', 'title': 'Transgender woman raising money for GRS online. How do you feel about crowd-sourcing?', 'created': 1384821414.0}"
2013-11-18 18:51:26,1qww1h,0,3,,transgender,Transgender Politician Reveals She Was Raped In London Before She Came Out As A Lesbian,1384825886.0,"{'created_utc': 1384800686, 'id': '1qww1h', 'num_comments': 0, 'score': 3, 'selftext': '', 'subreddit': 'transgender', 'title': 'Transgender Politician Reveals She Was Raped In London Before She Came Out As A Lesbian', 'created': 1384825886.0}"
2013-11-18 23:14:12,1qxlag,4,89,,transgender,Texas county adopts sweeping new policy to protect transgender rights in prison,1384841652.0,"{'created_utc': 1384816452, 'id': '1qxlag', 'num_comments': 4, 'score': 89, 'selftext': '', 'subreddit': 'transgender', 'title': 'Texas county adopts sweeping new policy to protect transgender rights in prison', 'created': 1384841652.0}"
2013-11-18 23:17:11,1qxlkt,0,3,,transgender,This Week in Transmisogyny: Miss Universe and Carmen Carrera,1384841831.0,"{'created_utc': 1384816631, 'id': '1qxlkt', 'num_comments': 0, 'score': 3, 'selftext': '', 'subreddit': 'transgender', 'title': 'This Week in Transmisogyny: Miss Universe and Carmen Carrera', 'created': 1384841831.0}"
2013-11-18 23:36:34,1qxndj,2,3,,transgender,Transgender Woman Found Murdered in Detroit,1384842994.0,"{'created_utc': 1384817794, 'id': '1qxndj', 'num_comments': 2, 'score': 3, 'selftext': '', 'subreddit': 'transgender', 'title': 'Transgender Woman Found Murdered in Detroit', 'created': 1384842994.0}"
2013-11-19 02:33:49,1qy3em,0,9,,transgender,"Trans*Athlete - a resource for athletes, coaches, &amp; administrators about trans* inclusion in athletics",1384853629.0,"{'created_utc': 1384828429, 'id': '1qy3em', 'num_comments': 0, 'score': 9, 'selftext': '', 'subreddit': 'transgender', 'title': 'Trans*Athlete - a resource for athletes, coaches, &amp; administrators about trans* inclusion in athletics', 'created': 1384853629.0}"
2013-11-19 03:36:32,1qy90p,4,21,,transgender,Court takes couple’s children because father is transgender,1384857392.0,"{'created_utc': 1384832192, 'id': '1qy90p', 'num_comments': 4, 'score': 21, 'selftext': '', 'subreddit': 'transgender', 'title': 'Court takes couple’s children because father is transgender', 'created': 1384857392.0}"
2013-11-19 03:46:14,1qy9v6,0,1,,transgender,I was arguing with my parents when they dropped this one,1384857974.0,"{'created_utc': 1384832774, 'id': '1qy9v6', 'num_comments': 0, 'score': 1, 'selftext': '', 'subreddit': 'transgender', 'title': 'I was arguing with my parents when they dropped this one', 'created': 1384857974.0}"
2013-11-19 04:31:45,1qydqv,0,7,,transgender,ENDA and the Capitalistic Marketplace,1384860705.0,"{'created_utc': 1384835505, 'id': '1qydqv', 'num_comments': 0, 'score': 7, 'selftext': '', 'subreddit': 'transgender', 'title': 'ENDA and the Capitalistic Marketplace', 'created': 1384860705.0}"
2013-11-19 06:55:14,1qymui,1,22,,transgender,"Another California trans student attacked, trans community responds: #JD4PJI",1384869314.0,"{'created_utc': 1384844114, 'id': '1qymui', 'num_comments': 1, 'score': 22, 'selftext': '', 'subreddit': 'transgender', 'title': 'Another California trans student attacked, trans community responds: #JD4PJI', 'created': 1384869314.0}"
2013-11-19 12:48:57,1qz1dw,0,10,,transgender,Why should we never forget? - Time 4 T marks the Transgender day of Rememberance,1384890537.0,"{'created_utc': 1384865337, 'id': '1qz1dw', 'num_comments': 0, 'score': 10, 'selftext': '', 'subreddit': 'transgender', 'title': 'Why should we never forget? - Time 4 T marks the Transgender day of Rememberance', 'created': 1384890537.0}"
2013-11-19 19:23:57,1qzxt9,6,32,,transgender,"Not directly Trans, but Nick Pitera really impresses me how well he can pull off a Female voice given his speaking voice.",1384914237.0,"{'created_utc': 1384889037, 'id': '1qzxt9', 'num_comments': 6, 'score': 32, 'selftext': '', 'subreddit': 'transgender', 'title': 'Not directly Trans, but Nick Pitera really impresses me how well he can pull off a Female voice given his speaking voice.', 'created': 1384914237.0}"
2013-11-19 23:34:03,1r0m45,1,25,,transgender,Why Transgender Inclusion is Good for Business,1384929243.0,"{'created_utc': 1384904043, 'id': '1r0m45', 'num_comments': 1, 'score': 25, 'selftext': '', 'subreddit': 'transgender', 'title': 'Why Transgender Inclusion is Good for Business', 'created': 1384929243.0}"
2013-11-19 23:44:10,1r0n1f,1,11,,transgender,Suspect in Islan Nettles Case Released,1384929850.0,"{'created_utc': 1384904650, 'id': '1r0n1f', 'num_comments': 1, 'score': 11, 'selftext': '', 'subreddit': 'transgender', 'title': 'Suspect in Islan Nettles Case Released', 'created': 1384929850.0}"
2013-11-20 00:36:01,1r0rrw,13,44,,transgender,CBS Show Mike and Molly Airs Super-Transphobic Episode,1384932961.0,"{'created_utc': 1384907761, 'id': '1r0rrw', 'num_comments': 13, 'score': 44, 'selftext': '', 'subreddit': 'transgender', 'title': 'CBS Show Mike and Molly Airs Super-Transphobic Episode', 'created': 1384932961.0}"
2013-11-20 12:33:48,1r1zq8,0,55,,transgender,Transgender Day of Remembrance (TDOR) in Second Life,1384976028.0,"{'created_utc': 1384950828, 'id': '1r1zq8', 'num_comments': 0, 'score': 55, 'selftext': '', 'subreddit': 'transgender', 'title': 'Transgender Day of Remembrance (TDOR) in Second Life', 'created': 1384976028.0}"
2013-11-20 12:57:02,1r20rw,0,6,,transgender,Action: Judgment Day For The Pacific Justice Institute - #JD4PJI,1384977422.0,"{'created_utc': 1384952222, 'id': '1r20rw', 'num_comments': 0, 'score': 6, 'selftext': '', 'subreddit': 'transgender', 'title': 'Action: Judgment Day For The Pacific Justice Institute - #JD4PJI', 'created': 1384977422.0}"
2013-11-20 15:11:04,1r28xm,0,1,,transgender,"Transgender Forum Support and Discussion Group #28 - Show Notes 18th Nov 2013 - Ice Cream and Pickles, IPL or Electrolysis?! Watch now!",1384985464.0,"{'created_utc': 1384960264, 'id': '1r28xm', 'num_comments': 0, 'score': 1, 'selftext': '', 'subreddit': 'transgender', 'title': 'Transgender Forum Support and Discussion Group #28 - Show Notes 18th Nov 2013 - Ice Cream and Pickles, IPL or Electrolysis?! Watch now!', 'created': 1384985464.0}"
2013-11-20 15:50:38,1r2c4l,0,6,,transgender,Pain,1384987838.0,"{'created_utc': 1384962638, 'id': '1r2c4l', 'num_comments': 0, 'score': 6, 'selftext': '', 'subreddit': 'transgender', 'title': 'Pain', 'created': 1384987838.0}"
2013-11-20 17:51:20,1r2msm,6,11,,transgender,"We'll Stand By You - much love to my T brothers and sisters, today and every day",1384995080.0,"{'created_utc': 1384969880, 'id': '1r2msm', 'num_comments': 6, 'score': 11, 'selftext': '', 'subreddit': 'transgender', 'title': ""We'll Stand By You - much love to my T brothers and sisters, today and every day"", 'created': 1384995080.0}"
2013-11-20 20:50:45,1r33p2,0,5,,transgender,Transgender Day of Remembrance: Assigned Sex Documentary,1385005845.0,"{'created_utc': 1384980645, 'id': '1r33p2', 'num_comments': 0, 'score': 5, 'selftext': '', 'subreddit': 'transgender', 'title': 'Transgender Day of Remembrance: Assigned Sex Documentary', 'created': 1385005845.0}"
2013-11-20 21:23:56,1r36y9,1,11,,transgender,"WATCH: Inspiring, young transgender advocate speaks out on Transgender Day of Remembrance…",1385007836.0,"{'created_utc': 1384982636, 'id': '1r36y9', 'num_comments': 1, 'score': 11, 'selftext': '', 'subreddit': 'transgender', 'title': 'WATCH: Inspiring, young transgender advocate speaks out on Transgender Day of Remembrance…', 'created': 1385007836.0}"
2013-11-20 21:50:55,1r39lx,1,50,,transgender,House Across From Westboro Baptist Church Gets A Makeover For Trans Day Of Remembrance,1385009455.0,"{'created_utc': 1384984255, 'id': '1r39lx', 'num_comments': 1, 'score': 50, 'selftext': '', 'subreddit': 'transgender', 'title': 'House Across From Westboro Baptist Church Gets A Makeover For Trans Day Of Remembrance', 'created': 1385009455.0}"
2013-11-20 22:04:00,1r3ark,1,28,,transgender,Transgender Day of Remembrance: Those We've Lost in 2013,1385010240.0,"{'created_utc': 1384985040, 'id': '1r3ark', 'num_comments': 1, 'score': 28, 'selftext': '', 'subreddit': 'transgender', 'title': ""Transgender Day of Remembrance: Those We've Lost in 2013"", 'created': 1385010240.0}"
2013-11-20 22:46:07,1r3en2,4,10,,transgender,"Great infographics about transgender pride, allies, stats and the right grammar",1385012767.0,"{'created_utc': 1384987567, 'id': '1r3en2', 'num_comments': 4, 'score': 10, 'selftext': '', 'subreddit': 'transgender', 'title': 'Great infographics about transgender pride, allies, stats and the right grammar', 'created': 1385012767.0}"
2013-11-20 23:24:26,1r3i2f,1,18,,transgender,The White House's Transgender Day of Remembrance Statement,1385015066.0,"{'created_utc': 1384989866, 'id': '1r3i2f', 'num_comments': 1, 'score': 18, 'selftext': '', 'subreddit': 'transgender', 'title': ""The White House's Transgender Day of Remembrance Statement"", 'created': 1385015066.0}"
2013-11-21 00:13:33,1r3mc1,1,47,,transgender,Saw this at my university campus: Trans* Day of Remembrance,1385018013.0,"{'created_utc': 1384992813, 'id': '1r3mc1', 'num_comments': 1, 'score': 47, 'selftext': '', 'subreddit': 'transgender', 'title': 'Saw this at my university campus: Trans* Day of Remembrance', 'created': 1385018013.0}"
2013-11-21 01:34:01,1r3t4v,0,4,,transgender,Transgender Day of Remembrance Vigil - (3:08),1385022841.0,"{'created_utc': 1384997641, 'id': '1r3t4v', 'num_comments': 0, 'score': 4, 'selftext': '', 'subreddit': 'transgender', 'title': 'Transgender Day of Remembrance Vigil - (3:08)', 'created': 1385022841.0}"
2013-11-21 01:50:58,1r3ulu,17,106,,transgender,My friend works for the VA. He forwarded me an email that all employees got on TDoR,1385023858.0,"{'created_utc': 1384998658, 'id': '1r3ulu', 'num_comments': 17, 'score': 106, 'selftext': '', 'subreddit': 'transgender', 'title': 'My friend works for the VA. He forwarded me an email that all employees got on TDoR', 'created': 1385023858.0}"
