created_utc,id,num_comments,score,selftext,subreddit,title,created,d_
2013-11-08 21:34:14,1q7dl7,0,1,,transgender,Transgender Forum • View topic - Grand Theft Auto - Trannies? - Post ops - truly Rock Bottom!,1383971654.0,"{'created_utc': 1383946454, 'id': '1q7dl7', 'num_comments': 0, 'score': 1, 'selftext': '', 'subreddit': 'transgender', 'title': 'Transgender Forum • View topic - Grand Theft Auto - Trannies? - Post ops - truly Rock Bottom!', 'created': 1383971654.0}"
2013-11-08 23:55:30,1q7os0,1,8,,transgender,Will Trans Folk Become ENDA Bargaining Chip?,1383980130.0,"{'created_utc': 1383954930, 'id': '1q7os0', 'num_comments': 1, 'score': 8, 'selftext': '', 'subreddit': 'transgender', 'title': 'Will Trans Folk Become ENDA Bargaining Chip?', 'created': 1383980130.0}"
2013-11-08 23:56:58,1q7ovz,3,9,,transgender,GLAAD Appoints First Transgender Co-Chair,1383980218.0,"{'created_utc': 1383955018, 'id': '1q7ovz', 'num_comments': 3, 'score': 9, 'selftext': '', 'subreddit': 'transgender', 'title': 'GLAAD Appoints First Transgender Co-Chair', 'created': 1383980218.0}"
2013-11-09 02:30:55,1q7zlm,0,1,,transgender,What's your take? Why hasn't protection for lbgt employees within the defense industry been enacted?,1383989455.0,"{'created_utc': 1383964255, 'id': '1q7zlm', 'num_comments': 0, 'score': 1, 'selftext': '', 'subreddit': 'transgender', 'title': ""What's your take? Why hasn't protection for lbgt employees within the defense industry been enacted?"", 'created': 1383989455.0}"
2013-11-09 02:31:44,1q7zne,0,12,,transgender,"Update of California referendum targeting trans children| If you're in California this weekend, YOUR HELP IS NEEDED!",1383989504.0,"{'created_utc': 1383964304, 'id': '1q7zne', 'num_comments': 0, 'score': 12, 'selftext': '', 'subreddit': 'transgender', 'title': ""Update of California referendum targeting trans children| If you're in California this weekend, YOUR HELP IS NEEDED!"", 'created': 1383989504.0}"
2013-11-09 03:35:55,1q83x8,11,32,,transgender,What Would You Do?: Carmen Carrera as transgender waitress insulted at a restaurant,1383993355.0,"{'created_utc': 1383968155, 'id': '1q83x8', 'num_comments': 11, 'score': 32, 'selftext': '', 'subreddit': 'transgender', 'title': 'What Would You Do?: Carmen Carrera as transgender waitress insulted at a restaurant', 'created': 1383993355.0}"
2013-11-09 03:54:37,1q854h,3,0,,transgender,Andain - Turn Up The Sound (tyDi Remix),1383994477.0,"{'created_utc': 1383969277, 'id': '1q854h', 'num_comments': 3, 'score': 0, 'selftext': '', 'subreddit': 'transgender', 'title': 'Andain - Turn Up The Sound (tyDi Remix)', 'created': 1383994477.0}"
2013-11-09 05:33:18,1q8axa,0,1,,transgender,Watch Her Fly! Breathtaking Carmen Carrera May Be the First Transgender Victoria’s Secret Runway Model and Could Get Angel Wings,1384000398.0,"{'created_utc': 1383975198, 'id': '1q8axa', 'num_comments': 0, 'score': 1, 'selftext': '', 'subreddit': 'transgender', 'title': 'Watch Her Fly! Breathtaking Carmen Carrera May Be the First Transgender Victoria’s Secret Runway Model and Could Get Angel Wings', 'created': 1384000398.0}"
2013-11-09 06:16:56,1q8dah,0,0,,transgender,(UPDATE 2 -- Jury convicts murderer) Cleveland trans woman found brutally murdered; newspaper hit by HRC for insulting coverage,1384003016.0,"{'created_utc': 1383977816, 'id': '1q8dah', 'num_comments': 0, 'score': 0, 'selftext': '', 'subreddit': 'transgender', 'title': '(UPDATE 2 -- Jury convicts murderer) Cleveland trans woman found brutally murdered; newspaper hit by HRC for insulting coverage', 'created': 1384003016.0}"
2013-11-09 06:19:29,1q8df6,0,15,,transgender,WSVN-TV - Miami Beach Police announces new transgender policy,1384003169.0,"{'created_utc': 1383977969, 'id': '1q8df6', 'num_comments': 0, 'score': 15, 'selftext': '', 'subreddit': 'transgender', 'title': 'WSVN-TV - Miami Beach Police announces new transgender policy', 'created': 1384003169.0}"
2013-11-09 16:21:47,1q91bl,2,78,,transgender,"""Sophia is written [so] the audience can really empathize with [her]; all of the sudden they’re empathizing with a real Trans person. For Trans folks, who need to see representations of people who are like them, that’s when it becomes really important"" Interview with Laverne Cox",1384039307.0,"{'created_utc': 1384014107, 'id': '1q91bl', 'num_comments': 2, 'score': 78, 'selftext': '', 'subreddit': 'transgender', 'title': '""Sophia is written [so] the audience can really empathize with [her]; all of the sudden they’re empathizing with a real Trans person. For Trans folks, who need to see representations of people who are like them, that’s when it becomes really important"" Interview with Laverne Cox', 'created': 1384039307.0}"
2013-11-09 19:19:18,1q9dkz,0,3,,transgender,A great article about the 2013 Gender Expansion Conference - the first trans health conference in Montana,1384049958.0,"{'created_utc': 1384024758, 'id': '1q9dkz', 'num_comments': 0, 'score': 3, 'selftext': '', 'subreddit': 'transgender', 'title': 'A great article about the 2013 Gender Expansion Conference - the first trans health conference in Montana', 'created': 1384049958.0}"
2013-11-09 21:18:02,1q9m4m,1,8,,transgender,"A Case Study in Transmisogyny: Lex and Terry ""I'd Have Shot His Ass, Too""",1384057082.0,"{'created_utc': 1384031882, 'id': '1q9m4m', 'num_comments': 1, 'score': 8, 'selftext': '', 'subreddit': 'transgender', 'title': 'A Case Study in Transmisogyny: Lex and Terry ""I\'d Have Shot His Ass, Too""', 'created': 1384057082.0}"
2013-11-10 08:38:27,1qaqtt,0,3,,transgender,Killers of trans women in NYC and Cleveland convicted,1384097907.0,"{'created_utc': 1384072707, 'id': '1qaqtt', 'num_comments': 0, 'score': 3, 'selftext': '', 'subreddit': 'transgender', 'title': 'Killers of trans women in NYC and Cleveland convicted', 'created': 1384097907.0}"
2013-11-10 08:42:59,1qaqyr,2,12,,transgender,Transgender man fights for free breast removal -,1384098179.0,"{'created_utc': 1384072979, 'id': '1qaqyr', 'num_comments': 2, 'score': 12, 'selftext': '', 'subreddit': 'transgender', 'title': 'Transgender man fights for free breast removal -', 'created': 1384098179.0}"
2013-11-10 08:43:59,1qar02,0,18,,transgender,Atlanta's Don Pollo Nightclub Discriminates Against Transgender Customer,1384098239.0,"{'created_utc': 1384073039, 'id': '1qar02', 'num_comments': 0, 'score': 18, 'selftext': '', 'subreddit': 'transgender', 'title': ""Atlanta's Don Pollo Nightclub Discriminates Against Transgender Customer"", 'created': 1384098239.0}"
2013-11-10 17:10:32,1qbbt4,9,5,,transgender,On crossdreaming lesbians and the sex life of trans women (autogynephilia and autoandrophilia revisited),1384128632.0,"{'created_utc': 1384103432, 'id': '1qbbt4', 'num_comments': 9, 'score': 5, 'selftext': '', 'subreddit': 'transgender', 'title': 'On crossdreaming lesbians and the sex life of trans women (autogynephilia and autoandrophilia revisited)', 'created': 1384128632.0}"
2013-11-10 18:52:59,1qbjg4,0,1,,transgender,California school students and faculty support genderqueer student set on fire who continues misgendered in press,1384134779.0,"{'created_utc': 1384109579, 'id': '1qbjg4', 'num_comments': 0, 'score': 1, 'selftext': '', 'subreddit': 'transgender', 'title': 'California school students and faculty support genderqueer student set on fire who continues misgendered in press', 'created': 1384134779.0}"
2013-11-10 19:12:31,1qbl3j,12,50,,transgender,California school students &amp; faculty support genderqueer student set on fire &amp; who continues to be misgendered in the press,1384135951.0,"{'created_utc': 1384110751, 'id': '1qbl3j', 'num_comments': 12, 'score': 50, 'selftext': '', 'subreddit': 'transgender', 'title': 'California school students &amp; faculty support genderqueer student set on fire &amp; who continues to be misgendered in the press', 'created': 1384135951.0}"
2013-11-10 23:15:09,1qc52k,6,12,,transgender,3D Printing organs coming soon? :D,1384150509.0,"{'created_utc': 1384125309, 'id': '1qc52k', 'num_comments': 6, 'score': 12, 'selftext': '', 'subreddit': 'transgender', 'title': '3D Printing organs coming soon? :D', 'created': 1384150509.0}"
2013-11-10 23:31:43,1qc6bj,0,1,,transgender,Rainbow Love . . . Katie McKinney Fox,1384151503.0,"{'created_utc': 1384126303, 'id': '1qc6bj', 'num_comments': 0, 'score': 1, 'selftext': '', 'subreddit': 'transgender', 'title': 'Rainbow Love . . . Katie McKinney Fox', 'created': 1384151503.0}"
2013-11-11 00:44:20,1qcbw5,4,28,,transgender,"Atlanta bar refuses to serve transgender customer and when confronted owner asks ""what's wrong with that"" and insists they are a ""private business"" and that they can discriminate.",1384155860.0,"{'created_utc': 1384130660, 'id': '1qcbw5', 'num_comments': 4, 'score': 28, 'selftext': '', 'subreddit': 'transgender', 'title': 'Atlanta bar refuses to serve transgender customer and when confronted owner asks ""what\'s wrong with that"" and insists they are a ""private business"" and that they can discriminate.', 'created': 1384155860.0}"
2013-11-11 03:32:59,1qcorh,20,40,,transgender,Hate group claims to have submitted enough signatures to overturn California law protecting trans youth. Opens door to possible vote.,1384165979.0,"{'created_utc': 1384140779, 'id': '1qcorh', 'num_comments': 20, 'score': 40, 'selftext': '', 'subreddit': 'transgender', 'title': 'Hate group claims to have submitted enough signatures to overturn California law protecting trans youth. Opens door to possible vote.', 'created': 1384165979.0}"
2013-11-11 04:12:58,1qcrvp,0,13,,transgender,History of Trans Day of Remembrance,1384168378.0,"{'created_utc': 1384143178, 'id': '1qcrvp', 'num_comments': 0, 'score': 13, 'selftext': '', 'subreddit': 'transgender', 'title': 'History of Trans Day of Remembrance', 'created': 1384168378.0}"
2013-11-11 04:20:59,1qcsfy,0,7,,transgender,"I'm having gender reassignment surgery (a ""sex change operation"") one month from today. My friends decided this would be an appropriate gift. I could not stop laughing!",1384168859.0,"{'created_utc': 1384143659, 'id': '1qcsfy', 'num_comments': 0, 'score': 7, 'selftext': '', 'subreddit': 'transgender', 'title': 'I\'m having gender reassignment surgery (a ""sex change operation"") one month from today. My friends decided this would be an appropriate gift. I could not stop laughing!', 'created': 1384168859.0}"
2013-11-11 07:46:02,1qd49x,4,3,,transgender,Transgender Awareness Week in My Community,1384181162.0,"{'created_utc': 1384155962, 'id': '1qd49x', 'num_comments': 4, 'score': 3, 'selftext': '', 'subreddit': 'transgender', 'title': 'Transgender Awareness Week in My Community', 'created': 1384181162.0}"
2013-11-11 10:45:53,1qdb2r,0,8,,transgender,Transgender Denied Treatment at the University of Nebraska Medical Center,1384191953.0,"{'created_utc': 1384166753, 'id': '1qdb2r', 'num_comments': 0, 'score': 8, 'selftext': '', 'subreddit': 'transgender', 'title': 'Transgender Denied Treatment at the University of Nebraska Medical Center', 'created': 1384191953.0}"
2013-11-11 12:08:45,1qde2u,0,1,,transgender,Transgender Join us on Mondays for Live Skype Support from 9.30pm Tonight in the first part 'Labels Simplified' (with Sam and the Gang) 'Labels Part 2' (advanced with Rebecca - for Part 1 see last week's Vlog on youtube.com/transgenderzone) and the Latest News and your Chat Room Comments!,1384196925.0,"{'created_utc': 1384171725, 'id': '1qde2u', 'num_comments': 0, 'score': 1, 'selftext': '', 'subreddit': 'transgender', 'title': ""Transgender Join us on Mondays for Live Skype Support from 9.30pm Tonight in the first part 'Labels Simplified' (with Sam and the Gang) 'Labels Part 2' (advanced with Rebecca - for Part 1 see last week's Vlog on youtube.com/transgenderzone) and the Latest News and your Chat Room Comments!"", 'created': 1384196925.0}"
2013-11-11 14:36:37,1qdlmi,3,11,,transgender,What is gender artifactualism?,1384205797.0,"{'created_utc': 1384180597, 'id': '1qdlmi', 'num_comments': 3, 'score': 11, 'selftext': '', 'subreddit': 'transgender', 'title': 'What is gender artifactualism?', 'created': 1384205797.0}"
2013-11-11 17:35:17,1qdzov,1,31,,transgender,"Transgender Veterans Fight for Military Paperwork to Match New Gender, Name",1384216517.0,"{'created_utc': 1384191317, 'id': '1qdzov', 'num_comments': 1, 'score': 31, 'selftext': '', 'subreddit': 'transgender', 'title': 'Transgender Veterans Fight for Military Paperwork to Match New Gender, Name', 'created': 1384216517.0}"
2013-11-11 19:28:57,1qe9yt,0,1,,transgender,Woman denied Kidney transplant after University of Nebraska Medical Center learned she's transgender,1384223337.0,"{'created_utc': 1384198137, 'id': '1qe9yt', 'num_comments': 0, 'score': 1, 'selftext': '', 'subreddit': 'transgender', 'title': ""Woman denied Kidney transplant after University of Nebraska Medical Center learned she's transgender"", 'created': 1384223337.0}"
2013-11-11 22:44:02,1qesrq,2,46,,transgender,It's NOT my job to educate the entire UNIVERSITY,1384235042.0,"{'created_utc': 1384209842, 'id': '1qesrq', 'num_comments': 2, 'score': 46, 'selftext': '', 'subreddit': 'transgender', 'title': ""It's NOT my job to educate the entire UNIVERSITY"", 'created': 1384235042.0}"
2013-11-11 23:21:54,1qew88,0,8,,transgender,Nine Ways Journalists Can Do a Better Job of Covering Transgender Subjects,1384237314.0,"{'created_utc': 1384212114, 'id': '1qew88', 'num_comments': 0, 'score': 8, 'selftext': '', 'subreddit': 'transgender', 'title': 'Nine Ways Journalists Can Do a Better Job of Covering Transgender Subjects', 'created': 1384237314.0}"
2013-11-12 04:09:54,1qfkth,2,1,,transgender,We're doing a study on safety in the trans* and gender variant community. Please help us out by taking a short survey!,1384254594.0,"{'created_utc': 1384229394, 'id': '1qfkth', 'num_comments': 2, 'score': 1, 'selftext': '', 'subreddit': 'transgender', 'title': ""We're doing a study on safety in the trans* and gender variant community. Please help us out by taking a short survey!"", 'created': 1384254594.0}"
2013-11-12 13:12:16,1qgbh3,1,40,,transgender,Restoring your faith in humanity: supporting Jane Doe,1384287136.0,"{'created_utc': 1384261936, 'id': '1qgbh3', 'num_comments': 1, 'score': 40, 'selftext': '', 'subreddit': 'transgender', 'title': 'Restoring your faith in humanity: supporting Jane Doe', 'created': 1384287136.0}"
2013-11-12 15:07:12,1qgil3,0,2,,transgender,Woman who claimed Nebraska Medical Center denied her treatment has taken Hir post down,1384294032.0,"{'created_utc': 1384268832, 'id': '1qgil3', 'num_comments': 0, 'score': 2, 'selftext': '', 'subreddit': 'transgender', 'title': 'Woman who claimed Nebraska Medical Center denied her treatment has taken Hir post down', 'created': 1384294032.0}"
2013-11-12 15:15:28,1qgj8b,0,1,,transgender,Trans Billionaire Reporting For Duty,1384294528.0,"{'created_utc': 1384269328, 'id': '1qgj8b', 'num_comments': 0, 'score': 1, 'selftext': '', 'subreddit': 'transgender', 'title': 'Trans Billionaire Reporting For Duty', 'created': 1384294528.0}"
2013-11-12 15:20:28,1qgjmb,7,16,,transgender,Trans Billionaire Reporting For Duty,1384294828.0,"{'created_utc': 1384269628, 'id': '1qgjmb', 'num_comments': 7, 'score': 16, 'selftext': '', 'subreddit': 'transgender', 'title': 'Trans Billionaire Reporting For Duty', 'created': 1384294828.0}"
2013-11-12 18:33:14,1qh0db,0,9,,transgender,"""Does Pacific Justice have any data on how often we're beating cis women in restrooms, threatening them, and telling them they have to leave? Or just some more videos about how nothing happened?""",1384306394.0,"{'created_utc': 1384281194, 'id': '1qh0db', 'num_comments': 0, 'score': 9, 'selftext': '', 'subreddit': 'transgender', 'title': '""Does Pacific Justice have any data on how often we\'re beating cis women in restrooms, threatening them, and telling them they have to leave? Or just some more videos about how nothing happened?""', 'created': 1384306394.0}"
2013-11-12 19:04:08,1qh38m,6,91,,transgender,Transgender women in women’s restrooms: A purely imagined harm,1384308248.0,"{'created_utc': 1384283048, 'id': '1qh38m', 'num_comments': 6, 'score': 91, 'selftext': '', 'subreddit': 'transgender', 'title': 'Transgender women in women’s restrooms: A purely imagined harm', 'created': 1384308248.0}"
2013-11-12 20:45:44,1qhco6,12,0,,transgender,Meet Virgin's transphobic 404 page. (Make sure to read the text),1384314344.0,"{'created_utc': 1384289144, 'id': '1qhco6', 'num_comments': 12, 'score': 0, 'selftext': '', 'subreddit': 'transgender', 'title': ""Meet Virgin's transphobic 404 page. (Make sure to read the text)"", 'created': 1384314344.0}"
2013-11-12 21:38:42,1qhi06,0,5,,transgender,Dalhousie trans student claims discrimination from cafeteria staff,1384317522.0,"{'created_utc': 1384292322, 'id': '1qhi06', 'num_comments': 0, 'score': 5, 'selftext': '', 'subreddit': 'transgender', 'title': 'Dalhousie trans student claims discrimination from cafeteria staff', 'created': 1384317522.0}"
2013-11-12 21:41:02,1qhi81,0,3,,transgender,Justice for Jessica rally at Dalhousie,1384317662.0,"{'created_utc': 1384292462, 'id': '1qhi81', 'num_comments': 0, 'score': 3, 'selftext': '', 'subreddit': 'transgender', 'title': 'Justice for Jessica rally at Dalhousie', 'created': 1384317662.0}"
2013-11-12 21:41:50,1qhiaf,0,1,,transgender,Rally in support of Jessica Dempsey calls for end to transphobia at Dalhousie University,1384317710.0,"{'created_utc': 1384292510, 'id': '1qhiaf', 'num_comments': 0, 'score': 1, 'selftext': '', 'subreddit': 'transgender', 'title': 'Rally in support of Jessica Dempsey calls for end to transphobia at Dalhousie University', 'created': 1384317710.0}"
2013-11-12 21:48:37,1qhiys,0,7,,transgender,This is the time in my life I get to become whole become me. I want to embrace this experience. Not being the person who has to educate the entire university.,1384318117.0,"{'created_utc': 1384292917, 'id': '1qhiys', 'num_comments': 0, 'score': 7, 'selftext': '', 'subreddit': 'transgender', 'title': 'This is the time in my life I get to become whole become me. I want to embrace this experience. Not being the person who has to educate the entire university.', 'created': 1384318117.0}"
2013-11-12 23:13:58,1qhr0a,0,4,,transgender,"glaad | Meet Stephen Alexander, America's first openly trans high school coach",1384323238.0,"{'created_utc': 1384298038, 'id': '1qhr0a', 'num_comments': 0, 'score': 4, 'selftext': '', 'subreddit': 'transgender', 'title': ""glaad | Meet Stephen Alexander, America's first openly trans high school coach"", 'created': 1384323238.0}"
2013-11-13 03:51:17,1qifaf,0,2,,transgender,The Trade- The Trans women of Christopher St,1384339877.0,"{'created_utc': 1384314677, 'id': '1qifaf', 'num_comments': 0, 'score': 2, 'selftext': '', 'subreddit': 'transgender', 'title': 'The Trade- The Trans women of Christopher St', 'created': 1384339877.0}"
2013-11-13 11:29:12,1qj2tl,1,9,,transgender,ACT govt considers third gender category,1384367352.0,"{'created_utc': 1384342152, 'id': '1qj2tl', 'num_comments': 1, 'score': 9, 'selftext': '', 'subreddit': 'transgender', 'title': 'ACT govt considers third gender category', 'created': 1384367352.0}"
2013-11-13 13:00:28,1qj6r8,8,11,,transgender,"More transphobic dribble from Bill O'riley. This time ""transgender inclusive bathrooms are like hooters without wings"".",1384372828.0,"{'created_utc': 1384347628, 'id': '1qj6r8', 'num_comments': 8, 'score': 11, 'selftext': '', 'subreddit': 'transgender', 'title': 'More transphobic dribble from Bill O\'riley. This time ""transgender inclusive bathrooms are like hooters without wings"".', 'created': 1384372828.0}"
2013-11-13 13:13:56,1qj7h5,9,3,,transgender,Man defending his transgender girlfriend slashed by 350-pound man at Greenwich Village McDonald’s,1384373636.0,"{'created_utc': 1384348436, 'id': '1qj7h5', 'num_comments': 9, 'score': 3, 'selftext': '', 'subreddit': 'transgender', 'title': 'Man defending his transgender girlfriend slashed by 350-pound man at Greenwich Village McDonald’s', 'created': 1384373636.0}"
2013-11-13 16:17:52,1qjk3o,0,42,,transgender,238 Trans People Murdered Worldwide In The Past Year,1384384672.0,"{'created_utc': 1384359472, 'id': '1qjk3o', 'num_comments': 0, 'score': 42, 'selftext': '', 'subreddit': 'transgender', 'title': '238 Trans People Murdered Worldwide In The Past Year', 'created': 1384384672.0}"
2013-11-13 16:49:31,1qjmrx,0,1,,transgender,"Against Me! finally unleashes the full band version of ""F-CKMYLIFE666"" from their forthcoming LP ""Transgender Dysphoria Blues""",1384386571.0,"{'created_utc': 1384361371, 'id': '1qjmrx', 'num_comments': 0, 'score': 1, 'selftext': '', 'subreddit': 'transgender', 'title': 'Against Me! finally unleashes the full band version of ""F-CKMYLIFE666"" from their forthcoming LP ""Transgender Dysphoria Blues""', 'created': 1384386571.0}"
2013-11-13 18:30:01,1qjvpk,4,10,,transgender,Colleen Francis and the infamous Evergreen State College incident,1384392601.0,"{'created_utc': 1384367401, 'id': '1qjvpk', 'num_comments': 4, 'score': 10, 'selftext': '', 'subreddit': 'transgender', 'title': 'Colleen Francis and the infamous Evergreen State College incident', 'created': 1384392601.0}"
2013-11-13 18:45:47,1qjx40,0,1,,transgender,Transgender Forum • View topic - Skype Support and Discussion Group Show Notes 11th Nov 2013 Transgender Labels Tutorial for Beginners! Ideal for those who are not trans to educate themselves.,1384393547.0,"{'created_utc': 1384368347, 'id': '1qjx40', 'num_comments': 0, 'score': 1, 'selftext': '', 'subreddit': 'transgender', 'title': 'Transgender Forum • View topic - Skype Support and Discussion Group Show Notes 11th Nov 2013 Transgender Labels Tutorial for Beginners! Ideal for those who are not trans to educate themselves.', 'created': 1384393547.0}"
2013-11-13 20:22:34,1qk5t5,5,52,,transgender,16 versus 19 (MtF timeline). HRT can change things a bit!,1384399354.0,"{'created_utc': 1384374154, 'id': '1qk5t5', 'num_comments': 5, 'score': 52, 'selftext': '', 'subreddit': 'transgender', 'title': '16 versus 19 (MtF timeline). HRT can change things a bit!', 'created': 1384399354.0}"
2013-11-13 22:08:12,1qkg36,4,29,,transgender,Denver queers picket gay bar with transphobic door policy.,1384405692.0,"{'created_utc': 1384380492, 'id': '1qkg36', 'num_comments': 4, 'score': 29, 'selftext': '', 'subreddit': 'transgender', 'title': 'Denver queers picket gay bar with transphobic door policy.', 'created': 1384405692.0}"
2013-11-13 22:18:47,1qkh31,4,2,,transgender,W. Kamua Bell on the Difference Between Sex and Gender,1384406327.0,"{'created_utc': 1384381127, 'id': '1qkh31', 'num_comments': 4, 'score': 2, 'selftext': '', 'subreddit': 'transgender', 'title': 'W. Kamua Bell on the Difference Between Sex and Gender', 'created': 1384406327.0}"
2013-11-13 22:21:15,1qkhbn,0,2,,transgender,"Riki Wilchins: Maxwell Klinger, Where Are you?",1384406475.0,"{'created_utc': 1384381275, 'id': '1qkhbn', 'num_comments': 0, 'score': 2, 'selftext': '', 'subreddit': 'transgender', 'title': 'Riki Wilchins: Maxwell Klinger, Where Are you?', 'created': 1384406475.0}"
2013-11-13 23:28:27,1qknjb,0,2,,transgender,Rally against transphobia inspired by Dal student's complaints,1384410507.0,"{'created_utc': 1384385307, 'id': '1qknjb', 'num_comments': 0, 'score': 2, 'selftext': '', 'subreddit': 'transgender', 'title': ""Rally against transphobia inspired by Dal student's complaints"", 'created': 1384410507.0}"
2013-11-13 23:38:31,1qkog0,9,1,,transgender,"Alissah Brooks, Transgender Woman, Allegedly Denied Entry To Don Pollo Bar &amp; Grill [UPDATED]",1384411111.0,"{'created_utc': 1384385911, 'id': '1qkog0', 'num_comments': 9, 'score': 1, 'selftext': '', 'subreddit': 'transgender', 'title': 'Alissah Brooks, Transgender Woman, Allegedly Denied Entry To Don Pollo Bar &amp; Grill [UPDATED]', 'created': 1384411111.0}"
2013-11-14 00:48:59,1qkuip,4,6,,transgender,A friend of mine is starting a trans culture magazine and would love your support!,1384415339.0,"{'created_utc': 1384390139, 'id': '1qkuip', 'num_comments': 4, 'score': 6, 'selftext': '', 'subreddit': 'transgender', 'title': 'A friend of mine is starting a trans culture magazine and would love your support!', 'created': 1384415339.0}"
2013-11-14 07:09:19,1qlmy0,2,23,,transgender,Add intimidation to the lies and fraud of the anti-AB1266 effort as signature gatherer caught bullying a trans advocate,1384438159.0,"{'created_utc': 1384412959, 'id': '1qlmy0', 'num_comments': 2, 'score': 23, 'selftext': '', 'subreddit': 'transgender', 'title': 'Add intimidation to the lies and fraud of the anti-AB1266 effort as signature gatherer caught bullying a trans advocate', 'created': 1384438159.0}"
2013-11-14 12:56:39,1qm0fy,2,0,,transgender,Possible-repeal-of-transgender-student-law-would-not-change-existing-protections,1384458999.0,"{'created_utc': 1384433799, 'id': '1qm0fy', 'num_comments': 2, 'score': 0, 'selftext': '', 'subreddit': 'transgender', 'title': 'Possible-repeal-of-transgender-student-law-would-not-change-existing-protections', 'created': 1384458999.0}"
2013-11-14 13:07:42,1qm0yz,21,91,,transgender,Houston to house trans inmates according to their gender identity and not biological sex. Hurray!!!,1384459662.0,"{'created_utc': 1384434462, 'id': '1qm0yz', 'num_comments': 21, 'score': 91, 'selftext': '', 'subreddit': 'transgender', 'title': 'Houston to house trans inmates according to their gender identity and not biological sex. Hurray!!!', 'created': 1384459662.0}"
