created_utc,id,num_comments,score,selftext,subreddit,title,created,d_
2017-04-25 03:26:38,67e30s,8,5,,transgender,FDU Poll: Public Opinion Divided on Transgender Rights,1493115998.0,"{'created_utc': 1493090798, 'id': '67e30s', 'num_comments': 8, 'score': 5, 'selftext': '', 'subreddit': 'transgender', 'title': 'FDU Poll: Public Opinion Divided on Transgender Rights', 'created': 1493115998.0}"
2017-04-25 05:12:46,67ekfd,13,109,,transgender,Transgender woman denied food at soup kitchen because she was wearing a dress,1493122366.0,"{'created_utc': 1493097166, 'id': '67ekfd', 'num_comments': 13, 'score': 109, 'selftext': '', 'subreddit': 'transgender', 'title': 'Transgender woman denied food at soup kitchen because she was wearing a dress', 'created': 1493122366.0}"
2017-04-25 11:15:42,67fvgk,10,12,,transgender,Street Artist Blankets Fox Studio With Images Comparing Caitlyn Jenner to 'It',1493144142.0,"{'created_utc': 1493118942, 'id': '67fvgk', 'num_comments': 10, 'score': 12, 'selftext': '', 'subreddit': 'transgender', 'title': ""Street Artist Blankets Fox Studio With Images Comparing Caitlyn Jenner to 'It'"", 'created': 1493144142.0}"
2017-04-25 12:17:55,67g5sx,17,106,,transgender,"EXCLUSIVE: ""Matrix"" director Lana Wachowski on the Trump ""crisis""",1493147875.0,"{'created_utc': 1493122675, 'id': '67g5sx', 'num_comments': 17, 'score': 106, 'selftext': '', 'subreddit': 'transgender', 'title': 'EXCLUSIVE: ""Matrix"" director Lana Wachowski on the Trump ""crisis""', 'created': 1493147875.0}"
2017-04-25 14:55:22,67h1mn,19,126,,transgender,Study: Trans and Cisgender Kids Aren’t That Different,1493157322.0,"{'created_utc': 1493132122, 'id': '67h1mn', 'num_comments': 19, 'score': 126, 'selftext': '', 'subreddit': 'transgender', 'title': 'Study: Trans and Cisgender Kids Aren’t That Different', 'created': 1493157322.0}"
2017-04-25 15:42:02,67hcis,3,25,,transgender,TERF legal team attempts to CENSOR the TransAdvocate,1493160122.0,"{'created_utc': 1493134922, 'id': '67hcis', 'num_comments': 3, 'score': 25, 'selftext': '', 'subreddit': 'transgender', 'title': 'TERF legal team attempts to CENSOR the TransAdvocate', 'created': 1493160122.0}"
2017-04-25 16:30:30,67ho32,0,1,,transgender,[X-post r/ainbow] Trans kids 'never significantly differ' from cis kids of their gender new study finds.,1493163030.0,"{'created_utc': 1493137830, 'id': '67ho32', 'num_comments': 0, 'score': 1, 'selftext': '', 'subreddit': 'transgender', 'title': ""[X-post r/ainbow] Trans kids 'never significantly differ' from cis kids of their gender new study finds."", 'created': 1493163030.0}"
2017-04-25 16:45:19,67hrlk,2,24,,transgender,Russia’s new scapegoats -- about how Putin uses homophobia to stay in power,1493163919.0,"{'created_utc': 1493138719, 'id': '67hrlk', 'num_comments': 2, 'score': 24, 'selftext': '', 'subreddit': 'transgender', 'title': 'Russia’s new scapegoats -- about how Putin uses homophobia to stay in power', 'created': 1493163919.0}"
2017-04-25 18:20:01,67ieso,1,36,,transgender,"Taiwan's transgender ""hacker minister"" reshaping digital democracy",1493169601.0,"{'created_utc': 1493144401, 'id': '67ieso', 'num_comments': 1, 'score': 36, 'selftext': '', 'subreddit': 'transgender', 'title': 'Taiwan\'s transgender ""hacker minister"" reshaping digital democracy', 'created': 1493169601.0}"
2017-04-25 18:34:29,67iich,0,1,[deleted],transgender,Amazing ad from India promoting transgender rights.,1493170469.0,"{'created_utc': 1493145269, 'id': '67iich', 'num_comments': 0, 'score': 1, 'selftext': '[deleted]', 'subreddit': 'transgender', 'title': 'Amazing ad from India promoting transgender rights.', 'created': 1493170469.0}"
2017-04-25 20:38:47,67jc1d,7,26,,transgender,Texas Senate gives OK to bill curbing transgender bathroom access,1493177927.0,"{'created_utc': 1493152727, 'id': '67jc1d', 'num_comments': 7, 'score': 26, 'selftext': '', 'subreddit': 'transgender', 'title': 'Texas Senate gives OK to bill curbing transgender bathroom access', 'created': 1493177927.0}"
2017-04-25 23:19:38,67kazg,0,0,[deleted],transgender,[Satire]Debate OVER: There Are Only TWO Genders and SIX Planets,1493187578.0,"{'created_utc': 1493162378, 'id': '67kazg', 'num_comments': 0, 'score': 0, 'selftext': '[deleted]', 'subreddit': 'transgender', 'title': '[Satire]Debate OVER: There Are Only TWO Genders and SIX Planets', 'created': 1493187578.0}"
2017-04-26 02:45:49,67len8,2,12,[deleted],transgender,"A study finds that among older transgender adults, those who had served in the military reported fewer symptoms of depression and greater mental health-related quality of life.",1493199949.0,"{'created_utc': 1493174749, 'id': '67len8', 'num_comments': 2, 'score': 12, 'selftext': '[deleted]', 'subreddit': 'transgender', 'title': 'A study finds that among older transgender adults, those who had served in the military reported fewer symptoms of depression and greater mental health-related quality of life.', 'created': 1493199949.0}"
2017-04-26 03:17:45,67lkil,6,1,[deleted],transgender,Hormone Replacement Therapy will change your food preferences,1493201865.0,"{'created_utc': 1493176665, 'id': '67lkil', 'num_comments': 6, 'score': 1, 'selftext': '[deleted]', 'subreddit': 'transgender', 'title': 'Hormone Replacement Therapy will change your food preferences', 'created': 1493201865.0}"
2017-04-26 09:32:34,67n1rg,0,1,[deleted],transgender,Why Blaire White is Wrong About Social Justice,1493224354.0,"{'created_utc': 1493199154, 'id': '67n1rg', 'num_comments': 0, 'score': 1, 'selftext': '[deleted]', 'subreddit': 'transgender', 'title': 'Why Blaire White is Wrong About Social Justice', 'created': 1493224354.0}"
2017-04-26 12:17:17,67nqfm,0,1,[deleted],transgender,She is the first trans to get married in Italy,1493234237.0,"{'created_utc': 1493209037, 'id': '67nqfm', 'num_comments': 0, 'score': 1, 'selftext': '[deleted]', 'subreddit': 'transgender', 'title': 'She is the first trans to get married in Italy', 'created': 1493234237.0}"
2017-04-26 12:30:58,67nsxx,111,659,,transgender,Adam Savage tweeting support for trans and nonbinary people,1493235058.0,"{'created_utc': 1493209858, 'id': '67nsxx', 'num_comments': 111, 'score': 659, 'selftext': '', 'subreddit': 'transgender', 'title': 'Adam Savage tweeting support for trans and nonbinary people', 'created': 1493235058.0}"
2017-04-26 12:53:09,67nx3l,1,13,,transgender,SciShow and Gendered Language – Hank Green – Medium,1493236389.0,"{'created_utc': 1493211189, 'id': '67nx3l', 'num_comments': 1, 'score': 13, 'selftext': '', 'subreddit': 'transgender', 'title': 'SciShow and Gendered Language – Hank Green – Medium', 'created': 1493236389.0}"
2017-04-26 13:33:37,67o576,4,1,[deleted],transgender,She is the first trans to get married in Italy,1493238817.0,"{'created_utc': 1493213617, 'id': '67o576', 'num_comments': 4, 'score': 1, 'selftext': '[deleted]', 'subreddit': 'transgender', 'title': 'She is the first trans to get married in Italy', 'created': 1493238817.0}"
2017-04-26 18:32:25,67q3al,0,17,,transgender,"Just a reminder that in times of trouble, our community can be really amazing!",1493256745.0,"{'created_utc': 1493231545, 'id': '67q3al', 'num_comments': 0, 'score': 17, 'selftext': '', 'subreddit': 'transgender', 'title': 'Just a reminder that in times of trouble, our community can be really amazing!', 'created': 1493256745.0}"
2017-04-26 23:10:23,67rszu,0,1,,transgender,Facebook just committed suicide?,1493273423.0,"{'created_utc': 1493248223, 'id': '67rszu', 'num_comments': 0, 'score': 1, 'selftext': '', 'subreddit': 'transgender', 'title': 'Facebook just committed suicide?', 'created': 1493273423.0}"
2017-04-27 01:17:16,67shpp,0,2,,transgender,Are you a boy? Or are you a girl?,1493281036.0,"{'created_utc': 1493255836, 'id': '67shpp', 'num_comments': 0, 'score': 2, 'selftext': '', 'subreddit': 'transgender', 'title': 'Are you a boy? Or are you a girl?', 'created': 1493281036.0}"
2017-04-27 01:44:22,67smwj,0,0,[deleted],transgender,Transgender Gets Death Threats From Hate Mob,1493282662.0,"{'created_utc': 1493257462, 'id': '67smwj', 'num_comments': 0, 'score': 0, 'selftext': '[deleted]', 'subreddit': 'transgender', 'title': 'Transgender Gets Death Threats From Hate Mob', 'created': 1493282662.0}"
2017-04-27 02:20:50,67stti,3,8,,transgender,How the Family Research Council brand transgender children as dangerous,1493284850.0,"{'created_utc': 1493259650, 'id': '67stti', 'num_comments': 3, 'score': 8, 'selftext': '', 'subreddit': 'transgender', 'title': 'How the Family Research Council brand transgender children as dangerous', 'created': 1493284850.0}"
2017-04-27 02:57:49,67t0j9,0,1,[deleted],transgender,"Haha fuck you, you mental bastards",1493287069.0,"{'created_utc': 1493261869, 'id': '67t0j9', 'num_comments': 0, 'score': 1, 'selftext': '[deleted]', 'subreddit': 'transgender', 'title': 'Haha fuck you, you mental bastards', 'created': 1493287069.0}"
2017-04-27 03:27:22,67t5qv,0,1,[deleted],transgender,Really cleaver commercial involving a transgender person.,1493288842.0,"{'created_utc': 1493263642, 'id': '67t5qv', 'num_comments': 0, 'score': 1, 'selftext': '[deleted]', 'subreddit': 'transgender', 'title': 'Really cleaver commercial involving a transgender person.', 'created': 1493288842.0}"
2017-04-27 05:34:35,67tpk0,0,1,[deleted],transgender,Sexual debut.,1493296475.0,"{'created_utc': 1493271275, 'id': '67tpk0', 'num_comments': 0, 'score': 1, 'selftext': '[deleted]', 'subreddit': 'transgender', 'title': 'Sexual debut.', 'created': 1493296475.0}"
2017-04-27 07:18:37,67u3nx,1,1,[deleted],transgender,Norwegian researches give an excellent rebuttal of anti-transgender TERF attack,1493302717.0,"{'created_utc': 1493277517, 'id': '67u3nx', 'num_comments': 1, 'score': 1, 'selftext': '[deleted]', 'subreddit': 'transgender', 'title': 'Norwegian researches give an excellent rebuttal of anti-transgender TERF attack', 'created': 1493302717.0}"
2017-04-27 09:22:24,67uihs,2,11,,transgender,Norwegian researchers give an excellent rebuttal of anti-transgender TERF attack,1493310144.0,"{'created_utc': 1493284944, 'id': '67uihs', 'num_comments': 2, 'score': 11, 'selftext': '', 'subreddit': 'transgender', 'title': 'Norwegian researchers give an excellent rebuttal of anti-transgender TERF attack', 'created': 1493310144.0}"
2017-04-27 10:57:38,67uuvw,1,1,,transgender,(Before and after) Male to female transgender timeline HRT transition st...,1493315858.0,"{'created_utc': 1493290658, 'id': '67uuvw', 'num_comments': 1, 'score': 1, 'selftext': '', 'subreddit': 'transgender', 'title': '(Before and after) Male to female transgender timeline HRT transition st...', 'created': 1493315858.0}"
2017-04-27 12:11:53,67v6n5,37,147,,transgender,This doctor is working to get insurance companies informed about transgender and non-binary patients. We need more than two boxes and more doctors like him.,1493320313.0,"{'created_utc': 1493295113, 'id': '67v6n5', 'num_comments': 37, 'score': 147, 'selftext': '', 'subreddit': 'transgender', 'title': 'This doctor is working to get insurance companies informed about transgender and non-binary patients. We need more than two boxes and more doctors like him.', 'created': 1493320313.0}"
2017-04-27 12:12:22,67v6qf,0,4,,transgender,"This doctor is working to get more boxes for the many people that don't fit into the two available. ""Gender is not the same as karyotype or sex assigned at birth. Please don’t give doctors boxes to check."" We need more doctors like him.",1493320342.0,"{'created_utc': 1493295142, 'id': '67v6qf', 'num_comments': 0, 'score': 4, 'selftext': '', 'subreddit': 'transgender', 'title': 'This doctor is working to get more boxes for the many people that don\'t fit into the two available. ""Gender is not the same as karyotype or sex assigned at birth. Please don’t give doctors boxes to check."" We need more doctors like him.', 'created': 1493320342.0}"
2017-04-27 15:40:19,67weuh,1,68,,transgender,Trump bump? More transgender candidates seek public office,1493332819.0,"{'created_utc': 1493307619, 'id': '67weuh', 'num_comments': 1, 'score': 68, 'selftext': '', 'subreddit': 'transgender', 'title': 'Trump bump? More transgender candidates seek public office', 'created': 1493332819.0}"
2017-04-27 15:48:52,67wgzl,0,15,,transgender,The transgender politician fighting for LGBT rights in the Philippines,1493333332.0,"{'created_utc': 1493308132, 'id': '67wgzl', 'num_comments': 0, 'score': 15, 'selftext': '', 'subreddit': 'transgender', 'title': 'The transgender politician fighting for LGBT rights in the Philippines', 'created': 1493333332.0}"
2017-04-27 16:15:47,67wnom,5,20,,transgender,TSA puts out guidance for screening transgender passengers,1493334947.0,"{'created_utc': 1493309747, 'id': '67wnom', 'num_comments': 5, 'score': 20, 'selftext': '', 'subreddit': 'transgender', 'title': 'TSA puts out guidance for screening transgender passengers', 'created': 1493334947.0}"
2017-04-27 17:49:21,67xacz,5,20,,transgender,Nerve Endings signals new beginnings for trans erotica: a carefully edited and curated erotic collection by and for trans people,1493340561.0,"{'created_utc': 1493315361, 'id': '67xacz', 'num_comments': 5, 'score': 20, 'selftext': '', 'subreddit': 'transgender', 'title': 'Nerve Endings signals new beginnings for trans erotica: a carefully edited and curated erotic collection by and for trans people', 'created': 1493340561.0}"
2017-04-27 17:53:12,67xbb0,13,0,,transgender,Thoughts?,1493340792.0,"{'created_utc': 1493315592, 'id': '67xbb0', 'num_comments': 13, 'score': 0, 'selftext': '', 'subreddit': 'transgender', 'title': 'Thoughts?', 'created': 1493340792.0}"
2017-04-27 20:47:12,67ygka,0,8,,transgender,"Surviving faith and family, Jaimie Wilson looks to support other trans people through music",1493351232.0,"{'created_utc': 1493326032, 'id': '67ygka', 'num_comments': 0, 'score': 8, 'selftext': '', 'subreddit': 'transgender', 'title': 'Surviving faith and family, Jaimie Wilson looks to support other trans people through music', 'created': 1493351232.0}"
2017-04-27 20:47:23,67ygm7,0,1,,transgender,Trans Country Crooner Jaimie Wilson Strumming His Way to Success-#Boom Magazine|2017,1493351243.0,"{'created_utc': 1493326043, 'id': '67ygm7', 'num_comments': 0, 'score': 1, 'selftext': '', 'subreddit': 'transgender', 'title': 'Trans Country Crooner Jaimie Wilson Strumming His Way to Success-#Boom Magazine|2017', 'created': 1493351243.0}"
2017-04-27 23:08:29,67zb84,3,0,,transgender,Caitlyn Jenner's Memoir Is a Lost Opportunity to Educate Cis America,1493359709.0,"{'created_utc': 1493334509, 'id': '67zb84', 'num_comments': 3, 'score': 0, 'selftext': '', 'subreddit': 'transgender', 'title': ""Caitlyn Jenner's Memoir Is a Lost Opportunity to Educate Cis America"", 'created': 1493359709.0}"
2017-04-28 02:01:53,6808qa,32,47,,transgender,"Activists want DC Pride to cut out police participation, and also gets gay conservative booted as Pride organizer for transgender political comments",1493370113.0,"{'created_utc': 1493344913, 'id': '6808qa', 'num_comments': 32, 'score': 47, 'selftext': '', 'subreddit': 'transgender', 'title': 'Activists want DC Pride to cut out police participation, and also gets gay conservative booted as Pride organizer for transgender political comments', 'created': 1493370113.0}"
2017-04-28 09:05:19,681ili,0,1,,transgender,Trannies are degenerates. Prove me wrong.,1493395519.0,"{'created_utc': 1493370319, 'id': '681ili', 'num_comments': 0, 'score': 1, 'selftext': '', 'subreddit': 'transgender', 'title': 'Trannies are degenerates. Prove me wrong.', 'created': 1493395519.0}"
2017-04-28 10:44:46,681v7x,3,88,,transgender,First Trans Woman Wins Glamour's College Women of the Year Award,1493401486.0,"{'created_utc': 1493376286, 'id': '681v7x', 'num_comments': 3, 'score': 88, 'selftext': '', 'subreddit': 'transgender', 'title': ""First Trans Woman Wins Glamour's College Women of the Year Award"", 'created': 1493401486.0}"
2017-04-28 14:50:43,6833bd,6,56,,transgender,Idaho transgender woman sues for the right to change gender on birth certificate,1493416243.0,"{'created_utc': 1493391043, 'id': '6833bd', 'num_comments': 6, 'score': 56, 'selftext': '', 'subreddit': 'transgender', 'title': 'Idaho transgender woman sues for the right to change gender on birth certificate', 'created': 1493416243.0}"
2017-04-28 15:04:00,6836ci,3,15,,transgender,"Outed myself 1 Year ago today: ""A Note about my Past""",1493417040.0,"{'created_utc': 1493391840, 'id': '6836ci', 'num_comments': 3, 'score': 15, 'selftext': '', 'subreddit': 'transgender', 'title': 'Outed myself 1 Year ago today: ""A Note about my Past""', 'created': 1493417040.0}"
2017-04-28 20:02:07,68521y,7,86,,transgender,MPAA Relents Giving Transgender Family Story ‘3 Generations’ a PG-13. There was a lot pressure to make it an R.,1493434927.0,"{'created_utc': 1493409727, 'id': '68521y', 'num_comments': 7, 'score': 86, 'selftext': '', 'subreddit': 'transgender', 'title': 'MPAA Relents Giving Transgender Family Story ‘3 Generations’ a PG-13. There was a lot pressure to make it an R.', 'created': 1493434927.0}"
2017-04-28 23:03:25,68637p,0,1,,transgender,"Bill Nye loses his mind: Claims transgenderism is “evolution,” without any proof to back it up…",1493445805.0,"{'created_utc': 1493420605, 'id': '68637p', 'num_comments': 0, 'score': 1, 'selftext': '', 'subreddit': 'transgender', 'title': 'Bill Nye loses his mind: Claims transgenderism is “evolution,” without any proof to back it up…', 'created': 1493445805.0}"
2017-04-29 02:19:13,6870pd,60,148,,transgender,These Gay Republicans Mocked Transgender Women At A Forum In New York City,1493457553.0,"{'created_utc': 1493432353, 'id': '6870pd', 'num_comments': 60, 'score': 148, 'selftext': '', 'subreddit': 'transgender', 'title': 'These Gay Republicans Mocked Transgender Women At A Forum In New York City', 'created': 1493457553.0}"
2017-04-29 03:43:44,687dt5,13,44,,transgender,“We will kill all trans people here”: El Salvador’s trans community lives in fear,1493462624.0,"{'created_utc': 1493437424, 'id': '687dt5', 'num_comments': 13, 'score': 44, 'selftext': '', 'subreddit': 'transgender', 'title': '“We will kill all trans people here”: El Salvador’s trans community lives in fear', 'created': 1493462624.0}"
2017-04-29 04:37:58,687li0,0,1,,transgender,Sex and Gender Aren't The Same And You Don't Have Control To Exert Over Others- Peter Coffin gives us the only response we need to anti trans biotruthing and similar bigotry.,1493465878.0,"{'created_utc': 1493440678, 'id': '687li0', 'num_comments': 0, 'score': 1, 'selftext': '', 'subreddit': 'transgender', 'title': ""Sex and Gender Aren't The Same And You Don't Have Control To Exert Over Others- Peter Coffin gives us the only response we need to anti trans biotruthing and similar bigotry."", 'created': 1493465878.0}"
2017-04-29 12:36:53,6894nw,1,1,,transgender,"Natural Testosterone Blocker ~ Testo Rid In Depth Review best testosterone blocker review, buy testosterone blocker, natural testosterone blocker, natural testosterone blockers, testo rid review, testo-rid, testosterone blocker, testosterone blockers",1493494613.0,"{'created_utc': 1493469413, 'id': '6894nw', 'num_comments': 1, 'score': 1, 'selftext': '', 'subreddit': 'transgender', 'title': 'Natural Testosterone Blocker ~ Testo Rid In Depth Review best testosterone blocker review, buy testosterone blocker, natural testosterone blocker, natural testosterone blockers, testo rid review, testo-rid, testosterone blocker, testosterone blockers', 'created': 1493494613.0}"
2017-04-29 15:18:58,689ufs,3,8,,transgender,"Lt. Gov. Dan Patrick supports ""House companion"" to Texas' ""bathroom bill""",1493504338.0,"{'created_utc': 1493479138, 'id': '689ufs', 'num_comments': 3, 'score': 8, 'selftext': '', 'subreddit': 'transgender', 'title': 'Lt. Gov. Dan Patrick supports ""House companion"" to Texas\' ""bathroom bill""', 'created': 1493504338.0}"
2017-04-29 16:31:15,68a88b,6,8,,transgender,MiraCosta Scholarships Target Transgender Students,1493508675.0,"{'created_utc': 1493483475, 'id': '68a88b', 'num_comments': 6, 'score': 8, 'selftext': '', 'subreddit': 'transgender', 'title': 'MiraCosta Scholarships Target Transgender Students', 'created': 1493508675.0}"
2017-04-29 17:35:53,68akwd,0,9,,transgender,Trans and Queer Brazilians Learn How to Fight Back,1493512553.0,"{'created_utc': 1493487353, 'id': '68akwd', 'num_comments': 0, 'score': 9, 'selftext': '', 'subreddit': 'transgender', 'title': 'Trans and Queer Brazilians Learn How to Fight Back', 'created': 1493512553.0}"
2017-04-29 17:51:03,68anvm,0,17,,transgender,Transgender and undocumented leader fights for rights in Arizona,1493513463.0,"{'created_utc': 1493488263, 'id': '68anvm', 'num_comments': 0, 'score': 17, 'selftext': '', 'subreddit': 'transgender', 'title': 'Transgender and undocumented leader fights for rights in Arizona', 'created': 1493513463.0}"
2017-04-29 18:13:33,68ascu,36,264,,transgender,Japan's first transgender male politician vows to fight for trans kids,1493514813.0,"{'created_utc': 1493489613, 'id': '68ascu', 'num_comments': 36, 'score': 264, 'selftext': '', 'subreddit': 'transgender', 'title': ""Japan's first transgender male politician vows to fight for trans kids"", 'created': 1493514813.0}"
2017-04-29 18:23:59,68auds,7,17,,transgender,College Roundup: Transgender athlete makes all-conference team,1493515439.0,"{'created_utc': 1493490239, 'id': '68auds', 'num_comments': 7, 'score': 17, 'selftext': '', 'subreddit': 'transgender', 'title': 'College Roundup: Transgender athlete makes all-conference team', 'created': 1493515439.0}"
2017-04-29 18:33:31,68awaa,0,5,,transgender,"Dignity Health, transgender employee settle discrimination suit",1493516011.0,"{'created_utc': 1493490811, 'id': '68awaa', 'num_comments': 0, 'score': 5, 'selftext': '', 'subreddit': 'transgender', 'title': 'Dignity Health, transgender employee settle discrimination suit', 'created': 1493516011.0}"
2017-04-29 18:48:55,68azej,62,32,,transgender,'Teenagers becoming transgender to be cool' article slammed by activists,1493516935.0,"{'created_utc': 1493491735, 'id': '68azej', 'num_comments': 62, 'score': 32, 'selftext': '', 'subreddit': 'transgender', 'title': ""'Teenagers becoming transgender to be cool' article slammed by activists"", 'created': 1493516935.0}"
2017-04-29 18:53:11,68b07g,0,1,,transgender,A Place Where Transgenders Are A Normal Part of Society,1493517191.0,"{'created_utc': 1493491991, 'id': '68b07g', 'num_comments': 0, 'score': 1, 'selftext': '', 'subreddit': 'transgender', 'title': 'A Place Where Transgenders Are A Normal Part of Society', 'created': 1493517191.0}"
2017-04-30 06:21:32,68e48s,0,1,,transgender,Nong Rose (a transgender Thai fighter) fighting for the Thai Rat Muay Thai Championship at 115 lbs vs vs Bangron Sayangym [full fight],1493558492.0,"{'created_utc': 1493533292, 'id': '68e48s', 'num_comments': 0, 'score': 1, 'selftext': '', 'subreddit': 'transgender', 'title': 'Nong Rose (a transgender Thai fighter) fighting for the Thai Rat Muay Thai Championship at 115 lbs vs vs Bangron Sayangym [full fight]', 'created': 1493558492.0}"
2017-04-30 09:56:20,68eqq5,0,1,,transgender,Deirdre McCloskey: A Transgender Woman in Academia,1493571380.0,"{'created_utc': 1493546180, 'id': '68eqq5', 'num_comments': 0, 'score': 1, 'selftext': '', 'subreddit': 'transgender', 'title': 'Deirdre McCloskey: A Transgender Woman in Academia', 'created': 1493571380.0}"
2017-04-30 11:25:40,68f041,9,64,,transgender,What Made Twin Peaks’ Denise Such a Radical Trans Character on TV,1493576740.0,"{'created_utc': 1493551540, 'id': '68f041', 'num_comments': 9, 'score': 64, 'selftext': '', 'subreddit': 'transgender', 'title': 'What Made Twin Peaks’ Denise Such a Radical Trans Character on TV', 'created': 1493576740.0}"
2017-04-30 15:51:47,68g4ca,0,1,[deleted],transgender,"After their senator said ""men wearing a tutu to a bar"" shouldn't be surprised if they get punched adding ""Well, he kind of asks for it,"" Wyoming residents are protesting that bigotry by wearing tutus.",1493592707.0,"{'created_utc': 1493567507, 'id': '68g4ca', 'num_comments': 0, 'score': 1, 'selftext': '[deleted]', 'subreddit': 'transgender', 'title': 'After their senator said ""men wearing a tutu to a bar"" shouldn\'t be surprised if they get punched adding ""Well, he kind of asks for it,"" Wyoming residents are protesting that bigotry by wearing tutus.', 'created': 1493592707.0}"
2017-04-30 16:17:58,68g9ga,1,46,,transgender,Miss Trans Italy winner in landmark trans wedding,1493594278.0,"{'created_utc': 1493569078, 'id': '68g9ga', 'num_comments': 1, 'score': 46, 'selftext': '', 'subreddit': 'transgender', 'title': 'Miss Trans Italy winner in landmark trans wedding', 'created': 1493594278.0}"
2017-04-30 18:14:40,68gwk7,3,124,,transgender,Why Trans People Have a Constitutional Right to Change Their Birth Certificates,1493601280.0,"{'created_utc': 1493576080, 'id': '68gwk7', 'num_comments': 3, 'score': 124, 'selftext': '', 'subreddit': 'transgender', 'title': 'Why Trans People Have a Constitutional Right to Change Their Birth Certificates', 'created': 1493601280.0}"
