created_utc,id,num_comments,score,selftext,subreddit,title,created,d_
2017-04-06 13:34:13,63sxuo,12,165,,transgender,European court of Human Rights rules against state enforced sterilization for official gender marker change,1491510853.0,"{'created_utc': 1491485653, 'id': '63sxuo', 'num_comments': 12, 'score': 165, 'selftext': '', 'subreddit': 'transgender', 'title': 'European court of Human Rights rules against state enforced sterilization for official gender marker change', 'created': 1491510853.0}"
2017-04-06 14:24:34,63t8fc,28,27,,transgender,It’s Time to Debunk Rachel Dolezal’s Big Transgender Lie,1491513874.0,"{'created_utc': 1491488674, 'id': '63t8fc', 'num_comments': 28, 'score': 27, 'selftext': '', 'subreddit': 'transgender', 'title': 'It’s Time to Debunk Rachel Dolezal’s Big Transgender Lie', 'created': 1491513874.0}"
2017-04-06 16:54:41,63u6yy,0,3,,transgender,The Heroines of My Life: Interview with Anna Kouroupou,1491522881.0,"{'created_utc': 1491497681, 'id': '63u6yy', 'num_comments': 0, 'score': 3, 'selftext': '', 'subreddit': 'transgender', 'title': 'The Heroines of My Life: Interview with Anna Kouroupou', 'created': 1491522881.0}"
2017-04-06 23:01:39,63wjjd,0,1,[deleted],transgender,WWII Veteran Finally Comes Out as Transgender at Age 90,1491544899.0,"{'created_utc': 1491519699, 'id': '63wjjd', 'num_comments': 0, 'score': 1, 'selftext': '[deleted]', 'subreddit': 'transgender', 'title': 'WWII Veteran Finally Comes Out as Transgender at Age 90', 'created': 1491544899.0}"
2017-04-06 23:03:19,63wjw8,6,135,,transgender,WWII Veteran Comes Out as Transgender at Age 90,1491544999.0,"{'created_utc': 1491519799, 'id': '63wjw8', 'num_comments': 6, 'score': 135, 'selftext': '', 'subreddit': 'transgender', 'title': 'WWII Veteran Comes Out as Transgender at Age 90', 'created': 1491544999.0}"
2017-04-07 01:25:29,63xbw0,4,7,,transgender,Hate crimes focal point of new DOJ task force,1491553529.0,"{'created_utc': 1491528329, 'id': '63xbw0', 'num_comments': 4, 'score': 7, 'selftext': '', 'subreddit': 'transgender', 'title': 'Hate crimes focal point of new DOJ task force', 'created': 1491553529.0}"
2017-04-07 02:29:39,63xotw,6,13,,transgender,Is it time to scrap gender specific awards?,1491557379.0,"{'created_utc': 1491532179, 'id': '63xotw', 'num_comments': 6, 'score': 13, 'selftext': '', 'subreddit': 'transgender', 'title': 'Is it time to scrap gender specific awards?', 'created': 1491557379.0}"
2017-04-07 03:33:00,63y0l3,53,47,,transgender,Fay Weldon: transgender people become women for 'frivolous' reasons such as 'fashion' and 'clothes',1491561180.0,"{'created_utc': 1491535980, 'id': '63y0l3', 'num_comments': 53, 'score': 47, 'selftext': '', 'subreddit': 'transgender', 'title': ""Fay Weldon: transgender people become women for 'frivolous' reasons such as 'fashion' and 'clothes'"", 'created': 1491561180.0}"
2017-04-07 12:45:40,6405eq,4,141,,transgender,Australian transgender model Andreja Pejic speaks out over bullying,1491594340.0,"{'created_utc': 1491569140, 'id': '6405eq', 'num_comments': 4, 'score': 141, 'selftext': '', 'subreddit': 'transgender', 'title': 'Australian transgender model Andreja Pejic speaks out over bullying', 'created': 1491594340.0}"
2017-04-07 13:42:11,640fvb,13,78,,transgender,"For Laura Jane Grace, Punk Was A Form Of Armor",1491597731.0,"{'created_utc': 1491572531, 'id': '640fvb', 'num_comments': 13, 'score': 78, 'selftext': '', 'subreddit': 'transgender', 'title': 'For Laura Jane Grace, Punk Was A Form Of Armor', 'created': 1491597731.0}"
2017-04-07 17:54:04,641z8b,4,77,,transgender,European Court Rules Forced Transgender Sterilization Violates Human Rights.,1491612844.0,"{'created_utc': 1491587644, 'id': '641z8b', 'num_comments': 4, 'score': 77, 'selftext': '', 'subreddit': 'transgender', 'title': 'European Court Rules Forced Transgender Sterilization Violates Human Rights.', 'created': 1491612844.0}"
2017-04-07 19:01:02,642ebx,9,53,,transgender,How Democrats sold out the transgender community in North Carolina,1491616862.0,"{'created_utc': 1491591662, 'id': '642ebx', 'num_comments': 9, 'score': 53, 'selftext': '', 'subreddit': 'transgender', 'title': 'How Democrats sold out the transgender community in North Carolina', 'created': 1491616862.0}"
2017-04-07 21:07:36,6435nb,1,77,,transgender,ACLU Files Suit in Wisconsin Over Denial of Insurance Coverage for Transgender State Employees,1491624456.0,"{'created_utc': 1491599256, 'id': '6435nb', 'num_comments': 1, 'score': 77, 'selftext': '', 'subreddit': 'transgender', 'title': 'ACLU Files Suit in Wisconsin Over Denial of Insurance Coverage for Transgender State Employees', 'created': 1491624456.0}"
2017-04-07 21:27:20,6439nh,26,33,,transgender,"Andraya Yearwood, transgender athlete, stars on female high school track team, hopes to inspire",1491625640.0,"{'created_utc': 1491600440, 'id': '6439nh', 'num_comments': 26, 'score': 33, 'selftext': '', 'subreddit': 'transgender', 'title': 'Andraya Yearwood, transgender athlete, stars on female high school track team, hopes to inspire', 'created': 1491625640.0}"
2017-04-08 00:21:01,6446pf,9,83,,transgender,Trans women still required to attend conscription day in Thailand,1491636061.0,"{'created_utc': 1491610861, 'id': '6446pf', 'num_comments': 9, 'score': 83, 'selftext': '', 'subreddit': 'transgender', 'title': 'Trans women still required to attend conscription day in Thailand', 'created': 1491636061.0}"
2017-04-08 01:36:50,644j5k,0,1,[deleted],transgender,"Strangest article I've come across all day: ""18 Pickle Recipes for Trans Women and the People Who Love Them""",1491640610.0,"{'created_utc': 1491615410, 'id': '644j5k', 'num_comments': 0, 'score': 1, 'selftext': '[deleted]', 'subreddit': 'transgender', 'title': 'Strangest article I\'ve come across all day: ""18 Pickle Recipes for Trans Women and the People Who Love Them""', 'created': 1491640610.0}"
2017-04-08 14:27:26,6479so,13,37,,transgender,Nightmare looms for transgender Thais at army draft,1491686846.0,"{'created_utc': 1491661646, 'id': '6479so', 'num_comments': 13, 'score': 37, 'selftext': '', 'subreddit': 'transgender', 'title': 'Nightmare looms for transgender Thais at army draft', 'created': 1491686846.0}"
2017-04-08 18:09:05,648g9n,8,3,,transgender,Writing an article about trans in sports - Need some help! Please :),1491700145.0,"{'created_utc': 1491674945, 'id': '648g9n', 'num_comments': 8, 'score': 3, 'selftext': '', 'subreddit': 'transgender', 'title': 'Writing an article about trans in sports - Need some help! Please :)', 'created': 1491700145.0}"
2017-04-08 20:33:34,64982z,37,177,,transgender,Sex Work is Work. And it Needs a Safe Workplace.,1491708814.0,"{'created_utc': 1491683614, 'id': '64982z', 'num_comments': 37, 'score': 177, 'selftext': '', 'subreddit': 'transgender', 'title': 'Sex Work is Work. And it Needs a Safe Workplace.', 'created': 1491708814.0}"
2017-04-08 22:30:34,649td6,0,1,,transgender,T Blockers~ How to Make Natural Testosterone Blockers,1491715834.0,"{'created_utc': 1491690634, 'id': '649td6', 'num_comments': 0, 'score': 1, 'selftext': '', 'subreddit': 'transgender', 'title': 'T Blockers~ How to Make Natural Testosterone Blockers', 'created': 1491715834.0}"
2017-04-09 01:39:16,64aow4,0,1,,transgender,WW2 Veteran Comes Out as Trans,1491727156.0,"{'created_utc': 1491701956, 'id': '64aow4', 'num_comments': 0, 'score': 1, 'selftext': '', 'subreddit': 'transgender', 'title': 'WW2 Veteran Comes Out as Trans', 'created': 1491727156.0}"
2017-04-09 05:06:33,64bjbu,7,57,,transgender,"My Son’s School Supported His Transition, and It Has Made All the Difference in the World. Now It’s Being Sued.",1491739593.0,"{'created_utc': 1491714393, 'id': '64bjbu', 'num_comments': 7, 'score': 57, 'selftext': '', 'subreddit': 'transgender', 'title': 'My Son’s School Supported His Transition, and It Has Made All the Difference in the World. Now It’s Being Sued.', 'created': 1491739593.0}"
2017-04-09 06:20:19,64bs81,0,1,,transgender,My friend needs to change his legal name! Please Donate!,1491744019.0,"{'created_utc': 1491718819, 'id': '64bs81', 'num_comments': 0, 'score': 1, 'selftext': '', 'subreddit': 'transgender', 'title': 'My friend needs to change his legal name! Please Donate!', 'created': 1491744019.0}"
2017-04-09 09:56:23,64cdp5,8,84,,transgender,Long shadow cast by psychiatrist on transgender issues finally recedes at Johns Hopkins,1491756983.0,"{'created_utc': 1491731783, 'id': '64cdp5', 'num_comments': 8, 'score': 84, 'selftext': '', 'subreddit': 'transgender', 'title': 'Long shadow cast by psychiatrist on transgender issues finally recedes at Johns Hopkins', 'created': 1491756983.0}"
2017-04-09 23:18:41,64g2se,0,1,,transgender,Do you know what you are? You are what you is.,1491805121.0,"{'created_utc': 1491779921, 'id': '64g2se', 'num_comments': 0, 'score': 1, 'selftext': '', 'subreddit': 'transgender', 'title': 'Do you know what you are? You are what you is.', 'created': 1491805121.0}"
2017-04-10 00:54:09,64gjy5,21,71,,transgender,Hannah Is a Girl. Doctors Finally Treat Her Like One.,1491810849.0,"{'created_utc': 1491785649, 'id': '64gjy5', 'num_comments': 21, 'score': 71, 'selftext': '', 'subreddit': 'transgender', 'title': 'Hannah Is a Girl. Doctors Finally Treat Her Like One.', 'created': 1491810849.0}"
2017-04-10 03:48:14,64hdsl,0,1,,transgender,Coming Out As Trans Am I Gay!?!?!?,1491821294.0,"{'created_utc': 1491796094, 'id': '64hdsl', 'num_comments': 0, 'score': 1, 'selftext': '', 'subreddit': 'transgender', 'title': 'Coming Out As Trans Am I Gay!?!?!?', 'created': 1491821294.0}"
2017-04-10 04:06:28,64hgpr,12,61,,transgender,All Too Visible: The New Terrorism Targeting Trans Communities,1491822388.0,"{'created_utc': 1491797188, 'id': '64hgpr', 'num_comments': 12, 'score': 61, 'selftext': '', 'subreddit': 'transgender', 'title': 'All Too Visible: The New Terrorism Targeting Trans Communities', 'created': 1491822388.0}"
2017-04-10 04:56:52,64ho0o,0,1,,transgender,Trans Podcast,1491825412.0,"{'created_utc': 1491800212, 'id': '64ho0o', 'num_comments': 0, 'score': 1, 'selftext': '', 'subreddit': 'transgender', 'title': 'Trans Podcast', 'created': 1491825412.0}"
2017-04-10 07:43:03,64i91f,52,40,,transgender,"Don't be fooled by Washington State's initiative 1552 ""Bathroom bill""",1491835383.0,"{'created_utc': 1491810183, 'id': '64i91f', 'num_comments': 52, 'score': 40, 'selftext': '', 'subreddit': 'transgender', 'title': 'Don\'t be fooled by Washington State\'s initiative 1552 ""Bathroom bill""', 'created': 1491835383.0}"
2017-04-10 07:56:17,64iafz,0,2,,transgender,The Heroines of My Life: Interview with Diana García,1491836177.0,"{'created_utc': 1491810977, 'id': '64iafz', 'num_comments': 0, 'score': 2, 'selftext': '', 'subreddit': 'transgender', 'title': 'The Heroines of My Life: Interview with Diana García', 'created': 1491836177.0}"
2017-04-10 12:08:16,64j6le,3,20,[deleted],transgender,Fatal blow by ECHR to forced sterilization of trans,1491851296.0,"{'created_utc': 1491826096, 'id': '64j6le', 'num_comments': 3, 'score': 20, 'selftext': '[deleted]', 'subreddit': 'transgender', 'title': 'Fatal blow by ECHR to forced sterilization of trans', 'created': 1491851296.0}"
2017-04-10 14:04:16,64jrc0,0,1,,transgender,Save an ftm's life. Read his story here.,1491858256.0,"{'created_utc': 1491833056, 'id': '64jrc0', 'num_comments': 0, 'score': 1, 'selftext': '', 'subreddit': 'transgender', 'title': ""Save an ftm's life. Read his story here."", 'created': 1491858256.0}"
2017-04-10 14:18:24,64ju9b,6,39,,transgender,Remarkable language chosen by this Judge in a traditionally conservative district.,1491859104.0,"{'created_utc': 1491833904, 'id': '64ju9b', 'num_comments': 6, 'score': 39, 'selftext': '', 'subreddit': 'transgender', 'title': 'Remarkable language chosen by this Judge in a traditionally conservative district.', 'created': 1491859104.0}"
2017-04-10 14:22:31,64jv51,26,102,,transgender,THE MATRIX As a Transgender Metaphor,1491859351.0,"{'created_utc': 1491834151, 'id': '64jv51', 'num_comments': 26, 'score': 102, 'selftext': '', 'subreddit': 'transgender', 'title': 'THE MATRIX As a Transgender Metaphor', 'created': 1491859351.0}"
2017-04-10 16:06:13,64khdq,8,5,,transgender,Gender non-conforming and Trans Christians?,1491865573.0,"{'created_utc': 1491840373, 'id': '64khdq', 'num_comments': 8, 'score': 5, 'selftext': '', 'subreddit': 'transgender', 'title': 'Gender non-conforming and Trans Christians?', 'created': 1491865573.0}"
2017-04-10 16:46:35,64kqcf,8,7,,transgender,How the weak repeal of HB2 was not nearly weak enough for North Carolina Republicans: they want HB2 back.,1491867995.0,"{'created_utc': 1491842795, 'id': '64kqcf', 'num_comments': 8, 'score': 7, 'selftext': '', 'subreddit': 'transgender', 'title': 'How the weak repeal of HB2 was not nearly weak enough for North Carolina Republicans: they want HB2 back.', 'created': 1491867995.0}"
2017-04-10 16:50:10,64kr5s,2,122,,transgender,Philippine court upholds guilty verdict on U.S. Marine in transgender woman's killing,1491868210.0,"{'created_utc': 1491843010, 'id': '64kr5s', 'num_comments': 2, 'score': 122, 'selftext': '', 'subreddit': 'transgender', 'title': ""Philippine court upholds guilty verdict on U.S. Marine in transgender woman's killing"", 'created': 1491868210.0}"
2017-04-10 17:29:30,64l03x,1,16,,transgender,World War II veteran comes out as transgender at 90,1491870570.0,"{'created_utc': 1491845370, 'id': '64l03x', 'num_comments': 1, 'score': 16, 'selftext': '', 'subreddit': 'transgender', 'title': 'World War II veteran comes out as transgender at 90', 'created': 1491870570.0}"
2017-04-11 02:25:56,64o59l,0,1,,transgender,"Came across this seems, seems pretty cool.",1491902756.0,"{'created_utc': 1491877556, 'id': '64o59l', 'num_comments': 0, 'score': 1, 'selftext': '', 'subreddit': 'transgender', 'title': 'Came across this seems, seems pretty cool.', 'created': 1491902756.0}"
2017-04-11 03:43:49,64oj0d,30,103,,transgender,Fake “Radical Feminist” group actually paid political front for anti-LGBT James Dobson organization,1491907429.0,"{'created_utc': 1491882229, 'id': '64oj0d', 'num_comments': 30, 'score': 103, 'selftext': '', 'subreddit': 'transgender', 'title': 'Fake “Radical Feminist” group actually paid political front for anti-LGBT James Dobson organization', 'created': 1491907429.0}"
2017-04-11 04:40:32,64os25,4,33,,transgender,This group is behind anti-transgender bathroom bills across the country,1491910832.0,"{'created_utc': 1491885632, 'id': '64os25', 'num_comments': 4, 'score': 33, 'selftext': '', 'subreddit': 'transgender', 'title': 'This group is behind anti-transgender bathroom bills across the country', 'created': 1491910832.0}"
2017-04-11 13:22:08,64qrpm,0,1,,transgender,Fantastic Trans Science Video Everybody Needs To See!!!,1491942128.0,"{'created_utc': 1491916928, 'id': '64qrpm', 'num_comments': 0, 'score': 1, 'selftext': '', 'subreddit': 'transgender', 'title': 'Fantastic Trans Science Video Everybody Needs To See!!!', 'created': 1491942128.0}"
2017-04-11 14:10:01,64r1fd,2,25,,transgender,The High School at the Center of Pennsylvania’s Trans Bathroom Showdown,1491945001.0,"{'created_utc': 1491919801, 'id': '64r1fd', 'num_comments': 2, 'score': 25, 'selftext': '', 'subreddit': 'transgender', 'title': 'The High School at the Center of Pennsylvania’s Trans Bathroom Showdown', 'created': 1491945001.0}"
2017-04-11 19:54:41,64ta0c,24,166,,transgender,"Oklahoma gov't employee calls LGBTQ students ""cross-dressers"" in email",1491965681.0,"{'created_utc': 1491940481, 'id': '64ta0c', 'num_comments': 24, 'score': 166, 'selftext': '', 'subreddit': 'transgender', 'title': 'Oklahoma gov\'t employee calls LGBTQ students ""cross-dressers"" in email', 'created': 1491965681.0}"
2017-04-12 01:25:13,64v6ao,0,1,,transgender,Why does Hulu only have male and female gender options?,1491985513.0,"{'created_utc': 1491960313, 'id': '64v6ao', 'num_comments': 0, 'score': 1, 'selftext': '', 'subreddit': 'transgender', 'title': 'Why does Hulu only have male and female gender options?', 'created': 1491985513.0}"
2017-04-12 02:29:36,64vi0b,28,33,,transgender,The TSA says it’s allowed to investigate inside your underwear and you should just accept it,1491989376.0,"{'created_utc': 1491964176, 'id': '64vi0b', 'num_comments': 28, 'score': 33, 'selftext': '', 'subreddit': 'transgender', 'title': 'The TSA says it’s allowed to investigate inside your underwear and you should just accept it', 'created': 1491989376.0}"
2017-04-12 14:23:39,64yg8v,5,90,,transgender,FtMEssentials' offers free binders to trans youth,1492032219.0,"{'created_utc': 1492007019, 'id': '64yg8v', 'num_comments': 5, 'score': 90, 'selftext': '', 'subreddit': 'transgender', 'title': ""FtMEssentials' offers free binders to trans youth"", 'created': 1492032219.0}"
2017-04-12 16:02:24,64z2ai,1,2,,transgender,Foxy Moxy Racing and KindHuman Bicycles Join Forces on Int'l Day of Pink!,1492038144.0,"{'created_utc': 1492012944, 'id': '64z2ai', 'num_comments': 1, 'score': 2, 'selftext': '', 'subreddit': 'transgender', 'title': ""Foxy Moxy Racing and KindHuman Bicycles Join Forces on Int'l Day of Pink!"", 'created': 1492038144.0}"
2017-04-12 17:32:56,64znbm,22,116,,transgender,Dove’s New Transgender-Inclusive Ad Shows that Love Makes a Mom Not Gender.,1492043576.0,"{'created_utc': 1492018376, 'id': '64znbm', 'num_comments': 22, 'score': 116, 'selftext': '', 'subreddit': 'transgender', 'title': 'Dove’s New Transgender-Inclusive Ad Shows that Love Makes a Mom Not Gender.', 'created': 1492043576.0}"
2017-04-12 18:52:51,6505xx,6,4,,transgender,"If you're afraid how your children might react, here's a beautiful article to easy your anxiety.",1492048371.0,"{'created_utc': 1492023171, 'id': '6505xx', 'num_comments': 6, 'score': 4, 'selftext': '', 'subreddit': 'transgender', 'title': ""If you're afraid how your children might react, here's a beautiful article to easy your anxiety."", 'created': 1492048371.0}"
2017-04-12 21:19:29,6513en,0,4,,transgender,Incredibly Moving Account of this Couple's New Son &lt;3,1492057169.0,"{'created_utc': 1492031969, 'id': '6513en', 'num_comments': 0, 'score': 4, 'selftext': '', 'subreddit': 'transgender', 'title': ""Incredibly Moving Account of this Couple's New Son &lt;3"", 'created': 1492057169.0}"
2017-04-12 21:39:33,6517qg,23,80,,transgender,"Transgender people 25 times as likely to attempt suicide, study finds",1492058373.0,"{'created_utc': 1492033173, 'id': '6517qg', 'num_comments': 23, 'score': 80, 'selftext': '', 'subreddit': 'transgender', 'title': 'Transgender people 25 times as likely to attempt suicide, study finds', 'created': 1492058373.0}"
2017-04-12 22:33:59,651jml,12,13,,transgender,Can Trans People Trust Johns Hopkins' New Clinic?,1492061639.0,"{'created_utc': 1492036439, 'id': '651jml', 'num_comments': 12, 'score': 13, 'selftext': '', 'subreddit': 'transgender', 'title': ""Can Trans People Trust Johns Hopkins' New Clinic?"", 'created': 1492061639.0}"
2017-04-13 00:11:34,65232g,19,0,,transgender,Important Things To Remember,1492067494.0,"{'created_utc': 1492042294, 'id': '65232g', 'num_comments': 19, 'score': 0, 'selftext': '', 'subreddit': 'transgender', 'title': 'Important Things To Remember', 'created': 1492067494.0}"
2017-04-13 00:59:11,652c3x,1,6,,transgender,10 months HRT and adding ED medicine to regime,1492070351.0,"{'created_utc': 1492045151, 'id': '652c3x', 'num_comments': 1, 'score': 6, 'selftext': '', 'subreddit': 'transgender', 'title': '10 months HRT and adding ED medicine to regime', 'created': 1492070351.0}"
2017-04-13 01:39:20,652jod,103,204,,transgender,A transgender man was just outed on survivor by another contestant.,1492072760.0,"{'created_utc': 1492047560, 'id': '652jod', 'num_comments': 103, 'score': 204, 'selftext': '', 'subreddit': 'transgender', 'title': 'A transgender man was just outed on survivor by another contestant.', 'created': 1492072760.0}"
2017-04-13 02:38:30,652uk0,0,50,,transgender,"Over 130 artists have signed an open letter against Texas' ""bathroom bill"", inc. Janelle Monae, Sting, Kesha, Chvrches, Sia, and Lady Gaga",1492076310.0,"{'created_utc': 1492051110, 'id': '652uk0', 'num_comments': 0, 'score': 50, 'selftext': '', 'subreddit': 'transgender', 'title': 'Over 130 artists have signed an open letter against Texas\' ""bathroom bill"", inc. Janelle Monae, Sting, Kesha, Chvrches, Sia, and Lady Gaga', 'created': 1492076310.0}"
2017-04-13 13:16:03,655e4z,17,141,,transgender,'Survivor' Contestant Opens Up About Being Outed as Transgender,1492114563.0,"{'created_utc': 1492089363, 'id': '655e4z', 'num_comments': 17, 'score': 141, 'selftext': '', 'subreddit': 'transgender', 'title': ""'Survivor' Contestant Opens Up About Being Outed as Transgender"", 'created': 1492114563.0}"
2017-04-13 13:18:14,655eip,0,1,,transgender,Person compares being transgender to wanting to work at NASA,1492114694.0,"{'created_utc': 1492089494, 'id': '655eip', 'num_comments': 0, 'score': 1, 'selftext': '', 'subreddit': 'transgender', 'title': 'Person compares being transgender to wanting to work at NASA', 'created': 1492114694.0}"
2017-04-13 14:46:45,655wus,4,51,,transgender,Why I stopped talking about being trans,1492120005.0,"{'created_utc': 1492094805, 'id': '655wus', 'num_comments': 4, 'score': 51, 'selftext': '', 'subreddit': 'transgender', 'title': 'Why I stopped talking about being trans', 'created': 1492120005.0}"
2017-04-13 15:01:57,656050,0,1,[deleted],transgender,Mistreatment Of Transgenders In Pakistan (A MUST WATCH!),1492120917.0,"{'created_utc': 1492095717, 'id': '656050', 'num_comments': 0, 'score': 1, 'selftext': '[deleted]', 'subreddit': 'transgender', 'title': 'Mistreatment Of Transgenders In Pakistan (A MUST WATCH!)', 'created': 1492120917.0}"
2017-04-13 15:06:03,65611n,0,1,[deleted],transgender,The clip of Zeke being outed on Survivor and the resulting conversation,1492121163.0,"{'created_utc': 1492095963, 'id': '65611n', 'num_comments': 0, 'score': 1, 'selftext': '[deleted]', 'subreddit': 'transgender', 'title': 'The clip of Zeke being outed on Survivor and the resulting conversation', 'created': 1492121163.0}"
2017-04-13 17:57:29,6574h4,0,1,[deleted],transgender,Needs More Gay: The Matrix's Transgender Themes (x-post with /r/transgamers),1492131449.0,"{'created_utc': 1492106249, 'id': '6574h4', 'num_comments': 0, 'score': 1, 'selftext': '[deleted]', 'subreddit': 'transgender', 'title': ""Needs More Gay: The Matrix's Transgender Themes (x-post with /r/transgamers)"", 'created': 1492131449.0}"
2017-04-13 18:33:14,657cvc,27,0,,transgender,Not All Transgender People Have Dysphoria – And Here Are 6 Reasons Why That Matters - Everyday Feminism,1492133594.0,"{'created_utc': 1492108394, 'id': '657cvc', 'num_comments': 27, 'score': 0, 'selftext': '', 'subreddit': 'transgender', 'title': 'Not All Transgender People Have Dysphoria – And Here Are 6 Reasons Why That Matters - Everyday Feminism', 'created': 1492133594.0}"
2017-04-13 20:43:55,6586fc,9,157,[deleted],transgender,Transgender candidate Misty Snow announces US House of Representatives bid in Utah,1492141435.0,"{'created_utc': 1492116235, 'id': '6586fc', 'num_comments': 9, 'score': 157, 'selftext': '[deleted]', 'subreddit': 'transgender', 'title': 'Transgender candidate Misty Snow announces US House of Representatives bid in Utah', 'created': 1492141435.0}"
2017-04-13 22:24:36,658rif,0,31,,transgender,A Transgender Learning Gap in the Emergency Room,1492147476.0,"{'created_utc': 1492122276, 'id': '658rif', 'num_comments': 0, 'score': 31, 'selftext': '', 'subreddit': 'transgender', 'title': 'A Transgender Learning Gap in the Emergency Room', 'created': 1492147476.0}"
2017-04-13 22:55:04,658xl2,6,0,,transgender,Jazz Jennings and the Zion Conspiracy of Transgender Kids,1492149304.0,"{'created_utc': 1492124104, 'id': '658xl2', 'num_comments': 6, 'score': 0, 'selftext': '', 'subreddit': 'transgender', 'title': 'Jazz Jennings and the Zion Conspiracy of Transgender Kids', 'created': 1492149304.0}"
2017-04-13 23:14:32,6591cw,1,1,,transgender,Ben Shapiro DESTROYS Transgenderism And Pro-Abortion Arguments?!,1492150472.0,"{'created_utc': 1492125272, 'id': '6591cw', 'num_comments': 1, 'score': 1, 'selftext': '', 'subreddit': 'transgender', 'title': 'Ben Shapiro DESTROYS Transgenderism And Pro-Abortion Arguments?!', 'created': 1492150472.0}"
2017-04-13 23:30:42,6594ks,1,13,,transgender,"Revised ""bathroom bill"" to get hearing in Texas house",1492151442.0,"{'created_utc': 1492126242, 'id': '6594ks', 'num_comments': 1, 'score': 13, 'selftext': '', 'subreddit': 'transgender', 'title': 'Revised ""bathroom bill"" to get hearing in Texas house', 'created': 1492151442.0}"
2017-04-13 23:36:46,6595o8,2,45,,transgender,"Hawaii Film About Transgender Woman Is At Center Of Federal Debate: Trump wants to eliminate money for public broadcasting, and support for “Kumu Hina” is cited as one reason for the budget cut.",1492151806.0,"{'created_utc': 1492126606, 'id': '6595o8', 'num_comments': 2, 'score': 45, 'selftext': '', 'subreddit': 'transgender', 'title': 'Hawaii Film About Transgender Woman Is At Center Of Federal Debate: Trump wants to eliminate money for public broadcasting, and support for “Kumu Hina” is cited as one reason for the budget cut.', 'created': 1492151806.0}"
2017-04-14 02:46:11,65a3al,2,24,,transgender,Jeff Varner's Outing of Trans Contestant Zeke Smith on Survivor Was Despicable,1492163171.0,"{'created_utc': 1492137971, 'id': '65a3al', 'num_comments': 2, 'score': 24, 'selftext': '', 'subreddit': 'transgender', 'title': ""Jeff Varner's Outing of Trans Contestant Zeke Smith on Survivor Was Despicable"", 'created': 1492163171.0}"
