created_utc,id,num_comments,score,selftext,subreddit,title,created,d_
2017-04-01 00:28:17,62pe1m,71,8,,transgender,"India Willoughby: Unless you are transitioning, stay out of the ladies",1491031697.0,"{'created_utc': 1491006497, 'id': '62pe1m', 'num_comments': 71, 'score': 8, 'selftext': '', 'subreddit': 'transgender', 'title': 'India Willoughby: Unless you are transitioning, stay out of the ladies', 'created': 1491031697.0}"
2017-04-01 03:44:58,62qe63,0,1,,transgender,"Proudly Visible. Proudly Trans-owned. Proudly TRANSforming the way we self-care, one shave at a time.",1491043498.0,"{'created_utc': 1491018298, 'id': '62qe63', 'num_comments': 0, 'score': 1, 'selftext': '', 'subreddit': 'transgender', 'title': 'Proudly Visible. Proudly Trans-owned. Proudly TRANSforming the way we self-care, one shave at a time.', 'created': 1491043498.0}"
2017-04-01 05:09:23,62qsgf,0,1,[deleted],transgender,My Friend Hannah Simpson Just Shared This - @OneWTC lighting up in BLUE PINK and WHITE for #TransDayOfVisibility,1491048563.0,"{'created_utc': 1491023363, 'id': '62qsgf', 'num_comments': 0, 'score': 1, 'selftext': '[deleted]', 'subreddit': 'transgender', 'title': 'My Friend Hannah Simpson Just Shared This - @OneWTC lighting up in BLUE PINK and WHITE for #TransDayOfVisibility', 'created': 1491048563.0}"
2017-04-01 05:14:30,62qtaf,1,1,,transgender,Giant transgender flag on /r/place,1491048870.0,"{'created_utc': 1491023670, 'id': '62qtaf', 'num_comments': 1, 'score': 1, 'selftext': '', 'subreddit': 'transgender', 'title': 'Giant transgender flag on /r/place', 'created': 1491048870.0}"
2017-04-01 05:40:45,62qxgo,1,63,,transgender,Taken tonight in lower Manhattan by a friend - One World Trade Center lighting up in BLUE PINK and WHITE for Trans Day Of Visibility,1491050445.0,"{'created_utc': 1491025245, 'id': '62qxgo', 'num_comments': 1, 'score': 63, 'selftext': '', 'subreddit': 'transgender', 'title': 'Taken tonight in lower Manhattan by a friend - One World Trade Center lighting up in BLUE PINK and WHITE for Trans Day Of Visibility', 'created': 1491050445.0}"
2017-04-01 15:48:25,62thw7,40,133,,transgender,"I am openly trans in tech, pretty connected, and want to help someone else get started. I am hosting a sponsorship for free. I just want to help other trans people who are interested in tech.",1491086905.0,"{'created_utc': 1491061705, 'id': '62thw7', 'num_comments': 40, 'score': 133, 'selftext': '', 'subreddit': 'transgender', 'title': 'I am openly trans in tech, pretty connected, and want to help someone else get started. I am hosting a sponsorship for free. I just want to help other trans people who are interested in tech.', 'created': 1491086905.0}"
2017-04-01 16:18:46,62tos3,0,2,,transgender,"My Son, My Daughter: A Mother's Evolution",1491088726.0,"{'created_utc': 1491063526, 'id': '62tos3', 'num_comments': 0, 'score': 2, 'selftext': '', 'subreddit': 'transgender', 'title': ""My Son, My Daughter: A Mother's Evolution"", 'created': 1491088726.0}"
2017-04-01 21:29:28,62vn4c,0,1,[deleted],transgender,Congrats guys r/place has a trans flag across their whole canvas!,1491107368.0,"{'created_utc': 1491082168, 'id': '62vn4c', 'num_comments': 0, 'score': 1, 'selftext': '[deleted]', 'subreddit': 'transgender', 'title': 'Congrats guys r/place has a trans flag across their whole canvas!', 'created': 1491107368.0}"
2017-04-01 22:24:29,62vzqm,9,111,,transgender,Transgender kids under 16 could change their legal gender under radical Irish proposals,1491110669.0,"{'created_utc': 1491085469, 'id': '62vzqm', 'num_comments': 9, 'score': 111, 'selftext': '', 'subreddit': 'transgender', 'title': 'Transgender kids under 16 could change their legal gender under radical Irish proposals', 'created': 1491110669.0}"
2017-04-01 22:58:22,62w6hb,23,114,,transgender,6 Signs That You Might Not Really Respect Your Transgender Loved One,1491112702.0,"{'created_utc': 1491087502, 'id': '62w6hb', 'num_comments': 23, 'score': 114, 'selftext': '', 'subreddit': 'transgender', 'title': '6 Signs That You Might Not Really Respect Your Transgender Loved One', 'created': 1491112702.0}"
2017-04-02 03:04:33,62xfl4,3,24,,transgender,This advert celebrating a trans mother will give you chills,1491127473.0,"{'created_utc': 1491102273, 'id': '62xfl4', 'num_comments': 3, 'score': 24, 'selftext': '', 'subreddit': 'transgender', 'title': 'This advert celebrating a trans mother will give you chills', 'created': 1491127473.0}"
2017-04-02 09:03:31,62yq5j,0,1,,transgender,Proud of ya'll! Keep it up!,1491149011.0,"{'created_utc': 1491123811, 'id': '62yq5j', 'num_comments': 0, 'score': 1, 'selftext': '', 'subreddit': 'transgender', 'title': ""Proud of ya'll! Keep it up!"", 'created': 1491149011.0}"
2017-04-02 16:39:57,630mvm,0,1,,transgender,How To Lower High Testosterone And Androgens In Women Naturally,1491176397.0,"{'created_utc': 1491151197, 'id': '630mvm', 'num_comments': 0, 'score': 1, 'selftext': '', 'subreddit': 'transgender', 'title': 'How To Lower High Testosterone And Androgens In Women Naturally', 'created': 1491176397.0}"
2017-04-02 16:47:26,630oi2,66,0,,transgender,A transgender winning a womens weightlifting competition.,1491176846.0,"{'created_utc': 1491151646, 'id': '630oi2', 'num_comments': 66, 'score': 0, 'selftext': '', 'subreddit': 'transgender', 'title': 'A transgender winning a womens weightlifting competition.', 'created': 1491176846.0}"
2017-04-02 21:15:30,632ay0,14,48,,transgender,Those two faced Companies,1491192930.0,"{'created_utc': 1491167730, 'id': '632ay0', 'num_comments': 14, 'score': 48, 'selftext': '', 'subreddit': 'transgender', 'title': 'Those two faced Companies', 'created': 1491192930.0}"
2017-04-02 22:28:11,632q86,0,1,[deleted],transgender,"I'm having a bit of anxiety from this text I received. I sent my family my coming out letter and I'm not too worried how their reaction will be, but I want to know how some of you overcame your anxiety when coming out. Thanks xoxo -*Alex•MtF•20*",1491197291.0,"{'created_utc': 1491172091, 'id': '632q86', 'num_comments': 0, 'score': 1, 'selftext': '[deleted]', 'subreddit': 'transgender', 'title': ""I'm having a bit of anxiety from this text I received. I sent my family my coming out letter and I'm not too worried how their reaction will be, but I want to know how some of you overcame your anxiety when coming out. Thanks xoxo -*Alex•MtF•20*"", 'created': 1491197291.0}"
2017-04-02 22:42:13,632t2h,6,78,[deleted],transgender,Trans woman dies after being stabbed in the neck in Brazil,1491198133.0,"{'created_utc': 1491172933, 'id': '632t2h', 'num_comments': 6, 'score': 78, 'selftext': '[deleted]', 'subreddit': 'transgender', 'title': 'Trans woman dies after being stabbed in the neck in Brazil', 'created': 1491198133.0}"
2017-04-02 22:45:19,632tq6,0,1,[deleted],transgender,The Filipino trans community made a beautiful video challenging stereotypes,1491198319.0,"{'created_utc': 1491173119, 'id': '632tq6', 'num_comments': 0, 'score': 1, 'selftext': '[deleted]', 'subreddit': 'transgender', 'title': 'The Filipino trans community made a beautiful video challenging stereotypes', 'created': 1491198319.0}"
2017-04-02 23:07:47,632yay,1,0,[deleted],transgender,Rachel Dolezal says transgender people face less prejudice than she does as ‘transracial’,1491199667.0,"{'created_utc': 1491174467, 'id': '632yay', 'num_comments': 1, 'score': 0, 'selftext': '[deleted]', 'subreddit': 'transgender', 'title': 'Rachel Dolezal says transgender people face less prejudice than she does as ‘transracial’', 'created': 1491199667.0}"
2017-04-02 23:29:22,6332hl,20,12,,transgender,A Transgender Student Won Her Battle. Now It's War.,1491200962.0,"{'created_utc': 1491175762, 'id': '6332hl', 'num_comments': 20, 'score': 12, 'selftext': '', 'subreddit': 'transgender', 'title': ""A Transgender Student Won Her Battle. Now It's War."", 'created': 1491200962.0}"
2017-04-03 02:51:22,6344oy,1,64,,transgender,FEATURE-'Am I next?': Killings in El Salvador leave transgender people in fear,1491213082.0,"{'created_utc': 1491187882, 'id': '6344oy', 'num_comments': 1, 'score': 64, 'selftext': '', 'subreddit': 'transgender', 'title': ""FEATURE-'Am I next?': Killings in El Salvador leave transgender people in fear"", 'created': 1491213082.0}"
2017-04-03 05:51:10,634xny,1,10,[deleted],transgender,Petition: Tougher sentences for transphobic crimes,1491223870.0,"{'created_utc': 1491198670, 'id': '634xny', 'num_comments': 1, 'score': 10, 'selftext': '[deleted]', 'subreddit': 'transgender', 'title': 'Petition: Tougher sentences for transphobic crimes', 'created': 1491223870.0}"
2017-04-03 11:50:47,6369cl,1,18,[deleted],transgender,TV channel postpones controversial documentary on trans kids,1491245447.0,"{'created_utc': 1491220247, 'id': '6369cl', 'num_comments': 1, 'score': 18, 'selftext': '[deleted]', 'subreddit': 'transgender', 'title': 'TV channel postpones controversial documentary on trans kids', 'created': 1491245447.0}"
2017-04-03 16:50:09,638082,8,68,,transgender,The Darkest Moments in a Transgender Existence,1491263409.0,"{'created_utc': 1491238209, 'id': '638082', 'num_comments': 8, 'score': 68, 'selftext': '', 'subreddit': 'transgender', 'title': 'The Darkest Moments in a Transgender Existence', 'created': 1491263409.0}"
2017-04-03 17:14:14,6385sn,0,1,,transgender,Male to Female Makeup Transformations! New Beauty Vlogger,1491264854.0,"{'created_utc': 1491239654, 'id': '6385sn', 'num_comments': 0, 'score': 1, 'selftext': '', 'subreddit': 'transgender', 'title': 'Male to Female Makeup Transformations! New Beauty Vlogger', 'created': 1491264854.0}"
2017-04-03 19:54:38,6396c2,2,16,,transgender,How a skeleton folk saint of death took off with Mexican transgender women,1491274478.0,"{'created_utc': 1491249278, 'id': '6396c2', 'num_comments': 2, 'score': 16, 'selftext': '', 'subreddit': 'transgender', 'title': 'How a skeleton folk saint of death took off with Mexican transgender women', 'created': 1491274478.0}"
2017-04-03 20:11:10,6399vb,7,19,,transgender,Long-Term Androgen Therapy Increases Cardiovascular Risk in Transgender Men,1491275470.0,"{'created_utc': 1491250270, 'id': '6399vb', 'num_comments': 7, 'score': 19, 'selftext': '', 'subreddit': 'transgender', 'title': 'Long-Term Androgen Therapy Increases Cardiovascular Risk in Transgender Men', 'created': 1491275470.0}"
2017-04-03 20:29:47,639drh,32,25,,transgender,'A man is a man' - Samoa protests New Zealand transgender weightlifter's win,1491276587.0,"{'created_utc': 1491251387, 'id': '639drh', 'num_comments': 32, 'score': 25, 'selftext': '', 'subreddit': 'transgender', 'title': ""'A man is a man' - Samoa protests New Zealand transgender weightlifter's win"", 'created': 1491276587.0}"
2017-04-03 20:54:55,639iuh,2,69,[deleted],transgender,Kennedy grandson urges NCAA to keep avoiding holding events in North Carolina,1491278095.0,"{'created_utc': 1491252895, 'id': '639iuh', 'num_comments': 2, 'score': 69, 'selftext': '[deleted]', 'subreddit': 'transgender', 'title': 'Kennedy grandson urges NCAA to keep avoiding holding events in North Carolina', 'created': 1491278095.0}"
2017-04-03 23:37:27,63ajyn,10,83,,transgender,"Texas Dem State Sen Lucio: ""I don't believe in separation of Church and State"", Claims Bathroom Bill Wasn't Bought",1491287847.0,"{'created_utc': 1491262647, 'id': '63ajyn', 'num_comments': 10, 'score': 83, 'selftext': '', 'subreddit': 'transgender', 'title': 'Texas Dem State Sen Lucio: ""I don\'t believe in separation of Church and State"", Claims Bathroom Bill Wasn\'t Bought', 'created': 1491287847.0}"
2017-04-03 23:59:29,63ao7m,3,9,,transgender,Intern Gains Invaluable Experience of Explaining Cis Privilege to 55-Year-Old Employer,1491289169.0,"{'created_utc': 1491263969, 'id': '63ao7m', 'num_comments': 3, 'score': 9, 'selftext': '', 'subreddit': 'transgender', 'title': 'Intern Gains Invaluable Experience of Explaining Cis Privilege to 55-Year-Old Employer', 'created': 1491289169.0}"
2017-04-04 00:04:12,63ap21,4,48,,transgender,Gia Gunn from RuPaul's Drag Race comes out as transgender,1491289452.0,"{'created_utc': 1491264252, 'id': '63ap21', 'num_comments': 4, 'score': 48, 'selftext': '', 'subreddit': 'transgender', 'title': ""Gia Gunn from RuPaul's Drag Race comes out as transgender"", 'created': 1491289452.0}"
2017-04-04 00:45:09,63ax4c,0,2,,transgender,Shachar Erez Came Out As Transgender For Himself — And The Israeli Army,1491291909.0,"{'created_utc': 1491266709, 'id': '63ax4c', 'num_comments': 0, 'score': 2, 'selftext': '', 'subreddit': 'transgender', 'title': 'Shachar Erez Came Out As Transgender For Himself — And The Israeli Army', 'created': 1491291909.0}"
2017-04-04 02:51:42,63bkp1,0,1,[deleted],transgender,"My Son, My Daughter: A Mother's Evolution",1491299502.0,"{'created_utc': 1491274302, 'id': '63bkp1', 'num_comments': 0, 'score': 1, 'selftext': '[deleted]', 'subreddit': 'transgender', 'title': ""My Son, My Daughter: A Mother's Evolution"", 'created': 1491299502.0}"
2017-04-04 03:37:18,63bscy,6,60,,transgender,What It’s Like To Be A Transgender Teacher In Donald Trump’s America,1491302238.0,"{'created_utc': 1491277038, 'id': '63bscy', 'num_comments': 6, 'score': 60, 'selftext': '', 'subreddit': 'transgender', 'title': 'What It’s Like To Be A Transgender Teacher In Donald Trump’s America', 'created': 1491302238.0}"
2017-04-04 07:58:52,63csqb,0,5,,transgender,The Heroines of My Life: Interview with Lauren Foster,1491317932.0,"{'created_utc': 1491292732, 'id': '63csqb', 'num_comments': 0, 'score': 5, 'selftext': '', 'subreddit': 'transgender', 'title': 'The Heroines of My Life: Interview with Lauren Foster', 'created': 1491317932.0}"
2017-04-04 15:21:36,63er28,2,25,,transgender,"Seth, 21, Came Out as Bi and Trans Via Power Point",1491344496.0,"{'created_utc': 1491319296, 'id': '63er28', 'num_comments': 2, 'score': 25, 'selftext': '', 'subreddit': 'transgender', 'title': 'Seth, 21, Came Out as Bi and Trans Via Power Point', 'created': 1491344496.0}"
2017-04-04 15:59:50,63ezte,6,21,,transgender,NCAA: NC back in running to host events after law change,1491346790.0,"{'created_utc': 1491321590, 'id': '63ezte', 'num_comments': 6, 'score': 21, 'selftext': '', 'subreddit': 'transgender', 'title': 'NCAA: NC back in running to host events after law change', 'created': 1491346790.0}"
2017-04-04 19:05:11,63g8tu,2,7,,transgender,NCAA Board of Governors’ Position on HB2 Repeal,1491357911.0,"{'created_utc': 1491332711, 'id': '63g8tu', 'num_comments': 2, 'score': 7, 'selftext': '', 'subreddit': 'transgender', 'title': 'NCAA Board of Governors’ Position on HB2 Repeal', 'created': 1491357911.0}"
2017-04-04 20:25:25,63grvw,4,23,[deleted],transgender,"I'm writing a paper about trans rights and experiences - if you have a moment, please take a look at this survey - it's anonymous, and it would really help me out!",1491362725.0,"{'created_utc': 1491337525, 'id': '63grvw', 'num_comments': 4, 'score': 23, 'selftext': '[deleted]', 'subreddit': 'transgender', 'title': ""I'm writing a paper about trans rights and experiences - if you have a moment, please take a look at this survey - it's anonymous, and it would really help me out!"", 'created': 1491362725.0}"
2017-04-04 22:14:13,63hgb1,0,1,[deleted],transgender,Here's a song I wrote about my transgenderism.,1491369253.0,"{'created_utc': 1491344053, 'id': '63hgb1', 'num_comments': 0, 'score': 1, 'selftext': '[deleted]', 'subreddit': 'transgender', 'title': ""Here's a song I wrote about my transgenderism."", 'created': 1491369253.0}"
2017-04-04 22:27:47,63hj7o,2,37,,transgender,Major Cities to Retain N.C. Travel Bans After HB 2's 'Compromise' Repeal,1491370067.0,"{'created_utc': 1491344867, 'id': '63hj7o', 'num_comments': 2, 'score': 37, 'selftext': '', 'subreddit': 'transgender', 'title': ""Major Cities to Retain N.C. Travel Bans After HB 2's 'Compromise' Repeal"", 'created': 1491370067.0}"
2017-04-04 22:48:32,63hnhj,45,84,,transgender,Transgender Woman Claims Self-Defense in Killing,1491371312.0,"{'created_utc': 1491346112, 'id': '63hnhj', 'num_comments': 45, 'score': 84, 'selftext': '', 'subreddit': 'transgender', 'title': 'Transgender Woman Claims Self-Defense in Killing', 'created': 1491371312.0}"
2017-04-04 22:59:12,63hpqo,11,20,,transgender,Transgender students exhibit higher-risk drinking patterns,1491371952.0,"{'created_utc': 1491346752, 'id': '63hpqo', 'num_comments': 11, 'score': 20, 'selftext': '', 'subreddit': 'transgender', 'title': 'Transgender students exhibit higher-risk drinking patterns', 'created': 1491371952.0}"
2017-04-04 23:22:01,63hugl,0,1,[deleted],transgender,This Trans Woman Kept Her Beard And Couldn't Be Happier,1491373321.0,"{'created_utc': 1491348121, 'id': '63hugl', 'num_comments': 0, 'score': 1, 'selftext': '[deleted]', 'subreddit': 'transgender', 'title': ""This Trans Woman Kept Her Beard And Couldn't Be Happier"", 'created': 1491373321.0}"
2017-04-04 23:23:32,63hurv,3,9,,transgender,‘The Assignment’ Director Defends Michelle Rodriguez Sex Change Movie,1491373412.0,"{'created_utc': 1491348212, 'id': '63hurv', 'num_comments': 3, 'score': 9, 'selftext': '', 'subreddit': 'transgender', 'title': '‘The Assignment’ Director Defends Michelle Rodriguez Sex Change Movie', 'created': 1491373412.0}"
2017-04-04 23:52:35,63i0dj,6,108,,transgender,TV finally got its first teenage transgender romance,1491375155.0,"{'created_utc': 1491349955, 'id': '63i0dj', 'num_comments': 6, 'score': 108, 'selftext': '', 'subreddit': 'transgender', 'title': 'TV finally got its first teenage transgender romance', 'created': 1491375155.0}"
2017-04-04 23:54:44,63i0rf,5,44,,transgender,"LGBT employees protected from workplace discrimination, appeals court rules",1491375284.0,"{'created_utc': 1491350084, 'id': '63i0rf', 'num_comments': 5, 'score': 44, 'selftext': '', 'subreddit': 'transgender', 'title': 'LGBT employees protected from workplace discrimination, appeals court rules', 'created': 1491375284.0}"
2017-04-05 00:26:10,63i73a,3,4,[deleted],transgender,Trans girl's use of a girls’ locker room sparks federal lawsuit,1491377170.0,"{'created_utc': 1491351970, 'id': '63i73a', 'num_comments': 3, 'score': 4, 'selftext': '[deleted]', 'subreddit': 'transgender', 'title': ""Trans girl's use of a girls’ locker room sparks federal lawsuit"", 'created': 1491377170.0}"
2017-04-05 00:52:26,63ic68,12,3,,transgender,"Transgender photo book, free download",1491378746.0,"{'created_utc': 1491353546, 'id': '63ic68', 'num_comments': 12, 'score': 3, 'selftext': '', 'subreddit': 'transgender', 'title': 'Transgender photo book, free download', 'created': 1491378746.0}"
2017-04-05 01:49:34,63imyu,0,6,[deleted],transgender,Nevada bill to let foster kids choose their own gender advances,1491382174.0,"{'created_utc': 1491356974, 'id': '63imyu', 'num_comments': 0, 'score': 6, 'selftext': '[deleted]', 'subreddit': 'transgender', 'title': 'Nevada bill to let foster kids choose their own gender advances', 'created': 1491382174.0}"
2017-04-05 02:13:49,63irjg,0,15,,transgender,"Founder of TDOR: ""We’ve been here before: child molesters &amp; the political right""",1491383629.0,"{'created_utc': 1491358429, 'id': '63irjg', 'num_comments': 0, 'score': 15, 'selftext': '', 'subreddit': 'transgender', 'title': 'Founder of TDOR: ""We’ve been here before: child molesters &amp; the political right""', 'created': 1491383629.0}"
2017-04-05 04:16:53,63jd8p,27,13,,transgender,Writer of The Assignment Insists the Movie Is Not Transphobic,1491391013.0,"{'created_utc': 1491365813, 'id': '63jd8p', 'num_comments': 27, 'score': 13, 'selftext': '', 'subreddit': 'transgender', 'title': 'Writer of The Assignment Insists the Movie Is Not Transphobic', 'created': 1491391013.0}"
2017-04-05 11:11:46,63kv3d,3,59,[deleted],transgender,Stonewall calls for a new gender on passports to include non-binary people,1491415906.0,"{'created_utc': 1491390706, 'id': '63kv3d', 'num_comments': 3, 'score': 59, 'selftext': '[deleted]', 'subreddit': 'transgender', 'title': 'Stonewall calls for a new gender on passports to include non-binary people', 'created': 1491415906.0}"
2017-04-05 12:57:27,63lcku,0,1,[deleted],transgender,Here's a song I wrote about my transgenderism.,1491422247.0,"{'created_utc': 1491397047, 'id': '63lcku', 'num_comments': 0, 'score': 1, 'selftext': '[deleted]', 'subreddit': 'transgender', 'title': ""Here's a song I wrote about my transgenderism."", 'created': 1491422247.0}"
2017-04-05 15:02:36,63m225,4,170,[deleted],transgender,Trans rights protected as anti-trans bathroom rights candidates lose election,1491429756.0,"{'created_utc': 1491404556, 'id': '63m225', 'num_comments': 4, 'score': 170, 'selftext': '[deleted]', 'subreddit': 'transgender', 'title': 'Trans rights protected as anti-trans bathroom rights candidates lose election', 'created': 1491429756.0}"
2017-04-05 15:23:16,63m6o8,0,1,[deleted],transgender,How am I doing after a year of hrt 18 years old,1491430996.0,"{'created_utc': 1491405796, 'id': '63m6o8', 'num_comments': 0, 'score': 1, 'selftext': '[deleted]', 'subreddit': 'transgender', 'title': 'How am I doing after a year of hrt 18 years old', 'created': 1491430996.0}"
2017-04-05 21:41:19,63onik,0,6,,transgender,Sisterhood Is Bullshit - why we were never united in the first place,1491453679.0,"{'created_utc': 1491428479, 'id': '63onik', 'num_comments': 0, 'score': 6, 'selftext': '', 'subreddit': 'transgender', 'title': 'Sisterhood Is Bullshit - why we were never united in the first place', 'created': 1491453679.0}"
2017-04-05 22:03:11,63os81,1,1,,transgender,411 Transgender is the best place to go for people who are going through their transition. &lt;3,1491454991.0,"{'created_utc': 1491429791, 'id': '63os81', 'num_comments': 1, 'score': 1, 'selftext': '', 'subreddit': 'transgender', 'title': '411 Transgender is the best place to go for people who are going through their transition. &lt;3', 'created': 1491454991.0}"
2017-04-06 00:53:41,63pqgm,2,23,,transgender,Federal judge rules Fair Housing Act protects LGBT people,1491465221.0,"{'created_utc': 1491440021, 'id': '63pqgm', 'num_comments': 2, 'score': 23, 'selftext': '', 'subreddit': 'transgender', 'title': 'Federal judge rules Fair Housing Act protects LGBT people', 'created': 1491465221.0}"
2017-04-06 01:28:26,63px5c,0,7,,transgender,Short survey for my paper on transgender clothing exchange!,1491467306.0,"{'created_utc': 1491442106, 'id': '63px5c', 'num_comments': 0, 'score': 7, 'selftext': '', 'subreddit': 'transgender', 'title': 'Short survey for my paper on transgender clothing exchange!', 'created': 1491467306.0}"
2017-04-06 01:52:17,63q1q5,12,58,,transgender,Why Louis C.K.’s Trans Joke Is Better Than Dave Chappelle’s,1491468737.0,"{'created_utc': 1491443537, 'id': '63q1q5', 'num_comments': 12, 'score': 58, 'selftext': '', 'subreddit': 'transgender', 'title': 'Why Louis C.K.’s Trans Joke Is Better Than Dave Chappelle’s', 'created': 1491468737.0}"
2017-04-06 02:16:27,63q69r,3,1,,transgender,Bioware apologizes and is changing dialogue with Transgender character,1491470187.0,"{'created_utc': 1491444987, 'id': '63q69r', 'num_comments': 3, 'score': 1, 'selftext': '', 'subreddit': 'transgender', 'title': 'Bioware apologizes and is changing dialogue with Transgender character', 'created': 1491470187.0}"
2017-04-06 02:26:07,63q813,0,14,,transgender,What Does That Civil Rights Act Victory for LGBT Employees Actually Mean?,1491470767.0,"{'created_utc': 1491445567, 'id': '63q813', 'num_comments': 0, 'score': 14, 'selftext': '', 'subreddit': 'transgender', 'title': 'What Does That Civil Rights Act Victory for LGBT Employees Actually Mean?', 'created': 1491470767.0}"
2017-04-06 03:18:18,63qhmq,5,32,,transgender,The 7th Circuit’s Landmark Anti-Gay Discrimination Ruling Is Also Great News for Trans Rights,1491473898.0,"{'created_utc': 1491448698, 'id': '63qhmq', 'num_comments': 5, 'score': 32, 'selftext': '', 'subreddit': 'transgender', 'title': 'The 7th Circuit’s Landmark Anti-Gay Discrimination Ruling Is Also Great News for Trans Rights', 'created': 1491473898.0}"
2017-04-06 06:17:07,63r8s6,1,1,,transgender,Multinational professional services firm EY’s new guide – Gender Transition – A Toolkit. Practical tips and advice for individuals and talent teams on gender transition in the workplace.,1491484627.0,"{'created_utc': 1491459427, 'id': '63r8s6', 'num_comments': 1, 'score': 1, 'selftext': '', 'subreddit': 'transgender', 'title': 'Multinational professional services firm EY’s new guide – Gender Transition – A Toolkit. Practical tips and advice for individuals and talent teams on gender transition in the workplace.', 'created': 1491484627.0}"
2017-04-06 07:21:17,63rgv7,1,1,,transgender,Transgender YouTube Channel!,1491488477.0,"{'created_utc': 1491463277, 'id': '63rgv7', 'num_comments': 1, 'score': 1, 'selftext': '', 'subreddit': 'transgender', 'title': 'Transgender YouTube Channel!', 'created': 1491488477.0}"
2017-04-06 10:35:32,63s465,0,1,[deleted],transgender,"Very insightful interview on pronouns, free speech, pc-culture. Worth a watch",1491500132.0,"{'created_utc': 1491474932, 'id': '63s465', 'num_comments': 0, 'score': 1, 'selftext': '[deleted]', 'subreddit': 'transgender', 'title': 'Very insightful interview on pronouns, free speech, pc-culture. Worth a watch', 'created': 1491500132.0}"
2017-04-06 13:33:05,63sxn0,0,48,[deleted],transgender,Attempt To Oust Pro-Transgender Equality School Board Members Fails In Illinois,1491510785.0,"{'created_utc': 1491485585, 'id': '63sxn0', 'num_comments': 0, 'score': 48, 'selftext': '[deleted]', 'subreddit': 'transgender', 'title': 'Attempt To Oust Pro-Transgender Equality School Board Members Fails In Illinois', 'created': 1491510785.0}"
