created_utc,id,num_comments,score,selftext,subreddit,title,created,d_
2017-04-14 11:55:28,65c379,1,1,[deleted],transgender,These guys in /r/biology are trying to argue that transwomen are not real women. Let's show them are combined knowledge and emotional experiences and Correct The Record!,1492196128.0,"{'created_utc': 1492170928, 'id': '65c379', 'num_comments': 1, 'score': 1, 'selftext': '[deleted]', 'subreddit': 'transgender', 'title': ""These guys in /r/biology are trying to argue that transwomen are not real women. Let's show them are combined knowledge and emotional experiences and Correct The Record!"", 'created': 1492196128.0}"
2017-04-14 15:12:45,65d2sk,27,114,,transgender,Trump Administration drops discrimination lawsuit against N.C.'s bathroom bill,1492207965.0,"{'created_utc': 1492182765, 'id': '65d2sk', 'num_comments': 27, 'score': 114, 'selftext': '', 'subreddit': 'transgender', 'title': ""Trump Administration drops discrimination lawsuit against N.C.'s bathroom bill"", 'created': 1492207965.0}"
2017-04-14 16:25:41,65dig2,10,81,,transgender,LiveJournal servers are now in Russia. LGBT and politics talk is banned.,1492212341.0,"{'created_utc': 1492187141, 'id': '65dig2', 'num_comments': 10, 'score': 81, 'selftext': '', 'subreddit': 'transgender', 'title': 'LiveJournal servers are now in Russia. LGBT and politics talk is banned.', 'created': 1492212341.0}"
2017-04-14 21:12:38,65f9em,2,12,,transgender,"The Leeway Transformation Award – $15,000 for Transgendered Writers and Artists In The Delaware Valley Region",1492229558.0,"{'created_utc': 1492204358, 'id': '65f9em', 'num_comments': 2, 'score': 12, 'selftext': '', 'subreddit': 'transgender', 'title': 'The Leeway Transformation Award – $15,000 for Transgendered Writers and Artists In The Delaware Valley Region', 'created': 1492229558.0}"
2017-04-14 21:12:47,65f9fn,5,30,,transgender,Good article thought you folks would get a kick out of,1492229567.0,"{'created_utc': 1492204367, 'id': '65f9fn', 'num_comments': 5, 'score': 30, 'selftext': '', 'subreddit': 'transgender', 'title': 'Good article thought you folks would get a kick out of', 'created': 1492229567.0}"
2017-04-15 00:52:13,65ge1o,3,47,,transgender,My Long Road to Genital Reassignment Surgery,1492242733.0,"{'created_utc': 1492217533, 'id': '65ge1o', 'num_comments': 3, 'score': 47, 'selftext': '', 'subreddit': 'transgender', 'title': 'My Long Road to Genital Reassignment Surgery', 'created': 1492242733.0}"
2017-04-15 15:22:01,65jlfb,5,42,,transgender,Enough With The Weird Fixation On Caitlyn Jenner’s Genitalia,1492294921.0,"{'created_utc': 1492269721, 'id': '65jlfb', 'num_comments': 5, 'score': 42, 'selftext': '', 'subreddit': 'transgender', 'title': 'Enough With The Weird Fixation On Caitlyn Jenner’s Genitalia', 'created': 1492294921.0}"
2017-04-15 16:22:11,65jwur,15,97,,transgender,Court dismisses lawsuit by student ‘distressed’ over schools’ transgender policy,1492298531.0,"{'created_utc': 1492273331, 'id': '65jwur', 'num_comments': 15, 'score': 97, 'selftext': '', 'subreddit': 'transgender', 'title': 'Court dismisses lawsuit by student ‘distressed’ over schools’ transgender policy', 'created': 1492298531.0}"
2017-04-15 16:36:32,65jzne,1,31,,transgender,Stanford Launches Short Online Course To Boost Understanding Of Transgender Kids,1492299392.0,"{'created_utc': 1492274192, 'id': '65jzne', 'num_comments': 1, 'score': 31, 'selftext': '', 'subreddit': 'transgender', 'title': 'Stanford Launches Short Online Course To Boost Understanding Of Transgender Kids', 'created': 1492299392.0}"
2017-04-15 23:06:07,65m11w,35,44,[deleted],transgender,North Carolina School Board Lets Kids Carry Pepper Spray in Case They Encounter Trans Students,1492322767.0,"{'created_utc': 1492297567, 'id': '65m11w', 'num_comments': 35, 'score': 44, 'selftext': '[deleted]', 'subreddit': 'transgender', 'title': 'North Carolina School Board Lets Kids Carry Pepper Spray in Case They Encounter Trans Students', 'created': 1492322767.0}"
2017-04-16 01:39:55,65mqkn,50,195,,transgender,‘Survivor’ Contestant Fired From Job After Transgender Outing Controversy,1492331995.0,"{'created_utc': 1492306795, 'id': '65mqkn', 'num_comments': 50, 'score': 195, 'selftext': '', 'subreddit': 'transgender', 'title': '‘Survivor’ Contestant Fired From Job After Transgender Outing Controversy', 'created': 1492331995.0}"
2017-04-16 10:17:55,65oh2d,9,0,,transgender,Are crossgender sexualities more prone to porn addiction?,1492363075.0,"{'created_utc': 1492337875, 'id': '65oh2d', 'num_comments': 9, 'score': 0, 'selftext': '', 'subreddit': 'transgender', 'title': 'Are crossgender sexualities more prone to porn addiction?', 'created': 1492363075.0}"
2017-04-16 23:52:00,65s8se,0,1,[deleted],transgender,GENDER BINARY (FUCK YOU) - Ryan Cassata,1492411920.0,"{'created_utc': 1492386720, 'id': '65s8se', 'num_comments': 0, 'score': 1, 'selftext': '[deleted]', 'subreddit': 'transgender', 'title': 'GENDER BINARY (FUCK YOU) - Ryan Cassata', 'created': 1492411920.0}"
2017-04-17 03:07:07,65t6h2,6,142,,transgender,"Racing driver transitions, then studies to become a ballerina",1492423627.0,"{'created_utc': 1492398427, 'id': '65t6h2', 'num_comments': 6, 'score': 142, 'selftext': '', 'subreddit': 'transgender', 'title': 'Racing driver transitions, then studies to become a ballerina', 'created': 1492423627.0}"
2017-04-17 07:06:12,65u474,1,1,[deleted],transgender,I would have been Jenny,1492437972.0,"{'created_utc': 1492412772, 'id': '65u474', 'num_comments': 1, 'score': 1, 'selftext': '[deleted]', 'subreddit': 'transgender', 'title': 'I would have been Jenny', 'created': 1492437972.0}"
2017-04-17 16:54:14,65wrhb,0,31,,transgender,Connie Rice on Gender Equality in Virginia.,1492473254.0,"{'created_utc': 1492448054, 'id': '65wrhb', 'num_comments': 0, 'score': 31, 'selftext': '', 'subreddit': 'transgender', 'title': 'Connie Rice on Gender Equality in Virginia.', 'created': 1492473254.0}"
2017-04-17 18:56:22,65xjpd,0,1,,transgender,"TIL: J-mi, one of the creators of the Dance Dance Revolution song ""Butterfly"" (among others), is trans!",1492480582.0,"{'created_utc': 1492455382, 'id': '65xjpd', 'num_comments': 0, 'score': 1, 'selftext': '', 'subreddit': 'transgender', 'title': 'TIL: J-mi, one of the creators of the Dance Dance Revolution song ""Butterfly"" (among others), is trans!', 'created': 1492480582.0}"
2017-04-18 03:39:59,660i0p,1,37,,transgender,A Powerful New Series Is Exploring What It’s Like To Grow Up Trans,1492511999.0,"{'created_utc': 1492486799, 'id': '660i0p', 'num_comments': 1, 'score': 37, 'selftext': '', 'subreddit': 'transgender', 'title': 'A Powerful New Series Is Exploring What It’s Like To Grow Up Trans', 'created': 1492511999.0}"
2017-04-18 13:36:29,662uwl,20,95,,transgender,"Transgender bathroom bill could cost Texas $3 billion a year, study says",1492547789.0,"{'created_utc': 1492522589, 'id': '662uwl', 'num_comments': 20, 'score': 95, 'selftext': '', 'subreddit': 'transgender', 'title': 'Transgender bathroom bill could cost Texas $3 billion a year, study says', 'created': 1492547789.0}"
2017-04-18 13:39:57,662vkz,0,23,,transgender,Why I joined the trans protest against Woman's Hour's Jenni Murray,1492547997.0,"{'created_utc': 1492522797, 'id': '662vkz', 'num_comments': 0, 'score': 23, 'selftext': '', 'subreddit': 'transgender', 'title': ""Why I joined the trans protest against Woman's Hour's Jenni Murray"", 'created': 1492547997.0}"
2017-04-18 14:37:51,6637jx,71,135,,transgender,17 year old sentenced to 6 years imprisonment for transgender hate attack,1492551471.0,"{'created_utc': 1492526271, 'id': '6637jx', 'num_comments': 71, 'score': 135, 'selftext': '', 'subreddit': 'transgender', 'title': '17 year old sentenced to 6 years imprisonment for transgender hate attack', 'created': 1492551471.0}"
2017-04-18 14:55:39,663bbq,54,160,,transgender,I Met a Pastor Who Thinks 'Transgenders' Are Deceptive—He Didn’t Know I’m Trans,1492552539.0,"{'created_utc': 1492527339, 'id': '663bbq', 'num_comments': 54, 'score': 160, 'selftext': '', 'subreddit': 'transgender', 'title': ""I Met a Pastor Who Thinks 'Transgenders' Are Deceptive—He Didn’t Know I’m Trans"", 'created': 1492552539.0}"
2017-04-18 20:20:03,665exe,1,34,,transgender,Twitter Hashtag Reveals Just How Damaging Expectations Of Masculinity Can Be,1492572003.0,"{'created_utc': 1492546803, 'id': '665exe', 'num_comments': 1, 'score': 34, 'selftext': '', 'subreddit': 'transgender', 'title': 'Twitter Hashtag Reveals Just How Damaging Expectations Of Masculinity Can Be', 'created': 1492572003.0}"
2017-04-18 20:53:39,665mke,1,9,,transgender,Best LGBT Podcasts (2017),1492574019.0,"{'created_utc': 1492548819, 'id': '665mke', 'num_comments': 1, 'score': 9, 'selftext': '', 'subreddit': 'transgender', 'title': 'Best LGBT Podcasts (2017)', 'created': 1492574019.0}"
2017-04-18 22:02:52,6661u1,3,20,,transgender,"Texas Gov. Abbott signals support for ""bathroom bill"" from Texas House",1492578172.0,"{'created_utc': 1492552972, 'id': '6661u1', 'num_comments': 3, 'score': 20, 'selftext': '', 'subreddit': 'transgender', 'title': 'Texas Gov. Abbott signals support for ""bathroom bill"" from Texas House', 'created': 1492578172.0}"
2017-04-19 00:01:38,666pnb,2,52,,transgender,Transgender students in TX speak out against SB6,1492585298.0,"{'created_utc': 1492560098, 'id': '666pnb', 'num_comments': 2, 'score': 52, 'selftext': '', 'subreddit': 'transgender', 'title': 'Transgender students in TX speak out against SB6', 'created': 1492585298.0}"
2017-04-19 00:31:16,666vh1,0,15,,transgender,The latest in the ongoing saga involving a trans police officer and the San Diego LGBT Center,1492587076.0,"{'created_utc': 1492561876, 'id': '666vh1', 'num_comments': 0, 'score': 15, 'selftext': '', 'subreddit': 'transgender', 'title': 'The latest in the ongoing saga involving a trans police officer and the San Diego LGBT Center', 'created': 1492587076.0}"
2017-04-19 01:44:15,667971,0,1,[deleted],transgender,"Fuck trans people, you all have autism",1492591455.0,"{'created_utc': 1492566255, 'id': '667971', 'num_comments': 0, 'score': 1, 'selftext': '[deleted]', 'subreddit': 'transgender', 'title': 'Fuck trans people, you all have autism', 'created': 1492591455.0}"
2017-04-19 12:04:15,669r26,6,86,,transgender,Lambda Legal Sues Over Idaho's Anti-Trans Birth Certificate Policy,1492628655.0,"{'created_utc': 1492603455, 'id': '669r26', 'num_comments': 6, 'score': 86, 'selftext': '', 'subreddit': 'transgender', 'title': ""Lambda Legal Sues Over Idaho's Anti-Trans Birth Certificate Policy"", 'created': 1492628655.0}"
2017-04-19 19:16:08,66ces1,26,74,,transgender,My Daughter Is Not Transgender. She's a Tomboy.,1492654568.0,"{'created_utc': 1492629368, 'id': '66ces1', 'num_comments': 26, 'score': 74, 'selftext': '', 'subreddit': 'transgender', 'title': ""My Daughter Is Not Transgender. She's a Tomboy."", 'created': 1492654568.0}"
2017-04-20 00:23:28,66e9qf,7,10,,transgender,[NSFW] Sex Post-Transition (FTM),1492673008.0,"{'created_utc': 1492647808, 'id': '66e9qf', 'num_comments': 7, 'score': 10, 'selftext': '', 'subreddit': 'transgender', 'title': '[NSFW] Sex Post-Transition (FTM)', 'created': 1492673008.0}"
2017-04-20 08:04:22,66gcbx,0,1,,transgender,1 day vs 6 months.,1492700662.0,"{'created_utc': 1492675462, 'id': '66gcbx', 'num_comments': 0, 'score': 1, 'selftext': '', 'subreddit': 'transgender', 'title': '1 day vs 6 months.', 'created': 1492700662.0}"
2017-04-20 13:43:49,66hrko,17,13,,transgender,"My voice, then and now",1492721029.0,"{'created_utc': 1492695829, 'id': '66hrko', 'num_comments': 17, 'score': 13, 'selftext': '', 'subreddit': 'transgender', 'title': 'My voice, then and now', 'created': 1492721029.0}"
2017-04-20 15:52:48,66ikvg,1,13,,transgender,How I came out as mtf/genderqueer to the public,1492728768.0,"{'created_utc': 1492703568, 'id': '66ikvg', 'num_comments': 1, 'score': 13, 'selftext': '', 'subreddit': 'transgender', 'title': 'How I came out as mtf/genderqueer to the public', 'created': 1492728768.0}"
2017-04-20 17:18:33,66j5qw,9,85,,transgender,Dallas aims to get its LGBT homeless youth off the streets by 2020,1492733913.0,"{'created_utc': 1492708713, 'id': '66j5qw', 'num_comments': 9, 'score': 85, 'selftext': '', 'subreddit': 'transgender', 'title': 'Dallas aims to get its LGBT homeless youth off the streets by 2020', 'created': 1492733913.0}"
2017-04-20 19:14:48,66jxu9,0,2,,transgender,"I'm glad these are still out there and getting viewed, I hope they help to protect us in the immediate future and change society's viewpoints so we have greater acceptance.",1492740888.0,"{'created_utc': 1492715688, 'id': '66jxu9', 'num_comments': 0, 'score': 2, 'selftext': '', 'subreddit': 'transgender', 'title': ""I'm glad these are still out there and getting viewed, I hope they help to protect us in the immediate future and change society's viewpoints so we have greater acceptance."", 'created': 1492740888.0}"
2017-04-20 19:39:40,66k3rl,0,8,,transgender,Biography on Civil Rights Hero and Legal Scholar Pauli Murray Sheds Light on her Gender Identity,1492742380.0,"{'created_utc': 1492717180, 'id': '66k3rl', 'num_comments': 0, 'score': 8, 'selftext': '', 'subreddit': 'transgender', 'title': 'Biography on Civil Rights Hero and Legal Scholar Pauli Murray Sheds Light on her Gender Identity', 'created': 1492742380.0}"
2017-04-21 00:16:51,66lshi,13,96,,transgender,An Open Letter to Those Praising the New York Times “Tomboy” Piece,1492759011.0,"{'created_utc': 1492733811, 'id': '66lshi', 'num_comments': 13, 'score': 96, 'selftext': '', 'subreddit': 'transgender', 'title': 'An Open Letter to Those Praising the New York Times “Tomboy” Piece', 'created': 1492759011.0}"
2017-04-21 00:17:38,66lsn1,16,33,,transgender,Intentionally Misgendering Transgender People is Considered Violence,1492759058.0,"{'created_utc': 1492733858, 'id': '66lsn1', 'num_comments': 16, 'score': 33, 'selftext': '', 'subreddit': 'transgender', 'title': 'Intentionally Misgendering Transgender People is Considered Violence', 'created': 1492759058.0}"
2017-04-21 03:26:23,66ms30,44,4,[deleted],transgender,Caitlyn Jenner is planning a NUDE photo shoot,1492770383.0,"{'created_utc': 1492745183, 'id': '66ms30', 'num_comments': 44, 'score': 4, 'selftext': '[deleted]', 'subreddit': 'transgender', 'title': 'Caitlyn Jenner is planning a NUDE photo shoot', 'created': 1492770383.0}"
2017-04-21 05:48:44,66ndvb,2,4,,transgender,My Friend's Book!,1492778924.0,"{'created_utc': 1492753724, 'id': '66ndvb', 'num_comments': 2, 'score': 4, 'selftext': '', 'subreddit': 'transgender', 'title': ""My Friend's Book!"", 'created': 1492778924.0}"
2017-04-21 09:45:27,66o753,1,1,,transgender,Hello I'm Penny Rose I'm a 37 year old transgendered artist. This is my blog,1492793127.0,"{'created_utc': 1492767927, 'id': '66o753', 'num_comments': 1, 'score': 1, 'selftext': '', 'subreddit': 'transgender', 'title': ""Hello I'm Penny Rose I'm a 37 year old transgendered artist. This is my blog"", 'created': 1492793127.0}"
2017-04-21 16:18:40,66q7uu,11,156,,transgender,Virginia trans teen is youngest of Time Magazine’s ‘Most Influential People’ for 2017,1492816720.0,"{'created_utc': 1492791520, 'id': '66q7uu', 'num_comments': 11, 'score': 156, 'selftext': '', 'subreddit': 'transgender', 'title': 'Virginia trans teen is youngest of Time Magazine’s ‘Most Influential People’ for 2017', 'created': 1492816720.0}"
2017-04-21 18:23:39,66r1db,3,20,,transgender,How to Make Primary Care Transgender-Friendly,1492824219.0,"{'created_utc': 1492799019, 'id': '66r1db', 'num_comments': 3, 'score': 20, 'selftext': '', 'subreddit': 'transgender', 'title': 'How to Make Primary Care Transgender-Friendly', 'created': 1492824219.0}"
2017-04-21 19:30:30,66rghy,1,1,,transgender,Transgender Relationship Experiences Research Study!,1492828230.0,"{'created_utc': 1492803030, 'id': '66rghy', 'num_comments': 1, 'score': 1, 'selftext': '', 'subreddit': 'transgender', 'title': 'Transgender Relationship Experiences Research Study!', 'created': 1492828230.0}"
2017-04-21 20:41:37,66rvye,0,1,,transgender,Anyone know of any studies requiring trans folk I could take part in?,1492832497.0,"{'created_utc': 1492807297, 'id': '66rvye', 'num_comments': 0, 'score': 1, 'selftext': '', 'subreddit': 'transgender', 'title': 'Anyone know of any studies requiring trans folk I could take part in?', 'created': 1492832497.0}"
2017-04-21 20:57:22,66rz97,1,1,,transgender,How It Feels When Your Girlfriend Tells You She's Your Boyfriend,1492833442.0,"{'created_utc': 1492808242, 'id': '66rz97', 'num_comments': 1, 'score': 1, 'selftext': '', 'subreddit': 'transgender', 'title': ""How It Feels When Your Girlfriend Tells You She's Your Boyfriend"", 'created': 1492833442.0}"
2017-04-21 21:03:42,66s0nw,1,1,,transgender,T.V.D- Men Who are Attracted to Trans women,1492833822.0,"{'created_utc': 1492808622, 'id': '66s0nw', 'num_comments': 1, 'score': 1, 'selftext': '', 'subreddit': 'transgender', 'title': 'T.V.D- Men Who are Attracted to Trans women', 'created': 1492833822.0}"
2017-04-21 23:48:59,66swvc,11,124,,transgender,Trump Pick For Army Secretary Says He Opposes Transgender Equality Because He Must ‘Crush Evil’,1492843739.0,"{'created_utc': 1492818539, 'id': '66swvc', 'num_comments': 11, 'score': 124, 'selftext': '', 'subreddit': 'transgender', 'title': 'Trump Pick For Army Secretary Says He Opposes Transgender Equality Because He Must ‘Crush Evil’', 'created': 1492843739.0}"
2017-04-22 00:59:29,66t95k,14,3,,transgender,"Hey, I'm having a debate with some people about being transgender. Anyone want to help?",1492847969.0,"{'created_utc': 1492822769, 'id': '66t95k', 'num_comments': 14, 'score': 3, 'selftext': '', 'subreddit': 'transgender', 'title': ""Hey, I'm having a debate with some people about being transgender. Anyone want to help?"", 'created': 1492847969.0}"
2017-04-22 03:05:34,66ttxj,4,1,,transgender,Gender Is Over! If You Want It - The pitfalls of advocating for a post-gender world.,1492855534.0,"{'created_utc': 1492830334, 'id': '66ttxj', 'num_comments': 4, 'score': 1, 'selftext': '', 'subreddit': 'transgender', 'title': 'Gender Is Over! If You Want It - The pitfalls of advocating for a post-gender world.', 'created': 1492855534.0}"
2017-04-22 03:28:18,66txf0,0,1,,transgender,Caitlyn Jenner: America’s Most Famous Transgender Tells Diane Sawyer She Takes Up To 40 Selfies A Day,1492856898.0,"{'created_utc': 1492831698, 'id': '66txf0', 'num_comments': 0, 'score': 1, 'selftext': '', 'subreddit': 'transgender', 'title': 'Caitlyn Jenner: America’s Most Famous Transgender Tells Diane Sawyer She Takes Up To 40 Selfies A Day', 'created': 1492856898.0}"
2017-04-22 03:56:59,66u1rv,17,0,[deleted],transgender,Pedophiles Are Trying To Squeeze Their Way Into The LGBT Movement,1492858619.0,"{'created_utc': 1492833419, 'id': '66u1rv', 'num_comments': 17, 'score': 0, 'selftext': '[deleted]', 'subreddit': 'transgender', 'title': 'Pedophiles Are Trying To Squeeze Their Way Into The LGBT Movement', 'created': 1492858619.0}"
2017-04-22 04:28:46,66u6h7,0,1,[deleted],transgender,Kylie Jenner &amp; Kendall Jenner Not Happy Caitlyn Jenner Removed Penis,1492860526.0,"{'created_utc': 1492835326, 'id': '66u6h7', 'num_comments': 0, 'score': 1, 'selftext': '[deleted]', 'subreddit': 'transgender', 'title': 'Kylie Jenner &amp; Kendall Jenner Not Happy Caitlyn Jenner Removed Penis', 'created': 1492860526.0}"
2017-04-22 11:42:57,66vjgn,3,4,[deleted],transgender,Looking for Answers on 14th Street,1492886577.0,"{'created_utc': 1492861377, 'id': '66vjgn', 'num_comments': 3, 'score': 4, 'selftext': '[deleted]', 'subreddit': 'transgender', 'title': 'Looking for Answers on 14th Street', 'created': 1492886577.0}"
2017-04-22 16:17:31,66wscu,0,1,[deleted],transgender,Transgender as therapy,1492903051.0,"{'created_utc': 1492877851, 'id': '66wscu', 'num_comments': 0, 'score': 1, 'selftext': '[deleted]', 'subreddit': 'transgender', 'title': 'Transgender as therapy', 'created': 1492903051.0}"
2017-04-22 20:36:10,66y7oa,2,12,,transgender,"Never liked Caitlyn, but her interview with Diane Sawyer on 20/20 Friday night was (surprisingly) good.",1492918570.0,"{'created_utc': 1492893370, 'id': '66y7oa', 'num_comments': 2, 'score': 12, 'selftext': '', 'subreddit': 'transgender', 'title': 'Never liked Caitlyn, but her interview with Diane Sawyer on 20/20 Friday night was (surprisingly) good.', 'created': 1492918570.0}"
2017-04-22 21:43:32,66yklp,75,178,,transgender,"So - it appears that NYT Opinion author left out one little detail. Yes, her child is trans.",1492922612.0,"{'created_utc': 1492897412, 'id': '66yklp', 'num_comments': 75, 'score': 178, 'selftext': '', 'subreddit': 'transgender', 'title': 'So - it appears that NYT Opinion author left out one little detail. Yes, her child is trans.', 'created': 1492922612.0}"
2017-04-23 00:12:35,66zbll,2,15,,transgender,"Senator Frank Artiles, Bathroom Bill author, resigns",1492931555.0,"{'created_utc': 1492906355, 'id': '66zbll', 'num_comments': 2, 'score': 15, 'selftext': '', 'subreddit': 'transgender', 'title': 'Senator Frank Artiles, Bathroom Bill author, resigns', 'created': 1492931555.0}"
2017-04-23 00:13:03,66zbnz,8,30,,transgender,Inspiring: This Progressive Bully Torments Transgender Students Using Their Preferred Pronoun,1492931583.0,"{'created_utc': 1492906383, 'id': '66zbnz', 'num_comments': 8, 'score': 30, 'selftext': '', 'subreddit': 'transgender', 'title': 'Inspiring: This Progressive Bully Torments Transgender Students Using Their Preferred Pronoun', 'created': 1492931583.0}"
2017-04-23 02:46:16,6700li,10,133,,transgender,"Trans Woman Chay Reed Shot &amp; Killed in Miami, 9th Trans Woman in 2017",1492940776.0,"{'created_utc': 1492915576, 'id': '6700li', 'num_comments': 10, 'score': 133, 'selftext': '', 'subreddit': 'transgender', 'title': 'Trans Woman Chay Reed Shot &amp; Killed in Miami, 9th Trans Woman in 2017', 'created': 1492940776.0}"
2017-04-23 03:38:00,6708h3,19,82,,transgender,Trump Pick For Army Secretary Says He Opposes Transgender Equality Because He Must 'Crush Evil',1492943880.0,"{'created_utc': 1492918680, 'id': '6708h3', 'num_comments': 19, 'score': 82, 'selftext': '', 'subreddit': 'transgender', 'title': ""Trump Pick For Army Secretary Says He Opposes Transgender Equality Because He Must 'Crush Evil'"", 'created': 1492943880.0}"
2017-04-23 20:55:44,674nz8,24,62,,transgender,How Trans Consultants Saved Dragon Age: Inquisition Trans Representation,1493006144.0,"{'created_utc': 1492980944, 'id': '674nz8', 'num_comments': 24, 'score': 62, 'selftext': '', 'subreddit': 'transgender', 'title': 'How Trans Consultants Saved Dragon Age: Inquisition Trans Representation', 'created': 1493006144.0}"
2017-04-24 00:14:35,675qg2,0,1,,transgender,1 day vs 6 months.,1493018075.0,"{'created_utc': 1492992875, 'id': '675qg2', 'num_comments': 0, 'score': 1, 'selftext': '', 'subreddit': 'transgender', 'title': '1 day vs 6 months.', 'created': 1493018075.0}"
2017-04-24 00:44:44,675w35,0,1,,transgender,1 day vs 6 months on T,1493019884.0,"{'created_utc': 1492994684, 'id': '675w35', 'num_comments': 0, 'score': 1, 'selftext': '', 'subreddit': 'transgender', 'title': '1 day vs 6 months on T', 'created': 1493019884.0}"
2017-04-24 03:01:05,676kb9,13,131,,transgender,"""I Had 4 Boys Until One of Them Told Me She Was Really a Girl""- Beautiful story from southern Christian mom",1493028065.0,"{'created_utc': 1493002865, 'id': '676kb9', 'num_comments': 13, 'score': 131, 'selftext': '', 'subreddit': 'transgender', 'title': '""I Had 4 Boys Until One of Them Told Me She Was Really a Girl""- Beautiful story from southern Christian mom', 'created': 1493028065.0}"
2017-04-24 12:48:18,678tg7,10,44,,transgender,Texas Governor to work with politicians to pass ‘bathroom bill’,1493063298.0,"{'created_utc': 1493038098, 'id': '678tg7', 'num_comments': 10, 'score': 44, 'selftext': '', 'subreddit': 'transgender', 'title': 'Texas Governor to work with politicians to pass ‘bathroom bill’', 'created': 1493063298.0}"
2017-04-24 16:04:15,679z4r,0,1,,transgender,My Girlfriend Proposed to me after her talk on the science of being transgender at Reason Con in North Carolina. We are both Transgender women.,1493075055.0,"{'created_utc': 1493049855, 'id': '679z4r', 'num_comments': 0, 'score': 1, 'selftext': '', 'subreddit': 'transgender', 'title': 'My Girlfriend Proposed to me after her talk on the science of being transgender at Reason Con in North Carolina. We are both Transgender women.', 'created': 1493075055.0}"
2017-04-24 18:01:15,67arai,1,18,,transgender,How Your Voice Conveys Your Gender,1493082075.0,"{'created_utc': 1493056875, 'id': '67arai', 'num_comments': 1, 'score': 18, 'selftext': '', 'subreddit': 'transgender', 'title': 'How Your Voice Conveys Your Gender', 'created': 1493082075.0}"
2017-04-24 20:01:08,67bjs6,6,113,,transgender,National LGBTQ campaign group backs transgender candidate in race agianst author of Virginia’s same-sex marriage ban,1493089268.0,"{'created_utc': 1493064068, 'id': '67bjs6', 'num_comments': 6, 'score': 113, 'selftext': '', 'subreddit': 'transgender', 'title': 'National LGBTQ campaign group backs transgender candidate in race agianst author of Virginia’s same-sex marriage ban', 'created': 1493089268.0}"
2017-04-24 20:58:31,67bx7p,7,39,,transgender,First plus-size trans model ‘will be part of campaign with full LGBT representation’,1493092711.0,"{'created_utc': 1493067511, 'id': '67bx7p', 'num_comments': 7, 'score': 39, 'selftext': '', 'subreddit': 'transgender', 'title': 'First plus-size trans model ‘will be part of campaign with full LGBT representation’', 'created': 1493092711.0}"
