created_utc,id,num_comments,score,selftext,subreddit,title,created,d_
2017-07-08 13:40:55,6m10r8,10,14,"Wish I wore them sooner. They keep my legs cooler than my over the knee shorts, and no fabric rubbing against my knees. I am a bit weary of wearing them in public but for indoors they are great.

https://www.instagram.com/p/BWQipdwhlcH/

First outfit is from the men's section, the Soffee's running shorts are made of nylon and feel so luxurious, I wish all my clothes were made of nylon! I have switched to mostly nylon undies now mostly men's but expanding to women's too. Wish it had pockets though. Not sure how I feel about the split sides. 

Second outfit is from women's section, I don't know why but so far all the short shorts I have encountered only have key pockets, except for underarmor. The pockets aren't that big but enough to hold my phone. I love the design, it is always nice to have something different from the usual solid color design. I will probably get some more women's underarmor shorts.

I cut an old pair of khakis and jeans, just need to hem the edges to make them mid thigh length. Should be more appropriate for going outside. Might need to get new khaki shorts though because my old ones are so baggy. I prefer tighter clothes now. I wore the jean shorts outside with my mom into a crowded area. I felt rather selfconcious, like out of dozens of people there only like 3 guys were wearing above the knee shorts and only 1 of them had long hair.

https://www.instagram.com/p/BWOr1johdff/

I have only been around the yard in my short shorts and I did notice some people passing by staring at me but I also have long hair and a shaggy beard so who knows which part is giving them pause, maybe all of them lol. but the only people who has said anything to me is my family. my mom kept saying stuff like ""wow your shorts are so short."" ""i didn't know they made men's shorts so short."" my cousin asked me why I am wearing girl shorts. and I ignored him. Then my mom attitude changed. ""you should pay more attention and make sure you don't buy the wrong shorts"" I told her I know its womens shorts. and she said ""men should not be wearing women's clothes"" my family has already been giving me shit for wearing leggings and skinny jeans. my mom also keeps pointing out that I have pink socks and pink underwear (despite them being men's boxer briefs). that's the only color that she points out.

I need to get some more vnecks too. most of my tops strangle my neck which is great for winter since it keeps me warm, but feels bad during the summer. I am motivated by price so far mostly buying clothes from marshals and their clothes seem to be mainstream gendered clothes. men's shirts barely any vnecks and all the shorts are 9+ inch inseams. women's shirts lots of vnecks and scoop necks, and almost all their shorts are 2 inch inseams. tempted to get a 2 inch inseam chino/khaki shorts but that will guarantee people staring and vocal disapproval from family. I also checked gap their mens shorts are also all long. but they do have midthigh womens shorts. but pricey though. that's why i am trying out cutting my old pants will have to see if I am okay with the super baggy shorts if not. I know about Chubbies and other brands that sell midthigh men's shorts but they all cost $50 or more. It would literally be cheaper to buy some slim fit chinos and cut them to the length I desire.",genderqueer,short shorts are amazing,1499546455.0,"{'created_utc': 1499521255, 'id': '6m10r8', 'num_comments': 10, 'score': 14, 'selftext': 'Wish I wore them sooner. They keep my legs cooler than my over the knee shorts, and no fabric rubbing against my knees. I am a bit weary of wearing them in public but for indoors they are great.\n\nhttps://www.instagram.com/p/BWQipdwhlcH/\n\nFirst outfit is from the men\'s section, the Soffee\'s running shorts are made of nylon and feel so luxurious, I wish all my clothes were made of nylon! I have switched to mostly nylon undies now mostly men\'s but expanding to women\'s too. Wish it had pockets though. Not sure how I feel about the split sides. \n\nSecond outfit is from women\'s section, I don\'t know why but so far all the short shorts I have encountered only have key pockets, except for underarmor. The pockets aren\'t that big but enough to hold my phone. I love the design, it is always nice to have something different from the usual solid color design. I will probably get some more women\'s underarmor shorts.\n\nI cut an old pair of khakis and jeans, just need to hem the edges to make them mid thigh length. Should be more appropriate for going outside. Might need to get new khaki shorts though because my old ones are so baggy. I prefer tighter clothes now. I wore the jean shorts outside with my mom into a crowded area. I felt rather selfconcious, like out of dozens of people there only like 3 guys were wearing above the knee shorts and only 1 of them had long hair.\n\nhttps://www.instagram.com/p/BWOr1johdff/\n\nI have only been around the yard in my short shorts and I did notice some people passing by staring at me but I also have long hair and a shaggy beard so who knows which part is giving them pause, maybe all of them lol. but the only people who has said anything to me is my family. my mom kept saying stuff like ""wow your shorts are so short."" ""i didn\'t know they made men\'s shorts so short."" my cousin asked me why I am wearing girl shorts. and I ignored him. Then my mom attitude changed. ""you should pay more attention and make sure you don\'t buy the wrong shorts"" I told her I know its womens shorts. and she said ""men should not be wearing women\'s clothes"" my family has already been giving me shit for wearing leggings and skinny jeans. my mom also keeps pointing out that I have pink socks and pink underwear (despite them being men\'s boxer briefs). that\'s the only color that she points out.\n\nI need to get some more vnecks too. most of my tops strangle my neck which is great for winter since it keeps me warm, but feels bad during the summer. I am motivated by price so far mostly buying clothes from marshals and their clothes seem to be mainstream gendered clothes. men\'s shirts barely any vnecks and all the shorts are 9+ inch inseams. women\'s shirts lots of vnecks and scoop necks, and almost all their shorts are 2 inch inseams. tempted to get a 2 inch inseam chino/khaki shorts but that will guarantee people staring and vocal disapproval from family. I also checked gap their mens shorts are also all long. but they do have midthigh womens shorts. but pricey though. that\'s why i am trying out cutting my old pants will have to see if I am okay with the super baggy shorts if not. I know about Chubbies and other brands that sell midthigh men\'s shorts but they all cost $50 or more. It would literally be cheaper to buy some slim fit chinos and cut them to the length I desire.', 'subreddit': 'genderqueer', 'title': 'short shorts are amazing', 'created': 1499546455.0}"
2017-07-08 14:08:11,6m159e,5,81,,genderqueer,Feeling cute on my 18th birthday! ^.^,1499548091.0,"{'created_utc': 1499522891, 'id': '6m159e', 'num_comments': 5, 'score': 81, 'selftext': '', 'subreddit': 'genderqueer', 'title': 'Feeling cute on my 18th birthday! ^.^', 'created': 1499548091.0}"
2017-07-08 14:11:02,6m15td,3,13,"Hi yall. I'm new here and newly in touch with my trans / non binary identity. 

So I came out to my wife officially as non binary. I'm not changing my name, but asking to be called by a nickname that feels less gendered to me, and now using they/them pronouns.

Soon I'll send a note to my friends and then I guess eventually I'll come out to my parents?

Though I'm having some feelings about that. Because technically nothing is really different about me. So is it worth putting the stress on my mother? It seems like she's finally over my short hair and androgynous style (I'm AFAB and came out as gay 7 years ago). I'm worried if I come out as NB, I'll stress her out over something that, to me, feels like no big deal. 

I'm not doing HRT yet, and don't know that I ever will. Not getting top surgery yet, but may in the future if I can't get my chest size down by losing weight. So yeah like I said, nothing is really changing about me right now.

Has anyone else felt like this? Like they're not ""trans enough"" to need to come out as trans to parents or friends?

ðŸ–¤",genderqueer,"On coming out as non binary but not feeling ""trans enough"" to tell my parents",1499548262.0,"{'created_utc': 1499523062, 'id': '6m15td', 'num_comments': 3, 'score': 13, 'selftext': 'Hi yall. I\'m new here and newly in touch with my trans / non binary identity. \n\nSo I came out to my wife officially as non binary. I\'m not changing my name, but asking to be called by a nickname that feels less gendered to me, and now using they/them pronouns.\n\nSoon I\'ll send a note to my friends and then I guess eventually I\'ll come out to my parents?\n\nThough I\'m having some feelings about that. Because technically nothing is really different about me. So is it worth putting the stress on my mother? It seems like she\'s finally over my short hair and androgynous style (I\'m AFAB and came out as gay 7 years ago). I\'m worried if I come out as NB, I\'ll stress her out over something that, to me, feels like no big deal. \n\nI\'m not doing HRT yet, and don\'t know that I ever will. Not getting top surgery yet, but may in the future if I can\'t get my chest size down by losing weight. So yeah like I said, nothing is really changing about me right now.\n\nHas anyone else felt like this? Like they\'re not ""trans enough"" to need to come out as trans to parents or friends?\n\nðŸ–¤', 'subreddit': 'genderqueer', 'title': 'On coming out as non binary but not feeling ""trans enough"" to tell my parents', 'created': 1499548262.0}"
2017-07-08 23:34:02,6m48q0,1,12,,genderqueer,First time with shaved legs out and about. Feels amazing!,1499582042.0,"{'created_utc': 1499556842, 'id': '6m48q0', 'num_comments': 1, 'score': 12, 'selftext': '', 'subreddit': 'genderqueer', 'title': 'First time with shaved legs out and about. Feels amazing!', 'created': 1499582042.0}"
2017-07-08 23:36:16,6m493u,8,7,"ok so heres the deal, i love me some short shorts, but i have a problem with them in the fact that i cant find underwear i can trust to keep my beef in place. do you cats have any stratageies or underwear that you can reccomend to me? i want to wear short shorts but i dont want my beef falling out and getting me in trouble. thank you for your consideration",genderqueer,AMAB having trouble with short shorts,1499582176.0,"{'created_utc': 1499556976, 'id': '6m493u', 'num_comments': 8, 'score': 7, 'selftext': 'ok so heres the deal, i love me some short shorts, but i have a problem with them in the fact that i cant find underwear i can trust to keep my beef in place. do you cats have any stratageies or underwear that you can reccomend to me? i want to wear short shorts but i dont want my beef falling out and getting me in trouble. thank you for your consideration', 'subreddit': 'genderqueer', 'title': 'AMAB having trouble with short shorts', 'created': 1499582176.0}"
2017-07-09 00:30:32,6m4iv3,3,15,"Hi all today I went out for the second time presenting as female (I'm AMAB). The first time was a couple weeks ago and could've gone better. Anyways, I went to a friend's house where we did facemasks and makeup with another friend. Sidenote they both talked about some personal stuff and other things you wouldn't tell everyone, so it was nice to know they trusted that much. Honestly I really felt like I was treated like a girlfriend, even though I just sat there and soaked it in, not really able to add anything. Although I wish I looked better than I did, I think I looked my best so far.

So we got lunch, and headed to Ulta, a makeup store. I got gendered correctly the entire time by the employees which was super awesome. My friend even used the right name too without me correcting her except for one instance which is totally fine. It's hard to put into words how affirming it is. I only had one situation that became an issue but it doesn't have anything to do with gender.

I definitely have gained more confidence from this and the first time going out presenting how I want to. I never thought I'd ever have to come out (even if it's only a couple people) yet alone go out in public. I might have even come to the point where I come out to more people but still not sure on that, but that's a whole different story. I guess my only regret is not coming out about questioning my gender earlier, only because we're all in college and starting to go our separate ways.

Edit: added info ",genderqueer,Second time out presenting as female,1499585432.0,"{'created_utc': 1499560232, 'id': '6m4iv3', 'num_comments': 3, 'score': 15, 'selftext': ""Hi all today I went out for the second time presenting as female (I'm AMAB). The first time was a couple weeks ago and could've gone better. Anyways, I went to a friend's house where we did facemasks and makeup with another friend. Sidenote they both talked about some personal stuff and other things you wouldn't tell everyone, so it was nice to know they trusted that much. Honestly I really felt like I was treated like a girlfriend, even though I just sat there and soaked it in, not really able to add anything. Although I wish I looked better than I did, I think I looked my best so far.\n\nSo we got lunch, and headed to Ulta, a makeup store. I got gendered correctly the entire time by the employees which was super awesome. My friend even used the right name too without me correcting her except for one instance which is totally fine. It's hard to put into words how affirming it is. I only had one situation that became an issue but it doesn't have anything to do with gender.\n\nI definitely have gained more confidence from this and the first time going out presenting how I want to. I never thought I'd ever have to come out (even if it's only a couple people) yet alone go out in public. I might have even come to the point where I come out to more people but still not sure on that, but that's a whole different story. I guess my only regret is not coming out about questioning my gender earlier, only because we're all in college and starting to go our separate ways.\n\nEdit: added info "", 'subreddit': 'genderqueer', 'title': 'Second time out presenting as female', 'created': 1499585432.0}"
2017-07-09 02:58:52,6m57iy,4,9,"Today was the first time I allowed Jessi to leave the house.  I had confidence in her -- I wasn't ashamed that she existed and she wanted to see the world.  She had been practicing and her net friends said she was ready. So, I let her visit her first real life friend.   She showed off her makeup, outfit, voice, her well practiced walk in heels and got comfortable.  My friend was totally in awe and declared she was ready so off she went to a museum.  She loved driving my car in heels, LOL more aggressive than I.  After the museum and now more confident, she wanted more so then we went makeup shopping, then shoe shopping, to the supermarket to grab something to eat and finally visited Starbucks.  We got complements and smiles along the way maybe one stare but we didn't care.  

I gave her a big hug -- totally embraced her, for the first time, ever.  We smiled, a happy we had never been.",genderqueer,I hugged myself today.,1499594332.0,"{'created_utc': 1499569132, 'id': '6m57iy', 'num_comments': 4, 'score': 9, 'selftext': ""Today was the first time I allowed Jessi to leave the house.  I had confidence in her -- I wasn't ashamed that she existed and she wanted to see the world.  She had been practicing and her net friends said she was ready. So, I let her visit her first real life friend.   She showed off her makeup, outfit, voice, her well practiced walk in heels and got comfortable.  My friend was totally in awe and declared she was ready so off she went to a museum.  She loved driving my car in heels, LOL more aggressive than I.  After the museum and now more confident, she wanted more so then we went makeup shopping, then shoe shopping, to the supermarket to grab something to eat and finally visited Starbucks.  We got complements and smiles along the way maybe one stare but we didn't care.  \n\nI gave her a big hug -- totally embraced her, for the first time, ever.  We smiled, a happy we had never been."", 'subreddit': 'genderqueer', 'title': 'I hugged myself today.', 'created': 1499594332.0}"
2017-07-09 04:02:14,6m5hl9,0,0,[deleted],genderqueer,PeNnIs PaRkEr,1499598134.0,"{'created_utc': 1499572934, 'id': '6m5hl9', 'num_comments': 0, 'score': 0, 'selftext': '[deleted]', 'subreddit': 'genderqueer', 'title': 'PeNnIs PaRkEr', 'created': 1499598134.0}"
2017-07-09 04:32:47,6m5ma5,1,1,,genderqueer,First time out of the house in a dress!,1499599967.0,"{'created_utc': 1499574767, 'id': '6m5ma5', 'num_comments': 1, 'score': 1, 'selftext': '', 'subreddit': 'genderqueer', 'title': 'First time out of the house in a dress!', 'created': 1499599967.0}"
2017-07-09 04:34:53,6m5mmh,24,251,,genderqueer,First time out of the house in a dress!,1499600093.0,"{'created_utc': 1499574893, 'id': '6m5mmh', 'num_comments': 24, 'score': 251, 'selftext': '', 'subreddit': 'genderqueer', 'title': 'First time out of the house in a dress!', 'created': 1499600093.0}"
2017-07-09 06:13:40,6m6066,0,10,"I'm AMAB and not sure exactly what my gender is, so I use genderqueer. I present mostly male, though I wear women's clothes and nail polish and currently have most of my body hair shaved.

I'm polyamorous, and my two main relationships started before I have identified as non-cisgendered. As a result, I can never tell if they see me as anything but a man. If they just love me for me, or really get my gender. I still get misgendered a lot by one of them, but it doesn't really hurt, because she does it semi-ironically, or something. Also, she doesn't do it when it really matters, when I feel vulnerable.

Anyway, I started seeing someone new, and she talks to me in mixed language (much more important in Hebrew, where it's really hard to speak in neutral language). I really appreciated it, and she was basically the first one to show an interest in me, post genderqueer identity, with the way I present and all. Because of this, it was really painful when she misgendered me last night, but not only that, she got angry that I focused on myself.

Basically, she said something about herself, and she felt she was exposing herself and her thoughts, but one of those thoughts was along the lines of ""He's just another guy..."". So I told her it bummed me, and the conversation went around that for a bit until she told me she was angry and the conversation was over.

This morning I wake up to a message saying that she was angry because I took the conversation back to me when she tried to say some things about her. Then she threw my own words in my face, me saying that I'm aware of the fact I take up space as a man would, and is the reason I identified as male non-conforming for a while. So she said Man, or not, you didn't give me space.

I feel like she doesn't quite get how hurtful that misgendering is, especially that last bit. But I don't know, maybe I'm overreacting. Maybe I'm being defensive instead of admitting I was wrong. But I'm hurting, so I'm sharing.",genderqueer,I need to share my pain.,1499606020.0,"{'created_utc': 1499580820, 'id': '6m6066', 'num_comments': 0, 'score': 10, 'selftext': 'I\'m AMAB and not sure exactly what my gender is, so I use genderqueer. I present mostly male, though I wear women\'s clothes and nail polish and currently have most of my body hair shaved.\n\nI\'m polyamorous, and my two main relationships started before I have identified as non-cisgendered. As a result, I can never tell if they see me as anything but a man. If they just love me for me, or really get my gender. I still get misgendered a lot by one of them, but it doesn\'t really hurt, because she does it semi-ironically, or something. Also, she doesn\'t do it when it really matters, when I feel vulnerable.\n\nAnyway, I started seeing someone new, and she talks to me in mixed language (much more important in Hebrew, where it\'s really hard to speak in neutral language). I really appreciated it, and she was basically the first one to show an interest in me, post genderqueer identity, with the way I present and all. Because of this, it was really painful when she misgendered me last night, but not only that, she got angry that I focused on myself.\n\nBasically, she said something about herself, and she felt she was exposing herself and her thoughts, but one of those thoughts was along the lines of ""He\'s just another guy..."". So I told her it bummed me, and the conversation went around that for a bit until she told me she was angry and the conversation was over.\n\nThis morning I wake up to a message saying that she was angry because I took the conversation back to me when she tried to say some things about her. Then she threw my own words in my face, me saying that I\'m aware of the fact I take up space as a man would, and is the reason I identified as male non-conforming for a while. So she said Man, or not, you didn\'t give me space.\n\nI feel like she doesn\'t quite get how hurtful that misgendering is, especially that last bit. But I don\'t know, maybe I\'m overreacting. Maybe I\'m being defensive instead of admitting I was wrong. But I\'m hurting, so I\'m sharing.', 'subreddit': 'genderqueer', 'title': 'I need to share my pain.', 'created': 1499606020.0}"
2017-07-09 19:47:59,6m9iji,2,4,,genderqueer,Anglican church set to offer special services for transgender people,1499654879.0,"{'created_utc': 1499629679, 'id': '6m9iji', 'num_comments': 2, 'score': 4, 'selftext': '', 'subreddit': 'genderqueer', 'title': 'Anglican church set to offer special services for transgender people', 'created': 1499654879.0}"
2017-07-10 00:45:48,6mb5tu,7,42,"I live in a conservative area (my B&amp;N literally had 10 books in the LGBTQ+ section).  I decided to buy ""Gender Outlaw"" by Kate Bornstein (and Symptoms of Being Human).  I was a little nervous walking to the checkout counter, especially because the cashier was wearing 3 inch cross earrings.  When she saw ""Gender Outlaw"" she said, ""Oh, this looks like it'll be a funny book"".  Until she read the rest of the cover that mentions the ""queer and trans community"".  And then she said, ""Oh...""",genderqueer,Fun incident at the bookstore,1499672748.0,"{'created_utc': 1499647548, 'id': '6mb5tu', 'num_comments': 7, 'score': 42, 'selftext': 'I live in a conservative area (my B&amp;N literally had 10 books in the LGBTQ+ section).  I decided to buy ""Gender Outlaw"" by Kate Bornstein (and Symptoms of Being Human).  I was a little nervous walking to the checkout counter, especially because the cashier was wearing 3 inch cross earrings.  When she saw ""Gender Outlaw"" she said, ""Oh, this looks like it\'ll be a funny book"".  Until she read the rest of the cover that mentions the ""queer and trans community"".  And then she said, ""Oh...""', 'subreddit': 'genderqueer', 'title': 'Fun incident at the bookstore', 'created': 1499672748.0}"
