created_utc,id,num_comments,score,selftext,subreddit,title,created,d_
2017-07-01 03:25:01,6kksjy,6,3,"Really struggling with pronouns right now. I still use masculine pronouns but they don't cover the whole picture. I would feel just as incomplete with female pronouns too. All the same they/them does not seem to fit perfectly either. I don't mind it but at the same time it still feels incomplete.  
I've been toying around with combining he/she him/her and I've got se/sim/sis/sim's/simself and I really like the sound of that. At the same time it's really uncharted territory and I feel really arrogant coming up with my own pronouns. Any ideas?  ",genderqueer,Pronoun struggles,1498904701.0,"{'created_utc': 1498879501, 'id': '6kksjy', 'num_comments': 6, 'score': 3, 'selftext': ""Really struggling with pronouns right now. I still use masculine pronouns but they don't cover the whole picture. I would feel just as incomplete with female pronouns too. All the same they/them does not seem to fit perfectly either. I don't mind it but at the same time it still feels incomplete.  \nI've been toying around with combining he/she him/her and I've got se/sim/sis/sim's/simself and I really like the sound of that. At the same time it's really uncharted territory and I feel really arrogant coming up with my own pronouns. Any ideas?  "", 'subreddit': 'genderqueer', 'title': 'Pronoun struggles', 'created': 1498904701.0}"
2017-07-01 05:13:41,6kl9pu,5,121,,genderqueer,Feeling pretty damn fabulous and I just want you all to know I love you,1498911221.0,"{'created_utc': 1498886021, 'id': '6kl9pu', 'num_comments': 5, 'score': 121, 'selftext': '', 'subreddit': 'genderqueer', 'title': 'Feeling pretty damn fabulous and I just want you all to know I love you', 'created': 1498911221.0}"
2017-07-01 21:34:17,6kpm5m,19,9,"Hi all,

I posted here last year sometime about my feelings on my gender (or lack thereof), and have continued to explore my own gender identity since. I have also  met my wonderful girlfriend who I feel very comfortable discussing my feelings with which has really helped.

I am AFAB, and currently identify as gay, but I always express myself in a very masculine way, I dress almost exclusively in men's clothes and have short hair as it's how I feel most comfortable. I have large breasts but always wear sports bras as I am uncomfortable with them but can't afford a good binder yet. I want to present as masculine as possible, but I don't feel trans, or at least I don't think I do. What all this boils down to is that I don't feel like a woman, and I am certain at this point that I do not fall into a binary gender category. 

I want to find the right description for me, just something that feels comfortable and natural, as I really would like to start coming out (again!) to friends and family. Currently I'm thinking of something like non-binary, genderqueer, or agender. So to help me in this process, would you guys mind telling me what description(s) you personally use, and why you identify with them?

I know I don't have to label myself, but in this case I want to, or at least want to try a couple out. I want to feel like I belong to a community a bit more, because at the moment I still feel lost. ",genderqueer,Looking for help with words,1498970057.0,"{'created_utc': 1498944857, 'id': '6kpm5m', 'num_comments': 19, 'score': 9, 'selftext': ""Hi all,\n\nI posted here last year sometime about my feelings on my gender (or lack thereof), and have continued to explore my own gender identity since. I have also  met my wonderful girlfriend who I feel very comfortable discussing my feelings with which has really helped.\n\nI am AFAB, and currently identify as gay, but I always express myself in a very masculine way, I dress almost exclusively in men's clothes and have short hair as it's how I feel most comfortable. I have large breasts but always wear sports bras as I am uncomfortable with them but can't afford a good binder yet. I want to present as masculine as possible, but I don't feel trans, or at least I don't think I do. What all this boils down to is that I don't feel like a woman, and I am certain at this point that I do not fall into a binary gender category. \n\nI want to find the right description for me, just something that feels comfortable and natural, as I really would like to start coming out (again!) to friends and family. Currently I'm thinking of something like non-binary, genderqueer, or agender. So to help me in this process, would you guys mind telling me what description(s) you personally use, and why you identify with them?\n\nI know I don't have to label myself, but in this case I want to, or at least want to try a couple out. I want to feel like I belong to a community a bit more, because at the moment I still feel lost. "", 'subreddit': 'genderqueer', 'title': 'Looking for help with words', 'created': 1498970057.0}"
2017-07-02 18:46:25,6kuv3f,6,10,"There seems to be a stigma that for an identity to be valid, it has to be constant. As someone whose gender identity fluctuates strongly over time, this is tough to deal with. 

If any of you have experience with fluidity and shifting pronouns over time, how do you manage this? Do you wait a certain period of time before making sure a new pronoun feels ""right?"" Do you tell people when you're feeling a different part of the spectrum than before? Or do you stick with one set of pronouns even if your identity might change? 

Background: My social circle, especially the ones less hip to queer stuff, have only just started using they/them pronouns for me consistently. But for about a month, I've been feeling much more he/him. On the one hand, I know my closest friends would be cool with switching and staying updated. On the other hand, it seems like a lot of work for something that could change again, and I'm worried it will confuse or fatigue the folks who just barely got a grasp on singular ""they"".",genderqueer,Pronoun Shifts: How do you handle them?,1499046385.0,"{'created_utc': 1499021185, 'id': '6kuv3f', 'num_comments': 6, 'score': 10, 'selftext': 'There seems to be a stigma that for an identity to be valid, it has to be constant. As someone whose gender identity fluctuates strongly over time, this is tough to deal with. \n\nIf any of you have experience with fluidity and shifting pronouns over time, how do you manage this? Do you wait a certain period of time before making sure a new pronoun feels ""right?"" Do you tell people when you\'re feeling a different part of the spectrum than before? Or do you stick with one set of pronouns even if your identity might change? \n\nBackground: My social circle, especially the ones less hip to queer stuff, have only just started using they/them pronouns for me consistently. But for about a month, I\'ve been feeling much more he/him. On the one hand, I know my closest friends would be cool with switching and staying updated. On the other hand, it seems like a lot of work for something that could change again, and I\'m worried it will confuse or fatigue the folks who just barely got a grasp on singular ""they"".', 'subreddit': 'genderqueer', 'title': 'Pronoun Shifts: How do you handle them?', 'created': 1499046385.0}"
2017-07-02 21:54:09,6kvwdm,12,13,,genderqueer,Does anyone have any advice on how I can appear more gender nutural?,1499057649.0,"{'created_utc': 1499032449, 'id': '6kvwdm', 'num_comments': 12, 'score': 13, 'selftext': '', 'subreddit': 'genderqueer', 'title': 'Does anyone have any advice on how I can appear more gender nutural?', 'created': 1499057649.0}"
2017-07-02 22:46:44,6kw690,0,1,[deleted],genderqueer,Did a look idk if I'm keen yet,1499060804.0,"{'created_utc': 1499035604, 'id': '6kw690', 'num_comments': 0, 'score': 1, 'selftext': '[deleted]', 'subreddit': 'genderqueer', 'title': ""Did a look idk if I'm keen yet"", 'created': 1499060804.0}"
2017-07-02 22:47:21,6kw6d0,10,78,,genderqueer,"Did a look, feelin cute",1499060841.0,"{'created_utc': 1499035641, 'id': '6kw6d0', 'num_comments': 10, 'score': 78, 'selftext': '', 'subreddit': 'genderqueer', 'title': 'Did a look, feelin cute', 'created': 1499060841.0}"
2017-07-03 08:18:19,6kynp3,18,7,[deleted],genderqueer,I don't want to be genderqueer. I don't want to be transgender. I just want to be like how I used to be.,1499095099.0,"{'created_utc': 1499069899, 'id': '6kynp3', 'num_comments': 18, 'score': 7, 'selftext': '[deleted]', 'subreddit': 'genderqueer', 'title': ""I don't want to be genderqueer. I don't want to be transgender. I just want to be like how I used to be."", 'created': 1499095099.0}"
2017-07-03 09:15:06,6kyuvl,3,2,"I really dont know what to do lately, i dont feel comfortable being me, a girl, but i dont think id be any more comfortable as a boy. i still like being feminine and wearing dresses and makeup and stuff but i still feel like me isnt me. i dont know who to talk to about any of this.",genderqueer,"I don't know, help",1499098506.0,"{'created_utc': 1499073306, 'id': '6kyuvl', 'num_comments': 3, 'score': 2, 'selftext': 'I really dont know what to do lately, i dont feel comfortable being me, a girl, but i dont think id be any more comfortable as a boy. i still like being feminine and wearing dresses and makeup and stuff but i still feel like me isnt me. i dont know who to talk to about any of this.', 'subreddit': 'genderqueer', 'title': ""I don't know, help"", 'created': 1499098506.0}"
2017-07-03 11:56:07,6kzgdf,3,23,"Breaching the Wall

I had said f it.  With my girls behind me. I said f it and went to Sephora to purchase foundation in person.  I said f the shame.  F the past 36 years.  I knew that I would need a color match.  I knew that I was walking in at the semi middle busiest time of the store.  I knew that it was the mall so there would be teens mulling about.  I said f it.  I had my pears.

In the middle of the store in front of a makeup battlestation I stood waiting for a sublime creature, Bailey, to use her magic and pick out a shade to match my skin.  My nerves had disappeared as I wanted this.  Telling her I currently used Loreal Perfect Match N3 she could understand what extra coverage I wanted.  Yielding her skin scanner, she scanned my cheek, neck and forehead, determined my skin tone and nonchalantly flicked through a tablet for matching products - MUFE just like Amy's.  She applied one swatch on my left cheek, an alternate shade on my right.  She disappeared into the aisle to grab another shade, cleaned my face, applied to left cheek again, and forehead and neck, asked co-worker to confirm...  She apologized a couple of times at how long it was taking as she wanted a good match -- I did too.  

In between, patiently waiting I chatted with my girls via the ether, the shoulders I leaned on -- as giddy as I was and wanting to know what was happening.  The other customers went about their business.  Bailey had me take a mirror AND WALK AROUND THE STORE to see how the shade looked in different lights.  I did that too because damn it the color did look a little different as I walked.  We had a match.   Bailey asked if I wanted to wear it out and what naturally came out of my mouth (because I wanted to look my best) was that I didn't have any color correcting concealer so I didn't want to.  

There in my hands was a black box, MUFE Matte #53.  Staring at it, it had become a symbol of a face to face exchange between someone (even if I was only in drab) who has been hidden for years with another -- not just talk, an exchange without shame and fear, I backed by wonderful gals hundreds of miles away only connected by ether -- they joking that I now could parade my Sephora bag around the mall -- and I did without shame.  All that and the only negative was, I forgot where I parked.

As I drove home, the wall must have continued falling because neutrality fell around me.  Neither dysphoria nor euphoria was present just a sereneness.  I was in drab and that was ok.  I didn't need to change my clothes as I entered the house as I usually did.  I sat as if a thousands of feet had been climbed.  I could finally rest.  Vanessa's words ""because it doesn't matter anymore, right?"" echo through my ears.",genderqueer,Visiting Makeup Store for First Time in Person,1499108167.0,"{'created_utc': 1499082967, 'id': '6kzgdf', 'num_comments': 3, 'score': 23, 'selftext': 'Breaching the Wall\n\nI had said f it.  With my girls behind me. I said f it and went to Sephora to purchase foundation in person.  I said f the shame.  F the past 36 years.  I knew that I would need a color match.  I knew that I was walking in at the semi middle busiest time of the store.  I knew that it was the mall so there would be teens mulling about.  I said f it.  I had my pears.\n\nIn the middle of the store in front of a makeup battlestation I stood waiting for a sublime creature, Bailey, to use her magic and pick out a shade to match my skin.  My nerves had disappeared as I wanted this.  Telling her I currently used Loreal Perfect Match N3 she could understand what extra coverage I wanted.  Yielding her skin scanner, she scanned my cheek, neck and forehead, determined my skin tone and nonchalantly flicked through a tablet for matching products - MUFE just like Amy\'s.  She applied one swatch on my left cheek, an alternate shade on my right.  She disappeared into the aisle to grab another shade, cleaned my face, applied to left cheek again, and forehead and neck, asked co-worker to confirm...  She apologized a couple of times at how long it was taking as she wanted a good match -- I did too.  \n\nIn between, patiently waiting I chatted with my girls via the ether, the shoulders I leaned on -- as giddy as I was and wanting to know what was happening.  The other customers went about their business.  Bailey had me take a mirror AND WALK AROUND THE STORE to see how the shade looked in different lights.  I did that too because damn it the color did look a little different as I walked.  We had a match.   Bailey asked if I wanted to wear it out and what naturally came out of my mouth (because I wanted to look my best) was that I didn\'t have any color correcting concealer so I didn\'t want to.  \n\nThere in my hands was a black box, MUFE Matte #53.  Staring at it, it had become a symbol of a face to face exchange between someone (even if I was only in drab) who has been hidden for years with another -- not just talk, an exchange without shame and fear, I backed by wonderful gals hundreds of miles away only connected by ether -- they joking that I now could parade my Sephora bag around the mall -- and I did without shame.  All that and the only negative was, I forgot where I parked.\n\nAs I drove home, the wall must have continued falling because neutrality fell around me.  Neither dysphoria nor euphoria was present just a sereneness.  I was in drab and that was ok.  I didn\'t need to change my clothes as I entered the house as I usually did.  I sat as if a thousands of feet had been climbed.  I could finally rest.  Vanessa\'s words ""because it doesn\'t matter anymore, right?"" echo through my ears.', 'subreddit': 'genderqueer', 'title': 'Visiting Makeup Store for First Time in Person', 'created': 1499108167.0}"
2017-07-03 12:59:37,6kzqln,1,6,"Hello everyone, 
I am slowly but surely coming to terms with having to come out to my parents. The reason is that I go by my chosen name Nik with all of my friends, and so far, I always 'forced' them to call me by my birthname, whenever my parents/general family is around, and I hate that. I hate that I am making my friends do that, especially b/c I know they might slip up and then feel bad and they really shouldn't. 

So I am 27, completely not depend on my parents anymore, my older brother is gay and out and my parents are in general very liberal. And I am still scared as fuck. 

It's mostly about the name change, even though I don't want/need my parents to call me Nik. My mom already suspects, she had a talk with one of my friends while I wasn't there, where he apparently slipped up and my mom said something along the lines of 'I know who you mean', so I think she might just be waiting for me to come out anyway, even though she probably has no idea as what since genderqueer is probably not something she is familiar with? But the other reason why I am worried is b/c we never talk about serious stuff and feelings in my family and that makes coming out really awkward. 

So I am wondering, did you guys come out to your parents? Do you have any tips or tricks? Do you think a letter would be a good idea, or is in person better? ",genderqueer,Coming out to parents ?!,1499111977.0,"{'created_utc': 1499086777, 'id': '6kzqln', 'num_comments': 1, 'score': 6, 'selftext': ""Hello everyone, \nI am slowly but surely coming to terms with having to come out to my parents. The reason is that I go by my chosen name Nik with all of my friends, and so far, I always 'forced' them to call me by my birthname, whenever my parents/general family is around, and I hate that. I hate that I am making my friends do that, especially b/c I know they might slip up and then feel bad and they really shouldn't. \n\nSo I am 27, completely not depend on my parents anymore, my older brother is gay and out and my parents are in general very liberal. And I am still scared as fuck. \n\nIt's mostly about the name change, even though I don't want/need my parents to call me Nik. My mom already suspects, she had a talk with one of my friends while I wasn't there, where he apparently slipped up and my mom said something along the lines of 'I know who you mean', so I think she might just be waiting for me to come out anyway, even though she probably has no idea as what since genderqueer is probably not something she is familiar with? But the other reason why I am worried is b/c we never talk about serious stuff and feelings in my family and that makes coming out really awkward. \n\nSo I am wondering, did you guys come out to your parents? Do you have any tips or tricks? Do you think a letter would be a good idea, or is in person better? "", 'subreddit': 'genderqueer', 'title': 'Coming out to parents ?!', 'created': 1499111977.0}"
2017-07-03 16:12:24,6l0txn,14,197,,genderqueer,Oregon Issued My Third Gender Driver's License This Morning!,1499123544.0,"{'created_utc': 1499098344, 'id': '6l0txn', 'num_comments': 14, 'score': 197, 'selftext': '', 'subreddit': 'genderqueer', 'title': ""Oregon Issued My Third Gender Driver's License This Morning!"", 'created': 1499123544.0}"
2017-07-03 17:35:16,6l1cp8,0,1,,genderqueer,Cute as F@#$! Can't wait to wear them out!!!,1499128516.0,"{'created_utc': 1499103316, 'id': '6l1cp8', 'num_comments': 0, 'score': 1, 'selftext': '', 'subreddit': 'genderqueer', 'title': ""Cute as F@#$! Can't wait to wear them out!!!"", 'created': 1499128516.0}"
2017-07-03 17:38:25,6l1dfw,0,1,,genderqueer,"Letters to Our Parents - a call for submissions to a zine by trans and nonbinary people, aimed at our parents. [x-post /r/transgender]",1499128705.0,"{'created_utc': 1499103505, 'id': '6l1dfw', 'num_comments': 0, 'score': 1, 'selftext': '', 'subreddit': 'genderqueer', 'title': 'Letters to Our Parents - a call for submissions to a zine by trans and nonbinary people, aimed at our parents. [x-post /r/transgender]', 'created': 1499128705.0}"
2017-07-04 01:30:42,6l427x,0,0,[deleted],genderqueer,The word unisex,1499157042.0,"{'created_utc': 1499131842, 'id': '6l427x', 'num_comments': 0, 'score': 0, 'selftext': '[deleted]', 'subreddit': 'genderqueer', 'title': 'The word unisex', 'created': 1499157042.0}"
2017-07-04 02:16:26,6l4a61,3,7,"Hi Everyone, I am struggling on how to come out to friends as non-binary and what exactly I want or need from that coming out process. I've gained a lot of confidence the past year and a half as I've gradually come to terms with dysphoria, confusion and the desire to no longer identify as a woman. However, there is still this ridiculous part of me that talks myself out of coming out to certain friends because for the most part, on the outside, I look the same. I do not intend to take testosterone or have top surgery. My appearance, including clothes and haircut, have definitely become increasingly masculine/androgynous over the past two years, and people have definitely suspected a 'shift' of sorts, but if I never opened up to friends, they could still go on for years just seeing me as the girl they've always known. I've begun to go by a new name at work and with new people that I meet. I still use 'she' pronouns because I am read as female and it just draws so much less attention to me, but I have come out to co-workers individually who I feel close to and comfortable with, and those aspects of my social transition have been very validating. Despite my dysphoria, my endless questioning, and my happiness at my social transition so far, I still talk myself out of all of this once every few months and try to shove myself back into the binary, all the while feeling incredibly awkward and disembodied whenever I think of myself as a woman. If anyone has any words of advice for moving towards a healthier place of self-acceptance, I'd greatly appreciate it. Honestly, the doubt and self-invalidation I still subject myself to is more difficult to deal with than any kind of dysphoria I experience in day to day life. I long so desperately to truly say, yes, my gender identity is valid, and wanting to share it with those closest to me is also valid, and I don't need to change my physical body to have the 'right' to share that with other people. I'm not sure why I keep holding myself back, and if you've experienced something similar I'd be grateful to hear your experience. ",genderqueer,How to come out to friends when you are only pursuing a social transition?,1499159786.0,"{'created_utc': 1499134586, 'id': '6l4a61', 'num_comments': 3, 'score': 7, 'selftext': ""Hi Everyone, I am struggling on how to come out to friends as non-binary and what exactly I want or need from that coming out process. I've gained a lot of confidence the past year and a half as I've gradually come to terms with dysphoria, confusion and the desire to no longer identify as a woman. However, there is still this ridiculous part of me that talks myself out of coming out to certain friends because for the most part, on the outside, I look the same. I do not intend to take testosterone or have top surgery. My appearance, including clothes and haircut, have definitely become increasingly masculine/androgynous over the past two years, and people have definitely suspected a 'shift' of sorts, but if I never opened up to friends, they could still go on for years just seeing me as the girl they've always known. I've begun to go by a new name at work and with new people that I meet. I still use 'she' pronouns because I am read as female and it just draws so much less attention to me, but I have come out to co-workers individually who I feel close to and comfortable with, and those aspects of my social transition have been very validating. Despite my dysphoria, my endless questioning, and my happiness at my social transition so far, I still talk myself out of all of this once every few months and try to shove myself back into the binary, all the while feeling incredibly awkward and disembodied whenever I think of myself as a woman. If anyone has any words of advice for moving towards a healthier place of self-acceptance, I'd greatly appreciate it. Honestly, the doubt and self-invalidation I still subject myself to is more difficult to deal with than any kind of dysphoria I experience in day to day life. I long so desperately to truly say, yes, my gender identity is valid, and wanting to share it with those closest to me is also valid, and I don't need to change my physical body to have the 'right' to share that with other people. I'm not sure why I keep holding myself back, and if you've experienced something similar I'd be grateful to hear your experience. "", 'subreddit': 'genderqueer', 'title': 'How to come out to friends when you are only pursuing a social transition?', 'created': 1499159786.0}"
2017-07-04 03:13:33,6l4jrx,2,1,[removed],genderqueer,Anyone want a free tarot reading? (x-post /r/nonbinary),1499163213.0,"{'created_utc': 1499138013, 'id': '6l4jrx', 'num_comments': 2, 'score': 1, 'selftext': '[removed]', 'subreddit': 'genderqueer', 'title': 'Anyone want a free tarot reading? (x-post /r/nonbinary)', 'created': 1499163213.0}"
2017-07-04 06:12:04,6l5c8q,0,1,[removed],genderqueer,Women/Non-Binary People Of Color Only Discord Server!,1499173924.0,"{'created_utc': 1499148724, 'id': '6l5c8q', 'num_comments': 0, 'score': 1, 'selftext': '[removed]', 'subreddit': 'genderqueer', 'title': 'Women/Non-Binary People Of Color Only Discord Server!', 'created': 1499173924.0}"
2017-07-04 15:44:28,6l7ssz,8,2,I'm an AMAB who just started shaving my armpits to help me feel more androgynous. But I'm getting really bad razor burn. I'm using a battery powered foil shaver because I don't trust myself with a razor and I shave when I shower in the morning. Does anyone have some good tips for preventing razor burn and treating it when it happens? Please help!!,genderqueer,Razor burn?!,1499208268.0,"{'created_utc': 1499183068, 'id': '6l7ssz', 'num_comments': 8, 'score': 2, 'selftext': ""I'm an AMAB who just started shaving my armpits to help me feel more androgynous. But I'm getting really bad razor burn. I'm using a battery powered foil shaver because I don't trust myself with a razor and I shave when I shower in the morning. Does anyone have some good tips for preventing razor burn and treating it when it happens? Please help!!"", 'subreddit': 'genderqueer', 'title': 'Razor burn?!', 'created': 1499208268.0}"
