created_utc,id,num_comments,score,selftext,subreddit,title,created,d_
2017-07-16 18:52:13,6nnw3n,8,3,"I just watched a Youtube video from someone who had a friend die on Dr. Garramone's operating table while getting top surgery. I've been seriously looking into getting top surgery and suddenly, for the first time, I'm afraid. 

Pain I can deal with (I think). Results that aren't perfect I can deal with. Death? No. I'm not a man and this isn't a life or death decision for me.

I know death is a risk of any surgery but I don't want to die just because I badly wanted a flat chest. Just because it's very, very unlikely to happen doesn't mean it won't. How do I deal with this? Just ignore the risk and hope for the best?",genderqueer,Top Surgery Risks,1500256333.0,"{'created_utc': 1500231133, 'id': '6nnw3n', 'num_comments': 8, 'score': 3, 'selftext': ""I just watched a Youtube video from someone who had a friend die on Dr. Garramone's operating table while getting top surgery. I've been seriously looking into getting top surgery and suddenly, for the first time, I'm afraid. \n\nPain I can deal with (I think). Results that aren't perfect I can deal with. Death? No. I'm not a man and this isn't a life or death decision for me.\n\nI know death is a risk of any surgery but I don't want to die just because I badly wanted a flat chest. Just because it's very, very unlikely to happen doesn't mean it won't. How do I deal with this? Just ignore the risk and hope for the best?"", 'subreddit': 'genderqueer', 'title': 'Top Surgery Risks', 'created': 1500256333.0}"
2017-07-16 22:44:45,6np7ph,0,1,[removed],genderqueer,Embracing my-self.,1500270285.0,"{'created_utc': 1500245085, 'id': '6np7ph', 'num_comments': 0, 'score': 1, 'selftext': '[removed]', 'subreddit': 'genderqueer', 'title': 'Embracing my-self.', 'created': 1500270285.0}"
2017-07-17 08:49:05,6nrvgb,0,1,[removed],genderqueer,Help for a friend. Don't know where to post.,1500306545.0,"{'created_utc': 1500281345, 'id': '6nrvgb', 'num_comments': 0, 'score': 1, 'selftext': '[removed]', 'subreddit': 'genderqueer', 'title': ""Help for a friend. Don't know where to post."", 'created': 1500306545.0}"
2017-07-17 14:37:18,6ntgbk,13,16,What's the difference? ,genderqueer,Trans man vs trans masculine,1500327438.0,"{'created_utc': 1500302238, 'id': '6ntgbk', 'num_comments': 13, 'score': 16, 'selftext': ""What's the difference? "", 'subreddit': 'genderqueer', 'title': 'Trans man vs trans masculine', 'created': 1500327438.0}"
2017-07-17 20:10:06,6nvogv,0,1,[removed],genderqueer,Are there genderqueer male-born individuals who altered their bodies/faces to be closer what they identify as?If so please share pics,1500347406.0,"{'created_utc': 1500322206, 'id': '6nvogv', 'num_comments': 0, 'score': 1, 'selftext': '[removed]', 'subreddit': 'genderqueer', 'title': 'Are there genderqueer male-born individuals who altered their bodies/faces to be closer what they identify as?If so please share pics', 'created': 1500347406.0}"
2017-07-18 12:21:19,6o0eju,0,1,,genderqueer,Representation in â€˜Doctor Whoâ€™: The Doctor Is Non-Binary and Gender-Fluid,1500405679.0,"{'created_utc': 1500380479, 'id': '6o0eju', 'num_comments': 0, 'score': 1, 'selftext': '', 'subreddit': 'genderqueer', 'title': 'Representation in â€˜Doctor Whoâ€™: The Doctor Is Non-Binary and Gender-Fluid', 'created': 1500405679.0}"
2017-07-18 19:35:41,6o35kr,11,50,"HI YALL. I finally did it. I came out to my family. Turns out they're all the fucking best and it went really well. I am so so so lucky.

I wanted to share the letter I wrote, because I feel it could be helpful to some. A few parts are pretty specific to me, but they don't give away my identity so I left them in. Others, I added brackets where you could swap in your own info if you wanted.

Hope you enjoy.

-----------------------------------------

Hi Family &lt;3

So I'm doing this in an email because even though I'm [AGE], I'm a coward. Plus with things like this, it helps to get it all out at once.

Here goes. I'm coming out again! This time as nonbinary/genderqueer, which is an identity that falls under the transgender umbrella. Whoa buddy. What does that even mean? Here are some links:

[INSERT YOUR PREFERRED LINKS]

The basics are this: Though I was Assigned Female At Birth, I've recently come to terms with the fact that I've never quite felt female. That said, I also don't quite feel male either. Growing up, I didn't know what this meant. I didn't even know it was a thing. Today, in 2017, trans folks are so much more visible than they ever were, and I've learned about all of the possibilities that are out there. Imagine my surprise when suddenly it all clicked, like ""Whoa... that's me!""

I wish I could tell you I was 100% certain about where I stand and who I will eventually become (side note wouldn't it be cool to know this for ANYTHING in life? LOL.) I don't know if I will get any surgeries. I don't know if I will do hormone replacement therapy. Thankfully, I've been seeing a gender therapist for the past few months and will continue to do so, because I'm still learning a lot about myself and what I want! It's all very new but it feels very right.

The most important thing I've learned is that it's CRUCIAL for me to let you in on my journey. The feeling of keeping a secret from you is the worst. I love you so much, and I want you to know what's going on with me and I hope we can all learn together.

Things I know for sure:

- For now, I'd like to keep this between us. Shouldn't be too hard! Brother, I obviously am ok with you telling your family! You can even just show them this email if you want. Eventually, I will be coming out publicly. When I'm ready.

- I'd like to start using the gender-neutral pronouns ""they/them/theirs"". I know this feels grammatically incorrect, but I bet you already use these pronouns in day-to-day conversations, (i.e. someone left their backpack here!, etc). Turns out language is constantly changing and evolving! And Merriam-Webster recognizes gender neutral pronouns as valid! Can you imagine if language never evolved? We'd all be saying ""thee, thou, etc"". Anyway, the more you use the pronouns the more comfortable they'll feel. I know this from experience.

- I'd like to ween everyone off [BIRTH NAME]. It's a beautiful name, but I never felt like it belonged to me. Sorry Mom and Dad :( For now, I'd prefer nicknames like [INSERT NICKNAMES]. Iâ€™ll let you know when I decide on the perfect name.

- I am literally the exact same person I always was. I will continue to be a tomboy, have short hair, dress like a 16 year old boy in summer, dress like an old fisherman in winter, get tattoos that you hate, use the F word on the internet, incessantly post photos of my cats on Instagram, etc.

I've also made a preemptive Q&amp;A for some things you may be thinking!!!

But what about that period of time in college that you were SO girly!!

- If I remember correctly, that lasted from age 19-21. That's three years of my life. 1/10 of my time on earth. If you'll remember before that, I was scared to TEARS at the very IDEA of dressing girly. It always felt like a costume I was wearing for other people, never for myself. Plus, after the girly period, I reverted back to my old tomboy ways, dressing more androgynously as time went on, leading me to where I am now. So the ""girly period"" was fun, but I think that contributes to my non-binary-ness! I didn't mind being girly, but who I am now feels better. Which brings me to my next point.

Do you have Gender Dysphoria (the terrible feeling of being uncomfortable in your body)? You seem so happy!

- I recently heard someone say, ""Sometimes it's not about gender dysphoria, but gender euphoria."" Yes, I have always hated my hips and my large chest. But everything else, I'm fine with it. I feel okay in my female body. I'm okay with the fact that I have both feminine and masculine mannerisms. But when I am perceived as androgynous, feel REALLY happy. Think of it this way: Mom, would it make you feel good if someone thought you were a man? NOPE! Dad or [BROTHER], how would it feel if someone thought you were a woman? NO THANKS. But for me, when someone mistakes me for a ""Sir"", or is confused about my gender, I love it. It feels really GOOD. It makes me feel like myself. There you have it: Gender Euphoria!

I'm devastated at the thought of losing my little girl!!

- See above. I'm still me!! In fact, I'll be a better happier version of myself!! Plus, nothing can take away your memories of the little girl you knew! She was so cute, but she's been gone for a while if you think about it. I grew up and out of my pink pajamas over two decades ago, y'know.

Yeah but LEGALLY and BIOLOGICALLY you'll still be female!

Correct. It's possible to be both non-binary and female! Biologically, yes, my SEX is Female. But for me and many others, GENDER is a Spectrum (insert liberal hippy peace sign and read more at the links above). I am non-binary/genderqueer.

Whew. So.

That's all I have for now. I'll let this sink in today, and if I don't hear from you (I hope I do!!!), I'll be FaceTiming each of you tomorrow to check in. I love you so much, more than anything on earth, and I hope you'll continue to love and accept me the same as you always have. You've always been the best, I feel pretty confident that you will. Please prove me right. 
ï¿¼
Love,

Your child / sibling (lol, we'll work on that...)
 

",genderqueer,I came out as NB/genderqueer to my family!! Here's my letter!,1500431741.0,"{'created_utc': 1500406541, 'id': '6o35kr', 'num_comments': 11, 'score': 50, 'selftext': 'HI YALL. I finally did it. I came out to my family. Turns out they\'re all the fucking best and it went really well. I am so so so lucky.\n\nI wanted to share the letter I wrote, because I feel it could be helpful to some. A few parts are pretty specific to me, but they don\'t give away my identity so I left them in. Others, I added brackets where you could swap in your own info if you wanted.\n\nHope you enjoy.\n\n-----------------------------------------\n\nHi Family &lt;3\n\nSo I\'m doing this in an email because even though I\'m [AGE], I\'m a coward. Plus with things like this, it helps to get it all out at once.\n\nHere goes. I\'m coming out again! This time as nonbinary/genderqueer, which is an identity that falls under the transgender umbrella. Whoa buddy. What does that even mean? Here are some links:\n\n[INSERT YOUR PREFERRED LINKS]\n\nThe basics are this: Though I was Assigned Female At Birth, I\'ve recently come to terms with the fact that I\'ve never quite felt female. That said, I also don\'t quite feel male either. Growing up, I didn\'t know what this meant. I didn\'t even know it was a thing. Today, in 2017, trans folks are so much more visible than they ever were, and I\'ve learned about all of the possibilities that are out there. Imagine my surprise when suddenly it all clicked, like ""Whoa... that\'s me!""\n\nI wish I could tell you I was 100% certain about where I stand and who I will eventually become (side note wouldn\'t it be cool to know this for ANYTHING in life? LOL.) I don\'t know if I will get any surgeries. I don\'t know if I will do hormone replacement therapy. Thankfully, I\'ve been seeing a gender therapist for the past few months and will continue to do so, because I\'m still learning a lot about myself and what I want! It\'s all very new but it feels very right.\n\nThe most important thing I\'ve learned is that it\'s CRUCIAL for me to let you in on my journey. The feeling of keeping a secret from you is the worst. I love you so much, and I want you to know what\'s going on with me and I hope we can all learn together.\n\nThings I know for sure:\n\n- For now, I\'d like to keep this between us. Shouldn\'t be too hard! Brother, I obviously am ok with you telling your family! You can even just show them this email if you want. Eventually, I will be coming out publicly. When I\'m ready.\n\n- I\'d like to start using the gender-neutral pronouns ""they/them/theirs"". I know this feels grammatically incorrect, but I bet you already use these pronouns in day-to-day conversations, (i.e. someone left their backpack here!, etc). Turns out language is constantly changing and evolving! And Merriam-Webster recognizes gender neutral pronouns as valid! Can you imagine if language never evolved? We\'d all be saying ""thee, thou, etc"". Anyway, the more you use the pronouns the more comfortable they\'ll feel. I know this from experience.\n\n- I\'d like to ween everyone off [BIRTH NAME]. It\'s a beautiful name, but I never felt like it belonged to me. Sorry Mom and Dad :( For now, I\'d prefer nicknames like [INSERT NICKNAMES]. Iâ€™ll let you know when I decide on the perfect name.\n\n- I am literally the exact same person I always was. I will continue to be a tomboy, have short hair, dress like a 16 year old boy in summer, dress like an old fisherman in winter, get tattoos that you hate, use the F word on the internet, incessantly post photos of my cats on Instagram, etc.\n\nI\'ve also made a preemptive Q&amp;A for some things you may be thinking!!!\n\nBut what about that period of time in college that you were SO girly!!\n\n- If I remember correctly, that lasted from age 19-21. That\'s three years of my life. 1/10 of my time on earth. If you\'ll remember before that, I was scared to TEARS at the very IDEA of dressing girly. It always felt like a costume I was wearing for other people, never for myself. Plus, after the girly period, I reverted back to my old tomboy ways, dressing more androgynously as time went on, leading me to where I am now. So the ""girly period"" was fun, but I think that contributes to my non-binary-ness! I didn\'t mind being girly, but who I am now feels better. Which brings me to my next point.\n\nDo you have Gender Dysphoria (the terrible feeling of being uncomfortable in your body)? You seem so happy!\n\n- I recently heard someone say, ""Sometimes it\'s not about gender dysphoria, but gender euphoria."" Yes, I have always hated my hips and my large chest. But everything else, I\'m fine with it. I feel okay in my female body. I\'m okay with the fact that I have both feminine and masculine mannerisms. But when I am perceived as androgynous, feel REALLY happy. Think of it this way: Mom, would it make you feel good if someone thought you were a man? NOPE! Dad or [BROTHER], how would it feel if someone thought you were a woman? NO THANKS. But for me, when someone mistakes me for a ""Sir"", or is confused about my gender, I love it. It feels really GOOD. It makes me feel like myself. There you have it: Gender Euphoria!\n\nI\'m devastated at the thought of losing my little girl!!\n\n- See above. I\'m still me!! In fact, I\'ll be a better happier version of myself!! Plus, nothing can take away your memories of the little girl you knew! She was so cute, but she\'s been gone for a while if you think about it. I grew up and out of my pink pajamas over two decades ago, y\'know.\n\nYeah but LEGALLY and BIOLOGICALLY you\'ll still be female!\n\nCorrect. It\'s possible to be both non-binary and female! Biologically, yes, my SEX is Female. But for me and many others, GENDER is a Spectrum (insert liberal hippy peace sign and read more at the links above). I am non-binary/genderqueer.\n\nWhew. So.\n\nThat\'s all I have for now. I\'ll let this sink in today, and if I don\'t hear from you (I hope I do!!!), I\'ll be FaceTiming each of you tomorrow to check in. I love you so much, more than anything on earth, and I hope you\'ll continue to love and accept me the same as you always have. You\'ve always been the best, I feel pretty confident that you will. Please prove me right. \nï¿¼\nLove,\n\nYour child / sibling (lol, we\'ll work on that...)\n \n\n', 'subreddit': 'genderqueer', 'title': ""I came out as NB/genderqueer to my family!! Here's my letter!"", 'created': 1500431741.0}"
2017-07-19 05:16:32,6o6em6,3,12,"Hey everyone, I've been struggling with identity recently, and was hoping for some insight into the life and history of ""coming out"" for some of you NB folks to help me determine if I am indeed NB. 

1) How did you realize that you were NB? 

2) What have you done to live more as yourself?

3) Did you experience doubts or confusion?

4)  What stuggles have you faced since starting to live more authentically?  Does society make it hard?

Finally, my personal story. 

I was assigned male at birth, I don't really have any body dysphoria, however I really see my ideal self as a woman. I realized this when I went to start a YouTube gaming channel, and I thought I'd use facerig to be unique. I stumbled upon an avatar that looked like the characters I usually make (purple haired girls). I cried. I wanted to be able to be that persona, the one I've based all of my characters around. I've been trying to figure things out since then. Much evidence points towards being MtF, however some, namely the complete lack of body dysphoria point towards possibly being NB. 

Thanks for reading and responding :)",genderqueer,"I might be NB, could use some insight",1500466592.0,"{'created_utc': 1500441392, 'id': '6o6em6', 'num_comments': 3, 'score': 12, 'selftext': 'Hey everyone, I\'ve been struggling with identity recently, and was hoping for some insight into the life and history of ""coming out"" for some of you NB folks to help me determine if I am indeed NB. \n\n1) How did you realize that you were NB? \n\n2) What have you done to live more as yourself?\n\n3) Did you experience doubts or confusion?\n\n4)  What stuggles have you faced since starting to live more authentically?  Does society make it hard?\n\nFinally, my personal story. \n\nI was assigned male at birth, I don\'t really have any body dysphoria, however I really see my ideal self as a woman. I realized this when I went to start a YouTube gaming channel, and I thought I\'d use facerig to be unique. I stumbled upon an avatar that looked like the characters I usually make (purple haired girls). I cried. I wanted to be able to be that persona, the one I\'ve based all of my characters around. I\'ve been trying to figure things out since then. Much evidence points towards being MtF, however some, namely the complete lack of body dysphoria point towards possibly being NB. \n\nThanks for reading and responding :)', 'subreddit': 'genderqueer', 'title': 'I might be NB, could use some insight', 'created': 1500466592.0}"
2017-07-19 07:03:15,6o6ugb,1,0,,genderqueer,Huh...,1500472995.0,"{'created_utc': 1500447795, 'id': '6o6ugb', 'num_comments': 1, 'score': 0, 'selftext': '', 'subreddit': 'genderqueer', 'title': 'Huh...', 'created': 1500472995.0}"
2017-07-19 12:03:55,6o806d,34,21,I've just recently come out as non binary to a few people and my girlfriend and I are freaking out because we don't what to call me. I've heard of significant other (s/o) but that's sort of a mouthful and often gets misinterpreted. Are there any other options?,genderqueer,Gender neutral alternative for Girlfriend/Boyfriend,1500491035.0,"{'created_utc': 1500465835, 'id': '6o806d', 'num_comments': 34, 'score': 21, 'selftext': ""I've just recently come out as non binary to a few people and my girlfriend and I are freaking out because we don't what to call me. I've heard of significant other (s/o) but that's sort of a mouthful and often gets misinterpreted. Are there any other options?"", 'subreddit': 'genderqueer', 'title': 'Gender neutral alternative for Girlfriend/Boyfriend', 'created': 1500491035.0}"
2017-07-19 12:26:25,6o845r,0,0,[removed],genderqueer,"There are only 2 genders you retards. Penis = male, Vagina = female",1500492385.0,"{'created_utc': 1500467185, 'id': '6o845r', 'num_comments': 0, 'score': 0, 'selftext': '[removed]', 'subreddit': 'genderqueer', 'title': 'There are only 2 genders you retards. Penis = male, Vagina = female', 'created': 1500492385.0}"
2017-07-19 19:03:34,6oaouz,0,1,,genderqueer,ðŸ˜Š,1500516214.0,"{'created_utc': 1500491014, 'id': '6oaouz', 'num_comments': 0, 'score': 1, 'selftext': '', 'subreddit': 'genderqueer', 'title': 'ðŸ˜Š', 'created': 1500516214.0}"
2017-07-19 19:15:49,6oarsa,5,89,,genderqueer,Feeling pretty... I think?,1500516949.0,"{'created_utc': 1500491749, 'id': '6oarsa', 'num_comments': 5, 'score': 89, 'selftext': '', 'subreddit': 'genderqueer', 'title': 'Feeling pretty... I think?', 'created': 1500516949.0}"
2017-07-19 20:18:25,6ob73b,0,16,,genderqueer,Scottish Government unveils plans for gender neutral school toilets,1500520705.0,"{'created_utc': 1500495505, 'id': '6ob73b', 'num_comments': 0, 'score': 16, 'selftext': '', 'subreddit': 'genderqueer', 'title': 'Scottish Government unveils plans for gender neutral school toilets', 'created': 1500520705.0}"
2017-07-20 20:45:39,6oj4xz,1,1,[deleted],genderqueer,"I got ma'amed today, feeling pretty now.",1500608739.0,"{'created_utc': 1500583539, 'id': '6oj4xz', 'num_comments': 1, 'score': 1, 'selftext': '[deleted]', 'subreddit': 'genderqueer', 'title': ""I got ma'amed today, feeling pretty now."", 'created': 1500608739.0}"
2017-07-20 20:50:03,6oj61t,9,136,,genderqueer,"Got ma'amed today, feeling like I can go outside more now",1500609003.0,"{'created_utc': 1500583803, 'id': '6oj61t', 'num_comments': 9, 'score': 136, 'selftext': '', 'subreddit': 'genderqueer', 'title': ""Got ma'amed today, feeling like I can go outside more now"", 'created': 1500609003.0}"
2017-07-21 01:38:22,6okuso,9,6,"I was recently at a local trans meeting and someone new asked:

What does it mean to identify as a non-binary gender?

I realized that I personally don't have a very good way of defining non-binary, do you? Personally I think of it as taking all of gender al a carte and using the parts of it that identity you and leaving the rest. To be honest though, I'm not super sure if this is totally accurate as I'm really trying to cement my own transgender identity.",genderqueer,Help defining non-binary,1500626302.0,"{'created_utc': 1500601102, 'id': '6okuso', 'num_comments': 9, 'score': 6, 'selftext': ""I was recently at a local trans meeting and someone new asked:\n\nWhat does it mean to identify as a non-binary gender?\n\nI realized that I personally don't have a very good way of defining non-binary, do you? Personally I think of it as taking all of gender al a carte and using the parts of it that identity you and leaving the rest. To be honest though, I'm not super sure if this is totally accurate as I'm really trying to cement my own transgender identity."", 'subreddit': 'genderqueer', 'title': 'Help defining non-binary', 'created': 1500626302.0}"
2017-07-21 14:33:14,6oo9vq,2,58,,genderqueer,Jennifer Lopez received praise from fans this week after she opted for gender neutral pronouns to reference her sisterâ€™s child in a heartfelt Instagram post.,1500672794.0,"{'created_utc': 1500647594, 'id': '6oo9vq', 'num_comments': 2, 'score': 58, 'selftext': '', 'subreddit': 'genderqueer', 'title': 'Jennifer Lopez received praise from fans this week after she opted for gender neutral pronouns to reference her sisterâ€™s child in a heartfelt Instagram post.', 'created': 1500672794.0}"
2017-07-21 15:39:37,6oooz9,7,14,My sibling has come out as gender queer and wants us to use they/them. My question is what term would you use in place of aunt or uncle. Im not currently pregnant and we are having difficulty so i really dont want to bring up future kids with my family right now or i would ask them myself. ,genderqueer,Question about aunts/uncle term,1500676777.0,"{'created_utc': 1500651577, 'id': '6oooz9', 'num_comments': 7, 'score': 14, 'selftext': 'My sibling has come out as gender queer and wants us to use they/them. My question is what term would you use in place of aunt or uncle. Im not currently pregnant and we are having difficulty so i really dont want to bring up future kids with my family right now or i would ask them myself. ', 'subreddit': 'genderqueer', 'title': 'Question about aunts/uncle term', 'created': 1500676777.0}"
2017-07-22 09:42:57,6ou6r2,8,116,,genderqueer,On my way to pride and I felt cute!,1500741777.0,"{'created_utc': 1500716577, 'id': '6ou6r2', 'num_comments': 8, 'score': 116, 'selftext': '', 'subreddit': 'genderqueer', 'title': 'On my way to pride and I felt cute!', 'created': 1500741777.0}"
2017-07-23 01:14:20,6oynwx,0,1,[removed],genderqueer,Androgynous swimwear options?,1500797660.0,"{'created_utc': 1500772460, 'id': '6oynwx', 'num_comments': 0, 'score': 1, 'selftext': '[removed]', 'subreddit': 'genderqueer', 'title': 'Androgynous swimwear options?', 'created': 1500797660.0}"
2017-07-23 02:46:50,6oz317,0,9,,genderqueer,Got some new shoes and decided to take some photos,1500803210.0,"{'created_utc': 1500778010, 'id': '6oz317', 'num_comments': 0, 'score': 9, 'selftext': '', 'subreddit': 'genderqueer', 'title': 'Got some new shoes and decided to take some photos', 'created': 1500803210.0}"
