created_utc,id,num_comments,score,selftext,subreddit,title,created,d_
2017-07-27 04:58:30,6ptrpd,5,8,"Hi. I'm sixteen years old and live on the West Coast of the United States. I have questioned my gender for basically my entire life. I was AFAB, and currently identify as a cisgender queer woman. (I identified as a lesbian for awhile there, but was recently thrown for a loop in terms of romantic &amp; sexual orientation as well.)

I can definitely remember wishing I was a boy as a really young kid. However, this feeling subsided significantly as soon as I recognized myself as queer. I now believe that I never truly wanted to be a boy; I was just envious that it was acceptable for a boy to fall in love with a girl, but not for me to. This theory was further substantiated as I began dating girls, and found a power in my femininity. It's been about three years since then, and all of the questions I have dealt with in the past have returned. Allow me to explain.

There are some days that I love calling myself a woman. I put on tight clothing, and embrace my curves. On these days, I am proud to be a woman that loves other women. I am okay with being seen.

Other days are difficult. I slip into my baggiest sweats and pull on a hoodie. On these days, I want to cut off my breasts and severely mutilate my genitals. I feel like my body has betrayed me, and I am furious.

Now, at face value, this sounds a lot like gender dysphoria. Except there is a huge factor that complicates things. I am a survivor of years of sexual abuse and assault by multiple people. The anger at my body could be about my gender; or it could be about the way that my body was used for all of those years without my permission.

I'm miserably confused, but terrified to talk to anyone about it. Telling the whole story would mean revealing my status as a survivor, and I'm really not at that place yet. I am in the process of switching to a new therapist, and this is not something I want to bring up to a brand new person just yet. I could really use some guidance from people who have dealt with their own gender-related struggles and/or sexual abuse. Thank you so much in advance.",genderqueer,I think that I might be non-binary and I'm really terrified.,1501156710.0,"{'created_utc': 1501131510, 'id': '6ptrpd', 'num_comments': 5, 'score': 8, 'selftext': ""Hi. I'm sixteen years old and live on the West Coast of the United States. I have questioned my gender for basically my entire life. I was AFAB, and currently identify as a cisgender queer woman. (I identified as a lesbian for awhile there, but was recently thrown for a loop in terms of romantic &amp; sexual orientation as well.)\n\nI can definitely remember wishing I was a boy as a really young kid. However, this feeling subsided significantly as soon as I recognized myself as queer. I now believe that I never truly wanted to be a boy; I was just envious that it was acceptable for a boy to fall in love with a girl, but not for me to. This theory was further substantiated as I began dating girls, and found a power in my femininity. It's been about three years since then, and all of the questions I have dealt with in the past have returned. Allow me to explain.\n\nThere are some days that I love calling myself a woman. I put on tight clothing, and embrace my curves. On these days, I am proud to be a woman that loves other women. I am okay with being seen.\n\nOther days are difficult. I slip into my baggiest sweats and pull on a hoodie. On these days, I want to cut off my breasts and severely mutilate my genitals. I feel like my body has betrayed me, and I am furious.\n\nNow, at face value, this sounds a lot like gender dysphoria. Except there is a huge factor that complicates things. I am a survivor of years of sexual abuse and assault by multiple people. The anger at my body could be about my gender; or it could be about the way that my body was used for all of those years without my permission.\n\nI'm miserably confused, but terrified to talk to anyone about it. Telling the whole story would mean revealing my status as a survivor, and I'm really not at that place yet. I am in the process of switching to a new therapist, and this is not something I want to bring up to a brand new person just yet. I could really use some guidance from people who have dealt with their own gender-related struggles and/or sexual abuse. Thank you so much in advance."", 'subreddit': 'genderqueer', 'title': ""I think that I might be non-binary and I'm really terrified."", 'created': 1501156710.0}"
2017-07-27 05:34:14,6ptxaf,2,2,,genderqueer,"I get misgendered even after literally coming out of the men's room, but I've been digging my look lately so what can ya do. Fuck yr gender norms. â¤ï¸",1501158854.0,"{'created_utc': 1501133654, 'id': '6ptxaf', 'num_comments': 2, 'score': 2, 'selftext': '', 'subreddit': 'genderqueer', 'title': ""I get misgendered even after literally coming out of the men's room, but I've been digging my look lately so what can ya do. Fuck yr gender norms. â¤ï¸"", 'created': 1501158854.0}"
2017-07-27 09:11:45,6pureu,3,4,"Hi, everyone. After reading a few other people's threads here, I decided to make my own in hopes that I could get some clarity. I understand that labels are, in the end, entirely up to me...it's just that I thought I was cis female until very recently so I'm still new at everything (although I HAVE been trying to educate myself on everything I've been missing) so I guess I would like everyone's ""more expert"" opinion.

First of all, I am a bisexual AFAB. Sexuality was a whole another monster I had to tackle...and I only came to terms with it when I reached my 20s (I come from a very conservative family that still to this very day think LGBTQ people are just ""faking it"" and am still closeted to family, even though my friends know I'm not straight.)

I also suffer from mental illness (anxiety/depression), which has made it difficult for me to accept myself to begin with (and not just in matters of gender/sexuality). Body image issues, poor self esteem, I've had it all...although it has gotten a lot better recently, esp after accepting my sexual identity+gaining a better support system.

So, I don't have much gender dysphoria anymore (although I do sometimes experience it--bottom but not top--esp in intimate situations) but I HAVE wished I wasn't female. I remember being especially uncomfortable during puberty, though, and wanting to be a boy when I was a kid (but even this I'm unsure whether or not it matters since I'm the only  girl in my entire family...so maybe I was just feeling ""left out"" among my many boy cousins?) I identified more with male TV/book characters--but since I'm also bi, I had this strange experience of also being attracted to them. In my dreams, I'm almost always a guy--or at least in the dreams where I'm happy with myself. However, despite all this, since I didn't have that strong body dysmorphia that my clearly FTM or even some nonbinary friends had, I didn't think I was trans.

To make things trickier, although in past years, I was more uncomfortable with it, I've recently grown to embrace my female body (although I suspect this may have to do with the fact that I've grown more accepting towards myself in general.) I love dressing up in feminine clothing and although I wore more gender neutral clothing as a teen, now, I find myself gravitating toward more feminine clothing...mostly because I know I look good in it. (Which I know doesn't matter to a certain extent since there are gay men who love dressing up in drag.) I actually like my not-flat chest, and I know I probably won't transition...at least not until they develop a better male bottom part since most of my dysphoria lies down there anyway. I'm also ok with she/her pronouns and my feminine name. 

So, I don't know. What are your thoughts? I've checked threads by people for each of the labels I've listed above but keep thinking I'm not ""FTM enough,"" ""nonbinary enough,"" ""gender fluid enough,"" or even ""cis enough"" so I'd really appreciate any insight you may have on this matter. Thank you in advance!



",genderqueer,Nonbinary? FTM? Gender fluid? None of the above?,1501171905.0,"{'created_utc': 1501146705, 'id': '6pureu', 'num_comments': 3, 'score': 4, 'selftext': 'Hi, everyone. After reading a few other people\'s threads here, I decided to make my own in hopes that I could get some clarity. I understand that labels are, in the end, entirely up to me...it\'s just that I thought I was cis female until very recently so I\'m still new at everything (although I HAVE been trying to educate myself on everything I\'ve been missing) so I guess I would like everyone\'s ""more expert"" opinion.\n\nFirst of all, I am a bisexual AFAB. Sexuality was a whole another monster I had to tackle...and I only came to terms with it when I reached my 20s (I come from a very conservative family that still to this very day think LGBTQ people are just ""faking it"" and am still closeted to family, even though my friends know I\'m not straight.)\n\nI also suffer from mental illness (anxiety/depression), which has made it difficult for me to accept myself to begin with (and not just in matters of gender/sexuality). Body image issues, poor self esteem, I\'ve had it all...although it has gotten a lot better recently, esp after accepting my sexual identity+gaining a better support system.\n\nSo, I don\'t have much gender dysphoria anymore (although I do sometimes experience it--bottom but not top--esp in intimate situations) but I HAVE wished I wasn\'t female. I remember being especially uncomfortable during puberty, though, and wanting to be a boy when I was a kid (but even this I\'m unsure whether or not it matters since I\'m the only  girl in my entire family...so maybe I was just feeling ""left out"" among my many boy cousins?) I identified more with male TV/book characters--but since I\'m also bi, I had this strange experience of also being attracted to them. In my dreams, I\'m almost always a guy--or at least in the dreams where I\'m happy with myself. However, despite all this, since I didn\'t have that strong body dysmorphia that my clearly FTM or even some nonbinary friends had, I didn\'t think I was trans.\n\nTo make things trickier, although in past years, I was more uncomfortable with it, I\'ve recently grown to embrace my female body (although I suspect this may have to do with the fact that I\'ve grown more accepting towards myself in general.) I love dressing up in feminine clothing and although I wore more gender neutral clothing as a teen, now, I find myself gravitating toward more feminine clothing...mostly because I know I look good in it. (Which I know doesn\'t matter to a certain extent since there are gay men who love dressing up in drag.) I actually like my not-flat chest, and I know I probably won\'t transition...at least not until they develop a better male bottom part since most of my dysphoria lies down there anyway. I\'m also ok with she/her pronouns and my feminine name. \n\nSo, I don\'t know. What are your thoughts? I\'ve checked threads by people for each of the labels I\'ve listed above but keep thinking I\'m not ""FTM enough,"" ""nonbinary enough,"" ""gender fluid enough,"" or even ""cis enough"" so I\'d really appreciate any insight you may have on this matter. Thank you in advance!\n\n\n\n', 'subreddit': 'genderqueer', 'title': 'Nonbinary? FTM? Gender fluid? None of the above?', 'created': 1501171905.0}"
2017-07-27 09:25:49,6putax,0,0,[deleted],genderqueer,Feeling lost,1501172749.0,"{'created_utc': 1501147549, 'id': '6putax', 'num_comments': 0, 'score': 0, 'selftext': '[deleted]', 'subreddit': 'genderqueer', 'title': 'Feeling lost', 'created': 1501172749.0}"
2017-07-27 15:20:38,6pwmce,4,85,[deleted],genderqueer,I can just lounge in this all day,1501194038.0,"{'created_utc': 1501168838, 'id': '6pwmce', 'num_comments': 4, 'score': 85, 'selftext': '[deleted]', 'subreddit': 'genderqueer', 'title': 'I can just lounge in this all day', 'created': 1501194038.0}"
2017-07-27 16:00:25,6pww4s,4,11,"It's four months now that I don't feel/identify as cis female anymore. Being non binary trans feels so true to myself and I'm grateful to get to know myself more! BUT at the same time I feel like almost EVERYTHING is getting more complicated, challenging or violent. It's all: the thousands of questions and thoughts in my head, the feeling of not belonging and having no space in a binary society, the transhatred, the fear of transhatred, misgendering, loosing friends, the fear and nervousness at each coming out, the difficulties finding a job ... it's not all bad, I don't wanna whine as I know other face much more shit than I do. I need your help though. I can clearly tell how my health and wellbeing suffer. Insomnia, panic attacks, sadness etc. I know that this is ""normal"" for trans folks but we deserve to be happy!!!!! What do you do to regain your energy? What helps you to recover from ignorance and hatred? What gives you hope? Can you tell that it gets better? What helps you not to give up? Where do you get support? How do you survive as nb _ trans?",genderqueer,Help and inspiration needed! How to survive and even be happy as nb _ trans???,1501196425.0,"{'created_utc': 1501171225, 'id': '6pww4s', 'num_comments': 4, 'score': 11, 'selftext': 'It\'s four months now that I don\'t feel/identify as cis female anymore. Being non binary trans feels so true to myself and I\'m grateful to get to know myself more! BUT at the same time I feel like almost EVERYTHING is getting more complicated, challenging or violent. It\'s all: the thousands of questions and thoughts in my head, the feeling of not belonging and having no space in a binary society, the transhatred, the fear of transhatred, misgendering, loosing friends, the fear and nervousness at each coming out, the difficulties finding a job ... it\'s not all bad, I don\'t wanna whine as I know other face much more shit than I do. I need your help though. I can clearly tell how my health and wellbeing suffer. Insomnia, panic attacks, sadness etc. I know that this is ""normal"" for trans folks but we deserve to be happy!!!!! What do you do to regain your energy? What helps you to recover from ignorance and hatred? What gives you hope? Can you tell that it gets better? What helps you not to give up? Where do you get support? How do you survive as nb _ trans?', 'subreddit': 'genderqueer', 'title': 'Help and inspiration needed! How to survive and even be happy as nb _ trans???', 'created': 1501196425.0}"
2017-07-27 19:05:42,6py78x,3,6,"I've been having issues with my gender identity for about 3 years now (I'm 18). The day I started wondering I was looking at this guy in my class and I realized I didn't just find him attractive, I wanted to look like him too. I constantly wish that I didn't have breasts and think about having a flat chest all the time. I have some issues with my genitalia too but not as often. I wish people would see me as androgynous at least.

I tried to force myself to fully identify as a woman which worked for a while but it eventually led to me having a breakdown a few days ago and I'm in a very bad place right now. There is no way that I could come out to anyone about this so I have no one to talk to. I don't know how to fix my feelings about my body and I constantly worry that I'm just making everything up and none of this is real. I've heard of the term transtrender and I'm just scared that I fall into that category. I don't know if what I'm feeling can be attributed to me being bisexual (butch?) in anyway or if I'm truly genderqueer. I'm scared of transitioning but I feel like I'm even more scared of feeling this way my whole life. This sounds kind of dumb but I feel like if my brain was put into a male body then I would be happy. I feel really empty thinking about spending the rest of my life as a woman, but I don't feel 100% male either. I'm really embarrassed over my feelings, especially seeing the things that people say about trans and genderqueer people.

Thank you to anyone who read this. Any insight about what I might be feeling would be really helpful. ",genderqueer,Lost and confused,1501207542.0,"{'created_utc': 1501182342, 'id': '6py78x', 'num_comments': 3, 'score': 6, 'selftext': ""I've been having issues with my gender identity for about 3 years now (I'm 18). The day I started wondering I was looking at this guy in my class and I realized I didn't just find him attractive, I wanted to look like him too. I constantly wish that I didn't have breasts and think about having a flat chest all the time. I have some issues with my genitalia too but not as often. I wish people would see me as androgynous at least.\n\nI tried to force myself to fully identify as a woman which worked for a while but it eventually led to me having a breakdown a few days ago and I'm in a very bad place right now. There is no way that I could come out to anyone about this so I have no one to talk to. I don't know how to fix my feelings about my body and I constantly worry that I'm just making everything up and none of this is real. I've heard of the term transtrender and I'm just scared that I fall into that category. I don't know if what I'm feeling can be attributed to me being bisexual (butch?) in anyway or if I'm truly genderqueer. I'm scared of transitioning but I feel like I'm even more scared of feeling this way my whole life. This sounds kind of dumb but I feel like if my brain was put into a male body then I would be happy. I feel really empty thinking about spending the rest of my life as a woman, but I don't feel 100% male either. I'm really embarrassed over my feelings, especially seeing the things that people say about trans and genderqueer people.\n\nThank you to anyone who read this. Any insight about what I might be feeling would be really helpful. "", 'subreddit': 'genderqueer', 'title': 'Lost and confused', 'created': 1501207542.0}"
2017-07-27 20:24:32,6pyr79,3,9,"Does anyone else who has lived both in a small, not-trans-aware community and a big liberal city actually preferred some aspects of how the small community dealt with your gender nonconformity?
(I should preface this by saying that my family did not exhibit the worst of what I hear other families in small communities often have to offer trans people, like the threat of physical violence or religiously-justified shaming, so maybe the thoughts I describe below are atypical).

A few thoughts I have on what I preferred about being gender-nonconforming in a community where that wasn't even a thing:

""Coming out"" was not a thing that had to happen, because I didn't know there was anything to come out as, and neither did my community. I didn't know any trans-related terminology, I just knew I ""didn't feel like a boy or girl,"" so I acted accordingly by dressing androgynously and not doing gender-related behaviors or tasks if I didn't feel like it. For their part, people around me knew I was ""androgynous"" (I don't think they distinguish between expression and actual gender) and have learned that they can't expect me to do ""girl"" things, and that's about as far as their understanding of my gender is ever going to go - and I'm actually fine with that. I never knew or cared about other forms of acknowledgement and respect (pronouns, name changes, alternative words for anatomy...and this isn't to say that these aren't critically important for some and shouldn't be respected) before going to college and also reading up on gender nonconformity, the discussion around which seems to be driven by educated, socially-aware liberal people who put more emphasis on the language of dealing with trans people (way more than a lot of people in my community would be able to get their heads around) than just interacting with them naturally. So for me, saying ""xyz are my pronouns"" or ""I go by xyz name now"" just doesn't feel genuine, because I never used to have to do that to be acknowledged.",genderqueer,"DAE who has lived both in a small, not-trans-aware community and a big liberal city actually preferred some aspects of how the small community dealt with your gender nonconformity?",1501212272.0,"{'created_utc': 1501187072, 'id': '6pyr79', 'num_comments': 3, 'score': 9, 'selftext': 'Does anyone else who has lived both in a small, not-trans-aware community and a big liberal city actually preferred some aspects of how the small community dealt with your gender nonconformity?\n(I should preface this by saying that my family did not exhibit the worst of what I hear other families in small communities often have to offer trans people, like the threat of physical violence or religiously-justified shaming, so maybe the thoughts I describe below are atypical).\n\nA few thoughts I have on what I preferred about being gender-nonconforming in a community where that wasn\'t even a thing:\n\n""Coming out"" was not a thing that had to happen, because I didn\'t know there was anything to come out as, and neither did my community. I didn\'t know any trans-related terminology, I just knew I ""didn\'t feel like a boy or girl,"" so I acted accordingly by dressing androgynously and not doing gender-related behaviors or tasks if I didn\'t feel like it. For their part, people around me knew I was ""androgynous"" (I don\'t think they distinguish between expression and actual gender) and have learned that they can\'t expect me to do ""girl"" things, and that\'s about as far as their understanding of my gender is ever going to go - and I\'m actually fine with that. I never knew or cared about other forms of acknowledgement and respect (pronouns, name changes, alternative words for anatomy...and this isn\'t to say that these aren\'t critically important for some and shouldn\'t be respected) before going to college and also reading up on gender nonconformity, the discussion around which seems to be driven by educated, socially-aware liberal people who put more emphasis on the language of dealing with trans people (way more than a lot of people in my community would be able to get their heads around) than just interacting with them naturally. So for me, saying ""xyz are my pronouns"" or ""I go by xyz name now"" just doesn\'t feel genuine, because I never used to have to do that to be acknowledged.', 'subreddit': 'genderqueer', 'title': 'DAE who has lived both in a small, not-trans-aware community and a big liberal city actually preferred some aspects of how the small community dealt with your gender nonconformity?', 'created': 1501212272.0}"
2017-07-27 22:56:51,6pzqfl,1,1,,genderqueer,Cats,1501221411.0,"{'created_utc': 1501196211, 'id': '6pzqfl', 'num_comments': 1, 'score': 1, 'selftext': '', 'subreddit': 'genderqueer', 'title': 'Cats', 'created': 1501221411.0}"
2017-07-27 23:14:45,6pzu91,0,1,[deleted],genderqueer,Preference,1501222485.0,"{'created_utc': 1501197285, 'id': '6pzu91', 'num_comments': 0, 'score': 1, 'selftext': '[deleted]', 'subreddit': 'genderqueer', 'title': 'Preference', 'created': 1501222485.0}"
2017-07-27 23:32:03,6pzxxy,6,21,,genderqueer,This shirt was so corny I had to get it,1501223523.0,"{'created_utc': 1501198323, 'id': '6pzxxy', 'num_comments': 6, 'score': 21, 'selftext': '', 'subreddit': 'genderqueer', 'title': 'This shirt was so corny I had to get it', 'created': 1501223523.0}"
