,created_utc,id,num_comments,score,selftext,subreddit,title,created,d_,Unnamed: 0
63,2014-04-16 03:33:55,235jxn,4,10,"Dude-type people and people otherwise accustomed to short hair, I'd love some advice for gels/pomades and styling.  My current style of ""wash the hair, pray, and wear a hat if the prayers fail"" isn't super flattering or professional most of the time, but I'm lost in the sea of men's styling products and would like some pointers on what you guys think work well/aren't ridiculously expensive.

Personally, I've got hair that ranges from pin straight to fully crazy curls, depending on the humidity and other unknown factors, but generally has varying degrees of wave to it.  So do pomades work for curly(ish) hair?  Are gels better?  What about mousse?  ",genderqueer,Hair styling help?,1397644435.0,"{'created_utc': 1397619235, 'id': '235jxn', 'num_comments': 4, 'score': 10, 'selftext': 'Dude-type people and people otherwise accustomed to short hair, I\'d love some advice for gels/pomades and styling.  My current style of ""wash the hair, pray, and wear a hat if the prayers fail"" isn\'t super flattering or professional most of the time, but I\'m lost in the sea of men\'s styling products and would like some pointers on what you guys think work well/aren\'t ridiculously expensive.\n\nPersonally, I\'ve got hair that ranges from pin straight to fully crazy curls, depending on the humidity and other unknown factors, but generally has varying degrees of wave to it.  So do pomades work for curly(ish) hair?  Are gels better?  What about mousse?  ', 'subreddit': 'genderqueer', 'title': 'Hair styling help?', 'created': 1397644435.0}",
64,2014-04-16 03:36:12,235k3n,0,1,,genderqueer,BBC News - India court recognises transgender people as third gender,1397644572.0,"{'created_utc': 1397619372, 'id': '235k3n', 'num_comments': 0, 'score': 1, 'selftext': '', 'subreddit': 'genderqueer', 'title': 'BBC News - India court recognises transgender people as third gender', 'created': 1397644572.0}",
65,2014-04-16 16:09:44,236uyl,4,3,"I've been increasingly frustrated with my overtly ""feminine"" look. I have long curly ethnic hair that I don't know what to do with - if I buzz it or cut it super short I feel like I would look weird. 
I definitely have a ""woman's body"" which makes it difficult for me to wear clothes other than women's clothing. I'm trying to expand my wardrobe to add more gender-neutral clothing but I always end up looking too feminine.
It bothers me since I don't always want to look feminine. I have my days, but it's not often. Most days I want to be neither!

Any GQ afro-latinas out there have any ideas or advice?!",genderqueer,Trying to look more androgynous...any ideas?,1397689784.0,"{'created_utc': 1397664584, 'id': '236uyl', 'num_comments': 4, 'score': 3, 'selftext': 'I\'ve been increasingly frustrated with my overtly ""feminine"" look. I have long curly ethnic hair that I don\'t know what to do with - if I buzz it or cut it super short I feel like I would look weird. \nI definitely have a ""woman\'s body"" which makes it difficult for me to wear clothes other than women\'s clothing. I\'m trying to expand my wardrobe to add more gender-neutral clothing but I always end up looking too feminine.\nIt bothers me since I don\'t always want to look feminine. I have my days, but it\'s not often. Most days I want to be neither!\n\nAny GQ afro-latinas out there have any ideas or advice?!', 'subreddit': 'genderqueer', 'title': 'Trying to look more androgynous...any ideas?', 'created': 1397689784.0}",
66,2014-04-16 19:14:33,237dpl,4,9,"So, I'm kind of in a bind (ha!) about what to do about my breasts. I'm wary of getting an actual binder because I know that they can cause permanent damage, and whilst I've been in a more masculine/neutral mood for the last few years, I've had more femmy phases in the past and don't want to end up feeling awful about having misshapen breasts if I have another swing in that direction. I know that even wearing a too-tight sports bra can cause damage, but I was wondering if there are any that do a decent job of hiding things without being tight enough for long-term damage? I'm already wearing sports bras full-time anyway, but the kind I'm using don't do the job as well as I'd like. I get the feeling that it might be too much to ask to have the look that I want at the moment without long-term consequences, but I'll never know if I don't ask, so... any ideas? I'm from the UK, so I'd prefer British brands or at least places that will ship here. Thanks =)  ",genderqueer,Sports bra recommendations?,1397700873.0,"{'created_utc': 1397675673, 'id': '237dpl', 'num_comments': 4, 'score': 9, 'selftext': ""So, I'm kind of in a bind (ha!) about what to do about my breasts. I'm wary of getting an actual binder because I know that they can cause permanent damage, and whilst I've been in a more masculine/neutral mood for the last few years, I've had more femmy phases in the past and don't want to end up feeling awful about having misshapen breasts if I have another swing in that direction. I know that even wearing a too-tight sports bra can cause damage, but I was wondering if there are any that do a decent job of hiding things without being tight enough for long-term damage? I'm already wearing sports bras full-time anyway, but the kind I'm using don't do the job as well as I'd like. I get the feeling that it might be too much to ask to have the look that I want at the moment without long-term consequences, but I'll never know if I don't ask, so... any ideas? I'm from the UK, so I'd prefer British brands or at least places that will ship here. Thanks =)  "", 'subreddit': 'genderqueer', 'title': 'Sports bra recommendations?', 'created': 1397700873.0}",
67,2014-04-17 00:34:07,2389gm,9,17,"Hey everyone, this is going to be long so you can see the full picture so sorry in advance. When I was little, I used to walk around in my grandmothers heels and I would pretend to be a girl. As I got older, I started wearing a wig and living a double life as a girl. By day, I acted like a normal guy and by night I was a girl. I would act like a girl, talk like a girl, and do regular things as a girl. It felt right. It felt good. One Halloween when I was 16, my dad’s gf let me wear her real hair wig she had in her collection (she wasn’t bald ha-ha) and my friend did my makeup. When I looked in the mirror... it felt right. It was like I was seeing who I was supposed to see. When I normally look in the mirror, I don’t like what I see. I was so happy, my friend did an amazing job and I looked great! I got to walk around all day and people just thought I was a chick not celebrating Halloween! I never understood these feelings and the whole ordeal, but now I do. I want to be able to walk around in public as a girl and I want to feel pretty. I want to paint my nails and wear makeup. One thing I never mentioned is I am heterosexual. I am not attracted to men one bit. I am also in a 3-year long relationship (I am 21 now) and I don’t know what to do. No one knows how I feel because I hid it this long. I want to tell my family and I am lucky enough to have a family I am sure would support me (my uncle is gay and we all love him), we are tight knit and family comes first. However I am scared. I am scared of losing my friends, my family, and my girlfriend. I also want biological children of my own someday too. (I am an only child) I really don’t want to disappoint my dad being his only son. I don’t know what to do or how to handle this. If I didn’t cover enough stuff, please AMA. I’m an open book.",genderqueer,Don't know where to turn... (male),1397720047.0,"{'created_utc': 1397694847, 'id': '2389gm', 'num_comments': 9, 'score': 17, 'selftext': 'Hey everyone, this is going to be long so you can see the full picture so sorry in advance. When I was little, I used to walk around in my grandmothers heels and I would pretend to be a girl. As I got older, I started wearing a wig and living a double life as a girl. By day, I acted like a normal guy and by night I was a girl. I would act like a girl, talk like a girl, and do regular things as a girl. It felt right. It felt good. One Halloween when I was 16, my dad’s gf let me wear her real hair wig she had in her collection (she wasn’t bald ha-ha) and my friend did my makeup. When I looked in the mirror... it felt right. It was like I was seeing who I was supposed to see. When I normally look in the mirror, I don’t like what I see. I was so happy, my friend did an amazing job and I looked great! I got to walk around all day and people just thought I was a chick not celebrating Halloween! I never understood these feelings and the whole ordeal, but now I do. I want to be able to walk around in public as a girl and I want to feel pretty. I want to paint my nails and wear makeup. One thing I never mentioned is I am heterosexual. I am not attracted to men one bit. I am also in a 3-year long relationship (I am 21 now) and I don’t know what to do. No one knows how I feel because I hid it this long. I want to tell my family and I am lucky enough to have a family I am sure would support me (my uncle is gay and we all love him), we are tight knit and family comes first. However I am scared. I am scared of losing my friends, my family, and my girlfriend. I also want biological children of my own someday too. (I am an only child) I really don’t want to disappoint my dad being his only son. I don’t know what to do or how to handle this. If I didn’t cover enough stuff, please AMA. I’m an open book.', 'subreddit': 'genderqueer', 'title': ""Don't know where to turn... (male)"", 'created': 1397720047.0}",
68,2014-04-17 13:11:15,239kvy,3,15,"Hi, I had always felt some gender dysmorphia since as far back as I can remember. It's something that remained far back in my mind for so long (I'm 23 now) but since discovering concepts like gender fluidity I immediately knew that was for me. This was about 3 months ago.

My fiancée has been really accepting of this so far but admits she doesn't really understand transgender issues. She's accommodating and supportive, even to the extent of helping me with research about things like breast binding and adopting my preferred gender pronouns when I feel masculine, neither or both.

From her perspective, she admits she feels like she's still in love with a woman who's ""acting out"" a different gender identity. She's admitted that in bed, she's been happy with this because she finds gender play a big turn on.

I've accepted this, I love her completely and we've been together since we first met at university nearly 5 years ago. I don't need her to understand, just accept and support.

When I came out as genderqueer, I came out as a genderfluid woman (I'm normally in a feminine mode, ranging from very feminine to my normal tomboyish phase) but for a variety of reasons, most recently a  sense of disillusionment with feminism and gender politics, I want to identify as fully genderqueer, not as a genderfluid woman.

My worry is am I just moving too fast? In these past months, this has felt nothing but completely right like I've found the language for my thoughts and feelings.

I'm a little scared of fully coming out to my fiancée too. Our relationship is very strong and we're devoting more spare time together over the next year, we both feel we're perfect for each other. Should I ease her into this or is it better to just come out and say it?

She's been accepting but never really understood things like how I could be attracted to a MAAB genderqueer person but not a cisgender man or transman. I think for her, gender = physical sex. I don't want any hormone treatment or physical alteration, I just don't feel ""woman"" fits any more.",genderqueer,Am I moving too fast?,1397765475.0,"{'created_utc': 1397740275, 'id': '239kvy', 'num_comments': 3, 'score': 15, 'selftext': 'Hi, I had always felt some gender dysmorphia since as far back as I can remember. It\'s something that remained far back in my mind for so long (I\'m 23 now) but since discovering concepts like gender fluidity I immediately knew that was for me. This was about 3 months ago.\n\nMy fiancée has been really accepting of this so far but admits she doesn\'t really understand transgender issues. She\'s accommodating and supportive, even to the extent of helping me with research about things like breast binding and adopting my preferred gender pronouns when I feel masculine, neither or both.\n\nFrom her perspective, she admits she feels like she\'s still in love with a woman who\'s ""acting out"" a different gender identity. She\'s admitted that in bed, she\'s been happy with this because she finds gender play a big turn on.\n\nI\'ve accepted this, I love her completely and we\'ve been together since we first met at university nearly 5 years ago. I don\'t need her to understand, just accept and support.\n\nWhen I came out as genderqueer, I came out as a genderfluid woman (I\'m normally in a feminine mode, ranging from very feminine to my normal tomboyish phase) but for a variety of reasons, most recently a  sense of disillusionment with feminism and gender politics, I want to identify as fully genderqueer, not as a genderfluid woman.\n\nMy worry is am I just moving too fast? In these past months, this has felt nothing but completely right like I\'ve found the language for my thoughts and feelings.\n\nI\'m a little scared of fully coming out to my fiancée too. Our relationship is very strong and we\'re devoting more spare time together over the next year, we both feel we\'re perfect for each other. Should I ease her into this or is it better to just come out and say it?\n\nShe\'s been accepting but never really understood things like how I could be attracted to a MAAB genderqueer person but not a cisgender man or transman. I think for her, gender = physical sex. I don\'t want any hormone treatment or physical alteration, I just don\'t feel ""woman"" fits any more.', 'subreddit': 'genderqueer', 'title': 'Am I moving too fast?', 'created': 1397765475.0}",
69,2014-04-17 21:57:23,23b0ut,10,70,,genderqueer,Dyed my hair. (Agender),1397797043.0,"{'created_utc': 1397771843, 'id': '23b0ut', 'num_comments': 10, 'score': 70, 'selftext': '', 'subreddit': 'genderqueer', 'title': 'Dyed my hair. (Agender)', 'created': 1397797043.0}",
70,2014-04-18 01:24:27,23bjwb,5,3,,genderqueer,Scientists discover the animal kingdom’s first ‘female penis’ (x-post from /r/science),1397809467.0,"{'created_utc': 1397784267, 'id': '23bjwb', 'num_comments': 5, 'score': 3, 'selftext': '', 'subreddit': 'genderqueer', 'title': 'Scientists discover the animal kingdom’s first ‘female penis’ (x-post from /r/science)', 'created': 1397809467.0}",
71,2014-04-18 05:32:58,23c3n8,10,12,"I am genderqueer/genderfluid/still figuring it out and AMAB. My mom has done pretty well with me being gay, she doesn't ""agree"" with it, in her words, but she loves and supports me. I even talk to her about boy problems. Anyways, within the past year, I've realized that I'm not cisgender, and I'm still trying to figure out what I want to call myself. I came home to visit for the weekend and I brought up that substitute teacher that was temporarily suspended after being outed because that was in my area. She basically said ""I wouldn't want my kids around it."" Now I have zero hope for ever being able to come out to her.",genderqueer,Just realized I can never come out to my mom,1397824378.0,"{'created_utc': 1397799178, 'id': '23c3n8', 'num_comments': 10, 'score': 12, 'selftext': 'I am genderqueer/genderfluid/still figuring it out and AMAB. My mom has done pretty well with me being gay, she doesn\'t ""agree"" with it, in her words, but she loves and supports me. I even talk to her about boy problems. Anyways, within the past year, I\'ve realized that I\'m not cisgender, and I\'m still trying to figure out what I want to call myself. I came home to visit for the weekend and I brought up that substitute teacher that was temporarily suspended after being outed because that was in my area. She basically said ""I wouldn\'t want my kids around it."" Now I have zero hope for ever being able to come out to her.', 'subreddit': 'genderqueer', 'title': 'Just realized I can never come out to my mom', 'created': 1397824378.0}",
72,2014-04-18 12:30:28,23cn8q,2,27,,genderqueer,Wee hippy glasses!,1397849428.0,"{'created_utc': 1397824228, 'id': '23cn8q', 'num_comments': 2, 'score': 27, 'selftext': '', 'subreddit': 'genderqueer', 'title': 'Wee hippy glasses!', 'created': 1397849428.0}",
73,2014-04-18 17:59:55,23dfyk,13,23,"For me seeing things like ""MEN OF REDDIT, what have you always wanted to know about women?"" or ""WOMEN, what's the weirdest way a guy has hit on you?"" makes me feel so excluded because none of those stereotypes really apply to me at all.

Even though it's easy to say ""Gender is subjective and being ____ doesn't mean you're masculine / being ___ doesn't mean you're feminine,"" it doesn't really seem to make a difference when you're faced with the sort of majority-rule idea of gender roles.  All the women (cis and trans alike)  bonding over things like bobby pins and going to the bathroom in herds and gossip and emotions, and all the men bonding over the equivalent stereotypically masculine stuff (some examples I saw were ""memorizing facts/statistics,"" ""walking awkwardly when they think girls are looking at them,"" and ""presenting solutions when a girlfriend has a problem, not emotional support."") It seems much easier for people to agree on those and relate to each other, and they seem happy with that identification.

I know it's all culturally based, and not biological, but it still makes me uncomfortable. I'm FAAB, and people always say ""Well, you can still be a woman and not be stereotypically feminine blah blah blah"" but then, how do transwomen know they're women / transmen know they're men, if gender is just a social construct? am I just missing the Thing inside my head that says ""I FEEL LIKE A WOMAN/MAN/____""?

Sometimes I think I might be a transman, but then I realize that what I am feeling isn't an identification with the male gender, but a lack of identification with the female gender (which is the one I got born into and so it's been expected of me a lot more).

**EDIT:** I think people in this thread thought I was referring to the titles of the questions and their being addressed to binary genders, not the content of the actual threads themselves and the subjects of the questions. I don't mind being addressed as ""MEN, etc. etc."" or ""WOMEN, etc. etc."", it's more just when people start discussing things that ""girls do"" or ""men do"" or whatever, the greatest common denominator ends up being typical cultural gender roles that I don't associate with at all.",genderqueer,"Does anyone else get dysphoria from gendered AskReddit questions? (bit rambly, sorry)",1397869195.0,"{'created_utc': 1397843995, 'id': '23dfyk', 'num_comments': 13, 'score': 23, 'selftext': 'For me seeing things like ""MEN OF REDDIT, what have you always wanted to know about women?"" or ""WOMEN, what\'s the weirdest way a guy has hit on you?"" makes me feel so excluded because none of those stereotypes really apply to me at all.\n\nEven though it\'s easy to say ""Gender is subjective and being ____ doesn\'t mean you\'re masculine / being ___ doesn\'t mean you\'re feminine,"" it doesn\'t really seem to make a difference when you\'re faced with the sort of majority-rule idea of gender roles.  All the women (cis and trans alike)  bonding over things like bobby pins and going to the bathroom in herds and gossip and emotions, and all the men bonding over the equivalent stereotypically masculine stuff (some examples I saw were ""memorizing facts/statistics,"" ""walking awkwardly when they think girls are looking at them,"" and ""presenting solutions when a girlfriend has a problem, not emotional support."") It seems much easier for people to agree on those and relate to each other, and they seem happy with that identification.\n\nI know it\'s all culturally based, and not biological, but it still makes me uncomfortable. I\'m FAAB, and people always say ""Well, you can still be a woman and not be stereotypically feminine blah blah blah"" but then, how do transwomen know they\'re women / transmen know they\'re men, if gender is just a social construct? am I just missing the Thing inside my head that says ""I FEEL LIKE A WOMAN/MAN/____""?\n\nSometimes I think I might be a transman, but then I realize that what I am feeling isn\'t an identification with the male gender, but a lack of identification with the female gender (which is the one I got born into and so it\'s been expected of me a lot more).\n\n**EDIT:** I think people in this thread thought I was referring to the titles of the questions and their being addressed to binary genders, not the content of the actual threads themselves and the subjects of the questions. I don\'t mind being addressed as ""MEN, etc. etc."" or ""WOMEN, etc. etc."", it\'s more just when people start discussing things that ""girls do"" or ""men do"" or whatever, the greatest common denominator ends up being typical cultural gender roles that I don\'t associate with at all.', 'subreddit': 'genderqueer', 'title': 'Does anyone else get dysphoria from gendered AskReddit questions? (bit rambly, sorry)', 'created': 1397869195.0}",
74,2014-04-19 22:50:46,23gx08,10,17,"I've been reading on here and other forums about gender identity and gender expression. I was born female, but I can't say I ever truly felt comfortable as a girl. I felt more masculine than feminine, but felt because I was born this way, I need to be a girl. I've been dealing with anxiety concerning my chest. I want top surgery to be rid of them for good. For so many years I thought I wouldn't be able to get a breast reduction because a surgeon would refuse.

I've been using body wash and cologne/spray. I like the way it smells. I want to purchase some boxers and other things, but worried my parents will see them and question me. 

Sometimes I wish I was a boy and other days I wish I could pass as either a boy or androgynous. ",genderqueer,Black and figuring out my identity.,1397973046.0,"{'created_utc': 1397947846, 'id': '23gx08', 'num_comments': 10, 'score': 17, 'selftext': ""I've been reading on here and other forums about gender identity and gender expression. I was born female, but I can't say I ever truly felt comfortable as a girl. I felt more masculine than feminine, but felt because I was born this way, I need to be a girl. I've been dealing with anxiety concerning my chest. I want top surgery to be rid of them for good. For so many years I thought I wouldn't be able to get a breast reduction because a surgeon would refuse.\n\nI've been using body wash and cologne/spray. I like the way it smells. I want to purchase some boxers and other things, but worried my parents will see them and question me. \n\nSometimes I wish I was a boy and other days I wish I could pass as either a boy or androgynous. "", 'subreddit': 'genderqueer', 'title': 'Black and figuring out my identity.', 'created': 1397973046.0}",
75,2014-04-20 17:55:23,23iw6q,13,6,,genderqueer,How androgynous am I? Thoughts?,1398041723.0,"{'created_utc': 1398016523, 'id': '23iw6q', 'num_comments': 13, 'score': 6, 'selftext': '', 'subreddit': 'genderqueer', 'title': 'How androgynous am I? Thoughts?', 'created': 1398041723.0}",
76,2014-04-20 21:16:35,23jdwn,0,5,,genderqueer,Somewhat genderfluid and queer performance art-photography thing that I found quite striking. [somwhat NSFW I imagine],1398053795.0,"{'created_utc': 1398028595, 'id': '23jdwn', 'num_comments': 0, 'score': 5, 'selftext': '', 'subreddit': 'genderqueer', 'title': 'Somewhat genderfluid and queer performance art-photography thing that I found quite striking. [somwhat NSFW I imagine]', 'created': 1398053795.0}",
