,created_utc,id,num_comments,score,selftext,subreddit,title,created,d_,Unnamed: 0
25,2014-04-05 14:13:07,229s33,5,23,,genderqueer,Singular “they” and the many reasons why it’s correct,1396732387.0,"{'created_utc': 1396707187, 'id': '229s33', 'num_comments': 5, 'score': 23, 'selftext': '', 'subreddit': 'genderqueer', 'title': 'Singular “they” and the many reasons why it’s correct', 'created': 1396732387.0}",22.0
26,2014-04-05 14:16:50,229sbt,22,12,"So you may remember me from when I was asking for advice about my partner's comfort with my identity and my name.

Well, I'm back, and now single. There were many reasons I decided to end it, but one of the reasons was because I got the sense that he would never be comfortable having his girlfriend introduce herself with a male name.

My question is this: should I just give up on dating cis men altogether? I'm pretty firmly attracted to them, but I'm worried this will be a deal breaker for many other people I might want to date.
",genderqueer,Should I only date other non-binary people?,1396732610.0,"{'created_utc': 1396707410, 'id': '229sbt', 'num_comments': 22, 'score': 12, 'selftext': ""So you may remember me from when I was asking for advice about my partner's comfort with my identity and my name.\n\nWell, I'm back, and now single. There were many reasons I decided to end it, but one of the reasons was because I got the sense that he would never be comfortable having his girlfriend introduce herself with a male name.\n\nMy question is this: should I just give up on dating cis men altogether? I'm pretty firmly attracted to them, but I'm worried this will be a deal breaker for many other people I might want to date.\n"", 'subreddit': 'genderqueer', 'title': 'Should I only date other non-binary people?', 'created': 1396732610.0}",23.0
27,2014-04-05 14:42:37,229typ,5,5,"I'm afab and questioning my gender, leaning towards agender, and I appear very feminine/always read as female. Should I tell a potential (straight male) sexual partner that I'm not exactly a girl, and if yes how do I explain to a probably totally clueless person?",genderqueer,If and how to disclose to potential partners.,1396734157.0,"{'created_utc': 1396708957, 'id': '229typ', 'num_comments': 5, 'score': 5, 'selftext': ""I'm afab and questioning my gender, leaning towards agender, and I appear very feminine/always read as female. Should I tell a potential (straight male) sexual partner that I'm not exactly a girl, and if yes how do I explain to a probably totally clueless person?"", 'subreddit': 'genderqueer', 'title': 'If and how to disclose to potential partners.', 'created': 1396734157.0}",24.0
28,2014-04-05 18:02:43,22aa7v,3,1,"My girlfriend and I were having a conversation about how traits like being ""strong"" or ""intelligent"" or ""brave"" are all used as examples of what it means to be a good man when really those traits are desirable in all people regardless of gender. 

It got me thinking about how we define gender and why the seperation between male and female even exists in the first place. So, /r/trans, what is the difference? What is it that makes you know that you're a Woman and not a man (or vice versa) despite having a sex to the contrary? what is that makes someone a man or woman exactly?",trans,Thought you lovely folks might have some interesting ideas about this question. What's the difference between men and women?,1396746163.0,"{'created_utc': 1396720963, 'id': '22aa7v', 'num_comments': 3, 'score': 1, 'selftext': 'My girlfriend and I were having a conversation about how traits like being ""strong"" or ""intelligent"" or ""brave"" are all used as examples of what it means to be a good man when really those traits are desirable in all people regardless of gender. \n\nIt got me thinking about how we define gender and why the seperation between male and female even exists in the first place. So, /r/trans, what is the difference? What is it that makes you know that you\'re a Woman and not a man (or vice versa) despite having a sex to the contrary? what is that makes someone a man or woman exactly?', 'subreddit': 'trans', 'title': ""Thought you lovely folks might have some interesting ideas about this question. What's the difference between men and women?"", 'created': 1396746163.0}",3.0
29,2014-04-05 20:32:03,22amnb,2,4,,genderqueer,"Hey everyone, I need some help!",1396755123.0,"{'created_utc': 1396729923, 'id': '22amnb', 'num_comments': 2, 'score': 4, 'selftext': '', 'subreddit': 'genderqueer', 'title': 'Hey everyone, I need some help!', 'created': 1396755123.0}",25.0
30,2014-04-06 01:22:38,22ba8p,34,29,,genderqueer,"I wrote this body hair removal tutorial for /r/feminineboys, but I thought there might be some people here who could dig it.",1396772558.0,"{'created_utc': 1396747358, 'id': '22ba8p', 'num_comments': 34, 'score': 29, 'selftext': '', 'subreddit': 'genderqueer', 'title': 'I wrote this body hair removal tutorial for /r/feminineboys, but I thought there might be some people here who could dig it.', 'created': 1396772558.0}",26.0
31,2014-04-06 02:26:03,22bexf,3,11,"Over the past few months, I've come to identify as genderqueer. I'm fairly comfortable in terms of pronouns/genitalia/whatnot, but I am interested in changing my outwards presentation. I feel various aspects of my face are very masculine, but I've also been told I have some very feminine traits. Recently I was backstage for my school's theatre production and had my makeup done for kicks, and it was apparently a rousing success, but I personally know nothing about it. I'm well aware that I'm far more masculine than feminine, and for the most part I like the (maybe) somewhat blended presentation I have, but I'm curious about how I would go about making myself look more feminine, which I'm somewhat interested in doing. Thanks!

Some pics for reference:  
http://imgur.com/Wv3vrrc  
http://imgur.com/UcxASvq  
http://imgur.com/g6EyheJ  ",genderqueer,Am I feminine? Tips for feminizing myself?,1396776363.0,"{'created_utc': 1396751163, 'id': '22bexf', 'num_comments': 3, 'score': 11, 'selftext': ""Over the past few months, I've come to identify as genderqueer. I'm fairly comfortable in terms of pronouns/genitalia/whatnot, but I am interested in changing my outwards presentation. I feel various aspects of my face are very masculine, but I've also been told I have some very feminine traits. Recently I was backstage for my school's theatre production and had my makeup done for kicks, and it was apparently a rousing success, but I personally know nothing about it. I'm well aware that I'm far more masculine than feminine, and for the most part I like the (maybe) somewhat blended presentation I have, but I'm curious about how I would go about making myself look more feminine, which I'm somewhat interested in doing. Thanks!\n\nSome pics for reference:  \nhttp://imgur.com/Wv3vrrc  \nhttp://imgur.com/UcxASvq  \nhttp://imgur.com/g6EyheJ  "", 'subreddit': 'genderqueer', 'title': 'Am I feminine? Tips for feminizing myself?', 'created': 1396776363.0}",27.0
32,2014-04-06 03:33:32,22bjmg,9,7,"I'm not sure if this is the appropriate place to ask this question but I don't know who else to turn to. Okay here goes. I am a pansexual, male bodied queer person. For the past few years I've been trying to figure myself out. Some things have been easier than others. But there is one thing I just have no idea how to even begin to approach.
I am both attracted to and want to be like lesbians with traditionally masculine characteristics (e.g. short hair). I identify strongly with lesbians, the lesbian cultural experience and lesbian sexuality. A butch lesbian, especially one who defies all gender norms, fills me with a strange sense of arousal and envy. I am attracted to and love men of all kinds but I never really envy them the way I seem to envy lesbians.
 
This is conflicting for me on many levels. For one thing, I'm queer but I have passing privilege. As far as society at large is concerned I'm 'male' unless I happened to feel like wearing a dress that day. Combine that with all my other privileges and I feel guilty for the way I feel towards lesbians. Is this just another symptom of my toxic privilege? Do I have any right to want to be a part of this experience I can only relate to in a marginal sense? 
And I'm not even sure how to address this longing feeling I have. I know, or at least I'm 99.9 percent sure, that I am not trans. I am fine with my body, it doesn't fill me with feelings of self loathing or disgust. I am not content with the constraints of the gender binary but other than that I'm okay. So if I'm not going to transition...how do I respond to this feeling? Dress like the women I admire so much? If I do that am I insulting them? I just...I don't even know what I'm going to do about this. Does anyone here have any experience with this?
TL;DR: I am a male bodied queer person who admires and wants to emulate lesbians with masculine characteristics. However I am not sure if I have the right to feel this way due to my privilege, help?",genderqueer,So...so confused,1396780412.0,"{'created_utc': 1396755212, 'id': '22bjmg', 'num_comments': 9, 'score': 7, 'selftext': ""I'm not sure if this is the appropriate place to ask this question but I don't know who else to turn to. Okay here goes. I am a pansexual, male bodied queer person. For the past few years I've been trying to figure myself out. Some things have been easier than others. But there is one thing I just have no idea how to even begin to approach.\nI am both attracted to and want to be like lesbians with traditionally masculine characteristics (e.g. short hair). I identify strongly with lesbians, the lesbian cultural experience and lesbian sexuality. A butch lesbian, especially one who defies all gender norms, fills me with a strange sense of arousal and envy. I am attracted to and love men of all kinds but I never really envy them the way I seem to envy lesbians.\n \nThis is conflicting for me on many levels. For one thing, I'm queer but I have passing privilege. As far as society at large is concerned I'm 'male' unless I happened to feel like wearing a dress that day. Combine that with all my other privileges and I feel guilty for the way I feel towards lesbians. Is this just another symptom of my toxic privilege? Do I have any right to want to be a part of this experience I can only relate to in a marginal sense? \nAnd I'm not even sure how to address this longing feeling I have. I know, or at least I'm 99.9 percent sure, that I am not trans. I am fine with my body, it doesn't fill me with feelings of self loathing or disgust. I am not content with the constraints of the gender binary but other than that I'm okay. So if I'm not going to transition...how do I respond to this feeling? Dress like the women I admire so much? If I do that am I insulting them? I just...I don't even know what I'm going to do about this. Does anyone here have any experience with this?\nTL;DR: I am a male bodied queer person who admires and wants to emulate lesbians with masculine characteristics. However I am not sure if I have the right to feel this way due to my privilege, help?"", 'subreddit': 'genderqueer', 'title': 'So...so confused', 'created': 1396780412.0}",28.0
33,2014-04-07 01:28:49,22e15j,4,9,,trans,"New Avici video, thoughts?",1396859329.0,"{'created_utc': 1396834129, 'id': '22e15j', 'num_comments': 4, 'score': 9, 'selftext': '', 'subreddit': 'trans', 'title': 'New Avici video, thoughts?', 'created': 1396859329.0}",4.0
34,2014-04-07 02:06:37,22e4er,11,11,"Hi! AMAB here, I'm going with Androgyne or just simply genderqueer for now - I'm still figuring my headspace out. I've lurked here since about Christmas on and off, reading other people's experiences and stuff. I've been questioning for a long time, nothing too serious but I've always been attracted to crossdressing since I was about thirteen and I've tried it on and off with the help of a couple of female friends, been made up only once. It's a little sexual, a little fun, and the rest is because I feel as though presenting acting and generally being feminine to be how I would feel most happy about myself (at least in looks, the stuff in my head is whatever I feel like... I just wanna be cute).

I was always just 'me', never really considered any of this or associated strongly with either of the binaries and I didn't consider it until I started beginning to seriously want to change my life for the better and improve myself as a person as I've been pretty ill for a couple of years (ulcerative colitis and M.E/chronic fatigue) and my entire life just kind of stopped - overall I was very unhappy in general and with myself, although I now know that was down to dysphoria (at least in part, of that I'm really sure).

If you asked me why exactly I feel the way I do, I really don't think I could explain. I've been using a metaphor with a box full of pink and blue marbles that's been shaken up, and all the marbles gently intermingle with each other day to day. It's not a sudden mixing or switching in how I feel about my gender, it's just a slow constant thing. It doesn't bother me too much, I just wish with all my heart I could appear female or feminine (I like clothes a lot, also thigh socks!). I'm fine with how I was born, I'm content with all the plumbing. I want to look and feel cute, and if people misgendering me and thinking I'm female is a secondary bonus then, well I'm pretty okay with that - although I should clarify that in my head I feel as though I'm pretty solidly in the middle of male and female with a minor feminine bias that comes and goes.

And on to the crossdressing/femininity part! I am not even going to try any of this if I can't pull off looking like a girl - I don't want to be a guy in makeup and a dress because I'm not confident at all and I'm really socially awkward/anxious, paranoid in public (I know that will get better with time, but it's really fucking terrifying for me). Anyway, ignoring the fact that I basically haven't moved in a year and a half to two years due to various health problems (thus having gained weight), I'm looking for pointers on a lot of things. Right now I feel my biggest challenge is getting to be the shape I want to be (IE skinny and one that will fit into &amp; look good in feminine/girls clothing) and finding a style of clothes that works on me. Also, my hair is really curly and goes afro-like when it's longer, but I'd like long hair (middle back or something, but all together and flowy... like feminine kind of curly hair, actually!). While I'm on the subject of hair, my legs are hairy (obviously) and the epilator I tried is unusably painful (I cried, I can't use it at all). I've seen the other thread with the tutorial in it though, so I'm going to look into that!

While I know this was probably a super long read, I'm so grateful to anybody that replies - I'm really picky about my friends and I'm uncomfortable in person around people that aren't my friends (or I would've gone to the LGBTQ group in my college - maybe in the future, just not now. I'd like to be a bit surer of myself). I'm going to look into finding a therapist, too. I'm really nervous around my friends and family because this is so new, I've always dressed and behaved the same way for YEARS. It's new territory, so any help I can get from impartial sources would be great. &lt;3

This was probably horribly formatted. Sorry. ;_;
EDIT: Yeah, it is. Wow. Again, sorry for subjecting you to this. I ramble a lot. It's also 3am.

Thanks, everyone~!",genderqueer,"Newbie, signing on! Also looking for advice on crossdressing/femininity in general~",1396861597.0,"{'created_utc': 1396836397, 'id': '22e4er', 'num_comments': 11, 'score': 11, 'selftext': ""Hi! AMAB here, I'm going with Androgyne or just simply genderqueer for now - I'm still figuring my headspace out. I've lurked here since about Christmas on and off, reading other people's experiences and stuff. I've been questioning for a long time, nothing too serious but I've always been attracted to crossdressing since I was about thirteen and I've tried it on and off with the help of a couple of female friends, been made up only once. It's a little sexual, a little fun, and the rest is because I feel as though presenting acting and generally being feminine to be how I would feel most happy about myself (at least in looks, the stuff in my head is whatever I feel like... I just wanna be cute).\n\nI was always just 'me', never really considered any of this or associated strongly with either of the binaries and I didn't consider it until I started beginning to seriously want to change my life for the better and improve myself as a person as I've been pretty ill for a couple of years (ulcerative colitis and M.E/chronic fatigue) and my entire life just kind of stopped - overall I was very unhappy in general and with myself, although I now know that was down to dysphoria (at least in part, of that I'm really sure).\n\nIf you asked me why exactly I feel the way I do, I really don't think I could explain. I've been using a metaphor with a box full of pink and blue marbles that's been shaken up, and all the marbles gently intermingle with each other day to day. It's not a sudden mixing or switching in how I feel about my gender, it's just a slow constant thing. It doesn't bother me too much, I just wish with all my heart I could appear female or feminine (I like clothes a lot, also thigh socks!). I'm fine with how I was born, I'm content with all the plumbing. I want to look and feel cute, and if people misgendering me and thinking I'm female is a secondary bonus then, well I'm pretty okay with that - although I should clarify that in my head I feel as though I'm pretty solidly in the middle of male and female with a minor feminine bias that comes and goes.\n\nAnd on to the crossdressing/femininity part! I am not even going to try any of this if I can't pull off looking like a girl - I don't want to be a guy in makeup and a dress because I'm not confident at all and I'm really socially awkward/anxious, paranoid in public (I know that will get better with time, but it's really fucking terrifying for me). Anyway, ignoring the fact that I basically haven't moved in a year and a half to two years due to various health problems (thus having gained weight), I'm looking for pointers on a lot of things. Right now I feel my biggest challenge is getting to be the shape I want to be (IE skinny and one that will fit into &amp; look good in feminine/girls clothing) and finding a style of clothes that works on me. Also, my hair is really curly and goes afro-like when it's longer, but I'd like long hair (middle back or something, but all together and flowy... like feminine kind of curly hair, actually!). While I'm on the subject of hair, my legs are hairy (obviously) and the epilator I tried is unusably painful (I cried, I can't use it at all). I've seen the other thread with the tutorial in it though, so I'm going to look into that!\n\nWhile I know this was probably a super long read, I'm so grateful to anybody that replies - I'm really picky about my friends and I'm uncomfortable in person around people that aren't my friends (or I would've gone to the LGBTQ group in my college - maybe in the future, just not now. I'd like to be a bit surer of myself). I'm going to look into finding a therapist, too. I'm really nervous around my friends and family because this is so new, I've always dressed and behaved the same way for YEARS. It's new territory, so any help I can get from impartial sources would be great. &lt;3\n\nThis was probably horribly formatted. Sorry. ;_;\nEDIT: Yeah, it is. Wow. Again, sorry for subjecting you to this. I ramble a lot. It's also 3am.\n\nThanks, everyone~!"", 'subreddit': 'genderqueer', 'title': 'Newbie, signing on! Also looking for advice on crossdressing/femininity in general~', 'created': 1396861597.0}",29.0
35,2014-04-07 04:09:49,22eeuo,7,10,I was wondering if anyone had experience with being trans and living or studying in china.  My trans son may be going to a major city to study for the summer.,trans,Trams in china,1396868989.0,"{'created_utc': 1396843789, 'id': '22eeuo', 'num_comments': 7, 'score': 10, 'selftext': 'I was wondering if anyone had experience with being trans and living or studying in china.  My trans son may be going to a major city to study for the summer.', 'subreddit': 'trans', 'title': 'Trams in china', 'created': 1396868989.0}",5.0
36,2014-04-07 05:10:04,22ej7g,24,9,"I'll have to start this off by saying that I spend most of my time on tumblr. That's actually where I was first exposed to non-binary genders, and where people helped me understand and accept who I am. If anyone else here goes on tumblr, some of this might sound familiar, but I just wanted other opinions from different people.

I personally use they pronouns. They're easy to remember, for me and others, and I feel like they are probably a little less confusing than pronouns like zi/xi. They pronouns just feel more comfortable for me overall.

During my time on tumblr, however, I've seen people make up their own pronouns, and use pronouns that are derived from other things (I'll explain more a bit later).

At first, I thought it was weird to make up your own pronouns, especially when there seems to be quite a few already that people can use other than he/she. I thought making up your own pronouns sounded more like a way to stand out and be a ""special snowflake"". But a friend of mine changed pronouns to something completely unique, something they had made up themselves. The pronouns are reasonable, nothing crazy, and works really well. In fact, I find it less confusing than zi/xi, and sounds a lot nicer/smoother. (I'd say what they are, but I'm going to try and keep this anonymous) That's when I started accepting that, hey, if it makes you feel comfortable, then that's fine! After all, I want to respect my friends.

The other thing though, that I'm not sure how to feel about, is pronouns that seem to come from random words. There was a list a couple months ago of pronouns for people to use. These pronouns were different, and some of the ones I can remember are things like ""pri/prin/prinself"" (coming from ""princess""), ""ham/hams/hamself"", paw/paws/pawself, dra/drag/dragself (from dragon), and a BUNCH of others. 

I've seen people who loved them, and I've seen people who say that they sound more like a way to be ""cutesy"", or pronouns for *anyone* to use,and that its making light or joking about gender identities.

**I really just wanted to get some other opinions on this. Are pronouns like ""ham/hamself"" weird or offensive? Have you or anyone you know made up their own pronouns? Is there a limit to what is a gender identity, and whats just for fun? Should any of these be considered ""wrong""? I honestly don't know what to think.**",genderqueer,Pronouns other than they/zi,1396872604.0,"{'created_utc': 1396847404, 'id': '22ej7g', 'num_comments': 24, 'score': 9, 'selftext': 'I\'ll have to start this off by saying that I spend most of my time on tumblr. That\'s actually where I was first exposed to non-binary genders, and where people helped me understand and accept who I am. If anyone else here goes on tumblr, some of this might sound familiar, but I just wanted other opinions from different people.\n\nI personally use they pronouns. They\'re easy to remember, for me and others, and I feel like they are probably a little less confusing than pronouns like zi/xi. They pronouns just feel more comfortable for me overall.\n\nDuring my time on tumblr, however, I\'ve seen people make up their own pronouns, and use pronouns that are derived from other things (I\'ll explain more a bit later).\n\nAt first, I thought it was weird to make up your own pronouns, especially when there seems to be quite a few already that people can use other than he/she. I thought making up your own pronouns sounded more like a way to stand out and be a ""special snowflake"". But a friend of mine changed pronouns to something completely unique, something they had made up themselves. The pronouns are reasonable, nothing crazy, and works really well. In fact, I find it less confusing than zi/xi, and sounds a lot nicer/smoother. (I\'d say what they are, but I\'m going to try and keep this anonymous) That\'s when I started accepting that, hey, if it makes you feel comfortable, then that\'s fine! After all, I want to respect my friends.\n\nThe other thing though, that I\'m not sure how to feel about, is pronouns that seem to come from random words. There was a list a couple months ago of pronouns for people to use. These pronouns were different, and some of the ones I can remember are things like ""pri/prin/prinself"" (coming from ""princess""), ""ham/hams/hamself"", paw/paws/pawself, dra/drag/dragself (from dragon), and a BUNCH of others. \n\nI\'ve seen people who loved them, and I\'ve seen people who say that they sound more like a way to be ""cutesy"", or pronouns for *anyone* to use,and that its making light or joking about gender identities.\n\n**I really just wanted to get some other opinions on this. Are pronouns like ""ham/hamself"" weird or offensive? Have you or anyone you know made up their own pronouns? Is there a limit to what is a gender identity, and whats just for fun? Should any of these be considered ""wrong""? I honestly don\'t know what to think.**', 'subreddit': 'genderqueer', 'title': 'Pronouns other than they/zi', 'created': 1396872604.0}",30.0
