,created_utc,id,num_comments,score,selftext,subreddit,title,created,d_,Unnamed: 0
0,2014-06-10 04:30:03,27resd,0,1,"I'm non-binary and I'm currently using an ""Ancient Fish King"" brand vest/tank top binder. So far I'm satisfied with it and it's pretty comfortable for something that was 15 dollars off of amazon. Has anyone who has used this binder before have a different opinion of it?

EDIT: Forgot to post a [link](http://www.amazon.com/gp/product/B00GQQEEYA/ref=oh_details_o01_s00_i00?ie=UTF8&amp;psc=1) to the product

",NonBinary,Binder Opinion?,1402399803.0,"{'created_utc': 1402374603, 'id': '27resd', 'num_comments': 0, 'score': 1, 'selftext': 'I\'m non-binary and I\'m currently using an ""Ancient Fish King"" brand vest/tank top binder. So far I\'m satisfied with it and it\'s pretty comfortable for something that was 15 dollars off of amazon. Has anyone who has used this binder before have a different opinion of it?\n\nEDIT: Forgot to post a [link](http://www.amazon.com/gp/product/B00GQQEEYA/ref=oh_details_o01_s00_i00?ie=UTF8&amp;psc=1) to the product\n\n', 'subreddit': 'NonBinary', 'title': 'Binder Opinion?', 'created': 1402399803.0}",
0,2014-04-03 02:29:13,222j12,1,5,"I really dont know what else to say or how to word it, i'm not even sure if this is the right place to post it, but I really dont know where else to go for advice. Throughout my life (im 16 right now) I have always had these spontaneous moments of a few minutes where I feel through and through like I am meant to be a girl and not a guy, like i'm trapped inside my own body and that i'm not living the life i'm meant too, that i'm just 'wrong' in gender; and my entire identity and life are wrong in turn because of that. After having this bout of a few minutes, I get scared and I feel 'emasculated' so to speak, almost ashamed I had the thought of being a girl inside. 

Even as a very young child of around 5-6 I had these moments, although of course they were different back then. People have always called me 'flamboyant' and 'effeminate' and I've had my fair share of accusations of being gay in life, despite the fact I have no attraction to men. Another thing thats odd to note is I often 'envy' girlish physique, and when looking at my own body I often feel like I want that of an attractive and cute female, and not a man.

Its so difficult to explain or word, and that was probably a disastrous explanation. I dont know where else to get advice, and if anyone knows somewhere better, please point me there.",trans,"Throughout my life, I have spontaneous moments where I feel like i'm meant to be a girl.",1396517353.0,"{'created_utc': 1396492153, 'id': '222j12', 'num_comments': 1, 'score': 5, 'selftext': ""I really dont know what else to say or how to word it, i'm not even sure if this is the right place to post it, but I really dont know where else to go for advice. Throughout my life (im 16 right now) I have always had these spontaneous moments of a few minutes where I feel through and through like I am meant to be a girl and not a guy, like i'm trapped inside my own body and that i'm not living the life i'm meant too, that i'm just 'wrong' in gender; and my entire identity and life are wrong in turn because of that. After having this bout of a few minutes, I get scared and I feel 'emasculated' so to speak, almost ashamed I had the thought of being a girl inside. \n\nEven as a very young child of around 5-6 I had these moments, although of course they were different back then. People have always called me 'flamboyant' and 'effeminate' and I've had my fair share of accusations of being gay in life, despite the fact I have no attraction to men. Another thing thats odd to note is I often 'envy' girlish physique, and when looking at my own body I often feel like I want that of an attractive and cute female, and not a man.\n\nIts so difficult to explain or word, and that was probably a disastrous explanation. I dont know where else to get advice, and if anyone knows somewhere better, please point me there."", 'subreddit': 'trans', 'title': ""Throughout my life, I have spontaneous moments where I feel like i'm meant to be a girl."", 'created': 1396517353.0}",
1,2014-04-03 19:10:21,224kjm,43,0,"It just seems like the psychological effect of asking a student to leave over a decision that carries no ethical implication is offensive and detrimental to their development as a person. I can't imagine the stress of being uprooted at that age, from one's school and one's friends / loved ones. The response I got on TIL was, ""Well, it's a women's college. Only women can graduate."" But women's colleges such as Smith College and Mills College do not carry this policy. Am I wrong in finding it deeply offensive?

http://chronicle.com/article/Womens-University-to/129490/ ",trans,"I got downvoted into oblivion on TIL for posting this -- am I delusional, or is this extremely offensive: women's college Hollins University does not allow students who identify as male during the course of their studies to graduate, and they must leave the semester of identifying as male.",1396577421.0,"{'created_utc': 1396552221, 'id': '224kjm', 'num_comments': 43, 'score': 0, 'selftext': 'It just seems like the psychological effect of asking a student to leave over a decision that carries no ethical implication is offensive and detrimental to their development as a person. I can\'t imagine the stress of being uprooted at that age, from one\'s school and one\'s friends / loved ones. The response I got on TIL was, ""Well, it\'s a women\'s college. Only women can graduate."" But women\'s colleges such as Smith College and Mills College do not carry this policy. Am I wrong in finding it deeply offensive?\n\nhttp://chronicle.com/article/Womens-University-to/129490/ ', 'subreddit': 'trans', 'title': ""I got downvoted into oblivion on TIL for posting this -- am I delusional, or is this extremely offensive: women's college Hollins University does not allow students who identify as male during the course of their studies to graduate, and they must leave the semester of identifying as male."", 'created': 1396577421.0}",
2,2014-04-05 07:46:36,229ayy,3,4,,trans,Christian college boots trans student from male dorm,1396709196.0,"{'created_utc': 1396683996, 'id': '229ayy', 'num_comments': 3, 'score': 4, 'selftext': '', 'subreddit': 'trans', 'title': 'Christian college boots trans student from male dorm', 'created': 1396709196.0}",
3,2014-04-05 18:02:43,22aa7v,3,1,"My girlfriend and I were having a conversation about how traits like being ""strong"" or ""intelligent"" or ""brave"" are all used as examples of what it means to be a good man when really those traits are desirable in all people regardless of gender. 

It got me thinking about how we define gender and why the seperation between male and female even exists in the first place. So, /r/trans, what is the difference? What is it that makes you know that you're a Woman and not a man (or vice versa) despite having a sex to the contrary? what is that makes someone a man or woman exactly?",trans,Thought you lovely folks might have some interesting ideas about this question. What's the difference between men and women?,1396746163.0,"{'created_utc': 1396720963, 'id': '22aa7v', 'num_comments': 3, 'score': 1, 'selftext': 'My girlfriend and I were having a conversation about how traits like being ""strong"" or ""intelligent"" or ""brave"" are all used as examples of what it means to be a good man when really those traits are desirable in all people regardless of gender. \n\nIt got me thinking about how we define gender and why the seperation between male and female even exists in the first place. So, /r/trans, what is the difference? What is it that makes you know that you\'re a Woman and not a man (or vice versa) despite having a sex to the contrary? what is that makes someone a man or woman exactly?', 'subreddit': 'trans', 'title': ""Thought you lovely folks might have some interesting ideas about this question. What's the difference between men and women?"", 'created': 1396746163.0}",
4,2014-04-07 01:28:49,22e15j,4,9,,trans,"New Avici video, thoughts?",1396859329.0,"{'created_utc': 1396834129, 'id': '22e15j', 'num_comments': 4, 'score': 9, 'selftext': '', 'subreddit': 'trans', 'title': 'New Avici video, thoughts?', 'created': 1396859329.0}",
5,2014-04-07 04:09:49,22eeuo,7,10,I was wondering if anyone had experience with being trans and living or studying in china.  My trans son may be going to a major city to study for the summer.,trans,Trams in china,1396868989.0,"{'created_utc': 1396843789, 'id': '22eeuo', 'num_comments': 7, 'score': 10, 'selftext': 'I was wondering if anyone had experience with being trans and living or studying in china.  My trans son may be going to a major city to study for the summer.', 'subreddit': 'trans', 'title': 'Trams in china', 'created': 1396868989.0}",
6,2014-04-07 15:19:22,22fifz,2,1,"Hello,

I recently became facebook friends with a former colleague and decently good friend. We still maintain a healthy texting relationship and if we still lived in the same geographic region, we would hang out semi-regularly. Well, he's been posting *a lot* of LGBT articles with a special emphasis on trans issues. If my friend is really a girl on the inside, I'd like to use the correct pronoun. I also know coming out is a personal decision, so I don't want to intrude on their life. I've ""liked"" a lot of the posts and commented with my support, but I don't know if I should ask him (at least as far as I know, that is the gender pronoun he uses). Hell, it's possible that he is a FtM and I just had no idea. If you were in this person's shoes, what would you prefer (ask, or just don't mention but continue being supportive via likes and comments)?

Thanks for your help!",trans,Should I ask if a friend is trans?,1396909162.0,"{'created_utc': 1396883962, 'id': '22fifz', 'num_comments': 2, 'score': 1, 'selftext': 'Hello,\n\nI recently became facebook friends with a former colleague and decently good friend. We still maintain a healthy texting relationship and if we still lived in the same geographic region, we would hang out semi-regularly. Well, he\'s been posting *a lot* of LGBT articles with a special emphasis on trans issues. If my friend is really a girl on the inside, I\'d like to use the correct pronoun. I also know coming out is a personal decision, so I don\'t want to intrude on their life. I\'ve ""liked"" a lot of the posts and commented with my support, but I don\'t know if I should ask him (at least as far as I know, that is the gender pronoun he uses). Hell, it\'s possible that he is a FtM and I just had no idea. If you were in this person\'s shoes, what would you prefer (ask, or just don\'t mention but continue being supportive via likes and comments)?\n\nThanks for your help!', 'subreddit': 'trans', 'title': 'Should I ask if a friend is trans?', 'created': 1396909162.0}",
7,2014-04-08 07:44:19,22i0sf,1,5,,trans,Transgender model comes out citing need to help others,1396968259.0,"{'created_utc': 1396943059, 'id': '22i0sf', 'num_comments': 1, 'score': 5, 'selftext': '', 'subreddit': 'trans', 'title': 'Transgender model comes out citing need to help others', 'created': 1396968259.0}",
8,2014-04-09 07:21:50,22l9ci,3,4,,trans,North Carolina trans student tells campus police: ‘stop bullying minorities!’,1397053310.0,"{'created_utc': 1397028110, 'id': '22l9ci', 'num_comments': 3, 'score': 4, 'selftext': '', 'subreddit': 'trans', 'title': 'North Carolina trans student tells campus police: ‘stop bullying minorities!’', 'created': 1397053310.0}",
9,2014-04-09 08:37:40,22ld8z,0,1,,trans,Transgender teacher suspended following parental transphobia,1397057860.0,"{'created_utc': 1397032660, 'id': '22ld8z', 'num_comments': 0, 'score': 1, 'selftext': '', 'subreddit': 'trans', 'title': 'Transgender teacher suspended following parental transphobia', 'created': 1397057860.0}",
10,2014-04-09 08:39:06,22ldba,0,3,,trans,Transgender teacher suspended following parental transphobia,1397057946.0,"{'created_utc': 1397032746, 'id': '22ldba', 'num_comments': 0, 'score': 3, 'selftext': '', 'subreddit': 'trans', 'title': 'Transgender teacher suspended following parental transphobia', 'created': 1397057946.0}",
11,2014-04-11 08:18:18,22rit6,0,7,,trans,Yesterday was my 1yr Cakeday and today I'm doing another game giveaway! :D,1397229498.0,"{'created_utc': 1397204298, 'id': '22rit6', 'num_comments': 0, 'score': 7, 'selftext': '', 'subreddit': 'trans', 'title': ""Yesterday was my 1yr Cakeday and today I'm doing another game giveaway! :D"", 'created': 1397229498.0}",
12,2014-04-11 19:46:50,22swjr,2,5,"Long story short, I'm MtF trans (pre-everything), I go to university in the deep south, come from a family of bigoted fundamental Christians (but I'm an Atheist), and I'm out to my parents (who aren't accepting me for it) and close group of friends who are totally accepting. I'm ready to start socially transitioning. I've slowly done this over the past year. Like, I've started growing my hair out, painting my nails often, wearing makeup, going out as my real self to parties. However, I want to start *living* as a female, not just getting trashed at a party and forgetting all of it. My friends have never known any trans* people, and this is clearly very odd for them. This weekend, I'm going to start presenting as female. Any tips on how I should get them acclimated to this change? Any tips on how to reduce my anxiety about it? Thanks, y'all! &lt;3",trans,Social transition tips?,1397270810.0,"{'created_utc': 1397245610, 'id': '22swjr', 'num_comments': 2, 'score': 5, 'selftext': ""Long story short, I'm MtF trans (pre-everything), I go to university in the deep south, come from a family of bigoted fundamental Christians (but I'm an Atheist), and I'm out to my parents (who aren't accepting me for it) and close group of friends who are totally accepting. I'm ready to start socially transitioning. I've slowly done this over the past year. Like, I've started growing my hair out, painting my nails often, wearing makeup, going out as my real self to parties. However, I want to start *living* as a female, not just getting trashed at a party and forgetting all of it. My friends have never known any trans* people, and this is clearly very odd for them. This weekend, I'm going to start presenting as female. Any tips on how I should get them acclimated to this change? Any tips on how to reduce my anxiety about it? Thanks, y'all! &lt;3"", 'subreddit': 'trans', 'title': 'Social transition tips?', 'created': 1397270810.0}",
13,2014-04-12 03:41:44,22tyv0,4,13,,trans,Engineered vaginas grown in women for the first time,1397299304.0,"{'created_utc': 1397274104, 'id': '22tyv0', 'num_comments': 4, 'score': 13, 'selftext': '', 'subreddit': 'trans', 'title': 'Engineered vaginas grown in women for the first time', 'created': 1397299304.0}",
14,2014-04-13 18:02:54,22xrdu,0,1,,trans,This is a call for submissions!,1397437374.0,"{'created_utc': 1397412174, 'id': '22xrdu', 'num_comments': 0, 'score': 1, 'selftext': '', 'subreddit': 'trans', 'title': 'This is a call for submissions!', 'created': 1397437374.0}",
15,2014-04-14 14:16:43,2306to,6,2,,trans,Local paper tries to shame trans woman while writing about her. This type of article makes me angry.,1397510203.0,"{'created_utc': 1397485003, 'id': '2306to', 'num_comments': 6, 'score': 2, 'selftext': '', 'subreddit': 'trans', 'title': 'Local paper tries to shame trans woman while writing about her. This type of article makes me angry.', 'created': 1397510203.0}",
16,2014-04-16 06:48:18,235we0,0,10,,trans,'Transgender rights are human rights' says India's Supreme Court,1397656098.0,"{'created_utc': 1397630898, 'id': '235we0', 'num_comments': 0, 'score': 10, 'selftext': '', 'subreddit': 'trans', 'title': ""'Transgender rights are human rights' says India's Supreme Court"", 'created': 1397656098.0}",
17,2014-04-17 19:40:39,23an29,1,6,,trans,California Judge Dismisses Transgender Discrimination Case Against BET,1397788839.0,"{'created_utc': 1397763639, 'id': '23an29', 'num_comments': 1, 'score': 6, 'selftext': '', 'subreddit': 'trans', 'title': 'California Judge Dismisses Transgender Discrimination Case Against BET', 'created': 1397788839.0}",
18,2014-04-17 22:53:10,23b63x,2,3,,trans,"gynosome: the scientific name for a ""strapless"" - Scientists have found an insect with a female penis",1397800390.0,"{'created_utc': 1397775190, 'id': '23b63x', 'num_comments': 2, 'score': 3, 'selftext': '', 'subreddit': 'trans', 'title': 'gynosome: the scientific name for a ""strapless"" - Scientists have found an insect with a female penis', 'created': 1397800390.0}",
19,2014-04-18 19:39:44,23dpsq,0,1,,trans,Transgender Icon Jayne County Banned from Facebook for Using Transgender 'Slur',1397875184.0,"{'created_utc': 1397849984, 'id': '23dpsq', 'num_comments': 0, 'score': 1, 'selftext': '', 'subreddit': 'trans', 'title': ""Transgender Icon Jayne County Banned from Facebook for Using Transgender 'Slur'"", 'created': 1397875184.0}",
20,2014-04-20 09:50:03,23i2hm,1,13,,trans,Defiant anti-transgender bar owner loses business after accounts seized,1398012603.0,"{'created_utc': 1397987403, 'id': '23i2hm', 'num_comments': 1, 'score': 13, 'selftext': '', 'subreddit': 'trans', 'title': 'Defiant anti-transgender bar owner loses business after accounts seized', 'created': 1398012603.0}",
21,2014-04-23 07:59:29,23r3o9,1,0,,trans,Suspended trans teacher reinstated? Maybe not,1398265169.0,"{'created_utc': 1398239969, 'id': '23r3o9', 'num_comments': 1, 'score': 0, 'selftext': '', 'subreddit': 'trans', 'title': 'Suspended trans teacher reinstated? Maybe not', 'created': 1398265169.0}",
22,2014-04-23 08:03:27,23r3uu,1,9,"I'm 23 years old. I was born as a male, but ever since I was young (like 4-5) I would pretend to be a girl in make believe games. Still today, I feel like I would be better suited to life as a girl, or at the very least that I am a girl in my mind even if I was born as the wrong gender. What is the next step after realizing you're the wrong gender and no one in your life knows? How do I ""come out"" as a girl to my friends and family when I look like the same boy they've always known, and they have no way of knowing or understanding how I feel inside? Is this normal or ok, that I feel like a girl while being born as a boy? The longer finger (middle or ring finger) test shows that I had more estrogen en-utero, but I'm a bit scared to admit that I'm a girl because I've lived so long a a boy while feeling something is wrong about who I am. Any insight into this feeling or into how to accept who I am would be appreciated, because I'm completely in the dark with this. I come from a very conservative family that would never even acknowledge that this is a possible situation for me to be in, and now I feel like I'm a prime candidate for the trans community. Please help me...",trans,"I think I need some help or assistance. No, actually, I know I need help and assistance.",1398265407.0,"{'created_utc': 1398240207, 'id': '23r3uu', 'num_comments': 1, 'score': 9, 'selftext': 'I\'m 23 years old. I was born as a male, but ever since I was young (like 4-5) I would pretend to be a girl in make believe games. Still today, I feel like I would be better suited to life as a girl, or at the very least that I am a girl in my mind even if I was born as the wrong gender. What is the next step after realizing you\'re the wrong gender and no one in your life knows? How do I ""come out"" as a girl to my friends and family when I look like the same boy they\'ve always known, and they have no way of knowing or understanding how I feel inside? Is this normal or ok, that I feel like a girl while being born as a boy? The longer finger (middle or ring finger) test shows that I had more estrogen en-utero, but I\'m a bit scared to admit that I\'m a girl because I\'ve lived so long a a boy while feeling something is wrong about who I am. Any insight into this feeling or into how to accept who I am would be appreciated, because I\'m completely in the dark with this. I come from a very conservative family that would never even acknowledge that this is a possible situation for me to be in, and now I feel like I\'m a prime candidate for the trans community. Please help me...', 'subreddit': 'trans', 'title': 'I think I need some help or assistance. No, actually, I know I need help and assistance.', 'created': 1398265407.0}",
23,2014-04-23 21:53:03,23szfs,8,10,"Throwaway for obvious reasons....

So basically I completely severed all ties with my old life when I decided to transition. I haven't had contact with my family for years before that, no friends, and quit all jobs/commitments. I was completely free and ""lay low"" for over a year while I changed.

I reemerged a new person. I got a court ordered name change, got a new ID and new SS card, and began meeting people with my new identity. I couldn't be happier with my new life!

Now I need a job! And my first worry was a background check - will the old name/gender automatically pop up? I'm in a tough industry and it's hard enough to find a job without that added hurdle. So far what I have been doing is leaving blank the ""any former names or aliases"" space, and if it comes down to it, I can privately explain to the HR person what the situation is.

What's more concerning though is job references. I feel like I really should not have to call up employers that I haven't spoken to in years and tell them what I've done - I intentionally quit everything so nobody has to know and I want to keep it that way. I also don't feel it's best to tell every prospective employer what the deal is. They don't need a reason to turn me down or start gossip in such a narrow industry. 

What's terrible is I'm ""photoshopping"" my new name onto written references, and asking friends to fake being professional references. I know it's wrong and it really sucks when I know my past employers LOVED me, but I just can't bear to drag my old life into my new one.

I just want to start fresh. I've tried volunteering and getting ""under the table"" jobs just so SOMEONE who knows me by my new identity can vouch for me, but even that required references.

This is so frustrating. I just want to get my life started but I feel so stuck.


Please help.",trans,Need help finding work post trans...job references and background checks,1398315183.0,"{'created_utc': 1398289983, 'id': '23szfs', 'num_comments': 8, 'score': 10, 'selftext': 'Throwaway for obvious reasons....\n\nSo basically I completely severed all ties with my old life when I decided to transition. I haven\'t had contact with my family for years before that, no friends, and quit all jobs/commitments. I was completely free and ""lay low"" for over a year while I changed.\n\nI reemerged a new person. I got a court ordered name change, got a new ID and new SS card, and began meeting people with my new identity. I couldn\'t be happier with my new life!\n\nNow I need a job! And my first worry was a background check - will the old name/gender automatically pop up? I\'m in a tough industry and it\'s hard enough to find a job without that added hurdle. So far what I have been doing is leaving blank the ""any former names or aliases"" space, and if it comes down to it, I can privately explain to the HR person what the situation is.\n\nWhat\'s more concerning though is job references. I feel like I really should not have to call up employers that I haven\'t spoken to in years and tell them what I\'ve done - I intentionally quit everything so nobody has to know and I want to keep it that way. I also don\'t feel it\'s best to tell every prospective employer what the deal is. They don\'t need a reason to turn me down or start gossip in such a narrow industry. \n\nWhat\'s terrible is I\'m ""photoshopping"" my new name onto written references, and asking friends to fake being professional references. I know it\'s wrong and it really sucks when I know my past employers LOVED me, but I just can\'t bear to drag my old life into my new one.\n\nI just want to start fresh. I\'ve tried volunteering and getting ""under the table"" jobs just so SOMEONE who knows me by my new identity can vouch for me, but even that required references.\n\nThis is so frustrating. I just want to get my life started but I feel so stuck.\n\n\nPlease help.', 'subreddit': 'trans', 'title': 'Need help finding work post trans...job references and background checks', 'created': 1398315183.0}",
24,2014-04-24 03:30:37,23tw88,0,8,,trans,Transmisogyny masquerading as parody: HuffPo’s Gay Voices promotes disturbing video from former Drag Race contestant,1398335437.0,"{'created_utc': 1398310237, 'id': '23tw88', 'num_comments': 0, 'score': 8, 'selftext': '', 'subreddit': 'trans', 'title': 'Transmisogyny masquerading as parody: HuffPo’s Gay Voices promotes disturbing video from former Drag Race contestant', 'created': 1398335437.0}",
25,2014-04-24 20:40:06,23w4ao,1,5,,trans,Can anyone help explain to this guy why these terms are so offensive? He seems to genuinely think folks who point out insensitivity are themselves bigots. Or am I missing something here?,1398397206.0,"{'created_utc': 1398372006, 'id': '23w4ao', 'num_comments': 1, 'score': 5, 'selftext': '', 'subreddit': 'trans', 'title': 'Can anyone help explain to this guy why these terms are so offensive? He seems to genuinely think folks who point out insensitivity are themselves bigots. Or am I missing something here?', 'created': 1398397206.0}",
