,created_utc,id,num_comments,score,selftext,subreddit,title,created,d_,Unnamed: 0
123,2014-04-26 17:23:36,241ixt,1,16,"I'm MAAB and realized I was non-binary last summer, and now I want to start seeing a therapist. I'd like to get it covered by insurance, which means a doctor has to diagnose me with gender dysphoria. Can anyone recommend a doctor/therapist that won't tell me I have to choose one or the other, and will be OK with a ""partial"" transition? I'm looking in the LA area, but I live in Santa Clarita and don't like driving any more than I have to (I know, it's a super conservative area, but it couldn't hurt to take a shot).

Also, can anybody share any stories, positive or negative, about interacting with the medical industry as a non-binary trans* person?",genderqueer,Non-binary friendly doctors in LA area?,1398558216.0,"{'created_utc': 1398533016, 'id': '241ixt', 'num_comments': 1, 'score': 16, 'selftext': 'I\'m MAAB and realized I was non-binary last summer, and now I want to start seeing a therapist. I\'d like to get it covered by insurance, which means a doctor has to diagnose me with gender dysphoria. Can anyone recommend a doctor/therapist that won\'t tell me I have to choose one or the other, and will be OK with a ""partial"" transition? I\'m looking in the LA area, but I live in Santa Clarita and don\'t like driving any more than I have to (I know, it\'s a super conservative area, but it couldn\'t hurt to take a shot).\n\nAlso, can anybody share any stories, positive or negative, about interacting with the medical industry as a non-binary trans* person?', 'subreddit': 'genderqueer', 'title': 'Non-binary friendly doctors in LA area?', 'created': 1398558216.0}",95.0
124,2014-04-26 18:49:25,241q6u,20,0,Wow.....,genderqueer,Wow the amount of transphobia in the /r/IAMA responses I'm receiving is absolutely disgusting.,1398563365.0,"{'created_utc': 1398538165, 'id': '241q6u', 'num_comments': 20, 'score': 0, 'selftext': 'Wow.....', 'subreddit': 'genderqueer', 'title': ""Wow the amount of transphobia in the /r/IAMA responses I'm receiving is absolutely disgusting."", 'created': 1398563365.0}",96.0
125,2014-04-27 06:57:59,243994,4,17,,genderqueer,ME AGAINST THE MAKEUP: Adventures in Unisex Products,1398607079.0,"{'created_utc': 1398581879, 'id': '243994', 'num_comments': 4, 'score': 17, 'selftext': '', 'subreddit': 'genderqueer', 'title': 'ME AGAINST THE MAKEUP: Adventures in Unisex Products', 'created': 1398607079.0}",97.0
126,2014-04-27 08:40:27,243dp7,8,13,"I apologize in advance if this is disorganized...I've got a lot of thoughts and I'm just going to do this stream-of-consciousness. 

I'm 23 years old and biologically female. In the past year or so, I've been thinking more about my gender identity, and in the past few weeks I've been thinking about it pretty much constantly. I think I might be genderqueer/genderfluid, but I'm not sure and I'm not sure if I'm ready to identify that way.

Recently, I've been thinking about all the ways I've disliked being female. The earliest memory is when I was maybe 4, and I was in the car with my mother, and I wanted to take my shirt off, and my mother didn't want me to, but relented because we were in the car and nobody would see. But of course as we pulled into our street, a bunch of my neighbors were there, and my mom stopped to chat with other parents. I distinctly remember another girl peering into the car, frowning. I don't know if she was frowning because I had my shirt off, or for some other reason, but her frown stuck with me. Afterwards, my mother told me that I had to keep a shirt on because other people had seen me.

I didn't have a lot of trouble with gender roles growing up, mainly because my mom is a 1960s/1970s feminist, and whenever people said that girls couldn't do something, she called it ""old-fashioned thinking.""

When I got older, I had more reasons to be jealous of boys. The ability to pee standing up was one of them, but relatively minor. When I was 11, I was diagnosed with trichotillomania, which is a compulsive hair-pulling disorder. I envied the fact that boys could shave their heads. I currently have managed to grow out the hair at the back of my head, and I've decided I like it long in the back and short in front, except that whenever I get stressed and pull my hair out it gets patchy and I don't like that. But I feel the short in front long in back style kind of fits my identity.

Around the time guys my age started hitting their growth spurts, I got jealous of their height. I remember in particular, one of my friends had been taller than I was until I hit my growth spurt, and when I hit my growth spurt and was finally taller than he was, I was really proud, until of course he hit his growth spurt and was once again taller than I was and I got jealous. Oh, and I also remember in kindergarten, not being allowed to have a sleepover with this same friend because ""boys and girls have different body parts.""

When I learned to like football, I was jealous that boys could play it and I couldn't, and in general I'm jealous of the muscles that men can develop. I work out a fair amount, but I can't reach the muscle size of guys that also work out. My boyfriend is a runner, and doesn't do much arm work, and my biceps are larger than his. I am very proud of this fact. He also does some ab work, and is naturally really skinny, and recently mentioned that he thought he was starting to get a six-pack. And my reaction was jealousy.

I find a lot of gay men attractive, and have on a couple occasions, had crushes on guys I didn't know were gay. I'm only attracted to men though, but including non-binary genders I'd say they have to be biologically male, but not identify as female. I recently discovered the term androphilic and am very happy about having discovered this term. I'm also scared about how my boyfriend might react if I started identifying as other than a cisgender female. We've been dating for 3 1/2 years, so I'm pretty invested in this relationship.

A fairly new issue I'm having is with clothing. I never really had problems with wearing feminine clothing before, but recently I've been having days where I absolutely do not want to wear skirts, dresses, or anything form-fitting. But other days I enjoy wearing feminine clothes. One of the days that I didn't feel like wearing dresses, I had a presentation that required I dress up, and my nice pants were dirty, so I had to wear a dress and by the end of the day, I was very cranky. But then I finally got to go home and change, and I felt so much better. I think this may have been triggered by my discovery of the wonderful thing that is the ""bro tank,"" which shows off my biceps, but doesn't make me look super-feminine. I need more of those.

One thing I'm happy about with being biologically female is the ability to get pregnant and give birth. Also I like to paint my nails. I can't think of a whole lot of other things, though. 

I'm kind of confused/questioning as to how I actually identify, though. Maybe I'm just a woman who doesn't like traditional gender roles. But maybe there's something more, like some days I'm feminine and some days I'm androgynous. I wouldn't say there are ever times where I would fully identify as male, though. Sometimes I feel as if I'm feminine too often to identify as genderqueer, or I'm not genderqueer enough, if that makes any sense. But I've been spending a lot of time thinking about it, so maybe that in itself is an indicator that I might be genderqueer.

So this is a question somehow. I want more information than I've been able to find on my own. Also, I just wanted to talk to somebody about it, but I don't feel comfortable talking with most people I know until I'm a little more sure about my identity. Maybe all I really needed was to write this and get it off my chest and I'll feel fine about everything tomorrow. That would be nice.

",genderqueer,Questioning my gender identity,1398613227.0,"{'created_utc': 1398588027, 'id': '243dp7', 'num_comments': 8, 'score': 13, 'selftext': 'I apologize in advance if this is disorganized...I\'ve got a lot of thoughts and I\'m just going to do this stream-of-consciousness. \n\nI\'m 23 years old and biologically female. In the past year or so, I\'ve been thinking more about my gender identity, and in the past few weeks I\'ve been thinking about it pretty much constantly. I think I might be genderqueer/genderfluid, but I\'m not sure and I\'m not sure if I\'m ready to identify that way.\n\nRecently, I\'ve been thinking about all the ways I\'ve disliked being female. The earliest memory is when I was maybe 4, and I was in the car with my mother, and I wanted to take my shirt off, and my mother didn\'t want me to, but relented because we were in the car and nobody would see. But of course as we pulled into our street, a bunch of my neighbors were there, and my mom stopped to chat with other parents. I distinctly remember another girl peering into the car, frowning. I don\'t know if she was frowning because I had my shirt off, or for some other reason, but her frown stuck with me. Afterwards, my mother told me that I had to keep a shirt on because other people had seen me.\n\nI didn\'t have a lot of trouble with gender roles growing up, mainly because my mom is a 1960s/1970s feminist, and whenever people said that girls couldn\'t do something, she called it ""old-fashioned thinking.""\n\nWhen I got older, I had more reasons to be jealous of boys. The ability to pee standing up was one of them, but relatively minor. When I was 11, I was diagnosed with trichotillomania, which is a compulsive hair-pulling disorder. I envied the fact that boys could shave their heads. I currently have managed to grow out the hair at the back of my head, and I\'ve decided I like it long in the back and short in front, except that whenever I get stressed and pull my hair out it gets patchy and I don\'t like that. But I feel the short in front long in back style kind of fits my identity.\n\nAround the time guys my age started hitting their growth spurts, I got jealous of their height. I remember in particular, one of my friends had been taller than I was until I hit my growth spurt, and when I hit my growth spurt and was finally taller than he was, I was really proud, until of course he hit his growth spurt and was once again taller than I was and I got jealous. Oh, and I also remember in kindergarten, not being allowed to have a sleepover with this same friend because ""boys and girls have different body parts.""\n\nWhen I learned to like football, I was jealous that boys could play it and I couldn\'t, and in general I\'m jealous of the muscles that men can develop. I work out a fair amount, but I can\'t reach the muscle size of guys that also work out. My boyfriend is a runner, and doesn\'t do much arm work, and my biceps are larger than his. I am very proud of this fact. He also does some ab work, and is naturally really skinny, and recently mentioned that he thought he was starting to get a six-pack. And my reaction was jealousy.\n\nI find a lot of gay men attractive, and have on a couple occasions, had crushes on guys I didn\'t know were gay. I\'m only attracted to men though, but including non-binary genders I\'d say they have to be biologically male, but not identify as female. I recently discovered the term androphilic and am very happy about having discovered this term. I\'m also scared about how my boyfriend might react if I started identifying as other than a cisgender female. We\'ve been dating for 3 1/2 years, so I\'m pretty invested in this relationship.\n\nA fairly new issue I\'m having is with clothing. I never really had problems with wearing feminine clothing before, but recently I\'ve been having days where I absolutely do not want to wear skirts, dresses, or anything form-fitting. But other days I enjoy wearing feminine clothes. One of the days that I didn\'t feel like wearing dresses, I had a presentation that required I dress up, and my nice pants were dirty, so I had to wear a dress and by the end of the day, I was very cranky. But then I finally got to go home and change, and I felt so much better. I think this may have been triggered by my discovery of the wonderful thing that is the ""bro tank,"" which shows off my biceps, but doesn\'t make me look super-feminine. I need more of those.\n\nOne thing I\'m happy about with being biologically female is the ability to get pregnant and give birth. Also I like to paint my nails. I can\'t think of a whole lot of other things, though. \n\nI\'m kind of confused/questioning as to how I actually identify, though. Maybe I\'m just a woman who doesn\'t like traditional gender roles. But maybe there\'s something more, like some days I\'m feminine and some days I\'m androgynous. I wouldn\'t say there are ever times where I would fully identify as male, though. Sometimes I feel as if I\'m feminine too often to identify as genderqueer, or I\'m not genderqueer enough, if that makes any sense. But I\'ve been spending a lot of time thinking about it, so maybe that in itself is an indicator that I might be genderqueer.\n\nSo this is a question somehow. I want more information than I\'ve been able to find on my own. Also, I just wanted to talk to somebody about it, but I don\'t feel comfortable talking with most people I know until I\'m a little more sure about my identity. Maybe all I really needed was to write this and get it off my chest and I\'ll feel fine about everything tomorrow. That would be nice.\n\n', 'subreddit': 'genderqueer', 'title': 'Questioning my gender identity', 'created': 1398613227.0}",98.0
127,2014-04-28 01:51:38,245hab,8,12,"So it sucks. My parents aren't at all cool with anyone who isn't cisgendered an heterosexual. After unsuccessfully coming out, I'm now trying to be very girlish and girly to...avert further suspicion. So I've got to learn to put on makeup and wear heels and dress like the other fashionable girls dress and do my hair and all that. And it sucks. Not that I don't enjoy some parts of being female, but I'm not into ALL of it. Obviously. So I'm stuck with a mountain of learning to accomplish against my will and judgment. Just wanted to vent somewhere. I'm pretty angry and resentful. 

K",genderqueer,Forced into the binary,1398675098.0,"{'created_utc': 1398649898, 'id': '245hab', 'num_comments': 8, 'score': 12, 'selftext': ""So it sucks. My parents aren't at all cool with anyone who isn't cisgendered an heterosexual. After unsuccessfully coming out, I'm now trying to be very girlish and girly to...avert further suspicion. So I've got to learn to put on makeup and wear heels and dress like the other fashionable girls dress and do my hair and all that. And it sucks. Not that I don't enjoy some parts of being female, but I'm not into ALL of it. Obviously. So I'm stuck with a mountain of learning to accomplish against my will and judgment. Just wanted to vent somewhere. I'm pretty angry and resentful. \n\nK"", 'subreddit': 'genderqueer', 'title': 'Forced into the binary', 'created': 1398675098.0}",99.0
128,2014-04-28 06:29:35,2461yy,20,40,,genderqueer,"Is there a gq-fashion subreddit? I feel like much of the GQ community is focused on AFAB folks who present masculine, but I'm AMAB and a kinda femme butcch thing thats punk as fuck. Pics in link. Just looking for tips for my ""style"" which I have no idea what it even is :/",1398691775.0,"{'created_utc': 1398666575, 'id': '2461yy', 'num_comments': 20, 'score': 40, 'selftext': '', 'subreddit': 'genderqueer', 'title': 'Is there a gq-fashion subreddit? I feel like much of the GQ community is focused on AFAB folks who present masculine, but I\'m AMAB and a kinda femme butcch thing thats punk as fuck. Pics in link. Just looking for tips for my ""style"" which I have no idea what it even is :/', 'created': 1398691775.0}",100.0
129,2014-04-28 09:04:53,2469a0,9,14,"Still getting my head around something that happened this afternoon. 

I was at my local equivalent of the Department of Motor Vehicles, getting a license renewed, and the guy processing my paperwork tells me the computer has me listed as female, which he said was odd because I'm clearly male. He said he could fix it without seeing a birth certificate because it was obvious that I was male and it must have just been a typo in the computer.

Yes, I'm MAAB and I look like a butch guy with a big beard, but I'm GQ and feel more female than male.

Apparently according to the DMV I've always been female, since I first got a license around 15 years ago. Gender isn't listed on licenses here so it would only have been noticed if I was pulled over by police and they looked up my record (I rarely drive and I've never been pulled over).

I'm still confused by it all, but I think I feel hurt that the DMV guy said there was no doubt at all that I'm male, and that I ""looked nothing like those people who could go either way"". I guess I look so male that he also assumed I'm a closed-minded bigot like he was.

I played it off as a funny mistake at the time, but it just shows that transitioning is not for me. I feel more female than male, but I guess I look far too male to ever pass as female. ""Lol, yeah, that's funny, DMV guy"", but it was a massive kick in the guts.",genderqueer,An odd thing happened today.,1398701093.0,"{'created_utc': 1398675893, 'id': '2469a0', 'num_comments': 9, 'score': 14, 'selftext': 'Still getting my head around something that happened this afternoon. \n\nI was at my local equivalent of the Department of Motor Vehicles, getting a license renewed, and the guy processing my paperwork tells me the computer has me listed as female, which he said was odd because I\'m clearly male. He said he could fix it without seeing a birth certificate because it was obvious that I was male and it must have just been a typo in the computer.\n\nYes, I\'m MAAB and I look like a butch guy with a big beard, but I\'m GQ and feel more female than male.\n\nApparently according to the DMV I\'ve always been female, since I first got a license around 15 years ago. Gender isn\'t listed on licenses here so it would only have been noticed if I was pulled over by police and they looked up my record (I rarely drive and I\'ve never been pulled over).\n\nI\'m still confused by it all, but I think I feel hurt that the DMV guy said there was no doubt at all that I\'m male, and that I ""looked nothing like those people who could go either way"". I guess I look so male that he also assumed I\'m a closed-minded bigot like he was.\n\nI played it off as a funny mistake at the time, but it just shows that transitioning is not for me. I feel more female than male, but I guess I look far too male to ever pass as female. ""Lol, yeah, that\'s funny, DMV guy"", but it was a massive kick in the guts.', 'subreddit': 'genderqueer', 'title': 'An odd thing happened today.', 'created': 1398701093.0}",101.0
130,2014-04-28 18:01:46,247d5a,16,60,"So I ride the Max (city train) every day to go to PSU. As I'm waiting at the stop, a drunk, older, possibly homeless man walks up to me, and was apparently going to ask me a question. But he stops and looks insanely perplexed. 

""Ey, you a boy'r girl'r what?"" he was slurring pretty bad. 

Taking this as an opportunity (I don't talk about my gender with many people) I took a beat and said ""Neither."" 

Even more confusion in those drunk eyes. ""Huh? You can't be neither, ya gotta pick one!"" 

""Not necessarily."" He's not getting it. Not ready to explain the complexities of gender identity and social constructs to a drunkard, I simply said ""I make my own rules!"" 

His face instantly lit up in a big, shit-eating, toothless grin, and started laughing. 

""Hahaha hey I like that! You make your own rules!"" He kept laughing about it to himself. 
Several minutes pass until the max shows up, then before I get on he comes up to me and says:

""Boy or Girl or what, you're kinda hot!""

It left me floored. Not that I would typically go looking for inebriated compliments from men who haven't showered in days, but it was such a simple interaction that ended so harmoniously. He accepted this new information in tow so quickly, and just moved on. I've never seen that, and it made me really happy. 

Tl;Dr When asked by a drunk man if I was a boy or a girl, I told him neither, and that I make my own rules. He told me I was hot anyway. If he gets it, why can't everyone? ",genderqueer,A Funny/Uplifting Encounter in Portland.,1398733306.0,"{'created_utc': 1398708106, 'id': '247d5a', 'num_comments': 16, 'score': 60, 'selftext': 'So I ride the Max (city train) every day to go to PSU. As I\'m waiting at the stop, a drunk, older, possibly homeless man walks up to me, and was apparently going to ask me a question. But he stops and looks insanely perplexed. \n\n""Ey, you a boy\'r girl\'r what?"" he was slurring pretty bad. \n\nTaking this as an opportunity (I don\'t talk about my gender with many people) I took a beat and said ""Neither."" \n\nEven more confusion in those drunk eyes. ""Huh? You can\'t be neither, ya gotta pick one!"" \n\n""Not necessarily."" He\'s not getting it. Not ready to explain the complexities of gender identity and social constructs to a drunkard, I simply said ""I make my own rules!"" \n\nHis face instantly lit up in a big, shit-eating, toothless grin, and started laughing. \n\n""Hahaha hey I like that! You make your own rules!"" He kept laughing about it to himself. \nSeveral minutes pass until the max shows up, then before I get on he comes up to me and says:\n\n""Boy or Girl or what, you\'re kinda hot!""\n\nIt left me floored. Not that I would typically go looking for inebriated compliments from men who haven\'t showered in days, but it was such a simple interaction that ended so harmoniously. He accepted this new information in tow so quickly, and just moved on. I\'ve never seen that, and it made me really happy. \n\nTl;Dr When asked by a drunk man if I was a boy or a girl, I told him neither, and that I make my own rules. He told me I was hot anyway. If he gets it, why can\'t everyone? ', 'subreddit': 'genderqueer', 'title': 'A Funny/Uplifting Encounter in Portland.', 'created': 1398733306.0}",102.0
131,2014-04-28 18:34:45,247gim,11,4,,genderqueer,How can I style my hair to present more femme? [Ignore gratuitous stubble/acne],1398735285.0,"{'created_utc': 1398710085, 'id': '247gim', 'num_comments': 11, 'score': 4, 'selftext': '', 'subreddit': 'genderqueer', 'title': 'How can I style my hair to present more femme? [Ignore gratuitous stubble/acne]', 'created': 1398735285.0}",103.0
132,2014-04-29 00:44:54,248i47,2,13,,trans,"Gender neutral bathrooms at the American Atheist conference, Utah 2014",1398757494.0,"{'created_utc': 1398732294, 'id': '248i47', 'num_comments': 2, 'score': 13, 'selftext': '', 'subreddit': 'trans', 'title': 'Gender neutral bathrooms at the American Atheist conference, Utah 2014', 'created': 1398757494.0}",28.0
133,2014-04-29 07:19:56,249dg8,5,6,,genderqueer,Any tips on looking more androgynous?,1398781196.0,"{'created_utc': 1398755996, 'id': '249dg8', 'num_comments': 5, 'score': 6, 'selftext': '', 'subreddit': 'genderqueer', 'title': 'Any tips on looking more androgynous?', 'created': 1398781196.0}",104.0
134,2014-04-29 11:15:27,249nz6,22,5,,trans,The intimate thoughts of a crossdresser,1398795327.0,"{'created_utc': 1398770127, 'id': '249nz6', 'num_comments': 22, 'score': 5, 'selftext': '', 'subreddit': 'trans', 'title': 'The intimate thoughts of a crossdresser', 'created': 1398795327.0}",29.0
135,2014-04-30 02:05:07,24c04k,12,14,"To appease my mother. My friend told me today (I'm back in a crew neck and jeans) that it just didn't look natural on me. I appreciated that. Have you ever gotten that response from friends you're out to when you dress stereotypically like the sex you were born as?

http://www.imgur.com/gallery/h28rK4n",genderqueer,Wore makeup yesterday,1398848707.0,"{'created_utc': 1398823507, 'id': '24c04k', 'num_comments': 12, 'score': 14, 'selftext': ""To appease my mother. My friend told me today (I'm back in a crew neck and jeans) that it just didn't look natural on me. I appreciated that. Have you ever gotten that response from friends you're out to when you dress stereotypically like the sex you were born as?\n\nhttp://www.imgur.com/gallery/h28rK4n"", 'subreddit': 'genderqueer', 'title': 'Wore makeup yesterday', 'created': 1398848707.0}",105.0
