created_utc,id,num_comments,score,selftext,subreddit,title,created,d_
2016-07-22 12:56:55,4u2m9i,3,6,"I have no idea who I am. It all started some years back when I fell into a deep depression, which I'll talk about later.

A little about me: 

I am a 21 year old male. After the past few months, I am pretty sure I am gender fluid, or some form thereof.

When I was a kid, I always felt different from other guys. I was always more feminine than they were. I considered myself girly. I never thought I was a girl, I just thought that I wasn't male. I always played with dolls and liked girly stuff. For a long time, I never connected with my gender. I didn't want to be a boy or think I was a boy, I just didn't quite fit in. So I didn't identify as being a guy. I always thought my being sensitive, small, and not liking sports made me not worthy of calling myself a guy. 
When I got to college, I sorta started identifying as a girl. I started realizing that I couldnt develop my own sense of masculinity.

I entered a depression last semester. To summarize, a girl I liked said some really awful things to me and told me that a real man doesn't wear nice clothes or act gentlemanly to everyone or cook (all things that I do/like to do). Combined with other circumstances in my life, I feel into a depression. After that, I started questioning my sexual and gender identities.

I like women's fashion. I take an interest in what women wear, and like it when I see a well-dressed women. I also think men should have more variety in their wardrobe. To me, women have more variety.

For the past few months I've been wondering if I'm trans. And I have no idea. I have never felt uncomfortable having a penis, nor have I ever wanted breasts or a vagina. On the contrary, I liked going into puberty and seeing more body hair and a deeper voice. I went to an all guys school, and I never felt uncomfortable being there. But I've been hung up on the idea that maybe I am trans.
I have a sexual fetish for women's and men's clothes. Not for everything, mostly women's hosiery, heels, and men's shoes.

I don't mind having a penis, nor do I mind having facial or body hair. Actually, I quite like having facial and body hair.

I don't mind it when people see me as a man. I have thought about cross-dressing for sexual pleasure and because I want to look sexy.

I have a bit of an odd relationship with my appearance. I like how I look (sometimes). But I always picture myself looking different. I always picture myself as a different, better-looking man. But then I look and I'm not.

I identify with some women, and I naturally get alone better with them and prefer their company. Additionally, when I'm around women I feel most like a man.

Some other facts, I've freaked out and had breakdowns about other things. I had a period where I was afraid I was gay. My sister said I had homosexual OCD (HOCD). I once had an irrational and paranoid fear that I was going insane, when I was really just depressed. That being said, I wonder if my fear about being trans is just another one of those irrational fears I have.

I'm really skinny, and I've had issues finding clothes that fit me like I would like. I am also extremely self conscious. As a result, there isn't much variety in my wardrobe. I fear that this combined with my interest in women's fashion makes me trans.

I have some ""feminine"" characteristics. I'm submissive, eager to please, I'm emotionally sensitive, and I like serving people.
I've always identified as being more feminine, but I've always known logically I was a boy.

I've also seen myself as more masculine sometimes, as well.

Last but not least, I've always been curious as to what it's like to be a woman.

With all of that being said, what do you think I am? Am I trans and in denial? Or am I just a cis guy who doesn't fit? Or am I something else?

Also, thank you so much for reading this. And sorry about the wall of text or if I'm repeating myself.",genderfluid,My identity crisis,1469217415.0,"{'created_utc': 1469192215, 'id': '4u2m9i', 'num_comments': 3, 'score': 6, 'selftext': 'I have no idea who I am. It all started some years back when I fell into a deep depression, which I\'ll talk about later.\n\nA little about me: \n\nI am a 21 year old male. After the past few months, I am pretty sure I am gender fluid, or some form thereof.\n\nWhen I was a kid, I always felt different from other guys. I was always more feminine than they were. I considered myself girly. I never thought I was a girl, I just thought that I wasn\'t male. I always played with dolls and liked girly stuff. For a long time, I never connected with my gender. I didn\'t want to be a boy or think I was a boy, I just didn\'t quite fit in. So I didn\'t identify as being a guy. I always thought my being sensitive, small, and not liking sports made me not worthy of calling myself a guy. \nWhen I got to college, I sorta started identifying as a girl. I started realizing that I couldnt develop my own sense of masculinity.\n\nI entered a depression last semester. To summarize, a girl I liked said some really awful things to me and told me that a real man doesn\'t wear nice clothes or act gentlemanly to everyone or cook (all things that I do/like to do). Combined with other circumstances in my life, I feel into a depression. After that, I started questioning my sexual and gender identities.\n\nI like women\'s fashion. I take an interest in what women wear, and like it when I see a well-dressed women. I also think men should have more variety in their wardrobe. To me, women have more variety.\n\nFor the past few months I\'ve been wondering if I\'m trans. And I have no idea. I have never felt uncomfortable having a penis, nor have I ever wanted breasts or a vagina. On the contrary, I liked going into puberty and seeing more body hair and a deeper voice. I went to an all guys school, and I never felt uncomfortable being there. But I\'ve been hung up on the idea that maybe I am trans.\nI have a sexual fetish for women\'s and men\'s clothes. Not for everything, mostly women\'s hosiery, heels, and men\'s shoes.\n\nI don\'t mind having a penis, nor do I mind having facial or body hair. Actually, I quite like having facial and body hair.\n\nI don\'t mind it when people see me as a man. I have thought about cross-dressing for sexual pleasure and because I want to look sexy.\n\nI have a bit of an odd relationship with my appearance. I like how I look (sometimes). But I always picture myself looking different. I always picture myself as a different, better-looking man. But then I look and I\'m not.\n\nI identify with some women, and I naturally get alone better with them and prefer their company. Additionally, when I\'m around women I feel most like a man.\n\nSome other facts, I\'ve freaked out and had breakdowns about other things. I had a period where I was afraid I was gay. My sister said I had homosexual OCD (HOCD). I once had an irrational and paranoid fear that I was going insane, when I was really just depressed. That being said, I wonder if my fear about being trans is just another one of those irrational fears I have.\n\nI\'m really skinny, and I\'ve had issues finding clothes that fit me like I would like. I am also extremely self conscious. As a result, there isn\'t much variety in my wardrobe. I fear that this combined with my interest in women\'s fashion makes me trans.\n\nI have some ""feminine"" characteristics. I\'m submissive, eager to please, I\'m emotionally sensitive, and I like serving people.\nI\'ve always identified as being more feminine, but I\'ve always known logically I was a boy.\n\nI\'ve also seen myself as more masculine sometimes, as well.\n\nLast but not least, I\'ve always been curious as to what it\'s like to be a woman.\n\nWith all of that being said, what do you think I am? Am I trans and in denial? Or am I just a cis guy who doesn\'t fit? Or am I something else?\n\nAlso, thank you so much for reading this. And sorry about the wall of text or if I\'m repeating myself.', 'subreddit': 'genderfluid', 'title': 'My identity crisis', 'created': 1469217415.0}"
2016-07-22 23:55:39,4u5qe1,5,11,"Alright, I'm just looking for someone to talk to because I just feel a bunch of mixed emotions right now and I'm going to probably have a wall of text, but that's the best way that I can just get all of my thoughts straight.

One of my earlierst memories was when I was in my first year of primary school and we were learning about wishes and the teacher asked everyone what they wished for... and I remember wishing to be a girl, and of course everyone laughed and I was embarassed but I never brought this up to anyone for a while. I also remember that my younger sister used to play with baby dolls and there were times when I wanted to play with them too, when I was maybe 7/8 and although my parents told me that I could do whatever I want (thankfully they're pretty supportive of whatever I do) I remember specifically not playing with them because something just felt wrong, or bad, by doing so. Years came and went and I remember having more signs growing up: I used to want to wear skirts and dresses, I would gravitate towards 'girls television' and prefer to hang out with the girls at school. When I went into high school a lot of the people I hung out with were the 'outcasts' and recently many of them have admitted to being gay or bi or not part of the 'norm.'

Well, a few months ago I started considering myself gender fluid, I knew I wanted to be a woman sometimes and hadn't given it much thought, but at the same time I considered myself a man. However, the other night I couldn't sleep at all, why? Because I just suddenly had this huge surge of emotions telling me that I wanted to be a female. That I wanted to come out to my friends and family, that I wanted to change everything about myself and put myself through surgery. That the only thing that had stopped these feelings in the past was the fact that I wanted to naturally have kids and I was worried about what people would think, but sperm could be frozen and I don't fucking care about what others think. I spent the next 24 hours just feeling this way. And today I feel like it all just stopped. I don't even know what the hell to feel anymore. Like, I've been putting all of those feelings from the other day out of my mind, I just want to think clearly, but I just don't know how to feel right now. It feels like there's a gender switch in my brain and it just can't make up it's bloody mind. Frankly, I just need someone to talk to and I just wish I could know the right decision

Sorry again for the huge wall of text, also sorry if this doesn't make much sense tense-wise. I had to spend two 'sessions' writing this, once the day after the event while I wanted to be female and once after the feeling had 'passed'.",genderfluid,Sudden feeling of dysphoria occurred and I just need to get my feelings out there,1469256939.0,"{'created_utc': 1469231739, 'id': '4u5qe1', 'num_comments': 5, 'score': 11, 'selftext': ""Alright, I'm just looking for someone to talk to because I just feel a bunch of mixed emotions right now and I'm going to probably have a wall of text, but that's the best way that I can just get all of my thoughts straight.\n\nOne of my earlierst memories was when I was in my first year of primary school and we were learning about wishes and the teacher asked everyone what they wished for... and I remember wishing to be a girl, and of course everyone laughed and I was embarassed but I never brought this up to anyone for a while. I also remember that my younger sister used to play with baby dolls and there were times when I wanted to play with them too, when I was maybe 7/8 and although my parents told me that I could do whatever I want (thankfully they're pretty supportive of whatever I do) I remember specifically not playing with them because something just felt wrong, or bad, by doing so. Years came and went and I remember having more signs growing up: I used to want to wear skirts and dresses, I would gravitate towards 'girls television' and prefer to hang out with the girls at school. When I went into high school a lot of the people I hung out with were the 'outcasts' and recently many of them have admitted to being gay or bi or not part of the 'norm.'\n\nWell, a few months ago I started considering myself gender fluid, I knew I wanted to be a woman sometimes and hadn't given it much thought, but at the same time I considered myself a man. However, the other night I couldn't sleep at all, why? Because I just suddenly had this huge surge of emotions telling me that I wanted to be a female. That I wanted to come out to my friends and family, that I wanted to change everything about myself and put myself through surgery. That the only thing that had stopped these feelings in the past was the fact that I wanted to naturally have kids and I was worried about what people would think, but sperm could be frozen and I don't fucking care about what others think. I spent the next 24 hours just feeling this way. And today I feel like it all just stopped. I don't even know what the hell to feel anymore. Like, I've been putting all of those feelings from the other day out of my mind, I just want to think clearly, but I just don't know how to feel right now. It feels like there's a gender switch in my brain and it just can't make up it's bloody mind. Frankly, I just need someone to talk to and I just wish I could know the right decision\n\nSorry again for the huge wall of text, also sorry if this doesn't make much sense tense-wise. I had to spend two 'sessions' writing this, once the day after the event while I wanted to be female and once after the feeling had 'passed'."", 'subreddit': 'genderfluid', 'title': 'Sudden feeling of dysphoria occurred and I just need to get my feelings out there', 'created': 1469256939.0}"
2016-07-23 08:35:03,4u7fwb,0,1,[removed],genderfluid,Hey. Looking for fellow buds. Hmu on snapchat,1469288103.0,"{'created_utc': 1469262903, 'id': '4u7fwb', 'num_comments': 0, 'score': 1, 'selftext': '[removed]', 'subreddit': 'genderfluid', 'title': 'Hey. Looking for fellow buds. Hmu on snapchat', 'created': 1469288103.0}"
2016-07-25 04:27:05,4ugsld,0,1,[deleted],genderfluid,So I crossdressed outdoors for the REAL(?) first time (AMAB),1469446025.0,"{'created_utc': 1469420825, 'id': '4ugsld', 'num_comments': 0, 'score': 1, 'selftext': '[deleted]', 'subreddit': 'genderfluid', 'title': 'So I crossdressed outdoors for the REAL(?) first time (AMAB)', 'created': 1469446025.0}"
2016-07-25 22:45:29,4ulea6,1,0,,genderfluid,There is no such thing as Genderfluid,1469511929.0,"{'created_utc': 1469486729, 'id': '4ulea6', 'num_comments': 1, 'score': 0, 'selftext': '', 'subreddit': 'genderfluid', 'title': 'There is no such thing as Genderfluid', 'created': 1469511929.0}"
2016-07-26 21:04:36,4uqy8x,4,7,"I'm a married bi genderfluid person. I only really discovered the right word for me (I'm in my 30s). So everyone thinks I'm a woman when that's not always the case.

Anyway.

I work for a pharmacy and have to where a gendered uniform. Every day I hate it a little bit more, especially as I become more confident in my gender-fluidity and identity. I can fix the shoes easy enough but the uniform itself is going to be a problem and I'm not sure how to go about asking to wear something a little more neutral.

The warehouse staff and drivers wear polo shirts (men and women) and I'd really like to wear one of those. I work in the back mostly, interacting with customers on the phone and it would still have the company logo on it. 

I don't know how to broach this with my bosses. My pharmacist is lovely, the manager is okay but doesn't always take me seriously about...anything. I don't want this to necessarily become a big thing and a huge fight but dammit it some days I hate that uniform. 

Any thoughts? Any one else have to wear gendered uniforms?",genderfluid,Gendered uniforms. (x-posted),1469592276.0,"{'created_utc': 1469567076, 'id': '4uqy8x', 'num_comments': 4, 'score': 7, 'selftext': ""I'm a married bi genderfluid person. I only really discovered the right word for me (I'm in my 30s). So everyone thinks I'm a woman when that's not always the case.\n\nAnyway.\n\nI work for a pharmacy and have to where a gendered uniform. Every day I hate it a little bit more, especially as I become more confident in my gender-fluidity and identity. I can fix the shoes easy enough but the uniform itself is going to be a problem and I'm not sure how to go about asking to wear something a little more neutral.\n\nThe warehouse staff and drivers wear polo shirts (men and women) and I'd really like to wear one of those. I work in the back mostly, interacting with customers on the phone and it would still have the company logo on it. \n\nI don't know how to broach this with my bosses. My pharmacist is lovely, the manager is okay but doesn't always take me seriously about...anything. I don't want this to necessarily become a big thing and a huge fight but dammit it some days I hate that uniform. \n\nAny thoughts? Any one else have to wear gendered uniforms?"", 'subreddit': 'genderfluid', 'title': 'Gendered uniforms. (x-posted)', 'created': 1469592276.0}"
2016-07-27 01:26:35,4us5bi,4,11,"I don't think I'm FTM. Just placing that out there. I've been thinking a lot lately, I'm almost 30, getting older, gaining weight as the metabolism shits itself, and I'm wondering about why I feel the way I do. As my breasts get more pronounced, and I am gaining even more hip mass, I'm getting pissed off!

I didn't want to jiggle today, damn you. Obey me! Literally an impossible request.

 I kindof need to vent/have someone who can relate? I've always had problems with my physical shape. Body dysmorphia, I was a very skinny child with no real alliance towards a sexual preference for the most part, and didn't really want to deal with puberty. I knew it was coming, and yet I was not happy about it. Let me be a 'person'.

It happened. I was pissed (lol, it's what the born female body does a good deal of the time...and yet I hated it). And every time the egg drops, I get pissed. It's not even that I want male genitalia. I think it'd be awesome, I'd love to experience that, but all the time? No. I want a choice.

Maybe pegged as 'person' first. Hot girl...when I feel like it.

I write roleplaying stories with people in scifi or fantasy situations. Not like 'der i hit u with a stick' more like '6k words later and we have a small novel'. Why? Because I want to be every goddamn variation of person. I don't want it static! It's maddening.

I know if I transitioned it's not the right fit, but I know staying where I am is not the right fit...either?

This makes it all-together so very confusing.

Pansexual and possibly gender-fluid. I never thought the latter was actually a 'thing' in my life. And yet it's a daily thing and I'm stupid for not really considering it.

 Today, I was feeling very 'dude'. Problem is, I'm extremely feminine looking. Like cute Christina Hendricks if the body was a bit more curvy. Like no. I don't want to do that today.

I have no interest in breast binding. I just don't want them to show up when I don't want them there. I also don't want to pretend to have a package. That's not how I want to be.

I've felt this way forever, but alas, I am a girl with dat hips and dat ass and dat cute girly face...what the shit can a girly girl do when she wants to, idk, present as male or even ????? sometimes?!

I don't even know how this shit works..My stomach fat is making me angry, my boobs are making me angry. 

When it comes to sexy times, I enjoy playing any and all roles and genders. The fact that I cannot fully be the role I want to at the given moment makes me livid...

The world was not made for people like me, it appears.

I am so confused, and so pissed off...

---- CAN ANYONE RELATE?

fuucckk",genderfluid,Starting to think I'm [GenderFluid]. Kinda pissed I didn't realize sooner.,1469607995.0,"{'created_utc': 1469582795, 'id': '4us5bi', 'num_comments': 4, 'score': 11, 'selftext': ""I don't think I'm FTM. Just placing that out there. I've been thinking a lot lately, I'm almost 30, getting older, gaining weight as the metabolism shits itself, and I'm wondering about why I feel the way I do. As my breasts get more pronounced, and I am gaining even more hip mass, I'm getting pissed off!\n\nI didn't want to jiggle today, damn you. Obey me! Literally an impossible request.\n\n I kindof need to vent/have someone who can relate? I've always had problems with my physical shape. Body dysmorphia, I was a very skinny child with no real alliance towards a sexual preference for the most part, and didn't really want to deal with puberty. I knew it was coming, and yet I was not happy about it. Let me be a 'person'.\n\nIt happened. I was pissed (lol, it's what the born female body does a good deal of the time...and yet I hated it). And every time the egg drops, I get pissed. It's not even that I want male genitalia. I think it'd be awesome, I'd love to experience that, but all the time? No. I want a choice.\n\nMaybe pegged as 'person' first. Hot girl...when I feel like it.\n\nI write roleplaying stories with people in scifi or fantasy situations. Not like 'der i hit u with a stick' more like '6k words later and we have a small novel'. Why? Because I want to be every goddamn variation of person. I don't want it static! It's maddening.\n\nI know if I transitioned it's not the right fit, but I know staying where I am is not the right fit...either?\n\nThis makes it all-together so very confusing.\n\nPansexual and possibly gender-fluid. I never thought the latter was actually a 'thing' in my life. And yet it's a daily thing and I'm stupid for not really considering it.\n\n Today, I was feeling very 'dude'. Problem is, I'm extremely feminine looking. Like cute Christina Hendricks if the body was a bit more curvy. Like no. I don't want to do that today.\n\nI have no interest in breast binding. I just don't want them to show up when I don't want them there. I also don't want to pretend to have a package. That's not how I want to be.\n\nI've felt this way forever, but alas, I am a girl with dat hips and dat ass and dat cute girly face...what the shit can a girly girl do when she wants to, idk, present as male or even ????? sometimes?!\n\nI don't even know how this shit works..My stomach fat is making me angry, my boobs are making me angry. \n\nWhen it comes to sexy times, I enjoy playing any and all roles and genders. The fact that I cannot fully be the role I want to at the given moment makes me livid...\n\nThe world was not made for people like me, it appears.\n\nI am so confused, and so pissed off...\n\n---- CAN ANYONE RELATE?\n\nfuucckk"", 'subreddit': 'genderfluid', 'title': ""Starting to think I'm [GenderFluid]. Kinda pissed I didn't realize sooner."", 'created': 1469607995.0}"
2016-07-27 06:57:46,4utcgw,2,11,"I seem to have mistaken lack of dysphoria for being a male, but I realise now that I am female through and through. But you guys, thanks. Also, between you and me, the trans sub is much less inviting. I will always respect you guys, and remember, your gender is VALID, nomatter who says it's not. Thanks guys :)",genderfluid,Thanks for everything,1469627866.0,"{'created_utc': 1469602666, 'id': '4utcgw', 'num_comments': 2, 'score': 11, 'selftext': ""I seem to have mistaken lack of dysphoria for being a male, but I realise now that I am female through and through. But you guys, thanks. Also, between you and me, the trans sub is much less inviting. I will always respect you guys, and remember, your gender is VALID, nomatter who says it's not. Thanks guys :)"", 'subreddit': 'genderfluid', 'title': 'Thanks for everything', 'created': 1469627866.0}"
