created_utc,id,num_comments,score,selftext,subreddit,title,created,d_
2016-07-09 17:19:39,4s18ix,6,10,"Okay, so this might be a bit rambly, and may verge slightly in to NSFW areas...you've been warned.

Right now, this is where I'm at in my gender identity. I like girls clothes. I like being able to be a little femme of center in how I act. I've always preferred a bit more to be in the company of girls than guys, although both can give me dysphoria in some ways.

I'm obviously AMAB, if you saw me in public, there'd be no denying it. My hair suffers from genetic baldness. My shoulders have a bit more masculine of a line to them. My upper half of my body, while not very muscular, is obviously that ""of a man.""

Typically, this part doesn't cause me issues. I, pretty much 100% of the time, like the fact that I don't have boobs to deal with. What I don't like is that my upper arms and shoulders can make a good bit of ""women's"" tops not fit right.

Socially, my obvious AMAB status makes it awkward to want to hang around a bunch of girls, as it serves to present even more of a contrast. Also, living in a more conservative area, where most guys are into cars and sports and crap like that, it sometimes gets awkward being a ""guy"" around a bunch of ""girl talk.""

That being said, I also suffer some dysphoria when I'm around a bunch of guys. Partly it's because I'm reminded of how feminine I really am inside when these guys are discussing things. I also have a bit of a feminine-ish curve (albeit more boyish than girlish at certain points) to my body when you go down from my waist.

I don't tend to hate my body, but when I've been shopping for things like jeans or tops, I'm reminded of how much I don't tend to fit either of the ""norms."" Like, my really thick thighs and somewhat girlish curve means that girls jeans tend to fit better, but seeing the more guyish upper half to my body, I feel kinda stupid at times when wanting to wear girls jeans. I also know that it'd be very easy to spot that I'm wearing them when hanging around with a group of guys and girls.

I've always found myself attracted to girls as well, which makes the hanging out with a group of girls more awkward, especially considering the attitudes that ""girls and guys can't be just friends."" Even though I'm AMAB, when I think about being sexually active, my junk isn't used in the typical AMAB way, at least not primarily. When I think about being sexually active, I think about me being with a girl and focusing less on ""tab a into slot b"" and more on what might be able to be described as typical lesbian actions rather than typical heterosexual actions (the best way I could describe it in a short burst).

Socially, I don't mind my male name nor being referred to as a guy. I'm like, yeah, I've always been ""Name"" and I'm a guy, at least by a binary physical status. I think, realistically, as it relates to presentation, I prefer the identity of ""genderqueer"" but there are times I can feel a bit of shift, enough to feel more or less at ease being associated by company within a group of guys or girls.

Most of my dysphoria doesn't seem to come from direct hatred of my body but rather feeling a shift in myself that sometimes comes from who I'm around. It's like, I get reminded of how much I really am different from the people I'm around.

I could be in the girliest outfit possible, but I see an AFAB girl in a similar outfit and I'm reminded just how stupid I must seem. Alternatively, I could be dressed in the most typical guy fashion, but spend time around guys and be reminded of how much I don't identify or agree with the way that ""guys are"" (I can catch myself thinking ""guys are stupid"" or stuff like that and feel like I'm speaking about guys as a separate group from myself).

Hopefully this makes sense...if you have any questions or suggestions or just want to spout off saying that this makes no sense whatsoever, please do.",genderfluid,My current headspace in relation to gender identity [may be slightly nSFW],1468109979.0,"{'created_utc': 1468084779, 'id': '4s18ix', 'num_comments': 6, 'score': 10, 'selftext': 'Okay, so this might be a bit rambly, and may verge slightly in to NSFW areas...you\'ve been warned.\n\nRight now, this is where I\'m at in my gender identity. I like girls clothes. I like being able to be a little femme of center in how I act. I\'ve always preferred a bit more to be in the company of girls than guys, although both can give me dysphoria in some ways.\n\nI\'m obviously AMAB, if you saw me in public, there\'d be no denying it. My hair suffers from genetic baldness. My shoulders have a bit more masculine of a line to them. My upper half of my body, while not very muscular, is obviously that ""of a man.""\n\nTypically, this part doesn\'t cause me issues. I, pretty much 100% of the time, like the fact that I don\'t have boobs to deal with. What I don\'t like is that my upper arms and shoulders can make a good bit of ""women\'s"" tops not fit right.\n\nSocially, my obvious AMAB status makes it awkward to want to hang around a bunch of girls, as it serves to present even more of a contrast. Also, living in a more conservative area, where most guys are into cars and sports and crap like that, it sometimes gets awkward being a ""guy"" around a bunch of ""girl talk.""\n\nThat being said, I also suffer some dysphoria when I\'m around a bunch of guys. Partly it\'s because I\'m reminded of how feminine I really am inside when these guys are discussing things. I also have a bit of a feminine-ish curve (albeit more boyish than girlish at certain points) to my body when you go down from my waist.\n\nI don\'t tend to hate my body, but when I\'ve been shopping for things like jeans or tops, I\'m reminded of how much I don\'t tend to fit either of the ""norms."" Like, my really thick thighs and somewhat girlish curve means that girls jeans tend to fit better, but seeing the more guyish upper half to my body, I feel kinda stupid at times when wanting to wear girls jeans. I also know that it\'d be very easy to spot that I\'m wearing them when hanging around with a group of guys and girls.\n\nI\'ve always found myself attracted to girls as well, which makes the hanging out with a group of girls more awkward, especially considering the attitudes that ""girls and guys can\'t be just friends."" Even though I\'m AMAB, when I think about being sexually active, my junk isn\'t used in the typical AMAB way, at least not primarily. When I think about being sexually active, I think about me being with a girl and focusing less on ""tab a into slot b"" and more on what might be able to be described as typical lesbian actions rather than typical heterosexual actions (the best way I could describe it in a short burst).\n\nSocially, I don\'t mind my male name nor being referred to as a guy. I\'m like, yeah, I\'ve always been ""Name"" and I\'m a guy, at least by a binary physical status. I think, realistically, as it relates to presentation, I prefer the identity of ""genderqueer"" but there are times I can feel a bit of shift, enough to feel more or less at ease being associated by company within a group of guys or girls.\n\nMost of my dysphoria doesn\'t seem to come from direct hatred of my body but rather feeling a shift in myself that sometimes comes from who I\'m around. It\'s like, I get reminded of how much I really am different from the people I\'m around.\n\nI could be in the girliest outfit possible, but I see an AFAB girl in a similar outfit and I\'m reminded just how stupid I must seem. Alternatively, I could be dressed in the most typical guy fashion, but spend time around guys and be reminded of how much I don\'t identify or agree with the way that ""guys are"" (I can catch myself thinking ""guys are stupid"" or stuff like that and feel like I\'m speaking about guys as a separate group from myself).\n\nHopefully this makes sense...if you have any questions or suggestions or just want to spout off saying that this makes no sense whatsoever, please do.', 'subreddit': 'genderfluid', 'title': 'My current headspace in relation to gender identity [may be slightly nSFW]', 'created': 1468109979.0}"
2016-07-10 02:45:14,4s3mfl,3,3,"I'm in my mid/late-30s, and since I've been passed puberty x-dressing has always been a factor. I've never really understood or accepted. In recent years, I've been trying to understand it better. While I've accepted that there's an obvious kink side to it, one issue I'm trying to face is how much I want to do it, even without a necessary sexual side. But I have a lot of fear around it.  But mostly, I feel this urge to be dressed as a woman and to buy/wear woman clothes when inebriated. I'm wondering if this is just something that is exposing my true nature to do so, to expose my fluidity, or if drinking can make it be attractive, but that it isn't my true/natural self. ",genderfluid,Gender fluid when Drinking,1468143914.0,"{'created_utc': 1468118714, 'id': '4s3mfl', 'num_comments': 3, 'score': 3, 'selftext': ""I'm in my mid/late-30s, and since I've been passed puberty x-dressing has always been a factor. I've never really understood or accepted. In recent years, I've been trying to understand it better. While I've accepted that there's an obvious kink side to it, one issue I'm trying to face is how much I want to do it, even without a necessary sexual side. But I have a lot of fear around it.  But mostly, I feel this urge to be dressed as a woman and to buy/wear woman clothes when inebriated. I'm wondering if this is just something that is exposing my true nature to do so, to expose my fluidity, or if drinking can make it be attractive, but that it isn't my true/natural self. "", 'subreddit': 'genderfluid', 'title': 'Gender fluid when Drinking', 'created': 1468143914.0}"
2016-07-11 03:16:58,4s8wt7,0,6,"Imagine you were a classic thespian. You studied the part for years. You know the role, Hamlet's every thought. You've landed a dream role in a major production! But when you're not on stage, and no one's watching. You secretly mouth every word to Ophelia's part. You know you could nail that role. But you can't. Because you're already playing Hamlet. Which is still pretty cool.
That's how I feel. There are times when I feel masculine. That role and expression feel natural. There are times when there's not really a gender at all. I just wear whatever. But there are also times when I feel feminine and wish I was female at birth.
I'm fine with being perceived as male no matter how I dress. It's not like multiple personalities, I'm still just me. But I am a part of the spectrum that people don't often express. And that's just fine.",genderfluid,You've always wanted to play Hamlet.,1468232218.0,"{'created_utc': 1468207018, 'id': '4s8wt7', 'num_comments': 0, 'score': 6, 'selftext': ""Imagine you were a classic thespian. You studied the part for years. You know the role, Hamlet's every thought. You've landed a dream role in a major production! But when you're not on stage, and no one's watching. You secretly mouth every word to Ophelia's part. You know you could nail that role. But you can't. Because you're already playing Hamlet. Which is still pretty cool.\nThat's how I feel. There are times when I feel masculine. That role and expression feel natural. There are times when there's not really a gender at all. I just wear whatever. But there are also times when I feel feminine and wish I was female at birth.\nI'm fine with being perceived as male no matter how I dress. It's not like multiple personalities, I'm still just me. But I am a part of the spectrum that people don't often express. And that's just fine."", 'subreddit': 'genderfluid', 'title': ""You've always wanted to play Hamlet."", 'created': 1468232218.0}"
2016-07-11 04:25:57,4s960i,9,8,"Half venting, half asking for advice here. AFAB here, my most stressful accounts of Dysphoria are when it comes down to buying new clothes. It defaults to me wearing nothing but t-shirts and hoodies and jeans. And I want very much to be able to branch out. But my family doesn't know of my gender issues in any way.

Female clothes make me want to cry, because they're almost always hideous to my eye, or if I like it and try it on, it fits horribly and I hate myself.
Male clothing is too big for me in almost any case, and would obviously raise questions from my parents if I were to come home wearing men's clothing.

I don't know what to do anymore. I don't feel comfortable no matter what I wear anymore.",genderfluid,Clothing Related Dysphoria,1468236357.0,"{'created_utc': 1468211157, 'id': '4s960i', 'num_comments': 9, 'score': 8, 'selftext': ""Half venting, half asking for advice here. AFAB here, my most stressful accounts of Dysphoria are when it comes down to buying new clothes. It defaults to me wearing nothing but t-shirts and hoodies and jeans. And I want very much to be able to branch out. But my family doesn't know of my gender issues in any way.\n\nFemale clothes make me want to cry, because they're almost always hideous to my eye, or if I like it and try it on, it fits horribly and I hate myself.\nMale clothing is too big for me in almost any case, and would obviously raise questions from my parents if I were to come home wearing men's clothing.\n\nI don't know what to do anymore. I don't feel comfortable no matter what I wear anymore."", 'subreddit': 'genderfluid', 'title': 'Clothing Related Dysphoria', 'created': 1468236357.0}"
2016-07-11 07:39:08,4s9s69,5,35,,genderfluid,"Getting better at dressing now. Complete outfit; hair, shoes, makeup and clothes.",1468247948.0,"{'created_utc': 1468222748, 'id': '4s9s69', 'num_comments': 5, 'score': 35, 'selftext': '', 'subreddit': 'genderfluid', 'title': 'Getting better at dressing now. Complete outfit; hair, shoes, makeup and clothes.', 'created': 1468247948.0}"
2016-07-11 10:25:09,4sa8v9,7,3,"Hi, all, I'm getting my hair cut on Thursday!! It'll be all chopped off, which is terrifying since I've always had long hair but also great! I'm AFAB, so I'm worried that I won't be able to pull it off well, and I'm scared that I won't be able to pass and
I'm also scared that I will be able to pass, and I'm just all around nervous, but also excited!!!! 

In other news, though, I'm hella confused. In discussing with one of my friends, I've been trying to put a little bit more of a pinpoint in my gender annnd...... I think I've figured it out? But I've never heard of this before. I've always felt a little bit male of center, but lately it's become more pronounced. And... I think I'm supposed to be physically male, but emotionally/mentally/etc., I'm still female (albeit a bit of a tomboy). Does this make sense/has anyone else experienced this? It's like, I want to present and pass as a man, even to the point of top surgery/packer (and maybe bottom surgery some day as well), but I'm NOT a man and don't want to cross that line into declaring that I am. But that's the body my woman-ish part of me wants to live in. 

Help???",genderfluid,Getting my hair cut! (And other confusing things),1468257909.0,"{'created_utc': 1468232709, 'id': '4sa8v9', 'num_comments': 7, 'score': 3, 'selftext': ""Hi, all, I'm getting my hair cut on Thursday!! It'll be all chopped off, which is terrifying since I've always had long hair but also great! I'm AFAB, so I'm worried that I won't be able to pull it off well, and I'm scared that I won't be able to pass and\nI'm also scared that I will be able to pass, and I'm just all around nervous, but also excited!!!! \n\nIn other news, though, I'm hella confused. In discussing with one of my friends, I've been trying to put a little bit more of a pinpoint in my gender annnd...... I think I've figured it out? But I've never heard of this before. I've always felt a little bit male of center, but lately it's become more pronounced. And... I think I'm supposed to be physically male, but emotionally/mentally/etc., I'm still female (albeit a bit of a tomboy). Does this make sense/has anyone else experienced this? It's like, I want to present and pass as a man, even to the point of top surgery/packer (and maybe bottom surgery some day as well), but I'm NOT a man and don't want to cross that line into declaring that I am. But that's the body my woman-ish part of me wants to live in. \n\nHelp???"", 'subreddit': 'genderfluid', 'title': 'Getting my hair cut! (And other confusing things)', 'created': 1468257909.0}"
2016-07-13 01:26:56,4skjq3,8,6,"Sometimes I Feel that I'm deliberating between two, often battling sides, one is a woman and wants to take estrogen and one is a man. I generally make them take turns, but today, I like, not heard but felt and imagined them conversing and fighting and at one point, she, metaphorically tied up the guy side, and I ended up taking a large doses of estrogen, regretting it, and throwing it up.

That's a little crazy. Does anyone else ever feel that they have multiple people in their head? Idk I'd it's mild DID, or if this is a normal experience of genderfluid folks. 

Like, I've been on estrogen before, but now I don't want to be, though, in the past, I've benefited. It almost feels like a different person wants to come out and needs estrogen to do that, and some experiences I've had match that... so far I've isolated 4 identities, but again, idk if it's DID, Genderfluid or just my way of interpreting it. A part of me hopes it's DID, and another part *really* doesn't.

Does this sound familiar to anyone? Be honest!",genderfluid,Sometimes I Feel Like I'm Going Crazy,1468398416.0,"{'created_utc': 1468373216, 'id': '4skjq3', 'num_comments': 8, 'score': 6, 'selftext': ""Sometimes I Feel that I'm deliberating between two, often battling sides, one is a woman and wants to take estrogen and one is a man. I generally make them take turns, but today, I like, not heard but felt and imagined them conversing and fighting and at one point, she, metaphorically tied up the guy side, and I ended up taking a large doses of estrogen, regretting it, and throwing it up.\n\nThat's a little crazy. Does anyone else ever feel that they have multiple people in their head? Idk I'd it's mild DID, or if this is a normal experience of genderfluid folks. \n\nLike, I've been on estrogen before, but now I don't want to be, though, in the past, I've benefited. It almost feels like a different person wants to come out and needs estrogen to do that, and some experiences I've had match that... so far I've isolated 4 identities, but again, idk if it's DID, Genderfluid or just my way of interpreting it. A part of me hopes it's DID, and another part *really* doesn't.\n\nDoes this sound familiar to anyone? Be honest!"", 'subreddit': 'genderfluid', 'title': ""Sometimes I Feel Like I'm Going Crazy"", 'created': 1468398416.0}"
2016-07-13 07:10:51,4sluz1,0,11,"Today, I was crushed

Asked boy or girl

The happiest thing I've felt forever

Still I had to answer

I answered boy, my given at birth

Although sometimes, it's not true

The weight lifted, then dropped twice as heavy

Broke my heart in two",genderfluid,A poem about recent events,1468419051.0,"{'created_utc': 1468393851, 'id': '4sluz1', 'num_comments': 0, 'score': 11, 'selftext': ""Today, I was crushed\n\nAsked boy or girl\n\nThe happiest thing I've felt forever\n\nStill I had to answer\n\nI answered boy, my given at birth\n\nAlthough sometimes, it's not true\n\nThe weight lifted, then dropped twice as heavy\n\nBroke my heart in two"", 'subreddit': 'genderfluid', 'title': 'A poem about recent events', 'created': 1468419051.0}"
2016-07-16 01:38:35,4t2i88,5,5,"I've been with my SO for a few months now, and have known her (girl days most of the time) for a lot longer, and I've known for a long time that she's genderfluid and have been accepting every part of it and making her feel the best I could in her body and mind. Once in a while she gets dysphoria ""attacks"" where she hates her body and I'm not too sure how to react and make her feel better. I usually always have something to say to help, but feeling powerless makes me feel bad and it scares me that she could think I can't deal with what affects her.

Would you have any tips? ",genderfluid,Helping my SO with gender dysphoria,1468658315.0,"{'created_utc': 1468633115, 'id': '4t2i88', 'num_comments': 5, 'score': 5, 'selftext': 'I\'ve been with my SO for a few months now, and have known her (girl days most of the time) for a lot longer, and I\'ve known for a long time that she\'s genderfluid and have been accepting every part of it and making her feel the best I could in her body and mind. Once in a while she gets dysphoria ""attacks"" where she hates her body and I\'m not too sure how to react and make her feel better. I usually always have something to say to help, but feeling powerless makes me feel bad and it scares me that she could think I can\'t deal with what affects her.\n\nWould you have any tips? ', 'subreddit': 'genderfluid', 'title': 'Helping my SO with gender dysphoria', 'created': 1468658315.0}"
2016-07-16 05:21:14,4t38yf,7,17,"I'm not cis. I have a strong feminine side to me and I have experienced days where I think I have gender issues, but then I feel really ashamed of how stupid I must've looked and I feel so embarrassed.

I talked to my friends and came out as gender fluid, but I still present as male so they think it's no big deal. I am usually male and sometimes female, but I almost am at the point where I feel like a FTM while being AMAB. It's really strange 😖😖😖",genderfluid,"Not woman enough to dress like one, not man enough to feel like one.",1468671674.0,"{'created_utc': 1468646474, 'id': '4t38yf', 'num_comments': 7, 'score': 17, 'selftext': ""I'm not cis. I have a strong feminine side to me and I have experienced days where I think I have gender issues, but then I feel really ashamed of how stupid I must've looked and I feel so embarrassed.\n\nI talked to my friends and came out as gender fluid, but I still present as male so they think it's no big deal. I am usually male and sometimes female, but I almost am at the point where I feel like a FTM while being AMAB. It's really strange 😖😖😖"", 'subreddit': 'genderfluid', 'title': 'Not woman enough to dress like one, not man enough to feel like one.', 'created': 1468671674.0}"
2016-07-17 02:38:06,4t7s71,8,4,"Lately, I've been feeling like there's a split in me. Some days I wake up and really don't care about gender and feel like I don't have one. Other days, I wake up and want to embrace everything. In the past, I've identified as agender, but I'm wondering if I may be genderfluid between pangender and agender? Anyone else have this experience?",genderfluid,Genderfluid between pangender and agender?,1468748286.0,"{'created_utc': 1468723086, 'id': '4t7s71', 'num_comments': 8, 'score': 4, 'selftext': ""Lately, I've been feeling like there's a split in me. Some days I wake up and really don't care about gender and feel like I don't have one. Other days, I wake up and want to embrace everything. In the past, I've identified as agender, but I'm wondering if I may be genderfluid between pangender and agender? Anyone else have this experience?"", 'subreddit': 'genderfluid', 'title': 'Genderfluid between pangender and agender?', 'created': 1468748286.0}"
