created_utc,id,num_comments,score,selftext,subreddit,title,created,d_
2016-07-17 08:59:42,4t8x0y,5,6,"So I had a talk with a feminist buddy of mine, yes the argument between  my conservative and feminist friend happened to bring up the whole ""social constructivism"" argument. Of which, my feminist friend , of course said the whole ""Gender and sex is a social construct"" comment. My conservative friend was a bit offended at their statement. Of course, I am a major Devil's Advocate when it comes to issues, and I tend to challenge everything. I pretty much said, ""Well, if that is the case, then the concept of all non-binary gender (identities) are  all social constructs."" 
Their reaction was to be expected,  and I was scolded with the whole ""Don't invalidate nonbinary folk"" line. But I had to ask, ""Well, being genderfluid, why are you upset at my statement when your feminist definition of social constructivism really means is that the definition of a word–or concept–is agreed upon via some form of common consensus?"" (quoted from this blog: https://evolutionistx.wordpress.com/2015/06/17/reality-is-a-social-construct/)

But the reality is,  this definition of social constructivism is actually called Word Association. In my Speech class,  I was told that societies would come to a consensus about words. Meaning that a word in and of itself has no meaning unless people agree to what definition a word should have.  A pen is called a ""pen"" becasue everyone agrees that the word ""pen"" applies to this object.

But it really does amuse me, as it isn't the first time I ran into a feminist who  took offense to this statement. Why do so many believe this concept of social constructivism but take offense to the idea that nonbinary gender identities and other identities fall under the same category?  I'd like to hear your thoughts on this.",genderfluid,"An analysis on social constructivism, speech, and current opposing views on gender.",1468771182.0,"{'created_utc': 1468745982, 'id': '4t8x0y', 'num_comments': 5, 'score': 6, 'selftext': 'So I had a talk with a feminist buddy of mine, yes the argument between  my conservative and feminist friend happened to bring up the whole ""social constructivism"" argument. Of which, my feminist friend , of course said the whole ""Gender and sex is a social construct"" comment. My conservative friend was a bit offended at their statement. Of course, I am a major Devil\'s Advocate when it comes to issues, and I tend to challenge everything. I pretty much said, ""Well, if that is the case, then the concept of all non-binary gender (identities) are  all social constructs."" \nTheir reaction was to be expected,  and I was scolded with the whole ""Don\'t invalidate nonbinary folk"" line. But I had to ask, ""Well, being genderfluid, why are you upset at my statement when your feminist definition of social constructivism really means is that the definition of a word–or concept–is agreed upon via some form of common consensus?"" (quoted from this blog: https://evolutionistx.wordpress.com/2015/06/17/reality-is-a-social-construct/)\n\nBut the reality is,  this definition of social constructivism is actually called Word Association. In my Speech class,  I was told that societies would come to a consensus about words. Meaning that a word in and of itself has no meaning unless people agree to what definition a word should have.  A pen is called a ""pen"" becasue everyone agrees that the word ""pen"" applies to this object.\n\nBut it really does amuse me, as it isn\'t the first time I ran into a feminist who  took offense to this statement. Why do so many believe this concept of social constructivism but take offense to the idea that nonbinary gender identities and other identities fall under the same category?  I\'d like to hear your thoughts on this.', 'subreddit': 'genderfluid', 'title': 'An analysis on social constructivism, speech, and current opposing views on gender.', 'created': 1468771182.0}"
2016-07-19 10:20:09,4tkfp8,4,4,"Hey, I'm a 16 year old female and I'm not sure what I am. 
I've had an identity crisis since I can remember and I'm getting sick of it. 
It really began when I was 6, I was in love with my best friend who was a girl. I didn't really think about it, I just knew I wanted to be with her forever. Later I learned about being gay, and I quickly accepted I was a lesbian. 
My memory from when I was younger is very bad, I think it's because I was very depressed most of the time. I remember my family always told me to smile once, because I never did. I don't exactly know why I was always sad, I just saw no joy in life. 
When I was between 8 and 12 I always enjoyed playing with boys more than girls. I cut my hair short because I wanted to be one of them, but while my hair was short I also hung out with girls who told me my short hair was weird. So I decided to let it grow long again. 
When I was 12 I also fell in love with another female friend, I tried to let het know with small hints but I don't she ever got it. 
Around that time I also learned about transgenders, and I wondered if I was a transgender too. 
I also noticed boys got interested in me, I was a girl who was addicted to minecraft like most boys that time. I made a lot of friends because of that, but most of those friendships got ruined when they started telling me they were in love with me. I was not even thinking about a relationship with a boy, so they stopped hanging out with me. 
I've always struggled with social anxiety, and that anxiety got very bad when I was 14. I had a huge fight with a friend of mine, she thought I was flirting with her crush because I was hanging out with him a lot. But all I wanted was a male friend. She was the most populair girl in my friend circle, so I couldnt hang out with most of my friends anymore.
I think anxiety is the reason I stopped hanging out with boys. I was scared people thought I was weird.
A few friends stayed with me after the fight. One of them was a guy who people said had a crush on me. We were both very shy, I think I was in love with him but I never told him. That was when I got confused if I really was a lesbian. I never told anyone that I was a lesbian btw, I just never talked about love stuff with my friends. 
I think I was 14 when I told people in my class I was lesbian, I never told my parents because we don't have a close relationship and I feel like it would be awkward. 
I never got problems for being lesbian because in my country being gay isn't a very big deal. I just felt very unconfortable knowing my female friends knew I'm gay. I've always been a bit awkward because of my anxiety, so I was scared my best friend would think I was in love with her.  So I later told them I wasn't lesbian after all. 
I was struggling very hard at that time with who I was, in online games I started telling people I was a guy, but later made a new account telling I was a girl. When I was a girl I wanted to be a guy and when I was a guy I wanted to be a girl. One day I will look in the mirror hating my breasts and the next day I will look in the mirror wishing they were bigger.  
When I was 15 I cut my hair really short, thinking it'd make me happier but it didn't. All I wanted was for it to grow long again. I missed the attention I got from guys.
Last year I got into a new class without any of my old friends. And since I'm very bad at making friends I sat alone most of the time. I made 1 new female friend, but we didn't hang out much. I also made a male friend, but he got depressed and didn't want to talk with me about it so we stopped talking.
Being my most lonely year, it was also my happiest year, I finally got out of my depression, and I started to love life. I feel like one of the luckiest people on earth and my dream is to share my luck with others. My anxiety is still as bad though.
I also feel like I'm falling back into my depression becausr I became scared of beigg alone and sleeping because I hate my thoughts right now.
I still hang out with my old friends sometimes, and we go to parties together but I keep feeling I don't belong with them and that they invite me because they feel bad for me. 
Recently I learned my anxiety is a lot less after drinking alcohol, so I can't wait for the parties I'll have this summer. 
My one wish is to find a male friend to talk with about girls &amp; stuff. That's what I always wanted. And maybe I'll find out if I'm trans or genderfluid or just lesbian. 

I'm sorry if this story is too unrelated I just don't know where to put this I don't have anyone to talk about this. ",genderfluid,I don't know if I'm genderfluid,1468948809.0,"{'created_utc': 1468923609, 'id': '4tkfp8', 'num_comments': 4, 'score': 4, 'selftext': ""Hey, I'm a 16 year old female and I'm not sure what I am. \nI've had an identity crisis since I can remember and I'm getting sick of it. \nIt really began when I was 6, I was in love with my best friend who was a girl. I didn't really think about it, I just knew I wanted to be with her forever. Later I learned about being gay, and I quickly accepted I was a lesbian. \nMy memory from when I was younger is very bad, I think it's because I was very depressed most of the time. I remember my family always told me to smile once, because I never did. I don't exactly know why I was always sad, I just saw no joy in life. \nWhen I was between 8 and 12 I always enjoyed playing with boys more than girls. I cut my hair short because I wanted to be one of them, but while my hair was short I also hung out with girls who told me my short hair was weird. So I decided to let it grow long again. \nWhen I was 12 I also fell in love with another female friend, I tried to let het know with small hints but I don't she ever got it. \nAround that time I also learned about transgenders, and I wondered if I was a transgender too. \nI also noticed boys got interested in me, I was a girl who was addicted to minecraft like most boys that time. I made a lot of friends because of that, but most of those friendships got ruined when they started telling me they were in love with me. I was not even thinking about a relationship with a boy, so they stopped hanging out with me. \nI've always struggled with social anxiety, and that anxiety got very bad when I was 14. I had a huge fight with a friend of mine, she thought I was flirting with her crush because I was hanging out with him a lot. But all I wanted was a male friend. She was the most populair girl in my friend circle, so I couldnt hang out with most of my friends anymore.\nI think anxiety is the reason I stopped hanging out with boys. I was scared people thought I was weird.\nA few friends stayed with me after the fight. One of them was a guy who people said had a crush on me. We were both very shy, I think I was in love with him but I never told him. That was when I got confused if I really was a lesbian. I never told anyone that I was a lesbian btw, I just never talked about love stuff with my friends. \nI think I was 14 when I told people in my class I was lesbian, I never told my parents because we don't have a close relationship and I feel like it would be awkward. \nI never got problems for being lesbian because in my country being gay isn't a very big deal. I just felt very unconfortable knowing my female friends knew I'm gay. I've always been a bit awkward because of my anxiety, so I was scared my best friend would think I was in love with her.  So I later told them I wasn't lesbian after all. \nI was struggling very hard at that time with who I was, in online games I started telling people I was a guy, but later made a new account telling I was a girl. When I was a girl I wanted to be a guy and when I was a guy I wanted to be a girl. One day I will look in the mirror hating my breasts and the next day I will look in the mirror wishing they were bigger.  \nWhen I was 15 I cut my hair really short, thinking it'd make me happier but it didn't. All I wanted was for it to grow long again. I missed the attention I got from guys.\nLast year I got into a new class without any of my old friends. And since I'm very bad at making friends I sat alone most of the time. I made 1 new female friend, but we didn't hang out much. I also made a male friend, but he got depressed and didn't want to talk with me about it so we stopped talking.\nBeing my most lonely year, it was also my happiest year, I finally got out of my depression, and I started to love life. I feel like one of the luckiest people on earth and my dream is to share my luck with others. My anxiety is still as bad though.\nI also feel like I'm falling back into my depression becausr I became scared of beigg alone and sleeping because I hate my thoughts right now.\nI still hang out with my old friends sometimes, and we go to parties together but I keep feeling I don't belong with them and that they invite me because they feel bad for me. \nRecently I learned my anxiety is a lot less after drinking alcohol, so I can't wait for the parties I'll have this summer. \nMy one wish is to find a male friend to talk with about girls &amp; stuff. That's what I always wanted. And maybe I'll find out if I'm trans or genderfluid or just lesbian. \n\nI'm sorry if this story is too unrelated I just don't know where to put this I don't have anyone to talk about this. "", 'subreddit': 'genderfluid', 'title': ""I don't know if I'm genderfluid"", 'created': 1468948809.0}"
2016-07-19 14:51:39,4tliae,4,3,"Hey everyone ! It's been a while since I've first sensed I was not completely a girl. I've always thought it was because I was a bit masculin-er than other girls. Some times ago, I even thought I might be a trans-man. So I finally looked into the net to help me with all those disphoria I've been having. And I finally discovered this reddit who helped a lot.

Now, I'm searching for some idea to perfect my ""guy look"". I have long hair that I don't wish to cut for now (don't know why). I think that I have a face close to one of an androgyne, but I think my eyes are too big to be masculine. And the worse : I have natural curves which I don't really like (sorry for the AMAB out there, I'll gladly donate them if I could). I have large shoulders but rather normal waist and large hip/butt/thighs for a guy.

So here are my questions :
- Is there some FAAB or AMAB here with long hair, and what do you do with them on guy day ?
- I don't use any make-up, but do you think I can use some to shrink my eyes maybe ?
- For FAAB with curves, what do you wear without looking like a rapper of '90 to hide those curves ?

Thank you !",genderfluid,FAAB problem,1468965099.0,"{'created_utc': 1468939899, 'id': '4tliae', 'num_comments': 4, 'score': 3, 'selftext': 'Hey everyone ! It\'s been a while since I\'ve first sensed I was not completely a girl. I\'ve always thought it was because I was a bit masculin-er than other girls. Some times ago, I even thought I might be a trans-man. So I finally looked into the net to help me with all those disphoria I\'ve been having. And I finally discovered this reddit who helped a lot.\n\nNow, I\'m searching for some idea to perfect my ""guy look"". I have long hair that I don\'t wish to cut for now (don\'t know why). I think that I have a face close to one of an androgyne, but I think my eyes are too big to be masculine. And the worse : I have natural curves which I don\'t really like (sorry for the AMAB out there, I\'ll gladly donate them if I could). I have large shoulders but rather normal waist and large hip/butt/thighs for a guy.\n\nSo here are my questions :\n- Is there some FAAB or AMAB here with long hair, and what do you do with them on guy day ?\n- I don\'t use any make-up, but do you think I can use some to shrink my eyes maybe ?\n- For FAAB with curves, what do you wear without looking like a rapper of \'90 to hide those curves ?\n\nThank you !', 'subreddit': 'genderfluid', 'title': 'FAAB problem', 'created': 1468965099.0}"
2016-07-19 19:02:34,4tmuxd,3,2,"I have kind of always thought about being a girl. But i also have times when being a male is what feels right. I dont really fully understand dysphoria but i assume thats a part of it. I guess i don't really notice shifts in my gender identity, but i definitely have often wanted to be a girl, while at other times wanting to be a man. That is gender fluid right? Could someone give me a better explanation of dysphoria?",genderfluid,questioning,1468980154.0,"{'created_utc': 1468954954, 'id': '4tmuxd', 'num_comments': 3, 'score': 2, 'selftext': ""I have kind of always thought about being a girl. But i also have times when being a male is what feels right. I dont really fully understand dysphoria but i assume thats a part of it. I guess i don't really notice shifts in my gender identity, but i definitely have often wanted to be a girl, while at other times wanting to be a man. That is gender fluid right? Could someone give me a better explanation of dysphoria?"", 'subreddit': 'genderfluid', 'title': 'questioning', 'created': 1468980154.0}"
2016-07-20 01:01:33,4tokls,2,26,,genderfluid,Porcelain a genderfluid DC Comics character,1469001693.0,"{'created_utc': 1468976493, 'id': '4tokls', 'num_comments': 2, 'score': 26, 'selftext': '', 'subreddit': 'genderfluid', 'title': 'Porcelain a genderfluid DC Comics character', 'created': 1469001693.0}"
2016-07-20 21:24:05,4ttgh7,6,7,I was just told about gender fluid and that I might be it. I am wondering what it fully is. I'm a male and most of the time I am happy and full on male. About once every month or so for about a week or so I get a burning urge to be a woman. Like it's all I can think about. I have dressed up a few times but never in public because I'm just to masculine. It makes me sad when this happens because I don't feel like the female I want to be.  I was talking to some one and they said I sound gender fluid and pointed me here. I guess I just need to know where to go from here. I'm not really sure I just feel lost. ,genderfluid,Where to start?,1469075045.0,"{'created_utc': 1469049845, 'id': '4ttgh7', 'num_comments': 6, 'score': 7, 'selftext': ""I was just told about gender fluid and that I might be it. I am wondering what it fully is. I'm a male and most of the time I am happy and full on male. About once every month or so for about a week or so I get a burning urge to be a woman. Like it's all I can think about. I have dressed up a few times but never in public because I'm just to masculine. It makes me sad when this happens because I don't feel like the female I want to be.  I was talking to some one and they said I sound gender fluid and pointed me here. I guess I just need to know where to go from here. I'm not really sure I just feel lost. "", 'subreddit': 'genderfluid', 'title': 'Where to start?', 'created': 1469075045.0}"
2016-07-22 10:04:56,4u22fz,3,4,"Hey Reddit, throwaway account from my main one.  I just wanted some advice.

I'm genderfluid, and AFAB.  Right not I'm feeling especially masculine, and I really REALLY want to dress the part, but my boobs are kind of huge.  I have a 5X G2M binder, but it doesn't really fit.  More accurately, it looks like I'm wearing an odd shirt over oddly lumpy boobs.

So any advice on what others do if they can't represent how they feel?  I know dysphoria will pass, but it's really strong right now.",genderfluid,"Looking for Advice. Interesting, Curvy, Genderfluid Problems",1469207096.0,"{'created_utc': 1469181896, 'id': '4u22fz', 'num_comments': 3, 'score': 4, 'selftext': ""Hey Reddit, throwaway account from my main one.  I just wanted some advice.\n\nI'm genderfluid, and AFAB.  Right not I'm feeling especially masculine, and I really REALLY want to dress the part, but my boobs are kind of huge.  I have a 5X G2M binder, but it doesn't really fit.  More accurately, it looks like I'm wearing an odd shirt over oddly lumpy boobs.\n\nSo any advice on what others do if they can't represent how they feel?  I know dysphoria will pass, but it's really strong right now."", 'subreddit': 'genderfluid', 'title': 'Looking for Advice. Interesting, Curvy, Genderfluid Problems', 'created': 1469207096.0}"
2016-07-22 10:08:22,4u22st,3,3,"Edit: this really should be titled ""DAE like one version of themselves then other ones?""",genderfluid,Is it bad that i like one version of myself than my other versions,1469207302.0,"{'created_utc': 1469182102, 'id': '4u22st', 'num_comments': 3, 'score': 3, 'selftext': 'Edit: this really should be titled ""DAE like one version of themselves then other ones?""', 'subreddit': 'genderfluid', 'title': 'Is it bad that i like one version of myself than my other versions', 'created': 1469207302.0}"
