created_utc,id,num_comments,score,selftext,subreddit,title,created,d_
2016-07-01 19:04:40,4qtfnv,8,5,"I'm 26/m, from Sheffield, UK. Anyway, I realized I was genderfluid last month. Single so don't have to tell anyone about it.

Some days I feel male, other days I'm female, more like 20/80, 20 percent male 80 percent female, yet I dont identify as trans.

I want to start passing as female but am too scared to use the changing rooms in Select Fashions for fear of being seen as a perv and security guards in shops with radios on thinking I'm a shoplifter.

This is the top I like - http://www.selectfashion.co.uk/clothing/s043-1403-046_black.html but I'm too embarrassed to go in ans try it on let alone buy it.

My feminine side is the same personality as me, no real change in interests, except uber-feminine in look.

I'm attracted to women, not men, both as man and woman.

Officially, I identify as a guy, for work, anyway, but outside of, I'm both.

Chapeltown here in Sheffield isn't great for LGBT, genderfluid, whatever so I need help on this/.

I need to gain some confidence but how can I start to be my true self so to speak?

Anyone here from around my area? I sometimes go up to Pitsmoor and Grenoside but they're not really accepting of LGBT let alone genderfluid people so I hear...

Just need advice from everyone.

















































",genderfluid,I've realized i'm genderfluid. Issues with changing rooms in shops. How do I deal with this.,1467425080.0,"{'created_utc': 1467399880, 'id': '4qtfnv', 'num_comments': 8, 'score': 5, 'selftext': ""I'm 26/m, from Sheffield, UK. Anyway, I realized I was genderfluid last month. Single so don't have to tell anyone about it.\n\nSome days I feel male, other days I'm female, more like 20/80, 20 percent male 80 percent female, yet I dont identify as trans.\n\nI want to start passing as female but am too scared to use the changing rooms in Select Fashions for fear of being seen as a perv and security guards in shops with radios on thinking I'm a shoplifter.\n\nThis is the top I like - http://www.selectfashion.co.uk/clothing/s043-1403-046_black.html but I'm too embarrassed to go in ans try it on let alone buy it.\n\nMy feminine side is the same personality as me, no real change in interests, except uber-feminine in look.\n\nI'm attracted to women, not men, both as man and woman.\n\nOfficially, I identify as a guy, for work, anyway, but outside of, I'm both.\n\nChapeltown here in Sheffield isn't great for LGBT, genderfluid, whatever so I need help on this/.\n\nI need to gain some confidence but how can I start to be my true self so to speak?\n\nAnyone here from around my area? I sometimes go up to Pitsmoor and Grenoside but they're not really accepting of LGBT let alone genderfluid people so I hear...\n\nJust need advice from everyone.\n\n\n\n\n\n\n\n\n\n\n\n\n\n\n\n\n\n\n\n\n\n\n\n\n\n\n\n\n\n\n\n\n\n\n\n\n\n\n\n\n\n\n\n\n\n\n\n\n\n"", 'subreddit': 'genderfluid', 'title': ""I've realized i'm genderfluid. Issues with changing rooms in shops. How do I deal with this."", 'created': 1467425080.0}"
2016-07-02 16:55:18,4qxzyg,0,3,"We are writing from a LGBTQ-affirmative research group at the [University of Massachusetts Boston — the LGBTQ UMass Boston Advocacy and Research Collaborative] (https://www.facebook.com/UMassBostonLgbtqResearchTeam) .  We have developed brief exercises to help LGBTQ people deal with experiences of heterosexism.  Heterosexism is prejudice or discrimination based on the idea that heterosexuality is the norm.  
We are hoping you would be willing to help us by sharing this information, and in turn contribute to the mental health of LGBTQ people who experience heterosexist experiences.  If participants finish the questionnaires and exercises at the times below, they will receive an $80 Amazon gift card, and if they participate at all they will be eligible for a raffle for a $100 gift card.  
In total, the entire study should take three hours to complete across five days (about 20-30 minutes on four of the days and 45-50 minutes on one day).  
            The study involves completing:  
*A questionnaire on the first day  
*A writing exercise on each of the following three days  
*A follow-up questionnaire two months later.   
The link to the survey is:   [http://www.surveygizmo.com/s3/2582177/Initial-Page]( http://www.surveygizmo.com/s3/2582177/Initial-Page)  
Please share this with people who have had heterosexist experiences who may be interested. We can also send a flyer you can share or distribute at meetings. 
If you have any questions, please let us know by writing to us at UMBstudyschedule@gmail.com . This study has been approved by the University of Massachusetts Boston Institutional Review Board. If you have questions about your rights as participants, please contact the University of Massachusetts Boston IRB at orsp@umb.edu or 617-287-5370.  
We really appreciate your support to better LGBTQ lives.  
Sincerely,  
Brianna Wadler, MS, Heidi Levitt, PhD &amp; the Heterosexist Experiences Study Team  
University of Massachusetts Boston  
",genderfluid,Study about Heterosexist Experiences,1467503718.0,"{'created_utc': 1467478518, 'id': '4qxzyg', 'num_comments': 0, 'score': 3, 'selftext': 'We are writing from a LGBTQ-affirmative research group at the [University of Massachusetts Boston — the LGBTQ UMass Boston Advocacy and Research Collaborative] (https://www.facebook.com/UMassBostonLgbtqResearchTeam) .  We have developed brief exercises to help LGBTQ people deal with experiences of heterosexism.  Heterosexism is prejudice or discrimination based on the idea that heterosexuality is the norm.  \nWe are hoping you would be willing to help us by sharing this information, and in turn contribute to the mental health of LGBTQ people who experience heterosexist experiences.  If participants finish the questionnaires and exercises at the times below, they will receive an $80 Amazon gift card, and if they participate at all they will be eligible for a raffle for a $100 gift card.  \nIn total, the entire study should take three hours to complete across five days (about 20-30 minutes on four of the days and 45-50 minutes on one day).  \n            The study involves completing:  \n*A questionnaire on the first day  \n*A writing exercise on each of the following three days  \n*A follow-up questionnaire two months later.   \nThe link to the survey is:   [http://www.surveygizmo.com/s3/2582177/Initial-Page]( http://www.surveygizmo.com/s3/2582177/Initial-Page)  \nPlease share this with people who have had heterosexist experiences who may be interested. We can also send a flyer you can share or distribute at meetings. \nIf you have any questions, please let us know by writing to us at UMBstudyschedule@gmail.com . This study has been approved by the University of Massachusetts Boston Institutional Review Board. If you have questions about your rights as participants, please contact the University of Massachusetts Boston IRB at orsp@umb.edu or 617-287-5370.  \nWe really appreciate your support to better LGBTQ lives.  \nSincerely,  \nBrianna Wadler, MS, Heidi Levitt, PhD &amp; the Heterosexist Experiences Study Team  \nUniversity of Massachusetts Boston  \n', 'subreddit': 'genderfluid', 'title': 'Study about Heterosexist Experiences', 'created': 1467503718.0}"
2016-07-02 23:09:42,4qzinb,2,3,"Hi all.
I'm 15 and AMAB and have been experiencing minor to moderate dysphoria on and off for most of my life. I discounted it for a long time, even for a couple years after I began encountering and being cool with LGBT people in 2013 or so. About 7 months ago now I decided I was probably genderfluid. In general, I tended to ID as male or female for a few hours or at the most days. But about a month and a half ago, I chose a feminine name and ever since then (well, really a couple hours before then, but y'know), I've identified as female. This is by far the longest amount of time I've been one gender since before I decided I was genderfluid. Is there any time that I should presume I'm not going to identify as male again and simply refer to myself as a transgender woman? If so, when? Any help or info would be appreciated.

update: i decided that my increasing feeling of discomfort about saying i'm genderfluid was probably relevant and am now out as a trans girl. thanks to /u/mangaraedh for the advice.",genderfluid,how can i tell if i'm not genderfluid?,1467526182.0,"{'created_utc': 1467500982, 'id': '4qzinb', 'num_comments': 2, 'score': 3, 'selftext': ""Hi all.\nI'm 15 and AMAB and have been experiencing minor to moderate dysphoria on and off for most of my life. I discounted it for a long time, even for a couple years after I began encountering and being cool with LGBT people in 2013 or so. About 7 months ago now I decided I was probably genderfluid. In general, I tended to ID as male or female for a few hours or at the most days. But about a month and a half ago, I chose a feminine name and ever since then (well, really a couple hours before then, but y'know), I've identified as female. This is by far the longest amount of time I've been one gender since before I decided I was genderfluid. Is there any time that I should presume I'm not going to identify as male again and simply refer to myself as a transgender woman? If so, when? Any help or info would be appreciated.\n\nupdate: i decided that my increasing feeling of discomfort about saying i'm genderfluid was probably relevant and am now out as a trans girl. thanks to /u/mangaraedh for the advice."", 'subreddit': 'genderfluid', 'title': ""how can i tell if i'm not genderfluid?"", 'created': 1467526182.0}"
2016-07-03 00:15:56,4qzrjs,13,0,[removed],genderfluid,What to put on my passport?,1467530156.0,"{'created_utc': 1467504956, 'id': '4qzrjs', 'num_comments': 13, 'score': 0, 'selftext': '[removed]', 'subreddit': 'genderfluid', 'title': 'What to put on my passport?', 'created': 1467530156.0}"
2016-07-03 13:36:13,4r2121,2,2,"I (AFAB) nearly came out as trans a little over a year ago before having the epiphany that I am gender fluid.  I have days where I present differently, but never solidly masculine or feminine. It does tend to always be leaning towards feminine. I experience dysphoria when I have long male periods, but generally I am fine with not having distinct presentation differences when I'm fluctuating. Is that okay? I'm just very confused.",genderfluid,Presentation Confusion,1467578173.0,"{'created_utc': 1467552973, 'id': '4r2121', 'num_comments': 2, 'score': 2, 'selftext': ""I (AFAB) nearly came out as trans a little over a year ago before having the epiphany that I am gender fluid.  I have days where I present differently, but never solidly masculine or feminine. It does tend to always be leaning towards feminine. I experience dysphoria when I have long male periods, but generally I am fine with not having distinct presentation differences when I'm fluctuating. Is that okay? I'm just very confused."", 'subreddit': 'genderfluid', 'title': 'Presentation Confusion', 'created': 1467578173.0}"
2016-07-03 18:16:38,4r33om,3,7,"Hi, my name is Alex and I'm completely new to Reddit. AFAB and bisexual(?)

The past 10 months or so I've been experimenting with my gender and sexual identity. I've been experimenting with wearing more traditionally masculine clothing, shaving my head, not shaving my legs, etc. I thought I identified as a trans man for a while but I'm still totally unsure. My boyfriend has been extremely supportive through all of this. (Not only my gender and sexual identity but also dropping out of college and moving in together) 

I like traditionally masculine things as well as feminine things. I really like wearing makeup. I don't know. I'm just so lost.

Do you guys have any tips on better discovering who you are? I'm really confused and just frustrated. ",genderfluid,Confused and frustrated,1467594998.0,"{'created_utc': 1467569798, 'id': '4r33om', 'num_comments': 3, 'score': 7, 'selftext': ""Hi, my name is Alex and I'm completely new to Reddit. AFAB and bisexual(?)\n\nThe past 10 months or so I've been experimenting with my gender and sexual identity. I've been experimenting with wearing more traditionally masculine clothing, shaving my head, not shaving my legs, etc. I thought I identified as a trans man for a while but I'm still totally unsure. My boyfriend has been extremely supportive through all of this. (Not only my gender and sexual identity but also dropping out of college and moving in together) \n\nI like traditionally masculine things as well as feminine things. I really like wearing makeup. I don't know. I'm just so lost.\n\nDo you guys have any tips on better discovering who you are? I'm really confused and just frustrated. "", 'subreddit': 'genderfluid', 'title': 'Confused and frustrated', 'created': 1467594998.0}"
2016-07-04 13:04:37,4r74c2,12,11,"Hey peeps, so I don't really have a pronoun problem, but I feel like a different gender based on who I speak to. Like if I talk to some girls, I feel like I want to paint my nails with them and have no attraction to them at all and I feel super girly and experience gender dysphoria post contact with them. But then when I'm with some people I feel like a man and no gender dysphoria is present. I'm AMAB. Does this sound like anyone here? Does this mean instead of fully trans I'm gender fluid?",genderfluid,I thought I was trans for the past 3 weeks. I then realized my identified gender changes by who I speak to!,1467662677.0,"{'created_utc': 1467637477, 'id': '4r74c2', 'num_comments': 12, 'score': 11, 'selftext': ""Hey peeps, so I don't really have a pronoun problem, but I feel like a different gender based on who I speak to. Like if I talk to some girls, I feel like I want to paint my nails with them and have no attraction to them at all and I feel super girly and experience gender dysphoria post contact with them. But then when I'm with some people I feel like a man and no gender dysphoria is present. I'm AMAB. Does this sound like anyone here? Does this mean instead of fully trans I'm gender fluid?"", 'subreddit': 'genderfluid', 'title': 'I thought I was trans for the past 3 weeks. I then realized my identified gender changes by who I speak to!', 'created': 1467662677.0}"
2016-07-05 05:24:49,4rb5w3,12,47,,genderfluid,Finally found a dress that works on Me,1467721489.0,"{'created_utc': 1467696289, 'id': '4rb5w3', 'num_comments': 12, 'score': 47, 'selftext': '', 'subreddit': 'genderfluid', 'title': 'Finally found a dress that works on Me', 'created': 1467721489.0}"
2016-07-05 06:53:16,4rbg3s,7,44,,genderfluid,"Last mount, I went to my prom in the most beautiful dress.",1467726796.0,"{'created_utc': 1467701596, 'id': '4rbg3s', 'num_comments': 7, 'score': 44, 'selftext': '', 'subreddit': 'genderfluid', 'title': 'Last mount, I went to my prom in the most beautiful dress.', 'created': 1467726796.0}"
2016-07-05 12:26:08,4rcf46,0,5,"Hi I'm a (AFAB) genderfluid person of colour and i'm just trying to find some role models , particularly of colour. Some role models i have are Kat Blaque of Youtube ( transwoman of colour) and Amandla Stenburg (nonbinary poc). Any more suggestions? ",genderfluid,nonbinary transmasc POC role models?,1467746768.0,"{'created_utc': 1467721568, 'id': '4rcf46', 'num_comments': 0, 'score': 5, 'selftext': ""Hi I'm a (AFAB) genderfluid person of colour and i'm just trying to find some role models , particularly of colour. Some role models i have are Kat Blaque of Youtube ( transwoman of colour) and Amandla Stenburg (nonbinary poc). Any more suggestions? "", 'subreddit': 'genderfluid', 'title': 'nonbinary transmasc POC role models?', 'created': 1467746768.0}"
2016-07-05 18:53:20,4re8qv,7,1,[deleted],genderfluid,Uh...,1467770000.0,"{'created_utc': 1467744800, 'id': '4re8qv', 'num_comments': 7, 'score': 1, 'selftext': '[deleted]', 'subreddit': 'genderfluid', 'title': 'Uh...', 'created': 1467770000.0}"
2016-07-06 01:02:09,4rfyyx,5,9,"Does anyone ever feel like one gender dominates their lives (their birth gender) and the other one seeps out sometimes? In my case I'm male like 95% of the time and my inner woman is only let out when I talk to people who are accepting of me. This leads me to think I'm almost cis, but when I identify as a woman I feel gender dysphoria and the urge to do feminine things. I'm also way more emotional and loving.

Is this common with gender fluid people or am I alone?

I also am super not picky with pronouns, but when I see a woman's restroom I do often take a second guess, but inevitably I can't ever pass as a woman so it makes more sense to use the men's room.

What are your thoughts? Do I sound gender fluid?",genderfluid,Feel like I shouldn't be here but know I belong,1467792129.0,"{'created_utc': 1467766929, 'id': '4rfyyx', 'num_comments': 5, 'score': 9, 'selftext': ""Does anyone ever feel like one gender dominates their lives (their birth gender) and the other one seeps out sometimes? In my case I'm male like 95% of the time and my inner woman is only let out when I talk to people who are accepting of me. This leads me to think I'm almost cis, but when I identify as a woman I feel gender dysphoria and the urge to do feminine things. I'm also way more emotional and loving.\n\nIs this common with gender fluid people or am I alone?\n\nI also am super not picky with pronouns, but when I see a woman's restroom I do often take a second guess, but inevitably I can't ever pass as a woman so it makes more sense to use the men's room.\n\nWhat are your thoughts? Do I sound gender fluid?"", 'subreddit': 'genderfluid', 'title': ""Feel like I shouldn't be here but know I belong"", 'created': 1467792129.0}"
2016-07-06 02:05:51,4rg8w2,7,7,"I've seen a lot of hate towards nonbinary people, and sometimes it really makes me wanna scream. It's really upsetting. I just don't understand why people view us so negatively. 

How do you ignore the hate and stay positive?",genderfluid,How do you deal with hate?,1467795951.0,"{'created_utc': 1467770751, 'id': '4rg8w2', 'num_comments': 7, 'score': 7, 'selftext': ""I've seen a lot of hate towards nonbinary people, and sometimes it really makes me wanna scream. It's really upsetting. I just don't understand why people view us so negatively. \n\nHow do you ignore the hate and stay positive?"", 'subreddit': 'genderfluid', 'title': 'How do you deal with hate?', 'created': 1467795951.0}"
2016-07-06 23:12:10,4rlcka,2,26,,genderfluid,First time feeling non binary.. thoughts?,1467871930.0,"{'created_utc': 1467846730, 'id': '4rlcka', 'num_comments': 2, 'score': 26, 'selftext': '', 'subreddit': 'genderfluid', 'title': 'First time feeling non binary.. thoughts?', 'created': 1467871930.0}"
2016-07-06 23:43:21,4rlhp2,1,8,"So when I experience gender dysphoria I don't want to wear feminine clothes, etc. (I'm AMAB) I just feel like I should have a vagina and don't like looking at my penis and I'm much more emotional and effeminate. No desire to wear dresses though. It's purely physical. I also have no desire for different pronouns or anything female. My sexual attraction shifts a bit to being more open to liking men, but not fully. I'm usually male except when I talk to some people. Is this common?",genderfluid,All of my dysphoria is physical and none of it is cultural. Can anyone relate?,1467873801.0,"{'created_utc': 1467848601, 'id': '4rlhp2', 'num_comments': 1, 'score': 8, 'selftext': ""So when I experience gender dysphoria I don't want to wear feminine clothes, etc. (I'm AMAB) I just feel like I should have a vagina and don't like looking at my penis and I'm much more emotional and effeminate. No desire to wear dresses though. It's purely physical. I also have no desire for different pronouns or anything female. My sexual attraction shifts a bit to being more open to liking men, but not fully. I'm usually male except when I talk to some people. Is this common?"", 'subreddit': 'genderfluid', 'title': 'All of my dysphoria is physical and none of it is cultural. Can anyone relate?', 'created': 1467873801.0}"
2016-07-07 00:16:35,4rln0g,8,35,,genderfluid,An album of masculine photos b/c I bought 'male' underwear for the first time (plus it's Star Wars underwear!),1467875795.0,"{'created_utc': 1467850595, 'id': '4rln0g', 'num_comments': 8, 'score': 35, 'selftext': '', 'subreddit': 'genderfluid', 'title': ""An album of masculine photos b/c I bought 'male' underwear for the first time (plus it's Star Wars underwear!)"", 'created': 1467875795.0}"
2016-07-07 18:23:51,4rq3ec,5,5,"Hi all, I'm IMAB and I've always enjoyed having long hair and I've been growing it out without styling it for the past three years. Anyways, I'm looking for a sort of more 'girly' hairstyle which can also be worn on men without seeming too feminine (sadly, I'm super insecure and I don't really intend on telling many people about this side of me). Many thanks for any help in advance!

[Here's some pics of me for reference](https://www.imgur.com/a/QHjeA)",genderfluid,Looking for slightly androgynous hair suggestions!,1467941031.0,"{'created_utc': 1467915831, 'id': '4rq3ec', 'num_comments': 5, 'score': 5, 'selftext': ""Hi all, I'm IMAB and I've always enjoyed having long hair and I've been growing it out without styling it for the past three years. Anyways, I'm looking for a sort of more 'girly' hairstyle which can also be worn on men without seeming too feminine (sadly, I'm super insecure and I don't really intend on telling many people about this side of me). Many thanks for any help in advance!\n\n[Here's some pics of me for reference](https://www.imgur.com/a/QHjeA)"", 'subreddit': 'genderfluid', 'title': 'Looking for slightly androgynous hair suggestions!', 'created': 1467941031.0}"
2016-07-08 04:07:51,4rsto1,7,6,[deleted],genderfluid,Chest binding for someone not transitioning...?,1467976071.0,"{'created_utc': 1467950871, 'id': '4rsto1', 'num_comments': 7, 'score': 6, 'selftext': '[deleted]', 'subreddit': 'genderfluid', 'title': 'Chest binding for someone not transitioning...?', 'created': 1467976071.0}"
