created_utc,id,num_comments,score,selftext,subreddit,title,created,d_
2012-02-11 03:25:33,pkbwc,6,6,"So, I have been following this subreddit for a bit now, from when I was still only questioning and not really sure. All my life I haven't really felt...male. Not entirely male at least. I always wanted to look more feminine when I was younger. I had long hair when I was wee and often got made fun of for it. Always felt more comfortable playing female characters in games. Things like that. Often wanted to try out women's clothes. I tried to put it out of my mind and not really think about it. 

After meeting my husband and learning more about trans people (since he is a transdude), I idly wondered if maybe I was trans. But it just didn't...feel right to me. I don't want to be a woman. I just don't really want to be just a male either. I want to be both sort of. Or neither. Something.

Things didn't really fully click for me until I talked to an old friend I hadn't seen in ages and found out she had actually recently figured out she was genderqueer. And had felt pretty much exactly like I had. Since then I've just felt so much better about life. Things make more sense. I can be who I want to be.

So, thank you for this community and for all you wonderful people. And for who I talked to about this. You know who you are.",genderqueer,An Introduction and a Thanks,1328955933.0,"{'created_utc': 1328930733, 'id': 'pkbwc', 'num_comments': 6, 'score': 6, 'selftext': ""So, I have been following this subreddit for a bit now, from when I was still only questioning and not really sure. All my life I haven't really felt...male. Not entirely male at least. I always wanted to look more feminine when I was younger. I had long hair when I was wee and often got made fun of for it. Always felt more comfortable playing female characters in games. Things like that. Often wanted to try out women's clothes. I tried to put it out of my mind and not really think about it. \n\nAfter meeting my husband and learning more about trans people (since he is a transdude), I idly wondered if maybe I was trans. But it just didn't...feel right to me. I don't want to be a woman. I just don't really want to be just a male either. I want to be both sort of. Or neither. Something.\n\nThings didn't really fully click for me until I talked to an old friend I hadn't seen in ages and found out she had actually recently figured out she was genderqueer. And had felt pretty much exactly like I had. Since then I've just felt so much better about life. Things make more sense. I can be who I want to be.\n\nSo, thank you for this community and for all you wonderful people. And for who I talked to about this. You know who you are."", 'subreddit': 'genderqueer', 'title': 'An Introduction and a Thanks', 'created': 1328955933.0}"
2012-02-11 16:47:51,pkvnd,12,18,"I've recently, in the last two or three months, come to the conclusion that I'm genderqueer. I'm an extremely weird person by nature, and my ""gender identity"" shifts from the very femme to androgynous and even masculine seemingly at random. It's always how I've been, ever since I was very little - gender never made much sense to me, which is, I think, the only real nugget of wisdom my biological mother ever imparted on me.

Three and a half years ago I started medically transitioning. My body identity had always been primarily female, even with a fluid gender identity. Thankfully, my doctor had been exposed to enough of the downtown queer community to ""get it"" somewhat, and didn't mind that I wasn't a ""hardline"" trans woman, or that I dressed like a tomboy who didn't give a fuck. However, I was lost, and didn't know anything about anything, so she recommended me to a couple of trans groups. From there, I fell into a crowd of hardline trans women.

Big mistake.

At first they accepted me, and were even my friends. For a while, it was good. After a little while, though, the questions started coming out and they started asking me when I was going to get the surgery, why I wasn't dressing more femininely or wearing makeup, and so on. They warned me that my doctor may even strip my HRT away from me if I didn't ""smarten up"" and start being hardline right then and there. They told me being ""genderqueer"" is just what those 18 year old first-year college students taking Women's Studies do, and that it's just a fad/trend for them, and they'll NEVER understand what being a REAL transperson was. Hell, they even went after the people who used the term ""trans woman,"" because ""trans"" is a bad word that should be erased. 

They were extremely catty, and I'd even say abusive near the end. Unless I was going to go stealth, they didn't want to hear about it. Eventually, they betrayed me and hung me out to dry, but not before instilling a metric ton of internalized transphobia and queerphobia. For a while I was miserable. I wanted to present however I wanted, but I was TERRIFIED of my doctor revoking my HRT, or never qualifying for SRS since dressing like a tomboy wouldn't be considered ""full time,"" even though SRS was, originally, the last thing that was on my mind. At that point, I was feeling a lot of anxieties that weren't even mine. 

At Burning Man 2011, though, the few GQ people that I knew went completely naked... and nobody gave a fuck. In fact, some people came up to them and said their bravery was inspiring, knowing full well how society at large treats gender-variant people. Eventually, I went topless there, and stopped giving a fuck myself, and two and half years of emotional conditioning just kinda unravelled all at once.

So, at this point, I don't really care if I'm ""Trans Enough."" I also don't care if people consider me trendy - this is how I've felt for 14-15 years at this point, so fuck it. Is it even a trend anymore when it lasts a lifetime? I'm going to present however I like, dye my hair, not wear makeup, and use whatever pitch of voice feels comfortable for me at the time. I have more important things to do than constantly re-evaluate my gender presentation. 

I don't actually hate the trans women I used to hang out with. I know they have their problems, and that most of the vile crap they spewed at me was internalized transphobia as well. I just hope this story inspires anyone else who was in my situation to stop giving so much of a fuck, and do what feels right. :)",genderqueer,"MtFtGQ: or, how I'm not a true scotsman, and I don't care",1329004071.0,"{'created_utc': 1328978871, 'id': 'pkvnd', 'num_comments': 12, 'score': 18, 'selftext': 'I\'ve recently, in the last two or three months, come to the conclusion that I\'m genderqueer. I\'m an extremely weird person by nature, and my ""gender identity"" shifts from the very femme to androgynous and even masculine seemingly at random. It\'s always how I\'ve been, ever since I was very little - gender never made much sense to me, which is, I think, the only real nugget of wisdom my biological mother ever imparted on me.\n\nThree and a half years ago I started medically transitioning. My body identity had always been primarily female, even with a fluid gender identity. Thankfully, my doctor had been exposed to enough of the downtown queer community to ""get it"" somewhat, and didn\'t mind that I wasn\'t a ""hardline"" trans woman, or that I dressed like a tomboy who didn\'t give a fuck. However, I was lost, and didn\'t know anything about anything, so she recommended me to a couple of trans groups. From there, I fell into a crowd of hardline trans women.\n\nBig mistake.\n\nAt first they accepted me, and were even my friends. For a while, it was good. After a little while, though, the questions started coming out and they started asking me when I was going to get the surgery, why I wasn\'t dressing more femininely or wearing makeup, and so on. They warned me that my doctor may even strip my HRT away from me if I didn\'t ""smarten up"" and start being hardline right then and there. They told me being ""genderqueer"" is just what those 18 year old first-year college students taking Women\'s Studies do, and that it\'s just a fad/trend for them, and they\'ll NEVER understand what being a REAL transperson was. Hell, they even went after the people who used the term ""trans woman,"" because ""trans"" is a bad word that should be erased. \n\nThey were extremely catty, and I\'d even say abusive near the end. Unless I was going to go stealth, they didn\'t want to hear about it. Eventually, they betrayed me and hung me out to dry, but not before instilling a metric ton of internalized transphobia and queerphobia. For a while I was miserable. I wanted to present however I wanted, but I was TERRIFIED of my doctor revoking my HRT, or never qualifying for SRS since dressing like a tomboy wouldn\'t be considered ""full time,"" even though SRS was, originally, the last thing that was on my mind. At that point, I was feeling a lot of anxieties that weren\'t even mine. \n\nAt Burning Man 2011, though, the few GQ people that I knew went completely naked... and nobody gave a fuck. In fact, some people came up to them and said their bravery was inspiring, knowing full well how society at large treats gender-variant people. Eventually, I went topless there, and stopped giving a fuck myself, and two and half years of emotional conditioning just kinda unravelled all at once.\n\nSo, at this point, I don\'t really care if I\'m ""Trans Enough."" I also don\'t care if people consider me trendy - this is how I\'ve felt for 14-15 years at this point, so fuck it. Is it even a trend anymore when it lasts a lifetime? I\'m going to present however I like, dye my hair, not wear makeup, and use whatever pitch of voice feels comfortable for me at the time. I have more important things to do than constantly re-evaluate my gender presentation. \n\nI don\'t actually hate the trans women I used to hang out with. I know they have their problems, and that most of the vile crap they spewed at me was internalized transphobia as well. I just hope this story inspires anyone else who was in my situation to stop giving so much of a fuck, and do what feels right. :)', 'subreddit': 'genderqueer', 'title': ""MtFtGQ: or, how I'm not a true scotsman, and I don't care"", 'created': 1329004071.0}"
2012-02-11 19:22:32,pl1so,18,20,,genderqueer,"Cross dressing high school students could be force to wear ""gender appropriate"" clothes in a VA school district",1329013352.0,"{'created_utc': 1328988152, 'id': 'pl1so', 'num_comments': 18, 'score': 20, 'selftext': '', 'subreddit': 'genderqueer', 'title': 'Cross dressing high school students could be force to wear ""gender appropriate"" clothes in a VA school district', 'created': 1329013352.0}"
2012-02-12 14:17:01,pm1h8,12,15,"Bear with me, this is going to take some time. I work for an online gaming site, and basically I'm in a room with about 200-odd people at any given time, trying to keep them entertained etc. This morning, shortly after arriving into work I was treated to a bunch of abuse off of some players after another Host called me a 'heshe' in chat.

I am Genderqueer, and have never said I am male or female on-site as it's never been brought up in the 2years I have been hosting. It went on for over an hour, being called a 'heshe' and a f'reak'/'weirdo' etc. It really, really got to me and I spent over 20mins in the toilets in tears. Turns out, 2 other members of staff had been calling me a 'heshe' to our members, finding it hilarious. I honestly don't know what to do. My boss isn't the most understanding person and I'm afraid if I say anything I will be reprimanded for it.

Sorry Reddit, I really don't know where else to turn.

EDIT: A member actually just came on-site to purposely find me and ask if I was okay, apparently she had been onto our website's FB group and it's all kicking off on there about me. Loads of members are sticking up for me, saying how these 2 members of staff should've have said what they did, and accusing them of bullying. I can't believe how much it has kicked off.

EDIT2: Thank you for all of your responses and kind words. I am off work now until Friday, but have agreed to go in if needed for a meeting or anything. I'll keep you guys updated with anything that happens.

UPDATE: I got pulled into a meeting yesterday to tell me that management ARE taking what happened very seriously, and when I'm back in on Tuesday I have a meeting with HR. Again, thanks for the kind, wise and supportive words Reddit.


EDIT 3: Well, after a week or so of being told ""It's being dealt with..."" I've been told that no action is being taken. I've asked why not, and I've been told because the guy in question said he was answering a question if I was male or female.
I hate myself for backing down, and I don't know how else to react, but yeah I've had to just let it go.
I've even moved onto the nightshift at work so I don't have to have much (if any) contact with him.

Thank you again for all of your support, Reddit, it means a lot. ",genderqueer,What happened at work (XPost from r/lgbt),1329081421.0,"{'created_utc': 1329056221, 'id': 'pm1h8', 'num_comments': 12, 'score': 15, 'selftext': 'Bear with me, this is going to take some time. I work for an online gaming site, and basically I\'m in a room with about 200-odd people at any given time, trying to keep them entertained etc. This morning, shortly after arriving into work I was treated to a bunch of abuse off of some players after another Host called me a \'heshe\' in chat.\n\nI am Genderqueer, and have never said I am male or female on-site as it\'s never been brought up in the 2years I have been hosting. It went on for over an hour, being called a \'heshe\' and a f\'reak\'/\'weirdo\' etc. It really, really got to me and I spent over 20mins in the toilets in tears. Turns out, 2 other members of staff had been calling me a \'heshe\' to our members, finding it hilarious. I honestly don\'t know what to do. My boss isn\'t the most understanding person and I\'m afraid if I say anything I will be reprimanded for it.\n\nSorry Reddit, I really don\'t know where else to turn.\n\nEDIT: A member actually just came on-site to purposely find me and ask if I was okay, apparently she had been onto our website\'s FB group and it\'s all kicking off on there about me. Loads of members are sticking up for me, saying how these 2 members of staff should\'ve have said what they did, and accusing them of bullying. I can\'t believe how much it has kicked off.\n\nEDIT2: Thank you for all of your responses and kind words. I am off work now until Friday, but have agreed to go in if needed for a meeting or anything. I\'ll keep you guys updated with anything that happens.\n\nUPDATE: I got pulled into a meeting yesterday to tell me that management ARE taking what happened very seriously, and when I\'m back in on Tuesday I have a meeting with HR. Again, thanks for the kind, wise and supportive words Reddit.\n\n\nEDIT 3: Well, after a week or so of being told ""It\'s being dealt with..."" I\'ve been told that no action is being taken. I\'ve asked why not, and I\'ve been told because the guy in question said he was answering a question if I was male or female.\nI hate myself for backing down, and I don\'t know how else to react, but yeah I\'ve had to just let it go.\nI\'ve even moved onto the nightshift at work so I don\'t have to have much (if any) contact with him.\n\nThank you again for all of your support, Reddit, it means a lot. ', 'subreddit': 'genderqueer', 'title': 'What happened at work (XPost from r/lgbt)', 'created': 1329081421.0}"
2012-02-12 21:48:13,pmief,0,7,,genderqueer,This song seems very...fitting for being GQ.,1329108493.0,"{'created_utc': 1329083293, 'id': 'pmief', 'num_comments': 0, 'score': 7, 'selftext': '', 'subreddit': 'genderqueer', 'title': 'This song seems very...fitting for being GQ.', 'created': 1329108493.0}"
2012-02-13 14:45:12,pnhqz,1,0,,genderqueer,Valentine's Getaway (X-posted from r/lgbt),1329169512.0,"{'created_utc': 1329144312, 'id': 'pnhqz', 'num_comments': 1, 'score': 0, 'selftext': '', 'subreddit': 'genderqueer', 'title': ""Valentine's Getaway (X-posted from r/lgbt)"", 'created': 1329169512.0}"
2012-02-14 03:55:41,poku4,16,13,"I'm born female and genderqueer. Most folks that really know me, know this, but if you just looked at me, I'd probably look like a tom boy, boyish, or kind of dykey. Which is cool.

I have this friend who identifies as male, trans, and going to towards female. They've been doing this for a really long time, and are self identified experts. However, when they learned of my being genderqueer, they have been almost competing with me, and undercutting my gender identity regularly. 

This last event was when I had to go get some blood draws to check my hormone levels. (I had some problems with the girl parts, and they were trouble shooting.) Surprisingly I came up with some atypical values. Higher than average T for someone who has a more feminine look. I posted this because I'm really open, and everyone was joking about maybe I really am just that much of a man. I could care less, and turns out it wasn't the problem they were looking for, so shrug. 

My buddy came on, and then started nosing around that I'd have to have some unusual characteristics for that to be true, and then asks about my genitals. I respond with a ""what?!""

Then they send me a personal email detailing how my values are probably not really indicative of my gender status at all, and really got condescending. I told them I wasn't questioning their biology, but thought they were asking for my clit size which was way too personal a question to be asking. After that, radio silence.

I am kind of distancing myself from them because we can't talk about gender without them taking this trans authority position. I've been dealing with this my whole life (I'm old), and I think part of their issue is I am not heading to transition. 

How have the rest of you dealt with this kind of thing? I've seen other folks here have similar experiences. I'm seriously thinking of cutting ties at this point. Life is too short to keep getting my gender questioned by someone that should know better. ",genderqueer,They asked about my genitals. ,1329216941.0,"{'created_utc': 1329191741, 'id': 'poku4', 'num_comments': 16, 'score': 13, 'selftext': 'I\'m born female and genderqueer. Most folks that really know me, know this, but if you just looked at me, I\'d probably look like a tom boy, boyish, or kind of dykey. Which is cool.\n\nI have this friend who identifies as male, trans, and going to towards female. They\'ve been doing this for a really long time, and are self identified experts. However, when they learned of my being genderqueer, they have been almost competing with me, and undercutting my gender identity regularly. \n\nThis last event was when I had to go get some blood draws to check my hormone levels. (I had some problems with the girl parts, and they were trouble shooting.) Surprisingly I came up with some atypical values. Higher than average T for someone who has a more feminine look. I posted this because I\'m really open, and everyone was joking about maybe I really am just that much of a man. I could care less, and turns out it wasn\'t the problem they were looking for, so shrug. \n\nMy buddy came on, and then started nosing around that I\'d have to have some unusual characteristics for that to be true, and then asks about my genitals. I respond with a ""what?!""\n\nThen they send me a personal email detailing how my values are probably not really indicative of my gender status at all, and really got condescending. I told them I wasn\'t questioning their biology, but thought they were asking for my clit size which was way too personal a question to be asking. After that, radio silence.\n\nI am kind of distancing myself from them because we can\'t talk about gender without them taking this trans authority position. I\'ve been dealing with this my whole life (I\'m old), and I think part of their issue is I am not heading to transition. \n\nHow have the rest of you dealt with this kind of thing? I\'ve seen other folks here have similar experiences. I\'m seriously thinking of cutting ties at this point. Life is too short to keep getting my gender questioned by someone that should know better. ', 'subreddit': 'genderqueer', 'title': 'They asked about my genitals. ', 'created': 1329216941.0}"
2012-02-14 16:47:45,pp9vn,1,10,,genderqueer,2012 Fashion Week: Gender-bending model Andrej Pejic pushes limits of the runway   - NY Daily News,1329263265.0,"{'created_utc': 1329238065, 'id': 'pp9vn', 'num_comments': 1, 'score': 10, 'selftext': '', 'subreddit': 'genderqueer', 'title': '2012 Fashion Week: Gender-bending model Andrej Pejic pushes limits of the runway \xa0 - NY Daily News', 'created': 1329263265.0}"
2012-02-15 00:14:12,ppwpw,3,9,"So, I was curious about going on HRT. I had been thinking about this prior to the thread about it recently. I read through it, but figured this would be a better place for specific questions I have.

I am male bodied, genderqueer (as you would assume) and want to go on HRT to gain some more feminine characteristics (breasts, more feminine appearance, so forth). I wanted to know if any of you out there have self-medicated and what your stories were. If any of you could help with this? Or if anyone at least could give some tips? My husband made a post about this in [r/transSpace](http://www.reddit.com/r/TransSpace/comments/polbh/hormone_question_self_med_genderqueer_femme/), but I figured this would be a good place to ask about it, too.",genderqueer,DIY HRT?,1329290052.0,"{'created_utc': 1329264852, 'id': 'ppwpw', 'num_comments': 3, 'score': 9, 'selftext': 'So, I was curious about going on HRT. I had been thinking about this prior to the thread about it recently. I read through it, but figured this would be a better place for specific questions I have.\n\nI am male bodied, genderqueer (as you would assume) and want to go on HRT to gain some more feminine characteristics (breasts, more feminine appearance, so forth). I wanted to know if any of you out there have self-medicated and what your stories were. If any of you could help with this? Or if anyone at least could give some tips? My husband made a post about this in [r/transSpace](http://www.reddit.com/r/TransSpace/comments/polbh/hormone_question_self_med_genderqueer_femme/), but I figured this would be a good place to ask about it, too.', 'subreddit': 'genderqueer', 'title': 'DIY HRT?', 'created': 1329290052.0}"
2012-02-15 10:04:20,pqjgv,5,5,"I'd like to know if anyone around here either uses it as a gender identity or knows someone who does, and if so, what does it mean to them?

To give the question some more context, I should probably speak a little about myself. I've identified as androgynous for four years, since I first heard the term. Whether because I never had a proper understanding of the identity or because common usage has changed, it now seems to refer to those who are equally male and female exclusively. While I certainly have qualities of both being male and female, I've never seen myself as being in-between the two, but separate and simply sharing some qualities.

I ask about the word epicene and it's potential usage as an identity because I want an easier way to explain who I am to people without feeling restricted or being incorrectly defined by the word I use. Any help would be appreciated, as would other identities you think I should look into to see if they fit me.

Edit: As an additional question, how do you define androgyny as an identity?",genderqueer,What does it mean to be epicene?,1329325460.0,"{'created_utc': 1329300260, 'id': 'pqjgv', 'num_comments': 5, 'score': 5, 'selftext': ""I'd like to know if anyone around here either uses it as a gender identity or knows someone who does, and if so, what does it mean to them?\n\nTo give the question some more context, I should probably speak a little about myself. I've identified as androgynous for four years, since I first heard the term. Whether because I never had a proper understanding of the identity or because common usage has changed, it now seems to refer to those who are equally male and female exclusively. While I certainly have qualities of both being male and female, I've never seen myself as being in-between the two, but separate and simply sharing some qualities.\n\nI ask about the word epicene and it's potential usage as an identity because I want an easier way to explain who I am to people without feeling restricted or being incorrectly defined by the word I use. Any help would be appreciated, as would other identities you think I should look into to see if they fit me.\n\nEdit: As an additional question, how do you define androgyny as an identity?"", 'subreddit': 'genderqueer', 'title': 'What does it mean to be epicene?', 'created': 1329325460.0}"
2012-02-16 13:27:08,ps9is,0,1,,genderqueer,Gender Animatic,1329424028.0,"{'created_utc': 1329398828, 'id': 'ps9is', 'num_comments': 0, 'score': 1, 'selftext': '', 'subreddit': 'genderqueer', 'title': 'Gender Animatic', 'created': 1329424028.0}"
2012-02-17 05:36:53,pti8e,0,18,,genderqueer,"TIL of a group of genderqueers in the 1700's. ""There is indeed a kind of animal, neither male nor female, a thing of the neuter gender, lately started up among us.""",1329482213.0,"{'created_utc': 1329457013, 'id': 'pti8e', 'num_comments': 0, 'score': 18, 'selftext': '', 'subreddit': 'genderqueer', 'title': 'TIL of a group of genderqueers in the 1700\'s. ""There is indeed a kind of animal, neither male nor female, a thing of the neuter gender, lately started up among us.""', 'created': 1329482213.0}"
