created_utc,id,num_comments,score,selftext,subreddit,title,created,d_
2012-02-25 12:01:15,q5dif,4,6,"So, as I always do, I've been thinking about transitioning. Not all the way, though. And that's sort of the problem; I don't want to go all the way, which sort of makes it a little more difficult. 

As usual, it basically boils down to wanting to look more feminine, but being afraid of what hormones will do to my dick. I'm very worried about infertility, since I don't really have the kind of money to bank sperm, and I'd rather do it the old fashioned way. The lessened erections are troubling, although sometimes I think a lowered sex drive would be good. No random boners and I already fap way too much. The breasts are... well, as long as they stayed small I definitely wouldn't mind them, but they'd probably be a bit troublesome.

I'm definitely not going to act on anything until at least next year, but this is the kind of thing where careful consideration is necessary. Or I continue to debate and get hairier and chinnier.

~~I'm interested to hear what other people have to say, and their experiences, especially the genderqueer folk. I'll x-post this over there.~~No need to copy that part, derp",genderqueer,"To transition or not, that is the question... ",1330196475.0,"{'created_utc': 1330171275, 'id': 'q5dif', 'num_comments': 4, 'score': 6, 'selftext': ""So, as I always do, I've been thinking about transitioning. Not all the way, though. And that's sort of the problem; I don't want to go all the way, which sort of makes it a little more difficult. \n\nAs usual, it basically boils down to wanting to look more feminine, but being afraid of what hormones will do to my dick. I'm very worried about infertility, since I don't really have the kind of money to bank sperm, and I'd rather do it the old fashioned way. The lessened erections are troubling, although sometimes I think a lowered sex drive would be good. No random boners and I already fap way too much. The breasts are... well, as long as they stayed small I definitely wouldn't mind them, but they'd probably be a bit troublesome.\n\nI'm definitely not going to act on anything until at least next year, but this is the kind of thing where careful consideration is necessary. Or I continue to debate and get hairier and chinnier.\n\n~~I'm interested to hear what other people have to say, and their experiences, especially the genderqueer folk. I'll x-post this over there.~~No need to copy that part, derp"", 'subreddit': 'genderqueer', 'title': 'To transition or not, that is the question... ', 'created': 1330196475.0}"
2012-02-25 16:32:45,q5juc,10,6,,genderqueer,Article on one man's journey on transitioning back . Thoughts?,1330212765.0,"{'created_utc': 1330187565, 'id': 'q5juc', 'num_comments': 10, 'score': 6, 'selftext': '', 'subreddit': 'genderqueer', 'title': ""Article on one man's journey on transitioning back . Thoughts?"", 'created': 1330212765.0}"
2012-02-26 07:06:48,q6h3q,9,60,,genderqueer,"I finally cut off all my hair today, and I'm starting to feel more like myself. Just wanted to share.",1330265208.0,"{'created_utc': 1330240008, 'id': 'q6h3q', 'num_comments': 9, 'score': 60, 'selftext': '', 'subreddit': 'genderqueer', 'title': ""I finally cut off all my hair today, and I'm starting to feel more like myself. Just wanted to share."", 'created': 1330265208.0}"
2012-02-27 05:04:31,q7ph2,13,12,,genderqueer,Meta: a new trans* and genderqueer magazine (x-posted from /r/transgender),1330344271.0,"{'created_utc': 1330319071, 'id': 'q7ph2', 'num_comments': 13, 'score': 12, 'selftext': '', 'subreddit': 'genderqueer', 'title': 'Meta: a new trans* and genderqueer magazine (x-posted from /r/transgender)', 'created': 1330344271.0}"
2012-02-27 06:23:20,q7sm1,0,11,,genderqueer,Where Are All the Nonbinary Parents? And Children?  – [Xposted from r/transgender],1330349000.0,"{'created_utc': 1330323800, 'id': 'q7sm1', 'num_comments': 0, 'score': 11, 'selftext': '', 'subreddit': 'genderqueer', 'title': 'Where Are All the Nonbinary Parents? And Children?  – [Xposted from r/transgender]', 'created': 1330349000.0}"
2012-02-28 08:09:04,q9grz,0,5,,genderqueer,Read this and other stories from genderqueer people's lives on this website,1330441744.0,"{'created_utc': 1330416544, 'id': 'q9grz', 'num_comments': 0, 'score': 5, 'selftext': '', 'subreddit': 'genderqueer', 'title': ""Read this and other stories from genderqueer people's lives on this website"", 'created': 1330441744.0}"
2012-02-28 11:33:21,q9ksh,21,12,"Hello fellow 'queers. I've been thinking about the issue of having children in the relatively near future. As an androgyne, I've dealt with gender-neutral language in the past, but until now I've never thought about first-person gender-neutral words for parents. Is there such a thing as a gender-neutral ""Mom/Dad""? I wouldn't like the idea of my kids calling me by my first name, and being called ""Mom"" or ""Dad"" would be wrong too. Is there perhaps a foreign language option kicking around? I'm curious to know how any GQ parents have handled this.",genderqueer,"Genderqueer, with children?",1330454001.0,"{'created_utc': 1330428801, 'id': 'q9ksh', 'num_comments': 21, 'score': 12, 'selftext': 'Hello fellow \'queers. I\'ve been thinking about the issue of having children in the relatively near future. As an androgyne, I\'ve dealt with gender-neutral language in the past, but until now I\'ve never thought about first-person gender-neutral words for parents. Is there such a thing as a gender-neutral ""Mom/Dad""? I wouldn\'t like the idea of my kids calling me by my first name, and being called ""Mom"" or ""Dad"" would be wrong too. Is there perhaps a foreign language option kicking around? I\'m curious to know how any GQ parents have handled this.', 'subreddit': 'genderqueer', 'title': 'Genderqueer, with children?', 'created': 1330454001.0}"
2012-02-28 23:52:15,qafzb,3,2,,genderqueer,Artistic Freestyle Contest (Win 10$ USD) : AmIASexyQueer,1330498335.0,"{'created_utc': 1330473135, 'id': 'qafzb', 'num_comments': 3, 'score': 2, 'selftext': '', 'subreddit': 'genderqueer', 'title': 'Artistic Freestyle Contest (Win 10$ USD) : AmIASexyQueer', 'created': 1330498335.0}"
2012-02-29 04:41:08,qausy,7,28,"Over the past few months, I've stared coming to terms with the fact that I'm not male or female. The whole thing is and has been confusing for me, but at the same time, it makes me feel a lot better because it explains a lot of the ways I felt when I was a child, and it fits in with the fact that I've always felt like it wouldn't have mattered if I had been born a different gender because my gender and my sexuality (pansexual) would still be the same.

That being said, I'm not out of the closet yet and I am definitely not ready to come out of the closet for this. It took me a while to become comfortable enough with my sexuality to come out with that (and I'm out mostly as bisexual at that), and that's something that I feel like society understands a little bit more than gender identity. I present as one gender (female; I'm AFAB).

I guess what I'm trying to say is that I feel like people only give me space to either be masculine or feminine, and if I want to present a more masculine side of myself, I can't because people can't seem to understand the idea of being both masculine and feminine. Am I imagining this, or is this a legitimate thing? It's just so frustrating when the people in my life have a sort of ""well aren't you a cute little girl for trying to like manly things"" attitude when I'm as much of a man as I am a woman. Yeah, I have a very feminine figure and yeah, I like a lot of traditionally feminine things (dresses and makeup!), but I can still like those things and be masculine too. Is this a normal way to feel? And does it get any easier coming to terms with things like this?

I've been lurking a bit on this sub and you guys have been really great about giving advice/being generally friendly to posters here. I hope you can do the same for me. I really, really appreciate it. Like I said, I'm very closeted so I have no one to talk to about this, so it's rather isolating.",genderqueer,"It's like I'm not allowed to be both masculine and feminine, but I hate the idea of having to choose one. Can anyone relate?",1330515668.0,"{'created_utc': 1330490468, 'id': 'qausy', 'num_comments': 7, 'score': 28, 'selftext': 'Over the past few months, I\'ve stared coming to terms with the fact that I\'m not male or female. The whole thing is and has been confusing for me, but at the same time, it makes me feel a lot better because it explains a lot of the ways I felt when I was a child, and it fits in with the fact that I\'ve always felt like it wouldn\'t have mattered if I had been born a different gender because my gender and my sexuality (pansexual) would still be the same.\n\nThat being said, I\'m not out of the closet yet and I am definitely not ready to come out of the closet for this. It took me a while to become comfortable enough with my sexuality to come out with that (and I\'m out mostly as bisexual at that), and that\'s something that I feel like society understands a little bit more than gender identity. I present as one gender (female; I\'m AFAB).\n\nI guess what I\'m trying to say is that I feel like people only give me space to either be masculine or feminine, and if I want to present a more masculine side of myself, I can\'t because people can\'t seem to understand the idea of being both masculine and feminine. Am I imagining this, or is this a legitimate thing? It\'s just so frustrating when the people in my life have a sort of ""well aren\'t you a cute little girl for trying to like manly things"" attitude when I\'m as much of a man as I am a woman. Yeah, I have a very feminine figure and yeah, I like a lot of traditionally feminine things (dresses and makeup!), but I can still like those things and be masculine too. Is this a normal way to feel? And does it get any easier coming to terms with things like this?\n\nI\'ve been lurking a bit on this sub and you guys have been really great about giving advice/being generally friendly to posters here. I hope you can do the same for me. I really, really appreciate it. Like I said, I\'m very closeted so I have no one to talk to about this, so it\'s rather isolating.', 'subreddit': 'genderqueer', 'title': ""It's like I'm not allowed to be both masculine and feminine, but I hate the idea of having to choose one. Can anyone relate?"", 'created': 1330515668.0}"
2012-02-29 13:43:34,qba19,0,6,,genderqueer,So here's a blog post I wrote about a wonderful article I just read on gender bullying in 1st grade. Link to original article in the post.,1330548214.0,"{'created_utc': 1330523014, 'id': 'qba19', 'num_comments': 0, 'score': 6, 'selftext': '', 'subreddit': 'genderqueer', 'title': ""So here's a blog post I wrote about a wonderful article I just read on gender bullying in 1st grade. Link to original article in the post."", 'created': 1330548214.0}"
2012-02-29 22:51:26,qc03q,1,25,,genderqueer,"Pink Brain, Blue Brain - Claims of sex differences fall apart",1330581086.0,"{'created_utc': 1330555886, 'id': 'qc03q', 'num_comments': 1, 'score': 25, 'selftext': '', 'subreddit': 'genderqueer', 'title': 'Pink Brain, Blue Brain - Claims of sex differences fall apart', 'created': 1330581086.0}"
