created_utc,id,num_comments,score,selftext,subreddit,title,created,d_
2012-02-01 01:44:34,p5g4n,4,7,"I have been lurking (on all of reddit) for quite some time.  Trying to soak up information.  I am questioning my gender identity but I feel a bit overwhelmed with the information on some online resources.   I don't quite understand all of the terms being thrown around and how the inter-relate.  genderqueer, intersex, dual gendered, dual spirit, transgender, cis (understand that relatively well).  

I start reading topics on line and find myself reading in circles.  I have joined forums and read up, but nothing seems to cover my issues.  I am too shy and too embarrassed to post.  I feel I don't know what I am talking about and will be unable to convey my message or ask tons of stupid questions. 

So I have a basic question.  What are some good online resources and/or information to start reading?",genderqueer,Online resources?,1328085874.0,"{'created_utc': 1328060674, 'id': 'p5g4n', 'num_comments': 4, 'score': 7, 'selftext': ""I have been lurking (on all of reddit) for quite some time.  Trying to soak up information.  I am questioning my gender identity but I feel a bit overwhelmed with the information on some online resources.   I don't quite understand all of the terms being thrown around and how the inter-relate.  genderqueer, intersex, dual gendered, dual spirit, transgender, cis (understand that relatively well).  \n\nI start reading topics on line and find myself reading in circles.  I have joined forums and read up, but nothing seems to cover my issues.  I am too shy and too embarrassed to post.  I feel I don't know what I am talking about and will be unable to convey my message or ask tons of stupid questions. \n\nSo I have a basic question.  What are some good online resources and/or information to start reading?"", 'subreddit': 'genderqueer', 'title': 'Online resources?', 'created': 1328085874.0}"
2012-02-01 15:07:00,p665f,10,21,"So, I've only just recently heard about this concept, but it interests me a great deal.  I've been trying to look into it more, but I still can't tell if this is the most general thing ever, or a specific type of identity.  

In my head I've always considered myself a guy with tits.  I'm a lesbian, I have mostly male friends, I generally feel more comfortable around men, I prefer to wear men's clothing, and most of my mannerisms are on the masculine side.  Although I am biologically female, I've never really considered myself a woman, and I don't believe I ever will. However, I also don't feel the need to transition.  I don't want to be a man, I'm just a guy.  This all seemed perfectly normal to me and I never really thought to question it any further.

Then one day, I said something to a female friend, and she didn't follow where I was going at all.  I jokingly responded ""I guess it's just a guy thing"" and she told me that it couldn't be a ""guy thing"" because I'm not a guy.  I don't think I've ever felt so offended by any comment in all my life, but I couldn't really articulate why.  When I tried to explain how I felt, she asked me if I was trans.  I had never really thought that being a guy made me trans, because I don't want to become a man in a physical sense.  

After that, I did a lot of thinking about genders and how I identify and where I belong.  When I first heard the term genderqueer, I thought I found my answer, but the more I try to understand, the less I feel like I do.  Am I close, or am I in the complete wrong place?",genderqueer,Some help for the new guy?,1328134020.0,"{'created_utc': 1328108820, 'id': 'p665f', 'num_comments': 10, 'score': 21, 'selftext': 'So, I\'ve only just recently heard about this concept, but it interests me a great deal.  I\'ve been trying to look into it more, but I still can\'t tell if this is the most general thing ever, or a specific type of identity.  \n\nIn my head I\'ve always considered myself a guy with tits.  I\'m a lesbian, I have mostly male friends, I generally feel more comfortable around men, I prefer to wear men\'s clothing, and most of my mannerisms are on the masculine side.  Although I am biologically female, I\'ve never really considered myself a woman, and I don\'t believe I ever will. However, I also don\'t feel the need to transition.  I don\'t want to be a man, I\'m just a guy.  This all seemed perfectly normal to me and I never really thought to question it any further.\n\nThen one day, I said something to a female friend, and she didn\'t follow where I was going at all.  I jokingly responded ""I guess it\'s just a guy thing"" and she told me that it couldn\'t be a ""guy thing"" because I\'m not a guy.  I don\'t think I\'ve ever felt so offended by any comment in all my life, but I couldn\'t really articulate why.  When I tried to explain how I felt, she asked me if I was trans.  I had never really thought that being a guy made me trans, because I don\'t want to become a man in a physical sense.  \n\nAfter that, I did a lot of thinking about genders and how I identify and where I belong.  When I first heard the term genderqueer, I thought I found my answer, but the more I try to understand, the less I feel like I do.  Am I close, or am I in the complete wrong place?', 'subreddit': 'genderqueer', 'title': 'Some help for the new guy?', 'created': 1328134020.0}"
2012-02-03 05:10:15,p8v5f,0,4,,genderqueer,"The Magnetic Fields' new single ""Andrew in Drag"" about a straight guy who falls madly in love with the drag persona of his straight friend Andrew",1328271015.0,"{'created_utc': 1328245815, 'id': 'p8v5f', 'num_comments': 0, 'score': 4, 'selftext': '', 'subreddit': 'genderqueer', 'title': 'The Magnetic Fields\' new single ""Andrew in Drag"" about a straight guy who falls madly in love with the drag persona of his straight friend Andrew', 'created': 1328271015.0}"
2012-02-04 14:30:06,pamwj,8,28,,genderqueer,That feeling... (X/Post TransSpace and F7U12),1328391006.0,"{'created_utc': 1328365806, 'id': 'pamwj', 'num_comments': 8, 'score': 28, 'selftext': '', 'subreddit': 'genderqueer', 'title': 'That feeling... (X/Post TransSpace and F7U12)', 'created': 1328391006.0}"
2012-02-04 20:21:37,payx1,0,1,,genderqueer,"Trans-Genderqueer ☿ techies+hackers+artists collective in NYC? – this craigslist post wants to form one, I guess?",1328412097.0,"{'created_utc': 1328386897, 'id': 'payx1', 'num_comments': 0, 'score': 1, 'selftext': '', 'subreddit': 'genderqueer', 'title': 'Trans-Genderqueer ☿ techies+hackers+artists collective in NYC? – this craigslist post wants to form one, I guess?', 'created': 1328412097.0}"
2012-02-05 23:38:27,pcfh0,1,14,,genderqueer,Nonbinary.org,1328510307.0,"{'created_utc': 1328485107, 'id': 'pcfh0', 'num_comments': 1, 'score': 14, 'selftext': '', 'subreddit': 'genderqueer', 'title': 'Nonbinary.org', 'created': 1328510307.0}"
2012-02-06 23:27:02,pdtbf,8,5,"Born male, grew up in a marginally more trans-accepting household than I figure most people do (my parents know the distinction between a person being a tranvestite, being transgendered, and being transexual). Haven't told them yet, but that's its own thing.

I'm genderfluid, tending to float around (supposing we assigned the traditional gender framework to the y-axis of a graph, assigning the positive side to male in accordance with the expectations of others and the negative side to female as it runs counter to others' expectations) a little south of female or just barely north of male, with the time in the middle split between feeling like both or feeling like neither.

I'm only recently coming to terms with this and it's pretty much terrible. In spite of my interest pre-realization-of-genderfluidity, I've never done any sort of genderbending activities; the closest I've gotten was receiving/borrowing-for-a-couple-of-years a super nifty androgynous jacket from a female friend. I don't know what to do to... to bring how I feel in line with how I feel I should feel, I guess is one way of saying it. I'm trying to work up the courage to draft a few of my female friends that I'm out to for assistance, but I don't really know in what way/how to go about... well, hold up, I first of all don't know what to go about. Then we can work back from there.

I kind of want to work towards a general androgyny with the capacity to shift either direction as suits my mood, I guess, but I don't even know what the questions I need to be asking are, much less their answers.",genderqueer,I feel like I'm suffocating in my own fear and hesitation.,1328596022.0,"{'created_utc': 1328570822, 'id': 'pdtbf', 'num_comments': 8, 'score': 5, 'selftext': ""Born male, grew up in a marginally more trans-accepting household than I figure most people do (my parents know the distinction between a \x7fperson being a tranvestite, being transgendered, and being transexual). Haven't told them yet, but that's its own thing.\n\nI'm genderfluid, tending to float around (supposing we assigned the traditional gender framework to the y-axis of a graph, assigning the positive side to male in accordance with the expectations of others and the negative side to female as it runs counter to others' expectations) a little south of female or just barely north of male, with the time in the middle split between feeling like both or feeling like neither.\n\nI'm only recently coming to terms with this and it's pretty much terrible. In spite of my interest pre-realization-of-genderfluidity, I've never done any sort of genderbending activities; the closest I've gotten was receiving/borrowing-for-a-couple-of-years a super nifty androgynous jacket from a female friend. I don't know what to do to... to bring how I feel in line with how I feel I should feel, I guess is one way of saying it. I'm trying to work up the courage to draft a few of my female friends that I'm out to for assistance, but I don't really know in what way/how to go about... well, hold up, I first of all don't know what to go about. Then we can work back from there.\n\nI kind of want to work towards a general androgyny with the capacity to shift either direction as suits my mood, I guess, but I don't even know what the questions I need to be asking are, much less their answers."", 'subreddit': 'genderqueer', 'title': ""I feel like I'm suffocating in my own fear and hesitation."", 'created': 1328596022.0}"
2012-02-07 16:50:45,peu7m,3,8,"It's funny how after hours of thinking I can't think of a better description than ""a little bit weird guy"".

It's probably easiest to just say the definite facts. I'm a bisexual male, notably leaning toward females. And I don't think I have any problems being a guy, physically speaking.

But mentally, well, that's a different question with completely odd answers.

I'm starting to come to terms with the fact that I *have* such thing as a personality.

I could say that it's starting to become clear to me that I have kind of a division between what I physically am, and what I am as a creative entity. My physical side is just what it is. My creative self is just... being creative, I guess.

People probably say that I'm roleplaying or something. I think that's incorrect.

I am a *narrator figure.*

The biggest revelations I've had lately have all had to do with the fact that I'm a writer, and how everything has something to do with the fact. Looking back, I can see that I'm one walking the path of words. My mission in this life is to tell stories. My mission in this life is to provoke thoughts through commentary.

And authors are supposed to distance themselves from the works. Good stories stand on their own. Solid facts stand on their own. But that is not how tales are told. People, surprisingly enough, care about who the author is, even when that's completely irrelevant as far as the story goes.

Which is why I become a narrator of some description.

This is so deeply ingrained in my personality that I can't shake it. I take the garbs of a narrator to make my way through a situation in life. I *become* the narrator. I find it easier to tell some kinds of tales by being a guy. I find it easier to tell some kinds of tales by being a gals. And people may have their expectations of some tales being told by men or women, but that's somewhat irrelevant; I just have to tell what I feel, and those feelings are somehow related to the narrator figures.

And mind you, it's still the *same output*. I don't mean that my writing would be purposefully adapted to use male or female writer clichés. It's just that I get my mind to the proper gear and manage to be somehow perceived as *something*.

And I feel comfort *being* these narrator figures. I feel comfort in building these storyteller agents. And yes, *now* we can get back to the roleplaying discussions: I enjoy character design in all forms. ...Maybe it's easier to understand this way: if I design a RPG character, I put my soul into that process, much the same way I put my soul in my characters and narrator figures. These fictional folks *are* me. They're my lenses for seeing the world in thousands of ways.

I now realise what exactly I meant when I realised, long ago, that most of my characters in my fiction have to have a *little* bit of my personality in them. Not total Mary Sues, but *something* little that may remind people who wrote this crud.

The key word here is ""comfort"", though. It's strange. I've posted on some other forums and listed my gender as female. That's how I identified my narrator figure as. That's what I *am*. And somehow I find comfort in that. Much like how I found comfort writing a tale in which a protagonist is female. And sometimes, I can feel comfort in being listed as male or exploring how a male character is feeling in a story.

This is all becoming clearer now. I was once thinking that it was just my online identity having a bit of gender confusion going on, but now I think it's just getting clearer that it's all coming back to what I really am: Yet another human being who is driven to inform and entertain, and who somehow has to pick a gender when telling tales.

I used to think it's completely irrelevant who I am, but I'm beginning to think that it may put my mind at ease if I just think of myself as having narrator personalities. A final curveball coming up: I just don't know what it says of me that my favourite ""narrator personality"" is just this tomboy living in my head. Maybe this is how oddness was destined to be.

Finally, here's [A random drawing I made earlier](http://fav.me/d4bayyd). Before all these strange revelations. =)
",genderqueer,"Hello, from a little bit weird guy.",1328658645.0,"{'created_utc': 1328633445, 'id': 'peu7m', 'num_comments': 3, 'score': 8, 'selftext': 'It\'s funny how after hours of thinking I can\'t think of a better description than ""a little bit weird guy"".\n\nIt\'s probably easiest to just say the definite facts. I\'m a bisexual male, notably leaning toward females. And I don\'t think I have any problems being a guy, physically speaking.\n\nBut mentally, well, that\'s a different question with completely odd answers.\n\nI\'m starting to come to terms with the fact that I *have* such thing as a personality.\n\nI could say that it\'s starting to become clear to me that I have kind of a division between what I physically am, and what I am as a creative entity. My physical side is just what it is. My creative self is just... being creative, I guess.\n\nPeople probably say that I\'m roleplaying or something. I think that\'s incorrect.\n\nI am a *narrator figure.*\n\nThe biggest revelations I\'ve had lately have all had to do with the fact that I\'m a writer, and how everything has something to do with the fact. Looking back, I can see that I\'m one walking the path of words. My mission in this life is to tell stories. My mission in this life is to provoke thoughts through commentary.\n\nAnd authors are supposed to distance themselves from the works. Good stories stand on their own. Solid facts stand on their own. But that is not how tales are told. People, surprisingly enough, care about who the author is, even when that\'s completely irrelevant as far as the story goes.\n\nWhich is why I become a narrator of some description.\n\nThis is so deeply ingrained in my personality that I can\'t shake it. I take the garbs of a narrator to make my way through a situation in life. I *become* the narrator. I find it easier to tell some kinds of tales by being a guy. I find it easier to tell some kinds of tales by being a gals. And people may have their expectations of some tales being told by men or women, but that\'s somewhat irrelevant; I just have to tell what I feel, and those feelings are somehow related to the narrator figures.\n\nAnd mind you, it\'s still the *same output*. I don\'t mean that my writing would be purposefully adapted to use male or female writer clichés. It\'s just that I get my mind to the proper gear and manage to be somehow perceived as *something*.\n\nAnd I feel comfort *being* these narrator figures. I feel comfort in building these storyteller agents. And yes, *now* we can get back to the roleplaying discussions: I enjoy character design in all forms. ...Maybe it\'s easier to understand this way: if I design a RPG character, I put my soul into that process, much the same way I put my soul in my characters and narrator figures. These fictional folks *are* me. They\'re my lenses for seeing the world in thousands of ways.\n\nI now realise what exactly I meant when I realised, long ago, that most of my characters in my fiction have to have a *little* bit of my personality in them. Not total Mary Sues, but *something* little that may remind people who wrote this crud.\n\nThe key word here is ""comfort"", though. It\'s strange. I\'ve posted on some other forums and listed my gender as female. That\'s how I identified my narrator figure as. That\'s what I *am*. And somehow I find comfort in that. Much like how I found comfort writing a tale in which a protagonist is female. And sometimes, I can feel comfort in being listed as male or exploring how a male character is feeling in a story.\n\nThis is all becoming clearer now. I was once thinking that it was just my online identity having a bit of gender confusion going on, but now I think it\'s just getting clearer that it\'s all coming back to what I really am: Yet another human being who is driven to inform and entertain, and who somehow has to pick a gender when telling tales.\n\nI used to think it\'s completely irrelevant who I am, but I\'m beginning to think that it may put my mind at ease if I just think of myself as having narrator personalities. A final curveball coming up: I just don\'t know what it says of me that my favourite ""narrator personality"" is just this tomboy living in my head. Maybe this is how oddness was destined to be.\n\nFinally, here\'s [A random drawing I made earlier](http://fav.me/d4bayyd). Before all these strange revelations. =)\n', 'subreddit': 'genderqueer', 'title': 'Hello, from a little bit weird guy.', 'created': 1328658645.0}"
2012-02-07 23:46:32,pfevt,14,13,"I have managed to avoid going on the pill until now (aged 25). I have had very bad period pain since my early teens to the point of throwing up and fainting but didn't want to go on the pill. However, about a year ago I started to get bad skin along with the painful periods. I avoided the pill for another year but felt I had to finally give it a shot as nothing else worked and it was affecting work every month. 

One of my main fears is that I identify as genderqueer and don't want to be any more feminine than I already am. It doesn't feel right to take  anti-androgen and oestrogen when I have considered taking the exact opposite.

Anyway, I have been on it for a very short time (just over a week) and my breasts are really sore, tender, heavy and big. :( Again, not something I want. (I went online and this seems to be a common symptom that all reviewers were putting in the ""pro"" section of their reviews of the pill I'm on). It's not a pro for me. It's horrible.

I just wanted to find out if anyone else had to go on the pill and how it made them feel/affected their body etc.? And how this affected their genderqueer identity?

Thanks.",genderqueer,"Have any female-bodied genderqueers here been on ""The Pill"" or are you currently on ""The Pill""?",1328683592.0,"{'created_utc': 1328658392, 'id': 'pfevt', 'num_comments': 14, 'score': 13, 'selftext': 'I have managed to avoid going on the pill until now (aged 25). I have had very bad period pain since my early teens to the point of throwing up and fainting but didn\'t want to go on the pill. However, about a year ago I started to get bad skin along with the painful periods. I avoided the pill for another year but felt I had to finally give it a shot as nothing else worked and it was affecting work every month. \n\nOne of my main fears is that I identify as genderqueer and don\'t want to be any more feminine than I already am. It doesn\'t feel right to take  anti-androgen and oestrogen when I have considered taking the exact opposite.\n\nAnyway, I have been on it for a very short time (just over a week) and my breasts are really sore, tender, heavy and big. :( Again, not something I want. (I went online and this seems to be a common symptom that all reviewers were putting in the ""pro"" section of their reviews of the pill I\'m on). It\'s not a pro for me. It\'s horrible.\n\nI just wanted to find out if anyone else had to go on the pill and how it made them feel/affected their body etc.? And how this affected their genderqueer identity?\n\nThanks.', 'subreddit': 'genderqueer', 'title': 'Have any female-bodied genderqueers here been on ""The Pill"" or are you currently on ""The Pill""?', 'created': 1328683592.0}"
2012-02-08 23:27:39,pgzb6,8,11,,genderqueer,The First Appearance of Genderqueer Flag At A LGBT Rally.,1328768859.0,"{'created_utc': 1328743659, 'id': 'pgzb6', 'num_comments': 8, 'score': 11, 'selftext': '', 'subreddit': 'genderqueer', 'title': 'The First Appearance of Genderqueer Flag At A LGBT Rally.', 'created': 1328768859.0}"
2012-02-09 22:01:09,pie4c,0,0,,genderqueer,Amazon shipped my stockings separate from the rest of the order...,1328850069.0,"{'created_utc': 1328824869, 'id': 'pie4c', 'num_comments': 0, 'score': 0, 'selftext': '', 'subreddit': 'genderqueer', 'title': 'Amazon shipped my stockings separate from the rest of the order...', 'created': 1328850069.0}"
2012-02-09 22:25:42,piff0,13,17,,genderqueer,Androgynous model Andrej Pejic walks runway as man and woman  - dailypress.com,1328851542.0,"{'created_utc': 1328826342, 'id': 'piff0', 'num_comments': 13, 'score': 17, 'selftext': '', 'subreddit': 'genderqueer', 'title': 'Androgynous model Andrej Pejic walks runway as man and woman  - dailypress.com', 'created': 1328851542.0}"
2012-02-11 02:39:48,pka7b,19,27,"Thank you! Thank you for this place existing. For the longest time I thought, knew, I was the only one that felt this way. I couldn't come to terms with it, I knew I wasn't transgender--I'm not a man, but--I'm not really a woman either. It was this struggle and I couldn't even verbalize it because I didn't even know what to call myself. 

Then all the sudden I'm sitting in class and we're watching this video about the trans world and this person says they are genderqueer. I couldn't even- I was flabbergasted. I wasn't alone! I'm not alone! And to find out not only am I not alone but my favorite forum was WAY ahead of me. I'm ready to cry with happiness because I don't have to be silent any longer. 

I know this isn't really a post asking questions or sharing a story, I'm just really really grateful that this is here. I'm sure all of you feel the same way, but it's really liberating to know I'm not the only one and have others I can share this experience with. 


tl;dr: Hi I'm new and really happy you all exist! ",genderqueer,I'm not alone!,1328953188.0,"{'created_utc': 1328927988, 'id': 'pka7b', 'num_comments': 19, 'score': 27, 'selftext': ""Thank you! Thank you for this place existing. For the longest time I thought, knew, I was the only one that felt this way. I couldn't come to terms with it, I knew I wasn't transgender--I'm not a man, but--I'm not really a woman either. It was this struggle and I couldn't even verbalize it because I didn't even know what to call myself. \n\nThen all the sudden I'm sitting in class and we're watching this video about the trans world and this person says they are genderqueer. I couldn't even- I was flabbergasted. I wasn't alone! I'm not alone! And to find out not only am I not alone but my favorite forum was WAY ahead of me. I'm ready to cry with happiness because I don't have to be silent any longer. \n\nI know this isn't really a post asking questions or sharing a story, I'm just really really grateful that this is here. I'm sure all of you feel the same way, but it's really liberating to know I'm not the only one and have others I can share this experience with. \n\n\ntl;dr: Hi I'm new and really happy you all exist! "", 'subreddit': 'genderqueer', 'title': ""I'm not alone!"", 'created': 1328953188.0}"
