created_utc,id,num_comments,score,selftext,subreddit,title,created,d_
2012-03-10 16:27:30,qqdj0,15,26,"I mean, obviously, on some level you actually are. But I mean it in the sense that I don't really identify with the concept of gender. I think I'd see the world the same regardless of whether or not I have what sexual organs I have.

That said, I present as my born sex, and am perfectly fine calling myself a girl, with others calling me a girl, dressing feminine, etc. But really, I don't identify with the concept of ""being a woman"" because, in my mind, I'm just a *person*; the core of what I am is in my brain, not the external bits I didn't have control over. I may dress feminine and wear makeup and enjoy doing it, but that's because that's what suits me aesthetically, and a lot of it is cultural, too, as this feminine thing is a pretty recent development for me. I feel like if I'd been born a dude, I'd probably be fine calling myself a dude and dressing masculine and enjoy doing that, too, but I'd still feel more like a brain than a gender. I don't gender my interests or activities. They're just what I like. I don't even really like terms like 'masculine' or 'feminine' for activities or interests or personalities or anything other than the physical, preferring instead terms like 'active' or 'passive.' I have trouble seeing people as 'a man' or 'a woman,' and just see them as.. well, people. 

If I could switch gender at will, I'd do it, provided I didn't have to stick to one. I think one body's handy for some purposes and experiences, and the other body's handy for others; I guess I just like the idea of experimenting with different perspectives. I don't feel attached to any one particular way of being.

Does anyone else feel like this? What is this? Is this what it is to be agender? Or am I bigender? Or androgynous? Do I have some kind of dissociation thing going on? Or am I just a girl? Is this how most (cis) people feel? Like a brain controlling some kind of biomecha? 

..Sounds a little weird now that I've written it down. I don't normally really think about it.

EDIT: And while I'm at it, I might as well go full weird on you - does anyone else find themselves looking at people and wondering how gender dynamics would work if, all of the sudden, we all had the same body, voice, and expressed body language (but the same internal gender/memories/etc.)? Sometimes I think people get so distracted by the exterior and attach themselves to it, when if you really listen to the message, each gender is basically saying and/or feeling the same thing, and it's the fact that we're so easily put off by external perception we end up with some pretty bizarre assumptions about what gender is.

..still don't know if any of that made any sense, but fuck it. Maybe someone else out there 'gets it.' Thoughts? 
",genderqueer,"What are you if you just feel like you're a brain in a body, or a person instead of a gender?",1331422050.0,"{'created_utc': 1331396850, 'id': 'qqdj0', 'num_comments': 15, 'score': 26, 'selftext': 'I mean, obviously, on some level you actually are. But I mean it in the sense that I don\'t really identify with the concept of gender. I think I\'d see the world the same regardless of whether or not I have what sexual organs I have.\n\nThat said, I present as my born sex, and am perfectly fine calling myself a girl, with others calling me a girl, dressing feminine, etc. But really, I don\'t identify with the concept of ""being a woman"" because, in my mind, I\'m just a *person*; the core of what I am is in my brain, not the external bits I didn\'t have control over. I may dress feminine and wear makeup and enjoy doing it, but that\'s because that\'s what suits me aesthetically, and a lot of it is cultural, too, as this feminine thing is a pretty recent development for me. I feel like if I\'d been born a dude, I\'d probably be fine calling myself a dude and dressing masculine and enjoy doing that, too, but I\'d still feel more like a brain than a gender. I don\'t gender my interests or activities. They\'re just what I like. I don\'t even really like terms like \'masculine\' or \'feminine\' for activities or interests or personalities or anything other than the physical, preferring instead terms like \'active\' or \'passive.\' I have trouble seeing people as \'a man\' or \'a woman,\' and just see them as.. well, people. \n\nIf I could switch gender at will, I\'d do it, provided I didn\'t have to stick to one. I think one body\'s handy for some purposes and experiences, and the other body\'s handy for others; I guess I just like the idea of experimenting with different perspectives. I don\'t feel attached to any one particular way of being.\n\nDoes anyone else feel like this? What is this? Is this what it is to be agender? Or am I bigender? Or androgynous? Do I have some kind of dissociation thing going on? Or am I just a girl? Is this how most (cis) people feel? Like a brain controlling some kind of biomecha? \n\n..Sounds a little weird now that I\'ve written it down. I don\'t normally really think about it.\n\nEDIT: And while I\'m at it, I might as well go full weird on you - does anyone else find themselves looking at people and wondering how gender dynamics would work if, all of the sudden, we all had the same body, voice, and expressed body language (but the same internal gender/memories/etc.)? Sometimes I think people get so distracted by the exterior and attach themselves to it, when if you really listen to the message, each gender is basically saying and/or feeling the same thing, and it\'s the fact that we\'re so easily put off by external perception we end up with some pretty bizarre assumptions about what gender is.\n\n..still don\'t know if any of that made any sense, but fuck it. Maybe someone else out there \'gets it.\' Thoughts? \n', 'subreddit': 'genderqueer', 'title': ""What are you if you just feel like you're a brain in a body, or a person instead of a gender?"", 'created': 1331422050.0}"
2012-03-11 18:56:48,qrryi,2,15,"I'm a 26-year-old man who recently realized that I am probably bisexual, and I am right now in that grey zone between questioning and bisexual. Even more recently, I started cross-dressing in private without really understanding why I was doing it other than that I have been curious about what it would be like to be female since I was a teenager, and I find women's fashion interesting. Let me first state that I am not gender dysphoric; for me to have the confidence to let myself cross-dress I had to first really look at my body and realize that I really do like my male-body and I enjoy being male, whatever that means. 

What's got me thinking I am bigender is that when I am *en femme* there are subtle changes in the way I behave and think. I fold my underwear before putting it away, I think I move differently, I dance femininely, and I prefer music by female musicians. What's really got me freaked out is that when I am *en femme* I love wearing a bra, and what I love even more is being able to fill out the bra (artificially of course, using rice in tied-off pantyhose feet). Wearing a stuffed bra feels so natural to me, and I often find myself forgetting I am wearing a bra or have fake boobs, reminding myself only when they get in the way of my arms or vision. Yesterday I found myself wrapping my arms around my bust and enjoying the look and feel of my chest and wishing they were real and I could always have breasts. However, when I'm not *en femme*...this weirds me out, as I normally like my flat male chest and pelt of chest hair, and have no desire to permanently stop being male.

So, I think I may be bigender, which would mean I have separate male and female gender identities, and I switch between expressing my personality through my male identity and female identity. Does anyone else have experience with questioning their gender identity after they started questioning their sexual orientation? Also, can anyone tell me about bigenderism?",genderqueer,"Realized I am Likely Bisexual, Now Think I Might Also be Bigender",1331517408.0,"{'created_utc': 1331492208, 'id': 'qrryi', 'num_comments': 2, 'score': 15, 'selftext': ""I'm a 26-year-old man who recently realized that I am probably bisexual, and I am right now in that grey zone between questioning and bisexual. Even more recently, I started cross-dressing in private without really understanding why I was doing it other than that I have been curious about what it would be like to be female since I was a teenager, and I find women's fashion interesting. Let me first state that I am not gender dysphoric; for me to have the confidence to let myself cross-dress I had to first really look at my body and realize that I really do like my male-body and I enjoy being male, whatever that means. \n\nWhat's got me thinking I am bigender is that when I am *en femme* there are subtle changes in the way I behave and think. I fold my underwear before putting it away, I think I move differently, I dance femininely, and I prefer music by female musicians. What's really got me freaked out is that when I am *en femme* I love wearing a bra, and what I love even more is being able to fill out the bra (artificially of course, using rice in tied-off pantyhose feet). Wearing a stuffed bra feels so natural to me, and I often find myself forgetting I am wearing a bra or have fake boobs, reminding myself only when they get in the way of my arms or vision. Yesterday I found myself wrapping my arms around my bust and enjoying the look and feel of my chest and wishing they were real and I could always have breasts. However, when I'm not *en femme*...this weirds me out, as I normally like my flat male chest and pelt of chest hair, and have no desire to permanently stop being male.\n\nSo, I think I may be bigender, which would mean I have separate male and female gender identities, and I switch between expressing my personality through my male identity and female identity. Does anyone else have experience with questioning their gender identity after they started questioning their sexual orientation? Also, can anyone tell me about bigenderism?"", 'subreddit': 'genderqueer', 'title': 'Realized I am Likely Bisexual, Now Think I Might Also be Bigender', 'created': 1331517408.0}"
2012-03-11 20:28:00,qrvz7,18,24,,genderqueer,(in)visible: i used to be a boy: challenging trans-normativity,1331522880.0,"{'created_utc': 1331497680, 'id': 'qrvz7', 'num_comments': 18, 'score': 24, 'selftext': '', 'subreddit': 'genderqueer', 'title': '(in)visible: i used to be a boy: challenging trans-normativity', 'created': 1331522880.0}"
2012-03-12 02:16:38,qsbcc,5,12,,genderqueer,I want to start asking EVERYONE their preferred pronoun. ,1331543798.0,"{'created_utc': 1331518598, 'id': 'qsbcc', 'num_comments': 5, 'score': 12, 'selftext': '', 'subreddit': 'genderqueer', 'title': 'I want to start asking EVERYONE their preferred pronoun. ', 'created': 1331543798.0}"
2012-03-12 02:46:44,qscr8,18,13,"I look very girly. Mostly in my hips and chest. I think my face is a little androgynous. I don't want to look so girly. But I don't really want to look like a boy. How can I help myself to look more gender neutral. I can post pics if needed
**EDIT:** As it has been requested, here's my [hair!](http://imgur.com/a/xKjRv) And two newer pics [here!](http://imgur.com/a/pBjHE)",genderqueer,What can I do to look gender neutral?,1331545604.0,"{'created_utc': 1331520404, 'id': 'qscr8', 'num_comments': 18, 'score': 13, 'selftext': ""I look very girly. Mostly in my hips and chest. I think my face is a little androgynous. I don't want to look so girly. But I don't really want to look like a boy. How can I help myself to look more gender neutral. I can post pics if needed\n**EDIT:** As it has been requested, here's my [hair!](http://imgur.com/a/xKjRv) And two newer pics [here!](http://imgur.com/a/pBjHE)"", 'subreddit': 'genderqueer', 'title': 'What can I do to look gender neutral?', 'created': 1331545604.0}"
2012-03-14 03:04:08,qvlt5,10,5,"Hello beautiful people,
 I am an anthropology student and a gender queer allie who is writing a piece to educate others about the gender queer movement. My ethnography will examine the cultural politics of gender and I hope to showcase to others that the concept of gender can be a privilege. Many in my class have challenged me on this, stating that only males have gender privilege, however, I hope to teach them with my assignment that if one feels congruent with the cultural construction of gender that society projects upon them, it is indeed a privilege. I would be forever greatful to anyone who would take the time to give me their insight on particular aspects of gender. For example: I would like you to explain your definition of the concept of gender. Explain your thoughts on gender as a privilege.  What do you think about the limits of the gender binary? In your opinion, is the gender binary an example of institutional violence? Please share with me any moments which have defined your life as a gender queer activist/individual. What would you like the gender queer movement to achieve? Any other thoughts or feelings are welcomed. 
   Thank you to all for taking the time to read this and contributing. I would be more than happy to share with you my research and my final piece. All information is, of course, confidential. Just message me if you have any questions or if you have been kind enough to answer the above questions. Thank you for paving a safe road for future generations!
         -Jeri",genderqueer,Questions for gender queer community,1331719448.0,"{'created_utc': 1331694248, 'id': 'qvlt5', 'num_comments': 10, 'score': 5, 'selftext': 'Hello beautiful people,\n I am an anthropology student and a gender queer allie who is writing a piece to educate others about the gender queer movement. My ethnography will examine the cultural politics of gender and I hope to showcase to others that the concept of gender can be a privilege. Many in my class have challenged me on this, stating that only males have gender privilege, however, I hope to teach them with my assignment that if one feels congruent with the cultural construction of gender that society projects upon them, it is indeed a privilege. I would be forever greatful to anyone who would take the time to give me their insight on particular aspects of gender. For example: I would like you to explain your definition of the concept of gender. Explain your thoughts on gender as a privilege.  What do you think about the limits of the gender binary? In your opinion, is the gender binary an example of institutional violence? Please share with me any moments which have defined your life as a gender queer activist/individual. What would you like the gender queer movement to achieve? Any other thoughts or feelings are welcomed. \n   Thank you to all for taking the time to read this and contributing. I would be more than happy to share with you my research and my final piece. All information is, of course, confidential. Just message me if you have any questions or if you have been kind enough to answer the above questions. Thank you for paving a safe road for future generations!\n         -Jeri', 'subreddit': 'genderqueer', 'title': 'Questions for gender queer community', 'created': 1331719448.0}"
2012-03-14 08:53:35,qvy9f,1,7,"I am a native English speaker and I am moving to the Netherlands in a few months. I need to figure out how I am going to talk about gender, and I'm curious if there are any Dutch speakers here who can help me out. I would be very interested to hear how the language affects discourse about gender in general if anyone cared to talk about it, but my immediate questions concern pronouns:

I use ""they"" now. I am also female-bodied and usually read as such, so if I use ""het"" I worry that people will hear it as a diminutive referring to a female (or correct my apparent grammatical mistake and I will have to awkwardly explain why it's on purpose). How can I be a visible nonbinary person linguistically/what pronouns do nonbinary people typically use in Dutch? Also, where might I find information regarding Dutch queer nomenclature?

Danken jullie &lt;3",genderqueer,Questions about gender in the Dutch language,1331740415.0,"{'created_utc': 1331715215, 'id': 'qvy9f', 'num_comments': 1, 'score': 7, 'selftext': 'I am a native English speaker and I am moving to the Netherlands in a few months. I need to figure out how I am going to talk about gender, and I\'m curious if there are any Dutch speakers here who can help me out. I would be very interested to hear how the language affects discourse about gender in general if anyone cared to talk about it, but my immediate questions concern pronouns:\n\nI use ""they"" now. I am also female-bodied and usually read as such, so if I use ""het"" I worry that people will hear it as a diminutive referring to a female (or correct my apparent grammatical mistake and I will have to awkwardly explain why it\'s on purpose). How can I be a visible nonbinary person linguistically/what pronouns do nonbinary people typically use in Dutch? Also, where might I find information regarding Dutch queer nomenclature?\n\nDanken jullie &lt;3', 'subreddit': 'genderqueer', 'title': 'Questions about gender in the Dutch language', 'created': 1331740415.0}"
2012-03-14 18:12:16,qwhg9,7,3,"So, here's the situation: I'm a CAMAB*, genderfluid person who drifts between ""female from the trans direction"" and ""genderqueer"" identification and presentation. I'm also a whole buncha other things (relevant ones for this post: neurodiverse, fat, disabled) and those things are coming together with the gender/body stuff into a perfect storm of What-the-fuck-do-I-do-here. 

Short version: I'm flying overseas in a couple months and my GQ identity tends to assert itself pretty strongly when travelling. It's also a lot more practical to let people make what they will of my gender in those circumstances (easy when in GQ space, remarkably hard when in female space), and I want to minimize stress in all cases, especially the hassle of going through customs. To that end I'm looking for gender-blurring, comfy, plus-size outfits. 

Problem: I'm very tall, and fat, and so buying clothes is one of the most stressful parts of my life (did I mention poor too? Yeah, I live on a fixed income -- someone else is paying the bill to fly me overseas, here). My ID and birth certificate reflect female gender, and I'm applying for a passport with that information, so all my documents are going to read ""F"". What I want to do is try and minimize the potential for harassment or pointless quibbles security-side; one of the things I've noticed is that if I wear clothes that leave gender blurry rather than neutral ones, I often get read as female, whereas if I present more directly-femme it's all down to how well I'm passing that day, which seems to be largely beyond my control most of the time.  

I have little fashion sense, and little cash, although enough that I can manage for this...it's just a question of being able to find the clothes and figure out what angles to work from. I'd really love thoughts, tips, or even just ""Yeah that sucks"" and commiseration from other folks in similar situations here. I kinda feel alone, like I'm the only CAMAB, tall, plus-size-wearing GQ person around, and I'd really like to be relieved of this illusion. 

*Because it's a term I only started using m'self recently and many still haven't heard it: Coercively Assigned Male At Birth.",genderqueer,"Intersectionality makes everything better! Well, more complicated. [Tips, advice, support, sympathy?]",1331773936.0,"{'created_utc': 1331748736, 'id': 'qwhg9', 'num_comments': 7, 'score': 3, 'selftext': 'So, here\'s the situation: I\'m a CAMAB*, genderfluid person who drifts between ""female from the trans direction"" and ""genderqueer"" identification and presentation. I\'m also a whole buncha other things (relevant ones for this post: neurodiverse, fat, disabled) and those things are coming together with the gender/body stuff into a perfect storm of What-the-fuck-do-I-do-here. \n\nShort version: I\'m flying overseas in a couple months and my GQ identity tends to assert itself pretty strongly when travelling. It\'s also a lot more practical to let people make what they will of my gender in those circumstances (easy when in GQ space, remarkably hard when in female space), and I want to minimize stress in all cases, especially the hassle of going through customs. To that end I\'m looking for gender-blurring, comfy, plus-size outfits. \n\nProblem: I\'m very tall, and fat, and so buying clothes is one of the most stressful parts of my life (did I mention poor too? Yeah, I live on a fixed income -- someone else is paying the bill to fly me overseas, here). My ID and birth certificate reflect female gender, and I\'m applying for a passport with that information, so all my documents are going to read ""F"". What I want to do is try and minimize the potential for harassment or pointless quibbles security-side; one of the things I\'ve noticed is that if I wear clothes that leave gender blurry rather than neutral ones, I often get read as female, whereas if I present more directly-femme it\'s all down to how well I\'m passing that day, which seems to be largely beyond my control most of the time.  \n\nI have little fashion sense, and little cash, although enough that I can manage for this...it\'s just a question of being able to find the clothes and figure out what angles to work from. I\'d really love thoughts, tips, or even just ""Yeah that sucks"" and commiseration from other folks in similar situations here. I kinda feel alone, like I\'m the only CAMAB, tall, plus-size-wearing GQ person around, and I\'d really like to be relieved of this illusion. \n\n*Because it\'s a term I only started using m\'self recently and many still haven\'t heard it: Coercively Assigned Male At Birth.', 'subreddit': 'genderqueer', 'title': 'Intersectionality makes everything better! Well, more complicated. [Tips, advice, support, sympathy?]', 'created': 1331773936.0}"
2012-03-14 23:55:45,qwz2e,80,12,I recently created [/r/lgbtpagan](/r/lgbtpagan) in an attempt to give those of us in the LGBT community who are also pagans a safe space to talk about our faith. Anyone amongst my GQ siblings interested? I'd love to have you!,genderqueer,LGBT Pagan,1331794545.0,"{'created_utc': 1331769345, 'id': 'qwz2e', 'num_comments': 80, 'score': 12, 'selftext': ""I recently created [/r/lgbtpagan](/r/lgbtpagan) in an attempt to give those of us in the LGBT community who are also pagans a safe space to talk about our faith. Anyone amongst my GQ siblings interested? I'd love to have you!"", 'subreddit': 'genderqueer', 'title': 'LGBT Pagan', 'created': 1331794545.0}"
