created_utc,id,num_comments,score,selftext,subreddit,title,created,d_
2012-03-01 05:07:13,qcin0,20,18,"I am a 22 year old male who has identified as bisexual since I was 19. I always knew there was something... off. Something different about me. I didn't necessarily have a problem fitting in, but knew I wasn't like others. It wasn't until recently that I considered the idea that I didn't quite fit the gender binary. I don't feel connected. A third wheel of sorts. I see men as a group that I can relate to in many ways, but don't truly feel like I am one. I see women much the same way. I notice more and more feminine tendencies the more that I think about it. 

Is this normal? I don't dress or appear androgynous. I guess you could say I dress like a well kept gay man would.",genderqueer,Rather confused :/,1330603633.0,"{'created_utc': 1330578433, 'id': 'qcin0', 'num_comments': 20, 'score': 18, 'selftext': ""I am a 22 year old male who has identified as bisexual since I was 19. I always knew there was something... off. Something different about me. I didn't necessarily have a problem fitting in, but knew I wasn't like others. It wasn't until recently that I considered the idea that I didn't quite fit the gender binary. I don't feel connected. A third wheel of sorts. I see men as a group that I can relate to in many ways, but don't truly feel like I am one. I see women much the same way. I notice more and more feminine tendencies the more that I think about it. \n\nIs this normal? I don't dress or appear androgynous. I guess you could say I dress like a well kept gay man would."", 'subreddit': 'genderqueer', 'title': 'Rather confused :/', 'created': 1330603633.0}"
2012-03-02 19:01:21,qet0n,4,21,"Has anyone here tried [Echo Bazaar](http://echobazaar.failbettergames.com)?
It is a fairly neat browser based game about Victorian London having fallen into the earth and things getting really weird because of it. Horrible Lovecraftian secrets, squid people, you not being able to die. Stuff like that.

The best part though? When you are creating your character and have to pick your gender, you can pick a third option. This makes your character be of 'mysterious and indistinct gender', and people have a really hard time telling what exactly you are. It is refreshing to see a game let you pick options like that.

Edit: My link seems to be acting screwy. So you may need to just copy and paste.",genderqueer,Echo Bazaar - Browser based game that lets you be genderqueer,1330740081.0,"{'created_utc': 1330714881, 'id': 'qet0n', 'num_comments': 4, 'score': 21, 'selftext': ""Has anyone here tried [Echo Bazaar](http://echobazaar.failbettergames.com)?\nIt is a fairly neat browser based game about Victorian London having fallen into the earth and things getting really weird because of it. Horrible Lovecraftian secrets, squid people, you not being able to die. Stuff like that.\n\nThe best part though? When you are creating your character and have to pick your gender, you can pick a third option. This makes your character be of 'mysterious and indistinct gender', and people have a really hard time telling what exactly you are. It is refreshing to see a game let you pick options like that.\n\nEdit: My link seems to be acting screwy. So you may need to just copy and paste."", 'subreddit': 'genderqueer', 'title': 'Echo Bazaar - Browser based game that lets you be genderqueer', 'created': 1330740081.0}"
2012-03-03 01:29:44,qfbar,13,38,,genderqueer,"Remember how the Girlscouts supported that transgirl? Which upset folks, and they decided to boycott cookies? I decided to put my money where my mouth was. ",1330763384.0,"{'created_utc': 1330738184, 'id': 'qfbar', 'num_comments': 13, 'score': 38, 'selftext': '', 'subreddit': 'genderqueer', 'title': 'Remember how the Girlscouts supported that transgirl? Which upset folks, and they decided to boycott cookies? I decided to put my money where my mouth was. ', 'created': 1330763384.0}"
2012-03-03 02:22:06,qfdg4,3,19,"I'm a 16 year old gay male, and I have always thought of myself as very much cis. I mean, I've never been stereotypically masculine, but I've never really been feminine either. Occasionally, maybe once or twice a month, I feel female. I can't really explain it. I just sort of feel like there is something very wrong with my body, and I act more ""feminine"". My voice gets higher, and I can tell that my gait has changed. I guess I figured just posting it here would make me feel better, thanks for reading!",genderqueer,Time to come out!,1330766526.0,"{'created_utc': 1330741326, 'id': 'qfdg4', 'num_comments': 3, 'score': 19, 'selftext': 'I\'m a 16 year old gay male, and I have always thought of myself as very much cis. I mean, I\'ve never been stereotypically masculine, but I\'ve never really been feminine either. Occasionally, maybe once or twice a month, I feel female. I can\'t really explain it. I just sort of feel like there is something very wrong with my body, and I act more ""feminine"". My voice gets higher, and I can tell that my gait has changed. I guess I figured just posting it here would make me feel better, thanks for reading!', 'subreddit': 'genderqueer', 'title': 'Time to come out!', 'created': 1330766526.0}"
2012-03-05 17:43:11,qisw0,34,17,"Hello, everyone! Like it says on the tin; this thread is for discussing things around the subreddit. I've been lurking through a lot of the drama unfolding over on r/lgbt, and one of the sensible suggestions that seems to keep popping up is that there should be a posted, open, and available set of rules to act as a set of guidelines for both the readers and the mod team. 

Right now, the mod team's just me, but we are still growing and we might need a new mod sometime soon. As it stands presently, we grow a little more every day and the workload isn't very heavy, so I figure I'll open applications for another mod when we hit a milestone like 1000 readers. I am, of course, open to feedback on this idea.

Rules! Yes, back to the bit about posting some standardized rules. At the moment, we've only had one person come here and post nasty, hurtful comments. Even so, I'm tempted to message them and strive to *teach* rather than to dismiss. More to the point, however, about rules. What should our rules be? These are rules that would cover everyone, so as readers you would be able to call me on it if I should happen to goof up somewhere, too. Personally, I do like to give people second chances, just in case, and I've been playing things by ear: If someone says something hurtful and I catch it, then I'll ask them to cool it, and if they continue then things will progress to a warning or even a ban. I do take a harder line on slurs; I feel that using slurs is reprehensible, but we're got an awesome community here, and fortunately that hasn't been an issue.

Also, flair! Flair is kinda fun, and I've always thought it looks neat. Right now we've got text-based flair, and I've been working on how to figure out image-based flair for a little while. I do very much like [/r/ainbow](/r/ainbow)'s flag flair; it seems very sensible and professional. To be honest, though, I'm not exactly a fan of the genderqueer flag; I'll rally beneath it, but I just don't like the lavender and green combination. I need to ask the mods of [/r/ainbow](/r/ainbow) how they got image-based flair up and running... and also, [/r/mylittlepony](/r/mylittlepony) had a utility running that would allow users to assign their own, custom flair at one point. All you needed was a tiny image to upload... I think that would be useful, because then everyone could pick whatever they feel suits them best, even though it would mean more work for me. Personally, I like the idea of creating a post asking for art from our community. That would allow us to have flair made by us, for us; I feel that would really encourage community participation and it would make things a little more welcoming and homely around here. I encourage this board as a welcoming space, and I feel it would encourage pride in our board. (Because people could say ""See that flair right there? *I* made that. How cool is that?"")

In summation:

1. Rules and guidelines: Let's work out some sensible rules together.

2. New Moderator: I'm planning on opening applications for another moderator when we get to 1,000 readers.

3. Flair: What sort of flair should we have? Should we go with [/r/ainbow](/r/ainbow)'s flag flair? Should we enable custom user-generated flair? (This may take a little longer for me to enable.) Should we issue a call for artists to produce brand new flair just for our subreddit here?

4. Old business: As always, I am open to suggestions and criticisms, if you have an excellent idea on how we can improve something, please message me and let me know!

Edit: Apparently I disabled text-based user flair while I was fiddling with the CSS to enable image-based flair. Text-based flair should be up and functional again; that's entirely my mistake, oops!",genderqueer,"Hello, everyone! - Discussion of Rules, Flair, and Subreddit Business.",1330994591.0,"{'created_utc': 1330969391, 'id': 'qisw0', 'num_comments': 34, 'score': 17, 'selftext': 'Hello, everyone! Like it says on the tin; this thread is for discussing things around the subreddit. I\'ve been lurking through a lot of the drama unfolding over on r/lgbt, and one of the sensible suggestions that seems to keep popping up is that there should be a posted, open, and available set of rules to act as a set of guidelines for both the readers and the mod team. \n\nRight now, the mod team\'s just me, but we are still growing and we might need a new mod sometime soon. As it stands presently, we grow a little more every day and the workload isn\'t very heavy, so I figure I\'ll open applications for another mod when we hit a milestone like 1000 readers. I am, of course, open to feedback on this idea.\n\nRules! Yes, back to the bit about posting some standardized rules. At the moment, we\'ve only had one person come here and post nasty, hurtful comments. Even so, I\'m tempted to message them and strive to *teach* rather than to dismiss. More to the point, however, about rules. What should our rules be? These are rules that would cover everyone, so as readers you would be able to call me on it if I should happen to goof up somewhere, too. Personally, I do like to give people second chances, just in case, and I\'ve been playing things by ear: If someone says something hurtful and I catch it, then I\'ll ask them to cool it, and if they continue then things will progress to a warning or even a ban. I do take a harder line on slurs; I feel that using slurs is reprehensible, but we\'re got an awesome community here, and fortunately that hasn\'t been an issue.\n\nAlso, flair! Flair is kinda fun, and I\'ve always thought it looks neat. Right now we\'ve got text-based flair, and I\'ve been working on how to figure out image-based flair for a little while. I do very much like [/r/ainbow](/r/ainbow)\'s flag flair; it seems very sensible and professional. To be honest, though, I\'m not exactly a fan of the genderqueer flag; I\'ll rally beneath it, but I just don\'t like the lavender and green combination. I need to ask the mods of [/r/ainbow](/r/ainbow) how they got image-based flair up and running... and also, [/r/mylittlepony](/r/mylittlepony) had a utility running that would allow users to assign their own, custom flair at one point. All you needed was a tiny image to upload... I think that would be useful, because then everyone could pick whatever they feel suits them best, even though it would mean more work for me. Personally, I like the idea of creating a post asking for art from our community. That would allow us to have flair made by us, for us; I feel that would really encourage community participation and it would make things a little more welcoming and homely around here. I encourage this board as a welcoming space, and I feel it would encourage pride in our board. (Because people could say ""See that flair right there? *I* made that. How cool is that?"")\n\nIn summation:\n\n1. Rules and guidelines: Let\'s work out some sensible rules together.\n\n2. New Moderator: I\'m planning on opening applications for another moderator when we get to 1,000 readers.\n\n3. Flair: What sort of flair should we have? Should we go with [/r/ainbow](/r/ainbow)\'s flag flair? Should we enable custom user-generated flair? (This may take a little longer for me to enable.) Should we issue a call for artists to produce brand new flair just for our subreddit here?\n\n4. Old business: As always, I am open to suggestions and criticisms, if you have an excellent idea on how we can improve something, please message me and let me know!\n\nEdit: Apparently I disabled text-based user flair while I was fiddling with the CSS to enable image-based flair. Text-based flair should be up and functional again; that\'s entirely my mistake, oops!', 'subreddit': 'genderqueer', 'title': 'Hello, everyone! - Discussion of Rules, Flair, and Subreddit Business.', 'created': 1330994591.0}"
2012-03-07 05:36:08,qlcjd,7,24,"Hi, I'm a 16 year old male, and I've finally realized who I am, totally gender queer... I guess I really owe it to you guys. So, thanks! 
But I have two other things:
First, just a happy little story...  I wore girl pants and jacket for the first time the other day and I actually got compliments from both girls and guys about how I looked! I was almost in tears from happiness.
Secondly, I shaved my legs for the first time as well, but I'm still really embarrassed to have anyone see them. So I really just want to know what you guys do to get up the courage to be yourselves... Any tips?",genderqueer,Made my first steps to really feeling like myself.,1331123768.0,"{'created_utc': 1331098568, 'id': 'qlcjd', 'num_comments': 7, 'score': 24, 'selftext': ""Hi, I'm a 16 year old male, and I've finally realized who I am, totally gender queer... I guess I really owe it to you guys. So, thanks! \nBut I have two other things:\nFirst, just a happy little story...  I wore girl pants and jacket for the first time the other day and I actually got compliments from both girls and guys about how I looked! I was almost in tears from happiness.\nSecondly, I shaved my legs for the first time as well, but I'm still really embarrassed to have anyone see them. So I really just want to know what you guys do to get up the courage to be yourselves... Any tips?"", 'subreddit': 'genderqueer', 'title': 'Made my first steps to really feeling like myself.', 'created': 1331123768.0}"
2012-03-07 23:33:08,qmgsv,11,24,"I'm a 15 year old. Biologically female. And I've realized a while ago that I didn't fit into either gender binary. I've been lurking this subreddit for a bit and it's taken me three days to gain enough courage to post here. I want to say thank you. I feel a lot less alone. I've also gotten a little more confident. Thank you, guys... ",genderqueer,Thank you.,1331188388.0,"{'created_utc': 1331163188, 'id': 'qmgsv', 'num_comments': 11, 'score': 24, 'selftext': ""I'm a 15 year old. Biologically female. And I've realized a while ago that I didn't fit into either gender binary. I've been lurking this subreddit for a bit and it's taken me three days to gain enough courage to post here. I want to say thank you. I feel a lot less alone. I've also gotten a little more confident. Thank you, guys... "", 'subreddit': 'genderqueer', 'title': 'Thank you.', 'created': 1331188388.0}"
2012-03-07 23:48:16,qmhjn,0,3,,genderqueer,"Twin Cities, Minnesota - The Naked I: Wide Open is coming back!",1331189296.0,"{'created_utc': 1331164096, 'id': 'qmhjn', 'num_comments': 0, 'score': 3, 'selftext': '', 'subreddit': 'genderqueer', 'title': 'Twin Cities, Minnesota - The Naked I: Wide Open is coming back!', 'created': 1331189296.0}"
2012-03-10 02:17:47,qps0r,7,16,,genderqueer,Androgynity,1331371067.0,"{'created_utc': 1331345867, 'id': 'qps0r', 'num_comments': 7, 'score': 16, 'selftext': '', 'subreddit': 'genderqueer', 'title': 'Androgynity', 'created': 1331371067.0}"
2012-03-10 06:14:36,qq0bw,3,5,"I'm a 22 year old American, and right now I identify as a trans* genderqueer butch person. I was assigned female at birth, identified as a transsexual man from the ages of 15-21, and after discovering that genderqueer is a thing, came to identify with that as a facet of my identity.

The thing is, there are a lot of things about my gender that I am uncertain of, and I would like some advice on how I might best proceed. (Also, my apologies if this is a bit obnoxious: I am slightly drunk at the moment.)

1. I changed my name legally when I was 20. I got the court order and everything. But while I liked the name at the time (my current legal name is something that I identified with since I first began identifying as transmasculine) it seems too gendered to me. I would like to go by something gender neutral. There is actually a name I have picked out, but I feel somewhat guilty and ridiculous asking people to learn/use yet another name and set of pronouns when I already asked them to do so three years ago. I don't want to change my name legally again, but I guess I'm asking, is it ok/normal/whatever to ask people to refer to me with ze/hir pronouns and a gender-neutral name, or should I just keep quiet and be grateful that they did a good job adopting a male name and he/him/his?  I think I might be genderfluid and while the ze/hir/hirs pronouns and gender neutral name give me a little more wiggle room in that regard, I am also worried that I might change my mind in another four years and be completely disregarded. 

2. I was assigned female at birth. I have never identified as a woman, though, and I stopped identifying as a man (what seems like) a long time ago. I am unusually tall though, heavyset, and quite butch looking. This tends to grant me a great deal of passing privilege, and I more or less get the privileges of appearing to be a heteronormative cisgender man even though I am none of those things. So I kind of want to cast those things aside and say no, I'm not a man, I'm not cis, and I'm not hetero... but I don't know how to go about that without appropriating the identities of other people.  Cis/trans* I'm not so worried about because I just frankly cannot imagine identifying as cis, even if I only fall under the trans umbrella because I'm genderqueer. But how can I own and celebrate my female-assigned body AND my nonbinary gender without invading spaces/invalidating identities of people who are female-assigned and/or female-identified?  To put it more clearly, I guess, I have absolutely no concept of what it means to be a woman, but I really don't want to be seen as a man, and I'm worried that if I wear a bra or speak up as a feminist or something I will just hurt women more. And it seems really shitty to like want to identify more strongly as nonbinary because I so hate being afforded male privilege and being seen as a threat and... ugh, I hate the patriarchy and don't want to be a part of it, but I'm also just genderqueer anyway I think, and I don't want to identify the ""wrong"" way or for the wrong reasons or hurt anybody.

Anyway, I realize that this is really long and that I'm not exactly coherent at the moment. But if there is anyone who would like to/be able to respond to my concerns or even just share my concerns, I would really appreciate it. Thanks.",genderqueer,I'm unsure of the right way to go about all this.,1331385276.0,"{'created_utc': 1331360076, 'id': 'qq0bw', 'num_comments': 3, 'score': 5, 'selftext': 'I\'m a 22 year old American, and right now I identify as a trans* genderqueer butch person. I was assigned female at birth, identified as a transsexual man from the ages of 15-21, and after discovering that genderqueer is a thing, came to identify with that as a facet of my identity.\n\nThe thing is, there are a lot of things about my gender that I am uncertain of, and I would like some advice on how I might best proceed. (Also, my apologies if this is a bit obnoxious: I am slightly drunk at the moment.)\n\n1. I changed my name legally when I was 20. I got the court order and everything. But while I liked the name at the time (my current legal name is something that I identified with since I first began identifying as transmasculine) it seems too gendered to me. I would like to go by something gender neutral. There is actually a name I have picked out, but I feel somewhat guilty and ridiculous asking people to learn/use yet another name and set of pronouns when I already asked them to do so three years ago. I don\'t want to change my name legally again, but I guess I\'m asking, is it ok/normal/whatever to ask people to refer to me with ze/hir pronouns and a gender-neutral name, or should I just keep quiet and be grateful that they did a good job adopting a male name and he/him/his?  I think I might be genderfluid and while the ze/hir/hirs pronouns and gender neutral name give me a little more wiggle room in that regard, I am also worried that I might change my mind in another four years and be completely disregarded. \n\n2. I was assigned female at birth. I have never identified as a woman, though, and I stopped identifying as a man (what seems like) a long time ago. I am unusually tall though, heavyset, and quite butch looking. This tends to grant me a great deal of passing privilege, and I more or less get the privileges of appearing to be a heteronormative cisgender man even though I am none of those things. So I kind of want to cast those things aside and say no, I\'m not a man, I\'m not cis, and I\'m not hetero... but I don\'t know how to go about that without appropriating the identities of other people.  Cis/trans* I\'m not so worried about because I just frankly cannot imagine identifying as cis, even if I only fall under the trans umbrella because I\'m genderqueer. But how can I own and celebrate my female-assigned body AND my nonbinary gender without invading spaces/invalidating identities of people who are female-assigned and/or female-identified?  To put it more clearly, I guess, I have absolutely no concept of what it means to be a woman, but I really don\'t want to be seen as a man, and I\'m worried that if I wear a bra or speak up as a feminist or something I will just hurt women more. And it seems really shitty to like want to identify more strongly as nonbinary because I so hate being afforded male privilege and being seen as a threat and... ugh, I hate the patriarchy and don\'t want to be a part of it, but I\'m also just genderqueer anyway I think, and I don\'t want to identify the ""wrong"" way or for the wrong reasons or hurt anybody.\n\nAnyway, I realize that this is really long and that I\'m not exactly coherent at the moment. But if there is anyone who would like to/be able to respond to my concerns or even just share my concerns, I would really appreciate it. Thanks.', 'subreddit': 'genderqueer', 'title': ""I'm unsure of the right way to go about all this."", 'created': 1331385276.0}"
2012-03-10 11:54:59,qq73p,9,13,"I had no idea where else to post this, but I wanted to ask/tell someone. It isn't even important, it's just me thinking. What and where is gender? Like, I know the actual answer, but lately I just can't see where my gender should or does fit into my life. I have no confusions or questions about which gender I am, but it sort of seems irrelevant. In my actions or in my mind, my gender never has an impact. Am i supposed to feel a certain way about being something? How does one feel a gender? ",genderqueer,I feel like my gender is irrelevant. ,1331405699.0,"{'created_utc': 1331380499, 'id': 'qq73p', 'num_comments': 9, 'score': 13, 'selftext': ""I had no idea where else to post this, but I wanted to ask/tell someone. It isn't even important, it's just me thinking. What and where is gender? Like, I know the actual answer, but lately I just can't see where my gender should or does fit into my life. I have no confusions or questions about which gender I am, but it sort of seems irrelevant. In my actions or in my mind, my gender never has an impact. Am i supposed to feel a certain way about being something? How does one feel a gender? "", 'subreddit': 'genderqueer', 'title': 'I feel like my gender is irrelevant. ', 'created': 1331405699.0}"
