created_utc,id,num_comments,score,selftext,subreddit,title,created,d_
2012-03-16 04:08:05,qyxb8,7,9,"So I'm a fat person. One of those women people describe as voluptuous or curvy. When I first sprouted booblettes it was very much a crossroad for me, I would either wear them with enticing pride, or hide them under layers of cloths and look even more fat than I already was... so I went with the former. Enticing cleavage and all the attention there-in. 

I do drag sometimes, I always enjoyed playing with gender, and I was cool with that, but I never went out because I felt, well, fat. 

Recently, I've been losing weight, exercising and eating better, and my goals, the one thing that has kept me going, is the idea of being able to drag better, and get rid of these god-awful tits. And I'm starting to think there's a little more queer in my gender than I previously thought. I am literally changing my body to match whats on the inside. Now, I totally get that there are all sorts of big bodied folks doing all sorts of gender expression, but I can't. My femininity is too caught up in it, in the curves, the hips, and of course, the bobas. 

So there's not really a question here, just reaching out to people, wondering if they can relate. I feel like there is an adorable little twinky boi underneath all my curves. So how do I let him grow, while the rest of me shrinks? 

It took me a long time to write this, and I feel like I'm leaving some stuff out. So ask away if you think I need to talk more about something. ",genderqueer,Underneath it all.,1331896085.0,"{'created_utc': 1331870885, 'id': 'qyxb8', 'num_comments': 7, 'score': 9, 'selftext': ""So I'm a fat person. One of those women people describe as voluptuous or curvy. When I first sprouted booblettes it was very much a crossroad for me, I would either wear them with enticing pride, or hide them under layers of cloths and look even more fat than I already was... so I went with the former. Enticing cleavage and all the attention there-in. \n\nI do drag sometimes, I always enjoyed playing with gender, and I was cool with that, but I never went out because I felt, well, fat. \n\nRecently, I've been losing weight, exercising and eating better, and my goals, the one thing that has kept me going, is the idea of being able to drag better, and get rid of these god-awful tits. And I'm starting to think there's a little more queer in my gender than I previously thought. I am literally changing my body to match whats on the inside. Now, I totally get that there are all sorts of big bodied folks doing all sorts of gender expression, but I can't. My femininity is too caught up in it, in the curves, the hips, and of course, the bobas. \n\nSo there's not really a question here, just reaching out to people, wondering if they can relate. I feel like there is an adorable little twinky boi underneath all my curves. So how do I let him grow, while the rest of me shrinks? \n\nIt took me a long time to write this, and I feel like I'm leaving some stuff out. So ask away if you think I need to talk more about something. "", 'subreddit': 'genderqueer', 'title': 'Underneath it all.', 'created': 1331896085.0}"
2012-03-17 04:23:23,r0fqa,59,29,"Hi. I'm kind of upset and confused right now and was hoping you all could help.

Let me start out by saying that I'm female and use female pronouns. For the past three or four years I've been a little gender confused. I still strongly identify when people say woman or female. But I also identify when people say men or male. And when I'm alone, thinking about myself, it gets more complicated than that. If it makes any sense at all, I kind of feel like I kind of identify as an in-between sex. Like I'm inter-sexed (though I know that is strictly a biological term).

Well, a few months ago I came across the term genderqueer and thought ""that's perfect!"". I assumed the term was an encompassing term for anything outside the gender binary. And it felt liberating and genuine. 

However, I recently spoke to a semi-close friend of mine who once identified as Androgynous, but now identifies genderqueer. Ze said that one cannot be genderqueer unless they are androgynous. And since I'm feminine and female, I cannot possibly be genderqueer. Ze also seemed really angry and offended by me using it.

Now I feel disheartened and guilty. I didn't mean to offend zir. What do you all think? ",genderqueer,Verbally Attacked for calling myself Genderqueer ,1331983403.0,"{'created_utc': 1331958203, 'id': 'r0fqa', 'num_comments': 59, 'score': 29, 'selftext': 'Hi. I\'m kind of upset and confused right now and was hoping you all could help.\n\nLet me start out by saying that I\'m female and use female pronouns. For the past three or four years I\'ve been a little gender confused. I still strongly identify when people say woman or female. But I also identify when people say men or male. And when I\'m alone, thinking about myself, it gets more complicated than that. If it makes any sense at all, I kind of feel like I kind of identify as an in-between sex. Like I\'m inter-sexed (though I know that is strictly a biological term).\n\nWell, a few months ago I came across the term genderqueer and thought ""that\'s perfect!"". I assumed the term was an encompassing term for anything outside the gender binary. And it felt liberating and genuine. \n\nHowever, I recently spoke to a semi-close friend of mine who once identified as Androgynous, but now identifies genderqueer. Ze said that one cannot be genderqueer unless they are androgynous. And since I\'m feminine and female, I cannot possibly be genderqueer. Ze also seemed really angry and offended by me using it.\n\nNow I feel disheartened and guilty. I didn\'t mean to offend zir. What do you all think? ', 'subreddit': 'genderqueer', 'title': 'Verbally Attacked for calling myself Genderqueer ', 'created': 1331983403.0}"
2012-03-18 07:35:54,r1twe,2,6,,genderqueer,Posted in r/ainbow and was directed here. Help me figure my gender identity out? (cross-post from r/ainbow).,1332081354.0,"{'created_utc': 1332056154, 'id': 'r1twe', 'num_comments': 2, 'score': 6, 'selftext': '', 'subreddit': 'genderqueer', 'title': 'Posted in r/ainbow and was directed here. Help me figure my gender identity out? (cross-post from r/ainbow).', 'created': 1332081354.0}"
2012-03-21 16:29:04,r6wx8,2,43,,genderqueer,"Rocky Horror Show writer, ""Im more male than female, but if I want to go out in a frock I will.",1332372544.0,"{'created_utc': 1332347344, 'id': 'r6wx8', 'num_comments': 2, 'score': 43, 'selftext': '', 'subreddit': 'genderqueer', 'title': 'Rocky Horror Show writer, ""Im more male than female, but if I want to go out in a frock I will.', 'created': 1332372544.0}"
2012-03-21 23:27:54,r7ill,3,14,"I decided to submit finally. I know that at least one other person in this sub-reddit has felt this way too (I hope). 
Here's my story: About a year ago, I came out as trans* to my parents (who are gay -- which I thought would make them more supportive). Initially, they were supportive because I seemed happy and whatnot. After about a month, though, my mom became less and less supportive. She's been like ""you were born a girl and you should act as one."" It really upset me but I continued to dress in loose clothes and button ups. The beginning of summer, my step mom's kids came to stay with us and I had to come out to them. The youngest, Haven, was the most supportive. She helped me so much -- calling by my preferred name and pronouns. One day while I was out, though, she got into a fight with my mom's other kid, Ryan, and it made my step mom pull me aside and tell me that I need to come out to Ryan and his dad because she didn't want to see Ryan &amp; Haven arguing over whether **I** was a girl or boy. Haven and her brother have gone home and all but more and more recently I've been having conflicting feelings. I'm not sure if coming out was my best choice especially if this could have been a ""phase"" (I hate that phrase, really). 
My question is: what can I do? I love being able to call myself a boy but I also love dresses and skirts and frills. I've never been able to put a name to my feelings so I went with trans* because that seemed to fit the most at the time but when I found the term ""gender queer"", I realized that I shouldn't have jumped so quickly into coming out as trans. Any time I go out with my mom to get clothes, she questions me. Like, I was trying out dresses and she said ""I thought you wanted to be a boy"". How would I go about explaining everything to her and my step mom?",genderqueer,I've been creeping here for awhile and.. ,1332397674.0,"{'created_utc': 1332372474, 'id': 'r7ill', 'num_comments': 3, 'score': 14, 'selftext': 'I decided to submit finally. I know that at least one other person in this sub-reddit has felt this way too (I hope). \nHere\'s my story: About a year ago, I came out as trans* to my parents (who are gay -- which I thought would make them more supportive). Initially, they were supportive because I seemed happy and whatnot. After about a month, though, my mom became less and less supportive. She\'s been like ""you were born a girl and you should act as one."" It really upset me but I continued to dress in loose clothes and button ups. The beginning of summer, my step mom\'s kids came to stay with us and I had to come out to them. The youngest, Haven, was the most supportive. She helped me so much -- calling by my preferred name and pronouns. One day while I was out, though, she got into a fight with my mom\'s other kid, Ryan, and it made my step mom pull me aside and tell me that I need to come out to Ryan and his dad because she didn\'t want to see Ryan &amp; Haven arguing over whether **I** was a girl or boy. Haven and her brother have gone home and all but more and more recently I\'ve been having conflicting feelings. I\'m not sure if coming out was my best choice especially if this could have been a ""phase"" (I hate that phrase, really). \nMy question is: what can I do? I love being able to call myself a boy but I also love dresses and skirts and frills. I\'ve never been able to put a name to my feelings so I went with trans* because that seemed to fit the most at the time but when I found the term ""gender queer"", I realized that I shouldn\'t have jumped so quickly into coming out as trans. Any time I go out with my mom to get clothes, she questions me. Like, I was trying out dresses and she said ""I thought you wanted to be a boy"". How would I go about explaining everything to her and my step mom?', 'subreddit': 'genderqueer', 'title': ""I've been creeping here for awhile and.. "", 'created': 1332397674.0}"
2012-03-22 02:31:40,r7rt0,9,12,"I've recently begun crossdressing as a way to express my more feminine side, and I've been enjoying it. I have a sizable group of girl friends who want to help me dress up, but there haven't been any good excuses or opportunities (or at least that we've noticed) for that. So, I turn to you guys and gals and otherwise for help. I'm currently very concretely closeted, but I'm anxious for opportunities to get out in the open and attempt to pass, but I want to do it in situations where being noticed would not be a problem. I'm already anxiously awaiting Halloween, but I was wondering if there were any other opportunities you could suggest that we may not have thought of/should be out on the lookout for. Thanks in advance!",genderqueer,Opportunities/Excuse to Express Feminine Side?,1332408700.0,"{'created_utc': 1332383500, 'id': 'r7rt0', 'num_comments': 9, 'score': 12, 'selftext': ""I've recently begun crossdressing as a way to express my more feminine side, and I've been enjoying it. I have a sizable group of girl friends who want to help me dress up, but there haven't been any good excuses or opportunities (or at least that we've noticed) for that. So, I turn to you guys and gals and otherwise for help. I'm currently very concretely closeted, but I'm anxious for opportunities to get out in the open and attempt to pass, but I want to do it in situations where being noticed would not be a problem. I'm already anxiously awaiting Halloween, but I was wondering if there were any other opportunities you could suggest that we may not have thought of/should be out on the lookout for. Thanks in advance!"", 'subreddit': 'genderqueer', 'title': 'Opportunities/Excuse to Express Feminine Side?', 'created': 1332408700.0}"
2012-03-22 06:39:30,r823i,1,9,"Ok Ill admit; I like being a guy. However, at times, when that ""mood"" strikes me, I find myself longing to be a woman sometimes. Not just physically but emotionally having a straight man and all. I'm not certain what this makes me and what term to put on it but I just thought Id share and maybe I'm not as cisgendered as I thought originally. Ive never heard of anyone else saying something like this but maybe there are others out there, I don't know. Its just the thought of being a woman and even the possibility of getting knocked up by a man just kinda helps that ""mood"". Yeah... its more or less though only when I'm in that ""mood."" Feel free to critique help or whatever or just comment.",genderqueer,Gender Queer Myself?,1332423570.0,"{'created_utc': 1332398370, 'id': 'r823i', 'num_comments': 1, 'score': 9, 'selftext': 'Ok Ill admit; I like being a guy. However, at times, when that ""mood"" strikes me, I find myself longing to be a woman sometimes. Not just physically but emotionally having a straight man and all. I\'m not certain what this makes me and what term to put on it but I just thought Id share and maybe I\'m not as cisgendered as I thought originally. Ive never heard of anyone else saying something like this but maybe there are others out there, I don\'t know. Its just the thought of being a woman and even the possibility of getting knocked up by a man just kinda helps that ""mood"". Yeah... its more or less though only when I\'m in that ""mood."" Feel free to critique help or whatever or just comment.', 'subreddit': 'genderqueer', 'title': 'Gender Queer Myself?', 'created': 1332423570.0}"
2012-03-22 09:13:52,r85i2,4,8,"**I posted this is the wrong place yesterday, and so I've posted it here instead**

Hi there, the title is likely confusing and unclear. If that's the case, then it somewhat eludes to how I feel. For years I have felt this constant to-and-fro feeling towards being trans/not trans. And I've just been needing a little place where I can talk about how I feel without being judged. If you don't care for that then feel free to stop reading.

It all started when I was about 12 (now 19) when I started to get envious of girls over, well most things. From the fact that they got to dress a certain way, to the fact that their bodies looked a certain way compared to the way mine was starting to become etc (puberty's a bitch) but after about a year (at an all boy school) I kind of got comfortable with being a guy and was happy, playing in the football (soccer) team, Rugby team and water polo team as well as doing a little fencing at the school. I was ok with being a guy, but every so often would wonder what if I were a girl.

At 15 I started hanging around some girls from an all girl school close by and it started making me feel dysphoric again. I questioned a lot about myself, but obviously kept it all inside and internalised my jealousy and became self-hating.

It was at this time that I started truly writing music that I felt had any meaning and substance to it. I started to feel as though the fluidity and interplay of counter melodies I created symbolised how I felt about my gender, whilst the harsh, aggressive chugging riffs embodied my anger, which at first I was aimed at myself, but later became aimed at the world for making me think I couldn't express myself.

Fast forward to now and I suddenly go on reddit, I find people who talk about ""genderfluidity"" and the like, and get intrigued. I keep reading and I feel as though I identify with this idea of being somewhere inbetween Male and Female, being both and niether at the same time. I love being a guy at times, but at others I hate it... It's hard to verbalise how I actually feel, like there aren't the words in the English language to describe it (or that I just lack the eloquence to find the correct words). So I'm going to use a word coined by my younger brother - Omniflage, to mean when that all encompassing feeling when you feel odd or weird, like something is wrong but don't know why or when something isn't wrong.

The main issue I have is, how do I tell people, or express myself if I'm not even sure how I feel? Now for some the answer may be a simple ""just do what feels right"" but for me, with religious Jewish family (not my immediate family, but grandparents, uncles and aunts etc. who I see regularly) as well as my friends being wholly ignorant when it comes to this kind of thing, it's hard to do something without being scared or freaked out that something bad will happen.

I guess I don't really know why I wrote this, but I just needed somewhere where I could finally say exactly how I've been thinking and get my thoughts out there, so that I don't unnecessarily put a label on myself for someone else to understand my thoughts or so I don't try to fit myself into something I'm not. I'm still unsure as to who I am or how I feel myself, which may contribute to why I have yet to express this externally. I'm aware this is entirely incoherent and probably not worth any kind of read, but for me this has already helped in terms of being highly therapeutic.

TL;DR Wah Wah Wah - life story - I'm not sure how to feel - thanks for reading",genderqueer,"A little help, or something... unsure here (x-post 
from r/transgender)",1332432832.0,"{'created_utc': 1332407632, 'id': 'r85i2', 'num_comments': 4, 'score': 8, 'selftext': '**I posted this is the wrong place yesterday, and so I\'ve posted it here instead**\n\nHi there, the title is likely confusing and unclear. If that\'s the case, then it somewhat eludes to how I feel. For years I have felt this constant to-and-fro feeling towards being trans/not trans. And I\'ve just been needing a little place where I can talk about how I feel without being judged. If you don\'t care for that then feel free to stop reading.\n\nIt all started when I was about 12 (now 19) when I started to get envious of girls over, well most things. From the fact that they got to dress a certain way, to the fact that their bodies looked a certain way compared to the way mine was starting to become etc (puberty\'s a bitch) but after about a year (at an all boy school) I kind of got comfortable with being a guy and was happy, playing in the football (soccer) team, Rugby team and water polo team as well as doing a little fencing at the school. I was ok with being a guy, but every so often would wonder what if I were a girl.\n\nAt 15 I started hanging around some girls from an all girl school close by and it started making me feel dysphoric again. I questioned a lot about myself, but obviously kept it all inside and internalised my jealousy and became self-hating.\n\nIt was at this time that I started truly writing music that I felt had any meaning and substance to it. I started to feel as though the fluidity and interplay of counter melodies I created symbolised how I felt about my gender, whilst the harsh, aggressive chugging riffs embodied my anger, which at first I was aimed at myself, but later became aimed at the world for making me think I couldn\'t express myself.\n\nFast forward to now and I suddenly go on reddit, I find people who talk about ""genderfluidity"" and the like, and get intrigued. I keep reading and I feel as though I identify with this idea of being somewhere inbetween Male and Female, being both and niether at the same time. I love being a guy at times, but at others I hate it... It\'s hard to verbalise how I actually feel, like there aren\'t the words in the English language to describe it (or that I just lack the eloquence to find the correct words). So I\'m going to use a word coined by my younger brother - Omniflage, to mean when that all encompassing feeling when you feel odd or weird, like something is wrong but don\'t know why or when something isn\'t wrong.\n\nThe main issue I have is, how do I tell people, or express myself if I\'m not even sure how I feel? Now for some the answer may be a simple ""just do what feels right"" but for me, with religious Jewish family (not my immediate family, but grandparents, uncles and aunts etc. who I see regularly) as well as my friends being wholly ignorant when it comes to this kind of thing, it\'s hard to do something without being scared or freaked out that something bad will happen.\n\nI guess I don\'t really know why I wrote this, but I just needed somewhere where I could finally say exactly how I\'ve been thinking and get my thoughts out there, so that I don\'t unnecessarily put a label on myself for someone else to understand my thoughts or so I don\'t try to fit myself into something I\'m not. I\'m still unsure as to who I am or how I feel myself, which may contribute to why I have yet to express this externally. I\'m aware this is entirely incoherent and probably not worth any kind of read, but for me this has already helped in terms of being highly therapeutic.\n\nTL;DR Wah Wah Wah - life story - I\'m not sure how to feel - thanks for reading', 'subreddit': 'genderqueer', 'title': 'A little help, or something... unsure here (x-post \nfrom r/transgender)', 'created': 1332432832.0}"
2012-03-23 18:04:13,ra9wp,10,8,,genderqueer,My submission to the Sock it to me  Sock Contest,1332551053.0,"{'created_utc': 1332525853, 'id': 'ra9wp', 'num_comments': 10, 'score': 8, 'selftext': '', 'subreddit': 'genderqueer', 'title': 'My submission to the Sock it to me  Sock Contest', 'created': 1332551053.0}"
2012-03-25 02:58:39,rc8bh,36,56,,genderqueer,Facebook's double standard,1332669519.0,"{'created_utc': 1332644319, 'id': 'rc8bh', 'num_comments': 36, 'score': 56, 'selftext': '', 'subreddit': 'genderqueer', 'title': ""Facebook's double standard"", 'created': 1332669519.0}"
2012-03-26 04:38:00,rdr20,4,10,,genderqueer,I started a blog about my experience presenting androgynously/ambiguously.,1332761880.0,"{'created_utc': 1332736680, 'id': 'rdr20', 'num_comments': 4, 'score': 10, 'selftext': '', 'subreddit': 'genderqueer', 'title': 'I started a blog about my experience presenting androgynously/ambiguously.', 'created': 1332761880.0}"
