created_utc,id,num_comments,score,selftext,subreddit,title,created,d_
2012-02-17 06:57:23,ptl6p,4,3,"As a male that dresses female and has been doing so long enough that I can pass as female. I run into issues at concerts and even local shows. (I guess this applies to all patdowns really) whenever I go to a show I get put in the female frisk line. So far I have got out of line and went to the male line this is not fun because I then have to tell every staff member that I am in fact a dude and yes I have balls. I think it would be easier to stay in the female line, but then I have that chick working it finding my bits and I can’t see that going super great. 

Have any of you gone through the other (presented) genders line and had it work and be cool, or is this just a bad situation?
",genderqueer,Going to shows?/frisks?,1329487043.0,"{'created_utc': 1329461843, 'id': 'ptl6p', 'num_comments': 4, 'score': 3, 'selftext': 'As a male that dresses female and has been doing so long enough that I can pass as female. I run into issues at concerts and even local shows. (I guess this applies to all patdowns really) whenever I go to a show I get put in the female frisk line. So far I have got out of line and went to the male line this is not fun because I then have to tell every staff member that I am in fact a dude and yes I have balls. I think it would be easier to stay in the female line, but then I have that chick working it finding my bits and I can’t see that going super great. \n\nHave any of you gone through the other (presented) genders line and had it work and be cool, or is this just a bad situation?\n', 'subreddit': 'genderqueer', 'title': 'Going to shows?/frisks?', 'created': 1329487043.0}"
2012-02-17 19:45:59,pu9zv,10,8,"Hi guys! I've been kicking around an idea for a clothing business. I, at 235 lbs and at 5'2"", have a hell of a time finding clothes that fit me. Once I find stuff in my waist size, I usually have a pair of pants that's got so much extra material at the legs, I could probably make myself a second pair. Finding shirts is also a hassle, especially nice ones. I have a thick neck and fairly broad shoulders, but...again, I'm very wee in the height area. 


I'm sure there's plenty of people around here who have problems finding clothes that fit them. I know my ex-girlfriend had troubles, being that she was close to 6'4"" and broad chested. And there's the other side, very slender and small gentleman. It's difficult to get out of the ""twelve year old"" looking phase when one's clothes all come from the little boy's section.


I also want to do something for the Genderqueer crowd, maybe find some way to make androgynous clothing. Any genderqueer people have suggestions as to what would make good clothing options? 


Basically, I just have this idea of being able to make a store for people who'se genetic makeup don't necessarily ""fit"" the usual store idea of what sizes should be for clothing. Primarily trans focused, of course, but honestly, I've known plenty of cis people who have had these same problems. I just don't have the technical knowledge to...well, really do any of this. I've been looking up how to open a small business, but that's definitely going to take a while to sift through.


Would anyone be interested in this, if it was a thing? Does anyone have any advice, ideas, tips, experience they'd like to share? What are some common sizes that you all have problems finding, or what sort of clothes do you think would be really cute/handsome/great? ",genderqueer,Clothing Store Idea (Cross posted from TransSpace),1329533159.0,"{'created_utc': 1329507959, 'id': 'pu9zv', 'num_comments': 10, 'score': 8, 'selftext': 'Hi guys! I\'ve been kicking around an idea for a clothing business. I, at 235 lbs and at 5\'2"", have a hell of a time finding clothes that fit me. Once I find stuff in my waist size, I usually have a pair of pants that\'s got so much extra material at the legs, I could probably make myself a second pair. Finding shirts is also a hassle, especially nice ones. I have a thick neck and fairly broad shoulders, but...again, I\'m very wee in the height area. \n\n\nI\'m sure there\'s plenty of people around here who have problems finding clothes that fit them. I know my ex-girlfriend had troubles, being that she was close to 6\'4"" and broad chested. And there\'s the other side, very slender and small gentleman. It\'s difficult to get out of the ""twelve year old"" looking phase when one\'s clothes all come from the little boy\'s section.\n\n\nI also want to do something for the Genderqueer crowd, maybe find some way to make androgynous clothing. Any genderqueer people have suggestions as to what would make good clothing options? \n\n\nBasically, I just have this idea of being able to make a store for people who\'se genetic makeup don\'t necessarily ""fit"" the usual store idea of what sizes should be for clothing. Primarily trans focused, of course, but honestly, I\'ve known plenty of cis people who have had these same problems. I just don\'t have the technical knowledge to...well, really do any of this. I\'ve been looking up how to open a small business, but that\'s definitely going to take a while to sift through.\n\n\nWould anyone be interested in this, if it was a thing? Does anyone have any advice, ideas, tips, experience they\'d like to share? What are some common sizes that you all have problems finding, or what sort of clothes do you think would be really cute/handsome/great? ', 'subreddit': 'genderqueer', 'title': 'Clothing Store Idea (Cross posted from TransSpace)', 'created': 1329533159.0}"
2012-02-18 00:33:12,pumro,32,12,"I feel like I need help from people who might understand my gender better.  I talked about this with a friend, but all he did was tell me the side effects of anything I mentioned might help, but not things I necessarily want to do.

I guess, the easiest way to explain it is that I wish I was a hermaphrodite.  Instead, I'm female, genderfluid and, to put it simply, pansexual.  I'm sick of my female body, but the desire to be FtM isn't strong enough to seriously or jokingly consider it, especially since bottom surgery can't create functioning parts, it wouldn't be worth it to me.  Plus, I like my ladyparts, they're fun, top and bottom.  I just really wish I could experience both worlds at once.  Unfortunately, if my body matched my brain I can't even *imagine* what would happen to my relationships with others, sexually or platonically.

I feel most dysphoric when it's ""that time of the month"" whatever you want to call it, shark week I don't care.  But I don't want to get on birth control to stop it.  The potential feminizing effects are too much for me, not to mention the other side effects like weight gain and loss of libido, plus I've heard it can be unhealthy.  It's unfortunate that taking enough testosterone to do what I want also has similar side effects, plus seems to be potentially more harmful, because I would rather deal with becoming more masculine than feminine.

This is the first time I've felt so dysphoric, and I'm kind of hoping it's just a one-off time.  The worst part is that even though I want to stop menstruating, I'd be paranoid all the time that I was pregnant and I think knowing I'm not is worth more to me than not bleeding.  I wish I wasn't so young and that I didn't want to someday have kids, because then something like a hysterectomy might be an option, but it's not.

I'm not really sure what I can do other than wait it out, hope it goes away and never comes back this strong...",genderqueer,Feeling dysphoric for really the first time...does anyone have advice?,1329550392.0,"{'created_utc': 1329525192, 'id': 'pumro', 'num_comments': 32, 'score': 12, 'selftext': 'I feel like I need help from people who might understand my gender better.  I talked about this with a friend, but all he did was tell me the side effects of anything I mentioned might help, but not things I necessarily want to do.\n\nI guess, the easiest way to explain it is that I wish I was a hermaphrodite.  Instead, I\'m female, genderfluid and, to put it simply, pansexual.  I\'m sick of my female body, but the desire to be FtM isn\'t strong enough to seriously or jokingly consider it, especially since bottom surgery can\'t create functioning parts, it wouldn\'t be worth it to me.  Plus, I like my ladyparts, they\'re fun, top and bottom.  I just really wish I could experience both worlds at once.  Unfortunately, if my body matched my brain I can\'t even *imagine* what would happen to my relationships with others, sexually or platonically.\n\nI feel most dysphoric when it\'s ""that time of the month"" whatever you want to call it, shark week I don\'t care.  But I don\'t want to get on birth control to stop it.  The potential feminizing effects are too much for me, not to mention the other side effects like weight gain and loss of libido, plus I\'ve heard it can be unhealthy.  It\'s unfortunate that taking enough testosterone to do what I want also has similar side effects, plus seems to be potentially more harmful, because I would rather deal with becoming more masculine than feminine.\n\nThis is the first time I\'ve felt so dysphoric, and I\'m kind of hoping it\'s just a one-off time.  The worst part is that even though I want to stop menstruating, I\'d be paranoid all the time that I was pregnant and I think knowing I\'m not is worth more to me than not bleeding.  I wish I wasn\'t so young and that I didn\'t want to someday have kids, because then something like a hysterectomy might be an option, but it\'s not.\n\nI\'m not really sure what I can do other than wait it out, hope it goes away and never comes back this strong...', 'subreddit': 'genderqueer', 'title': 'Feeling dysphoric for really the first time...does anyone have advice?', 'created': 1329550392.0}"
2012-02-18 02:51:53,purvs,32,43,,genderqueer,The Genderbread Person: 4 aspects of gender [from Tumblr],1329558713.0,"{'created_utc': 1329533513, 'id': 'purvs', 'num_comments': 32, 'score': 43, 'selftext': '', 'subreddit': 'genderqueer', 'title': 'The Genderbread Person: 4 aspects of gender [from Tumblr]', 'created': 1329558713.0}"
2012-02-18 21:10:55,pvmtm,4,25,"So yesterday I went to the mall and got my very own pair of boys' pants!  I feel so awesome and comfortable and like myself in them.  I feel like I'm finally at a point in my life where I can start presenting as whatever I feel that I am, and it's a really really really cool feeling ^_^

It's such a little thing, but I'm really excited and I wanted to share with people who would understand ^_^",genderqueer,Just got my first pair of boy pants in over a decade &lt;3,1329624655.0,"{'created_utc': 1329599455, 'id': 'pvmtm', 'num_comments': 4, 'score': 25, 'selftext': ""So yesterday I went to the mall and got my very own pair of boys' pants!  I feel so awesome and comfortable and like myself in them.  I feel like I'm finally at a point in my life where I can start presenting as whatever I feel that I am, and it's a really really really cool feeling ^_^\n\nIt's such a little thing, but I'm really excited and I wanted to share with people who would understand ^_^"", 'subreddit': 'genderqueer', 'title': 'Just got my first pair of boy pants in over a decade &lt;3', 'created': 1329624655.0}"
2012-02-18 22:12:48,pvpak,10,6,"I'm in a relationship with a straight, cisgendered male. He's loving and caring and wonderful and just about everything I could ask for, most of the time, except that he doesn't acknowledge me as anything but female. He looks at my body, and it's simple to him, he simply thinks, ""synesthesiatic is a girl."" If I present as my male self, he says I'm unattractive. I guess he doesn't love me as much if I'm not a girl, either. 

I've fallen back into shoving myself into girl clothes and being uncomfortable with myself. I don't know how to explain to him who and what I really am. My parents don't even acknowledge my genderqueer'dness, and my mother just stops the conversation whenever I talk about being a guy. 

I live on my own, not with my parents, and I'm of college age, but not in college. I feel like my self-worth is based on whether or not I can express my gender as I see fit and I feel like more and more I'm just being shoved into everyone else's ideas of who I should be. 

I'm pretty obviously biologically female and I hate looking in the mirror because it's not who I am in my mind. I feel ugly and stupid as a girl, and as a guy I'm the goddamn honey badger. 

Please help, GQ, I don't know what to do. ",genderqueer,"GQ friends, I need some advice...",1329628368.0,"{'created_utc': 1329603168, 'id': 'pvpak', 'num_comments': 10, 'score': 6, 'selftext': 'I\'m in a relationship with a straight, cisgendered male. He\'s loving and caring and wonderful and just about everything I could ask for, most of the time, except that he doesn\'t acknowledge me as anything but female. He looks at my body, and it\'s simple to him, he simply thinks, ""synesthesiatic is a girl."" If I present as my male self, he says I\'m unattractive. I guess he doesn\'t love me as much if I\'m not a girl, either. \n\nI\'ve fallen back into shoving myself into girl clothes and being uncomfortable with myself. I don\'t know how to explain to him who and what I really am. My parents don\'t even acknowledge my genderqueer\'dness, and my mother just stops the conversation whenever I talk about being a guy. \n\nI live on my own, not with my parents, and I\'m of college age, but not in college. I feel like my self-worth is based on whether or not I can express my gender as I see fit and I feel like more and more I\'m just being shoved into everyone else\'s ideas of who I should be. \n\nI\'m pretty obviously biologically female and I hate looking in the mirror because it\'s not who I am in my mind. I feel ugly and stupid as a girl, and as a guy I\'m the goddamn honey badger. \n\nPlease help, GQ, I don\'t know what to do. ', 'subreddit': 'genderqueer', 'title': 'GQ friends, I need some advice...', 'created': 1329628368.0}"
2012-02-20 05:36:03,pxfdv,5,5,"I have a friend who is by commonly accepted standards female and her parents have raised her as such, but she seems very dissatisfied with that identification. She frequently says things like ""I wish I was a boy/I wish I looked like a boy."" She's very self-conscious about her height (I don't know her exact height but I'm 5'2"" and taller than her) and looks in ways that make it seem like she really resents the ""femininity"" traditionally associated with them. Today, she said she resents being identified as female. She said she ""knows"" she's female but finds it somewhat unpleasant or even offensive when another person comments on her gender. 

There are other times when she does seem to be receptive of female identity, though. She will sometimes (rarely) have a confident attitude towards feminine traits and female identity. When this happens I start to wonder if she would benefit from taking time to rethink gender, and possibly discover that she is another gender or even just rethinking what it means to her to be female. 

It seems like she is very upset a large portion of the time in relation to her experiences with gender. Much of this I presume has to do with her upbringing, as she has very conservative parents who have already given her a heaping load of bullshit over her bisexuality. I try not to be gender specific in general (I really only rarely find a need to be) and I am particularly sensitive around her because, well, it just seems like other people give her a hard time without even meaning to and I don't want to contribute to that. I'm sure gender issues would not ease her home and social life at all but she will be leaving for college soon and I suspect that starting to tackle the issue on her own might open the door to a more positive side of life for her. 

I want to help my friend, but I don't want to say or do anything inappropriate or make the situation worse. We only met last year but she is a truly wonderful person and I would be so happy if she found a way to be more comfortable with herself. If the best course of action is to let her figure out things by herself and just be supportive of whatever she wants, I will, but if I can do more I want to. I haven't had very much trouble with my own gender so it is hard for me to know what the most sensitive action is. Can any of you offer any advice?

**TL;DR** - My friend seems to resent female identity most of the time, I think she might be happier if she at least reevaluated her opinions on gender but I don't want to broach the subject in an insensitive way. I want to help I don't know what to do :(",genderqueer,I think my friend feels obligated to accept the gender society has labeled her with... Is there any way I can respectfully suggest that she might want to reconsider her own feelings/identification?,1329741363.0,"{'created_utc': 1329716163, 'id': 'pxfdv', 'num_comments': 5, 'score': 5, 'selftext': 'I have a friend who is by commonly accepted standards female and her parents have raised her as such, but she seems very dissatisfied with that identification. She frequently says things like ""I wish I was a boy/I wish I looked like a boy."" She\'s very self-conscious about her height (I don\'t know her exact height but I\'m 5\'2"" and taller than her) and looks in ways that make it seem like she really resents the ""femininity"" traditionally associated with them. Today, she said she resents being identified as female. She said she ""knows"" she\'s female but finds it somewhat unpleasant or even offensive when another person comments on her gender. \n\nThere are other times when she does seem to be receptive of female identity, though. She will sometimes (rarely) have a confident attitude towards feminine traits and female identity. When this happens I start to wonder if she would benefit from taking time to rethink gender, and possibly discover that she is another gender or even just rethinking what it means to her to be female. \n\nIt seems like she is very upset a large portion of the time in relation to her experiences with gender. Much of this I presume has to do with her upbringing, as she has very conservative parents who have already given her a heaping load of bullshit over her bisexuality. I try not to be gender specific in general (I really only rarely find a need to be) and I am particularly sensitive around her because, well, it just seems like other people give her a hard time without even meaning to and I don\'t want to contribute to that. I\'m sure gender issues would not ease her home and social life at all but she will be leaving for college soon and I suspect that starting to tackle the issue on her own might open the door to a more positive side of life for her. \n\nI want to help my friend, but I don\'t want to say or do anything inappropriate or make the situation worse. We only met last year but she is a truly wonderful person and I would be so happy if she found a way to be more comfortable with herself. If the best course of action is to let her figure out things by herself and just be supportive of whatever she wants, I will, but if I can do more I want to. I haven\'t had very much trouble with my own gender so it is hard for me to know what the most sensitive action is. Can any of you offer any advice?\n\n**TL;DR** - My friend seems to resent female identity most of the time, I think she might be happier if she at least reevaluated her opinions on gender but I don\'t want to broach the subject in an insensitive way. I want to help I don\'t know what to do :(', 'subreddit': 'genderqueer', 'title': 'I think my friend feels obligated to accept the gender society has labeled her with... Is there any way I can respectfully suggest that she might want to reconsider her own feelings/identification?', 'created': 1329741363.0}"
2012-02-20 17:42:12,py0co,0,17,,genderqueer,Embodying Gender Differences  »  Sociological Images,1329784932.0,"{'created_utc': 1329759732, 'id': 'py0co', 'num_comments': 0, 'score': 17, 'selftext': '', 'subreddit': 'genderqueer', 'title': 'Embodying Gender Differences  »  Sociological Images', 'created': 1329784932.0}"
2012-02-20 18:26:45,py2gx,0,20,,genderqueer,Kids who veer from gender norms at higher risk for abuse - CNN.com,1329787605.0,"{'created_utc': 1329762405, 'id': 'py2gx', 'num_comments': 0, 'score': 20, 'selftext': '', 'subreddit': 'genderqueer', 'title': 'Kids who veer from gender norms at higher risk for abuse - CNN.com', 'created': 1329787605.0}"
2012-02-21 14:36:37,pzc47,6,49,,genderqueer,"My partner didn't make this, but this is how she makes me feel. And she's been playing way too much Pokemon lately (xpost from r/gaming)",1329860197.0,"{'created_utc': 1329834997, 'id': 'pzc47', 'num_comments': 6, 'score': 49, 'selftext': '', 'subreddit': 'genderqueer', 'title': ""My partner didn't make this, but this is how she makes me feel. And she's been playing way too much Pokemon lately (xpost from r/gaming)"", 'created': 1329860197.0}"
2012-02-21 15:56:18,pzf7j,1,16,"I am in my 40s, but I have a fairly nice body, and I am pretty nice. Was married with another GQ (pretty as hell, she had a gay boy inside) and for the time she liked what we did, till the antipsychotics cut down her sexual urges. We divorced in 2007, but a range of reasons.

I am not ""easy"". I am naturally drawn to those halfway the gender polarity; butch girls, effeminate boys, maybe even other genderqueers. Problem is I live in a country of faux-tolerants - the Netherlands. It isn't as much as the Dutch are tolerant, it's more most of them are ""bourgeois"" and ""unimaginative"" and ""apathic"".

So I went dating. Sure I did the dark rooms, and got some **wide eyed stares** there. They don't often get my type who goes through ten cocks on a night. It's nice, but it doesn't leave me fulfilled. I'll do that about four times every year, plus some on the side, all quite safe.

So, where can I date best? What is the best place to find the like-minded and be left satisfied and happy and *with someone* ? Because the traditional dating sites do not have much power for someone who is *and* bisexual, *and* pansexual, *and* genderqueer, *and* rather intense...

Mhurrr
",genderqueer,Dating,1329864978.0,"{'created_utc': 1329839778, 'id': 'pzf7j', 'num_comments': 1, 'score': 16, 'selftext': 'I am in my 40s, but I have a fairly nice body, and I am pretty nice. Was married with another GQ (pretty as hell, she had a gay boy inside) and for the time she liked what we did, till the antipsychotics cut down her sexual urges. We divorced in 2007, but a range of reasons.\n\nI am not ""easy"". I am naturally drawn to those halfway the gender polarity; butch girls, effeminate boys, maybe even other genderqueers. Problem is I live in a country of faux-tolerants - the Netherlands. It isn\'t as much as the Dutch are tolerant, it\'s more most of them are ""bourgeois"" and ""unimaginative"" and ""apathic"".\n\nSo I went dating. Sure I did the dark rooms, and got some **wide eyed stares** there. They don\'t often get my type who goes through ten cocks on a night. It\'s nice, but it doesn\'t leave me fulfilled. I\'ll do that about four times every year, plus some on the side, all quite safe.\n\nSo, where can I date best? What is the best place to find the like-minded and be left satisfied and happy and *with someone* ? Because the traditional dating sites do not have much power for someone who is *and* bisexual, *and* pansexual, *and* genderqueer, *and* rather intense...\n\nMhurrr\n', 'subreddit': 'genderqueer', 'title': 'Dating', 'created': 1329864978.0}"
2012-02-22 21:56:20,q1ijs,0,5,,genderqueer,"So, new blog. This one about my gender confusion and rainbows in general. Cheers!",1329972980.0,"{'created_utc': 1329947780, 'id': 'q1ijs', 'num_comments': 0, 'score': 5, 'selftext': '', 'subreddit': 'genderqueer', 'title': 'So, new blog. This one about my gender confusion and rainbows in general. Cheers!', 'created': 1329972980.0}"
2012-02-24 01:02:40,q3ctj,2,13,,genderqueer,Gender and the tyranny of the 'normal',1330070560.0,"{'created_utc': 1330045360, 'id': 'q3ctj', 'num_comments': 2, 'score': 13, 'selftext': '', 'subreddit': 'genderqueer', 'title': ""Gender and the tyranny of the 'normal'"", 'created': 1330070560.0}"
