created_utc,id,num_comments,score,selftext,subreddit,title,created,d_
2012-03-26 05:38:12,rdtdw,4,17,"I need someplace to talk about this, just to get it off my chest. A good friend of mine started talking to me about a year ago about her husband. She confessed to me that he was transgendered, and had just came out to her. She didn't know who else to really talk to about this but knew I was all down with the LGBT thing so thought I was the safest one to talk to about it all. I gave her advice, listened to her, and let her know if she ever needed to talk I was here for her. 

What I didn't tell her at first was that I spent most of my early life looking into gender studies and always felt myself as being trans(f2m) I remember reading an article about a woman who got a sex change to male in her 40s - after she was married with children. It struck such a cord with me when I was a kid. I even went so far as to do a lot of research and think about reconsigment surgery. It wasn't until I was talking to a trans friend of mine about it, and I voiced my worries - I'm only 4'9"" and have a hard enough life as female, that I wasn't sure if I could be male and at this height. She suggested I try living as a female - something I was born as but have never really LIVED as. Even as a small child I always passed as a boy, I kept my hair short, my friends were boys, and in high school I even adapted a boy's name as a nickname. So I did.. I lived life as a female from age 19 onward. Fast foward to now - I'm married, with 2 kids. My husband knows of my past and my feelings - he's been with me since I was a teen - but admits he loves the female side of me. 

And with my friend talking to me about her husband, a lot of long lost buried thoughts and feelings are coming back. Like I've been lying to myself, or to the world, and that I'm doing a disservice to the trans world because even though I feel inherently male, I still live in a female body, but I don't want to live a half life. I don't want to have to feel like I need to justify myself in why I feel like this and why I don't think I can change. Not because I'm worried about my husband, or my kids, but because in some weird way I'm so adapted now to life as a female I don't know if I can ever be just ONE gender. I'm not really feeling anymore like I am just male, or just female, but like I'm a wonderful mix of the two.

and I guess I don't know, that for the first time in 10 years a lot of forgotten feelings are coming up and I don't know how to deal with them. I finally came out and told my friend I was trans, and so that's why I know so much, but I feel now like that was a lie, like I thought I WAS trans all those years ago but now? I'm not so sure. 

tl;dr spent most of my life thinking I'm trans, now? not so sure. ",genderqueer,I'm so lost and confused ,1332765492.0,"{'created_utc': 1332740292, 'id': 'rdtdw', 'num_comments': 4, 'score': 17, 'selftext': 'I need someplace to talk about this, just to get it off my chest. A good friend of mine started talking to me about a year ago about her husband. She confessed to me that he was transgendered, and had just came out to her. She didn\'t know who else to really talk to about this but knew I was all down with the LGBT thing so thought I was the safest one to talk to about it all. I gave her advice, listened to her, and let her know if she ever needed to talk I was here for her. \n\nWhat I didn\'t tell her at first was that I spent most of my early life looking into gender studies and always felt myself as being trans(f2m) I remember reading an article about a woman who got a sex change to male in her 40s - after she was married with children. It struck such a cord with me when I was a kid. I even went so far as to do a lot of research and think about reconsigment surgery. It wasn\'t until I was talking to a trans friend of mine about it, and I voiced my worries - I\'m only 4\'9"" and have a hard enough life as female, that I wasn\'t sure if I could be male and at this height. She suggested I try living as a female - something I was born as but have never really LIVED as. Even as a small child I always passed as a boy, I kept my hair short, my friends were boys, and in high school I even adapted a boy\'s name as a nickname. So I did.. I lived life as a female from age 19 onward. Fast foward to now - I\'m married, with 2 kids. My husband knows of my past and my feelings - he\'s been with me since I was a teen - but admits he loves the female side of me. \n\nAnd with my friend talking to me about her husband, a lot of long lost buried thoughts and feelings are coming back. Like I\'ve been lying to myself, or to the world, and that I\'m doing a disservice to the trans world because even though I feel inherently male, I still live in a female body, but I don\'t want to live a half life. I don\'t want to have to feel like I need to justify myself in why I feel like this and why I don\'t think I can change. Not because I\'m worried about my husband, or my kids, but because in some weird way I\'m so adapted now to life as a female I don\'t know if I can ever be just ONE gender. I\'m not really feeling anymore like I am just male, or just female, but like I\'m a wonderful mix of the two.\n\nand I guess I don\'t know, that for the first time in 10 years a lot of forgotten feelings are coming up and I don\'t know how to deal with them. I finally came out and told my friend I was trans, and so that\'s why I know so much, but I feel now like that was a lie, like I thought I WAS trans all those years ago but now? I\'m not so sure. \n\ntl;dr spent most of my life thinking I\'m trans, now? not so sure. ', 'subreddit': 'genderqueer', 'title': ""I'm so lost and confused "", 'created': 1332765492.0}"
2012-03-26 16:47:44,reef8,0,6,,genderqueer,How to deal with friends who are terrible at using the correct gender pronouns? (x-post from /asktransgender),1332805664.0,"{'created_utc': 1332780464, 'id': 'reef8', 'num_comments': 0, 'score': 6, 'selftext': '', 'subreddit': 'genderqueer', 'title': 'How to deal with friends who are terrible at using the correct gender pronouns? (x-post from /asktransgender)', 'created': 1332805664.0}"
2012-03-26 17:10:59,reflc,8,14,"Hey folks, I'm about to take a yoga class and I've run into a bit of a problem. I can't really find good yoga clothes. All the women's stuff is way too tight and feminine and all the men's (what little I could find) would be so baggy that I'll either flash my undies or have my shirt pretty much fall off (then flashing my nice brightly colored sports bra to the world). I just want a nice in between! Does anyone have any experience with this? Thanks! ",genderqueer,Androgynous yoga clothes for the active GQ kid?,1332807059.0,"{'created_utc': 1332781859, 'id': 'reflc', 'num_comments': 8, 'score': 14, 'selftext': ""Hey folks, I'm about to take a yoga class and I've run into a bit of a problem. I can't really find good yoga clothes. All the women's stuff is way too tight and feminine and all the men's (what little I could find) would be so baggy that I'll either flash my undies or have my shirt pretty much fall off (then flashing my nice brightly colored sports bra to the world). I just want a nice in between! Does anyone have any experience with this? Thanks! "", 'subreddit': 'genderqueer', 'title': 'Androgynous yoga clothes for the active GQ kid?', 'created': 1332807059.0}"
2012-03-27 14:42:19,rfw12,23,22,,genderqueer,I'm always out. ,1332884539.0,"{'created_utc': 1332859339, 'id': 'rfw12', 'num_comments': 23, 'score': 22, 'selftext': '', 'subreddit': 'genderqueer', 'title': ""I'm always out. "", 'created': 1332884539.0}"
2012-03-27 19:03:11,rg8yl,0,3,"I've been having a tough time of things lately, hence this new Reddit account.


I am comfortable with my body, to a point. I have had bulimia since I was 12 because I don't feel I look like a ""proper woman"" for some reason. I would not want my body to be male, at any rate.



However, I get frustrated a lot. 



I feel like most of the world consists of those little pink pins and blue pins from the Game of Life and neither set wants to let me hang out with them because I'm a yellow pin. If I spend time with guys, I get along with them, but there's this barrier still; I can't go along to ""guy nights"" because I have breasts and no penis. I don't fit in with the pink pins, either, because women always seem to find me odd and stand-offish no matter how hard I try, and I can't engage with them the same way I can talk to men.



I don't want to change my appearance or identity in any way, I want to be my identity, but I feel it's smothered by all these ideas about what I should look like, how a girl should act, etc. My parents always question me about my social life and get worried if I say I don't really go out, whereas my brother doesn't get interrogated in the same way because it seems OK for guys to be more introverted.


If I dress in plain clothes and don't wear make-up, I get accused of being a lesbian by people I don't even know. Girls comment on my appearance, everything seems so tied in how I look that it makes me rage. If I show up for meetings with my mentor and haven't bothered to do my make-up, she always asks if I'm feeling OK. I get prickly about things, like my boss telling me to tie my hair up better when I have no idea how to make it look nice because I wasn't interested in that stuff as a kid.


I want to have no body at all and just float through life without people basing their analysis on the way I look. I feel so uncomfortable in my own skin purely because of the way people see me. I hate identifying as male or female, being called ""she"", even having a feminine sounding name (it's a flower name).



On a good day I feel like both gender; on a bad day I feel like neither, some kind of alien from outerspace.



I don't know what to make of this and am sorry if anything is offensive.",genderqueer,I don't feel like I fit in anywhere.,1332900191.0,"{'created_utc': 1332874991, 'id': 'rg8yl', 'num_comments': 0, 'score': 3, 'selftext': 'I\'ve been having a tough time of things lately, hence this new Reddit account.\n\n\nI am comfortable with my body, to a point. I have had bulimia since I was 12 because I don\'t feel I look like a ""proper woman"" for some reason. I would not want my body to be male, at any rate.\n\n\n\nHowever, I get frustrated a lot. \n\n\n\nI feel like most of the world consists of those little pink pins and blue pins from the Game of Life and neither set wants to let me hang out with them because I\'m a yellow pin. If I spend time with guys, I get along with them, but there\'s this barrier still; I can\'t go along to ""guy nights"" because I have breasts and no penis. I don\'t fit in with the pink pins, either, because women always seem to find me odd and stand-offish no matter how hard I try, and I can\'t engage with them the same way I can talk to men.\n\n\n\nI don\'t want to change my appearance or identity in any way, I want to be my identity, but I feel it\'s smothered by all these ideas about what I should look like, how a girl should act, etc. My parents always question me about my social life and get worried if I say I don\'t really go out, whereas my brother doesn\'t get interrogated in the same way because it seems OK for guys to be more introverted.\n\n\nIf I dress in plain clothes and don\'t wear make-up, I get accused of being a lesbian by people I don\'t even know. Girls comment on my appearance, everything seems so tied in how I look that it makes me rage. If I show up for meetings with my mentor and haven\'t bothered to do my make-up, she always asks if I\'m feeling OK. I get prickly about things, like my boss telling me to tie my hair up better when I have no idea how to make it look nice because I wasn\'t interested in that stuff as a kid.\n\n\nI want to have no body at all and just float through life without people basing their analysis on the way I look. I feel so uncomfortable in my own skin purely because of the way people see me. I hate identifying as male or female, being called ""she"", even having a feminine sounding name (it\'s a flower name).\n\n\n\nOn a good day I feel like both gender; on a bad day I feel like neither, some kind of alien from outerspace.\n\n\n\nI don\'t know what to make of this and am sorry if anything is offensive.', 'subreddit': 'genderqueer', 'title': ""I don't feel like I fit in anywhere."", 'created': 1332900191.0}"
2012-03-27 20:09:13,rgchj,0,8,,genderqueer,"""Sexting"" and trying to fix my awkward sexlife...",1332904153.0,"{'created_utc': 1332878953, 'id': 'rgchj', 'num_comments': 0, 'score': 8, 'selftext': '', 'subreddit': 'genderqueer', 'title': '""Sexting"" and trying to fix my awkward sexlife...', 'created': 1332904153.0}"
2012-03-29 00:19:36,rif7d,0,3,,genderqueer,My favourite YouTube channel - Genderqueer Chat,1333005576.0,"{'created_utc': 1332980376, 'id': 'rif7d', 'num_comments': 0, 'score': 3, 'selftext': '', 'subreddit': 'genderqueer', 'title': 'My favourite YouTube channel - Genderqueer Chat', 'created': 1333005576.0}"
2012-03-29 18:01:53,rjk4h,12,13,"What are some things a Genderqueer person might wear to a wedding?

My sister asked me this question a while back. She framed it in the form of ""If I ever got married, would you have to wear a dress?"" Asking me if it would be a case of me wanting to be Female presenting at the event. While if I was in shape and looked good in a dress I'd love too. The compromise I gave her was that I would wear a Suit top with a Kilt. She high fived this suggestion, but I've gone back to thinking about it...


Fuck it, I want to wear the dress, and the Tux Jacket, no Tux suit or cumberbund or anything, just the Jacket. 

Would that even look good?",genderqueer,To a wedding...,1333069313.0,"{'created_utc': 1333044113, 'id': 'rjk4h', 'num_comments': 12, 'score': 13, 'selftext': 'What are some things a Genderqueer person might wear to a wedding?\n\nMy sister asked me this question a while back. She framed it in the form of ""If I ever got married, would you have to wear a dress?"" Asking me if it would be a case of me wanting to be Female presenting at the event. While if I was in shape and looked good in a dress I\'d love too. The compromise I gave her was that I would wear a Suit top with a Kilt. She high fived this suggestion, but I\'ve gone back to thinking about it...\n\n\nFuck it, I want to wear the dress, and the Tux Jacket, no Tux suit or cumberbund or anything, just the Jacket. \n\nWould that even look good?', 'subreddit': 'genderqueer', 'title': 'To a wedding...', 'created': 1333069313.0}"
2012-03-30 22:20:45,rll3d,15,17,"Hey, I'm Mickey. I'm 15 years old and gender queer. 

So, today I went to the supermarket to grab the groceries. I saw these two kids staring and whispering, and that was okay with me. I was walking away and then from across the aisle, they scream, ""YO, YOU A BOY OR GIRL"" really obnoxiously. I've received this question many times. At school, the subway, the park, you name it. But I've never had someone draw so much attention to me and embarass me like that. People crowded around. I just told them, ""Neither. I don't really feel like a boy or a girl."" they seemed shocked like that was the most absurd thing they've ever heard, then continued to yell questions (and really personal ones too) across the supermarket when those questions should be asked more quietly. I had to leave because they kept following me and go home crying. I understand they were about 13 only, but it still bothered me. ",genderqueer,How would you handle this situation?,1333171245.0,"{'created_utc': 1333146045, 'id': 'rll3d', 'num_comments': 15, 'score': 17, 'selftext': 'Hey, I\'m Mickey. I\'m 15 years old and gender queer. \n\nSo, today I went to the supermarket to grab the groceries. I saw these two kids staring and whispering, and that was okay with me. I was walking away and then from across the aisle, they scream, ""YO, YOU A BOY OR GIRL"" really obnoxiously. I\'ve received this question many times. At school, the subway, the park, you name it. But I\'ve never had someone draw so much attention to me and embarass me like that. People crowded around. I just told them, ""Neither. I don\'t really feel like a boy or a girl."" they seemed shocked like that was the most absurd thing they\'ve ever heard, then continued to yell questions (and really personal ones too) across the supermarket when those questions should be asked more quietly. I had to leave because they kept following me and go home crying. I understand they were about 13 only, but it still bothered me. ', 'subreddit': 'genderqueer', 'title': 'How would you handle this situation?', 'created': 1333171245.0}"
2012-03-31 20:06:08,rmrop,13,24,,genderqueer,Do I look androgynous enough?,1333249568.0,"{'created_utc': 1333224368, 'id': 'rmrop', 'num_comments': 13, 'score': 24, 'selftext': '', 'subreddit': 'genderqueer', 'title': 'Do I look androgynous enough?', 'created': 1333249568.0}"
