,created_utc,id,num_comments,score,selftext,subreddit,title,created,d_
13,2016-08-07 05:06:02,4wjju5,7,3,"I'm 22 and entering my last semester of college soon.  As my time in college comes to a close, the search for a job begins, and my parents have been hounding me to cut off my hair to improve my odds of being hired, where ever that may be.

I don't exactly consider myself genderfluid, but I'm posting here as I feel it's somewhat relevant as I like having an feminine side to myself. (Ideally I'd wear some clothing that suggest some degree of femininity and shave my body, but I'm rather uncomfortable doing so in public.)

Nearly everyone I talk to about the search for employment and the unfortunate reality that my hair will limit my choices agrees that I need to suck it up and cut it off.  Apparently, if I want long hair I have to establish myself first.  It reaches about 4 inches past my shoulders, isn't dyed, and I just recently had it trimmed to clean up any dead ends and make it look neater.  If I was a girl there'd be no questions asked regarding my hair as it isn't by any means abnormal.  But because I'm a guy, it's not seen as professional.

This situation is no doubt a common one (though the reasons for wanting long hair may differ from person to person), though I feel like my disposition to hair related issues makes things more complicated....
***
I'll try and keep the backstory story short, but I've always been opposed to haircuts.  My parents were always in charge of when I'd get my hair cut and how I'd get it cut, only loosening their grip late into high school to allow it to be slightly longer than the standard nerdy ""my mom picked this cut.""  When I finally expressed interest in growing it, I got the ever repeated talk about how it will make others judge me and how self expression is unimportant as it impacts other's judgments.  Eventually even the slightly longer hair style I wore in high school was revoked from me after my parents secretly scheduled me a haircut, gave me a 3 minutes heads up, and my mother screamed at me until I would submit and have her drive me there and tell them to cut it short.  I couldn't look in the mirror for a week without my feeling nauseous.  Any time someone brought up my hair I felt my stomach do a flip and skin felt like pins and needles.  After two years of college, and more forced haircuts, I finally broke down crying to my mom over the phone telling her I couldn't take another haircut.  This also led to me telling her that I'm interested in guys (I said I was bisexual, though over time I feel like I lean more towards being gay) as the conversation progressed as I was afraid she'd draw conclusions, and I thought I might as well get it out of the way.  Her reaction, while shocked was neither positive or negative, and she hopes it's just a phase though was never nasty to me about it.

The other element to this story is that a good deal of my sexual attraction...is based around hair.  I love guys with long hair, and want to be able to pull off the look myself.  Even when a guy doesn't have long hair I find myself staring whenever someone has a particularly pretty hairstyle.  Even though I prefer guys, girls can have memorizing hairstyles as well.  A particularly pretty hair braid, a colorful pixie cut, I love it all so much.  Having somewhat of a hair fetish makes my predicament even more painful to me, as I often wish I could put my hair in a fancy bun or a fishtail braid.

Last, and fair warning this is really weird.  But for as long as I can remember, I have had a haircutting fetish.  I'm sexually aroused by watching mostly women have their hair cut very short or completely shaved off.  There's no sexual content in these videos/images, just hair cutting.  Perhaps this was a development due to my complete lack of freedom regarding my own hair and ability to be feminine.  I can't really explain why I have such a fetish, but I just do.  It was essentially all I would view for sexual pleasure in my high school years, though over time I distanced myself from it as it was upsetting to me to be aroused by something like that.  Having my haircut short mimics the feelings of humiliation and punishment present in some of those videos and makes me feel like I'm being disgraced.  Hence the not being able to look in a mirror after my cuts.  It makes me feel sub-human.

***

That turned out considerably longer than I expected.  If anyone here as some words of wisdom or thoughts on my situation, please comment.  I've been pretty distressed by the thought of having to part with my hair.",genderfluid,I'm afraid I might be Forced to get a haircut in the search for a Job,1470571562.0,"{'created_utc': 1470546362, 'id': '4wjju5', 'num_comments': 7, 'score': 3, 'selftext': 'I\'m 22 and entering my last semester of college soon.  As my time in college comes to a close, the search for a job begins, and my parents have been hounding me to cut off my hair to improve my odds of being hired, where ever that may be.\n\nI don\'t exactly consider myself genderfluid, but I\'m posting here as I feel it\'s somewhat relevant as I like having an feminine side to myself. (Ideally I\'d wear some clothing that suggest some degree of femininity and shave my body, but I\'m rather uncomfortable doing so in public.)\n\nNearly everyone I talk to about the search for employment and the unfortunate reality that my hair will limit my choices agrees that I need to suck it up and cut it off.  Apparently, if I want long hair I have to establish myself first.  It reaches about 4 inches past my shoulders, isn\'t dyed, and I just recently had it trimmed to clean up any dead ends and make it look neater.  If I was a girl there\'d be no questions asked regarding my hair as it isn\'t by any means abnormal.  But because I\'m a guy, it\'s not seen as professional.\n\nThis situation is no doubt a common one (though the reasons for wanting long hair may differ from person to person), though I feel like my disposition to hair related issues makes things more complicated....\n***\nI\'ll try and keep the backstory story short, but I\'ve always been opposed to haircuts.  My parents were always in charge of when I\'d get my hair cut and how I\'d get it cut, only loosening their grip late into high school to allow it to be slightly longer than the standard nerdy ""my mom picked this cut.""  When I finally expressed interest in growing it, I got the ever repeated talk about how it will make others judge me and how self expression is unimportant as it impacts other\'s judgments.  Eventually even the slightly longer hair style I wore in high school was revoked from me after my parents secretly scheduled me a haircut, gave me a 3 minutes heads up, and my mother screamed at me until I would submit and have her drive me there and tell them to cut it short.  I couldn\'t look in the mirror for a week without my feeling nauseous.  Any time someone brought up my hair I felt my stomach do a flip and skin felt like pins and needles.  After two years of college, and more forced haircuts, I finally broke down crying to my mom over the phone telling her I couldn\'t take another haircut.  This also led to me telling her that I\'m interested in guys (I said I was bisexual, though over time I feel like I lean more towards being gay) as the conversation progressed as I was afraid she\'d draw conclusions, and I thought I might as well get it out of the way.  Her reaction, while shocked was neither positive or negative, and she hopes it\'s just a phase though was never nasty to me about it.\n\nThe other element to this story is that a good deal of my sexual attraction...is based around hair.  I love guys with long hair, and want to be able to pull off the look myself.  Even when a guy doesn\'t have long hair I find myself staring whenever someone has a particularly pretty hairstyle.  Even though I prefer guys, girls can have memorizing hairstyles as well.  A particularly pretty hair braid, a colorful pixie cut, I love it all so much.  Having somewhat of a hair fetish makes my predicament even more painful to me, as I often wish I could put my hair in a fancy bun or a fishtail braid.\n\nLast, and fair warning this is really weird.  But for as long as I can remember, I have had a haircutting fetish.  I\'m sexually aroused by watching mostly women have their hair cut very short or completely shaved off.  There\'s no sexual content in these videos/images, just hair cutting.  Perhaps this was a development due to my complete lack of freedom regarding my own hair and ability to be feminine.  I can\'t really explain why I have such a fetish, but I just do.  It was essentially all I would view for sexual pleasure in my high school years, though over time I distanced myself from it as it was upsetting to me to be aroused by something like that.  Having my haircut short mimics the feelings of humiliation and punishment present in some of those videos and makes me feel like I\'m being disgraced.  Hence the not being able to look in a mirror after my cuts.  It makes me feel sub-human.\n\n***\n\nThat turned out considerably longer than I expected.  If anyone here as some words of wisdom or thoughts on my situation, please comment.  I\'ve been pretty distressed by the thought of having to part with my hair.', 'subreddit': 'genderfluid', 'title': ""I'm afraid I might be Forced to get a haircut in the search for a Job"", 'created': 1470571562.0}"
14,2016-08-07 20:16:20,4wmi5n,1,0,,genderfluid,"(Serious) Hi, I'm a strait male that fell in love with a gender fluid girl and she recently started a relationship with a bisexual guy, I'm Having a hard time moveing on, Any suggestions on how I get on with life after going through such a complicated time?",1470626180.0,"{'created_utc': 1470600980, 'id': '4wmi5n', 'num_comments': 1, 'score': 0, 'selftext': '', 'subreddit': 'genderfluid', 'title': ""(Serious) Hi, I'm a strait male that fell in love with a gender fluid girl and she recently started a relationship with a bisexual guy, I'm Having a hard time moveing on, Any suggestions on how I get on with life after going through such a complicated time?"", 'created': 1470626180.0}"
15,2016-08-08 02:28:50,4wo126,19,11,"Well. I'm sorry. About a week ago I was talking to a friend and kinda came out to her. She was asking me questions and I was pretty sure I was genderfluid. Reason being I still like boy stuff like sports and Videogames. But I would totally live as a girl if I could. Except I don't want surgery at all. So I'm not sure what I am exactly. Hopefully I can still stay in this forum or whatever because you guys are really nice :D



",genderfluid,I think I may be transgender. I'm sorry.,1470648530.0,"{'created_utc': 1470623330, 'id': '4wo126', 'num_comments': 19, 'score': 11, 'selftext': ""Well. I'm sorry. About a week ago I was talking to a friend and kinda came out to her. She was asking me questions and I was pretty sure I was genderfluid. Reason being I still like boy stuff like sports and Videogames. But I would totally live as a girl if I could. Except I don't want surgery at all. So I'm not sure what I am exactly. Hopefully I can still stay in this forum or whatever because you guys are really nice :D\n\n\n\n"", 'subreddit': 'genderfluid', 'title': ""I think I may be transgender. I'm sorry."", 'created': 1470648530.0}"
16,2016-08-08 07:46:42,4wp13i,2,0,[removed],genderfluid,Feeling like an acorn?,1470667602.0,"{'created_utc': 1470642402, 'id': '4wp13i', 'num_comments': 2, 'score': 0, 'selftext': '[removed]', 'subreddit': 'genderfluid', 'title': 'Feeling like an acorn?', 'created': 1470667602.0}"
17,2016-08-08 08:50:23,4wp76p,8,7,"Hi, I'm new to the thread (and embracing my identity in general, but that's okay), and as someone who is biologically female but has a lot of ""boy"" days, I'd like to be able to pass as such, but I have quite a bit in the way of breasts. I'd like to bind, but have a medical condition where the cartilage in my chest is often swollen and inflammed, so I don't know how I would be able to go about binding safely, or if I can at all. Any thoughts/advice on the matter would be extremely helpful :)",genderfluid,Thoughts on Binding?,1470671423.0,"{'created_utc': 1470646223, 'id': '4wp76p', 'num_comments': 8, 'score': 7, 'selftext': 'Hi, I\'m new to the thread (and embracing my identity in general, but that\'s okay), and as someone who is biologically female but has a lot of ""boy"" days, I\'d like to be able to pass as such, but I have quite a bit in the way of breasts. I\'d like to bind, but have a medical condition where the cartilage in my chest is often swollen and inflammed, so I don\'t know how I would be able to go about binding safely, or if I can at all. Any thoughts/advice on the matter would be extremely helpful :)', 'subreddit': 'genderfluid', 'title': 'Thoughts on Binding?', 'created': 1470671423.0}"
18,2016-08-10 15:50:42,4x2scd,2,6,"Hi there. I'm a sixteen year old female. For a while now, I've questioned my gender and it's starting to get really troublesome. As a child I'd often tend to do more of the tomboyish things in life, such as playing sports and never really being interested in the barbies aspect. I had no problem wearing dresses or anything, some days I'd enjoy wearing dresses and other days I would rather not. At the age of 9 I subconsciously made the decision to make an online persona of a male ( Don't worry, I don't catfish). I was more comfortable being perceived as a male then I was being a girl. I was fairly happy one day being a male online and another day I'd be myself. This still continues today, but it's where I began to wonder about my gender. I specifically wake up and wonder if I feel more like being a guy online, or a girl. I often refer to these as 'moods'. I've had these 'moods' since as long as I can remember. I've called them moods because that's what I think it is, one day I'll be in a girly mood where I'll love doing makeup and straightening my hair, and the next I'll be the closest thing you can get towards a stereotypical boy possible. I've always visioned what its like to be a guy, and wondered if it's better. Some days I'll prefer being a girl, and others I find myself thinking that'll be amazing if I was a boy. I don't really know, I'm just confused. One of my friends who I was super close with as a child has recently came out as transgender, and I'm super proud of him but its just kind of left me in more of a confusion about my gender. If anyone could help me even just clear up a little about this giant mess of my life, it would be so helpful. Thank you for reading this. (: ",genderfluid,I'm confused about my gender.,1470869442.0,"{'created_utc': 1470844242, 'id': '4x2scd', 'num_comments': 2, 'score': 6, 'selftext': ""Hi there. I'm a sixteen year old female. For a while now, I've questioned my gender and it's starting to get really troublesome. As a child I'd often tend to do more of the tomboyish things in life, such as playing sports and never really being interested in the barbies aspect. I had no problem wearing dresses or anything, some days I'd enjoy wearing dresses and other days I would rather not. At the age of 9 I subconsciously made the decision to make an online persona of a male ( Don't worry, I don't catfish). I was more comfortable being perceived as a male then I was being a girl. I was fairly happy one day being a male online and another day I'd be myself. This still continues today, but it's where I began to wonder about my gender. I specifically wake up and wonder if I feel more like being a guy online, or a girl. I often refer to these as 'moods'. I've had these 'moods' since as long as I can remember. I've called them moods because that's what I think it is, one day I'll be in a girly mood where I'll love doing makeup and straightening my hair, and the next I'll be the closest thing you can get towards a stereotypical boy possible. I've always visioned what its like to be a guy, and wondered if it's better. Some days I'll prefer being a girl, and others I find myself thinking that'll be amazing if I was a boy. I don't really know, I'm just confused. One of my friends who I was super close with as a child has recently came out as transgender, and I'm super proud of him but its just kind of left me in more of a confusion about my gender. If anyone could help me even just clear up a little about this giant mess of my life, it would be so helpful. Thank you for reading this. (: "", 'subreddit': 'genderfluid', 'title': ""I'm confused about my gender."", 'created': 1470869442.0}"
19,2016-08-10 19:37:00,4x3yr1,29,4,"Hey,
I'm a cis male bi or pan sexual person and have question to you guys. I know a other genderfluid person but sometimes is hard to ask them privat things, I think you people can understand it :) 
a) when did you figured out that you are genderfluid? How did you come out? 
b) does people of the outside see that you feel like a different gender for this day? maybe different cloths? different pronounce?
c) How difficult is it to find a partner for a relationship? 
d) How is sex for you guys when you feel like the different gender this day but have your ''normal'' genital and body?

I hope you guys can understand my questions, because I'm a friendly person who want to learn a lot of new things about genderfluids :) 
I wish you guys a really good day &lt;3  ",genderfluid,few Questions,1470883020.0,"{'created_utc': 1470857820, 'id': '4x3yr1', 'num_comments': 29, 'score': 4, 'selftext': ""Hey,\nI'm a cis male bi or pan sexual person and have question to you guys. I know a other genderfluid person but sometimes is hard to ask them privat things, I think you people can understand it :) \na) when did you figured out that you are genderfluid? How did you come out? \nb) does people of the outside see that you feel like a different gender for this day? maybe different cloths? different pronounce?\nc) How difficult is it to find a partner for a relationship? \nd) How is sex for you guys when you feel like the different gender this day but have your ''normal'' genital and body?\n\nI hope you guys can understand my questions, because I'm a friendly person who want to learn a lot of new things about genderfluids :) \nI wish you guys a really good day &lt;3  "", 'subreddit': 'genderfluid', 'title': 'few Questions', 'created': 1470883020.0}"
20,2016-08-12 03:34:38,4xbmum,1,2,Hey guys Im new here and I have been trying to soul search. I do believe that I am genderfluid but Idk if its 100%. I keep having dysphoric attacks and I know that I am not transgender. Im just at my wits end and Idk what to do. Can anyone help? ,genderfluid,Trying to figure myself out,1470998078.0,"{'created_utc': 1470972878, 'id': '4xbmum', 'num_comments': 1, 'score': 2, 'selftext': 'Hey guys Im new here and I have been trying to soul search. I do believe that I am genderfluid but Idk if its 100%. I keep having dysphoric attacks and I know that I am not transgender. Im just at my wits end and Idk what to do. Can anyone help? ', 'subreddit': 'genderfluid', 'title': 'Trying to figure myself out', 'created': 1470998078.0}"
21,2016-08-13 00:01:40,4xgmhh,1,8,"So, I'm staying in Florida for a while and it's awesome for swimming but...I'm Genderfluid and AFAB (I'm fabulous!) and this is one of the only times I've ever had dysphoria. Even with the most covering top I have, my breasts can still be seen. Help?",genderfluid,Bathing Suits...,1471071700.0,"{'created_utc': 1471046500, 'id': '4xgmhh', 'num_comments': 1, 'score': 8, 'selftext': ""So, I'm staying in Florida for a while and it's awesome for swimming but...I'm Genderfluid and AFAB (I'm fabulous!) and this is one of the only times I've ever had dysphoria. Even with the most covering top I have, my breasts can still be seen. Help?"", 'subreddit': 'genderfluid', 'title': 'Bathing Suits...', 'created': 1471071700.0}"
22,2016-08-13 04:22:28,4xhlfj,8,9,,genderfluid,"Any tips on how to make myself more, neutral?",1471087348.0,"{'created_utc': 1471062148, 'id': '4xhlfj', 'num_comments': 8, 'score': 9, 'selftext': '', 'subreddit': 'genderfluid', 'title': 'Any tips on how to make myself more, neutral?', 'created': 1471087348.0}"
23,2016-08-14 04:00:24,4xmmem,4,7,"My spouse and I have been married for nearly 12 years now, and we have 3 children. Recently, he (his identification currently) has let me know some of his desires in the bedroom which I won't go into detail. But many of them plus some off hand comments he's said randomly have got me thinking he is genderfluid. I have many friends who are also in the TQIA end of things so this is not an unknown realm to me. 

I think he's staying closeted. I'm doing my best to talk about things both in bed (where it seems to come more natural to him) and in conversation to let him know I'm fine with this. But I'm not sure what else I can do. Does anyone have any advice on what else I could be doing? Is this something he's going to have to decide to do whether I'm being supportive?

Originally posted in r/askGSM with no response",genderfluid,Supporting Spouse,1471172424.0,"{'created_utc': 1471147224, 'id': '4xmmem', 'num_comments': 4, 'score': 7, 'selftext': ""My spouse and I have been married for nearly 12 years now, and we have 3 children. Recently, he (his identification currently) has let me know some of his desires in the bedroom which I won't go into detail. But many of them plus some off hand comments he's said randomly have got me thinking he is genderfluid. I have many friends who are also in the TQIA end of things so this is not an unknown realm to me. \n\nI think he's staying closeted. I'm doing my best to talk about things both in bed (where it seems to come more natural to him) and in conversation to let him know I'm fine with this. But I'm not sure what else I can do. Does anyone have any advice on what else I could be doing? Is this something he's going to have to decide to do whether I'm being supportive?\n\nOriginally posted in r/askGSM with no response"", 'subreddit': 'genderfluid', 'title': 'Supporting Spouse', 'created': 1471172424.0}"
24,2016-08-14 17:19:32,4xp15s,15,5,"Hey,
I'm a AMAB who don't know if he is male or any other gender. yesterday I wanted nailpolish idk why, I just wanted it because it's awesome. after that I realized wait cis males don't do that, so I asked myself. 2 weeks ago when I was shopping I saw a really nice female tshirt, which I wanted but I'm male so this wouldn't fit. 5 weeks ago I wanted to dress me female with a skirt and stuff (idk why I wanted it). even before that I said to me I'm a more feminin male, because I think this label fits really well to me. I hate having short hair and cried as a young child when I got short hair, so my hairstyle is a mix of long and short. I like the color pink and cry really easily. not to easily but more often then a ''normal'' male and I have a lot of emotions. as a young child I played with dolls because I didn't find cars interesting at all. 
Idk what I am, I know that I am not trans but everything else idk. I am cis or any other gender? 
PS: can I upload a picture for showing my haircut? 
edit: i like to grab to my chests when nobody can see me. I don't do it because I want to I just do it and realized it 2 weeks ago. ",genderfluid,"yeah, I'm the guy with all the questions... (what is my gender)",1471220372.0,"{'created_utc': 1471195172, 'id': '4xp15s', 'num_comments': 15, 'score': 5, 'selftext': ""Hey,\nI'm a AMAB who don't know if he is male or any other gender. yesterday I wanted nailpolish idk why, I just wanted it because it's awesome. after that I realized wait cis males don't do that, so I asked myself. 2 weeks ago when I was shopping I saw a really nice female tshirt, which I wanted but I'm male so this wouldn't fit. 5 weeks ago I wanted to dress me female with a skirt and stuff (idk why I wanted it). even before that I said to me I'm a more feminin male, because I think this label fits really well to me. I hate having short hair and cried as a young child when I got short hair, so my hairstyle is a mix of long and short. I like the color pink and cry really easily. not to easily but more often then a ''normal'' male and I have a lot of emotions. as a young child I played with dolls because I didn't find cars interesting at all. \nIdk what I am, I know that I am not trans but everything else idk. I am cis or any other gender? \nPS: can I upload a picture for showing my haircut? \nedit: i like to grab to my chests when nobody can see me. I don't do it because I want to I just do it and realized it 2 weeks ago. "", 'subreddit': 'genderfluid', 'title': ""yeah, I'm the guy with all the questions... (what is my gender)"", 'created': 1471220372.0}"
25,2016-08-15 16:12:48,4xubhk,13,8,"So, I'm AFAB (I'm fabulous!) and Genderfluid, right now male. I wear sports bras but...they aren't really completely...they don't make my chest completely flat. Does anybody have any recommendations for bras? I don't really want to bind...",genderfluid,Bras...?,1471302768.0,"{'created_utc': 1471277568, 'id': '4xubhk', 'num_comments': 13, 'score': 8, 'selftext': ""So, I'm AFAB (I'm fabulous!) and Genderfluid, right now male. I wear sports bras but...they aren't really completely...they don't make my chest completely flat. Does anybody have any recommendations for bras? I don't really want to bind..."", 'subreddit': 'genderfluid', 'title': 'Bras...?', 'created': 1471302768.0}"
