,created_utc,id,num_comments,score,selftext,subreddit,title,created,d_
0,2016-08-01 01:02:42,4vk0wn,1,14,,NonBinary,1st time binding- yay :) Feels like squishy ribs :P,1470038562.0,"{'created_utc': 1470013362, 'id': '4vk0wn', 'num_comments': 1, 'score': 14, 'selftext': '', 'subreddit': 'NonBinary', 'title': '1st time binding- yay :) Feels like squishy ribs :P', 'created': 1470038562.0}"
1,2016-08-02 17:25:41,4vtmys,0,0,,NonBinary,LMFAOO TRUUUU,1470183941.0,"{'created_utc': 1470158741, 'id': '4vtmys', 'num_comments': 0, 'score': 0, 'selftext': '', 'subreddit': 'NonBinary', 'title': 'LMFAOO TRUUUU', 'created': 1470183941.0}"
2,2016-08-03 16:48:53,4vzgyw,14,11,"Firstly, I would like to explicitly state (so nobody feels I'm attempting to appropriate something I have no experience of) that I am a male. I was born male and have no issue with being referred to as he/him, though it is not an integral part of who I am.

I am also a writer (I know, I know) with the belief gender as a concept will eventually die out as the idea that gender and sexuality are fluid becomes more acceptable.

I am not looking to parade non-binary people around because they are 'cool and hot rn', I want to write a story set in a world where gender is viewed as a long-lost or non-existent concept, without the division of pronouns.

Further to this, I'm not a revolutionary, I'm not trying to make a political point, just further explore the idea of a world without gender, without making it the focal point.

If anyone can suggest any fiction which has done the same, I would love to read it. Also, I welcome any advice and guidance on how I could approach this realistically (even if it's just 'fuck you, don't') because I firmly believe to attempt this, as an outsider, without seeking out the experiences and beliefs of those who live it every day, would be worse than not doing it at all.

Thank you.",NonBinary,Can anyone recommend some fiction (other than Leckie...) set in a world that has no concept of gender or considers it outdated?,1470268133.0,"{'created_utc': 1470242933, 'id': '4vzgyw', 'num_comments': 14, 'score': 11, 'selftext': ""Firstly, I would like to explicitly state (so nobody feels I'm attempting to appropriate something I have no experience of) that I am a male. I was born male and have no issue with being referred to as he/him, though it is not an integral part of who I am.\n\nI am also a writer (I know, I know) with the belief gender as a concept will eventually die out as the idea that gender and sexuality are fluid becomes more acceptable.\n\nI am not looking to parade non-binary people around because they are 'cool and hot rn', I want to write a story set in a world where gender is viewed as a long-lost or non-existent concept, without the division of pronouns.\n\nFurther to this, I'm not a revolutionary, I'm not trying to make a political point, just further explore the idea of a world without gender, without making it the focal point.\n\nIf anyone can suggest any fiction which has done the same, I would love to read it. Also, I welcome any advice and guidance on how I could approach this realistically (even if it's just 'fuck you, don't') because I firmly believe to attempt this, as an outsider, without seeking out the experiences and beliefs of those who live it every day, would be worse than not doing it at all.\n\nThank you."", 'subreddit': 'NonBinary', 'title': 'Can anyone recommend some fiction (other than Leckie...) set in a world that has no concept of gender or considers it outdated?', 'created': 1470268133.0}"
3,2016-08-07 13:28:00,4wkty0,1,6,,NonBinary,I DON'T HAVE A GENDER!,1470601680.0,"{'created_utc': 1470576480, 'id': '4wkty0', 'num_comments': 1, 'score': 6, 'selftext': '', 'subreddit': 'NonBinary', 'title': ""I DON'T HAVE A GENDER!"", 'created': 1470601680.0}"
4,2016-08-08 19:50:30,4ws3sp,3,6,,NonBinary,#NonBinaryYT: P2. Let's Talk About Transition [CC],1470711030.0,"{'created_utc': 1470685830, 'id': '4ws3sp', 'num_comments': 3, 'score': 6, 'selftext': '', 'subreddit': 'NonBinary', 'title': ""#NonBinaryYT: P2. Let's Talk About Transition [CC]"", 'created': 1470711030.0}"
5,2016-08-09 23:33:45,4wz7xz,3,2,"Perhaps this isn't the best place to ask but I'll give it a try. I am a cisgender male who is technically heteroflexible but really just heterosexual.  I am currently dating a non-binary person who is biologically female, and we have been together for a few months now.  We have had a really harmonious relationship and are very open with each other about out problems and helping each other with them.

However lately I've been depressed about the relationship,  and while I still love this person to death I'm worried about my subconscious attitude towards the relationship. I'm constantly worrying about making the wrong move, which may be partially due to them being my first significant other but also just because I feel I need to be more cautious about what I say and do. This is tied in with the fact that despite the fact that I am completely supportive of my partners identity as a non-binary person, I still get pangs and the feeling that they should be she, and that that is unconsciously affecting my interactions with them.

This is not in my near future, but part of my dream for life is to have children, who are my biological children. My partner isn't really into the whole idea of children and much less bearing children, and although I don't know that we ultimately will end up in such a relationship but I always look ahead and I have a hard time seeing how we could ever work out in that respect.

Finally, we won't be seeing each other for much longer as they are moving far away from me and neither of us feel that a long distance relationship is possible or what either of us want. As they are my first love I may be more frantic about this than I should be but I dream about meeting up with them again after I'm more established and restarting our relationship. But I'm worried about the changes to both of us and I think it's affecting my relationship with this person right now.

I want to emphasize that my partner is 100% not at fault for any of this. We both were in love and I made the decision to love this person regardless of their gender. But I want to ask if you all here have any advice for me on how I can silence some of these doubts.  I'm willing to work hard to silence them. I know this may also have a better place in a relationship thread but I'm not sure how they will take this and I'm also new to this website so I'm not intrested in trying. Any advice is welcome!",NonBinary,Unease,1470810825.0,"{'created_utc': 1470785625, 'id': '4wz7xz', 'num_comments': 3, 'score': 2, 'selftext': ""Perhaps this isn't the best place to ask but I'll give it a try. I am a cisgender male who is technically heteroflexible but really just heterosexual.  I am currently dating a non-binary person who is biologically female, and we have been together for a few months now.  We have had a really harmonious relationship and are very open with each other about out problems and helping each other with them.\n\nHowever lately I've been depressed about the relationship,  and while I still love this person to death I'm worried about my subconscious attitude towards the relationship. I'm constantly worrying about making the wrong move, which may be partially due to them being my first significant other but also just because I feel I need to be more cautious about what I say and do. This is tied in with the fact that despite the fact that I am completely supportive of my partners identity as a non-binary person, I still get pangs and the feeling that they should be she, and that that is unconsciously affecting my interactions with them.\n\nThis is not in my near future, but part of my dream for life is to have children, who are my biological children. My partner isn't really into the whole idea of children and much less bearing children, and although I don't know that we ultimately will end up in such a relationship but I always look ahead and I have a hard time seeing how we could ever work out in that respect.\n\nFinally, we won't be seeing each other for much longer as they are moving far away from me and neither of us feel that a long distance relationship is possible or what either of us want. As they are my first love I may be more frantic about this than I should be but I dream about meeting up with them again after I'm more established and restarting our relationship. But I'm worried about the changes to both of us and I think it's affecting my relationship with this person right now.\n\nI want to emphasize that my partner is 100% not at fault for any of this. We both were in love and I made the decision to love this person regardless of their gender. But I want to ask if you all here have any advice for me on how I can silence some of these doubts.  I'm willing to work hard to silence them. I know this may also have a better place in a relationship thread but I'm not sure how they will take this and I'm also new to this website so I'm not intrested in trying. Any advice is welcome!"", 'subreddit': 'NonBinary', 'title': 'Unease', 'created': 1470810825.0}"
6,2016-08-10 18:44:46,4x3oqc,3,5,"(Question/seeking help) Hi my name is Eli, I was born female but sometimes I want to be male and others I want to remain femme! I have no clue what my true gender is please help me!",NonBinary,I don't know who I am,1470879886.0,"{'created_utc': 1470854686, 'id': '4x3oqc', 'num_comments': 3, 'score': 5, 'selftext': '(Question/seeking help) Hi my name is Eli, I was born female but sometimes I want to be male and others I want to remain femme! I have no clue what my true gender is please help me!', 'subreddit': 'NonBinary', 'title': ""I don't know who I am"", 'created': 1470879886.0}"
7,2016-08-12 16:20:48,4xecgk,7,2,"Heyyyy! So I've been trying to come up with a new name and so far I 've got Ari (pronounced Ah-ree), Avery with a nickname Avy, Eli/Elie and Rafael with a nickname of Raf or Raffi. I like the first two names but Ari I find is similar to my current name, and Avery I'm worried is not masculine enough. (I'm afab transmasc and I want quite a male-read name) I really like both Eli and Raffi but wonder whether Rafael is too formally and also they're biblical names? But my current name is Biblical anyway :P Also my last name starts with R so Raffi might mean I'd have to find a new last name too. Also I think my SO prefers Ari but I keep seeing the similarity to my current nameeeee... Any advice would be nice please :) ",NonBinary,Another name post (WhoamI_24601!),1471044048.0,"{'created_utc': 1471018848, 'id': '4xecgk', 'num_comments': 7, 'score': 2, 'selftext': ""Heyyyy! So I've been trying to come up with a new name and so far I 've got Ari (pronounced Ah-ree), Avery with a nickname Avy, Eli/Elie and Rafael with a nickname of Raf or Raffi. I like the first two names but Ari I find is similar to my current name, and Avery I'm worried is not masculine enough. (I'm afab transmasc and I want quite a male-read name) I really like both Eli and Raffi but wonder whether Rafael is too formally and also they're biblical names? But my current name is Biblical anyway :P Also my last name starts with R so Raffi might mean I'd have to find a new last name too. Also I think my SO prefers Ari but I keep seeing the similarity to my current nameeeee... Any advice would be nice please :) "", 'subreddit': 'NonBinary', 'title': 'Another name post (WhoamI_24601!)', 'created': 1471044048.0}"
8,2016-08-15 01:44:17,4xra69,7,4,"Can someone explain to me moderately in-depth what Non-binary is? Because my current understanding is from Tumblr, and as we all known Tumblr isn't exactly the greatest source in the world. I at the moment don't understand enough about Non-binary to really recognize it as a gender. If anyone has any reading material or anything that'd be great! Thanks for reading!",NonBinary,What exactly is Non-binary?,1471250657.0,"{'created_utc': 1471225457, 'id': '4xra69', 'num_comments': 7, 'score': 4, 'selftext': ""Can someone explain to me moderately in-depth what Non-binary is? Because my current understanding is from Tumblr, and as we all known Tumblr isn't exactly the greatest source in the world. I at the moment don't understand enough about Non-binary to really recognize it as a gender. If anyone has any reading material or anything that'd be great! Thanks for reading!"", 'subreddit': 'NonBinary', 'title': 'What exactly is Non-binary?', 'created': 1471250657.0}"
9,2016-08-16 15:16:59,4y00fe,24,10,,NonBinary,This article is painful -- Coming out as 'non-binary' throws other women under the bus,1471385819.0,"{'created_utc': 1471360619, 'id': '4y00fe', 'num_comments': 24, 'score': 10, 'selftext': '', 'subreddit': 'NonBinary', 'title': ""This article is painful -- Coming out as 'non-binary' throws other women under the bus"", 'created': 1471385819.0}"
10,2016-08-19 19:50:32,4ykw2x,7,8,"I id as nb/agender and while I do present masculinely in many ways, one thing that really fux with me is my receding hairline. I find it too masculine to fit how I want to present. Any one else here struggle with this? How do you cope? I know that total baldness is in my future, and I'm actually excited about it. My wig collection is going to greatly benefit. However, it's this in between phase that is killing me. I don't want to give up the fight too early in the game and start shaving my head. I feel like I've got to enjoy what I have while it lasts. Plus, I've worked too hard growing out this gay ass mullet to chop it off. Any advice or experience shared would be greatly appreciated!",NonBinary,nb amab folks with receding hair line— how do you deal?,1471661432.0,"{'created_utc': 1471636232, 'id': '4ykw2x', 'num_comments': 7, 'score': 8, 'selftext': ""I id as nb/agender and while I do present masculinely in many ways, one thing that really fux with me is my receding hairline. I find it too masculine to fit how I want to present. Any one else here struggle with this? How do you cope? I know that total baldness is in my future, and I'm actually excited about it. My wig collection is going to greatly benefit. However, it's this in between phase that is killing me. I don't want to give up the fight too early in the game and start shaving my head. I feel like I've got to enjoy what I have while it lasts. Plus, I've worked too hard growing out this gay ass mullet to chop it off. Any advice or experience shared would be greatly appreciated!"", 'subreddit': 'NonBinary', 'title': 'nb amab folks with receding hair line— how do you deal?', 'created': 1471661432.0}"
11,2016-08-20 16:17:50,4ypscd,2,5,"I'm non-binary and I don't want to sound overdramatic but I struggle a lot, not every day, but a lot of days. Sometimes about what I wear (I want to dress masculine and look masculine sometimes/go by a masculine name, but I'm a lesbian, so... that seems problematic).

And I'm fine with being typically feminine. I like my long hair, sometimes I want to wear it long like a guy's. I don't know where this comes from but it doesn't bother me, but I'm confused. I don't know who I am. I'm fine being addressed by my name, but online I go by another feminine name, and the middles are kind of gender neutral (two of them, and then there's another feminine name).

I just.. I just don't feel... valid.. or.. something. I don't know, I feel lost. I feel like I'm not non-binary enough, or something. I guess I'm just feeling confused and sad and I don't know why. I go between liking myself and hating myself.",NonBinary,I'm having a bad moment: vent,1471735070.0,"{'created_utc': 1471709870, 'id': '4ypscd', 'num_comments': 2, 'score': 5, 'selftext': ""I'm non-binary and I don't want to sound overdramatic but I struggle a lot, not every day, but a lot of days. Sometimes about what I wear (I want to dress masculine and look masculine sometimes/go by a masculine name, but I'm a lesbian, so... that seems problematic).\n\nAnd I'm fine with being typically feminine. I like my long hair, sometimes I want to wear it long like a guy's. I don't know where this comes from but it doesn't bother me, but I'm confused. I don't know who I am. I'm fine being addressed by my name, but online I go by another feminine name, and the middles are kind of gender neutral (two of them, and then there's another feminine name).\n\nI just.. I just don't feel... valid.. or.. something. I don't know, I feel lost. I feel like I'm not non-binary enough, or something. I guess I'm just feeling confused and sad and I don't know why. I go between liking myself and hating myself."", 'subreddit': 'NonBinary', 'title': ""I'm having a bad moment: vent"", 'created': 1471735070.0}"
12,2016-08-20 22:16:07,4yrj15,7,6,"Hi, younger androgyne here. (Throwaway account for reasons.) I may post this on multiple subs because I need as much advice as I can get.  
I'm AFAB and going into high school this year. As if starting freshman year in high school isn't nerve wracking enough, I'm genderqueer and have some concerns.  
A little background information (This paragraph isn't necessary, but I kept it here in case others relate or have advice about other things as well): I've felt mentally androgynous all my life, and was lucky enough to become familiar with non-binary identities last year. My understanding of these identities was very vague at the time, but it was enough to know that it matched me. Since then, I've not only learned much more but transitioned my appearance to look more androgynous, which has made me more confident and comfortable in my own skin. I wear a binder and ambiguous clothing. Fast forward to recently, my frustration with being seen as a girl (social dysphoria) boiled over and I spent months on edge, overly-reinforcing my masculine attributes and snapping at the word ""lady"". Thankfully things have leveled out again and I'm comfortable. What I'm looking for is a few answered questions from some more experienced people. I know some of these are hard because they should be things I'm deciding, but I'd like more input.  
* First of all, what should I do about changing for gym? My parents say going to a separate room such as a bathroom would make me an outcast and segregate me from others. They think people would wonder about it and such. On the contrary, I wear a binder... I guess I could wear a tank top over it when I change. As long as I convince myself a ""girl's"" locker room is just another way of saying anyone-whose-biological-sex-is-female's locker room, I feel alright with using it.  
* How are things socially in High School? I've heard it's tougher in regards to drama and teasing. I feel like at the least people will call me gay behind my back because they don't know what to make of me(they did this at the end of 8th grade), and at the most I could be bullied or something. I just want to make my high school years as enjoyable as I can. I also worry if people will initially, if not always, be weary of interacting with me because I'm different.  
* Should I use a different name? The name I was given at birth is very feminine, and was the 2nd most popular girl name of my year. It's not too bad of a name... but last year I picked out a neutral name for myself that I adore, and my friends call me by it. I'm debating whether I should go through the trouble of getting all the teachers to call me by my new name, or just stick with my old one and keep the new one for friends. I guess ultimately I'd like to know if I should pass as an androgynous(in appearance) girl just to make my life easier until I get out of high school and have more freedom.  
Any other advice for surviving high school in general would be greatly appreciated. Thank you so much!

",NonBinary,Help; Androgyny and High School,1471756567.0,"{'created_utc': 1471731367, 'id': '4yrj15', 'num_comments': 7, 'score': 6, 'selftext': 'Hi, younger androgyne here. (Throwaway account for reasons.) I may post this on multiple subs because I need as much advice as I can get.  \nI\'m AFAB and going into high school this year. As if starting freshman year in high school isn\'t nerve wracking enough, I\'m genderqueer and have some concerns.  \nA little background information (This paragraph isn\'t necessary, but I kept it here in case others relate or have advice about other things as well): I\'ve felt mentally androgynous all my life, and was lucky enough to become familiar with non-binary identities last year. My understanding of these identities was very vague at the time, but it was enough to know that it matched me. Since then, I\'ve not only learned much more but transitioned my appearance to look more androgynous, which has made me more confident and comfortable in my own skin. I wear a binder and ambiguous clothing. Fast forward to recently, my frustration with being seen as a girl (social dysphoria) boiled over and I spent months on edge, overly-reinforcing my masculine attributes and snapping at the word ""lady"". Thankfully things have leveled out again and I\'m comfortable. What I\'m looking for is a few answered questions from some more experienced people. I know some of these are hard because they should be things I\'m deciding, but I\'d like more input.  \n* First of all, what should I do about changing for gym? My parents say going to a separate room such as a bathroom would make me an outcast and segregate me from others. They think people would wonder about it and such. On the contrary, I wear a binder... I guess I could wear a tank top over it when I change. As long as I convince myself a ""girl\'s"" locker room is just another way of saying anyone-whose-biological-sex-is-female\'s locker room, I feel alright with using it.  \n* How are things socially in High School? I\'ve heard it\'s tougher in regards to drama and teasing. I feel like at the least people will call me gay behind my back because they don\'t know what to make of me(they did this at the end of 8th grade), and at the most I could be bullied or something. I just want to make my high school years as enjoyable as I can. I also worry if people will initially, if not always, be weary of interacting with me because I\'m different.  \n* Should I use a different name? The name I was given at birth is very feminine, and was the 2nd most popular girl name of my year. It\'s not too bad of a name... but last year I picked out a neutral name for myself that I adore, and my friends call me by it. I\'m debating whether I should go through the trouble of getting all the teachers to call me by my new name, or just stick with my old one and keep the new one for friends. I guess ultimately I\'d like to know if I should pass as an androgynous(in appearance) girl just to make my life easier until I get out of high school and have more freedom.  \nAny other advice for surviving high school in general would be greatly appreciated. Thank you so much!\n\n', 'subreddit': 'NonBinary', 'title': 'Help; Androgyny and High School', 'created': 1471756567.0}"
13,2016-08-22 06:09:13,4yz6w6,3,9,"https://soundcloud.com/user-465072119/book (reading some time ago(4 weeks , sitting down but trying to go deep

just now, no trying hard  just normal reading sitting down
https://soundcloud.com/user-465072119/book2

https://soundcloud.com/user-465072119/book3",NonBinary,I woke up and............ my voice is dropping. woo a step further towards a neutral voice.,1471871353.0,"{'created_utc': 1471846153, 'id': '4yz6w6', 'num_comments': 3, 'score': 9, 'selftext': 'https://soundcloud.com/user-465072119/book (reading some time ago(4 weeks , sitting down but trying to go deep\n\njust now, no trying hard  just normal reading sitting down\nhttps://soundcloud.com/user-465072119/book2\n\nhttps://soundcloud.com/user-465072119/book3', 'subreddit': 'NonBinary', 'title': 'I woke up and............ my voice is dropping. woo a step further towards a neutral voice.', 'created': 1471871353.0}"
14,2016-08-22 12:40:17,4z0bzd,5,48,,NonBinary,"31 mtnb, 2.5 months into physical (HRT) transition, identify as nonbinary but heading toward more femme presentation. Posting this as an official celebration of changing my name on Facebook :)",1471894817.0,"{'created_utc': 1471869617, 'id': '4z0bzd', 'num_comments': 5, 'score': 48, 'selftext': '', 'subreddit': 'NonBinary', 'title': '31 mtnb, 2.5 months into physical (HRT) transition, identify as nonbinary but heading toward more femme presentation. Posting this as an official celebration of changing my name on Facebook :)', 'created': 1471894817.0}"
15,2016-08-24 12:36:49,4zccgj,1,6,,NonBinary,MY AGENDER JOURNEY | 7 Months On Estrogen | Transition Update,1472067409.0,"{'created_utc': 1472042209, 'id': '4zccgj', 'num_comments': 1, 'score': 6, 'selftext': '', 'subreddit': 'NonBinary', 'title': 'MY AGENDER JOURNEY | 7 Months On Estrogen | Transition Update', 'created': 1472067409.0}"
16,2016-08-25 15:53:18,4zj6ud,3,22,,NonBinary,"Must read! LOCAL RESIDENT COMES OUT AS NON-BINARY, WORLD DOESN’T END",1472165598.0,"{'created_utc': 1472140398, 'id': '4zj6ud', 'num_comments': 3, 'score': 22, 'selftext': '', 'subreddit': 'NonBinary', 'title': 'Must read! LOCAL RESIDENT COMES OUT AS NON-BINARY, WORLD DOESN’T END', 'created': 1472165598.0}"
