,created_utc,id,num_comments,score,selftext,subreddit,title,created,d_
7,2016-08-02 03:58:23,4vqmbb,14,6,"I've known I was genderqueer for my whole life, but didn't know that actual word for it until a few months ago.

Now I'm trying to figure out where I fit under the genderqueer umbrella, and I'm just not finding the right word.

I'm more than genderqueer, I know that much.

Non binary fits, but doesn't feel right. To me, the definition is sort of having gender, but fitting somewhere within the spectrum instead of right on one of the poles. 

Genderfluid is closer, but feels even less like me than nonbinary. How masculine/feminine I feel will generally change a bit, but it only changes by a few degrees on the gender spectrum.

Agender feels like it might be a closer fit, but I *think* I still feel I have a gender. I might be getting caught up in the idea of ""no gender."" I think I feel *something* akin to gender, but I don't know how much or what it is.

And all the other terms don't really fit me in any way. Or, at least, I don't feel any connection with them.

What do you think? How did you find who you are? Did it just come to you? Or did it take a ton of self reflection?

Edit: Realized I should probably say something about my experience with gender. I'm AFAB, but feel like a man trapped in a woman's body. I vary between feeling like that man wants to escape and be himself, and a man that wants to surrender and just learn to comfortably live as female. Either way, the dysphoria is STRONG.",genderqueer,Trying to find the word to describe how I experience gender,1470135503.0,"{'created_utc': 1470110303, 'id': '4vqmbb', 'num_comments': 14, 'score': 6, 'selftext': 'I\'ve known I was genderqueer for my whole life, but didn\'t know that actual word for it until a few months ago.\n\nNow I\'m trying to figure out where I fit under the genderqueer umbrella, and I\'m just not finding the right word.\n\nI\'m more than genderqueer, I know that much.\n\nNon binary fits, but doesn\'t feel right. To me, the definition is sort of having gender, but fitting somewhere within the spectrum instead of right on one of the poles. \n\nGenderfluid is closer, but feels even less like me than nonbinary. How masculine/feminine I feel will generally change a bit, but it only changes by a few degrees on the gender spectrum.\n\nAgender feels like it might be a closer fit, but I *think* I still feel I have a gender. I might be getting caught up in the idea of ""no gender."" I think I feel *something* akin to gender, but I don\'t know how much or what it is.\n\nAnd all the other terms don\'t really fit me in any way. Or, at least, I don\'t feel any connection with them.\n\nWhat do you think? How did you find who you are? Did it just come to you? Or did it take a ton of self reflection?\n\nEdit: Realized I should probably say something about my experience with gender. I\'m AFAB, but feel like a man trapped in a woman\'s body. I vary between feeling like that man wants to escape and be himself, and a man that wants to surrender and just learn to comfortably live as female. Either way, the dysphoria is STRONG.', 'subreddit': 'genderqueer', 'title': 'Trying to find the word to describe how I experience gender', 'created': 1470135503.0}"
8,2016-08-02 15:28:18,4vt01w,7,14,"Not satisfied with having a gendered name ""Brad,"" at the beginning of 11th grade I started asking people to call me ""B."" Most people didn't, since they already knew me as Brad and didn't wanna change that, but a few close friends did and I liked it. So much so that I put my preferred name on my college applications as ""B."" However, I started college (a 4 week summer program) a few weeks ago, and all of the teachers and other students call me B, but it just feels weird to me now. Like, maybe it's just because it was only close friends and my mom who ever called me that, but I just don't know if I want to be called that anymore but it might be too late since I've already introduced myself to everyone as B. I still identify as genderqueer but I think I like my old name.",genderqueer,I don't like my neutral name anymore,1470176898.0,"{'created_utc': 1470151698, 'id': '4vt01w', 'num_comments': 7, 'score': 14, 'selftext': 'Not satisfied with having a gendered name ""Brad,"" at the beginning of 11th grade I started asking people to call me ""B."" Most people didn\'t, since they already knew me as Brad and didn\'t wanna change that, but a few close friends did and I liked it. So much so that I put my preferred name on my college applications as ""B."" However, I started college (a 4 week summer program) a few weeks ago, and all of the teachers and other students call me B, but it just feels weird to me now. Like, maybe it\'s just because it was only close friends and my mom who ever called me that, but I just don\'t know if I want to be called that anymore but it might be too late since I\'ve already introduced myself to everyone as B. I still identify as genderqueer but I think I like my old name.', 'subreddit': 'genderqueer', 'title': ""I don't like my neutral name anymore"", 'created': 1470176898.0}"
9,2016-08-02 18:13:26,4vtwa3,0,3,,genderqueer,Denim label launches gender neutral collection to help promote LGBTI visibility,1470186806.0,"{'created_utc': 1470161606, 'id': '4vtwa3', 'num_comments': 0, 'score': 3, 'selftext': '', 'subreddit': 'genderqueer', 'title': 'Denim label launches gender neutral collection to help promote LGBTI visibility', 'created': 1470186806.0}"
10,2016-08-02 21:59:33,4vv3ql,16,45,"My bi non binary bi partner went to buy nail polish with me the other day (my white male ass was too scared to go alone). so i painted my nails this weekend and it was great! Went outside, felt pretty good and didn't care about other people. but i removed the polish monday morning when i had to go to work.

Today i spent my evening by being fabulous and painting my nails light blue with golden glitter! but as soon as i think about going to work tomorrow and removing the color i feel sad ... it's not that i have a very restrictive job. i can easily wear a tshirt when meeting clients. i wear a rainbow colored necklace a lot. still ... i'm scared to show up with colored nails.

what makes me even more sad is, that i used to paint my nails and even wear skirts and stockings to parties when i was younger. i kissed everyone (boys, girls, don't care) and i loved it. but at some point i just ""grew"" into a ""normal"" member of society (32 now)... and i feel i can't go back. like my mother said when i showed up with my rainbow necklace: ""oh that phase again ...""

it's like all of those feelings i buried came back when i tried to understand how my non binary bi partner feels. and now it's totally too much but i don't want it to go away ... i hope that makes sense.

not really looking for advice. but thankful if you have any.",genderqueer,i painted my nails today. now i feel sad.,1470200373.0,"{'created_utc': 1470175173, 'id': '4vv3ql', 'num_comments': 16, 'score': 45, 'selftext': 'My bi non binary bi partner went to buy nail polish with me the other day (my white male ass was too scared to go alone). so i painted my nails this weekend and it was great! Went outside, felt pretty good and didn\'t care about other people. but i removed the polish monday morning when i had to go to work.\n\nToday i spent my evening by being fabulous and painting my nails light blue with golden glitter! but as soon as i think about going to work tomorrow and removing the color i feel sad ... it\'s not that i have a very restrictive job. i can easily wear a tshirt when meeting clients. i wear a rainbow colored necklace a lot. still ... i\'m scared to show up with colored nails.\n\nwhat makes me even more sad is, that i used to paint my nails and even wear skirts and stockings to parties when i was younger. i kissed everyone (boys, girls, don\'t care) and i loved it. but at some point i just ""grew"" into a ""normal"" member of society (32 now)... and i feel i can\'t go back. like my mother said when i showed up with my rainbow necklace: ""oh that phase again ...""\n\nit\'s like all of those feelings i buried came back when i tried to understand how my non binary bi partner feels. and now it\'s totally too much but i don\'t want it to go away ... i hope that makes sense.\n\nnot really looking for advice. but thankful if you have any.', 'subreddit': 'genderqueer', 'title': 'i painted my nails today. now i feel sad.', 'created': 1470200373.0}"
11,2016-08-03 00:53:59,4vvw6r,10,3,,genderqueer,Pope complains schools are telling children they can choose their gender,1470210839.0,"{'created_utc': 1470185639, 'id': '4vvw6r', 'num_comments': 10, 'score': 3, 'selftext': '', 'subreddit': 'genderqueer', 'title': 'Pope complains schools are telling children they can choose their gender', 'created': 1470210839.0}"
12,2016-08-03 02:59:16,4vwex8,22,22,"Hey guys. I just need to get a rant out of my system. 

I'm AMAB. Currently in the questioning stage of my gender, pretty sure I'm something-something queer but idk what exactly (and there's the lingering thought about me just making this whole thing up still). I can't remember exactly what brought me to this wonderful transgender community on Reddit, but it's been really great for figuring out what I am. There's a great representation of both AMAB and AFAB folks sharing their stories, experiences, etc. for everyone else that's trying to figure things out. However most other places I feel it's quite different. It seems that more transgender people are FTM then MTF, and waaaaaay more genderqueer people are AFAB then AMAB. Hell my local LBGT+ safeplace has a weekly meeting for ""queer girls"" -- this kind of rubs me the wrong way, assuming that all queer people are AFAB (they have a meeting for males too, but it's just branded as a meeting for LBGT+ guys, as opposed to specifically genderqueer ones). At my school, there's a fairly large amount of AFAB transgender people versus only two AMAB transgender people. Media's representation of genderqueer people is vastly skewed upon people that are AFAB. If someone that's AFAB goes into public wearing guy clothes, no one bats an eye. If someone that's AMAB goes into public wearing a dress, it sticks out like a sore thumb. One of my AMAB friends went to school one day in a crop top and got harassed for it, despite the school (supposedly) having a large LGBT+/genderqueer population. Why is this? It feels really bad, not having a whole lot of other people on the same boat as me and knowing that the only way I would feel comfortable dressing girly in public is passing completely. I just feel like all genderqueer people are made out to be the these teen/20 something trendy AFAB people with short hairstyles and a tumblr-cliche sense of fashion. Just to be clear I obviously have nothing against AFAB genderqueer or otherwise people, I just wanted to blow this steam because I honestly feel like this is a really big problem. Can anyone else relate?",genderqueer,Is AFAB Genderqueer the Norm?,1470218356.0,"{'created_utc': 1470193156, 'id': '4vwex8', 'num_comments': 22, 'score': 22, 'selftext': 'Hey guys. I just need to get a rant out of my system. \n\nI\'m AMAB. Currently in the questioning stage of my gender, pretty sure I\'m something-something queer but idk what exactly (and there\'s the lingering thought about me just making this whole thing up still). I can\'t remember exactly what brought me to this wonderful transgender community on Reddit, but it\'s been really great for figuring out what I am. There\'s a great representation of both AMAB and AFAB folks sharing their stories, experiences, etc. for everyone else that\'s trying to figure things out. However most other places I feel it\'s quite different. It seems that more transgender people are FTM then MTF, and waaaaaay more genderqueer people are AFAB then AMAB. Hell my local LBGT+ safeplace has a weekly meeting for ""queer girls"" -- this kind of rubs me the wrong way, assuming that all queer people are AFAB (they have a meeting for males too, but it\'s just branded as a meeting for LBGT+ guys, as opposed to specifically genderqueer ones). At my school, there\'s a fairly large amount of AFAB transgender people versus only two AMAB transgender people. Media\'s representation of genderqueer people is vastly skewed upon people that are AFAB. If someone that\'s AFAB goes into public wearing guy clothes, no one bats an eye. If someone that\'s AMAB goes into public wearing a dress, it sticks out like a sore thumb. One of my AMAB friends went to school one day in a crop top and got harassed for it, despite the school (supposedly) having a large LGBT+/genderqueer population. Why is this? It feels really bad, not having a whole lot of other people on the same boat as me and knowing that the only way I would feel comfortable dressing girly in public is passing completely. I just feel like all genderqueer people are made out to be the these teen/20 something trendy AFAB people with short hairstyles and a tumblr-cliche sense of fashion. Just to be clear I obviously have nothing against AFAB genderqueer or otherwise people, I just wanted to blow this steam because I honestly feel like this is a really big problem. Can anyone else relate?', 'subreddit': 'genderqueer', 'title': 'Is AFAB Genderqueer the Norm?', 'created': 1470218356.0}"
13,2016-08-03 15:03:49,4vyxm5,7,47,,genderqueer,Wore my binder in work for the first time (and despite being super hot) I LOVED IT!,1470261829.0,"{'created_utc': 1470236629, 'id': '4vyxm5', 'num_comments': 7, 'score': 47, 'selftext': '', 'subreddit': 'genderqueer', 'title': 'Wore my binder in work for the first time (and despite being super hot) I LOVED IT!', 'created': 1470261829.0}"
14,2016-08-03 17:49:44,4vzsro,1,2,,genderqueer,Nature vs. Nurture and the Gender Divide Nature versus Nurture in the Sex and Gender Divide: -What really determines our gender identity?,1470271784.0,"{'created_utc': 1470246584, 'id': '4vzsro', 'num_comments': 1, 'score': 2, 'selftext': '', 'subreddit': 'genderqueer', 'title': 'Nature vs. Nurture and the Gender Divide Nature versus Nurture in the Sex and Gender Divide: -What really determines our gender identity?', 'created': 1470271784.0}"
15,2016-08-03 18:59:02,4w06cb,16,9,"Hey guys. So I've been questioning my gender identity for a few months now and am pretty sure that I'm some kind of genderqueer. I've told a few of my friends, but I still present as male and no one else knows. A week or two ago, I was at a part and a cute girl called me cute. One thing led to another and we started texting, and I'm probably gonna make a move soonish. However I'm pretty sure she's straight (though I have no way of knowing for sure without asking, obv) and I don't know how she'd feel about me not really being a guy. I still plan on presenting fairly masculine in the future (I'm closer to a guy then a girl), but is this something I should tell her, even though I'm still sort of in the questioning stage? Would it be deceiving not to do it now? 

Also for all the non binary people on the sub how do you find people attracted to you, since technically speaking it's only going to be the pan people that give you a chance? That's something I'm kind of worried about, I have enough trouble finding a partner already lol.",genderqueer,Relationships while genderqueer?,1470275942.0,"{'created_utc': 1470250742, 'id': '4w06cb', 'num_comments': 16, 'score': 9, 'selftext': ""Hey guys. So I've been questioning my gender identity for a few months now and am pretty sure that I'm some kind of genderqueer. I've told a few of my friends, but I still present as male and no one else knows. A week or two ago, I was at a part and a cute girl called me cute. One thing led to another and we started texting, and I'm probably gonna make a move soonish. However I'm pretty sure she's straight (though I have no way of knowing for sure without asking, obv) and I don't know how she'd feel about me not really being a guy. I still plan on presenting fairly masculine in the future (I'm closer to a guy then a girl), but is this something I should tell her, even though I'm still sort of in the questioning stage? Would it be deceiving not to do it now? \n\nAlso for all the non binary people on the sub how do you find people attracted to you, since technically speaking it's only going to be the pan people that give you a chance? That's something I'm kind of worried about, I have enough trouble finding a partner already lol."", 'subreddit': 'genderqueer', 'title': 'Relationships while genderqueer?', 'created': 1470275942.0}"
16,2016-08-03 22:20:55,4w18pg,5,9,"I'm in the closet about my gender (gender queer 80% female) for the most part. I'm happy for some people who have a positive experience in coming out but I feel it will have disastrous consequences for me. Coming out as bi/pan when I was 15 was a terrible experience. My family didnt support me and I was bullied and lost most of my friends. As a result i had depression, contemplated suicide, entirely lost my self esteem and it took me years to get over it. I fell in love with a straight cis woman when I was 22 and we are nearly 10 years together. She accepts my sexuality but she doesn't want me to be open about it for her sake. 

Because of this bad experience I feel trapped about opening up about my gender. I came out to my partner as a woman twice (GQ is beyond her knowledge right now), once in the early part of our relationship and again last week. Both times I was blind drunk and when she asked me about it the next day I took it back. In between that time shes questioned me but ive always denied it. She has as much said that she would leave me if I ever came out as trans. I love her so much but I fear shell leave me. I managed to keep it suppressed for years but a few months ago with the massacre in the gay club it brought it all back stronger than before. I feel so trapped and lonely. I Dont know what to do.",genderqueer,The last few months have been hell on earth.,1470288055.0,"{'created_utc': 1470262855, 'id': '4w18pg', 'num_comments': 5, 'score': 9, 'selftext': ""I'm in the closet about my gender (gender queer 80% female) for the most part. I'm happy for some people who have a positive experience in coming out but I feel it will have disastrous consequences for me. Coming out as bi/pan when I was 15 was a terrible experience. My family didnt support me and I was bullied and lost most of my friends. As a result i had depression, contemplated suicide, entirely lost my self esteem and it took me years to get over it. I fell in love with a straight cis woman when I was 22 and we are nearly 10 years together. She accepts my sexuality but she doesn't want me to be open about it for her sake. \n\nBecause of this bad experience I feel trapped about opening up about my gender. I came out to my partner as a woman twice (GQ is beyond her knowledge right now), once in the early part of our relationship and again last week. Both times I was blind drunk and when she asked me about it the next day I took it back. In between that time shes questioned me but ive always denied it. She has as much said that she would leave me if I ever came out as trans. I love her so much but I fear shell leave me. I managed to keep it suppressed for years but a few months ago with the massacre in the gay club it brought it all back stronger than before. I feel so trapped and lonely. I Dont know what to do."", 'subreddit': 'genderqueer', 'title': 'The last few months have been hell on earth.', 'created': 1470288055.0}"
17,2016-08-05 22:41:12,4wd3bx,0,15,,genderqueer,How The Little Mermaid Helped a Genderqueer Teen Find Strength,1470462072.0,"{'created_utc': 1470436872, 'id': '4wd3bx', 'num_comments': 0, 'score': 15, 'selftext': '', 'subreddit': 'genderqueer', 'title': 'How The Little Mermaid Helped a Genderqueer Teen Find Strength', 'created': 1470462072.0}"
18,2016-08-06 01:23:25,4wdqef,6,19,"So I'm AMAB. Initially I thought I was binary mtf. But through some experimentation I realised I was nonbinary, with more experimentation I figured I'm likely transfeminine as well so I started experimenting with HRT. Over the last year and a bit I've gone off and on HRT a number of times trying to find a place where I'm comfortable. Whenever I go off HRT I get uncomfortable with the resurgence of hair and apparently my moods are incredibly unstable and in general I'm not pleasant and I always end up wanting to go back on HRT. When I go off HRT I normally stay on a low dose of anti-androgens, so I'm not completely off, just not on E. Not sure if I could handle natural levels of T.

Then when I do go back on HRT because I'm not happy, I'm fine for a couple of months. The subtle feminization is a god send. The better skin the reduction in body hair, general softness of my bodily features. All fantastic. And then my breasts start coming in a bit and i freak the fuck out. There are days where I like them or dont seem to mind them but more and more lately they've been bothering me. Playing with my nips is weird because it'll turn me on but at the same time I'll have this weird feeling shoot up the back of my neck into the back of my head and I'll feel so wrong and it'll give me this feeling as if i want to throw up.

I also occasionally find myself missing how easy it was to get horny. But that's not too big a deal. Libido is supposed to come back later right?

I could just be having a masculine episode. But it just feels every time I make progress in one direction I desperately feel the need to pull back to a middle ground? I don't know anymore. I just feel stuck and trying to work out what I need is doing my head in. I'm on a relatively low dose of E too. 

I definitely dont feel capable of stopping HRT all together. But I feel like the longer I stay on HRT the more distressed I'll be. Or maybe it'll pass? I'm just incredibly confused. I'm afraid to move forward and terrified of moving backward (back to natural T). 

This post likely doesn't do my feelings any justice, but i just needed to offload how i feel. Does anyone else feel this way? Has anyone felt this way? What did you end up doing?

Edit: I mean I had to take a patch off last night because of a random allergic reaction. Was really on the fence about putting another one back on. ",genderqueer,[NSFW] Feeling really stuck and trying to parse feelings unsuccessfully.,1470471805.0,"{'created_utc': 1470446605, 'id': '4wdqef', 'num_comments': 6, 'score': 19, 'selftext': ""So I'm AMAB. Initially I thought I was binary mtf. But through some experimentation I realised I was nonbinary, with more experimentation I figured I'm likely transfeminine as well so I started experimenting with HRT. Over the last year and a bit I've gone off and on HRT a number of times trying to find a place where I'm comfortable. Whenever I go off HRT I get uncomfortable with the resurgence of hair and apparently my moods are incredibly unstable and in general I'm not pleasant and I always end up wanting to go back on HRT. When I go off HRT I normally stay on a low dose of anti-androgens, so I'm not completely off, just not on E. Not sure if I could handle natural levels of T.\n\nThen when I do go back on HRT because I'm not happy, I'm fine for a couple of months. The subtle feminization is a god send. The better skin the reduction in body hair, general softness of my bodily features. All fantastic. And then my breasts start coming in a bit and i freak the fuck out. There are days where I like them or dont seem to mind them but more and more lately they've been bothering me. Playing with my nips is weird because it'll turn me on but at the same time I'll have this weird feeling shoot up the back of my neck into the back of my head and I'll feel so wrong and it'll give me this feeling as if i want to throw up.\n\nI also occasionally find myself missing how easy it was to get horny. But that's not too big a deal. Libido is supposed to come back later right?\n\nI could just be having a masculine episode. But it just feels every time I make progress in one direction I desperately feel the need to pull back to a middle ground? I don't know anymore. I just feel stuck and trying to work out what I need is doing my head in. I'm on a relatively low dose of E too. \n\nI definitely dont feel capable of stopping HRT all together. But I feel like the longer I stay on HRT the more distressed I'll be. Or maybe it'll pass? I'm just incredibly confused. I'm afraid to move forward and terrified of moving backward (back to natural T). \n\nThis post likely doesn't do my feelings any justice, but i just needed to offload how i feel. Does anyone else feel this way? Has anyone felt this way? What did you end up doing?\n\nEdit: I mean I had to take a patch off last night because of a random allergic reaction. Was really on the fence about putting another one back on. "", 'subreddit': 'genderqueer', 'title': '[NSFW] Feeling really stuck and trying to parse feelings unsuccessfully.', 'created': 1470471805.0}"
19,2016-08-06 06:00:26,4weolk,4,20,[removed],genderqueer,"AMAB, trans, fluid individual. What could a low dose of E do for me?",1470488426.0,"{'created_utc': 1470463226, 'id': '4weolk', 'num_comments': 4, 'score': 20, 'selftext': '[removed]', 'subreddit': 'genderqueer', 'title': 'AMAB, trans, fluid individual. What could a low dose of E do for me?', 'created': 1470488426.0}"
