,created_utc,id,num_comments,score,selftext,subreddit,title,created,d_
71,2016-08-17 18:26:15,4y791r,30,31,"Okay so I'm at my wit's end. I think of myself as an androgyne (AFAB) who is okay with they/she/he I really dont mind. Now I have a really long term boyfriend's who is cis male. I've come out to him and he says that I'm me and it doesnt matter and accepts me as who I am. I'm like awesome! I've hit the jackpot. I've voiced concerns because he identifies as straight and this makes him kinda not quite straight but he says he doesn't care about that kind of thing. Now the real problem came up yesterday when I was feeling particularly disheartened and emotional and trying to explain why I feel like being a woman is just not enough. That I don't like being grouped with women and expecting to understand women on that basis. I referenced a time one of our friends girlfriends was upset cause I wasn't taking her side and she said ""You're a girl so you have to be on my side"" now this really bugged me and I talked about it to him. I feel uncomfortable with being expected to side with her just based on gender. He kinda brushed it off as, well Alex and I are on a side so she wanted you on her side to make it even. I was like yeah I guess but it still rubbed me wrong cause I didn't agree with her on her point at all. Anyway I start talking about a new friend of mine who probably recognized me as genderqueer as we had a lovely discussion about the all gender bathroom near the computer lab of our class. I think she knows I am but I haven't ""come out"" to her. Here my bf interjects and says he doesn't want me to identify with a group of people because it isn't who I am and I'm trying to fit myself into a box that shouldn't exist. He says that people are people and that basically I can be who I am without identify as genderqueer. Now I'm crying pm because I think he kinda right but it still feels wrong. I don't want to be treated ""like a girl"" but I still have a female body and don't want to change that. And basically I realized all I wanted was a little validation of my feelings and for him to say yes, feeling this way is okay and I'm with you, but what I got was no you're not genderqueer quit trying to to fit yourself into another box people made up. The problem is this ""box"" feels good. This new word makes me feel freer and more true to myself. My bf thinks I'm just trying to be special and ""better"" than cis people. I don't claim to be better, just different and frustrated with how others see me. Its like he's okay with my identity as long as I dont remind him that that's how I see myself now. I'm really fucking confused and I just want it to be obvious I don't gel with the whole ""women's club"" socialization expectation. I don't even know where I'm going with his because I love him it just seems like despite saying he's accepting that he is it really isn't. I don't know what to do....",genderqueer,Being genderqueer is fine but not if you show it off?,1471483575.0,"{'created_utc': 1471458375, 'id': '4y791r', 'num_comments': 30, 'score': 31, 'selftext': 'Okay so I\'m at my wit\'s end. I think of myself as an androgyne (AFAB) who is okay with they/she/he I really dont mind. Now I have a really long term boyfriend\'s who is cis male. I\'ve come out to him and he says that I\'m me and it doesnt matter and accepts me as who I am. I\'m like awesome! I\'ve hit the jackpot. I\'ve voiced concerns because he identifies as straight and this makes him kinda not quite straight but he says he doesn\'t care about that kind of thing. Now the real problem came up yesterday when I was feeling particularly disheartened and emotional and trying to explain why I feel like being a woman is just not enough. That I don\'t like being grouped with women and expecting to understand women on that basis. I referenced a time one of our friends girlfriends was upset cause I wasn\'t taking her side and she said ""You\'re a girl so you have to be on my side"" now this really bugged me and I talked about it to him. I feel uncomfortable with being expected to side with her just based on gender. He kinda brushed it off as, well Alex and I are on a side so she wanted you on her side to make it even. I was like yeah I guess but it still rubbed me wrong cause I didn\'t agree with her on her point at all. Anyway I start talking about a new friend of mine who probably recognized me as genderqueer as we had a lovely discussion about the all gender bathroom near the computer lab of our class. I think she knows I am but I haven\'t ""come out"" to her. Here my bf interjects and says he doesn\'t want me to identify with a group of people because it isn\'t who I am and I\'m trying to fit myself into a box that shouldn\'t exist. He says that people are people and that basically I can be who I am without identify as genderqueer. Now I\'m crying pm because I think he kinda right but it still feels wrong. I don\'t want to be treated ""like a girl"" but I still have a female body and don\'t want to change that. And basically I realized all I wanted was a little validation of my feelings and for him to say yes, feeling this way is okay and I\'m with you, but what I got was no you\'re not genderqueer quit trying to to fit yourself into another box people made up. The problem is this ""box"" feels good. This new word makes me feel freer and more true to myself. My bf thinks I\'m just trying to be special and ""better"" than cis people. I don\'t claim to be better, just different and frustrated with how others see me. Its like he\'s okay with my identity as long as I dont remind him that that\'s how I see myself now. I\'m really fucking confused and I just want it to be obvious I don\'t gel with the whole ""women\'s club"" socialization expectation. I don\'t even know where I\'m going with his because I love him it just seems like despite saying he\'s accepting that he is it really isn\'t. I don\'t know what to do....', 'subreddit': 'genderqueer', 'title': 'Being genderqueer is fine but not if you show it off?', 'created': 1471483575.0}"
72,2016-08-17 18:56:17,4y7f4b,1,17,,genderqueer,Target adding single-stall bathrooms at all stores,1471485377.0,"{'created_utc': 1471460177, 'id': '4y7f4b', 'num_comments': 1, 'score': 17, 'selftext': '', 'subreddit': 'genderqueer', 'title': 'Target adding single-stall bathrooms at all stores', 'created': 1471485377.0}"
73,2016-08-18 01:52:22,4y9lbv,1,1,[deleted],genderqueer,i'm redesigning our company's website and that means new headshots,1471510342.0,"{'created_utc': 1471485142, 'id': '4y9lbv', 'num_comments': 1, 'score': 1, 'selftext': '[deleted]', 'subreddit': 'genderqueer', 'title': ""i'm redesigning our company's website and that means new headshots"", 'created': 1471510342.0}"
74,2016-08-18 09:31:08,4ybbyf,5,11,,genderqueer,Gender-diverse Victorians to be given greater freedom to change birth certificates,1471537868.0,"{'created_utc': 1471512668, 'id': '4ybbyf', 'num_comments': 5, 'score': 11, 'selftext': '', 'subreddit': 'genderqueer', 'title': 'Gender-diverse Victorians to be given greater freedom to change birth certificates', 'created': 1471537868.0}"
75,2016-08-18 17:01:51,4ydek0,2,9,"Hello. I'll start off by saying I've always loved the way many girls look with the never ending combinations of hair, body types and clothes. I love girls with long hair and hips wider than shoulders. Because of my affinity with long hair I decided to stop cutting mine (currently only 10cm long) and let it grow. Then it hit me: I want to look and behave like girls.  

So I am familiar with the word androgyny because of Pete Burns circa 1985 and I figured I can do that too. That's why I have come here. I hope to get some tips on how to do my best to make my hair grow the fastest and become cute and lovely. I also want to start exercising to get my body as close to my preferences as possible (but the question is if that is even possible because I'm sure men are fundamentally different from women). I should say I'm perfectly fine with my genitalia and want to keep being a guy but look like a girl and perhaps do girly things but just don't know where to even start from. 

Do the guys and gals of this subreddit have any advice for me? Like lifestyle, interests, diet, shopping tips that I can learn from? I want to have like chest long hair and thick hips and thighs and shins and calves, and also be able to wear a skirt in public and make friends who can accept me.  How long does the ""transistion"" (don't know if that's the correct word) usually take? What do I do to celebrate the new me afterwards? I hope I can get some feedback here.

P.S. throwaway because I use the same username everywhere and I don't know how people who know me are going to react until I go past the awkward beginnings phase. ",genderqueer,"Guy, 18, longing to look more feminine [x-post from r/androgyny]",1471564911.0,"{'created_utc': 1471539711, 'id': '4ydek0', 'num_comments': 2, 'score': 9, 'selftext': 'Hello. I\'ll start off by saying I\'ve always loved the way many girls look with the never ending combinations of hair, body types and clothes. I love girls with long hair and hips wider than shoulders. Because of my affinity with long hair I decided to stop cutting mine (currently only 10cm long) and let it grow. Then it hit me: I want to look and behave like girls.  \n\nSo I am familiar with the word androgyny because of Pete Burns circa 1985 and I figured I can do that too. That\'s why I have come here. I hope to get some tips on how to do my best to make my hair grow the fastest and become cute and lovely. I also want to start exercising to get my body as close to my preferences as possible (but the question is if that is even possible because I\'m sure men are fundamentally different from women). I should say I\'m perfectly fine with my genitalia and want to keep being a guy but look like a girl and perhaps do girly things but just don\'t know where to even start from. \n\nDo the guys and gals of this subreddit have any advice for me? Like lifestyle, interests, diet, shopping tips that I can learn from? I want to have like chest long hair and thick hips and thighs and shins and calves, and also be able to wear a skirt in public and make friends who can accept me.  How long does the ""transistion"" (don\'t know if that\'s the correct word) usually take? What do I do to celebrate the new me afterwards? I hope I can get some feedback here.\n\nP.S. throwaway because I use the same username everywhere and I don\'t know how people who know me are going to react until I go past the awkward beginnings phase. ', 'subreddit': 'genderqueer', 'title': 'Guy, 18, longing to look more feminine [x-post from r/androgyny]', 'created': 1471564911.0}"
76,2016-08-18 18:17:22,4ydtzd,11,112,,genderqueer,i'm redesigning our company's website and that means new headshots,1471569442.0,"{'created_utc': 1471544242, 'id': '4ydtzd', 'num_comments': 11, 'score': 112, 'selftext': '', 'subreddit': 'genderqueer', 'title': ""i'm redesigning our company's website and that means new headshots"", 'created': 1471569442.0}"
77,2016-08-19 13:14:34,4yiugp,9,5,"So, I'm AFAB and would tentatively identify as bigender. I don't have any plans for HRT or GRS of any kind, but I do on some days identify as more masculine. My friends and SO know but my family doesn't. 

My dad is getting married at the beginning of next month to a very nice lady. She's been trying her best to get to know me ever since she and my dad started dating (I'm 22, they started dating about two years ago). And I've been mostly accepting of this.

However, there have been moments recently where her attempts to ""bond"" with me have sort of caused me to have dysphoric moments. Recently, she helped her daughter (who's about my age) pick out a dress. She talked about how she's really good at seeing what outfits work best on people, and she said that any girls coming to the wedding could ask for her help shopping. Then she turned to me and said ""you're next, kitkatkez"".

Everyone laughed. I laughed along. Inside I died. It's a funny thing, I've always had these feelings anytime someone drew attention to the fact that in their eyes I was 100% a girl, but now that I'm more out with my identity I feel it even more. I guess I always thought before that I was just an awkward tomboy afraid that I had to leave that stuff behind. Now I know it's something more.

That wasn't the end of it. My dad really wants me to talk to his fiancé more, so he kept talking to me and texting me about how I need a dress for the wedding and she's more than willing to help. I told him I don't like shopping with other people (true) and I also already have a dress (sorta true). I ended up buying a simple dress just to end the discussion. 

About a week ago I went to visit her and my dad. She kept asking me about my bangs, told me she could show me how to get them in one direction/easily trim them. At first I declined but she kept asking so I finally relented. As we were going upstairs I asked if my SO wanted to come with me and she said ""no, you go ahead and relax, this is girl time"". Needles in the brain. It wasn't a bad experience (I don't like people touching my hair but the advice she gave me was helpful) but that comment just kept going through my head. 

My dad during the dress episode sent me a thing about how ""all the girls are going to wear dresses and all the guys are going to wear dress shirts and slacks"" and there's still a burning part of me that wants to wear the second thing. But I worry that since they were so insistent on the dress thing that me doing that will be taken as me being difficult, and take away from their wedding, which is the absolute last thing I want to do.

It's just - stuff like this makes me think that I'm never going to get to be acknowledged the way I want to unless I transition completely. And I don't blame either of them, they don't know anything about this. But I don't know if I should tell them. My dad wouldn't cut off contact or anything, they wouldn't hate me but they wouldn't understand. My dad only now is starting to understand binary trans issues and he still misgenders people and says stuff like ""well if a woman wants to take hormones so she can be a man, why should anyone stop her, let her live her life."" Which I guess is better than hating trans people? Not by much? I love my dad but maaan. I just can't imagine explaining non binary to him at this point. Much less to his fiancé. 

I just feel a little sad because back when I was young and seen as a tomboy my dad always seemed to have my back on not liking feminine things. He stopped my bio mom from piercing my ears when I was a baby because he thought I should get to make that decision myself, and I decided I didn't want it. He gave me my early love of video games, a hobby that at the time was seen as even more of a boys club than now. My mom always hemmed and hawed about how he was just turning me into a boy because he never had a son, but he was letting me be me. Now I wish he'd say something to his fiancé about how maybe giving me girl time isn't the way for us to get to know each other. Instead I feel like he's putting it on me to bloom into my feminine flower already so we can be besties. But I know that's not what he means, it's more just me dealing with dysphoria blowing this all out of proportion. 

I guess, can anyone offer any words of advice in this situation? ",genderqueer,Gender and weddings,1471637674.0,"{'created_utc': 1471612474, 'id': '4yiugp', 'num_comments': 9, 'score': 5, 'selftext': 'So, I\'m AFAB and would tentatively identify as bigender. I don\'t have any plans for HRT or GRS of any kind, but I do on some days identify as more masculine. My friends and SO know but my family doesn\'t. \n\nMy dad is getting married at the beginning of next month to a very nice lady. She\'s been trying her best to get to know me ever since she and my dad started dating (I\'m 22, they started dating about two years ago). And I\'ve been mostly accepting of this.\n\nHowever, there have been moments recently where her attempts to ""bond"" with me have sort of caused me to have dysphoric moments. Recently, she helped her daughter (who\'s about my age) pick out a dress. She talked about how she\'s really good at seeing what outfits work best on people, and she said that any girls coming to the wedding could ask for her help shopping. Then she turned to me and said ""you\'re next, kitkatkez"".\n\nEveryone laughed. I laughed along. Inside I died. It\'s a funny thing, I\'ve always had these feelings anytime someone drew attention to the fact that in their eyes I was 100% a girl, but now that I\'m more out with my identity I feel it even more. I guess I always thought before that I was just an awkward tomboy afraid that I had to leave that stuff behind. Now I know it\'s something more.\n\nThat wasn\'t the end of it. My dad really wants me to talk to his fiancé more, so he kept talking to me and texting me about how I need a dress for the wedding and she\'s more than willing to help. I told him I don\'t like shopping with other people (true) and I also already have a dress (sorta true). I ended up buying a simple dress just to end the discussion. \n\nAbout a week ago I went to visit her and my dad. She kept asking me about my bangs, told me she could show me how to get them in one direction/easily trim them. At first I declined but she kept asking so I finally relented. As we were going upstairs I asked if my SO wanted to come with me and she said ""no, you go ahead and relax, this is girl time"". Needles in the brain. It wasn\'t a bad experience (I don\'t like people touching my hair but the advice she gave me was helpful) but that comment just kept going through my head. \n\nMy dad during the dress episode sent me a thing about how ""all the girls are going to wear dresses and all the guys are going to wear dress shirts and slacks"" and there\'s still a burning part of me that wants to wear the second thing. But I worry that since they were so insistent on the dress thing that me doing that will be taken as me being difficult, and take away from their wedding, which is the absolute last thing I want to do.\n\nIt\'s just - stuff like this makes me think that I\'m never going to get to be acknowledged the way I want to unless I transition completely. And I don\'t blame either of them, they don\'t know anything about this. But I don\'t know if I should tell them. My dad wouldn\'t cut off contact or anything, they wouldn\'t hate me but they wouldn\'t understand. My dad only now is starting to understand binary trans issues and he still misgenders people and says stuff like ""well if a woman wants to take hormones so she can be a man, why should anyone stop her, let her live her life."" Which I guess is better than hating trans people? Not by much? I love my dad but maaan. I just can\'t imagine explaining non binary to him at this point. Much less to his fiancé. \n\nI just feel a little sad because back when I was young and seen as a tomboy my dad always seemed to have my back on not liking feminine things. He stopped my bio mom from piercing my ears when I was a baby because he thought I should get to make that decision myself, and I decided I didn\'t want it. He gave me my early love of video games, a hobby that at the time was seen as even more of a boys club than now. My mom always hemmed and hawed about how he was just turning me into a boy because he never had a son, but he was letting me be me. Now I wish he\'d say something to his fiancé about how maybe giving me girl time isn\'t the way for us to get to know each other. Instead I feel like he\'s putting it on me to bloom into my feminine flower already so we can be besties. But I know that\'s not what he means, it\'s more just me dealing with dysphoria blowing this all out of proportion. \n\nI guess, can anyone offer any words of advice in this situation? ', 'subreddit': 'genderqueer', 'title': 'Gender and weddings', 'created': 1471637674.0}"
78,2016-08-19 16:26:36,4yjv50,1,1,,genderqueer,First post here. Do I look androgynous? (Probably not),1471649196.0,"{'created_utc': 1471623996, 'id': '4yjv50', 'num_comments': 1, 'score': 1, 'selftext': '', 'subreddit': 'genderqueer', 'title': 'First post here. Do I look androgynous? (Probably not)', 'created': 1471649196.0}"
79,2016-08-19 16:36:47,4yjx3m,11,14,,genderqueer,First post here. Do I look androgynous? (Probably not :/),1471649807.0,"{'created_utc': 1471624607, 'id': '4yjx3m', 'num_comments': 11, 'score': 14, 'selftext': '', 'subreddit': 'genderqueer', 'title': 'First post here. Do I look androgynous? (Probably not :/)', 'created': 1471649807.0}"
80,2016-08-19 17:34:06,4yk75x,17,17,"Hey guys. Let me preface this by saying I'm still a bit confused about my gender identity, as I constantly change my mind about what I'm feeling. I may be genderfluid but frankly I don't know if I'm fluid enough for that? Like what will typically happen is I will talk myself in a circle, leaving me even less sure about what I feel I am.

This being said I've found that I'm happiest when I feel like a girl, besides the dysphoria that sets in when I realize that well, I'm not one. I've thought for a while that I wish I was born a girl, but this also isn't consistent and I sometimes appreciate being a dude. I enjoy browsing Reddit, including some of the LGBT+ friendly subreddits, however when I had came upon people posting about being MTF I felt somewhat of a disconnect, i.e. I'm happy for them etc but that's not me. However recently I was browsing and it's like a switch flipped, I found myself fantasizing about being a girl and all that jazz. However I want to reiterate that it's a matter of wanting to be a girl, not necessarily feeling like one. This may be because I find many girls attractive (I'm pan but def more into girls then guys) or may be because I have a bit of a link for this type of thing (i.e. dressing up in girl clothes usually arouses me, although I also get somewhat of an emotional gratification from it). On the flip side whenever I've seen stuff about people transitioning from a female to male, I've picked up that I feel something along the lines of ""why would they want to do that? Who would want to be a guy, especially when you get to be born a girl?"" (With all due respect to those people that are FTM, do whatever makes you happy :))

To further complicate things I don't always feel this way, and there are varying shades to the feelings, i.e. when I feel like I want to be a girl that can be a guy sometimes. What does this all mean? I know if you feel like I AM a girl then it's like okay you probably are one, but wanting to be one?",genderqueer,Is it normal to WANT to be a girl?,1471653246.0,"{'created_utc': 1471628046, 'id': '4yk75x', 'num_comments': 17, 'score': 17, 'selftext': 'Hey guys. Let me preface this by saying I\'m still a bit confused about my gender identity, as I constantly change my mind about what I\'m feeling. I may be genderfluid but frankly I don\'t know if I\'m fluid enough for that? Like what will typically happen is I will talk myself in a circle, leaving me even less sure about what I feel I am.\n\nThis being said I\'ve found that I\'m happiest when I feel like a girl, besides the dysphoria that sets in when I realize that well, I\'m not one. I\'ve thought for a while that I wish I was born a girl, but this also isn\'t consistent and I sometimes appreciate being a dude. I enjoy browsing Reddit, including some of the LGBT+ friendly subreddits, however when I had came upon people posting about being MTF I felt somewhat of a disconnect, i.e. I\'m happy for them etc but that\'s not me. However recently I was browsing and it\'s like a switch flipped, I found myself fantasizing about being a girl and all that jazz. However I want to reiterate that it\'s a matter of wanting to be a girl, not necessarily feeling like one. This may be because I find many girls attractive (I\'m pan but def more into girls then guys) or may be because I have a bit of a link for this type of thing (i.e. dressing up in girl clothes usually arouses me, although I also get somewhat of an emotional gratification from it). On the flip side whenever I\'ve seen stuff about people transitioning from a female to male, I\'ve picked up that I feel something along the lines of ""why would they want to do that? Who would want to be a guy, especially when you get to be born a girl?"" (With all due respect to those people that are FTM, do whatever makes you happy :))\n\nTo further complicate things I don\'t always feel this way, and there are varying shades to the feelings, i.e. when I feel like I want to be a girl that can be a guy sometimes. What does this all mean? I know if you feel like I AM a girl then it\'s like okay you probably are one, but wanting to be one?', 'subreddit': 'genderqueer', 'title': 'Is it normal to WANT to be a girl?', 'created': 1471653246.0}"
81,2016-08-19 22:54:51,4yludx,1,1,,genderqueer,"We had updated photos taken at work today, gender me?",1471672491.0,"{'created_utc': 1471647291, 'id': '4yludx', 'num_comments': 1, 'score': 1, 'selftext': '', 'subreddit': 'genderqueer', 'title': 'We had updated photos taken at work today, gender me?', 'created': 1471672491.0}"
82,2016-08-19 22:57:27,4ylutp,59,61,,genderqueer,We had updated photos taken at work. Gender me?,1471672647.0,"{'created_utc': 1471647447, 'id': '4ylutp', 'num_comments': 59, 'score': 61, 'selftext': '', 'subreddit': 'genderqueer', 'title': 'We had updated photos taken at work. Gender me?', 'created': 1471672647.0}"
