created_utc,id,num_comments,score,selftext,subreddit,title,created,d_
2018-02-01 00:50:49,7uev44,2,58,,trans,They corrected themselves without asking anything 😁,1517471449.0,"{'created_utc': 1517446249, 'id': '7uev44', 'num_comments': 2, 'score': 58, 'selftext': '', 'subreddit': 'trans', 'title': 'They corrected themselves without asking anything 😁', 'created': 1517471449.0}"
2018-02-01 03:02:42,7ufotu,1,0,"Please check out my research at : https://docs.google.com/document/d/18qLB20TBSWJUSipF_vvV1jtHg5Q5WRiQsbgUw0OkWA4/edit?usp=sharing

Leave any feedback on this post, I am looking to spread it and gain some knowledge about this because I think it has promise!",trans,"Research on Theoretical SRS Procedures, MTF Version",1517479362.0,"{'created_utc': 1517454162, 'id': '7ufotu', 'num_comments': 1, 'score': 0, 'selftext': 'Please check out my research at : https://docs.google.com/document/d/18qLB20TBSWJUSipF_vvV1jtHg5Q5WRiQsbgUw0OkWA4/edit?usp=sharing\n\nLeave any feedback on this post, I am looking to spread it and gain some knowledge about this because I think it has promise!', 'subreddit': 'trans', 'title': 'Research on Theoretical SRS Procedures, MTF Version', 'created': 1517479362.0}"
2018-02-01 03:51:20,7ufzg0,3,2,"I am starting therapy tomorrow, I have recently realized that I am trans (mtf). I have repressed this and over compensated with a masculine macho mask for years. I came out to my wife and it was a shit show at first but things have calmed down. 

I find myself thinking about coming out to family, friends, work and I just get so overwhelmed. Idk how any of this is going to go but I have low hopes for family. I am lucky that my work specifically doesn’t discriminate against trans people and also my city names it as a protected class. But this is going to be a big change in my relationship with all my co-workers. I have no idea how my current friend group will react. 

I could use some encouragement ",trans,"Starting therapy tomorrow, can’t describe how scared I am",1517482280.0,"{'created_utc': 1517457080, 'id': '7ufzg0', 'num_comments': 3, 'score': 2, 'selftext': 'I am starting therapy tomorrow, I have recently realized that I am trans (mtf). I have repressed this and over compensated with a masculine macho mask for years. I came out to my wife and it was a shit show at first but things have calmed down. \n\nI find myself thinking about coming out to family, friends, work and I just get so overwhelmed. Idk how any of this is going to go but I have low hopes for family. I am lucky that my work specifically doesn’t discriminate against trans people and also my city names it as a protected class. But this is going to be a big change in my relationship with all my co-workers. I have no idea how my current friend group will react. \n\nI could use some encouragement ', 'subreddit': 'trans', 'title': 'Starting therapy tomorrow, can’t describe how scared I am', 'created': 1517482280.0}"
2018-02-01 04:11:33,7ug3vg,1,0,,trans,Looking for guys to wor$hip me,1517483493.0,"{'created_utc': 1517458293, 'id': '7ug3vg', 'num_comments': 1, 'score': 0, 'selftext': '', 'subreddit': 'trans', 'title': 'Looking for guys to wor$hip me', 'created': 1517483493.0}"
2018-02-01 04:57:54,7ugd4f,6,33,,trans,😀,1517486274.0,"{'created_utc': 1517461074, 'id': '7ugd4f', 'num_comments': 6, 'score': 33, 'selftext': '', 'subreddit': 'trans', 'title': '😀', 'created': 1517486274.0}"
2018-02-01 13:30:43,7uiqd9,7,5,"New account just in case. I'm looking for some answers and I don't know if you guys have any but Reddit is usually pretty cool so. I'm going out of my mind with this stuff. Some days I just feel like what is the point of sorting out my gender if I am not going to be able to transition IRL. But I can't stop thinking about my gender. I started going by a nickname IRL and now it bothers me every time I hear my full name. I feel like the more open I am about not being a girl, the more it's going to drive me nuts not to just come all the way out, but when I don't talk about it, my friends get worried and I get depressed. Is this a normal part of the process? ",trans,Hi,1517517043.0,"{'created_utc': 1517491843, 'id': '7uiqd9', 'num_comments': 7, 'score': 5, 'selftext': ""New account just in case. I'm looking for some answers and I don't know if you guys have any but Reddit is usually pretty cool so. I'm going out of my mind with this stuff. Some days I just feel like what is the point of sorting out my gender if I am not going to be able to transition IRL. But I can't stop thinking about my gender. I started going by a nickname IRL and now it bothers me every time I hear my full name. I feel like the more open I am about not being a girl, the more it's going to drive me nuts not to just come all the way out, but when I don't talk about it, my friends get worried and I get depressed. Is this a normal part of the process? "", 'subreddit': 'trans', 'title': 'Hi', 'created': 1517517043.0}"
2018-02-01 14:13:03,7uiz5r,7,1,I starting to feel like I'll never be able to start hrt with how things are going now with the fact my work is refusing to give me time off so I can see the psychiatrist and my hope with informed consent is over seeing as I would need to spend 1400 just to get a letter from my psychologist (no one I know who's done informed consent needed one) and I feel hopeless and almost Want to end it but that's a stupid way to go about it. I'm just ranting and don't know what to do the little voice in the back of my head is saying I'm too old already even though I know that I'm not ,trans,Venting,1517519583.0,"{'created_utc': 1517494383, 'id': '7uiz5r', 'num_comments': 7, 'score': 1, 'selftext': ""I starting to feel like I'll never be able to start hrt with how things are going now with the fact my work is refusing to give me time off so I can see the psychiatrist and my hope with informed consent is over seeing as I would need to spend 1400 just to get a letter from my psychologist (no one I know who's done informed consent needed one) and I feel hopeless and almost Want to end it but that's a stupid way to go about it. I'm just ranting and don't know what to do the little voice in the back of my head is saying I'm too old already even though I know that I'm not "", 'subreddit': 'trans', 'title': 'Venting', 'created': 1517519583.0}"
2018-02-01 16:09:50,7ujrl8,1,1,,trans,MY WIFE IS A MAN!,1517526590.0,"{'created_utc': 1517501390, 'id': '7ujrl8', 'num_comments': 1, 'score': 1, 'selftext': '', 'subreddit': 'trans', 'title': 'MY WIFE IS A MAN!', 'created': 1517526590.0}"
2018-02-01 20:55:45,7ulxrv,5,12,"I'll try to keep it relatively short, I would just appreciate some advice.. One of my best friends is trans, he came out about four years ago. Since then, he goes by his new name and all of his friends are really supportive, which is great. Problem is, his parents are in full denial. They only call him by his birth name, won't look into the topic at all and avoid talking about it. We all try our best to support him as effectively as possible, but of course the situation with his parents weights him down a lot and lately his depression, anxiety and dismorphia have been getting worse and worse and it breaks my heart.

We've talked about how badly he wants to start HRT once but then never again because he hates that topic - he describes it as a dream that'll never come true anyway and is just too depressing to even think about. Like seeing that one bright thing that you want more than anything else in life but it's completely out of reach. 

And that's the thing, because I don't really see why it'd be impossible. He's of age and I've looked into it and here in Germany, health insurance would absorb the costs, the only thing he needs is an affirmation from his psychiatrist and a few general health checks and stuff. He wouldn't even have to discuss it with his parents and wouldn't need their approval either.

I think the point that keeps him from going through with HRT is that he doesn't want to ""disappoint"" his parents and family and he's scared of how a transition would affect their relationship. I completely understand that because their relationship has been really good up until his outing and he still loves them - while they love their ""daughter"" and he's scared of rejection. 

But it's become more and more obvious that he can't keep going like this either and I'm really worried about him. Does anyone know how to handle a situation like this and how I could carefully talk to him about how this is solely his choice and his life and stuff without invading his space and making him uncomfortable and depressed? I know I can't do much but I feel so helpless watching him suffer :(",trans,I wanna help my trans friend so badly but I don't know how,1517543745.0,"{'created_utc': 1517518545, 'id': '7ulxrv', 'num_comments': 5, 'score': 12, 'selftext': 'I\'ll try to keep it relatively short, I would just appreciate some advice.. One of my best friends is trans, he came out about four years ago. Since then, he goes by his new name and all of his friends are really supportive, which is great. Problem is, his parents are in full denial. They only call him by his birth name, won\'t look into the topic at all and avoid talking about it. We all try our best to support him as effectively as possible, but of course the situation with his parents weights him down a lot and lately his depression, anxiety and dismorphia have been getting worse and worse and it breaks my heart.\n\nWe\'ve talked about how badly he wants to start HRT once but then never again because he hates that topic - he describes it as a dream that\'ll never come true anyway and is just too depressing to even think about. Like seeing that one bright thing that you want more than anything else in life but it\'s completely out of reach. \n\nAnd that\'s the thing, because I don\'t really see why it\'d be impossible. He\'s of age and I\'ve looked into it and here in Germany, health insurance would absorb the costs, the only thing he needs is an affirmation from his psychiatrist and a few general health checks and stuff. He wouldn\'t even have to discuss it with his parents and wouldn\'t need their approval either.\n\nI think the point that keeps him from going through with HRT is that he doesn\'t want to ""disappoint"" his parents and family and he\'s scared of how a transition would affect their relationship. I completely understand that because their relationship has been really good up until his outing and he still loves them - while they love their ""daughter"" and he\'s scared of rejection. \n\nBut it\'s become more and more obvious that he can\'t keep going like this either and I\'m really worried about him. Does anyone know how to handle a situation like this and how I could carefully talk to him about how this is solely his choice and his life and stuff without invading his space and making him uncomfortable and depressed? I know I can\'t do much but I feel so helpless watching him suffer :(', 'subreddit': 'trans', 'title': ""I wanna help my trans friend so badly but I don't know how"", 'created': 1517543745.0}"
2018-02-02 01:36:31,7unu8y,11,17,"This whole week has been chaos trying to get my estradiol filled. After multiple delays at the pharmacy &amp; trying to acquire the money to even be able to afford the stuff, I finally got to bring my estrogen home and I just finished taking my first shot.

I can't even describe how happy I am right now. This honestly doesn't even feel real. A year and a half ago, I figured I would never get to transition. But here I am :-)

I just wanted to share this with someone. I hope you're all doing well, much love &lt;3",trans,This whole week was hell trying to get my estradiol. But now it's finally over and I couldn't be happier.,1517560591.0,"{'created_utc': 1517535391, 'id': '7unu8y', 'num_comments': 11, 'score': 17, 'selftext': ""This whole week has been chaos trying to get my estradiol filled. After multiple delays at the pharmacy &amp; trying to acquire the money to even be able to afford the stuff, I finally got to bring my estrogen home and I just finished taking my first shot.\n\nI can't even describe how happy I am right now. This honestly doesn't even feel real. A year and a half ago, I figured I would never get to transition. But here I am :-)\n\nI just wanted to share this with someone. I hope you're all doing well, much love &lt;3"", 'subreddit': 'trans', 'title': ""This whole week was hell trying to get my estradiol. But now it's finally over and I couldn't be happier."", 'created': 1517560591.0}"
2018-02-02 23:14:50,7uvg22,3,14,"I posted here earlier about having a conversation with my therapist. It was late last year. Today I celebrate day one of my hormone replacement therapy! Got my patches in the mail and stuck the first one to myself! I'm so excited and happy that I've made it so far and I'm excited to continue making progress.

And of course, I know this is gonna take a long while. Thankfully I'm not in a hurry to see results, but definitely excited to see em!",trans,Day one!,1517638490.0,"{'created_utc': 1517613290, 'id': '7uvg22', 'num_comments': 3, 'score': 14, 'selftext': ""I posted here earlier about having a conversation with my therapist. It was late last year. Today I celebrate day one of my hormone replacement therapy! Got my patches in the mail and stuck the first one to myself! I'm so excited and happy that I've made it so far and I'm excited to continue making progress.\n\nAnd of course, I know this is gonna take a long while. Thankfully I'm not in a hurry to see results, but definitely excited to see em!"", 'subreddit': 'trans', 'title': 'Day one!', 'created': 1517638490.0}"
2018-02-02 23:42:32,7uvmjs,1,0,,trans,New scientific discovery proves being transgender is a hoax.,1517640152.0,"{'created_utc': 1517614952, 'id': '7uvmjs', 'num_comments': 1, 'score': 0, 'selftext': '', 'subreddit': 'trans', 'title': 'New scientific discovery proves being transgender is a hoax.', 'created': 1517640152.0}"
2018-02-03 03:21:54,7uwvve,25,6,,trans,I made a video to help explains trans people in hopes of getting people to understand,1517653314.0,"{'created_utc': 1517628114, 'id': '7uwvve', 'num_comments': 25, 'score': 6, 'selftext': '', 'subreddit': 'trans', 'title': 'I made a video to help explains trans people in hopes of getting people to understand', 'created': 1517653314.0}"
2018-02-03 07:56:21,7uy3lo,0,0,[removed],trans,Straight Male first experience,1517669781.0,"{'created_utc': 1517644581, 'id': '7uy3lo', 'num_comments': 0, 'score': 0, 'selftext': '[removed]', 'subreddit': 'trans', 'title': 'Straight Male first experience', 'created': 1517669781.0}"
2018-02-03 08:33:10,7uy8bg,18,49,"For full context, I came out this week. You can read the details of how it went here: [Link](https://www.reddit.com/r/relationships/comments/7up1en/update_i_25_mtf_am_coming_out_to_my_conservative/)

I have been kicked out of my parents' lives. I came home today after spending some time out, and after about two hours of me being home, I hear them talking about me in very disrespectful, insulting, and offensive ways, even insofar as the transness is concerned. I tried to drown it out for about an hour, but they kept going. So I walked out and said ""I can hear you,"" to which my dad said, ""Yeah, I know."" So I decided to leave. As I was going, my dad said, ""If you leave you are the biggest pussy and a coward, and you need to toughen the fuck up."" To which I said, ""Well, at least I had the balls to tell you to your face."" and as I was leaving he acted offended and said if I kept walking it would be a huge mistake, and when I did just that, he told me never to come back.


I was fine with being patient and giving them time to understand the ins and outs of everything, but I wasn't going to sit their in such a toxic environment when I already have enough shit on my plate as it is.",trans,I have been removed from my parents' lives,1517671990.0,"{'created_utc': 1517646790, 'id': '7uy8bg', 'num_comments': 18, 'score': 49, 'selftext': 'For full context, I came out this week. You can read the details of how it went here: [Link](https://www.reddit.com/r/relationships/comments/7up1en/update_i_25_mtf_am_coming_out_to_my_conservative/)\n\nI have been kicked out of my parents\' lives. I came home today after spending some time out, and after about two hours of me being home, I hear them talking about me in very disrespectful, insulting, and offensive ways, even insofar as the transness is concerned. I tried to drown it out for about an hour, but they kept going. So I walked out and said ""I can hear you,"" to which my dad said, ""Yeah, I know."" So I decided to leave. As I was going, my dad said, ""If you leave you are the biggest pussy and a coward, and you need to toughen the fuck up."" To which I said, ""Well, at least I had the balls to tell you to your face."" and as I was leaving he acted offended and said if I kept walking it would be a huge mistake, and when I did just that, he told me never to come back.\n\n\nI was fine with being patient and giving them time to understand the ins and outs of everything, but I wasn\'t going to sit their in such a toxic environment when I already have enough shit on my plate as it is.', 'subreddit': 'trans', 'title': ""I have been removed from my parents' lives"", 'created': 1517671990.0}"
2018-02-03 11:31:25,7uytzk,4,0,[removed],trans,I identify as big white pillow. Ask me anything.,1517682685.0,"{'created_utc': 1517657485, 'id': '7uytzk', 'num_comments': 4, 'score': 0, 'selftext': '[removed]', 'subreddit': 'trans', 'title': 'I identify as big white pillow. Ask me anything.', 'created': 1517682685.0}"
2018-02-03 16:58:29,7v0h29,0,2,"My Fiance and I are both Transmasculine and we wanted to talk about whether or not transition is a choice. Let us know what you think! 

https://youtu.be/7GCSUsa38uM",trans,Transition a Choice?,1517702309.0,"{'created_utc': 1517677109, 'id': '7v0h29', 'num_comments': 0, 'score': 2, 'selftext': 'My Fiance and I are both Transmasculine and we wanted to talk about whether or not transition is a choice. Let us know what you think! \n\nhttps://youtu.be/7GCSUsa38uM', 'subreddit': 'trans', 'title': 'Transition a Choice?', 'created': 1517702309.0}"
2018-02-04 01:48:17,7v3su3,7,12,"My little brother, whos 8 and has been saying hes a girl since he was about 5 confuses me... i just wanted to ask the people of reddit if it seems possible to you to have a kid who hasnt even hit puberty yet to be able to change his gender. Its not like im against lgbt or anything, seeing as how im bi but i just dont understand how when i was a kid i was playing with legos while when he is a kid hes discovering his gender...",trans,Im confused about my sibling,1517734097.0,"{'created_utc': 1517708897, 'id': '7v3su3', 'num_comments': 7, 'score': 12, 'selftext': 'My little brother, whos 8 and has been saying hes a girl since he was about 5 confuses me... i just wanted to ask the people of reddit if it seems possible to you to have a kid who hasnt even hit puberty yet to be able to change his gender. Its not like im against lgbt or anything, seeing as how im bi but i just dont understand how when i was a kid i was playing with legos while when he is a kid hes discovering his gender...', 'subreddit': 'trans', 'title': 'Im confused about my sibling', 'created': 1517734097.0}"
2018-02-04 03:33:05,7v4cwk,3,71,,trans,14.5 months hrt,1517740385.0,"{'created_utc': 1517715185, 'id': '7v4cwk', 'num_comments': 3, 'score': 71, 'selftext': '', 'subreddit': 'trans', 'title': '14.5 months hrt', 'created': 1517740385.0}"
2018-02-04 03:38:10,7v4duv,15,3,"I have recently reconnected with one of my old high school friends. He called me and said that he'd like to go out for old time sake and shoot some pool. I have not seen him in over 4 years. We used to be real close, but time and distance systematically ended that. We were to meet at a bar we used to go to together and (try) to pick up girls! I go there on time and waited and waited and waited, but he never showed. Two days later he called me and asked why I did not come over to at leas say hello. I told him I was there and he was not. His voice changed and sounded so much like a girl I thought he handed the phone off to some one else... noooo it was him, I mean her. He transitioned, he is MTF?!?!?!! He was a great looking guy and I could not imagine him as a woman. We finally met at the bar and he, I mean she came right up to me and said hello! I stood there in shock... he, damn it I mean she is beautiful!!! Ronny is now Ronnie. We talked and talked and got drunk. Never played pool. We sat in my car (same one we used to sit in while we were in high school lol) and continued to talk. Well Let me cut to the chase... we ended up back at my apartment and then slept together. I am freaking the f#uck out. Ronnie is calling and texting me and I don't know what to do. I can't seem to come to terms with having sex with my old/new best friend. She is just as amazing as she was back in college, just in a whole different way? I guess? What the hell is wrong with me? We were the best of friends. I can't imagine facing her, I feel so awkward. I don't know what to do???? I am bisexual and have had relationships with both men and woman, but this is so confusing to me. Sorry for the book, but I have to address this and I simply don't know how. I think about her all the time... she knows me inside and out, but I feel like she is a stranger now... Or is me that is simply being strange??? ",trans,Really confused,1517740690.0,"{'created_utc': 1517715490, 'id': '7v4duv', 'num_comments': 15, 'score': 3, 'selftext': ""I have recently reconnected with one of my old high school friends. He called me and said that he'd like to go out for old time sake and shoot some pool. I have not seen him in over 4 years. We used to be real close, but time and distance systematically ended that. We were to meet at a bar we used to go to together and (try) to pick up girls! I go there on time and waited and waited and waited, but he never showed. Two days later he called me and asked why I did not come over to at leas say hello. I told him I was there and he was not. His voice changed and sounded so much like a girl I thought he handed the phone off to some one else... noooo it was him, I mean her. He transitioned, he is MTF?!?!?!! He was a great looking guy and I could not imagine him as a woman. We finally met at the bar and he, I mean she came right up to me and said hello! I stood there in shock... he, damn it I mean she is beautiful!!! Ronny is now Ronnie. We talked and talked and got drunk. Never played pool. We sat in my car (same one we used to sit in while we were in high school lol) and continued to talk. Well Let me cut to the chase... we ended up back at my apartment and then slept together. I am freaking the f#uck out. Ronnie is calling and texting me and I don't know what to do. I can't seem to come to terms with having sex with my old/new best friend. She is just as amazing as she was back in college, just in a whole different way? I guess? What the hell is wrong with me? We were the best of friends. I can't imagine facing her, I feel so awkward. I don't know what to do???? I am bisexual and have had relationships with both men and woman, but this is so confusing to me. Sorry for the book, but I have to address this and I simply don't know how. I think about her all the time... she knows me inside and out, but I feel like she is a stranger now... Or is me that is simply being strange??? "", 'subreddit': 'trans', 'title': 'Really confused', 'created': 1517740690.0}"
2018-02-04 03:50:00,7v4g1b,1,2,,trans,Trans BRASILIAN. SP,1517741400.0,"{'created_utc': 1517716200, 'id': '7v4g1b', 'num_comments': 1, 'score': 2, 'selftext': '', 'subreddit': 'trans', 'title': 'Trans BRASILIAN. SP', 'created': 1517741400.0}"
2018-02-04 15:21:31,7v79tp,0,2,,trans,"For peeps that are interested, this video covers cheap breast forms for around £20 or less...",1517782891.0,"{'created_utc': 1517757691, 'id': '7v79tp', 'num_comments': 0, 'score': 2, 'selftext': '', 'subreddit': 'trans', 'title': 'For peeps that are interested, this video covers cheap breast forms for around £20 or less...', 'created': 1517782891.0}"
2018-02-04 17:21:26,7v80tt,1,61,,trans,First event 2018 with my parents,1517790086.0,"{'created_utc': 1517764886, 'id': '7v80tt', 'num_comments': 1, 'score': 61, 'selftext': '', 'subreddit': 'trans', 'title': 'First event 2018 with my parents', 'created': 1517790086.0}"
2018-02-04 21:11:08,7v9mnk,34,34,,trans,Why couldn't it be this simple to resolve the bathroom issue...,1517803868.0,"{'created_utc': 1517778668, 'id': '7v9mnk', 'num_comments': 34, 'score': 34, 'selftext': '', 'subreddit': 'trans', 'title': ""Why couldn't it be this simple to resolve the bathroom issue..."", 'created': 1517803868.0}"
2018-02-05 01:15:19,7vb6lt,6,2,"This is a question for the trans women who are from NYC. How have your experiences been living there being trans? Do you face a lot of discrimination, assault, or fear for your life or is it a bit more safer in the big apple for trans women?",trans,Being A Trans Woman in New York?,1517818519.0,"{'created_utc': 1517793319, 'id': '7vb6lt', 'num_comments': 6, 'score': 2, 'selftext': 'This is a question for the trans women who are from NYC. How have your experiences been living there being trans? Do you face a lot of discrimination, assault, or fear for your life or is it a bit more safer in the big apple for trans women?', 'subreddit': 'trans', 'title': 'Being A Trans Woman in New York?', 'created': 1517818519.0}"
