created_utc,id,num_comments,score,selftext,subreddit,title,created,d_
2018-02-14 05:16:09,7xfri8,0,1,[deleted],trans,"A close shave with reality... razors are for legs, not scalps",1518610569.0,"{'created_utc': 1518585369, 'id': '7xfri8', 'num_comments': 0, 'score': 1, 'selftext': '[deleted]', 'subreddit': 'trans', 'title': 'A close shave with reality... razors are for legs, not scalps', 'created': 1518610569.0}"
2018-02-14 07:10:24,7xgb34,2,7,"How would I go about doing it? I realized at some point I need to, but I don't really know how to go about doing it.
I've been meaning to for months, but can't figure out a good way of doing it.. Any ideas? 
Here's a picture of me --- https://imgur.com/ewJNiTA",trans,Coming out as a trans streamer/video maker,1518617424.0,"{'created_utc': 1518592224, 'id': '7xgb34', 'num_comments': 2, 'score': 7, 'selftext': ""How would I go about doing it? I realized at some point I need to, but I don't really know how to go about doing it.\nI've been meaning to for months, but can't figure out a good way of doing it.. Any ideas? \nHere's a picture of me --- https://imgur.com/ewJNiTA"", 'subreddit': 'trans', 'title': 'Coming out as a trans streamer/video maker', 'created': 1518617424.0}"
2018-02-14 16:44:31,7xjc18,32,33,"I am lucky to not feel like I'm in the wrong body, I'm comfortable in my own skin and don't hate to see myself in the mirror. When I look at my reflection- it is a reflection of me. The problem is I really don't enjoy being female.

I have always been a tomboy, never wanted to do anything that's particularly girly except maybe going through a phase of loving horses. I loved the outdoors, sports and video games, growing up I was simply a girl that liked to do things that boys typically do- which is completely normal. 

My parents might have been a little reserved but they never forced me to be something I'm not if it made me unhappy. They let me quit ballet when I used to cry about doing it every day and even let me join a mixed football team instead so long as I was doing something active they were fine with it. They cheered me on at sports and bought me football shirts and videogames for my birthday.  

It wasn't until I was older that I realized my gender was starting to hold me back from doing the things I loved. My best friends who I played football went on to play for their school and I couldn't go with them. The school didn't have a girls football team. (Football meaning soccer- I'm from Europe.) I played field hockey instead and got pretty good at it even though I didn't enjoy is so much. 

People were always surprised when I got A's in Chemistry and Math- asking me if I was sure I wanted to take such 'hard' subjects. They commented that as a girl I should really have neater writing. Even now in university people are asking me if Computer Science is what I want to pursue. I hate that I'm not as strong as a man so I can't perform sports as well/have to train 5 times as hard to get to the same level. I really hate that people see me as someone who has to have a child at some point. Getting pregnant terrifies me I don't want to give up my career or hobbies and then have to look after a kid full time stuck at home. Because of that I'm not sure I even want a kid.

I don't like that I'm sometimes afraid to speak my mind or crack a joke as people don't seem to respond to it as well if it comes from a female. I hate that when physical shit needs to be done like hauling boats up a beach or unpacking a van well natured family and friends tell me to stand back while they do the heavy lifting (often for objects that aren't even heavy) I'm kind of fed up of being the weaker sex. I don't feel then need for surgery but given the chose to be born again male I'd chose that life in a heartbeat. ",trans,Not trans but really dislike being a girl.,1518651871.0,"{'created_utc': 1518626671, 'id': '7xjc18', 'num_comments': 32, 'score': 33, 'selftext': ""I am lucky to not feel like I'm in the wrong body, I'm comfortable in my own skin and don't hate to see myself in the mirror. When I look at my reflection- it is a reflection of me. The problem is I really don't enjoy being female.\n\nI have always been a tomboy, never wanted to do anything that's particularly girly except maybe going through a phase of loving horses. I loved the outdoors, sports and video games, growing up I was simply a girl that liked to do things that boys typically do- which is completely normal. \n\nMy parents might have been a little reserved but they never forced me to be something I'm not if it made me unhappy. They let me quit ballet when I used to cry about doing it every day and even let me join a mixed football team instead so long as I was doing something active they were fine with it. They cheered me on at sports and bought me football shirts and videogames for my birthday.  \n\nIt wasn't until I was older that I realized my gender was starting to hold me back from doing the things I loved. My best friends who I played football went on to play for their school and I couldn't go with them. The school didn't have a girls football team. (Football meaning soccer- I'm from Europe.) I played field hockey instead and got pretty good at it even though I didn't enjoy is so much. \n\nPeople were always surprised when I got A's in Chemistry and Math- asking me if I was sure I wanted to take such 'hard' subjects. They commented that as a girl I should really have neater writing. Even now in university people are asking me if Computer Science is what I want to pursue. I hate that I'm not as strong as a man so I can't perform sports as well/have to train 5 times as hard to get to the same level. I really hate that people see me as someone who has to have a child at some point. Getting pregnant terrifies me I don't want to give up my career or hobbies and then have to look after a kid full time stuck at home. Because of that I'm not sure I even want a kid.\n\nI don't like that I'm sometimes afraid to speak my mind or crack a joke as people don't seem to respond to it as well if it comes from a female. I hate that when physical shit needs to be done like hauling boats up a beach or unpacking a van well natured family and friends tell me to stand back while they do the heavy lifting (often for objects that aren't even heavy) I'm kind of fed up of being the weaker sex. I don't feel then need for surgery but given the chose to be born again male I'd chose that life in a heartbeat. "", 'subreddit': 'trans', 'title': 'Not trans but really dislike being a girl.', 'created': 1518651871.0}"
2018-02-14 17:46:49,7xjt67,2,5,,trans,Gender Nihilism: thoughts?,1518655609.0,"{'created_utc': 1518630409, 'id': '7xjt67', 'num_comments': 2, 'score': 5, 'selftext': '', 'subreddit': 'trans', 'title': 'Gender Nihilism: thoughts?', 'created': 1518655609.0}"
2018-02-14 22:37:04,7xlz2q,0,2,,trans,Dealing with gender dysthoria,1518673024.0,"{'created_utc': 1518647824, 'id': '7xlz2q', 'num_comments': 0, 'score': 2, 'selftext': '', 'subreddit': 'trans', 'title': 'Dealing with gender dysthoria', 'created': 1518673024.0}"
2018-02-15 03:29:37,7xnqlj,3,3,"Ever since I was a kid I always felt like I'd fit in better as a boy but of course without knowing as a child that this may be me figuring out that I'm trans.. Here I am at 29 still wondering. 

As an adult I've still wondered what I'd look like as a male, if I'd be happier, if that's who I truly am meant to be. I've also always had this penis envy, however I've identified as a lesbian since I was a young teen, so idk if that's me wishing I had different genitalia to be more ""as one"" with my partner sexually or if I truly am trans. 

I enjoy watching heterosexual porn in the way that I enjoy watching the male role in the scenes and am of course turned on by the whole male on female idea, but I do not wish to have any sexual encounter with a male. 

I don't know what to think, I'm just so lost in this gray area of trying to figure out who I am. Any advice, incite, sharing comparable experiences, etc.. All would be of great appreciation. ",trans,I feel stuck... Please give me incite,1518690577.0,"{'created_utc': 1518665377, 'id': '7xnqlj', 'num_comments': 3, 'score': 3, 'selftext': 'Ever since I was a kid I always felt like I\'d fit in better as a boy but of course without knowing as a child that this may be me figuring out that I\'m trans.. Here I am at 29 still wondering. \n\nAs an adult I\'ve still wondered what I\'d look like as a male, if I\'d be happier, if that\'s who I truly am meant to be. I\'ve also always had this penis envy, however I\'ve identified as a lesbian since I was a young teen, so idk if that\'s me wishing I had different genitalia to be more ""as one"" with my partner sexually or if I truly am trans. \n\nI enjoy watching heterosexual porn in the way that I enjoy watching the male role in the scenes and am of course turned on by the whole male on female idea, but I do not wish to have any sexual encounter with a male. \n\nI don\'t know what to think, I\'m just so lost in this gray area of trying to figure out who I am. Any advice, incite, sharing comparable experiences, etc.. All would be of great appreciation. ', 'subreddit': 'trans', 'title': 'I feel stuck... Please give me incite', 'created': 1518690577.0}"
2018-02-15 03:33:13,7xnrbn,8,42,,trans,"Let's agree, thigh highs and suspenders are some of the best inventions.",1518690793.0,"{'created_utc': 1518665593, 'id': '7xnrbn', 'num_comments': 8, 'score': 42, 'selftext': '', 'subreddit': 'trans', 'title': ""Let's agree, thigh highs and suspenders are some of the best inventions."", 'created': 1518690793.0}"
2018-02-15 11:01:15,7xpncw,8,27,,trans,Five Reasons Why I WOULD Date A Transgender Woman,1518717675.0,"{'created_utc': 1518692475, 'id': '7xpncw', 'num_comments': 8, 'score': 27, 'selftext': '', 'subreddit': 'trans', 'title': 'Five Reasons Why I WOULD Date A Transgender Woman', 'created': 1518717675.0}"
2018-02-15 17:36:14,7xrzsw,12,5,"First, I'm sorry if I sound ignorant.

Anyways. I've heard stories about men who say they didn't know their partner was transgender (no surgery). Is that really possible?",trans,Question for trans women,1518741374.0,"{'created_utc': 1518716174, 'id': '7xrzsw', 'num_comments': 12, 'score': 5, 'selftext': ""First, I'm sorry if I sound ignorant.\n\nAnyways. I've heard stories about men who say they didn't know their partner was transgender (no surgery). Is that really possible?"", 'subreddit': 'trans', 'title': 'Question for trans women', 'created': 1518741374.0}"
2018-02-15 17:36:55,7xs00p,2,26,"The Scottish Government is currently consulting on proposed changes to Gender Recognition.

The main points are:

* **Self declaration**  
Let trans people get official recognition of their gender without the current requirement of a psychiatric report.
* **16-17 year olds**  
Let trans people apply for gender recognition from 16, the age at which young people in Scotland are deemed to have full legal capacity.
* **Non-binary**  
Let non-binary people have their gender fully legally recognised through self-declaration.

This consultation is **vital** and closes on the 1 March at 17:00 (GMT). If the Scottish Gov gets more negative responses than positive ones it will be extremely difficult for them to justify updating legal gender recognition. If the number of negative responses is large then the rights of trans people are at risk of being rolled back, not only in Scotland but also in the whole of the UK.

**Most unfortunately, the media has been particularly hostile about trans equality in recent weeks and so there is a REAL RISK that this negative media coverage will encourage a larger number of negative responses. So now more than ever we need people to respond to the consultation!**

Please take 10 min to complete a positive response. You can find a guide and link to the consultation at

**http://equalrecognition.scot/consultation/**

Not all the questions need to be answered. Even saying something simple like “I support trans rights” already helps. They do ask for a name and e-mail address but these can be kept confidential.

Responses from outside of Scotland/UK are also welcome - a lot of the negative responses come from transphobes around the world.",trans,Scottish trans people need your help! | Government Consultation on Equal Recognition (Open to ALL),1518741415.0,"{'created_utc': 1518716215, 'id': '7xs00p', 'num_comments': 2, 'score': 26, 'selftext': 'The Scottish Government is currently consulting on proposed changes to Gender Recognition.\n\nThe main points are:\n\n* **Self declaration**  \nLet trans people get official recognition of their gender without the current requirement of a psychiatric report.\n* **16-17 year olds**  \nLet trans people apply for gender recognition from 16, the age at which young people in Scotland are deemed to have full legal capacity.\n* **Non-binary**  \nLet non-binary people have their gender fully legally recognised through self-declaration.\n\nThis consultation is **vital** and closes on the 1 March at 17:00 (GMT). If the Scottish Gov gets more negative responses than positive ones it will be extremely difficult for them to justify updating legal gender recognition. If the number of negative responses is large then the rights of trans people are at risk of being rolled back, not only in Scotland but also in the whole of the UK.\n\n**Most unfortunately, the media has been particularly hostile about trans equality in recent weeks and so there is a REAL RISK that this negative media coverage will encourage a larger number of negative responses. So now more than ever we need people to respond to the consultation!**\n\nPlease take 10 min to complete a positive response. You can find a guide and link to the consultation at\n\n**http://equalrecognition.scot/consultation/**\n\nNot all the questions need to be answered. Even saying something simple like “I support trans rights” already helps. They do ask for a name and e-mail address but these can be kept confidential.\n\nResponses from outside of Scotland/UK are also welcome - a lot of the negative responses come from transphobes around the world.', 'subreddit': 'trans', 'title': 'Scottish trans people need your help! | Government Consultation on Equal Recognition (Open to ALL)', 'created': 1518741415.0}"
2018-02-16 02:24:37,7xvn9l,1,49,,trans,uggh can't believe i'm wearing red,1518773077.0,"{'created_utc': 1518747877, 'id': '7xvn9l', 'num_comments': 1, 'score': 49, 'selftext': '', 'subreddit': 'trans', 'title': ""uggh can't believe i'm wearing red"", 'created': 1518773077.0}"
2018-02-16 03:06:19,7xvvv6,3,4,"I hate asking people for help, I hate being the center of attention. Buuuuuut. Being not out to anyone means the internet is my only avenue for assistance. I’m about 6 weeks into my trans journey and in some ways I’ve been rocketing down this life-road with the gas pedal glued firmly to the floor, I am not exaggerating to say that reading about trans things has consumed 90% of my free time in the last month and a half. Yet, so much I don’t know, and in other ways i’m still recently hatched. But my current conundrum or block to progress is this:

1) I know I want to be a woman.

2) I don’t think I am a woman.

3) I don’t know if I can become a woman.

I can still call myself trans because that first one is very strong. I want to be a woman badly. In my life I have very rarely cared deeply about anything or desired/wanted things, physical or otherwise. But even in my more despairing moments if I ask myself if I still want this, the answer is always a strong yes. This answer is also why I think i’m mtf and not nb

The second point is mostly where I want opinions. As strongly as I want to be a woman, I don’t feel like I am or have ever been a woman deep inside. To be fair, i don’t particularly feel like man either and I’m still kinda resentful of masculinity as a general concept.

So my main question is for those of you who have been on this path longer than I have, how much does #2 change over time? Do you start to feel more and more like you are your gender? It seems like most people started by saying “I am &lt;gender&gt;” (#2) and then had to struggle to accept “I want to be &lt;gender&gt;” (#1) for themselves, and i’m just backwards. But this might just be the standard narrative and it’s not actually how most people experience their gender transition. I don’t know.

And #3 is mostly that when I do fem things like lipstick or clothing, it doesn’t make me feel like more of a lady. It doesn’t help #2. I do sometimes get strong emotional reactions to a bra or a dress, so something’s certainly happening deep in the back of my skull, but it's mostly crying and frustration and not affirming feelings.

So, dear internet, on the scale of one cat to all the cats. Please tell me if this is reasonably typical.

**EDIT:**
OK. I was apparently just Googling things in the wrong way, and I found some posts talking about exactly this 'want vs am' problem, and they're also saying that this is super common...

I don't want do delete this post, but [see the comments here](https://www.reddit.com/r/asktransgender/comments/715e15/mtf_i_dont_feel_like_a_woman_but_rather_that_i/)",trans,The 'want' vs 'am' vs 'can be' problem,1518775579.0,"{'created_utc': 1518750379, 'id': '7xvvv6', 'num_comments': 3, 'score': 4, 'selftext': ""I hate asking people for help, I hate being the center of attention. Buuuuuut. Being not out to anyone means the internet is my only avenue for assistance. I’m about 6 weeks into my trans journey and in some ways I’ve been rocketing down this life-road with the gas pedal glued firmly to the floor, I am not exaggerating to say that reading about trans things has consumed 90% of my free time in the last month and a half. Yet, so much I don’t know, and in other ways i’m still recently hatched. But my current conundrum or block to progress is this:\n\n1) I know I want to be a woman.\n\n2) I don’t think I am a woman.\n\n3) I don’t know if I can become a woman.\n\nI can still call myself trans because that first one is very strong. I want to be a woman badly. In my life I have very rarely cared deeply about anything or desired/wanted things, physical or otherwise. But even in my more despairing moments if I ask myself if I still want this, the answer is always a strong yes. This answer is also why I think i’m mtf and not nb\n\nThe second point is mostly where I want opinions. As strongly as I want to be a woman, I don’t feel like I am or have ever been a woman deep inside. To be fair, i don’t particularly feel like man either and I’m still kinda resentful of masculinity as a general concept.\n\nSo my main question is for those of you who have been on this path longer than I have, how much does #2 change over time? Do you start to feel more and more like you are your gender? It seems like most people started by saying “I am &lt;gender&gt;” (#2) and then had to struggle to accept “I want to be &lt;gender&gt;” (#1) for themselves, and i’m just backwards. But this might just be the standard narrative and it’s not actually how most people experience their gender transition. I don’t know.\n\nAnd #3 is mostly that when I do fem things like lipstick or clothing, it doesn’t make me feel like more of a lady. It doesn’t help #2. I do sometimes get strong emotional reactions to a bra or a dress, so something’s certainly happening deep in the back of my skull, but it's mostly crying and frustration and not affirming feelings.\n\nSo, dear internet, on the scale of one cat to all the cats. Please tell me if this is reasonably typical.\n\n**EDIT:**\nOK. I was apparently just Googling things in the wrong way, and I found some posts talking about exactly this 'want vs am' problem, and they're also saying that this is super common...\n\nI don't want do delete this post, but [see the comments here](https://www.reddit.com/r/asktransgender/comments/715e15/mtf_i_dont_feel_like_a_woman_but_rather_that_i/)"", 'subreddit': 'trans', 'title': ""The 'want' vs 'am' vs 'can be' problem"", 'created': 1518775579.0}"
2018-02-16 07:25:27,7xx67o,1,0,[removed],trans,"Important question: once and for all, are traps gay?",1518791127.0,"{'created_utc': 1518765927, 'id': '7xx67o', 'num_comments': 1, 'score': 0, 'selftext': '[removed]', 'subreddit': 'trans', 'title': 'Important question: once and for all, are traps gay?', 'created': 1518791127.0}"
2018-02-16 15:05:34,7xzajc,13,1,"Soooo to try and make this short. Im definantly trans. I want to be a woman, but my wife would hate it and the army guard units in my state are not keen to trans people. When I talk about wanting to grow my hair out and stuff my family would mention about how I could pass as a girl(which didn't help) honestly it made me feel really good but also guilty. I also have a shot at becoming a green beret which I would have to give up on (and that is my dream job). I think its a mental disorder, but I definantly have it.

I have a lot to lose if I try and transition, should I just try and fight it my whole life or throw everything away? Im really struggling and would appreciate some solid advice. ",trans,Forever in the closet.,1518818734.0,"{'created_utc': 1518793534, 'id': '7xzajc', 'num_comments': 13, 'score': 1, 'selftext': ""Soooo to try and make this short. Im definantly trans. I want to be a woman, but my wife would hate it and the army guard units in my state are not keen to trans people. When I talk about wanting to grow my hair out and stuff my family would mention about how I could pass as a girl(which didn't help) honestly it made me feel really good but also guilty. I also have a shot at becoming a green beret which I would have to give up on (and that is my dream job). I think its a mental disorder, but I definantly have it.\n\nI have a lot to lose if I try and transition, should I just try and fight it my whole life or throw everything away? Im really struggling and would appreciate some solid advice. "", 'subreddit': 'trans', 'title': 'Forever in the closet.', 'created': 1518818734.0}"
2018-02-16 18:00:20,7y0khr,14,20,I may get a salt lick.,trans,"""So, how do I know I'm having a sodium craving? I mean, I've never craved salt before, what will it be-- OH MY GOD, THESE OLIVES ARE AMAZING!""",1518829220.0,"{'created_utc': 1518804020, 'id': '7y0khr', 'num_comments': 14, 'score': 20, 'selftext': 'I may get a salt lick.', 'subreddit': 'trans', 'title': '""So, how do I know I\'m having a sodium craving? I mean, I\'ve never craved salt before, what will it be-- OH MY GOD, THESE OLIVES ARE AMAZING!""', 'created': 1518829220.0}"
2018-02-16 20:36:14,7y1ptj,10,103,,trans,TIL the composer who did The Shining and A Clockwork Orange was a trans woman,1518838574.0,"{'created_utc': 1518813374, 'id': '7y1ptj', 'num_comments': 10, 'score': 103, 'selftext': '', 'subreddit': 'trans', 'title': 'TIL the composer who did The Shining and A Clockwork Orange was a trans woman', 'created': 1518838574.0}"
2018-02-17 04:44:39,7y4m8e,15,133,,trans,"Just wanted to share my first birthday as a girl with y'all, thanks for being y'all and being awesome!",1518867879.0,"{'created_utc': 1518842679, 'id': '7y4m8e', 'num_comments': 15, 'score': 133, 'selftext': '', 'subreddit': 'trans', 'title': ""Just wanted to share my first birthday as a girl with y'all, thanks for being y'all and being awesome!"", 'created': 1518867879.0}"
2018-02-17 07:37:45,7y5cgg,2,1,"So I was estrogen and spiro for about six months and then I just sorta stopped for the better part of a month. I recently started again and was wondering what kind of effect that would have on my progress. 
Anything anyone could tell me would help ",trans,Hormone Help,1518878265.0,"{'created_utc': 1518853065, 'id': '7y5cgg', 'num_comments': 2, 'score': 1, 'selftext': 'So I was estrogen and spiro for about six months and then I just sorta stopped for the better part of a month. I recently started again and was wondering what kind of effect that would have on my progress. \nAnything anyone could tell me would help ', 'subreddit': 'trans', 'title': 'Hormone Help', 'created': 1518878265.0}"
2018-02-17 07:57:18,7y5ez1,0,2,[deleted],trans,I need to know where u/thelandofmagic is ASAP,1518879438.0,"{'created_utc': 1518854238, 'id': '7y5ez1', 'num_comments': 0, 'score': 2, 'selftext': '[deleted]', 'subreddit': 'trans', 'title': 'I need to know where u/thelandofmagic is ASAP', 'created': 1518879438.0}"
2018-02-17 08:36:15,7y5k8b,0,2,I known for a while that I’m a girl in the brain but I’ve never told anyone right now everyone thinks I’m gay idk what to do or how to think about it I’d love to chat with anyone who feels like it ,trans,Any advice,1518881775.0,"{'created_utc': 1518856575, 'id': '7y5k8b', 'num_comments': 0, 'score': 2, 'selftext': 'I known for a while that I’m a girl in the brain but I’ve never told anyone right now everyone thinks I’m gay idk what to do or how to think about it I’d love to chat with anyone who feels like it ', 'subreddit': 'trans', 'title': 'Any advice', 'created': 1518881775.0}"
2018-02-17 23:04:28,7ya7qh,3,53,,trans,Gota stop using filters but felt cute 🙈,1518933868.0,"{'created_utc': 1518908668, 'id': '7ya7qh', 'num_comments': 3, 'score': 53, 'selftext': '', 'subreddit': 'trans', 'title': 'Gota stop using filters but felt cute 🙈', 'created': 1518933868.0}"
