created_utc,id,num_comments,score,selftext,subreddit,title,created,d_
2018-02-09 07:46:38,7wby64,16,13,"hello all, i found out one of my best friends is trans (mtf) about 6 months ago. it was a huge shock, he was never feminine in the slightest. i will keep referring to him as he because he has not switched pronouns yet. anyway, he's super depressed. he's on hormones and has experimented with wigs and makeup with my help but doesn't have the confidence to go out in public that way. he's constantly caught between wanting to express himself and wanting to fit in, and at this early stage in his transition having both is pretty impossible.

at first he was so happy that people were accepting him (no family support, he hates his mother and doesn't want to tell her) but often he will message me late at night having an emotional breakdown about how none of this is fair and he just wants to be normal. how his life is meaningless. how no one cares even though i obviously do. although we live in a liberal college town, this is still the south. he is afraid for his safety.

i don't know what to do. i try my best to be there. he almost flunked out of college but the school is letting him try again after telling them about his dsyphoria. but he's still skipping class. i told him that staying at home all day will only make him feel worse and that he needs to find something to focus on. i told him that he needs to be brave. but who am i to say that? i will never imagine what he is going through.

any advice is greatly appreciated. ",trans,How can I best support my trans friend?,1518187598.0,"{'created_utc': 1518162398, 'id': '7wby64', 'num_comments': 16, 'score': 13, 'selftext': ""hello all, i found out one of my best friends is trans (mtf) about 6 months ago. it was a huge shock, he was never feminine in the slightest. i will keep referring to him as he because he has not switched pronouns yet. anyway, he's super depressed. he's on hormones and has experimented with wigs and makeup with my help but doesn't have the confidence to go out in public that way. he's constantly caught between wanting to express himself and wanting to fit in, and at this early stage in his transition having both is pretty impossible.\n\nat first he was so happy that people were accepting him (no family support, he hates his mother and doesn't want to tell her) but often he will message me late at night having an emotional breakdown about how none of this is fair and he just wants to be normal. how his life is meaningless. how no one cares even though i obviously do. although we live in a liberal college town, this is still the south. he is afraid for his safety.\n\ni don't know what to do. i try my best to be there. he almost flunked out of college but the school is letting him try again after telling them about his dsyphoria. but he's still skipping class. i told him that staying at home all day will only make him feel worse and that he needs to find something to focus on. i told him that he needs to be brave. but who am i to say that? i will never imagine what he is going through.\n\nany advice is greatly appreciated. "", 'subreddit': 'trans', 'title': 'How can I best support my trans friend?', 'created': 1518187598.0}"
2018-02-09 17:15:28,7wexlt,0,1,,trans,Psytrance 2018,1518221728.0,"{'created_utc': 1518196528, 'id': '7wexlt', 'num_comments': 0, 'score': 1, 'selftext': '', 'subreddit': 'trans', 'title': 'Psytrance 2018', 'created': 1518221728.0}"
2018-02-09 19:12:49,7wft2m,0,0,[removed],trans,Do trans people deserve rights?,1518228769.0,"{'created_utc': 1518203569, 'id': '7wft2m', 'num_comments': 0, 'score': 0, 'selftext': '[removed]', 'subreddit': 'trans', 'title': 'Do trans people deserve rights?', 'created': 1518228769.0}"
2018-02-09 21:45:19,7wgw0q,0,3,,trans,"Trans icon Miss Peppermint (RPDR S9) shoots new music video ""Harlem Cleopatra"" w/gay rapper Cazwell",1518237919.0,"{'created_utc': 1518212719, 'id': '7wgw0q', 'num_comments': 0, 'score': 3, 'selftext': '', 'subreddit': 'trans', 'title': 'Trans icon Miss Peppermint (RPDR S9) shoots new music video ""Harlem Cleopatra"" w/gay rapper Cazwell', 'created': 1518237919.0}"
2018-02-10 05:04:32,7wjhey,7,17,"Before starting HRT my hairline had an M shape although the middle part was more rounded if that naves sense. I didn’t not suffer any hair loss and my hair was and still is extremely thick. I recently noticed that I have a bunch of hair at varying lengths starting to cover up the little v corners on each side of my head. I’m excited to finally try some high pony tails without worrying about my masculine hairline. My hair overall is getting thicker and I notice a bunch of pointy flyaways on top of my head, not that I really need it but I guess I cannot complain. I’m also shedding much less, which is great. I have already started breaking regular hair ties! ",trans,My Hairline is Finally Changing!,1518264272.0,"{'created_utc': 1518239072, 'id': '7wjhey', 'num_comments': 7, 'score': 17, 'selftext': 'Before starting HRT my hairline had an M shape although the middle part was more rounded if that naves sense. I didn’t not suffer any hair loss and my hair was and still is extremely thick. I recently noticed that I have a bunch of hair at varying lengths starting to cover up the little v corners on each side of my head. I’m excited to finally try some high pony tails without worrying about my masculine hairline. My hair overall is getting thicker and I notice a bunch of pointy flyaways on top of my head, not that I really need it but I guess I cannot complain. I’m also shedding much less, which is great. I have already started breaking regular hair ties! ', 'subreddit': 'trans', 'title': 'My Hairline is Finally Changing!', 'created': 1518264272.0}"
2018-02-10 06:32:48,7wjvs9,9,16,"Hi lovelies,

So as of recent I am flooded with the excitement of freedom from male aggression and the instantaneous organic flood of desire to foster organic, innocent, precious  youth. Knowing I will never be able to nurture such cuteness and potential  for my own like a cis gal I still am enamored with the concept of spoiling a cute, young innocence instead like a dog or cat. Have any of you had the same experience? ( in short, any trans gals felt the longing for a floofy fur-baby to fill the void estrogen leaves us with?",trans,Mama bear needs cubs... baby fever,1518269568.0,"{'created_utc': 1518244368, 'id': '7wjvs9', 'num_comments': 9, 'score': 16, 'selftext': 'Hi lovelies,\n\nSo as of recent I am flooded with the excitement of freedom from male aggression and the instantaneous organic flood of desire to foster organic, innocent, precious  youth. Knowing I will never be able to nurture such cuteness and potential  for my own like a cis gal I still am enamored with the concept of spoiling a cute, young innocence instead like a dog or cat. Have any of you had the same experience? ( in short, any trans gals felt the longing for a floofy fur-baby to fill the void estrogen leaves us with?', 'subreddit': 'trans', 'title': 'Mama bear needs cubs... baby fever', 'created': 1518269568.0}"
2018-02-10 14:26:59,7wlpa3,10,10,"My friend is trans and also suffers from hair loss, leaving her without a full head of hair. This leaves her very insecure, and she doesnt have a lot of money to get a nice wig. I want to surprise her with one! Does anyone know anywhere I can order a good long lasting realistiv wig? I cant spend extreme amounts of money either, but looking for any tips if anyone could help. It would be really appeciated. :-)",trans,"Does anyone know about any good, not too expensive wigs?",1518298019.0,"{'created_utc': 1518272819, 'id': '7wlpa3', 'num_comments': 10, 'score': 10, 'selftext': 'My friend is trans and also suffers from hair loss, leaving her without a full head of hair. This leaves her very insecure, and she doesnt have a lot of money to get a nice wig. I want to surprise her with one! Does anyone know anywhere I can order a good long lasting realistiv wig? I cant spend extreme amounts of money either, but looking for any tips if anyone could help. It would be really appeciated. :-)', 'subreddit': 'trans', 'title': 'Does anyone know about any good, not too expensive wigs?', 'created': 1518298019.0}"
2018-02-10 21:10:58,7wo8x3,6,7,"How are you all resocializing? Any tips? 

https://youtu.be/u91wvpgo3eM",trans,Socializing with cis men?,1518322258.0,"{'created_utc': 1518297058, 'id': '7wo8x3', 'num_comments': 6, 'score': 7, 'selftext': 'How are you all resocializing? Any tips? \n\nhttps://youtu.be/u91wvpgo3eM', 'subreddit': 'trans', 'title': 'Socializing with cis men?', 'created': 1518322258.0}"
2018-02-11 00:38:09,7wpig2,5,14,"Wife's 92 year old dad is totally whatevs...

The extended family might be iffy...they're conservative Christians. 

Edit: And I really should be revising my assumptions...because I'm getting positive responses from them as well. ",trans,"Here we go, coming out to my wife's side of the family.",1518334689.0,"{'created_utc': 1518309489, 'id': '7wpig2', 'num_comments': 5, 'score': 14, 'selftext': ""Wife's 92 year old dad is totally whatevs...\n\nThe extended family might be iffy...they're conservative Christians. \n\nEdit: And I really should be revising my assumptions...because I'm getting positive responses from them as well. "", 'subreddit': 'trans', 'title': ""Here we go, coming out to my wife's side of the family."", 'created': 1518334689.0}"
2018-02-11 03:02:59,7wqb01,0,0,[deleted],trans,Wanna have a passionate heated debate?,1518343379.0,"{'created_utc': 1518318179, 'id': '7wqb01', 'num_comments': 0, 'score': 0, 'selftext': '[deleted]', 'subreddit': 'trans', 'title': 'Wanna have a passionate heated debate?', 'created': 1518343379.0}"
2018-02-11 03:13:34,7wqd3y,2,18,,trans,Support Beautiful Transgender Couple,1518344014.0,"{'created_utc': 1518318814, 'id': '7wqd3y', 'num_comments': 2, 'score': 18, 'selftext': '', 'subreddit': 'trans', 'title': 'Support Beautiful Transgender Couple', 'created': 1518344014.0}"
2018-02-11 04:50:40,7wqu9c,6,5,"The movie "" To Wong Foo Thanks For Everything""...I know the main theme is drag queens...just asking what your thoughts are if you have watched it. 
Background on why I am asking: I met Paige in treatment and I don't want to be that person that overally tries to connnect someones journey/life through a movie because I may not understand. Just asking for advice so I can be there dor her. ",trans,May I ask a question?,1518349840.0,"{'created_utc': 1518324640, 'id': '7wqu9c', 'num_comments': 6, 'score': 5, 'selftext': 'The movie "" To Wong Foo Thanks For Everything""...I know the main theme is drag queens...just asking what your thoughts are if you have watched it. \nBackground on why I am asking: I met Paige in treatment and I don\'t want to be that person that overally tries to connnect someones journey/life through a movie because I may not understand. Just asking for advice so I can be there dor her. ', 'subreddit': 'trans', 'title': 'May I ask a question?', 'created': 1518349840.0}"
2018-02-11 06:27:37,7wra4b,2,55,,trans,Saw this and thought of y'all. 'Where To Now' - ttttrent (xpost /r/designporn),1518355657.0,"{'created_utc': 1518330457, 'id': '7wra4b', 'num_comments': 2, 'score': 55, 'selftext': '', 'subreddit': 'trans', 'title': ""Saw this and thought of y'all. 'Where To Now' - ttttrent (xpost /r/designporn)"", 'created': 1518355657.0}"
2018-02-11 06:29:29,7wradp,2,1,Hey everybody we made a messager group and we wanted to know if anybody would like to join?,trans,Messager group,1518355769.0,"{'created_utc': 1518330569, 'id': '7wradp', 'num_comments': 2, 'score': 1, 'selftext': 'Hey everybody we made a messager group and we wanted to know if anybody would like to join?', 'subreddit': 'trans', 'title': 'Messager group', 'created': 1518355769.0}"
2018-02-11 07:12:36,7wrge9,0,2,,trans,Trans Woman Roasting/ telling jokes (very funny),1518358356.0,"{'created_utc': 1518333156, 'id': '7wrge9', 'num_comments': 0, 'score': 2, 'selftext': '', 'subreddit': 'trans', 'title': 'Trans Woman Roasting/ telling jokes (very funny)', 'created': 1518358356.0}"
2018-02-11 19:04:00,7wur3d,2,5,,trans,TS Madison (Trans Woman) Roasting the Kardashians,1518401040.0,"{'created_utc': 1518375840, 'id': '7wur3d', 'num_comments': 2, 'score': 5, 'selftext': '', 'subreddit': 'trans', 'title': 'TS Madison (Trans Woman) Roasting the Kardashians', 'created': 1518401040.0}"
2018-02-12 04:42:50,7wyct0,6,13,"Please excuse the format as I'm typing this from mobile :)

My little sister is almost 10 years old. I'd say from the time she was about 5 my family and I had noticed that she was more tom-boy than anything. This didn't come as a surprise, as most of the women in my family (including my mother and myself) were very tom-boyish growing up.

She prefers ""boy"" toys, like cars and nerf guns rather than ""girl"" toys like dolls and makeup. She doesn't like princesses much but really loves spiderman and lots of ""boyish"" things. 

When she was around 7 years old she felt very uncomfortable wearing dresses and she refused to wear a one piece or two piece bathing suit. She asked my mother for swim shorts and a surf top to go swimming in. My family is very open and accepting and we've never questioned or cared and we happily let her wear whatever she wants (as long as it's appropriate for her age, of course).

She has said a few times in the past that she wishes she were a boy and she *only* shops in the boy section for clothes. 

She wouldn't sleep in her room, that was painted purple, for years and slept on the couch in the living room. She claimed she was afraid of the dark. Her room was recently painted blue, and she now sleeps in there every night. 

So.... What can I do? If she is in fact transgendered I want her to be comfortable and aware that's it's perfectly okay. She's also very young so I don't want to out right say anything about it, necessarily. ",trans,How can I help?,1518435770.0,"{'created_utc': 1518410570, 'id': '7wyct0', 'num_comments': 6, 'score': 13, 'selftext': 'Please excuse the format as I\'m typing this from mobile :)\n\nMy little sister is almost 10 years old. I\'d say from the time she was about 5 my family and I had noticed that she was more tom-boy than anything. This didn\'t come as a surprise, as most of the women in my family (including my mother and myself) were very tom-boyish growing up.\n\nShe prefers ""boy"" toys, like cars and nerf guns rather than ""girl"" toys like dolls and makeup. She doesn\'t like princesses much but really loves spiderman and lots of ""boyish"" things. \n\nWhen she was around 7 years old she felt very uncomfortable wearing dresses and she refused to wear a one piece or two piece bathing suit. She asked my mother for swim shorts and a surf top to go swimming in. My family is very open and accepting and we\'ve never questioned or cared and we happily let her wear whatever she wants (as long as it\'s appropriate for her age, of course).\n\nShe has said a few times in the past that she wishes she were a boy and she *only* shops in the boy section for clothes. \n\nShe wouldn\'t sleep in her room, that was painted purple, for years and slept on the couch in the living room. She claimed she was afraid of the dark. Her room was recently painted blue, and she now sleeps in there every night. \n\nSo.... What can I do? If she is in fact transgendered I want her to be comfortable and aware that\'s it\'s perfectly okay. She\'s also very young so I don\'t want to out right say anything about it, necessarily. ', 'subreddit': 'trans', 'title': 'How can I help?', 'created': 1518435770.0}"
2018-02-12 12:52:00,7x0ilu,2,3,,trans,Add some white bars and it's a beautiful representation of the trans journey,1518465120.0,"{'created_utc': 1518439920, 'id': '7x0ilu', 'num_comments': 2, 'score': 3, 'selftext': '', 'subreddit': 'trans', 'title': ""Add some white bars and it's a beautiful representation of the trans journey"", 'created': 1518465120.0}"
2018-02-12 17:24:56,7x2bzz,1,0,trans,I am a male escort. Hear me out.,1518481496.0,"{'created_utc': 1518456296, 'id': '7x2bzz', 'num_comments': 1, 'score': 0, 'subreddit': 'trans', 'title': 'I am a male escort. Hear me out.', 'created': 1518481496.0}",
2018-02-12 22:24:14,7x4lde,7,18,,trans,"Please, can any Trans* identifying participants fill in a survey about issues faced in high schools for my final year research project. Must be over 18. I would really appreciate the help and also hopefully the results of the research will help transgender pupils currently in high school.",1518499454.0,"{'created_utc': 1518474254, 'id': '7x4lde', 'num_comments': 7, 'score': 18, 'selftext': '', 'subreddit': 'trans', 'title': 'Please, can any Trans* identifying participants fill in a survey about issues faced in high schools for my final year research project. Must be over 18. I would really appreciate the help and also hopefully the results of the research will help transgender pupils currently in high school.', 'created': 1518499454.0}"
2018-02-13 01:54:12,7x5zfq,27,94,,trans,Do I look female at all ?,1518512052.0,"{'created_utc': 1518486852, 'id': '7x5zfq', 'num_comments': 27, 'score': 94, 'selftext': '', 'subreddit': 'trans', 'title': 'Do I look female at all ?', 'created': 1518512052.0}"
2018-02-13 04:21:44,7x6v2e,7,34,"So to spell it out, I am 28 and have been on HRT for 2+ years now. My mom has already pretty much decided that she can only use my name and pronouns when my 2 year old is around out of sympathy for him or something. 

My dad is a rough tough heavy machinery road construction boss dude who has lived in the mid west his whole life. I was following in those footsteps making my own way and finding some good success too. 

I've been dragging my feet to tell him about my transition for more than a year. I guess I was afraid of loosing him too. I am reaching a point where I have to draw a line about being respectful of my name and pronouns for my own health and sanity and I have been afraid of loosing him.  

Well, here is what he said...

""I have no problem at all with that. Im going to bed now but I wanted to say I support you in looking on the outside like you feel on the inside and I swear to god I've ALWAYS wanted a daughter... Goodnight I love you.""

TL;DR I was scared but it turns out my daddy loves me anyway. Now I am melting and I am pretty much just a puddle right now. Pass the tissue please. ",trans,MtF Just told my dad...,1518520904.0,"{'created_utc': 1518495704, 'id': '7x6v2e', 'num_comments': 7, 'score': 34, 'selftext': 'So to spell it out, I am 28 and have been on HRT for 2+ years now. My mom has already pretty much decided that she can only use my name and pronouns when my 2 year old is around out of sympathy for him or something. \n\nMy dad is a rough tough heavy machinery road construction boss dude who has lived in the mid west his whole life. I was following in those footsteps making my own way and finding some good success too. \n\nI\'ve been dragging my feet to tell him about my transition for more than a year. I guess I was afraid of loosing him too. I am reaching a point where I have to draw a line about being respectful of my name and pronouns for my own health and sanity and I have been afraid of loosing him.  \n\nWell, here is what he said...\n\n""I have no problem at all with that. Im going to bed now but I wanted to say I support you in looking on the outside like you feel on the inside and I swear to god I\'ve ALWAYS wanted a daughter... Goodnight I love you.""\n\nTL;DR I was scared but it turns out my daddy loves me anyway. Now I am melting and I am pretty much just a puddle right now. Pass the tissue please. ', 'subreddit': 'trans', 'title': 'MtF Just told my dad...', 'created': 1518520904.0}"
2018-02-13 12:39:03,7x93gv,0,1,[deleted],trans,Coming out...,1518550743.0,"{'created_utc': 1518525543, 'id': '7x93gv', 'num_comments': 0, 'score': 1, 'selftext': '[deleted]', 'subreddit': 'trans', 'title': 'Coming out...', 'created': 1518550743.0}"
2018-02-13 22:08:48,7xd4kr,0,1,"I figured to ask this question here because I fee that trans people might have good knowledge on hormones. I am a cis female though.
Just got my test results, after suspecting my hormones are not ok for some time. 
Im 31, female. 
LH 12.6 mIU/ml
FSH 5.8 mIU/ml
Estradiol 38.7 pg/ml
Testosterone Serum 22 ng/ml

I only did the basic female hormones test so this is all have. I did it in the luteal phase. 
As far as I understand my estrogen and testosterone are both low and LH is high. 
Can I please get some interpretations of my results before I see the doctor. I am just eager to know what these mean. 
I am skinny (not intentionally, I don’t work out at all), slightly underweight, not very curvy. I have genetic predisposition towards weak aromatase according to 23&amp;me results. 
What are my options in order to lift hormones and reach balance? Thank you
",trans,Hormones test interpretation,1518584928.0,"{'created_utc': 1518559728, 'id': '7xd4kr', 'num_comments': 0, 'score': 1, 'selftext': 'I figured to ask this question here because I fee that trans people might have good knowledge on hormones. I am a cis female though.\nJust got my test results, after suspecting my hormones are not ok for some time.\xa0\nIm 31, female.\xa0\nLH 12.6 mIU/ml\nFSH 5.8 mIU/ml\nEstradiol 38.7 pg/ml\nTestosterone Serum 22 ng/ml\n\nI only did the basic female hormones test so this is all have. I did it in the luteal phase.\xa0\nAs far as I understand my estrogen and testosterone are both low and LH is high.\xa0\nCan I please get some interpretations of my results before I see the doctor. I am just eager to know what these mean.\xa0\nI am skinny (not intentionally, I don’t work out at all), slightly underweight, not very curvy. I have genetic predisposition towards weak aromatase according to 23&amp;me results.\xa0\nWhat are my options in order to lift hormones and reach balance? Thank you\n', 'subreddit': 'trans', 'title': 'Hormones test interpretation', 'created': 1518584928.0}"
2018-02-13 22:49:29,7xdeun,2,12,"i just feel so trapped, my parents say im too young to choose my gender (ugh),  i cant get therapy until i come home from my 3 month ""vacation"" ( of course, they bought the plane tickets without asking me) i can't even enjoy anything because im constantly stressed and just looking at a mirror makes me want to cut, i dont even know if ill get a gatekeeper therapist or something like that and i doubt ill be able to change therapists because my parents are already doubtful of me being trans.  sometimes i just think how much easier it would be to jump out the window. maybe I'll be reincarnated as a cis girl :(

sorry for this messy post i just wanted to get my feelings out *somewhere*",trans,stressed and lonely,1518587369.0,"{'created_utc': 1518562169, 'id': '7xdeun', 'num_comments': 2, 'score': 12, 'selftext': 'i just feel so trapped, my parents say im too young to choose my gender (ugh),  i cant get therapy until i come home from my 3 month ""vacation"" ( of course, they bought the plane tickets without asking me) i can\'t even enjoy anything because im constantly stressed and just looking at a mirror makes me want to cut, i dont even know if ill get a gatekeeper therapist or something like that and i doubt ill be able to change therapists because my parents are already doubtful of me being trans.  sometimes i just think how much easier it would be to jump out the window. maybe I\'ll be reincarnated as a cis girl :(\n\nsorry for this messy post i just wanted to get my feelings out *somewhere*', 'subreddit': 'trans', 'title': 'stressed and lonely', 'created': 1518587369.0}"
2018-02-14 02:40:50,7xew0q,4,1,"I could use some suggestions as to what a MtF woman could use in the early part of their change.  At the moment she only has clothes.  I'm fishing around for gift ideas that are useful and aimed at people like her.  She's rather young.  Not even twenty.  We're not a serious couple, but a good sugar daddy has to keep his little girl happy.",trans,"If you had a supply wish list, what would be on it?",1518601250.0,"{'created_utc': 1518576050, 'id': '7xew0q', 'num_comments': 4, 'score': 1, 'selftext': ""I could use some suggestions as to what a MtF woman could use in the early part of their change.  At the moment she only has clothes.  I'm fishing around for gift ideas that are useful and aimed at people like her.  She's rather young.  Not even twenty.  We're not a serious couple, but a good sugar daddy has to keep his little girl happy."", 'subreddit': 'trans', 'title': 'If you had a supply wish list, what would be on it?', 'created': 1518601250.0}"
2018-02-14 05:04:55,7xfp9b,2,11,"Hello
I am Sylvia, a 17 year old trans girl. I recently realised I am a girl about a month ago now, after on and off questioning my whole life. Since then I have questioned who I am every day. I want to be a girl so bad, but at the same time, I still keep doubting myself, telling myself this isn't what I should do or that I'll regret this later. How do I make this doubt go away? 
",trans,Doubting myself,1518609895.0,"{'created_utc': 1518584695, 'id': '7xfp9b', 'num_comments': 2, 'score': 11, 'selftext': ""Hello\nI am Sylvia, a 17 year old trans girl. I recently realised I am a girl about a month ago now, after on and off questioning my whole life. Since then I have questioned who I am every day. I want to be a girl so bad, but at the same time, I still keep doubting myself, telling myself this isn't what I should do or that I'll regret this later. How do I make this doubt go away? \n"", 'subreddit': 'trans', 'title': 'Doubting myself', 'created': 1518609895.0}"
