created_utc,id,num_comments,score,selftext,subreddit,title,created,d_
2018-02-18 00:24:23,7yapbd,16,3,"Some of my questions are: 
What kind of garments do you like/look for? 
Would you like to take a class on pattern making and sewing your own garments?
Do you have any inspiration garments/photos that would love to have but can’t find them?
What is the main issue
Any stories you would like to share about your experience! 
",trans,"Hello! I’m a fashion tech (fit) designer and I would like to make a line for male/female intimates, swim, also for any special occasion. Would you please help me with answering some question? PMs are welcome! I would love to understand what you go through and how I can help in this area!",1518938663.0,"{'created_utc': 1518913463, 'id': '7yapbd', 'num_comments': 16, 'score': 3, 'selftext': 'Some of my questions are: \nWhat kind of garments do you like/look for? \nWould you like to take a class on pattern making and sewing your own garments?\nDo you have any inspiration garments/photos that would love to have but can’t find them?\nWhat is the main issue\nAny stories you would like to share about your experience! \n', 'subreddit': 'trans', 'title': 'Hello! I’m a fashion tech (fit) designer and I would like to make a line for male/female intimates, swim, also for any special occasion. Would you please help me with answering some question? PMs are welcome! I would love to understand what you go through and how I can help in this area!', 'created': 1518938663.0}"
2018-02-18 05:47:22,7ycgs2,1,2,"Ever since I came out as gender fluid it has been easier for me to express that side of myself online. People just accept me as female online and I usually don't come out to them as trans because I've always noticed that even when people are cool with me being trans they don't trat me like a woman anymore. It's subtle but they start treating me like a trans male to female in little but noticeable and very frustrating ways. 

I know a lot of you are probably thinking ""Catfish!"" but I don't use this online space to lead people on. I may be flirtatious but I'm actually in a committed monogamous relationship in the real world so if anyone ever starts to take things beyond flirtation I gently remind them I'm taken. 

I've actually made a lot of friends online and we have had some deep conversations where we've helped each other with our real world problems and I do deeply care about a lot of these people. 

Recently, however, one of my closest friends actually has an opportunity, and really wants to meet me in person. And I mean I'd love to meet him too and talk but, I am stuck with this very clearly male body.  He'll be coming through the area by the end of next month and I am terrified.

We've spoken about trans issues before and he seems like a very supportive guy but I thibk that he'll react with anger when he discovers I am geneticly male . . . He'll feel betrayed and I can't blame him, I've been lying to him after all. . . 

I seriously have no idea what to do. If he finds out, everyone will know, best case scenario, everyone will treat me differently, worst case scenario, they'll all hate me for being deceitful.",trans,They want to meet,1518958042.0,"{'created_utc': 1518932842, 'id': '7ycgs2', 'num_comments': 1, 'score': 2, 'selftext': 'Ever since I came out as gender fluid it has been easier for me to express that side of myself online. People just accept me as female online and I usually don\'t come out to them as trans because I\'ve always noticed that even when people are cool with me being trans they don\'t trat me like a woman anymore. It\'s subtle but they start treating me like a trans male to female in little but noticeable and very frustrating ways. \n\nI know a lot of you are probably thinking ""Catfish!"" but I don\'t use this online space to lead people on. I may be flirtatious but I\'m actually in a committed monogamous relationship in the real world so if anyone ever starts to take things beyond flirtation I gently remind them I\'m taken. \n\nI\'ve actually made a lot of friends online and we have had some deep conversations where we\'ve helped each other with our real world problems and I do deeply care about a lot of these people. \n\nRecently, however, one of my closest friends actually has an opportunity, and really wants to meet me in person. And I mean I\'d love to meet him too and talk but, I am stuck with this very clearly male body.  He\'ll be coming through the area by the end of next month and I am terrified.\n\nWe\'ve spoken about trans issues before and he seems like a very supportive guy but I thibk that he\'ll react with anger when he discovers I am geneticly male . . . He\'ll feel betrayed and I can\'t blame him, I\'ve been lying to him after all. . . \n\nI seriously have no idea what to do. If he finds out, everyone will know, best case scenario, everyone will treat me differently, worst case scenario, they\'ll all hate me for being deceitful.', 'subreddit': 'trans', 'title': 'They want to meet', 'created': 1518958042.0}"
2018-02-18 06:03:38,7ycjev,6,2,,trans,God damn it,1518959018.0,"{'created_utc': 1518933818, 'id': '7ycjev', 'num_comments': 6, 'score': 2, 'selftext': '', 'subreddit': 'trans', 'title': 'God damn it', 'created': 1518959018.0}"
2018-02-18 10:59:27,7ydmm3,39,25,,trans,Probably going to stop transitioning,1518976767.0,"{'created_utc': 1518951567, 'id': '7ydmm3', 'num_comments': 39, 'score': 25, 'selftext': '', 'subreddit': 'trans', 'title': 'Probably going to stop transitioning', 'created': 1518976767.0}"
2018-02-18 13:49:30,7yebm7,1,6,[deleted],trans,My dysphoria is destroying my school performance.,1518986970.0,"{'created_utc': 1518961770, 'id': '7yebm7', 'num_comments': 1, 'score': 6, 'selftext': '[deleted]', 'subreddit': 'trans', 'title': 'My dysphoria is destroying my school performance.', 'created': 1518986970.0}"
2018-02-18 18:36:45,7yg7ec,0,0,,trans,New hair &amp; makeup! How am I looking?,1519004205.0,"{'created_utc': 1518979005, 'id': '7yg7ec', 'num_comments': 0, 'score': 0, 'selftext': '', 'subreddit': 'trans', 'title': 'New hair &amp; makeup! How am I looking?', 'created': 1519004205.0}"
2018-02-18 20:24:45,7yh1fd,1,2,"I’m a CD and I may or may not transition in the future, I’m looking to chat and make new friends with MtF trans, I’m from the UK and I’m 24 :) ",trans,Looking to chat and make new friends :),1519010685.0,"{'created_utc': 1518985485, 'id': '7yh1fd', 'num_comments': 1, 'score': 2, 'selftext': 'I’m a CD and I may or may not transition in the future, I’m looking to chat and make new friends with MtF trans, I’m from the UK and I’m 24 :) ', 'subreddit': 'trans', 'title': 'Looking to chat and make new friends :)', 'created': 1519010685.0}"
2018-02-19 03:49:54,7yjwck,4,53,,trans,Felt a little cute tonight,1519037394.0,"{'created_utc': 1519012194, 'id': '7yjwck', 'num_comments': 4, 'score': 53, 'selftext': '', 'subreddit': 'trans', 'title': 'Felt a little cute tonight', 'created': 1519037394.0}"
2018-02-19 07:37:26,7yl20m,8,4,,trans,Thoughts?,1519051046.0,"{'created_utc': 1519025846, 'id': '7yl20m', 'num_comments': 8, 'score': 4, 'selftext': '', 'subreddit': 'trans', 'title': 'Thoughts?', 'created': 1519051046.0}"
2018-02-19 09:26:07,7yli9i,3,1,,trans,My friend doesn't think she's cute. What do you guys think?,1519057567.0,"{'created_utc': 1519032367, 'id': '7yli9i', 'num_comments': 3, 'score': 1, 'selftext': '', 'subreddit': 'trans', 'title': ""My friend doesn't think she's cute. What do you guys think?"", 'created': 1519057567.0}"
2018-02-19 17:59:15,7yokhv,2,0,"If I have a Penis but I identify as female, with which gender am I going in a Room with?",trans,What if I go on a study trip and there are no mixed rooms?,1519088355.0,"{'created_utc': 1519063155, 'id': '7yokhv', 'num_comments': 2, 'score': 0, 'selftext': 'If I have a Penis but I identify as female, with which gender am I going in a Room with?', 'subreddit': 'trans', 'title': 'What if I go on a study trip and there are no mixed rooms?', 'created': 1519088355.0}"
2018-02-19 18:35:26,7yovge,1,0,,trans,"man turns sexually into a girl , You will not believe what he looks like...",1519090526.0,"{'created_utc': 1519065326, 'id': '7yovge', 'num_comments': 1, 'score': 0, 'selftext': '', 'subreddit': 'trans', 'title': 'man turns sexually into a girl , You will not believe what he looks like...', 'created': 1519090526.0}"
2018-02-19 18:59:54,7yp2mg,4,21,,trans,Just being me,1519091994.0,"{'created_utc': 1519066794, 'id': '7yp2mg', 'num_comments': 4, 'score': 21, 'selftext': '', 'subreddit': 'trans', 'title': 'Just being me', 'created': 1519091994.0}"
2018-02-19 20:20:59,7yprty,1,3,[deleted],trans,Fear of what will happen to my Gen..,1519096859.0,"{'created_utc': 1519071659, 'id': '7yprty', 'num_comments': 1, 'score': 3, 'selftext': '[deleted]', 'subreddit': 'trans', 'title': 'Fear of what will happen to my Gen..', 'created': 1519096859.0}"
2018-02-19 21:35:52,7yqedq,1,10,,trans,Shaved my arms and legs for the first time yesterday! Trying to look fem.,1519101352.0,"{'created_utc': 1519076152, 'id': '7yqedq', 'num_comments': 1, 'score': 10, 'selftext': '', 'subreddit': 'trans', 'title': 'Shaved my arms and legs for the first time yesterday! Trying to look fem.', 'created': 1519101352.0}"
2018-02-20 00:11:20,7yrjjp,0,1,[removed],trans,Trans people..,1519110680.0,"{'created_utc': 1519085480, 'id': '7yrjjp', 'num_comments': 0, 'score': 1, 'selftext': '[removed]', 'subreddit': 'trans', 'title': 'Trans people..', 'created': 1519110680.0}"
2018-02-20 04:03:15,7yt1nc,19,25,,trans,Council stages transgender-only swim night,1519124595.0,"{'created_utc': 1519099395, 'id': '7yt1nc', 'num_comments': 19, 'score': 25, 'selftext': '', 'subreddit': 'trans', 'title': 'Council stages transgender-only swim night', 'created': 1519124595.0}"
2018-02-20 16:42:10,7yxap8,14,59,,trans,Blue Hearts :P,1519170130.0,"{'created_utc': 1519144930, 'id': '7yxap8', 'num_comments': 14, 'score': 59, 'selftext': '', 'subreddit': 'trans', 'title': 'Blue Hearts :P', 'created': 1519170130.0}"
2018-02-20 17:22:05,7yxmkb,5,1,"Hello,

Very soon I will finally be able to start my transition (MTF) but there is still a problem I still don't know how I will solve: hair.

Everyone talks about lazer hair removal and electrolysis but I absolutly can't afford this, not now and not anytime soon either.

So I was wondering how I could get rid of my hair with little money.

Everything I tried yet wasn't effective:

- Trimmer: Didn't cut much
- Depilatory cream: Caused hurtfull bloody red dots on my thighs (the friction of my pants against my thighs still hurt even several days later) and left some remaining hair
- Shaving (disposable razor): Chicken skin effect and bloody red dots on my thighs
- Hot wax hair removal at the esthetician: Many more bloody red dots on my thighs. The esthetician said it would go away in 2 days, it took 2 weeks. My hair grew back by the time my legs recovered. Moreover, I can't afford to pay the esthetician every 2 weeks.

These hair remains to me the most important obstacle between me and my feminity. If some of you had the same problems, I hope you can give me precise advice. After all my attempts, finding an affordable and effective way to get rid of my hair seems more and more complicated to me.",trans,Getting rid of hair with little money,1519172525.0,"{'created_utc': 1519147325, 'id': '7yxmkb', 'num_comments': 5, 'score': 1, 'selftext': ""Hello,\n\nVery soon I will finally be able to start my transition (MTF) but there is still a problem I still don't know how I will solve: hair.\n\nEveryone talks about lazer hair removal and electrolysis but I absolutly can't afford this, not now and not anytime soon either.\n\nSo I was wondering how I could get rid of my hair with little money.\n\nEverything I tried yet wasn't effective:\n\n- Trimmer: Didn't cut much\n- Depilatory cream: Caused hurtfull bloody red dots on my thighs (the friction of my pants against my thighs still hurt even several days later) and left some remaining hair\n- Shaving (disposable razor): Chicken skin effect and bloody red dots on my thighs\n- Hot wax hair removal at the esthetician: Many more bloody red dots on my thighs. The esthetician said it would go away in 2 days, it took 2 weeks. My hair grew back by the time my legs recovered. Moreover, I can't afford to pay the esthetician every 2 weeks.\n\nThese hair remains to me the most important obstacle between me and my feminity. If some of you had the same problems, I hope you can give me precise advice. After all my attempts, finding an affordable and effective way to get rid of my hair seems more and more complicated to me."", 'subreddit': 'trans', 'title': 'Getting rid of hair with little money', 'created': 1519172525.0}"
2018-02-20 17:37:12,7yxr5d,0,1,,trans,"[Survey] LGBGTQIA+ Health, Attitudes, Resiliency, and Interpersonal Conflict Study",1519173432.0,"{'created_utc': 1519148232, 'id': '7yxr5d', 'num_comments': 0, 'score': 1, 'selftext': '', 'subreddit': 'trans', 'title': '[Survey] LGBGTQIA+ Health, Attitudes, Resiliency, and Interpersonal Conflict Study', 'created': 1519173432.0}"
2018-02-20 23:17:55,7z0ldw,19,86,,trans,Went out to a hookah bar last night dressed up for the first time.,1519193875.0,"{'created_utc': 1519168675, 'id': '7z0ldw', 'num_comments': 19, 'score': 86, 'selftext': '', 'subreddit': 'trans', 'title': 'Went out to a hookah bar last night dressed up for the first time.', 'created': 1519193875.0}"
2018-02-21 01:33:36,7z1lkz,3,17,"Hi guys, I just thought I'd post a few nice light-hearted things involving my nan, who has quite advanced dementia. (Pleeeeease don't tell me off for mocking dementia - I live with hers. I know. Call it affection, a coping strategy, reclamation, I don't care which.)

So, firstly, good news is that she doesn't remember me too well from the Joe days, so that when I open the door and I'm presenting female, she doesn't recognise me. My voice is changed enough that when she asks ""which one are you?"" and I reply ""Jenny, Nan! Your granddaughter"", her response is usually something like, ""I didn't realise I had another granddaughter,"" or ""Aren't you tall for a girl?"" Which yes, sisters, I am. 

But secondly, this whole ""becoming a different person to her"", might not've even been necessary. Because in her oldies singing club today, a trans lady came in and sang a song on her guitar, etc. and my mum said that driving nan home in the car, she said ""We had someone in playing the guitar today, but you know, I wasn't sure if it was a man or a woman!"" Mum took a deep breath, and said ""Yes, it was a woman, she's transgender."" ""What's that?"" ""Well, she used to be a boy, but she took hormones, surgery and now she lives as a woman."" (Simplified and possibly inaccurate version I know) ""Gosh, well I've never heard of that before"". No complains, arguments, just peaceful cogitation........ And then a few minutes later......""You know, we had someone playing the guitar today, but I wasn't sure if it was a man or a woman!""

Like, I know it sounds patronising, but god bless her. She had a gay cousin, but when she found out Stephen Fry was gay she said ""That's a shame"". These guys are complicated.......",trans,Fun trans stuff with my nan,1519202016.0,"{'created_utc': 1519176816, 'id': '7z1lkz', 'num_comments': 3, 'score': 17, 'selftext': 'Hi guys, I just thought I\'d post a few nice light-hearted things involving my nan, who has quite advanced dementia. (Pleeeeease don\'t tell me off for mocking dementia - I live with hers. I know. Call it affection, a coping strategy, reclamation, I don\'t care which.)\n\nSo, firstly, good news is that she doesn\'t remember me too well from the Joe days, so that when I open the door and I\'m presenting female, she doesn\'t recognise me. My voice is changed enough that when she asks ""which one are you?"" and I reply ""Jenny, Nan! Your granddaughter"", her response is usually something like, ""I didn\'t realise I had another granddaughter,"" or ""Aren\'t you tall for a girl?"" Which yes, sisters, I am. \n\nBut secondly, this whole ""becoming a different person to her"", might not\'ve even been necessary. Because in her oldies singing club today, a trans lady came in and sang a song on her guitar, etc. and my mum said that driving nan home in the car, she said ""We had someone in playing the guitar today, but you know, I wasn\'t sure if it was a man or a woman!"" Mum took a deep breath, and said ""Yes, it was a woman, she\'s transgender."" ""What\'s that?"" ""Well, she used to be a boy, but she took hormones, surgery and now she lives as a woman."" (Simplified and possibly inaccurate version I know) ""Gosh, well I\'ve never heard of that before"". No complains, arguments, just peaceful cogitation........ And then a few minutes later......""You know, we had someone playing the guitar today, but I wasn\'t sure if it was a man or a woman!""\n\nLike, I know it sounds patronising, but god bless her. She had a gay cousin, but when she found out Stephen Fry was gay she said ""That\'s a shame"". These guys are complicated.......', 'subreddit': 'trans', 'title': 'Fun trans stuff with my nan', 'created': 1519202016.0}"
2018-02-21 03:03:19,7z28by,1,5,Hello all! I have my first appointment with a therapist tomorrow morning and I seriously don't know what I am supposed to talk about with them. I think I'm probably trans (but honestly I don't know) because I've been questioning for like a year now and because I honestly wish I could be a girl. But... I just don't know what to say to a therapist... Help? 16 amab if that helps ,trans,Therapist,1519207399.0,"{'created_utc': 1519182199, 'id': '7z28by', 'num_comments': 1, 'score': 5, 'selftext': ""Hello all! I have my first appointment with a therapist tomorrow morning and I seriously don't know what I am supposed to talk about with them. I think I'm probably trans (but honestly I don't know) because I've been questioning for like a year now and because I honestly wish I could be a girl. But... I just don't know what to say to a therapist... Help? 16 amab if that helps "", 'subreddit': 'trans', 'title': 'Therapist', 'created': 1519207399.0}"
2018-02-21 04:40:17,7z2v7a,1,2,Ive already told my parents im gay but i dont know how they would react to finding out they have a daughter even though they aren’t transphobic,trans,Help coming out,1519213217.0,"{'created_utc': 1519188017, 'id': '7z2v7a', 'num_comments': 1, 'score': 2, 'selftext': 'Ive already told my parents im gay but i dont know how they would react to finding out they have a daughter even though they aren’t transphobic', 'subreddit': 'trans', 'title': 'Help coming out', 'created': 1519213217.0}"
2018-02-21 06:37:31,7z3k4l,2,5,"After a month of delays I finally got my prescription to start HRT and popped my first dose as soon as i got home. 

Ive been given 2mg Progynova and 12.5mg cyproterone. Which they said will be increased after 3 months. 

So glad to get the ball rolling after all these years in this incorrect shell.

Im so happy. If only everything else in my life could come right.",trans,First Doses,1519220251.0,"{'created_utc': 1519195051, 'id': '7z3k4l', 'num_comments': 2, 'score': 5, 'selftext': 'After a month of delays I finally got my prescription to start HRT and popped my first dose as soon as i got home. \n\nIve been given 2mg Progynova and 12.5mg cyproterone. Which they said will be increased after 3 months. \n\nSo glad to get the ball rolling after all these years in this incorrect shell.\n\nIm so happy. If only everything else in my life could come right.', 'subreddit': 'trans', 'title': 'First Doses', 'created': 1519220251.0}"
2018-02-21 17:10:58,7z75ou,6,57,,trans,"For someone who's struggling with their identity, seeing friends support one another touched my heart",1519258258.0,"{'created_utc': 1519233058, 'id': '7z75ou', 'num_comments': 6, 'score': 57, 'selftext': '', 'subreddit': 'trans', 'title': ""For someone who's struggling with their identity, seeing friends support one another touched my heart"", 'created': 1519258258.0}"
2018-02-21 17:46:05,7z7g1n,0,1,[deleted],trans,I came out as a trans woman on youtube today,1519260365.0,"{'created_utc': 1519235165, 'id': '7z7g1n', 'num_comments': 0, 'score': 1, 'selftext': '[deleted]', 'subreddit': 'trans', 'title': 'I came out as a trans woman on youtube today', 'created': 1519260365.0}"
2018-02-21 17:59:43,7z7k2j,15,24,,trans,I came out as a Trans Woman on YouTube today,1519261183.0,"{'created_utc': 1519235983, 'id': '7z7k2j', 'num_comments': 15, 'score': 24, 'selftext': '', 'subreddit': 'trans', 'title': 'I came out as a Trans Woman on YouTube today', 'created': 1519261183.0}"
2018-02-21 19:20:11,7z87m4,0,2,trans,I‘m completely breaking apart,1519266011.0,"{'created_utc': 1519240811, 'id': '7z87m4', 'num_comments': 0, 'score': 2, 'subreddit': 'trans', 'title': 'I‘m completely breaking apart', 'created': 1519266011.0}",
2018-02-22 00:14:13,7zah9t,0,1,I've been thinking of going with the masho packer (4 inches) as it has a more natural look to it. The Mr. Limpy xs seems to stick out to me since it's shorter. Before I order it though I want to be sure that I'm making the right size choice. I'm 5'2. ,trans,Packer size?,1519283653.0,"{'created_utc': 1519258453, 'id': '7zah9t', 'num_comments': 0, 'score': 1, 'selftext': ""I've been thinking of going with the masho packer (4 inches) as it has a more natural look to it. The Mr. Limpy xs seems to stick out to me since it's shorter. Before I order it though I want to be sure that I'm making the right size choice. I'm 5'2. "", 'subreddit': 'trans', 'title': 'Packer size?', 'created': 1519283653.0}"
2018-02-22 06:11:07,7zcplq,3,10,I'm scared of who I am? I don't know why I have felt this way since 7th grade like I'm terrified of the fact I'm trans and pansexual I don't want to disappoint people  cause in my family I'm the only girl which makes  me scared of coming out cause I feel like no one will accept it or even care anymore and everyone thinks I'll marry a man when I may not and I'm scared of letting everyone down. I want to just get over it and I don't know how what should I do?,trans,scared??,1519305067.0,"{'created_utc': 1519279867, 'id': '7zcplq', 'num_comments': 3, 'score': 10, 'selftext': ""I'm scared of who I am? I don't know why I have felt this way since 7th grade like I'm terrified of the fact I'm trans and pansexual I don't want to disappoint people  cause in my family I'm the only girl which makes  me scared of coming out cause I feel like no one will accept it or even care anymore and everyone thinks I'll marry a man when I may not and I'm scared of letting everyone down. I want to just get over it and I don't know how what should I do?"", 'subreddit': 'trans', 'title': 'scared??', 'created': 1519305067.0}"
2018-02-22 07:51:23,7zd7g8,3,0,,trans,Trans 101 question answered: Why aren't trans people just given more of the male or female hormones needed to match their outward physical self?,1519311083.0,"{'created_utc': 1519285883, 'id': '7zd7g8', 'num_comments': 3, 'score': 0, 'selftext': '', 'subreddit': 'trans', 'title': ""Trans 101 question answered: Why aren't trans people just given more of the male or female hormones needed to match their outward physical self?"", 'created': 1519311083.0}"
2018-02-22 17:35:02,7zgns9,13,16,"ive always had shit bottom dysphoria and recently its been the worst. ive been saving up for a long time and very soon im gonna have enough money to get myself a peecock. 

HOWEVER, my friends are very noisy and dont think before they speak. theyre gonna notice that i all of a sudden have a massive dick and will question it. resulting in them taking the absolute piss out of me for having one and will go around telling everyone that i have a fucking strap on 😂

Also, i have a girlfriend and she would realise. Shes weirded out by packing let alone me having a 3 in 1. i dont want her weirded out about it at all but having a fake dick is weird and she would make it a big deal basically.

Honestly i have no idea how reddit can help and my friends might find this post but fuck it. Help me. Somehow.",trans,im embarrased to get a 3 in 1 (packer... basically),1519346102.0,"{'created_utc': 1519320902, 'id': '7zgns9', 'num_comments': 13, 'score': 16, 'selftext': 'ive always had shit bottom dysphoria and recently its been the worst. ive been saving up for a long time and very soon im gonna have enough money to get myself a peecock. \n\nHOWEVER, my friends are very noisy and dont think before they speak. theyre gonna notice that i all of a sudden have a massive dick and will question it. resulting in them taking the absolute piss out of me for having one and will go around telling everyone that i have a fucking strap on 😂\n\nAlso, i have a girlfriend and she would realise. Shes weirded out by packing let alone me having a 3 in 1. i dont want her weirded out about it at all but having a fake dick is weird and she would make it a big deal basically.\n\nHonestly i have no idea how reddit can help and my friends might find this post but fuck it. Help me. Somehow.', 'subreddit': 'trans', 'title': 'im embarrased to get a 3 in 1 (packer... basically)', 'created': 1519346102.0}"
2018-02-22 21:26:39,7zii56,0,1,,trans,Dealing with discrimination,1519359999.0,"{'created_utc': 1519334799, 'id': '7zii56', 'num_comments': 0, 'score': 1, 'selftext': '', 'subreddit': 'trans', 'title': 'Dealing with discrimination', 'created': 1519359999.0}"
2018-02-23 01:59:28,7zkg6p,14,29,,trans,So freaking ready for electro :/ ouchhh,1519376368.0,"{'created_utc': 1519351168, 'id': '7zkg6p', 'num_comments': 14, 'score': 29, 'selftext': '', 'subreddit': 'trans', 'title': 'So freaking ready for electro :/ ouchhh', 'created': 1519376368.0}"
