created_utc,id,num_comments,score,selftext,subreddit,title,created,d_
2016-09-22 23:19:09,541ubu,0,8,,transgender,Navy Seal Kristin Beck Humiliated by TSA,1474611549.0,"{'created_utc': 1474586349, 'id': '541ubu', 'num_comments': 0, 'score': 8, 'selftext': '', 'subreddit': 'transgender', 'title': 'Navy Seal Kristin Beck Humiliated by TSA', 'created': 1474611549.0}"
2016-09-22 23:38:41,541x9y,4,33,,transgender,Chelsea Manning prepares defense against charges stemming from suicide attempt,1474612721.0,"{'created_utc': 1474587521, 'id': '541x9y', 'num_comments': 4, 'score': 33, 'selftext': '', 'subreddit': 'transgender', 'title': 'Chelsea Manning prepares defense against charges stemming from suicide attempt', 'created': 1474612721.0}"
2016-09-23 00:46:46,5427ez,1,6,,transgender,Transgender former Navy SEAL says TSA humiliated her,1474616806.0,"{'created_utc': 1474591606, 'id': '5427ez', 'num_comments': 1, 'score': 6, 'selftext': '', 'subreddit': 'transgender', 'title': 'Transgender former Navy SEAL says TSA humiliated her', 'created': 1474616806.0}"
2016-09-23 01:28:32,542dq2,0,1,,transgender,Pharmacology of Anti-Androgens V 2.2,1474619312.0,"{'created_utc': 1474594112, 'id': '542dq2', 'num_comments': 0, 'score': 1, 'selftext': '', 'subreddit': 'transgender', 'title': 'Pharmacology of Anti-Androgens V 2.2', 'created': 1474619312.0}"
2016-09-23 12:07:29,544d39,18,218,,transgender,Laura Jane Grace's Ex-Wife Slams 'Rolling Stone' For Twisting Her Words And Misgendering,1474657649.0,"{'created_utc': 1474632449, 'id': '544d39', 'num_comments': 18, 'score': 218, 'selftext': '', 'subreddit': 'transgender', 'title': ""Laura Jane Grace's Ex-Wife Slams 'Rolling Stone' For Twisting Her Words And Misgendering"", 'created': 1474657649.0}"
2016-09-23 12:08:27,544d7p,7,24,,transgender,Teen Becomes His School Football Team's First Transgender Player,1474657707.0,"{'created_utc': 1474632507, 'id': '544d7p', 'num_comments': 7, 'score': 24, 'selftext': '', 'subreddit': 'transgender', 'title': ""Teen Becomes His School Football Team's First Transgender Player"", 'created': 1474657707.0}"
2016-09-23 17:19:29,545txo,0,1,,transgender,Please help fund my friends sex change,1474676369.0,"{'created_utc': 1474651169, 'id': '545txo', 'num_comments': 0, 'score': 1, 'selftext': '', 'subreddit': 'transgender', 'title': 'Please help fund my friends sex change', 'created': 1474676369.0}"
2016-09-23 17:41:10,545y3j,1,17,,transgender,Transgender Couple from Ecuador have their first child and plan for more.,1474677670.0,"{'created_utc': 1474652470, 'id': '545y3j', 'num_comments': 1, 'score': 17, 'selftext': '', 'subreddit': 'transgender', 'title': 'Transgender Couple from Ecuador have their first child and plan for more.', 'created': 1474677670.0}"
2016-09-23 19:55:02,546moc,0,1,,transgender,"Please check out my first YOUTUBE video! Like, Share, Comment and Subscribe for more!",1474685702.0,"{'created_utc': 1474660502, 'id': '546moc', 'num_comments': 0, 'score': 1, 'selftext': '', 'subreddit': 'transgender', 'title': 'Please check out my first YOUTUBE video! Like, Share, Comment and Subscribe for more!', 'created': 1474685702.0}"
2016-09-23 20:35:47,546u7i,0,9,,transgender,Becoming Blair: A Transgender Documentary,1474688147.0,"{'created_utc': 1474662947, 'id': '546u7i', 'num_comments': 0, 'score': 9, 'selftext': '', 'subreddit': 'transgender', 'title': 'Becoming Blair: A Transgender Documentary', 'created': 1474688147.0}"
2016-09-23 22:08:50,547a1w,24,19,,transgender,Transgender Customer Denied Preferred Changing Room at Urban Outfitters,1474693730.0,"{'created_utc': 1474668530, 'id': '547a1w', 'num_comments': 24, 'score': 19, 'selftext': '', 'subreddit': 'transgender', 'title': 'Transgender Customer Denied Preferred Changing Room at Urban Outfitters', 'created': 1474693730.0}"
2016-09-24 01:44:21,5485k2,0,1,[deleted],transgender,"MtF transgender, before any sort of treatment. I'm proud of how far I've come on my own!",1474706661.0,"{'created_utc': 1474681461, 'id': '5485k2', 'num_comments': 0, 'score': 1, 'selftext': '[deleted]', 'subreddit': 'transgender', 'title': ""MtF transgender, before any sort of treatment. I'm proud of how far I've come on my own!"", 'created': 1474706661.0}"
2016-09-24 13:21:55,54a3ce,1,1,,transgender,A questão do banheiro: para nós ou para elxs?,1474748515.0,"{'created_utc': 1474723315, 'id': '54a3ce', 'num_comments': 1, 'score': 1, 'selftext': '', 'subreddit': 'transgender', 'title': 'A questão do banheiro: para nós ou para elxs?', 'created': 1474748515.0}"
2016-09-24 16:15:16,54arsy,5,92,,transgender,A transgender man granted asylum by the U.S. last year is challenging an Indiana law that prevents him from changing his first name to a male name that matches his gender identity.,1474758916.0,"{'created_utc': 1474733716, 'id': '54arsy', 'num_comments': 5, 'score': 92, 'selftext': '', 'subreddit': 'transgender', 'title': 'A transgender man granted asylum by the U.S. last year is challenging an Indiana law that prevents him from changing his first name to a male name that matches his gender identity.', 'created': 1474758916.0}"
2016-09-25 03:52:47,54dm5y,0,1,,transgender,9 months later...,1474800767.0,"{'created_utc': 1474775567, 'id': '54dm5y', 'num_comments': 0, 'score': 1, 'selftext': '', 'subreddit': 'transgender', 'title': '9 months later...', 'created': 1474800767.0}"
2016-09-25 04:18:20,54dp68,0,1,,transgender,Just talking a bit about how i feel.,1474802300.0,"{'created_utc': 1474777100, 'id': '54dp68', 'num_comments': 0, 'score': 1, 'selftext': '', 'subreddit': 'transgender', 'title': 'Just talking a bit about how i feel.', 'created': 1474802300.0}"
2016-09-25 06:01:40,54dzf0,1,1,[deleted],transgender,Tinder is still transphobic and it's almost 2017,1474808500.0,"{'created_utc': 1474783300, 'id': '54dzf0', 'num_comments': 1, 'score': 1, 'selftext': '[deleted]', 'subreddit': 'transgender', 'title': ""Tinder is still transphobic and it's almost 2017"", 'created': 1474808500.0}"
2016-09-26 08:59:13,54jpy0,9,8,,transgender,Why No One Calls Me Fat Anymore,1474905553.0,"{'created_utc': 1474880353, 'id': '54jpy0', 'num_comments': 9, 'score': 8, 'selftext': '', 'subreddit': 'transgender', 'title': 'Why No One Calls Me Fat Anymore', 'created': 1474905553.0}"
2016-09-26 13:55:30,54kojl,0,0,[deleted],transgender,Basic behavioral patterns of men &amp; women,1474923330.0,"{'created_utc': 1474898130, 'id': '54kojl', 'num_comments': 0, 'score': 0, 'selftext': '[deleted]', 'subreddit': 'transgender', 'title': 'Basic behavioral patterns of men &amp; women', 'created': 1474923330.0}"
2016-09-26 15:04:17,54l0cy,42,18,,transgender,Can Your Sexual Orientation Change With Hormones?,1474927457.0,"{'created_utc': 1474902257, 'id': '54l0cy', 'num_comments': 42, 'score': 18, 'selftext': '', 'subreddit': 'transgender', 'title': 'Can Your Sexual Orientation Change With Hormones?', 'created': 1474927457.0}"
2016-09-26 16:46:41,54ljla,0,1,,transgender,Part II of our gender and sex and running podcast episode is out!,1474933601.0,"{'created_utc': 1474908401, 'id': '54ljla', 'num_comments': 0, 'score': 1, 'selftext': '', 'subreddit': 'transgender', 'title': 'Part II of our gender and sex and running podcast episode is out!', 'created': 1474933601.0}"
2016-09-26 17:00:38,54lm9z,13,146,,transgender,“Modern Family” Casts First Openly Transgender Child Actor,1474934438.0,"{'created_utc': 1474909238, 'id': '54lm9z', 'num_comments': 13, 'score': 146, 'selftext': '', 'subreddit': 'transgender', 'title': '“Modern Family” Casts First Openly Transgender Child Actor', 'created': 1474934438.0}"
2016-09-26 17:45:26,54luui,1,7,,transgender,Coping with Gender Dysphoria,1474937126.0,"{'created_utc': 1474911926, 'id': '54luui', 'num_comments': 1, 'score': 7, 'selftext': '', 'subreddit': 'transgender', 'title': 'Coping with Gender Dysphoria', 'created': 1474937126.0}"
2016-09-26 18:12:46,54m020,0,1,[deleted],transgender,"Not specifically about transgender, but interesting to an extent? [ A tale of two people | Heather Newman | TEDxSchriever]",1474938766.0,"{'created_utc': 1474913566, 'id': '54m020', 'num_comments': 0, 'score': 1, 'selftext': '[deleted]', 'subreddit': 'transgender', 'title': 'Not specifically about transgender, but interesting to an extent? [ A tale of two people | Heather Newman | TEDxSchriever]', 'created': 1474938766.0}"
2016-09-26 22:25:49,54nblu,1,1,,transgender,"Transgender woman says employer's &amp; insurer's refusal to cover gender-change surgery violated employment and Obamacare laws, rules.",1474953949.0,"{'created_utc': 1474928749, 'id': '54nblu', 'num_comments': 1, 'score': 1, 'selftext': '', 'subreddit': 'transgender', 'title': ""Transgender woman says employer's &amp; insurer's refusal to cover gender-change surgery violated employment and Obamacare laws, rules."", 'created': 1474953949.0}"
2016-09-27 00:26:47,54nvrj,0,1,[deleted],transgender,Ruxolitinib: A drug that may cure alopecia? Maybe even in less than six months?,1474961207.0,"{'created_utc': 1474936007, 'id': '54nvrj', 'num_comments': 0, 'score': 1, 'selftext': '[deleted]', 'subreddit': 'transgender', 'title': 'Ruxolitinib: A drug that may cure alopecia? Maybe even in less than six months?', 'created': 1474961207.0}"
2016-09-27 00:44:43,54nyp5,0,1,,transgender,Who else is ready for Halloween? (please excuse the hair and lack of makeup),1474962283.0,"{'created_utc': 1474937083, 'id': '54nyp5', 'num_comments': 0, 'score': 1, 'selftext': '', 'subreddit': 'transgender', 'title': 'Who else is ready for Halloween? (please excuse the hair and lack of makeup)', 'created': 1474962283.0}"
2016-09-27 02:16:47,54odll,14,104,,transgender,Planned Parenthood to offer services to transgender clients!,1474967807.0,"{'created_utc': 1474942607, 'id': '54odll', 'num_comments': 14, 'score': 104, 'selftext': '', 'subreddit': 'transgender', 'title': 'Planned Parenthood to offer services to transgender clients!', 'created': 1474967807.0}"
2016-09-27 08:52:53,54pp34,0,1,,transgender,Intro,1474991573.0,"{'created_utc': 1474966373, 'id': '54pp34', 'num_comments': 0, 'score': 1, 'selftext': '', 'subreddit': 'transgender', 'title': 'Intro', 'created': 1474991573.0}"
2016-09-27 11:23:50,54q3hu,32,58,,transgender,[FYI] ... Why the story of body-swapping teenagers has gripped Japan,1475000630.0,"{'created_utc': 1474975430, 'id': '54q3hu', 'num_comments': 32, 'score': 58, 'selftext': '', 'subreddit': 'transgender', 'title': '[FYI] ... Why the story of body-swapping teenagers has gripped Japan', 'created': 1475000630.0}"
2016-09-27 18:46:09,54s472,4,13,,transgender,On Cis Actors Playing Trans Characters,1475027169.0,"{'created_utc': 1475001969, 'id': '54s472', 'num_comments': 4, 'score': 13, 'selftext': '', 'subreddit': 'transgender', 'title': 'On Cis Actors Playing Trans Characters', 'created': 1475027169.0}"
2016-09-27 20:03:52,54siig,15,81,,transgender,‘Modern Family’ Becomes First Show to Hire Transgender Child Actor.,1475031832.0,"{'created_utc': 1475006632, 'id': '54siig', 'num_comments': 15, 'score': 81, 'selftext': '', 'subreddit': 'transgender', 'title': '‘Modern Family’ Becomes First Show to Hire Transgender Child Actor.', 'created': 1475031832.0}"
2016-09-28 00:07:51,54tnrp,0,0,[deleted],transgender,Sex survey with a chance to win $20 AFTER completion; 15-min (sexually active trans participants only).,1475046471.0,"{'created_utc': 1475021271, 'id': '54tnrp', 'num_comments': 0, 'score': 0, 'selftext': '[deleted]', 'subreddit': 'transgender', 'title': 'Sex survey with a chance to win $20 AFTER completion; 15-min (sexually active trans participants only).', 'created': 1475046471.0}"
2016-09-28 04:04:03,54um9p,4,14,,transgender,Universities that Cover the Cost of Transitions,1475060643.0,"{'created_utc': 1475035443, 'id': '54um9p', 'num_comments': 4, 'score': 14, 'selftext': '', 'subreddit': 'transgender', 'title': 'Universities that Cover the Cost of Transitions', 'created': 1475060643.0}"
2016-09-28 12:09:52,54vzw4,27,12,,transgender,[BBC] The transgender Republican trying to change her party,1475089792.0,"{'created_utc': 1475064592, 'id': '54vzw4', 'num_comments': 27, 'score': 12, 'selftext': '', 'subreddit': 'transgender', 'title': '[BBC] The transgender Republican trying to change her party', 'created': 1475089792.0}"
2016-09-28 15:02:54,54wr0k,34,131,,transgender,New Gender-Neutral Toy Ad Praised for Showing Boy in a Princess Dress. There is a video with the story. Thoughts?,1475100174.0,"{'created_utc': 1475074974, 'id': '54wr0k', 'num_comments': 34, 'score': 131, 'selftext': '', 'subreddit': 'transgender', 'title': 'New Gender-Neutral Toy Ad Praised for Showing Boy in a Princess Dress. There is a video with the story. Thoughts?', 'created': 1475100174.0}"
2016-09-28 17:53:29,54xmt7,0,1,,transgender,New legal name today.,1475110409.0,"{'created_utc': 1475085209, 'id': '54xmt7', 'num_comments': 0, 'score': 1, 'selftext': '', 'subreddit': 'transgender', 'title': 'New legal name today.', 'created': 1475110409.0}"
2016-09-28 18:30:20,54xtr8,1,1,,transgender,"did anybody see that two-piece is much too little for her like what the heck? joking, GOD GUYS, simply KIDDING! it practically fits consummately",1475112620.0,"{'created_utc': 1475087420, 'id': '54xtr8', 'num_comments': 1, 'score': 1, 'selftext': '', 'subreddit': 'transgender', 'title': 'did anybody see that two-piece is much too little for her like what the heck? joking, GOD GUYS, simply KIDDING! it practically fits consummately', 'created': 1475112620.0}"
2016-09-28 20:12:25,54yd7d,2,8,,transgender,Porn Site Buys Alexis Arquette Sex Tape But Not For The Reason You'd Think,1475118745.0,"{'created_utc': 1475093545, 'id': '54yd7d', 'num_comments': 2, 'score': 8, 'selftext': '', 'subreddit': 'transgender', 'title': ""Porn Site Buys Alexis Arquette Sex Tape But Not For The Reason You'd Think"", 'created': 1475118745.0}"
2016-09-29 00:29:30,54zl0y,5,8,,transgender,Half of Americans Think Gender Identity and Bathrooms Don't Mix,1475134170.0,"{'created_utc': 1475108970, 'id': '54zl0y', 'num_comments': 5, 'score': 8, 'selftext': '', 'subreddit': 'transgender', 'title': ""Half of Americans Think Gender Identity and Bathrooms Don't Mix"", 'created': 1475134170.0}"
2016-09-29 01:09:58,54zr92,0,29,,transgender,Transgender Community in India Fights for Recognition in Electoral System,1475136598.0,"{'created_utc': 1475111398, 'id': '54zr92', 'num_comments': 0, 'score': 29, 'selftext': '', 'subreddit': 'transgender', 'title': 'Transgender Community in India Fights for Recognition in Electoral System', 'created': 1475136598.0}"
2016-09-29 05:55:22,550t6d,13,1,,transgender,What Is The Difference Between Transgender and Transsexual? – Anyone Knows?,1475153722.0,"{'created_utc': 1475128522, 'id': '550t6d', 'num_comments': 13, 'score': 1, 'selftext': '', 'subreddit': 'transgender', 'title': 'What Is The Difference Between Transgender and Transsexual? – Anyone Knows?', 'created': 1475153722.0}"
2016-09-29 14:16:22,552d7y,16,63,,transgender,Dealing with the TSA at airports,1475183782.0,"{'created_utc': 1475158582, 'id': '552d7y', 'num_comments': 16, 'score': 63, 'selftext': '', 'subreddit': 'transgender', 'title': 'Dealing with the TSA at airports', 'created': 1475183782.0}"
2016-09-29 17:21:49,553aik,2,15,,transgender,HRC and national pediatric organizations team up for new guide on raising transgender kids,1475194909.0,"{'created_utc': 1475169709, 'id': '553aik', 'num_comments': 2, 'score': 15, 'selftext': '', 'subreddit': 'transgender', 'title': 'HRC and national pediatric organizations team up for new guide on raising transgender kids', 'created': 1475194909.0}"
2016-09-29 18:30:09,553ncx,11,0,,transgender,Provocative post by Clare Flourish on the possiblity of getting the genitalia of your true gender,1475199009.0,"{'created_utc': 1475173809, 'id': '553ncx', 'num_comments': 11, 'score': 0, 'selftext': '', 'subreddit': 'transgender', 'title': 'Provocative post by Clare Flourish on the possiblity of getting the genitalia of your true gender', 'created': 1475199009.0}"
2016-09-29 18:58:53,553stl,0,10,,transgender,About Paul McHugh -- my (former mormon) take on Johns Hopkins distancing their name from his report (which is already a favorite of mormons),1475200733.0,"{'created_utc': 1475175533, 'id': '553stl', 'num_comments': 0, 'score': 10, 'selftext': '', 'subreddit': 'transgender', 'title': 'About Paul McHugh -- my (former mormon) take on Johns Hopkins distancing their name from his report (which is already a favorite of mormons)', 'created': 1475200733.0}"
2016-09-29 19:48:46,55425e,14,159,,transgender,Saskatchewan To Cover Up To 100% Of Gender Reassignment Surgery Costs,1475203726.0,"{'created_utc': 1475178526, 'id': '55425e', 'num_comments': 14, 'score': 159, 'selftext': '', 'subreddit': 'transgender', 'title': 'Saskatchewan To Cover Up To 100% Of Gender Reassignment Surgery Costs', 'created': 1475203726.0}"
2016-09-29 20:05:49,554577,8,21,,transgender,"Wake County, NC Sheriff thinks being trans is similar to having head lice",1475204749.0,"{'created_utc': 1475179549, 'id': '554577', 'num_comments': 8, 'score': 21, 'selftext': '', 'subreddit': 'transgender', 'title': 'Wake County, NC Sheriff thinks being trans is similar to having head lice', 'created': 1475204749.0}"
2016-09-29 20:13:15,5546mu,11,114,,transgender,Norwegians now can change genders legally with a mouse click,1475205195.0,"{'created_utc': 1475179995, 'id': '5546mu', 'num_comments': 11, 'score': 114, 'selftext': '', 'subreddit': 'transgender', 'title': 'Norwegians now can change genders legally with a mouse click', 'created': 1475205195.0}"
2016-09-29 20:51:01,554dix,18,58,,transgender,John Hopkins distances themselves from Paul R. McHugh,1475207461.0,"{'created_utc': 1475182261, 'id': '554dix', 'num_comments': 18, 'score': 58, 'selftext': '', 'subreddit': 'transgender', 'title': 'John Hopkins distances themselves from Paul R. McHugh', 'created': 1475207461.0}"
2016-09-29 20:56:05,554ej4,0,1,,transgender,The Des Moines Register is holding a forum on trans experiences and invited leaders from an LGBT hate group to speak.,1475207765.0,"{'created_utc': 1475182565, 'id': '554ej4', 'num_comments': 0, 'score': 1, 'selftext': '', 'subreddit': 'transgender', 'title': 'The Des Moines Register is holding a forum on trans experiences and invited leaders from an LGBT hate group to speak.', 'created': 1475207765.0}"
2016-09-29 23:21:56,5552t9,0,1,,transgender,"The CDC says that violence is real, but I guess trans youth are not.",1475216516.0,"{'created_utc': 1475191316, 'id': '5552t9', 'num_comments': 0, 'score': 1, 'selftext': '', 'subreddit': 'transgender', 'title': 'The CDC says that violence is real, but I guess trans youth are not.', 'created': 1475216516.0}"
2016-09-30 06:01:02,556l0n,0,1,,transgender,"Today was a first for me, I went out in public as a girl!",1475240462.0,"{'created_utc': 1475215262, 'id': '556l0n', 'num_comments': 0, 'score': 1, 'selftext': '', 'subreddit': 'transgender', 'title': 'Today was a first for me, I went out in public as a girl!', 'created': 1475240462.0}"
2016-09-30 13:38:56,557xmj,5,4,,transgender,Attorney General Jackley Joins Challenge to Federal Government Withholding of Education Funds over Transgender,1475267936.0,"{'created_utc': 1475242736, 'id': '557xmj', 'num_comments': 5, 'score': 4, 'selftext': '', 'subreddit': 'transgender', 'title': 'Attorney General Jackley Joins Challenge to Federal Government Withholding of Education Funds over Transgender', 'created': 1475267936.0}"
2016-09-30 17:43:30,5593ii,89,169,,transgender,Trump Pledges to Legalize LGBT Discrimination,1475282610.0,"{'created_utc': 1475257410, 'id': '5593ii', 'num_comments': 89, 'score': 169, 'selftext': '', 'subreddit': 'transgender', 'title': 'Trump Pledges to Legalize LGBT Discrimination', 'created': 1475282610.0}"
2016-09-30 18:30:53,559bog,10,39,,transgender,"TIL about Christine Jorgensen, the first American transsexual public figure, who was a media sensation in the 1950s",1475285453.0,"{'created_utc': 1475260253, 'id': '559bog', 'num_comments': 10, 'score': 39, 'selftext': '', 'subreddit': 'transgender', 'title': 'TIL about Christine Jorgensen, the first American transsexual public figure, who was a media sensation in the 1950s', 'created': 1475285453.0}"
2016-09-30 19:07:32,559iaq,8,97,,transgender,Miley Cyrus helped support a fan through her transition,1475287652.0,"{'created_utc': 1475262452, 'id': '559iaq', 'num_comments': 8, 'score': 97, 'selftext': '', 'subreddit': 'transgender', 'title': 'Miley Cyrus helped support a fan through her transition', 'created': 1475287652.0}"
2016-09-30 19:08:40,559iht,2,13,,transgender,How the US Military Became the Country's Largest Employer of Transgender Americans,1475287720.0,"{'created_utc': 1475262520, 'id': '559iht', 'num_comments': 2, 'score': 13, 'selftext': '', 'subreddit': 'transgender', 'title': ""How the US Military Became the Country's Largest Employer of Transgender Americans"", 'created': 1475287720.0}"
2016-09-30 22:10:52,55addy,0,1,[deleted],transgender,Fun Facts For Transphobic Fundamentalists: Protect athe Children,1475298652.0,"{'created_utc': 1475273452, 'id': '55addy', 'num_comments': 0, 'score': 1, 'selftext': '[deleted]', 'subreddit': 'transgender', 'title': 'Fun Facts For Transphobic Fundamentalists: Protect athe Children', 'created': 1475298652.0}"
2016-09-30 22:12:14,55adla,0,13,,transgender,Fun Facts For Transphobic Fundamentalists: Protect The Children,1475298734.0,"{'created_utc': 1475273534, 'id': '55adla', 'num_comments': 0, 'score': 13, 'selftext': '', 'subreddit': 'transgender', 'title': 'Fun Facts For Transphobic Fundamentalists: Protect The Children', 'created': 1475298734.0}"
