created_utc,id,num_comments,score,selftext,subreddit,title,created,d_
2016-09-16 19:42:36,533pwb,8,0,,transgender,Transgender Video Game Characters: Super Mario's Birdo,1474080156.0,"{'created_utc': 1474054956, 'id': '533pwb', 'num_comments': 8, 'score': 0, 'selftext': '', 'subreddit': 'transgender', 'title': ""Transgender Video Game Characters: Super Mario's Birdo"", 'created': 1474080156.0}"
2016-09-17 02:58:19,535jcd,10,66,,transgender,"Trans Woman Murdered in Baltimore Is 21st This Year, Equaling 2015's Total",1474106299.0,"{'created_utc': 1474081099, 'id': '535jcd', 'num_comments': 10, 'score': 66, 'selftext': '', 'subreddit': 'transgender', 'title': ""Trans Woman Murdered in Baltimore Is 21st This Year, Equaling 2015's Total"", 'created': 1474106299.0}"
2016-09-17 03:28:19,535mxz,0,1,,transgender,http://www.gofundme.com/2nls9po,1474108099.0,"{'created_utc': 1474082899, 'id': '535mxz', 'num_comments': 0, 'score': 1, 'selftext': '', 'subreddit': 'transgender', 'title': 'http://www.gofundme.com/2nls9po', 'created': 1474108099.0}"
2016-09-17 05:43:36,5361xf,1,1,,transgender,Is Vivian from Paper Mario transgender?,1474116216.0,"{'created_utc': 1474091016, 'id': '5361xf', 'num_comments': 1, 'score': 1, 'selftext': '', 'subreddit': 'transgender', 'title': 'Is Vivian from Paper Mario transgender?', 'created': 1474116216.0}"
2016-09-17 10:36:45,536qaf,1,0,,transgender,'I'm transgender... can I join the Orange Order?' BBC journalist Peter Coulter meets a transgender woman living in Belfast.,1474133805.0,"{'created_utc': 1474108605, 'id': '536qaf', 'num_comments': 1, 'score': 0, 'selftext': '', 'subreddit': 'transgender', 'title': ""'I'm transgender... can I join the Orange Order?' BBC journalist Peter Coulter meets a transgender woman living in Belfast."", 'created': 1474133805.0}"
2016-09-17 16:22:15,537vyk,32,15,,transgender,Sigourney Weaver defend sex change horror flick at Toronto film festival,1474154535.0,"{'created_utc': 1474129335, 'id': '537vyk', 'num_comments': 32, 'score': 15, 'selftext': '', 'subreddit': 'transgender', 'title': 'Sigourney Weaver defend sex change horror flick at Toronto film festival', 'created': 1474154535.0}"
2016-09-17 17:03:45,5382ij,0,2,,transgender,Just wanted to share my friend's new vlog about transitioning as a teen.,1474157025.0,"{'created_utc': 1474131825, 'id': '5382ij', 'num_comments': 0, 'score': 2, 'selftext': '', 'subreddit': 'transgender', 'title': ""Just wanted to share my friend's new vlog about transitioning as a teen."", 'created': 1474157025.0}"
2016-09-17 20:58:08,539451,7,160,,transgender,"""12 Things I've Learned In The First Year With My Vagina""",1474171088.0,"{'created_utc': 1474145888, 'id': '539451', 'num_comments': 7, 'score': 160, 'selftext': '', 'subreddit': 'transgender', 'title': '""12 Things I\'ve Learned In The First Year With My Vagina""', 'created': 1474171088.0}"
2016-09-17 22:22:03,539gol,0,6,,transgender,India opens the doors of its fashion world to new era of trans models,1474176123.0,"{'created_utc': 1474150923, 'id': '539gol', 'num_comments': 0, 'score': 6, 'selftext': '', 'subreddit': 'transgender', 'title': 'India opens the doors of its fashion world to new era of trans models', 'created': 1474176123.0}"
2016-09-18 00:19:51,539x50,33,49,,transgender,Breaking: The Free Software Foundation dismissed a trans employee who was allegedly being harassed by a coworker,1474183191.0,"{'created_utc': 1474157991, 'id': '539x50', 'num_comments': 33, 'score': 49, 'selftext': '', 'subreddit': 'transgender', 'title': 'Breaking: The Free Software Foundation dismissed a trans employee who was allegedly being harassed by a coworker', 'created': 1474183191.0}"
2016-09-18 06:41:51,53b5a4,18,38,,transgender,Governor’s office: HB2 repeal possible if Charlotte drops LGBT ordinance first,1474206111.0,"{'created_utc': 1474180911, 'id': '53b5a4', 'num_comments': 18, 'score': 38, 'selftext': '', 'subreddit': 'transgender', 'title': 'Governor’s office: HB2 repeal possible if Charlotte drops LGBT ordinance first', 'created': 1474206111.0}"
2016-09-18 10:09:29,53blth,0,1,,transgender,CopperCab gets constructively destroyed,1474218569.0,"{'created_utc': 1474193369, 'id': '53blth', 'num_comments': 0, 'score': 1, 'selftext': '', 'subreddit': 'transgender', 'title': 'CopperCab gets constructively destroyed', 'created': 1474218569.0}"
2016-09-18 18:01:17,53dal3,13,72,,transgender,Police Misengender Transgender Woman Murdered in Chicago,1474246877.0,"{'created_utc': 1474221677, 'id': '53dal3', 'num_comments': 13, 'score': 72, 'selftext': '', 'subreddit': 'transgender', 'title': 'Police Misengender Transgender Woman Murdered in Chicago', 'created': 1474246877.0}"
2016-09-18 19:54:36,53dtxz,2,1,,transgender,Is Ronda Rousey a transgender?,1474253676.0,"{'created_utc': 1474228476, 'id': '53dtxz', 'num_comments': 2, 'score': 1, 'selftext': '', 'subreddit': 'transgender', 'title': 'Is Ronda Rousey a transgender?', 'created': 1474253676.0}"
2016-09-18 21:30:59,53ea0w,0,0,,transgender,"If we're not educating, who is?",1474259459.0,"{'created_utc': 1474234259, 'id': '53ea0w', 'num_comments': 0, 'score': 0, 'selftext': '', 'subreddit': 'transgender', 'title': ""If we're not educating, who is?"", 'created': 1474259459.0}"
2016-09-18 22:30:11,53ej7z,1,1,[deleted],transgender,Transition for the right reasons!,1474263011.0,"{'created_utc': 1474237811, 'id': '53ej7z', 'num_comments': 1, 'score': 1, 'selftext': '[deleted]', 'subreddit': 'transgender', 'title': 'Transition for the right reasons!', 'created': 1474263011.0}"
2016-09-19 03:13:23,53fp7n,1,1,[deleted],transgender,"My blog and my social non adult website for all transgender people. Free chat, blog and groups.",1474280003.0,"{'created_utc': 1474254803, 'id': '53fp7n', 'num_comments': 1, 'score': 1, 'selftext': '[deleted]', 'subreddit': 'transgender', 'title': 'My blog and my social non adult website for all transgender people. Free chat, blog and groups.', 'created': 1474280003.0}"
2016-09-19 07:03:35,53gezf,1,1,,transgender,TV looking for real in Hannover/Germany,1474293815.0,"{'created_utc': 1474268615, 'id': '53gezf', 'num_comments': 1, 'score': 1, 'selftext': '', 'subreddit': 'transgender', 'title': 'TV looking for real in Hannover/Germany', 'created': 1474293815.0}"
2016-09-19 09:37:15,53gsbw,27,0,,transgender,"An ambitious report on some of the science and medicine behind LGBT healthcare, Part Three: Gender Identity",1474303035.0,"{'created_utc': 1474277835, 'id': '53gsbw', 'num_comments': 27, 'score': 0, 'selftext': '', 'subreddit': 'transgender', 'title': 'An ambitious report on some of the science and medicine behind LGBT healthcare, Part Three: Gender Identity', 'created': 1474303035.0}"
2016-09-19 11:07:42,53h0ub,0,1,[deleted],transgender,"Interview: Ashley Altadonna and Helen Boyd talks crossdressing, queer, transgender",1474308462.0,"{'created_utc': 1474283262, 'id': '53h0ub', 'num_comments': 0, 'score': 1, 'selftext': '[deleted]', 'subreddit': 'transgender', 'title': 'Interview: Ashley Altadonna and Helen Boyd talks crossdressing, queer, transgender', 'created': 1474308462.0}"
2016-09-19 12:26:14,53haew,1,1,,transgender,Sunkee Angel - I Am Not A Label (Powerful video by trans artist),1474313174.0,"{'created_utc': 1474287974, 'id': '53haew', 'num_comments': 1, 'score': 1, 'selftext': '', 'subreddit': 'transgender', 'title': 'Sunkee Angel - I Am Not A Label (Powerful video by trans artist)', 'created': 1474313174.0}"
2016-09-19 12:31:16,53hb2p,0,4,,transgender,How Two Producers of ‘Transparent’ Made Their Own Trans Lives More Visible,1474313476.0,"{'created_utc': 1474288276, 'id': '53hb2p', 'num_comments': 0, 'score': 4, 'selftext': '', 'subreddit': 'transgender', 'title': 'How Two Producers of ‘Transparent’ Made Their Own Trans Lives More Visible', 'created': 1474313476.0}"
2016-09-19 13:53:15,53hn1b,1,1,,transgender,Are you a gender diverse (non-cisgender) parent? Would you be willing to answer some confidential questions about your life and about your family?,1474318395.0,"{'created_utc': 1474293195, 'id': '53hn1b', 'num_comments': 1, 'score': 1, 'selftext': '', 'subreddit': 'transgender', 'title': 'Are you a gender diverse (non-cisgender) parent? Would you be willing to answer some confidential questions about your life and about your family?', 'created': 1474318395.0}"
2016-09-19 14:16:20,53hqqf,9,27,[deleted],transgender,Navy requires all to undergo Transgender Education by July 2017,1474319780.0,"{'created_utc': 1474294580, 'id': '53hqqf', 'num_comments': 9, 'score': 27, 'selftext': '[deleted]', 'subreddit': 'transgender', 'title': 'Navy requires all to undergo Transgender Education by July 2017', 'created': 1474319780.0}"
2016-09-19 16:33:40,53if8j,28,18,,transgender,Transgender Fetishism and the Culture of Chasers | Transgender Universe,1474328020.0,"{'created_utc': 1474302820, 'id': '53if8j', 'num_comments': 28, 'score': 18, 'selftext': '', 'subreddit': 'transgender', 'title': 'Transgender Fetishism and the Culture of Chasers | Transgender Universe', 'created': 1474328020.0}"
2016-09-19 17:13:57,53imp6,0,1,[deleted],transgender,"Navy to Hold All-Hands Training, Webinars on New Transgender",1474330437.0,"{'created_utc': 1474305237, 'id': '53imp6', 'num_comments': 0, 'score': 1, 'selftext': '[deleted]', 'subreddit': 'transgender', 'title': 'Navy to Hold All-Hands Training, Webinars on New Transgender', 'created': 1474330437.0}"
2016-09-19 17:32:41,53iq5x,0,13,[deleted],transgender,India hires team of transgender traffic police,1474331561.0,"{'created_utc': 1474306361, 'id': '53iq5x', 'num_comments': 0, 'score': 13, 'selftext': '[deleted]', 'subreddit': 'transgender', 'title': 'India hires team of transgender traffic police', 'created': 1474331561.0}"
2016-09-19 17:34:22,53iqgp,0,10,[deleted],transgender,Navy Sailors to Undergo Transgender Education by July 2017,1474331662.0,"{'created_utc': 1474306462, 'id': '53iqgp', 'num_comments': 0, 'score': 10, 'selftext': '[deleted]', 'subreddit': 'transgender', 'title': 'Navy Sailors to Undergo Transgender Education by July 2017', 'created': 1474331662.0}"
2016-09-19 18:00:37,53iv8t,4,5,[deleted],transgender,NCAA Boycotts North Carolina to Protest State's Transgender Bathroom Laws,1474333237.0,"{'created_utc': 1474308037, 'id': '53iv8t', 'num_comments': 4, 'score': 5, 'selftext': '[deleted]', 'subreddit': 'transgender', 'title': ""NCAA Boycotts North Carolina to Protest State's Transgender Bathroom Laws"", 'created': 1474333237.0}"
2016-09-19 18:19:32,53iyrd,26,228,,transgender,"""Please give transgender talent a chance,"" says Jeffrey Tambor",1474334372.0,"{'created_utc': 1474309172, 'id': '53iyrd', 'num_comments': 26, 'score': 228, 'selftext': '', 'subreddit': 'transgender', 'title': '""Please give transgender talent a chance,"" says Jeffrey Tambor', 'created': 1474334372.0}"
2016-09-19 19:22:33,53jafh,0,1,[deleted],transgender,"Vancouver, Canada",1474338153.0,"{'created_utc': 1474312953, 'id': '53jafh', 'num_comments': 0, 'score': 1, 'selftext': '[deleted]', 'subreddit': 'transgender', 'title': 'Vancouver, Canada', 'created': 1474338153.0}"
2016-09-19 20:05:47,53jidj,0,29,,transgender,"Jeffery Tambor: ""Please Give Transgender Talent a Chance""",1474340747.0,"{'created_utc': 1474315547, 'id': '53jidj', 'num_comments': 0, 'score': 29, 'selftext': '', 'subreddit': 'transgender', 'title': 'Jeffery Tambor: ""Please Give Transgender Talent a Chance""', 'created': 1474340747.0}"
2016-09-19 20:34:05,53jnkk,12,9,,transgender,A New Front in the Religious Right's Fight Against Transgender People,1474342445.0,"{'created_utc': 1474317245, 'id': '53jnkk', 'num_comments': 12, 'score': 9, 'selftext': '', 'subreddit': 'transgender', 'title': ""A New Front in the Religious Right'\x80\x99s Fight Against Transgender People"", 'created': 1474342445.0}"
2016-09-20 00:07:32,53knsm,4,14,,transgender,"Take a look at my new website, QueerPortraits.com, where I've illustrated and researched 60 (so far) historical LGBTQ people",1474355252.0,"{'created_utc': 1474330052, 'id': '53knsm', 'num_comments': 4, 'score': 14, 'selftext': '', 'subreddit': 'transgender', 'title': ""Take a look at my new website, QueerPortraits.com, where I've illustrated and researched 60 (so far) historical LGBTQ people"", 'created': 1474355252.0}"
2016-09-20 01:53:44,53l4ax,5,0,,transgender,Transgender Love: Blaming Chasers Doesn't Solve a Thing,1474361624.0,"{'created_utc': 1474336424, 'id': '53l4ax', 'num_comments': 5, 'score': 0, 'selftext': '', 'subreddit': 'transgender', 'title': ""Transgender Love: Blaming Chasers Doesn't Solve a Thing"", 'created': 1474361624.0}"
2016-09-20 12:54:25,53n7cu,0,1,[deleted],transgender,Transgender soldier Chloe Allen is first woman on British Army frontlinE,1474401265.0,"{'created_utc': 1474376065, 'id': '53n7cu', 'num_comments': 0, 'score': 1, 'selftext': '[deleted]', 'subreddit': 'transgender', 'title': 'Transgender soldier Chloe Allen is first woman on British Army frontlinE', 'created': 1474401265.0}"
2016-09-20 12:57:17,53n7q2,7,33,,transgender,Transgender soldier Chloe Allen is first woman on British Army frontline,1474401437.0,"{'created_utc': 1474376237, 'id': '53n7q2', 'num_comments': 7, 'score': 33, 'selftext': '', 'subreddit': 'transgender', 'title': 'Transgender soldier Chloe Allen is first woman on British Army frontline', 'created': 1474401437.0}"
2016-09-20 14:26:08,53nlmh,0,6,[deleted],transgender,How to improve access to healthcare for transgender people in Europe?,1474406768.0,"{'created_utc': 1474381568, 'id': '53nlmh', 'num_comments': 0, 'score': 6, 'selftext': '[deleted]', 'subreddit': 'transgender', 'title': 'How to improve access to healthcare for transgender people in Europe?', 'created': 1474406768.0}"
2016-09-20 15:11:42,53ntcj,0,37,,transgender,Difficult People's Shakina Nayfack on Eliminating 'Transface' in Hollywood,1474409502.0,"{'created_utc': 1474384302, 'id': '53ntcj', 'num_comments': 0, 'score': 37, 'selftext': '', 'subreddit': 'transgender', 'title': ""Difficult People's Shakina Nayfack on Eliminating 'Transface' in Hollywood"", 'created': 1474409502.0}"
2016-09-20 15:43:14,53nz4u,4,75,,transgender,HUD Finalizes Rule to Ensure Shelters Protect Homeless Trans People,1474411394.0,"{'created_utc': 1474386194, 'id': '53nz4u', 'num_comments': 4, 'score': 75, 'selftext': '', 'subreddit': 'transgender', 'title': 'HUD Finalizes Rule to Ensure Shelters Protect Homeless Trans People', 'created': 1474411394.0}"
2016-09-20 16:19:07,53o5n2,0,1,,transgender,Transgender boy stabbed his mother,1474413547.0,"{'created_utc': 1474388347, 'id': '53o5n2', 'num_comments': 0, 'score': 1, 'selftext': '', 'subreddit': 'transgender', 'title': 'Transgender boy stabbed his mother', 'created': 1474413547.0}"
2016-09-20 16:32:57,53o894,0,2,,transgender,Pharmacology of Anti-Androgens (updated),1474414377.0,"{'created_utc': 1474389177, 'id': '53o894', 'num_comments': 0, 'score': 2, 'selftext': '', 'subreddit': 'transgender', 'title': 'Pharmacology of Anti-Androgens (updated)', 'created': 1474414377.0}"
2016-09-20 17:09:15,53of14,0,1,,transgender,Twitch 'speed run gamer' begins transitioning and streaming day to day life.,1474416555.0,"{'created_utc': 1474391355, 'id': '53of14', 'num_comments': 0, 'score': 1, 'selftext': '', 'subreddit': 'transgender', 'title': ""Twitch 'speed run gamer' begins transitioning and streaming day to day life."", 'created': 1474416555.0}"
2016-09-20 19:32:37,53p5o0,8,0,,transgender,Where to meet a real transexual woman. My blog and my social site,1474425157.0,"{'created_utc': 1474399957, 'id': '53p5o0', 'num_comments': 8, 'score': 0, 'selftext': '', 'subreddit': 'transgender', 'title': 'Where to meet a real transexual woman. My blog and my social site', 'created': 1474425157.0}"
2016-09-20 19:39:37,53p6ww,22,27,,transgender,[Out.com] Hormone Therapy is Lifesaving — But Why is No One Studying Its Long-Term Effects?,1474425577.0,"{'created_utc': 1474400377, 'id': '53p6ww', 'num_comments': 22, 'score': 27, 'selftext': '', 'subreddit': 'transgender', 'title': '[Out.com] Hormone Therapy is Lifesaving — But Why is No One Studying Its Long-Term Effects?', 'created': 1474425577.0}"
2016-09-20 21:10:07,53pnna,3,0,,transgender,Transgender Video Game Characters: Guilty Gear's Bridget,1474431007.0,"{'created_utc': 1474405807, 'id': '53pnna', 'num_comments': 3, 'score': 0, 'selftext': '', 'subreddit': 'transgender', 'title': ""Transgender Video Game Characters: Guilty Gear's Bridget"", 'created': 1474431007.0}"
2016-09-20 21:43:16,53pthu,0,1,[deleted],transgender,How I feel about my body hair.,1474432996.0,"{'created_utc': 1474407796, 'id': '53pthu', 'num_comments': 0, 'score': 1, 'selftext': '[deleted]', 'subreddit': 'transgender', 'title': 'How I feel about my body hair.', 'created': 1474432996.0}"
2016-09-21 02:13:06,53qziz,0,10,,transgender,South Georgia transgender community rallies for support,1474449186.0,"{'created_utc': 1474423986, 'id': '53qziz', 'num_comments': 0, 'score': 10, 'selftext': '', 'subreddit': 'transgender', 'title': 'South Georgia transgender community rallies for support', 'created': 1474449186.0}"
2016-09-21 02:14:23,53qzqj,0,7,,transgender,Transgender suit against Wisconsin school advances,1474449263.0,"{'created_utc': 1474424063, 'id': '53qzqj', 'num_comments': 0, 'score': 7, 'selftext': '', 'subreddit': 'transgender', 'title': 'Transgender suit against Wisconsin school advances', 'created': 1474449263.0}"
2016-09-21 03:28:29,53radh,0,12,,transgender,Comic Book Artists Create Publication to Honor Orlando Victims - NYTimes.com,1474453709.0,"{'created_utc': 1474428509, 'id': '53radh', 'num_comments': 0, 'score': 12, 'selftext': '', 'subreddit': 'transgender', 'title': 'Comic Book Artists Create Publication to Honor Orlando Victims - NYTimes.com', 'created': 1474453709.0}"
2016-09-21 07:37:25,53s2jq,20,0,,transgender,BB-8 is the First Transgender Star Wars Character,1474468645.0,"{'created_utc': 1474443445, 'id': '53s2jq', 'num_comments': 20, 'score': 0, 'selftext': '', 'subreddit': 'transgender', 'title': 'BB-8 is the First Transgender Star Wars Character', 'created': 1474468645.0}"
2016-09-21 08:03:48,53s4t7,11,48,,transgender,Sex-change surgery is now legal in the United Arab Emirates,1474470228.0,"{'created_utc': 1474445028, 'id': '53s4t7', 'num_comments': 11, 'score': 48, 'selftext': '', 'subreddit': 'transgender', 'title': 'Sex-change surgery is now legal in the United Arab Emirates', 'created': 1474470228.0}"
2016-09-21 08:31:57,53s78k,3,5,[deleted],transgender,"I came out to my parents yesterday with my therapist to help them understand. I then decided to find them resources by typing ""parents of transgender"" into Google and this is the first link that pops up 😡",1474471917.0,"{'created_utc': 1474446717, 'id': '53s78k', 'num_comments': 3, 'score': 5, 'selftext': '[deleted]', 'subreddit': 'transgender', 'title': 'I came out to my parents yesterday with my therapist to help them understand. I then decided to find them resources by typing ""parents of transgender"" into Google and this is the first link that pops up 😡', 'created': 1474471917.0}"
2016-09-21 12:10:34,53stl5,59,60,,transgender,Campaign wants transgender community to 'ask them first' before using restroom,1474485034.0,"{'created_utc': 1474459834, 'id': '53stl5', 'num_comments': 59, 'score': 60, 'selftext': '', 'subreddit': 'transgender', 'title': ""Campaign wants transgender community to 'ask them first' before using restroom"", 'created': 1474485034.0}"
2016-09-21 13:02:32,53t0m5,2,20,,transgender,First time in UAE history: Woman seeks legal route to sex change,1474488152.0,"{'created_utc': 1474462952, 'id': '53t0m5', 'num_comments': 2, 'score': 20, 'selftext': '', 'subreddit': 'transgender', 'title': 'First time in UAE history: Woman seeks legal route to sex change', 'created': 1474488152.0}"
2016-09-21 16:27:04,53u019,0,1,,transgender,Gender Non-Conformity and Non-Binary,1474500424.0,"{'created_utc': 1474475224, 'id': '53u019', 'num_comments': 0, 'score': 1, 'selftext': '', 'subreddit': 'transgender', 'title': 'Gender Non-Conformity and Non-Binary', 'created': 1474500424.0}"
2016-09-21 18:12:52,53ujyc,2,8,,transgender,"Alexis Arquette's Cause of Death Revealed, Actress Battled HIV for 29 Years",1474506772.0,"{'created_utc': 1474481572, 'id': '53ujyc', 'num_comments': 2, 'score': 8, 'selftext': '', 'subreddit': 'transgender', 'title': ""Alexis Arquette's Cause of Death Revealed, Actress Battled HIV for 29 Years"", 'created': 1474506772.0}"
2016-09-21 19:10:41,53uuoy,0,1,[deleted],transgender,Unbelievable transguy shows all!,1474510241.0,"{'created_utc': 1474485041, 'id': '53uuoy', 'num_comments': 0, 'score': 1, 'selftext': '[deleted]', 'subreddit': 'transgender', 'title': 'Unbelievable transguy shows all!', 'created': 1474510241.0}"
2016-09-21 20:41:23,53vb6b,5,103,,transgender,Federal judge rules Wisconsin school district must allow transgender student to use the restroom he wants,1474515683.0,"{'created_utc': 1474490483, 'id': '53vb6b', 'num_comments': 5, 'score': 103, 'selftext': '', 'subreddit': 'transgender', 'title': 'Federal judge rules Wisconsin school district must allow transgender student to use the restroom he wants', 'created': 1474515683.0}"
2016-09-21 21:01:38,53vesc,0,1,[deleted],transgender,FTM transition: 5 years on testosterone,1474516898.0,"{'created_utc': 1474491698, 'id': '53vesc', 'num_comments': 0, 'score': 1, 'selftext': '[deleted]', 'subreddit': 'transgender', 'title': 'FTM transition: 5 years on testosterone', 'created': 1474516898.0}"
2016-09-21 21:19:33,53vi04,5,32,,transgender,"Minneapolis police announce new transgender, gender nonconformity policy",1474517973.0,"{'created_utc': 1474492773, 'id': '53vi04', 'num_comments': 5, 'score': 32, 'selftext': '', 'subreddit': 'transgender', 'title': 'Minneapolis police announce new transgender, gender nonconformity policy', 'created': 1474517973.0}"
2016-09-22 01:24:09,53wlo2,0,1,,transgender,Trans Sex,1474532649.0,"{'created_utc': 1474507449, 'id': '53wlo2', 'num_comments': 0, 'score': 1, 'selftext': '', 'subreddit': 'transgender', 'title': 'Trans Sex', 'created': 1474532649.0}"
2016-09-22 01:24:54,53wlry,0,1,[deleted],transgender,An interesting article written in a feminist newsletter at my university,1474532694.0,"{'created_utc': 1474507494, 'id': '53wlry', 'num_comments': 0, 'score': 1, 'selftext': '[deleted]', 'subreddit': 'transgender', 'title': 'An interesting article written in a feminist newsletter at my university', 'created': 1474532694.0}"
2016-09-22 01:42:54,53wolh,0,1,[deleted],transgender,An interesting article about the hypocrisy of public figures and organizations that pursue anti-trans policy. It focuses on HB2. It was written in an online feminist newsletter at my university.,1474533774.0,"{'created_utc': 1474508574, 'id': '53wolh', 'num_comments': 0, 'score': 1, 'selftext': '[deleted]', 'subreddit': 'transgender', 'title': 'An interesting article about the hypocrisy of public figures and organizations that pursue anti-trans policy. It focuses on HB2. It was written in an online feminist newsletter at my university.', 'created': 1474533774.0}"
2016-09-22 02:37:28,53wwr9,0,1,,transgender,Trans Sex on YouTube channel Sexplanations (very 101),1474537048.0,"{'created_utc': 1474511848, 'id': '53wwr9', 'num_comments': 0, 'score': 1, 'selftext': '', 'subreddit': 'transgender', 'title': 'Trans Sex on YouTube channel Sexplanations (very 101)', 'created': 1474537048.0}"
2016-09-22 03:47:28,53x6yo,15,33,,transgender,Pentagon to Pay for Some Sex-Change Operations for Transgender Troops,1474541248.0,"{'created_utc': 1474516048, 'id': '53x6yo', 'num_comments': 15, 'score': 33, 'selftext': '', 'subreddit': 'transgender', 'title': 'Pentagon to Pay for Some Sex-Change Operations for Transgender Troops', 'created': 1474541248.0}"
2016-09-22 09:55:01,53y7ye,7,13,[deleted],transgender,She/he came before the Danish Girl,1474563301.0,"{'created_utc': 1474538101, 'id': '53y7ye', 'num_comments': 7, 'score': 13, 'selftext': '[deleted]', 'subreddit': 'transgender', 'title': 'She/he came before the Danish Girl', 'created': 1474563301.0}"
2016-09-22 10:34:50,53ybpp,0,1,,transgender,Pharmacology of Anti-Androgens V 2.0,1474565690.0,"{'created_utc': 1474540490, 'id': '53ybpp', 'num_comments': 0, 'score': 1, 'selftext': '', 'subreddit': 'transgender', 'title': 'Pharmacology of Anti-Androgens V 2.0', 'created': 1474565690.0}"
2016-09-22 16:47:33,53zwbh,1,21,,transgender,Joseph Lobdell: Tragedy and Triumph | Being Trans in the 19th Century,1474588053.0,"{'created_utc': 1474562853, 'id': '53zwbh', 'num_comments': 1, 'score': 21, 'selftext': '', 'subreddit': 'transgender', 'title': 'Joseph Lobdell: Tragedy and Triumph | Being Trans in the 19th Century', 'created': 1474588053.0}"
2016-09-22 17:04:25,53zzdq,16,57,,transgender,Kristin Beck Harassed by the TSA | Transgender Universe,1474589065.0,"{'created_utc': 1474563865, 'id': '53zzdq', 'num_comments': 16, 'score': 57, 'selftext': '', 'subreddit': 'transgender', 'title': 'Kristin Beck Harassed by the TSA | Transgender Universe', 'created': 1474589065.0}"
2016-09-22 21:00:35,54170t,13,83,,transgender,The First Sex Toy for Trans Men Is Here,1474603235.0,"{'created_utc': 1474578035, 'id': '54170t', 'num_comments': 13, 'score': 83, 'selftext': '', 'subreddit': 'transgender', 'title': 'The First Sex Toy for Trans Men Is Here', 'created': 1474603235.0}"
2016-09-22 21:52:19,541fzw,12,0,,transgender,[The Federalist] Pushing Kids Into Transgenderism Is Medical Malpractice,1474606339.0,"{'created_utc': 1474581139, 'id': '541fzw', 'num_comments': 12, 'score': 0, 'selftext': '', 'subreddit': 'transgender', 'title': '[The Federalist] Pushing Kids Into Transgenderism Is Medical Malpractice', 'created': 1474606339.0}"
