created_utc,id,num_comments,score,selftext,subreddit,title,created,d_
2016-09-01 01:11:00,50knel,0,8,,transgender,"Tony Pontes is my hero! Mississauga, Brampton and Caledon Ontario high schools have some all-gender washrooms now.",1472717460.0,"{'created_utc': 1472692260, 'id': '50knel', 'num_comments': 0, 'score': 8, 'selftext': '', 'subreddit': 'transgender', 'title': 'Tony Pontes is my hero! Mississauga, Brampton and Caledon Ontario high schools have some all-gender washrooms now.', 'created': 1472717460.0}"
2016-09-01 01:25:42,50kpti,0,3,,transgender,Sketchy Pharmacies Are Selling Hormones to Transgender People,1472718342.0,"{'created_utc': 1472693142, 'id': '50kpti', 'num_comments': 0, 'score': 3, 'selftext': '', 'subreddit': 'transgender', 'title': 'Sketchy Pharmacies Are Selling Hormones to Transgender People', 'created': 1472718342.0}"
2016-09-01 02:51:02,50l3du,12,69,,transgender,Video Games Allow Characters More Varied Sexual Identities,1472723462.0,"{'created_utc': 1472698262, 'id': '50l3du', 'num_comments': 12, 'score': 69, 'selftext': '', 'subreddit': 'transgender', 'title': 'Video Games Allow Characters More Varied Sexual Identities', 'created': 1472723462.0}"
2016-09-01 03:02:34,50l52b,0,1,,transgender,Home Inspection Carolina,1472724154.0,"{'created_utc': 1472698954, 'id': '50l52b', 'num_comments': 0, 'score': 1, 'selftext': '', 'subreddit': 'transgender', 'title': 'Home Inspection Carolina', 'created': 1472724154.0}"
2016-09-01 11:59:40,50mt41,1,7,,transgender,Holy Bullies and Headless Monsters: This is transgender,1472756380.0,"{'created_utc': 1472731180, 'id': '50mt41', 'num_comments': 1, 'score': 7, 'selftext': '', 'subreddit': 'transgender', 'title': 'Holy Bullies and Headless Monsters: This is transgender', 'created': 1472756380.0}"
2016-09-01 15:01:09,50nlse,48,70,,transgender,WHO reevaluating classification of transgender identity as a mental disorder,1472767269.0,"{'created_utc': 1472742069, 'id': '50nlse', 'num_comments': 48, 'score': 70, 'selftext': '', 'subreddit': 'transgender', 'title': 'WHO reevaluating classification of transgender identity as a mental disorder', 'created': 1472767269.0}"
2016-09-01 17:12:55,50ob1j,9,6,,transgender,DOJ releases transgender sensitivity training video for law enforcement,1472775175.0,"{'created_utc': 1472749975, 'id': '50ob1j', 'num_comments': 9, 'score': 6, 'selftext': '', 'subreddit': 'transgender', 'title': 'DOJ releases transgender sensitivity training video for law enforcement', 'created': 1472775175.0}"
2016-09-01 17:33:13,50of8w,1,5,,transgender,"LGBTQ+ research organization searching for LGBTQ+ individuals to participate in a focus group discussion in Durham NC, and Big Horn County, Wyoming",1472776393.0,"{'created_utc': 1472751193, 'id': '50of8w', 'num_comments': 1, 'score': 5, 'selftext': '', 'subreddit': 'transgender', 'title': 'LGBTQ+ research organization searching for LGBTQ+ individuals to participate in a focus group discussion in Durham NC, and Big Horn County, Wyoming', 'created': 1472776393.0}"
2016-09-01 22:44:27,50q0u9,1,50,,transgender,Transgender Pregnancy: The Making of a New American Family,1472795067.0,"{'created_utc': 1472769867, 'id': '50q0u9', 'num_comments': 1, 'score': 50, 'selftext': '', 'subreddit': 'transgender', 'title': 'Transgender Pregnancy: The Making of a New American Family', 'created': 1472795067.0}"
2016-09-01 23:34:00,50q9ad,0,1,[deleted],transgender,"Maybe you've already seen it a thousand times, but it still amazes me to see just how true a single photo can be.",1472798040.0,"{'created_utc': 1472772840, 'id': '50q9ad', 'num_comments': 0, 'score': 1, 'selftext': '[deleted]', 'subreddit': 'transgender', 'title': ""Maybe you've already seen it a thousand times, but it still amazes me to see just how true a single photo can be."", 'created': 1472798040.0}"
2016-09-02 02:52:12,50r419,0,28,,transgender,"Matt Bomer and Men Who Play Transgender Women Send a ""Toxic and Dangerous"" Message (Guest Column)",1472809932.0,"{'created_utc': 1472784732, 'id': '50r419', 'num_comments': 0, 'score': 28, 'selftext': '', 'subreddit': 'transgender', 'title': 'Matt Bomer and Men Who Play Transgender Women Send a ""Toxic and Dangerous"" Message (Guest Column)', 'created': 1472809932.0}"
2016-09-02 02:52:35,50r434,11,66,,transgender,Actress Jen Richards just nailed the problem with casting cisgender actors in trans roles,1472809955.0,"{'created_utc': 1472784755, 'id': '50r434', 'num_comments': 11, 'score': 66, 'selftext': '', 'subreddit': 'transgender', 'title': 'Actress Jen Richards just nailed the problem with casting cisgender actors in trans roles', 'created': 1472809955.0}"
2016-09-02 08:38:28,50s9sq,0,7,,transgender,"Bravery | Angie’s 4th Fight – A Kathoey, Transgender Fighter",1472830708.0,"{'created_utc': 1472805508, 'id': '50s9sq', 'num_comments': 0, 'score': 7, 'selftext': '', 'subreddit': 'transgender', 'title': 'Bravery | Angie’s 4th Fight – A Kathoey, Transgender Fighter', 'created': 1472830708.0}"
2016-09-02 12:03:00,50svb9,7,11,,transgender,Holy Bullies and Headless Monsters: New anti-lgbt 'study' latest in religious right habit of cherry-picking science,1472842980.0,"{'created_utc': 1472817780, 'id': '50svb9', 'num_comments': 7, 'score': 11, 'selftext': '', 'subreddit': 'transgender', 'title': ""Holy Bullies and Headless Monsters: New anti-lgbt 'study' latest in religious right habit of cherry-picking science"", 'created': 1472842980.0}"
2016-09-02 12:07:48,50svwz,0,1,[deleted],transgender,"Daniel Zagorski , Talks to Liz about being a young Transexual man.",1472843268.0,"{'created_utc': 1472818068, 'id': '50svwz', 'num_comments': 0, 'score': 1, 'selftext': '[deleted]', 'subreddit': 'transgender', 'title': 'Daniel Zagorski , Talks to Liz about being a young Transexual man.', 'created': 1472843268.0}"
2016-09-02 12:15:55,50sx0t,0,1,,transgender,Sex Change Operations in Mexico with Best SRS Transgender Tourism,1472843755.0,"{'created_utc': 1472818555, 'id': '50sx0t', 'num_comments': 0, 'score': 1, 'selftext': '', 'subreddit': 'transgender', 'title': 'Sex Change Operations in Mexico with Best SRS Transgender Tourism', 'created': 1472843755.0}"
2016-09-02 14:56:33,50tmg8,76,157,,transgender,"Donald Trump has spent his campaign threatening to undo crucial protections for LGBTQ people in the United States, vowing to appoint judges to the Supreme Court to turn back the legalization of same-sex marriage and supporting state-sanctioned discrimination against transgender people.",1472853393.0,"{'created_utc': 1472828193, 'id': '50tmg8', 'num_comments': 76, 'score': 157, 'selftext': '', 'subreddit': 'transgender', 'title': 'Donald Trump has spent his campaign threatening to undo crucial protections for LGBTQ people in the United States, vowing to appoint judges to the Supreme Court to turn back the legalization of same-sex marriage and supporting state-sanctioned discrimination against transgender people.', 'created': 1472853393.0}"
2016-09-02 16:50:39,50u74m,4,68,,transgender,"So... this happened, HuffPo wrote an article about me: ""This Trans Activist Wants To Change Mexico By Promoting Self-Love""",1472860239.0,"{'created_utc': 1472835039, 'id': '50u74m', 'num_comments': 4, 'score': 68, 'selftext': '', 'subreddit': 'transgender', 'title': 'So... this happened, HuffPo wrote an article about me: ""This Trans Activist Wants To Change Mexico By Promoting Self-Love""', 'created': 1472860239.0}"
2016-09-02 17:00:49,50u8yc,4,7,,transgender,At Work in Two Genders - Observations from accomplished trans women about power and leadership in the office,1472860849.0,"{'created_utc': 1472835649, 'id': '50u8yc', 'num_comments': 4, 'score': 7, 'selftext': '', 'subreddit': 'transgender', 'title': 'At Work in Two Genders - Observations from accomplished trans women about power and leadership in the office', 'created': 1472860849.0}"
2016-09-02 17:17:25,50uc3a,14,47,,transgender,Hollywood needs to stop casting cis men in trans roles,1472861845.0,"{'created_utc': 1472836645, 'id': '50uc3a', 'num_comments': 14, 'score': 47, 'selftext': '', 'subreddit': 'transgender', 'title': 'Hollywood needs to stop casting cis men in trans roles', 'created': 1472861845.0}"
2016-09-02 17:23:12,50ud5b,0,7,,transgender,A Primer on Hollywood Transploitation,1472862192.0,"{'created_utc': 1472836992, 'id': '50ud5b', 'num_comments': 0, 'score': 7, 'selftext': '', 'subreddit': 'transgender', 'title': 'A Primer on Hollywood Transploitation', 'created': 1472862192.0}"
2016-09-02 17:37:42,50ufy8,2,1,,transgender,Not just transgender - a story of hope,1472863062.0,"{'created_utc': 1472837862, 'id': '50ufy8', 'num_comments': 2, 'score': 1, 'selftext': '', 'subreddit': 'transgender', 'title': 'Not just transgender - a story of hope', 'created': 1472863062.0}"
2016-09-02 22:01:02,50vrfp,11,8,,transgender,"The Problem with ""Gender Identity""",1472878862.0,"{'created_utc': 1472853662, 'id': '50vrfp', 'num_comments': 11, 'score': 8, 'selftext': '', 'subreddit': 'transgender', 'title': 'The Problem with ""Gender Identity""', 'created': 1472878862.0}"
2016-09-03 00:36:54,50wfte,4,3,,transgender,Cities With the Largest Transgender Populations,1472888214.0,"{'created_utc': 1472863014, 'id': '50wfte', 'num_comments': 4, 'score': 3, 'selftext': '', 'subreddit': 'transgender', 'title': 'Cities With the Largest Transgender Populations', 'created': 1472888214.0}"
2016-09-03 05:54:16,50xkjh,1,0,,transgender,My Trasition MTF/25/9 Months HRT,1472907256.0,"{'created_utc': 1472882056, 'id': '50xkjh', 'num_comments': 1, 'score': 0, 'selftext': '', 'subreddit': 'transgender', 'title': 'My Trasition MTF/25/9 Months HRT', 'created': 1472907256.0}"
2016-09-03 15:40:04,50zbz2,10,56,,transgender,"A county commissioner in Maryland wants to ""look out"" for transgender kids by acting like they aren't transgender. He doesn't want trans-students to participate in single-sex athletic teams, use locker rooms and bathrooms or sleep in overnight situations consistent with his/her identified gender.",1472942404.0,"{'created_utc': 1472917204, 'id': '50zbz2', 'num_comments': 10, 'score': 56, 'selftext': '', 'subreddit': 'transgender', 'title': 'A county commissioner in Maryland wants to ""look out"" for transgender kids by acting like they aren\'t transgender. He doesn\'t want trans-students to participate in single-sex athletic teams, use locker rooms and bathrooms or sleep in overnight situations consistent with his/her identified gender.', 'created': 1472942404.0}"
2016-09-03 20:12:50,510kdo,0,20,,transgender,Trial over North Carolina's trans bathroom law delayed,1472958770.0,"{'created_utc': 1472933570, 'id': '510kdo', 'num_comments': 0, 'score': 20, 'selftext': '', 'subreddit': 'transgender', 'title': ""Trial over North Carolina's trans bathroom law delayed"", 'created': 1472958770.0}"
2016-09-04 00:59:03,511r79,36,78,,transgender,Radical Feminists and Conservative Christians Team Up Against Transgender People,1472975943.0,"{'created_utc': 1472950743, 'id': '511r79', 'num_comments': 36, 'score': 78, 'selftext': '', 'subreddit': 'transgender', 'title': 'Radical Feminists and Conservative Christians Team Up Against Transgender People', 'created': 1472975943.0}"
2016-09-04 19:31:49,515jtp,16,64,,transgender,Texas attorney general dines with 8-year-old transgender boy,1473042709.0,"{'created_utc': 1473017509, 'id': '515jtp', 'num_comments': 16, 'score': 64, 'selftext': '', 'subreddit': 'transgender', 'title': 'Texas attorney general dines with 8-year-old transgender boy', 'created': 1473042709.0}"
2016-09-05 03:16:47,517i3f,5,5,,transgender,Trans Travel Advice: How To Be Safe While Traveling,1473070607.0,"{'created_utc': 1473045407, 'id': '517i3f', 'num_comments': 5, 'score': 5, 'selftext': '', 'subreddit': 'transgender', 'title': 'Trans Travel Advice: How To Be Safe While Traveling', 'created': 1473070607.0}"
2016-09-05 07:43:17,518dv9,10,36,,transgender,Detransition: Stop this buzzword,1473086597.0,"{'created_utc': 1473061397, 'id': '518dv9', 'num_comments': 10, 'score': 36, 'selftext': '', 'subreddit': 'transgender', 'title': 'Detransition: Stop this buzzword', 'created': 1473086597.0}"
2016-09-05 09:18:13,518mga,28,0,,transgender,Survey of female detransition and reidentification: results and analysis,1473092293.0,"{'created_utc': 1473067093, 'id': '518mga', 'num_comments': 28, 'score': 0, 'selftext': '', 'subreddit': 'transgender', 'title': 'Survey of female detransition and reidentification: results and analysis', 'created': 1473092293.0}"
2016-09-05 16:35:19,51a8a1,6,21,,transgender,"High court getting pulled into transgender bathroom wars. At least five cases related to the joint guidance the Education Department and the Department of Justice released in May on bathroom use are making their way through the courts, with one case out of Virginia already before the high court.",1473118519.0,"{'created_utc': 1473093319, 'id': '51a8a1', 'num_comments': 6, 'score': 21, 'selftext': '', 'subreddit': 'transgender', 'title': 'High court getting pulled into transgender bathroom wars. At least five cases related to the joint guidance the Education Department and the Department of Justice released in May on bathroom use are making their way through the courts, with one case out of Virginia already before the high court.', 'created': 1473118519.0}"
2016-09-05 17:58:41,51angx,12,37,,transgender,Exposing the Transgender Hate Machine | Transgender Universe,1473123521.0,"{'created_utc': 1473098321, 'id': '51angx', 'num_comments': 12, 'score': 37, 'selftext': '', 'subreddit': 'transgender', 'title': 'Exposing the Transgender Hate Machine | Transgender Universe', 'created': 1473123521.0}"
2016-09-05 19:49:34,51b73a,14,47,,transgender,The High Cost Of Being Transgender,1473130174.0,"{'created_utc': 1473104974, 'id': '51b73a', 'num_comments': 14, 'score': 47, 'selftext': '', 'subreddit': 'transgender', 'title': 'The High Cost Of Being Transgender', 'created': 1473130174.0}"
2016-09-05 20:08:35,51baby,0,1,,transgender,Laci Green Hates Female to Male Transgender People? Really?!,1473131315.0,"{'created_utc': 1473106115, 'id': '51baby', 'num_comments': 0, 'score': 1, 'selftext': '', 'subreddit': 'transgender', 'title': 'Laci Green Hates Female to Male Transgender People? Really?!', 'created': 1473131315.0}"
2016-09-05 20:08:45,51bacs,0,1,[deleted],transgender,2 Drag performers were assaulted following a Pride event in Olympia Wa - Capital City Pride - Timeline,1473131325.0,"{'created_utc': 1473106125, 'id': '51bacs', 'num_comments': 0, 'score': 1, 'selftext': '[deleted]', 'subreddit': 'transgender', 'title': '2 Drag performers were assaulted following a Pride event in Olympia Wa - Capital City Pride - Timeline', 'created': 1473131325.0}"
2016-09-05 23:23:30,51c8hc,26,42,,transgender,Montana car dealer posts video online saying he would remove Trans individuals from his restrooms,1473143010.0,"{'created_utc': 1473117810, 'id': '51c8hc', 'num_comments': 26, 'score': 42, 'selftext': '', 'subreddit': 'transgender', 'title': 'Montana car dealer posts video online saying he would remove Trans individuals from his restrooms', 'created': 1473143010.0}"
2016-09-06 05:23:03,51dp82,0,1,[deleted],transgender,And um... well this happened... (x-posted from /r/facepalm),1473164583.0,"{'created_utc': 1473139383, 'id': '51dp82', 'num_comments': 0, 'score': 1, 'selftext': '[deleted]', 'subreddit': 'transgender', 'title': 'And um... well this happened... (x-posted from /r/facepalm)', 'created': 1473164583.0}"
2016-09-06 11:42:47,51es46,13,13,,transgender,"The Horrible Way Colors ""Shakti"" Represents Transgender People",1473187367.0,"{'created_utc': 1473162167, 'id': '51es46', 'num_comments': 13, 'score': 13, 'selftext': '', 'subreddit': 'transgender', 'title': 'The Horrible Way Colors ""Shakti"" Represents Transgender People', 'created': 1473187367.0}"
2016-09-07 04:05:56,51jf69,0,2,[deleted],transgender,Please help me with my thesis survey on HPV and anal cancer with a raffle included at the end! (15 minutes),1473246356.0,"{'created_utc': 1473221156, 'id': '51jf69', 'num_comments': 0, 'score': 2, 'selftext': '[deleted]', 'subreddit': 'transgender', 'title': 'Please help me with my thesis survey on HPV and anal cancer with a raffle included at the end! (15 minutes)', 'created': 1473246356.0}"
2016-09-07 11:06:59,51kpr6,0,1,[deleted],transgender,"Transgender in tech: Inclusion, with limits",1473271619.0,"{'created_utc': 1473246419, 'id': '51kpr6', 'num_comments': 0, 'score': 1, 'selftext': '[deleted]', 'subreddit': 'transgender', 'title': 'Transgender in tech: Inclusion, with limits', 'created': 1473271619.0}"
2016-09-07 13:00:44,51l4lz,27,150,[deleted],transgender,84% support legislation protecting gender identity from discrimination in Canadian Human Rights Act,1473278444.0,"{'created_utc': 1473253244, 'id': '51l4lz', 'num_comments': 27, 'score': 150, 'selftext': '[deleted]', 'subreddit': 'transgender', 'title': '84% support legislation protecting gender identity from discrimination in Canadian Human Rights Act', 'created': 1473278444.0}"
2016-09-07 14:42:24,51lkzm,1,1,,transgender,"Diane Ehrensaft, ""The Gender Creative Child: Pathways for Nurturing and Supporting Children Who Live Outside Gender Boxes"" (The Experiment, 2016)",1473284544.0,"{'created_utc': 1473259344, 'id': '51lkzm', 'num_comments': 1, 'score': 1, 'selftext': '', 'subreddit': 'transgender', 'title': 'Diane Ehrensaft, ""The Gender Creative Child: Pathways for Nurturing and Supporting Children Who Live Outside Gender Boxes"" (The Experiment, 2016)', 'created': 1473284544.0}"
2016-09-07 16:14:25,51m1qy,0,22,,transgender,New Life of Bria!,1473290065.0,"{'created_utc': 1473264865, 'id': '51m1qy', 'num_comments': 0, 'score': 22, 'selftext': '', 'subreddit': 'transgender', 'title': 'New Life of Bria!', 'created': 1473290065.0}"
2016-09-07 17:16:27,51mde8,2,0,,transgender,'Transgender' Ken Doll Cake Results in Backlash,1473293787.0,"{'created_utc': 1473268587, 'id': '51mde8', 'num_comments': 2, 'score': 0, 'selftext': '', 'subreddit': 'transgender', 'title': ""'Transgender' Ken Doll Cake Results in Backlash"", 'created': 1473293787.0}"
2016-09-07 18:54:55,51mvid,9,27,,transgender,Desperate Gov. McCrory attacks trans teens in new ad aimed at saving his flailing NC campaign,1473299695.0,"{'created_utc': 1473274495, 'id': '51mvid', 'num_comments': 9, 'score': 27, 'selftext': '', 'subreddit': 'transgender', 'title': 'Desperate Gov. McCrory attacks trans teens in new ad aimed at saving his flailing NC campaign', 'created': 1473299695.0}"
2016-09-07 19:18:14,51mzr8,16,41,,transgender,No Transgender Characters in Top 100 Grossing Films Says USC Study | Transgender Universe,1473301094.0,"{'created_utc': 1473275894, 'id': '51mzr8', 'num_comments': 16, 'score': 41, 'selftext': '', 'subreddit': 'transgender', 'title': 'No Transgender Characters in Top 100 Grossing Films Says USC Study | Transgender Universe', 'created': 1473301094.0}"
2016-09-07 19:53:26,51n6it,0,1,,transgender,Transmen &amp; transwomen share their experiences with hormones.,1473303206.0,"{'created_utc': 1473278006, 'id': '51n6it', 'num_comments': 0, 'score': 1, 'selftext': '', 'subreddit': 'transgender', 'title': 'Transmen &amp; transwomen share their experiences with hormones.', 'created': 1473303206.0}"
2016-09-07 21:10:32,51nlje,1,4,,transgender,7 Companies that Have Embraced the Transgender Community,1473307832.0,"{'created_utc': 1473282632, 'id': '51nlje', 'num_comments': 1, 'score': 4, 'selftext': '', 'subreddit': 'transgender', 'title': '7 Companies that Have Embraced the Transgender Community', 'created': 1473307832.0}"
2016-09-07 23:58:23,51oeue,2,9,,transgender,A Trans Child Takes Center Stage in the Moving Short Doc Pink Boy,1473317903.0,"{'created_utc': 1473292703, 'id': '51oeue', 'num_comments': 2, 'score': 9, 'selftext': '', 'subreddit': 'transgender', 'title': 'A Trans Child Takes Center Stage in the Moving Short Doc Pink Boy', 'created': 1473317903.0}"
2016-09-08 00:40:22,51olou,0,3,,transgender,Transgender hockey policies launch in Ontario,1473320422.0,"{'created_utc': 1473295222, 'id': '51olou', 'num_comments': 0, 'score': 3, 'selftext': '', 'subreddit': 'transgender', 'title': 'Transgender hockey policies launch in Ontario', 'created': 1473320422.0}"
2016-09-08 02:19:03,51p1lm,0,11,,transgender,Lessons From a Life in Two Genders,1473326343.0,"{'created_utc': 1473301143, 'id': '51p1lm', 'num_comments': 0, 'score': 11, 'selftext': '', 'subreddit': 'transgender', 'title': 'Lessons From a Life in Two Genders', 'created': 1473326343.0}"
2016-09-08 03:03:29,51p8gt,4,26,,transgender,Transgender inmate sues Greene County Sheriff's Office,1473329009.0,"{'created_utc': 1473303809, 'id': '51p8gt', 'num_comments': 4, 'score': 26, 'selftext': '', 'subreddit': 'transgender', 'title': ""Transgender inmate sues Greene County Sheriff's Office"", 'created': 1473329009.0}"
2016-09-08 13:46:04,51rd7s,0,1,,transgender,Whoopi Goldberg just earned a ton of respect from me. Props for Colbert for having her on to talk about this on his show.,1473367564.0,"{'created_utc': 1473342364, 'id': '51rd7s', 'num_comments': 0, 'score': 1, 'selftext': '', 'subreddit': 'transgender', 'title': 'Whoopi Goldberg just earned a ton of respect from me. Props for Colbert for having her on to talk about this on his show.', 'created': 1473367564.0}"
2016-09-08 17:32:43,51shjf,2,1,,transgender,Mental Health and Gender Identity Survey (Crossposted from r/LGBT),1473381163.0,"{'created_utc': 1473355963, 'id': '51shjf', 'num_comments': 2, 'score': 1, 'selftext': '', 'subreddit': 'transgender', 'title': 'Mental Health and Gender Identity Survey (Crossposted from r/LGBT)', 'created': 1473381163.0}"
2016-09-08 18:34:49,51stlq,0,23,,transgender,A beautiful short doc about young gender-creative boy from Palm Springs 2015,1473384889.0,"{'created_utc': 1473359689, 'id': '51stlq', 'num_comments': 0, 'score': 23, 'selftext': '', 'subreddit': 'transgender', 'title': 'A beautiful short doc about young gender-creative boy from Palm Springs 2015', 'created': 1473384889.0}"
2016-09-08 19:21:03,51t2j7,15,15,[deleted],transgender,Way to go guys. Not super tone-deaf or anything. Real good joke -_-,1473387663.0,"{'created_utc': 1473362463, 'id': '51t2j7', 'num_comments': 15, 'score': 15, 'selftext': '[deleted]', 'subreddit': 'transgender', 'title': 'Way to go guys. Not super tone-deaf or anything. Real good joke -_-', 'created': 1473387663.0}"
2016-09-08 22:49:44,51u4uq,11,0,,transgender,Michelle Rodriguez's Latest Movie is Upsetting Millions in LGBTQ Community,1473400184.0,"{'created_utc': 1473374984, 'id': '51u4uq', 'num_comments': 11, 'score': 0, 'selftext': '', 'subreddit': 'transgender', 'title': ""Michelle Rodriguez's Latest Movie is Upsetting Millions in LGBTQ Community"", 'created': 1473400184.0}"
2016-09-08 23:30:04,51ubnl,0,1,,transgender,"Cis woman goes for ""FFS"" and BA",1473402604.0,"{'created_utc': 1473377404, 'id': '51ubnl', 'num_comments': 0, 'score': 1, 'selftext': '', 'subreddit': 'transgender', 'title': 'Cis woman goes for ""FFS"" and BA', 'created': 1473402604.0}"
2016-09-09 04:43:00,51vo8d,24,65,,transgender,The Personality Characteristic That Predicts Transphobia,1473421380.0,"{'created_utc': 1473396180, 'id': '51vo8d', 'num_comments': 24, 'score': 65, 'selftext': '', 'subreddit': 'transgender', 'title': 'The Personality Characteristic That Predicts Transphobia', 'created': 1473421380.0}"
2016-09-09 05:42:58,51vvqr,8,7,,transgender,How Trans Players Find Support from the Gaming Community | VICE | United States,1473424978.0,"{'created_utc': 1473399778, 'id': '51vvqr', 'num_comments': 8, 'score': 7, 'selftext': '', 'subreddit': 'transgender', 'title': 'How Trans Players Find Support from the Gaming Community | VICE | United States', 'created': 1473424978.0}"
2016-09-09 10:44:48,51wrq0,0,1,[deleted],transgender,Story of Transgender Chelsea Attonley suffers from gender dysphoria and has spent her life struggling to know if she is a woman trapped in a man’s body or the other way around.,1473443088.0,"{'created_utc': 1473417888, 'id': '51wrq0', 'num_comments': 0, 'score': 1, 'selftext': '[deleted]', 'subreddit': 'transgender', 'title': 'Story of Transgender Chelsea Attonley suffers from gender dysphoria and has spent her life struggling to know if she is a woman trapped in a man’s body or the other way around.', 'created': 1473443088.0}"
2016-09-09 11:44:26,51wyn7,10,38,,transgender,This Is What It Felt Like When My Daughter Became My Son,1473446666.0,"{'created_utc': 1473421466, 'id': '51wyn7', 'num_comments': 10, 'score': 38, 'selftext': '', 'subreddit': 'transgender', 'title': 'This Is What It Felt Like When My Daughter Became My Son', 'created': 1473446666.0}"
2016-09-09 12:38:35,51x5z5,2,0,,transgender,YES – You can be anything you want to be,1473449915.0,"{'created_utc': 1473424715, 'id': '51x5z5', 'num_comments': 2, 'score': 0, 'selftext': '', 'subreddit': 'transgender', 'title': 'YES – You can be anything you want to be', 'created': 1473449915.0}"
2016-09-09 17:08:03,51yh6x,5,20,,transgender,Magdalene Visaggio on the Problem with Cis Creators Writing Trans Narratives,1473466083.0,"{'created_utc': 1473440883, 'id': '51yh6x', 'num_comments': 5, 'score': 20, 'selftext': '', 'subreddit': 'transgender', 'title': 'Magdalene Visaggio on the Problem with Cis Creators Writing Trans Narratives', 'created': 1473466083.0}"
2016-09-09 17:53:45,51ypo3,1,1,,transgender,Help a trans kid out,1473468825.0,"{'created_utc': 1473443625, 'id': '51ypo3', 'num_comments': 1, 'score': 1, 'selftext': '', 'subreddit': 'transgender', 'title': 'Help a trans kid out', 'created': 1473468825.0}"
2016-09-09 19:09:14,51z3ol,0,1,,transgender,Saw this on another subreddit. Curious what you all think...,1473473354.0,"{'created_utc': 1473448154, 'id': '51z3ol', 'num_comments': 0, 'score': 1, 'selftext': '', 'subreddit': 'transgender', 'title': 'Saw this on another subreddit. Curious what you all think...', 'created': 1473473354.0}"
