created_utc,id,num_comments,score,selftext,subreddit,title,created,d_
2016-09-09 21:24:24,51zrtv,39,196,,transgender,Chelsea Manning begins hunger strike: 'I need help',1473481464.0,"{'created_utc': 1473456264, 'id': '51zrtv', 'num_comments': 39, 'score': 196, 'selftext': '', 'subreddit': 'transgender', 'title': ""Chelsea Manning begins hunger strike: 'I need help'"", 'created': 1473481464.0}"
2016-09-09 22:18:24,5201ak,20,0,,transgender,7 Badass Transgender Video Game Characters,1473484704.0,"{'created_utc': 1473459504, 'id': '5201ak', 'num_comments': 20, 'score': 0, 'selftext': '', 'subreddit': 'transgender', 'title': '7 Badass Transgender Video Game Characters', 'created': 1473484704.0}"
2016-09-09 23:04:46,52095u,1,17,,transgender,Chelsea Manning Starts Hunger Strike,1473487486.0,"{'created_utc': 1473462286, 'id': '52095u', 'num_comments': 1, 'score': 17, 'selftext': '', 'subreddit': 'transgender', 'title': 'Chelsea Manning Starts Hunger Strike', 'created': 1473487486.0}"
2016-09-10 02:15:43,5211yp,8,5,,transgender,Life of Bria (makes a really good point),1473498943.0,"{'created_utc': 1473473743, 'id': '5211yp', 'num_comments': 8, 'score': 5, 'selftext': '', 'subreddit': 'transgender', 'title': 'Life of Bria (makes a really good point)', 'created': 1473498943.0}"
2016-09-10 03:43:10,521dss,1,1,,transgender,TRANS-HATER ATTACKS WITH LOADED GUN - SHOTS FIRED - CAUGHT ON CAMERA,1473504190.0,"{'created_utc': 1473478990, 'id': '521dss', 'num_comments': 1, 'score': 1, 'selftext': '', 'subreddit': 'transgender', 'title': 'TRANS-HATER ATTACKS WITH LOADED GUN - SHOTS FIRED - CAUGHT ON CAMERA', 'created': 1473504190.0}"
2016-09-10 17:05:05,5240r8,0,1,,transgender,Someone created a transgender kids character... Meet Guy the ladybug...,1473552305.0,"{'created_utc': 1473527105, 'id': '5240r8', 'num_comments': 0, 'score': 1, 'selftext': '', 'subreddit': 'transgender', 'title': 'Someone created a transgender kids character... Meet Guy the ladybug...', 'created': 1473552305.0}"
2016-09-10 21:49:30,525d7a,0,1,,transgender,i found this video online and first it triggered me but then i realized how relatable it was who feels the same way? ;-;,1473569370.0,"{'created_utc': 1473544170, 'id': '525d7a', 'num_comments': 0, 'score': 1, 'selftext': '', 'subreddit': 'transgender', 'title': 'i found this video online and first it triggered me but then i realized how relatable it was who feels the same way? ;-;', 'created': 1473569370.0}"
2016-09-10 22:05:22,525fr5,16,0,,transgender,"When trans people become parents, who gets called mother?",1473570322.0,"{'created_utc': 1473545122, 'id': '525fr5', 'num_comments': 16, 'score': 0, 'selftext': '', 'subreddit': 'transgender', 'title': 'When trans people become parents, who gets called mother?', 'created': 1473570322.0}"
2016-09-11 00:25:13,5260x2,20,49,,transgender,Why Won't Hollywood Cast Trans Actors in Starring Roles?,1473578713.0,"{'created_utc': 1473553513, 'id': '5260x2', 'num_comments': 20, 'score': 49, 'selftext': '', 'subreddit': 'transgender', 'title': ""Why Won't Hollywood Cast Trans Actors in Starring Roles?"", 'created': 1473578713.0}"
2016-09-11 04:59:27,5273ig,0,1,,transgender,Transgender Blogger Speaks Out on Islamophobia,1473595167.0,"{'created_utc': 1473569967, 'id': '5273ig', 'num_comments': 0, 'score': 1, 'selftext': '', 'subreddit': 'transgender', 'title': 'Transgender Blogger Speaks Out on Islamophobia', 'created': 1473595167.0}"
2016-09-11 14:51:00,528tx6,28,77,,transgender,New Lawsuit Demonizes Transgender Girl For Acting Like A Girl,1473630660.0,"{'created_utc': 1473605460, 'id': '528tx6', 'num_comments': 28, 'score': 77, 'selftext': '', 'subreddit': 'transgender', 'title': 'New Lawsuit Demonizes Transgender Girl For Acting Like A Girl', 'created': 1473630660.0}"
2016-09-11 15:06:04,528wb4,1,1,[deleted],transgender,Gender Isn't Just a Social Construct: Why gender roles are more complicated than you think,1473631564.0,"{'created_utc': 1473606364, 'id': '528wb4', 'num_comments': 1, 'score': 1, 'selftext': '[deleted]', 'subreddit': 'transgender', 'title': ""Gender Isn't Just a Social Construct: Why gender roles are more complicated than you think"", 'created': 1473631564.0}"
2016-09-11 16:33:59,529bhq,48,122,,transgender,Whoopi Goldberg explains why it’s weird to ask trans people about their junk,1473636839.0,"{'created_utc': 1473611639, 'id': '529bhq', 'num_comments': 48, 'score': 122, 'selftext': '', 'subreddit': 'transgender', 'title': 'Whoopi Goldberg explains why it’s weird to ask trans people about their junk', 'created': 1473636839.0}"
2016-09-11 17:06:58,529hhj,1,7,,transgender,"Trans star of ‘Midnight’, The Lady Chablis, dies aged 59",1473638818.0,"{'created_utc': 1473613618, 'id': '529hhj', 'num_comments': 1, 'score': 7, 'selftext': '', 'subreddit': 'transgender', 'title': 'Trans star of ‘Midnight’, The Lady Chablis, dies aged 59', 'created': 1473638818.0}"
2016-09-11 19:22:53,52a64n,11,17,,transgender,Alexis Arquette Has Died (cw: misgendering),1473646973.0,"{'created_utc': 1473621773, 'id': '52a64n', 'num_comments': 11, 'score': 17, 'selftext': '', 'subreddit': 'transgender', 'title': 'Alexis Arquette Has Died (cw: misgendering)', 'created': 1473646973.0}"
2016-09-11 21:12:02,52apzs,0,1,,transgender,Trans Woman Speaks Out on Islamophobia,1473653522.0,"{'created_utc': 1473628322, 'id': '52apzs', 'num_comments': 0, 'score': 1, 'selftext': '', 'subreddit': 'transgender', 'title': 'Trans Woman Speaks Out on Islamophobia', 'created': 1473653522.0}"
2016-09-12 03:41:19,52cgiz,2,23,,transgender,Transgender Actress Alexis Arquette Dead At 47,1473676879.0,"{'created_utc': 1473651679, 'id': '52cgiz', 'num_comments': 2, 'score': 23, 'selftext': '', 'subreddit': 'transgender', 'title': 'Transgender Actress Alexis Arquette Dead At 47', 'created': 1473676879.0}"
2016-09-12 06:19:51,52czbs,0,1,[deleted],transgender,Transgender Foundation of America.,1473686391.0,"{'created_utc': 1473661191, 'id': '52czbs', 'num_comments': 0, 'score': 1, 'selftext': '[deleted]', 'subreddit': 'transgender', 'title': 'Transgender Foundation of America.', 'created': 1473686391.0}"
2016-09-12 06:29:56,52d0bq,0,1,[deleted],transgender,How transgender people get treated online. This happened to me. After I told him the truth in the first sentence.,1473686996.0,"{'created_utc': 1473661796, 'id': '52d0bq', 'num_comments': 0, 'score': 1, 'selftext': '[deleted]', 'subreddit': 'transgender', 'title': 'How transgender people get treated online. This happened to me. After I told him the truth in the first sentence.', 'created': 1473686996.0}"
2016-09-12 09:01:27,52dffa,0,1,,transgender,Transgender actress Alexis Arquette has died at 47,1473696087.0,"{'created_utc': 1473670887, 'id': '52dffa', 'num_comments': 0, 'score': 1, 'selftext': '', 'subreddit': 'transgender', 'title': 'Transgender actress Alexis Arquette has died at 47', 'created': 1473696087.0}"
2016-09-12 10:58:13,52drgq,0,1,,transgender,Please take the U.S. Transgender Survey 2016,1473703093.0,"{'created_utc': 1473677893, 'id': '52drgq', 'num_comments': 0, 'score': 1, 'selftext': '', 'subreddit': 'transgender', 'title': 'Please take the U.S. Transgender Survey 2016', 'created': 1473703093.0}"
2016-09-12 12:04:54,52dzfx,0,1,[deleted],transgender,"Transgender actress Alexis Arquette, of the Arquette acting family, is dead",1473707094.0,"{'created_utc': 1473681894, 'id': '52dzfx', 'num_comments': 0, 'score': 1, 'selftext': '[deleted]', 'subreddit': 'transgender', 'title': 'Transgender actress Alexis Arquette, of the Arquette acting family, is dead', 'created': 1473707094.0}"
2016-09-12 13:42:32,52edji,7,75,,transgender,"People who cannot tolerate ambiguity are more likely to be transphobic, research report says",1473712952.0,"{'created_utc': 1473687752, 'id': '52edji', 'num_comments': 7, 'score': 75, 'selftext': '', 'subreddit': 'transgender', 'title': 'People who cannot tolerate ambiguity are more likely to be transphobic, research report says', 'created': 1473712952.0}"
2016-09-12 15:43:41,52eyz4,2,1,,transgender,"Human sperm grown in lab for the first time, study claims",1473720221.0,"{'created_utc': 1473695021, 'id': '52eyz4', 'num_comments': 2, 'score': 1, 'selftext': '', 'subreddit': 'transgender', 'title': 'Human sperm grown in lab for the first time, study claims', 'created': 1473720221.0}"
2016-09-12 16:42:59,52fa1b,3,3,,transgender,My Suporn GRS Diary - Surgery tomorrow,1473723779.0,"{'created_utc': 1473698579, 'id': '52fa1b', 'num_comments': 3, 'score': 3, 'selftext': '', 'subreddit': 'transgender', 'title': 'My Suporn GRS Diary - Surgery tomorrow', 'created': 1473723779.0}"
2016-09-12 19:29:03,52g650,0,5,,transgender,Alissah Brooks Discusses Her New Song with TRANZGENDR,1473733743.0,"{'created_utc': 1473708543, 'id': '52g650', 'num_comments': 0, 'score': 5, 'selftext': '', 'subreddit': 'transgender', 'title': 'Alissah Brooks Discusses Her New Song with TRANZGENDR', 'created': 1473733743.0}"
2016-09-12 21:50:58,52gx8a,14,138,,transgender,"New Life of Bria (A so very common experience, so very empowering.)",1473742258.0,"{'created_utc': 1473717058, 'id': '52gx8a', 'num_comments': 14, 'score': 138, 'selftext': '', 'subreddit': 'transgender', 'title': 'New Life of Bria (A so very common experience, so very empowering.)', 'created': 1473742258.0}"
2016-09-12 22:08:04,52h0ev,9,4,,transgender,Why I Fear the Laser | Transgender Universe,1473743284.0,"{'created_utc': 1473718084, 'id': '52h0ev', 'num_comments': 9, 'score': 4, 'selftext': '', 'subreddit': 'transgender', 'title': 'Why I Fear the Laser | Transgender Universe', 'created': 1473743284.0}"
2016-09-13 00:50:31,52hs1o,1,2,,transgender,Pride School Opens in Atlanta for Trans Students,1473753031.0,"{'created_utc': 1473727831, 'id': '52hs1o', 'num_comments': 1, 'score': 2, 'selftext': '', 'subreddit': 'transgender', 'title': 'Pride School Opens in Atlanta for Trans Students', 'created': 1473753031.0}"
2016-09-13 01:08:53,52hv4i,0,1,,transgender,Are you packing?,1473754133.0,"{'created_utc': 1473728933, 'id': '52hv4i', 'num_comments': 0, 'score': 1, 'selftext': '', 'subreddit': 'transgender', 'title': 'Are you packing?', 'created': 1473754133.0}"
2016-09-13 01:11:53,52hvmr,13,0,,transgender,Transgender Video Games Characters: Street Fighter's Poison,1473754313.0,"{'created_utc': 1473729113, 'id': '52hvmr', 'num_comments': 13, 'score': 0, 'selftext': '', 'subreddit': 'transgender', 'title': ""Transgender Video Games Characters: Street Fighter's Poison"", 'created': 1473754313.0}"
2016-09-13 01:40:56,52i0d1,0,14,,transgender,Another ‘My Wife Is Trans’ Story,1473756056.0,"{'created_utc': 1473730856, 'id': '52i0d1', 'num_comments': 0, 'score': 14, 'selftext': '', 'subreddit': 'transgender', 'title': 'Another ‘My Wife Is Trans’ Story', 'created': 1473756056.0}"
2016-09-13 05:23:35,52ivz6,17,58,,transgender,"NCAA Moves Championship Events From North Carolina, Citing Anti-LGBT Law",1473769415.0,"{'created_utc': 1473744215, 'id': '52ivz6', 'num_comments': 17, 'score': 58, 'selftext': '', 'subreddit': 'transgender', 'title': 'NCAA Moves Championship Events From North Carolina, Citing Anti-LGBT Law', 'created': 1473769415.0}"
2016-09-13 06:04:45,52j0o2,0,5,,transgender,Transgender woman slain in Chicago's Garfield Park is 20th transgender killing this year,1473771885.0,"{'created_utc': 1473746685, 'id': '52j0o2', 'num_comments': 0, 'score': 5, 'selftext': '', 'subreddit': 'transgender', 'title': ""Transgender woman slain in Chicago's Garfield Park is 20th transgender killing this year"", 'created': 1473771885.0}"
2016-09-13 07:04:48,52j6wl,1,1,,transgender,Klitty or slitty??,1473775488.0,"{'created_utc': 1473750288, 'id': '52j6wl', 'num_comments': 1, 'score': 1, 'selftext': '', 'subreddit': 'transgender', 'title': 'Klitty or slitty??', 'created': 1473775488.0}"
2016-09-13 07:35:48,52ja4f,0,19,,transgender,Alexis Arquette Died of an AIDS / HIV Related Illness,1473777348.0,"{'created_utc': 1473752148, 'id': '52ja4f', 'num_comments': 0, 'score': 19, 'selftext': '', 'subreddit': 'transgender', 'title': 'Alexis Arquette Died of an AIDS / HIV Related Illness', 'created': 1473777348.0}"
2016-09-13 11:49:09,52k10u,0,1,,transgender,"Hello! I just turned 18 and I'm going to college soon, and I would really love to buy a realiable, safe binder that I can use pretty much everyday. I wasn't able to get one due to always being with my parents, but now that I'm moving out, it's the perfect oppurtunity. Anything helps, thank you!!!",1473792549.0,"{'created_utc': 1473767349, 'id': '52k10u', 'num_comments': 0, 'score': 1, 'selftext': '', 'subreddit': 'transgender', 'title': ""Hello! I just turned 18 and I'm going to college soon, and I would really love to buy a realiable, safe binder that I can use pretty much everyday. I wasn't able to get one due to always being with my parents, but now that I'm moving out, it's the perfect oppurtunity. Anything helps, thank you!!!"", 'created': 1473792549.0}"
2016-09-13 17:33:01,52lqp2,0,36,,transgender,How Two Producers of ‘Transparent’ Made Their Own Trans Lives More Visible,1473813181.0,"{'created_utc': 1473787981, 'id': '52lqp2', 'num_comments': 0, 'score': 36, 'selftext': '', 'subreddit': 'transgender', 'title': 'How Two Producers of ‘Transparent’ Made Their Own Trans Lives More Visible', 'created': 1473813181.0}"
2016-09-13 19:10:28,52macd,1,6,,transgender,Transgender Books for Kids and Teens,1473819028.0,"{'created_utc': 1473793828, 'id': '52macd', 'num_comments': 1, 'score': 6, 'selftext': '', 'subreddit': 'transgender', 'title': 'Transgender Books for Kids and Teens', 'created': 1473819028.0}"
2016-09-13 21:08:50,52mxg5,1,1,[deleted],transgender,Hope for trans women to one day carry a child.,1473826130.0,"{'created_utc': 1473800930, 'id': '52mxg5', 'num_comments': 1, 'score': 1, 'selftext': '[deleted]', 'subreddit': 'transgender', 'title': 'Hope for trans women to one day carry a child.', 'created': 1473826130.0}"
2016-09-13 21:23:06,52n02p,1,1,,transgender,Using skin cells instead of eggs to make embryos.,1473826986.0,"{'created_utc': 1473801786, 'id': '52n02p', 'num_comments': 1, 'score': 1, 'selftext': '', 'subreddit': 'transgender', 'title': 'Using skin cells instead of eggs to make embryos.', 'created': 1473826986.0}"
2016-09-14 00:47:03,52nyif,62,201,,transgender,"Chelsea Manning will receive gender transition surgery, lawyer says",1473839223.0,"{'created_utc': 1473814023, 'id': '52nyif', 'num_comments': 62, 'score': 201, 'selftext': '', 'subreddit': 'transgender', 'title': 'Chelsea Manning will receive gender transition surgery, lawyer says', 'created': 1473839223.0}"
2016-09-14 05:06:43,52oz4w,3,22,,transgender,First NC Republican lawmaker calls for repeal of House Bill 2,1473854803.0,"{'created_utc': 1473829603, 'id': '52oz4w', 'num_comments': 3, 'score': 22, 'selftext': '', 'subreddit': 'transgender', 'title': 'First NC Republican lawmaker calls for repeal of House Bill 2', 'created': 1473854803.0}"
2016-09-14 06:17:07,52p6o6,2,19,,transgender,Chelsea Manning Wins the Right to Transition After Hunger Strike,1473859027.0,"{'created_utc': 1473833827, 'id': '52p6o6', 'num_comments': 2, 'score': 19, 'selftext': '', 'subreddit': 'transgender', 'title': 'Chelsea Manning Wins the Right to Transition After Hunger Strike', 'created': 1473859027.0}"
2016-09-14 08:05:53,52pgxa,3,9,,transgender,Victorian Liberal MP Louise Staley under fire for transphobic comments - Star Observer,1473865553.0,"{'created_utc': 1473840353, 'id': '52pgxa', 'num_comments': 3, 'score': 9, 'selftext': '', 'subreddit': 'transgender', 'title': 'Victorian Liberal MP Louise Staley under fire for transphobic comments - Star Observer', 'created': 1473865553.0}"
2016-09-14 11:46:47,52q24k,4,8,[deleted],transgender,Percentage of pregancies among adolescent trans mirrors percentage among non-trans,1473878807.0,"{'created_utc': 1473853607, 'id': '52q24k', 'num_comments': 4, 'score': 8, 'selftext': '[deleted]', 'subreddit': 'transgender', 'title': 'Percentage of pregancies among adolescent trans mirrors percentage among non-trans', 'created': 1473878807.0}"
2016-09-14 12:26:06,52q7dd,19,62,,transgender,Judge Tells Trans Man To 'Pick A Name I Can Live With',1473881166.0,"{'created_utc': 1473855966, 'id': '52q7dd', 'num_comments': 19, 'score': 62, 'selftext': '', 'subreddit': 'transgender', 'title': ""Judge Tells Trans Man To 'Pick A Name I Can Live With'"", 'created': 1473881166.0}"
2016-09-14 16:06:08,52r7s2,0,1,,transgender,Transgender Serbian army veteran celebrates new identity as woman,1473894368.0,"{'created_utc': 1473869168, 'id': '52r7s2', 'num_comments': 0, 'score': 1, 'selftext': '', 'subreddit': 'transgender', 'title': 'Transgender Serbian army veteran celebrates new identity as woman', 'created': 1473894368.0}"
2016-09-14 17:18:14,52rkp6,197,153,,transgender,"Jill Stein on Twitter: ""Glad @xychelsea is getting gender confirmation surgery. Let's #PardonChelsea + move to trans-inclusive single-payer.""",1473898694.0,"{'created_utc': 1473873494, 'id': '52rkp6', 'num_comments': 197, 'score': 153, 'selftext': '', 'subreddit': 'transgender', 'title': 'Jill Stein on Twitter: ""Glad @xychelsea is getting gender confirmation surgery. Let\'s #PardonChelsea + move to trans-inclusive single-payer.""', 'created': 1473898694.0}"
2016-09-14 18:21:06,52rw5i,11,13,,transgender,Will NCAA decision be the tipping point for North Carolina's anti-LGBT law?,1473902466.0,"{'created_utc': 1473877266, 'id': '52rw5i', 'num_comments': 11, 'score': 13, 'selftext': '', 'subreddit': 'transgender', 'title': ""Will NCAA decision be the tipping point for North Carolina's anti-LGBT law?"", 'created': 1473902466.0}"
2016-09-14 18:21:43,52rw9g,3,29,,transgender,California launches program to get transgender people jobs,1473902503.0,"{'created_utc': 1473877303, 'id': '52rw9g', 'num_comments': 3, 'score': 29, 'selftext': '', 'subreddit': 'transgender', 'title': 'California launches program to get transgender people jobs', 'created': 1473902503.0}"
2016-09-14 18:56:03,52s2rd,5,44,,transgender,ACC to move its championships out of North Carolina due to HB2,1473904563.0,"{'created_utc': 1473879363, 'id': '52s2rd', 'num_comments': 5, 'score': 44, 'selftext': '', 'subreddit': 'transgender', 'title': 'ACC to move its championships out of North Carolina due to HB2', 'created': 1473904563.0}"
2016-09-14 18:57:11,52s2ye,6,12,,transgender,Indiana won't let transgender man change name,1473904631.0,"{'created_utc': 1473879431, 'id': '52s2ye', 'num_comments': 6, 'score': 12, 'selftext': '', 'subreddit': 'transgender', 'title': ""Indiana won't let transgender man change name"", 'created': 1473904631.0}"
2016-09-14 23:25:41,52tdg4,5,47,,transgender,Transgender Actress Jen Richards Cast in 'Nashville',1473920741.0,"{'created_utc': 1473895541, 'id': '52tdg4', 'num_comments': 5, 'score': 47, 'selftext': '', 'subreddit': 'transgender', 'title': ""Transgender Actress Jen Richards Cast in 'Nashville'"", 'created': 1473920741.0}"
2016-09-15 04:44:49,52umcn,0,1,,transgender,Australian university research to improve cosmetic surgery outcomes,1473939889.0,"{'created_utc': 1473914689, 'id': '52umcn', 'num_comments': 0, 'score': 1, 'selftext': '', 'subreddit': 'transgender', 'title': 'Australian university research to improve cosmetic surgery outcomes', 'created': 1473939889.0}"
2016-09-15 05:36:19,52us0d,16,15,,transgender,Why is North Carolina making sexual assault easier?,1473942979.0,"{'created_utc': 1473917779, 'id': '52us0d', 'num_comments': 16, 'score': 15, 'selftext': '', 'subreddit': 'transgender', 'title': 'Why is North Carolina making sexual assault easier?', 'created': 1473942979.0}"
2016-09-15 11:52:25,52vrlm,1,1,,transgender,An Indian Transgender Beauty All Set For 'The Miss International Beauty Pageant',1473965545.0,"{'created_utc': 1473940345, 'id': '52vrlm', 'num_comments': 1, 'score': 1, 'selftext': '', 'subreddit': 'transgender', 'title': ""An Indian Transgender Beauty All Set For 'The Miss International Beauty Pageant'"", 'created': 1473965545.0}"
2016-09-15 17:11:49,52x7wd,1,1,,transgender,"#GenderProud: ""I want to help others live their truth without shame and terror.""",1473984709.0,"{'created_utc': 1473959509, 'id': '52x7wd', 'num_comments': 1, 'score': 1, 'selftext': '', 'subreddit': 'transgender', 'title': '#GenderProud: ""I want to help others live their truth without shame and terror.""', 'created': 1473984709.0}"
2016-09-15 17:52:59,52xf8u,0,1,[deleted],transgender,"An Open Letter to the Tween Girl's Clothing Store, Justice",1473987179.0,"{'created_utc': 1473961979, 'id': '52xf8u', 'num_comments': 0, 'score': 1, 'selftext': '[deleted]', 'subreddit': 'transgender', 'title': ""An Open Letter to the Tween Girl's Clothing Store, Justice"", 'created': 1473987179.0}"
2016-09-15 18:00:02,52xggw,15,1,,transgender,Don’t Get Bogged Down With Choosing Your New Name,1473987602.0,"{'created_utc': 1473962402, 'id': '52xggw', 'num_comments': 15, 'score': 1, 'selftext': '', 'subreddit': 'transgender', 'title': 'Don’t Get Bogged Down With Choosing Your New Name', 'created': 1473987602.0}"
2016-09-15 18:07:57,52xhzt,29,104,,transgender,"An Open Letter To Justice, The Tween Girls' Clothing Store",1473988077.0,"{'created_utc': 1473962877, 'id': '52xhzt', 'num_comments': 29, 'score': 104, 'selftext': '', 'subreddit': 'transgender', 'title': ""An Open Letter To Justice, The Tween Girls' Clothing Store"", 'created': 1473988077.0}"
2016-09-15 21:19:19,52yh46,5,36,,transgender,"Alexis Arquette's Ex-Lover Sells Sex Tape to xHamster, Porn Company Destroys All Copies",1473999559.0,"{'created_utc': 1473974359, 'id': '52yh46', 'num_comments': 5, 'score': 36, 'selftext': '', 'subreddit': 'transgender', 'title': ""Alexis Arquette's Ex-Lover Sells Sex Tape to xHamster, Porn Company Destroys All Copies"", 'created': 1473999559.0}"
2016-09-15 21:59:12,52yo4e,72,171,,transgender,Julian Assange Offers to Surrender to U.S. if Chelsea Manning Is Released,1474001952.0,"{'created_utc': 1473976752, 'id': '52yo4e', 'num_comments': 72, 'score': 171, 'selftext': '', 'subreddit': 'transgender', 'title': 'Julian Assange Offers to Surrender to U.S. if Chelsea Manning Is Released', 'created': 1474001952.0}"
2016-09-15 22:03:54,52yozg,3,18,,transgender,Gender Isn't Just a Social Construct,1474002234.0,"{'created_utc': 1473977034, 'id': '52yozg', 'num_comments': 3, 'score': 18, 'selftext': '', 'subreddit': 'transgender', 'title': ""Gender Isn't Just a Social Construct"", 'created': 1474002234.0}"
2016-09-15 22:30:34,52yti3,1,6,,transgender,Transgender 7th Grader Inspires All in School Board Speech | Transgender Universe,1474003834.0,"{'created_utc': 1473978634, 'id': '52yti3', 'num_comments': 1, 'score': 6, 'selftext': '', 'subreddit': 'transgender', 'title': 'Transgender 7th Grader Inspires All in School Board Speech | Transgender Universe', 'created': 1474003834.0}"
2016-09-16 00:00:41,52z7un,5,4,,transgender,Was loudmouth Ted Cruz dumbstruck when confronted by Caitlyn Jenner on the Hill?,1474009241.0,"{'created_utc': 1473984041, 'id': '52z7un', 'num_comments': 5, 'score': 4, 'selftext': '', 'subreddit': 'transgender', 'title': 'Was loudmouth Ted Cruz dumbstruck when confronted by Caitlyn Jenner on the Hill?', 'created': 1474009241.0}"
2016-09-16 00:03:39,52z8b3,1,3,,transgender,Speculating about Alexis Arquette's gender does no one any good,1474009419.0,"{'created_utc': 1473984219, 'id': '52z8b3', 'num_comments': 1, 'score': 3, 'selftext': '', 'subreddit': 'transgender', 'title': ""Speculating about Alexis Arquette's gender does no one any good"", 'created': 1474009419.0}"
2016-09-16 02:17:11,52zsbo,18,50,,transgender,"Transgender woman stabbed 119 times, Navy seaman trainee charged",1474017431.0,"{'created_utc': 1473992231, 'id': '52zsbo', 'num_comments': 18, 'score': 50, 'selftext': '', 'subreddit': 'transgender', 'title': 'Transgender woman stabbed 119 times, Navy seaman trainee charged', 'created': 1474017431.0}"
2016-09-16 05:02:12,530dyd,1,3,,transgender,Growing up trans,1474027332.0,"{'created_utc': 1474002132, 'id': '530dyd', 'num_comments': 1, 'score': 3, 'selftext': '', 'subreddit': 'transgender', 'title': 'Growing up trans', 'created': 1474027332.0}"
2016-09-16 08:21:05,530xka,0,1,,transgender,Coming out as Transgender on Newswatch 99,1474039265.0,"{'created_utc': 1474014065, 'id': '530xka', 'num_comments': 0, 'score': 1, 'selftext': '', 'subreddit': 'transgender', 'title': 'Coming out as Transgender on Newswatch 99', 'created': 1474039265.0}"
2016-09-16 16:02:50,532m06,0,1,,transgender,[VIDEO]:(Re)Assignment? Hollywood We Can and Should Do Better.,1474066970.0,"{'created_utc': 1474041770, 'id': '532m06', 'num_comments': 0, 'score': 1, 'selftext': '', 'subreddit': 'transgender', 'title': '[VIDEO]:(Re)Assignment? Hollywood We Can and Should Do Better.', 'created': 1474066970.0}"
2016-09-16 16:27:40,532qiu,1,3,,transgender,"Alexis Arquette, transgender activist and actress, dies at 47",1474068460.0,"{'created_utc': 1474043260, 'id': '532qiu', 'num_comments': 1, 'score': 3, 'selftext': '', 'subreddit': 'transgender', 'title': 'Alexis Arquette, transgender activist and actress, dies at 47', 'created': 1474068460.0}"
2016-09-16 16:45:45,532tt2,25,130,,transgender,"Comic about first transgender superhero released recently, will show transition.",1474069545.0,"{'created_utc': 1474044345, 'id': '532tt2', 'num_comments': 25, 'score': 130, 'selftext': '', 'subreddit': 'transgender', 'title': 'Comic about first transgender superhero released recently, will show transition.', 'created': 1474069545.0}"
2016-09-16 17:39:21,5333nd,0,10,,transgender,Dear Mark Ruffalo: Casting trans actors – G-TV News,1474072761.0,"{'created_utc': 1474047561, 'id': '5333nd', 'num_comments': 0, 'score': 10, 'selftext': '', 'subreddit': 'transgender', 'title': 'Dear Mark Ruffalo: Casting trans actors – G-TV News', 'created': 1474072761.0}"
