created_utc,id,num_comments,score,selftext,subreddit,title,created,d_
2020-02-14 12:34:28,f3rkcu,0,1,"Dear poets and writers of r/NonBinaryTalk,

I'm from a writers’ resources company called [Winning Writers](http://www.winningwriters.com/).    Part of our mission is to find and promote voices and themes    underrepresented in publishing,  including (but of course not limited   to) racial, cultural, national, religious, gender/sexual identity, body   positive, and \[dis\]abled. I’m  posting here specifically because our   long term goal is to change the  composition of our entry pool to   include more entries featuring diverse  characters and themes. These   voices need to be heard, and we are  actively reaching out to find them.

We are currently looking for new talent in humor poetry, short fiction and essay:

[The Wergle Flomp Humor Poetry Contest](https://winningwriters.com/our-contests/wergle-flomp-humor-poetry-contest-free)offers a first prize of $1000, a second prize of $250, and ten    honorable mentions of $100 each. Entrants are invited to submit humor    poetry on any theme. The top twelve entries will be published online.    The contest is international and the deadline is April 1. The contest is    free to enter.

[The Tom Howard/John H. Reid Fiction &amp; Essay Contest](https://winningwriters.com/our-contests/tom-howard-john-h-reid-fiction-essay-contest)offers a two first prizes of $3,000 each (up from $2,000 last year,)   as  well as ten honorable mentions of $200 each. Entrants are invited  to   submit short fiction and essays on any topic. The top twelve  entries   will be published online. The contest is international and the  deadline   is April 30th. The fee for the contest is $20.

We    started implementing a policy of reaching out specifically to groups    dedicated to connecting/celebrating underrepresented voices a couple  of   years ago, and I'm glad to say that we have seen our entry levels  from   these communities rise. We'll be continuing with this effort in  order  to  keep trying to get as many people into the national and   international  conversation on literature as we can.

Sometimes    when I post, there are some replies worried about a scam, so in order    to head that off I just want to say that our competitions are listed  by   The Write Life as some of the [top writing competitions out there](https://thewritelife.com/writing-contests/), and we’re in Writer’s Digest’s [top eight sites for writers](https://www.writersdigest.com/online-editor/top-websites-for-writers-best-publishing-marketing-resources). Besides contests, we also offer a lot of [free publishing and style resources](https://winningwriters.com/resources), including a [database of free poetry and prose competitions](https://winningwriters.com/the-best-free-literary-contests), at [https://winningwriters.com/](https://winningwriters.com/). And of course, stop by our subreddit for daily submissions opportunities worldwide, [r/literarycontests](https://www.reddit.com/r/literarycontests).

I    know this isn't a writing sub per se, but there are a lot of talented    people here and I just wanted to reach out in case anyone was looking    for an opportunity like this. Thanks for listening, and have a good  day.",NonBinaryTalk,Creating opportunities for NonBinary poets and writers to be heard,1581708868.0,"{'created_utc': 1581683668, 'id': 'f3rkcu', 'num_comments': 0, 'score': 1, 'selftext': ""Dear poets and writers of r/NonBinaryTalk,\n\nI'm from a writers’ resources company called [Winning Writers](http://www.winningwriters.com/).    Part of our mission is to find and promote voices and themes    underrepresented in publishing,  including (but of course not limited   to) racial, cultural, national, religious, gender/sexual identity, body   positive, and \\[dis\\]abled. I’m  posting here specifically because our   long term goal is to change the  composition of our entry pool to   include more entries featuring diverse  characters and themes. These   voices need to be heard, and we are  actively reaching out to find them.\n\nWe are currently looking for new talent in humor poetry, short fiction and essay:\n\n[The Wergle Flomp Humor Poetry Contest](https://winningwriters.com/our-contests/wergle-flomp-humor-poetry-contest-free)offers a first prize of $1000, a second prize of $250, and ten    honorable mentions of $100 each. Entrants are invited to submit humor    poetry on any theme. The top twelve entries will be published online.    The contest is international and the deadline is April 1. The contest is    free to enter.\n\n[The Tom Howard/John H. Reid Fiction &amp; Essay Contest](https://winningwriters.com/our-contests/tom-howard-john-h-reid-fiction-essay-contest)offers a two first prizes of $3,000 each (up from $2,000 last year,)   as  well as ten honorable mentions of $200 each. Entrants are invited  to   submit short fiction and essays on any topic. The top twelve  entries   will be published online. The contest is international and the  deadline   is April 30th. The fee for the contest is $20.\n\nWe    started implementing a policy of reaching out specifically to groups    dedicated to connecting/celebrating underrepresented voices a couple  of   years ago, and I'm glad to say that we have seen our entry levels  from   these communities rise. We'll be continuing with this effort in  order  to  keep trying to get as many people into the national and   international  conversation on literature as we can.\n\nSometimes    when I post, there are some replies worried about a scam, so in order    to head that off I just want to say that our competitions are listed  by   The Write Life as some of the [top writing competitions out there](https://thewritelife.com/writing-contests/), and we’re in Writer’s Digest’s [top eight sites for writers](https://www.writersdigest.com/online-editor/top-websites-for-writers-best-publishing-marketing-resources). Besides contests, we also offer a lot of [free publishing and style resources](https://winningwriters.com/resources), including a [database of free poetry and prose competitions](https://winningwriters.com/the-best-free-literary-contests), at [https://winningwriters.com/](https://winningwriters.com/). And of course, stop by our subreddit for daily submissions opportunities worldwide, [r/literarycontests](https://www.reddit.com/r/literarycontests).\n\nI    know this isn't a writing sub per se, but there are a lot of talented    people here and I just wanted to reach out in case anyone was looking    for an opportunity like this. Thanks for listening, and have a good  day."", 'subreddit': 'NonBinaryTalk', 'title': 'Creating opportunities for NonBinary poets and writers to be heard', 'created': 1581708868.0}"
2020-02-15 02:30:20,f432w8,4,1,"today over text i came out to my parents (first my mom, them my dad). my mom was very chill about it and my dad didn’t respond (i’m not sure why). overall i think it went pretty well though",NonBinaryTalk,i came out to my parents today!,1581759020.0,"{'created_utc': 1581733820, 'id': 'f432w8', 'num_comments': 4, 'score': 1, 'selftext': 'today over text i came out to my parents (first my mom, them my dad). my mom was very chill about it and my dad didn’t respond (i’m not sure why). overall i think it went pretty well though', 'subreddit': 'NonBinaryTalk', 'title': 'i came out to my parents today!', 'created': 1581759020.0}"
2020-02-15 05:41:15,f457tt,2,1,"So im awake at midnight because i am as my name implies, confused(and wanting to scream) and so i came here to vent and kinda just throw all the cards down on the table. I previously thought i was ftm masc trans and all that but now im not so sure.

First off im terrified of top surgery but also my top is very triggering to my dysphoria(especially now that i have glasses and can see it in all its booby glory) but only like... undressed? When i have clothes on im fine and have even thought of getting myself some nice bras again to wear with my clothes.

But also i dont know if i want to wear feminine clothes for myself or to please the people around me(mainly my mom) i watch a lot of fashion youtube and think ""oh thats cute"" but maybe not on me?? Like idk.

Thats all i have for now. Gender has always been hard for me so i kinda came here for some advice. Like do any of you feel the same? Do you think im just masc or should just stay masc and commit to it or can i still like... do whatever? 

Thanks for your time.",NonBinaryTalk,Exploring my gender,1581770475.0,"{'created_utc': 1581745275, 'id': 'f457tt', 'num_comments': 2, 'score': 1, 'selftext': 'So im awake at midnight because i am as my name implies, confused(and wanting to scream) and so i came here to vent and kinda just throw all the cards down on the table. I previously thought i was ftm masc trans and all that but now im not so sure.\n\nFirst off im terrified of top surgery but also my top is very triggering to my dysphoria(especially now that i have glasses and can see it in all its booby glory) but only like... undressed? When i have clothes on im fine and have even thought of getting myself some nice bras again to wear with my clothes.\n\nBut also i dont know if i want to wear feminine clothes for myself or to please the people around me(mainly my mom) i watch a lot of fashion youtube and think ""oh thats cute"" but maybe not on me?? Like idk.\n\nThats all i have for now. Gender has always been hard for me so i kinda came here for some advice. Like do any of you feel the same? Do you think im just masc or should just stay masc and commit to it or can i still like... do whatever? \n\nThanks for your time.', 'subreddit': 'NonBinaryTalk', 'title': 'Exploring my gender', 'created': 1581770475.0}"
2020-02-15 06:57:42,f45y0n,20,1,I just come out to my mom and sister as nb and Im fucking shaking so bad but my mom was accepting and holy fuck Im like panicking hahahahahahahah Im a fucking mess holy shit,NonBinaryTalk,Wow holy fuck I just came out fuck,1581775062.0,"{'created_utc': 1581749862, 'id': 'f45y0n', 'num_comments': 20, 'score': 1, 'selftext': 'I just come out to my mom and sister as nb and Im fucking shaking so bad but my mom was accepting and holy fuck Im like panicking hahahahahahahah Im a fucking mess holy shit', 'subreddit': 'NonBinaryTalk', 'title': 'Wow holy fuck I just came out fuck', 'created': 1581775062.0}"
2020-02-15 07:05:05,f460d8,3,1,"I came to a sudden and powerful realization a couple of weeks ago, that caused me burst into tears and leave my phone and my coffee and my Xbox to seek the comfort of a hug from a loved one. I had figured it all out; I'm Non-Binary.

Several weeks later, I still feel so strongly and so sure of myself now that it wasn't just some weird fluke or manic episode, and there's no harm in trying. 

I felt it right away, as I ran down the stairs, the cold weather making my knees ache and my hairy body bristle and goosebump. My voice, my already thinning hair, my giant shoulders, and square head, and 6 foot height, and my dang beard. All of it was blaring, and scary, and a blatant reminder that I would have to work for it, but finally, it was something to work for. I could babystep my way forward. For the first time in my life, I knew who I was, and who I wanted to be.

The fact that I feel good by trying different things means I should be exploring. The fact that I feel bad when I stay still means I should keep moving forward, wherever that leads. It could be one or the other or both or neither that motivates you, but if it feels right, keep questioning. 

Hi. My new name is Grey. I don't really mind He, but I'd like to try out They if you don't mind. Yesterday I tried to put on a piece of gender-affirming clothing to see how I felt, and failed miserably. Everything I tried was so small I could never fit in them. It was humiliating, even in private, and made me feel awful about how broad I was, but I knew it meant I was expecting to feel a certain way, and that I should chase that feeling.

Next paycheque, I ride. I hear racerback tops make shoulders look thinner, despite exposing more of them. I'll try that next.

---

I'm gonna do yoga and wax my bod, and become more powerful than you can imagine, and watch cartoons, and pet my cat.

Be weed, smoke gay, 2021 will be my year for sure. She-Ra and Stevonnie saved my life if you stan any queer disaster from those shows, hmu. ^Just ^kidding ^I'm ^a ^shy ^baby. ^I ^can't ^express ^sincerity ^without ^sounding ^sarcastic ^it's ^my ^curse.",NonBinaryTalk,My dysphoria makes me valid. My dysphoria makes me powerful.,1581775505.0,"{'created_utc': 1581750305, 'id': 'f460d8', 'num_comments': 3, 'score': 1, 'selftext': ""I came to a sudden and powerful realization a couple of weeks ago, that caused me burst into tears and leave my phone and my coffee and my Xbox to seek the comfort of a hug from a loved one. I had figured it all out; I'm Non-Binary.\n\nSeveral weeks later, I still feel so strongly and so sure of myself now that it wasn't just some weird fluke or manic episode, and there's no harm in trying. \n\nI felt it right away, as I ran down the stairs, the cold weather making my knees ache and my hairy body bristle and goosebump. My voice, my already thinning hair, my giant shoulders, and square head, and 6 foot height, and my dang beard. All of it was blaring, and scary, and a blatant reminder that I would have to work for it, but finally, it was something to work for. I could babystep my way forward. For the first time in my life, I knew who I was, and who I wanted to be.\n\nThe fact that I feel good by trying different things means I should be exploring. The fact that I feel bad when I stay still means I should keep moving forward, wherever that leads. It could be one or the other or both or neither that motivates you, but if it feels right, keep questioning. \n\nHi. My new name is Grey. I don't really mind He, but I'd like to try out They if you don't mind. Yesterday I tried to put on a piece of gender-affirming clothing to see how I felt, and failed miserably. Everything I tried was so small I could never fit in them. It was humiliating, even in private, and made me feel awful about how broad I was, but I knew it meant I was expecting to feel a certain way, and that I should chase that feeling.\n\nNext paycheque, I ride. I hear racerback tops make shoulders look thinner, despite exposing more of them. I'll try that next.\n\n---\n\nI'm gonna do yoga and wax my bod, and become more powerful than you can imagine, and watch cartoons, and pet my cat.\n\nBe weed, smoke gay, 2021 will be my year for sure. She-Ra and Stevonnie saved my life if you stan any queer disaster from those shows, hmu. ^Just ^kidding ^I'm ^a ^shy ^baby. ^I ^can't ^express ^sincerity ^without ^sounding ^sarcastic ^it's ^my ^curse."", 'subreddit': 'NonBinaryTalk', 'title': 'My dysphoria makes me valid. My dysphoria makes me powerful.', 'created': 1581775505.0}"
2020-02-15 09:48:29,f47eap,8,1,"Hi I’m Summer! I’m 19 and I’m 3 months on hormones. I kinda just want to get to know more non binary people because we’re like hella cool and all that. I prefer to use discord to chat and talk to people but I can usually make arrangements for other mediums. 

A cool icebreaker would be how you came to realize you were non binary, as opposed to a binary gender or your agab? I’m good at conversion (most of the time lol) so we can go off from there. 

Lastly it’s like 15 till 4am so if I don’t reply right away it’s because I’m s l e e p",NonBinaryTalk,I could use some more non binary friends,1581785309.0,"{'created_utc': 1581760109, 'id': 'f47eap', 'num_comments': 8, 'score': 1, 'selftext': 'Hi I’m Summer! I’m 19 and I’m 3 months on hormones. I kinda just want to get to know more non binary people because we’re like hella cool and all that. I prefer to use discord to chat and talk to people but I can usually make arrangements for other mediums. \n\nA cool icebreaker would be how you came to realize you were non binary, as opposed to a binary gender or your agab? I’m good at conversion (most of the time lol) so we can go off from there. \n\nLastly it’s like 15 till 4am so if I don’t reply right away it’s because I’m s l e e p', 'subreddit': 'NonBinaryTalk', 'title': 'I could use some more non binary friends', 'created': 1581785309.0}"
2020-02-15 22:38:14,f4h1df,2,1,"I'm AFAB but I identify as Non-Binary. I did came out to some of my friends but they some time misgendered me. I don't say anything because we live in a place where being gender non-conforming is not understood well. They are nice people however they seem to have a hard time grasping that I'm not a female.

So, they started to talk about Nikkie tutorials while talking calling her ""HE"" and ""MALE"" despite the fact that she is a women. Which make me think if they can't respect her pronouns how are they going to respect mine. And also asking if I'm a female a lot of times.

We also have a religious class because we will receive the third sacrament of the Catholic Church (Eucharist). The churches we go to is were nice. They teach us that being homosexual and transgender IS NOT A SIN. The priest that teaches there is very open minded and he like to joke around. It was Valentines day and a couple came over to talk to us about purity and they were sexist talking that only men masturbate and that only women are not satisfied with their bodies. Everybody can masturbate and be not satisfied with their bodies it makes no sense to me.",NonBinaryTalk,Social problems,1581831494.0,"{'created_utc': 1581806294, 'id': 'f4h1df', 'num_comments': 2, 'score': 1, 'selftext': 'I\'m AFAB but I identify as Non-Binary. I did came out to some of my friends but they some time misgendered me. I don\'t say anything because we live in a place where being gender non-conforming is not understood well. They are nice people however they seem to have a hard time grasping that I\'m not a female.\n\nSo, they started to talk about Nikkie tutorials while talking calling her ""HE"" and ""MALE"" despite the fact that she is a women. Which make me think if they can\'t respect her pronouns how are they going to respect mine. And also asking if I\'m a female a lot of times.\n\nWe also have a religious class because we will receive the third sacrament of the Catholic Church (Eucharist). The churches we go to is were nice. They teach us that being homosexual and transgender IS NOT A SIN. The priest that teaches there is very open minded and he like to joke around. It was Valentines day and a couple came over to talk to us about purity and they were sexist talking that only men masturbate and that only women are not satisfied with their bodies. Everybody can masturbate and be not satisfied with their bodies it makes no sense to me.', 'subreddit': 'NonBinaryTalk', 'title': 'Social problems', 'created': 1581831494.0}"
2020-02-16 02:44:16,f4k9np,14,1,,NonBinaryTalk,The solution to formal addresses sir/ma'am? We all get a doctorate or PhD so we are addressed as doctor or professor,1581846256.0,"{'created_utc': 1581821056, 'id': 'f4k9np', 'num_comments': 14, 'score': 1, 'selftext': '', 'subreddit': 'NonBinaryTalk', 'title': ""The solution to formal addresses sir/ma'am? We all get a doctorate or PhD so we are addressed as doctor or professor"", 'created': 1581846256.0}"
2020-02-16 03:22:30,f4kq6r,1,1,"So last night I got drunk with a friend, and, as things tend to do after drinking, we got very open with each other. I opened up about how I think I might be non binary and about some of the dysphoria I’ve been feeling, then I cried and we hugged it out.

It was very positive, but I’m concerned she thinks I’m not actually experiencing this. It’s definitely more my paranoia and nothing that she did, but I’m just nervous that I couldn’t find the right words to express what I was actually feeling. 

Has anyone else gone through this post coming out stress?",NonBinaryTalk,Stress after Coming Out,1581848550.0,"{'created_utc': 1581823350, 'id': 'f4kq6r', 'num_comments': 1, 'score': 1, 'selftext': 'So last night I got drunk with a friend, and, as things tend to do after drinking, we got very open with each other. I opened up about how I think I might be non binary and about some of the dysphoria I’ve been feeling, then I cried and we hugged it out.\n\nIt was very positive, but I’m concerned she thinks I’m not actually experiencing this. It’s definitely more my paranoia and nothing that she did, but I’m just nervous that I couldn’t find the right words to express what I was actually feeling. \n\nHas anyone else gone through this post coming out stress?', 'subreddit': 'NonBinaryTalk', 'title': 'Stress after Coming Out', 'created': 1581848550.0}"
2020-02-16 07:23:47,f4nc4o,1,1,"Hi, I'm new here. I really need to get these feelings off my chest and get some advice. Also I'm sorry if certain parts don't make much sense or if it seems as if I'm rambling as I have not slept yet (it 7am currently)

From the moment I wake up, I feel like I'm trapped in a bubble and it just keeps getting smaller and smaller. I feel like I'm gasping for air when there is none. I've tried to ignore it but it just keeps getting worse. It's starting to affect my day to day life more than ever. Sometimes I can't even go college because of how it affects my anxiety.

I'm really scared about coming out. I'm only out to my bf and two other people that have forgotten I've even came out to them in the first place. I know that I can't keep up pretending to be something that I'm not to my friends. I want to be treated the way I should be. I'm worried that they won't accept me as a lot of them have some transphobic and enbyphobic opinions. I don't really want to associate with some of these people after I'm done with college but they're always around me in college so we have to socialise.

I'm not sure if I should see I can stick it out for another year until I go Uni or come out and try deal with that in college. A few of my friends are clocking on to me. I don't want them to figure it out and force me to come out. I want to come out on my own terms. I feel like I need to come out before the opportunity is taken from me. 

The only person that is fully supportive of me is my boyfriend. He's really amazing and I'm don't know what I would do without him. He understands how I feel as he's trans and knows how it feels when people don't refer to you by the right pronouns, name or treat you in a way that you don't want to be treated. He wants me to be comfortable with him and give me the same amount of respect, support and care I give him. 

I wish more people in the world were like him as I only feel like myself around him and vice versa. When I'm not with him, I feel like I'm playing a role of the person everyone thinks that I am. It gets draining and I end up feeling empty and hollow when I go to bed. I'm just tired of pretending to be someone I'm not.",NonBinaryTalk,I think I need to come out,1581863027.0,"{'created_utc': 1581837827, 'id': 'f4nc4o', 'num_comments': 1, 'score': 1, 'selftext': ""Hi, I'm new here. I really need to get these feelings off my chest and get some advice. Also I'm sorry if certain parts don't make much sense or if it seems as if I'm rambling as I have not slept yet (it 7am currently)\n\nFrom the moment I wake up, I feel like I'm trapped in a bubble and it just keeps getting smaller and smaller. I feel like I'm gasping for air when there is none. I've tried to ignore it but it just keeps getting worse. It's starting to affect my day to day life more than ever. Sometimes I can't even go college because of how it affects my anxiety.\n\nI'm really scared about coming out. I'm only out to my bf and two other people that have forgotten I've even came out to them in the first place. I know that I can't keep up pretending to be something that I'm not to my friends. I want to be treated the way I should be. I'm worried that they won't accept me as a lot of them have some transphobic and enbyphobic opinions. I don't really want to associate with some of these people after I'm done with college but they're always around me in college so we have to socialise.\n\nI'm not sure if I should see I can stick it out for another year until I go Uni or come out and try deal with that in college. A few of my friends are clocking on to me. I don't want them to figure it out and force me to come out. I want to come out on my own terms. I feel like I need to come out before the opportunity is taken from me. \n\nThe only person that is fully supportive of me is my boyfriend. He's really amazing and I'm don't know what I would do without him. He understands how I feel as he's trans and knows how it feels when people don't refer to you by the right pronouns, name or treat you in a way that you don't want to be treated. He wants me to be comfortable with him and give me the same amount of respect, support and care I give him. \n\nI wish more people in the world were like him as I only feel like myself around him and vice versa. When I'm not with him, I feel like I'm playing a role of the person everyone thinks that I am. It gets draining and I end up feeling empty and hollow when I go to bed. I'm just tired of pretending to be someone I'm not."", 'subreddit': 'NonBinaryTalk', 'title': 'I think I need to come out', 'created': 1581863027.0}"
