created_utc,id,num_comments,score,selftext,subreddit,title,created,d_
2020-02-01 00:42:15,ewy1cb,4,1,"ive always connected w the pronouns they/them the most. whenever someone calls me she or her, i just feel...like gross i guess? it just doesnt feel like me at all, it feels like that person is talking about an entirely different person. it makes me happy when people say they. even w my name, i like 2 go by a more androgynous version of and feel uncomfy w being called my full name, but not as much.

and i hate having a 'female' body sooo much, but i dont think being 'male' would help me either. i dont care about my clothes at all, i can wear whatever i want, but idk. it could all just be self hatred/insecurities tho so idek at all???

im just confused about everything, this is just a small rant ig lol, idk what this is",NonBinaryTalk,ahhhh i dont know what i am???,1580542935.0,"{'created_utc': 1580517735, 'id': 'ewy1cb', 'num_comments': 4, 'score': 1, 'selftext': ""ive always connected w the pronouns they/them the most. whenever someone calls me she or her, i just feel...like gross i guess? it just doesnt feel like me at all, it feels like that person is talking about an entirely different person. it makes me happy when people say they. even w my name, i like 2 go by a more androgynous version of and feel uncomfy w being called my full name, but not as much.\n\nand i hate having a 'female' body sooo much, but i dont think being 'male' would help me either. i dont care about my clothes at all, i can wear whatever i want, but idk. it could all just be self hatred/insecurities tho so idek at all???\n\nim just confused about everything, this is just a small rant ig lol, idk what this is"", 'subreddit': 'NonBinaryTalk', 'title': 'ahhhh i dont know what i am???', 'created': 1580542935.0}"
2020-02-01 06:19:08,ex1yvf,3,1,"I’m a D cup Uk size and i need top surgery, but I don’t want a male looking chest I want something that looks a bit in between and still slightly looks like breasts but not like a lot of that makes sense? I’m scared that it may not be possible cos of my size and I can’t find much online apart from people saying they were turned away for being non binary.",NonBinaryTalk,[TW: chest dysphoria] Has anyone here had top surgery that was meant too achieve a chest as small as possible without being male looking?,1580563148.0,"{'created_utc': 1580537948, 'id': 'ex1yvf', 'num_comments': 3, 'score': 1, 'selftext': 'I’m a D cup Uk size and i need top surgery, but I don’t want a male looking chest I want something that looks a bit in between and still slightly looks like breasts but not like a lot of that makes sense? I’m scared that it may not be possible cos of my size and I can’t find much online apart from people saying they were turned away for being non binary.', 'subreddit': 'NonBinaryTalk', 'title': '[TW: chest dysphoria] Has anyone here had top surgery that was meant too achieve a chest as small as possible without being male looking?', 'created': 1580563148.0}"
2020-02-01 13:14:33,ex5yvg,0,1,"Happy LGBT history month everyone! I'm trying to make weekly, sometimes bi-weekly videos on YouTube this month discussing bookish LGBT history topics. If you're interested - I've just reviewed 'What We Left Behind' by Robin Talley as the first of the series.

The name's Trans\_Bookworm",NonBinaryTalk,Happy LGBT History Month!,1580588073.0,"{'created_utc': 1580562873, 'id': 'ex5yvg', 'num_comments': 0, 'score': 1, 'selftext': ""Happy LGBT history month everyone! I'm trying to make weekly, sometimes bi-weekly videos on YouTube this month discussing bookish LGBT history topics. If you're interested - I've just reviewed 'What We Left Behind' by Robin Talley as the first of the series.\n\nThe name's Trans\\_Bookworm"", 'subreddit': 'NonBinaryTalk', 'title': 'Happy LGBT History Month!', 'created': 1580588073.0}"
2020-02-01 15:26:11,ex7mtv,8,1,,NonBinaryTalk,Wonderful hot take on MascNB,1580595971.0,"{'created_utc': 1580570771, 'id': 'ex7mtv', 'num_comments': 8, 'score': 1, 'selftext': '', 'subreddit': 'NonBinaryTalk', 'title': 'Wonderful hot take on MascNB', 'created': 1580595971.0}"
2020-02-01 16:13:48,ex8bsg,6,1,"So I'm a transmasculine genderfaun (he/they) enby and generally I prefer an androgynous/masculine presentation but there are some feminine clothing styles I like a lot. For me I see those styles as being gender nonconforming but because I'm pre-top surgery I know others won't see it that way and that it just goes to further the idea that I'm female and so it triggers dysphoria. I know that if I were to wear it with a flat chest I'd be happy with it and so it gets kinda upsetting. Unfortunately at the moment I'm unable to afford a chest binder either

I guess the point of this ramble is to ask if anyone else can relate to an experience like this and ask for suggestions to cope with it. Also sorry it this is confusing at all I'm tired.",NonBinaryTalk,Question about gender presentation/ dysphoria,1580598828.0,"{'created_utc': 1580573628, 'id': 'ex8bsg', 'num_comments': 6, 'score': 1, 'selftext': ""So I'm a transmasculine genderfaun (he/they) enby and generally I prefer an androgynous/masculine presentation but there are some feminine clothing styles I like a lot. For me I see those styles as being gender nonconforming but because I'm pre-top surgery I know others won't see it that way and that it just goes to further the idea that I'm female and so it triggers dysphoria. I know that if I were to wear it with a flat chest I'd be happy with it and so it gets kinda upsetting. Unfortunately at the moment I'm unable to afford a chest binder either\n\nI guess the point of this ramble is to ask if anyone else can relate to an experience like this and ask for suggestions to cope with it. Also sorry it this is confusing at all I'm tired."", 'subreddit': 'NonBinaryTalk', 'title': 'Question about gender presentation/ dysphoria', 'created': 1580598828.0}"
2020-02-01 19:26:55,exb7bj,3,1,,NonBinaryTalk,There are only two genders and you know it,1580610415.0,"{'created_utc': 1580585215, 'id': 'exb7bj', 'num_comments': 3, 'score': 1, 'selftext': '', 'subreddit': 'NonBinaryTalk', 'title': 'There are only two genders and you know it', 'created': 1580610415.0}"
2020-02-02 00:55:14,exfy4s,0,1,"Guys I am LGBT 
I do go by no gender labels but I like to be referred to as a baby doll,baby clown or clown doll
I am also pansexual",NonBinaryTalk,Ya,1580630114.0,"{'created_utc': 1580604914, 'id': 'exfy4s', 'num_comments': 0, 'score': 1, 'selftext': 'Guys I am LGBT \nI do go by no gender labels but I like to be referred to as a baby doll,baby clown or clown doll\nI am also pansexual', 'subreddit': 'NonBinaryTalk', 'title': 'Ya', 'created': 1580630114.0}"
2020-02-02 01:10:01,exg65n,1,1,"Hey!  I'm new to reddit and this forum, I mostly joined to try to find some support and people with similar issues to help me out. 
I have a good support system (mostly friends and my older brother, I'm terrified to tell my mom)  but something's they can't help on
How do you handle telling people your perfered pronouns?  I want to tell some people I trust but I'm scared and nervous. 
How did you handle it?",NonBinaryTalk,New here :),1580631001.0,"{'created_utc': 1580605801, 'id': 'exg65n', 'num_comments': 1, 'score': 1, 'selftext': ""Hey!  I'm new to reddit and this forum, I mostly joined to try to find some support and people with similar issues to help me out. \nI have a good support system (mostly friends and my older brother, I'm terrified to tell my mom)  but something's they can't help on\nHow do you handle telling people your perfered pronouns?  I want to tell some people I trust but I'm scared and nervous. \nHow did you handle it?"", 'subreddit': 'NonBinaryTalk', 'title': 'New here :)', 'created': 1580631001.0}"
2020-02-02 14:07:01,exow2r,4,1,"I wanna came out to my family as NB... eventually xD but i have no idea of how to tell them about this. Im scared they're most likely to think that being NB is just something i came up with and it's just me getting weird ideas. In my mind, i think id be harder to convince them about my gender than about my orientation, so i wanna ask NB people who are already out:

How did you do it? What did you say to convince the others you're not just getting ideas?",NonBinaryTalk,How did you came out?,1580677621.0,"{'created_utc': 1580652421, 'id': 'exow2r', 'num_comments': 4, 'score': 1, 'selftext': ""I wanna came out to my family as NB... eventually xD but i have no idea of how to tell them about this. Im scared they're most likely to think that being NB is just something i came up with and it's just me getting weird ideas. In my mind, i think id be harder to convince them about my gender than about my orientation, so i wanna ask NB people who are already out:\n\nHow did you do it? What did you say to convince the others you're not just getting ideas?"", 'subreddit': 'NonBinaryTalk', 'title': 'How did you came out?', 'created': 1580677621.0}"
2020-02-02 15:10:24,expq0h,0,1,"I am AFAB. For years I have been going back and forth identifying as FTM and identifying as a gender nonconforming woman and I am just now starting to come to terms with neither of those identities feeling quite right. I am going through another phase of trying to come to terms with being a gnc woman but I can’t enter women’s only spaces without feeling like I make women uncomfortable or feeling like I don’t fit in. I’m not trying to say it in an “I’m not like other girls” type way because for me it’s not something that I’m proud of. It feels incredibly lonely and I feel like anywhere I go I’m going to get weird looks based on how I present, and I’m never going to be able to relate to feeling comfortable in womanhood and navigating the world as a woman. At the same time, going into male spaces feels just as intimidating. I’m always physically comparing myself to men and feeling like even if I go on testosterone I still won’t be able to fit in or be accepted, and that I might not even feel happy presenting as someone who is 100% male. I just hate that everything is so gendered. I just want to exist as a person and feel comfortable in my body and it makes me feel really insecure when places like r/GenderCritical reduce non-binary identities to trivial things like clothing. For me, it extends beyond that. It extends into social interactions and an internal sense of figuring out where you belong in the world. Are my feelings wrong? Is this all just internalized misogyny? What does it mean to be a woman or a man, and why do people care so much about defining those terms in such rigid ways when they can really mean a lot of different things?",NonBinaryTalk,I don’t feel comfortable in women’s or men’s spaces,1580681424.0,"{'created_utc': 1580656224, 'id': 'expq0h', 'num_comments': 0, 'score': 1, 'selftext': 'I am AFAB. For years I have been going back and forth identifying as FTM and identifying as a gender nonconforming woman and I am just now starting to come to terms with neither of those identities feeling quite right. I am going through another phase of trying to come to terms with being a gnc woman but I can’t enter women’s only spaces without feeling like I make women uncomfortable or feeling like I don’t fit in. I’m not trying to say it in an “I’m not like other girls” type way because for me it’s not something that I’m proud of. It feels incredibly lonely and I feel like anywhere I go I’m going to get weird looks based on how I present, and I’m never going to be able to relate to feeling comfortable in womanhood and navigating the world as a woman. At the same time, going into male spaces feels just as intimidating. I’m always physically comparing myself to men and feeling like even if I go on testosterone I still won’t be able to fit in or be accepted, and that I might not even feel happy presenting as someone who is 100% male. I just hate that everything is so gendered. I just want to exist as a person and feel comfortable in my body and it makes me feel really insecure when places like r/GenderCritical reduce non-binary identities to trivial things like clothing. For me, it extends beyond that. It extends into social interactions and an internal sense of figuring out where you belong in the world. Are my feelings wrong? Is this all just internalized misogyny? What does it mean to be a woman or a man, and why do people care so much about defining those terms in such rigid ways when they can really mean a lot of different things?', 'subreddit': 'NonBinaryTalk', 'title': 'I don’t feel comfortable in women’s or men’s spaces', 'created': 1580681424.0}"
2020-02-02 15:10:27,expq1g,0,1,"I am AFAB. For years I have been going back and forth identifying as FTM and identifying as a gender nonconforming woman and I am just now starting to come to terms with neither of those identities feeling quite right. I am going through another phase of trying to come to terms with being a gnc woman but I can’t enter women’s only spaces without feeling like I make women uncomfortable or feeling like I don’t fit in. I’m not trying to say it in an “I’m not like other girls” type way because for me it’s not something that I’m proud of. It feels incredibly lonely and I feel like anywhere I go I’m going to get weird looks based on how I present, and I’m never going to be able to relate to feeling comfortable in womanhood and navigating the world as a woman. At the same time, going into male spaces feels just as intimidating. I’m always physically comparing myself to men and feeling like even if I go on testosterone I still won’t be able to fit in or be accepted, and that I might not even feel happy presenting as someone who is 100% male. I just hate that everything is so gendered. I just want to exist as a person and feel comfortable in my body and it makes me feel really insecure when places like r/GenderCritical reduce non-binary identities to trivial things like clothing. For me, it extends beyond that. It extends into social interactions and an internal sense of figuring out where you belong in the world. Are my feelings wrong? Is this all just internalized misogyny? What does it mean to be a woman or a man, and why do people care so much about defining those terms in such rigid ways when they can really mean a lot of different things?",NonBinaryTalk,I don’t feel comfortable in women’s or men’s spaces,1580681427.0,"{'created_utc': 1580656227, 'id': 'expq1g', 'num_comments': 0, 'score': 1, 'selftext': 'I am AFAB. For years I have been going back and forth identifying as FTM and identifying as a gender nonconforming woman and I am just now starting to come to terms with neither of those identities feeling quite right. I am going through another phase of trying to come to terms with being a gnc woman but I can’t enter women’s only spaces without feeling like I make women uncomfortable or feeling like I don’t fit in. I’m not trying to say it in an “I’m not like other girls” type way because for me it’s not something that I’m proud of. It feels incredibly lonely and I feel like anywhere I go I’m going to get weird looks based on how I present, and I’m never going to be able to relate to feeling comfortable in womanhood and navigating the world as a woman. At the same time, going into male spaces feels just as intimidating. I’m always physically comparing myself to men and feeling like even if I go on testosterone I still won’t be able to fit in or be accepted, and that I might not even feel happy presenting as someone who is 100% male. I just hate that everything is so gendered. I just want to exist as a person and feel comfortable in my body and it makes me feel really insecure when places like r/GenderCritical reduce non-binary identities to trivial things like clothing. For me, it extends beyond that. It extends into social interactions and an internal sense of figuring out where you belong in the world. Are my feelings wrong? Is this all just internalized misogyny? What does it mean to be a woman or a man, and why do people care so much about defining those terms in such rigid ways when they can really mean a lot of different things?', 'subreddit': 'NonBinaryTalk', 'title': 'I don’t feel comfortable in women’s or men’s spaces', 'created': 1580681427.0}"
2020-02-02 15:10:34,expq4i,0,1,"I am AFAB. For years I have been going back and forth identifying as FTM and identifying as a gender nonconforming woman and I am just now starting to come to terms with neither of those identities feeling quite right. I am going through another phase of trying to come to terms with being a gnc woman but I can’t enter women’s only spaces without feeling like I make women uncomfortable or feeling like I don’t fit in. I’m not trying to say it in an “I’m not like other girls” type way because for me it’s not something that I’m proud of. It feels incredibly lonely and I feel like anywhere I go I’m going to get weird looks based on how I present, and I’m never going to be able to relate to feeling comfortable in womanhood and navigating the world as a woman. At the same time, going into male spaces feels just as intimidating. I’m always physically comparing myself to men and feeling like even if I go on testosterone I still won’t be able to fit in or be accepted, and that I might not even feel happy presenting as someone who is 100% male. I just hate that everything is so gendered. I just want to exist as a person and feel comfortable in my body and it makes me feel really insecure when places like r/GenderCritical reduce non-binary identities to trivial things like clothing. For me, it extends beyond that. It extends into social interactions and an internal sense of figuring out where you belong in the world. Are my feelings wrong? Is this all just internalized misogyny? What does it mean to be a woman or a man, and why do people care so much about defining those terms in such rigid ways when they can really mean a lot of different things?",NonBinaryTalk,I don’t feel comfortable in women’s or men’s spaces,1580681434.0,"{'created_utc': 1580656234, 'id': 'expq4i', 'num_comments': 0, 'score': 1, 'selftext': 'I am AFAB. For years I have been going back and forth identifying as FTM and identifying as a gender nonconforming woman and I am just now starting to come to terms with neither of those identities feeling quite right. I am going through another phase of trying to come to terms with being a gnc woman but I can’t enter women’s only spaces without feeling like I make women uncomfortable or feeling like I don’t fit in. I’m not trying to say it in an “I’m not like other girls” type way because for me it’s not something that I’m proud of. It feels incredibly lonely and I feel like anywhere I go I’m going to get weird looks based on how I present, and I’m never going to be able to relate to feeling comfortable in womanhood and navigating the world as a woman. At the same time, going into male spaces feels just as intimidating. I’m always physically comparing myself to men and feeling like even if I go on testosterone I still won’t be able to fit in or be accepted, and that I might not even feel happy presenting as someone who is 100% male. I just hate that everything is so gendered. I just want to exist as a person and feel comfortable in my body and it makes me feel really insecure when places like r/GenderCritical reduce non-binary identities to trivial things like clothing. For me, it extends beyond that. It extends into social interactions and an internal sense of figuring out where you belong in the world. Are my feelings wrong? Is this all just internalized misogyny? What does it mean to be a woman or a man, and why do people care so much about defining those terms in such rigid ways when they can really mean a lot of different things?', 'subreddit': 'NonBinaryTalk', 'title': 'I don’t feel comfortable in women’s or men’s spaces', 'created': 1580681434.0}"
2020-02-02 15:10:44,expq7g,12,1,"I am AFAB. For years I have been going back and forth identifying as FTM and identifying as a gender nonconforming woman and I am just now starting to come to terms with neither of those identities feeling quite right. I am going through another phase of trying to come to terms with being a gnc woman but I can’t enter women’s only spaces without feeling like I make women uncomfortable or feeling like I don’t fit in. I’m not trying to say it in an “I’m not like other girls” type way because for me it’s not something that I’m proud of. It feels incredibly lonely and I feel like anywhere I go I’m going to get weird looks based on how I present, and I’m never going to be able to relate to feeling comfortable in womanhood and navigating the world as a woman. At the same time, going into male spaces feels just as intimidating. I’m always physically comparing myself to men and feeling like even if I go on testosterone I still won’t be able to fit in or be accepted, and that I might not even feel happy presenting as someone who is 100% male. I just hate that everything is so gendered. I just want to exist as a person and feel comfortable in my body and it makes me feel really insecure when places like r/GenderCritical reduce non-binary identities to trivial things like clothing. For me, it extends beyond that. It extends into social interactions and an internal sense of figuring out where you belong in the world. Are my feelings wrong? Is this all just internalized misogyny? What does it mean to be a woman or a man, and why do people care so much about defining those terms in such rigid ways when they can really mean a lot of different things?",NonBinaryTalk,I don’t feel comfortable in women’s or men’s spaces,1580681444.0,"{'created_utc': 1580656244, 'id': 'expq7g', 'num_comments': 12, 'score': 1, 'selftext': 'I am AFAB. For years I have been going back and forth identifying as FTM and identifying as a gender nonconforming woman and I am just now starting to come to terms with neither of those identities feeling quite right. I am going through another phase of trying to come to terms with being a gnc woman but I can’t enter women’s only spaces without feeling like I make women uncomfortable or feeling like I don’t fit in. I’m not trying to say it in an “I’m not like other girls” type way because for me it’s not something that I’m proud of. It feels incredibly lonely and I feel like anywhere I go I’m going to get weird looks based on how I present, and I’m never going to be able to relate to feeling comfortable in womanhood and navigating the world as a woman. At the same time, going into male spaces feels just as intimidating. I’m always physically comparing myself to men and feeling like even if I go on testosterone I still won’t be able to fit in or be accepted, and that I might not even feel happy presenting as someone who is 100% male. I just hate that everything is so gendered. I just want to exist as a person and feel comfortable in my body and it makes me feel really insecure when places like r/GenderCritical reduce non-binary identities to trivial things like clothing. For me, it extends beyond that. It extends into social interactions and an internal sense of figuring out where you belong in the world. Are my feelings wrong? Is this all just internalized misogyny? What does it mean to be a woman or a man, and why do people care so much about defining those terms in such rigid ways when they can really mean a lot of different things?', 'subreddit': 'NonBinaryTalk', 'title': 'I don’t feel comfortable in women’s or men’s spaces', 'created': 1580681444.0}"
2020-02-02 16:08:51,exqler,3,1,"I realised I was enby when I was ten
It took my class and mother 3 years to start using my name and pronouns
My dad still doesn't 
It took 4 years to convince my mother to let me start horomone blockers
We decided not to tell my dad for fear of his response
It took a month for the first appointment with my doctor
It took months to hear from insurance 
And after calling, and waiting, and worrying
My insurance sent us a letter, denying our request for coverage because they didn't see diagnosed gender dysphoria as a serious enough issue that it needed treatment
We can't afford horomone blockers on our own
And I haven't been aloud to talk to anyone about it because my dad might find out, but I had to vent, so I put it here. I know I should feel licky for having a supportive mother and realising so younge, but I am so tired of waiting just to be let down.",NonBinaryTalk,Vent,1580684931.0,"{'created_utc': 1580659731, 'id': 'exqler', 'num_comments': 3, 'score': 1, 'selftext': ""I realised I was enby when I was ten\nIt took my class and mother 3 years to start using my name and pronouns\nMy dad still doesn't \nIt took 4 years to convince my mother to let me start horomone blockers\nWe decided not to tell my dad for fear of his response\nIt took a month for the first appointment with my doctor\nIt took months to hear from insurance \nAnd after calling, and waiting, and worrying\nMy insurance sent us a letter, denying our request for coverage because they didn't see diagnosed gender dysphoria as a serious enough issue that it needed treatment\nWe can't afford horomone blockers on our own\nAnd I haven't been aloud to talk to anyone about it because my dad might find out, but I had to vent, so I put it here. I know I should feel licky for having a supportive mother and realising so younge, but I am so tired of waiting just to be let down."", 'subreddit': 'NonBinaryTalk', 'title': 'Vent', 'created': 1580684931.0}"
