created_utc,id,num_comments,score,selftext,subreddit,title,created,d_
2020-02-07 02:14:15,f03j71,6,1,"hey,, ! how did you guys (if you had dysphoria) deal with chest dysphoria? it’s been getting worse and worse for me and i can’t afford a binder because my family can’t afford it :( i don’t know what to do. i’ve been using sports bras but it hasn’t been binding good enough and if i go a size down it makes it way to tight. i really hate my chest and i want it all to go away. i wish i was able to get a binder. :((",NonBinaryTalk,"Chest dysphoria, help",1581066855.0,"{'created_utc': 1581041655, 'id': 'f03j71', 'num_comments': 6, 'score': 1, 'selftext': 'hey,, ! how did you guys (if you had dysphoria) deal with chest dysphoria? it’s been getting worse and worse for me and i can’t afford a binder because my family can’t afford it :( i don’t know what to do. i’ve been using sports bras but it hasn’t been binding good enough and if i go a size down it makes it way to tight. i really hate my chest and i want it all to go away. i wish i was able to get a binder. :((', 'subreddit': 'NonBinaryTalk', 'title': 'Chest dysphoria, help', 'created': 1581066855.0}"
2020-02-07 02:52:54,f041if,0,1,,NonBinaryTalk,"For those who pack, what are some things that are not packers that you have stuffed in your boxers to get the effect, and did they work well?",1581069174.0,"{'created_utc': 1581043974, 'id': 'f041if', 'num_comments': 0, 'score': 1, 'selftext': '', 'subreddit': 'NonBinaryTalk', 'title': 'For those who pack, what are some things that are not packers that you have stuffed in your boxers to get the effect, and did they work well?', 'created': 1581069174.0}"
2020-02-07 03:57:38,f04vb9,11,1,"Honest question. I genuinely want to understand why they are necessary.  Why are they/them pronouns insufficient?  If someone told me zir pronouns are zi, zir, zem, zemself (a real set I have seen a lot) I would 100% respect and use those pronouns for zem. But like...why?  Is gender not confusing enough without adding ""made-up"" words into the mix? Does it ever get confusing for the person who goes by those pronouns? What about a room full of people, each with a different set of neopronouns?  

Again, this is a serious, honest question. I just want to understand. 

And before anyone asks yes I am nonbinary, they/them pronouns please.",NonBinaryTalk,"People who use neopronouns and nounself pronouns, what it the point of them?",1581073058.0,"{'created_utc': 1581047858, 'id': 'f04vb9', 'num_comments': 11, 'score': 1, 'selftext': 'Honest question. I genuinely want to understand why they are necessary.  Why are they/them pronouns insufficient?  If someone told me zir pronouns are zi, zir, zem, zemself (a real set I have seen a lot) I would 100% respect and use those pronouns for zem. But like...why?  Is gender not confusing enough without adding ""made-up"" words into the mix? Does it ever get confusing for the person who goes by those pronouns? What about a room full of people, each with a different set of neopronouns?  \n\nAgain, this is a serious, honest question. I just want to understand. \n\nAnd before anyone asks yes I am nonbinary, they/them pronouns please.', 'subreddit': 'NonBinaryTalk', 'title': 'People who use neopronouns and nounself pronouns, what it the point of them?', 'created': 1581073058.0}"
2020-02-07 21:01:22,f0gtvc,22,1,I used to have a name that i loves and would go by but now it sounds boring. Can people please tell me how they found theirs / possible methods to try / suggestions?,NonBinaryTalk,Help me please,1581134482.0,"{'created_utc': 1581109282, 'id': 'f0gtvc', 'num_comments': 22, 'score': 1, 'selftext': 'I used to have a name that i loves and would go by but now it sounds boring. Can people please tell me how they found theirs / possible methods to try / suggestions?', 'subreddit': 'NonBinaryTalk', 'title': 'Help me please', 'created': 1581134482.0}"
2020-02-07 23:34:44,f0j0wb,2,1,"I’m always seen as a cis female &amp; well that’s just whatever to me because being “cis” for almost 25 years it’s hard to get people on the right track of recognizing the change in your identity. (Not that it’s a big change lmao). Anyway I’m filling in for our screen printer while he’s recovering from surgery at the company I work for &amp; to be funny my boss started to call me Rich, that’s the printers name &amp; it’s also close to Rachel which is my name. I’m not out to anyone at my job because I really just don’t care, they’re all baby boomers anyway. But !! It feels nice to be called a more masculine presenting name !! My boss gives everyone nick names so I’m hoping this one sticks !",NonBinaryTalk,Small victories,1581143684.0,"{'created_utc': 1581118484, 'id': 'f0j0wb', 'num_comments': 2, 'score': 1, 'selftext': 'I’m always seen as a cis female &amp; well that’s just whatever to me because being “cis” for almost 25 years it’s hard to get people on the right track of recognizing the change in your identity. (Not that it’s a big change lmao). Anyway I’m filling in for our screen printer while he’s recovering from surgery at the company I work for &amp; to be funny my boss started to call me Rich, that’s the printers name &amp; it’s also close to Rachel which is my name. I’m not out to anyone at my job because I really just don’t care, they’re all baby boomers anyway. But !! It feels nice to be called a more masculine presenting name !! My boss gives everyone nick names so I’m hoping this one sticks !', 'subreddit': 'NonBinaryTalk', 'title': 'Small victories', 'created': 1581143684.0}"
2020-02-08 01:48:23,f0kp6a,5,1,"Hi,
I'm a closeted non binary living in Portugal. I really wanted to come out to my friends but I have problem.
With the English language it's easier to pick the right pronouns for my gender identity, the problem is in my native language.
In Portuguese the English pronouns ""they"" are also gendered into ""eles"" they mas and ""elas"" they fem.
I just wanted to find the right pronouns to myself in my native language please help me~ &gt;&lt;",NonBinaryTalk,Help,1581151703.0,"{'created_utc': 1581126503, 'id': 'f0kp6a', 'num_comments': 5, 'score': 1, 'selftext': 'Hi,\nI\'m a closeted non binary living in Portugal. I really wanted to come out to my friends but I have problem.\nWith the English language it\'s easier to pick the right pronouns for my gender identity, the problem is in my native language.\nIn Portuguese the English pronouns ""they"" are also gendered into ""eles"" they mas and ""elas"" they fem.\nI just wanted to find the right pronouns to myself in my native language please help me~ &gt;&lt;', 'subreddit': 'NonBinaryTalk', 'title': 'Help', 'created': 1581151703.0}"
2020-02-08 02:42:21,f0lcnl,35,1,"I don't have anybody in my life who is also nonbinary, and I need some people who I can relate (and sometimes complain?) To. (I have memes too.... I'll send you memes....)",NonBinaryTalk,Hi! I need some NB friends to talk with,1581154941.0,"{'created_utc': 1581129741, 'id': 'f0lcnl', 'num_comments': 35, 'score': 1, 'selftext': ""I don't have anybody in my life who is also nonbinary, and I need some people who I can relate (and sometimes complain?) To. (I have memes too.... I'll send you memes....)"", 'subreddit': 'NonBinaryTalk', 'title': 'Hi! I need some NB friends to talk with', 'created': 1581154941.0}"
2020-02-08 23:15:05,f0zj4e,13,1,"🧒🧑🧑‍🦱🧑‍🦰👱🧑‍🦳🧑‍🦲🧓👳👮👷💂🕵️🧑‍⚕️🧑‍🌾🧑‍🍳🧑‍🎓🧑‍🎤🧑‍🏫🧑‍🏭🧑‍💻🧑‍💼🧑‍🔧🧑‍🔬🧑‍🎨🧑‍🚒🧑‍✈️🧑‍🚀🧑‍⚖️🦸🦹🧙🧝🧛🧟🧞‍♂️🧜🧚🙇💁🙅🙆🙋🤦🧏🤷🙎🙍💇💆🧖👯🧑‍🦽🧑‍🦼🚶🧑‍🦯🧎🏃🧍

And yes, you saw the mermaid, genie and faerie right- THEYRE WEARING BINDERS!🧜🧞🧚

Lemme just geek out for a hot second.",NonBinaryTalk,Just realized Apple now has non-binary emojis!,1581228905.0,"{'created_utc': 1581203705, 'id': 'f0zj4e', 'num_comments': 13, 'score': 1, 'selftext': '🧒🧑🧑\u200d🦱🧑\u200d🦰👱🧑\u200d🦳🧑\u200d🦲🧓👳👮👷💂🕵️🧑\u200d⚕️🧑\u200d🌾🧑\u200d🍳🧑\u200d🎓🧑\u200d🎤🧑\u200d🏫🧑\u200d🏭🧑\u200d💻🧑\u200d💼🧑\u200d🔧🧑\u200d🔬🧑\u200d🎨🧑\u200d🚒🧑\u200d✈️🧑\u200d🚀🧑\u200d⚖️🦸🦹🧙🧝🧛🧟🧞\u200d♂️🧜🧚🙇💁🙅🙆🙋🤦🧏🤷🙎🙍💇💆🧖👯🧑\u200d🦽🧑\u200d🦼🚶🧑\u200d🦯🧎🏃🧍\n\nAnd yes, you saw the mermaid, genie and faerie right- THEYRE WEARING BINDERS!🧜🧞🧚\n\nLemme just geek out for a hot second.', 'subreddit': 'NonBinaryTalk', 'title': 'Just realized Apple now has non-binary emojis!', 'created': 1581228905.0}"
2020-02-08 23:44:51,f0zxz7,0,1,,NonBinaryTalk,I have nowhere else to share this so here you go Reddit.,1581230691.0,"{'created_utc': 1581205491, 'id': 'f0zxz7', 'num_comments': 0, 'score': 1, 'selftext': '', 'subreddit': 'NonBinaryTalk', 'title': 'I have nowhere else to share this so here you go Reddit.', 'created': 1581230691.0}"
2020-02-09 02:45:12,f12bqc,0,1,YaY mY gOoD fRiEnD dYsPhOrIa HaS cOmE tO vIsIt,NonBinaryTalk,Dysphoria,1581241512.0,"{'created_utc': 1581216312, 'id': 'f12bqc', 'num_comments': 0, 'score': 1, 'selftext': 'YaY mY gOoD fRiEnD dYsPhOrIa HaS cOmE tO vIsIt', 'subreddit': 'NonBinaryTalk', 'title': 'Dysphoria', 'created': 1581241512.0}"
2020-02-09 03:06:22,f12ljh,0,1,,NonBinaryTalk,Non-binary person looking for other nb people to take undergraduate survey,1581242782.0,"{'created_utc': 1581217582, 'id': 'f12ljh', 'num_comments': 0, 'score': 1, 'selftext': '', 'subreddit': 'NonBinaryTalk', 'title': 'Non-binary person looking for other nb people to take undergraduate survey', 'created': 1581242782.0}"
2020-02-09 03:23:41,f12tem,8,1,"&amp;#x200B;

Hi! My name is Holly Smith and I am a 3rd year psychology student at Oxford Brookes University. The following survey is for my final project on how your gender affects the quality of your friendships. If you are at least 18 years of age I would appreciate it if you could complete my questionnaire. It will take roughly 10 minutes. Thank you for your time!

[https://brookeshls.co1.qualtrics.com/jfe/form/SV\_5c1vAbSxT0GL0uF](https://brookeshls.co1.qualtrics.com/jfe/form/SV_5c1vAbSxT0GL0uF)",NonBinaryTalk,Non-binary person looking for other nb people to take undergrad questionnaire,1581243821.0,"{'created_utc': 1581218621, 'id': 'f12tem', 'num_comments': 8, 'score': 1, 'selftext': '&amp;#x200B;\n\nHi! My name is Holly Smith and I am a 3rd year psychology student at Oxford Brookes University. The following survey is for my final project on how your gender affects the quality of your friendships. If you are at least 18 years of age I would appreciate it if you could complete my questionnaire. It will take roughly 10 minutes. Thank you for your time!\n\n[https://brookeshls.co1.qualtrics.com/jfe/form/SV\\_5c1vAbSxT0GL0uF](https://brookeshls.co1.qualtrics.com/jfe/form/SV_5c1vAbSxT0GL0uF)', 'subreddit': 'NonBinaryTalk', 'title': 'Non-binary person looking for other nb people to take undergrad questionnaire', 'created': 1581243821.0}"
2020-02-09 04:25:20,f13k49,1,1,,NonBinaryTalk,🤡,1581247520.0,"{'created_utc': 1581222320, 'id': 'f13k49', 'num_comments': 1, 'score': 1, 'selftext': '', 'subreddit': 'NonBinaryTalk', 'title': '🤡', 'created': 1581247520.0}"
2020-02-09 05:07:39,f1411f,1,1,"I've not posted here before but I wanted to share that today a service worker first gendered me he/him then changed to they/them and that felt really really nice.

I feel so invisible sometimes so idk... gave me good feelings.",NonBinaryTalk,A thing happened,1581250059.0,"{'created_utc': 1581224859, 'id': 'f1411f', 'num_comments': 1, 'score': 1, 'selftext': ""I've not posted here before but I wanted to share that today a service worker first gendered me he/him then changed to they/them and that felt really really nice.\n\nI feel so invisible sometimes so idk... gave me good feelings."", 'subreddit': 'NonBinaryTalk', 'title': 'A thing happened', 'created': 1581250059.0}"
2020-02-09 06:14:41,f14pvo,4,1,"My most sincere apologies for the upcoming rant. 

Hey everyone, so recently I came out to my family as bisexual, and I feel like that freed me up, only to have that feeling return about gender. 

I’m AMAB and caught myself going through the same things I went through on my realization of my sexuality (a lot of introspection, doing dumb online quizzes about gender, etc...). There’s just been a lot of really small things piling up that have made me feel kind of lost.

I’ve always been a little feminine, but the most I’ve ever done was paint my nails and had my makeup done (which I very much enjoyed). Recently I tried on a dress and felt this feeling of like relief maybe? I don’t know how to describe it but it was overwhelming.

So naturally I’m starting to think that I might nonbinary, but my fear is that I’m just lying to myself about it and just convincing myself to fulfill a need to feel “special” or “different.” 

TL;DR: I’ve started question my gender but nervous that I’m just faking it",NonBinaryTalk,Fears About Gender Questioning,1581254081.0,"{'created_utc': 1581228881, 'id': 'f14pvo', 'num_comments': 4, 'score': 1, 'selftext': 'My most sincere apologies for the upcoming rant. \n\nHey everyone, so recently I came out to my family as bisexual, and I feel like that freed me up, only to have that feeling return about gender. \n\nI’m AMAB and caught myself going through the same things I went through on my realization of my sexuality (a lot of introspection, doing dumb online quizzes about gender, etc...). There’s just been a lot of really small things piling up that have made me feel kind of lost.\n\nI’ve always been a little feminine, but the most I’ve ever done was paint my nails and had my makeup done (which I very much enjoyed). Recently I tried on a dress and felt this feeling of like relief maybe? I don’t know how to describe it but it was overwhelming.\n\nSo naturally I’m starting to think that I might nonbinary, but my fear is that I’m just lying to myself about it and just convincing myself to fulfill a need to feel “special” or “different.” \n\nTL;DR: I’ve started question my gender but nervous that I’m just faking it', 'subreddit': 'NonBinaryTalk', 'title': 'Fears About Gender Questioning', 'created': 1581254081.0}"
2020-02-09 06:31:34,f14vvz,1,1, I just bought my first binder. I'm so excited for it to come. It's taken me so long for me to realize that I'm Non-binary and that it's ok. I've been debating buying this for a very long time. Now that it's finally done and all I have to do is wait for it to arrive I'm filled with a mix of anticipation and dread. I'm scared about what it means for my future and my identity but I'm excited because I wanted one so bad.,NonBinaryTalk,My first binder,1581255094.0,"{'created_utc': 1581229894, 'id': 'f14vvz', 'num_comments': 1, 'score': 1, 'selftext': "" I just bought my first binder. I'm so excited for it to come. It's taken me so long for me to realize that I'm Non-binary and that it's ok. I've been debating buying this for a very long time. Now that it's finally done and all I have to do is wait for it to arrive I'm filled with a mix of anticipation and dread. I'm scared about what it means for my future and my identity but I'm excited because I wanted one so bad."", 'subreddit': 'NonBinaryTalk', 'title': 'My first binder', 'created': 1581255094.0}"
2020-02-09 12:35:45,f18302,12,1,"I'm not sure if I'm wording that title correctly. I'm a guy, but I'm not so sure that I'm strictly a binary dude anymore. I keep going back and forth between being a genderless person to being strictly binary. I'm so confused and stressed out. It would be helpful to hear everyone's experiences of coming out (to themselves) to compare similarities. How did you come to terms that you're Nonbinary?",NonBinaryTalk,"How did you ""know"" you're Nonbinary?",1581276945.0,"{'created_utc': 1581251745, 'id': 'f18302', 'num_comments': 12, 'score': 1, 'selftext': ""I'm not sure if I'm wording that title correctly. I'm a guy, but I'm not so sure that I'm strictly a binary dude anymore. I keep going back and forth between being a genderless person to being strictly binary. I'm so confused and stressed out. It would be helpful to hear everyone's experiences of coming out (to themselves) to compare similarities. How did you come to terms that you're Nonbinary?"", 'subreddit': 'NonBinaryTalk', 'title': 'How did you ""know"" you\'re Nonbinary?', 'created': 1581276945.0}"
2020-02-09 12:52:03,f188nf,6,1,"So a little background,
I've identified as nonbinary since I was 17 and that identity became more and more a part of me as I got older. I thought I could set it aside and just tolerate being referred to with female pronouns in professional settings just so I could get by. But then it was killing me on the inside. It's hard to describe how it felt, but it felt wrong.

So halfway into my freshman year of college, I started emailing professors about my name and my preferred pronouns. Lucky for me, everyone was really receptive. A few times professors messed up, they would email me later that day apologizing. It was nice feeling validated. 

But as college was ending I was worried about going out into the real world. I went to.college for being a teacher and I live down south so we all know what that can be like. I tried dipping my toes in the water during student teaching. My University told me they supported my gender identity 100% and told me if I was placed in a school that didnt respect my identity, I could switch. And luckily the high school I student taught at was great and everyone there respected my pronouns. As a teacher I got to go by Mx._______. A lot of the LGBT students were happy I was there. 

And then I got a job. 

As an elementary teacher. 


I thought to myself its time to face the real world, just suck it up until you find another job. I was warned about possibly being rejected about being called they/them and Mx. In an elementary setting because students are still learning grammar and it may confuse them and I was fine with that. But, a few days after I got hired I just decided to shoot my shot and asked my principal, ""Hey is it okay if I go by Mx. ?""
And she said that was a great idea!

Im lucky that my county has a policy protecting me (which I didn't even know about.) I had a meeting with my principal and vice principal about making sure I felt comfortable at work and that people would only know what I needed them to know. I basically told them Im not going any further than explaining I identify as nonbinary, please use the following pronouns to refer to me. 

My students call me Mx. My colleagues use my proper pronouns. I never thought I'd get to this point in life or that it was even possible but it feels good, and I wanted to share it with everyone here to let them know there is a place for us in the world out therem 

TL;DR: I was worried I wouldn't be able to ID as nonbinary as a teacher, but my new elementary school supports me 100%.",NonBinaryTalk,I get to be nonbinary in my professional life!,1581277923.0,"{'created_utc': 1581252723, 'id': 'f188nf', 'num_comments': 6, 'score': 1, 'selftext': 'So a little background,\nI\'ve identified as nonbinary since I was 17 and that identity became more and more a part of me as I got older. I thought I could set it aside and just tolerate being referred to with female pronouns in professional settings just so I could get by. But then it was killing me on the inside. It\'s hard to describe how it felt, but it felt wrong.\n\nSo halfway into my freshman year of college, I started emailing professors about my name and my preferred pronouns. Lucky for me, everyone was really receptive. A few times professors messed up, they would email me later that day apologizing. It was nice feeling validated. \n\nBut as college was ending I was worried about going out into the real world. I went to.college for being a teacher and I live down south so we all know what that can be like. I tried dipping my toes in the water during student teaching. My University told me they supported my gender identity 100% and told me if I was placed in a school that didnt respect my identity, I could switch. And luckily the high school I student taught at was great and everyone there respected my pronouns. As a teacher I got to go by Mx._______. A lot of the LGBT students were happy I was there. \n\nAnd then I got a job. \n\nAs an elementary teacher. \n\n\nI thought to myself its time to face the real world, just suck it up until you find another job. I was warned about possibly being rejected about being called they/them and Mx. In an elementary setting because students are still learning grammar and it may confuse them and I was fine with that. But, a few days after I got hired I just decided to shoot my shot and asked my principal, ""Hey is it okay if I go by Mx. ?""\nAnd she said that was a great idea!\n\nIm lucky that my county has a policy protecting me (which I didn\'t even know about.) I had a meeting with my principal and vice principal about making sure I felt comfortable at work and that people would only know what I needed them to know. I basically told them Im not going any further than explaining I identify as nonbinary, please use the following pronouns to refer to me. \n\nMy students call me Mx. My colleagues use my proper pronouns. I never thought I\'d get to this point in life or that it was even possible but it feels good, and I wanted to share it with everyone here to let them know there is a place for us in the world out therem \n\nTL;DR: I was worried I wouldn\'t be able to ID as nonbinary as a teacher, but my new elementary school supports me 100%.', 'subreddit': 'NonBinaryTalk', 'title': 'I get to be nonbinary in my professional life!', 'created': 1581277923.0}"
2020-02-09 18:13:45,f1ci8x,43,1,Can all the older enbies here prove them wrong?,NonBinaryTalk,Someone told me there where no nonbinary people over the age of 25...,1581297225.0,"{'created_utc': 1581272025, 'id': 'f1ci8x', 'num_comments': 43, 'score': 1, 'selftext': 'Can all the older enbies here prove them wrong?', 'subreddit': 'NonBinaryTalk', 'title': 'Someone told me there where no nonbinary people over the age of 25...', 'created': 1581297225.0}"
2020-02-09 22:41:09,f1giio,0,1,"So labels are weird, especially when it comes to gender. So far I've used genderfluid, genderqueer, nonbinary, trans feminine. I think polygender and/or pangender might be one of the more accurate labels for myself. I've seen a lot of nonbinary folk say say they're neither male nor female, but for me I feel like yes both and more please. All the genders. I've got genders like I've got bad habits. Wanna borrow one?",NonBinaryTalk,Further explorations and realizations of self,1581313269.0,"{'created_utc': 1581288069, 'id': 'f1giio', 'num_comments': 0, 'score': 1, 'selftext': ""So labels are weird, especially when it comes to gender. So far I've used genderfluid, genderqueer, nonbinary, trans feminine. I think polygender and/or pangender might be one of the more accurate labels for myself. I've seen a lot of nonbinary folk say say they're neither male nor female, but for me I feel like yes both and more please. All the genders. I've got genders like I've got bad habits. Wanna borrow one?"", 'subreddit': 'NonBinaryTalk', 'title': 'Further explorations and realizations of self', 'created': 1581313269.0}"
2020-02-10 04:06:59,f1kswv,1,1,,NonBinaryTalk,This is genius,1581332819.0,"{'created_utc': 1581307619, 'id': 'f1kswv', 'num_comments': 1, 'score': 1, 'selftext': '', 'subreddit': 'NonBinaryTalk', 'title': 'This is genius', 'created': 1581332819.0}"
2020-02-10 04:51:23,f1lbq7,0,1,,NonBinaryTalk,am I genderfluid?,1581335483.0,"{'created_utc': 1581310283, 'id': 'f1lbq7', 'num_comments': 0, 'score': 1, 'selftext': '', 'subreddit': 'NonBinaryTalk', 'title': 'am I genderfluid?', 'created': 1581335483.0}"
2020-02-10 16:56:38,f1t4i0,14,1,,NonBinaryTalk,I use dude for everything.,1581378998.0,"{'created_utc': 1581353798, 'id': 'f1t4i0', 'num_comments': 14, 'score': 1, 'selftext': '', 'subreddit': 'NonBinaryTalk', 'title': 'I use dude for everything.', 'created': 1581378998.0}"
2020-02-10 17:21:50,f1thz7,4,1,"Hey y'all, I'm trying to find some gender neutral terms for things like bride/groom and king/queen, or like boyfriend/girlfriend. I know there are things like partner or significant other, but I just feel like those are almost... idk, dismissive? Those terms just feel sort of impersonal and like blanket terms. I want more specific terms ya know?

Anyone know any alternative terms?",NonBinaryTalk,Looking for gender neutral terms,1581380510.0,"{'created_utc': 1581355310, 'id': 'f1thz7', 'num_comments': 4, 'score': 1, 'selftext': ""Hey y'all, I'm trying to find some gender neutral terms for things like bride/groom and king/queen, or like boyfriend/girlfriend. I know there are things like partner or significant other, but I just feel like those are almost... idk, dismissive? Those terms just feel sort of impersonal and like blanket terms. I want more specific terms ya know?\n\nAnyone know any alternative terms?"", 'subreddit': 'NonBinaryTalk', 'title': 'Looking for gender neutral terms', 'created': 1581380510.0}"
