created_utc,id,num_comments,score,selftext,subreddit,title,created,d_
2016-04-18 19:40:02,4fdmwv,3,3,"Just trying to find some videos to show a class. I hate it when nature documentaries will try to be all anthropomorphic cutesy, like [this one's](https://www.youtube.com/watch?v=YH1ytkBM69Q) use of ""devious drag act"" and ""cross-dresser.""",genderqueer,I hate nature documentary narration (I mean except Attenborough voice),1461033602.0,"{'created_utc': 1461008402, 'id': '4fdmwv', 'num_comments': 3, 'score': 3, 'selftext': 'Just trying to find some videos to show a class. I hate it when nature documentaries will try to be all anthropomorphic cutesy, like [this one\'s](https://www.youtube.com/watch?v=YH1ytkBM69Q) use of ""devious drag act"" and ""cross-dresser.""', 'subreddit': 'genderqueer', 'title': 'I hate nature documentary narration (I mean except Attenborough voice)', 'created': 1461033602.0}"
2016-04-18 20:31:10,4fdw62,2,9,,genderqueer,Gender Identity and Associated Gender Language: A Primer,1461036670.0,"{'created_utc': 1461011470, 'id': '4fdw62', 'num_comments': 2, 'score': 9, 'selftext': '', 'subreddit': 'genderqueer', 'title': 'Gender Identity and Associated Gender Language: A Primer', 'created': 1461036670.0}"
2016-04-19 01:25:17,4ff7gx,21,14,"Hi there,
Random question - are there any butches, genderqueer (non-FTM) folks who have had top surgery?  After surgery have you gone to the beach topless?",genderqueer,top surgery for nonFTM,1461054317.0,"{'created_utc': 1461029117, 'id': '4ff7gx', 'num_comments': 21, 'score': 14, 'selftext': 'Hi there,\nRandom question - are there any butches, genderqueer (non-FTM) folks who have had top surgery?  After surgery have you gone to the beach topless?', 'subreddit': 'genderqueer', 'title': 'top surgery for nonFTM', 'created': 1461054317.0}"
2016-04-19 01:44:32,4ffaiz,0,0,[deleted],genderqueer,ambiguity [nsfw],1461055472.0,"{'created_utc': 1461030272, 'id': '4ffaiz', 'num_comments': 0, 'score': 0, 'selftext': '[deleted]', 'subreddit': 'genderqueer', 'title': 'ambiguity [nsfw]', 'created': 1461055472.0}"
2016-04-19 03:27:14,4ffq7h,0,2,[deleted],genderqueer,"Took this subs advice, and went a bit more andro. Very happy with the results, though my eyeliner is a bit rough. Any more advice?",1461061634.0,"{'created_utc': 1461036434, 'id': '4ffq7h', 'num_comments': 0, 'score': 2, 'selftext': '[deleted]', 'subreddit': 'genderqueer', 'title': 'Took this subs advice, and went a bit more andro. Very happy with the results, though my eyeliner is a bit rough. Any more advice?', 'created': 1461061634.0}"
2016-04-19 04:12:15,4ffwhk,3,23,[deleted],genderqueer,"Follow up post. Wanted to be a bit more androgynous, so I followed the advice I was given on here. I'm very happy with the results. :)",1461064335.0,"{'created_utc': 1461039135, 'id': '4ffwhk', 'num_comments': 3, 'score': 23, 'selftext': '[deleted]', 'subreddit': 'genderqueer', 'title': ""Follow up post. Wanted to be a bit more androgynous, so I followed the advice I was given on here. I'm very happy with the results. :)"", 'created': 1461064335.0}"
2016-04-19 10:59:22,4fh1l3,1,23,,genderqueer,Hiding your hair under a beanie is short hair without the commitment!,1461088762.0,"{'created_utc': 1461063562, 'id': '4fh1l3', 'num_comments': 1, 'score': 23, 'selftext': '', 'subreddit': 'genderqueer', 'title': 'Hiding your hair under a beanie is short hair without the commitment!', 'created': 1461088762.0}"
2016-04-19 15:15:00,4fi1qx,0,1,[deleted],genderqueer,What the hell is gender?,1461104100.0,"{'created_utc': 1461078900, 'id': '4fi1qx', 'num_comments': 0, 'score': 1, 'selftext': '[deleted]', 'subreddit': 'genderqueer', 'title': 'What the hell is gender?', 'created': 1461104100.0}"
2016-04-19 21:58:48,4fk0vm,35,34,"(Excuse the long off-my-chest post as I try to write my feelings out for myself.)

I'm baffled by gender and I'm baffled by my identity.

I'm female and I like girls. I'm 22. I've never understood what it means to be a woman or feel like one. I've also never really understood what it means to be a man. Everyone I know easily (and sometimes strongly) identifies with their sex, gender, and sexuality and I feel like I'm left out, confused, and frustrated.

I want to be one or the either but I feel stifled and conflicted and depressed when I'm forced into one box or the other. I don't want to go by alternative pronouns and be referred to as some ""other"".

But when people refer to me as a girl I feel awkward. They're not wrong... But they're not quite right either? I'm completely fine with being identified as a daughter and a sister, but being a girl and a woman is something weird and almost distant to me. It's not the social roles or expectations of girls/women that bother me as some people have asked me -- I don't give a flying fuck about those and have disregarded them from the time I was little (""I do what I want, bitch"" is generally my philosophy).

When I was in middle/high school I thought I was FtM transgender. If I wasn't a girl, surely I was a boy? My parents sent me to a counselor (not to punish me, but so that I could talk through my feelings and due to other depression-related reasons) and I was talked into? identifying as a lesbian.

So I carried along in my high school years as a fairly closeted ""butchy"" lesbian still fairly uncomfortable with myself but happier that I had some kind of label. I still felt awkward about my body (particularly my chest), about using the bathrooms and locker-rooms, and being assigned in girl-boy arrangements.

And then here comes college. I go away from my home in little ol' Vermont to Montana to try and catch a breath of fresh air and some change. Without my mother's nitpicking on what I wear I bought a new wardrobe of masculine/men's clothing, a proper binder (or two), and for the first time in a while felt more content and happy with myself looking how I wanted to look. I was still in the closet to the outside world regarding anything and everything but I joined the university's queer alliance club and finally got to interact with more than just a handful of LGBTQ identifying folk. I didn't know how to identify myself to the group and shirked away from any further labels but I made a few friends. People within the group assumed I was FtM transgender due to the way I dressed, talked, and carried myself however I shied away from identifying myself as such. I wasn't a butch lesbian because lesbians, even butch, intrinsically identify as women but I didn't quite feel transgender either as I didn't really care about what was between my legs and if people referred to me as male or female.

I had to leave Montana and come back to Vermont as I couldn't cope with the harassment I was experiencing. My parents were more accepting of how I presented myself (not that they never didn't accept me, but I think my mom had difficulty accepting her oldest daughter wasn't the feminine princess she had when I was 2-6 years old). I was happy doing whatever the fuck I wanted.

This past year I tried, I really really tried, experimenting with my femininity. I grew my hair out for the first time since I was 9 years old. I dabbled in make-up. I bought more feminine clothing. It was fun, don't get me wrong, to play with make-up and make myself look like this bizarre foreign being and dressing up in pretty clothes. I don't mind too much wearing dresses to formal/business events as long as the dress is ""my style"" (conservative, plain, solid colors, a-line). But what I didn't realize until I cut my hair short again recently is that every time I looked in the mirror I was looking at a stranger. A pretender. I don't know how to describe it, it's not like hair or dressing a certain way should really *matter* if I'm happy with myself or know who I am, but it didn't make me feel like me and it made me depressed. It was fun for a while and then it became a burden and an expectation.

I cut my hair short again and I looked in the mirror. There was the boy-ish androgynous face I knew looking back at me. My hair cut and styled how I always had it. A sports bra to diminish my breasts and a dumb t-shirt. There was me again. But at the same time... What am I?

I feel like a nothing. Like a blank person. I tell my friends that ""I'm just me!"" but feeling like you have no real identity sucks, as much as I claim not to care. I just want to be happy saying I'm a guy or a girl and not terribly conflicted and confused about what it means.",genderqueer,What the hell is gender?,1461128328.0,"{'created_utc': 1461103128, 'id': '4fk0vm', 'num_comments': 35, 'score': 34, 'selftext': '(Excuse the long off-my-chest post as I try to write my feelings out for myself.)\n\nI\'m baffled by gender and I\'m baffled by my identity.\n\nI\'m female and I like girls. I\'m 22. I\'ve never understood what it means to be a woman or feel like one. I\'ve also never really understood what it means to be a man. Everyone I know easily (and sometimes strongly) identifies with their sex, gender, and sexuality and I feel like I\'m left out, confused, and frustrated.\n\nI want to be one or the either but I feel stifled and conflicted and depressed when I\'m forced into one box or the other. I don\'t want to go by alternative pronouns and be referred to as some ""other"".\n\nBut when people refer to me as a girl I feel awkward. They\'re not wrong... But they\'re not quite right either? I\'m completely fine with being identified as a daughter and a sister, but being a girl and a woman is something weird and almost distant to me. It\'s not the social roles or expectations of girls/women that bother me as some people have asked me -- I don\'t give a flying fuck about those and have disregarded them from the time I was little (""I do what I want, bitch"" is generally my philosophy).\n\nWhen I was in middle/high school I thought I was FtM transgender. If I wasn\'t a girl, surely I was a boy? My parents sent me to a counselor (not to punish me, but so that I could talk through my feelings and due to other depression-related reasons) and I was talked into? identifying as a lesbian.\n\nSo I carried along in my high school years as a fairly closeted ""butchy"" lesbian still fairly uncomfortable with myself but happier that I had some kind of label. I still felt awkward about my body (particularly my chest), about using the bathrooms and locker-rooms, and being assigned in girl-boy arrangements.\n\nAnd then here comes college. I go away from my home in little ol\' Vermont to Montana to try and catch a breath of fresh air and some change. Without my mother\'s nitpicking on what I wear I bought a new wardrobe of masculine/men\'s clothing, a proper binder (or two), and for the first time in a while felt more content and happy with myself looking how I wanted to look. I was still in the closet to the outside world regarding anything and everything but I joined the university\'s queer alliance club and finally got to interact with more than just a handful of LGBTQ identifying folk. I didn\'t know how to identify myself to the group and shirked away from any further labels but I made a few friends. People within the group assumed I was FtM transgender due to the way I dressed, talked, and carried myself however I shied away from identifying myself as such. I wasn\'t a butch lesbian because lesbians, even butch, intrinsically identify as women but I didn\'t quite feel transgender either as I didn\'t really care about what was between my legs and if people referred to me as male or female.\n\nI had to leave Montana and come back to Vermont as I couldn\'t cope with the harassment I was experiencing. My parents were more accepting of how I presented myself (not that they never didn\'t accept me, but I think my mom had difficulty accepting her oldest daughter wasn\'t the feminine princess she had when I was 2-6 years old). I was happy doing whatever the fuck I wanted.\n\nThis past year I tried, I really really tried, experimenting with my femininity. I grew my hair out for the first time since I was 9 years old. I dabbled in make-up. I bought more feminine clothing. It was fun, don\'t get me wrong, to play with make-up and make myself look like this bizarre foreign being and dressing up in pretty clothes. I don\'t mind too much wearing dresses to formal/business events as long as the dress is ""my style"" (conservative, plain, solid colors, a-line). But what I didn\'t realize until I cut my hair short again recently is that every time I looked in the mirror I was looking at a stranger. A pretender. I don\'t know how to describe it, it\'s not like hair or dressing a certain way should really *matter* if I\'m happy with myself or know who I am, but it didn\'t make me feel like me and it made me depressed. It was fun for a while and then it became a burden and an expectation.\n\nI cut my hair short again and I looked in the mirror. There was the boy-ish androgynous face I knew looking back at me. My hair cut and styled how I always had it. A sports bra to diminish my breasts and a dumb t-shirt. There was me again. But at the same time... What am I?\n\nI feel like a nothing. Like a blank person. I tell my friends that ""I\'m just me!"" but feeling like you have no real identity sucks, as much as I claim not to care. I just want to be happy saying I\'m a guy or a girl and not terribly conflicted and confused about what it means.', 'subreddit': 'genderqueer', 'title': 'What the hell is gender?', 'created': 1461128328.0}"
2016-04-20 02:09:19,4fl41a,6,16,"Today Facebook reminded me that my junior prom was several years ago today. I checked out the photos and was reminded of how much I hated being femme! I never wore makeup or did my hair, so dressing up for prom made me extremely uncomfortable. Idk if it shows in the photos, but when I look at them, all I can think is how much I disliked myself at that time. Anyways here's the photos, plus a bonus of me now, not giving a fuck about femininity. 
Prom 2009: http://m.imgur.com/LT6eeMr
2015: http://m.imgur.com/jkYVcav

(Idk how to format on reddit mobile so sorry for the links)",genderqueer,"Facebook memories reminding me of when I still attempted to be ""feminine""...",1461143359.0,"{'created_utc': 1461118159, 'id': '4fl41a', 'num_comments': 6, 'score': 16, 'selftext': ""Today Facebook reminded me that my junior prom was several years ago today. I checked out the photos and was reminded of how much I hated being femme! I never wore makeup or did my hair, so dressing up for prom made me extremely uncomfortable. Idk if it shows in the photos, but when I look at them, all I can think is how much I disliked myself at that time. Anyways here's the photos, plus a bonus of me now, not giving a fuck about femininity. \nProm 2009: http://m.imgur.com/LT6eeMr\n2015: http://m.imgur.com/jkYVcav\n\n(Idk how to format on reddit mobile so sorry for the links)"", 'subreddit': 'genderqueer', 'title': 'Facebook memories reminding me of when I still attempted to be ""feminine""...', 'created': 1461143359.0}"
2016-04-20 03:17:02,4fleek,0,1,[removed],genderqueer,Unsure about things (x-post from /r/lgbt),1461147422.0,"{'created_utc': 1461122222, 'id': '4fleek', 'num_comments': 0, 'score': 1, 'selftext': '[removed]', 'subreddit': 'genderqueer', 'title': 'Unsure about things (x-post from /r/lgbt)', 'created': 1461147422.0}"
2016-04-20 04:21:44,4fln5f,8,3,"I hope this is the right sub to be posting this too, and apologise if it isn't! If not, could someone direct me to somewhere more appropriate? 

I don't really know how to start this. I'm already 19 years old, and I've been questioning questioning my gender expression for only a few months, maybe more. I've always actively thought that I was completely comfortable with my identity of a cis woman, but lately thoughts and ideas have been creeping in. 

I've always 'admired' (I suppose that's not the correct word, but it's the best I could think of) the top half men's bodies; the long, flat torso/chest, the straight up and down waist/hips, etc. At first I thought it was simple attraction, but it's progressed to the point that I want it for myself. I've been looking at binders and such. 

My question really is, what's going on with me? I'm still totally comfortable and happy identifying as a woman, but I don't know anyone else who wants to conform their body to fit the 'typical' average of the other sex. The thoughts are getting more and more persistent (as they have over the past couple of months). I've started realising the men I've found myself 'attracted' to, are really men I want to look like. 

I'm very confused and haven't found anything to fit what I think is happening. I can't say it's gender dysphoria, as I mentioned before, I'm very happy identifying as a woman. Body dysphoria didn't really seem to cover it either. I was wondering if anyone else experienced/s this, or something similar? Apologies for the long essay and thank you in advance to anyone who has anything to contribute!",genderqueer,Not Sure What's Happening,1461151304.0,"{'created_utc': 1461126104, 'id': '4fln5f', 'num_comments': 8, 'score': 3, 'selftext': ""I hope this is the right sub to be posting this too, and apologise if it isn't! If not, could someone direct me to somewhere more appropriate? \n\nI don't really know how to start this. I'm already 19 years old, and I've been questioning questioning my gender expression for only a few months, maybe more. I've always actively thought that I was completely comfortable with my identity of a cis woman, but lately thoughts and ideas have been creeping in. \n\nI've always 'admired' (I suppose that's not the correct word, but it's the best I could think of) the top half men's bodies; the long, flat torso/chest, the straight up and down waist/hips, etc. At first I thought it was simple attraction, but it's progressed to the point that I want it for myself. I've been looking at binders and such. \n\nMy question really is, what's going on with me? I'm still totally comfortable and happy identifying as a woman, but I don't know anyone else who wants to conform their body to fit the 'typical' average of the other sex. The thoughts are getting more and more persistent (as they have over the past couple of months). I've started realising the men I've found myself 'attracted' to, are really men I want to look like. \n\nI'm very confused and haven't found anything to fit what I think is happening. I can't say it's gender dysphoria, as I mentioned before, I'm very happy identifying as a woman. Body dysphoria didn't really seem to cover it either. I was wondering if anyone else experienced/s this, or something similar? Apologies for the long essay and thank you in advance to anyone who has anything to contribute!"", 'subreddit': 'genderqueer', 'title': ""Not Sure What's Happening"", 'created': 1461151304.0}"
2016-04-20 08:52:58,4fmgj5,4,3,"It was suggested that I post this here as well, as this was first posted on /r/lgbt.
Here's the post.

----
Hi. Posting this on a throwaway account, just in case. Let's start things off with the basics - I'm 16, and I'm bisexual. That's what I know for sure. I've been thinking about stuff lately, and have realised that I might be agender, or something along those lines. However, I'm not sure about this, and don't really know where to start in terms of figuring out if this is who I am, and would like some advice. Thanks.",genderqueer,Unsure about things,1461167578.0,"{'created_utc': 1461142378, 'id': '4fmgj5', 'num_comments': 4, 'score': 3, 'selftext': ""It was suggested that I post this here as well, as this was first posted on /r/lgbt.\nHere's the post.\n\n----\nHi. Posting this on a throwaway account, just in case. Let's start things off with the basics - I'm 16, and I'm bisexual. That's what I know for sure. I've been thinking about stuff lately, and have realised that I might be agender, or something along those lines. However, I'm not sure about this, and don't really know where to start in terms of figuring out if this is who I am, and would like some advice. Thanks."", 'subreddit': 'genderqueer', 'title': 'Unsure about things', 'created': 1461167578.0}"
2016-04-20 09:57:47,4fmmoz,0,14,,genderqueer,"Everybody poops, even trans people",1461171467.0,"{'created_utc': 1461146267, 'id': '4fmmoz', 'num_comments': 0, 'score': 14, 'selftext': '', 'subreddit': 'genderqueer', 'title': 'Everybody poops, even trans people', 'created': 1461171467.0}"
2016-04-20 11:30:23,4fmvp2,10,10,"Hi all. Interested to hear whether other non-binary folks have had the desire to medically transition to some degree but not necessarily socially transition to the 'other' (binary) gender.

It'd be real nice if no-one ever assumed my gender and I could live fully in the world as a NB person but that isn't happening any time soon. I'm afab and currently 10 weeks on T. I think when I started trying to get on T I was kinda thinking I could partially transition to some kind of andro/masc-ish person and still keep my legal name and 'pass' as a woman in the workplace (and wider society, bureaucratic stuff etc). But that seems less and less realistic. And I guess my ideal gendered self-image at the moment involves dressing pretty femme but on quite a masculinised body. But the idea of being gendered as a dude freaks me out even more than being gendered as a woman does (I dunno, the woman thing is incorrect but at least its familiar?) Anyone had similar or related experiences?",genderqueer,Medical transition without social transition?,1461177023.0,"{'created_utc': 1461151823, 'id': '4fmvp2', 'num_comments': 10, 'score': 10, 'selftext': ""Hi all. Interested to hear whether other non-binary folks have had the desire to medically transition to some degree but not necessarily socially transition to the 'other' (binary) gender.\n\nIt'd be real nice if no-one ever assumed my gender and I could live fully in the world as a NB person but that isn't happening any time soon. I'm afab and currently 10 weeks on T. I think when I started trying to get on T I was kinda thinking I could partially transition to some kind of andro/masc-ish person and still keep my legal name and 'pass' as a woman in the workplace (and wider society, bureaucratic stuff etc). But that seems less and less realistic. And I guess my ideal gendered self-image at the moment involves dressing pretty femme but on quite a masculinised body. But the idea of being gendered as a dude freaks me out even more than being gendered as a woman does (I dunno, the woman thing is incorrect but at least its familiar?) Anyone had similar or related experiences?"", 'subreddit': 'genderqueer', 'title': 'Medical transition without social transition?', 'created': 1461177023.0}"
2016-04-20 17:26:02,4fogk2,1,8,,genderqueer,"Gender-neutral model, transgender man speak out against HB2; call for full repeal",1461198362.0,"{'created_utc': 1461173162, 'id': '4fogk2', 'num_comments': 1, 'score': 8, 'selftext': '', 'subreddit': 'genderqueer', 'title': 'Gender-neutral model, transgender man speak out against HB2; call for full repeal', 'created': 1461198362.0}"
2016-04-20 19:20:05,4fp18e,1,28,"Not sure I'm 100% comfortable with posting this everywhere and everyone seeing it, but oh well. 

I posted a little while ago about finding resources for trans survivors of sexual abuse and assault, and someone (I forget who) suggested making a sub for it, so I did. It's at transsurvivors and is very quiet just now, but if you want to come and lurk/share your experiences/just have a chat, please come and have a look. 


Oh, also, if it helps anyone feel more comfortable, I'm genderqueer, so it's definitely not just a space for binary trans people. ",genderqueer,I made a subreddit for trans survivors (x-posted with various other subs),1461205205.0,"{'created_utc': 1461180005, 'id': '4fp18e', 'num_comments': 1, 'score': 28, 'selftext': ""Not sure I'm 100% comfortable with posting this everywhere and everyone seeing it, but oh well. \n\nI posted a little while ago about finding resources for trans survivors of sexual abuse and assault, and someone (I forget who) suggested making a sub for it, so I did. It's at transsurvivors and is very quiet just now, but if you want to come and lurk/share your experiences/just have a chat, please come and have a look. \n\n\nOh, also, if it helps anyone feel more comfortable, I'm genderqueer, so it's definitely not just a space for binary trans people. "", 'subreddit': 'genderqueer', 'title': 'I made a subreddit for trans survivors (x-posted with various other subs)', 'created': 1461205205.0}"
2016-04-20 20:02:26,4fp8y7,12,10,"Hi ya'll, so I've been more comfortable with my gender identity lately. And I was wondering how to dress more feminine or genderless without portraying masculinity. If it helps I'm AMAB.
",genderqueer,Dressing more femme and genderless,1461207746.0,"{'created_utc': 1461182546, 'id': '4fp8y7', 'num_comments': 12, 'score': 10, 'selftext': ""Hi ya'll, so I've been more comfortable with my gender identity lately. And I was wondering how to dress more feminine or genderless without portraying masculinity. If it helps I'm AMAB.\n"", 'subreddit': 'genderqueer', 'title': 'Dressing more femme and genderless', 'created': 1461207746.0}"
2016-04-20 22:43:29,4fq0kx,5,9,,genderqueer,"Students, protesters fight outside L.A. school that recently installed gender-neutral bathrooms.",1461217409.0,"{'created_utc': 1461192209, 'id': '4fq0kx', 'num_comments': 5, 'score': 9, 'selftext': '', 'subreddit': 'genderqueer', 'title': 'Students, protesters fight outside L.A. school that recently installed gender-neutral bathrooms.', 'created': 1461217409.0}"
