created_utc,id,num_comments,score,selftext,subreddit,title,created,d_
2016-04-05 15:06:16,4dgtcs,7,29,,genderqueer,PayPal pulls North Carolina center over new LGBT law,1459893976.0,"{'created_utc': 1459868776, 'id': '4dgtcs', 'num_comments': 7, 'score': 29, 'selftext': '', 'subreddit': 'genderqueer', 'title': 'PayPal pulls North Carolina center over new LGBT law', 'created': 1459893976.0}"
2016-04-05 17:10:47,4dhegk,5,6,"I just got a binder and I love it and it's very comfortable! But my boobs don't stay in place. I pull them apart after I get the binder on to give a flatter appearance, but they just work their way back to the center within a minute or two. I think it might be because I'm fairly small chested anyway? I think it just looks like I'm wearing a sports bra, which is okay because I've just been braless for years because it hurts to wear a bra, and my binder is the tank top style and it's much more comfortable to me. So, I look flatter, but not as flat as I'd like. Is there anything I can do to look even flatter? I don't think the next size down would fit me.",genderqueer,Question about binding,1459901447.0,"{'created_utc': 1459876247, 'id': '4dhegk', 'num_comments': 5, 'score': 6, 'selftext': ""I just got a binder and I love it and it's very comfortable! But my boobs don't stay in place. I pull them apart after I get the binder on to give a flatter appearance, but they just work their way back to the center within a minute or two. I think it might be because I'm fairly small chested anyway? I think it just looks like I'm wearing a sports bra, which is okay because I've just been braless for years because it hurts to wear a bra, and my binder is the tank top style and it's much more comfortable to me. So, I look flatter, but not as flat as I'd like. Is there anything I can do to look even flatter? I don't think the next size down would fit me."", 'subreddit': 'genderqueer', 'title': 'Question about binding', 'created': 1459901447.0}"
2016-04-05 20:56:22,4digka,0,3,,genderqueer,Pennsylvania: Pine-Richland school district faces questions about transgender bathroom practices. Parents were recently made aware of practice that's been in place 'for years' with no incidents.,1459914982.0,"{'created_utc': 1459889782, 'id': '4digka', 'num_comments': 0, 'score': 3, 'selftext': '', 'subreddit': 'genderqueer', 'title': ""Pennsylvania: Pine-Richland school district faces questions about transgender bathroom practices. Parents were recently made aware of practice that's been in place 'for years' with no incidents."", 'created': 1459914982.0}"
2016-04-05 22:05:50,4dirx0,2,11,,genderqueer,This Is What It's Like to Raise a Gender-Neutral Child,1459919150.0,"{'created_utc': 1459893950, 'id': '4dirx0', 'num_comments': 2, 'score': 11, 'selftext': '', 'subreddit': 'genderqueer', 'title': ""This Is What It's Like to Raise a Gender-Neutral Child"", 'created': 1459919150.0}"
2016-04-05 23:19:53,4dj3c9,7,9,"Feeling like a fraud. I've always identified as a lesbian, at first I didn't know that meant but now that I know I'm trans it makes sense (sort of).

Only problem is I don't know if I'll ever medically transition. Every time I go on HRT it makes me doubtful (on a low dose at the moment and I'm still having moments where I consider stopping). Gotta discuss this with the gender therapist I suppose.
It just makes me feel like a big old phony that I'm not sure what I want for myself and yet I still feel like a woman and a lesbian, but I'm okay with my body to an extent? The extent being I don't want any further masculine development, but if I could be a super androgynous dude shaped person then maybe I'd be okay with myself? The other alternative is that I'm a super androgynous woman shaped person, but i don't know.

Also lately I've been getting anxiety and I'm not sure if it's because I have small boobs and wish I had no boobs, or if it's because I have small boobs and want them to be more complete.

HRT is just another form of confusing at the moment :'( but I don't want to stop my low dose E because I don't want that masculinisation I was talking about. At the same time I don't know if this is what I want. I've heard about SERMs but I don't know if they're an option. And it's all just blegh. 

I don't even know anymore. Sorry for the random rant. Just needed to say it. Everytime I feel like I've got my shit sorted my brain plays up again. 
",genderqueer,Confused rant. Feeling like a fraud.,1459923593.0,"{'created_utc': 1459898393, 'id': '4dj3c9', 'num_comments': 7, 'score': 9, 'selftext': ""Feeling like a fraud. I've always identified as a lesbian, at first I didn't know that meant but now that I know I'm trans it makes sense (sort of).\n\nOnly problem is I don't know if I'll ever medically transition. Every time I go on HRT it makes me doubtful (on a low dose at the moment and I'm still having moments where I consider stopping). Gotta discuss this with the gender therapist I suppose.\nIt just makes me feel like a big old phony that I'm not sure what I want for myself and yet I still feel like a woman and a lesbian, but I'm okay with my body to an extent? The extent being I don't want any further masculine development, but if I could be a super androgynous dude shaped person then maybe I'd be okay with myself? The other alternative is that I'm a super androgynous woman shaped person, but i don't know.\n\nAlso lately I've been getting anxiety and I'm not sure if it's because I have small boobs and wish I had no boobs, or if it's because I have small boobs and want them to be more complete.\n\nHRT is just another form of confusing at the moment :'( but I don't want to stop my low dose E because I don't want that masculinisation I was talking about. At the same time I don't know if this is what I want. I've heard about SERMs but I don't know if they're an option. And it's all just blegh. \n\nI don't even know anymore. Sorry for the random rant. Just needed to say it. Everytime I feel like I've got my shit sorted my brain plays up again. \n"", 'subreddit': 'genderqueer', 'title': 'Confused rant. Feeling like a fraud.', 'created': 1459923593.0}"
2016-04-06 13:43:21,4dls9k,15,13,"I just came out as a male-bodied genderqueer. My spouse has always liked my androgynous gender nonconformity, but she can't handle the fact that I shaved off my beard. She has pretty severe PTSD based on childhood trauma and my face without the beard reminds her of her abuser somehow. The last thing I want to do is retraumatize her, but I also very much want to present more femme. Any thoughts on femme looks with beards?",genderqueer,Femmy beards?,1459975401.0,"{'created_utc': 1459950201, 'id': '4dls9k', 'num_comments': 15, 'score': 13, 'selftext': ""I just came out as a male-bodied genderqueer. My spouse has always liked my androgynous gender nonconformity, but she can't handle the fact that I shaved off my beard. She has pretty severe PTSD based on childhood trauma and my face without the beard reminds her of her abuser somehow. The last thing I want to do is retraumatize her, but I also very much want to present more femme. Any thoughts on femme looks with beards?"", 'subreddit': 'genderqueer', 'title': 'Femmy beards?', 'created': 1459975401.0}"
2016-04-06 15:02:16,4dm403,3,20,,genderqueer,"Bathroom Bills, Selfies, and the Erasure of Nonbinary Trans People",1459980136.0,"{'created_utc': 1459954936, 'id': '4dm403', 'num_comments': 3, 'score': 20, 'selftext': '', 'subreddit': 'genderqueer', 'title': 'Bathroom Bills, Selfies, and the Erasure of Nonbinary Trans People', 'created': 1459980136.0}"
2016-04-06 22:38:20,4do79m,1,1,,genderqueer,South Carolina Senator introduces LGBT public bathroom bill that mirrors N.C. law,1460007500.0,"{'created_utc': 1459982300, 'id': '4do79m', 'num_comments': 1, 'score': 1, 'selftext': '', 'subreddit': 'genderqueer', 'title': 'South Carolina Senator introduces LGBT public bathroom bill that mirrors N.C. law', 'created': 1460007500.0}"
2016-04-07 12:20:11,4dqruk,12,23,"So my (much younger) cousin has just come out to my extended family as a trans man and I'm so so happy for him but also (somewhat narcissisticly) don't know what it means for me. He's been out for years now as a 'lesbian' and as a bi/queer person who passes so easily for straight I've probably harboured some envy towards him and what he stands for - a queer youth that I never experienced and a queer legitimacy that I never had access to. His binary trans-ness against my wishy-washy no-fucking-idea-what-I-am-or-what-I'm-doing non-binary transition just makes me feel a bit 'not trans/queer enough'.

The feeling of not being trans enough - how do you deal?",genderqueer,Binary envy and 'not trans enough',1460056811.0,"{'created_utc': 1460031611, 'id': '4dqruk', 'num_comments': 12, 'score': 23, 'selftext': ""So my (much younger) cousin has just come out to my extended family as a trans man and I'm so so happy for him but also (somewhat narcissisticly) don't know what it means for me. He's been out for years now as a 'lesbian' and as a bi/queer person who passes so easily for straight I've probably harboured some envy towards him and what he stands for - a queer youth that I never experienced and a queer legitimacy that I never had access to. His binary trans-ness against my wishy-washy no-fucking-idea-what-I-am-or-what-I'm-doing non-binary transition just makes me feel a bit 'not trans/queer enough'.\n\nThe feeling of not being trans enough - how do you deal?"", 'subreddit': 'genderqueer', 'title': ""Binary envy and 'not trans enough'"", 'created': 1460056811.0}"
2016-04-07 14:42:20,4drc27,0,2,,genderqueer,North Carolina's War Against Gender-Nonconforming People,1460065340.0,"{'created_utc': 1460040140, 'id': '4drc27', 'num_comments': 0, 'score': 2, 'selftext': '', 'subreddit': 'genderqueer', 'title': ""North Carolina's War Against Gender-Nonconforming People"", 'created': 1460065340.0}"
2016-04-07 16:39:06,4drvom,13,95,"It's not as feminine as I'd've liked to present, but I went to work in a pretty floral skirt and nobody cared and it was awesome! (And all of my friends are busy and far away so I needed to squee to somebody.)

http://imgur.com/XJZR5wp",genderqueer,Wore a skirt to work!,1460072346.0,"{'created_utc': 1460047146, 'id': '4drvom', 'num_comments': 13, 'score': 95, 'selftext': ""It's not as feminine as I'd've liked to present, but I went to work in a pretty floral skirt and nobody cared and it was awesome! (And all of my friends are busy and far away so I needed to squee to somebody.)\n\nhttp://imgur.com/XJZR5wp"", 'subreddit': 'genderqueer', 'title': 'Wore a skirt to work!', 'created': 1460072346.0}"
2016-04-07 18:42:15,4dshd7,7,46,,genderqueer,"I got a haircut, am I still cute?",1460079735.0,"{'created_utc': 1460054535, 'id': '4dshd7', 'num_comments': 7, 'score': 46, 'selftext': '', 'subreddit': 'genderqueer', 'title': 'I got a haircut, am I still cute?', 'created': 1460079735.0}"
2016-04-07 18:48:25,4dsig9,0,1,[deleted],genderqueer,"Preferred name, Elle!",1460080105.0,"{'created_utc': 1460054905, 'id': '4dsig9', 'num_comments': 0, 'score': 1, 'selftext': '[deleted]', 'subreddit': 'genderqueer', 'title': 'Preferred name, Elle!', 'created': 1460080105.0}"
2016-04-07 21:11:02,4dt6er,0,1,[removed],genderqueer,I created a survey to compare the media narrative of transgender people vs real life experiences!,1460088662.0,"{'created_utc': 1460063462, 'id': '4dt6er', 'num_comments': 0, 'score': 1, 'selftext': '[removed]', 'subreddit': 'genderqueer', 'title': 'I created a survey to compare the media narrative of transgender people vs real life experiences!', 'created': 1460088662.0}"
2016-04-08 14:00:53,4dwi41,1,2,[deleted],genderqueer,Discovering who I am,1460149253.0,"{'created_utc': 1460124053, 'id': '4dwi41', 'num_comments': 1, 'score': 2, 'selftext': '[deleted]', 'subreddit': 'genderqueer', 'title': 'Discovering who I am', 'created': 1460149253.0}"
2016-04-08 17:57:33,4dxkok,3,27,,genderqueer,West Virginia University to offer gender-neutral housing,1460163453.0,"{'created_utc': 1460138253, 'id': '4dxkok', 'num_comments': 3, 'score': 27, 'selftext': '', 'subreddit': 'genderqueer', 'title': 'West Virginia University to offer gender-neutral housing', 'created': 1460163453.0}"
2016-04-08 20:12:57,4dy6nm,5,35,,genderqueer,‘Dungeons and Dragons’ creators defend your right to be an angry pansexual bearded female dwarf,1460171577.0,"{'created_utc': 1460146377, 'id': '4dy6nm', 'num_comments': 5, 'score': 35, 'selftext': '', 'subreddit': 'genderqueer', 'title': '‘Dungeons and Dragons’ creators defend your right to be an angry pansexual bearded female dwarf', 'created': 1460171577.0}"
2016-04-09 07:26:32,4e0fya,8,21,"Hi everyone,
34 years old/CA/not really a baby girl skunk, I was just looking at pictures of baby skunks when I made the user name. Aww.
Anyway.
So I've made a lot of progress in the past couple of days. I asked some questions on here at this sub as well as the Ask Transgender sub and Genderqueer, about low-dose T, top surgery, and all that. People have been really helpful which is great. I live in the Bay Area so I called the Pacific Center yesterday and will be going to a group therapy session/meeting for genderqueer and non-binary folks this coming week.
Then I called Lyon Martin, an LGBTQ+ health clinic, and got an appointment for medical care for next month as well as left a voicemail for their mental health department to get a gender therapist.
THEN, today, I spoke with Dr. Mosser's surgery clinic about top surgery and scheduled a free consultation for June because YOLO.
So I did all this and I've been trying to open up to people in my life a little more about how I'm feeling. On some level I feel this weird sort of giddy liberation. And I'm probably just emotionally exhausted after taking all these giant steps, but for whatever reason, instead of feeling happy and positive and liberated to be figuring this shit out, I also just feel:
sad that I didn't do this sooner.
sad that I feel this way at all.
sad that it's gotten worse over the years instead of better.
cheated out of a real childhood (I am FAAB and hit puberty at basically age 10, so there went that. got my period and then started growing boobs and I hated it and just felt like I would never be the same).
exhausted by the hat0rade I have run across on the Internet about gender-variant folks.
terrified of telling my parents any of this, yet feeling like I should include them in at least SOME statement about, ""Hi, I don't really think of myself as being 100% female and never have. It's okay if you keep calling me my name and using female pronouns and calling me your daughter because I am okay with being those things to you and I love you. But I just wanted to tell you my real feelings because I did not want to leave you completely out of such an important part of my life.""
really worried that there is something else chemically off with me that's somehow causing this, like borderline personality disorder or something. Or some manic episode or PMDD. I have not been diagnosed with any of these things but I am just not trusting my own feelings all of a sudden. Like what if I'm wrong about all this? What if I go back?
But I can't go back.
And god dammit, why should I, so I can keep being miserable and dysphoric and weird about everything for ANOTHER 20 years? Aw hell no.
So why can't I just be happy that I'm on this journey? Why am I so afraid?
TL;DR: UGH. Thanks for reading. &lt;3",genderqueer,cross-posted in /r/nonbinary; not feeling very stable tonight :-(,1460211992.0,"{'created_utc': 1460186792, 'id': '4e0fya', 'num_comments': 8, 'score': 21, 'selftext': 'Hi everyone,\n34 years old/CA/not really a baby girl skunk, I was just looking at pictures of baby skunks when I made the user name. Aww.\nAnyway.\nSo I\'ve made a lot of progress in the past couple of days. I asked some questions on here at this sub as well as the Ask Transgender sub and Genderqueer, about low-dose T, top surgery, and all that. People have been really helpful which is great. I live in the Bay Area so I called the Pacific Center yesterday and will be going to a group therapy session/meeting for genderqueer and non-binary folks this coming week.\nThen I called Lyon Martin, an LGBTQ+ health clinic, and got an appointment for medical care for next month as well as left a voicemail for their mental health department to get a gender therapist.\nTHEN, today, I spoke with Dr. Mosser\'s surgery clinic about top surgery and scheduled a free consultation for June because YOLO.\nSo I did all this and I\'ve been trying to open up to people in my life a little more about how I\'m feeling. On some level I feel this weird sort of giddy liberation. And I\'m probably just emotionally exhausted after taking all these giant steps, but for whatever reason, instead of feeling happy and positive and liberated to be figuring this shit out, I also just feel:\nsad that I didn\'t do this sooner.\nsad that I feel this way at all.\nsad that it\'s gotten worse over the years instead of better.\ncheated out of a real childhood (I am FAAB and hit puberty at basically age 10, so there went that. got my period and then started growing boobs and I hated it and just felt like I would never be the same).\nexhausted by the hat0rade I have run across on the Internet about gender-variant folks.\nterrified of telling my parents any of this, yet feeling like I should include them in at least SOME statement about, ""Hi, I don\'t really think of myself as being 100% female and never have. It\'s okay if you keep calling me my name and using female pronouns and calling me your daughter because I am okay with being those things to you and I love you. But I just wanted to tell you my real feelings because I did not want to leave you completely out of such an important part of my life.""\nreally worried that there is something else chemically off with me that\'s somehow causing this, like borderline personality disorder or something. Or some manic episode or PMDD. I have not been diagnosed with any of these things but I am just not trusting my own feelings all of a sudden. Like what if I\'m wrong about all this? What if I go back?\nBut I can\'t go back.\nAnd god dammit, why should I, so I can keep being miserable and dysphoric and weird about everything for ANOTHER 20 years? Aw hell no.\nSo why can\'t I just be happy that I\'m on this journey? Why am I so afraid?\nTL;DR: UGH. Thanks for reading. &lt;3', 'subreddit': 'genderqueer', 'title': 'cross-posted in /r/nonbinary; not feeling very stable tonight :-(', 'created': 1460211992.0}"
2016-04-09 21:00:18,4e307c,4,3,"So at the moment I am almost all the time thinking about gender and stuff and it is very exhausting. I can't get it off my head because when I try to be more focused on other things it sort of feels like I am suppressing my feelings.

Last night when I was finally able to fall asleep I had some odd dreams. I have already had dreams about wearing female things before that even arouse me sexually a lot (also during sleep). Back in the day I also crossdressed but I haven't since some months now.
So last night I was dreaming that I was buying a bra with my mum (as a guy) and it felt very good doing that. For some odd reason the bra we bought was made of bread. I know that doesnt make any sense and I have no idea what my mind wants to tell me with that. 
However later on I was with 2 girls from my class and I remember watching in a mirror seeing me with a full makeover and long hair, it looked beautiful.

I don't really know what to do right now. I think I might be genderfluid since I like my androgynous male body and behave sort of male naturally but the idea of presenting female is really tempting sometimes. I would not want to transition but I like the idea of having boobs. I don't always feel this female thrift, mostly when I am alone and have nothing to do.

The ideal scenario would be that I would come together with this girl I have a huge crush on and she understands my feelings and we can do girly things together as well.

However the best thing I can do right now is to do the things that feel right for me and not to care about labels too much.
Sometimes I just fear of exploring this side of me since it feels so strange. And maybe it is all due to borderline syndrom that I think I might have.

What do you think?",genderqueer,Some thoughts I have,1460260818.0,"{'created_utc': 1460235618, 'id': '4e307c', 'num_comments': 4, 'score': 3, 'selftext': ""So at the moment I am almost all the time thinking about gender and stuff and it is very exhausting. I can't get it off my head because when I try to be more focused on other things it sort of feels like I am suppressing my feelings.\n\nLast night when I was finally able to fall asleep I had some odd dreams. I have already had dreams about wearing female things before that even arouse me sexually a lot (also during sleep). Back in the day I also crossdressed but I haven't since some months now.\nSo last night I was dreaming that I was buying a bra with my mum (as a guy) and it felt very good doing that. For some odd reason the bra we bought was made of bread. I know that doesnt make any sense and I have no idea what my mind wants to tell me with that. \nHowever later on I was with 2 girls from my class and I remember watching in a mirror seeing me with a full makeover and long hair, it looked beautiful.\n\nI don't really know what to do right now. I think I might be genderfluid since I like my androgynous male body and behave sort of male naturally but the idea of presenting female is really tempting sometimes. I would not want to transition but I like the idea of having boobs. I don't always feel this female thrift, mostly when I am alone and have nothing to do.\n\nThe ideal scenario would be that I would come together with this girl I have a huge crush on and she understands my feelings and we can do girly things together as well.\n\nHowever the best thing I can do right now is to do the things that feel right for me and not to care about labels too much.\nSometimes I just fear of exploring this side of me since it feels so strange. And maybe it is all due to borderline syndrom that I think I might have.\n\nWhat do you think?"", 'subreddit': 'genderqueer', 'title': 'Some thoughts I have', 'created': 1460260818.0}"
