created_utc,id,num_comments,score,selftext,subreddit,title,created,d_
2016-04-14 01:51:40,4eoxjm,5,5,"I know I've been posting here a lot lately. Sorry for that. My brain at the moment is just blegh. Most of my anxiety is born from not knowing what to do medically. 

I'm currently on low AAs and low E. And while that's great. My itty bitty titties do on occasion give me anxiety and make me worry about them getting bigger. 

The alternative is to go on a tiny (and potentially ineffectual) level of AAs or stop completely. I tried a lowish dose of AAs for a while and all i got were hot flushes, a short temper and mood swings. 

I'm afraid of stopping altogether because i honestly can't remember how i felt when i wasn't surpressing T. I remember being horny a lot but that was about it. Also, masculinising isn't my idea of a super fun time. 

So I'm kind of stuck. I kind of have to come to terms with either solution. Unless SERMs become an option, but I'm not holding my breath. 

What doesn't help with this is that my gender is really incongruent. I identify as a woman a majority of the time, but dont have too much of a problem with my androgynously male body. On top of that, my voice im pretty fine with. I like it and i like my singing voice. I don't want to change that. But if i continue to feminise and then present as femme more, that too will be jarring and that worries me. I feel like it'd make me uncomfortable, but maybe that's me being stupid. 

It just gets harder to pin down what path feels right, i feel like there are so many parts of me pulling me in different directions. 

At the start of the year my therapist and I sort of said that i should I should try and be okay with my inconsistency and flux. But that was on my AA dose that gave me a near constant state of puberty blues and general shittiness. So that was short lived. 

I'm just not sure who i am anymore and what i want. 

Thanks for reading. Sorry for the pity party. ",genderqueer,Wibbly wobbly gender is confusing me.,1460623900.0,"{'created_utc': 1460598700, 'id': '4eoxjm', 'num_comments': 5, 'score': 5, 'selftext': ""I know I've been posting here a lot lately. Sorry for that. My brain at the moment is just blegh. Most of my anxiety is born from not knowing what to do medically. \n\nI'm currently on low AAs and low E. And while that's great. My itty bitty titties do on occasion give me anxiety and make me worry about them getting bigger. \n\nThe alternative is to go on a tiny (and potentially ineffectual) level of AAs or stop completely. I tried a lowish dose of AAs for a while and all i got were hot flushes, a short temper and mood swings. \n\nI'm afraid of stopping altogether because i honestly can't remember how i felt when i wasn't surpressing T. I remember being horny a lot but that was about it. Also, masculinising isn't my idea of a super fun time. \n\nSo I'm kind of stuck. I kind of have to come to terms with either solution. Unless SERMs become an option, but I'm not holding my breath. \n\nWhat doesn't help with this is that my gender is really incongruent. I identify as a woman a majority of the time, but dont have too much of a problem with my androgynously male body. On top of that, my voice im pretty fine with. I like it and i like my singing voice. I don't want to change that. But if i continue to feminise and then present as femme more, that too will be jarring and that worries me. I feel like it'd make me uncomfortable, but maybe that's me being stupid. \n\nIt just gets harder to pin down what path feels right, i feel like there are so many parts of me pulling me in different directions. \n\nAt the start of the year my therapist and I sort of said that i should I should try and be okay with my inconsistency and flux. But that was on my AA dose that gave me a near constant state of puberty blues and general shittiness. So that was short lived. \n\nI'm just not sure who i am anymore and what i want. \n\nThanks for reading. Sorry for the pity party. "", 'subreddit': 'genderqueer', 'title': 'Wibbly wobbly gender is confusing me.', 'created': 1460623900.0}"
2016-04-14 04:59:13,4epnwd,0,1,,genderqueer,"Feeling confused. Doubts, anxiety, questioning (Xpost from R/Nonbinary)",1460635153.0,"{'created_utc': 1460609953, 'id': '4epnwd', 'num_comments': 0, 'score': 1, 'selftext': '', 'subreddit': 'genderqueer', 'title': 'Feeling confused. Doubts, anxiety, questioning (Xpost from R/Nonbinary)', 'created': 1460635153.0}"
2016-04-14 17:07:44,4es5f3,2,7,,genderqueer,"The head of the UK Office for Standards in Education, Children's Services and Skills (Ofsted) ‘hasn’t given one second of thought’ to transgender bathrooms policy. The head schools watchdog chief had admitted he has “never thought” about how to protect transgender students in bathrooms.",1460678864.0,"{'created_utc': 1460653664, 'id': '4es5f3', 'num_comments': 2, 'score': 7, 'selftext': '', 'subreddit': 'genderqueer', 'title': ""The head of the UK Office for Standards in Education, Children's Services and Skills (Ofsted) ‘hasn’t given one second of thought’ to transgender bathrooms policy. The head schools watchdog chief had admitted he has “never thought” about how to protect transgender students in bathrooms."", 'created': 1460678864.0}"
2016-04-14 17:13:22,4es6dx,0,1,,genderqueer,Executive order from NC Gov. “doubles down” on transgender discrimination,1460679202.0,"{'created_utc': 1460654002, 'id': '4es6dx', 'num_comments': 0, 'score': 1, 'selftext': '', 'subreddit': 'genderqueer', 'title': 'Executive order from NC Gov. “doubles down” on transgender discrimination', 'created': 1460679202.0}"
2016-04-14 21:42:19,4ethjc,15,15,"Gender roles seem ridiculous to me. I can understand that people feel male or female and act that way but it also seems so made-up to me. Prejudices concerning gender also make absolutely no sense to me.

I recently started identifying as genderqueer since I feel like I am something in between male and female (amab). It also depends, sometimes the boyish side is more dominant and sometimes the girly side. I'm still in the process of questioning but right now that is the term that makes me feel most comfortable.

I don't know why I feel ashamed for that. It's the way I feel and I am.
I don't like it when people make assumptions of what I am just of how I look. I can't really blame them though since most people don't know it otherwise.

Additionally transgender people, who I totally respect, also seem to be enforcing gender roles even though they switched gender. It seems to me that ""passing"" which is like the ultimate goal for most transgender folks is embracing the gender roles even more.

Is this a reasonable thought or is there something wrong with me? It confuses the hell out of me and it is intimidating because it feels like it's me alone against the rest of the world. 
Maybe it's just nonsense but I had to get that off my chest.",genderqueer,I don't like gender roles,1460695339.0,"{'created_utc': 1460670139, 'id': '4ethjc', 'num_comments': 15, 'score': 15, 'selftext': 'Gender roles seem ridiculous to me. I can understand that people feel male or female and act that way but it also seems so made-up to me. Prejudices concerning gender also make absolutely no sense to me.\n\nI recently started identifying as genderqueer since I feel like I am something in between male and female (amab). It also depends, sometimes the boyish side is more dominant and sometimes the girly side. I\'m still in the process of questioning but right now that is the term that makes me feel most comfortable.\n\nI don\'t know why I feel ashamed for that. It\'s the way I feel and I am.\nI don\'t like it when people make assumptions of what I am just of how I look. I can\'t really blame them though since most people don\'t know it otherwise.\n\nAdditionally transgender people, who I totally respect, also seem to be enforcing gender roles even though they switched gender. It seems to me that ""passing"" which is like the ultimate goal for most transgender folks is embracing the gender roles even more.\n\nIs this a reasonable thought or is there something wrong with me? It confuses the hell out of me and it is intimidating because it feels like it\'s me alone against the rest of the world. \nMaybe it\'s just nonsense but I had to get that off my chest.', 'subreddit': 'genderqueer', 'title': ""I don't like gender roles"", 'created': 1460695339.0}"
2016-04-15 01:29:57,4eufv8,15,15,"Just wondering if anyone else fuels the same way I do. Since I was a little boy I have always been small and fragile. I have never acted tough and macho like other guys (18btw). I am also very small for a guy my age, im only 5:3 and I weigh 100lbs and I fucking love it. I just love being small and petite and wishing someone would cuddle me and get on top and have their way with me. The only exception is that im still straight. I love women and am disgusted by the thought of being with a male. I just wish I had been born a female so I could be with a female. I like to think I'd make a cute ggirlfriend/wife. Does anyone else feel the same? I'd really like to hear your thoughts on this. Im just another confused teenager.",genderqueer,Girl feelings,1460708997.0,"{'created_utc': 1460683797, 'id': '4eufv8', 'num_comments': 15, 'score': 15, 'selftext': ""Just wondering if anyone else fuels the same way I do. Since I was a little boy I have always been small and fragile. I have never acted tough and macho like other guys (18btw). I am also very small for a guy my age, im only 5:3 and I weigh 100lbs and I fucking love it. I just love being small and petite and wishing someone would cuddle me and get on top and have their way with me. The only exception is that im still straight. I love women and am disgusted by the thought of being with a male. I just wish I had been born a female so I could be with a female. I like to think I'd make a cute ggirlfriend/wife. Does anyone else feel the same? I'd really like to hear your thoughts on this. Im just another confused teenager."", 'subreddit': 'genderqueer', 'title': 'Girl feelings', 'created': 1460708997.0}"
2016-04-15 17:48:03,4exw00,8,17,,genderqueer,"South Carolina Sheriff: Opposition to bathroom bill is 'bologna,' only 'chicks' should wear dresses.",1460767683.0,"{'created_utc': 1460742483, 'id': '4exw00', 'num_comments': 8, 'score': 17, 'selftext': '', 'subreddit': 'genderqueer', 'title': ""South Carolina Sheriff: Opposition to bathroom bill is 'bologna,' only 'chicks' should wear dresses."", 'created': 1460767683.0}"
2016-04-16 00:27:09,4ezn95,16,25,[deleted],genderqueer,"Too feminine for the boys, too masculine for the girls",1460791629.0,"{'created_utc': 1460766429, 'id': '4ezn95', 'num_comments': 16, 'score': 25, 'selftext': '[deleted]', 'subreddit': 'genderqueer', 'title': 'Too feminine for the boys, too masculine for the girls', 'created': 1460791629.0}"
2016-04-16 00:42:13,4ezp8n,14,10,"27, they them, have been telling parents for two years to use they/them. I even recently ranted over email at my dad who called back and toned shamed me saying he is trying..... two weeks later, just got an email calling me a he. Never tries. So. Obtuse. 

Any success stories??",genderqueer,Does ANYONE'S parents respect their pronouns??,1460792533.0,"{'created_utc': 1460767333, 'id': '4ezp8n', 'num_comments': 14, 'score': 10, 'selftext': '27, they them, have been telling parents for two years to use they/them. I even recently ranted over email at my dad who called back and toned shamed me saying he is trying..... two weeks later, just got an email calling me a he. Never tries. So. Obtuse. \n\nAny success stories??', 'subreddit': 'genderqueer', 'title': ""Does ANYONE'S parents respect their pronouns??"", 'created': 1460792533.0}"
2016-04-16 00:50:15,4ezqad,0,6,,genderqueer,Anti-Trans Bathroom Bills Have Nothing to Do With Privacy and Everything To Do With Fear and Hatred,1460793015.0,"{'created_utc': 1460767815, 'id': '4ezqad', 'num_comments': 0, 'score': 6, 'selftext': '', 'subreddit': 'genderqueer', 'title': 'Anti-Trans Bathroom Bills Have Nothing to Do With Privacy and Everything To Do With Fear and Hatred', 'created': 1460793015.0}"
2016-04-16 01:56:30,4ezz0x,0,1,,genderqueer,Bathrooms and the Bible: The Latest Front in States' Culture Wars,1460796990.0,"{'created_utc': 1460771790, 'id': '4ezz0x', 'num_comments': 0, 'score': 1, 'selftext': '', 'subreddit': 'genderqueer', 'title': ""Bathrooms and the Bible: The Latest Front in States' Culture Wars"", 'created': 1460796990.0}"
2016-04-16 03:12:01,4f08eb,3,18,"Hi everyone. FAABulous, genderqueer (transmasculine) 34 years young. I work in IT on a pretty small team for a Bay Area tech company. My manager and I have a good rapport and have had some pretty deep conversations in the past. Because of everything I've been questioning/going through, I decided maybe I should just say something and get it over with. So um, I did. It was far from my usual eloquence and poise, but I didn't burst out sobbing and when we were wrapping up our conversation, he said he was thankful and honored that I trusted him to talk about this stuff with him, and then asked if there was anything I needed at this point. I said I'm still feeling that out, but thanked him for asking. 

I'm simultaneously overjoyed, scared to death, and profoundly grateful that we live in a society which is slowly learning to accept this. I also feel so exhausted. Is it normal to be like, COMPLETELY WIPED OUT when you first start figuring these things out about yourself? I could seriously sleep for days, yet I also feel sort of jittery and almost euphoric and definitely relieved. It's weird as hell. I identified as FTM almost 10 years ago and then got scared and went back in the goddamn closet for pretty much the worst 10 years of my life. I keep worrying that what if this is just a ""phase"" again?

Is it normal to have flashes of, ""maybe/what if I'm wrong?"" to worry about what others will think or how it'll turn out, to worry you won't be the same and that you're changing a part of yourself that isn't ""supposed"" to be changed? Is it normal to be afraid? 

Please tell me your Coming Out At Work/To Family stories, especially if you consider yourself non-binary/genderqueer. I'm kinda overwhelmed by how much more real this feels now. And I am TERRIFIED of telling my parents, that's the other thing. 

On a positive note, I think I may have finally found a therapist! I just have to call them back. ",genderqueer,Just came out to my manager,1460801521.0,"{'created_utc': 1460776321, 'id': '4f08eb', 'num_comments': 3, 'score': 18, 'selftext': 'Hi everyone. FAABulous, genderqueer (transmasculine) 34 years young. I work in IT on a pretty small team for a Bay Area tech company. My manager and I have a good rapport and have had some pretty deep conversations in the past. Because of everything I\'ve been questioning/going through, I decided maybe I should just say something and get it over with. So um, I did. It was far from my usual eloquence and poise, but I didn\'t burst out sobbing and when we were wrapping up our conversation, he said he was thankful and honored that I trusted him to talk about this stuff with him, and then asked if there was anything I needed at this point. I said I\'m still feeling that out, but thanked him for asking. \n\nI\'m simultaneously overjoyed, scared to death, and profoundly grateful that we live in a society which is slowly learning to accept this. I also feel so exhausted. Is it normal to be like, COMPLETELY WIPED OUT when you first start figuring these things out about yourself? I could seriously sleep for days, yet I also feel sort of jittery and almost euphoric and definitely relieved. It\'s weird as hell. I identified as FTM almost 10 years ago and then got scared and went back in the goddamn closet for pretty much the worst 10 years of my life. I keep worrying that what if this is just a ""phase"" again?\n\nIs it normal to have flashes of, ""maybe/what if I\'m wrong?"" to worry about what others will think or how it\'ll turn out, to worry you won\'t be the same and that you\'re changing a part of yourself that isn\'t ""supposed"" to be changed? Is it normal to be afraid? \n\nPlease tell me your Coming Out At Work/To Family stories, especially if you consider yourself non-binary/genderqueer. I\'m kinda overwhelmed by how much more real this feels now. And I am TERRIFIED of telling my parents, that\'s the other thing. \n\nOn a positive note, I think I may have finally found a therapist! I just have to call them back. ', 'subreddit': 'genderqueer', 'title': 'Just came out to my manager', 'created': 1460801521.0}"
2016-04-16 06:01:17,4f0qq2,0,15,,genderqueer,"What It's Like to Use a Public Bathroom While Trans - ""Some people just take bathrooms for granted, but over history, the bathroom has been a place where rights are fought""",1460811677.0,"{'created_utc': 1460786477, 'id': '4f0qq2', 'num_comments': 0, 'score': 15, 'selftext': '', 'subreddit': 'genderqueer', 'title': 'What It\'s Like to Use a Public Bathroom While Trans - ""Some people just take bathrooms for granted, but over history, the bathroom has been a place where rights are fought""', 'created': 1460811677.0}"
2016-04-16 07:17:12,4f0xny,19,2,"I'm still looking for a middle name. I definitely want to keep my initials, so the M is non-negotiable. I've considered Marlin, Marill, Marius, or even just M... not sure if I like any of those.

Amias M___ S. 

Suggestions?",genderqueer,Gender-neutral variant of Marie?,1460816232.0,"{'created_utc': 1460791032, 'id': '4f0xny', 'num_comments': 19, 'score': 2, 'selftext': ""I'm still looking for a middle name. I definitely want to keep my initials, so the M is non-negotiable. I've considered Marlin, Marill, Marius, or even just M... not sure if I like any of those.\n\nAmias M___ S. \n\nSuggestions?"", 'subreddit': 'genderqueer', 'title': 'Gender-neutral variant of Marie?', 'created': 1460816232.0}"
2016-04-16 18:17:24,4f30xy,0,24,,genderqueer,The 21 Best Transgender and Gender Non-conforming Books for Kids,1460855844.0,"{'created_utc': 1460830644, 'id': '4f30xy', 'num_comments': 0, 'score': 24, 'selftext': '', 'subreddit': 'genderqueer', 'title': 'The 21 Best Transgender and Gender Non-conforming Books for Kids', 'created': 1460855844.0}"
2016-04-17 01:23:38,4f4nf1,13,11,"I am gender dysphoric. I get very anxious because each day I get older, I fear that I will never be able to get an endometrial ablation. If you don't know what that is, it's a surgical procedure that basically destroys your uterus and terminates periods. I fear that my OBGYN won't perform it for me when I turn 18. I get severe dysphoria with it. I just need to break free from this monthly cycle of dysphoria. Does anyone feel the same? Or does anyone know doctors that are willing to help? Anybody? ",genderqueer,Doctors who are not willing to perform an endometrial ablation,1460881418.0,"{'created_utc': 1460856218, 'id': '4f4nf1', 'num_comments': 13, 'score': 11, 'selftext': ""I am gender dysphoric. I get very anxious because each day I get older, I fear that I will never be able to get an endometrial ablation. If you don't know what that is, it's a surgical procedure that basically destroys your uterus and terminates periods. I fear that my OBGYN won't perform it for me when I turn 18. I get severe dysphoria with it. I just need to break free from this monthly cycle of dysphoria. Does anyone feel the same? Or does anyone know doctors that are willing to help? Anybody? "", 'subreddit': 'genderqueer', 'title': 'Doctors who are not willing to perform an endometrial ablation', 'created': 1460881418.0}"
2016-04-17 04:23:19,4f5883,2,5,,genderqueer,"Growing up transgender: North Jersey kids tell of unease, bullying, acceptance",1460892199.0,"{'created_utc': 1460866999, 'id': '4f5883', 'num_comments': 2, 'score': 5, 'selftext': '', 'subreddit': 'genderqueer', 'title': 'Growing up transgender: North Jersey kids tell of unease, bullying, acceptance', 'created': 1460892199.0}"
2016-04-17 06:11:53,4f5iyk,0,1,[removed],genderqueer,"I think my orientation might be one that nobody else has, or at least one that lacks a name.",1460898713.0,"{'created_utc': 1460873513, 'id': '4f5iyk', 'num_comments': 0, 'score': 1, 'selftext': '[removed]', 'subreddit': 'genderqueer', 'title': 'I think my orientation might be one that nobody else has, or at least one that lacks a name.', 'created': 1460898713.0}"
2016-04-17 06:41:35,4f5lnp,2,0,,genderqueer,"Regardless of gender or identity, we can all unite and agree on WHITE POWER!",1460900495.0,"{'created_utc': 1460875295, 'id': '4f5lnp', 'num_comments': 2, 'score': 0, 'selftext': '', 'subreddit': 'genderqueer', 'title': 'Regardless of gender or identity, we can all unite and agree on WHITE POWER!', 'created': 1460900495.0}"
2016-04-17 17:55:24,4f7nar,0,3,[removed],genderqueer,Hi there people of the genderqueer subreddit!,1460940924.0,"{'created_utc': 1460915724, 'id': '4f7nar', 'num_comments': 0, 'score': 3, 'selftext': '[removed]', 'subreddit': 'genderqueer', 'title': 'Hi there people of the genderqueer subreddit!', 'created': 1460940924.0}"
2016-04-17 18:40:50,4f7uo5,2,0,,genderqueer,North Carolina Gov. Pat McCrory Discusses His State's 'Bathroom Law',1460943650.0,"{'created_utc': 1460918450, 'id': '4f7uo5', 'num_comments': 2, 'score': 0, 'selftext': '', 'subreddit': 'genderqueer', 'title': ""North Carolina Gov. Pat McCrory Discusses His State's 'Bathroom Law'"", 'created': 1460943650.0}"
2016-04-17 19:06:02,4f7yof,0,1,,genderqueer,Amazing Hip-Hop Video Chronicles An Autobiographical Journey With Gender,1460945162.0,"{'created_utc': 1460919962, 'id': '4f7yof', 'num_comments': 0, 'score': 1, 'selftext': '', 'subreddit': 'genderqueer', 'title': 'Amazing Hip-Hop Video Chronicles An Autobiographical Journey With Gender', 'created': 1460945162.0}"
2016-04-17 20:33:22,4f8bzp,0,4,,genderqueer,LGBT Law: Backlash in North Carolina,1460950402.0,"{'created_utc': 1460925202, 'id': '4f8bzp', 'num_comments': 0, 'score': 4, 'selftext': '', 'subreddit': 'genderqueer', 'title': 'LGBT Law: Backlash in North Carolina', 'created': 1460950402.0}"
2016-04-17 21:00:12,4f8g3q,0,7,,genderqueer,How The Philippines’ Call Center Boom Launched A Transgender Revolution,1460952012.0,"{'created_utc': 1460926812, 'id': '4f8g3q', 'num_comments': 0, 'score': 7, 'selftext': '', 'subreddit': 'genderqueer', 'title': 'How The Philippines’ Call Center Boom Launched A Transgender Revolution', 'created': 1460952012.0}"
2016-04-17 21:26:59,4f8k8s,0,1,,genderqueer,Beyond The Bathroom: Transgender Policies Under Review By N.J. Schools,1460953619.0,"{'created_utc': 1460928419, 'id': '4f8k8s', 'num_comments': 0, 'score': 1, 'selftext': '', 'subreddit': 'genderqueer', 'title': 'Beyond The Bathroom: Transgender Policies Under Review By N.J. Schools', 'created': 1460953619.0}"
2016-04-18 02:23:49,4f9r2l,0,1,[deleted],genderqueer,My first time trying makeup. Wore this to a concert and got great reactions.,1460971429.0,"{'created_utc': 1460946229, 'id': '4f9r2l', 'num_comments': 0, 'score': 1, 'selftext': '[deleted]', 'subreddit': 'genderqueer', 'title': 'My first time trying makeup. Wore this to a concert and got great reactions.', 'created': 1460971429.0}"
2016-04-18 02:34:33,4f9sl6,20,50,,genderqueer,Trying to be a bit more ambiguous. This is my first time trying makeup. Thoughts?,1460972073.0,"{'created_utc': 1460946873, 'id': '4f9sl6', 'num_comments': 20, 'score': 50, 'selftext': '', 'subreddit': 'genderqueer', 'title': 'Trying to be a bit more ambiguous. This is my first time trying makeup. Thoughts?', 'created': 1460972073.0}"
2016-04-18 14:17:10,4fc1by,2,2,"I'm AFAB genderqueer, and have been toying with the idea of getting a binder for when I'm having those more masculine days for about a year now - not because I am unsure of wanting one, but because I am unsure of what type/material/price range/brand I should be considering. 

I've browsed around the internet for quite a while and know of some popular companies, but I'm just wondering if anyone could give any recommendations or tell me about your favourite/preferred binder if you use one? 

(Also I live in the UK if that makes any difference, and I'm a student so I can't afford anything too pricey, but if it's really worth it then I can always save!) Thanks guys! ",genderqueer,Binder recommendations?,1461014230.0,"{'created_utc': 1460989030, 'id': '4fc1by', 'num_comments': 2, 'score': 2, 'selftext': ""I'm AFAB genderqueer, and have been toying with the idea of getting a binder for when I'm having those more masculine days for about a year now - not because I am unsure of wanting one, but because I am unsure of what type/material/price range/brand I should be considering. \n\nI've browsed around the internet for quite a while and know of some popular companies, but I'm just wondering if anyone could give any recommendations or tell me about your favourite/preferred binder if you use one? \n\n(Also I live in the UK if that makes any difference, and I'm a student so I can't afford anything too pricey, but if it's really worth it then I can always save!) Thanks guys! "", 'subreddit': 'genderqueer', 'title': 'Binder recommendations?', 'created': 1461014230.0}"
