created_utc,id,num_comments,score,selftext,subreddit,title,created,d_
2016-04-01 04:23:32,4ctwfp,14,18,"(I'm AFAB.) I was out having dinner with a friend earlier tonight, and I was dressed/presenting as non-binary. At one point a little boy who was with his family, once he saw me, started staring at me for like, a *really* long time, and it made me really uncomfortable. He looked at me up and down and everything. At one point while I was talking to my friend I just froze in place while looking at him out of the corner of my eye; at that moment I just sat there, wishing he would JUST. STOP. STARING. AT. ME. When he *finally* did, I whispered to my friend that he was staring at me and it made me really uncomfortable. Argh. Argh. Argh. Thankfully that uncomfortable and awkward happening didn't kill my mood since my friend and I quickly moved to other topics after I briefly ranted how that kid stared at me and how frequently cashiers on campus at my school have misgendered me, but thinking back to it again, I felt like I just got emotionally  stabbed in the heart. I know I shouldn't let this kind of thing get to me, but while that kid was staring at me, he probably had a really toxic train of thought, like I was a freak of nature because I don't fit into the binary. Auughhh I feel like shit right now, but I guess that's sort of my fault.

Anyway, I just wanted to rant about this here.",genderqueer,"Had a really, really uncomfortable moment when I was out with a friend earlier tonight :(",1459509812.0,"{'created_utc': 1459484612, 'id': '4ctwfp', 'num_comments': 14, 'score': 18, 'selftext': ""(I'm AFAB.) I was out having dinner with a friend earlier tonight, and I was dressed/presenting as non-binary. At one point a little boy who was with his family, once he saw me, started staring at me for like, a *really* long time, and it made me really uncomfortable. He looked at me up and down and everything. At one point while I was talking to my friend I just froze in place while looking at him out of the corner of my eye; at that moment I just sat there, wishing he would JUST. STOP. STARING. AT. ME. When he *finally* did, I whispered to my friend that he was staring at me and it made me really uncomfortable. Argh. Argh. Argh. Thankfully that uncomfortable and awkward happening didn't kill my mood since my friend and I quickly moved to other topics after I briefly ranted how that kid stared at me and how frequently cashiers on campus at my school have misgendered me, but thinking back to it again, I felt like I just got emotionally  stabbed in the heart. I know I shouldn't let this kind of thing get to me, but while that kid was staring at me, he probably had a really toxic train of thought, like I was a freak of nature because I don't fit into the binary. Auughhh I feel like shit right now, but I guess that's sort of my fault.\n\nAnyway, I just wanted to rant about this here."", 'subreddit': 'genderqueer', 'title': 'Had a really, really uncomfortable moment when I was out with a friend earlier tonight :(', 'created': 1459509812.0}"
2016-04-01 04:47:09,4ctzk7,13,14,"(Posted this in /r/asktransgender yesterday but didn't really get any replies so I'll post it here instead. Hope that's OK.)

I'm not sure about the exact label yet but I'm pretty sure I'm agender (or some kind of strange mixture of man and woman, but most likely agender) and I feel like I should probably tell my boyfriend about it. We've been together for many years now and even though I've thought about both my gender identity and sexuality for years, it's not until the past half a year that I've really been questioning, doing research, and learning about these parts of myself. Last month I told my boyfriend I'm probably bisexual and that was scary enough. Telling him that I'm non-binary seems *even scarier*.

How do I tell my boyfriend, who thinks of me as a woman, that I don't really identify as a woman? I have no problem with female pronouns but *I don't feel like a woman*. Not entirely anyway. There's some kind of indescribable disconnect between my assigned sex/gender and how I really feel. How do I tell my boyfriend, who likes my female body, that a big goal of mine is to one day go through a breast reduction (not remove them completely) so that I can look more androgynous? It will sound absolutely *ridiculous* to someone who isn't familiar with the world of non-binary (it's still difficult for *me* to fully understand it all, and I *am* non-binary).

And then there's this tiny ""voice"" in the back of my mind that tells me I'm probably imagining everything and that I'm as cisgender as can be. Stupid thought since I got happy when someone thought I was a boy when I was 10 years old and since I remember asking myself *""why don't I feel like a woman?""* as far back as 13 years ago.

I never learned about everything that isn't cisgender when I grew up and honestly didn't educate myself on the matter until 6 months ago, which is crazy. I've referred to myself as ""mentally androgynous"" for *years* (though that's not the correct term) without knowing there is actually a name for what I've felt my whole life. Learning about all of this has made me feel really confused and anxious but at the same time liberated in some way. It's like my world view has broadened and like I suddenly feel like it's OK to be me. Does that make sense? I'd like to share that with my boyfriend (I also think he has the right to know), but I'm scared of how he's going to react.

Any advice?

Also, I feel like I should add two things: 1) I don't want to transition since I don't identify as male (though I'd rather be male if I could choose). I do, however, want to keep dressing androgynously and I want to have a breast reduction. 2) I came out as non-binary for the first time ever a couple of days ago. I told a good friend of mine and she was great about it. Doubt my boyfriend will be as understanding as she was.

**EDIT:** Sorry for not replying to all the posts right now. Having a really bad day with lots of anxiety etc. I'll reply when I feel better!",genderqueer,How do I come out to my boyfriend?,1459511229.0,"{'created_utc': 1459486029, 'id': '4ctzk7', 'num_comments': 13, 'score': 14, 'selftext': '(Posted this in /r/asktransgender yesterday but didn\'t really get any replies so I\'ll post it here instead. Hope that\'s OK.)\n\nI\'m not sure about the exact label yet but I\'m pretty sure I\'m agender (or some kind of strange mixture of man and woman, but most likely agender) and I feel like I should probably tell my boyfriend about it. We\'ve been together for many years now and even though I\'ve thought about both my gender identity and sexuality for years, it\'s not until the past half a year that I\'ve really been questioning, doing research, and learning about these parts of myself. Last month I told my boyfriend I\'m probably bisexual and that was scary enough. Telling him that I\'m non-binary seems *even scarier*.\n\nHow do I tell my boyfriend, who thinks of me as a woman, that I don\'t really identify as a woman? I have no problem with female pronouns but *I don\'t feel like a woman*. Not entirely anyway. There\'s some kind of indescribable disconnect between my assigned sex/gender and how I really feel. How do I tell my boyfriend, who likes my female body, that a big goal of mine is to one day go through a breast reduction (not remove them completely) so that I can look more androgynous? It will sound absolutely *ridiculous* to someone who isn\'t familiar with the world of non-binary (it\'s still difficult for *me* to fully understand it all, and I *am* non-binary).\n\nAnd then there\'s this tiny ""voice"" in the back of my mind that tells me I\'m probably imagining everything and that I\'m as cisgender as can be. Stupid thought since I got happy when someone thought I was a boy when I was 10 years old and since I remember asking myself *""why don\'t I feel like a woman?""* as far back as 13 years ago.\n\nI never learned about everything that isn\'t cisgender when I grew up and honestly didn\'t educate myself on the matter until 6 months ago, which is crazy. I\'ve referred to myself as ""mentally androgynous"" for *years* (though that\'s not the correct term) without knowing there is actually a name for what I\'ve felt my whole life. Learning about all of this has made me feel really confused and anxious but at the same time liberated in some way. It\'s like my world view has broadened and like I suddenly feel like it\'s OK to be me. Does that make sense? I\'d like to share that with my boyfriend (I also think he has the right to know), but I\'m scared of how he\'s going to react.\n\nAny advice?\n\nAlso, I feel like I should add two things: 1) I don\'t want to transition since I don\'t identify as male (though I\'d rather be male if I could choose). I do, however, want to keep dressing androgynously and I want to have a breast reduction. 2) I came out as non-binary for the first time ever a couple of days ago. I told a good friend of mine and she was great about it. Doubt my boyfriend will be as understanding as she was.\n\n**EDIT:** Sorry for not replying to all the posts right now. Having a really bad day with lots of anxiety etc. I\'ll reply when I feel better!', 'subreddit': 'genderqueer', 'title': 'How do I come out to my boyfriend?', 'created': 1459511229.0}"
2016-04-01 22:55:26,4cyokj,20,8,"My partner and I really enjoy watching cartoons together, because they're easy to fit into our schedules and they're a nice way to relax and enjoy something together. However, we've found it pretty common for these sorts of shows to have really uncomfortable, unnecessary, and/or stereotypical gender references that really jar us and make it hard to enjoy the show. Do you all have suggestions towards cartoons (or similar media) in which this isn't the case?

Positive example: we really liked Steven Universe and are eagerly awaiting new episodes. Gender exists in the show, but is rarely referenced and almost never in context of stereotypes. There is a character that is pretty clearly nonbinary, which is cool.

Negative examples:

1. In Gravity Falls, one of the villians (Gideon) is male but is consistantly derided by some of the main characters (esp. Stan) for acting and looking ""girly"". Additionally, one of the early episodes has one of the main characters (Dipper) being upset and made-fun-of for not being ""manly"".   
2. In Avatar: The Last Airbender, one of the main characters (Sokka) often makes comments about not expect not expecting ""girls"" to be good warriors and generally reinforces stereotypical gender roles. Even when he is proven wrong (e.g. is captured by a group of female warriors), it feels awkward and unnecessary that this is used as a source of comic relief.

I gave the examples that I did because these were particularly surprising/annoying to me, as these are popular and highly praised shows. I know there are a lot that are much worse about this, but the fact that I otherwise like a lot about Avatar and Gravity Falls makes it partiularly upsetting that I can't enjoy them properly because of their gender references.

Hopefully you all have better suggestions for things that avoid these sorts of unnecessary gendered references. :)",genderqueer,Cartoons or similar media without unnecessary gender references/portrayals?,1459576526.0,"{'created_utc': 1459551326, 'id': '4cyokj', 'num_comments': 20, 'score': 8, 'selftext': 'My partner and I really enjoy watching cartoons together, because they\'re easy to fit into our schedules and they\'re a nice way to relax and enjoy something together. However, we\'ve found it pretty common for these sorts of shows to have really uncomfortable, unnecessary, and/or stereotypical gender references that really jar us and make it hard to enjoy the show. Do you all have suggestions towards cartoons (or similar media) in which this isn\'t the case?\n\nPositive example: we really liked Steven Universe and are eagerly awaiting new episodes. Gender exists in the show, but is rarely referenced and almost never in context of stereotypes. There is a character that is pretty clearly nonbinary, which is cool.\n\nNegative examples:\n\n1. In Gravity Falls, one of the villians (Gideon) is male but is consistantly derided by some of the main characters (esp. Stan) for acting and looking ""girly"". Additionally, one of the early episodes has one of the main characters (Dipper) being upset and made-fun-of for not being ""manly"".   \n2. In Avatar: The Last Airbender, one of the main characters (Sokka) often makes comments about not expect not expecting ""girls"" to be good warriors and generally reinforces stereotypical gender roles. Even when he is proven wrong (e.g. is captured by a group of female warriors), it feels awkward and unnecessary that this is used as a source of comic relief.\n\nI gave the examples that I did because these were particularly surprising/annoying to me, as these are popular and highly praised shows. I know there are a lot that are much worse about this, but the fact that I otherwise like a lot about Avatar and Gravity Falls makes it partiularly upsetting that I can\'t enjoy them properly because of their gender references.\n\nHopefully you all have better suggestions for things that avoid these sorts of unnecessary gendered references. :)', 'subreddit': 'genderqueer', 'title': 'Cartoons or similar media without unnecessary gender references/portrayals?', 'created': 1459576526.0}"
2016-04-02 02:56:29,4czq6d,0,1,[removed],genderqueer,Can someone give me reasons why gender as a concept is useful? Should we not just toss the whole thing out in favor of sex?,1459590989.0,"{'created_utc': 1459565789, 'id': '4czq6d', 'num_comments': 0, 'score': 1, 'selftext': '[removed]', 'subreddit': 'genderqueer', 'title': 'Can someone give me reasons why gender as a concept is useful? Should we not just toss the whole thing out in favor of sex?', 'created': 1459590989.0}"
2016-04-02 04:28:42,4d02dc,12,4,"Besides the obvious xy chromosomes that I can't change, there's so much more about me that adds up to me both trying to convince myself that I really am genderqueer, and me trying to tell myself to live genderqueer because I don't think I'll ever live totally female.  My unchangable past is listed out: 

-Born male and will proably never have functional female parts to lead the female life I dream of. not all women have kids but still...i would've liked to. yes i did bank sperm, but its not the same.  yeah, i know it could be worse. this isn't the worst on my list though

-Hesitated coming out, leading to irreversible male changes or changes necessitating risky surgery (huge feet, taller than most women, feel like i have an oversized body, lowww voice-practice and surgery can change pitch, not resonance of a bigger voice box-, adam's apple and brow ridge/nose/etc-all can be changed with surgery, but surgery has its risks. 

-the biggest problem: i've been raised as a male and forced myself to assimilate so well that i don't think i can ever find a way or the time to become the girl i could've been.  i don't have the confidence yet, but this is *years*, almost 2 decades of training that I want to overcome. Its impossible to delete learned things but the brain does wire neurons based on habits, and basically i could ""prune"" the branches of neurons that aren't used as often, since that's how the brain works (via my rudimentary knowledge of neurology and psychology).  but i have no female ""skills"", i quashed almost all of my feminine behaviours that came naturally, or the ones i learned in secret, because i was supposed to be learning from men as my role models. and it takes me the majority of a social outing to just work up the courage to be even a little bit feminine, the little bit that i have left.  because of being raised as a boy i missed all the normal girl experiences that other girls went through, i have no close friends that are girls, and I've always felt distanced even from my ""best"" guy friends. like i never fully connected.  but then i was distanced from the girls because physically and socially i wasn't one. 

Its like...like the act became me because I was acting when I was also feeling emotions and it all jumbled together and formed a new damaged me that functions well enough to get by. 

I don't know quite why I'm writing this.  I'm not searching for answers, even though suggestions or anything is welcome.  And I know im certainly not the only one who feels this way.  but even trying to be friends with other trans people doesn't work well, due to seeing them as freaks because i see myself as a freak probly, i think its internalized transphobia.  I worry that nothing will ever feel quite right. 

So yeah, just kinda writing to see what you guys think, I guess. 

Also really trying to be as PC as possible, please don't call me out if i messed up on anything, but do correct me.

TL;DR basically i want to be a woman but feel i never can be due to my past experiences and biology, so i try to be genderqueer because i trained myself to be male, and already was born that way, and have my internal female side. but nothing feels right",genderqueer,Tempted to be genderqueer because I'll never be totally female (I know how bad this sounds but hear me out pls),1459596522.0,"{'created_utc': 1459571322, 'id': '4d02dc', 'num_comments': 12, 'score': 4, 'selftext': 'Besides the obvious xy chromosomes that I can\'t change, there\'s so much more about me that adds up to me both trying to convince myself that I really am genderqueer, and me trying to tell myself to live genderqueer because I don\'t think I\'ll ever live totally female.  My unchangable past is listed out: \n\n-Born male and will proably never have functional female parts to lead the female life I dream of. not all women have kids but still...i would\'ve liked to. yes i did bank sperm, but its not the same.  yeah, i know it could be worse. this isn\'t the worst on my list though\n\n-Hesitated coming out, leading to irreversible male changes or changes necessitating risky surgery (huge feet, taller than most women, feel like i have an oversized body, lowww voice-practice and surgery can change pitch, not resonance of a bigger voice box-, adam\'s apple and brow ridge/nose/etc-all can be changed with surgery, but surgery has its risks. \n\n-the biggest problem: i\'ve been raised as a male and forced myself to assimilate so well that i don\'t think i can ever find a way or the time to become the girl i could\'ve been.  i don\'t have the confidence yet, but this is *years*, almost 2 decades of training that I want to overcome. Its impossible to delete learned things but the brain does wire neurons based on habits, and basically i could ""prune"" the branches of neurons that aren\'t used as often, since that\'s how the brain works (via my rudimentary knowledge of neurology and psychology).  but i have no female ""skills"", i quashed almost all of my feminine behaviours that came naturally, or the ones i learned in secret, because i was supposed to be learning from men as my role models. and it takes me the majority of a social outing to just work up the courage to be even a little bit feminine, the little bit that i have left.  because of being raised as a boy i missed all the normal girl experiences that other girls went through, i have no close friends that are girls, and I\'ve always felt distanced even from my ""best"" guy friends. like i never fully connected.  but then i was distanced from the girls because physically and socially i wasn\'t one. \n\nIts like...like the act became me because I was acting when I was also feeling emotions and it all jumbled together and formed a new damaged me that functions well enough to get by. \n\nI don\'t know quite why I\'m writing this.  I\'m not searching for answers, even though suggestions or anything is welcome.  And I know im certainly not the only one who feels this way.  but even trying to be friends with other trans people doesn\'t work well, due to seeing them as freaks because i see myself as a freak probly, i think its internalized transphobia.  I worry that nothing will ever feel quite right. \n\nSo yeah, just kinda writing to see what you guys think, I guess. \n\nAlso really trying to be as PC as possible, please don\'t call me out if i messed up on anything, but do correct me.\n\nTL;DR basically i want to be a woman but feel i never can be due to my past experiences and biology, so i try to be genderqueer because i trained myself to be male, and already was born that way, and have my internal female side. but nothing feels right', 'subreddit': 'genderqueer', 'title': ""Tempted to be genderqueer because I'll never be totally female (I know how bad this sounds but hear me out pls)"", 'created': 1459596522.0}"
2016-04-02 10:10:24,4d0zhp,6,16,"I'm playing miitomo and while I figured I would have to select a gender, I didn't think it would matter too much. I've been going back and forth between male and female but for now I'm deciding on female cuz I think it's weird when I take off my character's clothes and they don't have a shirt on lol. But then that means when I'm visiting a friend, my character uses she pronouns, and I don't want people to think that's what I use irl (I use they and am testing out he pronouns) 

This is such a goofy thing to be annoyed with but I thought I'd rant a little :/ In games I usually set my characters gender as female cuz I'm worried about missing out on cute clothes and long hairstyles and stuff.",genderqueer,Ridiculous miitomo nitpick,1459617024.0,"{'created_utc': 1459591824, 'id': '4d0zhp', 'num_comments': 6, 'score': 16, 'selftext': ""I'm playing miitomo and while I figured I would have to select a gender, I didn't think it would matter too much. I've been going back and forth between male and female but for now I'm deciding on female cuz I think it's weird when I take off my character's clothes and they don't have a shirt on lol. But then that means when I'm visiting a friend, my character uses she pronouns, and I don't want people to think that's what I use irl (I use they and am testing out he pronouns) \n\nThis is such a goofy thing to be annoyed with but I thought I'd rant a little :/ In games I usually set my characters gender as female cuz I'm worried about missing out on cute clothes and long hairstyles and stuff."", 'subreddit': 'genderqueer', 'title': 'Ridiculous miitomo nitpick', 'created': 1459617024.0}"
2016-04-02 16:33:37,4d26dn,1,1,[deleted],genderqueer,"SURVEY: Stigma Experienced by Transgender Individuals from Mental Health Providers (18+, Transgender, Live in US)",1459640017.0,"{'created_utc': 1459614817, 'id': '4d26dn', 'num_comments': 1, 'score': 1, 'selftext': '[deleted]', 'subreddit': 'genderqueer', 'title': 'SURVEY: Stigma Experienced by Transgender Individuals from Mental Health Providers (18+, Transgender, Live in US)', 'created': 1459640017.0}"
2016-04-02 23:21:59,4d3uhr,13,7,"Hi everyone, I was wondering if anyone new any social-media for people who don't identify within the binary. It's just really hard to find other folks who don't identify in the binary on regular social media, thank you!",genderqueer,Meeting other genderqueer folks,1459664519.0,"{'created_utc': 1459639319, 'id': '4d3uhr', 'num_comments': 13, 'score': 7, 'selftext': ""Hi everyone, I was wondering if anyone new any social-media for people who don't identify within the binary. It's just really hard to find other folks who don't identify in the binary on regular social media, thank you!"", 'subreddit': 'genderqueer', 'title': 'Meeting other genderqueer folks', 'created': 1459664519.0}"
2016-04-02 23:49:59,4d3yb8,8,26,,genderqueer,Hi! I've been working on appearing more feminine lately. How am I doing?,1459666199.0,"{'created_utc': 1459640999, 'id': '4d3yb8', 'num_comments': 8, 'score': 26, 'selftext': '', 'subreddit': 'genderqueer', 'title': ""Hi! I've been working on appearing more feminine lately. How am I doing?"", 'created': 1459666199.0}"
2016-04-03 04:24:26,4d4vwt,6,4,"I wonder if saying these products are ""for men"" or ""men's skincare"" has the potential to sound insensitive. 

Of course I don't care who uses my products and how they define their gender; I just want to suggest the kinds of scents I'm using and some of the stuff (i.e. beard soap) I'm selling.

Am I already shooting myself in the foot by saying ""men's""? What about words like ""masculine""?

Thanks!",genderqueer,"Creating cosmetic products ""for men"" -- I want to be respectful about concepts of gender",1459682666.0,"{'created_utc': 1459657466, 'id': '4d4vwt', 'num_comments': 6, 'score': 4, 'selftext': 'I wonder if saying these products are ""for men"" or ""men\'s skincare"" has the potential to sound insensitive. \n\nOf course I don\'t care who uses my products and how they define their gender; I just want to suggest the kinds of scents I\'m using and some of the stuff (i.e. beard soap) I\'m selling.\n\nAm I already shooting myself in the foot by saying ""men\'s""? What about words like ""masculine""?\n\nThanks!', 'subreddit': 'genderqueer', 'title': 'Creating cosmetic products ""for men"" -- I want to be respectful about concepts of gender', 'created': 1459682666.0}"
