created_utc,id,num_comments,score,selftext,subreddit,title,created,d_
2017-05-21 20:57:59,6ciy6b,17,7,Hey all! ,NonBinary,Weekly Off-Topic Discussion post,1495425479.0,"{'created_utc': 1495400279, 'id': '6ciy6b', 'num_comments': 17, 'score': 7, 'selftext': 'Hey all! ', 'subreddit': 'NonBinary', 'title': 'Weekly Off-Topic Discussion post', 'created': 1495425479.0}"
2017-05-22 02:01:48,6ckhmf,4,7,,NonBinary,"Q&amp;A With Pixie: 26, Androgynous, Non-binary, Genderqueer and Lesbian",1495443708.0,"{'created_utc': 1495418508, 'id': '6ckhmf', 'num_comments': 4, 'score': 7, 'selftext': '', 'subreddit': 'NonBinary', 'title': 'Q&amp;A With Pixie: 26, Androgynous, Non-binary, Genderqueer and Lesbian', 'created': 1495443708.0}"
2017-05-22 13:43:48,6cnb8k,2,38,,NonBinary,"Meet Jen Ramos, the first openly non-binary executive in pro sports",1495485828.0,"{'created_utc': 1495460628, 'id': '6cnb8k', 'num_comments': 2, 'score': 38, 'selftext': '', 'subreddit': 'NonBinary', 'title': 'Meet Jen Ramos, the first openly non-binary executive in pro sports', 'created': 1495485828.0}"
2017-05-22 21:01:08,6cq1pp,1,6,"I'm not familiar with kids in general, but last nite a 5 yrs old son of some friends (first time I met him) ask me if I were a boy or a girl. Curiously, he didn't accepted ""both"" as answer but was fine with ""neither"". Go figure. However, things got complicated when another kid who was playing around asked me if I had a *insert here cute euphemism for penis* or a *insert here cute euphemism for vagina*. I'm curious about any experience\good practice\effective talks on the matter.",NonBinary,Explain it to a kid,1495512068.0,"{'created_utc': 1495486868, 'id': '6cq1pp', 'num_comments': 1, 'score': 6, 'selftext': 'I\'m not familiar with kids in general, but last nite a 5 yrs old son of some friends (first time I met him) ask me if I were a boy or a girl. Curiously, he didn\'t accepted ""both"" as answer but was fine with ""neither"". Go figure. However, things got complicated when another kid who was playing around asked me if I had a *insert here cute euphemism for penis* or a *insert here cute euphemism for vagina*. I\'m curious about any experience\\good practice\\effective talks on the matter.', 'subreddit': 'NonBinary', 'title': 'Explain it to a kid', 'created': 1495512068.0}"
2017-05-23 15:48:34,6cvhgm,0,3,[deleted],NonBinary,non-binary/trans friendly whatsapp group?,1495579714.0,"{'created_utc': 1495554514, 'id': '6cvhgm', 'num_comments': 0, 'score': 3, 'selftext': '[deleted]', 'subreddit': 'NonBinary', 'title': 'non-binary/trans friendly whatsapp group?', 'created': 1495579714.0}"
2017-05-23 17:08:24,6cw0ac,13,12,"Throwaway for obvious reasons. Use they/them pronouns. 

Do masculine AMAB non-binary people exist? I was AMAB and I feel NB, but queer masculinity really speaks to me. My ideal destination would be a mostly female body, without breasts. I want to dress mostly masc with a slight feminine flair. 

Is there anyone like this here? I've never met anyone else who felt this way. ",NonBinary,Masculine AMAB people?,1495584504.0,"{'created_utc': 1495559304, 'id': '6cw0ac', 'num_comments': 13, 'score': 12, 'selftext': ""Throwaway for obvious reasons. Use they/them pronouns. \n\nDo masculine AMAB non-binary people exist? I was AMAB and I feel NB, but queer masculinity really speaks to me. My ideal destination would be a mostly female body, without breasts. I want to dress mostly masc with a slight feminine flair. \n\nIs there anyone like this here? I've never met anyone else who felt this way. "", 'subreddit': 'NonBinary', 'title': 'Masculine AMAB people?', 'created': 1495584504.0}"
2017-05-24 19:55:29,6d4ko9,3,8,"I'm 5'9"", and except for my boobs, I'm very androgynous in body. I have big feet and hands, I'm strongly square-built, no hips to speak of. Most of my body dimensions, such as waist-hip ratio, are more typically male than female. I even have my primary fat storage in my abdomen/belly. I am naturally hirsute, and have to shave daily (no testosterone). 

And I don't want to be androgynous! Sometimes I feel like I'm an MtF, and my body is just wrong. The very sight of non-passing MtFs have actually become dysphoric for me because it sets off my dysphoria over my not ""looking like a girl."" Then I go into guy mode, and my guy side is pretty happy with the base body type he has to work with. 

I'm bi-gender, with a strong female side and an only slightly weaker male side. When my two sides mix, when I'm not really in a male or female situation where one side or another comes out and totally takes over, I'm dysphoric. At home alone it's not so bad, but in public I begin to be convinced someone is going to call me out as a fraud because I'm not entirely the girl I present myself as. My physical androgyny makes matters far worse.

I tend to overcompensate toward femme to look feminine at all, and really, until recently I had no idea why I felt the way I do. Yet I also like my masculine side. I just don't really want anyone to *see* him.

I desperately wish I could be entirely girl, both in form and in mind. I want to stop being this big androgynous physical mess, and this female/male mental mess. But no amount of estrogen will ""feminize"" my face or my body, not like it works for MtFs. I'm going to try testosterone, to see if heading more to the masculine direction will take care of my dysphoria over androgyny. I'm prepared for both failure and success. 

The last two times I tried to go guy mode in dress/appearance, my boobs and lack of appendage between my legs was massively dysphoric. It was some of the highest level of dysphoria I've ever experienced, because it looked so bad. Massive fail. Mostly because of boobs, but also because of my long hair, which I refuse to give up because I want to be girly when I want to be, and I don't look very good with short hair as a girl.",NonBinary,"Physically androgynous AFAB, but wish I could transition to my birth sex? Does this make any sense?",1495680929.0,"{'created_utc': 1495655729, 'id': '6d4ko9', 'num_comments': 3, 'score': 8, 'selftext': 'I\'m 5\'9"", and except for my boobs, I\'m very androgynous in body. I have big feet and hands, I\'m strongly square-built, no hips to speak of. Most of my body dimensions, such as waist-hip ratio, are more typically male than female. I even have my primary fat storage in my abdomen/belly. I am naturally hirsute, and have to shave daily (no testosterone). \n\nAnd I don\'t want to be androgynous! Sometimes I feel like I\'m an MtF, and my body is just wrong. The very sight of non-passing MtFs have actually become dysphoric for me because it sets off my dysphoria over my not ""looking like a girl."" Then I go into guy mode, and my guy side is pretty happy with the base body type he has to work with. \n\nI\'m bi-gender, with a strong female side and an only slightly weaker male side. When my two sides mix, when I\'m not really in a male or female situation where one side or another comes out and totally takes over, I\'m dysphoric. At home alone it\'s not so bad, but in public I begin to be convinced someone is going to call me out as a fraud because I\'m not entirely the girl I present myself as. My physical androgyny makes matters far worse.\n\nI tend to overcompensate toward femme to look feminine at all, and really, until recently I had no idea why I felt the way I do. Yet I also like my masculine side. I just don\'t really want anyone to *see* him.\n\nI desperately wish I could be entirely girl, both in form and in mind. I want to stop being this big androgynous physical mess, and this female/male mental mess. But no amount of estrogen will ""feminize"" my face or my body, not like it works for MtFs. I\'m going to try testosterone, to see if heading more to the masculine direction will take care of my dysphoria over androgyny. I\'m prepared for both failure and success. \n\nThe last two times I tried to go guy mode in dress/appearance, my boobs and lack of appendage between my legs was massively dysphoric. It was some of the highest level of dysphoria I\'ve ever experienced, because it looked so bad. Massive fail. Mostly because of boobs, but also because of my long hair, which I refuse to give up because I want to be girly when I want to be, and I don\'t look very good with short hair as a girl.', 'subreddit': 'NonBinary', 'title': 'Physically androgynous AFAB, but wish I could transition to my birth sex? Does this make any sense?', 'created': 1495680929.0}"
2017-05-25 00:03:20,6d62vx,6,14,"Hello! 

My afab SO came to me recently saying that she (SO is still ok with she/her pronouns) has been questioning her gender lately and thinks she might be nonbinary. I'm ftm and I have a couple close friends who identify as nonbinary so I'm not totally lost when it comes to this community. I guess my question is how can I help my SO during this early period of questioning? What is something that helped you or could have helped you during your early questioning period? I know that my dysphoria/experience is different from nonbinary people so I'm afraid of accidently making assumptions about her dysphoria/experience. I want to help her feel less lost, but I don't know how to do that when all I know is my ftm experience. I remember that when I was questioning my gender I felt very alone and like a freak, so I just want to help my SO as much as possible so she doesn't have to go through the shit I went through.",NonBinary,"SO is questioning gender, how can I help?",1495695800.0,"{'created_utc': 1495670600, 'id': '6d62vx', 'num_comments': 6, 'score': 14, 'selftext': ""Hello! \n\nMy afab SO came to me recently saying that she (SO is still ok with she/her pronouns) has been questioning her gender lately and thinks she might be nonbinary. I'm ftm and I have a couple close friends who identify as nonbinary so I'm not totally lost when it comes to this community. I guess my question is how can I help my SO during this early period of questioning? What is something that helped you or could have helped you during your early questioning period? I know that my dysphoria/experience is different from nonbinary people so I'm afraid of accidently making assumptions about her dysphoria/experience. I want to help her feel less lost, but I don't know how to do that when all I know is my ftm experience. I remember that when I was questioning my gender I felt very alone and like a freak, so I just want to help my SO as much as possible so she doesn't have to go through the shit I went through."", 'subreddit': 'NonBinary', 'title': 'SO is questioning gender, how can I help?', 'created': 1495695800.0}"
2017-05-25 03:17:40,6d73bp,0,1,[deleted],NonBinary,"""Do We Even need gender?""",1495707460.0,"{'created_utc': 1495682260, 'id': '6d73bp', 'num_comments': 0, 'score': 1, 'selftext': '[deleted]', 'subreddit': 'NonBinary', 'title': '""Do We Even need gender?""', 'created': 1495707460.0}"
2017-05-25 03:27:46,6d7517,0,15,"[Do We Even Need Gender?](http://www.sbs.com.au/topics/sexuality/agenda/article/2017/05/24/do-we-even-need-gender)
*""... institutions should not separate people by gender unless they can point to a specific, clear, and valid reason""*",NonBinary,"""Do We Even Need Gender?""",1495708066.0,"{'created_utc': 1495682866, 'id': '6d7517', 'num_comments': 0, 'score': 15, 'selftext': '[Do We Even Need Gender?](http://www.sbs.com.au/topics/sexuality/agenda/article/2017/05/24/do-we-even-need-gender)\n*""... institutions should not separate people by gender unless they can point to a specific, clear, and valid reason""*', 'subreddit': 'NonBinary', 'title': '""Do We Even Need Gender?""', 'created': 1495708066.0}"
2017-05-25 08:25:29,6d8c1j,22,41,"why do so many people who are ""against"" non-binary gender identities assume that our genders are political? my gender is not part of a political movement. my gender isn't there to make a statement. my gender has nothing to do with feminism. my gender is about me and my identity only!",NonBinary,my gender is not political.,1495725929.0,"{'created_utc': 1495700729, 'id': '6d8c1j', 'num_comments': 22, 'score': 41, 'selftext': 'why do so many people who are ""against"" non-binary gender identities assume that our genders are political? my gender is not part of a political movement. my gender isn\'t there to make a statement. my gender has nothing to do with feminism. my gender is about me and my identity only!', 'subreddit': 'NonBinary', 'title': 'my gender is not political.', 'created': 1495725929.0}"
2017-05-25 17:15:32,6db0zw,2,3,"Hello! I'm amab, non-binary, and 19. I'm looking for opinions and advice about how much I should tone down my presentation while taking the subway back and forth to my classes this summer. 

A little bit of background, I go to a very liberal art college where I feel pretty safe presenting however I want to. I also live in a pretty liberal area as well. I've been out and presenting as my queer self for a while, and i've been on HRT for eight months now. It's to the point now where unless I take steps to hide my breasts I look visibly trans. This works for me on a personal level, because I'm non-binary and my ideal presentation is a pretty inherently queer one. I've been able to present this way because I lived in the dorm at my school, and the dorm is right across the street from my classes, so I never felt particularly vulnerable. I dress pretty feminine or androgynous most of the time, often with makeup, skirts or cute socks and things, though mostly I just wear whatever I feel like at the time.

When I needed to go out on my own to other places on errands and such I would just dress normatively. However, this summer I'm back home and I'm taking summer classes a few times a week for about a month. I have to ride the subway for a fair ways in order to get to my school. I'm really worried about being harassed or targeted for being visibly trans on public transportation. It doesn't help that I also have pretty bad anxiety, and public transport completely terrifies me on it's own even without the added stress of being trans.

 I've gotten used to being able to express myself openly at school. While I know that's a huge privilege, I really don't want to go back to hiding my real self. I also would have to stop painting my nails for a whole month while going to classes, and having that fear interfere with my presentation in my normal personal life sucks. Toning down my presentation doesn't erase my queerness. But because I have anxiety my presentation is often the only way I can make myself visible and express myself to other people, and it's also one of the few things that gives me confidence in social situations. Plus it just hurts every time people gender me as male. Trying to ""Pass"" in public as female would be closer to my desired presentation than my assigned gender is, but I don't know if I could, and I've never really attempted it.

So what do you people think? Should I dress completely as my assigned gender on the train, or should I just present how I want anyway, or is there a viable compromise between expression and safety. It's really hard for me to decide because a combination of my anxiety, and inexperience presenting in completely public spaces prevents me from realistically assessing the situation.

tl;dr - I'm amab and present pretty feminine. I used to be close to my college classes, but now I have to take the train and I'm worried about safety with how I present.
",NonBinary,Safety on Public Transport Advice,1495757732.0,"{'created_utc': 1495732532, 'id': '6db0zw', 'num_comments': 2, 'score': 3, 'selftext': 'Hello! I\'m amab, non-binary, and 19. I\'m looking for opinions and advice about how much I should tone down my presentation while taking the subway back and forth to my classes this summer. \n\nA little bit of background, I go to a very liberal art college where I feel pretty safe presenting however I want to. I also live in a pretty liberal area as well. I\'ve been out and presenting as my queer self for a while, and i\'ve been on HRT for eight months now. It\'s to the point now where unless I take steps to hide my breasts I look visibly trans. This works for me on a personal level, because I\'m non-binary and my ideal presentation is a pretty inherently queer one. I\'ve been able to present this way because I lived in the dorm at my school, and the dorm is right across the street from my classes, so I never felt particularly vulnerable. I dress pretty feminine or androgynous most of the time, often with makeup, skirts or cute socks and things, though mostly I just wear whatever I feel like at the time.\n\nWhen I needed to go out on my own to other places on errands and such I would just dress normatively. However, this summer I\'m back home and I\'m taking summer classes a few times a week for about a month. I have to ride the subway for a fair ways in order to get to my school. I\'m really worried about being harassed or targeted for being visibly trans on public transportation. It doesn\'t help that I also have pretty bad anxiety, and public transport completely terrifies me on it\'s own even without the added stress of being trans.\n\n I\'ve gotten used to being able to express myself openly at school. While I know that\'s a huge privilege, I really don\'t want to go back to hiding my real self. I also would have to stop painting my nails for a whole month while going to classes, and having that fear interfere with my presentation in my normal personal life sucks. Toning down my presentation doesn\'t erase my queerness. But because I have anxiety my presentation is often the only way I can make myself visible and express myself to other people, and it\'s also one of the few things that gives me confidence in social situations. Plus it just hurts every time people gender me as male. Trying to ""Pass"" in public as female would be closer to my desired presentation than my assigned gender is, but I don\'t know if I could, and I\'ve never really attempted it.\n\nSo what do you people think? Should I dress completely as my assigned gender on the train, or should I just present how I want anyway, or is there a viable compromise between expression and safety. It\'s really hard for me to decide because a combination of my anxiety, and inexperience presenting in completely public spaces prevents me from realistically assessing the situation.\n\ntl;dr - I\'m amab and present pretty feminine. I used to be close to my college classes, but now I have to take the train and I\'m worried about safety with how I present.\n', 'subreddit': 'NonBinary', 'title': 'Safety on Public Transport Advice', 'created': 1495757732.0}"
2017-05-25 17:41:39,6db75e,11,12,"So, a friend of mine just said she (sorry if that's not the correct term, but I'm very, very new to this) identified as non-binary and considered herself neither female or male. I'll be honest, I honestly didn't care, I could likely have guesses that she would have identified as that.

My question is, is it OK that I didn't react to her confessing, that to me and a group of friend she told just kinda shrugged it off? My exact words were ""Sure, you are who you are, I don't really care."" I don't care what she identifies as, my main concern is not offending her.",NonBinary,Quick Question from someone who just found out a friend is non-binary,1495759299.0,"{'created_utc': 1495734099, 'id': '6db75e', 'num_comments': 11, 'score': 12, 'selftext': 'So, a friend of mine just said she (sorry if that\'s not the correct term, but I\'m very, very new to this) identified as non-binary and considered herself neither female or male. I\'ll be honest, I honestly didn\'t care, I could likely have guesses that she would have identified as that.\n\nMy question is, is it OK that I didn\'t react to her confessing, that to me and a group of friend she told just kinda shrugged it off? My exact words were ""Sure, you are who you are, I don\'t really care."" I don\'t care what she identifies as, my main concern is not offending her.', 'subreddit': 'NonBinary', 'title': 'Quick Question from someone who just found out a friend is non-binary', 'created': 1495759299.0}"
2017-05-26 04:04:48,6deoer,10,20,So does anyone else feel like they have to constantly come out to/ remind the people around you that you aren't your assigned sex? I know I've told my mom that I'm not a girl but it never seems like I get the point across so I feel like I have to constantly tell her I'm not a girl... If you also experience this does it also feel like the people you need to constantly tell don't really accept you (because that's how I feel a lot of the time)?,NonBinary,Constantly coming out?,1495796688.0,"{'created_utc': 1495771488, 'id': '6deoer', 'num_comments': 10, 'score': 20, 'selftext': ""So does anyone else feel like they have to constantly come out to/ remind the people around you that you aren't your assigned sex? I know I've told my mom that I'm not a girl but it never seems like I get the point across so I feel like I have to constantly tell her I'm not a girl... If you also experience this does it also feel like the people you need to constantly tell don't really accept you (because that's how I feel a lot of the time)?"", 'subreddit': 'NonBinary', 'title': 'Constantly coming out?', 'created': 1495796688.0}"
2017-05-26 19:14:47,6dj1h6,8,20,"Today I let people know in a group chat that I prefer they/them to she/her. It was pretty scary so I went to the kitchen to get a drink and a guy I work with came in and was confrontational and acting like I had done something wrong.  I have mentioned it to an HR person (they are good people) so it is written down and such but I just don't know how to cope day to day.

It's a small office so it's not possible to avoid them, and there's only so much HR can do about it.  I guess it's also harder because I thought this person was my friend. There were other not so great comments but I suppose that one jut got to me. Advice/support pls :(",NonBinary,Came out at work and some people took it badly,1495851287.0,"{'created_utc': 1495826087, 'id': '6dj1h6', 'num_comments': 8, 'score': 20, 'selftext': ""Today I let people know in a group chat that I prefer they/them to she/her. It was pretty scary so I went to the kitchen to get a drink and a guy I work with came in and was confrontational and acting like I had done something wrong.  I have mentioned it to an HR person (they are good people) so it is written down and such but I just don't know how to cope day to day.\n\nIt's a small office so it's not possible to avoid them, and there's only so much HR can do about it.  I guess it's also harder because I thought this person was my friend. There were other not so great comments but I suppose that one jut got to me. Advice/support pls :("", 'subreddit': 'NonBinary', 'title': 'Came out at work and some people took it badly', 'created': 1495851287.0}"
2017-05-28 04:51:55,6ds3ql,12,14,I've been thinking a lot about this and was wondering what gender neutral terms could stand in for 'mom' and 'dad'. I'd love to hear from anyone with kids or anyone who might have any ideas for this.,NonBinary,NonBinary parents- what do your kids call you?,1495972315.0,"{'created_utc': 1495947115, 'id': '6ds3ql', 'num_comments': 12, 'score': 14, 'selftext': ""I've been thinking a lot about this and was wondering what gender neutral terms could stand in for 'mom' and 'dad'. I'd love to hear from anyone with kids or anyone who might have any ideas for this."", 'subreddit': 'NonBinary', 'title': 'NonBinary parents- what do your kids call you?', 'created': 1495972315.0}"
2017-05-28 21:08:29,6dw6lh,0,1,[deleted],NonBinary,To T or not to T (hormone advice)?,1496030909.0,"{'created_utc': 1496005709, 'id': '6dw6lh', 'num_comments': 0, 'score': 1, 'selftext': '[deleted]', 'subreddit': 'NonBinary', 'title': 'To T or not to T (hormone advice)?', 'created': 1496030909.0}"
