created_utc,id,num_comments,score,selftext,subreddit,title,created,d_
2017-05-10 04:25:21,6aan7b,13,12,"I was discussing this on an askreddit post iirc and somebody said I was leaving out non-binary employers by addressing a letter ""sir and/or madam"". What would an appropriate replacement be? Somebody else brought up zhe but that's a nominative pronoun so it wouldn't fit the context.

Thoughts?",NonBinary,"Hi, I have a question - what do you think an appropriate pronoun is in a formal context, like a job application?",1494415521.0,"{'created_utc': 1494390321, 'id': '6aan7b', 'num_comments': 13, 'score': 12, 'selftext': 'I was discussing this on an askreddit post iirc and somebody said I was leaving out non-binary employers by addressing a letter ""sir and/or madam"". What would an appropriate replacement be? Somebody else brought up zhe but that\'s a nominative pronoun so it wouldn\'t fit the context.\n\nThoughts?', 'subreddit': 'NonBinary', 'title': 'Hi, I have a question - what do you think an appropriate pronoun is in a formal context, like a job application?', 'created': 1494415521.0}"
2017-05-10 06:21:25,6ab3o5,0,1,[deleted],NonBinary,There are only two gendere,1494422485.0,"{'created_utc': 1494397285, 'id': '6ab3o5', 'num_comments': 0, 'score': 1, 'selftext': '[deleted]', 'subreddit': 'NonBinary', 'title': 'There are only two gendere', 'created': 1494422485.0}"
2017-05-10 23:09:22,6agc96,9,13,"Honest preface: my gender and sexual identities are things that I try not to think about or recognize because I really don't want to be ""different"" and I wonder if I'm just trying to stick extra labels on myself since I already have a number of mental illnesses. I'm also afraid my MIs (CPTSD and BPD) are making me think I relate to identities that I'm actually not.

I wrote a long post somewhere else but got insecure and took it down so here's kind of a brief summary... I'm afab and like (androgynous leaning) female fashion, makeup, etc. I desperately want to be considered conventionally attractive.

I also (maybe because of my lifelong abuse and trauma) never felt like I fit in with other girls or women. Sometimes I feel like cis women are living a totally different life than I am (except maybe rn I'm just being a whiny cis woman lol if so I apologize.) I've never really had a close female friend. Whenever I'm around other women/female friends I feel uncomfortable and like I'm missing something and don't work properly as a ""woman"". Oh, and I don't really feel comfortable applying the words ""woman"" or ""girl"" to myself. I hate having ""good girl"" said to me but I like ""good boy"". When I have stuffed animals I always call them by male pronouns.

But I don't really feel like a guy either. I was neglected by my father, bullied by my brother and abused by an older man. I'm afraid of men. But my closest friends in life (ie the people I've felt most comfortable around) have been androgynous or feminine leaning men.  

I used to say I wouldn't mind being reborn as a boy but now I don't really feel much of either. It would be really nice if the world suddenly became genderless and everyone were somewhere in between, because those are the people I'm most comfortable around. I wouldn't feel comfortable asking for non-gendered pronouns but I think it'd be nice if they were just implemented for everyone. 

I definitely feel like I'm in my own awkward not-real-woman corner, just a person. I definitely don't want to identify as ""both man and woman"", more like neither. Except I still like feminine (somewhat, more androgynous is better) fashion, makeup, and care a lot about becoming ""prettier"". 

What am I? If the answer is just a cis woman who needs to stfu, please let me know gently. I'm also a victim of intense lifelong child abuse which may be giving me the confusion but that means I have trouble handling the idea of people being angry at me. Thanks for your patience. ",NonBinary,Am I nonbinary if I want to be conventionally attractive by feminine standards?,1494482962.0,"{'created_utc': 1494457762, 'id': '6agc96', 'num_comments': 9, 'score': 13, 'selftext': 'Honest preface: my gender and sexual identities are things that I try not to think about or recognize because I really don\'t want to be ""different"" and I wonder if I\'m just trying to stick extra labels on myself since I already have a number of mental illnesses. I\'m also afraid my MIs (CPTSD and BPD) are making me think I relate to identities that I\'m actually not.\n\nI wrote a long post somewhere else but got insecure and took it down so here\'s kind of a brief summary... I\'m afab and like (androgynous leaning) female fashion, makeup, etc. I desperately want to be considered conventionally attractive.\n\nI also (maybe because of my lifelong abuse and trauma) never felt like I fit in with other girls or women. Sometimes I feel like cis women are living a totally different life than I am (except maybe rn I\'m just being a whiny cis woman lol if so I apologize.) I\'ve never really had a close female friend. Whenever I\'m around other women/female friends I feel uncomfortable and like I\'m missing something and don\'t work properly as a ""woman"". Oh, and I don\'t really feel comfortable applying the words ""woman"" or ""girl"" to myself. I hate having ""good girl"" said to me but I like ""good boy"". When I have stuffed animals I always call them by male pronouns.\n\nBut I don\'t really feel like a guy either. I was neglected by my father, bullied by my brother and abused by an older man. I\'m afraid of men. But my closest friends in life (ie the people I\'ve felt most comfortable around) have been androgynous or feminine leaning men.  \n\nI used to say I wouldn\'t mind being reborn as a boy but now I don\'t really feel much of either. It would be really nice if the world suddenly became genderless and everyone were somewhere in between, because those are the people I\'m most comfortable around. I wouldn\'t feel comfortable asking for non-gendered pronouns but I think it\'d be nice if they were just implemented for everyone. \n\nI definitely feel like I\'m in my own awkward not-real-woman corner, just a person. I definitely don\'t want to identify as ""both man and woman"", more like neither. Except I still like feminine (somewhat, more androgynous is better) fashion, makeup, and care a lot about becoming ""prettier"". \n\nWhat am I? If the answer is just a cis woman who needs to stfu, please let me know gently. I\'m also a victim of intense lifelong child abuse which may be giving me the confusion but that means I have trouble handling the idea of people being angry at me. Thanks for your patience. ', 'subreddit': 'NonBinary', 'title': 'Am I nonbinary if I want to be conventionally attractive by feminine standards?', 'created': 1494482962.0}"
2017-05-11 00:14:37,6agond,3,6,"I was born as male and have identified with that for a long time. Then I got to thinking a few nights ago about gender and I felt mostly sure I still identified as male. But every day, being male just felt more, I don't really know if this is the right word but, distant, like it wasn't a part of who I was. However, female seems wrong too. I've always dressed male, and usually felt comfortable and while I still feel comfortable dressing like a male, ""he"" just seems weird. ""She"" also seems weird, and I don't know how to identify anymore. I haven't told anyone in case I'm wrong and confused, but I don't know how to identify myself. (I don't know if this will help but I am attracted to males, and used to identify as gay, but would I still be called that if I end up not being binary?)",NonBinary,I think I may be non-binary.,1494486877.0,"{'created_utc': 1494461677, 'id': '6agond', 'num_comments': 3, 'score': 6, 'selftext': 'I was born as male and have identified with that for a long time. Then I got to thinking a few nights ago about gender and I felt mostly sure I still identified as male. But every day, being male just felt more, I don\'t really know if this is the right word but, distant, like it wasn\'t a part of who I was. However, female seems wrong too. I\'ve always dressed male, and usually felt comfortable and while I still feel comfortable dressing like a male, ""he"" just seems weird. ""She"" also seems weird, and I don\'t know how to identify anymore. I haven\'t told anyone in case I\'m wrong and confused, but I don\'t know how to identify myself. (I don\'t know if this will help but I am attracted to males, and used to identify as gay, but would I still be called that if I end up not being binary?)', 'subreddit': 'NonBinary', 'title': 'I think I may be non-binary.', 'created': 1494486877.0}"
2017-05-11 12:33:45,6ajtfo,8,38,"So imagine you've bought a house, but when you move in, you discover the previous family's things are still everywhere - pictures on the walls, decorations, toys and belongings, like they still lived there. But you're not allowed to remove the old stuff, it's been bolted down and nailed to the walls, and when you bring it up with the estate agents they tell you you're not allowed to get rid of their things. So you live in this house, and you can make small changes, you can put new pictures up, you can fill it with your stuff and paint the walls, but at the end of the day you're always constantly aware that you're living in someone else's house.
",NonBinary,"My best friend has trouble understanding my body dysphoria, but I've written an analogy that really helped her and I wanted to share it",1494531225.0,"{'created_utc': 1494506025, 'id': '6ajtfo', 'num_comments': 8, 'score': 38, 'selftext': ""So imagine you've bought a house, but when you move in, you discover the previous family's things are still everywhere - pictures on the walls, decorations, toys and belongings, like they still lived there. But you're not allowed to remove the old stuff, it's been bolted down and nailed to the walls, and when you bring it up with the estate agents they tell you you're not allowed to get rid of their things. So you live in this house, and you can make small changes, you can put new pictures up, you can fill it with your stuff and paint the walls, but at the end of the day you're always constantly aware that you're living in someone else's house.\n"", 'subreddit': 'NonBinary', 'title': ""My best friend has trouble understanding my body dysphoria, but I've written an analogy that really helped her and I wanted to share it"", 'created': 1494531225.0}"
2017-05-11 13:19:50,6ak22l,4,2,"I think too much and this is what I'm thinking about today. Does your gender experience impede or facilitate, is it central or peripheral, does it matter at all in your big picture view of life?",NonBinary,How does your experience with gender influence what you see as your purpose or drive in life (if it does)?,1494533990.0,"{'created_utc': 1494508790, 'id': '6ak22l', 'num_comments': 4, 'score': 2, 'selftext': ""I think too much and this is what I'm thinking about today. Does your gender experience impede or facilitate, is it central or peripheral, does it matter at all in your big picture view of life?"", 'subreddit': 'NonBinary', 'title': 'How does your experience with gender influence what you see as your purpose or drive in life (if it does)?', 'created': 1494533990.0}"
2017-05-11 20:47:54,6amw2j,5,8,"So I could go on a long rant about it, but I feel like my story is pretty similar to a lot of people's on here.  Suffice it to say, I'm afab, have more or less identified as a woman my whole life probably mostly because it never occurred to me I could be anything else, then in recent years felt more and more distant from my assigned gender. I've never felt like a guy, but I often don't feel like a woman, either. I think I fluctuate between female and, like, neutral.  So there's that. 

Thing is, I'm fine with she/her pronouns, I'm okay with my name (it's a gendered name for sure), and about half the time I dress pretty femme. So I've never really felt a need to ""come out"" as NB or anything. I don't have dysphoria, I don't think. At the most I feel kind of apathetic towards like my body and how people gender me.

I recently started a new job where I have to dress more professionally, and have entered a world of frustration with women's office wear being dumb but being too small to fit into men's clothes and uhg, so that's a whole thing. I normally prefer to dress pretty casual because it feels more neutral to me to just wear tees and jeans. I guess it's triggered like...an examination of my gender, along with some discomfort. I've been thinking about it all the time and reading on here and r/genderqueer and googling things. And I've been watching Kaitlyn Alexander's videos on YouTube (bless them), and can't decide if I have a giant crush on them or just want to be them. Ahaha. 

Another thing is that I've been kind of referring to myself in my head as NB/gender fluid for maybe a week or two and honestly I really like those feels. When it occurred to me that I didn't actually need to make a big outward change this revelation around (flashback to the billion other times/ways I've ""come out"" in my life), it started feeling like this kind of cool personal thing I don't have to share. Like, for the first time I'm taking control of my gender internally rather than letting people's assumptions define me. I don't do that for anything else, why should I do it for gender?

But I don't know. I've been feeling some kind of way about my gender, sometimes happy and sometimes confused and sometimes frustrated, but don't know if it...changes anything, exactly. I talk to bae about it a lot and she told me something I somehow hadn't learned in almost two years of dating, which is that she came out a few years back as just her - not a man or a woman, just her name. She's super laid back about gender and only gets bothered when people aggressively/rudely assume she's a she. And I kind of feel the same except I also have this, like, need to address it in some way. But I also don't want to make a big deal about it. Maybe it's more of an internal thing for me. But...like...gah.

I also don't want to be one of those cis people who just dislikes gender norms and conflates being a different gender with just defying expectations of their expected gender. Like, do I not want to be a woman, or am I not actually a woman? I feel more like it's the latter I'm just not sure. I don't want to take up space that isn't mine to take.

Guess I was gonna rant anyway. Oops.

TL;DR: I've been reconsidering my gender but am also sort of okay with the box I get put in, and don't know how to feel about that or what, if anything, to do. 

Does anyone else feel this way? ",NonBinary,"Gender feels, obsessing over NB YouTuber, feeling a little crazy...",1494560874.0,"{'created_utc': 1494535674, 'id': '6amw2j', 'num_comments': 5, 'score': 8, 'selftext': 'So I could go on a long rant about it, but I feel like my story is pretty similar to a lot of people\'s on here.  Suffice it to say, I\'m afab, have more or less identified as a woman my whole life probably mostly because it never occurred to me I could be anything else, then in recent years felt more and more distant from my assigned gender. I\'ve never felt like a guy, but I often don\'t feel like a woman, either. I think I fluctuate between female and, like, neutral.  So there\'s that. \n\nThing is, I\'m fine with she/her pronouns, I\'m okay with my name (it\'s a gendered name for sure), and about half the time I dress pretty femme. So I\'ve never really felt a need to ""come out"" as NB or anything. I don\'t have dysphoria, I don\'t think. At the most I feel kind of apathetic towards like my body and how people gender me.\n\nI recently started a new job where I have to dress more professionally, and have entered a world of frustration with women\'s office wear being dumb but being too small to fit into men\'s clothes and uhg, so that\'s a whole thing. I normally prefer to dress pretty casual because it feels more neutral to me to just wear tees and jeans. I guess it\'s triggered like...an examination of my gender, along with some discomfort. I\'ve been thinking about it all the time and reading on here and r/genderqueer and googling things. And I\'ve been watching Kaitlyn Alexander\'s videos on YouTube (bless them), and can\'t decide if I have a giant crush on them or just want to be them. Ahaha. \n\nAnother thing is that I\'ve been kind of referring to myself in my head as NB/gender fluid for maybe a week or two and honestly I really like those feels. When it occurred to me that I didn\'t actually need to make a big outward change this revelation around (flashback to the billion other times/ways I\'ve ""come out"" in my life), it started feeling like this kind of cool personal thing I don\'t have to share. Like, for the first time I\'m taking control of my gender internally rather than letting people\'s assumptions define me. I don\'t do that for anything else, why should I do it for gender?\n\nBut I don\'t know. I\'ve been feeling some kind of way about my gender, sometimes happy and sometimes confused and sometimes frustrated, but don\'t know if it...changes anything, exactly. I talk to bae about it a lot and she told me something I somehow hadn\'t learned in almost two years of dating, which is that she came out a few years back as just her - not a man or a woman, just her name. She\'s super laid back about gender and only gets bothered when people aggressively/rudely assume she\'s a she. And I kind of feel the same except I also have this, like, need to address it in some way. But I also don\'t want to make a big deal about it. Maybe it\'s more of an internal thing for me. But...like...gah.\n\nI also don\'t want to be one of those cis people who just dislikes gender norms and conflates being a different gender with just defying expectations of their expected gender. Like, do I not want to be a woman, or am I not actually a woman? I feel more like it\'s the latter I\'m just not sure. I don\'t want to take up space that isn\'t mine to take.\n\nGuess I was gonna rant anyway. Oops.\n\nTL;DR: I\'ve been reconsidering my gender but am also sort of okay with the box I get put in, and don\'t know how to feel about that or what, if anything, to do. \n\nDoes anyone else feel this way? ', 'subreddit': 'NonBinary', 'title': 'Gender feels, obsessing over NB YouTuber, feeling a little crazy...', 'created': 1494560874.0}"
2017-05-12 17:11:16,6asm00,2,10,"Hey guys. So I'm not sure where else to put this, but was hoping for some help from my fellow nb's. I'm afab, prefer they/them, leaning towards masc, and am pansexual. I just got home from college for the summer and I'm looking for a therapist. Although I'm interested in T, I don't know if I'm ready for it. I wanted to find a lgtb+ therapist that could help me work out what all would be best for me.  My problem is trying to find a place to go that I'm comfortable with that my parents wouldn't be angry with me for going to.  I haven't come out as nb to them(though I have come out as pan), and am worried what they will think when I do as they are religious and haven't seemed very comfortable with trans people in the past. I guess what I'm looking for is some help on how to approach the subject with them.  Any advice would be helpful,  or directing me to a more suitable subreddit for this kind of question.  Thanks and I love you all. ",NonBinary,Advice on coming out and therapists,1494634276.0,"{'created_utc': 1494609076, 'id': '6asm00', 'num_comments': 2, 'score': 10, 'selftext': ""Hey guys. So I'm not sure where else to put this, but was hoping for some help from my fellow nb's. I'm afab, prefer they/them, leaning towards masc, and am pansexual. I just got home from college for the summer and I'm looking for a therapist. Although I'm interested in T, I don't know if I'm ready for it. I wanted to find a lgtb+ therapist that could help me work out what all would be best for me.  My problem is trying to find a place to go that I'm comfortable with that my parents wouldn't be angry with me for going to.  I haven't come out as nb to them(though I have come out as pan), and am worried what they will think when I do as they are religious and haven't seemed very comfortable with trans people in the past. I guess what I'm looking for is some help on how to approach the subject with them.  Any advice would be helpful,  or directing me to a more suitable subreddit for this kind of question.  Thanks and I love you all. "", 'subreddit': 'NonBinary', 'title': 'Advice on coming out and therapists', 'created': 1494634276.0}"
2017-05-12 20:36:15,6atu4n,1,0,,NonBinary,Non-binary babe documenting life in love :),1494646575.0,"{'created_utc': 1494621375, 'id': '6atu4n', 'num_comments': 1, 'score': 0, 'selftext': '', 'subreddit': 'NonBinary', 'title': 'Non-binary babe documenting life in love :)', 'created': 1494646575.0}"
2017-05-12 21:19:00,6au2xa,1,18,"Yesterday I had my first appointment at an ICATH gender clinic for HRT. I don't get my prescription until May 31, but at least I'm on the road. Apparently my insurance will cover gel, so that's what I asked for. First, sticking myself with a needle - no. Second, the ups and downs of T injection dose wearing off before the next shot sounds no fun. Third, did I mention needles?

I was disappointed the doc wants to start me on a lower dose than I was hoping for. I'll appeal when I go back on the 31st.

I also came out on Facebook last week. It was incredibly anticlimatic. Nothing negative at all, and only one of my 324 Facebook ""friends"" disappeared after my post. And since I can't even figure out who it was, I guess that person wasn't important to me.
",NonBinary,Another step done,1494649140.0,"{'created_utc': 1494623940, 'id': '6au2xa', 'num_comments': 1, 'score': 18, 'selftext': 'Yesterday I had my first appointment at an ICATH gender clinic for HRT. I don\'t get my prescription until May 31, but at least I\'m on the road. Apparently my insurance will cover gel, so that\'s what I asked for. First, sticking myself with a needle - no. Second, the ups and downs of T injection dose wearing off before the next shot sounds no fun. Third, did I mention needles?\n\nI was disappointed the doc wants to start me on a lower dose than I was hoping for. I\'ll appeal when I go back on the 31st.\n\nI also came out on Facebook last week. It was incredibly anticlimatic. Nothing negative at all, and only one of my 324 Facebook ""friends"" disappeared after my post. And since I can\'t even figure out who it was, I guess that person wasn\'t important to me.\n', 'subreddit': 'NonBinary', 'title': 'Another step done', 'created': 1494649140.0}"
2017-05-13 12:35:35,6axlq8,5,33,"I did it! I am healing up pretty well and just wanted to share that I was able to get my nonbinary top surgery done on Wednesday. I am so happy. I have been riding a gender euphoria wave and I am literally the happiest I have felt in my body since puberty. 

",NonBinary,Top surgery success!,1494704135.0,"{'created_utc': 1494678935, 'id': '6axlq8', 'num_comments': 5, 'score': 33, 'selftext': 'I did it! I am healing up pretty well and just wanted to share that I was able to get my nonbinary top surgery done on Wednesday. I am so happy. I have been riding a gender euphoria wave and I am literally the happiest I have felt in my body since puberty. \n\n', 'subreddit': 'NonBinary', 'title': 'Top surgery success!', 'created': 1494704135.0}"
2017-05-13 17:48:32,6az4qe,0,1,[deleted],NonBinary,Hilarious truth.,1494722912.0,"{'created_utc': 1494697712, 'id': '6az4qe', 'num_comments': 0, 'score': 1, 'selftext': '[deleted]', 'subreddit': 'NonBinary', 'title': 'Hilarious truth.', 'created': 1494722912.0}"
2017-05-13 22:56:43,6b0qmh,5,32,,NonBinary,"Me in 1988. Not trying to be androgynous, but I seemed to be succeeding.",1494741403.0,"{'created_utc': 1494716203, 'id': '6b0qmh', 'num_comments': 5, 'score': 32, 'selftext': '', 'subreddit': 'NonBinary', 'title': 'Me in 1988. Not trying to be androgynous, but I seemed to be succeeding.', 'created': 1494741403.0}"
