created_utc,id,num_comments,score,selftext,subreddit,title,created,d_
2017-05-01 01:19:17,68j5wg,7,5,,NonBinary,My new blog about gender and stuff,1493626757.0,"{'created_utc': 1493601557, 'id': '68j5wg', 'num_comments': 7, 'score': 5, 'selftext': '', 'subreddit': 'NonBinary', 'title': 'My new blog about gender and stuff', 'created': 1493626757.0}"
2017-05-01 03:20:57,68jqbf,1,1,[deleted],NonBinary,The alt right is hijacking the peace sign....,1493634057.0,"{'created_utc': 1493608857, 'id': '68jqbf', 'num_comments': 1, 'score': 1, 'selftext': '[deleted]', 'subreddit': 'NonBinary', 'title': 'The alt right is hijacking the peace sign....', 'created': 1493634057.0}"
2017-05-01 19:27:47,68o4mm,26,26,"So I've been sick and tired of hearing all the reddiots over on /r/television bitching and moaning about how triggered they are because their beloved childhood hero turned on them by explaining a scientific concept that their hateful, two sizes too small, hearts can't handle. I haven't actually seen Nye's new show or the gender spectrum segment, but I would like to better inform myself about  nonbinary gender individuals, to drift away from the flock on the path of hate and fear. 

I don't have much knowledge of nonbinary gender, I am familiar about transgender identity, and have known some transgender people in real life. I know that gender is psychological, and not strictly synonymous with the physical sexual identity. I also know that some people prefer to be referred to with they/them pronouns. I have come here to ask for a basic primer on the concept of nonbinary gender, and some the genders between strictly male and female. I would also like to know about your personal experiences, when and where did you first learn about nonbinary gender, how do you know for sure about your identity, and how has this affected your personal life?

Finally, if it is at all possible, I would like to know if there are some  ideas can better communicate with the rest of Reddit and better inform them about the science about nonbinary genders. I know this may seem impossible, but if we can enlighten a handful of people as well as myself, I would be pretty satisfied.",NonBinary,"Can you please educate me, a clueless cisgender male, about nonbinary gender or your experiences?",1493692067.0,"{'created_utc': 1493666867, 'id': '68o4mm', 'num_comments': 26, 'score': 26, 'selftext': ""So I've been sick and tired of hearing all the reddiots over on /r/television bitching and moaning about how triggered they are because their beloved childhood hero turned on them by explaining a scientific concept that their hateful, two sizes too small, hearts can't handle. I haven't actually seen Nye's new show or the gender spectrum segment, but I would like to better inform myself about  nonbinary gender individuals, to drift away from the flock on the path of hate and fear. \n\nI don't have much knowledge of nonbinary gender, I am familiar about transgender identity, and have known some transgender people in real life. I know that gender is psychological, and not strictly synonymous with the physical sexual identity. I also know that some people prefer to be referred to with they/them pronouns. I have come here to ask for a basic primer on the concept of nonbinary gender, and some the genders between strictly male and female. I would also like to know about your personal experiences, when and where did you first learn about nonbinary gender, how do you know for sure about your identity, and how has this affected your personal life?\n\nFinally, if it is at all possible, I would like to know if there are some  ideas can better communicate with the rest of Reddit and better inform them about the science about nonbinary genders. I know this may seem impossible, but if we can enlighten a handful of people as well as myself, I would be pretty satisfied."", 'subreddit': 'NonBinary', 'title': 'Can you please educate me, a clueless cisgender male, about nonbinary gender or your experiences?', 'created': 1493692067.0}"
2017-05-02 01:00:15,68q1vk,0,2,Do people whose bodies naturally produced testosterone but who went on anti-androgens/got an orchiectomy and began using estrogen HRT experience a slowing down of their metabolism?,NonBinary,Does estrogen HRT slow down one's metabolism in comparison to testosterone?,1493712015.0,"{'created_utc': 1493686815, 'id': '68q1vk', 'num_comments': 0, 'score': 2, 'selftext': 'Do people whose bodies naturally produced testosterone but who went on anti-androgens/got an orchiectomy and began using estrogen HRT experience a slowing down of their metabolism?', 'subreddit': 'NonBinary', 'title': ""Does estrogen HRT slow down one's metabolism in comparison to testosterone?"", 'created': 1493712015.0}"
2017-05-02 01:14:12,68q4hy,1,0,[removed],NonBinary,What does LGBT mean,1493712852.0,"{'created_utc': 1493687652, 'id': '68q4hy', 'num_comments': 1, 'score': 0, 'selftext': '[removed]', 'subreddit': 'NonBinary', 'title': 'What does LGBT mean', 'created': 1493712852.0}"
2017-05-02 17:16:34,68uhcp,7,5,"So I know about finasteride, but honestly I'm more interested in taking antiandrogens because the absence of a good amount of testosterone in my body sounds far more appealing to me. I do not want to have any kind of a libido and I feel like having a body filled with testosterone is more negative than positive. The idea of potentially losing muscle mass is very appealing to me, essentially the feminization aspect of anti androgens is incredibly appealing to me and if I could take them to avoid male pattern baldness with all of these other things on top of that then I would be pretty happy with it. I'm just wondering how effective it would be to take spironolactone or any other anti androgen for these effects... honestly if I could go out and ask a surgeon to castrate me I would, but that's not really something I think would be possible unless I had cancer in that area... also I'm 26... not sure how relevant that is to anything but I figured I'd throw that in there.",NonBinary,[AMAB] Using Anti Androgens To Prevent Hair Loss?,1493770594.0,"{'created_utc': 1493745394, 'id': '68uhcp', 'num_comments': 7, 'score': 5, 'selftext': ""So I know about finasteride, but honestly I'm more interested in taking antiandrogens because the absence of a good amount of testosterone in my body sounds far more appealing to me. I do not want to have any kind of a libido and I feel like having a body filled with testosterone is more negative than positive. The idea of potentially losing muscle mass is very appealing to me, essentially the feminization aspect of anti androgens is incredibly appealing to me and if I could take them to avoid male pattern baldness with all of these other things on top of that then I would be pretty happy with it. I'm just wondering how effective it would be to take spironolactone or any other anti androgen for these effects... honestly if I could go out and ask a surgeon to castrate me I would, but that's not really something I think would be possible unless I had cancer in that area... also I'm 26... not sure how relevant that is to anything but I figured I'd throw that in there."", 'subreddit': 'NonBinary', 'title': '[AMAB] Using Anti Androgens To Prevent Hair Loss?', 'created': 1493770594.0}"
2017-05-02 19:18:48,68v9c5,7,7,So don't let anyone give you shit when you correct them on your pronouns. ,NonBinary,When you misgender someone either intentionally or accidentally you're erasing a core aspect of that person. Trans* people's identities are more important than Cis people's sensibilities and 'proper grammar'.,1493777928.0,"{'created_utc': 1493752728, 'id': '68v9c5', 'num_comments': 7, 'score': 7, 'selftext': ""So don't let anyone give you shit when you correct them on your pronouns. "", 'subreddit': 'NonBinary', 'title': ""When you misgender someone either intentionally or accidentally you're erasing a core aspect of that person. Trans* people's identities are more important than Cis people's sensibilities and 'proper grammar'."", 'created': 1493777928.0}"
2017-05-02 20:10:14,68vkz8,3,16,,NonBinary,Interesting article on NPR,1493781014.0,"{'created_utc': 1493755814, 'id': '68vkz8', 'num_comments': 3, 'score': 16, 'selftext': '', 'subreddit': 'NonBinary', 'title': 'Interesting article on NPR', 'created': 1493781014.0}"
2017-05-02 22:45:50,68wha7,1,26,,NonBinary,[AMAB] Felt good about my boob hair for once,1493790350.0,"{'created_utc': 1493765150, 'id': '68wha7', 'num_comments': 1, 'score': 26, 'selftext': '', 'subreddit': 'NonBinary', 'title': '[AMAB] Felt good about my boob hair for once', 'created': 1493790350.0}"
2017-05-03 04:01:09,68y3rp,6,0,,NonBinary,Behold the truth.,1493809269.0,"{'created_utc': 1493784069, 'id': '68y3rp', 'num_comments': 6, 'score': 0, 'selftext': '', 'subreddit': 'NonBinary', 'title': 'Behold the truth.', 'created': 1493809269.0}"
2017-05-03 14:35:56,690psk,0,13,"My friends and I have created Trans Coven, a trans and non-binary exclusive, 18+ server that hopes to be a friendly, welcoming environment. We have isolated channels for trans men, trans women, and non-binary folk, as well as a multitude of others open for general discussion. We’ll be hosting regular game nights, from Overwatch to Team Fortress 2, and are always open to suggestions for others! We’d love to welcome those in any stage of questioning or transitioning to help us build a little community of our own. 

Link to join: https://discord.gg/zcZh9eu",NonBinary,18+ Trans/Non-Binary Discord Server!,1493847356.0,"{'created_utc': 1493822156, 'id': '690psk', 'num_comments': 0, 'score': 13, 'selftext': 'My friends and I have created Trans Coven, a trans and non-binary exclusive, 18+ server that hopes to be a friendly, welcoming environment. We have isolated channels for trans men, trans women, and non-binary folk, as well as a multitude of others open for general discussion. We’ll be hosting regular game nights, from Overwatch to Team Fortress 2, and are always open to suggestions for others! We’d love to welcome those in any stage of questioning or transitioning to help us build a little community of our own. \n\nLink to join: https://discord.gg/zcZh9eu', 'subreddit': 'NonBinary', 'title': '18+ Trans/Non-Binary Discord Server!', 'created': 1493847356.0}"
2017-05-03 15:43:28,6914ex,7,20,,NonBinary,An Incredible Thing Happened When This Man Bought Himself A Pair Of Gucci Heels,1493851408.0,"{'created_utc': 1493826208, 'id': '6914ex', 'num_comments': 7, 'score': 20, 'selftext': '', 'subreddit': 'NonBinary', 'title': 'An Incredible Thing Happened When This Man Bought Himself A Pair Of Gucci Heels', 'created': 1493851408.0}"
2017-05-05 00:21:40,69bfr5,1,9,"I'm at a loss. 

So I work in a super professional (skirts &amp; suits kinda thing) office. During the winter it was easy to just wear woolen sweaters over button-downs, with boots and trousers. 

Spring is here, and its getting too warm for sweaters. 

Any ideas or lookbook links? I'm approaching 30 and can't yet wear a binder (STILL breastfeeding omg), and I get heatstroke at the mention of humidity (for real). 

Ideas? Thoughts? ",NonBinary,Nonbinary office fashions: summer edition,1493968900.0,"{'created_utc': 1493943700, 'id': '69bfr5', 'num_comments': 1, 'score': 9, 'selftext': ""I'm at a loss. \n\nSo I work in a super professional (skirts &amp; suits kinda thing) office. During the winter it was easy to just wear woolen sweaters over button-downs, with boots and trousers. \n\nSpring is here, and its getting too warm for sweaters. \n\nAny ideas or lookbook links? I'm approaching 30 and can't yet wear a binder (STILL breastfeeding omg), and I get heatstroke at the mention of humidity (for real). \n\nIdeas? Thoughts? "", 'subreddit': 'NonBinary', 'title': 'Nonbinary office fashions: summer edition', 'created': 1493968900.0}"
2017-05-05 20:07:00,69h06v,2,3,"I'm seeing an Endo on Thursday. As an afab F/M bi-gender individual I don't want to lose all of my connection to my femme side while on T for bottom growth to get meta. I know a lot of MtFs who only take E without AAs and still have T in their systems and they seem to get the effects of both.

Is it worth it to ask my Endo for a mix, not just T? Is this something that is done? Has anyone here done anything like this? Is so, what are the effects of having all of them in your system at once? Would it slow bottom growth?

(cross-post to Asktransgender)",NonBinary,"Going on T, what about E and P?",1494040020.0,"{'created_utc': 1494014820, 'id': '69h06v', 'num_comments': 2, 'score': 3, 'selftext': ""I'm seeing an Endo on Thursday. As an afab F/M bi-gender individual I don't want to lose all of my connection to my femme side while on T for bottom growth to get meta. I know a lot of MtFs who only take E without AAs and still have T in their systems and they seem to get the effects of both.\n\nIs it worth it to ask my Endo for a mix, not just T? Is this something that is done? Has anyone here done anything like this? Is so, what are the effects of having all of them in your system at once? Would it slow bottom growth?\n\n(cross-post to Asktransgender)"", 'subreddit': 'NonBinary', 'title': 'Going on T, what about E and P?', 'created': 1494040020.0}"
2017-05-05 21:12:48,69hdyd,0,5,,NonBinary,NB poetry,1494043968.0,"{'created_utc': 1494018768, 'id': '69hdyd', 'num_comments': 0, 'score': 5, 'selftext': '', 'subreddit': 'NonBinary', 'title': 'NB poetry', 'created': 1494043968.0}"
2017-05-06 17:36:27,69mfkm,0,2,[deleted],NonBinary,Dealing with transphobia,1494117387.0,"{'created_utc': 1494092187, 'id': '69mfkm', 'num_comments': 0, 'score': 2, 'selftext': '[deleted]', 'subreddit': 'NonBinary', 'title': 'Dealing with transphobia', 'created': 1494117387.0}"
2017-05-06 21:39:02,69nphp,0,1,[deleted],NonBinary,Look at how transphobic and terrible r/Dankmemes is!,1494131942.0,"{'created_utc': 1494106742, 'id': '69nphp', 'num_comments': 0, 'score': 1, 'selftext': '[deleted]', 'subreddit': 'NonBinary', 'title': 'Look at how transphobic and terrible r/Dankmemes is!', 'created': 1494131942.0}"
2017-05-06 23:20:35,69o7k7,2,10,,NonBinary,A short film about being fluid/nb,1494138035.0,"{'created_utc': 1494112835, 'id': '69o7k7', 'num_comments': 2, 'score': 10, 'selftext': '', 'subreddit': 'NonBinary', 'title': 'A short film about being fluid/nb', 'created': 1494138035.0}"
2017-05-07 16:01:34,69s098,34,50,"So I don't know how many of you have been seeing these posts on Reddit about how Bill Nye ""sucks"" now because he believes gender is a spectrum. 
I really didn't think that this hardcore belief in the binary existed on Reddit. I am surprised and angry and disappointed after reading about 500 comments all saying that there is male or female. 

Most of the confusion is over the distinction between sex and gender. What's so frustrating is that people think this distinction started in 2017...

I don't know what else to say other than to just ask if it's been bugging you all too...",NonBinary,This Bill Nye/Reddit thing has me messed up (might be triggering),1494198094.0,"{'created_utc': 1494172894, 'id': '69s098', 'num_comments': 34, 'score': 50, 'selftext': 'So I don\'t know how many of you have been seeing these posts on Reddit about how Bill Nye ""sucks"" now because he believes gender is a spectrum. \nI really didn\'t think that this hardcore belief in the binary existed on Reddit. I am surprised and angry and disappointed after reading about 500 comments all saying that there is male or female. \n\nMost of the confusion is over the distinction between sex and gender. What\'s so frustrating is that people think this distinction started in 2017...\n\nI don\'t know what else to say other than to just ask if it\'s been bugging you all too...', 'subreddit': 'NonBinary', 'title': 'This Bill Nye/Reddit thing has me messed up (might be triggering)', 'created': 1494198094.0}"
2017-05-07 20:28:04,69tkis,2,4,,NonBinary,I'M COMING OUT AS NONBINARY,1494214084.0,"{'created_utc': 1494188884, 'id': '69tkis', 'num_comments': 2, 'score': 4, 'selftext': '', 'subreddit': 'NonBinary', 'title': ""I'M COMING OUT AS NONBINARY"", 'created': 1494214084.0}"
2017-05-07 21:35:12,69ty65,1,13,"So, I already know the people on Kik can be a mess. Tons of guys looking for nudes, and so on.

But a friend from one group invited me into another. Soon after I enter, one member asks what NonBinary is, and another starts bashing me for having it in my profile description. 

I would have been open to having a conversation, but it was just a flood of trash talk, from one of the admins. Basically saying that people like me made binary genders look bad. And so on. I basically responded that it was not my fault that they were spiteful, and that l hoped nobody treated them the same way. They said I wasn't part of the community, and I responded that I was glad, and left. 

I hope nobody dares to act that way in public, I don't think I could keep my cool.",NonBinary,"Wow, unexpected aggression",1494218112.0,"{'created_utc': 1494192912, 'id': '69ty65', 'num_comments': 1, 'score': 13, 'selftext': ""So, I already know the people on Kik can be a mess. Tons of guys looking for nudes, and so on.\n\nBut a friend from one group invited me into another. Soon after I enter, one member asks what NonBinary is, and another starts bashing me for having it in my profile description. \n\nI would have been open to having a conversation, but it was just a flood of trash talk, from one of the admins. Basically saying that people like me made binary genders look bad. And so on. I basically responded that it was not my fault that they were spiteful, and that l hoped nobody treated them the same way. They said I wasn't part of the community, and I responded that I was glad, and left. \n\nI hope nobody dares to act that way in public, I don't think I could keep my cool."", 'subreddit': 'NonBinary', 'title': 'Wow, unexpected aggression', 'created': 1494218112.0}"
2017-05-08 00:50:29,69uye0,2,7,"Hi, I'm just looking for a little support, maybe some guidance. I was born a male and haven't really thought about my gender identity until a while ago. I have never related too much to the identity of man but also not too much to that of woman. I guess my thing is, I feel giving up the identity of man is not only a way of giving myself freedom to express myself better, but also a political tool. 
That said, I like both he and she pronouns for me, but feel I can't refer to myself as she, because I don't have the set of experiences of a woman. Maybe I just lack the courage to do it, even though I really want to. I'm having these thoughts that maybe I don't have enough femininity in me to justify it to myself, but then again I don't have that much masculinity neither. I would really appreciate it if someone could help me clarify all these conflicting emotions. I don't really have someone to talk to about this particular subject. ",NonBinary,Newbie here. I have some doubts. Come talk? :),1494229829.0,"{'created_utc': 1494204629, 'id': '69uye0', 'num_comments': 2, 'score': 7, 'selftext': ""Hi, I'm just looking for a little support, maybe some guidance. I was born a male and haven't really thought about my gender identity until a while ago. I have never related too much to the identity of man but also not too much to that of woman. I guess my thing is, I feel giving up the identity of man is not only a way of giving myself freedom to express myself better, but also a political tool. \nThat said, I like both he and she pronouns for me, but feel I can't refer to myself as she, because I don't have the set of experiences of a woman. Maybe I just lack the courage to do it, even though I really want to. I'm having these thoughts that maybe I don't have enough femininity in me to justify it to myself, but then again I don't have that much masculinity neither. I would really appreciate it if someone could help me clarify all these conflicting emotions. I don't really have someone to talk to about this particular subject. "", 'subreddit': 'NonBinary', 'title': 'Newbie here. I have some doubts. Come talk? :)', 'created': 1494229829.0}"
2017-05-08 07:44:36,69wpum,20,5,How is everyone doing?,NonBinary,Weekly Off-Topic post!,1494254676.0,"{'created_utc': 1494229476, 'id': '69wpum', 'num_comments': 20, 'score': 5, 'selftext': 'How is everyone doing?', 'subreddit': 'NonBinary', 'title': 'Weekly Off-Topic post!', 'created': 1494254676.0}"
2017-05-08 18:04:55,69zsge,0,0,[deleted],NonBinary,Trigger warning,1494291895.0,"{'created_utc': 1494266695, 'id': '69zsge', 'num_comments': 0, 'score': 0, 'selftext': '[deleted]', 'subreddit': 'NonBinary', 'title': 'Trigger warning', 'created': 1494291895.0}"
2017-05-09 16:37:42,6a6jst,8,3,"Hello, I'm a Communications Student from UFMG, in Brazil. Recently my professor asked us to conduct studies regarding non-binary gender, and I decided to focus my research on advertising and products in general. The idea is simple: gather as much information as I possibly can on how you feel/think and create advertisement, as well as new products, that can adequately represent you.

I'm really trying to make a product that actually portrays non-binary people and helps society question the gender-binary culture, so if you could answer any of these questions you'd be helping a lot with my research! 

Anyways, here are the questions:

1. How do you feel when someone talks to you using a pronoun that doesn't represent you (""he"", ""she"", etc.)? In what way you would like to be addressed?
2. What are the biggest difficulties you face day-to-day?
3. When were your first introduced to the non-binary community? What grabbed your attention and made you research more about?
4. In your opinion, do you think the LGBT movement helps the non-binary community?
5. What is your opinion on how advertisement represents the community? Would like to see non-binary advertisement more often?
6. How do you feel when purchasing objects advertised to specific genders, such as clothes and personal hygiene products? 

Feel free to answer them in whatever way you prefer, through the comment section or inbox. You can be as concise or as detail-oriented as you want to be. 

Thanks for the attention and have a great day!",NonBinary,"Hi, I'm making a study on non-binary representation in advertising, and I could use your help!",1494373062.0,"{'created_utc': 1494347862, 'id': '6a6jst', 'num_comments': 8, 'score': 3, 'selftext': 'Hello, I\'m a Communications Student from UFMG, in Brazil. Recently my professor asked us to conduct studies regarding non-binary gender, and I decided to focus my research on advertising and products in general. The idea is simple: gather as much information as I possibly can on how you feel/think and create advertisement, as well as new products, that can adequately represent you.\n\nI\'m really trying to make a product that actually portrays non-binary people and helps society question the gender-binary culture, so if you could answer any of these questions you\'d be helping a lot with my research! \n\nAnyways, here are the questions:\n\n1. How do you feel when someone talks to you using a pronoun that doesn\'t represent you (""he"", ""she"", etc.)? In what way you would like to be addressed?\n2. What are the biggest difficulties you face day-to-day?\n3. When were your first introduced to the non-binary community? What grabbed your attention and made you research more about?\n4. In your opinion, do you think the LGBT movement helps the non-binary community?\n5. What is your opinion on how advertisement represents the community? Would like to see non-binary advertisement more often?\n6. How do you feel when purchasing objects advertised to specific genders, such as clothes and personal hygiene products? \n\nFeel free to answer them in whatever way you prefer, through the comment section or inbox. You can be as concise or as detail-oriented as you want to be. \n\nThanks for the attention and have a great day!', 'subreddit': 'NonBinary', 'title': ""Hi, I'm making a study on non-binary representation in advertising, and I could use your help!"", 'created': 1494373062.0}"
2017-05-09 18:50:02,6a7fke,42,7,"I need some clarification. I asked my enby friend if we're enby, does that means we're not cis.

From my understanding, trans is an umbrella term, and nonbinary is also an umbrella term. Would nonbinary be included under the trans umbrella, or is it vice versa? Is there overlap?",NonBinary,Is nonbinary the same as trans?,1494381002.0,"{'created_utc': 1494355802, 'id': '6a7fke', 'num_comments': 42, 'score': 7, 'selftext': ""I need some clarification. I asked my enby friend if we're enby, does that means we're not cis.\n\nFrom my understanding, trans is an umbrella term, and nonbinary is also an umbrella term. Would nonbinary be included under the trans umbrella, or is it vice versa? Is there overlap?"", 'subreddit': 'NonBinary', 'title': 'Is nonbinary the same as trans?', 'created': 1494381002.0}"
2017-05-10 00:08:16,6a9ce6,9,16,help,NonBinary,What do you do when your dysphoria is so bad you don't want to shower even though you desperately need it,1494400096.0,"{'created_utc': 1494374896, 'id': '6a9ce6', 'num_comments': 9, 'score': 16, 'selftext': 'help', 'subreddit': 'NonBinary', 'title': ""What do you do when your dysphoria is so bad you don't want to shower even though you desperately need it"", 'created': 1494400096.0}"
