created_utc,id,num_comments,score,selftext,subreddit,title,created,d_
2017-02-04 12:18:39,5s099r,0,0,[removed],NonBinary,Look who’s here! Long time no see!,1486235919.0,"{'created_utc': 1486210719, 'id': '5s099r', 'num_comments': 0, 'score': 0, 'selftext': '[removed]', 'subreddit': 'NonBinary', 'title': 'Look who’s here! Long time no see!', 'created': 1486235919.0}"
2017-02-04 12:54:21,5s0e6a,14,16,"apologies in advance if this makes little sense/rambles.

I am an afab, visibly feminine person. I don't feel like 'female' fits who I feel I am. I prefer to think of myself as genderless, or just a person, rather than 'female' or 'male'. I've come across the term 'non binary' through research and this really feels like it fits how I feel and think about myself. However everything I've found suggests non binary and trans are the same thing, or are at least very closely related identities. I know I'm not trans, and I know I don't want to transition at all. the only thing I want to do is to start presenting more androgynously, but not inherently masculine (I kind of want to bind to achieve a smaller chest, and dress less feminine, but I don't want to be perceived as a man). I also like using the she/her pronouns and the female name I was given at birth, and think of myself as my partner's girlfriend, and don't want this to change, but I don't know if this makes wanting to look androgynous just a style/aesthetic thing.

can I be non binary without being trans? can I be valid as a non binary person if I'm comfortable using pronouns/name that align with the gender I was assigned at birth? is wanting to look androgynous a part of my gender identity or is it just a style thing?",NonBinary,non binary/trans? am I valid? help?,1486238061.0,"{'created_utc': 1486212861, 'id': '5s0e6a', 'num_comments': 14, 'score': 16, 'selftext': ""apologies in advance if this makes little sense/rambles.\n\nI am an afab, visibly feminine person. I don't feel like 'female' fits who I feel I am. I prefer to think of myself as genderless, or just a person, rather than 'female' or 'male'. I've come across the term 'non binary' through research and this really feels like it fits how I feel and think about myself. However everything I've found suggests non binary and trans are the same thing, or are at least very closely related identities. I know I'm not trans, and I know I don't want to transition at all. the only thing I want to do is to start presenting more androgynously, but not inherently masculine (I kind of want to bind to achieve a smaller chest, and dress less feminine, but I don't want to be perceived as a man). I also like using the she/her pronouns and the female name I was given at birth, and think of myself as my partner's girlfriend, and don't want this to change, but I don't know if this makes wanting to look androgynous just a style/aesthetic thing.\n\ncan I be non binary without being trans? can I be valid as a non binary person if I'm comfortable using pronouns/name that align with the gender I was assigned at birth? is wanting to look androgynous a part of my gender identity or is it just a style thing?"", 'subreddit': 'NonBinary', 'title': 'non binary/trans? am I valid? help?', 'created': 1486238061.0}"
2017-02-04 14:06:23,5s0q7l,0,1,[removed],NonBinary,Frankly speaking,1486242383.0,"{'created_utc': 1486217183, 'id': '5s0q7l', 'num_comments': 0, 'score': 1, 'selftext': '[removed]', 'subreddit': 'NonBinary', 'title': 'Frankly speaking', 'created': 1486242383.0}"
2017-02-04 17:48:43,5s1x5v,7,4,"I don't feel the need to change my she/her gender pronouns. Even when I am in my masculine mode, it feels wrong to switch to something else.

Is there anyone else here who doesn't feel right using anything but the one assigned at birth? How unusual is this? Is it because I spent my whole life (I'm nearly 50) denying my male side?
",NonBinary,Not changing my gender pronoun,1486255723.0,"{'created_utc': 1486230523, 'id': '5s1x5v', 'num_comments': 7, 'score': 4, 'selftext': ""I don't feel the need to change my she/her gender pronouns. Even when I am in my masculine mode, it feels wrong to switch to something else.\n\nIs there anyone else here who doesn't feel right using anything but the one assigned at birth? How unusual is this? Is it because I spent my whole life (I'm nearly 50) denying my male side?\n"", 'subreddit': 'NonBinary', 'title': 'Not changing my gender pronoun', 'created': 1486255723.0}"
2017-02-04 18:43:29,5s280o,10,0,"Uh I guess this isn't really a nonbinary thing but more of a genderqueer thing, but like, genderqueer can be used to mean ""queering gender"" (which I take to mean ""undermining gender""). What are some of the more well-known political gender identities, designed for the sake of saying ""no"" to gender?",NonBinary,Political genders?,1486259009.0,"{'created_utc': 1486233809, 'id': '5s280o', 'num_comments': 10, 'score': 0, 'selftext': 'Uh I guess this isn\'t really a nonbinary thing but more of a genderqueer thing, but like, genderqueer can be used to mean ""queering gender"" (which I take to mean ""undermining gender""). What are some of the more well-known political gender identities, designed for the sake of saying ""no"" to gender?', 'subreddit': 'NonBinary', 'title': 'Political genders?', 'created': 1486259009.0}"
2017-02-04 21:30:53,5s3aif,3,11,"So I'm looking to get top surgery soon and I've come across the most awesome new Nonbinary instagrammer who's had top surgery! (I can't quite tell for sure, but I don't think they're on T either)

They show their results on their Insta (@the_trashpanda) which look pretty damn good. Really great to see someone pre/no T (i think) who has had top surgery - great to see it's an option.

Just sharing for any other people like myself who are looking to go down the same route. Check them out! 

Also - if anyone knows any other cool NB Instagrammers let me know!  ",NonBinary,NB Top surgery,1486269053.0,"{'created_utc': 1486243853, 'id': '5s3aif', 'num_comments': 3, 'score': 11, 'selftext': ""So I'm looking to get top surgery soon and I've come across the most awesome new Nonbinary instagrammer who's had top surgery! (I can't quite tell for sure, but I don't think they're on T either)\n\nThey show their results on their Insta (@the_trashpanda) which look pretty damn good. Really great to see someone pre/no T (i think) who has had top surgery - great to see it's an option.\n\nJust sharing for any other people like myself who are looking to go down the same route. Check them out! \n\nAlso - if anyone knows any other cool NB Instagrammers let me know!  "", 'subreddit': 'NonBinary', 'title': 'NB Top surgery', 'created': 1486269053.0}"
2017-02-04 22:09:39,5s3kft,0,1,[removed],NonBinary,Can you be quiet for a moment?,1486271379.0,"{'created_utc': 1486246179, 'id': '5s3kft', 'num_comments': 0, 'score': 1, 'selftext': '[removed]', 'subreddit': 'NonBinary', 'title': 'Can you be quiet for a moment?', 'created': 1486271379.0}"
2017-02-04 23:51:32,5s4978,0,1,[removed],NonBinary,It is been a while!,1486277492.0,"{'created_utc': 1486252292, 'id': '5s4978', 'num_comments': 0, 'score': 1, 'selftext': '[removed]', 'subreddit': 'NonBinary', 'title': 'It is been a while!', 'created': 1486277492.0}"
2017-02-05 07:18:09,5s67q1,0,3,"Hey.

So I've been out as nonbinary (AFAB) for a couple of years now and I still feel so disgusted with myself in so many ways.  My body disgusts me because I hate seeing and feeling the aspects that make me look physically female. So a part of me feels desperate to transition, but people keep saying that I should just do what cis people are encouraged to do and try to accept my body as it is.  And maybe they're right.  I just don't know and it's driving me crazy.  Like, actually crazy.  I have bipolar disorder and every time I start thinking about this stuff I start wanting to kill myself more than usual :/ .  I don't want to grow old feeling like this.

Sometimes I feel like I'm faking it or that I'm not trans enough, but this identity is in my head now and I don't think I can go back to being/wanting to be perceived as a girl.  I wish I could, to be honest.

Also whenever I start a new class at school or meet someone or going to the doctor or anything like that I have to decide whether to use my chosen name or my given name, and it always seems like I'm asking for a favor if I say my chosen name.  Except for close friends I don't tell people what my pronouns are mostly because I'm ashamed/afraid of being  ""needy"" or attention-seeking.

I've avoided talking to the trans people I know irl about this stuff because it seems like I'm supposed to celebrate and accept my identity. But I can't. At all. Basically I wish I'd never figured out that I was anything other than a cis woman.  But there's no going back.

Sorry if this is incoherent or rambling, but does anyone have any advice or any kind of response? I feel like total shit and it would help to just get a response so I can stop feeling like I'm just talking into space or going around in circles in my head.",NonBinary,Dealing with shame/self-hatred/doubt,1486304289.0,"{'created_utc': 1486279089, 'id': '5s67q1', 'num_comments': 0, 'score': 3, 'selftext': 'Hey.\n\nSo I\'ve been out as nonbinary (AFAB) for a couple of years now and I still feel so disgusted with myself in so many ways.  My body disgusts me because I hate seeing and feeling the aspects that make me look physically female. So a part of me feels desperate to transition, but people keep saying that I should just do what cis people are encouraged to do and try to accept my body as it is.  And maybe they\'re right.  I just don\'t know and it\'s driving me crazy.  Like, actually crazy.  I have bipolar disorder and every time I start thinking about this stuff I start wanting to kill myself more than usual :/ .  I don\'t want to grow old feeling like this.\n\nSometimes I feel like I\'m faking it or that I\'m not trans enough, but this identity is in my head now and I don\'t think I can go back to being/wanting to be perceived as a girl.  I wish I could, to be honest.\n\nAlso whenever I start a new class at school or meet someone or going to the doctor or anything like that I have to decide whether to use my chosen name or my given name, and it always seems like I\'m asking for a favor if I say my chosen name.  Except for close friends I don\'t tell people what my pronouns are mostly because I\'m ashamed/afraid of being  ""needy"" or attention-seeking.\n\nI\'ve avoided talking to the trans people I know irl about this stuff because it seems like I\'m supposed to celebrate and accept my identity. But I can\'t. At all. Basically I wish I\'d never figured out that I was anything other than a cis woman.  But there\'s no going back.\n\nSorry if this is incoherent or rambling, but does anyone have any advice or any kind of response? I feel like total shit and it would help to just get a response so I can stop feeling like I\'m just talking into space or going around in circles in my head.', 'subreddit': 'NonBinary', 'title': 'Dealing with shame/self-hatred/doubt', 'created': 1486304289.0}"
2017-02-05 10:51:25,5s6tsm,0,1,[removed],NonBinary,It sееms to mе thаt,1486317085.0,"{'created_utc': 1486291885, 'id': '5s6tsm', 'num_comments': 0, 'score': 1, 'selftext': '[removed]', 'subreddit': 'NonBinary', 'title': 'It sееms to mе thаt', 'created': 1486317085.0}"
2017-02-05 17:06:04,5s8hj9,0,1,[removed],NonBinary,"I сould dо with somе hеlp, plеаsе.",1486339564.0,"{'created_utc': 1486314364, 'id': '5s8hj9', 'num_comments': 0, 'score': 1, 'selftext': '[removed]', 'subreddit': 'NonBinary', 'title': 'I сould dо with somе hеlp, plеаsе.', 'created': 1486339564.0}"
2017-02-05 21:11:13,5s9xk8,7,5,"I'm 24 years old. AMAB. My (pansexual) girlfriend tells me that I'm allowed to identify as whatever gender I want. But I'm a bit confused regarding the rules here as to what's considered a valid reason.

I've never felt consistently masculine or interested in maintaining masculinity. I don't look very masculine and I often dress somewhat feminine. (I don't wear dresses or skirts or anything but aside from that, I feel like ""feminine clothes"" is just society's label for clothes that fit well). My girlfriend says I'm the most feminine guy she's ever been with and I honestly don't mind. I'm told most guys would.

However I'm concerned that some of my reasons for wanting to identify as non-binary are not good ones. I don't feel like people understand me or accept me because I'm a man the way they would if I was something else. I don't want people judging me the way that I feel like they do because of being a man.

So I seem like a non-binary person but I also have a lot incentives for wanting to be non-binary that are not the ""real reasons"". 

My girlfriend said once, ""you shouldn't call yourself non-binary just because it will make people like you more."" 

My response was: ""what's the difference though. I can't tell why I would want to be a gender so why not just do whatever works?""

So how do I know if I'm non-binary?",NonBinary,"Another ""am I non-binary?"" thread.",1486354273.0,"{'created_utc': 1486329073, 'id': '5s9xk8', 'num_comments': 7, 'score': 5, 'selftext': 'I\'m 24 years old. AMAB. My (pansexual) girlfriend tells me that I\'m allowed to identify as whatever gender I want. But I\'m a bit confused regarding the rules here as to what\'s considered a valid reason.\n\nI\'ve never felt consistently masculine or interested in maintaining masculinity. I don\'t look very masculine and I often dress somewhat feminine. (I don\'t wear dresses or skirts or anything but aside from that, I feel like ""feminine clothes"" is just society\'s label for clothes that fit well). My girlfriend says I\'m the most feminine guy she\'s ever been with and I honestly don\'t mind. I\'m told most guys would.\n\nHowever I\'m concerned that some of my reasons for wanting to identify as non-binary are not good ones. I don\'t feel like people understand me or accept me because I\'m a man the way they would if I was something else. I don\'t want people judging me the way that I feel like they do because of being a man.\n\nSo I seem like a non-binary person but I also have a lot incentives for wanting to be non-binary that are not the ""real reasons"". \n\nMy girlfriend said once, ""you shouldn\'t call yourself non-binary just because it will make people like you more."" \n\nMy response was: ""what\'s the difference though. I can\'t tell why I would want to be a gender so why not just do whatever works?""\n\nSo how do I know if I\'m non-binary?', 'subreddit': 'NonBinary', 'title': 'Another ""am I non-binary?"" thread.', 'created': 1486354273.0}"
2017-02-05 22:24:08,5sacty,8,55,"At the CVS in baggy clothes (no binder) and short-as-hell hair, and an old man called me 'this young man' to a cashier. I'm so sick of being gendered female that I couldn't stop smiling and it honestly made my day, since I don't normally pass as male at all. Just wanted to share.",NonBinary,AFAB and gendered male today,1486358648.0,"{'created_utc': 1486333448, 'id': '5sacty', 'num_comments': 8, 'score': 55, 'selftext': ""At the CVS in baggy clothes (no binder) and short-as-hell hair, and an old man called me 'this young man' to a cashier. I'm so sick of being gendered female that I couldn't stop smiling and it honestly made my day, since I don't normally pass as male at all. Just wanted to share."", 'subreddit': 'NonBinary', 'title': 'AFAB and gendered male today', 'created': 1486358648.0}"
2017-02-05 23:18:00,5san20,0,1,[deleted],NonBinary,I've identified as nonbinary for a year (though I haven't shared it much); here is what I mean by it,1486361880.0,"{'created_utc': 1486336680, 'id': '5san20', 'num_comments': 0, 'score': 1, 'selftext': '[deleted]', 'subreddit': 'NonBinary', 'title': ""I've identified as nonbinary for a year (though I haven't shared it much); here is what I mean by it"", 'created': 1486361880.0}"
2017-02-06 09:45:09,5sdc75,0,8,"Hi! 

I’m a PhD student at the university of Helsinki and I am looking for native English, Finnish and Swedish speakers to participate in a survey on language use and attitudes. 


Participants need to be over 18 years old and a) native speakers of English (any variety) or b) native Finnish or Swedish speakers who speak English fluently. Filling in the survey will take approximately 15-30 minutes, depending on your own input. Responses will be handled anonymously.

Here is the[ link](http://languageuse.questionpro.com) to the survey.

All help is greatly appreciated! Comments and criticism are welcome too, but please do not reveal details about the survey in the comment section so that every potential participant can form their own opinion. Thanks!

This post has been approved by a moderator (u/Ebomb1)",NonBinary,Invitation to participate in a survey on language use and attitudes,1486399509.0,"{'created_utc': 1486374309, 'id': '5sdc75', 'num_comments': 0, 'score': 8, 'selftext': 'Hi! \n\nI’m a PhD student at the university of Helsinki and I am looking for native English, Finnish and Swedish speakers to participate in a survey on language use and attitudes. \n\n\nParticipants need to be over 18 years old and a) native speakers of English (any variety) or b) native Finnish or Swedish speakers who speak English fluently. Filling in the survey will take approximately 15-30 minutes, depending on your own input. Responses will be handled anonymously.\n\nHere is the[ link](http://languageuse.questionpro.com) to the survey.\n\nAll help is greatly appreciated! Comments and criticism are welcome too, but please do not reveal details about the survey in the comment section so that every potential participant can form their own opinion. Thanks!\n\nThis post has been approved by a moderator (u/Ebomb1)', 'subreddit': 'NonBinary', 'title': 'Invitation to participate in a survey on language use and attitudes', 'created': 1486399509.0}"
2017-02-06 10:20:49,5sdgrb,0,0,[removed],NonBinary,Niсе to sее уou again,1486401649.0,"{'created_utc': 1486376449, 'id': '5sdgrb', 'num_comments': 0, 'score': 0, 'selftext': '[removed]', 'subreddit': 'NonBinary', 'title': 'Niсе to sее уou again', 'created': 1486401649.0}"
2017-02-06 18:00:53,5sfr4n,0,21,,NonBinary,"[Survey] Fourth annual Nonbinary/Genderqueer Stats survey, investigating the language we use to describe and express ourselves and our genders. (Nonbinary/genderqueer/otherwise gender-binary-rejecting and -transcending people) [x-post from /r/SampleSize]",1486429253.0,"{'created_utc': 1486404053, 'id': '5sfr4n', 'num_comments': 0, 'score': 21, 'selftext': '', 'subreddit': 'NonBinary', 'title': '[Survey] Fourth annual Nonbinary/Genderqueer Stats survey, investigating the language we use to describe and express ourselves and our genders. (Nonbinary/genderqueer/otherwise gender-binary-rejecting and -transcending people) [x-post from /r/SampleSize]', 'created': 1486429253.0}"
2017-02-06 23:56:28,5shxwt,2,4,"Hello everyone, here is my story, I need some help figuring out what it all means.
I am an 18 year old male. I've always been comfortable being a male. I am by no means the stereotipical boy who likes playing football and cars but I still feel very comfortable being male. I have a wonderful girlfriend which I love very much and it feels natural to be the male partner of the couple. Yet I'd also love to be a female. Not a mix of the two thing but rather be able to switch between one and the other whenever I feel like it. I would like to be able to wear a dress and high heels like I like to wear a tie for example.
Very often when I was at home by myself (I don't live there anymore) I would go into my sister's room and dress up as a woman and it felt natural, just like it feels natural to be male. I would use socks to make the breasts, use a wig, put on a dress that would not show too much of my male body of course and high heels. Whenever I did that, I, for some reason I don't know, got an erection.
Also I spent hours watching videos of other boys transforming themselves into girls using makeup and other things.
Very often I would also dream about being a female in various occasions. I would also fantasize about it in my head.
What does this mean and what could help me? Is this just attraction to the female side like any heterosexual male is or what is it? I don't feel sexually attracted by other men, I'd just like to be able to be a girl or a boy, whatever I feel like.
Thanks",NonBinary,Confused about myself,1486450588.0,"{'created_utc': 1486425388, 'id': '5shxwt', 'num_comments': 2, 'score': 4, 'selftext': ""Hello everyone, here is my story, I need some help figuring out what it all means.\nI am an 18 year old male. I've always been comfortable being a male. I am by no means the stereotipical boy who likes playing football and cars but I still feel very comfortable being male. I have a wonderful girlfriend which I love very much and it feels natural to be the male partner of the couple. Yet I'd also love to be a female. Not a mix of the two thing but rather be able to switch between one and the other whenever I feel like it. I would like to be able to wear a dress and high heels like I like to wear a tie for example.\nVery often when I was at home by myself (I don't live there anymore) I would go into my sister's room and dress up as a woman and it felt natural, just like it feels natural to be male. I would use socks to make the breasts, use a wig, put on a dress that would not show too much of my male body of course and high heels. Whenever I did that, I, for some reason I don't know, got an erection.\nAlso I spent hours watching videos of other boys transforming themselves into girls using makeup and other things.\nVery often I would also dream about being a female in various occasions. I would also fantasize about it in my head.\nWhat does this mean and what could help me? Is this just attraction to the female side like any heterosexual male is or what is it? I don't feel sexually attracted by other men, I'd just like to be able to be a girl or a boy, whatever I feel like.\nThanks"", 'subreddit': 'NonBinary', 'title': 'Confused about myself', 'created': 1486450588.0}"
2017-02-07 02:35:38,5sisht,2,5,"Hey guys, I know there aren't a ton of resources out there for nonbinary folks so I'm going to start putting some more effort into my youtube channel. Check it out if you're interested and let me know what you might like to see. Thanks! 
https://youtu.be/YLFlhSvpgxg",NonBinary,Nonbinary YouTuber!,1486460138.0,"{'created_utc': 1486434938, 'id': '5sisht', 'num_comments': 2, 'score': 5, 'selftext': ""Hey guys, I know there aren't a ton of resources out there for nonbinary folks so I'm going to start putting some more effort into my youtube channel. Check it out if you're interested and let me know what you might like to see. Thanks! \nhttps://youtu.be/YLFlhSvpgxg"", 'subreddit': 'NonBinary', 'title': 'Nonbinary YouTuber!', 'created': 1486460138.0}"
2017-02-07 02:53:33,5sivrs,8,8,"For someone who gets an orchiectomy but wants to keep his or her penis, that is.",NonBinary,Is it possible to reshape a post-orchiectomy scrotum into something vagina-like?,1486461213.0,"{'created_utc': 1486436013, 'id': '5sivrs', 'num_comments': 8, 'score': 8, 'selftext': 'For someone who gets an orchiectomy but wants to keep his or her penis, that is.', 'subreddit': 'NonBinary', 'title': 'Is it possible to reshape a post-orchiectomy scrotum into something vagina-like?', 'created': 1486461213.0}"
2017-02-07 05:57:45,5sjq9f,17,70,,NonBinary,on being shameless,1486472265.0,"{'created_utc': 1486447065, 'id': '5sjq9f', 'num_comments': 17, 'score': 70, 'selftext': '', 'subreddit': 'NonBinary', 'title': 'on being shameless', 'created': 1486472265.0}"
