created_utc,id,num_comments,score,selftext,subreddit,title,created,d_
2017-02-01 04:46:59,5rdjiu,4,17,,NonBinary,I'm writing about my experience as a non-binary person who recently had top surgery. Check it out!,1485949619.0,"{'created_utc': 1485924419, 'id': '5rdjiu', 'num_comments': 4, 'score': 17, 'selftext': '', 'subreddit': 'NonBinary', 'title': ""I'm writing about my experience as a non-binary person who recently had top surgery. Check it out!"", 'created': 1485949619.0}"
2017-02-01 10:40:17,5respj,4,8,"Hi everyone! I think the title says as much as I need to, I'd like to look fully female or maybe like a more androgynous female, but sometimes I find it a little hard as an amab, I'd like some makeup advice and clothing tips if anyone would be so kind, also keep in mind I have pretty limiting parents so I can't go overboard with buying stuff, I can getaway with hiding some stuff, as long as it's not too much. Here are some recent piccies of myself: 

https://68.media.tumblr.com/3a82ee63cb08b02a587f0dc1df55402c/tumblr_okoyduIZp11vcyvfoo3_540.jpg

https://68.media.tumblr.com/24a6315e45ac08893560be56d958102d/tumblr_okoyduIZp11vcyvfoo1_1280.jpg

https://68.media.tumblr.com/ccdbf2565773b3433c378428a9b6b51d/tumblr_okoyduIZp11vcyvfoo2_1280.jpg
",NonBinary,I need some advice on looking more feminine/androgynous!,1485970817.0,"{'created_utc': 1485945617, 'id': '5respj', 'num_comments': 4, 'score': 8, 'selftext': ""Hi everyone! I think the title says as much as I need to, I'd like to look fully female or maybe like a more androgynous female, but sometimes I find it a little hard as an amab, I'd like some makeup advice and clothing tips if anyone would be so kind, also keep in mind I have pretty limiting parents so I can't go overboard with buying stuff, I can getaway with hiding some stuff, as long as it's not too much. Here are some recent piccies of myself: \n\nhttps://68.media.tumblr.com/3a82ee63cb08b02a587f0dc1df55402c/tumblr_okoyduIZp11vcyvfoo3_540.jpg\n\nhttps://68.media.tumblr.com/24a6315e45ac08893560be56d958102d/tumblr_okoyduIZp11vcyvfoo1_1280.jpg\n\nhttps://68.media.tumblr.com/ccdbf2565773b3433c378428a9b6b51d/tumblr_okoyduIZp11vcyvfoo2_1280.jpg\n"", 'subreddit': 'NonBinary', 'title': 'I need some advice on looking more feminine/androgynous!', 'created': 1485970817.0}"
2017-02-01 17:13:05,5rgpxg,3,38,,NonBinary,One of my favourite quotes about Gender I have ever read - also an excellent way of explaining it to Cis people.,1485994385.0,"{'created_utc': 1485969185, 'id': '5rgpxg', 'num_comments': 3, 'score': 38, 'selftext': '', 'subreddit': 'NonBinary', 'title': 'One of my favourite quotes about Gender I have ever read - also an excellent way of explaining it to Cis people.', 'created': 1485994385.0}"
2017-02-01 17:47:49,5rgxtw,1,2,"Hi folks! 

I'm currently writing this post as I feel that I am working through some things but would like some feedback on them. 

To give you some context, I have been questioning my gender (identity and expression) since September last year (2016). It first started with noticing how uncomfortable I was having a feminine gender expression. I forced myself to be somewhat high maintenance. This to me was wearing long weave, doing my nails, wearing makeup, dressing up etc.

Which was nice and sometimes I felt okay. But underneath it all, I had terrible self esteem. I was convinced I was huge in terms of size, felt really self conscious and didn't really see what people saw in me.  I was also diagnosed with body image distortions by a therapist (which I wonder at times if that was actually body dysphoria?).

So I realised how tired I was with how I presented, something was making me tired. I decided to make a decision to not conform to societal norms for women. Something I really advocate. But my questioning and conclusions didn't stop there. 

I dated someone recently, who was transgender. During that time I used to compare myself to them, was really curious about their transition. I watched and researched people who were transgender, thinking I was doing this to be a supportive cis friend. 

However, I subconsciously started to apply these ideas to myself. Would I live as male? Would I identify as male? Which my answer at the time was, ""well, yeah"". That night I concluded that I was a trans guy with little dysphoria. 

Since then, I have been having this constant internal conflict. There's not a day gone by that I don't think about my gender. Am I am a man or a woman. Am I comfortable being perceived as either or both? What kind of discomfort do I have gender wise, and in what ways etc. 

I have since presented more masculine, immediately my being self conscious has reduced somewhat. I now have a healthier relationship with my body, possibly because I contemplated taking testosterone (and still do sometimes). This forced me to contemplate my body a lot. 

I've been researching a lot of gender identities and think that non-binary transmasculine fits me. I feel that my gender identity is mostly neutral but also masculine. In that, I feel I identify as a person (agender) and a guy (male). I have thought about how my personality does not reflect my gender, neither does my gender expression. Despite behaving and dressing more masculine, it feels like something is still missing somehow. 

I constantly have doubts. Am I doing this for attention? Is my depression (which I am getting better with) causing me to want to reinvent myself somehow? Am I doing this to deal with the rejection of a break up for some crazy reason? 

I have these doubts even though I educated myself on the consequences of what this all means, how my life and relationships with people would change if I came out and if I am right about this. 

Any advice would be great, as you know, it is hard sometimes to work through something alone. ",NonBinary,"Working through my issues and thoughts regarding gender, in need of advice",1485996469.0,"{'created_utc': 1485971269, 'id': '5rgxtw', 'num_comments': 1, 'score': 2, 'selftext': 'Hi folks! \n\nI\'m currently writing this post as I feel that I am working through some things but would like some feedback on them. \n\nTo give you some context, I have been questioning my gender (identity and expression) since September last year (2016). It first started with noticing how uncomfortable I was having a feminine gender expression. I forced myself to be somewhat high maintenance. This to me was wearing long weave, doing my nails, wearing makeup, dressing up etc.\n\nWhich was nice and sometimes I felt okay. But underneath it all, I had terrible self esteem. I was convinced I was huge in terms of size, felt really self conscious and didn\'t really see what people saw in me.  I was also diagnosed with body image distortions by a therapist (which I wonder at times if that was actually body dysphoria?).\n\nSo I realised how tired I was with how I presented, something was making me tired. I decided to make a decision to not conform to societal norms for women. Something I really advocate. But my questioning and conclusions didn\'t stop there. \n\nI dated someone recently, who was transgender. During that time I used to compare myself to them, was really curious about their transition. I watched and researched people who were transgender, thinking I was doing this to be a supportive cis friend. \n\nHowever, I subconsciously started to apply these ideas to myself. Would I live as male? Would I identify as male? Which my answer at the time was, ""well, yeah"". That night I concluded that I was a trans guy with little dysphoria. \n\nSince then, I have been having this constant internal conflict. There\'s not a day gone by that I don\'t think about my gender. Am I am a man or a woman. Am I comfortable being perceived as either or both? What kind of discomfort do I have gender wise, and in what ways etc. \n\nI have since presented more masculine, immediately my being self conscious has reduced somewhat. I now have a healthier relationship with my body, possibly because I contemplated taking testosterone (and still do sometimes). This forced me to contemplate my body a lot. \n\nI\'ve been researching a lot of gender identities and think that non-binary transmasculine fits me. I feel that my gender identity is mostly neutral but also masculine. In that, I feel I identify as a person (agender) and a guy (male). I have thought about how my personality does not reflect my gender, neither does my gender expression. Despite behaving and dressing more masculine, it feels like something is still missing somehow. \n\nI constantly have doubts. Am I doing this for attention? Is my depression (which I am getting better with) causing me to want to reinvent myself somehow? Am I doing this to deal with the rejection of a break up for some crazy reason? \n\nI have these doubts even though I educated myself on the consequences of what this all means, how my life and relationships with people would change if I came out and if I am right about this. \n\nAny advice would be great, as you know, it is hard sometimes to work through something alone. ', 'subreddit': 'NonBinary', 'title': 'Working through my issues and thoughts regarding gender, in need of advice', 'created': 1485996469.0}"
2017-02-01 22:15:41,5rinoc,5,10,[deleted],NonBinary,Thinking I might be nonbinary.,1486012541.0,"{'created_utc': 1485987341, 'id': '5rinoc', 'num_comments': 5, 'score': 10, 'selftext': '[deleted]', 'subreddit': 'NonBinary', 'title': 'Thinking I might be nonbinary.', 'created': 1486012541.0}"
2017-02-02 03:51:33,5rkjvo,8,9,"Last night I had a dream that I came out to my parents and things went well. Now I'm awake and I feel like shit.

I love my parents, but I can't tell them about this. They've ranted to me about how ""nonbinaries"" don't exist, trans women are perverts, and goddamn it, dead name, shave your leg hair and start wearing less flannel (I'm AFAB btw).

I know it sounds like they're hot-headed, stubborn, and controlling - and they are. But they're also caring, funny, and empathetic, and the fact that I can't share this with them saddens me in such a fundamental way I can't even find the words for it. Even worse is that I'm living in fear - if they find out about this, I'm terrified that they'll be verbally abusive or even kick me out. (I'm a senior in high school, so that would pretty much destroy my future.)

Then I had that dream last night, where they found out on their own and were totally okay, and I'm just so sad. I hate hiding in my own home like this. I want so badly to be myself around the people I love, but I know that can't happen any time soon. ",NonBinary,"Dealing with parents, feeling like garbage (x-post from r/genderqueer)",1486032693.0,"{'created_utc': 1486007493, 'id': '5rkjvo', 'num_comments': 8, 'score': 9, 'selftext': 'Last night I had a dream that I came out to my parents and things went well. Now I\'m awake and I feel like shit.\n\nI love my parents, but I can\'t tell them about this. They\'ve ranted to me about how ""nonbinaries"" don\'t exist, trans women are perverts, and goddamn it, dead name, shave your leg hair and start wearing less flannel (I\'m AFAB btw).\n\nI know it sounds like they\'re hot-headed, stubborn, and controlling - and they are. But they\'re also caring, funny, and empathetic, and the fact that I can\'t share this with them saddens me in such a fundamental way I can\'t even find the words for it. Even worse is that I\'m living in fear - if they find out about this, I\'m terrified that they\'ll be verbally abusive or even kick me out. (I\'m a senior in high school, so that would pretty much destroy my future.)\n\nThen I had that dream last night, where they found out on their own and were totally okay, and I\'m just so sad. I hate hiding in my own home like this. I want so badly to be myself around the people I love, but I know that can\'t happen any time soon. ', 'subreddit': 'NonBinary', 'title': 'Dealing with parents, feeling like garbage (x-post from r/genderqueer)', 'created': 1486032693.0}"
2017-02-02 07:11:25,5rle9z,2,13,"Alrighty folks, so I was on a LGBTQ+ amino, and we were discussing how little there is in resources specifically for NB people. They suggested with my writing skill, I make a website to educate people about our identities, and fight discrimination! It's not much of anything yet, but I plan on making a few more posts tonight, and then going from there. I will probably post on saturdays, and hope that you will enjoy! www.nbeducate.wordpress.com",NonBinary,I made a website!,1486044685.0,"{'created_utc': 1486019485, 'id': '5rle9z', 'num_comments': 2, 'score': 13, 'selftext': ""Alrighty folks, so I was on a LGBTQ+ amino, and we were discussing how little there is in resources specifically for NB people. They suggested with my writing skill, I make a website to educate people about our identities, and fight discrimination! It's not much of anything yet, but I plan on making a few more posts tonight, and then going from there. I will probably post on saturdays, and hope that you will enjoy! www.nbeducate.wordpress.com"", 'subreddit': 'NonBinary', 'title': 'I made a website!', 'created': 1486044685.0}"
2017-02-02 14:53:09,5rn6fh,0,13,"Hey folks, the annual NBGQ survey needs funding help. See if you can pitch in. They conduct annual worldwide and UK surveys on the identities/pronouns/titles of NB people.

https://www.indiegogo.com/projects/the-nbgq-stats-survey-2017-lgbt#/

You can find the previous survey results here: http://nonbinarystats.tumblr.com/results",NonBinary,NBGQ annual survey 2017 fundraising,1486072389.0,"{'created_utc': 1486047189, 'id': '5rn6fh', 'num_comments': 0, 'score': 13, 'selftext': 'Hey folks, the annual NBGQ survey needs funding help. See if you can pitch in. They conduct annual worldwide and UK surveys on the identities/pronouns/titles of NB people.\n\nhttps://www.indiegogo.com/projects/the-nbgq-stats-survey-2017-lgbt#/\n\nYou can find the previous survey results here: http://nonbinarystats.tumblr.com/results', 'subreddit': 'NonBinary', 'title': 'NBGQ annual survey 2017 fundraising', 'created': 1486072389.0}"
2017-02-02 22:44:39,5rq2po,1,3,"It's been roughly 15 months, and I've jumped from 120 lb to 185 lb. I've gained two/three pants sizes, and a lot of fat in the face and stomach especially.

There's no difference in my calorie intake or exercise since starting, and according to information I've been given, weight/fat gain is very common and expected.

I've gained a very similar amount of weight between ages 12-14, near the end of my puberty years.

Although it's no life-threatening concern, I do want to know if this fat gain is here to stay, or if this is just another part of my second puberty, and it'll plateau eventually.
",NonBinary,"Those on T; If you gained body fat, did you eventually lose it?",1486100679.0,"{'created_utc': 1486075479, 'id': '5rq2po', 'num_comments': 1, 'score': 3, 'selftext': ""It's been roughly 15 months, and I've jumped from 120 lb to 185 lb. I've gained two/three pants sizes, and a lot of fat in the face and stomach especially.\n\nThere's no difference in my calorie intake or exercise since starting, and according to information I've been given, weight/fat gain is very common and expected.\n\nI've gained a very similar amount of weight between ages 12-14, near the end of my puberty years.\n\nAlthough it's no life-threatening concern, I do want to know if this fat gain is here to stay, or if this is just another part of my second puberty, and it'll plateau eventually.\n"", 'subreddit': 'NonBinary', 'title': 'Those on T; If you gained body fat, did you eventually lose it?', 'created': 1486100679.0}"
2017-02-03 00:08:10,5rqjzq,0,0,[removed],NonBinary,If I might аdd sоmеthing,1486105690.0,"{'created_utc': 1486080490, 'id': '5rqjzq', 'num_comments': 0, 'score': 0, 'selftext': '[removed]', 'subreddit': 'NonBinary', 'title': 'If I might аdd sоmеthing', 'created': 1486105690.0}"
2017-02-03 03:12:56,5rrj5f,25,6,Or is it just me? ,NonBinary,Any other cis heterosexual women who bind?,1486116776.0,"{'created_utc': 1486091576, 'id': '5rrj5f', 'num_comments': 25, 'score': 6, 'selftext': 'Or is it just me? ', 'subreddit': 'NonBinary', 'title': 'Any other cis heterosexual women who bind?', 'created': 1486116776.0}"
2017-02-03 10:32:14,5rt7bv,0,0,[removed],NonBinary,Gооd tо sее you again,1486143134.0,"{'created_utc': 1486117934, 'id': '5rt7bv', 'num_comments': 0, 'score': 0, 'selftext': '[removed]', 'subreddit': 'NonBinary', 'title': 'Gооd tо sее you again', 'created': 1486143134.0}"
2017-02-03 16:35:48,5rux3v,3,6,"16, afab, USA.
so for a while now I've been playing with the name Rowan. Not necessarily having people call me it, but calling myself by it, putting it bios, writing it at the top of papers, whatever. And it feels really natural! I'm perfectly comfortable with the name, and it has a meaning to me (I like names based in nature already, but Rowan reminds me of Roanoke—the Lost Colony— too, which is a mystery I'm in love with). I've really been thinking of myself solely as Rowan for almost a month now.
And thats not even to mention that my birth name is a bit too feminine for me (Abigail ugh), and even when people call me Abbi *all the time* it's still way too obvious it was derived from Abigail.
**But** I also don't want to *totally* lose my birth name. I have friends that I've known for five, ten years that have been calling me Abbi this whole time, and my family (minus my dad but he doesn't matter lololol) is really accepting and I'm still comfortable with *them* calling me Abbi.
Soooo? Should I change my name? Could I *add* it to my name? In terms of legalities, *could* I officially add it to my name, in conjunction with Abbi, if I choose to do so??? If I always think of myself as Rowan should I change it because it's who I *really* am??? I'm super confused ugh",NonBinary,a name I don't know what to do with,1486164948.0,"{'created_utc': 1486139748, 'id': '5rux3v', 'num_comments': 3, 'score': 6, 'selftext': ""16, afab, USA.\nso for a while now I've been playing with the name Rowan. Not necessarily having people call me it, but calling myself by it, putting it bios, writing it at the top of papers, whatever. And it feels really natural! I'm perfectly comfortable with the name, and it has a meaning to me (I like names based in nature already, but Rowan reminds me of Roanoke—the Lost Colony— too, which is a mystery I'm in love with). I've really been thinking of myself solely as Rowan for almost a month now.\nAnd thats not even to mention that my birth name is a bit too feminine for me (Abigail ugh), and even when people call me Abbi *all the time* it's still way too obvious it was derived from Abigail.\n**But** I also don't want to *totally* lose my birth name. I have friends that I've known for five, ten years that have been calling me Abbi this whole time, and my family (minus my dad but he doesn't matter lololol) is really accepting and I'm still comfortable with *them* calling me Abbi.\nSoooo? Should I change my name? Could I *add* it to my name? In terms of legalities, *could* I officially add it to my name, in conjunction with Abbi, if I choose to do so??? If I always think of myself as Rowan should I change it because it's who I *really* am??? I'm super confused ugh"", 'subreddit': 'NonBinary', 'title': ""a name I don't know what to do with"", 'created': 1486164948.0}"
2017-02-03 20:07:03,5rw7rh,7,11,"So I am AFAB, and 18 years old. Never really questioned my gender until I learned what nonbinary meant. Since then I've completely felt connected to it. I cut my hair and feel so much happier like this. I want to start going by they/them pronouns and also considering a more unisex name.

Right now, I'm playing with Quinn. I used it at Starbucks today (lame ikr) sounded still too girly. It's a name that I consider unisex but also just seems girly. I really like the name but now I don't know if I'm comfortable with it. Any ideas of what to do now? Should I keep playing with it or look for something else? Suggestions are welcome! I'd like something classic sounding but not too traditional. Nothing that will go out of style .",NonBinary,Trying out new names.,1486177623.0,"{'created_utc': 1486152423, 'id': '5rw7rh', 'num_comments': 7, 'score': 11, 'selftext': ""So I am AFAB, and 18 years old. Never really questioned my gender until I learned what nonbinary meant. Since then I've completely felt connected to it. I cut my hair and feel so much happier like this. I want to start going by they/them pronouns and also considering a more unisex name.\n\nRight now, I'm playing with Quinn. I used it at Starbucks today (lame ikr) sounded still too girly. It's a name that I consider unisex but also just seems girly. I really like the name but now I don't know if I'm comfortable with it. Any ideas of what to do now? Should I keep playing with it or look for something else? Suggestions are welcome! I'd like something classic sounding but not too traditional. Nothing that will go out of style ."", 'subreddit': 'NonBinary', 'title': 'Trying out new names.', 'created': 1486177623.0}"
2017-02-03 23:12:27,5rx9si,7,1,"Caelan Jade
Cailan Jade
Cailen Jade
Caelen Jade

Can you tell by name what gender this individual is? Is one spelling version more masculine/feminine than the others?",NonBinary,"I think I have my name, but working on the details",1486188747.0,"{'created_utc': 1486163547, 'id': '5rx9si', 'num_comments': 7, 'score': 1, 'selftext': 'Caelan Jade\nCailan Jade\nCailen Jade\nCaelen Jade\n\nCan you tell by name what gender this individual is? Is one spelling version more masculine/feminine than the others?', 'subreddit': 'NonBinary', 'title': 'I think I have my name, but working on the details', 'created': 1486188747.0}"
2017-02-04 04:45:41,5ryu49,4,5,"I've finally found a group where I can see/hear my pronouns being used for me and actually get to test them out now, and I've noticed something that feels odd about when it comes to me and they/them pronouns.

I've grown up with singular they, and I understand when it's being used for other people, and I have no problem using it for a singular person. But hearing it for myself, I always hear it in the plural? It takes me a moment to realize my friends are talking about me. Is that common when you use they/them for yourself?

When I do realize they're talking about me, it feels good since it's not my /wrong/ pronouns and it shows that my friends respect me. But is that what euphoria for pronouns feels like when you're nb, or is it just ""it's not completely wrong so I'll take it""? Should I give it some more time to try out or should I go ahead and ask my friends to try something else out for me?",NonBinary,Question for fellow nbs who use 'they' for self,1486208741.0,"{'created_utc': 1486183541, 'id': '5ryu49', 'num_comments': 4, 'score': 5, 'selftext': 'I\'ve finally found a group where I can see/hear my pronouns being used for me and actually get to test them out now, and I\'ve noticed something that feels odd about when it comes to me and they/them pronouns.\n\nI\'ve grown up with singular they, and I understand when it\'s being used for other people, and I have no problem using it for a singular person. But hearing it for myself, I always hear it in the plural? It takes me a moment to realize my friends are talking about me. Is that common when you use they/them for yourself?\n\nWhen I do realize they\'re talking about me, it feels good since it\'s not my /wrong/ pronouns and it shows that my friends respect me. But is that what euphoria for pronouns feels like when you\'re nb, or is it just ""it\'s not completely wrong so I\'ll take it""? Should I give it some more time to try out or should I go ahead and ask my friends to try something else out for me?', 'subreddit': 'NonBinary', 'title': ""Question for fellow nbs who use 'they' for self"", 'created': 1486208741.0}"
2017-02-04 11:55:14,5s062d,3,5,"This is my face: http://imgur.com/wUabfRv

It sounds a bit trivial between the other posts about dysphoria, names and identity here but I've been struggling with my hair for months now. I'm 21 years old nb AFAB but 95% see me as a young male and my hairstylist appointments accordingly fail on all fronts, since I'm unable to find any photos to show to them and can't afford anything near a professional. I'm searching for something asymmetrical, preferably a bit feminine but I'm very bad at managing/imagining anything to do with style and ""how is this stuff going to look on me?"" I thought maybe some of you have some recommendations on what *could* work?  I'm starting a new job in a few weeks and would love to start with my gender expression somewhere more androgynous than it is now. 
",NonBinary,Unstylish enby seeking hair advice.,1486234514.0,"{'created_utc': 1486209314, 'id': '5s062d', 'num_comments': 3, 'score': 5, 'selftext': 'This is my face: http://imgur.com/wUabfRv\n\nIt sounds a bit trivial between the other posts about dysphoria, names and identity here but I\'ve been struggling with my hair for months now. I\'m 21 years old nb AFAB but 95% see me as a young male and my hairstylist appointments accordingly fail on all fronts, since I\'m unable to find any photos to show to them and can\'t afford anything near a professional. I\'m searching for something asymmetrical, preferably a bit feminine but I\'m very bad at managing/imagining anything to do with style and ""how is this stuff going to look on me?"" I thought maybe some of you have some recommendations on what *could* work?  I\'m starting a new job in a few weeks and would love to start with my gender expression somewhere more androgynous than it is now. \n', 'subreddit': 'NonBinary', 'title': 'Unstylish enby seeking hair advice.', 'created': 1486234514.0}"
