created_utc,id,num_comments,score,selftext,subreddit,title,created,d_
2017-02-07 07:25:55,5sk2bg,7,4,"Soooo... Does anyone have experience coming out as trans at work? I am AFAB and identify as agender. I am pre-T/pre-top surgery also. I dress in men's clothing most of the time and have a very short haircut. I also go by a gender neutral name. Despite this I am super short and have a very feminine face. I never, ever, ever pass as anything other than female. I started a new job today as a server/bartender. I have not done this type a work in a while and forgot how gendered it can be. My dysphoria was really kicking my ass with every 'yes ma'am' and 'she'll be your server'... I did not tell the person that hired me i am trans...I am terrified to come out to an employer for fear of losing a job. Should I tell my employer I am trans and if so would it be better to say I am FTM vs nonbinary?...I am considering just sucking it up despite how painful this is for me as I need the money.
What do you think the best thing to do in this situation is?",NonBinary,Coming out at work? advice needed,1486477555.0,"{'created_utc': 1486452355, 'id': '5sk2bg', 'num_comments': 7, 'score': 4, 'selftext': ""Soooo... Does anyone have experience coming out as trans at work? I am AFAB and identify as agender. I am pre-T/pre-top surgery also. I dress in men's clothing most of the time and have a very short haircut. I also go by a gender neutral name. Despite this I am super short and have a very feminine face. I never, ever, ever pass as anything other than female. I started a new job today as a server/bartender. I have not done this type a work in a while and forgot how gendered it can be. My dysphoria was really kicking my ass with every 'yes ma'am' and 'she'll be your server'... I did not tell the person that hired me i am trans...I am terrified to come out to an employer for fear of losing a job. Should I tell my employer I am trans and if so would it be better to say I am FTM vs nonbinary?...I am considering just sucking it up despite how painful this is for me as I need the money.\nWhat do you think the best thing to do in this situation is?"", 'subreddit': 'NonBinary', 'title': 'Coming out at work? advice needed', 'created': 1486477555.0}"
2017-02-07 10:21:01,5skmvt,0,1,[removed],NonBinary,Whаt I mеаn is,1486488061.0,"{'created_utc': 1486462861, 'id': '5skmvt', 'num_comments': 0, 'score': 1, 'selftext': '[removed]', 'subreddit': 'NonBinary', 'title': 'Whаt I mеаn is', 'created': 1486488061.0}"
2017-02-07 22:18:31,5sol6k,1,6,,NonBinary,How many orchiectomy doctors perform inguinal orchiectomies?,1486531111.0,"{'created_utc': 1486505911, 'id': '5sol6k', 'num_comments': 1, 'score': 6, 'selftext': '', 'subreddit': 'NonBinary', 'title': 'How many orchiectomy doctors perform inguinal orchiectomies?', 'created': 1486531111.0}"
2017-02-08 09:40:16,5srqsh,8,4,"I'm a naturally overtly 'feminine' afab person ie I have wide exaggerated hips, plus sized boobs, bigger thighs etc. and I find that presenting masc is extremely difficult lol

Because of my large hips/smaller waist combo (""hourglass"") I find that high waisted pants and shorts are the only thing thats comfortable for me to wear. I should also mention that I'm a size 12/14 and 5'1 so I have have some excess fat especially near my hips/lower hip area and leg area 

Basically my problem is that I can't really find any type of pants that are comfortable for me that dont show off my curves? I hate any low rise or anything that will accentuate my muffin top but high waists are too femme for me :/ does anyone else have this problem and any tips for a middle ground? Also any tips for being masc when ur short as fuck lol!!! ",NonBinary,Tips on presenting masc??,1486572016.0,"{'created_utc': 1486546816, 'id': '5srqsh', 'num_comments': 8, 'score': 4, 'selftext': 'I\'m a naturally overtly \'feminine\' afab person ie I have wide exaggerated hips, plus sized boobs, bigger thighs etc. and I find that presenting masc is extremely difficult lol\n\nBecause of my large hips/smaller waist combo (""hourglass"") I find that high waisted pants and shorts are the only thing thats comfortable for me to wear. I should also mention that I\'m a size 12/14 and 5\'1 so I have have some excess fat especially near my hips/lower hip area and leg area \n\nBasically my problem is that I can\'t really find any type of pants that are comfortable for me that dont show off my curves? I hate any low rise or anything that will accentuate my muffin top but high waists are too femme for me :/ does anyone else have this problem and any tips for a middle ground? Also any tips for being masc when ur short as fuck lol!!! ', 'subreddit': 'NonBinary', 'title': 'Tips on presenting masc??', 'created': 1486572016.0}"
2017-02-08 10:27:21,5srxik,0,0,[removed],NonBinary,[Free] Dating_Sexy_Girls,1486574841.0,"{'created_utc': 1486549641, 'id': '5srxik', 'num_comments': 0, 'score': 0, 'selftext': '[removed]', 'subreddit': 'NonBinary', 'title': '[Free] Dating_Sexy_Girls', 'created': 1486574841.0}"
2017-02-08 11:37:19,5ss7uu,17,22,,NonBinary,"Starfriends! This very nonbinary-inclusive social network is approaching beta, and we've had an influx of new users in the past couple of days!",1486579039.0,"{'created_utc': 1486553839, 'id': '5ss7uu', 'num_comments': 17, 'score': 22, 'selftext': '', 'subreddit': 'NonBinary', 'title': ""Starfriends! This very nonbinary-inclusive social network is approaching beta, and we've had an influx of new users in the past couple of days!"", 'created': 1486579039.0}"
2017-02-08 19:40:03,5suyp2,11,5,"I desperately want to go on HRT (testosterone) to become more in touch with my masculine side, and because I need the clitoral growth for simple release meta, which I think about all the time. I can't stop thinking about it. But I still don't know if I can even get meta because 1) I'm fat, but have already lost a lot of weight with plans to lose much more, and 2) there is no guarantee of enough clitoral growth for meta, especially at my age (47).

I don't plan to transition all the way to male. I want to continue to appear primarily female, but be able to be physically male at the same time.

However, the idea of losing my female voice, growing body hair, and male pattern baldness are terrifying.

My hair and my voice are just about the only things I like about myself. I can deal with hair growth by getting rid of it - there are multiple ways. I can deal with hair loss by starting the hair protection regimen even before I start T. 

But losing my voice and having to retrain it the transwoman way is so abhorrent, its the only thing holding me back. It's my natural voice, I feel like it's humiliating to have to do the transwoman thing to get back what is rightfully mine. And even then it wouldn't be the same. I'd have to resort to voice surgery, and I can't imagine having the funds for the procedure.

Help! What do I do?",NonBinary,"Want HRT, but terrified of some effects",1486608003.0,"{'created_utc': 1486582803, 'id': '5suyp2', 'num_comments': 11, 'score': 5, 'selftext': ""I desperately want to go on HRT (testosterone) to become more in touch with my masculine side, and because I need the clitoral growth for simple release meta, which I think about all the time. I can't stop thinking about it. But I still don't know if I can even get meta because 1) I'm fat, but have already lost a lot of weight with plans to lose much more, and 2) there is no guarantee of enough clitoral growth for meta, especially at my age (47).\n\nI don't plan to transition all the way to male. I want to continue to appear primarily female, but be able to be physically male at the same time.\n\nHowever, the idea of losing my female voice, growing body hair, and male pattern baldness are terrifying.\n\nMy hair and my voice are just about the only things I like about myself. I can deal with hair growth by getting rid of it - there are multiple ways. I can deal with hair loss by starting the hair protection regimen even before I start T. \n\nBut losing my voice and having to retrain it the transwoman way is so abhorrent, its the only thing holding me back. It's my natural voice, I feel like it's humiliating to have to do the transwoman thing to get back what is rightfully mine. And even then it wouldn't be the same. I'd have to resort to voice surgery, and I can't imagine having the funds for the procedure.\n\nHelp! What do I do?"", 'subreddit': 'NonBinary', 'title': 'Want HRT, but terrified of some effects', 'created': 1486608003.0}"
2017-02-09 07:17:03,5syluh,12,15,"Hi there, so i'm a cisgender pansexual guy from Canada and I have a question regarding pronouns. I recently started talking to someone who is nonbinary and goes by he/his/they/them pronouns and I was wondering on how I should address them (although i expect this answer to vary somewhat)

When talking about them, is it considered rude to say him when their pronouns are him/them his/their?

I really don't know, just trying to make it so I don't fuck up talking to them.

An example of this would be like talking to a coworker and saying ""So i met this really nice guy, he's non-binary"" versus ""So I met this really nice person, they're non-binary"" when again, they want to go by he/his/them/their. 

Thanks for any help everyone! ",NonBinary,Question for nonbinary folk!,1486649823.0,"{'created_utc': 1486624623, 'id': '5syluh', 'num_comments': 12, 'score': 15, 'selftext': 'Hi there, so i\'m a cisgender pansexual guy from Canada and I have a question regarding pronouns. I recently started talking to someone who is nonbinary and goes by he/his/they/them pronouns and I was wondering on how I should address them (although i expect this answer to vary somewhat)\n\nWhen talking about them, is it considered rude to say him when their pronouns are him/them his/their?\n\nI really don\'t know, just trying to make it so I don\'t fuck up talking to them.\n\nAn example of this would be like talking to a coworker and saying ""So i met this really nice guy, he\'s non-binary"" versus ""So I met this really nice person, they\'re non-binary"" when again, they want to go by he/his/them/their. \n\nThanks for any help everyone! ', 'subreddit': 'NonBinary', 'title': 'Question for nonbinary folk!', 'created': 1486649823.0}"
2017-02-09 10:37:23,5szamk,0,0,[removed],NonBinary,[FREE] Free-Sex-Dаting-Website,1486661843.0,"{'created_utc': 1486636643, 'id': '5szamk', 'num_comments': 0, 'score': 0, 'selftext': '[removed]', 'subreddit': 'NonBinary', 'title': '[FREE] Free-Sex-Dаting-Website', 'created': 1486661843.0}"
2017-02-09 16:47:18,5t13p0,0,0,[removed],NonBinary,I’d say that I’d suggest that,1486684038.0,"{'created_utc': 1486658838, 'id': '5t13p0', 'num_comments': 0, 'score': 0, 'selftext': '[removed]', 'subreddit': 'NonBinary', 'title': 'I’d say that I’d suggest that', 'created': 1486684038.0}"
2017-02-09 19:11:17,5t23in,10,12,"So, without going into too much detail, I'm pretty sure I'm nonbinary. Sort of. I don't know?

The thing is, I'm hung up on transitioning. I'm AFAB and currently I'm transitioning. I know I want top surgery and T, my dysphoria is really bad. I'm pretty sure I'm going to want bottom surgery too sometime in the future.

Can I be nonbinary and still want a male body? Am I just a GNC guy? I don't really feel like a guy, I feel like something else. I look down at my shoes and I feel like they don't belong to a guy or a girl, they belong to something else I can't put my finger on. Based on that I think I'm nb but can I have dysphoria and still be nb?",NonBinary,Question about medical stuff and my identity.,1486692677.0,"{'created_utc': 1486667477, 'id': '5t23in', 'num_comments': 10, 'score': 12, 'selftext': ""So, without going into too much detail, I'm pretty sure I'm nonbinary. Sort of. I don't know?\n\nThe thing is, I'm hung up on transitioning. I'm AFAB and currently I'm transitioning. I know I want top surgery and T, my dysphoria is really bad. I'm pretty sure I'm going to want bottom surgery too sometime in the future.\n\nCan I be nonbinary and still want a male body? Am I just a GNC guy? I don't really feel like a guy, I feel like something else. I look down at my shoes and I feel like they don't belong to a guy or a girl, they belong to something else I can't put my finger on. Based on that I think I'm nb but can I have dysphoria and still be nb?"", 'subreddit': 'NonBinary', 'title': 'Question about medical stuff and my identity.', 'created': 1486692677.0}"
2017-02-10 10:07:30,5t6h02,0,0,[removed],NonBinary,Nice to see you again,1486746450.0,"{'created_utc': 1486721250, 'id': '5t6h02', 'num_comments': 0, 'score': 0, 'selftext': '[removed]', 'subreddit': 'NonBinary', 'title': 'Nice to see you again', 'created': 1486746450.0}"
2017-02-10 21:04:51,5t9x4h,8,0,"I am cis male, kinda chubby and hairy and completely gay, into other chubbier/bara looking men.

I dont really like femininity, the thing though is that i find my dick useless and sometimes dont like it at all and often wish i much rather have a vagina, or at least a vagina like thing between my legs instead of it. There have been many names for this, overly sexual like cuntmen, silly ones like vagentleman or reverse shemale etc in popular art.

There were times where i was thinking i could be transgender but i really cant say i like the female body or want to be anything like it outside the genitals. I like my male looking hairy chubby body and dont really want to change anything outside that small part. And i cant even deny it logically since i am a complete bottom sexually so i dislike even more the fact that i got a dick down there. I was thinking i could be intersex but my understanding is that you are born intersex, cant become intersex.

And this isnt just some random fetish after seeing some art, i have had these thoughts for at least 4-5 years now and have started thinking of going to thailand where regulations are more lax so with enough money and a doctor with quality results i could go through that genital change surgery.

This isnt what normal cis men do so i think it is quite a serious and not a mere fetish.
",NonBinary,What would my gender be? intersex?,1486785891.0,"{'created_utc': 1486760691, 'id': '5t9x4h', 'num_comments': 8, 'score': 0, 'selftext': 'I am cis male, kinda chubby and hairy and completely gay, into other chubbier/bara looking men.\n\nI dont really like femininity, the thing though is that i find my dick useless and sometimes dont like it at all and often wish i much rather have a vagina, or at least a vagina like thing between my legs instead of it. There have been many names for this, overly sexual like cuntmen, silly ones like vagentleman or reverse shemale etc in popular art.\n\nThere were times where i was thinking i could be transgender but i really cant say i like the female body or want to be anything like it outside the genitals. I like my male looking hairy chubby body and dont really want to change anything outside that small part. And i cant even deny it logically since i am a complete bottom sexually so i dislike even more the fact that i got a dick down there. I was thinking i could be intersex but my understanding is that you are born intersex, cant become intersex.\n\nAnd this isnt just some random fetish after seeing some art, i have had these thoughts for at least 4-5 years now and have started thinking of going to thailand where regulations are more lax so with enough money and a doctor with quality results i could go through that genital change surgery.\n\nThis isnt what normal cis men do so i think it is quite a serious and not a mere fetish.\n', 'subreddit': 'NonBinary', 'title': 'What would my gender be? intersex?', 'created': 1486785891.0}"
2017-02-10 21:32:15,5ta2wk,0,0,[deleted],NonBinary,I just realized I'm very androgynous and I don't want to be.,1486787535.0,"{'created_utc': 1486762335, 'id': '5ta2wk', 'num_comments': 0, 'score': 0, 'selftext': '[deleted]', 'subreddit': 'NonBinary', 'title': ""I just realized I'm very androgynous and I don't want to be."", 'created': 1486787535.0}"
2017-02-11 00:27:23,5tb2jm,0,1,[removed],NonBinary,I wonder if you could help me with this?,1486798043.0,"{'created_utc': 1486772843, 'id': '5tb2jm', 'num_comments': 0, 'score': 1, 'selftext': '[removed]', 'subreddit': 'NonBinary', 'title': 'I wonder if you could help me with this?', 'created': 1486798043.0}"
2017-02-11 08:54:25,5td1zk,0,0,,NonBinary,Nice Sexy selfie,1486828465.0,"{'created_utc': 1486803265, 'id': '5td1zk', 'num_comments': 0, 'score': 0, 'selftext': '', 'subreddit': 'NonBinary', 'title': 'Nice Sexy selfie', 'created': 1486828465.0}"
2017-02-11 09:27:06,5td69c,19,7,"Hi everyone! (AMAB)
I have a mess of questions and things that I would like advice on.
Firstly,
Getting rid of body hair.
In a few days I will have enough money to purchase an Epilator, (I can handle the pain) and I was wondering if there were any tips from people who have used them before.

Head hair.
I've been growing my hair out slowly for the first time ever and it feels great.
But in planning for the times when it is longer, would it be possible to wear a hairstyle with two (I don't know the word, bangs?) on either side of my face, bound with a little ribbon, (like asada shino, from SAO if anyone knows it)
Would this look incredibly stupid? Or is it possible to look okay with something like it?",NonBinary,Hair. Both bodily and head.,1486830426.0,"{'created_utc': 1486805226, 'id': '5td69c', 'num_comments': 19, 'score': 7, 'selftext': ""Hi everyone! (AMAB)\nI have a mess of questions and things that I would like advice on.\nFirstly,\nGetting rid of body hair.\nIn a few days I will have enough money to purchase an Epilator, (I can handle the pain) and I was wondering if there were any tips from people who have used them before.\n\nHead hair.\nI've been growing my hair out slowly for the first time ever and it feels great.\nBut in planning for the times when it is longer, would it be possible to wear a hairstyle with two (I don't know the word, bangs?) on either side of my face, bound with a little ribbon, (like asada shino, from SAO if anyone knows it)\nWould this look incredibly stupid? Or is it possible to look okay with something like it?"", 'subreddit': 'NonBinary', 'title': 'Hair. Both bodily and head.', 'created': 1486830426.0}"
2017-02-12 21:04:14,5to77c,4,5,"Most of the suggested haircuts I've seen suggested are very definitely for youthful types - not for middle-age types. I'm nearing my 50th birthday, though I'm told I look more 35 or so. Thank you genetics. I'm trying to figure out what will work for me.

My hair is currently dark brown, long, thin, fine, and mostly straight with a slight wave. For styling, nothing will hold except straightening. Basically it falls where it wants.

I have a very round face with unfortunate jowls, so pixie cuts emphasizes the round and fat and jowls. I've done it before. It wasn't a good look. Ugh. 

Second option, how can I keep my hair long but make it look masculine? The hat and sweeping the hair across the forehead would look ridiculous on me. Yet another youth look.

My fashion choices tend to be more dressy - office wear to dressy casual.  only time I wear anything relaxed I'm probably working in the garden. I need a hairstyle that would fit if I were to meet with a publisher in New York, a governor, or a county sheriff, or simply out on the town for dinner with hubby.",NonBinary,Suggestions needed: unisex hairstyle for an old fart?,1486958654.0,"{'created_utc': 1486933454, 'id': '5to77c', 'num_comments': 4, 'score': 5, 'selftext': ""Most of the suggested haircuts I've seen suggested are very definitely for youthful types - not for middle-age types. I'm nearing my 50th birthday, though I'm told I look more 35 or so. Thank you genetics. I'm trying to figure out what will work for me.\n\nMy hair is currently dark brown, long, thin, fine, and mostly straight with a slight wave. For styling, nothing will hold except straightening. Basically it falls where it wants.\n\nI have a very round face with unfortunate jowls, so pixie cuts emphasizes the round and fat and jowls. I've done it before. It wasn't a good look. Ugh. \n\nSecond option, how can I keep my hair long but make it look masculine? The hat and sweeping the hair across the forehead would look ridiculous on me. Yet another youth look.\n\nMy fashion choices tend to be more dressy - office wear to dressy casual.  only time I wear anything relaxed I'm probably working in the garden. I need a hairstyle that would fit if I were to meet with a publisher in New York, a governor, or a county sheriff, or simply out on the town for dinner with hubby."", 'subreddit': 'NonBinary', 'title': 'Suggestions needed: unisex hairstyle for an old fart?', 'created': 1486958654.0}"
2017-02-13 00:18:27,5tpm3v,28,14,"This is a 30-day challenge to ""get to know yourself."" It has 30 questions, and you answer one a day. I'll post one question per day.

Today's question: 1) Do you use any other terms to define or explain your gender?

To see all the questions, go to: http://genderqueerid.com/post/19662297051/30-day-genderqueer-challenge",NonBinary,"Non-binary ""get to know yourself"" challenge: Question 1",1486970307.0,"{'created_utc': 1486945107, 'id': '5tpm3v', 'num_comments': 28, 'score': 14, 'selftext': 'This is a 30-day challenge to ""get to know yourself."" It has 30 questions, and you answer one a day. I\'ll post one question per day.\n\nToday\'s question: 1) Do you use any other terms to define or explain your gender?\n\nTo see all the questions, go to: http://genderqueerid.com/post/19662297051/30-day-genderqueer-challenge', 'subreddit': 'NonBinary', 'title': 'Non-binary ""get to know yourself"" challenge: Question 1', 'created': 1486970307.0}"
2017-02-13 11:02:26,5tsadb,10,6,,NonBinary,[Survey] Nonbinary/genderqueer parents - what do your children call you?,1487008946.0,"{'created_utc': 1486983746, 'id': '5tsadb', 'num_comments': 10, 'score': 6, 'selftext': '', 'subreddit': 'NonBinary', 'title': '[Survey] Nonbinary/genderqueer parents - what do your children call you?', 'created': 1487008946.0}"
2017-02-13 14:40:08,5tt6m3,9,14,,NonBinary,An account of top surgery by a non-binary person. Thoughts?,1487022008.0,"{'created_utc': 1486996808, 'id': '5tt6m3', 'num_comments': 9, 'score': 14, 'selftext': '', 'subreddit': 'NonBinary', 'title': 'An account of top surgery by a non-binary person. Thoughts?', 'created': 1487022008.0}"
2017-02-13 22:01:20,5tvwe1,12,11,"This is a 30-day challenge to ""get to know yourself."" It has 30 questions, and you answer one a day.

Today's question: 2) How did you grow up with your gender?

To see all the questions, go to: http://genderqueerid.com/post/19662297051/30-day-genderqueer-challenge",NonBinary,"Non-binary ""get to know yourself"" challenge: Question 2",1487048480.0,"{'created_utc': 1487023280, 'id': '5tvwe1', 'num_comments': 12, 'score': 11, 'selftext': 'This is a 30-day challenge to ""get to know yourself."" It has 30 questions, and you answer one a day.\n\nToday\'s question: 2) How did you grow up with your gender?\n\nTo see all the questions, go to: http://genderqueerid.com/post/19662297051/30-day-genderqueer-challenge', 'subreddit': 'NonBinary', 'title': 'Non-binary ""get to know yourself"" challenge: Question 2', 'created': 1487048480.0}"
2017-02-14 04:29:40,5ty2hi,5,29,"From a press release...

 National Geographic has announced it will make the two-hour documentary GENDER REVOLUTION: A JOURNEY WITH KATIE COURIC available to stream for free, beginning Tuesday, Feb. 14, for one week. The stream will be available on National Geographic’s website, YouTube channel, Facebook page, Apple TV app and TV Everywhere mobile apps. 
.....
The documentary is also currently airing on National Geographic around the globe in 171 countries and in 45 languages.",NonBinary,Gender Revolution documentary available for free for one week starting 2/14/17!!!,1487071780.0,"{'created_utc': 1487046580, 'id': '5ty2hi', 'num_comments': 5, 'score': 29, 'selftext': 'From a press release...\n\n National Geographic has announced it will make the two-hour documentary GENDER REVOLUTION: A JOURNEY WITH KATIE COURIC available to stream for free, beginning Tuesday, Feb. 14, for one week. The stream will be available on National Geographic’s website, YouTube channel, Facebook page, Apple TV app and TV Everywhere mobile apps. \n.....\nThe documentary is also currently airing on National Geographic around the globe in 171 countries and in 45 languages.', 'subreddit': 'NonBinary', 'title': 'Gender Revolution documentary available for free for one week starting 2/14/17!!!', 'created': 1487071780.0}"
2017-02-14 19:13:51,5u2aig,12,3,"This is a 30-day challenge to ""get to know yourself."" It has 30 questions, and you answer one a day.

Today's question: Day 3) What’s your favorite ways of upsetting gender roles / genderbending / genderfucking?

To see all the questions, go to: http://genderqueerid.com/post/19662297051/30-day-genderqueer-challenge
",NonBinary,"Non-binary ""get to know yourself"" challenge: Question 3",1487124831.0,"{'created_utc': 1487099631, 'id': '5u2aig', 'num_comments': 12, 'score': 3, 'selftext': 'This is a 30-day challenge to ""get to know yourself."" It has 30 questions, and you answer one a day.\n\nToday\'s question: Day 3) What’s your favorite ways of upsetting gender roles / genderbending / genderfucking?\n\nTo see all the questions, go to: http://genderqueerid.com/post/19662297051/30-day-genderqueer-challenge\n', 'subreddit': 'NonBinary', 'title': 'Non-binary ""get to know yourself"" challenge: Question 3', 'created': 1487124831.0}"
2017-02-14 19:15:24,5u2azw,0,1,,NonBinary,Gabriella22,1487124924.0,"{'created_utc': 1487099724, 'id': '5u2azw', 'num_comments': 0, 'score': 1, 'selftext': '', 'subreddit': 'NonBinary', 'title': 'Gabriella22', 'created': 1487124924.0}"
