created_utc,id,num_comments,score,selftext,subreddit,title,created,d_
2017-02-23 03:08:22,5vnpqs,8,16,"Today I requested that all of my coworkers use correct pronouns for me -- they/them. I sent out a polite, short, and informative email. After having my pronouns in my email signature, wearing a pronoun button, and having one-on-one conversations with some key people, I noticed that nobody seemed to budge, and I had to take it to another level if I really wanted this to happen. I talked to my HR person and she backed me 100%.

I really didn't want to ~come out~ over an email after using subtle forms of noting my pronouns, but the more I lived as a full person in my nonwork life, the more it killed me to live as a half-self in my work life, especially when I love my job. I want this because when people talk around me using incorrect pronouns makes me shrivel. It stops me from being productive. It hinders me from doing the job that I want to keep for a long time.

I also want to stand up in my organization and be an agent of change. I want to pave the way for other nonbinary, genderqueer, and trans people to come forward and be treated with respect. 

I feel *incredibly* fortunate to be able to do this -- to feel safe doing asking my coworkers to use gender-neutral pronouns -- and to know that I have allies in my organization's leadership, including in my manager, that can and will help me through this likely long period of transition. I feel scared to ask for what I need -- when I often feel like it's ""too much"" or ""too weird"" or ""too needy."" My coworker reminded me that it's the most basic request, to ask to be treated with respect, and that I deserve to do this. And because I work in a state and an organization that have protections for trans people, I have the *right*. Guh. This has been a long time coming.",NonBinary,Onward! Requesting correct pronouns at work,1487844502.0,"{'created_utc': 1487819302, 'id': '5vnpqs', 'num_comments': 8, 'score': 16, 'selftext': 'Today I requested that all of my coworkers use correct pronouns for me -- they/them. I sent out a polite, short, and informative email. After having my pronouns in my email signature, wearing a pronoun button, and having one-on-one conversations with some key people, I noticed that nobody seemed to budge, and I had to take it to another level if I really wanted this to happen. I talked to my HR person and she backed me 100%.\n\nI really didn\'t want to ~come out~ over an email after using subtle forms of noting my pronouns, but the more I lived as a full person in my nonwork life, the more it killed me to live as a half-self in my work life, especially when I love my job. I want this because when people talk around me using incorrect pronouns makes me shrivel. It stops me from being productive. It hinders me from doing the job that I want to keep for a long time.\n\nI also want to stand up in my organization and be an agent of change. I want to pave the way for other nonbinary, genderqueer, and trans people to come forward and be treated with respect. \n\nI feel *incredibly* fortunate to be able to do this -- to feel safe doing asking my coworkers to use gender-neutral pronouns -- and to know that I have allies in my organization\'s leadership, including in my manager, that can and will help me through this likely long period of transition. I feel scared to ask for what I need -- when I often feel like it\'s ""too much"" or ""too weird"" or ""too needy."" My coworker reminded me that it\'s the most basic request, to ask to be treated with respect, and that I deserve to do this. And because I work in a state and an organization that have protections for trans people, I have the *right*. Guh. This has been a long time coming.', 'subreddit': 'NonBinary', 'title': 'Onward! Requesting correct pronouns at work', 'created': 1487844502.0}"
2017-02-23 04:00:00,5vo1h6,0,4,"HRT First Appointment in 18 days, 13 hours, and 1 minute!  I won't be getting the prescription yet, but I have it noted that I want informed consent, so it should go quickly.  I had a quick high on life after I made the appointment today.  I'm so excited, I downloaded a countdown app on my phone *specifically* for this!

&amp;nbsp;

I would like to thank a few people:  My parents, for being so supportive.  My friends, for allowing me to experiment with their help.  My club, for allowing me to become a part of the community.  Reddit, for answering so many of my questions and putting up with my bullshit.  \^u\^  And a BIG thank you to MS Excel 2016 for allowing me to do these needlessly precise calculations in a more-complicated-than-necessary way.

&amp;nbsp;

*Edit: There are not 60 hours in a day*",NonBinary,Set a Countdown!,1487847600.0,"{'created_utc': 1487822400, 'id': '5vo1h6', 'num_comments': 0, 'score': 4, 'selftext': ""HRT First Appointment in 18 days, 13 hours, and 1 minute!  I won't be getting the prescription yet, but I have it noted that I want informed consent, so it should go quickly.  I had a quick high on life after I made the appointment today.  I'm so excited, I downloaded a countdown app on my phone *specifically* for this!\n\n&amp;nbsp;\n\nI would like to thank a few people:  My parents, for being so supportive.  My friends, for allowing me to experiment with their help.  My club, for allowing me to become a part of the community.  Reddit, for answering so many of my questions and putting up with my bullshit.  \\^u\\^  And a BIG thank you to MS Excel 2016 for allowing me to do these needlessly precise calculations in a more-complicated-than-necessary way.\n\n&amp;nbsp;\n\n*Edit: There are not 60 hours in a day*"", 'subreddit': 'NonBinary', 'title': 'Set a Countdown!', 'created': 1487847600.0}"
2017-02-23 17:24:12,5vrp4q,6,19,"Oh man and its a career-starting job, too! I just filled out my forms for HR and had to pause at the gender selection: ""male or female."" There was no third option. 

I uh. I ticked both boxes. 

For my first week or so I'm sticking to a gender-conforming dress code but pretty soon I should be able to start playing with my appearance a bit more. My workplace seems to be pretty lgbt~ positive, and I'm pretty sure the person in the office across from mine is trans so that's cool (she's also a riot). 

So just... Yeah. Pretty positive overall.",NonBinary,Nonbinary at a new job,1487895852.0,"{'created_utc': 1487870652, 'id': '5vrp4q', 'num_comments': 6, 'score': 19, 'selftext': 'Oh man and its a career-starting job, too! I just filled out my forms for HR and had to pause at the gender selection: ""male or female."" There was no third option. \n\nI uh. I ticked both boxes. \n\nFor my first week or so I\'m sticking to a gender-conforming dress code but pretty soon I should be able to start playing with my appearance a bit more. My workplace seems to be pretty lgbt~ positive, and I\'m pretty sure the person in the office across from mine is trans so that\'s cool (she\'s also a riot). \n\nSo just... Yeah. Pretty positive overall.', 'subreddit': 'NonBinary', 'title': 'Nonbinary at a new job', 'created': 1487895852.0}"
2017-02-24 00:37:55,5vuc3f,3,3,"Warning: if you don't want a probably depressing post with descriptions of anatomy, this post isn't for you. I think I mostly just need to ramble, but if anyone wants to share similar experiences or offer opinions that would be great!

Basically, I've had dysphoria since I hit puberty. But even before that, I was weird about gender. Reading trans stories, I never felt trans, but I wished I was because that would give me a reason to want to get rid of my boobs. I've never liked them, and for the last couple of years I've also wanted HRT. I actually learned of puberty blockers when I was like 15, but I never really asked my mum about them?? I was so depressed already, I think I just thought ""oh, she'd never agree"" then went back to my 24-7 brain fog (not to mention I was already pretty ""developed"" and felt it was too late).

Now I'm 19, and I live with my mum, who makes unintentionally hurtful comments but would never kick me out. I live in Australia, where transition is affordable for me. There's a good-sounding clinic that could be closer, but is reachable. But I'm just too scared to make an appointment? I wish I could just go there once, get a HRT prescription and be done with it. But it requires a GP referral, then several therapist appointments, then blood-work. The sooner I get it started, right? But to get it started I need to call the place, which terrifies me. I keep trying to tell myself it's my subconscious telling me not to transition, but I know it's not true. I'm autistic, I have severe social anxiety, I've had no friends since I was 12. It's the idea of calling.

But I feel like calling would be a mistake? There's all these tiny reasons that add up. Just when I reached 18, I finally liked wearing dresses and stuff (I'm afab). But I'd be too scared to wear them if I looked like a guy. I'm already hairy as fuck and don't want to be hairier, or bald (but I like all the other effects of HRT). I'll spend hours looking at binders online, then chicken out (""I've never bought anything online, and they take so long to ship anyway it's not worth it""). And since 18, I've hated my boobs slightly less. I think I may be genderfluid? Although I only feel like my assigned sex like once every few months, for half a day at best. Mostly I feel neither male or female. I think I'd be okay to pass as a guy, but paradoxically I don't want to bind, even though I want my boobs gone. As my mum's said, I'm a ""pretty girl"" but I'd be a short, ugly guy... which I wouldn't mind if I'm really trans, but what if I'm wrong?

Being trans is also embarrassing! I had the whole ""maybe I'm a trans boy"" convo with her when I was 15, she now knows I'm nonbinary, but I really can't discuss it with her because of the disgusted way she speaks of it. She thinks she's supportive, but her most supportive advice has been ""try dressing as a girl for a year, since you've never really tried being a girl, then try being a boy for a year!"". She's always there for me, but she is the opposite of what I need for trans matters. The idea of trying to talk to any family, or even a stranger who's a doctor is so embarrassing.

I constantly feel like I'm running out of time. I feel the days go by without me while I browse the internet mindlessly, ignoring my problems. I've always ignored problems rather than solved them. I leave work to the last minute. I take literal hours to get out of bed, even after I've woken up. I wish I had gone on HRT younger (all my immediate afab family are tall and big nosed! Not me!) I used to write stories all the time. Now I have heaps of stories in my head of nonbinary characters that struggle with acceptance but realize they're trans. My brain trying to tell me something? Or my brain trying to fill the friendless, empty-of-personality gap? Have I taught myself to be nonbinary, or am I living vicariously through my characters?

I'm autistic. My mum says I'm young for my age. When I was younger, I said repeatedly I didn't want to grow up - a fear of adulthood, or womanhood, or both??? I spent a year at uni, hoping I would feel like an adult and gain the self-knowledge to know if I truly am nonbinary. I joined clubs, didn't really talk to anyone, still feel like a child. The idea of all the paperwork of name changes and such exhausts me. I spend hours mindlessly browsing the internet about non-trans things. Then I spend hours reading other trans peoples' stories, or name lists, or binder websites.

I always leave schoolwork to the last minute, but the work stays on my mind constantly. Being trans feels the same way? But I'll think ""ugh, my boobs feel weird today"" then I'll go ""do I really think that? Or am I just trying to convince myself I'm nonbinary? One time I wore a great bra that made them look big but also held them securely so that if I didn't see them I didn't feel them at all, and I felt great!"" I just want a personality outside of being nonbinary. I think my depression started when I hit puberty, not when I became friendless. But what if I'm wrong, and I'm clinging to being nonbinary because I feel dissociated all the time?",NonBinary,"Cycles of self-doubt, and feeling like a helpless kid even though I'm not",1487921875.0,"{'created_utc': 1487896675, 'id': '5vuc3f', 'num_comments': 3, 'score': 3, 'selftext': 'Warning: if you don\'t want a probably depressing post with descriptions of anatomy, this post isn\'t for you. I think I mostly just need to ramble, but if anyone wants to share similar experiences or offer opinions that would be great!\n\nBasically, I\'ve had dysphoria since I hit puberty. But even before that, I was weird about gender. Reading trans stories, I never felt trans, but I wished I was because that would give me a reason to want to get rid of my boobs. I\'ve never liked them, and for the last couple of years I\'ve also wanted HRT. I actually learned of puberty blockers when I was like 15, but I never really asked my mum about them?? I was so depressed already, I think I just thought ""oh, she\'d never agree"" then went back to my 24-7 brain fog (not to mention I was already pretty ""developed"" and felt it was too late).\n\nNow I\'m 19, and I live with my mum, who makes unintentionally hurtful comments but would never kick me out. I live in Australia, where transition is affordable for me. There\'s a good-sounding clinic that could be closer, but is reachable. But I\'m just too scared to make an appointment? I wish I could just go there once, get a HRT prescription and be done with it. But it requires a GP referral, then several therapist appointments, then blood-work. The sooner I get it started, right? But to get it started I need to call the place, which terrifies me. I keep trying to tell myself it\'s my subconscious telling me not to transition, but I know it\'s not true. I\'m autistic, I have severe social anxiety, I\'ve had no friends since I was 12. It\'s the idea of calling.\n\nBut I feel like calling would be a mistake? There\'s all these tiny reasons that add up. Just when I reached 18, I finally liked wearing dresses and stuff (I\'m afab). But I\'d be too scared to wear them if I looked like a guy. I\'m already hairy as fuck and don\'t want to be hairier, or bald (but I like all the other effects of HRT). I\'ll spend hours looking at binders online, then chicken out (""I\'ve never bought anything online, and they take so long to ship anyway it\'s not worth it""). And since 18, I\'ve hated my boobs slightly less. I think I may be genderfluid? Although I only feel like my assigned sex like once every few months, for half a day at best. Mostly I feel neither male or female. I think I\'d be okay to pass as a guy, but paradoxically I don\'t want to bind, even though I want my boobs gone. As my mum\'s said, I\'m a ""pretty girl"" but I\'d be a short, ugly guy... which I wouldn\'t mind if I\'m really trans, but what if I\'m wrong?\n\nBeing trans is also embarrassing! I had the whole ""maybe I\'m a trans boy"" convo with her when I was 15, she now knows I\'m nonbinary, but I really can\'t discuss it with her because of the disgusted way she speaks of it. She thinks she\'s supportive, but her most supportive advice has been ""try dressing as a girl for a year, since you\'ve never really tried being a girl, then try being a boy for a year!"". She\'s always there for me, but she is the opposite of what I need for trans matters. The idea of trying to talk to any family, or even a stranger who\'s a doctor is so embarrassing.\n\nI constantly feel like I\'m running out of time. I feel the days go by without me while I browse the internet mindlessly, ignoring my problems. I\'ve always ignored problems rather than solved them. I leave work to the last minute. I take literal hours to get out of bed, even after I\'ve woken up. I wish I had gone on HRT younger (all my immediate afab family are tall and big nosed! Not me!) I used to write stories all the time. Now I have heaps of stories in my head of nonbinary characters that struggle with acceptance but realize they\'re trans. My brain trying to tell me something? Or my brain trying to fill the friendless, empty-of-personality gap? Have I taught myself to be nonbinary, or am I living vicariously through my characters?\n\nI\'m autistic. My mum says I\'m young for my age. When I was younger, I said repeatedly I didn\'t want to grow up - a fear of adulthood, or womanhood, or both??? I spent a year at uni, hoping I would feel like an adult and gain the self-knowledge to know if I truly am nonbinary. I joined clubs, didn\'t really talk to anyone, still feel like a child. The idea of all the paperwork of name changes and such exhausts me. I spend hours mindlessly browsing the internet about non-trans things. Then I spend hours reading other trans peoples\' stories, or name lists, or binder websites.\n\nI always leave schoolwork to the last minute, but the work stays on my mind constantly. Being trans feels the same way? But I\'ll think ""ugh, my boobs feel weird today"" then I\'ll go ""do I really think that? Or am I just trying to convince myself I\'m nonbinary? One time I wore a great bra that made them look big but also held them securely so that if I didn\'t see them I didn\'t feel them at all, and I felt great!"" I just want a personality outside of being nonbinary. I think my depression started when I hit puberty, not when I became friendless. But what if I\'m wrong, and I\'m clinging to being nonbinary because I feel dissociated all the time?', 'subreddit': 'NonBinary', 'title': ""Cycles of self-doubt, and feeling like a helpless kid even though I'm not"", 'created': 1487921875.0}"
2017-02-24 03:06:25,5vv3tw,9,8,"Hi! I'm Doug, I'm 17, AFAB, and I really have no idea what I am in terms of gender. I use they/them and he/him pronouns and I think the closest thing I can think of to describe me is ""gender nonconforming"". 

I'm into dudes. Straight guys wouldn't like me, gay guys wouldn't like me, and I know like, 2 bi guys. I wish I could casually date, but since I don't exactly fall into ""girl"" or ""boy"", I feel like I'm immediately marked off as not desirable? 

I dunno. I just feel really discouraged and that guys don't like me, or that I'm scaring them away with my identity. Does anyone else relate to feeling kind of hopeless? ",NonBinary,Feeling discouraged about my dating life,1487930785.0,"{'created_utc': 1487905585, 'id': '5vv3tw', 'num_comments': 9, 'score': 8, 'selftext': 'Hi! I\'m Doug, I\'m 17, AFAB, and I really have no idea what I am in terms of gender. I use they/them and he/him pronouns and I think the closest thing I can think of to describe me is ""gender nonconforming"". \n\nI\'m into dudes. Straight guys wouldn\'t like me, gay guys wouldn\'t like me, and I know like, 2 bi guys. I wish I could casually date, but since I don\'t exactly fall into ""girl"" or ""boy"", I feel like I\'m immediately marked off as not desirable? \n\nI dunno. I just feel really discouraged and that guys don\'t like me, or that I\'m scaring them away with my identity. Does anyone else relate to feeling kind of hopeless? ', 'subreddit': 'NonBinary', 'title': 'Feeling discouraged about my dating life', 'created': 1487930785.0}"
2017-02-24 18:37:42,5vz7ma,1,7,"So i live in southern EU and as you can imagine you cant really expect some really progressive gender therapists around that are open to the idea of non binary people and dont brainlessly follow a book.

I am male, have a very slight gender confusion and a more serious genital dysphoria and i am looking to discuss this with a therapist and when they realize this is something serious get the approval letter for bottom surgery.

But of course i cant do something like that with some random therapist who doesnt even recognize non binary people so i would like to know if anyone had experiences with good gender therapists in EU countries, probably northern EU ones since i can easily move there to be close to a therapist and discuss that issue.

I know US has quite a few in progressive states but moving there is way harder than moving to an EU country.",NonBinary,Countries with progressive gender therapist?,1487986662.0,"{'created_utc': 1487961462, 'id': '5vz7ma', 'num_comments': 1, 'score': 7, 'selftext': 'So i live in southern EU and as you can imagine you cant really expect some really progressive gender therapists around that are open to the idea of non binary people and dont brainlessly follow a book.\n\nI am male, have a very slight gender confusion and a more serious genital dysphoria and i am looking to discuss this with a therapist and when they realize this is something serious get the approval letter for bottom surgery.\n\nBut of course i cant do something like that with some random therapist who doesnt even recognize non binary people so i would like to know if anyone had experiences with good gender therapists in EU countries, probably northern EU ones since i can easily move there to be close to a therapist and discuss that issue.\n\nI know US has quite a few in progressive states but moving there is way harder than moving to an EU country.', 'subreddit': 'NonBinary', 'title': 'Countries with progressive gender therapist?', 'created': 1487986662.0}"
2017-02-25 03:04:52,5w1z76,1,12,"I just started a new job - just finished my first week in fact - and while I wasn't planning on jumping into gender non-conformance so soon I also feel a little bit like ""casual Friday"" was a good time to push that envelope a little bit. 

It might be a bit formal for casual friday, but I was wearing jeans. 

The outfit: light grey slim denims, blundstone shoes, a (men's) navy flannel button-down, a black blazer, and a good tie. No binder (I can't wear them, due to breastfeeding). 

https://imgur.com/gallery/bCCOf",NonBinary,Some of you requested pics of work outfits (pt. 1),1488017092.0,"{'created_utc': 1487991892, 'id': '5w1z76', 'num_comments': 1, 'score': 12, 'selftext': 'I just started a new job - just finished my first week in fact - and while I wasn\'t planning on jumping into gender non-conformance so soon I also feel a little bit like ""casual Friday"" was a good time to push that envelope a little bit. \n\nIt might be a bit formal for casual friday, but I was wearing jeans. \n\nThe outfit: light grey slim denims, blundstone shoes, a (men\'s) navy flannel button-down, a black blazer, and a good tie. No binder (I can\'t wear them, due to breastfeeding). \n\nhttps://imgur.com/gallery/bCCOf', 'subreddit': 'NonBinary', 'title': 'Some of you requested pics of work outfits (pt. 1)', 'created': 1488017092.0}"
2017-02-25 03:22:40,5w222g,2,2,"I just realized what I am (bi-gender) and what I want are two different things. I desperately want to separate my two genders (female and male) to be able to be one or the other, separating them so I can be either/or. Which I just realized is genderfluid. I hate the way I am now, an odd mix of the two, and it's one of three main causes of dysphoria for me. I come off as awkward as female because the male traits are always there, and I'm pretty sure I'd be an awkward male too, because those female traits are always there.

Is it even possible to change from bi-gender to gender fluid so I can be one or the other? I seem to do it unconsciously in situational moments. Shopping with my daughter for ballgowns or makeup, my guy disappears. Chatting with the guys at the tool store, my girl disappears. I feel great during those moments. Euphoric. But the vast majority of my life is spent in a low level of buzzing dysphoria.",NonBinary,Bi-gender to genderfluid?,1488018160.0,"{'created_utc': 1487992960, 'id': '5w222g', 'num_comments': 2, 'score': 2, 'selftext': ""I just realized what I am (bi-gender) and what I want are two different things. I desperately want to separate my two genders (female and male) to be able to be one or the other, separating them so I can be either/or. Which I just realized is genderfluid. I hate the way I am now, an odd mix of the two, and it's one of three main causes of dysphoria for me. I come off as awkward as female because the male traits are always there, and I'm pretty sure I'd be an awkward male too, because those female traits are always there.\n\nIs it even possible to change from bi-gender to gender fluid so I can be one or the other? I seem to do it unconsciously in situational moments. Shopping with my daughter for ballgowns or makeup, my guy disappears. Chatting with the guys at the tool store, my girl disappears. I feel great during those moments. Euphoric. But the vast majority of my life is spent in a low level of buzzing dysphoria."", 'subreddit': 'NonBinary', 'title': 'Bi-gender to genderfluid?', 'created': 1488018160.0}"
