created_utc,id,num_comments,score,selftext,subreddit,title,created,d_
2017-05-14 04:22:45,6b25mc,7,10,"As a non-binary person I have a few problems concerning androgynous clothing styles so I'd like some help with this. 

Some of the concerns I have with my body are that I have a large chest despite being somewhat thin (I have a 32-4 DDD chest, with a binder it is suppressed /mostly/ but in some clothes it's apparent I still have boobs) and that I have long hair (I'm not willing to cut it, I just don't know how to style it I guess? lots of ""androgynous"" hairstyles are short or medium-short and it's hard to find longer androgynous hairstyles). I'm also pretty short at 5' tall...

In terms of clothing I absolutely abhor button up shirts 99% of the time, flannel is okay unbuttoned or around my waist though. I don't want to look like a woman in mens style clothing, I want something that mixes male and female without it being a male suit tailored to fit a womans body or without just taking mens clothing and putting it on a womans body. I don't wanna look like the stereotype of a male high-school history teacher either if u feel me.

Also does anyone else have this issue? I feel like a lot of ""androgynous"" styles are often just mens clothing tailored a little differently and that's not what androgyny is to me personally I guess.

Sorry this got so long lmao I'm just trying to figure myself out 

Edit: forgot to say I'm short.",NonBinary,Advice on appearing androgynous?,1494760965.0,"{'created_utc': 1494735765, 'id': '6b25mc', 'num_comments': 7, 'score': 10, 'selftext': 'As a non-binary person I have a few problems concerning androgynous clothing styles so I\'d like some help with this. \n\nSome of the concerns I have with my body are that I have a large chest despite being somewhat thin (I have a 32-4 DDD chest, with a binder it is suppressed /mostly/ but in some clothes it\'s apparent I still have boobs) and that I have long hair (I\'m not willing to cut it, I just don\'t know how to style it I guess? lots of ""androgynous"" hairstyles are short or medium-short and it\'s hard to find longer androgynous hairstyles). I\'m also pretty short at 5\' tall...\n\nIn terms of clothing I absolutely abhor button up shirts 99% of the time, flannel is okay unbuttoned or around my waist though. I don\'t want to look like a woman in mens style clothing, I want something that mixes male and female without it being a male suit tailored to fit a womans body or without just taking mens clothing and putting it on a womans body. I don\'t wanna look like the stereotype of a male high-school history teacher either if u feel me.\n\nAlso does anyone else have this issue? I feel like a lot of ""androgynous"" styles are often just mens clothing tailored a little differently and that\'s not what androgyny is to me personally I guess.\n\nSorry this got so long lmao I\'m just trying to figure myself out \n\nEdit: forgot to say I\'m short.', 'subreddit': 'NonBinary', 'title': 'Advice on appearing androgynous?', 'created': 1494760965.0}"
2017-05-14 13:59:33,6b40le,10,26,,NonBinary,[Results] The results of the annual nonbinary/genderqueer stats survey (that I posted about here in February asking you to take part) are up! [x-post /r/samplesize],1494795573.0,"{'created_utc': 1494770373, 'id': '6b40le', 'num_comments': 10, 'score': 26, 'selftext': '', 'subreddit': 'NonBinary', 'title': '[Results] The results of the annual nonbinary/genderqueer stats survey (that I posted about here in February asking you to take part) are up! [x-post /r/samplesize]', 'created': 1494795573.0}"
2017-05-14 15:43:23,6b4iqu,3,6,[deleted],NonBinary,Is Tumblr getting ruined?,1494801803.0,"{'created_utc': 1494776603, 'id': '6b4iqu', 'num_comments': 3, 'score': 6, 'selftext': '[deleted]', 'subreddit': 'NonBinary', 'title': 'Is Tumblr getting ruined?', 'created': 1494801803.0}"
2017-05-14 22:44:32,6b6rnb,3,48,,NonBinary,If People Talked About Other Things the Way They Talked About Gender Identity - McSweeney’s Internet Tendency,1494827072.0,"{'created_utc': 1494801872, 'id': '6b6rnb', 'num_comments': 3, 'score': 48, 'selftext': '', 'subreddit': 'NonBinary', 'title': 'If People Talked About Other Things the Way They Talked About Gender Identity - McSweeney’s Internet Tendency', 'created': 1494827072.0}"
2017-05-14 23:36:44,6b70vo,12,4,[deleted],NonBinary,"AFAB without a gender, prefer he/him over they/them?",1494830204.0,"{'created_utc': 1494805004, 'id': '6b70vo', 'num_comments': 12, 'score': 4, 'selftext': '[deleted]', 'subreddit': 'NonBinary', 'title': 'AFAB without a gender, prefer he/him over they/them?', 'created': 1494830204.0}"
2017-05-15 03:00:14,6b7z3r,0,1,How are y'all this week?,NonBinary,Weekly Off-Topic Discussion post,1494842414.0,"{'created_utc': 1494817214, 'id': '6b7z3r', 'num_comments': 0, 'score': 1, 'selftext': ""How are y'all this week?"", 'subreddit': 'NonBinary', 'title': 'Weekly Off-Topic Discussion post', 'created': 1494842414.0}"
2017-05-15 03:00:17,6b7z3y,20,2,How are y'all this week?,NonBinary,Weekly Off-Topic Discussion post,1494842417.0,"{'created_utc': 1494817217, 'id': '6b7z3y', 'num_comments': 20, 'score': 2, 'selftext': ""How are y'all this week?"", 'subreddit': 'NonBinary', 'title': 'Weekly Off-Topic Discussion post', 'created': 1494842417.0}"
2017-05-15 23:35:13,6bdy9i,16,14,,NonBinary,"Do any of you have personal experience with laser hair removal and/or with electrolysis? If so, how exactly was it for you?",1494916513.0,"{'created_utc': 1494891313, 'id': '6bdy9i', 'num_comments': 16, 'score': 14, 'selftext': '', 'subreddit': 'NonBinary', 'title': 'Do any of you have personal experience with laser hair removal and/or with electrolysis? If so, how exactly was it for you?', 'created': 1494916513.0}"
2017-05-16 09:40:12,6bghfo,1,0,[removed],NonBinary,IELTS certificate for sale,1494952812.0,"{'created_utc': 1494927612, 'id': '6bghfo', 'num_comments': 1, 'score': 0, 'selftext': '[removed]', 'subreddit': 'NonBinary', 'title': 'IELTS certificate for sale', 'created': 1494952812.0}"
2017-05-16 23:00:44,6bkwlj,7,11,"TL;DR: what are some key things to say when coming out as nonbinary to people of all kinds, including people who don't know about nonbinary (or maybe even binary trans people)

I really want to come out and hopefully it'll get rid of some of my fears of dressing how I want as well as the discomfort of my birth name and male pronouns but I'm not really sure how to? I have a lot of family to come out to, I was thinking of posting in our family whatsapp (which is most of the close people) but I'm not sure what to say. My mum told some of them I'm trans ages ago but my mum isn't really aware I'm nonbinary (because 1. I accepted it more so after I already came out and 2. I didn't know how to explain it). I also want to come out on Facebook and make a new profile but at the same time I don't really like Facebook. I also can't take a picture of myself that I like (although when I get my haircut it might be different)

I feel like I should message my grandparents and tell them rather than let them find out through facebook but they're not in the whatsapp chat and it feels really intimidating to message them 1 to 1.

Lastly I don't really know how to word it or how much to say. With my parents I wrote a long letter but that made sense because they're my parents but with slightly further family to random people I used to go to school with I'm not sure what kind of etiquette to go for. I feel like saying ""I'm nonbinary, they/them pronouns and my name is now Elise"" is a bit too short and less sincere but I don't think most of them want to see me spill my life story on Facebook.

Any tips on what you awesome lot may have done when you came out/things you'd wish you'd done would be really helpful. ",NonBinary,Anyone got a good guide for coming out publicly as a nonbinary person?,1495000844.0,"{'created_utc': 1494975644, 'id': '6bkwlj', 'num_comments': 7, 'score': 11, 'selftext': 'TL;DR: what are some key things to say when coming out as nonbinary to people of all kinds, including people who don\'t know about nonbinary (or maybe even binary trans people)\n\nI really want to come out and hopefully it\'ll get rid of some of my fears of dressing how I want as well as the discomfort of my birth name and male pronouns but I\'m not really sure how to? I have a lot of family to come out to, I was thinking of posting in our family whatsapp (which is most of the close people) but I\'m not sure what to say. My mum told some of them I\'m trans ages ago but my mum isn\'t really aware I\'m nonbinary (because 1. I accepted it more so after I already came out and 2. I didn\'t know how to explain it). I also want to come out on Facebook and make a new profile but at the same time I don\'t really like Facebook. I also can\'t take a picture of myself that I like (although when I get my haircut it might be different)\n\nI feel like I should message my grandparents and tell them rather than let them find out through facebook but they\'re not in the whatsapp chat and it feels really intimidating to message them 1 to 1.\n\nLastly I don\'t really know how to word it or how much to say. With my parents I wrote a long letter but that made sense because they\'re my parents but with slightly further family to random people I used to go to school with I\'m not sure what kind of etiquette to go for. I feel like saying ""I\'m nonbinary, they/them pronouns and my name is now Elise"" is a bit too short and less sincere but I don\'t think most of them want to see me spill my life story on Facebook.\n\nAny tips on what you awesome lot may have done when you came out/things you\'d wish you\'d done would be really helpful. ', 'subreddit': 'NonBinary', 'title': 'Anyone got a good guide for coming out publicly as a nonbinary person?', 'created': 1495000844.0}"
2017-05-17 18:07:20,6bqfaf,8,9,"so a definition i read said ""partially identifying as a boy/girl but not wholly"". but what's the other part? is it gender neutral?",NonBinary,question about demiboys/girls,1495069640.0,"{'created_utc': 1495044440, 'id': '6bqfaf', 'num_comments': 8, 'score': 9, 'selftext': 'so a definition i read said ""partially identifying as a boy/girl but not wholly"". but what\'s the other part? is it gender neutral?', 'subreddit': 'NonBinary', 'title': 'question about demiboys/girls', 'created': 1495069640.0}"
2017-05-18 05:02:54,6bu5lv,11,8,"nothing to long to this, just wondering if and AFAB ppl with huge chests (but thinner bodies) have any advice on binding? My binder works but just barely, if I were to measure it gets me to around an ""a-cup"" size, maybe b-cup. My regular bra size is a 32-4 DDD if that helps",NonBinary,AFAB advice,1495108974.0,"{'created_utc': 1495083774, 'id': '6bu5lv', 'num_comments': 11, 'score': 8, 'selftext': 'nothing to long to this, just wondering if and AFAB ppl with huge chests (but thinner bodies) have any advice on binding? My binder works but just barely, if I were to measure it gets me to around an ""a-cup"" size, maybe b-cup. My regular bra size is a 32-4 DDD if that helps', 'subreddit': 'NonBinary', 'title': 'AFAB advice', 'created': 1495108974.0}"
2017-05-18 21:06:51,6bz597,11,7,"Here the questions:

* Did starting HRT make you change your perception of your own gender?

* How did you decide to start HRT while knowing you didn't want to cross completely to the other side of the binary?

Some background: 

AFAB. I am kinda oscillating between identifying as a man and identifying as non binary. I have not yet started to take T, but I hope to get it into the future. ",NonBinary,Questions for non binary people on HRT,1495166811.0,"{'created_utc': 1495141611, 'id': '6bz597', 'num_comments': 11, 'score': 7, 'selftext': ""Here the questions:\n\n* Did starting HRT make you change your perception of your own gender?\n\n* How did you decide to start HRT while knowing you didn't want to cross completely to the other side of the binary?\n\nSome background: \n\nAFAB. I am kinda oscillating between identifying as a man and identifying as non binary. I have not yet started to take T, but I hope to get it into the future. "", 'subreddit': 'NonBinary', 'title': 'Questions for non binary people on HRT', 'created': 1495166811.0}"
2017-05-19 00:08:33,6c06w0,0,1,,NonBinary,Is there any way to see a picture/simulation of what you will look like after FFS before you actually undergo FFS?,1495177713.0,"{'created_utc': 1495152513, 'id': '6c06w0', 'num_comments': 0, 'score': 1, 'selftext': '', 'subreddit': 'NonBinary', 'title': 'Is there any way to see a picture/simulation of what you will look like after FFS before you actually undergo FFS?', 'created': 1495177713.0}"
2017-05-19 14:18:29,6c3wpb,4,3,"I am just beginning to explore my NB-ness, and the first thing I want to change is my hair style. But I don't know where to start, or what would work on fine, curly hair! You guys have any ideas of where to go to find resources or help?? Thanks!",NonBinary,Hair styles?,1495228709.0,"{'created_utc': 1495203509, 'id': '6c3wpb', 'num_comments': 4, 'score': 3, 'selftext': ""I am just beginning to explore my NB-ness, and the first thing I want to change is my hair style. But I don't know where to start, or what would work on fine, curly hair! You guys have any ideas of where to go to find resources or help?? Thanks!"", 'subreddit': 'NonBinary', 'title': 'Hair styles?', 'created': 1495228709.0}"
2017-05-19 15:13:10,6c48pp,2,22,"Hey!!

 im a Quebecois! So i speak french and im from canada! Ill try to write in english! 

Im a nonbinary with a vagina! I have big boobs that a hate so much!!!!!

Im fiancé with a person that a love so much.she is my soulmate and she accept that i have a chirurgy to reduce my boobs... i want a neutral body and i dont want to be obligatated (now i am because of my giga boobs) to wear a bra! Im no sure i want a plate chest? 

I sent my paper to meet a plastic surgeon (it will be pay by the health insurance (i have so much big boobs so it will be covered))!!! So i think it will be my last summer with thoses!! Kind of sad, in a way! But it will be FREEDOM after all!!!!! :D 

Im without job and school at this moment, so im free to talk if someone want to discuss! 

Lets have a beautiful day !!! 

Xoxo",NonBinary,Hey humans!!!,1495231990.0,"{'created_utc': 1495206790, 'id': '6c48pp', 'num_comments': 2, 'score': 22, 'selftext': 'Hey!!\n\n im a Quebecois! So i speak french and im from canada! Ill try to write in english! \n\nIm a nonbinary with a vagina! I have big boobs that a hate so much!!!!!\n\nIm fiancé with a person that a love so much.she is my soulmate and she accept that i have a chirurgy to reduce my boobs... i want a neutral body and i dont want to be obligatated (now i am because of my giga boobs) to wear a bra! Im no sure i want a plate chest? \n\nI sent my paper to meet a plastic surgeon (it will be pay by the health insurance (i have so much big boobs so it will be covered))!!! So i think it will be my last summer with thoses!! Kind of sad, in a way! But it will be FREEDOM after all!!!!! :D \n\nIm without job and school at this moment, so im free to talk if someone want to discuss! \n\nLets have a beautiful day !!! \n\nXoxo', 'subreddit': 'NonBinary', 'title': 'Hey humans!!!', 'created': 1495231990.0}"
2017-05-20 01:51:54,6c7vl4,13,6,"Hello there guys, gals, and nonbinary pals. I need help, I don't know how to properly shave/wax/get rid of my beard and it's getting pretty annoying.

I shave like ~once every 3 months, and lately my beard's getting thicker and growing faster and I despise it. I just shaved yesterday and my face already feels like sandpaper, even though there's no hair visible. Is there any (preferably cheap and discreet) way to make my beard thinner and grow slower? As a side note, I'm not interested in getting HRT, and I'm not out to most of my family.

Thanks in advance!",NonBinary,"AMAB here, need help murdering my beard",1495270314.0,"{'created_utc': 1495245114, 'id': '6c7vl4', 'num_comments': 13, 'score': 6, 'selftext': ""Hello there guys, gals, and nonbinary pals. I need help, I don't know how to properly shave/wax/get rid of my beard and it's getting pretty annoying.\n\nI shave like ~once every 3 months, and lately my beard's getting thicker and growing faster and I despise it. I just shaved yesterday and my face already feels like sandpaper, even though there's no hair visible. Is there any (preferably cheap and discreet) way to make my beard thinner and grow slower? As a side note, I'm not interested in getting HRT, and I'm not out to most of my family.\n\nThanks in advance!"", 'subreddit': 'NonBinary', 'title': 'AMAB here, need help murdering my beard', 'created': 1495270314.0}"
2017-05-20 16:51:54,6cbd23,12,3,"Notice: This is not about ageplay.

I do. And I'm pretty much lost. It would be nice to have someone else to talk to. To put it straight I am mtf, but don't feel as a woman but a 12~13 year old girl. I don't want any puberty, I don't want breasts. I also have problems connecting with adults (apart from my social fears), what they talk about just doesn't interest me. And being at my local trans support group I feel strangely out of place, all this old people talking about old people problems, like bureaucracy, sex, marriage, work and stuff. I just say Hi and sit there, watching them like family visiting, at the end I say Bye and wonder where I would find people like me.

There is [this case](https://www.youtube.com/watch?v=MbiAHnjHlHg). So I'm not the only one. But I don't know how to go from here. I haven't told my therapist, she knows I'm transgender, but not that I'm... transadolescent (?).

I have been taking T-Blockers for a month now, and it's a great relive. But I also know that I can't go forever without sexual hormones (Does any one have definitive data on what might happen?). I'm afraid to have a second puberty, the first one destroyed my life, the second one could do it again. Still if there would be no other choice I would rather live as a woman than as a man, but that would be a solution half way there and then taking a wrong turn.",NonBinary,(Sorry for asking) Does anyone here feel as a child?,1495324314.0,"{'created_utc': 1495299114, 'id': '6cbd23', 'num_comments': 12, 'score': 3, 'selftext': ""Notice: This is not about ageplay.\n\nI do. And I'm pretty much lost. It would be nice to have someone else to talk to. To put it straight I am mtf, but don't feel as a woman but a 12~13 year old girl. I don't want any puberty, I don't want breasts. I also have problems connecting with adults (apart from my social fears), what they talk about just doesn't interest me. And being at my local trans support group I feel strangely out of place, all this old people talking about old people problems, like bureaucracy, sex, marriage, work and stuff. I just say Hi and sit there, watching them like family visiting, at the end I say Bye and wonder where I would find people like me.\n\nThere is [this case](https://www.youtube.com/watch?v=MbiAHnjHlHg). So I'm not the only one. But I don't know how to go from here. I haven't told my therapist, she knows I'm transgender, but not that I'm... transadolescent (?).\n\nI have been taking T-Blockers for a month now, and it's a great relive. But I also know that I can't go forever without sexual hormones (Does any one have definitive data on what might happen?). I'm afraid to have a second puberty, the first one destroyed my life, the second one could do it again. Still if there would be no other choice I would rather live as a woman than as a man, but that would be a solution half way there and then taking a wrong turn."", 'subreddit': 'NonBinary', 'title': '(Sorry for asking) Does anyone here feel as a child?', 'created': 1495324314.0}"
2017-05-20 19:52:20,6cccub,2,12,"I am 50 years old, AMAB, identifying as third gender.  I had an orchiectomy 2 years ago.  I began estradiol shortly before that, and gradually increased from 1mg to my current 4mg (2mg morning and night) sublingual each day.  The goal has been to change my body to become more neutral-toward-feminine, and I've had some success with that (some breast development, erections very rare, body hair thinning and hope it thins more).  I feel good on the 4mg daily, though I'd be happier if I had more sex drive and stronger fingernails.  I've done all this through private ""civilian"" physicians.  My most recent estradiol level was 212.3 pg/ml.  I do not consider myself ""finished"" with physical transitioning, and I eventually want further bottom surgery once I lose enough weight to get it done.

The Veterans Administration has worked with my civilian doctor and provided my prescription meds.  Recently though, I moved to a new city, and the VA hospital here insists on reviewing everything with their specialists.  They now insist that I see a VA endocrinologist.  The primary care doctor there referred me ""electronically"" to one of their endocrinologists, and he returned a treatment note that was frustrating---both for misgendering and for oddball recommendations:

""Would start with baseline fasting AM total testosterone, estradiol, LH, FSH and prolactin. As patient is S/P bilateral orchiectomy, she should not require high dose oral estrogen therapy and no spironolactone. Generally, transdermal estrogen patch therapy is recommended to provide adequate circulating estrogen (30 -70 pg/ml range) while at the same time avoiding first pass hepatic
matabolism and theoretically lowering iatrogenic DVT risk. Will still require screening mammograms every 2 years (is a generally recommended frequency).""

So, clearly this endocrinologist missed the notation that I'm non-binary, NOT female, just for starters.  The fact that he wants me tested for testosterone level is bizarre, given that I'm nearly two years post-orchiectomy.  I'm all for reducing the risk of DVT, as I'm overweight, etc.  HOWEVER, dropping from 212.3 pg/ml estradiol level to a 30-70 pg/ml range sounds like a TERRIBLE idea, especially if I'm still seeking further physical transition.  As I understand it, this would place me essentially at the level of a postmenopausal cisgender woman.

I am getting the blood tests per their direction, and I have to see their endocrinologist soon.  I realize others on here are NOT doctors, but have any of you dealt with similar conflicts in doctor recommendations--let alone such a directed reduction?  Thoughts?  Experiences?  HELP!",NonBinary,Non-Binary and Perplexed with Conflicting Doctors' Hormone Opinions,1495335140.0,"{'created_utc': 1495309940, 'id': '6cccub', 'num_comments': 2, 'score': 12, 'selftext': 'I am 50 years old, AMAB, identifying as third gender.  I had an orchiectomy 2 years ago.  I began estradiol shortly before that, and gradually increased from 1mg to my current 4mg (2mg morning and night) sublingual each day.  The goal has been to change my body to become more neutral-toward-feminine, and I\'ve had some success with that (some breast development, erections very rare, body hair thinning and hope it thins more).  I feel good on the 4mg daily, though I\'d be happier if I had more sex drive and stronger fingernails.  I\'ve done all this through private ""civilian"" physicians.  My most recent estradiol level was 212.3 pg/ml.  I do not consider myself ""finished"" with physical transitioning, and I eventually want further bottom surgery once I lose enough weight to get it done.\n\nThe Veterans Administration has worked with my civilian doctor and provided my prescription meds.  Recently though, I moved to a new city, and the VA hospital here insists on reviewing everything with their specialists.  They now insist that I see a VA endocrinologist.  The primary care doctor there referred me ""electronically"" to one of their endocrinologists, and he returned a treatment note that was frustrating---both for misgendering and for oddball recommendations:\n\n""Would start with baseline fasting AM total testosterone, estradiol, LH, FSH and prolactin. As patient is S/P bilateral orchiectomy, she should not require high dose oral estrogen therapy and no spironolactone. Generally, transdermal estrogen patch therapy is recommended to provide adequate circulating estrogen (30 -70 pg/ml range) while at the same time avoiding first pass hepatic\nmatabolism and theoretically lowering iatrogenic DVT risk. Will still require screening mammograms every 2 years (is a generally recommended frequency).""\n\nSo, clearly this endocrinologist missed the notation that I\'m non-binary, NOT female, just for starters.  The fact that he wants me tested for testosterone level is bizarre, given that I\'m nearly two years post-orchiectomy.  I\'m all for reducing the risk of DVT, as I\'m overweight, etc.  HOWEVER, dropping from 212.3 pg/ml estradiol level to a 30-70 pg/ml range sounds like a TERRIBLE idea, especially if I\'m still seeking further physical transition.  As I understand it, this would place me essentially at the level of a postmenopausal cisgender woman.\n\nI am getting the blood tests per their direction, and I have to see their endocrinologist soon.  I realize others on here are NOT doctors, but have any of you dealt with similar conflicts in doctor recommendations--let alone such a directed reduction?  Thoughts?  Experiences?  HELP!', 'subreddit': 'NonBinary', 'title': ""Non-Binary and Perplexed with Conflicting Doctors' Hormone Opinions"", 'created': 1495335140.0}"
2017-05-21 10:46:59,6cfxqq,7,0,[removed],NonBinary,Can you identify as the opposite race?,1495388819.0,"{'created_utc': 1495363619, 'id': '6cfxqq', 'num_comments': 7, 'score': 0, 'selftext': '[removed]', 'subreddit': 'NonBinary', 'title': 'Can you identify as the opposite race?', 'created': 1495388819.0}"
