created_utc,id,num_comments,score,selftext,subreddit,title,created,d_
2015-09-13 03:28:23,3kqrvt,0,47,,transgender,Boss Who Asked Transgender Woman 'What Are You?' Agrees To Significant Settlement,1442140103.0,"{'created_utc': 1442114903, 'id': '3kqrvt', 'num_comments': 0, 'score': 47, 'selftext': '', 'subreddit': 'transgender', 'title': ""Boss Who Asked Transgender Woman 'What Are You?' Agrees To Significant Settlement"", 'created': 1442140103.0}"
2015-09-13 12:28:22,3krynt,2,7,,transgender,"What I Wanted to Wear: Getting Real, Getting Free (On being feminine enough to be read as transfeminine.)",1442172502.0,"{'created_utc': 1442147302, 'id': '3krynt', 'num_comments': 2, 'score': 7, 'selftext': '', 'subreddit': 'transgender', 'title': 'What I Wanted to Wear: Getting Real, Getting Free (On being feminine enough to be read as transfeminine.)', 'created': 1442172502.0}"
2015-09-13 14:04:14,3ks882,0,1,,transgender,"Banheiros Neutros, a solução americana para combater à transfobia",1442178254.0,"{'created_utc': 1442153054, 'id': '3ks882', 'num_comments': 0, 'score': 1, 'selftext': '', 'subreddit': 'transgender', 'title': 'Banheiros Neutros, a solução americana para combater à transfobia', 'created': 1442178254.0}"
2015-09-13 17:10:24,3kswkp,1,1,,transgender,Louis Theroux Transgender Kids,1442189424.0,"{'created_utc': 1442164224, 'id': '3kswkp', 'num_comments': 1, 'score': 1, 'selftext': '', 'subreddit': 'transgender', 'title': 'Louis Theroux Transgender Kids', 'created': 1442189424.0}"
2015-09-13 17:35:26,3kt05v,0,1,[deleted],transgender,[X-post from r/transgenderuk ]Put your question to Cameron about the state of the gender clinics here,1442190926.0,"{'created_utc': 1442165726, 'id': '3kt05v', 'num_comments': 0, 'score': 1, 'selftext': '[deleted]', 'subreddit': 'transgender', 'title': '[X-post from r/transgenderuk ]Put your question to Cameron about the state of the gender clinics here', 'created': 1442190926.0}"
2015-09-13 19:14:29,3kte91,0,3,,transgender,Put your question to Cameron about the state of the gender clinics here,1442196869.0,"{'created_utc': 1442171669, 'id': '3kte91', 'num_comments': 0, 'score': 3, 'selftext': '', 'subreddit': 'transgender', 'title': 'Put your question to Cameron about the state of the gender clinics here', 'created': 1442196869.0}"
2015-09-13 19:30:13,3ktgih,19,85,,transgender,MSU sorority opens doors to transgender women,1442197813.0,"{'created_utc': 1442172613, 'id': '3ktgih', 'num_comments': 19, 'score': 85, 'selftext': '', 'subreddit': 'transgender', 'title': 'MSU sorority opens doors to transgender women', 'created': 1442197813.0}"
2015-09-13 20:29:21,3ktovu,0,1,[deleted],transgender,It's us against them... plain and simple!,1442201361.0,"{'created_utc': 1442176161, 'id': '3ktovu', 'num_comments': 0, 'score': 1, 'selftext': '[deleted]', 'subreddit': 'transgender', 'title': ""It's us against them... plain and simple!"", 'created': 1442201361.0}"
2015-09-13 20:46:13,3ktrd9,4,13,,transgender,Transgender high school cheerleader happy to be one of the girls,1442202373.0,"{'created_utc': 1442177173, 'id': '3ktrd9', 'num_comments': 4, 'score': 13, 'selftext': '', 'subreddit': 'transgender', 'title': 'Transgender high school cheerleader happy to be one of the girls', 'created': 1442202373.0}"
2015-09-13 20:53:31,3ktsdi,0,0,,transgender,Meet six-year-old twin brother who is now a twin sister - and one of Britain's youngest transgender children,1442202811.0,"{'created_utc': 1442177611, 'id': '3ktsdi', 'num_comments': 0, 'score': 0, 'selftext': '', 'subreddit': 'transgender', 'title': ""Meet six-year-old twin brother who is now a twin sister - and one of Britain's youngest transgender children"", 'created': 1442202811.0}"
2015-09-13 21:06:10,3ktu57,5,9,,transgender,An excellent summary by Molay about the reality of transgender research: it's us against them. Love versus hate.,1442203570.0,"{'created_utc': 1442178370, 'id': '3ktu57', 'num_comments': 5, 'score': 9, 'selftext': '', 'subreddit': 'transgender', 'title': ""An excellent summary by Molay about the reality of transgender research: it's us against them. Love versus hate."", 'created': 1442203570.0}"
2015-09-13 22:51:46,3ku830,0,2,,transgender,Falling in (and Out of) Love Is Complicated When You’re Transgender,1442209906.0,"{'created_utc': 1442184706, 'id': '3ku830', 'num_comments': 0, 'score': 2, 'selftext': '', 'subreddit': 'transgender', 'title': 'Falling in (and Out of) Love Is Complicated When You’re Transgender', 'created': 1442209906.0}"
2015-09-14 04:51:43,3kvefx,0,6,,transgender,S.F. Announces Jail Integration Plan for Trans Women,1442231503.0,"{'created_utc': 1442206303, 'id': '3kvefx', 'num_comments': 0, 'score': 6, 'selftext': '', 'subreddit': 'transgender', 'title': 'S.F. Announces Jail Integration Plan for Trans Women', 'created': 1442231503.0}"
2015-09-14 05:06:32,3kvfvz,2,2,,transgender,Trans Lives Matter Activists Storm the Stage at USCA,1442232392.0,"{'created_utc': 1442207192, 'id': '3kvfvz', 'num_comments': 2, 'score': 2, 'selftext': '', 'subreddit': 'transgender', 'title': 'Trans Lives Matter Activists Storm the Stage at USCA', 'created': 1442232392.0}"
2015-09-14 07:10:18,3kvqud,0,1,,transgender,[TW] First girl in the League of Legends championship is Trans and it's not going down well...,1442239818.0,"{'created_utc': 1442214618, 'id': '3kvqud', 'num_comments': 0, 'score': 1, 'selftext': '', 'subreddit': 'transgender', 'title': ""[TW] First girl in the League of Legends championship is Trans and it's not going down well..."", 'created': 1442239818.0}"
2015-09-14 07:56:28,3kvues,4,42,,transgender,Eve Ensler: trans people have been caricatures for too long,1442242588.0,"{'created_utc': 1442217388, 'id': '3kvues', 'num_comments': 4, 'score': 42, 'selftext': '', 'subreddit': 'transgender', 'title': 'Eve Ensler: trans people have been caricatures for too long', 'created': 1442242588.0}"
2015-09-14 14:39:14,3kwxod,0,1,,transgender,"Trans DJ Lina Bradford, queen of Fire Island",1442266754.0,"{'created_utc': 1442241554, 'id': '3kwxod', 'num_comments': 0, 'score': 1, 'selftext': '', 'subreddit': 'transgender', 'title': 'Trans DJ Lina Bradford, queen of Fire Island', 'created': 1442266754.0}"
2015-09-14 16:26:56,3kxcp3,12,0,,transgender,Transgender a hot trend,1442273216.0,"{'created_utc': 1442248016, 'id': '3kxcp3', 'num_comments': 12, 'score': 0, 'selftext': '', 'subreddit': 'transgender', 'title': 'Transgender a hot trend', 'created': 1442273216.0}"
2015-09-14 16:40:40,3kxet0,0,18,,transgender,I Am A Grey Area #6 (comic),1442274040.0,"{'created_utc': 1442248840, 'id': '3kxet0', 'num_comments': 0, 'score': 18, 'selftext': '', 'subreddit': 'transgender', 'title': 'I Am A Grey Area #6 (comic)', 'created': 1442274040.0}"
2015-09-14 17:02:46,3kxi5w,0,1,[deleted],transgender,Parent Denies Transgender Son a Haircut | What Would You Do? | WWYD,1442275366.0,"{'created_utc': 1442250166, 'id': '3kxi5w', 'num_comments': 0, 'score': 1, 'selftext': '[deleted]', 'subreddit': 'transgender', 'title': 'Parent Denies Transgender Son a Haircut | What Would You Do? | WWYD', 'created': 1442275366.0}"
2015-09-14 18:20:38,3kxu95,5,60,,transgender,Transgender Kids Show Consistent Gender Identity Across Measures,1442280038.0,"{'created_utc': 1442254838, 'id': '3kxu95', 'num_comments': 5, 'score': 60, 'selftext': '', 'subreddit': 'transgender', 'title': 'Transgender Kids Show Consistent Gender Identity Across Measures', 'created': 1442280038.0}"
2015-09-14 18:23:48,3kxur0,9,28,,transgender,Trailblazing trans pilot Jessica Taylor pushes for equality,1442280228.0,"{'created_utc': 1442255028, 'id': '3kxur0', 'num_comments': 9, 'score': 28, 'selftext': '', 'subreddit': 'transgender', 'title': 'Trailblazing trans pilot Jessica Taylor pushes for equality', 'created': 1442280228.0}"
2015-09-14 22:13:27,3kyti2,6,7,,transgender,"My new podcast ""Diary of a Trans Woman""",1442294007.0,"{'created_utc': 1442268807, 'id': '3kyti2', 'num_comments': 6, 'score': 7, 'selftext': '', 'subreddit': 'transgender', 'title': 'My new podcast ""Diary of a Trans Woman""', 'created': 1442294007.0}"
2015-09-14 22:27:00,3kyvdh,0,2,,transgender,I have two voices (just some personal venting of thoughts. Sorry about the open window),1442294820.0,"{'created_utc': 1442269620, 'id': '3kyvdh', 'num_comments': 0, 'score': 2, 'selftext': '', 'subreddit': 'transgender', 'title': 'I have two voices (just some personal venting of thoughts. Sorry about the open window)', 'created': 1442294820.0}"
2015-09-15 01:40:21,3kzkoo,5,0,[deleted],transgender,5 reasons why I use the term ‘crossdreaming’ in transgender terminology,1442306421.0,"{'created_utc': 1442281221, 'id': '3kzkoo', 'num_comments': 5, 'score': 0, 'selftext': '[deleted]', 'subreddit': 'transgender', 'title': '5 reasons why I use the term ‘crossdreaming’ in transgender terminology', 'created': 1442306421.0}"
2015-09-15 02:49:44,3kztcs,1,1,,transgender,The Price of Normal,1442310584.0,"{'created_utc': 1442285384, 'id': '3kztcs', 'num_comments': 1, 'score': 1, 'selftext': '', 'subreddit': 'transgender', 'title': 'The Price of Normal', 'created': 1442310584.0}"
2015-09-15 03:18:36,3kzwue,49,64,,transgender,Dallas Man Gets Probation in Fatal Assault of Trans Woman Janette Tover,1442312316.0,"{'created_utc': 1442287116, 'id': '3kzwue', 'num_comments': 49, 'score': 64, 'selftext': '', 'subreddit': 'transgender', 'title': 'Dallas Man Gets Probation in Fatal Assault of Trans Woman Janette Tover', 'created': 1442312316.0}"
2015-09-15 05:55:21,3l0d47,9,26,,transgender,Huffington Post - Fighting Back Against Anti- Transgender Talking Points,1442321721.0,"{'created_utc': 1442296521, 'id': '3l0d47', 'num_comments': 9, 'score': 26, 'selftext': '', 'subreddit': 'transgender', 'title': 'Huffington Post - Fighting Back Against Anti- Transgender Talking Points', 'created': 1442321721.0}"
2015-09-15 12:44:12,3l1bbp,96,33,,transgender,Caitlyn Jenner to face the wrath of South Park,1442346252.0,"{'created_utc': 1442321052, 'id': '3l1bbp', 'num_comments': 96, 'score': 33, 'selftext': '', 'subreddit': 'transgender', 'title': 'Caitlyn Jenner to face the wrath of South Park', 'created': 1442346252.0}"
2015-09-15 15:07:56,3l1t4j,10,0,,transgender,Woman who posed as man guilty of sexual assault,1442354876.0,"{'created_utc': 1442329676, 'id': '3l1t4j', 'num_comments': 10, 'score': 0, 'selftext': '', 'subreddit': 'transgender', 'title': 'Woman who posed as man guilty of sexual assault', 'created': 1442354876.0}"
2015-09-15 18:15:35,3l2kcp,1,1,,transgender,A Christian has something to say about Caitlyn Jenner!@,1442366135.0,"{'created_utc': 1442340935, 'id': '3l2kcp', 'num_comments': 1, 'score': 1, 'selftext': '', 'subreddit': 'transgender', 'title': 'A Christian has something to say about Caitlyn Jenner!@', 'created': 1442366135.0}"
2015-09-15 18:45:55,3l2osx,0,1,[deleted],transgender,New Stonewall clip. Thoughts?,1442367955.0,"{'created_utc': 1442342755, 'id': '3l2osx', 'num_comments': 0, 'score': 1, 'selftext': '[deleted]', 'subreddit': 'transgender', 'title': 'New Stonewall clip. Thoughts?', 'created': 1442367955.0}"
2015-09-15 19:57:57,3l2z8i,1,1,,transgender,update debbie lynn r ..big city,1442372277.0,"{'created_utc': 1442347077, 'id': '3l2z8i', 'num_comments': 1, 'score': 1, 'selftext': '', 'subreddit': 'transgender', 'title': 'update debbie lynn r ..big city', 'created': 1442372277.0}"
2015-09-16 01:38:04,3l492n,1,4,,transgender,Elle Fanning’s Transgender Drama ‘About Ray’ Delayed,1442392684.0,"{'created_utc': 1442367484, 'id': '3l492n', 'num_comments': 1, 'score': 4, 'selftext': '', 'subreddit': 'transgender', 'title': 'Elle Fanning’s Transgender Drama ‘About Ray’ Delayed', 'created': 1442392684.0}"
2015-09-16 01:38:46,3l495k,7,33,,transgender,Brad Pitt and Angelina Jolie Consulted a Transgender Expert About Shiloh’s Gender Identity,1442392726.0,"{'created_utc': 1442367526, 'id': '3l495k', 'num_comments': 7, 'score': 33, 'selftext': '', 'subreddit': 'transgender', 'title': 'Brad Pitt and Angelina Jolie Consulted a Transgender Expert About Shiloh’s Gender Identity', 'created': 1442392726.0}"
2015-09-16 01:46:44,3l4a51,0,1,[deleted],transgender,Feeling Myself: Accepting My Transgender Body,1442393204.0,"{'created_utc': 1442368004, 'id': '3l4a51', 'num_comments': 0, 'score': 1, 'selftext': '[deleted]', 'subreddit': 'transgender', 'title': 'Feeling Myself: Accepting My Transgender Body', 'created': 1442393204.0}"
2015-09-16 02:33:13,3l4g34,11,0,[deleted],transgender,Bruce Jenner is a Fraud,1442395993.0,"{'created_utc': 1442370793, 'id': '3l4g34', 'num_comments': 11, 'score': 0, 'selftext': '[deleted]', 'subreddit': 'transgender', 'title': 'Bruce Jenner is a Fraud', 'created': 1442395993.0}"
2015-09-16 10:12:06,3l5kix,33,20,,transgender,The transrepresentation of Lili Elbe,1442423526.0,"{'created_utc': 1442398326, 'id': '3l5kix', 'num_comments': 33, 'score': 20, 'selftext': '', 'subreddit': 'transgender', 'title': 'The transrepresentation of Lili Elbe', 'created': 1442423526.0}"
2015-09-16 16:07:40,3l6ptx,52,96,,transgender,Enough With the Queer and Trans Films That Are Actually About Straight People,1442444860.0,"{'created_utc': 1442419660, 'id': '3l6ptx', 'num_comments': 52, 'score': 96, 'selftext': '', 'subreddit': 'transgender', 'title': 'Enough With the Queer and Trans Films That Are Actually About Straight People', 'created': 1442444860.0}"
2015-09-16 17:18:24,3l70d2,8,46,[deleted],transgender,There's no such thing as gay blood. Or trans blood. Join the campaign to #endtheban,1442449104.0,"{'created_utc': 1442423904, 'id': '3l70d2', 'num_comments': 8, 'score': 46, 'selftext': '[deleted]', 'subreddit': 'transgender', 'title': ""There's no such thing as gay blood. Or trans blood. Join the campaign to #endtheban"", 'created': 1442449104.0}"
2015-09-16 18:04:19,3l773u,0,1,,transgender,Alex is a Black Trans Man Who Will Not Apologize for His Existence #AMPLIFY,1442451859.0,"{'created_utc': 1442426659, 'id': '3l773u', 'num_comments': 0, 'score': 1, 'selftext': '', 'subreddit': 'transgender', 'title': 'Alex is a Black Trans Man Who Will Not Apologize for His Existence #AMPLIFY', 'created': 1442451859.0}"
2015-09-16 21:06:19,3l7ybf,3,7,,transgender,One More Week to Take Largest Survey On Trans* Individuals in the US.,1442462779.0,"{'created_utc': 1442437579, 'id': '3l7ybf', 'num_comments': 3, 'score': 7, 'selftext': '', 'subreddit': 'transgender', 'title': 'One More Week to Take Largest Survey On Trans* Individuals in the US.', 'created': 1442462779.0}"
2015-09-16 22:47:55,3l8cnp,11,0,,transgender,"Caitlyn Jenner has filed paperwork to make her name and gender transition official, but she has requested privacy accommodations citing threats she has received.",1442468875.0,"{'created_utc': 1442443675, 'id': '3l8cnp', 'num_comments': 11, 'score': 0, 'selftext': '', 'subreddit': 'transgender', 'title': 'Caitlyn Jenner has filed paperwork to make her name and gender transition official, but she has requested privacy accommodations citing threats she has received.', 'created': 1442468875.0}"
2015-09-17 07:36:00,3l9ywv,0,1,,transgender,My transition Inspiration video. I hope it helps others dealing with deciding to transition to their inner gender,1442500560.0,"{'created_utc': 1442475360, 'id': '3l9ywv', 'num_comments': 0, 'score': 1, 'selftext': '', 'subreddit': 'transgender', 'title': 'My transition Inspiration video. I hope it helps others dealing with deciding to transition to their inner gender', 'created': 1442500560.0}"
2015-09-17 10:53:44,3ladni,1,1,,transgender,A Light in the New Darkness,1442512424.0,"{'created_utc': 1442487224, 'id': '3ladni', 'num_comments': 1, 'score': 1, 'selftext': '', 'subreddit': 'transgender', 'title': 'A Light in the New Darkness', 'created': 1442512424.0}"
2015-09-17 11:10:48,3laf4j,3,18,,transgender,Pre-natal hormonal exposure affects ferrets' masculine/feminine tendencies.,1442513448.0,"{'created_utc': 1442488248, 'id': '3laf4j', 'num_comments': 3, 'score': 18, 'selftext': '', 'subreddit': 'transgender', 'title': ""Pre-natal hormonal exposure affects ferrets' masculine/feminine tendencies."", 'created': 1442513448.0}"
2015-09-17 17:33:05,3lbr6j,2,38,,transgender,Meet the rural Virginia teen who might change the lives of transgender youth around the country,1442536385.0,"{'created_utc': 1442511185, 'id': '3lbr6j', 'num_comments': 2, 'score': 38, 'selftext': '', 'subreddit': 'transgender', 'title': 'Meet the rural Virginia teen who might change the lives of transgender youth around the country', 'created': 1442536385.0}"
2015-09-17 19:50:27,3lcbcs,1,1,,transgender,Would it matter if Lila Perry was a trans man using a male locker room?,1442544627.0,"{'created_utc': 1442519427, 'id': '3lcbcs', 'num_comments': 1, 'score': 1, 'selftext': '', 'subreddit': 'transgender', 'title': 'Would it matter if Lila Perry was a trans man using a male locker room?', 'created': 1442544627.0}"
2015-09-17 20:24:45,3lcgrm,0,1,[deleted],transgender,Doritos Rainbows - Support It Gets Better!,1442546685.0,"{'created_utc': 1442521485, 'id': '3lcgrm', 'num_comments': 0, 'score': 1, 'selftext': '[deleted]', 'subreddit': 'transgender', 'title': 'Doritos Rainbows - Support It Gets Better!', 'created': 1442546685.0}"
2015-09-17 21:44:47,3lcsxt,9,0,,transgender,Would you like to see Transgender divisions in the UFC or any other organizations. Why or why not?,1442551487.0,"{'created_utc': 1442526287, 'id': '3lcsxt', 'num_comments': 9, 'score': 0, 'selftext': '', 'subreddit': 'transgender', 'title': 'Would you like to see Transgender divisions in the UFC or any other organizations. Why or why not?', 'created': 1442551487.0}"
2015-09-17 22:47:31,3ld1fe,0,1,,transgender,"""Binders and modification garments should be comfortable, effective, and as attractive as the people who wear them. Join us."" - Kansas City based lingerie boutique owner working with local based designers and seamstresses plans to open shop aimed at making modern modification garments",1442555251.0,"{'created_utc': 1442530051, 'id': '3ld1fe', 'num_comments': 0, 'score': 1, 'selftext': '', 'subreddit': 'transgender', 'title': '""Binders and modification garments should be comfortable, effective, and as attractive as the people who wear them. Join us."" - Kansas City based lingerie boutique owner working with local based designers and seamstresses plans to open shop aimed at making modern modification garments', 'created': 1442555251.0}"
2015-09-17 23:23:28,3ld5ur,2,1,,transgender,Transformation Magazine seeks representatives for International Issue,1442557408.0,"{'created_utc': 1442532208, 'id': '3ld5ur', 'num_comments': 2, 'score': 1, 'selftext': '', 'subreddit': 'transgender', 'title': 'Transformation Magazine seeks representatives for International Issue', 'created': 1442557408.0}"
2015-09-18 00:01:33,3ldauu,0,1,[deleted],transgender,With over 5 years as a Rural Fire-fighter I turned up to the station tonight to find the Captain has updated every thing with my new name. We are waiting for new name tags for my uniforms now.,1442559693.0,"{'created_utc': 1442534493, 'id': '3ldauu', 'num_comments': 0, 'score': 1, 'selftext': '[deleted]', 'subreddit': 'transgender', 'title': 'With over 5 years as a Rural Fire-fighter I turned up to the station tonight to find the Captain has updated every thing with my new name. We are waiting for new name tags for my uniforms now.', 'created': 1442559693.0}"
2015-09-18 00:57:26,3ldhmy,2,17,,transgender,Transwoman Denied Access to VA Hospitals,1442563046.0,"{'created_utc': 1442537846, 'id': '3ldhmy', 'num_comments': 2, 'score': 17, 'selftext': '', 'subreddit': 'transgender', 'title': 'Transwoman Denied Access to VA Hospitals', 'created': 1442563046.0}"
2015-09-18 04:15:57,3le4o7,15,5,,transgender,Oregon lawmaker wants to bar transgender teenagers from sex reassignment surgery without parents' permission,1442574957.0,"{'created_utc': 1442549757, 'id': '3le4o7', 'num_comments': 15, 'score': 5, 'selftext': '', 'subreddit': 'transgender', 'title': ""Oregon lawmaker wants to bar transgender teenagers from sex reassignment surgery without parents' permission"", 'created': 1442574957.0}"
2015-09-18 04:48:11,3le81x,1,4,,transgender,"""Breakfast on Pluto"": a 90s Trans Classic",1442576891.0,"{'created_utc': 1442551691, 'id': '3le81x', 'num_comments': 1, 'score': 4, 'selftext': '', 'subreddit': 'transgender', 'title': '""Breakfast on Pluto"": a 90s Trans Classic', 'created': 1442576891.0}"
2015-09-18 04:48:36,3le837,2,15,,transgender,New interview with Aydian Dowling,1442576916.0,"{'created_utc': 1442551716, 'id': '3le837', 'num_comments': 2, 'score': 15, 'selftext': '', 'subreddit': 'transgender', 'title': 'New interview with Aydian Dowling', 'created': 1442576916.0}"
2015-09-18 11:56:26,3lf7hm,2,10,,transgender,One in four people have a transgender work colleague – rising to 50% in India,1442602586.0,"{'created_utc': 1442577386, 'id': '3lf7hm', 'num_comments': 2, 'score': 10, 'selftext': '', 'subreddit': 'transgender', 'title': 'One in four people have a transgender work colleague – rising to 50% in India', 'created': 1442602586.0}"
2015-09-18 13:20:39,3lfh00,24,45,,transgender,U.S. Marine Testifies in Killing of Transgender Woman in Philippines,1442607639.0,"{'created_utc': 1442582439, 'id': '3lfh00', 'num_comments': 24, 'score': 45, 'selftext': '', 'subreddit': 'transgender', 'title': 'U.S. Marine Testifies in Killing of Transgender Woman in Philippines', 'created': 1442607639.0}"
2015-09-18 15:22:12,3lfxhi,0,3,,transgender,Damaging labels do transgender people a disservice,1442614932.0,"{'created_utc': 1442589732, 'id': '3lfxhi', 'num_comments': 0, 'score': 3, 'selftext': '', 'subreddit': 'transgender', 'title': 'Damaging labels do transgender people a disservice', 'created': 1442614932.0}"
2015-09-18 16:50:41,3lganb,0,1,[deleted],transgender,What It's Like For One Dad Whose Son Says: 'I Want To Become A Woman' Dr. Phil Show (triggery),1442620241.0,"{'created_utc': 1442595041, 'id': '3lganb', 'num_comments': 0, 'score': 1, 'selftext': '[deleted]', 'subreddit': 'transgender', 'title': ""What It's Like For One Dad Whose Son Says: 'I Want To Become A Woman' Dr. Phil Show (triggery)"", 'created': 1442620241.0}"
2015-09-18 16:53:53,3lgb38,5,0,,transgender,What It's Like For One Dad Whose Son Says: 'I Want To Become A Woman' Dr. Phil Show (videos: triggery),1442620433.0,"{'created_utc': 1442595233, 'id': '3lgb38', 'num_comments': 5, 'score': 0, 'selftext': '', 'subreddit': 'transgender', 'title': ""What It's Like For One Dad Whose Son Says: 'I Want To Become A Woman' Dr. Phil Show (videos: triggery)"", 'created': 1442620433.0}"
2015-09-18 17:02:00,3lgcbp,0,1,[deleted],transgender,You Tube Gold: April Ashley interview from the '70s. (Thames Television),1442620920.0,"{'created_utc': 1442595720, 'id': '3lgcbp', 'num_comments': 0, 'score': 1, 'selftext': '[deleted]', 'subreddit': 'transgender', 'title': ""You Tube Gold: April Ashley interview from the '70s. (Thames Television)"", 'created': 1442620920.0}"
2015-09-18 18:44:47,3lgrrr,1,1,,transgender,Transgender Support APP,1442627087.0,"{'created_utc': 1442601887, 'id': '3lgrrr', 'num_comments': 1, 'score': 1, 'selftext': '', 'subreddit': 'transgender', 'title': 'Transgender Support APP', 'created': 1442627087.0}"
2015-09-18 20:35:08,3lh7ih,2,6,,transgender,WOW!,1442633708.0,"{'created_utc': 1442608508, 'id': '3lh7ih', 'num_comments': 2, 'score': 6, 'selftext': '', 'subreddit': 'transgender', 'title': 'WOW!', 'created': 1442633708.0}"
2015-09-19 02:00:37,3lic82,0,1,[deleted],transgender,The war on Christian White Males.,1442653237.0,"{'created_utc': 1442628037, 'id': '3lic82', 'num_comments': 0, 'score': 1, 'selftext': '[deleted]', 'subreddit': 'transgender', 'title': 'The war on Christian White Males.', 'created': 1442653237.0}"
2015-09-19 02:40:32,3lighw,0,1,[deleted],transgender,"""Stunning and Beautiful""",1442655632.0,"{'created_utc': 1442630432, 'id': '3lighw', 'num_comments': 0, 'score': 1, 'selftext': '[deleted]', 'subreddit': 'transgender', 'title': '""Stunning and Beautiful""', 'created': 1442655632.0}"
2015-09-19 02:49:57,3lihg3,7,84,,transgender,Amanda Simpson becomes the highest ranking openly transgender official in the Obama administration,1442656197.0,"{'created_utc': 1442630997, 'id': '3lihg3', 'num_comments': 7, 'score': 84, 'selftext': '', 'subreddit': 'transgender', 'title': 'Amanda Simpson becomes the highest ranking openly transgender official in the Obama administration', 'created': 1442656197.0}"
2015-09-19 03:29:08,3lilmi,0,1,,transgender,10 Best Herbs for Female Hormone Balance,1442658548.0,"{'created_utc': 1442633348, 'id': '3lilmi', 'num_comments': 0, 'score': 1, 'selftext': '', 'subreddit': 'transgender', 'title': '10 Best Herbs for Female Hormone Balance', 'created': 1442658548.0}"
2015-09-19 14:25:26,3lk5mf,0,1,,transgender,Was bored and made this for he satanic people on here :P,1442697926.0,"{'created_utc': 1442672726, 'id': '3lk5mf', 'num_comments': 0, 'score': 1, 'selftext': '', 'subreddit': 'transgender', 'title': 'Was bored and made this for he satanic people on here :P', 'created': 1442697926.0}"
2015-09-19 16:08:35,3lkjbe,1,1,,transgender,The Big Edit,1442704115.0,"{'created_utc': 1442678915, 'id': '3lkjbe', 'num_comments': 1, 'score': 1, 'selftext': '', 'subreddit': 'transgender', 'title': 'The Big Edit', 'created': 1442704115.0}"
2015-09-19 16:24:51,3lkll9,20,58,,transgender,The New “Stonewall” Film Tramples On Trans History,1442705091.0,"{'created_utc': 1442679891, 'id': '3lkll9', 'num_comments': 20, 'score': 58, 'selftext': '', 'subreddit': 'transgender', 'title': 'The New “Stonewall” Film Tramples On Trans History', 'created': 1442705091.0}"
