created_utc,id,num_comments,score,selftext,subreddit,title,created,d_
2015-09-01 00:15:18,3j5jwt,4,20,,transgender,How To Find The RIGHT Therapist For You (And Make It Work!),1441091718.0,"{'created_utc': 1441066518, 'id': '3j5jwt', 'num_comments': 4, 'score': 20, 'selftext': '', 'subreddit': 'transgender', 'title': 'How To Find The RIGHT Therapist For You (And Make It Work!)', 'created': 1441091718.0}"
2015-09-01 01:46:18,3j5w8c,29,46,,transgender,"Hillsboro, Texas High School students stage walkout in dispute over transgender student",1441097178.0,"{'created_utc': 1441071978, 'id': '3j5w8c', 'num_comments': 29, 'score': 46, 'selftext': '', 'subreddit': 'transgender', 'title': 'Hillsboro, Texas High School students stage walkout in dispute over transgender student', 'created': 1441097178.0}"
2015-09-01 01:46:47,3j5wb6,0,1,,transgender,Transgender Teen Fashion Shoot - Behind the Scenes,1441097207.0,"{'created_utc': 1441072007, 'id': '3j5wb6', 'num_comments': 0, 'score': 1, 'selftext': '', 'subreddit': 'transgender', 'title': 'Transgender Teen Fashion Shoot - Behind the Scenes', 'created': 1441097207.0}"
2015-09-01 05:37:07,3j6nm1,0,1,,transgender,The Transgender Bathroom Dilemma,1441111027.0,"{'created_utc': 1441085827, 'id': '3j6nm1', 'num_comments': 0, 'score': 1, 'selftext': '', 'subreddit': 'transgender', 'title': 'The Transgender Bathroom Dilemma', 'created': 1441111027.0}"
2015-09-01 12:09:32,3j7lwl,1,1,,transgender,Transgender Children: Kitten for a Day,1441134572.0,"{'created_utc': 1441109372, 'id': '3j7lwl', 'num_comments': 1, 'score': 1, 'selftext': '', 'subreddit': 'transgender', 'title': 'Transgender Children: Kitten for a Day', 'created': 1441134572.0}"
2015-09-01 13:49:31,3j7wkx,127,83,,transgender,Trans student drops class after 200 protest for and against her,1441140571.0,"{'created_utc': 1441115371, 'id': '3j7wkx', 'num_comments': 127, 'score': 83, 'selftext': '', 'subreddit': 'transgender', 'title': 'Trans student drops class after 200 protest for and against her', 'created': 1441140571.0}"
2015-09-01 15:48:59,3j8d18,1,4,,transgender,Troy Ohio - Transgender Bathroom Policy,1441147739.0,"{'created_utc': 1441122539, 'id': '3j8d18', 'num_comments': 1, 'score': 4, 'selftext': '', 'subreddit': 'transgender', 'title': 'Troy Ohio - Transgender Bathroom Policy', 'created': 1441147739.0}"
2015-09-01 16:26:46,3j8iph,0,3,,transgender,"Interview: Ektomarch Releasing Trans-Positive Game Aerannis, Available September 15th",1441150006.0,"{'created_utc': 1441124806, 'id': '3j8iph', 'num_comments': 0, 'score': 3, 'selftext': '', 'subreddit': 'transgender', 'title': 'Interview: Ektomarch Releasing Trans-Positive Game Aerannis, Available September 15th', 'created': 1441150006.0}"
2015-09-01 16:57:21,3j8n9x,2,1,,transgender,East Side's Ground Floor Theatre Celebrates Austin's Diversity,1441151841.0,"{'created_utc': 1441126641, 'id': '3j8n9x', 'num_comments': 2, 'score': 1, 'selftext': '', 'subreddit': 'transgender', 'title': ""East Side's Ground Floor Theatre Celebrates Austin's Diversity"", 'created': 1441151841.0}"
2015-09-01 17:20:44,3j8qws,0,1,[deleted],transgender,The Danish Girl Official Trailer,1441153244.0,"{'created_utc': 1441128044, 'id': '3j8qws', 'num_comments': 0, 'score': 1, 'selftext': '[deleted]', 'subreddit': 'transgender', 'title': 'The Danish Girl Official Trailer', 'created': 1441153244.0}"
2015-09-01 17:25:24,3j8rn2,58,77,,transgender,"The First Trailer For ""The Danish Girl"" With Eddie Redmayne Is Incredibly Powerful",1441153524.0,"{'created_utc': 1441128324, 'id': '3j8rn2', 'num_comments': 58, 'score': 77, 'selftext': '', 'subreddit': 'transgender', 'title': 'The First Trailer For ""The Danish Girl"" With Eddie Redmayne Is Incredibly Powerful', 'created': 1441153524.0}"
2015-09-01 17:48:05,3j8v80,45,16,,transgender,VIDEO: First Look at Eddie Redmayne as Transgender Woman in ‘The Danish Girl’. What do you think?,1441154885.0,"{'created_utc': 1441129685, 'id': '3j8v80', 'num_comments': 45, 'score': 16, 'selftext': '', 'subreddit': 'transgender', 'title': 'VIDEO: First Look at Eddie Redmayne as Transgender Woman in ‘The Danish Girl’. What do you think?', 'created': 1441154885.0}"
2015-09-01 18:20:35,3j905d,1,1,,transgender,Transgender Stories - Trans Lives Matter - In Loving Memory of trans wom...,1441156835.0,"{'created_utc': 1441131635, 'id': '3j905d', 'num_comments': 1, 'score': 1, 'selftext': '', 'subreddit': 'transgender', 'title': 'Transgender Stories - Trans Lives Matter - In Loving Memory of trans wom...', 'created': 1441156835.0}"
2015-09-01 19:07:08,3j97dw,1,1,,transgender,Male to Female Transition Timeline Transgender Story 3 Years HRT MTF ...,1441159628.0,"{'created_utc': 1441134428, 'id': '3j97dw', 'num_comments': 1, 'score': 1, 'selftext': '', 'subreddit': 'transgender', 'title': 'Male to Female Transition Timeline Transgender Story 3 Years HRT MTF ...', 'created': 1441159628.0}"
2015-09-01 21:21:51,3j9slt,1,1,,transgender,Transgender stories - Emily's Transition (Wonders of Life by Julianna),1441167711.0,"{'created_utc': 1441142511, 'id': '3j9slt', 'num_comments': 1, 'score': 1, 'selftext': '', 'subreddit': 'transgender', 'title': ""Transgender stories - Emily's Transition (Wonders of Life by Julianna)"", 'created': 1441167711.0}"
2015-09-01 21:31:35,3j9u27,1,1,,transgender,Important reminder for where our priorities should be,1441168295.0,"{'created_utc': 1441143095, 'id': '3j9u27', 'num_comments': 1, 'score': 1, 'selftext': '', 'subreddit': 'transgender', 'title': 'Important reminder for where our priorities should be', 'created': 1441168295.0}"
2015-09-02 00:20:06,3jagfe,0,1,,transgender,The White House for the first time has hired an openly transgender person as a member of its staff,1441178406.0,"{'created_utc': 1441153206, 'id': '3jagfe', 'num_comments': 0, 'score': 1, 'selftext': '', 'subreddit': 'transgender', 'title': 'The White House for the first time has hired an openly transgender person as a member of its staff', 'created': 1441178406.0}"
2015-09-02 01:13:49,3janmv,0,0,[deleted],transgender,Georgia parole board releases transgender inmate who sued,1441181629.0,"{'created_utc': 1441156429, 'id': '3janmv', 'num_comments': 0, 'score': 0, 'selftext': '[deleted]', 'subreddit': 'transgender', 'title': 'Georgia parole board releases transgender inmate who sued', 'created': 1441181629.0}"
2015-09-02 01:30:16,3japw7,0,1,,transgender,Big Changes in the Metro Trans Umbrella Group,1441182616.0,"{'created_utc': 1441157416, 'id': '3japw7', 'num_comments': 0, 'score': 1, 'selftext': '', 'subreddit': 'transgender', 'title': 'Big Changes in the Metro Trans Umbrella Group', 'created': 1441182616.0}"
2015-09-02 02:06:22,3jaus6,2,1,,transgender,The Women of San Quentin -- The Soul Murder of Transgender Women in Male Prisons,1441184782.0,"{'created_utc': 1441159582, 'id': '3jaus6', 'num_comments': 2, 'score': 1, 'selftext': '', 'subreddit': 'transgender', 'title': 'The Women of San Quentin -- The Soul Murder of Transgender Women in Male Prisons', 'created': 1441184782.0}"
2015-09-02 02:47:59,3jb07p,1,1,,transgender,Transgender stories - Emily's platform 'Trans Lives Matter',1441187279.0,"{'created_utc': 1441162079, 'id': '3jb07p', 'num_comments': 1, 'score': 1, 'selftext': '', 'subreddit': 'transgender', 'title': ""Transgender stories - Emily's platform 'Trans Lives Matter'"", 'created': 1441187279.0}"
2015-09-02 09:01:18,3jc1y3,0,0,[deleted],transgender,Transgender teen sparks protests and walkout at Missouri high school after using girls' locker room,1441209678.0,"{'created_utc': 1441184478, 'id': '3jc1y3', 'num_comments': 0, 'score': 0, 'selftext': '[deleted]', 'subreddit': 'transgender', 'title': ""Transgender teen sparks protests and walkout at Missouri high school after using girls' locker room"", 'created': 1441209678.0}"
2015-09-02 09:04:22,3jc27k,1,1,,transgender,You want seex! I am Madison I want seex! Please! Help me!,1441209862.0,"{'created_utc': 1441184662, 'id': '3jc27k', 'num_comments': 1, 'score': 1, 'selftext': '', 'subreddit': 'transgender', 'title': 'You want seex! I am Madison I want seex! Please! Help me!', 'created': 1441209862.0}"
2015-09-02 14:14:21,3jcyry,0,25,,transgender,From Showgirl to CEO: Trans Businesswoman Angelica Ross Tells All,1441228461.0,"{'created_utc': 1441203261, 'id': '3jcyry', 'num_comments': 0, 'score': 25, 'selftext': '', 'subreddit': 'transgender', 'title': 'From Showgirl to CEO: Trans Businesswoman Angelica Ross Tells All', 'created': 1441228461.0}"
2015-09-02 16:47:29,3jdl6b,0,1,,transgender,Two trans topics on Facebook news feed today.,1441237649.0,"{'created_utc': 1441212449, 'id': '3jdl6b', 'num_comments': 0, 'score': 1, 'selftext': '', 'subreddit': 'transgender', 'title': 'Two trans topics on Facebook news feed today.', 'created': 1441237649.0}"
2015-09-02 17:56:35,3jdvv5,25,0,,transgender,Samus Aran...Transgender?,1441241795.0,"{'created_utc': 1441216595, 'id': '3jdvv5', 'num_comments': 25, 'score': 0, 'selftext': '', 'subreddit': 'transgender', 'title': 'Samus Aran...Transgender?', 'created': 1441241795.0}"
2015-09-02 18:42:27,3je2x4,11,20,,transgender,"I am neither Mr, Mrs nor Ms but Mx",1441244547.0,"{'created_utc': 1441219347, 'id': '3je2x4', 'num_comments': 11, 'score': 20, 'selftext': '', 'subreddit': 'transgender', 'title': 'I am neither Mr, Mrs nor Ms but Mx', 'created': 1441244547.0}"
2015-09-02 20:31:34,3jeit0,0,1,,transgender,"Identity: In &amp; Beyond The Binary. features trans, genderqueer, butch and queer people interviewed on their varied experiences with gender identity",1441251094.0,"{'created_utc': 1441225894, 'id': '3jeit0', 'num_comments': 0, 'score': 1, 'selftext': '', 'subreddit': 'transgender', 'title': 'Identity: In &amp; Beyond The Binary. features trans, genderqueer, butch and queer people interviewed on their varied experiences with gender identity', 'created': 1441251094.0}"
2015-09-02 21:00:11,3jen0f,0,21,,transgender,"In 1982, Camelot 3000 Broke Barriers with Its Portrayal of a Trans Character",1441252811.0,"{'created_utc': 1441227611, 'id': '3jen0f', 'num_comments': 0, 'score': 21, 'selftext': '', 'subreddit': 'transgender', 'title': 'In 1982, Camelot 3000 Broke Barriers with Its Portrayal of a Trans Character', 'created': 1441252811.0}"
2015-09-02 22:57:15,3jf41d,0,1,,transgender,Gender Analysis 10. Paul McHugh is wrong: transitioning is effective,1441259835.0,"{'created_utc': 1441234635, 'id': '3jf41d', 'num_comments': 0, 'score': 1, 'selftext': '', 'subreddit': 'transgender', 'title': 'Gender Analysis 10. Paul McHugh is wrong: transitioning is effective', 'created': 1441259835.0}"
2015-09-03 01:11:28,3jfm4j,1,1,,transgender,U need seex? I am Molly I need seex! Please! Help me! 6411,1441267888.0,"{'created_utc': 1441242688, 'id': '3jfm4j', 'num_comments': 1, 'score': 1, 'selftext': '', 'subreddit': 'transgender', 'title': 'U need seex? I am Molly I need seex! Please! Help me! 6411', 'created': 1441267888.0}"
2015-09-03 01:16:38,3jfmwf,11,3,,transgender,"A follow up to the Samus article I posted: Decent read, now with 70% less clickbait!",1441268198.0,"{'created_utc': 1441242998, 'id': '3jfmwf', 'num_comments': 11, 'score': 3, 'selftext': '', 'subreddit': 'transgender', 'title': 'A follow up to the Samus article I posted: Decent read, now with 70% less clickbait!', 'created': 1441268198.0}"
2015-09-03 02:11:29,3jftll,21,46,,transgender,"Transgender Catholics Can't Be Godparents, Vatican Says",1441271489.0,"{'created_utc': 1441246289, 'id': '3jftll', 'num_comments': 21, 'score': 46, 'selftext': '', 'subreddit': 'transgender', 'title': ""Transgender Catholics Can't Be Godparents, Vatican Says"", 'created': 1441271489.0}"
2015-09-03 04:09:04,3jg76a,11,63,,transgender,A Pennsylvania judge on Wednesday rejected an effort by the parents of a 48-year-old transgender woman to block her gender reassignment surgery after they said she is incompetent.,1441278544.0,"{'created_utc': 1441253344, 'id': '3jg76a', 'num_comments': 11, 'score': 63, 'selftext': '', 'subreddit': 'transgender', 'title': 'A Pennsylvania judge on Wednesday rejected an effort by the parents of a 48-year-old transgender woman to block her gender reassignment surgery after they said she is incompetent.', 'created': 1441278544.0}"
2015-09-03 10:59:26,3jh36i,33,10,,transgender,Caitlyn Jenner Halloween costume causes social media outrage: “It’s disgusting”,1441303166.0,"{'created_utc': 1441277966, 'id': '3jh36i', 'num_comments': 33, 'score': 10, 'selftext': '', 'subreddit': 'transgender', 'title': 'Caitlyn Jenner Halloween costume causes social media outrage: “It’s disgusting”', 'created': 1441303166.0}"
2015-09-03 11:22:21,3jh5cf,0,1,,transgender,Missouri Courage Scholarship Announces Trans Courage Award,1441304541.0,"{'created_utc': 1441279341, 'id': '3jh5cf', 'num_comments': 0, 'score': 1, 'selftext': '', 'subreddit': 'transgender', 'title': 'Missouri Courage Scholarship Announces Trans Courage Award', 'created': 1441304541.0}"
2015-09-03 16:56:56,3jib7b,0,0,,transgender,Hard hitting parody of the autogynephilia theory,1441324616.0,"{'created_utc': 1441299416, 'id': '3jib7b', 'num_comments': 0, 'score': 0, 'selftext': '', 'subreddit': 'transgender', 'title': 'Hard hitting parody of the autogynephilia theory', 'created': 1441324616.0}"
2015-09-03 17:22:27,3jif0c,0,5,,transgender,Who Gets to Play the Transgender Part?,1441326147.0,"{'created_utc': 1441300947, 'id': '3jif0c', 'num_comments': 0, 'score': 5, 'selftext': '', 'subreddit': 'transgender', 'title': 'Who Gets to Play the Transgender Part?', 'created': 1441326147.0}"
2015-09-03 17:33:18,3jiglj,13,58,,transgender,New Rules Bar Transgender Discrimination In Health Care,1441326798.0,"{'created_utc': 1441301598, 'id': '3jiglj', 'num_comments': 13, 'score': 58, 'selftext': '', 'subreddit': 'transgender', 'title': 'New Rules Bar Transgender Discrimination In Health Care', 'created': 1441326798.0}"
2015-09-03 17:46:42,3jiil7,12,83,,transgender,How psychiatrist Paul McHugh used a deeply flawed study to spread an anti-trans hoax for decades,1441327602.0,"{'created_utc': 1441302402, 'id': '3jiil7', 'num_comments': 12, 'score': 83, 'selftext': '', 'subreddit': 'transgender', 'title': 'How psychiatrist Paul McHugh used a deeply flawed study to spread an anti-trans hoax for decades', 'created': 1441327602.0}"
2015-09-03 18:14:26,3jimse,9,30,,transgender,Terrifying new Windows 10 feature could ‘out’ kids to their parents,1441329266.0,"{'created_utc': 1441304066, 'id': '3jimse', 'num_comments': 9, 'score': 30, 'selftext': '', 'subreddit': 'transgender', 'title': 'Terrifying new Windows 10 feature could ‘out’ kids to their parents', 'created': 1441329266.0}"
2015-09-03 19:20:45,3jiwah,0,1,[deleted],transgender,U.S. government to extend healthcare nondiscrimination law to transgender people,1441333245.0,"{'created_utc': 1441308045, 'id': '3jiwah', 'num_comments': 0, 'score': 1, 'selftext': '[deleted]', 'subreddit': 'transgender', 'title': 'U.S. government to extend healthcare nondiscrimination law to transgender people', 'created': 1441333245.0}"
2015-09-03 20:48:45,3jj97w,13,95,,transgender,Amazing news! New proposed rule requiring health insurance to cover transition-related care,1441338525.0,"{'created_utc': 1441313325, 'id': '3jj97w', 'num_comments': 13, 'score': 95, 'selftext': '', 'subreddit': 'transgender', 'title': 'Amazing news! New proposed rule requiring health insurance to cover transition-related care', 'created': 1441338525.0}"
2015-09-03 22:12:20,3jjl5d,1,1,[deleted],transgender,I need photos of transgender people for a calendar! Proceeds will go to a trans benefitting charity.,1441343540.0,"{'created_utc': 1441318340, 'id': '3jjl5d', 'num_comments': 1, 'score': 1, 'selftext': '[deleted]', 'subreddit': 'transgender', 'title': 'I need photos of transgender people for a calendar! Proceeds will go to a trans benefitting charity.', 'created': 1441343540.0}"
2015-09-03 23:14:26,3jjtls,1,1,,transgender,Freedom won't be free until we eradicate hatred and bigotry. Gender is more than genitalia.,1441347266.0,"{'created_utc': 1441322066, 'id': '3jjtls', 'num_comments': 1, 'score': 1, 'selftext': '', 'subreddit': 'transgender', 'title': ""Freedom won't be free until we eradicate hatred and bigotry. Gender is more than genitalia."", 'created': 1441347266.0}"
2015-09-04 00:50:41,3jk5p4,0,1,,transgender,travesti adana |adana travesti üyeleri bu blogta bulabilirsiniz... çok fazla travesti yok ama size yeter,1441353041.0,"{'created_utc': 1441327841, 'id': '3jk5p4', 'num_comments': 0, 'score': 1, 'selftext': '', 'subreddit': 'transgender', 'title': 'travesti adana |adana travesti üyeleri bu blogta bulabilirsiniz... çok fazla travesti yok ama size yeter', 'created': 1441353041.0}"
2015-09-04 01:21:24,3jk9s4,0,0,[deleted],transgender,How to approach transgendered identified people respectfully,1441354884.0,"{'created_utc': 1441329684, 'id': '3jk9s4', 'num_comments': 0, 'score': 0, 'selftext': '[deleted]', 'subreddit': 'transgender', 'title': 'How to approach transgendered identified people respectfully', 'created': 1441354884.0}"
2015-09-04 01:28:04,3jkamu,0,1,,transgender,Target Toy Department #IAintShit but... (Transgender Agenda),1441355284.0,"{'created_utc': 1441330084, 'id': '3jkamu', 'num_comments': 0, 'score': 1, 'selftext': '', 'subreddit': 'transgender', 'title': 'Target Toy Department #IAintShit but... (Transgender Agenda)', 'created': 1441355284.0}"
2015-09-04 01:44:55,3jkcll,3,1,,transgender,PSA: You can get a 2 year passport (US) while transitioning,1441356295.0,"{'created_utc': 1441331095, 'id': '3jkcll', 'num_comments': 3, 'score': 1, 'selftext': '', 'subreddit': 'transgender', 'title': 'PSA: You can get a 2 year passport (US) while transitioning', 'created': 1441356295.0}"
2015-09-04 02:37:26,3jkj8r,0,0,,transgender,Who Gets to Play the Transgender Part?,1441359446.0,"{'created_utc': 1441334246, 'id': '3jkj8r', 'num_comments': 0, 'score': 0, 'selftext': '', 'subreddit': 'transgender', 'title': 'Who Gets to Play the Transgender Part?', 'created': 1441359446.0}"
2015-09-04 03:58:58,3jkskc,0,3,,transgender,U.S. court: Transgender illegal immigrant cannot be deported to Mexico,1441364338.0,"{'created_utc': 1441339138, 'id': '3jkskc', 'num_comments': 0, 'score': 3, 'selftext': '', 'subreddit': 'transgender', 'title': 'U.S. court: Transgender illegal immigrant cannot be deported to Mexico', 'created': 1441364338.0}"
2015-09-04 04:23:35,3jkv4x,0,1,[deleted],transgender,"I'm SO excited for this movie. The Danish Girl, played by Eddie Redmayne (Theory of Everything actor)",1441365815.0,"{'created_utc': 1441340615, 'id': '3jkv4x', 'num_comments': 0, 'score': 1, 'selftext': '[deleted]', 'subreddit': 'transgender', 'title': ""I'm SO excited for this movie. The Danish Girl, played by Eddie Redmayne (Theory of Everything actor)"", 'created': 1441365815.0}"
2015-09-04 04:53:47,3jky57,0,1,,transgender,"Being Laxmi: 'I belong to the hijra, the oldest transgender community'",1441367627.0,"{'created_utc': 1441342427, 'id': '3jky57', 'num_comments': 0, 'score': 1, 'selftext': '', 'subreddit': 'transgender', 'title': ""Being Laxmi: 'I belong to the hijra, the oldest transgender community'"", 'created': 1441367627.0}"
2015-09-04 06:11:07,3jl56h,2,18,,transgender,An excellent transgender character on Mr. Robot [spoilers],1441372267.0,"{'created_utc': 1441347067, 'id': '3jl56h', 'num_comments': 2, 'score': 18, 'selftext': '', 'subreddit': 'transgender', 'title': 'An excellent transgender character on Mr. Robot [spoilers]', 'created': 1441372267.0}"
2015-09-04 08:35:49,3jlg7r,0,1,[deleted],transgender,Harvard allows students to register with gender neutral pronouns,1441380949.0,"{'created_utc': 1441355749, 'id': '3jlg7r', 'num_comments': 0, 'score': 1, 'selftext': '[deleted]', 'subreddit': 'transgender', 'title': 'Harvard allows students to register with gender neutral pronouns', 'created': 1441380949.0}"
2015-09-04 13:55:14,3jmb62,52,0,,transgender,Reaction to Idea of Samus Being Transgender Shows How Transphobic Gaming Really Is,1441400114.0,"{'created_utc': 1441374914, 'id': '3jmb62', 'num_comments': 52, 'score': 0, 'selftext': '', 'subreddit': 'transgender', 'title': 'Reaction to Idea of Samus Being Transgender Shows How Transphobic Gaming Really Is', 'created': 1441400114.0}"
2015-09-04 15:08:08,3jmkse,1,12,,transgender,"Angelica Ross, CEO of TransTech, addresses misrepresentation on 'I Am Cait'",1441404488.0,"{'created_utc': 1441379288, 'id': '3jmkse', 'num_comments': 1, 'score': 12, 'selftext': '', 'subreddit': 'transgender', 'title': ""Angelica Ross, CEO of TransTech, addresses misrepresentation on 'I Am Cait'"", 'created': 1441404488.0}"
2015-09-04 15:56:25,3jms3x,18,60,,transgender,California School to Add Gender-Neutral Bathrooms,1441407385.0,"{'created_utc': 1441382185, 'id': '3jms3x', 'num_comments': 18, 'score': 60, 'selftext': '', 'subreddit': 'transgender', 'title': 'California School to Add Gender-Neutral Bathrooms', 'created': 1441407385.0}"
2015-09-04 17:32:41,3jn7jn,0,1,[deleted],transgender,Elegant transgender middlewear Kickstarter!,1441413161.0,"{'created_utc': 1441387961, 'id': '3jn7jn', 'num_comments': 0, 'score': 1, 'selftext': '[deleted]', 'subreddit': 'transgender', 'title': 'Elegant transgender middlewear Kickstarter!', 'created': 1441413161.0}"
2015-09-04 18:04:48,3jnc5o,2,28,,transgender,Trans Man Sues NYPD For Discrimination After Alleged Hate Crime,1441415088.0,"{'created_utc': 1441389888, 'id': '3jnc5o', 'num_comments': 2, 'score': 28, 'selftext': '', 'subreddit': 'transgender', 'title': 'Trans Man Sues NYPD For Discrimination After Alleged Hate Crime', 'created': 1441415088.0}"
2015-09-04 18:54:04,3jnja4,0,14,,transgender,Video: Faces of Transgender Teen America Speak to Themselves Ten Years From Now.,1441418044.0,"{'created_utc': 1441392844, 'id': '3jnja4', 'num_comments': 0, 'score': 14, 'selftext': '', 'subreddit': 'transgender', 'title': 'Video: Faces of Transgender Teen America Speak to Themselves Ten Years From Now.', 'created': 1441418044.0}"
2015-09-04 19:42:42,3jnpxa,16,10,,transgender,"In this new interview, Julie Bindel condemns groups which are 'pro-trans, pro-sex work, and pro- other anti-women nonsense'",1441420962.0,"{'created_utc': 1441395762, 'id': '3jnpxa', 'num_comments': 16, 'score': 10, 'selftext': '', 'subreddit': 'transgender', 'title': ""In this new interview, Julie Bindel condemns groups which are 'pro-trans, pro-sex work, and pro- other anti-women nonsense'"", 'created': 1441420962.0}"
2015-09-05 00:27:29,3jorlr,8,10,,transgender,I created a subreddit about Hormone replacement therapy,1441438049.0,"{'created_utc': 1441412849, 'id': '3jorlr', 'num_comments': 8, 'score': 10, 'selftext': '', 'subreddit': 'transgender', 'title': 'I created a subreddit about Hormone replacement therapy', 'created': 1441438049.0}"
2015-09-05 01:57:06,3jp1bj,0,10,,transgender,Sixteen months into the reset of my life,1441443426.0,"{'created_utc': 1441418226, 'id': '3jp1bj', 'num_comments': 0, 'score': 10, 'selftext': '', 'subreddit': 'transgender', 'title': 'Sixteen months into the reset of my life', 'created': 1441443426.0}"
2015-09-05 04:19:14,3jphcp,1,1,,transgender,Transgender stories - Emily's 2 minute M to F transition video,1441451954.0,"{'created_utc': 1441426754, 'id': '3jphcp', 'num_comments': 1, 'score': 1, 'selftext': '', 'subreddit': 'transgender', 'title': ""Transgender stories - Emily's 2 minute M to F transition video"", 'created': 1441451954.0}"
2015-09-05 05:15:56,3jpmrn,1,1,,transgender,Transgender stories - Emily of T-Girl Angel's M to F transition,1441455356.0,"{'created_utc': 1441430156, 'id': '3jpmrn', 'num_comments': 1, 'score': 1, 'selftext': '', 'subreddit': 'transgender', 'title': ""Transgender stories - Emily of T-Girl Angel's M to F transition"", 'created': 1441455356.0}"
2015-09-05 06:05:48,3jprab,0,2,,transgender,"Crossing Over - Born in El Paso, She Made Herself in Juárez",1441458348.0,"{'created_utc': 1441433148, 'id': '3jprab', 'num_comments': 0, 'score': 2, 'selftext': '', 'subreddit': 'transgender', 'title': 'Crossing Over - Born in El Paso, She Made Herself in Juárez', 'created': 1441458348.0}"
2015-09-05 06:41:30,3jpu5v,7,1,,transgender,Is this pharmacy legitimate?,1441460490.0,"{'created_utc': 1441435290, 'id': '3jpu5v', 'num_comments': 7, 'score': 1, 'selftext': '', 'subreddit': 'transgender', 'title': 'Is this pharmacy legitimate?', 'created': 1441460490.0}"
2015-09-05 12:23:32,3jqjc2,7,46,,transgender,"Court: Trans Asylum Seeker is not the same as gay, She may stay",1441481012.0,"{'created_utc': 1441455812, 'id': '3jqjc2', 'num_comments': 7, 'score': 46, 'selftext': '', 'subreddit': 'transgender', 'title': 'Court: Trans Asylum Seeker is not the same as gay, She may stay', 'created': 1441481012.0}"
2015-09-05 15:16:50,3jr26k,0,1,,transgender,New youtube channel where I combine talking about trans stuff in my life with games.,1441491410.0,"{'created_utc': 1441466210, 'id': '3jr26k', 'num_comments': 0, 'score': 1, 'selftext': '', 'subreddit': 'transgender', 'title': 'New youtube channel where I combine talking about trans stuff in my life with games.', 'created': 1441491410.0}"
2015-09-05 17:40:04,3jrkpv,0,11,,transgender,"""The story of New Zealand's first sex change""",1441500004.0,"{'created_utc': 1441474804, 'id': '3jrkpv', 'num_comments': 0, 'score': 11, 'selftext': '', 'subreddit': 'transgender', 'title': '""The story of New Zealand\'s first sex change""', 'created': 1441500004.0}"
2015-09-05 22:04:16,3jsjf8,1,1,,transgender,Transgender stories - Emily's Transition (Emily's drum song),1441515856.0,"{'created_utc': 1441490656, 'id': '3jsjf8', 'num_comments': 1, 'score': 1, 'selftext': '', 'subreddit': 'transgender', 'title': ""Transgender stories - Emily's Transition (Emily's drum song)"", 'created': 1441515856.0}"
