created_utc,id,num_comments,score,selftext,subreddit,title,created,d_
2015-09-19 21:58:24,3llw3k,5,27,,transgender,Military Officials Will Force Chelsea Manning to Follow Male Grooming Standards,1442725104.0,"{'created_utc': 1442699904, 'id': '3llw3k', 'num_comments': 5, 'score': 27, 'selftext': '', 'subreddit': 'transgender', 'title': 'Military Officials Will Force Chelsea Manning to Follow Male Grooming Standards', 'created': 1442725104.0}"
2015-09-19 23:43:59,3lm9o7,1,1,,transgender,(x-post from r/ainbow) Awesome trans inclusive campaign,1442731439.0,"{'created_utc': 1442706239, 'id': '3lm9o7', 'num_comments': 1, 'score': 1, 'selftext': '', 'subreddit': 'transgender', 'title': '(x-post from r/ainbow) Awesome trans inclusive campaign', 'created': 1442731439.0}"
2015-09-20 00:05:47,3lmcd1,21,56,,transgender,The 3 Types Of People You Meet As A Trans Person On OKCupid,1442732747.0,"{'created_utc': 1442707547, 'id': '3lmcd1', 'num_comments': 21, 'score': 56, 'selftext': '', 'subreddit': 'transgender', 'title': 'The 3 Types Of People You Meet As A Trans Person On OKCupid', 'created': 1442732747.0}"
2015-09-20 16:07:04,3loqll,2,7,,transgender,HRT Progress post and a little of my story - 41 years young midwest transwoman,1442790424.0,"{'created_utc': 1442765224, 'id': '3loqll', 'num_comments': 2, 'score': 7, 'selftext': '', 'subreddit': 'transgender', 'title': 'HRT Progress post and a little of my story - 41 years young midwest transwoman', 'created': 1442790424.0}"
2015-09-20 19:50:02,3lpnji,0,1,,transgender,How Did You Know You Were Transgender?,1442803802.0,"{'created_utc': 1442778602, 'id': '3lpnji', 'num_comments': 0, 'score': 1, 'selftext': '', 'subreddit': 'transgender', 'title': 'How Did You Know You Were Transgender?', 'created': 1442803802.0}"
2015-09-21 00:31:12,3lqr0y,1,4,,transgender,Growing up transgender in Texas,1442820672.0,"{'created_utc': 1442795472, 'id': '3lqr0y', 'num_comments': 1, 'score': 4, 'selftext': '', 'subreddit': 'transgender', 'title': 'Growing up transgender in Texas', 'created': 1442820672.0}"
2015-09-21 03:38:58,3lrerz,23,149,,transgender,What Happened When I Revealed to Men on Tinder That I'm a Transgender Woman,1442831938.0,"{'created_utc': 1442806738, 'id': '3lrerz', 'num_comments': 23, 'score': 149, 'selftext': '', 'subreddit': 'transgender', 'title': ""What Happened When I Revealed to Men on Tinder That I'm a Transgender Woman"", 'created': 1442831938.0}"
2015-09-21 10:50:09,3lsgtm,0,18,,transgender,India left far behind: Nepal's new LGBT non-discrimination laws put even the liberal West to shame,1442857809.0,"{'created_utc': 1442832609, 'id': '3lsgtm', 'num_comments': 0, 'score': 18, 'selftext': '', 'subreddit': 'transgender', 'title': ""India left far behind: Nepal's new LGBT non-discrimination laws put even the liberal West to shame"", 'created': 1442857809.0}"
2015-09-21 10:50:29,3lsgux,7,27,,transgender,The astonishing village where little girls turn into boys aged 12,1442857829.0,"{'created_utc': 1442832629, 'id': '3lsgux', 'num_comments': 7, 'score': 27, 'selftext': '', 'subreddit': 'transgender', 'title': 'The astonishing village where little girls turn into boys aged 12', 'created': 1442857829.0}"
2015-09-21 12:12:08,3lsodx,0,3,,transgender,Apparently there are boys born looking like girls and only grow their penis when they hit puberty.,1442862728.0,"{'created_utc': 1442837528, 'id': '3lsodx', 'num_comments': 0, 'score': 3, 'selftext': '', 'subreddit': 'transgender', 'title': 'Apparently there are boys born looking like girls and only grow their penis when they hit puberty.', 'created': 1442862728.0}"
2015-09-21 18:24:15,3lu2u6,1,0,,transgender,"Not specifically trans related, but I loved this quote from Doctor Who this past Saturday.",1442885055.0,"{'created_utc': 1442859855, 'id': '3lu2u6', 'num_comments': 1, 'score': 0, 'selftext': '', 'subreddit': 'transgender', 'title': 'Not specifically trans related, but I loved this quote from Doctor Who this past Saturday.', 'created': 1442885055.0}"
2015-09-21 20:09:54,3luiq9,0,1,,transgender,Conchita Wurst Boyfriend,1442891394.0,"{'created_utc': 1442866194, 'id': '3luiq9', 'num_comments': 0, 'score': 1, 'selftext': '', 'subreddit': 'transgender', 'title': 'Conchita Wurst Boyfriend', 'created': 1442891394.0}"
2015-09-21 20:10:06,3luir5,11,53,,transgender,Transgender waitress's post about family eating in her restaurant goes viral,1442891406.0,"{'created_utc': 1442866206, 'id': '3luir5', 'num_comments': 11, 'score': 53, 'selftext': '', 'subreddit': 'transgender', 'title': ""Transgender waitress's post about family eating in her restaurant goes viral"", 'created': 1442891406.0}"
2015-09-21 20:12:22,3luj3g,2,40,,transgender,Trans-Affirmative Action for Jobs Passes Unanimously in Argentina,1442891542.0,"{'created_utc': 1442866342, 'id': '3luj3g', 'num_comments': 2, 'score': 40, 'selftext': '', 'subreddit': 'transgender', 'title': 'Trans-Affirmative Action for Jobs Passes Unanimously in Argentina', 'created': 1442891542.0}"
2015-09-21 20:14:39,3lujgj,1,2,,transgender,A Pictorial Look Inside the Trans Community of Peru,1442891679.0,"{'created_utc': 1442866479, 'id': '3lujgj', 'num_comments': 1, 'score': 2, 'selftext': '', 'subreddit': 'transgender', 'title': 'A Pictorial Look Inside the Trans Community of Peru', 'created': 1442891679.0}"
2015-09-21 21:28:42,3luuk3,1,1,,transgender,Finding Doctor Right,1442896122.0,"{'created_utc': 1442870922, 'id': '3luuk3', 'num_comments': 1, 'score': 1, 'selftext': '', 'subreddit': 'transgender', 'title': 'Finding Doctor Right', 'created': 1442896122.0}"
2015-09-21 21:34:18,3luvf2,0,27,,transgender,Sex Reassignment Is Latest Company Benefit in Equality Push,1442896458.0,"{'created_utc': 1442871258, 'id': '3luvf2', 'num_comments': 0, 'score': 27, 'selftext': '', 'subreddit': 'transgender', 'title': 'Sex Reassignment Is Latest Company Benefit in Equality Push', 'created': 1442896458.0}"
2015-09-21 22:36:12,3lv490,13,25,[deleted],transgender,Shadi Petosky held by TSA for being trans,1442900172.0,"{'created_utc': 1442874972, 'id': '3lv490', 'num_comments': 13, 'score': 25, 'selftext': '[deleted]', 'subreddit': 'transgender', 'title': 'Shadi Petosky held by TSA for being trans', 'created': 1442900172.0}"
2015-09-22 04:34:28,3lwddh,42,128,,transgender,Transgender woman live-tweets her expulsion from Orlando airport,1442921668.0,"{'created_utc': 1442896468, 'id': '3lwddh', 'num_comments': 42, 'score': 128, 'selftext': '', 'subreddit': 'transgender', 'title': 'Transgender woman live-tweets her expulsion from Orlando airport', 'created': 1442921668.0}"
2015-09-22 06:20:46,3lwn22,0,1,,transgender,CM Plastic Surgery - Cosmetic Surgeons,1442928046.0,"{'created_utc': 1442902846, 'id': '3lwn22', 'num_comments': 0, 'score': 1, 'selftext': '', 'subreddit': 'transgender', 'title': 'CM Plastic Surgery - Cosmetic Surgeons', 'created': 1442928046.0}"
2015-09-22 17:18:18,3lyit5,0,10,,transgender,"Trans poets, game designers, &amp; botmakers on book tour of US Northeast in October",1442967498.0,"{'created_utc': 1442942298, 'id': '3lyit5', 'num_comments': 0, 'score': 10, 'selftext': '', 'subreddit': 'transgender', 'title': 'Trans poets, game designers, &amp; botmakers on book tour of US Northeast in October', 'created': 1442967498.0}"
2015-09-23 01:57:44,3m0j6w,4,18,,transgender,"Meet Gender neutral Generation Z-- ""Gender neutrality is also a significant fashion trend amongst members of Generation Z.""",1442998664.0,"{'created_utc': 1442973464, 'id': '3m0j6w', 'num_comments': 4, 'score': 18, 'selftext': '', 'subreddit': 'transgender', 'title': 'Meet Gender neutral Generation Z-- ""Gender neutrality is also a significant fashion trend amongst members of Generation Z.""', 'created': 1442998664.0}"
2015-09-23 06:20:19,3m1avt,0,8,,transgender,"""The story of New Zealand's first sex change""",1443014419.0,"{'created_utc': 1442989219, 'id': '3m1avt', 'num_comments': 0, 'score': 8, 'selftext': '', 'subreddit': 'transgender', 'title': '""The story of New Zealand\'s first sex change""', 'created': 1443014419.0}"
2015-09-23 09:09:12,3m1nik,2,5,,transgender,12 Essential Books on Transgender,1443024552.0,"{'created_utc': 1442999352, 'id': '3m1nik', 'num_comments': 2, 'score': 5, 'selftext': '', 'subreddit': 'transgender', 'title': '12 Essential Books on Transgender', 'created': 1443024552.0}"
2015-09-23 15:36:55,3m2slp,3,60,,transgender,India court gives police protection to US transgender man,1443047815.0,"{'created_utc': 1443022615, 'id': '3m2slp', 'num_comments': 3, 'score': 60, 'selftext': '', 'subreddit': 'transgender', 'title': 'India court gives police protection to US transgender man', 'created': 1443047815.0}"
2015-09-23 17:17:17,3m37fz,2,0,,transgender,Kudos to these parents. Lets be real. It's still tough out there for the Trans community.,1443053837.0,"{'created_utc': 1443028637, 'id': '3m37fz', 'num_comments': 2, 'score': 0, 'selftext': '', 'subreddit': 'transgender', 'title': ""Kudos to these parents. Lets be real. It's still tough out there for the Trans community."", 'created': 1443053837.0}"
2015-09-23 17:42:32,3m3bg1,0,1,,transgender,"An interview with podcaster Chemda, her transgender husband Hennessy, and Lux Alptraum, who is making a comedy short about ""second puberty""",1443055352.0,"{'created_utc': 1443030152, 'id': '3m3bg1', 'num_comments': 0, 'score': 1, 'selftext': '', 'subreddit': 'transgender', 'title': 'An interview with podcaster Chemda, her transgender husband Hennessy, and Lux Alptraum, who is making a comedy short about ""second puberty""', 'created': 1443055352.0}"
2015-09-23 19:51:34,3m3v4f,2,18,,transgender,"""Being transgender isn’t a disorder"" - Friend of mine wrote this article and I wanted to share it here!",1443063094.0,"{'created_utc': 1443037894, 'id': '3m3v4f', 'num_comments': 2, 'score': 18, 'selftext': '', 'subreddit': 'transgender', 'title': '""Being transgender isn’t a disorder"" - Friend of mine wrote this article and I wanted to share it here!', 'created': 1443063094.0}"
2015-09-24 00:37:48,3m507h,1,1,,transgender,"The Genderqueer Movement, as Seen Through a Transwoman's Eyes",1443080268.0,"{'created_utc': 1443055068, 'id': '3m507h', 'num_comments': 1, 'score': 1, 'selftext': '', 'subreddit': 'transgender', 'title': ""The Genderqueer Movement, as Seen Through a Transwoman's Eyes"", 'created': 1443080268.0}"
2015-09-24 05:51:13,3m6155,25,33,,transgender,Banned transgender customers to get $400K from Portland bar,1443099073.0,"{'created_utc': 1443073873, 'id': '3m6155', 'num_comments': 25, 'score': 33, 'selftext': '', 'subreddit': 'transgender', 'title': 'Banned transgender customers to get $400K from Portland bar', 'created': 1443099073.0}"
2015-09-24 05:53:14,3m61bd,4,7,,transgender,Nevada school district bans trans teen from using men's bathroom,1443099194.0,"{'created_utc': 1443073994, 'id': '3m61bd', 'num_comments': 4, 'score': 7, 'selftext': '', 'subreddit': 'transgender', 'title': ""Nevada school district bans trans teen from using men's bathroom"", 'created': 1443099194.0}"
2015-09-24 07:41:37,3m6a7z,19,16,,transgender,A transgender thought experiment,1443105697.0,"{'created_utc': 1443080497, 'id': '3m6a7z', 'num_comments': 19, 'score': 16, 'selftext': '', 'subreddit': 'transgender', 'title': 'A transgender thought experiment', 'created': 1443105697.0}"
2015-09-24 08:26:17,3m6did,4,19,,transgender,Never Woman Enough: How Trans Women Are Held to Unrealistic Standards,1443108377.0,"{'created_utc': 1443083177, 'id': '3m6did', 'num_comments': 4, 'score': 19, 'selftext': '', 'subreddit': 'transgender', 'title': 'Never Woman Enough: How Trans Women Are Held to Unrealistic Standards', 'created': 1443108377.0}"
2015-09-24 09:27:56,3m6hty,0,1,,transgender,"Brother and sister – both transgender – talk about life, school and university",1443112076.0,"{'created_utc': 1443086876, 'id': '3m6hty', 'num_comments': 0, 'score': 1, 'selftext': '', 'subreddit': 'transgender', 'title': 'Brother and sister – both transgender – talk about life, school and university', 'created': 1443112076.0}"
2015-09-24 12:04:30,3m6u4d,15,258,,transgender,Netflix adds gender reassignment surgery to list of staff benefits,1443121470.0,"{'created_utc': 1443096270, 'id': '3m6u4d', 'num_comments': 15, 'score': 258, 'selftext': '', 'subreddit': 'transgender', 'title': 'Netflix adds gender reassignment surgery to list of staff benefits', 'created': 1443121470.0}"
2015-09-24 14:07:05,3m789f,1,6,,transgender,How to shop for health insurance as a transgender person,1443128825.0,"{'created_utc': 1443103625, 'id': '3m789f', 'num_comments': 1, 'score': 6, 'selftext': '', 'subreddit': 'transgender', 'title': 'How to shop for health insurance as a transgender person', 'created': 1443128825.0}"
2015-09-24 14:28:47,3m7b6a,3,11,,transgender,"Searching for Eve: a trans woman, but only online",1443130127.0,"{'created_utc': 1443104927, 'id': '3m7b6a', 'num_comments': 3, 'score': 11, 'selftext': '', 'subreddit': 'transgender', 'title': 'Searching for Eve: a trans woman, but only online', 'created': 1443130127.0}"
2015-09-24 21:11:29,3m8zrd,0,2,,transgender,The Gender Playbook: A Guide to Figuring Out Your Non-Binary Identity,1443154289.0,"{'created_utc': 1443129089, 'id': '3m8zrd', 'num_comments': 0, 'score': 2, 'selftext': '', 'subreddit': 'transgender', 'title': 'The Gender Playbook: A Guide to Figuring Out Your Non-Binary Identity', 'created': 1443154289.0}"
2015-09-24 22:11:25,3m98bf,0,1,,transgender,Argentinian Province Sets Transgender Hiring Quota. Since this applies only to Public Sector employment I think it makes sense and is enforceable.,1443157885.0,"{'created_utc': 1443132685, 'id': '3m98bf', 'num_comments': 0, 'score': 1, 'selftext': '', 'subreddit': 'transgender', 'title': 'Argentinian Province Sets Transgender Hiring Quota. Since this applies only to Public Sector employment I think it makes sense and is enforceable.', 'created': 1443157885.0}"
2015-09-24 22:42:09,3m9cn2,1,1,,transgender,"Trans blog, no nonsense and thought provoking.",1443159729.0,"{'created_utc': 1443134529, 'id': '3m9cn2', 'num_comments': 1, 'score': 1, 'selftext': '', 'subreddit': 'transgender', 'title': 'Trans blog, no nonsense and thought provoking.', 'created': 1443159729.0}"
2015-09-24 22:50:09,3m9dou,0,14,,transgender,Transgender undergrads endure staggering amount of unwanted sexual contact,1443160209.0,"{'created_utc': 1443135009, 'id': '3m9dou', 'num_comments': 0, 'score': 14, 'selftext': '', 'subreddit': 'transgender', 'title': 'Transgender undergrads endure staggering amount of unwanted sexual contact', 'created': 1443160209.0}"
2015-09-24 23:21:37,3m9htj,4,41,,transgender,Stonewall Movie: 22 Hilarious Excerpts From Scathing Reviews,1443162097.0,"{'created_utc': 1443136897, 'id': '3m9htj', 'num_comments': 4, 'score': 41, 'selftext': '', 'subreddit': 'transgender', 'title': 'Stonewall Movie: 22 Hilarious Excerpts From Scathing Reviews', 'created': 1443162097.0}"
2015-09-25 00:49:31,3m9u06,0,1,,transgender,7 Months on HRT Update | MtF Teen Transgender ♡,1443167371.0,"{'created_utc': 1443142171, 'id': '3m9u06', 'num_comments': 0, 'score': 1, 'selftext': '', 'subreddit': 'transgender', 'title': '7 Months on HRT Update | MtF Teen Transgender ♡', 'created': 1443167371.0}"
2015-09-25 02:00:21,3ma42e,14,6,,transgender,The Straight Men Who Have Sex with Trans Women,1443171621.0,"{'created_utc': 1443146421, 'id': '3ma42e', 'num_comments': 14, 'score': 6, 'selftext': '', 'subreddit': 'transgender', 'title': 'The Straight Men Who Have Sex with Trans Women', 'created': 1443171621.0}"
2015-09-25 02:24:51,3ma7jb,1,13,,transgender,South Dakota Lawmaker Proposes Genital Inspections For Trans Athletes,1443173091.0,"{'created_utc': 1443147891, 'id': '3ma7jb', 'num_comments': 1, 'score': 13, 'selftext': '', 'subreddit': 'transgender', 'title': 'South Dakota Lawmaker Proposes Genital Inspections For Trans Athletes', 'created': 1443173091.0}"
2015-09-25 03:52:22,3majc0,1,8,,transgender,Follow Your Arrow: Blacksmith Willow Zietman on Returning to her Craft,1443178342.0,"{'created_utc': 1443153142, 'id': '3majc0', 'num_comments': 1, 'score': 8, 'selftext': '', 'subreddit': 'transgender', 'title': 'Follow Your Arrow: Blacksmith Willow Zietman on Returning to her Craft', 'created': 1443178342.0}"
2015-09-25 06:03:42,3maxtk,0,1,,transgender,Transgender Journey from MTF: Episode 6 (Lacey's Big Change),1443186222.0,"{'created_utc': 1443161022, 'id': '3maxtk', 'num_comments': 0, 'score': 1, 'selftext': '', 'subreddit': 'transgender', 'title': ""Transgender Journey from MTF: Episode 6 (Lacey's Big Change)"", 'created': 1443186222.0}"
2015-09-25 08:01:50,3mb8k1,7,8,,transgender,Gender dysphoria and ageing,1443193310.0,"{'created_utc': 1443168110, 'id': '3mb8k1', 'num_comments': 7, 'score': 8, 'selftext': '', 'subreddit': 'transgender', 'title': 'Gender dysphoria and ageing', 'created': 1443193310.0}"
2015-09-25 10:07:40,3mbhx9,37,93,,transgender,The TSA quietly deleted the trans traveller page on their website that shows their policy of doing pat downs in accordance with gender presentation. It's mirrored here.,1443200860.0,"{'created_utc': 1443175660, 'id': '3mbhx9', 'num_comments': 37, 'score': 93, 'selftext': '', 'subreddit': 'transgender', 'title': ""The TSA quietly deleted the trans traveller page on their website that shows their policy of doing pat downs in accordance with gender presentation. It's mirrored here."", 'created': 1443200860.0}"
2015-09-25 11:30:58,3mboeo,1,0,,transgender,Queer Normative Frustrations,1443205858.0,"{'created_utc': 1443180658, 'id': '3mboeo', 'num_comments': 1, 'score': 0, 'selftext': '', 'subreddit': 'transgender', 'title': 'Queer Normative Frustrations', 'created': 1443205858.0}"
2015-09-25 11:48:36,3mbpvt,1,1,,transgender,Tall Dark Stranger - Distraction Pieces Podcast,1443206916.0,"{'created_utc': 1443181716, 'id': '3mbpvt', 'num_comments': 1, 'score': 1, 'selftext': '', 'subreddit': 'transgender', 'title': 'Tall Dark Stranger - Distraction Pieces Podcast', 'created': 1443206916.0}"
2015-09-25 14:16:58,3mc6eh,10,154,,transgender,A transgender inmate who says guards called her an animal and encouraged her to kill herself has won a legal battle against Maryland prison officials in the first successful lawsuit of its kind against a U.S. correctional facility,1443215818.0,"{'created_utc': 1443190618, 'id': '3mc6eh', 'num_comments': 10, 'score': 154, 'selftext': '', 'subreddit': 'transgender', 'title': 'A transgender inmate who says guards called her an animal and encouraged her to kill herself has won a legal battle against Maryland prison officials in the first successful lawsuit of its kind against a U.S. correctional facility', 'created': 1443215818.0}"
2015-09-25 15:00:00,3mccla,5,8,[deleted],transgender,After the female quota here come the “trans” quota,1443218400.0,"{'created_utc': 1443193200, 'id': '3mccla', 'num_comments': 5, 'score': 8, 'selftext': '[deleted]', 'subreddit': 'transgender', 'title': 'After the female quota here come the “trans” quota', 'created': 1443218400.0}"
2015-09-25 16:13:22,3mcnra,0,2,,transgender,"One of the most popular procedurals on US tv, Law&amp;Order:SVU, takes on Transphobia/tranasbashing in new ep sept 30th",1443222802.0,"{'created_utc': 1443197602, 'id': '3mcnra', 'num_comments': 0, 'score': 2, 'selftext': '', 'subreddit': 'transgender', 'title': 'One of the most popular procedurals on US tv, Law&amp;Order:SVU, takes on Transphobia/tranasbashing in new ep sept 30th', 'created': 1443222802.0}"
2015-09-25 17:40:48,3md0jf,0,1,,transgender,Threats Trigger Anxiety in LGBT Community Members,1443228048.0,"{'created_utc': 1443202848, 'id': '3md0jf', 'num_comments': 0, 'score': 1, 'selftext': '', 'subreddit': 'transgender', 'title': 'Threats Trigger Anxiety in LGBT Community Members', 'created': 1443228048.0}"
2015-09-25 18:24:00,3md7d6,3,0,[deleted],transgender,"Judge grants Jenner's request to legally change name, gender",1443230640.0,"{'created_utc': 1443205440, 'id': '3md7d6', 'num_comments': 3, 'score': 0, 'selftext': '[deleted]', 'subreddit': 'transgender', 'title': ""Judge grants Jenner's request to legally change name, gender"", 'created': 1443230640.0}"
2015-09-25 20:35:47,3mdra0,3,27,,transgender,Housing often closed to transgender tenants,1443238547.0,"{'created_utc': 1443213347, 'id': '3mdra0', 'num_comments': 3, 'score': 27, 'selftext': '', 'subreddit': 'transgender', 'title': 'Housing often closed to transgender tenants', 'created': 1443238547.0}"
2015-09-25 20:51:29,3mdtk6,0,1,,transgender,Trans Model Alhena Fashion SlideShow,1443239489.0,"{'created_utc': 1443214289, 'id': '3mdtk6', 'num_comments': 0, 'score': 1, 'selftext': '', 'subreddit': 'transgender', 'title': 'Trans Model Alhena Fashion SlideShow', 'created': 1443239489.0}"
2015-09-26 01:32:59,3meu72,0,1,,transgender,"Jamison Green keynoting 2015 Gender Expansion Trans* Health Conference in Missoula, Montana - October 2nd!",1443256379.0,"{'created_utc': 1443231179, 'id': '3meu72', 'num_comments': 0, 'score': 1, 'selftext': '', 'subreddit': 'transgender', 'title': 'Jamison Green keynoting 2015 Gender Expansion Trans* Health Conference in Missoula, Montana - October 2nd!', 'created': 1443256379.0}"
2015-09-26 03:51:33,3mfa98,2,1,,transgender,"TranzGendr, Daniel's Project : Series : Amazon Studios",1443264693.0,"{'created_utc': 1443239493, 'id': '3mfa98', 'num_comments': 2, 'score': 1, 'selftext': '', 'subreddit': 'transgender', 'title': ""TranzGendr, Daniel's Project : Series : Amazon Studios"", 'created': 1443264693.0}"
2015-09-26 22:50:08,3min2t,4,0,,transgender,"Caitlyn Jenner on her controversial Halloween costume, """"I think it's great!""",1443333008.0,"{'created_utc': 1443307808, 'id': '3min2t', 'num_comments': 4, 'score': 0, 'selftext': '', 'subreddit': 'transgender', 'title': 'Caitlyn Jenner on her controversial Halloween costume, """"I think it\'s great!""', 'created': 1443333008.0}"
2015-09-26 23:16:08,3miq5t,3,0,[deleted],transgender,"Brett Favre and Caitlyn Jenner, another possibilty",1443334568.0,"{'created_utc': 1443309368, 'id': '3miq5t', 'num_comments': 3, 'score': 0, 'selftext': '[deleted]', 'subreddit': 'transgender', 'title': 'Brett Favre and Caitlyn Jenner, another possibilty', 'created': 1443334568.0}"
2015-09-27 01:25:20,3mj4tl,0,6,,transgender,A Trans History,1443342320.0,"{'created_utc': 1443317120, 'id': '3mj4tl', 'num_comments': 0, 'score': 6, 'selftext': '', 'subreddit': 'transgender', 'title': 'A Trans History', 'created': 1443342320.0}"
2015-09-27 05:27:34,3mjshj,27,44,,transgender,Did the Pope Just Say Our 'Lifestyles' Are 'Irresponsible?',1443356854.0,"{'created_utc': 1443331654, 'id': '3mjshj', 'num_comments': 27, 'score': 44, 'selftext': '', 'subreddit': 'transgender', 'title': ""Did the Pope Just Say Our 'Lifestyles' Are 'Irresponsible?'"", 'created': 1443356854.0}"
2015-09-27 08:13:41,3mk3sx,0,1,,transgender,Transgender Journey from MTF: Episode 7 (Depression),1443366821.0,"{'created_utc': 1443341621, 'id': '3mk3sx', 'num_comments': 0, 'score': 1, 'selftext': '', 'subreddit': 'transgender', 'title': 'Transgender Journey from MTF: Episode 7 (Depression)', 'created': 1443366821.0}"
2015-09-27 08:43:01,3mk5mm,11,14,,transgender,My HusbandIs Now My Wife | The spouses of transgender people face their own dramatic transformations—only no one celebrates them.,1443368581.0,"{'created_utc': 1443343381, 'id': '3mk5mm', 'num_comments': 11, 'score': 14, 'selftext': '', 'subreddit': 'transgender', 'title': 'My HusbandIs Now My Wife | The spouses of transgender people face their own dramatic transformations—only no one celebrates them.', 'created': 1443368581.0}"
2015-09-27 15:12:47,3ml0ba,1,1,,transgender,Taking Back the Night,1443391967.0,"{'created_utc': 1443366767, 'id': '3ml0ba', 'num_comments': 1, 'score': 1, 'selftext': '', 'subreddit': 'transgender', 'title': 'Taking Back the Night', 'created': 1443391967.0}"
2015-09-27 17:45:05,3mljyg,1,0,[deleted],transgender,Our community is...interesting.,1443401105.0,"{'created_utc': 1443375905, 'id': '3mljyg', 'num_comments': 1, 'score': 0, 'selftext': '[deleted]', 'subreddit': 'transgender', 'title': 'Our community is...interesting.', 'created': 1443401105.0}"
2015-09-27 18:24:18,3mlp9i,6,65,,transgender,"Transgender at school: As more teachers come out, districts struggle to put policy into practice",1443403458.0,"{'created_utc': 1443378258, 'id': '3mlp9i', 'num_comments': 6, 'score': 65, 'selftext': '', 'subreddit': 'transgender', 'title': 'Transgender at school: As more teachers come out, districts struggle to put policy into practice', 'created': 1443403458.0}"
2015-09-27 20:52:01,3mm9aj,0,1,,transgender,LGBT blog turkey,1443412321.0,"{'created_utc': 1443387121, 'id': '3mm9aj', 'num_comments': 0, 'score': 1, 'selftext': '', 'subreddit': 'transgender', 'title': 'LGBT blog turkey', 'created': 1443412321.0}"
2015-09-28 01:44:18,3mnajw,0,1,,transgender,I'm an aspiring transgender MTF artist and i'm entering this into my schools art competition,1443429858.0,"{'created_utc': 1443404658, 'id': '3mnajw', 'num_comments': 0, 'score': 1, 'selftext': '', 'subreddit': 'transgender', 'title': ""I'm an aspiring transgender MTF artist and i'm entering this into my schools art competition"", 'created': 1443429858.0}"
2015-09-28 03:05:04,3mnk6x,4,0,,transgender,Episode 6: The Inside Scoop: What It’s Like To Be Transgender! Featuring: Interview With Buck Angel,1443434704.0,"{'created_utc': 1443409504, 'id': '3mnk6x', 'num_comments': 4, 'score': 0, 'selftext': '', 'subreddit': 'transgender', 'title': 'Episode 6: The Inside Scoop: What It’s Like To Be Transgender! Featuring: Interview With Buck Angel', 'created': 1443434704.0}"
