created_utc,id,num_comments,score,selftext,subreddit,title,created,d_
2015-09-05 23:31:28,3jstys,15,18,,transgender,‘The Danish Girl’: Eddie Redmayne Wows as Lili Elbe,1441521088.0,"{'created_utc': 1441495888, 'id': '3jstys', 'num_comments': 15, 'score': 18, 'selftext': '', 'subreddit': 'transgender', 'title': '‘The Danish Girl’: Eddie Redmayne Wows as Lili Elbe', 'created': 1441521088.0}"
2015-09-06 00:49:34,3jt2jd,1,1,,transgender,The Girl That Could Have Been,1441525774.0,"{'created_utc': 1441500574, 'id': '3jt2jd', 'num_comments': 1, 'score': 1, 'selftext': '', 'subreddit': 'transgender', 'title': 'The Girl That Could Have Been', 'created': 1441525774.0}"
2015-09-06 02:40:18,3jtebq,5,20,,transgender,I got into the news and I didn't even know it! (picture of me is around the 50 second mark with me painting a bench,1441532418.0,"{'created_utc': 1441507218, 'id': '3jtebq', 'num_comments': 5, 'score': 20, 'selftext': '', 'subreddit': 'transgender', 'title': ""I got into the news and I didn't even know it! (picture of me is around the 50 second mark with me painting a bench"", 'created': 1441532418.0}"
2015-09-06 18:26:26,3jvqtj,21,50,,transgender,Danish Girl director Tom Hooper: film industry has 'problem' with transgender actors,1441589186.0,"{'created_utc': 1441563986, 'id': '3jvqtj', 'num_comments': 21, 'score': 50, 'selftext': '', 'subreddit': 'transgender', 'title': ""Danish Girl director Tom Hooper: film industry has 'problem' with transgender actors"", 'created': 1441589186.0}"
2015-09-06 23:06:49,3jwpef,3,23,,transgender,Update on Gavin Grimm: Reagan Appointee Federal Judge Denies Trans Student the Right to Use Male Restroom,1441606009.0,"{'created_utc': 1441580809, 'id': '3jwpef', 'num_comments': 3, 'score': 23, 'selftext': '', 'subreddit': 'transgender', 'title': 'Update on Gavin Grimm: Reagan Appointee Federal Judge Denies Trans Student the Right to Use Male Restroom', 'created': 1441606009.0}"
2015-09-06 23:51:56,3jwuex,12,59,,transgender,"Saga Becker, first trans woman to be nominated in the official Swedish film awards, won Best Female Lead Role in 2015 for her role as pre-transition sebastian / Ellie.",1441608716.0,"{'created_utc': 1441583516, 'id': '3jwuex', 'num_comments': 12, 'score': 59, 'selftext': '', 'subreddit': 'transgender', 'title': 'Saga Becker, first trans woman to be nominated in the official Swedish film awards, won Best Female Lead Role in 2015 for her role as pre-transition sebastian / Ellie.', 'created': 1441608716.0}"
2015-09-07 05:21:54,3jxu2n,0,20,,transgender,Activists Say Police Abuse of Transgender People Persists Despite Reforms,1441628514.0,"{'created_utc': 1441603314, 'id': '3jxu2n', 'num_comments': 0, 'score': 20, 'selftext': '', 'subreddit': 'transgender', 'title': 'Activists Say Police Abuse of Transgender People Persists Despite Reforms', 'created': 1441628514.0}"
2015-09-07 07:56:41,3jy798,3,5,,transgender,Gender Core Theory – why am I transgender?,1441637801.0,"{'created_utc': 1441612601, 'id': '3jy798', 'num_comments': 3, 'score': 5, 'selftext': '', 'subreddit': 'transgender', 'title': 'Gender Core Theory – why am I transgender?', 'created': 1441637801.0}"
2015-09-07 14:30:11,3jz4np,2,0,,transgender,Drag Queenery on the Road to Womanhood,1441661411.0,"{'created_utc': 1441636211, 'id': '3jz4np', 'num_comments': 2, 'score': 0, 'selftext': '', 'subreddit': 'transgender', 'title': 'Drag Queenery on the Road to Womanhood', 'created': 1441661411.0}"
2015-09-07 16:51:09,3jzmrx,47,15,,transgender,Redmayne says the reason a transgender actress was not used for The Danish Girl is because of HRT. Really??,1441669869.0,"{'created_utc': 1441644669, 'id': '3jzmrx', 'num_comments': 47, 'score': 15, 'selftext': '', 'subreddit': 'transgender', 'title': 'Redmayne says the reason a transgender actress was not used for The Danish Girl is because of HRT. Really??', 'created': 1441669869.0}"
2015-09-07 18:32:52,3k00yo,1,1,,transgender,My friend attempting to get her license renewed in Baton Rouge,1441675972.0,"{'created_utc': 1441650772, 'id': '3k00yo', 'num_comments': 1, 'score': 1, 'selftext': '', 'subreddit': 'transgender', 'title': 'My friend attempting to get her license renewed in Baton Rouge', 'created': 1441675972.0}"
2015-09-07 21:45:23,3k0o7r,6,5,,transgender,"A response to the recent article ""Why Transgender Kids Should Wait to Transition""",1441687523.0,"{'created_utc': 1441662323, 'id': '3k0o7r', 'num_comments': 6, 'score': 5, 'selftext': '', 'subreddit': 'transgender', 'title': 'A response to the recent article ""Why Transgender Kids Should Wait to Transition""', 'created': 1441687523.0}"
2015-09-07 21:49:00,3k0ojc,8,69,,transgender,Robot Hugs - The Femininity Double Standard,1441687740.0,"{'created_utc': 1441662540, 'id': '3k0ojc', 'num_comments': 8, 'score': 69, 'selftext': '', 'subreddit': 'transgender', 'title': 'Robot Hugs - The Femininity Double Standard', 'created': 1441687740.0}"
2015-09-08 03:59:52,3k1wgt,1,1,,transgender,Nice,1441709992.0,"{'created_utc': 1441684792, 'id': '3k1wgt', 'num_comments': 1, 'score': 1, 'selftext': '', 'subreddit': 'transgender', 'title': 'Nice', 'created': 1441709992.0}"
2015-09-08 05:18:12,3k24ii,0,1,,transgender,What does the transgender community think about The Danish Girl?,1441714692.0,"{'created_utc': 1441689492, 'id': '3k24ii', 'num_comments': 0, 'score': 1, 'selftext': '', 'subreddit': 'transgender', 'title': 'What does the transgender community think about The Danish Girl?', 'created': 1441714692.0}"
2015-09-08 06:39:59,3k2bos,1,1,,transgender,Transgender stories - Emily of T-Girl Angel (Edited version),1441719599.0,"{'created_utc': 1441694399, 'id': '3k2bos', 'num_comments': 1, 'score': 1, 'selftext': '', 'subreddit': 'transgender', 'title': 'Transgender stories - Emily of T-Girl Angel (Edited version)', 'created': 1441719599.0}"
2015-09-08 07:32:13,3k2fzw,0,17,,transgender,Ireland’s revolutionary new trans recognition law comes into effect next week,1441722733.0,"{'created_utc': 1441697533, 'id': '3k2fzw', 'num_comments': 0, 'score': 17, 'selftext': '', 'subreddit': 'transgender', 'title': 'Ireland’s revolutionary new trans recognition law comes into effect next week', 'created': 1441722733.0}"
2015-09-08 07:38:42,3k2gix,0,1,,transgender,Transgender Journey from MTF: Episode 2 (Denial),1441723122.0,"{'created_utc': 1441697922, 'id': '3k2gix', 'num_comments': 0, 'score': 1, 'selftext': '', 'subreddit': 'transgender', 'title': 'Transgender Journey from MTF: Episode 2 (Denial)', 'created': 1441723122.0}"
2015-09-08 12:48:30,3k36yn,29,33,,transgender,Canadian radio station offers 40000$ for a transition. The new normal,1441741710.0,"{'created_utc': 1441716510, 'id': '3k36yn', 'num_comments': 29, 'score': 33, 'selftext': '', 'subreddit': 'transgender', 'title': 'Canadian radio station offers 40000$ for a transition. The new normal', 'created': 1441741710.0}"
2015-09-08 13:06:25,3k38qr,11,66,,transgender,"The NHS is not treating transgender people equally with other patients, senior doctors warn",1441742785.0,"{'created_utc': 1441717585, 'id': '3k38qr', 'num_comments': 11, 'score': 66, 'selftext': '', 'subreddit': 'transgender', 'title': 'The NHS is not treating transgender people equally with other patients, senior doctors warn', 'created': 1441742785.0}"
2015-09-08 14:41:22,3k3kvy,5,17,,transgender,Federal Judge rules against Virginia transgender teen in bathroom battle,1441748482.0,"{'created_utc': 1441723282, 'id': '3k3kvy', 'num_comments': 5, 'score': 17, 'selftext': '', 'subreddit': 'transgender', 'title': 'Federal Judge rules against Virginia transgender teen in bathroom battle', 'created': 1441748482.0}"
2015-09-08 15:39:40,3k3sve,1,33,,transgender,"Eating disorders five times more prevalent in transgender college students, study finds",1441751980.0,"{'created_utc': 1441726780, 'id': '3k3sve', 'num_comments': 1, 'score': 33, 'selftext': '', 'subreddit': 'transgender', 'title': 'Eating disorders five times more prevalent in transgender college students, study finds', 'created': 1441751980.0}"
2015-09-08 16:09:20,3k3x8b,2,1,,transgender,Transequality (A trans info site by a friend of mine),1441753760.0,"{'created_utc': 1441728560, 'id': '3k3x8b', 'num_comments': 2, 'score': 1, 'selftext': '', 'subreddit': 'transgender', 'title': 'Transequality (A trans info site by a friend of mine)', 'created': 1441753760.0}"
2015-09-08 17:00:28,3k44uc,0,1,[deleted],transgender,Conference: Attraction to transgender people,1441756828.0,"{'created_utc': 1441731628, 'id': '3k44uc', 'num_comments': 0, 'score': 1, 'selftext': '[deleted]', 'subreddit': 'transgender', 'title': 'Conference: Attraction to transgender people', 'created': 1441756828.0}"
2015-09-08 17:34:26,3k4a32,2,8,,transgender,Real Talk With Trans People: How to be an ally.,1441758866.0,"{'created_utc': 1441733666, 'id': '3k4a32', 'num_comments': 2, 'score': 8, 'selftext': '', 'subreddit': 'transgender', 'title': 'Real Talk With Trans People: How to be an ally.', 'created': 1441758866.0}"
2015-09-08 18:52:28,3k4lr7,1,26,,transgender,My Child Came Out as Transgender Last Year: Why Being Her Advocate is So Important,1441763548.0,"{'created_utc': 1441738348, 'id': '3k4lr7', 'num_comments': 1, 'score': 26, 'selftext': '', 'subreddit': 'transgender', 'title': 'My Child Came Out as Transgender Last Year: Why Being Her Advocate is So Important', 'created': 1441763548.0}"
2015-09-08 22:34:46,3k5i0d,0,5,,transgender,"Candis Cayne On Caitlyn’s Politics, Dating &amp; Returning to Barracuda!",1441776886.0,"{'created_utc': 1441751686, 'id': '3k5i0d', 'num_comments': 0, 'score': 5, 'selftext': '', 'subreddit': 'transgender', 'title': 'Candis Cayne On Caitlyn’s Politics, Dating &amp; Returning to Barracuda!', 'created': 1441776886.0}"
2015-09-08 22:36:51,3k5idm,7,77,[deleted],transgender,"If you ever get discriminated against by a company, think twice about going to the press/starting a twitter storm. This is what happened to me.",1441777011.0,"{'created_utc': 1441751811, 'id': '3k5idm', 'num_comments': 7, 'score': 77, 'selftext': '[deleted]', 'subreddit': 'transgender', 'title': 'If you ever get discriminated against by a company, think twice about going to the press/starting a twitter storm. This is what happened to me.', 'created': 1441777011.0}"
2015-09-09 02:15:43,3k6fxs,1,1,,transgender,Dating: Pansexual Dreams,1441790143.0,"{'created_utc': 1441764943, 'id': '3k6fxs', 'num_comments': 1, 'score': 1, 'selftext': '', 'subreddit': 'transgender', 'title': 'Dating: Pansexual Dreams', 'created': 1441790143.0}"
2015-09-09 02:41:01,3k6juw,1,1,,transgender,Another trans woman buried under the wrong name. This woman's real name is Erin.,1441791661.0,"{'created_utc': 1441766461, 'id': '3k6juw', 'num_comments': 1, 'score': 1, 'selftext': '', 'subreddit': 'transgender', 'title': ""Another trans woman buried under the wrong name. This woman's real name is Erin."", 'created': 1441791661.0}"
2015-09-09 03:19:42,3k6plt,2,3,[deleted],transgender,Gender reassignment surgery extremely complicated,1441793982.0,"{'created_utc': 1441768782, 'id': '3k6plt', 'num_comments': 2, 'score': 3, 'selftext': '[deleted]', 'subreddit': 'transgender', 'title': 'Gender reassignment surgery extremely complicated', 'created': 1441793982.0}"
2015-09-09 04:03:17,3k6w1e,0,1,,transgender,Eddie Redmayne Is Likely to Win His 2nd Oscar for This Inspiring Transgender Role. Don't You Think so?,1441796597.0,"{'created_utc': 1441771397, 'id': '3k6w1e', 'num_comments': 0, 'score': 1, 'selftext': '', 'subreddit': 'transgender', 'title': ""Eddie Redmayne Is Likely to Win His 2nd Oscar for This Inspiring Transgender Role. Don't You Think so?"", 'created': 1441796597.0}"
2015-09-09 04:08:08,3k6wpl,70,71,,transgender,Ellen DeGeneres confronts Caitlyn Jenner: Your fellow Repubs are not going to support you as a trans person,1441796888.0,"{'created_utc': 1441771688, 'id': '3k6wpl', 'num_comments': 70, 'score': 71, 'selftext': '', 'subreddit': 'transgender', 'title': 'Ellen DeGeneres confronts Caitlyn Jenner: Your fellow Repubs are not going to support you as a trans person', 'created': 1441796888.0}"
2015-09-09 06:07:43,3k7baj,0,1,,transgender,My very first T day!! \(^__^)/,1441804063.0,"{'created_utc': 1441778863, 'id': '3k7baj', 'num_comments': 0, 'score': 1, 'selftext': '', 'subreddit': 'transgender', 'title': 'My very first T day!! \\(^__^)/', 'created': 1441804063.0}"
2015-09-09 15:24:59,3k94st,0,1,[deleted],transgender,"Just thought I'd share this, Kanye West counter protesting the Westboro Baptist Church over LGBT rights with the perfect sign.",1441837499.0,"{'created_utc': 1441812299, 'id': '3k94st', 'num_comments': 0, 'score': 1, 'selftext': '[deleted]', 'subreddit': 'transgender', 'title': ""Just thought I'd share this, Kanye West counter protesting the Westboro Baptist Church over LGBT rights with the perfect sign."", 'created': 1441837499.0}"
2015-09-09 15:48:40,3k98pn,0,28,,transgender,"WATCH: At Rally, Missourians Show Trans Students Love",1441838920.0,"{'created_utc': 1441813720, 'id': '3k98pn', 'num_comments': 0, 'score': 28, 'selftext': '', 'subreddit': 'transgender', 'title': 'WATCH: At Rally, Missourians Show Trans Students Love', 'created': 1441838920.0}"
2015-09-09 19:04:41,3ka4zz,0,16,,transgender,7 Talks on the Transgender Experience,1441850681.0,"{'created_utc': 1441825481, 'id': '3ka4zz', 'num_comments': 0, 'score': 16, 'selftext': '', 'subreddit': 'transgender', 'title': '7 Talks on the Transgender Experience', 'created': 1441850681.0}"
2015-09-09 21:23:11,3kat39,8,17,,transgender,"Caitlyn Jenner on her controversial Halloween costume, """"I think it's great!""",1441858991.0,"{'created_utc': 1441833791, 'id': '3kat39', 'num_comments': 8, 'score': 17, 'selftext': '', 'subreddit': 'transgender', 'title': 'Caitlyn Jenner on her controversial Halloween costume, """"I think it\'s great!""', 'created': 1441858991.0}"
2015-09-09 21:54:14,3kayae,14,121,,transgender,The White House is requiring insurers to cover transgender services. That’s a first.,1441860854.0,"{'created_utc': 1441835654, 'id': '3kayae', 'num_comments': 14, 'score': 121, 'selftext': '', 'subreddit': 'transgender', 'title': 'The White House is requiring insurers to cover transgender services. That’s a first.', 'created': 1441860854.0}"
2015-09-09 23:10:22,3kbbn8,0,1,,transgender,[transgender] My name is Victoria I wait you! Fck me now! My id: 89270114041750392,1441865422.0,"{'created_utc': 1441840222, 'id': '3kbbn8', 'num_comments': 0, 'score': 1, 'selftext': '', 'subreddit': 'transgender', 'title': '[transgender] My name is Victoria I wait you! Fck me now! My id: 89270114041750392', 'created': 1441865422.0}"
2015-09-09 23:10:40,3kbbp3,1,24,,transgender,The Faces of Transgender Teens | Mashable Photo Essay,1441865440.0,"{'created_utc': 1441840240, 'id': '3kbbp3', 'num_comments': 1, 'score': 24, 'selftext': '', 'subreddit': 'transgender', 'title': 'The Faces of Transgender Teens | Mashable Photo Essay', 'created': 1441865440.0}"
2015-09-10 02:27:02,3kc6yc,0,1,,transgender,TRANSITION VIDEO,1441877222.0,"{'created_utc': 1441852022, 'id': '3kc6yc', 'num_comments': 0, 'score': 1, 'selftext': '', 'subreddit': 'transgender', 'title': 'TRANSITION VIDEO', 'created': 1441877222.0}"
2015-09-10 04:40:46,3kcpi3,0,1,[deleted],transgender,Have you ever tried to stand in heels? Have you ever tried to stand for your right in heels?,1441885246.0,"{'created_utc': 1441860046, 'id': '3kcpi3', 'num_comments': 0, 'score': 1, 'selftext': '[deleted]', 'subreddit': 'transgender', 'title': 'Have you ever tried to stand in heels? Have you ever tried to stand for your right in heels?', 'created': 1441885246.0}"
2015-09-10 11:37:06,3kdwda,0,1,,transgender,You are Beautiful!,1441910226.0,"{'created_utc': 1441885026, 'id': '3kdwda', 'num_comments': 0, 'score': 1, 'selftext': '', 'subreddit': 'transgender', 'title': 'You are Beautiful!', 'created': 1441910226.0}"
2015-09-10 13:04:37,3ke7t6,3,8,,transgender,This School Is Switching to Gender-Neutral Bathrooms for All Students,1441915477.0,"{'created_utc': 1441890277, 'id': '3ke7t6', 'num_comments': 3, 'score': 8, 'selftext': '', 'subreddit': 'transgender', 'title': 'This School Is Switching to Gender-Neutral Bathrooms for All Students', 'created': 1441915477.0}"
2015-09-10 15:04:31,3keq7j,11,45,,transgender,Boss Who Asked Transgender Woman 'What Are You?' Agrees To Significant Settlement,1441922671.0,"{'created_utc': 1441897471, 'id': '3keq7j', 'num_comments': 11, 'score': 45, 'selftext': '', 'subreddit': 'transgender', 'title': ""Boss Who Asked Transgender Woman 'What Are You?' Agrees To Significant Settlement"", 'created': 1441922671.0}"
2015-09-10 15:54:20,3keytc,0,6,,transgender,This Midwestern Artist is Painting Portraits of LGBTQIA People in His Community,1441925660.0,"{'created_utc': 1441900460, 'id': '3keytc', 'num_comments': 0, 'score': 6, 'selftext': '', 'subreddit': 'transgender', 'title': 'This Midwestern Artist is Painting Portraits of LGBTQIA People in His Community', 'created': 1441925660.0}"
2015-09-10 17:20:14,3kfdhy,0,1,[deleted],transgender,Was coding in Sublime Text and realized the colors looked familiar...,1441930814.0,"{'created_utc': 1441905614, 'id': '3kfdhy', 'num_comments': 0, 'score': 1, 'selftext': '[deleted]', 'subreddit': 'transgender', 'title': 'Was coding in Sublime Text and realized the colors looked familiar...', 'created': 1441930814.0}"
2015-09-10 19:21:13,3kfz5n,0,6,,transgender,The Heroines of My Life: Interview with Elle Bradford,1441938073.0,"{'created_utc': 1441912873, 'id': '3kfz5n', 'num_comments': 0, 'score': 6, 'selftext': '', 'subreddit': 'transgender', 'title': 'The Heroines of My Life: Interview with Elle Bradford', 'created': 1441938073.0}"
2015-09-10 19:54:54,3kg542,1,1,,transgender,Parents in Ohio angry over transgender student's bathroom choice,1441940094.0,"{'created_utc': 1441914894, 'id': '3kg542', 'num_comments': 1, 'score': 1, 'selftext': '', 'subreddit': 'transgender', 'title': ""Parents in Ohio angry over transgender student's bathroom choice"", 'created': 1441940094.0}"
2015-09-10 20:33:10,3kgbt7,11,34,,transgender,Three school board members resign after transgender student debate,1441942390.0,"{'created_utc': 1441917190, 'id': '3kgbt7', 'num_comments': 11, 'score': 34, 'selftext': '', 'subreddit': 'transgender', 'title': 'Three school board members resign after transgender student debate', 'created': 1441942390.0}"
2015-09-11 01:17:16,3khg3i,1,1,,transgender,How our daughter turned us into allies.,1441959436.0,"{'created_utc': 1441934236, 'id': '3khg3i', 'num_comments': 1, 'score': 1, 'selftext': '', 'subreddit': 'transgender', 'title': 'How our daughter turned us into allies.', 'created': 1441959436.0}"
2015-09-11 01:45:05,3khjn8,5,57,,transgender,The Gender Playbook | A Guide To Figuring Out Your Gender,1441961105.0,"{'created_utc': 1441935905, 'id': '3khjn8', 'num_comments': 5, 'score': 57, 'selftext': '', 'subreddit': 'transgender', 'title': 'The Gender Playbook | A Guide To Figuring Out Your Gender', 'created': 1441961105.0}"
2015-09-11 03:09:12,3khu2c,0,2,[deleted],transgender,Hi I'm Brooklyn and today I start my journey ☺️,1441966152.0,"{'created_utc': 1441940952, 'id': '3khu2c', 'num_comments': 0, 'score': 2, 'selftext': '[deleted]', 'subreddit': 'transgender', 'title': ""Hi I'm Brooklyn and today I start my journey ☺️"", 'created': 1441966152.0}"
2015-09-11 03:38:41,3khxis,0,1,[deleted],transgender,Can someone give me some feedback on my podcast please. It takes me a lot of time to record and write and I don't know if it's worth it. Much appreciated... xx,1441967921.0,"{'created_utc': 1441942721, 'id': '3khxis', 'num_comments': 0, 'score': 1, 'selftext': '[deleted]', 'subreddit': 'transgender', 'title': ""Can someone give me some feedback on my podcast please. It takes me a lot of time to record and write and I don't know if it's worth it. Much appreciated... xx"", 'created': 1441967921.0}"
2015-09-11 03:48:48,3khyo0,9,13,,transgender,New Podcast episode: Why do some transgender people identify so late?,1441968528.0,"{'created_utc': 1441943328, 'id': '3khyo0', 'num_comments': 9, 'score': 13, 'selftext': '', 'subreddit': 'transgender', 'title': 'New Podcast episode: Why do some transgender people identify so late?', 'created': 1441968528.0}"
2015-09-11 06:38:26,3kift8,1,1,,transgender,"I had an idea for a book. Called Sincerely, Your Son for trans masculine people.",1441978706.0,"{'created_utc': 1441953506, 'id': '3kift8', 'num_comments': 1, 'score': 1, 'selftext': '', 'subreddit': 'transgender', 'title': 'I had an idea for a book. Called Sincerely, Your Son for trans masculine people.', 'created': 1441978706.0}"
2015-09-11 22:19:08,3klkm3,0,1,,transgender,"Something for my fellow gamers, a side-scrolling action game with a transwoman heroine. So hyped as it's nearly released.",1442035148.0,"{'created_utc': 1442009948, 'id': '3klkm3', 'num_comments': 0, 'score': 1, 'selftext': '', 'subreddit': 'transgender', 'title': ""Something for my fellow gamers, a side-scrolling action game with a transwoman heroine. So hyped as it's nearly released."", 'created': 1442035148.0}"
2015-09-12 03:09:23,3kmick,0,8,,transgender,The Trans Manicurist Trading Nail Art For Education,1442052563.0,"{'created_utc': 1442027363, 'id': '3kmick', 'num_comments': 0, 'score': 8, 'selftext': '', 'subreddit': 'transgender', 'title': 'The Trans Manicurist Trading Nail Art For Education', 'created': 1442052563.0}"
2015-09-12 03:20:39,3kmjh7,97,71,,transgender,"Caitlyn Jenner enters the ""not that kind of trans woman"" part of her PR campaign",1442053239.0,"{'created_utc': 1442028039, 'id': '3kmjh7', 'num_comments': 97, 'score': 71, 'selftext': '', 'subreddit': 'transgender', 'title': 'Caitlyn Jenner enters the ""not that kind of trans woman"" part of her PR campaign', 'created': 1442053239.0}"
2015-09-12 05:26:37,3kmuu5,2,5,,transgender,What We’ve Gained And Lost Since Stonewall,1442060797.0,"{'created_utc': 1442035597, 'id': '3kmuu5', 'num_comments': 2, 'score': 5, 'selftext': '', 'subreddit': 'transgender', 'title': 'What We’ve Gained And Lost Since Stonewall', 'created': 1442060797.0}"
2015-09-12 12:36:50,3knowk,0,5,,transgender,"Podcast interview with transgender activist &amp; musician Skylar Kergil about songwriting, LGBT rights &amp; audience connection.",1442086610.0,"{'created_utc': 1442061410, 'id': '3knowk', 'num_comments': 0, 'score': 5, 'selftext': '', 'subreddit': 'transgender', 'title': 'Podcast interview with transgender activist &amp; musician Skylar Kergil about songwriting, LGBT rights &amp; audience connection.', 'created': 1442086610.0}"
2015-09-12 14:46:26,3ko1z1,1,1,,transgender,Disclosure Fails,1442094386.0,"{'created_utc': 1442069186, 'id': '3ko1z1', 'num_comments': 1, 'score': 1, 'selftext': '', 'subreddit': 'transgender', 'title': 'Disclosure Fails', 'created': 1442094386.0}"
2015-09-12 15:16:52,3ko5o1,4,44,,transgender,The Invisible Risk: How I survived New Orleans prison as a sex worker,1442096212.0,"{'created_utc': 1442071012, 'id': '3ko5o1', 'num_comments': 4, 'score': 44, 'selftext': '', 'subreddit': 'transgender', 'title': 'The Invisible Risk: How I survived New Orleans prison as a sex worker', 'created': 1442096212.0}"
2015-09-12 15:56:00,3koau9,1,2,,transgender,Caitlyn Jenner is the recipient of EIPA Special Recognition Award,1442098560.0,"{'created_utc': 1442073360, 'id': '3koau9', 'num_comments': 1, 'score': 2, 'selftext': '', 'subreddit': 'transgender', 'title': 'Caitlyn Jenner is the recipient of EIPA Special Recognition Award', 'created': 1442098560.0}"
2015-09-12 16:36:02,3kog6z,5,19,,transgender,Making Trans People the Enemy Was Another Vatican Mistake,1442100962.0,"{'created_utc': 1442075762, 'id': '3kog6z', 'num_comments': 5, 'score': 19, 'selftext': '', 'subreddit': 'transgender', 'title': 'Making Trans People the Enemy Was Another Vatican Mistake', 'created': 1442100962.0}"
2015-09-12 16:38:50,3kogjo,0,1,[deleted],transgender,That's what you are in the eyes of healthy society,1442101130.0,"{'created_utc': 1442075930, 'id': '3kogjo', 'num_comments': 0, 'score': 1, 'selftext': '[deleted]', 'subreddit': 'transgender', 'title': ""That's what you are in the eyes of healthy society"", 'created': 1442101130.0}"
2015-09-12 18:21:19,3kou8g,7,9,,transgender,Anyone see this? Potential prison sentence for Cait Jenner?,1442107279.0,"{'created_utc': 1442082079, 'id': '3kou8g', 'num_comments': 7, 'score': 9, 'selftext': '', 'subreddit': 'transgender', 'title': 'Anyone see this? Potential prison sentence for Cait Jenner?', 'created': 1442107279.0}"
2015-09-12 20:13:51,3kp9wx,14,18,,transgender,The biological basis for transgender psychology is undeniable...,1442114031.0,"{'created_utc': 1442088831, 'id': '3kp9wx', 'num_comments': 14, 'score': 18, 'selftext': '', 'subreddit': 'transgender', 'title': 'The biological basis for transgender psychology is undeniable...', 'created': 1442114031.0}"
2015-09-12 21:28:29,3kpkfk,8,61,,transgender,San Francisco jails to house transgender inmates based on gender preference,1442118509.0,"{'created_utc': 1442093309, 'id': '3kpkfk', 'num_comments': 8, 'score': 61, 'selftext': '', 'subreddit': 'transgender', 'title': 'San Francisco jails to house transgender inmates based on gender preference', 'created': 1442118509.0}"
2015-09-12 21:36:59,3kplla,1,7,,transgender,"Pretty simple article explaining gender and sex isn't simple, but it could be useful to help educate people who do not no much on this topic",1442119019.0,"{'created_utc': 1442093819, 'id': '3kplla', 'num_comments': 1, 'score': 7, 'selftext': '', 'subreddit': 'transgender', 'title': ""Pretty simple article explaining gender and sex isn't simple, but it could be useful to help educate people who do not no much on this topic"", 'created': 1442119019.0}"
