Unnamed: 0,created_utc,id,num_comments,score,selftext,subreddit,title,created,d_
26,2013-08-19 07:44:57,1knl8v,0,8,,trans,Guessing gender for unwanted intersex baby ends up in cut off penis,1376923497.0,"{'created_utc': 1376898297, 'id': '1knl8v', 'num_comments': 0, 'score': 8, 'selftext': '', 'subreddit': 'trans', 'title': 'Guessing gender for unwanted intersex baby ends up in cut off penis', 'created': 1376923497.0}"
27,2013-08-19 09:17:20,1knobz,1,11,,trans,"Rabid anti-trans/LGBT moralist busted for rape of minors, including males",1376929040.0,"{'created_utc': 1376903840, 'id': '1knobz', 'num_comments': 1, 'score': 11, 'selftext': '', 'subreddit': 'trans', 'title': 'Rabid anti-trans/LGBT moralist busted for rape of minors, including males', 'created': 1376929040.0}"
51,2013-08-19 19:57:56,1konua,4,8,"Hi all. I'm not sure if this is the right sub or if this is more of a question for MtF/trans* people, but I figured I'd start here.

So I'm a 21-year-old gay man, and I'm generally pretty happy being a male. I like my male genitals, I like having sex with men, and I don't want to transition to being a woman. But lately, I've sort of been feeling like I wouldn't mind being a woman for a while. I've thought about cross dressing, but I haven't tried anything yet.

I'm fairly heavy set, and by some quirk of genetics, I've got pretty big man-boobs (which frankly I'm happy with, as I'm attracted to big people). I recently came across a blog by a guy who's been taking a low dose of estrogen in order to develop breasts, and it's pretty incredible. He's got a man's face and other parts but pretty nice, feminine breasts, and he doesn't plan on transitioning. I have to admit that I'm jealous. I feel like I want to be like that: sort of a combination of male and female. 

I certainly wouldn't take hormones without a doctor's supervision (honestly I'll probably never take them, period), but it's something I can't stop thinking about. I actually chatted a bit with the guy who runs the blog, but I can't find many other people who have done what he's doing (sort of a partial physical transition, but keeping his birth/assigned gender). I'm sure this sounds really weird, but I'm a bit confused about all this. Is this just a weird sexual kink? Am I really trans* and in denial? I don't know. Have any of you ever felt like this?",genderqueer,"Body confusion. Not sure how I feel, and looking for thoughts/advice.",1376967476.0,"{'created_utc': 1376942276, 'id': '1konua', 'num_comments': 4, 'score': 8, 'selftext': ""Hi all. I'm not sure if this is the right sub or if this is more of a question for MtF/trans* people, but I figured I'd start here.\n\nSo I'm a 21-year-old gay man, and I'm generally pretty happy being a male. I like my male genitals, I like having sex with men, and I don't want to transition to being a woman. But lately, I've sort of been feeling like I wouldn't mind being a woman for a while. I've thought about cross dressing, but I haven't tried anything yet.\n\nI'm fairly heavy set, and by some quirk of genetics, I've got pretty big man-boobs (which frankly I'm happy with, as I'm attracted to big people). I recently came across a blog by a guy who's been taking a low dose of estrogen in order to develop breasts, and it's pretty incredible. He's got a man's face and other parts but pretty nice, feminine breasts, and he doesn't plan on transitioning. I have to admit that I'm jealous. I feel like I want to be like that: sort of a combination of male and female. \n\nI certainly wouldn't take hormones without a doctor's supervision (honestly I'll probably never take them, period), but it's something I can't stop thinking about. I actually chatted a bit with the guy who runs the blog, but I can't find many other people who have done what he's doing (sort of a partial physical transition, but keeping his birth/assigned gender). I'm sure this sounds really weird, but I'm a bit confused about all this. Is this just a weird sexual kink? Am I really trans* and in denial? I don't know. Have any of you ever felt like this?"", 'subreddit': 'genderqueer', 'title': 'Body confusion. Not sure how I feel, and looking for thoughts/advice.', 'created': 1376967476.0}"
52,2013-08-19 23:49:41,1kp6da,1,2,"Hey everyone! 

As someone who's identified as a gay man for many years, I haven't really begun to question my gender identity until just recently, and decided to turn here for a bit of guidance.

Currently, I'm just beginning to explore my own feelings on the matter. 

In a short and synoptic sentence, to be blunt, as a biological male, I have never really felt the same sort of affinity towards my genitals that others seem to feel. I have, quite frequently throughout my life, searched up about the likes of castration and vasectomies without any anxiety about the idea; infact, viewing the possibility in a positive manner.

When it comes to my genitals, I'm quite ambivalent - I have, even as a gay man, had occasional experiences of autogynephilia; however, although I feel I would feel more natural without my male genitals, I have yet to feel comfortable enough to take the chop to them.

Additionally, in spite of the occasional autogynephilia, I feel that I would still always identify as a man - and looking as a man, perhaps slightly more androgynous, is how I would like to remain.

Does anyone have any advice or guidance they may be able to give me in regards to myself?",genderqueer,Possible genderqueer,1376981381.0,"{'created_utc': 1376956181, 'id': '1kp6da', 'num_comments': 1, 'score': 2, 'selftext': ""Hey everyone! \n\nAs someone who's identified as a gay man for many years, I haven't really begun to question my gender identity until just recently, and decided to turn here for a bit of guidance.\n\nCurrently, I'm just beginning to explore my own feelings on the matter. \n\nIn a short and synoptic sentence, to be blunt, as a biological male, I have never really felt the same sort of affinity towards my genitals that others seem to feel. I have, quite frequently throughout my life, searched up about the likes of castration and vasectomies without any anxiety about the idea; infact, viewing the possibility in a positive manner.\n\nWhen it comes to my genitals, I'm quite ambivalent - I have, even as a gay man, had occasional experiences of autogynephilia; however, although I feel I would feel more natural without my male genitals, I have yet to feel comfortable enough to take the chop to them.\n\nAdditionally, in spite of the occasional autogynephilia, I feel that I would still always identify as a man - and looking as a man, perhaps slightly more androgynous, is how I would like to remain.\n\nDoes anyone have any advice or guidance they may be able to give me in regards to myself?"", 'subreddit': 'genderqueer', 'title': 'Possible genderqueer', 'created': 1376981381.0}"
53,2013-08-19 23:57:47,1kp6ww,4,60,,genderqueer,Stolen from the frontpage... I thought it fit pretty well as a First World GQ Problem,1376981867.0,"{'created_utc': 1376956667, 'id': '1kp6ww', 'num_comments': 4, 'score': 60, 'selftext': '', 'subreddit': 'genderqueer', 'title': 'Stolen from the frontpage... I thought it fit pretty well as a First World GQ Problem', 'created': 1376981867.0}"
28,2013-08-20 08:58:54,1kq265,0,2,,trans,‘Third gender’ birth certificate marker option for German intersex newborns becomes law,1377014334.0,"{'created_utc': 1376989134, 'id': '1kq265', 'num_comments': 0, 'score': 2, 'selftext': '', 'subreddit': 'trans', 'title': '‘Third gender’ birth certificate marker option for German intersex newborns becomes law', 'created': 1377014334.0}"
54,2013-08-21 00:06:17,1krq7t,0,9,,genderqueer,"Adventure Time fans, an interesting discussion of BMO as a genderless character",1377068777.0,"{'created_utc': 1377043577, 'id': '1krq7t', 'num_comments': 0, 'score': 9, 'selftext': '', 'subreddit': 'genderqueer', 'title': 'Adventure Time fans, an interesting discussion of BMO as a genderless character', 'created': 1377068777.0}"
55,2013-08-21 01:57:05,1krygl,55,45,"[I wear pretty things and can probably kick your ass.](http://imgur.com/ajzcZII,ImNtdDK,93KCqfB#0)",genderqueer,F**k your gender rules! I'm a man!,1377075425.0,"{'created_utc': 1377050225, 'id': '1krygl', 'num_comments': 55, 'score': 45, 'selftext': '[I wear pretty things and can probably kick your ass.](http://imgur.com/ajzcZII,ImNtdDK,93KCqfB#0)', 'subreddit': 'genderqueer', 'title': ""F**k your gender rules! I'm a man!"", 'created': 1377075425.0}"
56,2013-08-21 07:30:13,1ksifo,16,10," all the GQ people i meet there birth sex is female, as someone with a penis i feel really alone here. 

Anybody understand?

 i feel so ugly... so out of shape.... so... lost... Like i don't fit in anyplace... not here or /r/transgender  


I wanna wear skirts n shit and express my fem side... but... ugh... why is this so confusing and isolating. 

**help**.",genderqueer,Feeling alone,1377095413.0,"{'created_utc': 1377070213, 'id': '1ksifo', 'num_comments': 16, 'score': 10, 'selftext': "" all the GQ people i meet there birth sex is female, as someone with a penis i feel really alone here. \n\nAnybody understand?\n\n i feel so ugly... so out of shape.... so... lost... Like i don't fit in anyplace... not here or /r/transgender  \n\n\nI wanna wear skirts n shit and express my fem side... but... ugh... why is this so confusing and isolating. \n\n**help**."", 'subreddit': 'genderqueer', 'title': 'Feeling alone', 'created': 1377095413.0}"
29,2013-08-21 08:16:05,1ksk5s,0,0,,trans,Mob attacks group of trans people in Turkey,1377098165.0,"{'created_utc': 1377072965, 'id': '1ksk5s', 'num_comments': 0, 'score': 0, 'selftext': '', 'subreddit': 'trans', 'title': 'Mob attacks group of trans people in Turkey', 'created': 1377098165.0}"
57,2013-08-21 18:29:27,1ktj0y,0,1,"(I'm a teenager.)


I've struggled with gender identity issues for as long as I can remember. When I first realized that I'm not 'exactly' (I say 'exactly' because like I said, I'm really confused but could possibly be cis) cis (FAAB), I came out and was *very* comfortable identifying as male.


It's been a while since then and I've kind of started struggling again. Overall I don't feel male, but I don't feel female. I used to loosely identify as genderfluid and I was really comfortable with it, but for some reason I don't feel like it ""fits"" me now.


In fact, I don't feel like *anything* really fits me now. I feel like *maybe* I could someday be comfortable with the identity of 'female' or *maybe* I could be comfortable with the identity of 'male' (or genderfluid/GQ again, bigender [which feels like the closest right now], etc), but nothing's solid. I *want* it to be solid.


I know I shouldn't feel the need to label myself but for some reason I do. And I know I shouldn't be so impatient with this since I can't force anything, but I've been getting really depressed over this. I have therapy in 2 days and I was thinking about talking about all this with my therapist, because the last thing I told her about my gender identity was that I'm comfortable as male. But I don't feel like that's the case anymore.


*sigh* Just looking for insight or encouragement or a friend or something.",genderqueer,Confused and overwhelmed...,1377134967.0,"{'created_utc': 1377109767, 'id': '1ktj0y', 'num_comments': 0, 'score': 1, 'selftext': '(I\'m a teenager.)\n\n\nI\'ve struggled with gender identity issues for as long as I can remember. When I first realized that I\'m not \'exactly\' (I say \'exactly\' because like I said, I\'m really confused but could possibly be cis) cis (FAAB), I came out and was *very* comfortable identifying as male.\n\n\nIt\'s been a while since then and I\'ve kind of started struggling again. Overall I don\'t feel male, but I don\'t feel female. I used to loosely identify as genderfluid and I was really comfortable with it, but for some reason I don\'t feel like it ""fits"" me now.\n\n\nIn fact, I don\'t feel like *anything* really fits me now. I feel like *maybe* I could someday be comfortable with the identity of \'female\' or *maybe* I could be comfortable with the identity of \'male\' (or genderfluid/GQ again, bigender [which feels like the closest right now], etc), but nothing\'s solid. I *want* it to be solid.\n\n\nI know I shouldn\'t feel the need to label myself but for some reason I do. And I know I shouldn\'t be so impatient with this since I can\'t force anything, but I\'ve been getting really depressed over this. I have therapy in 2 days and I was thinking about talking about all this with my therapist, because the last thing I told her about my gender identity was that I\'m comfortable as male. But I don\'t feel like that\'s the case anymore.\n\n\n*sigh* Just looking for insight or encouragement or a friend or something.', 'subreddit': 'genderqueer', 'title': 'Confused and overwhelmed...', 'created': 1377134967.0}"
58,2013-08-21 21:50:33,1ktzdx,6,11,"Hi there! Just wanted to let everyone know about a series of trans* orientated subreddits dedicated to the buying/selling and trading of goods. (As discussed and requested by several redditors)


/r/ftmmall and /r/mtfmall are pages which focus on that half of the spectrums transitional goods. (I.e. packers with /r/ftmmall and breast forms with /r/mtfmall).

There is also /r/transclothingmall which is a general place for trans* people of all types to buy/sell/trade various clothing items.


So stop on by and check it out.:)",genderqueer,Trans* Shopping Centers (subreddits),1377147033.0,"{'created_utc': 1377121833, 'id': '1ktzdx', 'num_comments': 6, 'score': 11, 'selftext': 'Hi there! Just wanted to let everyone know about a series of trans* orientated subreddits dedicated to the buying/selling and trading of goods. (As discussed and requested by several redditors)\n\n\n/r/ftmmall and /r/mtfmall are pages which focus on that half of the spectrums transitional goods. (I.e. packers with /r/ftmmall and breast forms with /r/mtfmall).\n\nThere is also /r/transclothingmall which is a general place for trans* people of all types to buy/sell/trade various clothing items.\n\n\nSo stop on by and check it out.:)', 'subreddit': 'genderqueer', 'title': 'Trans* Shopping Centers (subreddits)', 'created': 1377147033.0}"
30,2013-08-21 22:31:35,1ku2lm,1,4,,trans,Out of the Mouths of Babes: Supporting Our 7 Year Old Trans Son (New Zealand),1377149495.0,"{'created_utc': 1377124295, 'id': '1ku2lm', 'num_comments': 1, 'score': 4, 'selftext': '', 'subreddit': 'trans', 'title': 'Out of the Mouths of Babes: Supporting Our 7 Year Old Trans Son (New Zealand)', 'created': 1377149495.0}"
31,2013-08-22 03:49:18,1kup4s,0,5,,trans,Web reality show trans woman found dead,1377168558.0,"{'created_utc': 1377143358, 'id': '1kup4s', 'num_comments': 0, 'score': 5, 'selftext': '', 'subreddit': 'trans', 'title': 'Web reality show trans woman found dead', 'created': 1377168558.0}"
32,2013-08-22 09:16:51,1kv4ha,0,6,,trans,Los Angeles CBS affiliate used ‘man in a dress’ headline for trans murder victim report,1377188211.0,"{'created_utc': 1377163011, 'id': '1kv4ha', 'num_comments': 0, 'score': 6, 'selftext': '', 'subreddit': 'trans', 'title': 'Los Angeles CBS affiliate used ‘man in a dress’ headline for trans murder victim report', 'created': 1377188211.0}"
59,2013-08-22 10:39:17,1kv7aw,12,10,"And I really have no idea what to say at the appointment.
(For reference, i'm in the UK so I think I need to try and get to a GIC?).

I've never actually spoken with the GP before - I've just moved to a new area. Anyone know the best way to get a referral to the GIC (who hopefully will have more of an idea of what to do with myself).

Currently I'm a huge ball of nerves - I don't find it easy talking about stuff like this in person to anyone, even if I've known them for a long time. So the idea of putting it out infront of someone I don't know is... kinda scary.",genderqueer,So I appear to have made a GP appointment.,1377193157.0,"{'created_utc': 1377167957, 'id': '1kv7aw', 'num_comments': 12, 'score': 10, 'selftext': ""And I really have no idea what to say at the appointment.\n(For reference, i'm in the UK so I think I need to try and get to a GIC?).\n\nI've never actually spoken with the GP before - I've just moved to a new area. Anyone know the best way to get a referral to the GIC (who hopefully will have more of an idea of what to do with myself).\n\nCurrently I'm a huge ball of nerves - I don't find it easy talking about stuff like this in person to anyone, even if I've known them for a long time. So the idea of putting it out infront of someone I don't know is... kinda scary."", 'subreddit': 'genderqueer', 'title': 'So I appear to have made a GP appointment.', 'created': 1377193157.0}"
33,2013-08-22 12:19:28,1kvbcb,2,10,,trans,"Bradley Manning wants to live as a woman, be known as Chelsea",1377199168.0,"{'created_utc': 1377173968, 'id': '1kvbcb', 'num_comments': 2, 'score': 10, 'selftext': '', 'subreddit': 'trans', 'title': 'Bradley Manning wants to live as a woman, be known as Chelsea', 'created': 1377199168.0}"
60,2013-08-22 14:58:41,1kvl62,10,6,"So, I found [this](http://redd.it/1kqonl) thread on /r/asktransgender, which really spoke to me. My comment on this thread is what I'm looking for advice on: 

&gt;But what if, like the OP's situation, I have started to ""socially"" transition (FtM, I guess?), but I'm not sure if I even want to transition to male? I never really wanted a penis, nor do I despise my female body as much since I am able to dress as I like (masculine). I hate being referred to as a ""girl"", but I don't really care about the masculine pronouns so much. I want to change my name to a gender-neutral one and start going by it. I probably make very little sense right now, but I understand the OP's situation and feelings somewhat, and I'm confused.",genderqueer,Sorting something out.,1377208721.0,"{'created_utc': 1377183521, 'id': '1kvl62', 'num_comments': 10, 'score': 6, 'selftext': 'So, I found [this](http://redd.it/1kqonl) thread on /r/asktransgender, which really spoke to me. My comment on this thread is what I\'m looking for advice on: \n\n&gt;But what if, like the OP\'s situation, I have started to ""socially"" transition (FtM, I guess?), but I\'m not sure if I even want to transition to male? I never really wanted a penis, nor do I despise my female body as much since I am able to dress as I like (masculine). I hate being referred to as a ""girl"", but I don\'t really care about the masculine pronouns so much. I want to change my name to a gender-neutral one and start going by it. I probably make very little sense right now, but I understand the OP\'s situation and feelings somewhat, and I\'m confused.', 'subreddit': 'genderqueer', 'title': 'Sorting something out.', 'created': 1377208721.0}"
34,2013-08-22 15:48:39,1kvox9,32,19,,trans,"This keeps getting downvoted in the main subreddits, hopefully it gets traction here: Bradley Manning is transgendered",1377211719.0,"{'created_utc': 1377186519, 'id': '1kvox9', 'num_comments': 32, 'score': 19, 'selftext': '', 'subreddit': 'trans', 'title': 'This keeps getting downvoted in the main subreddits, hopefully it gets traction here: Bradley Manning is transgendered', 'created': 1377211719.0}"
61,2013-08-22 16:37:42,1kvsvt,26,7,"[yeah get phd is plan A, but i need a plan B to make plan A less stressful]

ok... i could transition, but that's not for me for various reasons

BUT i can't stand being called miss (or ms or mrs), i can't cope with being miss for the rest of my life

how do i sort this?

anti-discrimination law in my country now means government departments etc. aren't allowed to demand a gendered title, but i get the impression that people in general won't budge

e.g. i would sort of like to be a highschool teacher in my field if academia doesn't work out, but no way can i cope with a class of 30 teenagers calling me miss!! i could cope with mr... but i can't see that going over well?

[the presentation i feel comfortable in is kinda accidentally femme, i like skirts because they're comfortable, i don't do much to enhance my femininity, no make up, no hair removal, etc. but i tend to look 100% female, i am tall-ish with broad shoulders and a square jaw, but a very curvy figure and huge fat girly face cheeks. People are usually very presumptive of my gender unless they've got to know me on-line before seeing me in the flesh. A cop once put female on my witness statement, despite me telling him not to, and left my friend's gender blank, despite us both having the same F on our ID.]",genderqueer,"how do i get out of being called miss (or mrs, or ms) if i don't get my PhD?",1377214662.0,"{'created_utc': 1377189462, 'id': '1kvsvt', 'num_comments': 26, 'score': 7, 'selftext': ""[yeah get phd is plan A, but i need a plan B to make plan A less stressful]\n\nok... i could transition, but that's not for me for various reasons\n\nBUT i can't stand being called miss (or ms or mrs), i can't cope with being miss for the rest of my life\n\nhow do i sort this?\n\nanti-discrimination law in my country now means government departments etc. aren't allowed to demand a gendered title, but i get the impression that people in general won't budge\n\ne.g. i would sort of like to be a highschool teacher in my field if academia doesn't work out, but no way can i cope with a class of 30 teenagers calling me miss!! i could cope with mr... but i can't see that going over well?\n\n[the presentation i feel comfortable in is kinda accidentally femme, i like skirts because they're comfortable, i don't do much to enhance my femininity, no make up, no hair removal, etc. but i tend to look 100% female, i am tall-ish with broad shoulders and a square jaw, but a very curvy figure and huge fat girly face cheeks. People are usually very presumptive of my gender unless they've got to know me on-line before seeing me in the flesh. A cop once put female on my witness statement, despite me telling him not to, and left my friend's gender blank, despite us both having the same F on our ID.]"", 'subreddit': 'genderqueer', 'title': ""how do i get out of being called miss (or mrs, or ms) if i don't get my PhD?"", 'created': 1377214662.0}"
62,2013-08-22 16:46:43,1kvtll,4,35,"So, my family doesn't understand queer things. I was disowned by my family for coming out with my orientation. I was not expecting good things from coming out with my gender.

My mom said some things like, ""I don't understand what caused you to be like this"" and said she thinks something ""happened"" to make me this way. But after a good talk about [mice and the importance of diversity](http://www.roostertailscomic.com/?p=626), and reminding her of situations with me growing up (boobs grew; I hid them under a denim jacket and refused to wear a bra, got super aggressive during football when the other boys treated me more gently, etc), I think she is really coming to the idea that this is not only natural, not only very real, but it's also okay, and doesn't really change anything.

She ended things with ""Well, I've always said I just want you to be happy. I don't like you having this inner conflict."" This went so much better than I ever dreamed. We've come such a long way.",genderqueer,Just came out to my mom.,1377215203.0,"{'created_utc': 1377190003, 'id': '1kvtll', 'num_comments': 4, 'score': 35, 'selftext': 'So, my family doesn\'t understand queer things. I was disowned by my family for coming out with my orientation. I was not expecting good things from coming out with my gender.\n\nMy mom said some things like, ""I don\'t understand what caused you to be like this"" and said she thinks something ""happened"" to make me this way. But after a good talk about [mice and the importance of diversity](http://www.roostertailscomic.com/?p=626), and reminding her of situations with me growing up (boobs grew; I hid them under a denim jacket and refused to wear a bra, got super aggressive during football when the other boys treated me more gently, etc), I think she is really coming to the idea that this is not only natural, not only very real, but it\'s also okay, and doesn\'t really change anything.\n\nShe ended things with ""Well, I\'ve always said I just want you to be happy. I don\'t like you having this inner conflict."" This went so much better than I ever dreamed. We\'ve come such a long way.', 'subreddit': 'genderqueer', 'title': 'Just came out to my mom.', 'created': 1377215203.0}"
63,2013-08-22 23:19:10,1kwomw,6,9,"I mean, while I am identifying as gender queer, sometimes I get really confused about how I should express myself. Sometimes I feel like makeup and skirts are the bee's knees and other times I want to grow a beard and wear jeans and shit.",genderqueer,DAE ever have problems figuring how to express themselves?,1377238750.0,"{'created_utc': 1377213550, 'id': '1kwomw', 'num_comments': 6, 'score': 9, 'selftext': ""I mean, while I am identifying as gender queer, sometimes I get really confused about how I should express myself. Sometimes I feel like makeup and skirts are the bee's knees and other times I want to grow a beard and wear jeans and shit."", 'subreddit': 'genderqueer', 'title': 'DAE ever have problems figuring how to express themselves?', 'created': 1377238750.0}"
35,2013-08-23 00:00:40,1kwreq,0,0,,trans,New Subreddit to /r/FreeChelsea,1377241240.0,"{'created_utc': 1377216040, 'id': '1kwreq', 'num_comments': 0, 'score': 0, 'selftext': '', 'subreddit': 'trans', 'title': 'New Subreddit to /r/FreeChelsea', 'created': 1377241240.0}"
