Unnamed: 0,created_utc,id,num_comments,score,selftext,subreddit,title,created,d_
64,2013-08-23 02:43:04,1kx2l8,6,29,"First off, I'm unsure about a lot of pronouns and some terminology, so sorry in advance.

I haven't known Vance for more than a year or so... but, my friend came to me today as Valerie.  I've experienced dysphoria most my life, I know exactly what she's been through. But to be completely honest, I thought she was kidding at first... she'd always seemed to be the effeminate male type, and I guess I wrote off any chances of her being trans* as something so incredibly out-of-character for them that it couldn't happen.

But she wasn't kidding. Val had been Val for around two years, and after knowing me for just 11 months, she trusted that kind of knowledge with me. Personally, I opted for being neutrois, because I've never had the heart to transist... Val definitely has that, and she'll make a wonderful lady on the outside as well as the inside when she's done. It's incredibly moving, to know someone so close to me found where they fit best in this crazy world. It's more moving yet knowing I'm enough of a friend to her for her to open up like this. 

I know she's reading this right now, so I just want to say: this means a lot, and I hope everyone else here feels the same way. You'll still be yourself to me, as Vance or Val. Thanks again. &lt;3",genderqueer,"Today, my best friend came out to me, as trans.",1377250984.0,"{'created_utc': 1377225784, 'id': '1kx2l8', 'num_comments': 6, 'score': 29, 'selftext': ""First off, I'm unsure about a lot of pronouns and some terminology, so sorry in advance.\n\nI haven't known Vance for more than a year or so... but, my friend came to me today as Valerie.  I've experienced dysphoria most my life, I know exactly what she's been through. But to be completely honest, I thought she was kidding at first... she'd always seemed to be the effeminate male type, and I guess I wrote off any chances of her being trans* as something so incredibly out-of-character for them that it couldn't happen.\n\nBut she wasn't kidding. Val had been Val for around two years, and after knowing me for just 11 months, she trusted that kind of knowledge with me. Personally, I opted for being neutrois, because I've never had the heart to transist... Val definitely has that, and she'll make a wonderful lady on the outside as well as the inside when she's done. It's incredibly moving, to know someone so close to me found where they fit best in this crazy world. It's more moving yet knowing I'm enough of a friend to her for her to open up like this. \n\nI know she's reading this right now, so I just want to say: this means a lot, and I hope everyone else here feels the same way. You'll still be yourself to me, as Vance or Val. Thanks again. &lt;3"", 'subreddit': 'genderqueer', 'title': 'Today, my best friend came out to me, as trans.', 'created': 1377250984.0}"
65,2013-08-23 04:09:19,1kx8iu,3,3,"I come from a very conservative muslim country and I have a conservative family. But soon I'm going to be in college in the UK and I'll have a chance at coming out of the closet.

Not only am I bi and GQ, but I'm also an atheist. I've become so used to lying about myself that I'm not sure how I'm going to go about coming out. I don't want to fall into the same habits I have here. I also have a very feminine name so obviously I'm going to be immediately read as a women when I get there.

I'm terrified of going there and seeing that things aren't that different than it is here.",genderqueer,Going to college in a month. Some advice or support would be nice.,1377256159.0,"{'created_utc': 1377230959, 'id': '1kx8iu', 'num_comments': 3, 'score': 3, 'selftext': ""I come from a very conservative muslim country and I have a conservative family. But soon I'm going to be in college in the UK and I'll have a chance at coming out of the closet.\n\nNot only am I bi and GQ, but I'm also an atheist. I've become so used to lying about myself that I'm not sure how I'm going to go about coming out. I don't want to fall into the same habits I have here. I also have a very feminine name so obviously I'm going to be immediately read as a women when I get there.\n\nI'm terrified of going there and seeing that things aren't that different than it is here."", 'subreddit': 'genderqueer', 'title': 'Going to college in a month. Some advice or support would be nice.', 'created': 1377256159.0}"
36,2013-08-23 07:53:35,1kxj8k,0,9,,trans,"Life support disconnected, brutally beaten NYC trans woman dies",1377269615.0,"{'created_utc': 1377244415, 'id': '1kxj8k', 'num_comments': 0, 'score': 9, 'selftext': '', 'subreddit': 'trans', 'title': 'Life support disconnected, brutally beaten NYC trans woman dies', 'created': 1377269615.0}"
66,2013-08-23 10:39:00,1kxon2,5,1,"I do a bit of letter-writing activism and I'm in the UK. I play in the nonbinary.org wiki's UK recognition section: http://nonbinary.org/wiki/Recognition_(UK). I would totally join something like/r/nonbinaryUK.

Is there anyone else interested in this sort of thing?

Edit: I made it: /r/nonbinaryUK I have no idea what I'm doing but if anyone would like to mod with me or just subscribe bad things might not happen??",genderqueer,Any demand for a UK nonbinary/genderqueer subreddit? (x-post UKLGBT),1377279540.0,"{'created_utc': 1377254340, 'id': '1kxon2', 'num_comments': 5, 'score': 1, 'selftext': ""I do a bit of letter-writing activism and I'm in the UK. I play in the nonbinary.org wiki's UK recognition section: http://nonbinary.org/wiki/Recognition_(UK). I would totally join something like/r/nonbinaryUK.\n\nIs there anyone else interested in this sort of thing?\n\nEdit: I made it: /r/nonbinaryUK I have no idea what I'm doing but if anyone would like to mod with me or just subscribe bad things might not happen??"", 'subreddit': 'genderqueer', 'title': 'Any demand for a UK nonbinary/genderqueer subreddit? (x-post UKLGBT)', 'created': 1377279540.0}"
67,2013-08-23 14:50:15,1ky0xa,0,24,"the sales lady at The BodyShop couldn't tell what gender I was so she kept suggesting the most gender neutral shower gels she could find x) 
it was quite funny, and she had a really bewildered look on her face x) ofc I did my very best to not confirm anything one way or the other. hehe.. eventually I wound up with Blueberry shower gel and Raspberry body butter :3 mmmh, raspberry.",genderqueer,had fun while shopping at a mall today :),1377294615.0,"{'created_utc': 1377269415, 'id': '1ky0xa', 'num_comments': 0, 'score': 24, 'selftext': ""the sales lady at The BodyShop couldn't tell what gender I was so she kept suggesting the most gender neutral shower gels she could find x) \nit was quite funny, and she had a really bewildered look on her face x) ofc I did my very best to not confirm anything one way or the other. hehe.. eventually I wound up with Blueberry shower gel and Raspberry body butter :3 mmmh, raspberry."", 'subreddit': 'genderqueer', 'title': 'had fun while shopping at a mall today :)', 'created': 1377294615.0}"
68,2013-08-24 00:43:13,1kz7ds,0,15,"Hi everyone! Is anyone interested in helping to get my new subreddit off the ground? It's to promote the use of gender neutral pronouns. :)

http://www.reddit.com/r/genderneutral ",genderqueer,Gender Neutral Pronouns,1377330193.0,"{'created_utc': 1377304993, 'id': '1kz7ds', 'num_comments': 0, 'score': 15, 'selftext': ""Hi everyone! Is anyone interested in helping to get my new subreddit off the ground? It's to promote the use of gender neutral pronouns. :)\n\nhttp://www.reddit.com/r/genderneutral "", 'subreddit': 'genderqueer', 'title': 'Gender Neutral Pronouns', 'created': 1377330193.0}"
69,2013-08-24 03:49:07,1kzi4k,25,9,"I want to change my name to something gender neutral, but also on the unique side. So far, I'm leaning towards Ashton (Ash) or Shey. Does anyone have any ideas?

Edit: Thanks for all the website suggestions. I've already looked at a few on my name hunt quest. I also want some top of the head suggestions. What names pop out at you without having to look things up.",genderqueer,Gender neutral names?,1377341347.0,"{'created_utc': 1377316147, 'id': '1kzi4k', 'num_comments': 25, 'score': 9, 'selftext': ""I want to change my name to something gender neutral, but also on the unique side. So far, I'm leaning towards Ashton (Ash) or Shey. Does anyone have any ideas?\n\nEdit: Thanks for all the website suggestions. I've already looked at a few on my name hunt quest. I also want some top of the head suggestions. What names pop out at you without having to look things up."", 'subreddit': 'genderqueer', 'title': 'Gender neutral names?', 'created': 1377341347.0}"
37,2013-08-24 05:49:43,1kzo96,3,17,,trans,"Thanks to social media, NPR will now refer to Chelsea Manning as “she” instead of “he”",1377348583.0,"{'created_utc': 1377323383, 'id': '1kzo96', 'num_comments': 3, 'score': 17, 'selftext': '', 'subreddit': 'trans', 'title': 'Thanks to social media, NPR will now refer to Chelsea Manning as “she” instead of “he”', 'created': 1377348583.0}"
38,2013-08-24 21:30:33,1l0tyh,18,5,"Hi everyone, something has been on my mind on and off the past few days since the announcement regarding Chelsea's change from Bradley Manning. I'm not trans, but I am bisexual, so I am part of (if only in a small way) part of the LGBT community, and I find that I have mixed emotions regarding everything regarding Chelsea's announcement.

On one side she deserves to live life as she feels most comfortable, but on the other side I feel like the announcement comes at a very delicate time and threatens to give ample ammunition to the transphobes in much of the news world. Rather than focusing on the whistleblowing on its moral/ethical basis, I'm worried that her actions will be overshadowed by her gender identity and that it'll all be dismissed as ""someone really confused and emotionally unstable"" rather than examining the two situations (the whistleblowing and the switch from man to woman). I almost feel like she should have waited a bit longer, let the media storm die down before making the announcement, rather than doing it now and running the risk of further marginalizing the trans community. 

What does everyone think? As someone looking in from the outside, its easy for me to have a more critical opinion because I lack the same empathy for the situation that you all share, and there is a much greater impact of an announcement regarding gender identity than sexual preference, so my effort at putting myself in your shoes is ineffective at best.

I look forward to hearing from you all on this topic!",trans,Question for the trans community regarding Chelsea Manning,1377405033.0,"{'created_utc': 1377379833, 'id': '1l0tyh', 'num_comments': 18, 'score': 5, 'selftext': 'Hi everyone, something has been on my mind on and off the past few days since the announcement regarding Chelsea\'s change from Bradley Manning. I\'m not trans, but I am bisexual, so I am part of (if only in a small way) part of the LGBT community, and I find that I have mixed emotions regarding everything regarding Chelsea\'s announcement.\n\nOn one side she deserves to live life as she feels most comfortable, but on the other side I feel like the announcement comes at a very delicate time and threatens to give ample ammunition to the transphobes in much of the news world. Rather than focusing on the whistleblowing on its moral/ethical basis, I\'m worried that her actions will be overshadowed by her gender identity and that it\'ll all be dismissed as ""someone really confused and emotionally unstable"" rather than examining the two situations (the whistleblowing and the switch from man to woman). I almost feel like she should have waited a bit longer, let the media storm die down before making the announcement, rather than doing it now and running the risk of further marginalizing the trans community. \n\nWhat does everyone think? As someone looking in from the outside, its easy for me to have a more critical opinion because I lack the same empathy for the situation that you all share, and there is a much greater impact of an announcement regarding gender identity than sexual preference, so my effort at putting myself in your shoes is ineffective at best.\n\nI look forward to hearing from you all on this topic!', 'subreddit': 'trans', 'title': 'Question for the trans community regarding Chelsea Manning', 'created': 1377405033.0}"
70,2013-08-25 02:08:38,1l1an9,1,9,"Basically, the title. Lately i've been experiencing fantasies of me being a beautiful girl seducing other girls. I'm not considering the fact im genderqueer, just curious as to what to make of this.",genderqueer,hormone-crazy straight teen fantasizing about being a girl,1377421718.0,"{'created_utc': 1377396518, 'id': '1l1an9', 'num_comments': 1, 'score': 9, 'selftext': ""Basically, the title. Lately i've been experiencing fantasies of me being a beautiful girl seducing other girls. I'm not considering the fact im genderqueer, just curious as to what to make of this."", 'subreddit': 'genderqueer', 'title': 'hormone-crazy straight teen fantasizing about being a girl', 'created': 1377421718.0}"
39,2013-08-25 06:56:09,1l1ob8,10,7,"So first off this is from a cell phone so pardon the obvious side effects. 

I. . .  I really dont know what to say.  I cant stop thinking about the possibility of living as a woman.  (I am currently male).  If I have free time to think, I wonder how family would react.  Friends.  What would change about life.  i fantasize about magical events that would leave me female.  Winning the lottery and using the money for procedures.  Becoming my dark souls character XD  Let me just put out my own list of I guess pros and cons.  

Pros.
I think I would be happier with myself.  
I think I would be more comfortable.
I would spend less time thinking about how much life will suck as a male.
I wouldn't have to sneak into my moms room to look at her clothes and wish I would look halfway nice in them, if I could ever wear them.  
I wouldnt find thinking of the future so absolutely depressing and frustrating.  
Generally probably being just happier and more content with myself

Cons
My parents are lds.  I have no idea how they would react.  Probably try to convince me I am wrong then argue then quote scripture and in the end my mom would be crying and everyone would be awkward if not straight up angry at me.  Except my brother.  He would be the chill one...
I have no monetary way to do any sort of hormone therapy or buy new clothes or do any kind of surgery.  That also means no money for a councillor (probably spelled wrong) or anything like that, hence dr. Reddit...
Social stigmas in getting jobs, houses, or just living.  
My friends. . .  I know a few of them would be put off to say the least.
The fact I would make an ugly woman with body hair and being overweight and all that crap.  (Though overweight is kinda improving I guess)
And lastly, I am attracted to girls, so throw being a lesbian on top of trans.


I dont know.  I dont understand what I think or feel or what.  All I know is that the weight of the whole thing is suffocating and I dont know if its just me being silly or if I actually feel this way.  Fuck this all sounds so cheesy.  I dont know what to do about feeling this way.  My mentality so far has been ignore it it will go away or I will move on.  
Well that changed for me when I picture my future and contemplate if my current future is worth anything.  Then I think about alternatives.  

If all this just sounds like normal teenage angst, just tell me so I can try to move on from it.  I dont know.  If its real, well I still dont know. 
If this isnt the right subreddit, sorry.  I generally lurk so this is new.  For a lot of reasons.

Edit: 
Just wanted to give you guys an update and thank you again for your help.  I feel I am transgender, and will hopefully be able to talk to a school councillor about it this year, as well as my brother and one of my friends.  
Again, thank you guys/girls so much for the help.  I was pretty sure that if I didnt tell anybody about my feelings I would suffocate.  ♡   
",trans,I dont know if I am trans or just confused...,1377438969.0,"{'created_utc': 1377413769, 'id': '1l1ob8', 'num_comments': 10, 'score': 7, 'selftext': ""So first off this is from a cell phone so pardon the obvious side effects. \n\nI. . .  I really dont know what to say.  I cant stop thinking about the possibility of living as a woman.  (I am currently male).  If I have free time to think, I wonder how family would react.  Friends.  What would change about life.  i fantasize about magical events that would leave me female.  Winning the lottery and using the money for procedures.  Becoming my dark souls character XD  Let me just put out my own list of I guess pros and cons.  \n\nPros.\nI think I would be happier with myself.  \nI think I would be more comfortable.\nI would spend less time thinking about how much life will suck as a male.\nI wouldn't have to sneak into my moms room to look at her clothes and wish I would look halfway nice in them, if I could ever wear them.  \nI wouldnt find thinking of the future so absolutely depressing and frustrating.  \nGenerally probably being just happier and more content with myself\n\nCons\nMy parents are lds.  I have no idea how they would react.  Probably try to convince me I am wrong then argue then quote scripture and in the end my mom would be crying and everyone would be awkward if not straight up angry at me.  Except my brother.  He would be the chill one...\nI have no monetary way to do any sort of hormone therapy or buy new clothes or do any kind of surgery.  That also means no money for a councillor (probably spelled wrong) or anything like that, hence dr. Reddit...\nSocial stigmas in getting jobs, houses, or just living.  \nMy friends. . .  I know a few of them would be put off to say the least.\nThe fact I would make an ugly woman with body hair and being overweight and all that crap.  (Though overweight is kinda improving I guess)\nAnd lastly, I am attracted to girls, so throw being a lesbian on top of trans.\n\n\nI dont know.  I dont understand what I think or feel or what.  All I know is that the weight of the whole thing is suffocating and I dont know if its just me being silly or if I actually feel this way.  Fuck this all sounds so cheesy.  I dont know what to do about feeling this way.  My mentality so far has been ignore it it will go away or I will move on.  \nWell that changed for me when I picture my future and contemplate if my current future is worth anything.  Then I think about alternatives.  \n\nIf all this just sounds like normal teenage angst, just tell me so I can try to move on from it.  I dont know.  If its real, well I still dont know. \nIf this isnt the right subreddit, sorry.  I generally lurk so this is new.  For a lot of reasons.\n\nEdit: \nJust wanted to give you guys an update and thank you again for your help.  I feel I am transgender, and will hopefully be able to talk to a school councillor about it this year, as well as my brother and one of my friends.  \nAgain, thank you guys/girls so much for the help.  I was pretty sure that if I didnt tell anybody about my feelings I would suffocate.  ♡   \n"", 'subreddit': 'trans', 'title': 'I dont know if I am trans or just confused...', 'created': 1377438969.0}"
71,2013-08-25 12:43:49,1l1xzd,7,10,"I've heard of ser, which is pronounced ""sair""; is that the only alternative? I'm not keen because to me and most people I've spoken to it looks like it's just pronounced ""sir"".

I'd really like to write something in place of ""Dear sir/madam"" in letters. I sometimes use ""To whom it may concern,"" but what if you know who it concerns (eg: the secretary) and you just don't want to assume a binary gender?

I never say ""excuse me, sir?"" to strangers in the street, but it would be cool to be able to do that in a neutral way.

This is something people ask me a lot, in various online ways, and I never know. There's always a few people who say that ""sir"" is gender-neutral, which just doesn't feel right for lots of androcorpid people. Erm.

This post is unstructured! I hope it makes sense. :)

(Cross-posted to /r/nonbinaryUK and /r/genderneutral)",genderqueer,A question I can't find the answer to: are there neutral versions of sir/madam? (x-post to nonbinaryUK and genderneutral),1377459829.0,"{'created_utc': 1377434629, 'id': '1l1xzd', 'num_comments': 7, 'score': 10, 'selftext': 'I\'ve heard of ser, which is pronounced ""sair""; is that the only alternative? I\'m not keen because to me and most people I\'ve spoken to it looks like it\'s just pronounced ""sir"".\n\nI\'d really like to write something in place of ""Dear sir/madam"" in letters. I sometimes use ""To whom it may concern,"" but what if you know who it concerns (eg: the secretary) and you just don\'t want to assume a binary gender?\n\nI never say ""excuse me, sir?"" to strangers in the street, but it would be cool to be able to do that in a neutral way.\n\nThis is something people ask me a lot, in various online ways, and I never know. There\'s always a few people who say that ""sir"" is gender-neutral, which just doesn\'t feel right for lots of androcorpid people. Erm.\n\nThis post is unstructured! I hope it makes sense. :)\n\n(Cross-posted to /r/nonbinaryUK and /r/genderneutral)', 'subreddit': 'genderqueer', 'title': ""A question I can't find the answer to: are there neutral versions of sir/madam? (x-post to nonbinaryUK and genderneutral)"", 'created': 1377459829.0}"
72,2013-08-25 22:39:58,1l2x1p,37,32,"I would love to see pics of your beautiful genderqueer faces! also any sort of things to do to decorate yourself in a genderqueer way (I mean anything we do is genderqueer because we are genderqueer haha) 

I recently was going to re-dye my hair but I liked how it looked after bleaching the roots so I left it that way: [Pics](http://imgur.com/a/p89fb)

Your turn! ",genderqueer,I want to see your genderqueerness! Face/fashion thread?,1377495598.0,"{'created_utc': 1377470398, 'id': '1l2x1p', 'num_comments': 37, 'score': 32, 'selftext': 'I would love to see pics of your beautiful genderqueer faces! also any sort of things to do to decorate yourself in a genderqueer way (I mean anything we do is genderqueer because we are genderqueer haha) \n\nI recently was going to re-dye my hair but I liked how it looked after bleaching the roots so I left it that way: [Pics](http://imgur.com/a/p89fb)\n\nYour turn! ', 'subreddit': 'genderqueer', 'title': 'I want to see your genderqueerness! Face/fashion thread?', 'created': 1377495598.0}"
73,2013-08-26 05:07:17,1l3m5t,0,1,,genderqueer,Sex-assignment surgery on a child ruled unconstitutional,1377518837.0,"{'created_utc': 1377493637, 'id': '1l3m5t', 'num_comments': 0, 'score': 1, 'selftext': '', 'subreddit': 'genderqueer', 'title': 'Sex-assignment surgery on a child ruled unconstitutional', 'created': 1377518837.0}"
74,2013-08-26 06:07:07,1l3p5l,32,22,"Hey everyone,
I'm wondering if anyone out there identifies as genderqueer but still presents in a way that pretty much conforms to what they were assigned at birth. I'm having trouble working out how I want to identify because of this. 

I'm FAAB but don't feel that female-ness or woman-ness is that important to my identity, but I don't mind ""she"" pronouns and my femme name. I often dress in masculine clothes, but not in a neutral way, more of a lesbian sort of way- everyone definitely reads me as female. The Gender field on forms has started to give me pause, though, because I don't really feel like there's a point to me checking ""female."" It just don't matter to me. Maybe there's a different word that I don't know that means this? Ultimately it doesn't matter I suppose.

But original question. Anyone not *present* as genderqueer but still identify that way?

Edit: You are all so nice, I really love hearing your answers.",genderqueer,Identifying as GQ without presenting as GQ?,1377522427.0,"{'created_utc': 1377497227, 'id': '1l3p5l', 'num_comments': 32, 'score': 22, 'selftext': 'Hey everyone,\nI\'m wondering if anyone out there identifies as genderqueer but still presents in a way that pretty much conforms to what they were assigned at birth. I\'m having trouble working out how I want to identify because of this. \n\nI\'m FAAB but don\'t feel that female-ness or woman-ness is that important to my identity, but I don\'t mind ""she"" pronouns and my femme name. I often dress in masculine clothes, but not in a neutral way, more of a lesbian sort of way- everyone definitely reads me as female. The Gender field on forms has started to give me pause, though, because I don\'t really feel like there\'s a point to me checking ""female."" It just don\'t matter to me. Maybe there\'s a different word that I don\'t know that means this? Ultimately it doesn\'t matter I suppose.\n\nBut original question. Anyone not *present* as genderqueer but still identify that way?\n\nEdit: You are all so nice, I really love hearing your answers.', 'subreddit': 'genderqueer', 'title': 'Identifying as GQ without presenting as GQ?', 'created': 1377522427.0}"
40,2013-08-26 08:06:40,1l3tx2,0,9,,trans,Defending trans rights? LGBs apparently leave Ts to fend for themselves,1377529600.0,"{'created_utc': 1377504400, 'id': '1l3tx2', 'num_comments': 0, 'score': 9, 'selftext': '', 'subreddit': 'trans', 'title': 'Defending trans rights? LGBs apparently leave Ts to fend for themselves', 'created': 1377529600.0}"
