Unnamed: 0,created_utc,id,num_comments,score,selftext,subreddit,title,created,d_
0,2013-08-01 04:46:09,1jh2xn,0,5,,trans,16-year-old trans kid lobbies California Gov. Brown for K-12 equality bill signature,1375357569.0,"{'created_utc': 1375332369, 'id': '1jh2xn', 'num_comments': 0, 'score': 5, 'selftext': '', 'subreddit': 'trans', 'title': '16-year-old trans kid lobbies California Gov. Brown for K-12 equality bill signature', 'created': 1375357569.0}"
0,2013-08-01 13:35:49,1jhqwf,2,15,"Sometimes transgender issues cloud the thinking because they're so personal (not to mention political, religious, divisive).  Analogies work well for me, maybe this one will for you.  I found an article (source unknown) years ago about gifted students and today I suddenly found the assertion relevant to gender issues too:

Gifted students grow up in schools surrounded by peers who are intellectually or emotionally behind them.  It can be tough spending so much time with people when their interests seem so immature.  Furthermore, schoolwork becomes tedious and boring.  Teachers address this by claiming that it's your fault for being profoundly uninterested in kindergarten puzzles.  ""If you're so smart, you should be able to complete the schoolwork *and* understand how to make friends with your peers!""

They are correct - learning to do tedious tasks and make friends with relative duds is a good skill.  However, what our education system fails to understand is that there is a difference between *learning* how to do it and *living* with it.  Being forced to practice that ""lesson"" for 6 hours a day, day in and day out, for your *entire childhood* is nothing short of *torture*.  It's *abuse*.

The same applies to transgender issues.  You can, and already have, learned to play society's gender role.  And most transgendered people do it when they need to.  Living it, however, is something entirely different.  It is *torture* and it is wrong.  Anyone who insists you play the part for the rest of your life needs to be taught some perspective.",genderqueer,"When the world tells you to play your role, act your part, and doesn't understand it is torture.",1375389349.0,"{'created_utc': 1375364149, 'id': '1jhqwf', 'num_comments': 2, 'score': 15, 'selftext': 'Sometimes transgender issues cloud the thinking because they\'re so personal (not to mention political, religious, divisive).  Analogies work well for me, maybe this one will for you.  I found an article (source unknown) years ago about gifted students and today I suddenly found the assertion relevant to gender issues too:\n\nGifted students grow up in schools surrounded by peers who are intellectually or emotionally behind them.  It can be tough spending so much time with people when their interests seem so immature.  Furthermore, schoolwork becomes tedious and boring.  Teachers address this by claiming that it\'s your fault for being profoundly uninterested in kindergarten puzzles.  ""If you\'re so smart, you should be able to complete the schoolwork *and* understand how to make friends with your peers!""\n\nThey are correct - learning to do tedious tasks and make friends with relative duds is a good skill.  However, what our education system fails to understand is that there is a difference between *learning* how to do it and *living* with it.  Being forced to practice that ""lesson"" for 6 hours a day, day in and day out, for your *entire childhood* is nothing short of *torture*.  It\'s *abuse*.\n\nThe same applies to transgender issues.  You can, and already have, learned to play society\'s gender role.  And most transgendered people do it when they need to.  Living it, however, is something entirely different.  It is *torture* and it is wrong.  Anyone who insists you play the part for the rest of your life needs to be taught some perspective.', 'subreddit': 'genderqueer', 'title': ""When the world tells you to play your role, act your part, and doesn't understand it is torture."", 'created': 1375389349.0}"
1,2013-08-01 20:50:32,1jiq2v,9,21,"I started questioning my gender a few years ago. I remember one night in highschool having an epiphany that I must be gay, and then the next morning I felt completely different, and it's been like that ever since. I know I'm not gay now, I'm pretty comfortable saying that my sexuality is bisexual and that I'm mostly attracted to girls, but occasionally to guys as well. However, I've been trying to ignore the issues I have with my gender (and you can probably guess how that turns out...).

The past year has been me living as I always have and ignoring it, and then it all came flooding back in the past couple of weeks. So, I've decided to start checking out the lgbt scene where I live and try to find a therapist to talk to about all of this.

I feel more feminine at times, and I want to explore that more, and I started by ordering some clothes and dressing up for the first time. It was nice, but when I looked at myself in the mirror I couldn't help but feel out of place. I have to wonder if this is more of a sexual thing (it does get me off a little bit..) and not really who I am.

Really, I feel like I don't want to have to separate sides of myself. I don't want to dress up in private and be a guy in public. I want to blend the two fluidly, because that's what I feel like. Wear makeup, maybe some androgynous clothing, keep it subtle, maybe push it sometimes... but whenever I have gone out wearing eye liner and blush (about a year ago now) I felt so awkward and out of place. It doesn't help that my voice is very masculine, as is my way of talking, and I don't want to change that a huge amount.

I'm not sure if this is just normal hesitance or a sign that I'm acting out of some repressed urge and swinging so far the other direction that it's not really me either. I know I'm afraid, I've always been afraid to just be me and be looked down on, but I don't want to let that control me anymore. I just want to figure out who I am and be that person.

So I guess, tl;dr, is it normal to feel awkward when you first start exploring your gender?",genderqueer,Do you ever feel awkward?,1375415432.0,"{'created_utc': 1375390232, 'id': '1jiq2v', 'num_comments': 9, 'score': 21, 'selftext': ""I started questioning my gender a few years ago. I remember one night in highschool having an epiphany that I must be gay, and then the next morning I felt completely different, and it's been like that ever since. I know I'm not gay now, I'm pretty comfortable saying that my sexuality is bisexual and that I'm mostly attracted to girls, but occasionally to guys as well. However, I've been trying to ignore the issues I have with my gender (and you can probably guess how that turns out...).\n\nThe past year has been me living as I always have and ignoring it, and then it all came flooding back in the past couple of weeks. So, I've decided to start checking out the lgbt scene where I live and try to find a therapist to talk to about all of this.\n\nI feel more feminine at times, and I want to explore that more, and I started by ordering some clothes and dressing up for the first time. It was nice, but when I looked at myself in the mirror I couldn't help but feel out of place. I have to wonder if this is more of a sexual thing (it does get me off a little bit..) and not really who I am.\n\nReally, I feel like I don't want to have to separate sides of myself. I don't want to dress up in private and be a guy in public. I want to blend the two fluidly, because that's what I feel like. Wear makeup, maybe some androgynous clothing, keep it subtle, maybe push it sometimes... but whenever I have gone out wearing eye liner and blush (about a year ago now) I felt so awkward and out of place. It doesn't help that my voice is very masculine, as is my way of talking, and I don't want to change that a huge amount.\n\nI'm not sure if this is just normal hesitance or a sign that I'm acting out of some repressed urge and swinging so far the other direction that it's not really me either. I know I'm afraid, I've always been afraid to just be me and be looked down on, but I don't want to let that control me anymore. I just want to figure out who I am and be that person.\n\nSo I guess, tl;dr, is it normal to feel awkward when you first start exploring your gender?"", 'subreddit': 'genderqueer', 'title': 'Do you ever feel awkward?', 'created': 1375415432.0}"
1,2013-08-02 08:59:43,1jjz50,5,44,,trans,Women defined,1375459183.0,"{'created_utc': 1375433983, 'id': '1jjz50', 'num_comments': 5, 'score': 44, 'selftext': '', 'subreddit': 'trans', 'title': 'Women defined', 'created': 1375459183.0}"
2,2013-08-02 09:15:02,1jjzlm,2,2,,trans,"Researchers finds gender far from fixed in the embryo, sex cells must be actively prevented from changing",1375460102.0,"{'created_utc': 1375434902, 'id': '1jjzlm', 'num_comments': 2, 'score': 2, 'selftext': '', 'subreddit': 'trans', 'title': 'Researchers finds gender far from fixed in the embryo, sex cells must be actively prevented from changing', 'created': 1375460102.0}"
3,2013-08-02 11:47:01,1jk4lf,0,0,,trans,One of the happiest days of my life. New passport !,1375469221.0,"{'created_utc': 1375444021, 'id': '1jk4lf', 'num_comments': 0, 'score': 0, 'selftext': '', 'subreddit': 'trans', 'title': 'One of the happiest days of my life. New passport !', 'created': 1375469221.0}"
4,2013-08-02 13:24:59,1jk94g,1,28,,trans,One of the happiest days of my life. New passport !!!,1375475099.0,"{'created_utc': 1375449899, 'id': '1jk94g', 'num_comments': 1, 'score': 28, 'selftext': '', 'subreddit': 'trans', 'title': 'One of the happiest days of my life. New passport !!!', 'created': 1375475099.0}"
2,2013-08-03 02:11:35,1jlrfq,11,14,"This post isn't really asking for advice or anything. Just I have a friend who's also gender nonconforming, and I'm seeing her tomorrow to talk to her about me identifying as genderqueer. I'm really nervous and I have no idea what I'm going to say, but making this post makes it feel more real, somehow.",genderqueer,I'm coming out to my friend tomorrow!,1375521095.0,"{'created_utc': 1375495895, 'id': '1jlrfq', 'num_comments': 11, 'score': 14, 'selftext': ""This post isn't really asking for advice or anything. Just I have a friend who's also gender nonconforming, and I'm seeing her tomorrow to talk to her about me identifying as genderqueer. I'm really nervous and I have no idea what I'm going to say, but making this post makes it feel more real, somehow."", 'subreddit': 'genderqueer', 'title': ""I'm coming out to my friend tomorrow!"", 'created': 1375521095.0}"
3,2013-08-03 07:54:34,1jm8l5,23,51,,genderqueer,What happened when a woman's son wore a pink headband to Walmart,1375541674.0,"{'created_utc': 1375516474, 'id': '1jm8l5', 'num_comments': 23, 'score': 51, 'selftext': '', 'subreddit': 'genderqueer', 'title': ""What happened when a woman's son wore a pink headband to Walmart"", 'created': 1375541674.0}"
5,2013-08-03 17:45:50,1jmvzh,4,25,,trans,My MTF Daughter,1375577150.0,"{'created_utc': 1375551950, 'id': '1jmvzh', 'num_comments': 4, 'score': 25, 'selftext': '', 'subreddit': 'trans', 'title': 'My MTF Daughter', 'created': 1375577150.0}"
6,2013-08-03 17:48:26,1jmw5l,0,8,,trans,We Think He Might Be a Boy - Raising a Transgender Child,1375577306.0,"{'created_utc': 1375552106, 'id': '1jmw5l', 'num_comments': 0, 'score': 8, 'selftext': '', 'subreddit': 'trans', 'title': 'We Think He Might Be a Boy - Raising a Transgender Child', 'created': 1375577306.0}"
4,2013-08-03 20:20:16,1jn5j3,0,13,,genderqueer,Here and (gender) queer,1375586416.0,"{'created_utc': 1375561216, 'id': '1jn5j3', 'num_comments': 0, 'score': 13, 'selftext': '', 'subreddit': 'genderqueer', 'title': 'Here and (gender) queer', 'created': 1375586416.0}"
5,2013-08-04 22:44:56,1jpdny,6,17,"I was getting on a small passenger boat and I noticed that the guy was either sir or ma'aming people. Eg: ""would you like a hand sir?"" He looked at me and changed it to Fella! I'm hoping that means he didn't know which to choose although he could have just been thinking 'that girl's trying to dress like a guy. I'll appease her.' 
 
A bit later, maybe twenty minutes or so, I was messing around with these two kids who seemed to be drawn to me for some reason. The girl, who was about four possibly five, just outright said ""are you a boy or a girl?"" To which I replied ""neither"" but then before I could say anything else my aunt came over (I'm so in the closet my bestfriend has goat legs) so I had to change my answer to ""girl"". I've read about that others on this sub reddit being asked that but I didn't think it would ever happen to me!!!!!",genderqueer,Two interesting moments today...,1375681496.0,"{'created_utc': 1375656296, 'id': '1jpdny', 'num_comments': 6, 'score': 17, 'selftext': 'I was getting on a small passenger boat and I noticed that the guy was either sir or ma\'aming people. Eg: ""would you like a hand sir?"" He looked at me and changed it to Fella! I\'m hoping that means he didn\'t know which to choose although he could have just been thinking \'that girl\'s trying to dress like a guy. I\'ll appease her.\' \n \nA bit later, maybe twenty minutes or so, I was messing around with these two kids who seemed to be drawn to me for some reason. The girl, who was about four possibly five, just outright said ""are you a boy or a girl?"" To which I replied ""neither"" but then before I could say anything else my aunt came over (I\'m so in the closet my bestfriend has goat legs) so I had to change my answer to ""girl"". I\'ve read about that others on this sub reddit being asked that but I didn\'t think it would ever happen to me!!!!!', 'subreddit': 'genderqueer', 'title': 'Two interesting moments today...', 'created': 1375681496.0}"
6,2013-08-05 06:15:14,1jq4yb,2,13,,genderqueer,Young People Push Back Against Gender Categories,1375708514.0,"{'created_utc': 1375683314, 'id': '1jq4yb', 'num_comments': 2, 'score': 13, 'selftext': '', 'subreddit': 'genderqueer', 'title': 'Young People Push Back Against Gender Categories', 'created': 1375708514.0}"
7,2013-08-05 07:32:54,1jq86v,0,0,,trans,"Transgender mayor’s life turned into a Broadway-style musical, gets rave reviews",1375713174.0,"{'created_utc': 1375687974, 'id': '1jq86v', 'num_comments': 0, 'score': 0, 'selftext': '', 'subreddit': 'trans', 'title': 'Transgender mayor’s life turned into a Broadway-style musical, gets rave reviews', 'created': 1375713174.0}"
7,2013-08-05 08:02:39,1jq99y,2,4,,genderqueer,What's the Best Way to Raise Children Who Might Have Gender Identity Issues?,1375714959.0,"{'created_utc': 1375689759, 'id': '1jq99y', 'num_comments': 2, 'score': 4, 'selftext': '', 'subreddit': 'genderqueer', 'title': ""What's the Best Way to Raise Children Who Might Have Gender Identity Issues?"", 'created': 1375714959.0}"
8,2013-08-05 09:30:28,1jqc7c,0,13,,genderqueer,Boy or girl? Society slowly accepting idea birth may not decide gender,1375720228.0,"{'created_utc': 1375695028, 'id': '1jqc7c', 'num_comments': 0, 'score': 13, 'selftext': '', 'subreddit': 'genderqueer', 'title': 'Boy or girl? Society slowly accepting idea birth may not decide gender', 'created': 1375720228.0}"
9,2013-08-05 15:56:53,1jqv3z,7,6,"Hey,

I am a 29 year old guy, married with 2 kids, and I'm pretty confused :(

Quick back story, used to try on my sisters and mothers clothes and underwear when I was a teenager, i've thought for a while that it was just a sex thing for me then, but thinking about it more I clearly remember wanting to always wear womens underwear, always wanted to go to sleep in them and wake up in the morning wearing them instead of boxers, but was terrified that my Mum or Dad would pop their head in at night to check on me and see, if the covers had fallen off or something. 

I joined the army when I was 19 and didnt really crossdress at all for years, fantasised about it, but never doing it, then when I was 26 I left the forces, met my wife and got married, had kids etc, I told my wife all about this, and she encouraged it, still does, saying that she loves me for who I am, not INSPITE of who I am, which is awesome , we've done so much in the past 4 or 5 years, and she's really made me slowly start to creap out of my shell, we go out shopping together for clothes, i've been out a few times fully dressed and made up, been to a MAC counter in guy mode and sat getting a foundation match in a packed dept store, started shaving my legs for a while and then actually started going out with shorts on + shaven legs, grown my hair long and started going to work in a ponytail, and this weekend, went and got ourselves some matching tattoo's, hers on her upper back and mine in a very sexy + feminine position on my hip, which I love!! This is all sounds great, and it would be, but its confusing the hell out of me, because I just don't feel like a guy, I get jealous of almost every attractive woman I see, its not the normal guy thoughts though, I want to BE them, not be IN them, is the easiest and bluntest (sorry) way I can put it :( I watch my wife getting dressed and I'm jealous of her curves and breasts and long thick hair that always looks good, she's said it before and I can't ever deny it, because its true, I want to be her. 

Not related to my gender confusedness, but kinda because it shows a lot about my personality, I've also always wanted to hook up with guys, talking to them on good ol' AOL chat when I was younger and arranging to meet up but then bottling it, I joined the army when I was 19 and spent much of my early 20's in the following cycle on nights out every weekend, go out with friends and get drunk, slink off to a nearby gay bar and hang around outside scared to go in in-case I knew anyone in there, go back home and immediately get on webcams for guys, arrange to meet up, bottle it incase anyone found out, rinse and repeat.

I've always been painfully shy, and pretty socially awkward at times, always terrified of other peoples opinions and what they would do or say about the things that I like/wore etc. I think i'm starting to shake this now, with a lot of help from my wife, I recently went for a day out to a farm with my little girl, wearing some skinny jeans, a long, blatantly womens, cardigan and my hair tied back and put in some plaits, something which I would NEVER have done as little as a year ago, i really feel like I'm finding myself, but I'm not sure who that person is. 

In a perfect world I'd have a smooth stubble free face, with a curvy shape and some boobs, which makes me sound trans, and for a while I thought I was (going on depression meds after imagining killing myself on the commute most mornings, and getting lost staring into a mirror thinking about stabbing my adams apple with some tweezers!), but I don't think I feel like a woman! :( and transition is also something I don't know if I could ever go through with, unless I was holding a gun to my head every night, but that won't happen as I am not desperately unhappy as a guy, and I get butterflies in my stomach just thinking about coming out into the open with all that and being out there for friends and family to disown and the world to laugh and stare at as I pass in the street.

I kinda wish there was a button that I could press where I wake up as a woman tomorrow, with my relationship intact, and my work colleageus acting like I have always turned up to work in a skirt and heels :(

And thats my rant done, there's no conclusion, I'm not even sure if I'm asking anything in particular, I'd just really like some advice on this if possible.

Thanks

Going to xpost this in /r/asktransgender too as I'm not sure at all where I fall, incase you hadnt realised!

",genderqueer,Confused.... umm person??,1375743413.0,"{'created_utc': 1375718213, 'id': '1jqv3z', 'num_comments': 7, 'score': 6, 'selftext': ""Hey,\n\nI am a 29 year old guy, married with 2 kids, and I'm pretty confused :(\n\nQuick back story, used to try on my sisters and mothers clothes and underwear when I was a teenager, i've thought for a while that it was just a sex thing for me then, but thinking about it more I clearly remember wanting to always wear womens underwear, always wanted to go to sleep in them and wake up in the morning wearing them instead of boxers, but was terrified that my Mum or Dad would pop their head in at night to check on me and see, if the covers had fallen off or something. \n\nI joined the army when I was 19 and didnt really crossdress at all for years, fantasised about it, but never doing it, then when I was 26 I left the forces, met my wife and got married, had kids etc, I told my wife all about this, and she encouraged it, still does, saying that she loves me for who I am, not INSPITE of who I am, which is awesome , we've done so much in the past 4 or 5 years, and she's really made me slowly start to creap out of my shell, we go out shopping together for clothes, i've been out a few times fully dressed and made up, been to a MAC counter in guy mode and sat getting a foundation match in a packed dept store, started shaving my legs for a while and then actually started going out with shorts on + shaven legs, grown my hair long and started going to work in a ponytail, and this weekend, went and got ourselves some matching tattoo's, hers on her upper back and mine in a very sexy + feminine position on my hip, which I love!! This is all sounds great, and it would be, but its confusing the hell out of me, because I just don't feel like a guy, I get jealous of almost every attractive woman I see, its not the normal guy thoughts though, I want to BE them, not be IN them, is the easiest and bluntest (sorry) way I can put it :( I watch my wife getting dressed and I'm jealous of her curves and breasts and long thick hair that always looks good, she's said it before and I can't ever deny it, because its true, I want to be her. \n\nNot related to my gender confusedness, but kinda because it shows a lot about my personality, I've also always wanted to hook up with guys, talking to them on good ol' AOL chat when I was younger and arranging to meet up but then bottling it, I joined the army when I was 19 and spent much of my early 20's in the following cycle on nights out every weekend, go out with friends and get drunk, slink off to a nearby gay bar and hang around outside scared to go in in-case I knew anyone in there, go back home and immediately get on webcams for guys, arrange to meet up, bottle it incase anyone found out, rinse and repeat.\n\nI've always been painfully shy, and pretty socially awkward at times, always terrified of other peoples opinions and what they would do or say about the things that I like/wore etc. I think i'm starting to shake this now, with a lot of help from my wife, I recently went for a day out to a farm with my little girl, wearing some skinny jeans, a long, blatantly womens, cardigan and my hair tied back and put in some plaits, something which I would NEVER have done as little as a year ago, i really feel like I'm finding myself, but I'm not sure who that person is. \n\nIn a perfect world I'd have a smooth stubble free face, with a curvy shape and some boobs, which makes me sound trans, and for a while I thought I was (going on depression meds after imagining killing myself on the commute most mornings, and getting lost staring into a mirror thinking about stabbing my adams apple with some tweezers!), but I don't think I feel like a woman! :( and transition is also something I don't know if I could ever go through with, unless I was holding a gun to my head every night, but that won't happen as I am not desperately unhappy as a guy, and I get butterflies in my stomach just thinking about coming out into the open with all that and being out there for friends and family to disown and the world to laugh and stare at as I pass in the street.\n\nI kinda wish there was a button that I could press where I wake up as a woman tomorrow, with my relationship intact, and my work colleageus acting like I have always turned up to work in a skirt and heels :(\n\nAnd thats my rant done, there's no conclusion, I'm not even sure if I'm asking anything in particular, I'd just really like some advice on this if possible.\n\nThanks\n\nGoing to xpost this in /r/asktransgender too as I'm not sure at all where I fall, incase you hadnt realised!\n\n"", 'subreddit': 'genderqueer', 'title': 'Confused.... umm person??', 'created': 1375743413.0}"
10,2013-08-05 16:14:53,1jqwgw,2,7,"One of my online buddies is having a few issues with their binder, mainly that its too damn hot to wear. They live in Florida and wondering if there's any tips anyone has to help cope with the heat or get a binder that breathes a bit more. Afaik they have one from underworks FTM section. They're also worried that the 997 from underworks won't be enough to fully hide their shape, so any more tips there for them will be helpful too. 

They will be watching this thread, I'm posting on their behalf with their permission :)",genderqueer,[Help] A binder and tips for a friend.,1375744493.0,"{'created_utc': 1375719293, 'id': '1jqwgw', 'num_comments': 2, 'score': 7, 'selftext': ""One of my online buddies is having a few issues with their binder, mainly that its too damn hot to wear. They live in Florida and wondering if there's any tips anyone has to help cope with the heat or get a binder that breathes a bit more. Afaik they have one from underworks FTM section. They're also worried that the 997 from underworks won't be enough to fully hide their shape, so any more tips there for them will be helpful too. \n\nThey will be watching this thread, I'm posting on their behalf with their permission :)"", 'subreddit': 'genderqueer', 'title': '[Help] A binder and tips for a friend.', 'created': 1375744493.0}"
