Unnamed: 0,created_utc,id,num_comments,score,selftext,subreddit,title,created,d_
28,2013-08-09 03:58:10,1k07jy,22,9,"I've identified as genderqueer for the past two years, and I've been best friends with someone (we'll call them llama) for the past 3 years. they've been very disrespectful to me about it to my face. i ask llama to use my preferred pronoun and to not refer to me as a ""girlfriend"" when the person i am dating is around, but they just laugh at me or roll their eyes. i've sat t hem down and talked about it once to llama, and he told me that because i'm okay with going by my feminine birth name (for now) and i'm a feminist, i'm actually just a girl who's making it up. he told me he doesn't think being genderqueer is real. 

today i was in teh car with my mother (slightly transphobic/homophobic in general, so i'm obviously not out to her) and llama. llama had some papers in his hand and there was a thing that said ""gender: m/f"" and i pointed at it while making a face at him. he said really loudly ""hey so does your mom know??"" and i said ""know what??"" while giving him the universal shut the fuck up stare. my mom said ""know what??"" while he rudely/incorrectly explained what genderqueer meant. i can't remember word for word, but at the end of it the obvious point of his speech was to make me sound stupid.

my mom told me that i'm stupid and i'm only doing it for attention.

i had to sit there in the car with them for an extra 20 minutes and talk to them like i wasn't horribly offended, or even bothered at all. when i finally got home and was in the saftey of my own room, i spent a good while crying.

what do i do about llama? he's a good friend but the way he belittles me is starting to be very negative for me. honestly thinking about the whole situation all over again is starting to make me cry. thanks very much in advance anyone. ",genderqueer,"I don't know what to do, please give me some advice.",1376045890.0,"{'created_utc': 1376020690, 'id': '1k07jy', 'num_comments': 22, 'score': 9, 'selftext': 'I\'ve identified as genderqueer for the past two years, and I\'ve been best friends with someone (we\'ll call them llama) for the past 3 years. they\'ve been very disrespectful to me about it to my face. i ask llama to use my preferred pronoun and to not refer to me as a ""girlfriend"" when the person i am dating is around, but they just laugh at me or roll their eyes. i\'ve sat t hem down and talked about it once to llama, and he told me that because i\'m okay with going by my feminine birth name (for now) and i\'m a feminist, i\'m actually just a girl who\'s making it up. he told me he doesn\'t think being genderqueer is real. \n\ntoday i was in teh car with my mother (slightly transphobic/homophobic in general, so i\'m obviously not out to her) and llama. llama had some papers in his hand and there was a thing that said ""gender: m/f"" and i pointed at it while making a face at him. he said really loudly ""hey so does your mom know??"" and i said ""know what??"" while giving him the universal shut the fuck up stare. my mom said ""know what??"" while he rudely/incorrectly explained what genderqueer meant. i can\'t remember word for word, but at the end of it the obvious point of his speech was to make me sound stupid.\n\nmy mom told me that i\'m stupid and i\'m only doing it for attention.\n\ni had to sit there in the car with them for an extra 20 minutes and talk to them like i wasn\'t horribly offended, or even bothered at all. when i finally got home and was in the saftey of my own room, i spent a good while crying.\n\nwhat do i do about llama? he\'s a good friend but the way he belittles me is starting to be very negative for me. honestly thinking about the whole situation all over again is starting to make me cry. thanks very much in advance anyone. ', 'subreddit': 'genderqueer', 'title': ""I don't know what to do, please give me some advice."", 'created': 1376045890.0}"
29,2013-08-10 02:03:32,1k2eao,20,0,"I'm getting my tubes tied. Any advice from genderqueers who are bio females?

I have no idea what to expect from this, but I know I don't want kids. I also want to stop menstruating but I don't want any hormones or temporary solutions. I am a free spirit. I want to travel the world without any fear of pregnancy or pills or IUD mishaps. Are there any genderqueer bio females who've done this procedure that can help me out about what to expect cost wise, post-op etc?

I'm bracing myself to get some shit from the doctors about ""are your sure?"" YES I AM SURE. Should I just say ""its for religious reasons so yes I'm sure.""

EDIT: spelling.

PS I wonder if this is my first step to a full transition? Who will know?

PPS Funny thought, if women are as smart as men, we should have figured out how to remain fertile without bleeding out our orifices by now. (no offense intended)",genderqueer,I'm getting my tubes tied. Any advice from genderqueers who are bio females?,1376125412.0,"{'created_utc': 1376100212, 'id': '1k2eao', 'num_comments': 20, 'score': 0, 'selftext': 'I\'m getting my tubes tied. Any advice from genderqueers who are bio females?\n\nI have no idea what to expect from this, but I know I don\'t want kids. I also want to stop menstruating but I don\'t want any hormones or temporary solutions. I am a free spirit. I want to travel the world without any fear of pregnancy or pills or IUD mishaps. Are there any genderqueer bio females who\'ve done this procedure that can help me out about what to expect cost wise, post-op etc?\n\nI\'m bracing myself to get some shit from the doctors about ""are your sure?"" YES I AM SURE. Should I just say ""its for religious reasons so yes I\'m sure.""\n\nEDIT: spelling.\n\nPS I wonder if this is my first step to a full transition? Who will know?\n\nPPS Funny thought, if women are as smart as men, we should have figured out how to remain fertile without bleeding out our orifices by now. (no offense intended)', 'subreddit': 'genderqueer', 'title': ""I'm getting my tubes tied. Any advice from genderqueers who are bio females?"", 'created': 1376125412.0}"
30,2013-08-10 05:40:43,1k2qqu,9,84,,genderqueer,#notgettingit,1376138443.0,"{'created_utc': 1376113243, 'id': '1k2qqu', 'num_comments': 9, 'score': 84, 'selftext': '', 'subreddit': 'genderqueer', 'title': '#notgettingit', 'created': 1376138443.0}"
31,2013-08-10 21:11:07,1k3x6z,7,22,,genderqueer,UNC system bans gender-inclusive housing on all 17 campuses,1376194267.0,"{'created_utc': 1376169067, 'id': '1k3x6z', 'num_comments': 7, 'score': 22, 'selftext': '', 'subreddit': 'genderqueer', 'title': 'UNC system bans gender-inclusive housing on all 17 campuses', 'created': 1376194267.0}"
15,2013-08-10 21:28:57,1k3yco,0,0,,trans,Permanent Hair Removal in Seattle recommendations? [x-post r/Seattle],1376195337.0,"{'created_utc': 1376170137, 'id': '1k3yco', 'num_comments': 0, 'score': 0, 'selftext': '', 'subreddit': 'trans', 'title': 'Permanent Hair Removal in Seattle recommendations? [x-post r/Seattle]', 'created': 1376195337.0}"
32,2013-08-11 03:10:18,1k4ip1,13,22,"When I was younger, for years I thought I was a transwoman. I recoiled from that and went ultra masculine for a while. Joined the Army in a combat branch, went to war, lived an extremely manly life. And I enjoyed my manly side, which made me think ""Well, I must not be trans...a trans couldn't stand to live as a man, would NEED to transition completely right?"". However I also still wanted to be a woman....and there was no reconciling these two points. I couldn't understand it. After the Army I did come to terms with, and come out mostly, with my bisexuality...however I still did not understand my gender. The terms just weren't there for me. Today I stumbled onto the concept of ""genderqueer"" and ""dualgender"", and have been soaking up these subreddits all day...I feel like a light has come on inside my head. I'm finally starting to have the words, and the concepts, for who I am. I just can't explain how amazing that is to me, and I just want to thank everyone in the DualGender and genderqueer community's that have been posting to reddit and helping me finally know me, even if you didn't know that's what you're doing. ;)",genderqueer,Finally starting to understand me.,1376215818.0,"{'created_utc': 1376190618, 'id': '1k4ip1', 'num_comments': 13, 'score': 22, 'selftext': 'When I was younger, for years I thought I was a transwoman. I recoiled from that and went ultra masculine for a while. Joined the Army in a combat branch, went to war, lived an extremely manly life. And I enjoyed my manly side, which made me think ""Well, I must not be trans...a trans couldn\'t stand to live as a man, would NEED to transition completely right?"". However I also still wanted to be a woman....and there was no reconciling these two points. I couldn\'t understand it. After the Army I did come to terms with, and come out mostly, with my bisexuality...however I still did not understand my gender. The terms just weren\'t there for me. Today I stumbled onto the concept of ""genderqueer"" and ""dualgender"", and have been soaking up these subreddits all day...I feel like a light has come on inside my head. I\'m finally starting to have the words, and the concepts, for who I am. I just can\'t explain how amazing that is to me, and I just want to thank everyone in the DualGender and genderqueer community\'s that have been posting to reddit and helping me finally know me, even if you didn\'t know that\'s what you\'re doing. ;)', 'subreddit': 'genderqueer', 'title': 'Finally starting to understand me.', 'created': 1376215818.0}"
33,2013-08-11 03:33:26,1k4k0f,7,6,"So I may or may not be drunk, but I want to ramble and rant. It's been a shit week when it comes to gender issues and I don't know where to even start, I just want to ramble/talk.

There are times when I feel like I'm faking, do any of you feel the same way? Like I don't particularly want to have top surgery, most of the time. I often feel like I'm exaggerating my feelings and dysphoria, like maybe I""m not actually feeling it as strongly as I make myself believe I am, which just makes feeling it all the worse. It's like ""Oh, I really want to compress my tits and wear men's scents and have a packer"" but the next day I may be perfectly fine looking female (increasingly rare).

Some days (like recently), just looking at a naked male is enough to set off the ""I hate myself and my body"" feelings. Especially if it's a fit male. I'm nearly 100 lbs overweight and I lack the willpower to effectively lose weight consistently (I've lost 45lbs over the past year, though, which is something), so I feel like crap when I think about it.

I envy MTF or feminine GQ or trans individuals, because you seem so much better represented in the community. Every day I see something about an MFT or feminine individual on some subreddit or another, often multiple ones at the same exact time. And I envy you and I resent it, as bad as it makes me feel to resent it. I try to offer help on here to as many MTF/feminine people as possible, but it's draining when the masculine/FTM group is so underrepresented. I feel bad about it, but I can't help but feel bitter about it when I see these posts.

I also feel bitter against the FTM community, because it's all about passing as a stereotypical male, but I'm not a stereotypical male. I have long, curly, thick hair and I love it, I don't want to get rid of it. If I were thin, I'd like the freedom to sometimes wear bikinis or other incredibly feminine clothing, while still having the freedom to portray myself as incredibly masculine if I was feeling that way on that day. 

I don't fit into any category I've seen as of now and it's so draining I often don't know what to do. I write about it, my most recent character is a transguy who I haven't had the chance to fully explore, but right now even writing him is draining because he gets to do what I can't, though at the same time I want to be able to switch between a male and female body at will. It's just incredibly difficult to think straight when I can't come up with a concrete idea of what I want my physical body to look like, and I needed to rant and stuff about it. Maybe some of you have had similar experiences or feelings and can relate, that'd be nice.

Also, further apologies to those wonderful femme folks who frequent this sub, I honestly have no hard feelings against you, whatever my post may say. I wish you all luck in your transformations and self expressions. 

Edit: oh, look, I totally posted that last night, wonderful.",genderqueer,Rambling/Ranting (many topics covered),1376217206.0,"{'created_utc': 1376192006, 'id': '1k4k0f', 'num_comments': 7, 'score': 6, 'selftext': 'So I may or may not be drunk, but I want to ramble and rant. It\'s been a shit week when it comes to gender issues and I don\'t know where to even start, I just want to ramble/talk.\n\nThere are times when I feel like I\'m faking, do any of you feel the same way? Like I don\'t particularly want to have top surgery, most of the time. I often feel like I\'m exaggerating my feelings and dysphoria, like maybe I""m not actually feeling it as strongly as I make myself believe I am, which just makes feeling it all the worse. It\'s like ""Oh, I really want to compress my tits and wear men\'s scents and have a packer"" but the next day I may be perfectly fine looking female (increasingly rare).\n\nSome days (like recently), just looking at a naked male is enough to set off the ""I hate myself and my body"" feelings. Especially if it\'s a fit male. I\'m nearly 100 lbs overweight and I lack the willpower to effectively lose weight consistently (I\'ve lost 45lbs over the past year, though, which is something), so I feel like crap when I think about it.\n\nI envy MTF or feminine GQ or trans individuals, because you seem so much better represented in the community. Every day I see something about an MFT or feminine individual on some subreddit or another, often multiple ones at the same exact time. And I envy you and I resent it, as bad as it makes me feel to resent it. I try to offer help on here to as many MTF/feminine people as possible, but it\'s draining when the masculine/FTM group is so underrepresented. I feel bad about it, but I can\'t help but feel bitter about it when I see these posts.\n\nI also feel bitter against the FTM community, because it\'s all about passing as a stereotypical male, but I\'m not a stereotypical male. I have long, curly, thick hair and I love it, I don\'t want to get rid of it. If I were thin, I\'d like the freedom to sometimes wear bikinis or other incredibly feminine clothing, while still having the freedom to portray myself as incredibly masculine if I was feeling that way on that day. \n\nI don\'t fit into any category I\'ve seen as of now and it\'s so draining I often don\'t know what to do. I write about it, my most recent character is a transguy who I haven\'t had the chance to fully explore, but right now even writing him is draining because he gets to do what I can\'t, though at the same time I want to be able to switch between a male and female body at will. It\'s just incredibly difficult to think straight when I can\'t come up with a concrete idea of what I want my physical body to look like, and I needed to rant and stuff about it. Maybe some of you have had similar experiences or feelings and can relate, that\'d be nice.\n\nAlso, further apologies to those wonderful femme folks who frequent this sub, I honestly have no hard feelings against you, whatever my post may say. I wish you all luck in your transformations and self expressions. \n\nEdit: oh, look, I totally posted that last night, wonderful.', 'subreddit': 'genderqueer', 'title': 'Rambling/Ranting (many topics covered)', 'created': 1376217206.0}"
16,2013-08-11 10:03:17,1k4z2g,14,9,"Lately I've been thinking that I might not want sex reassignment surgery, both because of how it would look and feel. I haven't come to any conclusions, but I have been feeling a lot more comfortable with having a penis. Are there any other tgirls who have felt like this?",trans,Am I the only mtf who may not want SRS?,1376240597.0,"{'created_utc': 1376215397, 'id': '1k4z2g', 'num_comments': 14, 'score': 9, 'selftext': ""Lately I've been thinking that I might not want sex reassignment surgery, both because of how it would look and feel. I haven't come to any conclusions, but I have been feeling a lot more comfortable with having a penis. Are there any other tgirls who have felt like this?"", 'subreddit': 'trans', 'title': 'Am I the only mtf who may not want SRS?', 'created': 1376240597.0}"
17,2013-08-12 01:37:58,1k6fvn,9,3,"Hi! Just wanted to let you all know about /r/ftmmall which is a lovely little place that allows users to post about items they are looking to buy/sell/trade, or they can post items that they found somewhere via purchase links. 

~~We will be adding a sister site soon called mtfmall for our trans*female friends .~~
The MTF sister site /r/mtfmall is now up and ready for submissions

Thanks!",trans,FTM Mall (New Subreddit),1376296678.0,"{'created_utc': 1376271478, 'id': '1k6fvn', 'num_comments': 9, 'score': 3, 'selftext': 'Hi! Just wanted to let you all know about /r/ftmmall which is a lovely little place that allows users to post about items they are looking to buy/sell/trade, or they can post items that they found somewhere via purchase links. \n\n~~We will be adding a sister site soon called mtfmall for our trans*female friends .~~\nThe MTF sister site /r/mtfmall is now up and ready for submissions\n\nThanks!', 'subreddit': 'trans', 'title': 'FTM Mall (New Subreddit)', 'created': 1376296678.0}"
18,2013-08-12 07:05:24,1k6zrm,1,4,,trans,‘Transgender feelings’ explained following man’s ER visit,1376316324.0,"{'created_utc': 1376291124, 'id': '1k6zrm', 'num_comments': 1, 'score': 4, 'selftext': '', 'subreddit': 'trans', 'title': '‘Transgender feelings’ explained following man’s ER visit', 'created': 1376316324.0}"
19,2013-08-12 08:53:42,1k73mv,0,4,,trans,Conviction for 2008 NY transgender murder overturned,1376322822.0,"{'created_utc': 1376297622, 'id': '1k73mv', 'num_comments': 0, 'score': 4, 'selftext': '', 'subreddit': 'trans', 'title': 'Conviction for 2008 NY transgender murder overturned', 'created': 1376322822.0}"
20,2013-08-12 16:59:49,1k7szr,1,9,,trans,"Angry mob in Jamaica beats, stabs, shoots and runs over a transgendered teen for showing up at a party in a dress",1376351989.0,"{'created_utc': 1376326789, 'id': '1k7szr', 'num_comments': 1, 'score': 9, 'selftext': '', 'subreddit': 'trans', 'title': 'Angry mob in Jamaica beats, stabs, shoots and runs over a transgendered teen for showing up at a party in a dress', 'created': 1376351989.0}"
21,2013-08-13 02:32:36,1k92n9,0,10,,trans,UPDATE: Gov. Brown signs CA ‘trans equality in K-12 schools’ bill.,1376386356.0,"{'created_utc': 1376361156, 'id': '1k92n9', 'num_comments': 0, 'score': 10, 'selftext': '', 'subreddit': 'trans', 'title': 'UPDATE: Gov. Brown signs CA ‘trans equality in K-12 schools’ bill.', 'created': 1376386356.0}"
22,2013-08-13 05:02:48,1k9d3g,0,5,"Hi there! Just wanted to let everyone know about a series of trans* orientated subreddits dedicated to the buying/selling and trading of goods. (As discussed and requested by several redditors) 

/r/ftmmall and /r/mtfmall are pages which focus on that half of the spectrums transitional goods. (I.e. packers with /r/ftmmall and breast forms with /r/mtfmall). 

There is also /r/transclothingmall which is a general place for trans* people of all types to buy/sell/trade various clothing items. 

So stop on by and check it out.:)",trans,Trans* Shopping Center (subreddits),1376395368.0,"{'created_utc': 1376370168, 'id': '1k9d3g', 'num_comments': 0, 'score': 5, 'selftext': 'Hi there! Just wanted to let everyone know about a series of trans* orientated subreddits dedicated to the buying/selling and trading of goods. (As discussed and requested by several redditors) \n\n/r/ftmmall and /r/mtfmall are pages which focus on that half of the spectrums transitional goods. (I.e. packers with /r/ftmmall and breast forms with /r/mtfmall). \n\nThere is also /r/transclothingmall which is a general place for trans* people of all types to buy/sell/trade various clothing items. \n\nSo stop on by and check it out.:)', 'subreddit': 'trans', 'title': 'Trans* Shopping Center (subreddits)', 'created': 1376395368.0}"
34,2013-08-13 17:41:40,1kahad,4,20,,genderqueer,"Was reading this article and the author included Genderqueers in it, blew my mind!",1376440900.0,"{'created_utc': 1376415700, 'id': '1kahad', 'num_comments': 4, 'score': 20, 'selftext': '', 'subreddit': 'genderqueer', 'title': 'Was reading this article and the author included Genderqueers in it, blew my mind!', 'created': 1376440900.0}"
35,2013-08-13 21:46:13,1kb22g,15,21,"Hey all!  I am faab and identify as genderqueer.  I can't stand being gendered female tho, and started testosterone a couple months ago.   Now that things have started to change and this is becoming a reality, I realize I am worried as being percieved as male as well.  I really dont want to be percieved as either m or f, go figure.

Have any of you considered hormones?  Why did you choose to (or not to) persue this option?  If any of you are on hormones, are you happy with the results?  Were you nervous as you went through this?  Do you have any regrets?

",genderqueer,Experiences as genderqueer on hormones?,1376455573.0,"{'created_utc': 1376430373, 'id': '1kb22g', 'num_comments': 15, 'score': 21, 'selftext': ""Hey all!  I am faab and identify as genderqueer.  I can't stand being gendered female tho, and started testosterone a couple months ago.   Now that things have started to change and this is becoming a reality, I realize I am worried as being percieved as male as well.  I really dont want to be percieved as either m or f, go figure.\n\nHave any of you considered hormones?  Why did you choose to (or not to) persue this option?  If any of you are on hormones, are you happy with the results?  Were you nervous as you went through this?  Do you have any regrets?\n\n"", 'subreddit': 'genderqueer', 'title': 'Experiences as genderqueer on hormones?', 'created': 1376455573.0}"
23,2013-08-14 08:39:32,1kc60m,0,9,,trans,FOX News’ transphobic mocking reaches all time high,1376494772.0,"{'created_utc': 1376469572, 'id': '1kc60m', 'num_comments': 0, 'score': 9, 'selftext': '', 'subreddit': 'trans', 'title': 'FOX News’ transphobic mocking reaches all time high', 'created': 1376494772.0}"
36,2013-08-14 13:16:21,1kcgno,1,7,,genderqueer,If only it was this easy. (Probably posted before but this amused me. Sorry for moblie link.),1376511381.0,"{'created_utc': 1376486181, 'id': '1kcgno', 'num_comments': 1, 'score': 7, 'selftext': '', 'subreddit': 'genderqueer', 'title': 'If only it was this easy. (Probably posted before but this amused me. Sorry for moblie link.)', 'created': 1376511381.0}"
24,2013-08-14 16:59:57,1kcwo0,5,10,,trans,"Does someone post a link to all these stories to major subreddits like r/news r/politics? It seems like it would behoove us to do so. The world has no idea what's going on and though it shouldn't be ourn job to tell them, no one else is doing it.",1376524797.0,"{'created_utc': 1376499597, 'id': '1kcwo0', 'num_comments': 5, 'score': 10, 'selftext': '', 'subreddit': 'trans', 'title': ""Does someone post a link to all these stories to major subreddits like r/news r/politics? It seems like it would behoove us to do so. The world has no idea what's going on and though it shouldn't be ourn job to tell them, no one else is doing it."", 'created': 1376524797.0}"
37,2013-08-14 20:08:28,1kdd2b,0,28,,genderqueer,Boston University president approves gender neutral campus housing,1376536108.0,"{'created_utc': 1376510908, 'id': '1kdd2b', 'num_comments': 0, 'score': 28, 'selftext': '', 'subreddit': 'genderqueer', 'title': 'Boston University president approves gender neutral campus housing', 'created': 1376536108.0}"
