created_utc,id,num_comments,score,selftext,subreddit,title,created,d_
2015-09-02 13:32:03,3jct5l,5,3,"Is it possible to be bigender and nonbinary at the same time? Because about 75% of the time I identify as a demi-boy, but sometimes I still more femme and feel like a demi-girl. I'm honestly so confused and would like to know.",NonBinary,Honest Question from a Struggling DFAB GQ Person,1441225923.0,"{'created_utc': 1441200723, 'id': '3jct5l', 'num_comments': 5, 'score': 3, 'selftext': ""Is it possible to be bigender and nonbinary at the same time? Because about 75% of the time I identify as a demi-boy, but sometimes I still more femme and feel like a demi-girl. I'm honestly so confused and would like to know."", 'subreddit': 'NonBinary', 'title': 'Honest Question from a Struggling DFAB GQ Person', 'created': 1441225923.0}"
2015-09-05 07:37:02,3jpyay,5,1,"I want some outside input because I have no one else that will help me decide. Everyone's opinion is welcome.
So, my first name is Aaron and my last name starts with an E. Which one of these two middle names sound best?

Aaron SKYLAR E.

Aaron ELLIOT E.


Please and thank you for your input, everyone.",NonBinary,Picking a middle name,1441463822.0,"{'created_utc': 1441438622, 'id': '3jpyay', 'num_comments': 5, 'score': 1, 'selftext': ""I want some outside input because I have no one else that will help me decide. Everyone's opinion is welcome.\nSo, my first name is Aaron and my last name starts with an E. Which one of these two middle names sound best?\n\nAaron SKYLAR E.\n\nAaron ELLIOT E.\n\n\nPlease and thank you for your input, everyone."", 'subreddit': 'NonBinary', 'title': 'Picking a middle name', 'created': 1441463822.0}"
2015-09-06 15:55:56,3jv7sw,9,6,"I'm DFAB and I'm non-binary. I'm not quite out yet so I don't really have anyone to ask, but I've gotten some discrimination on tumblr lately and its awful. 

Do you guys think that someone who looks feminine with long hair and all of that can be nonbinary? I've gotten a lot of hate that says ""well you look like a girl all the time so you really can't be a boy."" 

They said if I cut my hair or shaved it I'd be non binary but for now I'm a girl that's pretending. Are they right? ",NonBinary,I've got a question!,1441580156.0,"{'created_utc': 1441554956, 'id': '3jv7sw', 'num_comments': 9, 'score': 6, 'selftext': 'I\'m DFAB and I\'m non-binary. I\'m not quite out yet so I don\'t really have anyone to ask, but I\'ve gotten some discrimination on tumblr lately and its awful. \n\nDo you guys think that someone who looks feminine with long hair and all of that can be nonbinary? I\'ve gotten a lot of hate that says ""well you look like a girl all the time so you really can\'t be a boy."" \n\nThey said if I cut my hair or shaved it I\'d be non binary but for now I\'m a girl that\'s pretending. Are they right? ', 'subreddit': 'NonBinary', 'title': ""I've got a question!"", 'created': 1441580156.0}"
2015-09-25 19:27:39,3mdh6i,23,4,,NonBinary,how do folks define there sexuality as a non binary person,1443234459.0,"{'created_utc': 1443209259, 'id': '3mdh6i', 'num_comments': 23, 'score': 4, 'selftext': '', 'subreddit': 'NonBinary', 'title': 'how do folks define there sexuality as a non binary person', 'created': 1443234459.0}"
