created_utc,id,num_comments,score,selftext,subreddit,title,created,d_
2013-11-01 02:33:22,1pnvux,0,1,,trans,[TW]- Feelings,1383298402.0,"{'created_utc': 1383273202, 'id': '1pnvux', 'num_comments': 0, 'score': 1, 'selftext': '', 'subreddit': 'trans', 'title': '[TW]- Feelings', 'created': 1383298402.0}"
2013-11-01 04:33:38,1po3tj,0,0,,trans,Transgender Day of Remembrance 2013: A Reporter's List,1383305618.0,"{'created_utc': 1383280418, 'id': '1po3tj', 'num_comments': 0, 'score': 0, 'selftext': '', 'subreddit': 'trans', 'title': ""Transgender Day of Remembrance 2013: A Reporter's List"", 'created': 1383305618.0}"
2013-11-01 06:07:59,1po8ce,0,3,,trans,Germany to allow 'indeterminate' gender at birth,1383311279.0,"{'created_utc': 1383286079, 'id': '1po8ce', 'num_comments': 0, 'score': 3, 'selftext': '', 'subreddit': 'trans', 'title': ""Germany to allow 'indeterminate' gender at birth"", 'created': 1383311279.0}"
2013-11-01 07:06:12,1poaks,0,0,,trans,Photo of 29 trans people to remember on TDOR 2013,1383314772.0,"{'created_utc': 1383289572, 'id': '1poaks', 'num_comments': 0, 'score': 0, 'selftext': '', 'subreddit': 'trans', 'title': 'Photo of 29 trans people to remember on TDOR 2013', 'created': 1383314772.0}"
2013-11-01 07:08:27,1poanv,0,10,,trans,Chelsea Manning name row: Wikipedia editors banned from trans pages | Technology,1383314907.0,"{'created_utc': 1383289707, 'id': '1poanv', 'num_comments': 0, 'score': 10, 'selftext': '', 'subreddit': 'trans', 'title': 'Chelsea Manning name row: Wikipedia editors banned from trans pages | Technology', 'created': 1383314907.0}"
2013-11-01 07:09:43,1poapm,0,6,,trans,Jared Leto Says Playing A Transgender Character Changed And Inspired Him,1383314983.0,"{'created_utc': 1383289783, 'id': '1poapm', 'num_comments': 0, 'score': 6, 'selftext': '', 'subreddit': 'trans', 'title': 'Jared Leto Says Playing A Transgender Character Changed And Inspired Him', 'created': 1383314983.0}"
2013-11-01 19:18:30,1ppfat,1,31,"I volunteer at a writing center for kids here in LA, and a couple days ago I was working with a group of 4th graders. Their class TA was trans, so when I asked my group whether the main character of our story should be a boy or a girl they excitedly went ""Both! Both like she is!"" And the TA laughed &amp; went ""Sorry, I've been teaching them about gender neutrality"". SO COOL!!!! And super heartwarming!!! ",trans,Had a great moment with 4th graders and their trans TA,1383358710.0,"{'created_utc': 1383333510, 'id': '1ppfat', 'num_comments': 1, 'score': 31, 'selftext': 'I volunteer at a writing center for kids here in LA, and a couple days ago I was working with a group of 4th graders. Their class TA was trans, so when I asked my group whether the main character of our story should be a boy or a girl they excitedly went ""Both! Both like she is!"" And the TA laughed &amp; went ""Sorry, I\'ve been teaching them about gender neutrality"". SO COOL!!!! And super heartwarming!!! ', 'subreddit': 'trans', 'title': 'Had a great moment with 4th graders and their trans TA', 'created': 1383358710.0}"
2013-11-02 19:14:54,1prj1z,3,40,,trans,"Every cell in a bird's body has a chromosomal sex. This parakeet is half male, half female.",1383444894.0,"{'created_utc': 1383419694, 'id': '1prj1z', 'num_comments': 3, 'score': 40, 'selftext': '', 'subreddit': 'trans', 'title': ""Every cell in a bird's body has a chromosomal sex. This parakeet is half male, half female."", 'created': 1383444894.0}"
2013-11-02 20:46:19,1prpnm,0,4,,trans,FTM: International Transculture Magazine Kickstarter Project,1383450379.0,"{'created_utc': 1383425179, 'id': '1prpnm', 'num_comments': 0, 'score': 4, 'selftext': '', 'subreddit': 'trans', 'title': 'FTM: International Transculture Magazine Kickstarter Project', 'created': 1383450379.0}"
2013-11-02 20:51:53,1prq3y,1,2,"We are currently seeking trans* friendly healthcare providers across the nation to put into our national resource directory - http://www.genderexpansionproject.org/directory
We are a gender inclusive / gender diverse non-profit organization focused on creating a trans* inclusive environment in healthcare through education, advocacy and collaborative networking.
Do you have a resource you are willing to recommend? Email us at resources@genderexpansionproject.org or by calling us at 406-848-1220.",trans,Looking for a trans* inclusive health provider,1383450713.0,"{'created_utc': 1383425513, 'id': '1prq3y', 'num_comments': 1, 'score': 2, 'selftext': 'We are currently seeking trans* friendly healthcare providers across the nation to put into our national resource directory - http://www.genderexpansionproject.org/directory\nWe are a gender inclusive / gender diverse non-profit organization focused on creating a trans* inclusive environment in healthcare through education, advocacy and collaborative networking.\nDo you have a resource you are willing to recommend? Email us at resources@genderexpansionproject.org or by calling us at 406-848-1220.', 'subreddit': 'trans', 'title': 'Looking for a trans* inclusive health provider', 'created': 1383450713.0}"
2013-11-03 09:07:57,1psuj6,0,5,,trans,Third gender option for German birth certificates? Not so fast,1383494877.0,"{'created_utc': 1383469677, 'id': '1psuj6', 'num_comments': 0, 'score': 5, 'selftext': '', 'subreddit': 'trans', 'title': 'Third gender option for German birth certificates? Not so fast', 'created': 1383494877.0}"
2013-11-03 09:09:38,1psukj,0,5,,trans,How Obamacare Will Affect Trans Folks and Families,1383494978.0,"{'created_utc': 1383469778, 'id': '1psukj', 'num_comments': 0, 'score': 5, 'selftext': '', 'subreddit': 'trans', 'title': 'How Obamacare Will Affect Trans Folks and Families', 'created': 1383494978.0}"
2013-11-07 09:31:31,1q3b59,5,0,,trans,Face recognition technology: dangerous implications for trans people?,1383841891.0,"{'created_utc': 1383816691, 'id': '1q3b59', 'num_comments': 5, 'score': 0, 'selftext': '', 'subreddit': 'trans', 'title': 'Face recognition technology: dangerous implications for trans people?', 'created': 1383841891.0}"
2013-11-07 09:33:25,1q3b7x,0,2,,trans,Need to Know: San Francisco Transgender Film Festival,1383842005.0,"{'created_utc': 1383816805, 'id': '1q3b7x', 'num_comments': 0, 'score': 2, 'selftext': '', 'subreddit': 'trans', 'title': 'Need to Know: San Francisco Transgender Film Festival', 'created': 1383842005.0}"
2013-11-08 07:40:37,1q5xw2,0,4,,trans,U.S. Sen. Merkley of Oregon key to passage of trans/LGBT protection bill ENDA,1383921637.0,"{'created_utc': 1383896437, 'id': '1q5xw2', 'num_comments': 0, 'score': 4, 'selftext': '', 'subreddit': 'trans', 'title': 'U.S. Sen. Merkley of Oregon key to passage of trans/LGBT protection bill ENDA', 'created': 1383921637.0}"
2013-11-08 07:42:09,1q5xyj,1,5,,trans,X Factor judge attacks trans singer: She sings back ‘Words can’t bring me down’,1383921729.0,"{'created_utc': 1383896529, 'id': '1q5xyj', 'num_comments': 1, 'score': 5, 'selftext': '', 'subreddit': 'trans', 'title': 'X Factor judge attacks trans singer: She sings back ‘Words can’t bring me down’', 'created': 1383921729.0}"
2013-11-08 18:46:42,1q6z6s,1,1,"Hi reddit trans community! I recently started dating a trans guy (I'm a cis female) and I just have a question regarding outing him to my friends. When I met him, I didn't know he was trans. He added me on facebook, and because of a few things he posted, I gathered that this was the case. Before we really started to get to know one another, I talked to my 3 closest friends about him and the fact that I thought he was trans. 

I wasn't very familiar with the etiquette that might be involved in such things, and have since educated myself better. I'm afraid that telling my friends about it will be a point of contention. They're all very amazing people, and it doesn't make any more difference to them than it does to me. But I'm worried I've crossed a line before I even knew it was a line that could be crossed. I don't want to upset him. I know that passing is very important to him. 

I'd like to talk to him about it tonight when I see him. I guess I'm asking for advice on how to broach the subject? I'm so very into him, and I don't think he'll be super upset. He is pretty transparent about it on facebook, after all. But I get nervous talking about serious things sometimes, and I don't want him to be upset or disappointed with me. Any advice?",trans,Dating a trans guy - advice?,1383961602.0,"{'created_utc': 1383936402, 'id': '1q6z6s', 'num_comments': 1, 'score': 1, 'selftext': ""Hi reddit trans community! I recently started dating a trans guy (I'm a cis female) and I just have a question regarding outing him to my friends. When I met him, I didn't know he was trans. He added me on facebook, and because of a few things he posted, I gathered that this was the case. Before we really started to get to know one another, I talked to my 3 closest friends about him and the fact that I thought he was trans. \n\nI wasn't very familiar with the etiquette that might be involved in such things, and have since educated myself better. I'm afraid that telling my friends about it will be a point of contention. They're all very amazing people, and it doesn't make any more difference to them than it does to me. But I'm worried I've crossed a line before I even knew it was a line that could be crossed. I don't want to upset him. I know that passing is very important to him. \n\nI'd like to talk to him about it tonight when I see him. I guess I'm asking for advice on how to broach the subject? I'm so very into him, and I don't think he'll be super upset. He is pretty transparent about it on facebook, after all. But I get nervous talking about serious things sometimes, and I don't want him to be upset or disappointed with me. Any advice?"", 'subreddit': 'trans', 'title': 'Dating a trans guy - advice?', 'created': 1383961602.0}"
2013-11-09 06:17:20,1q8db6,0,0,,trans,(UPDATE 2 — Jury convicts murderer) Cleveland trans woman found brutally murdered; newspaper hit by HRC for insulting coverage,1384003040.0,"{'created_utc': 1383977840, 'id': '1q8db6', 'num_comments': 0, 'score': 0, 'selftext': '', 'subreddit': 'trans', 'title': '(UPDATE 2 — Jury convicts murderer) Cleveland trans woman found brutally murdered; newspaper hit by HRC for insulting coverage', 'created': 1384003040.0}"
2013-11-09 06:18:20,1q8dcv,0,1,,trans,Will Trans Folk Become an ENDA Bargaining Chip?,1384003100.0,"{'created_utc': 1383977900, 'id': '1q8dcv', 'num_comments': 0, 'score': 1, 'selftext': '', 'subreddit': 'trans', 'title': 'Will Trans Folk Become an ENDA Bargaining Chip?', 'created': 1384003100.0}"
2013-11-09 08:51:18,1q8jky,14,20,,trans,Autogynophilia pathologizes normal female behavior.,1384012278.0,"{'created_utc': 1383987078, 'id': '1q8jky', 'num_comments': 14, 'score': 20, 'selftext': '', 'subreddit': 'trans', 'title': 'Autogynophilia pathologizes normal female behavior.', 'created': 1384012278.0}"
2013-11-10 08:39:18,1qaqux,0,11,,trans,Killers of trans women in NYC and Cleveland convicted,1384097958.0,"{'created_utc': 1384072758, 'id': '1qaqux', 'num_comments': 0, 'score': 11, 'selftext': '', 'subreddit': 'trans', 'title': 'Killers of trans women in NYC and Cleveland convicted', 'created': 1384097958.0}"
2013-11-10 08:42:35,1qaqy6,0,5,,trans,Transgender man fights for free breast removal -,1384098155.0,"{'created_utc': 1384072955, 'id': '1qaqy6', 'num_comments': 0, 'score': 5, 'selftext': '', 'subreddit': 'trans', 'title': 'Transgender man fights for free breast removal -', 'created': 1384098155.0}"
2013-11-10 08:44:26,1qar0m,0,0,,trans,Atlanta's Don Pollo Nightclub Discriminates Against Transgender Customer,1384098266.0,"{'created_utc': 1384073066, 'id': '1qar0m', 'num_comments': 0, 'score': 0, 'selftext': '', 'subreddit': 'trans', 'title': ""Atlanta's Don Pollo Nightclub Discriminates Against Transgender Customer"", 'created': 1384098266.0}"
2013-11-12 19:16:46,1qh4ei,1,3,,trans,Support for the Transgendered Communities,1384309006.0,"{'created_utc': 1384283806, 'id': '1qh4ei', 'num_comments': 1, 'score': 3, 'selftext': '', 'subreddit': 'trans', 'title': 'Support for the Transgendered Communities', 'created': 1384309006.0}"
2013-11-15 21:42:08,1qpwun,1,0,,trans,USA: The callousness of the trans community,1384576928.0,"{'created_utc': 1384551728, 'id': '1qpwun', 'num_comments': 1, 'score': 0, 'selftext': '', 'subreddit': 'trans', 'title': 'USA: The callousness of the trans community', 'created': 1384576928.0}"
2013-11-16 15:33:44,1qrh61,4,1,,trans,"USA: Those who are intensely transsexual, but are also mentally disabled",1384641224.0,"{'created_utc': 1384616024, 'id': '1qrh61', 'num_comments': 4, 'score': 1, 'selftext': '', 'subreddit': 'trans', 'title': 'USA: Those who are intensely transsexual, but are also mentally disabled', 'created': 1384641224.0}"
2013-11-17 21:38:53,1qujlo,12,25,,trans,transgender vs. transgendered - thought this might be a useful way to explain it to people,1384749533.0,"{'created_utc': 1384724333, 'id': '1qujlo', 'num_comments': 12, 'score': 25, 'selftext': '', 'subreddit': 'trans', 'title': 'transgender vs. transgendered - thought this might be a useful way to explain it to people', 'created': 1384749533.0}"
2013-11-18 08:13:15,1qvuhz,0,1,,trans,Southern Poverty Law Center forces Texas school district to yield to transgender student,1384787595.0,"{'created_utc': 1384762395, 'id': '1qvuhz', 'num_comments': 0, 'score': 1, 'selftext': '', 'subreddit': 'trans', 'title': 'Southern Poverty Law Center forces Texas school district to yield to transgender student', 'created': 1384787595.0}"
2013-11-18 08:15:27,1qvulh,5,11,,trans,WATCH: Trans woman performs duet with previous self,1384787727.0,"{'created_utc': 1384762527, 'id': '1qvulh', 'num_comments': 5, 'score': 11, 'selftext': '', 'subreddit': 'trans', 'title': 'WATCH: Trans woman performs duet with previous self', 'created': 1384787727.0}"
2013-11-18 08:16:47,1qvunf,0,8,,trans,Former UKIP MEP reveals she is the UK’s first transgender Parliamentarian,1384787807.0,"{'created_utc': 1384762607, 'id': '1qvunf', 'num_comments': 0, 'score': 8, 'selftext': '', 'subreddit': 'trans', 'title': 'Former UKIP MEP reveals she is the UK’s first transgender Parliamentarian', 'created': 1384787807.0}"
2013-11-18 09:57:39,1qvyhi,0,0,,trans,Iconic transgender pioneer Vicki Marlane gets multi-media exhibit at SF museum,1384793859.0,"{'created_utc': 1384768659, 'id': '1qvyhi', 'num_comments': 0, 'score': 0, 'selftext': '', 'subreddit': 'trans', 'title': 'Iconic transgender pioneer Vicki Marlane gets multi-media exhibit at SF museum', 'created': 1384793859.0}"
2013-11-18 10:00:02,1qvykh,0,6,,trans,My transgender uncle: A family secret hidden for decades,1384794002.0,"{'created_utc': 1384768802, 'id': '1qvykh', 'num_comments': 0, 'score': 6, 'selftext': '', 'subreddit': 'trans', 'title': 'My transgender uncle: A family secret hidden for decades', 'created': 1384794002.0}"
2013-11-18 14:43:37,1qwbd7,2,2,,trans,There is only one rule: you define yourself.,1384811017.0,"{'created_utc': 1384785817, 'id': '1qwbd7', 'num_comments': 2, 'score': 2, 'selftext': '', 'subreddit': 'trans', 'title': 'There is only one rule: you define yourself.', 'created': 1384811017.0}"
2013-11-19 03:38:50,1qy972,5,18,,trans,Court takes couple’s children because father is transgender,1384857530.0,"{'created_utc': 1384832330, 'id': '1qy972', 'num_comments': 5, 'score': 18, 'selftext': '', 'subreddit': 'trans', 'title': 'Court takes couple’s children because father is transgender', 'created': 1384857530.0}"
2013-11-22 02:26:00,1r6sfz,8,19,"Hi everyone!
I don't know a lot about the trans community, so please forgive &amp; correct me if I get any terminology wrong.

I work at a day-care centre, and one of the children I care for has a very interesting relationship with his/her gender. Biologically, the child is male. I'll call him Tim.

Tim loves to play with hair, wear princess dresses, and have ribbons tied into his/her hair.

More interestingly though, Tim often goes by other names like 'Daisy' 'Sally' and 'Alice'. I overheard a conversation between him/her and another child yesterday: ""You're pretending to be a girl!"" ""No, I am a girl!""

Later, I asked Daisy, ""Will you be Daisy tomorrow?"" ""No, I'm going to be Sally"" ""Do you think you'll be Tim another day?"" ""I don't want to be Tim ever again""

He/she also expresses a strong desire to have ""beautiful, long hair"".

All of the educators roll with it, and call him/her by the name that he/she chooses each day. When I help him/her to get changed on days that she's a girl, I'll call her underwear 'knickers' or 'undies' instead of 'jocks'.
Sometimes other children will say, 'You're not a girl, you're a boy!' and if I hear them, I'll say 'Daisy is a girl today'. Most of the kids pick up on it and call her Daisy for the rest of the day. 

I guess I want to make sure that I'm handling this properly? And find out as much information as I can about very young children who are transgender, anecdotal or otherwise.


",trans,Transgender in preschool?,1385112360.0,"{'created_utc': 1385087160, 'id': '1r6sfz', 'num_comments': 8, 'score': 19, 'selftext': 'Hi everyone!\nI don\'t know a lot about the trans community, so please forgive &amp; correct me if I get any terminology wrong.\n\nI work at a day-care centre, and one of the children I care for has a very interesting relationship with his/her gender. Biologically, the child is male. I\'ll call him Tim.\n\nTim loves to play with hair, wear princess dresses, and have ribbons tied into his/her hair.\n\nMore interestingly though, Tim often goes by other names like \'Daisy\' \'Sally\' and \'Alice\'. I overheard a conversation between him/her and another child yesterday: ""You\'re pretending to be a girl!"" ""No, I am a girl!""\n\nLater, I asked Daisy, ""Will you be Daisy tomorrow?"" ""No, I\'m going to be Sally"" ""Do you think you\'ll be Tim another day?"" ""I don\'t want to be Tim ever again""\n\nHe/she also expresses a strong desire to have ""beautiful, long hair"".\n\nAll of the educators roll with it, and call him/her by the name that he/she chooses each day. When I help him/her to get changed on days that she\'s a girl, I\'ll call her underwear \'knickers\' or \'undies\' instead of \'jocks\'.\nSometimes other children will say, \'You\'re not a girl, you\'re a boy!\' and if I hear them, I\'ll say \'Daisy is a girl today\'. Most of the kids pick up on it and call her Daisy for the rest of the day. \n\nI guess I want to make sure that I\'m handling this properly? And find out as much information as I can about very young children who are transgender, anecdotal or otherwise.\n\n\n', 'subreddit': 'trans', 'title': 'Transgender in preschool?', 'created': 1385112360.0}"
2013-11-22 09:00:55,1r7h2u,0,7,,trans,Tesco caught in a hypocritical pickle as employees mock trans customers online,1385136055.0,"{'created_utc': 1385110855, 'id': '1r7h2u', 'num_comments': 0, 'score': 7, 'selftext': '', 'subreddit': 'trans', 'title': 'Tesco caught in a hypocritical pickle as employees mock trans customers online', 'created': 1385136055.0}"
2013-11-22 09:02:14,1r7h4w,0,5,,trans,TransActive: A Haven and a Voice for Transgender Children,1385136134.0,"{'created_utc': 1385110934, 'id': '1r7h4w', 'num_comments': 0, 'score': 5, 'selftext': '', 'subreddit': 'trans', 'title': 'TransActive: A Haven and a Voice for Transgender Children', 'created': 1385136134.0}"
2013-11-22 09:04:04,1r7h7g,0,4,,trans,Activists March To Bring Attention To Violence Against Transgender New Yorkers,1385136244.0,"{'created_utc': 1385111044, 'id': '1r7h7g', 'num_comments': 0, 'score': 4, 'selftext': '', 'subreddit': 'trans', 'title': 'Activists March To Bring Attention To Violence Against Transgender New Yorkers', 'created': 1385136244.0}"
2013-11-23 04:14:32,1r9n9h,2,10,"**I had posted this in another subreddit a month ago but I still need more interviews.**


I'm currently in a Second language acquisition course, and I'm particularly interesting in the affects of transitioning on second language acquisition. Specifically I want to know what happens pre and post hormonal treatment for transmen and transwomen. Of interest are those that have either learnt a second language and are working on their third post transition or are learning a second during the transition process. But anyone who is trans* identified and has learned a second language and is continuing its use is welcomed. 

What I'll need is around 30 - 60 minutes of time with an interview, either on skype or in-person (if you are in the bay area) about your experiences learning another language. I will need to record the interviews to then transcribe. You will be shown the transcription once I finish and have the ability to edit it. Of course, all interviews will be anonymous and completely voluntary. This can be any language so both native and non-English speakers are fine. Along with learning a ( first or second) signed language. To be a part of this please email me here on reddit. 

Thanks in advance.

edit: for anyone that doesn't have a reddit account you can email me @ slaresearcher@gmail.com",trans,I need trans* identified people for a research project on Second language acquisition.,1385205272.0,"{'created_utc': 1385180072, 'id': '1r9n9h', 'num_comments': 2, 'score': 10, 'selftext': ""**I had posted this in another subreddit a month ago but I still need more interviews.**\n\n\nI'm currently in a Second language acquisition course, and I'm particularly interesting in the affects of transitioning on second language acquisition. Specifically I want to know what happens pre and post hormonal treatment for transmen and transwomen. Of interest are those that have either learnt a second language and are working on their third post transition or are learning a second during the transition process. But anyone who is trans* identified and has learned a second language and is continuing its use is welcomed. \n\nWhat I'll need is around 30 - 60 minutes of time with an interview, either on skype or in-person (if you are in the bay area) about your experiences learning another language. I will need to record the interviews to then transcribe. You will be shown the transcription once I finish and have the ability to edit it. Of course, all interviews will be anonymous and completely voluntary. This can be any language so both native and non-English speakers are fine. Along with learning a ( first or second) signed language. To be a part of this please email me here on reddit. \n\nThanks in advance.\n\nedit: for anyone that doesn't have a reddit account you can email me @ slaresearcher@gmail.com"", 'subreddit': 'trans', 'title': 'I need trans* identified people for a research project on Second language acquisition.', 'created': 1385205272.0}"
2013-11-23 08:39:22,1ra09e,2,5,,trans,Colorado school board member: castration before transgender student equality,1385221162.0,"{'created_utc': 1385195962, 'id': '1ra09e', 'num_comments': 2, 'score': 5, 'selftext': '', 'subreddit': 'trans', 'title': 'Colorado school board member: castration before transgender student equality', 'created': 1385221162.0}"
2013-11-23 08:42:02,1ra0ck,0,12,,trans,Statement by Secretary Kerry: Transgender Day of Remembrance,1385221322.0,"{'created_utc': 1385196122, 'id': '1ra0ck', 'num_comments': 0, 'score': 12, 'selftext': '', 'subreddit': 'trans', 'title': 'Statement by Secretary Kerry: Transgender Day of Remembrance', 'created': 1385221322.0}"
2013-11-25 08:37:12,1renyb,6,0,,trans,"Trans women found dead in the UK, Detroit",1385393832.0,"{'created_utc': 1385368632, 'id': '1renyb', 'num_comments': 6, 'score': 0, 'selftext': '', 'subreddit': 'trans', 'title': 'Trans women found dead in the UK, Detroit', 'created': 1385393832.0}"
2013-11-25 08:39:27,1reo17,0,6,,trans,Why A Transgender Woman Got Fined After Presenting Train Ticket,1385393967.0,"{'created_utc': 1385368767, 'id': '1reo17', 'num_comments': 0, 'score': 6, 'selftext': '', 'subreddit': 'trans', 'title': 'Why A Transgender Woman Got Fined After Presenting Train Ticket', 'created': 1385393967.0}"
2013-11-25 08:40:29,1reo2r,0,2,,trans,Transgender Police Officer Files Harassment Complaint Against Middletown Department,1385394029.0,"{'created_utc': 1385368829, 'id': '1reo2r', 'num_comments': 0, 'score': 2, 'selftext': '', 'subreddit': 'trans', 'title': 'Transgender Police Officer Files Harassment Complaint Against Middletown Department', 'created': 1385394029.0}"
2013-11-25 10:10:38,1rerf9,0,0,,trans,Lawyer gets naked for trans rights in Russia,1385399438.0,"{'created_utc': 1385374238, 'id': '1rerf9', 'num_comments': 0, 'score': 0, 'selftext': '', 'subreddit': 'trans', 'title': 'Lawyer gets naked for trans rights in Russia', 'created': 1385399438.0}"
2013-11-25 10:12:15,1rerhi,1,7,,trans,Holding the Line on Transgender Student Protections,1385399535.0,"{'created_utc': 1385374335, 'id': '1rerhi', 'num_comments': 1, 'score': 7, 'selftext': '', 'subreddit': 'trans', 'title': 'Holding the Line on Transgender Student Protections', 'created': 1385399535.0}"
