created_utc,id,num_comments,score,selftext,subreddit,title,created,d_
2013-09-26 08:08:06,1n5xmf,9,9,"I've been wondering this for a while, and I am not entirely sure myself, so I would like to get some insight from someone else, yet I held off for a while because it feel insensitive to ask. 

I don't completely understand why T is added to LGB when sexuality and gender are two different things. I somehow feel like this is partly the reason why my psych asks me questions pertaining to my sexuality on each and every visit. ",trans,Why are Trans* people put together with LGB?,1380208086.0,"{'created_utc': 1380182886, 'id': '1n5xmf', 'num_comments': 9, 'score': 9, 'selftext': ""I've been wondering this for a while, and I am not entirely sure myself, so I would like to get some insight from someone else, yet I held off for a while because it feel insensitive to ask. \n\nI don't completely understand why T is added to LGB when sexuality and gender are two different things. I somehow feel like this is partly the reason why my psych asks me questions pertaining to my sexuality on each and every visit. "", 'subreddit': 'trans', 'title': 'Why are Trans* people put together with LGB?', 'created': 1380208086.0}"
2013-09-26 08:33:46,1n5ygf,0,0,,trans,New Jersey trans woman dies from stab wounds,1380209626.0,"{'created_utc': 1380184426, 'id': '1n5ygf', 'num_comments': 0, 'score': 0, 'selftext': '', 'subreddit': 'trans', 'title': 'New Jersey trans woman dies from stab wounds', 'created': 1380209626.0}"
2013-09-27 03:31:16,1n845j,10,11,"Hello fellow trans boys and girls,

I lived 23 years of my life thinking that I'm a gay man; and it wasn't until a friend's joking/unintentional question ""are you transgender?"" that I realized who I really am - a transgender woman (kinda long story short here...lol maybe another reddit post)

I'm pre-hormone due to financial reason. And I realized that when my friends refer to me as ""she"" in public while I look and dress like a man, it sends a very powerful message to the people around me: gender is an identity, it's not what body you're born with. 

I noticed that there are plenty of photography projects out there that focus on transgender people after the transition or when they dress in the way that matches their gender identity, they're all super awesome. 
But I want to do something bold and new. I want to photograph pre-hormone trans individuals, much like myself, looking/dressing the way that society thinks we are (because of our assigned-at-birth sex) while holding a sign that shows clearly what our true gender identity is.
As an artist, I really enjoy the contrast that lies there, and also the whole thought-provoking experience.

If you live in the Los Angeles area, and you would like to participate in this project, please contact me through this email and we'll schedule a shoot (you can give me as little information about yourself or as much as you'd like. I want you to feel 100% comfortable): 
betweenmyears@gmail.com

Here's the website I created for the project:

http://betweenmyearsproject.tumblr.com/

If you don't live in LA but you wish to participate, please feel free to email me your submissions at the email provided above :)

Note: 1) if you wish to remain anonymous in the photo, simply hold the sign in front of your face or just crop out your head.
2) the sign can be a stick figure drawing/the gender sign that I used in my photo/or any written words that express your gender identity.

Thank you so much for reading this long post I apologize for the length :/

And if you have any questions or opinions, feel free to let me know :)

Kai
 ",trans,Transgender Photography Project - Between My Ears,1380277876.0,"{'created_utc': 1380252676, 'id': '1n845j', 'num_comments': 10, 'score': 11, 'selftext': 'Hello fellow trans boys and girls,\n\nI lived 23 years of my life thinking that I\'m a gay man; and it wasn\'t until a friend\'s joking/unintentional question ""are you transgender?"" that I realized who I really am - a transgender woman (kinda long story short here...lol maybe another reddit post)\n\nI\'m pre-hormone due to financial reason. And I realized that when my friends refer to me as ""she"" in public while I look and dress like a man, it sends a very powerful message to the people around me: gender is an identity, it\'s not what body you\'re born with. \n\nI noticed that there are plenty of photography projects out there that focus on transgender people after the transition or when they dress in the way that matches their gender identity, they\'re all super awesome. \nBut I want to do something bold and new. I want to photograph pre-hormone trans individuals, much like myself, looking/dressing the way that society thinks we are (because of our assigned-at-birth sex) while holding a sign that shows clearly what our true gender identity is.\nAs an artist, I really enjoy the contrast that lies there, and also the whole thought-provoking experience.\n\nIf you live in the Los Angeles area, and you would like to participate in this project, please contact me through this email and we\'ll schedule a shoot (you can give me as little information about yourself or as much as you\'d like. I want you to feel 100% comfortable): \nbetweenmyears@gmail.com\n\nHere\'s the website I created for the project:\n\nhttp://betweenmyearsproject.tumblr.com/\n\nIf you don\'t live in LA but you wish to participate, please feel free to email me your submissions at the email provided above :)\n\nNote: 1) if you wish to remain anonymous in the photo, simply hold the sign in front of your face or just crop out your head.\n2) the sign can be a stick figure drawing/the gender sign that I used in my photo/or any written words that express your gender identity.\n\nThank you so much for reading this long post I apologize for the length :/\n\nAnd if you have any questions or opinions, feel free to let me know :)\n\nKai\n ', 'subreddit': 'trans', 'title': 'Transgender Photography Project - Between My Ears', 'created': 1380277876.0}"
2013-09-27 07:27:54,1n8gql,1,8,"My partner came out as a transwoman a few months ago, which I think is really good, and it's something she'd talked to me about before, so I was already supportive when that happened, but now I often doubt whether or not I'm being a good enough partner or showing enough support. I'm not really sure what to do. I try to show her I'm here to talk about it, but I know there's only so much I can do, being a ciswoman and not quite being able to relate. Trying to understand my own privilege while also trying to bond on my own feelings of body dysphoria in the past or pressures I have to be femme. But it's not something I understand. I want her to know that she doesn't have to feel oppressed by the pressure to be femme, but it's also that she wants to do it for her own self-image. That makes sense. I guess I just want some advice, from the transwomen on Reddit, on things maybe you would want from a partner and things you would want a partner to know. I don't know.

At a loss, sometimes!",trans,Being a supportive partner,1380292074.0,"{'created_utc': 1380266874, 'id': '1n8gql', 'num_comments': 1, 'score': 8, 'selftext': ""My partner came out as a transwoman a few months ago, which I think is really good, and it's something she'd talked to me about before, so I was already supportive when that happened, but now I often doubt whether or not I'm being a good enough partner or showing enough support. I'm not really sure what to do. I try to show her I'm here to talk about it, but I know there's only so much I can do, being a ciswoman and not quite being able to relate. Trying to understand my own privilege while also trying to bond on my own feelings of body dysphoria in the past or pressures I have to be femme. But it's not something I understand. I want her to know that she doesn't have to feel oppressed by the pressure to be femme, but it's also that she wants to do it for her own self-image. That makes sense. I guess I just want some advice, from the transwomen on Reddit, on things maybe you would want from a partner and things you would want a partner to know. I don't know.\n\nAt a loss, sometimes!"", 'subreddit': 'trans', 'title': 'Being a supportive partner', 'created': 1380292074.0}"
2013-09-28 01:09:42,1naaxp,0,2,,trans,my word!,1380355782.0,"{'created_utc': 1380330582, 'id': '1naaxp', 'num_comments': 0, 'score': 2, 'selftext': '', 'subreddit': 'trans', 'title': 'my word!', 'created': 1380355782.0}"
2013-09-28 06:30:05,1narx2,0,0,,trans,"LA trans woman slips, then struck by a hit and run driver",1380375005.0,"{'created_utc': 1380349805, 'id': '1narx2', 'num_comments': 0, 'score': 0, 'selftext': '', 'subreddit': 'trans', 'title': 'LA trans woman slips, then struck by a hit and run driver', 'created': 1380375005.0}"
2013-09-28 19:42:05,1nbu9y,29,11,"I want to share a brief story and ask for some feedback. I apologize if I use incorrect vocabulary; I'm out of my element.

I am an EMT on a small ambulance service in the Midwest. I've been in EMS for about 10 years. A while ago I was called to assist a woman with severe abdominal pain. We followed our standard treatment protocols, assessing her for various underlying causes ranging from urinary tract infection to appendicitis to internal haemorrhaging.

This woman was generally cooperative and denied any significant past medical history or problems. I asked about family history of ovarian cysts, pregnancies, regular menstruation, and so on, all of which are part of our normal fact-finding checklist. She denied any of the above, and the only odd moment was when my partner asked if she could be currently pregnant and she got angry. That can be a touchy subject under any circumstances, so we didn't pursue that line of questioning much further. We transported her to the hospital, transferred her to the ER, and went home.

A few days later, a friend at the hospital called me to tell me that the woman was MTF transgender. This came as a surprise, having never had a transgender patient in my time in EMS (remember, small town Midwest), and more importantly because she never mentioned anything about it. Nor, in retrospect, did she give any cause to seriously consider it. Nor did she correct my assumption of her sex when I started asking about ovaries &amp; pregnancy.

I don't know her motivations or psychological state, I don't know very much about her at all. Heck, perhaps she thought she appeared so obviously transgender that I couldn't help but realize it, and thus she thought I was a complete idiot when I started asking such irrelevant questions. 

Whatever the case, I was operating without knowing some extremely relevant information about my patient's anatomy. Because of this, I couldn't assess her accurately, and in somewhat different circumstances that could have led to me making significantly incorrect treatment decisions and potentially endangering her health.

Short of adding ""Are you transgender?"" to our assessment questions (which, let me assure you, won't go over well around here), should I have done something differently? 

I know many trans people have encountered ridicule and harassment in medical settings and may be hesitant (and in the case of something like a broken arm it's not relevant). But please, if you're the recipient of emergency medical services, make sure that the EMTs are aware of what anatomy they're dealing with. We're there to help, and we can do that better if we understand your circumstances.",trans,Transgender &amp; Medical Emergencies,1380422525.0,"{'created_utc': 1380397325, 'id': '1nbu9y', 'num_comments': 29, 'score': 11, 'selftext': 'I want to share a brief story and ask for some feedback. I apologize if I use incorrect vocabulary; I\'m out of my element.\n\nI am an EMT on a small ambulance service in the Midwest. I\'ve been in EMS for about 10 years. A while ago I was called to assist a woman with severe abdominal pain. We followed our standard treatment protocols, assessing her for various underlying causes ranging from urinary tract infection to appendicitis to internal haemorrhaging.\n\nThis woman was generally cooperative and denied any significant past medical history or problems. I asked about family history of ovarian cysts, pregnancies, regular menstruation, and so on, all of which are part of our normal fact-finding checklist. She denied any of the above, and the only odd moment was when my partner asked if she could be currently pregnant and she got angry. That can be a touchy subject under any circumstances, so we didn\'t pursue that line of questioning much further. We transported her to the hospital, transferred her to the ER, and went home.\n\nA few days later, a friend at the hospital called me to tell me that the woman was MTF transgender. This came as a surprise, having never had a transgender patient in my time in EMS (remember, small town Midwest), and more importantly because she never mentioned anything about it. Nor, in retrospect, did she give any cause to seriously consider it. Nor did she correct my assumption of her sex when I started asking about ovaries &amp; pregnancy.\n\nI don\'t know her motivations or psychological state, I don\'t know very much about her at all. Heck, perhaps she thought she appeared so obviously transgender that I couldn\'t help but realize it, and thus she thought I was a complete idiot when I started asking such irrelevant questions. \n\nWhatever the case, I was operating without knowing some extremely relevant information about my patient\'s anatomy. Because of this, I couldn\'t assess her accurately, and in somewhat different circumstances that could have led to me making significantly incorrect treatment decisions and potentially endangering her health.\n\nShort of adding ""Are you transgender?"" to our assessment questions (which, let me assure you, won\'t go over well around here), should I have done something differently? \n\nI know many trans people have encountered ridicule and harassment in medical settings and may be hesitant (and in the case of something like a broken arm it\'s not relevant). But please, if you\'re the recipient of emergency medical services, make sure that the EMTs are aware of what anatomy they\'re dealing with. We\'re there to help, and we can do that better if we understand your circumstances.', 'subreddit': 'trans', 'title': 'Transgender &amp; Medical Emergencies', 'created': 1380422525.0}"
2013-09-29 10:37:46,1nd97e,3,3,"So I posted a while ago about my gender confusion and stuff.  Since then I have concluded that I am Trans and do plan on transitioning from Male to Female as soon as possible.  But as a senior in high school the best thing is really to wait until after high school, to avoid that mess.  I have been in contact with the school social worker but that's about it so far.  

I think about it pretty much every day, and in the past couple weeks I have started to think slightly more dark things.  Weighing the pros and cons of life in general.  Which option does less damage to my family/friends.  

Me living and coming out will hurt my parents.  My mom will think she is losing me religiously wise, and probably blame herself and think she is a terrible parent.  I am pretty much my dad's only nerd/guy friend in my stepfamily.  He lives with my stepmom and stepsister so me being a girl too may mess him up more.  My friends will probably be creeped out to say the least.  They may still be ok with me but a few of them will avoid the mess that will become my life.  

OR.  My mom simply loses me.  I'm sure it would be bad, but in her mind, I would be in heaven somewhere.  Not here alive but not in a good way afterlife wise.  My dad would be in the same boat I guess, but at least he wouldn't possibly feel betrayed.  My friends could go on without having to work around my problems to do things like D&amp;D.  Its not like they really need me to do it.  Also parents wouldn't have to give me gas money, pay for food/clothes/all that junk.  They could probably still return my class ring, so thats an extra 300 right there.  I just don't feel like I'm worth the pain.  

Also then I wouldn't have to deal with the inevitable disappointment and shit of going from gentleman whale to lady whale.  As in I'm stupidly fat and hrt tends to cause weight gain.  So thats shitty.  Also I doubt many game companies are looking for fat trans programmers with self confidence issues and zero social skills.  So thats great too.  Also javascript is shit.  
Other topics of thought, what way of killing ones self would be the least inconvenient.  Obviously I don't want to make a huge mess or traumatize a bystander or something.  Also interesting, seems you cannot hold your breath too long or you almost pass out and kinda force yourself to breath again.  
Ever lost interest in your only get away?  Yeah, I can't really enjoy gaming.  Its just frustrating and distracting at this point, which makes me sad.  

I don't really know why I choose to post this.  I guess its my human instinct/self preservation trying to fix the helplessly broken.  It probably just sounds like me whining for attention.  Sorry. 

If this is the wrong place to post this let me know so I can go find said place and stop bugging you.  Also sorry for being depressing.  And stupid.  Also my fucking cat ran away. Apparently she didn't like me either. 

EDIT:
Thanks for the responses and help.  It was like 5am when I posted this so being stupidly tired helped, plus my cat took off literally last night. (my cat is a big deal, like the only creature I know for sure will accept me no matter what) Suicidal thoughts never really go away, at least at the moment, but at least I went to sleep and woke up with other people in the house, making anything pretty much impossible at the moment. I think I will email the social worker at school.  Sorry if this was depressing.  ",trans,I'm not a terribly useful person.,1380476266.0,"{'created_utc': 1380451066, 'id': '1nd97e', 'num_comments': 3, 'score': 3, 'selftext': ""So I posted a while ago about my gender confusion and stuff.  Since then I have concluded that I am Trans and do plan on transitioning from Male to Female as soon as possible.  But as a senior in high school the best thing is really to wait until after high school, to avoid that mess.  I have been in contact with the school social worker but that's about it so far.  \n\nI think about it pretty much every day, and in the past couple weeks I have started to think slightly more dark things.  Weighing the pros and cons of life in general.  Which option does less damage to my family/friends.  \n\nMe living and coming out will hurt my parents.  My mom will think she is losing me religiously wise, and probably blame herself and think she is a terrible parent.  I am pretty much my dad's only nerd/guy friend in my stepfamily.  He lives with my stepmom and stepsister so me being a girl too may mess him up more.  My friends will probably be creeped out to say the least.  They may still be ok with me but a few of them will avoid the mess that will become my life.  \n\nOR.  My mom simply loses me.  I'm sure it would be bad, but in her mind, I would be in heaven somewhere.  Not here alive but not in a good way afterlife wise.  My dad would be in the same boat I guess, but at least he wouldn't possibly feel betrayed.  My friends could go on without having to work around my problems to do things like D&amp;D.  Its not like they really need me to do it.  Also parents wouldn't have to give me gas money, pay for food/clothes/all that junk.  They could probably still return my class ring, so thats an extra 300 right there.  I just don't feel like I'm worth the pain.  \n\nAlso then I wouldn't have to deal with the inevitable disappointment and shit of going from gentleman whale to lady whale.  As in I'm stupidly fat and hrt tends to cause weight gain.  So thats shitty.  Also I doubt many game companies are looking for fat trans programmers with self confidence issues and zero social skills.  So thats great too.  Also javascript is shit.  \nOther topics of thought, what way of killing ones self would be the least inconvenient.  Obviously I don't want to make a huge mess or traumatize a bystander or something.  Also interesting, seems you cannot hold your breath too long or you almost pass out and kinda force yourself to breath again.  \nEver lost interest in your only get away?  Yeah, I can't really enjoy gaming.  Its just frustrating and distracting at this point, which makes me sad.  \n\nI don't really know why I choose to post this.  I guess its my human instinct/self preservation trying to fix the helplessly broken.  It probably just sounds like me whining for attention.  Sorry. \n\nIf this is the wrong place to post this let me know so I can go find said place and stop bugging you.  Also sorry for being depressing.  And stupid.  Also my fucking cat ran away. Apparently she didn't like me either. \n\nEDIT:\nThanks for the responses and help.  It was like 5am when I posted this so being stupidly tired helped, plus my cat took off literally last night. (my cat is a big deal, like the only creature I know for sure will accept me no matter what) Suicidal thoughts never really go away, at least at the moment, but at least I went to sleep and woke up with other people in the house, making anything pretty much impossible at the moment. I think I will email the social worker at school.  Sorry if this was depressing.  "", 'subreddit': 'trans', 'title': ""I'm not a terribly useful person."", 'created': 1380476266.0}"
2013-09-30 07:04:27,1nfcpz,0,10,,trans,Trans homecoming queen gracefully transcends haters by posing for NOH8,1380549867.0,"{'created_utc': 1380524667, 'id': '1nfcpz', 'num_comments': 0, 'score': 10, 'selftext': '', 'subreddit': 'trans', 'title': 'Trans homecoming queen gracefully transcends haters by posing for NOH8', 'created': 1380549867.0}"
2013-09-30 22:46:47,1ngyv4,5,8, It burns like fire! what are some things that you guys/ gals learned the hard way?,trans,so TIL that moisturizing your face right after shaving is NOT such a good idea...,1380606407.0,"{'created_utc': 1380581207, 'id': '1ngyv4', 'num_comments': 5, 'score': 8, 'selftext': ' It burns like fire! what are some things that you guys/ gals learned the hard way?', 'subreddit': 'trans', 'title': 'so TIL that moisturizing your face right after shaving is NOT such a good idea...', 'created': 1380606407.0}"
