created_utc,id,num_comments,score,selftext,subreddit,title,created,d_
2013-09-02 08:10:37,1lkejn,0,7,,trans,An anti-LGBT Oregon business shuts doors following state’s recent tough stance against trans discrimination,1378134637.0,"{'created_utc': 1378109437, 'id': '1lkejn', 'num_comments': 0, 'score': 7, 'selftext': '', 'subreddit': 'trans', 'title': 'An anti-LGBT Oregon business shuts doors following state’s recent tough stance against trans discrimination', 'created': 1378134637.0}"
2013-09-03 18:34:16,1lnqm8,6,12,"My partner has made offhand comments before, but admitted to me finally that he wishes he was born a woman. He's been pushing this down for a long time, and I'm worried that I don't have the right tools to help him in a healthy way.  I told him that I'd support him no matter what, and it's never too late to be happy- but beyond that, I don't know what to do. I don't know to what extent I should encourage learning about the resources out there (I don't want to push too hard, but I also don't want to watch him repress and go through depression more). I have no idea what the next steps are to help him. Does anyone have advice? Resources?",trans,"Helping partner, who is struggling with gender",1378258456.0,"{'created_utc': 1378233256, 'id': '1lnqm8', 'num_comments': 6, 'score': 12, 'selftext': ""My partner has made offhand comments before, but admitted to me finally that he wishes he was born a woman. He's been pushing this down for a long time, and I'm worried that I don't have the right tools to help him in a healthy way.  I told him that I'd support him no matter what, and it's never too late to be happy- but beyond that, I don't know what to do. I don't know to what extent I should encourage learning about the resources out there (I don't want to push too hard, but I also don't want to watch him repress and go through depression more). I have no idea what the next steps are to help him. Does anyone have advice? Resources?"", 'subreddit': 'trans', 'title': 'Helping partner, who is struggling with gender', 'created': 1378258456.0}"
2013-09-05 04:39:54,1lrkkb,7,20,,trans,"AWESOME-looking (and hot-looking) trans -positive porn launching end of September. As a trans woman who likes trans folks, I'm pretty excited",1378381194.0,"{'created_utc': 1378355994, 'id': '1lrkkb', 'num_comments': 7, 'score': 20, 'selftext': '', 'subreddit': 'trans', 'title': ""AWESOME-looking (and hot-looking) trans -positive porn launching end of September. As a trans woman who likes trans folks, I'm pretty excited"", 'created': 1378381194.0}"
2013-09-05 07:50:34,1lrt80,0,0,,trans,"During city hearing on pro-trans ordinance, opposition tweets transphobic comment about trans speaker",1378392634.0,"{'created_utc': 1378367434, 'id': '1lrt80', 'num_comments': 0, 'score': 0, 'selftext': '', 'subreddit': 'trans', 'title': 'During city hearing on pro-trans ordinance, opposition tweets transphobic comment about trans speaker', 'created': 1378392634.0}"
2013-09-06 05:13:56,1lu4ol,0,6,,trans,UPDATE — San Antonio’s Trans/LGBT protection ordinance passes!,1378469636.0,"{'created_utc': 1378444436, 'id': '1lu4ol', 'num_comments': 0, 'score': 6, 'selftext': '', 'subreddit': 'trans', 'title': 'UPDATE — San Antonio’s Trans/LGBT protection ordinance passes!', 'created': 1378469636.0}"
2013-09-06 09:32:15,1luela,5,5,,trans,FTM Crossplay Makeup Guide (x-post from r/ftm),1378485135.0,"{'created_utc': 1378459935, 'id': '1luela', 'num_comments': 5, 'score': 5, 'selftext': '', 'subreddit': 'trans', 'title': 'FTM Crossplay Makeup Guide (x-post from r/ftm)', 'created': 1378485135.0}"
2013-09-06 19:09:05,1lvcem,1,2,"What happens if one has elevated liver enzymes when initially tested? I'm starting the medical part of my transition early next month, and am starting to get really anxious about all the things that could go wrong.",trans,Question regarding blood tests prior to hrt(ftm).,1378519745.0,"{'created_utc': 1378494545, 'id': '1lvcem', 'num_comments': 1, 'score': 2, 'selftext': ""What happens if one has elevated liver enzymes when initially tested? I'm starting the medical part of my transition early next month, and am starting to get really anxious about all the things that could go wrong."", 'subreddit': 'trans', 'title': 'Question regarding blood tests prior to hrt(ftm).', 'created': 1378519745.0}"
2013-09-07 07:20:41,1lwkes,0,0,,trans,UK scholar urges Hong Kong government to delete transgender surgery requirement,1378563641.0,"{'created_utc': 1378538441, 'id': '1lwkes', 'num_comments': 0, 'score': 0, 'selftext': '', 'subreddit': 'trans', 'title': 'UK scholar urges Hong Kong government to delete transgender surgery requirement', 'created': 1378563641.0}"
2013-09-07 17:55:04,1lxake,2,1,"For example, if I was talking to a m -&gt; f trans person about their early life, would I use their current gender or their gender at the time? Or is it just personal preference?",trans,Which gender do I refer to a trans person as when talking about their childhood/pre-trans life?,1378601704.0,"{'created_utc': 1378576504, 'id': '1lxake', 'num_comments': 2, 'score': 1, 'selftext': 'For example, if I was talking to a m -&gt; f trans person about their early life, would I use their current gender or their gender at the time? Or is it just personal preference?', 'subreddit': 'trans', 'title': 'Which gender do I refer to a trans person as when talking about their childhood/pre-trans life?', 'created': 1378601704.0}"
2013-09-08 07:10:00,1lyl6o,0,3,,trans,(repost) Transgender director Lana Wachowski mesmerizes audience,1378649400.0,"{'created_utc': 1378624200, 'id': '1lyl6o', 'num_comments': 0, 'score': 3, 'selftext': '', 'subreddit': 'trans', 'title': '(repost) Transgender director Lana Wachowski mesmerizes audience', 'created': 1378649400.0}"
2013-09-08 08:18:50,1lyncj,9,17,,trans,x-post from r/gaming but I think it is appropriate here :D,1378653530.0,"{'created_utc': 1378628330, 'id': '1lyncj', 'num_comments': 9, 'score': 17, 'selftext': '', 'subreddit': 'trans', 'title': 'x-post from r/gaming but I think it is appropriate here :D', 'created': 1378653530.0}"
2013-09-09 09:35:32,1m0w6h,0,0,,trans,Is a transgender homecoming queen hopeful–internet sensation story a ‘puff piece?’,1378744532.0,"{'created_utc': 1378719332, 'id': '1m0w6h', 'num_comments': 0, 'score': 0, 'selftext': '', 'subreddit': 'trans', 'title': 'Is a transgender homecoming queen hopeful–internet sensation story a ‘puff piece?’', 'created': 1378744532.0}"
2013-09-10 02:53:38,1m2wak,2,0,,trans,"Why should psychopathic faggots known as ""trans"" people force society to acknowledge something that is empirically false?",1378806818.0,"{'created_utc': 1378781618, 'id': '1m2wak', 'num_comments': 2, 'score': 0, 'selftext': '', 'subreddit': 'trans', 'title': 'Why should psychopathic faggots known as ""trans"" people force society to acknowledge something that is empirically false?', 'created': 1378806818.0}"
2013-09-10 02:59:50,1m2wsp,0,1,,trans,Fired transgender NYC teacher gets victory in court,1378807190.0,"{'created_utc': 1378781990, 'id': '1m2wsp', 'num_comments': 0, 'score': 1, 'selftext': '', 'subreddit': 'trans', 'title': 'Fired transgender NYC teacher gets victory in court', 'created': 1378807190.0}"
2013-09-11 13:27:04,1m69sl,28,13,"I recently started a debate on a FB event page for a drag show that was put on by a queer/trans group. Just wondering what your take on this is? 

Campy drag (or drag in general), offensive to the transgender/transsexual community? Does it just make the cis/het population consider all trans* people to be ""men in dresses"" and that they're all good for a laugh/entertainment/butt of the joke? Or on the king side, that all men as super masc and have beards, etc?

*note: I know Transgender is an umbrella term, which actually includes drag queens/kings (whether or not they should be is up for debate). Let's not get hung up on semantics here. ",trans,"Question: Do you find drag, specifically campy drag, to be offensive to transsexuals?",1378931224.0,"{'created_utc': 1378906024, 'id': '1m69sl', 'num_comments': 28, 'score': 13, 'selftext': 'I recently started a debate on a FB event page for a drag show that was put on by a queer/trans group. Just wondering what your take on this is? \n\nCampy drag (or drag in general), offensive to the transgender/transsexual community? Does it just make the cis/het population consider all trans* people to be ""men in dresses"" and that they\'re all good for a laugh/entertainment/butt of the joke? Or on the king side, that all men as super masc and have beards, etc?\n\n*note: I know Transgender is an umbrella term, which actually includes drag queens/kings (whether or not they should be is up for debate). Let\'s not get hung up on semantics here. ', 'subreddit': 'trans', 'title': 'Question: Do you find drag, specifically campy drag, to be offensive to transsexuals?', 'created': 1378931224.0}"
2013-09-11 20:59:18,1m79fs,4,17,,trans,"WTF Gay male Community. ""Trannyshack"" ? It's 2013, you guys should know better.",1378958358.0,"{'created_utc': 1378933158, 'id': '1m79fs', 'num_comments': 4, 'score': 17, 'selftext': '', 'subreddit': 'trans', 'title': 'WTF Gay male Community. ""Trannyshack"" ? It\'s 2013, you guys should know better.', 'created': 1378958358.0}"
2013-09-13 04:42:47,1maq0t,0,1,,trans,"Trans woman found dead in Denton county, Texas | THE GUERRILLA ANGEL REPORT by Lexie Cannes",1379072567.0,"{'created_utc': 1379047367, 'id': '1maq0t', 'num_comments': 0, 'score': 1, 'selftext': '', 'subreddit': 'trans', 'title': 'Trans woman found dead in Denton county, Texas | THE GUERRILLA ANGEL REPORT by Lexie Cannes', 'created': 1379072567.0}"
2013-09-13 04:43:13,1maq1n,0,4,,trans,"Trans woman found dead in Denton county, Texas",1379072593.0,"{'created_utc': 1379047393, 'id': '1maq1n', 'num_comments': 0, 'score': 4, 'selftext': '', 'subreddit': 'trans', 'title': 'Trans woman found dead in Denton county, Texas', 'created': 1379072593.0}"
2013-09-13 08:14:13,1mayxh,0,2,,trans,Transgender lawyer in Russia thumbs nose at Vladimir Putin,1379085253.0,"{'created_utc': 1379060053, 'id': '1mayxh', 'num_comments': 0, 'score': 2, 'selftext': '', 'subreddit': 'trans', 'title': 'Transgender lawyer in Russia thumbs nose at Vladimir Putin', 'created': 1379085253.0}"
2013-09-13 19:30:12,1mc0i7,1,1,,trans,I believe that Transsexuals cannot be truly considered as their preferred gender. CMV,1379125812.0,"{'created_utc': 1379100612, 'id': '1mc0i7', 'num_comments': 1, 'score': 1, 'selftext': '', 'subreddit': 'trans', 'title': 'I believe that Transsexuals cannot be truly considered as their preferred gender. CMV', 'created': 1379125812.0}"
2013-09-14 18:20:34,1mdz7a,6,4,"It's been a week and 2 days for me on HRT, and every day is just so exciting to wake up to.  I think we should come together as a community a little bit, and get to know one another.  I don't have any lgbt groups around me, so I think you guys are the closest best thing for me.

So I guess every week we should do progress reports on where we're at with our transitions, and post weekly update picture of ourselves if you may feel so inclined.

I haven't had any major changes yet, I'm still really early in, obviously, but I can tell I'm changing.  And I love it so far.  I still can't go full time, but I'm building my feminine wardrobe up anyway.  I bought my first skirt and headband, and I think it's pretty cute... Haha.

Here's my day 1 - now pictures :D

http://imgur.com/vVexlxk

Hope you gals feel like joining in ;D
",trans,Picture Progress Saturday - 1 - Let's come together!,1379208034.0,"{'created_utc': 1379182834, 'id': '1mdz7a', 'num_comments': 6, 'score': 4, 'selftext': ""It's been a week and 2 days for me on HRT, and every day is just so exciting to wake up to.  I think we should come together as a community a little bit, and get to know one another.  I don't have any lgbt groups around me, so I think you guys are the closest best thing for me.\n\nSo I guess every week we should do progress reports on where we're at with our transitions, and post weekly update picture of ourselves if you may feel so inclined.\n\nI haven't had any major changes yet, I'm still really early in, obviously, but I can tell I'm changing.  And I love it so far.  I still can't go full time, but I'm building my feminine wardrobe up anyway.  I bought my first skirt and headband, and I think it's pretty cute... Haha.\n\nHere's my day 1 - now pictures :D\n\nhttp://imgur.com/vVexlxk\n\nHope you gals feel like joining in ;D\n"", 'subreddit': 'trans', 'title': ""Picture Progress Saturday - 1 - Let's come together!"", 'created': 1379208034.0}"
2013-09-15 02:23:27,1meucc,3,1,"So I've been thinking about taking some tweezers to my beard. I just can't stand to see it anymore, and no matter how much I shave it's still there. So should I or shouldn't I? Anyone know the pro's and con's of doing such a thing?",trans,Tweezing The Facial Hair.,1379237007.0,"{'created_utc': 1379211807, 'id': '1meucc', 'num_comments': 3, 'score': 1, 'selftext': ""So I've been thinking about taking some tweezers to my beard. I just can't stand to see it anymore, and no matter how much I shave it's still there. So should I or shouldn't I? Anyone know the pro's and con's of doing such a thing?"", 'subreddit': 'trans', 'title': 'Tweezing The Facial Hair.', 'created': 1379237007.0}"
2013-09-15 08:40:46,1mfawx,0,2,,trans,Trans women beaten to death in Los Angeles; Baton Rouge,1379259646.0,"{'created_utc': 1379234446, 'id': '1mfawx', 'num_comments': 0, 'score': 2, 'selftext': '', 'subreddit': 'trans', 'title': 'Trans women beaten to death in Los Angeles; Baton Rouge', 'created': 1379259646.0}"
2013-09-15 13:21:48,1mfiyl,0,3,,trans,Marsha P. Johnson: Revolutionary,1379276508.0,"{'created_utc': 1379251308, 'id': '1mfiyl', 'num_comments': 0, 'score': 3, 'selftext': '', 'subreddit': 'trans', 'title': 'Marsha P. Johnson: Revolutionary', 'created': 1379276508.0}"
2013-09-16 12:50:00,1mhx5v,1,0,"My surgery appointment is in less then two months and I question that I'm having troubles getting a straight answer.

How long before I can have sex? Both Penetrative and all other kinds.",trans,Question about G/SRS surgery,1379361000.0,"{'created_utc': 1379335800, 'id': '1mhx5v', 'num_comments': 1, 'score': 0, 'selftext': ""My surgery appointment is in less then two months and I question that I'm having troubles getting a straight answer.\n\nHow long before I can have sex? Both Penetrative and all other kinds."", 'subreddit': 'trans', 'title': 'Question about G/SRS surgery', 'created': 1379361000.0}"
2013-09-17 08:34:00,1mk7td,2,10,,trans,"Trans worker gets $50,000; firing people on the basis of gender ID or expression may be history",1379432040.0,"{'created_utc': 1379406840, 'id': '1mk7td', 'num_comments': 2, 'score': 10, 'selftext': '', 'subreddit': 'trans', 'title': 'Trans worker gets $50,000; firing people on the basis of gender ID or expression may be history', 'created': 1379432040.0}"
2013-09-18 00:28:30,1mlyw3,0,0,,trans,"Trans person asks question on /r/polyamory, is told to ""fuck off"" for using gender-neutral pronouns",1379489310.0,"{'created_utc': 1379464110, 'id': '1mlyw3', 'num_comments': 0, 'score': 0, 'selftext': '', 'subreddit': 'trans', 'title': 'Trans person asks question on /r/polyamory, is told to ""fuck off"" for using gender-neutral pronouns', 'created': 1379489310.0}"
2013-09-18 07:22:00,1mmnw8,0,0,,trans,"No words (Lisa Empanada, Amber Maxwell)",1379514120.0,"{'created_utc': 1379488920, 'id': '1mmnw8', 'num_comments': 0, 'score': 0, 'selftext': '', 'subreddit': 'trans', 'title': 'No words (Lisa Empanada, Amber Maxwell)', 'created': 1379514120.0}"
2013-09-18 23:11:45,1moblu,1,3,,trans,Non-Binary South West. A new support group for non-binary people in SW England and beyond... (x-posted all over the place),1379571105.0,"{'created_utc': 1379545905, 'id': '1moblu', 'num_comments': 1, 'score': 3, 'selftext': '', 'subreddit': 'trans', 'title': 'Non-Binary South West. A new support group for non-binary people in SW England and beyond... (x-posted all over the place)', 'created': 1379571105.0}"
2013-09-19 07:16:44,1mp4pw,0,1,,trans,Transgender whipping post: The Daily Caller,1379600204.0,"{'created_utc': 1379575004, 'id': '1mp4pw', 'num_comments': 0, 'score': 1, 'selftext': '', 'subreddit': 'trans', 'title': 'Transgender whipping post: The Daily Caller', 'created': 1379600204.0}"
2013-09-19 16:50:39,1mpxvp,19,11,"No throwaway because reasons.

To get to the point right away, I (m/19) have recently started to question whether I really want to live the rest of my life as a man. It's not tearing me apart, but the thought is always there and wont leave my head, I think about it every night when I go to sleep and countless times during the day. I don't think I really hate being a man, but I don't feel happy or anything in any way to be one; if I could just magically turn into a girl without anyone noticing the difference I'd do it in a heartbeat. I can acknowledge that men can look good, but no man looks like what I would want to look like if I could just choose freely, if I see myself in the mirror I know it's me, but it feels like what's in my reflection is not what I should see, it's almost as if I'm a little bit surprised that that is what I look like every time I see my face.

I'm already sure I'm not gay however, I can say a man is good looking but I could never think of a man as beautiful in the same way as a women.

I don't know quite what I'm hoping to achieve with this post, maybe some advice, someone I could ask weird questions or just the affirmation that I'm not crazy, because right now I'm just really out of it and don't know what to think or do. I can in no way come out to my parents at this point since I'm also socially anxious and already have an incredibly hard time talking about my feelings at all with anyone, my fingers are literally shaking from being nervous while I'm just typing this. I'm a little scared of admitting this to myself, but I'm even more scared of the possibility of spending all my life as a man when it might never make me quite happy.",trans,Starting to question my gender identity,1379634639.0,"{'created_utc': 1379609439, 'id': '1mpxvp', 'num_comments': 19, 'score': 11, 'selftext': ""No throwaway because reasons.\n\nTo get to the point right away, I (m/19) have recently started to question whether I really want to live the rest of my life as a man. It's not tearing me apart, but the thought is always there and wont leave my head, I think about it every night when I go to sleep and countless times during the day. I don't think I really hate being a man, but I don't feel happy or anything in any way to be one; if I could just magically turn into a girl without anyone noticing the difference I'd do it in a heartbeat. I can acknowledge that men can look good, but no man looks like what I would want to look like if I could just choose freely, if I see myself in the mirror I know it's me, but it feels like what's in my reflection is not what I should see, it's almost as if I'm a little bit surprised that that is what I look like every time I see my face.\n\nI'm already sure I'm not gay however, I can say a man is good looking but I could never think of a man as beautiful in the same way as a women.\n\nI don't know quite what I'm hoping to achieve with this post, maybe some advice, someone I could ask weird questions or just the affirmation that I'm not crazy, because right now I'm just really out of it and don't know what to think or do. I can in no way come out to my parents at this point since I'm also socially anxious and already have an incredibly hard time talking about my feelings at all with anyone, my fingers are literally shaking from being nervous while I'm just typing this. I'm a little scared of admitting this to myself, but I'm even more scared of the possibility of spending all my life as a man when it might never make me quite happy."", 'subreddit': 'trans', 'title': 'Starting to question my gender identity', 'created': 1379634639.0}"
2013-09-20 07:28:28,1mrke3,0,0,,trans,"Raging transphobe ""apologizes"" to trans fighter Fallon Fox",1379687308.0,"{'created_utc': 1379662108, 'id': '1mrke3', 'num_comments': 0, 'score': 0, 'selftext': '', 'subreddit': 'trans', 'title': 'Raging transphobe ""apologizes"" to trans fighter Fallon Fox', 'created': 1379687308.0}"
2013-09-21 06:23:53,1mtqqc,0,0,,trans,(UPDATE: Trans student wins crown!) Is a transgender homecoming queen hopeful--internet sensation story a 'puff piece?',1379769833.0,"{'created_utc': 1379744633, 'id': '1mtqqc', 'num_comments': 0, 'score': 0, 'selftext': '', 'subreddit': 'trans', 'title': ""(UPDATE: Trans student wins crown!) Is a transgender homecoming queen hopeful--internet sensation story a 'puff piece?'"", 'created': 1379769833.0}"
2013-09-21 18:01:32,1muk86,3,1,"I am working with the University of Buckingham on a project of which the quality of life in transsexuals with and without hormone therapy is being investigated. The study is using a questionnaire to gather information. This study has been given ethical approval by the ethical committee. The study will look at aspects of quality of life in relation to transsexuals. The questionnaire itself will last no longer than 5 minutes.
https://www.surveymonkey.com/s/V3D6JNG

please have a look, and please spread the word if you can.

Thank you,",trans,Quality of life questionnaire.,1379811692.0,"{'created_utc': 1379786492, 'id': '1muk86', 'num_comments': 3, 'score': 1, 'selftext': 'I am working with the University of Buckingham on a project of which the quality of life in transsexuals with and without hormone therapy is being investigated. The study is using a questionnaire to gather information. This study has been given ethical approval by the ethical committee. The study will look at aspects of quality of life in relation to transsexuals. The questionnaire itself will last no longer than 5 minutes.\nhttps://www.surveymonkey.com/s/V3D6JNG\n\nplease have a look, and please spread the word if you can.\n\nThank you,', 'subreddit': 'trans', 'title': 'Quality of life questionnaire.', 'created': 1379811692.0}"
2013-09-22 14:35:33,1mw84w,0,1,,trans,"Reddit, I need to make my body match my internal understanding of how my body should be. I have Gender Dysphoria, have been on HRT for several months, and it's time to have that final, life affirming surgery. Please give what you can.",1379885733.0,"{'created_utc': 1379860533, 'id': '1mw84w', 'num_comments': 0, 'score': 1, 'selftext': '', 'subreddit': 'trans', 'title': ""Reddit, I need to make my body match my internal understanding of how my body should be. I have Gender Dysphoria, have been on HRT for several months, and it's time to have that final, life affirming surgery. Please give what you can."", 'created': 1379885733.0}"
2013-09-23 19:45:37,1mzail,5,20,,trans,"This gives me hope! Couple both have SRS, and get married again!",1379990737.0,"{'created_utc': 1379965537, 'id': '1mzail', 'num_comments': 5, 'score': 20, 'selftext': '', 'subreddit': 'trans', 'title': 'This gives me hope! Couple both have SRS, and get married again!', 'created': 1379990737.0}"
2013-09-24 04:22:10,1n0e1a,0,5,,trans,(UPDATE: Plans to run for Russian President) Trans lawyer in Russia thumbs nose at Vladimir Putin,1380021730.0,"{'created_utc': 1379996530, 'id': '1n0e1a', 'num_comments': 0, 'score': 5, 'selftext': '', 'subreddit': 'trans', 'title': '(UPDATE: Plans to run for Russian President) Trans lawyer in Russia thumbs nose at Vladimir Putin', 'created': 1380021730.0}"
2013-09-24 08:42:33,1n0p8o,2,0,,trans,School district superintendent texted ‘black people’s last name should always be N*IGGER’,1380037353.0,"{'created_utc': 1380012153, 'id': '1n0p8o', 'num_comments': 2, 'score': 0, 'selftext': '', 'subreddit': 'trans', 'title': 'School district superintendent texted ‘black people’s last name should always be N*IGGER’', 'created': 1380037353.0}"
2013-09-25 06:31:18,1n361f,1,1,,trans,12-year-old trans role model urge trans kids to 'step out of the shadows',1380115878.0,"{'created_utc': 1380090678, 'id': '1n361f', 'num_comments': 1, 'score': 1, 'selftext': '', 'subreddit': 'trans', 'title': ""12-year-old trans role model urge trans kids to 'step out of the shadows'"", 'created': 1380115878.0}"
2013-09-25 07:53:40,1n39qb,0,3,,trans,"Anti-trans ""family association"" demonizes trans kid with transphobic rant",1380120820.0,"{'created_utc': 1380095620, 'id': '1n39qb', 'num_comments': 0, 'score': 3, 'selftext': '', 'subreddit': 'trans', 'title': 'Anti-trans ""family association"" demonizes trans kid with transphobic rant', 'created': 1380120820.0}"
2013-09-25 23:13:45,1n50h0,4,10,"I will have my first MD visit leading to HRT, at Whitman-Walker Health in DC!!! What a cake day!  UPDATE:  Green lights from psych and trans advocate, Labs drawn...a few days to go  :  )",trans,"Tomorrow, on my birthday : )",1380176025.0,"{'created_utc': 1380150825, 'id': '1n50h0', 'num_comments': 4, 'score': 10, 'selftext': 'I will have my first MD visit leading to HRT, at Whitman-Walker Health in DC!!! What a cake day!  UPDATE:  Green lights from psych and trans advocate, Labs drawn...a few days to go  :  )', 'subreddit': 'trans', 'title': 'Tomorrow, on my birthday : )', 'created': 1380176025.0}"
