created_utc,id,num_comments,score,selftext,subreddit,title,created,d_
2013-11-26 04:01:08,1rgzu1,4,7,"Okay, so lately I've been slowly showing my more masculine side, but today I may have crossed the line. I wore my hair in a beanie and it kind of looked like p!nks hair style, and my mom said ""Oh, you want the Bieber do'?"" and I said ""Uhm...sure."" (I kind of do, but I prefer it like this so I can choose for my hair for whatever gender I feel that day) and she said ""You..you're scaring me, you keep on acting like a boy and doing what I've come to find you never have liked or found fun!"" I just said ""Mom, it's okay, people change and their tastes change with them."" 

Has anyone else experienced this? Is this a trans* wide thing?",trans,"""You're scaring me!""",1385463668.0,"{'created_utc': 1385438468, 'id': '1rgzu1', 'num_comments': 4, 'score': 7, 'selftext': 'Okay, so lately I\'ve been slowly showing my more masculine side, but today I may have crossed the line. I wore my hair in a beanie and it kind of looked like p!nks hair style, and my mom said ""Oh, you want the Bieber do\'?"" and I said ""Uhm...sure."" (I kind of do, but I prefer it like this so I can choose for my hair for whatever gender I feel that day) and she said ""You..you\'re scaring me, you keep on acting like a boy and doing what I\'ve come to find you never have liked or found fun!"" I just said ""Mom, it\'s okay, people change and their tastes change with them."" \n\nHas anyone else experienced this? Is this a trans* wide thing?', 'subreddit': 'trans', 'title': '""You\'re scaring me!""', 'created': 1385463668.0}"
2013-11-26 07:39:25,1rhdzm,0,5,,trans,Victory! Transgender Man Wins Right to Work as Authentic Self,1385476765.0,"{'created_utc': 1385451565, 'id': '1rhdzm', 'num_comments': 0, 'score': 5, 'selftext': '', 'subreddit': 'trans', 'title': 'Victory! Transgender Man Wins Right to Work as Authentic Self', 'created': 1385476765.0}"
2013-11-26 16:47:11,1ri5uf,5,14,"It just occurred to me that when I think about myself pre-transition, it's like I'm thinking about a different person who is at the same time still me, and I wonder if that's how the Doctor feels about his past regenerations.",trans,I think I know how the Doctor (Doctor Who) feels,1385509631.0,"{'created_utc': 1385484431, 'id': '1ri5uf', 'num_comments': 5, 'score': 14, 'selftext': ""It just occurred to me that when I think about myself pre-transition, it's like I'm thinking about a different person who is at the same time still me, and I wonder if that's how the Doctor feels about his past regenerations."", 'subreddit': 'trans', 'title': 'I think I know how the Doctor (Doctor Who) feels', 'created': 1385509631.0}"
2013-11-27 09:13:09,1rk8vw,0,6,,trans,Family strife following pride event triggers trans woman’s suicide,1385568789.0,"{'created_utc': 1385543589, 'id': '1rk8vw', 'num_comments': 0, 'score': 6, 'selftext': '', 'subreddit': 'trans', 'title': 'Family strife following pride event triggers trans woman’s suicide', 'created': 1385568789.0}"
2013-11-29 08:04:07,1rp6ae,0,0,,trans,Perseverance rewards transgender musician,1385737447.0,"{'created_utc': 1385712247, 'id': '1rp6ae', 'num_comments': 0, 'score': 0, 'selftext': '', 'subreddit': 'trans', 'title': 'Perseverance rewards transgender musician', 'created': 1385737447.0}"
2013-11-29 08:07:44,1rp6fp,0,8,,trans,OP-ED: Transgender individuals should not be left out of universal healthcare,1385737664.0,"{'created_utc': 1385712464, 'id': '1rp6fp', 'num_comments': 0, 'score': 8, 'selftext': '', 'subreddit': 'trans', 'title': 'OP-ED: Transgender individuals should not be left out of universal healthcare', 'created': 1385737664.0}"
2013-11-30 14:10:17,1rruuk,0,11,,trans,'Preferred' pronouns gain traction at US colleges,1385845817.0,"{'created_utc': 1385820617, 'id': '1rruuk', 'num_comments': 0, 'score': 11, 'selftext': '', 'subreddit': 'trans', 'title': ""'Preferred' pronouns gain traction at US colleges"", 'created': 1385845817.0}"
