,created_utc,id,num_comments,score,selftext,subreddit,title,created,d_,Unnamed: 0
63,2012-08-08 07:23:49,xvd9s,1,11,,transgender,Upcoming trans study says men in military twice as likely to identify as female ,1344435829.0,"{'created_utc': 1344410629, 'id': 'xvd9s', 'num_comments': 1, 'score': 11, 'selftext': '', 'subreddit': 'transgender', 'title': 'Upcoming trans study says men in military twice as likely to identify as female ', 'created': 1344435829.0}",
64,2012-08-08 08:07:35,xvep6,1,0,,transgender,"Bought a trans bracelet online, came with other free goodies!",1344438455.0,"{'created_utc': 1344413255, 'id': 'xvep6', 'num_comments': 1, 'score': 0, 'selftext': '', 'subreddit': 'transgender', 'title': 'Bought a trans bracelet online, came with other free goodies!', 'created': 1344438455.0}",
65,2012-08-08 13:28:05,xvogi,2,10,,transgender,TIL there is a trans subreddit for UK folks,1344457685.0,"{'created_utc': 1344432485, 'id': 'xvogi', 'num_comments': 2, 'score': 10, 'selftext': '', 'subreddit': 'transgender', 'title': 'TIL there is a trans subreddit for UK folks', 'created': 1344457685.0}",
66,2012-08-08 16:32:31,xvyot,13,87,,transgender,Trans Man Denied Cancer Treatment; Now Feds Say It's Illegal,1344468751.0,"{'created_utc': 1344443551, 'id': 'xvyot', 'num_comments': 13, 'score': 87, 'selftext': '', 'subreddit': 'transgender', 'title': ""Trans Man Denied Cancer Treatment; Now Feds Say It's Illegal"", 'created': 1344468751.0}",
67,2012-08-08 20:59:31,xwhc3,0,3,,transgender,"an exercise in ventriloquism: my submission to catharsis; personal narrative &amp; analysis of rape, psychiatric disability, transmisogyny &amp; barriers to support. (trigger warning)",1344484771.0,"{'created_utc': 1344459571, 'id': 'xwhc3', 'num_comments': 0, 'score': 3, 'selftext': '', 'subreddit': 'transgender', 'title': 'an exercise in ventriloquism: my submission to catharsis; personal narrative &amp; analysis of rape, psychiatric disability, transmisogyny &amp; barriers to support. (trigger warning)', 'created': 1344484771.0}",
68,2012-08-08 22:25:06,xwmzx,21,68,,transgender,Stage 1 complete.,1344489906.0,"{'created_utc': 1344464706, 'id': 'xwmzx', 'num_comments': 21, 'score': 68, 'selftext': '', 'subreddit': 'transgender', 'title': 'Stage 1 complete.', 'created': 1344489906.0}",
69,2012-08-08 23:08:51,xwpps,9,43,,transgender,What’s So Bad About a Boy Who Wants to Wear a Dress? - NYTimes.com,1344492531.0,"{'created_utc': 1344467331, 'id': 'xwpps', 'num_comments': 9, 'score': 43, 'selftext': '', 'subreddit': 'transgender', 'title': 'What’s So Bad About a Boy Who Wants to Wear a Dress? - NYTimes.com', 'created': 1344492531.0}",
70,2012-08-09 02:34:07,xx28t,4,9,,transgender,Successful white hair removal with combined coloring and intense pulsed Light,1344504847.0,"{'created_utc': 1344479647, 'id': 'xx28t', 'num_comments': 4, 'score': 9, 'selftext': '', 'subreddit': 'transgender', 'title': 'Successful white hair removal with combined coloring and intense pulsed Light', 'created': 1344504847.0}",
71,2012-08-09 02:37:23,xx2fp,11,7,,transgender,Prominent Deaf Civil Rights Organization Thumbs Its Nose at LGBT People a Second Time ,1344505043.0,"{'created_utc': 1344479843, 'id': 'xx2fp', 'num_comments': 11, 'score': 7, 'selftext': '', 'subreddit': 'transgender', 'title': 'Prominent Deaf Civil Rights Organization Thumbs Its Nose at LGBT People a Second Time ', 'created': 1344505043.0}",
72,2012-08-09 03:04:19,xx439,0,1,,transgender,I heard this song on the radio and it made me think of you guys &lt;3,1344506659.0,"{'created_utc': 1344481459, 'id': 'xx439', 'num_comments': 0, 'score': 1, 'selftext': '', 'subreddit': 'transgender', 'title': 'I heard this song on the radio and it made me think of you guys &lt;3', 'created': 1344506659.0}",
73,2012-08-09 03:15:16,xx4rc,3,13,,transgender,I just heard this on the radio and it made me think of you all &lt;3,1344507316.0,"{'created_utc': 1344482116, 'id': 'xx4rc', 'num_comments': 3, 'score': 13, 'selftext': '', 'subreddit': 'transgender', 'title': 'I just heard this on the radio and it made me think of you all &lt;3', 'created': 1344507316.0}",
74,2012-08-09 04:04:59,xx7pa,1,8,,transgender,Learning to Hide Things About Yourself,1344510299.0,"{'created_utc': 1344485099, 'id': 'xx7pa', 'num_comments': 1, 'score': 8, 'selftext': '', 'subreddit': 'transgender', 'title': 'Learning to Hide Things About Yourself', 'created': 1344510299.0}",
75,2012-08-09 08:54:42,xxjo2,56,19,,transgender,"The Male Gaze, a constant presence in a trans woman’s life  ",1344527682.0,"{'created_utc': 1344502482, 'id': 'xxjo2', 'num_comments': 56, 'score': 19, 'selftext': '', 'subreddit': 'transgender', 'title': 'The Male Gaze, a constant presence in a trans woman’s life  ', 'created': 1344527682.0}",
76,2012-08-09 11:33:03,xxnmp,0,0,,transgender,What's In a Name Anyway?,1344537183.0,"{'created_utc': 1344511983, 'id': 'xxnmp', 'num_comments': 0, 'score': 0, 'selftext': '', 'subreddit': 'transgender', 'title': ""What's In a Name Anyway?"", 'created': 1344537183.0}",
77,2012-08-09 11:43:38,xxnxo,2,14,,transgender,A thank you to Reddit &amp; beginning of a long process,1344537818.0,"{'created_utc': 1344512618, 'id': 'xxnxo', 'num_comments': 2, 'score': 14, 'selftext': '', 'subreddit': 'transgender', 'title': 'A thank you to Reddit &amp; beginning of a long process', 'created': 1344537818.0}",
78,2012-08-09 16:50:36,xy3al,14,115,,transgender,"I want both ;(, damn troll questions",1344556236.0,"{'created_utc': 1344531036, 'id': 'xy3al', 'num_comments': 14, 'score': 115, 'selftext': '', 'subreddit': 'transgender', 'title': 'I want both ;(, damn troll questions', 'created': 1344556236.0}",
79,2012-08-09 16:54:34,xy3jd,0,2,,transgender,"For Trans People, from Peak Radphlegm",1344556474.0,"{'created_utc': 1344531274, 'id': 'xy3jd', 'num_comments': 0, 'score': 2, 'selftext': '', 'subreddit': 'transgender', 'title': 'For Trans People, from Peak Radphlegm', 'created': 1344556474.0}",
80,2012-08-09 19:55:56,xyfrg,8,53,,transgender,"""Disgusting"" - an open letter to the man who spat at me a few days ago.",1344567356.0,"{'created_utc': 1344542156, 'id': 'xyfrg', 'num_comments': 8, 'score': 53, 'selftext': '', 'subreddit': 'transgender', 'title': '""Disgusting"" - an open letter to the man who spat at me a few days ago.', 'created': 1344567356.0}",
81,2012-08-09 20:47:42,xyj80,0,1,,transgender,HHS Clarifies That The Affordable Care Act Prohibits Discrimination Based On Gender Identity!,1344570462.0,"{'created_utc': 1344545262, 'id': 'xyj80', 'num_comments': 0, 'score': 1, 'selftext': '', 'subreddit': 'transgender', 'title': 'HHS Clarifies That The Affordable Care Act Prohibits Discrimination Based On Gender Identity!', 'created': 1344570462.0}",
82,2012-08-09 23:43:48,xyugz,1,5,,transgender,"Check out our new css beta, please leave comments.",1344581028.0,"{'created_utc': 1344555828, 'id': 'xyugz', 'num_comments': 1, 'score': 5, 'selftext': '', 'subreddit': 'transgender', 'title': 'Check out our new css beta, please leave comments.', 'created': 1344581028.0}",
83,2012-08-10 01:16:41,xz02v,16,21,,transgender,Transition = Life or How to Cure Suicide,1344586601.0,"{'created_utc': 1344561401, 'id': 'xz02v', 'num_comments': 16, 'score': 21, 'selftext': '', 'subreddit': 'transgender', 'title': 'Transition = Life or How to Cure Suicide', 'created': 1344586601.0}",
84,2012-08-10 07:19:07,xzj13,2,11,,transgender,A new subreddit dedicated to celebrating all the ways in which we are gender non-compliant.,1344608347.0,"{'created_utc': 1344583147, 'id': 'xzj13', 'num_comments': 2, 'score': 11, 'selftext': '', 'subreddit': 'transgender', 'title': 'A new subreddit dedicated to celebrating all the ways in which we are gender non-compliant.', 'created': 1344608347.0}",
85,2012-08-10 08:56:25,xzly5,18,35,,transgender,State investigates bar after owner tells transgender patrons not to return  ,1344614185.0,"{'created_utc': 1344588985, 'id': 'xzly5', 'num_comments': 18, 'score': 35, 'selftext': '', 'subreddit': 'transgender', 'title': 'State investigates bar after owner tells transgender patrons not to return  ', 'created': 1344614185.0}",
86,2012-08-10 10:46:43,xzomg,1,0,,transgender,Question to the community regarding flair,1344620803.0,"{'created_utc': 1344595603, 'id': 'xzomg', 'num_comments': 1, 'score': 0, 'selftext': '', 'subreddit': 'transgender', 'title': 'Question to the community regarding flair', 'created': 1344620803.0}",
87,2012-08-10 11:27:05,xzpo4,6,26,,transgender,"I missed the most important appointment of my life, but only because I totally didn't know about it. Srsly, FML.",1344623225.0,"{'created_utc': 1344598025, 'id': 'xzpo4', 'num_comments': 6, 'score': 26, 'selftext': '', 'subreddit': 'transgender', 'title': ""I missed the most important appointment of my life, but only because I totally didn't know about it. Srsly, FML."", 'created': 1344623225.0}",
88,2012-08-10 13:15:34,xztfu,0,0,,transgender,Watched TV last night and felt worthless and disgusting...,1344629734.0,"{'created_utc': 1344604534, 'id': 'xztfu', 'num_comments': 0, 'score': 0, 'selftext': '', 'subreddit': 'transgender', 'title': 'Watched TV last night and felt worthless and disgusting...', 'created': 1344629734.0}",
89,2012-08-10 21:46:18,y0occ,7,55,,transgender,Its those little things like having your proper named used on the receipt...,1344660378.0,"{'created_utc': 1344635178, 'id': 'y0occ', 'num_comments': 7, 'score': 55, 'selftext': '', 'subreddit': 'transgender', 'title': 'Its those little things like having your proper named used on the receipt...', 'created': 1344660378.0}",
90,2012-08-10 22:35:41,y0r6k,11,7,,transgender,"I don't really like Ray William Johnson, but this really pissed me off. First 15 seconds of the video...",1344663341.0,"{'created_utc': 1344638141, 'id': 'y0r6k', 'num_comments': 11, 'score': 7, 'selftext': '', 'subreddit': 'transgender', 'title': ""I don't really like Ray William Johnson, but this really pissed me off. First 15 seconds of the video..."", 'created': 1344663341.0}",
91,2012-08-11 05:21:03,y1bs0,11,236,,transgender,The joys of hormones,1344687663.0,"{'created_utc': 1344662463, 'id': 'y1bs0', 'num_comments': 11, 'score': 236, 'selftext': '', 'subreddit': 'transgender', 'title': 'The joys of hormones', 'created': 1344687663.0}",
92,2012-08-11 06:45:02,y1fap,2,3,,transgender,I just felt like sharing: This genre may not be your forte but this song holds significance to me,1344692702.0,"{'created_utc': 1344667502, 'id': 'y1fap', 'num_comments': 2, 'score': 3, 'selftext': '', 'subreddit': 'transgender', 'title': 'I just felt like sharing: This genre may not be your forte but this song holds significance to me', 'created': 1344692702.0}",
93,2012-08-11 15:05:00,y1sjx,0,0,,transgender,"Fine Australia I get it, we can't be friends",1344722700.0,"{'created_utc': 1344697500, 'id': 'y1sjx', 'num_comments': 0, 'score': 0, 'selftext': '', 'subreddit': 'transgender', 'title': ""Fine Australia I get it, we can't be friends"", 'created': 1344722700.0}",
94,2012-08-11 16:53:48,y1xd0,2,30,,transgender,Passing through Gawker and spotted this. Thought it was an interesting read. ,1344729228.0,"{'created_utc': 1344704028, 'id': 'y1xd0', 'num_comments': 2, 'score': 30, 'selftext': '', 'subreddit': 'transgender', 'title': 'Passing through Gawker and spotted this. Thought it was an interesting read. ', 'created': 1344729228.0}",
95,2012-08-11 20:50:14,y29lk,44,14,,transgender,Thought this was interesting: Judith Butler: Your Behavior Creates Your Gender,1344743414.0,"{'created_utc': 1344718214, 'id': 'y29lk', 'num_comments': 44, 'score': 14, 'selftext': '', 'subreddit': 'transgender', 'title': 'Thought this was interesting: Judith Butler: Your Behavior Creates Your Gender', 'created': 1344743414.0}",
96,2012-08-11 20:52:46,y29re,0,10,,transgender,Exploring Gender : Visibility,1344743566.0,"{'created_utc': 1344718366, 'id': 'y29re', 'num_comments': 0, 'score': 10, 'selftext': '', 'subreddit': 'transgender', 'title': 'Exploring Gender : Visibility', 'created': 1344743566.0}",
97,2012-08-12 02:33:32,y2r7t,3,25,,transgender,I answer the 7 Questions for We Happy Trans,1344764012.0,"{'created_utc': 1344738812, 'id': 'y2r7t', 'num_comments': 3, 'score': 25, 'selftext': '', 'subreddit': 'transgender', 'title': 'I answer the 7 Questions for We Happy Trans', 'created': 1344764012.0}",
98,2012-08-12 08:30:51,y35l0,24,42,,transgender,I'm a transwoman synthpop singer\songwriter (more info in the comments).  Here's my music if you'd like to listen.,1344785451.0,"{'created_utc': 1344760251, 'id': 'y35l0', 'num_comments': 24, 'score': 42, 'selftext': '', 'subreddit': 'transgender', 'title': ""I'm a transwoman synthpop singer\\songwriter (more info in the comments).  Here's my music if you'd like to listen."", 'created': 1344785451.0}",
99,2012-08-12 15:28:10,y3g5i,0,2,,transgender,Is It Something I Said?,1344810490.0,"{'created_utc': 1344785290, 'id': 'y3g5i', 'num_comments': 0, 'score': 2, 'selftext': '', 'subreddit': 'transgender', 'title': 'Is It Something I Said?', 'created': 1344810490.0}",
100,2012-08-12 20:06:17,y3ubm,0,1,,transgender,*requested Update* 188 Day HRT Transition,1344827177.0,"{'created_utc': 1344801977, 'id': 'y3ubm', 'num_comments': 0, 'score': 1, 'selftext': '', 'subreddit': 'transgender', 'title': '*requested Update* 188 Day HRT Transition', 'created': 1344827177.0}",
101,2012-08-12 20:07:15,y3udx,0,1,,transgender,*requested Update* 188 Day HRT Transition,1344827235.0,"{'created_utc': 1344802035, 'id': 'y3udx', 'num_comments': 0, 'score': 1, 'selftext': '', 'subreddit': 'transgender', 'title': '*requested Update* 188 Day HRT Transition', 'created': 1344827235.0}",
102,2012-08-12 20:07:55,y3uf9,0,1,,transgender,*requested Update* 188 Day HRT Transition,1344827275.0,"{'created_utc': 1344802075, 'id': 'y3uf9', 'num_comments': 0, 'score': 1, 'selftext': '', 'subreddit': 'transgender', 'title': '*requested Update* 188 Day HRT Transition', 'created': 1344827275.0}",
103,2012-08-12 20:08:39,y3ugd,0,1,,transgender,*requested Update* 188 Day HRT Transition,1344827319.0,"{'created_utc': 1344802119, 'id': 'y3ugd', 'num_comments': 0, 'score': 1, 'selftext': '', 'subreddit': 'transgender', 'title': '*requested Update* 188 Day HRT Transition', 'created': 1344827319.0}",
104,2012-08-12 20:09:20,y3uhj,43,130,,transgender,*Requested Update* 188 Day HRT Transition,1344827360.0,"{'created_utc': 1344802160, 'id': 'y3uhj', 'num_comments': 43, 'score': 130, 'selftext': '', 'subreddit': 'transgender', 'title': '*Requested Update* 188 Day HRT Transition', 'created': 1344827360.0}",
105,2012-08-12 20:11:58,y3umt,0,1,,transgender,*requested Update* 188 Day HRT Transition,1344827518.0,"{'created_utc': 1344802318, 'id': 'y3umt', 'num_comments': 0, 'score': 1, 'selftext': '', 'subreddit': 'transgender', 'title': '*requested Update* 188 Day HRT Transition', 'created': 1344827518.0}",
106,2012-08-12 20:12:17,y3unh,0,0,,transgender,*requested Update* 188 Day HRT Transition,1344827537.0,"{'created_utc': 1344802337, 'id': 'y3unh', 'num_comments': 0, 'score': 0, 'selftext': '', 'subreddit': 'transgender', 'title': '*requested Update* 188 Day HRT Transition', 'created': 1344827537.0}",
107,2012-08-12 20:12:51,y3uot,0,0,,transgender,*requested Update* 188 Day HRT Transition,1344827571.0,"{'created_utc': 1344802371, 'id': 'y3uot', 'num_comments': 0, 'score': 0, 'selftext': '', 'subreddit': 'transgender', 'title': '*requested Update* 188 Day HRT Transition', 'created': 1344827571.0}",
108,2012-08-12 20:14:45,y3us6,0,0,,transgender,*requested Update* 188 Day HRT Transition,1344827685.0,"{'created_utc': 1344802485, 'id': 'y3us6', 'num_comments': 0, 'score': 0, 'selftext': '', 'subreddit': 'transgender', 'title': '*requested Update* 188 Day HRT Transition', 'created': 1344827685.0}",
109,2012-08-12 23:06:43,y449l,2,3,,transgender,"I enjoyed ""Gentlemen Broncos"" for the first hour and ten minutes until someone said tr-nny and it was supposed to be funny. Transphobia sucks!",1344838003.0,"{'created_utc': 1344812803, 'id': 'y449l', 'num_comments': 2, 'score': 3, 'selftext': '', 'subreddit': 'transgender', 'title': 'I enjoyed ""Gentlemen Broncos"" for the first hour and ten minutes until someone said tr-nny and it was supposed to be funny. Transphobia sucks!', 'created': 1344838003.0}",
110,2012-08-13 00:16:33,y486y,2,2,,transgender,"Buck Angel on Ireland AM, interviewed before the GAZE LGBT Film Festival",1344842193.0,"{'created_utc': 1344816993, 'id': 'y486y', 'num_comments': 2, 'score': 2, 'selftext': '', 'subreddit': 'transgender', 'title': 'Buck Angel on Ireland AM, interviewed before the GAZE LGBT Film Festival', 'created': 1344842193.0}",
111,2012-08-13 00:47:54,y49ur,12,32,,transgender,"My Timelines, Update! (Top is condensed, bottom is in depth and details my journey.) (xpost /r/Transtimelines)",1344844074.0,"{'created_utc': 1344818874, 'id': 'y49ur', 'num_comments': 12, 'score': 32, 'selftext': '', 'subreddit': 'transgender', 'title': 'My Timelines, Update! (Top is condensed, bottom is in depth and details my journey.) (xpost /r/Transtimelines)', 'created': 1344844074.0}",
112,2012-08-13 00:58:17,y4ag4,6,14,,transgender,Brandsition (Switching brands after transitioning): How do you decide?,1344844697.0,"{'created_utc': 1344819497, 'id': 'y4ag4', 'num_comments': 6, 'score': 14, 'selftext': '', 'subreddit': 'transgender', 'title': 'Brandsition (Switching brands after transitioning): How do you decide?', 'created': 1344844697.0}",
113,2012-08-13 01:15:06,y4bdp,14,107,,transgender,"Me, MtF, being confused.",1344845706.0,"{'created_utc': 1344820506, 'id': 'y4bdp', 'num_comments': 14, 'score': 107, 'selftext': '', 'subreddit': 'transgender', 'title': 'Me, MtF, being confused.', 'created': 1344845706.0}",
114,2012-08-13 04:10:42,y4lom,0,2,,transgender,"Had this Son House song in my head when I came out to my parents; recorded a cover yesterday.. very trans-relevant, so I thought I'd share.",1344856242.0,"{'created_utc': 1344831042, 'id': 'y4lom', 'num_comments': 0, 'score': 2, 'selftext': '', 'subreddit': 'transgender', 'title': ""Had this Son House song in my head when I came out to my parents; recorded a cover yesterday.. very trans-relevant, so I thought I'd share."", 'created': 1344856242.0}",
115,2012-08-13 08:15:15,y4wjl,0,1,,transgender,"‘Punish’ the eunuchs, because they are ‘vulgar’ – The Express Tribune Blog",1344870915.0,"{'created_utc': 1344845715, 'id': 'y4wjl', 'num_comments': 0, 'score': 1, 'selftext': '', 'subreddit': 'transgender', 'title': '‘Punish’ the eunuchs, because they are ‘vulgar’ – The Express Tribune Blog', 'created': 1344870915.0}",
116,2012-08-13 11:13:44,y51fz,7,12,,transgender,"Follow-up to ""I missed the most important appointment of my life..."", look at my stupid grinning face!",1344881624.0,"{'created_utc': 1344856424, 'id': 'y51fz', 'num_comments': 7, 'score': 12, 'selftext': '', 'subreddit': 'transgender', 'title': 'Follow-up to ""I missed the most important appointment of my life..."", look at my stupid grinning face!', 'created': 1344881624.0}",
117,2012-08-13 18:04:41,y5ln1,6,0,,transgender,Launching /r/askgsm a space for educating people on gender and sexual minorities,1344906281.0,"{'created_utc': 1344881081, 'id': 'y5ln1', 'num_comments': 6, 'score': 0, 'selftext': '', 'subreddit': 'transgender', 'title': 'Launching /r/askgsm a space for educating people on gender and sexual minorities', 'created': 1344906281.0}",
118,2012-08-13 19:29:10,y5r7j,29,94,,transgender,Just had my first endocrinologist appointment...,1344911350.0,"{'created_utc': 1344886150, 'id': 'y5r7j', 'num_comments': 29, 'score': 94, 'selftext': '', 'subreddit': 'transgender', 'title': 'Just had my first endocrinologist appointment...', 'created': 1344911350.0}",
119,2012-08-13 20:14:00,y5ubf,11,116,,transgender,My Dad doesn't understand pronouns...,1344914040.0,"{'created_utc': 1344888840, 'id': 'y5ubf', 'num_comments': 11, 'score': 116, 'selftext': '', 'subreddit': 'transgender', 'title': ""My Dad doesn't understand pronouns..."", 'created': 1344914040.0}",
120,2012-08-13 20:40:40,y5w5r,8,22,,transgender,My First Makeover :),1344915640.0,"{'created_utc': 1344890440, 'id': 'y5w5r', 'num_comments': 8, 'score': 22, 'selftext': '', 'subreddit': 'transgender', 'title': 'My First Makeover :)', 'created': 1344915640.0}",
121,2012-08-13 23:42:02,y67wa,17,14,,transgender,Exploring Gender : APA Replacing Gender Identity Disorder with Gender Dysphoria,1344926522.0,"{'created_utc': 1344901322, 'id': 'y67wa', 'num_comments': 17, 'score': 14, 'selftext': '', 'subreddit': 'transgender', 'title': 'Exploring Gender : APA Replacing Gender Identity Disorder with Gender Dysphoria', 'created': 1344926522.0}",
122,2012-08-14 01:07:10,y6d80,5,3,,transgender,Transgender woman settles discrimination suit with Illinois town,1344931630.0,"{'created_utc': 1344906430, 'id': 'y6d80', 'num_comments': 5, 'score': 3, 'selftext': '', 'subreddit': 'transgender', 'title': 'Transgender woman settles discrimination suit with Illinois town', 'created': 1344931630.0}",
123,2012-08-14 01:07:41,y6d94,1,19,,transgender,FAA Eliminates Unnecessary Testing for Trans Pilots,1344931661.0,"{'created_utc': 1344906461, 'id': 'y6d94', 'num_comments': 1, 'score': 19, 'selftext': '', 'subreddit': 'transgender', 'title': 'FAA Eliminates Unnecessary Testing for Trans Pilots', 'created': 1344931661.0}",
124,2012-08-14 01:11:11,y6dhd,5,3,,transgender,Voter Suppression and the Transgender Community ,1344931871.0,"{'created_utc': 1344906671, 'id': 'y6dhd', 'num_comments': 5, 'score': 3, 'selftext': '', 'subreddit': 'transgender', 'title': 'Voter Suppression and the Transgender Community ', 'created': 1344931871.0}",
125,2012-08-14 01:14:51,y6dp4,105,168,,transgender,"Today, I got to #3 on r/gonewild.",1344932091.0,"{'created_utc': 1344906891, 'id': 'y6dp4', 'num_comments': 105, 'score': 168, 'selftext': '', 'subreddit': 'transgender', 'title': 'Today, I got to #3 on r/gonewild.', 'created': 1344932091.0}",
126,2012-08-14 03:19:15,y6lif,5,13,,transgender,"Red without Blue, a truly inspiring but sad story.  Very close to home with this one..",1344939555.0,"{'created_utc': 1344914355, 'id': 'y6lif', 'num_comments': 5, 'score': 13, 'selftext': '', 'subreddit': 'transgender', 'title': 'Red without Blue, a truly inspiring but sad story.  Very close to home with this one..', 'created': 1344939555.0}",
127,2012-08-14 04:44:25,y6qj7,0,4,,transgender,"Unity, NOT Uniformity!",1344944665.0,"{'created_utc': 1344919465, 'id': 'y6qj7', 'num_comments': 0, 'score': 4, 'selftext': '', 'subreddit': 'transgender', 'title': 'Unity, NOT Uniformity!', 'created': 1344944665.0}",
128,2012-08-14 05:00:25,y6rf5,0,7,,transgender,One of the most helpful videos for me as an ftm,1344945625.0,"{'created_utc': 1344920425, 'id': 'y6rf5', 'num_comments': 0, 'score': 7, 'selftext': '', 'subreddit': 'transgender', 'title': 'One of the most helpful videos for me as an ftm', 'created': 1344945625.0}",
129,2012-08-14 10:17:53,y72q4,1,0,,transgender,"The Future's So Dark, I'm a Fool To Wear Shades",1344964673.0,"{'created_utc': 1344939473, 'id': 'y72q4', 'num_comments': 1, 'score': 0, 'selftext': '', 'subreddit': 'transgender', 'title': ""The Future's So Dark, I'm a Fool To Wear Shades"", 'created': 1344964673.0}",
130,2012-08-14 13:00:00,y77t9,71,50,,transgender,A disgusting piece on trans women in women's facilities. Please kill it with fire. (trigger warning).,1344974400.0,"{'created_utc': 1344949200, 'id': 'y77t9', 'num_comments': 71, 'score': 50, 'selftext': '', 'subreddit': 'transgender', 'title': ""A disgusting piece on trans women in women's facilities. Please kill it with fire. (trigger warning)."", 'created': 1344974400.0}",
131,2012-08-14 16:42:01,y7k6k,4,7,,transgender,"very interesting article on the concept of being ""trapped in the wrong body""",1344987721.0,"{'created_utc': 1344962521, 'id': 'y7k6k', 'num_comments': 4, 'score': 7, 'selftext': '', 'subreddit': 'transgender', 'title': 'very interesting article on the concept of being ""trapped in the wrong body""', 'created': 1344987721.0}",
132,2012-08-14 17:08:01,y7lww,14,68,,transgender,Trans Man Wins Big Brother UK,1344989281.0,"{'created_utc': 1344964081, 'id': 'y7lww', 'num_comments': 14, 'score': 68, 'selftext': '', 'subreddit': 'transgender', 'title': 'Trans Man Wins Big Brother UK', 'created': 1344989281.0}",
133,2012-08-14 19:13:34,y7uos,4,14,,transgender,Made a short video with a trans lead. Would appreciate a little feedback.,1344996814.0,"{'created_utc': 1344971614, 'id': 'y7uos', 'num_comments': 4, 'score': 14, 'selftext': '', 'subreddit': 'transgender', 'title': 'Made a short video with a trans lead. Would appreciate a little feedback.', 'created': 1344996814.0}",
134,2012-08-14 23:16:50,y8b98,0,1,,transgender,"I Would Shake Your Hand, but I Don't Want to Get a Blood Disease - Lessons Learned at a Protest",1345011410.0,"{'created_utc': 1344986210, 'id': 'y8b98', 'num_comments': 0, 'score': 1, 'selftext': '', 'subreddit': 'transgender', 'title': ""I Would Shake Your Hand, but I Don't Want to Get a Blood Disease - Lessons Learned at a Protest"", 'created': 1345011410.0}",
135,2012-08-15 00:43:07,y8gfo,1,8,,transgender,'Pregnant Man' Thomas Beatie's Divorce Proceedings Delayed As Judge Questions Union's Legality,1345016587.0,"{'created_utc': 1344991387, 'id': 'y8gfo', 'num_comments': 1, 'score': 8, 'selftext': '', 'subreddit': 'transgender', 'title': ""'Pregnant Man' Thomas Beatie's Divorce Proceedings Delayed As Judge Questions Union's Legality"", 'created': 1345016587.0}",
