,created_utc,id,num_comments,score,selftext,subreddit,title,created,d_,Unnamed: 0
32,2012-08-13 19:02:27,y5pe7,2,11,"Introducing /r/askGSM! /r/askGSM is a space for people who are interested in discussing and learning about gender and sexual minorities (LGBTQ or GSM). This is a collaborative effort between the GSM subreddit mods, the emphasis here is on education and outreach for people with little to no experience in GSM topics.

If you're questioning and need a little guidance, just ask! If you're just interested in learning more about LGBTQ people then this sub will give you answers to your questions. If you're a concerned member of the community or interested in helping people learn about life as a GSM, please feel free to step up and be a mentor. The objective here is for the community to take responsibility for answering questions, so that people who are interested in learning about us can get some friendly answers. We're going to keep things civil, light-hearted, and respectful.

Similar to /r/AskScience, if you have a degree or are a professional in a relevant field, please message the moderators with a verification and we'll grant you a special scholarly flair: This will help distinguish people who could be considered knowledgeable experts for discussion. But what if you're not a scholar or you have no clue what all this stuff is about? That's okay! This subreddit is for you!

Come in, relax, put your feet up and have fun. If there's a problem, just send the mods a note and we'll have it all fixed in a jiffy. When we work together, we can do great things.
",genderqueer,We created a new subreddit for educational purposes - /r/AskGSM,1344909747.0,"{'created_utc': 1344884547, 'id': 'y5pe7', 'num_comments': 2, 'score': 11, 'selftext': ""Introducing /r/askGSM! /r/askGSM is a space for people who are interested in discussing and learning about gender and sexual minorities (LGBTQ or GSM). This is a collaborative effort between the GSM subreddit mods, the emphasis here is on education and outreach for people with little to no experience in GSM topics.\n\nIf you're questioning and need a little guidance, just ask! If you're just interested in learning more about LGBTQ people then this sub will give you answers to your questions. If you're a concerned member of the community or interested in helping people learn about life as a GSM, please feel free to step up and be a mentor. The objective here is for the community to take responsibility for answering questions, so that people who are interested in learning about us can get some friendly answers. We're going to keep things civil, light-hearted, and respectful.\n\nSimilar to /r/AskScience, if you have a degree or are a professional in a relevant field, please message the moderators with a verification and we'll grant you a special scholarly flair: This will help distinguish people who could be considered knowledgeable experts for discussion. But what if you're not a scholar or you have no clue what all this stuff is about? That's okay! This subreddit is for you!\n\nCome in, relax, put your feet up and have fun. If there's a problem, just send the mods a note and we'll have it all fixed in a jiffy. When we work together, we can do great things.\n"", 'subreddit': 'genderqueer', 'title': 'We created a new subreddit for educational purposes - /r/AskGSM', 'created': 1344909747.0}",31.0
33,2012-08-14 03:21:07,y6lmw,19,17,"I'm kind of genderqueer... I mean, it's the word that closest describes who I am :/ I'm biologically male, and I identify as a male (I prefer male pronouns, though I have no problem with female pronouns), but I don't feel 'just male'. I act and dress as androgynously as I can, because I feel wrong just being male or just being female, but I can't help but want to be one or the other.

Like... I feel like I just want to go to the doctors and ask them to give me male hormones just to undo me being halfway... which is how I feel, like I'm halfway but leaning more male most of the time (there are always times when I feel so effeminate and female).

Is this wrong? To want to just pick one way or the other? I know that no doctor would ever prescribe me male hormones, because I'm male, and allow myself to be percieved as male -_- But I'm just sick of feeling like I don't belong to anything. I identify as gay, but when I go to [/r/gaybros](/r/gaybros) and places like that, I just feel pathetic, because they're all talking about men doing this and men doing that and 'real men' and stuff...",genderqueer,"So... this is weird, and I feel stupid for 
even thinking it...",1344939667.0,"{'created_utc': 1344914467, 'id': 'y6lmw', 'num_comments': 19, 'score': 17, 'selftext': ""I'm kind of genderqueer... I mean, it's the word that closest describes who I am :/ I'm biologically male, and I identify as a male (I prefer male pronouns, though I have no problem with female pronouns), but I don't feel 'just male'. I act and dress as androgynously as I can, because I feel wrong just being male or just being female, but I can't help but want to be one or the other.\n\nLike... I feel like I just want to go to the doctors and ask them to give me male hormones just to undo me being halfway... which is how I feel, like I'm halfway but leaning more male most of the time (there are always times when I feel so effeminate and female).\n\nIs this wrong? To want to just pick one way or the other? I know that no doctor would ever prescribe me male hormones, because I'm male, and allow myself to be percieved as male -_- But I'm just sick of feeling like I don't belong to anything. I identify as gay, but when I go to [/r/gaybros](/r/gaybros) and places like that, I just feel pathetic, because they're all talking about men doing this and men doing that and 'real men' and stuff..."", 'subreddit': 'genderqueer', 'title': 'So... this is weird, and I feel stupid for \neven thinking it...', 'created': 1344939667.0}",32.0
34,2012-08-14 06:52:55,y6wm6,9,11,,genderqueer,"So, why do I like to date other genderqueers?",1344952375.0,"{'created_utc': 1344927175, 'id': 'y6wm6', 'num_comments': 9, 'score': 11, 'selftext': '', 'subreddit': 'genderqueer', 'title': 'So, why do I like to date other genderqueers?', 'created': 1344952375.0}",33.0
35,2012-08-14 08:05:45,y6z65,22,16,"as fellow genderqueers how do you all refer to yourselves inside of relationships, i tend to date femmes who like to be my girlfriends but i never know what i want them to call me... ",genderqueer,alternative names to girlfriend/boyfriend,1344956745.0,"{'created_utc': 1344931545, 'id': 'y6z65', 'num_comments': 22, 'score': 16, 'selftext': 'as fellow genderqueers how do you all refer to yourselves inside of relationships, i tend to date femmes who like to be my girlfriends but i never know what i want them to call me... ', 'subreddit': 'genderqueer', 'title': 'alternative names to girlfriend/boyfriend', 'created': 1344956745.0}",34.0
36,2012-08-14 10:36:40,y738c,18,17,"Hey,

So I've been identifying myself as bigender or dualgender for a while now, I'm biologically male, late twenties.  I was on /r/DualGender, which I hadn't gone to until a month or so ago, but I haunt /r/genderqueer all the time, and the DG people were mentioning 'phases' a lot.  Girl phase, guy phase.  This sort of makes sense to me but I personally hadn't heard of that or thought of it that way before.  

I just wanted to ask you all what you thought.  I feel pretty much like I'm both, pretty much all the time.  Man and Woman, all the time.  I always get jealous of the pretty girls with great figures, I always feel a little bummed that I don't have real breasts or a vagina, but I also always love my penis.  I always wish I could switch back and forth whenever I wanted.  Granted when I dress like a woman I feel more like a woman, so if anything that might be a phase.  But I sort of always feel like a man on the outside and a woman on the inside and also a woman on the outside and a man on the inside (depending on my presentation.)  Anyone else relate to this?  Is there a different term than bigender that I should look into?  I know that I'm just who I am at the end of the day, but I enjoy the community of knowing the ""right"" label.  

DualSpirit is how I feel.  Like my soul or what have you is male and female simultaneously.  I just wish it were possible to make my body able to switch back and forth as fluidly (as I know many of us do.)

Thanks!  ",genderqueer,Phases?  What about all the time?,1344965800.0,"{'created_utc': 1344940600, 'id': 'y738c', 'num_comments': 18, 'score': 17, 'selftext': 'Hey,\n\nSo I\'ve been identifying myself as bigender or dualgender for a while now, I\'m biologically male, late twenties.  I was on /r/DualGender, which I hadn\'t gone to until a month or so ago, but I haunt /r/genderqueer all the time, and the DG people were mentioning \'phases\' a lot.  Girl phase, guy phase.  This sort of makes sense to me but I personally hadn\'t heard of that or thought of it that way before.  \n\nI just wanted to ask you all what you thought.  I feel pretty much like I\'m both, pretty much all the time.  Man and Woman, all the time.  I always get jealous of the pretty girls with great figures, I always feel a little bummed that I don\'t have real breasts or a vagina, but I also always love my penis.  I always wish I could switch back and forth whenever I wanted.  Granted when I dress like a woman I feel more like a woman, so if anything that might be a phase.  But I sort of always feel like a man on the outside and a woman on the inside and also a woman on the outside and a man on the inside (depending on my presentation.)  Anyone else relate to this?  Is there a different term than bigender that I should look into?  I know that I\'m just who I am at the end of the day, but I enjoy the community of knowing the ""right"" label.  \n\nDualSpirit is how I feel.  Like my soul or what have you is male and female simultaneously.  I just wish it were possible to make my body able to switch back and forth as fluidly (as I know many of us do.)\n\nThanks!  ', 'subreddit': 'genderqueer', 'title': 'Phases?  What about all the time?', 'created': 1344965800.0}",35.0
37,2012-08-14 19:33:38,y7w4b,1,0,,genderqueer,Asexual Activists: Stop stigmatizing us because we don't like sex,1344998018.0,"{'created_utc': 1344972818, 'id': 'y7w4b', 'num_comments': 1, 'score': 0, 'selftext': '', 'subreddit': 'genderqueer', 'title': ""Asexual Activists: Stop stigmatizing us because we don't like sex"", 'created': 1344998018.0}",36.0
38,2012-08-14 20:27:30,y7zut,4,3,"Anyone here have any experience with them? Would you recommend them? They're a little pricey, so I'm looking for thoughts/advice before I consider purchasing a pair.",genderqueer,Breastforms,1345001250.0,"{'created_utc': 1344976050, 'id': 'y7zut', 'num_comments': 4, 'score': 3, 'selftext': ""Anyone here have any experience with them? Would you recommend them? They're a little pricey, so I'm looking for thoughts/advice before I consider purchasing a pair."", 'subreddit': 'genderqueer', 'title': 'Breastforms', 'created': 1345001250.0}",37.0
39,2012-08-15 09:35:35,y9677,0,0,,genderqueer,Through the Bifocal Lens,1345048535.0,"{'created_utc': 1345023335, 'id': 'y9677', 'num_comments': 0, 'score': 0, 'selftext': '', 'subreddit': 'genderqueer', 'title': 'Through the Bifocal Lens', 'created': 1345048535.0}",38.0
40,2012-08-16 12:50:08,ybg3n,15,7,"I am a bit excited right now, and a bit confused, and worried.  I usually put these thoughts on the back burner because I know that labels don't NEED to be assigned to things, but after reading a bunch of this reddit, definitions, I feel like I'd really like some insight.

So I am a 26 year old female.  I have been interested in girls since I was about 7, and my first experience with one was at that age and she was the same age as me.   
As I went through puberty I knew I liked guys too.  I was certain I liked males but I wasn't positive about females although I could not stop fantasizing about them, only in my fantasies I usually had a penis or was in another guys body fucking her!  Finally in my early adulthood I got to experience a few women, manly ones and girly ones, and realized I was most certainly bi-sexual, but I am still nervous as hell around women I am attracted to and it has greatly impeded my self confidence in even beginning to try out a real relationship with one.  Until the last two years, being in a heterosexual relationship with someone whos sex drive is MUCH lower than mine, I have spent a lot of time experimenting with myself, him, and my feelings about sexuality.  I remember being very attracted to cross dressers and (edited) transsexuals when I used to go to gay bars back in Canada (I live in the USA now), but I think all of them were into men as no one seemed to take my advances seriously.  I seem to be pansexual in that reguard...I think?  And then, I still fantasize about being with women as a man with a penis, but I never really THOUGHT about it until recently when my boyfriend took my very accurate looking penis dildo, placed it on my crotch and began to suck it as if it was my dick.  I hadn't been that turned on in a long time.  Now he likes when I experiment on him with anal, which is also arousing, but I feel so flexible now.  I have always been the submissive one, sometimes brutally so, and I love it.  Am I genderqueer?  lol.  I dressed like a boy when I was a kid, and only hung out with boys, and did boy things.  99% of my friends are still all guys, and the girls I maintain friendships with are always a bit dominant and masculine themselves.  Hitting puberty I think fucked it up.  Like I was too young to register the fact that society was pushing me into a gender roll that I didn't necessarily feel inside of myself.  I love being feminine, in dress and makeup, but there is this repressed masculinity in me I feel.  Not sure how to deal with it.  
  
Also, I have a whole bunch of questions to one day ask about my boyfriend.  I won't even get into that now.
  
Anyways, this was a rant I guess.  I really wanted to get this off my chest to a group of people who wont think I'm completely mental.  Also, ask what label I could apply to myself if I wanted to.  I see now that the genderqueer term has a pretty vast definition.

Thanks for listening.  &lt;3",genderqueer,I have never expressed this to anyone.,1345146608.0,"{'created_utc': 1345121408, 'id': 'ybg3n', 'num_comments': 15, 'score': 7, 'selftext': ""I am a bit excited right now, and a bit confused, and worried.  I usually put these thoughts on the back burner because I know that labels don't NEED to be assigned to things, but after reading a bunch of this reddit, definitions, I feel like I'd really like some insight.\n\nSo I am a 26 year old female.  I have been interested in girls since I was about 7, and my first experience with one was at that age and she was the same age as me.   \nAs I went through puberty I knew I liked guys too.  I was certain I liked males but I wasn't positive about females although I could not stop fantasizing about them, only in my fantasies I usually had a penis or was in another guys body fucking her!  Finally in my early adulthood I got to experience a few women, manly ones and girly ones, and realized I was most certainly bi-sexual, but I am still nervous as hell around women I am attracted to and it has greatly impeded my self confidence in even beginning to try out a real relationship with one.  Until the last two years, being in a heterosexual relationship with someone whos sex drive is MUCH lower than mine, I have spent a lot of time experimenting with myself, him, and my feelings about sexuality.  I remember being very attracted to cross dressers and (edited) transsexuals when I used to go to gay bars back in Canada (I live in the USA now), but I think all of them were into men as no one seemed to take my advances seriously.  I seem to be pansexual in that reguard...I think?  And then, I still fantasize about being with women as a man with a penis, but I never really THOUGHT about it until recently when my boyfriend took my very accurate looking penis dildo, placed it on my crotch and began to suck it as if it was my dick.  I hadn't been that turned on in a long time.  Now he likes when I experiment on him with anal, which is also arousing, but I feel so flexible now.  I have always been the submissive one, sometimes brutally so, and I love it.  Am I genderqueer?  lol.  I dressed like a boy when I was a kid, and only hung out with boys, and did boy things.  99% of my friends are still all guys, and the girls I maintain friendships with are always a bit dominant and masculine themselves.  Hitting puberty I think fucked it up.  Like I was too young to register the fact that society was pushing me into a gender roll that I didn't necessarily feel inside of myself.  I love being feminine, in dress and makeup, but there is this repressed masculinity in me I feel.  Not sure how to deal with it.  \n  \nAlso, I have a whole bunch of questions to one day ask about my boyfriend.  I won't even get into that now.\n  \nAnyways, this was a rant I guess.  I really wanted to get this off my chest to a group of people who wont think I'm completely mental.  Also, ask what label I could apply to myself if I wanted to.  I see now that the genderqueer term has a pretty vast definition.\n\nThanks for listening.  &lt;3"", 'subreddit': 'genderqueer', 'title': 'I have never expressed this to anyone.', 'created': 1345146608.0}",39.0
41,2012-08-16 18:22:42,ybz5p,8,16,"Most of the time I'm cool with being genderqueer. I'm biologically female, socially female, and mentally I'm rather neutral.

But there are days when I fucking hate being female. Women are treated like shit - we're assumed to be weak and stupid, and if you aren't able to have a baby then what the fuck kind of monster are you? Today is one of these days, and they don't come around often. Sometimes I think - if I were born a man, I wouldn't encounter so much frustration. I know this is sexist and doesn't help my current predicament, but I can't help wondering what would change.

I'm /this/ close to being transgender and posing as a man, but I don't see the benefits of actually being a male socially and biologically as outweighing the cons of transitioning and risking all of the transhate out there. And there is a hell of a lot of it. I'm so uncomfortable in my own skin, and I usually don't feel this way.

I'm not sorry to rant at everyone, as I think sometimes it's needed... especially in a community like this, where there is such frustration and confusion about how to deal with oneself.",genderqueer,Gender rant.,1345166562.0,"{'created_utc': 1345141362, 'id': 'ybz5p', 'num_comments': 8, 'score': 16, 'selftext': ""Most of the time I'm cool with being genderqueer. I'm biologically female, socially female, and mentally I'm rather neutral.\n\nBut there are days when I fucking hate being female. Women are treated like shit - we're assumed to be weak and stupid, and if you aren't able to have a baby then what the fuck kind of monster are you? Today is one of these days, and they don't come around often. Sometimes I think - if I were born a man, I wouldn't encounter so much frustration. I know this is sexist and doesn't help my current predicament, but I can't help wondering what would change.\n\nI'm /this/ close to being transgender and posing as a man, but I don't see the benefits of actually being a male socially and biologically as outweighing the cons of transitioning and risking all of the transhate out there. And there is a hell of a lot of it. I'm so uncomfortable in my own skin, and I usually don't feel this way.\n\nI'm not sorry to rant at everyone, as I think sometimes it's needed... especially in a community like this, where there is such frustration and confusion about how to deal with oneself."", 'subreddit': 'genderqueer', 'title': 'Gender rant.', 'created': 1345166562.0}",40.0
42,2012-08-16 19:27:40,yc3m3,40,11,I've heard this term talked about by other gay guys and stuff but I have no idea what it is. Even when I do a google seach i'm confused by the responses. And as a gay male I feel like this is something I should know. ,genderqueer,Genderqueer? ELI5.,1345170460.0,"{'created_utc': 1345145260, 'id': 'yc3m3', 'num_comments': 40, 'score': 11, 'selftext': ""I've heard this term talked about by other gay guys and stuff but I have no idea what it is. Even when I do a google seach i'm confused by the responses. And as a gay male I feel like this is something I should know. "", 'subreddit': 'genderqueer', 'title': 'Genderqueer? ELI5.', 'created': 1345170460.0}",41.0
43,2012-08-16 21:41:52,ycbza,0,1,,genderqueer,Queer Reflections: A Series of photographs,1345178512.0,"{'created_utc': 1345153312, 'id': 'ycbza', 'num_comments': 0, 'score': 1, 'selftext': '', 'subreddit': 'genderqueer', 'title': 'Queer Reflections: A Series of photographs', 'created': 1345178512.0}",42.0
