,created_utc,id,num_comments,score,selftext,subreddit,title,created,d_,Unnamed: 0
0,2012-08-07 11:49:42,xthwd,5,6,"My partner just came out as trans about 2 month ago (MtoF). I know she is looking to start getting a skin care regement and some make-up. 

Her birthday is in just over a month I was wondering if anyone could recommed any sort of skin care or make-up that would make her a nice starter pack. ",trans,looking for a gift,1344365382.0,"{'created_utc': 1344340182, 'id': 'xthwd', 'num_comments': 5, 'score': 6, 'selftext': 'My partner just came out as trans about 2 month ago (MtoF). I know she is looking to start getting a skin care regement and some make-up. \n\nHer birthday is in just over a month I was wondering if anyone could recommed any sort of skin care or make-up that would make her a nice starter pack. ', 'subreddit': 'trans', 'title': 'looking for a gift', 'created': 1344365382.0}",
1,2012-08-19 20:00:33,yhhnk,4,28,,trans,"Comic explains life after realization, before transition (without being about transgender issues at all.) ",1345431633.0,"{'created_utc': 1345406433, 'id': 'yhhnk', 'num_comments': 4, 'score': 28, 'selftext': '', 'subreddit': 'trans', 'title': 'Comic explains life after realization, before transition (without being about transgender issues at all.) ', 'created': 1345431633.0}",
2,2012-08-28 20:32:29,yzb1b,2,11,,trans,The man (and woman) in the mirror,1346211149.0,"{'created_utc': 1346185949, 'id': 'yzb1b', 'num_comments': 2, 'score': 11, 'selftext': '', 'subreddit': 'trans', 'title': 'The man (and woman) in the mirror', 'created': 1346211149.0}",
0,2012-08-01 01:10:47,xhbgb,7,9,"I'm 16. I'm biologically a female. I identify as a lesbian. Sometimes i go through phases of dressing a little girly buy mostly i wear boy clothes and want to get a binder. If im genderqueer, what does that make my sexuality? I'm taken and in a lovely relationship with a girl, and i am only interested in girls. Am i a genderqueer lesbian? Is that possible? Or can i say ""fuck what people think, im a genderqueer lesbian""? 
Also; my dad always tells me: ""dress like a girl, cause you are a girl, be normal"". So if i told him i was anything but a girl, he'd probably freak. 
Help me?",genderqueer,"I'm a bit confused, help?",1343808647.0,"{'created_utc': 1343783447, 'id': 'xhbgb', 'num_comments': 7, 'score': 9, 'selftext': 'I\'m 16. I\'m biologically a female. I identify as a lesbian. Sometimes i go through phases of dressing a little girly buy mostly i wear boy clothes and want to get a binder. If im genderqueer, what does that make my sexuality? I\'m taken and in a lovely relationship with a girl, and i am only interested in girls. Am i a genderqueer lesbian? Is that possible? Or can i say ""fuck what people think, im a genderqueer lesbian""? \nAlso; my dad always tells me: ""dress like a girl, cause you are a girl, be normal"". So if i told him i was anything but a girl, he\'d probably freak. \nHelp me?', 'subreddit': 'genderqueer', 'title': ""I'm a bit confused, help?"", 'created': 1343808647.0}",
1,2012-08-01 11:45:35,xi2c8,19,5,,genderqueer,"Posted this to OCD, transgender and now here. PLEASE help me.",1343846735.0,"{'created_utc': 1343821535, 'id': 'xi2c8', 'num_comments': 19, 'score': 5, 'selftext': '', 'subreddit': 'genderqueer', 'title': 'Posted this to OCD, transgender and now here. PLEASE help me.', 'created': 1343846735.0}",
2,2012-08-01 20:07:47,xiuxy,42,15,"Full disclosure: I'm a cis-gendered pansexual woman, the mom of an adult lesbian who considers herself genderqueer/asexual, but who doesn't care about what pronouns we use. I don't have a lot of experience with using preferred pronouns, except on the internet (I'm agoraphobic, so not a lot of opportunity to hang around with other lgbtq folk).

One of the characters in an erotic novel I'm beginning is genderqueer and completely androgynous in appearance and presentation. In the context of the plot, this character is a god, a Trickster -- like Coyote, who was thought to be a ""two-spirited"" being with the ability to shift fluidly from one gender to the other or anywhere in between. In the realm of the gods, this character can be anything they please; in reality, they are female-bodied, with a mixture of femme and butch aspects all adding up to a totally androgynous look. 

The thing I want to ask your advice on is how to approach the pronouns I use for this character. Writing sex scenes while avoiding pronouns for one character is clunky and odd, so I need to know what pronouns *you* would like to see in a story. Obviously I can use *zie* and *hir*, but I want to hear from you about how you'd like to see such a character presented, what to avoid, what to watch out for.

Help me not be an asshole without meaning to, r/genderqueer.",genderqueer,"Writing about a genderqueer character, and I want to talk to you about pronouns.",1343876867.0,"{'created_utc': 1343851667, 'id': 'xiuxy', 'num_comments': 42, 'score': 15, 'selftext': 'Full disclosure: I\'m a cis-gendered pansexual woman, the mom of an adult lesbian who considers herself genderqueer/asexual, but who doesn\'t care about what pronouns we use. I don\'t have a lot of experience with using preferred pronouns, except on the internet (I\'m agoraphobic, so not a lot of opportunity to hang around with other lgbtq folk).\n\nOne of the characters in an erotic novel I\'m beginning is genderqueer and completely androgynous in appearance and presentation. In the context of the plot, this character is a god, a Trickster -- like Coyote, who was thought to be a ""two-spirited"" being with the ability to shift fluidly from one gender to the other or anywhere in between. In the realm of the gods, this character can be anything they please; in reality, they are female-bodied, with a mixture of femme and butch aspects all adding up to a totally androgynous look. \n\nThe thing I want to ask your advice on is how to approach the pronouns I use for this character. Writing sex scenes while avoiding pronouns for one character is clunky and odd, so I need to know what pronouns *you* would like to see in a story. Obviously I can use *zie* and *hir*, but I want to hear from you about how you\'d like to see such a character presented, what to avoid, what to watch out for.\n\nHelp me not be an asshole without meaning to, r/genderqueer.', 'subreddit': 'genderqueer', 'title': 'Writing about a genderqueer character, and I want to talk to you about pronouns.', 'created': 1343876867.0}",
3,2012-08-02 15:02:29,xkd5w,0,23,,genderqueer,"Intersex mayor Tony Briffa to stand for re-election in Melbourne, Australia",1343944949.0,"{'created_utc': 1343919749, 'id': 'xkd5w', 'num_comments': 0, 'score': 23, 'selftext': '', 'subreddit': 'genderqueer', 'title': 'Intersex mayor Tony Briffa to stand for re-election in Melbourne, Australia', 'created': 1343944949.0}",
4,2012-08-02 21:22:47,xl2j3,0,1,,genderqueer,Listening to some of my old CDs today and came across this song.. This song always made me cry.,1343967767.0,"{'created_utc': 1343942567, 'id': 'xl2j3', 'num_comments': 0, 'score': 1, 'selftext': '', 'subreddit': 'genderqueer', 'title': 'Listening to some of my old CDs today and came across this song.. This song always made me cry.', 'created': 1343967767.0}",
5,2012-08-02 22:06:16,xl5fz,1,25,,genderqueer,"Since the topic of this article was gender, lets talk about gender in modern entertainment.",1343970376.0,"{'created_utc': 1343945176, 'id': 'xl5fz', 'num_comments': 1, 'score': 25, 'selftext': '', 'subreddit': 'genderqueer', 'title': 'Since the topic of this article was gender, lets talk about gender in modern entertainment.', 'created': 1343970376.0}",
6,2012-08-03 15:33:15,xmg0q,11,12,"I was just wondering if you kind folks could tell me what the symbols for genderqueer are and if there are any types of jewelry to symbolize being genderqueer.

I'm excited to see what I can learn :)",genderqueer,So about symbols and what not....,1344033195.0,"{'created_utc': 1344007995, 'id': 'xmg0q', 'num_comments': 11, 'score': 12, 'selftext': ""I was just wondering if you kind folks could tell me what the symbols for genderqueer are and if there are any types of jewelry to symbolize being genderqueer.\n\nI'm excited to see what I can learn :)"", 'subreddit': 'genderqueer', 'title': 'So about symbols and what not....', 'created': 1344033195.0}",
7,2012-08-03 15:37:13,xmg9q,13,119,,genderqueer,My own brand of androgyny.,1344033433.0,"{'created_utc': 1344008233, 'id': 'xmg9q', 'num_comments': 13, 'score': 119, 'selftext': '', 'subreddit': 'genderqueer', 'title': 'My own brand of androgyny.', 'created': 1344033433.0}",
8,2012-08-04 17:36:25,xoeir,6,29,,genderqueer,Mommas don't let your daughters grow up to be cowboys....,1344126985.0,"{'created_utc': 1344101785, 'id': 'xoeir', 'num_comments': 6, 'score': 29, 'selftext': '', 'subreddit': 'genderqueer', 'title': ""Mommas don't let your daughters grow up to be cowboys...."", 'created': 1344126985.0}",
9,2012-08-05 16:04:54,xpupn,5,20,"My partner is very androgynous - she is intoxicating and the most beautiful person I have ever seen. She is also the step mom to my four year old daughter.

My daughter has a toy camera and the 'picture' it takes is Cinderella &amp; Prince Charming dancing. 

She pretends it's my partner and I dancing when we get married. I am Cinderella and my partner is Prince Charming.

Although she's learning more about gender and different family structures, it's pretty cool hearing the questions she has.  ",genderqueer,Cinderella &amp; Prince Charming,1344207894.0,"{'created_utc': 1344182694, 'id': 'xpupn', 'num_comments': 5, 'score': 20, 'selftext': ""My partner is very androgynous - she is intoxicating and the most beautiful person I have ever seen. She is also the step mom to my four year old daughter.\n\nMy daughter has a toy camera and the 'picture' it takes is Cinderella &amp; Prince Charming dancing. \n\nShe pretends it's my partner and I dancing when we get married. I am Cinderella and my partner is Prince Charming.\n\nAlthough she's learning more about gender and different family structures, it's pretty cool hearing the questions she has.  "", 'subreddit': 'genderqueer', 'title': 'Cinderella &amp; Prince Charming', 'created': 1344207894.0}",
10,2012-08-05 16:25:33,xpvmy,2,88,,genderqueer,"nope, it doesn't",1344209133.0,"{'created_utc': 1344183933, 'id': 'xpvmy', 'num_comments': 2, 'score': 88, 'selftext': '', 'subreddit': 'genderqueer', 'title': ""nope, it doesn't"", 'created': 1344209133.0}",
11,2012-08-06 05:26:35,xr149,5,7,"Hi! I'm a female biologically, and i identify as a genderqueer lesbian :) i dont want people to recognize me as a 'lady, m'am, or girly girl'. I want to have a genderneutral name. My name is Michalah. What is a neutral cool sounding name i can tell people to call me by?

Edit: My name is pronounced like: (Mick-Ay-Luh)",genderqueer,Name change for school?,1344255995.0,"{'created_utc': 1344230795, 'id': 'xr149', 'num_comments': 5, 'score': 7, 'selftext': ""Hi! I'm a female biologically, and i identify as a genderqueer lesbian :) i dont want people to recognize me as a 'lady, m'am, or girly girl'. I want to have a genderneutral name. My name is Michalah. What is a neutral cool sounding name i can tell people to call me by?\n\nEdit: My name is pronounced like: (Mick-Ay-Luh)"", 'subreddit': 'genderqueer', 'title': 'Name change for school?', 'created': 1344255995.0}",
12,2012-08-06 18:42:43,xs192,6,59,,genderqueer,police your own gender....,1344303763.0,"{'created_utc': 1344278563, 'id': 'xs192', 'num_comments': 6, 'score': 59, 'selftext': '', 'subreddit': 'genderqueer', 'title': 'police your own gender....', 'created': 1344303763.0}",
13,2012-08-06 20:11:27,xs7ex,34,4,"I was wondering how many of you change your name? Not specifically in the legal aspect but more in the social aspect. Maybe not change your name just refer to yourself as another name? Or have different names for your genders? Or if it's not that important and you don't mind what gender your name is. :) I'm just curious as to how common it is for people to change their name(s) and what the difficulties are with doing so.

On a slightly different note:
I'm not sure if I want to give myself a nickname that is more gender neutral or not. I've been thinking about it since school is starting up soon and I've recently been discovering myself this summer.",genderqueer,Some questions about names :),1344309087.0,"{'created_utc': 1344283887, 'id': 'xs7ex', 'num_comments': 34, 'score': 4, 'selftext': ""I was wondering how many of you change your name? Not specifically in the legal aspect but more in the social aspect. Maybe not change your name just refer to yourself as another name? Or have different names for your genders? Or if it's not that important and you don't mind what gender your name is. :) I'm just curious as to how common it is for people to change their name(s) and what the difficulties are with doing so.\n\nOn a slightly different note:\nI'm not sure if I want to give myself a nickname that is more gender neutral or not. I've been thinking about it since school is starting up soon and I've recently been discovering myself this summer."", 'subreddit': 'genderqueer', 'title': 'Some questions about names :)', 'created': 1344309087.0}",
14,2012-08-07 01:43:19,xsslf,37,26,"For about a year now I'm been having some trouble with my gender. Sexually, im female, but i feel like a boy. Sometimes i feel more genderfluid, but other times i just wanna dress like a boy and have a flat muscular chest. 
But im always thinking, like how to tell my loving caring family and if they'd all understand, and i just dont want to go through that trouble, i just want to be normal. but i cant.",genderqueer,I feel like i may be transgender but i don't want to go to all the trouble of transitioning. ,1344328999.0,"{'created_utc': 1344303799, 'id': 'xsslf', 'num_comments': 37, 'score': 26, 'selftext': ""For about a year now I'm been having some trouble with my gender. Sexually, im female, but i feel like a boy. Sometimes i feel more genderfluid, but other times i just wanna dress like a boy and have a flat muscular chest. \nBut im always thinking, like how to tell my loving caring family and if they'd all understand, and i just dont want to go through that trouble, i just want to be normal. but i cant."", 'subreddit': 'genderqueer', 'title': ""I feel like i may be transgender but i don't want to go to all the trouble of transitioning. "", 'created': 1344328999.0}",
15,2012-08-07 08:39:15,xtcng,10,11,"I'm 17, Male Pan-sexual Male who is about to go into senior year. I have support and no real problems with other people with my sexuality or gender. I'm pretty confident on my sexuality, but when it comes to the gender identification, I've been struggling to come up with an answer for the past year or so. I've gone through many phases where I would call myself Trans, Androgynous, and at one point it was just 'idk'. Every 'phase' always leads a bitter taste and it feels ""right"" for a week or two, but then after that I fall flat. I don't know where I stand at this point, and gender feels like a weird part of me that I can't really explain. The issue only came to me when I started to question my sexuality and started to find cross-dressing and crossplaying to be entertaining for me. I don't know what I want out of this post to be honest, but maybe someone who has/is going through a similar phase can tell me what they where thinking.  Thanks all who respond! ",genderqueer,"Phases of gender, and where I stand? ",1344353955.0,"{'created_utc': 1344328755, 'id': 'xtcng', 'num_comments': 10, 'score': 11, 'selftext': 'I\'m 17, Male Pan-sexual Male who is about to go into senior year. I have support and no real problems with other people with my sexuality or gender. I\'m pretty confident on my sexuality, but when it comes to the gender identification, I\'ve been struggling to come up with an answer for the past year or so. I\'ve gone through many phases where I would call myself Trans, Androgynous, and at one point it was just \'idk\'. Every \'phase\' always leads a bitter taste and it feels ""right"" for a week or two, but then after that I fall flat. I don\'t know where I stand at this point, and gender feels like a weird part of me that I can\'t really explain. The issue only came to me when I started to question my sexuality and started to find cross-dressing and crossplaying to be entertaining for me. I don\'t know what I want out of this post to be honest, but maybe someone who has/is going through a similar phase can tell me what they where thinking.  Thanks all who respond! ', 'subreddit': 'genderqueer', 'title': 'Phases of gender, and where I stand? ', 'created': 1344353955.0}",
16,2012-08-08 10:09:56,xvhyd,9,43,,genderqueer,What they didn't teach you at school,1344445796.0,"{'created_utc': 1344420596, 'id': 'xvhyd', 'num_comments': 9, 'score': 43, 'selftext': '', 'subreddit': 'genderqueer', 'title': ""What they didn't teach you at school"", 'created': 1344445796.0}",
17,2012-08-08 23:18:32,xwq9a,0,4,,genderqueer,"Adhamh Roland is a queer folk artist, I think y'all will like this song of his: Bathrooms, Boxes, Binary",1344493112.0,"{'created_utc': 1344467912, 'id': 'xwq9a', 'num_comments': 0, 'score': 4, 'selftext': '', 'subreddit': 'genderqueer', 'title': ""Adhamh Roland is a queer folk artist, I think y'all will like this song of his: Bathrooms, Boxes, Binary"", 'created': 1344493112.0}",
18,2012-08-09 03:40:23,xx68z,6,51,,genderqueer,What’s So Bad About a Boy Who Wants to Wear a Dress? - NYTimes.com,1344508823.0,"{'created_utc': 1344483623, 'id': 'xx68z', 'num_comments': 6, 'score': 51, 'selftext': '', 'subreddit': 'genderqueer', 'title': 'What’s So Bad About a Boy Who Wants to Wear a Dress? - NYTimes.com', 'created': 1344508823.0}",
19,2012-08-09 07:31:01,xxh6v,0,7,,genderqueer,Genderqueer Australia,1344522661.0,"{'created_utc': 1344497461, 'id': 'xxh6v', 'num_comments': 0, 'score': 7, 'selftext': '', 'subreddit': 'genderqueer', 'title': 'Genderqueer Australia', 'created': 1344522661.0}",
20,2012-08-09 09:16:03,xxjzd,6,17,,genderqueer,"A gay teen talks about life at a brainwashing school for ""troubled teens""",1344528963.0,"{'created_utc': 1344503763, 'id': 'xxjzd', 'num_comments': 6, 'score': 17, 'selftext': '', 'subreddit': 'genderqueer', 'title': 'A gay teen talks about life at a brainwashing school for ""troubled teens""', 'created': 1344528963.0}",
21,2012-08-09 20:40:18,xyipp,0,1,,genderqueer,be fabulous!,1344570018.0,"{'created_utc': 1344544818, 'id': 'xyipp', 'num_comments': 0, 'score': 1, 'selftext': '', 'subreddit': 'genderqueer', 'title': 'be fabulous!', 'created': 1344570018.0}",
22,2012-08-10 05:42:26,xzf51,19,24,"Why is it that it feels like anything relating to genderqueer is so looked down upon? I have only decided that I am agender for about a day now, and already I have been told that it doesn't exist, that I'm an idiot, and that I'm trying to be a 'special snowflake'. I am aromantic and pansexual, and never have I gotten so much shit for my orientation before this. This is the first time I have ever really been scared to say what I am, for fear of other people's reactions. Why is it like this?",genderqueer,"I have only just realized that I am agender, and already I have been shamed more than I have from any other orientation.",1344602546.0,"{'created_utc': 1344577346, 'id': 'xzf51', 'num_comments': 19, 'score': 24, 'selftext': ""Why is it that it feels like anything relating to genderqueer is so looked down upon? I have only decided that I am agender for about a day now, and already I have been told that it doesn't exist, that I'm an idiot, and that I'm trying to be a 'special snowflake'. I am aromantic and pansexual, and never have I gotten so much shit for my orientation before this. This is the first time I have ever really been scared to say what I am, for fear of other people's reactions. Why is it like this?"", 'subreddit': 'genderqueer', 'title': 'I have only just realized that I am agender, and already I have been shamed more than I have from any other orientation.', 'created': 1344602546.0}",
23,2012-08-11 14:43:05,y1rof,13,39,,genderqueer,Transphobic words ... hopefully people will start to think more before they speak. ,1344721385.0,"{'created_utc': 1344696185, 'id': 'y1rof', 'num_comments': 13, 'score': 39, 'selftext': '', 'subreddit': 'genderqueer', 'title': 'Transphobic words ... hopefully people will start to think more before they speak. ', 'created': 1344721385.0}",
24,2012-08-11 20:26:17,y28dw,0,0,,genderqueer,"The term can encompass anything from transsexuals, to crossdressers, to genderqueer, to intersex, to whatever gender variant you can think to invent for yourself. It's a political umbrella, created to give voice to all those people whose gender has split free from the standard male/female binary.",1344741977.0,"{'created_utc': 1344716777, 'id': 'y28dw', 'num_comments': 0, 'score': 0, 'selftext': '', 'subreddit': 'genderqueer', 'title': ""The term can encompass anything from transsexuals, to crossdressers, to genderqueer, to intersex, to whatever gender variant you can think to invent for yourself. It's a political umbrella, created to give voice to all those people whose gender has split free from the standard male/female binary."", 'created': 1344741977.0}",
25,2012-08-11 21:43:11,y2ch0,5,7,"For the past few months I've been having MAJOR identity issues. I used to think that I had gender dysphoria, but lately I'm not feeling it. I have days where I wear my super skinny jeans, but other days where I want to wear boot-cut jeans, work boots, and a tank top. I know it's not me just feeling like wearing something different, 'cause the feeling is emotional, not just a decision. Could I be genderqueer?

More info, if it helps: 15, gay male. 
My more nuetral phase (image) http://i48.tinypic.com/29vyueb.jpg

Edit: Forgot to mention possibly being genderqueer.",genderqueer,Could it be?,1344746591.0,"{'created_utc': 1344721391, 'id': 'y2ch0', 'num_comments': 5, 'score': 7, 'selftext': ""For the past few months I've been having MAJOR identity issues. I used to think that I had gender dysphoria, but lately I'm not feeling it. I have days where I wear my super skinny jeans, but other days where I want to wear boot-cut jeans, work boots, and a tank top. I know it's not me just feeling like wearing something different, 'cause the feeling is emotional, not just a decision. Could I be genderqueer?\n\nMore info, if it helps: 15, gay male. \nMy more nuetral phase (image) http://i48.tinypic.com/29vyueb.jpg\n\nEdit: Forgot to mention possibly being genderqueer."", 'subreddit': 'genderqueer', 'title': 'Could it be?', 'created': 1344746591.0}",
26,2012-08-12 10:55:59,y38m8,0,1,,genderqueer,The Crossdressing Room,1344794159.0,"{'created_utc': 1344768959, 'id': 'y38m8', 'num_comments': 0, 'score': 1, 'selftext': '', 'subreddit': 'genderqueer', 'title': 'The Crossdressing Room', 'created': 1344794159.0}",
27,2012-08-12 21:06:41,y3xpc,0,5,,genderqueer,The Woman in My Life – Playing with the Concept of the Feminine ,1344830801.0,"{'created_utc': 1344805601, 'id': 'y3xpc', 'num_comments': 0, 'score': 5, 'selftext': '', 'subreddit': 'genderqueer', 'title': 'The Woman in My Life – Playing with the Concept of the Feminine ', 'created': 1344830801.0}",
28,2012-08-12 23:18:44,y44w5,8,7,"Hi. I'm 19 and I know biologically that I'm female. And I'm perfectly fine with female pronouns, using the women's bathroom, ect.
But sometimes my gender doesn't seem to match up. I just feel neutral when it comes to my gender. Sometimes I want to bind my chest because I just feel uncomfortable because I'm pretty certain people use my chest to decide my gender.
I was wondering if this could be me just being a tomboy or actually being genderqueer or something. I have been doing trial runs with gender neutral pronouns online when I can (though not a lot of people actually use pronouns when talking to me).
I've just been thinking about it a lot lately and part of me wants some assistance and part of me just wants to put it out in the open.
",genderqueer,I've been wondering this for awhile... (x-post from r/questioning),1344838724.0,"{'created_utc': 1344813524, 'id': 'y44w5', 'num_comments': 8, 'score': 7, 'selftext': ""Hi. I'm 19 and I know biologically that I'm female. And I'm perfectly fine with female pronouns, using the women's bathroom, ect.\nBut sometimes my gender doesn't seem to match up. I just feel neutral when it comes to my gender. Sometimes I want to bind my chest because I just feel uncomfortable because I'm pretty certain people use my chest to decide my gender.\nI was wondering if this could be me just being a tomboy or actually being genderqueer or something. I have been doing trial runs with gender neutral pronouns online when I can (though not a lot of people actually use pronouns when talking to me).\nI've just been thinking about it a lot lately and part of me wants some assistance and part of me just wants to put it out in the open.\n"", 'subreddit': 'genderqueer', 'title': ""I've been wondering this for awhile... (x-post from r/questioning)"", 'created': 1344838724.0}",
