,created_utc,id,num_comments,score,selftext,subreddit,title,created,d_,Unnamed: 0
54,2012-08-22 03:16:33,ym9ju,11,24,"So, every time I go to type ""genderqueer"", 90% of the time, I end up typing ""genderqueen"" 

It's just something that made me laugh. ",genderqueer,Just a funny little typo I keep doing,1345630593.0,"{'created_utc': 1345605393, 'id': 'ym9ju', 'num_comments': 11, 'score': 24, 'selftext': 'So, every time I go to type ""genderqueer"", 90% of the time, I end up typing ""genderqueen"" \n\nIt\'s just something that made me laugh. ', 'subreddit': 'genderqueer', 'title': 'Just a funny little typo I keep doing', 'created': 1345630593.0}",
55,2012-08-22 06:30:45,ymjgb,2,6,,genderqueer,Trans-action and Gender Floods by Atreyu Bat,1345642245.0,"{'created_utc': 1345617045, 'id': 'ymjgb', 'num_comments': 2, 'score': 6, 'selftext': '', 'subreddit': 'genderqueer', 'title': 'Trans-action and Gender Floods by Atreyu Bat', 'created': 1345642245.0}",
56,2012-08-22 16:15:13,yn6hn,6,10,"I am not sure on how to identify myself. I am physically female and that is perfectly ok. I do not wish to be a male (the thought of having male parts disturbs me 0-0 no offense!) but mentally I feel as if I am a male. Ever since I was a little girl I always played with toys geared toward boys and I hated anything that was even a little girly. Now that I am older and I have started dating I feel that I should be the one taking on the ""male role"" and being the ""dominant one"" In the past year I have come to terms with myself and accepted that I am a lesbian and now I would like to figure out how to identify my gender. I don't feel like I am gender fluid or androgynous. So does anybody know if there is a term for someone who is physically female and mentally a male? Thanks!(:  ",genderqueer,Not sure how to identify. ,1345677313.0,"{'created_utc': 1345652113, 'id': 'yn6hn', 'num_comments': 6, 'score': 10, 'selftext': 'I am not sure on how to identify myself. I am physically female and that is perfectly ok. I do not wish to be a male (the thought of having male parts disturbs me 0-0 no offense!) but mentally I feel as if I am a male. Ever since I was a little girl I always played with toys geared toward boys and I hated anything that was even a little girly. Now that I am older and I have started dating I feel that I should be the one taking on the ""male role"" and being the ""dominant one"" In the past year I have come to terms with myself and accepted that I am a lesbian and now I would like to figure out how to identify my gender. I don\'t feel like I am gender fluid or androgynous. So does anybody know if there is a term for someone who is physically female and mentally a male? Thanks!(:  ', 'subreddit': 'genderqueer', 'title': 'Not sure how to identify. ', 'created': 1345677313.0}",
57,2012-08-22 16:34:40,yn7pi,22,19,"After finally starting to accept myself as queer, I've wanted to begin presenting myself as more androgynous or even more on the male spectrum of appearance. My problem is that I look super fucking feminine. 

I have huge boobs. L cup. It's making me crazy because no matter what I do, I still look awkward and lumpy, and not even close to androgynous. Eventually I'll be getting a breast reduction, but that's a while down the road yet and I'd like to start presenting as less female now. 

Any thoughts or advice?",genderqueer,"I want to bind, but my boobs are too big.",1345678480.0,"{'created_utc': 1345653280, 'id': 'yn7pi', 'num_comments': 22, 'score': 19, 'selftext': ""After finally starting to accept myself as queer, I've wanted to begin presenting myself as more androgynous or even more on the male spectrum of appearance. My problem is that I look super fucking feminine. \n\nI have huge boobs. L cup. It's making me crazy because no matter what I do, I still look awkward and lumpy, and not even close to androgynous. Eventually I'll be getting a breast reduction, but that's a while down the road yet and I'd like to start presenting as less female now. \n\nAny thoughts or advice?"", 'subreddit': 'genderqueer', 'title': 'I want to bind, but my boobs are too big.', 'created': 1345678480.0}",
58,2012-08-22 18:15:59,yne87,5,8,"Has anyone else seen this, and if so, do you remember the URL?

EDIT: Aha! http://genderqueeries.tumblr.com/titles I found it. Needed to google some of the terms themselves.",genderqueer,"A while back, I saw a big list of gender-neutral and genderqueer-specific equivalents of usually gendered terms.",1345684559.0,"{'created_utc': 1345659359, 'id': 'yne87', 'num_comments': 5, 'score': 8, 'selftext': 'Has anyone else seen this, and if so, do you remember the URL?\n\nEDIT: Aha! http://genderqueeries.tumblr.com/titles I found it. Needed to google some of the terms themselves.', 'subreddit': 'genderqueer', 'title': 'A while back, I saw a big list of gender-neutral and genderqueer-specific equivalents of usually gendered terms.', 'created': 1345684559.0}",
59,2012-08-22 22:15:07,ynu9n,18,14,"Hi, I'm AMAB, have always been a little uncomfortable with being a man, moreso now than before. I'd like to think when people get to know me, they don't think of me as masculine/man. My physical presentation though is still very dudish though, and I really don't like it and it makes me kinda uncomfortable; I want to look more femme. Any tips on this? I'm kind of against makeup for several reasons, and would prefer not to do much more than a little eyeliner (which I do with some irregularity already). ",genderqueer,How to have a more femme presentation without makeup? ,1345698907.0,"{'created_utc': 1345673707, 'id': 'ynu9n', 'num_comments': 18, 'score': 14, 'selftext': ""Hi, I'm AMAB, have always been a little uncomfortable with being a man, moreso now than before. I'd like to think when people get to know me, they don't think of me as masculine/man. My physical presentation though is still very dudish though, and I really don't like it and it makes me kinda uncomfortable; I want to look more femme. Any tips on this? I'm kind of against makeup for several reasons, and would prefer not to do much more than a little eyeliner (which I do with some irregularity already). "", 'subreddit': 'genderqueer', 'title': 'How to have a more femme presentation without makeup? ', 'created': 1345698907.0}",
60,2012-08-23 00:04:35,yo15o,8,15,"So I only recently discovered my genderqueerness (gender queer-ity?), which is great, I mean YAY I finally know myself a little better. But it also sucks hardcore because thanks to genetics and a long time in sports, the bulk of my uhh... bulk, is muscle. Well that and a little extra, but mostly muscle. I want to start presenting as more androgynous but I have giant man shoulder and a big ol' man chest and I have a core like a barrel.

Are my only options hormones or starvation? I'm totally open to feminizing with hormones but then I'd have to have the trans* but not trans discussion with my parents which would be... not good.

So is there any other way and if so, how? ",genderqueer,Will I ever get rid of these muscles?,1345705475.0,"{'created_utc': 1345680275, 'id': 'yo15o', 'num_comments': 8, 'score': 15, 'selftext': ""So I only recently discovered my genderqueerness (gender queer-ity?), which is great, I mean YAY I finally know myself a little better. But it also sucks hardcore because thanks to genetics and a long time in sports, the bulk of my uhh... bulk, is muscle. Well that and a little extra, but mostly muscle. I want to start presenting as more androgynous but I have giant man shoulder and a big ol' man chest and I have a core like a barrel.\n\nAre my only options hormones or starvation? I'm totally open to feminizing with hormones but then I'd have to have the trans* but not trans discussion with my parents which would be... not good.\n\nSo is there any other way and if so, how? "", 'subreddit': 'genderqueer', 'title': 'Will I ever get rid of these muscles?', 'created': 1345705475.0}",
61,2012-08-23 02:12:17,yo919,3,0,,genderqueer,The Gift of Monstrosity. A documentary a friend of mine is trying to raise money to finish. Looks intriguing!,1345713137.0,"{'created_utc': 1345687937, 'id': 'yo919', 'num_comments': 3, 'score': 0, 'selftext': '', 'subreddit': 'genderqueer', 'title': 'The Gift of Monstrosity. A documentary a friend of mine is trying to raise money to finish. Looks intriguing!', 'created': 1345713137.0}",
62,2012-08-23 17:27:20,ypefm,2,16,,genderqueer,"From ""Community"" creator Dan Harmon's AMA - Cute exchange genderqueer/transwoman and Dan about GQ character Dean Pelton",1345768040.0,"{'created_utc': 1345742840, 'id': 'ypefm', 'num_comments': 2, 'score': 16, 'selftext': '', 'subreddit': 'genderqueer', 'title': 'From ""Community"" creator Dan Harmon\'s AMA - Cute exchange genderqueer/transwoman and Dan about GQ character Dean Pelton', 'created': 1345768040.0}",
63,2012-08-23 18:40:57,ypjdo,31,10,"I took the COGIATI just for fun, because I do think tests like this are sort of dangerous and should never be taken that seriously, but I was pleasantly surprised when it lined up with the identity I have for myself already.  I got a 35, which is pretty much smack dab in the middle of Androgyne, which is the term I have found (with the help of /r/Genderqueer, yey!) that most fits me.  So that is a pleasant surprise!  What do you all think of tests like this?  Have you ever been surprised when you thought something would go one way and it turned out rather nice?",genderqueer,So I took that Gender Test the COGIATI...,1345772457.0,"{'created_utc': 1345747257, 'id': 'ypjdo', 'num_comments': 31, 'score': 10, 'selftext': 'I took the COGIATI just for fun, because I do think tests like this are sort of dangerous and should never be taken that seriously, but I was pleasantly surprised when it lined up with the identity I have for myself already.  I got a 35, which is pretty much smack dab in the middle of Androgyne, which is the term I have found (with the help of /r/Genderqueer, yey!) that most fits me.  So that is a pleasant surprise!  What do you all think of tests like this?  Have you ever been surprised when you thought something would go one way and it turned out rather nice?', 'subreddit': 'genderqueer', 'title': 'So I took that Gender Test the COGIATI...', 'created': 1345772457.0}",
64,2012-08-24 05:12:47,yqmqm,24,24,"For as long as I can remember, I've wondered what it would be like to spend some time as a biological member of the opposite sex. While impossible, it's always been a fun idea to play around with. 

I have no desire to transition or permanently alter my body but I fantasize about what it would be like to have another body of the opposite sex which I could transfer into whenever I felt so inclined. One day female, the next day male. However I felt that particular day. No real restrictions.

While I enjoy all my fantasies, related to this and not, I can't help but feel they are a little ""off"" at times. I've been reading a lot of posts in GQ over the last week and I've really enjoyed my time here. Thought this might be the best place to ask.  Anyone else out have similar thoughts? Would love to hear how others  think/cope/fantasize. ",genderqueer,Temporary Body Swapping,1345810367.0,"{'created_utc': 1345785167, 'id': 'yqmqm', 'num_comments': 24, 'score': 24, 'selftext': 'For as long as I can remember, I\'ve wondered what it would be like to spend some time as a biological member of the opposite sex. While impossible, it\'s always been a fun idea to play around with. \n\nI have no desire to transition or permanently alter my body but I fantasize about what it would be like to have another body of the opposite sex which I could transfer into whenever I felt so inclined. One day female, the next day male. However I felt that particular day. No real restrictions.\n\nWhile I enjoy all my fantasies, related to this and not, I can\'t help but feel they are a little ""off"" at times. I\'ve been reading a lot of posts in GQ over the last week and I\'ve really enjoyed my time here. Thought this might be the best place to ask.  Anyone else out have similar thoughts? Would love to hear how others  think/cope/fantasize. ', 'subreddit': 'genderqueer', 'title': 'Temporary Body Swapping', 'created': 1345810367.0}",
65,2012-08-24 14:31:11,yr6uv,16,7,"I think it's about time I should let my friends know that I see myself as gender neutral but I don't know of alternatives to she and her that won't making the conversation confusing for everyone (like referring back to me as ""they"" as in ""hey where's Aoife246?"" ""they're busy""). Please help.",genderqueer,What are some terms my friends can use instead of she or her when referring to me? ,1345843871.0,"{'created_utc': 1345818671, 'id': 'yr6uv', 'num_comments': 16, 'score': 7, 'selftext': 'I think it\'s about time I should let my friends know that I see myself as gender neutral but I don\'t know of alternatives to she and her that won\'t making the conversation confusing for everyone (like referring back to me as ""they"" as in ""hey where\'s Aoife246?"" ""they\'re busy""). Please help.', 'subreddit': 'genderqueer', 'title': 'What are some terms my friends can use instead of she or her when referring to me? ', 'created': 1345843871.0}",
66,2012-08-24 20:24:21,yrtc1,6,11,"Now, for a long long time I've told friends that personality wise I consider myself pretty androgynous. I never liked a lot of perceptions of ""masculinity"" and there were plenty of things I did or would enjoy that would be considered ""feminine"" But I never really felt very comfortable with either label. But I also didn't really like the idea of cross-dressing either, I don't want to be particularly ""femme""

About a year ago I met a girl that was gender-queer. I learned this once I got over the awkwardness and had to ask her what gender she is. She laughed and explained that she likes androgyne (and finds it funny when people are confused) And I thought it was cool but didn't start to seriously consider it until very recently. I think noticed a page about the ""COGIATI"" which I know doesn't need to be taken super seriously, but when I took it I got exactly 0, right in the middle of androgyne.

So the thought has been there to start to more accurately reflect this, but I'm pretty new to the concept. I don't want to over-femme myself, cause that would certainly make me uncomfortable, but I also don't want it to be so obvious I'm male. I guess I'm just curious to learn more about the idea of gender-queer/androgyne and some tips/ideas/thoughts about it. (I realize a pic would be helpful, but this is a pretty secretive account so I prefer not)",genderqueer,New to/curious about the idea of androgyne/gender-queer,1345865061.0,"{'created_utc': 1345839861, 'id': 'yrtc1', 'num_comments': 6, 'score': 11, 'selftext': 'Now, for a long long time I\'ve told friends that personality wise I consider myself pretty androgynous. I never liked a lot of perceptions of ""masculinity"" and there were plenty of things I did or would enjoy that would be considered ""feminine"" But I never really felt very comfortable with either label. But I also didn\'t really like the idea of cross-dressing either, I don\'t want to be particularly ""femme""\n\nAbout a year ago I met a girl that was gender-queer. I learned this once I got over the awkwardness and had to ask her what gender she is. She laughed and explained that she likes androgyne (and finds it funny when people are confused) And I thought it was cool but didn\'t start to seriously consider it until very recently. I think noticed a page about the ""COGIATI"" which I know doesn\'t need to be taken super seriously, but when I took it I got exactly 0, right in the middle of androgyne.\n\nSo the thought has been there to start to more accurately reflect this, but I\'m pretty new to the concept. I don\'t want to over-femme myself, cause that would certainly make me uncomfortable, but I also don\'t want it to be so obvious I\'m male. I guess I\'m just curious to learn more about the idea of gender-queer/androgyne and some tips/ideas/thoughts about it. (I realize a pic would be helpful, but this is a pretty secretive account so I prefer not)', 'subreddit': 'genderqueer', 'title': 'New to/curious about the idea of androgyne/gender-queer', 'created': 1345865061.0}",
67,2012-08-24 23:51:28,ys5ux,5,5,,genderqueer,Transgender Rapper Mykki Blanco Premieres 'Wavvy' Video,1345877488.0,"{'created_utc': 1345852288, 'id': 'ys5ux', 'num_comments': 5, 'score': 5, 'selftext': '', 'subreddit': 'genderqueer', 'title': ""Transgender Rapper Mykki Blanco Premieres 'Wavvy' Video"", 'created': 1345877488.0}",
68,2012-08-25 02:57:02,ysfoy,15,20,"Context: I consider myself genderqueer (physically female, feel much more masculine, though not to the point where I'd consider myself trans, as I love my female body quite a bit).

When it comes to who I find myself attracted to, it's always people who are masculine.  Masculine men, masculine lesbians, FTM trans folk who aren't particularly femme, and tomboys.  I seem to be attracted to masculinity, regardless of the gender or sexuality of the person.

Is there a name for that?",genderqueer,What is it called when you're attracted to a particular gender expression?,1345888622.0,"{'created_utc': 1345863422, 'id': 'ysfoy', 'num_comments': 15, 'score': 20, 'selftext': ""Context: I consider myself genderqueer (physically female, feel much more masculine, though not to the point where I'd consider myself trans, as I love my female body quite a bit).\n\nWhen it comes to who I find myself attracted to, it's always people who are masculine.  Masculine men, masculine lesbians, FTM trans folk who aren't particularly femme, and tomboys.  I seem to be attracted to masculinity, regardless of the gender or sexuality of the person.\n\nIs there a name for that?"", 'subreddit': 'genderqueer', 'title': ""What is it called when you're attracted to a particular gender expression?"", 'created': 1345888622.0}",
69,2012-08-25 21:02:08,ytlz6,0,1,"Found an interesting episode of Star Trek the Next Generation on Netflix:

""While aiding an androgynous race who lost a couple of members in an unmapped region of space, Riker falls for one of them, which can lead to trouble if detected, since the alien race does not endorse gender specificity.  http://www.imdb.com/title/tt0708815/ ""

Good Ol' Riker.  Always falling in love with everyone.  The episode does an alright job, I don't know if it is perfect, but it's interesting.  Has a few really neat bits in it.  Like how on the alien's planet people who prefer a specific gender are shunned and ""treated.""  Interesting, if not obvious, commentary.

A quote from the episode:
""Soren: I am female. I was born that way. I have had those feelings, those longings, all of my life. It is not unnatural. I am not sick because I feel this way. I do not need to be helped. I do not need to be cured. What I need, and what all of those who are like me need, is your understanding. And your compassion. We have not injured you in any way. And yet we are scorned and attacked. And all because we are different. What we do is no different from what you do. We talk, and laugh. We complain about work. And we wonder about growing old. We talk about our families, and we worry about the future. And we cry with each other when things seem hopeless. All of the loving things that you do with each other, that is what we do. And for that, we are called misfits, and deviants, and criminals. What right do you have to punish us? What right do you have to change us? What makes you think you can dictate how people love each other?
Noor: I congratulate you, Soren. Your decision to admit your perversion makes it much more likely that we can help you."" ",genderqueer,Just discovered an interesting episode of Star Trek: TNG about an Androgenous race.,1345953728.0,"{'created_utc': 1345928528, 'id': 'ytlz6', 'num_comments': 0, 'score': 1, 'selftext': 'Found an interesting episode of Star Trek the Next Generation on Netflix:\n\n""While aiding an androgynous race who lost a couple of members in an unmapped region of space, Riker falls for one of them, which can lead to trouble if detected, since the alien race does not endorse gender specificity.  http://www.imdb.com/title/tt0708815/ ""\n\nGood Ol\' Riker.  Always falling in love with everyone.  The episode does an alright job, I don\'t know if it is perfect, but it\'s interesting.  Has a few really neat bits in it.  Like how on the alien\'s planet people who prefer a specific gender are shunned and ""treated.""  Interesting, if not obvious, commentary.\n\nA quote from the episode:\n""Soren: I am female. I was born that way. I have had those feelings, those longings, all of my life. It is not unnatural. I am not sick because I feel this way. I do not need to be helped. I do not need to be cured. What I need, and what all of those who are like me need, is your understanding. And your compassion. We have not injured you in any way. And yet we are scorned and attacked. And all because we are different. What we do is no different from what you do. We talk, and laugh. We complain about work. And we wonder about growing old. We talk about our families, and we worry about the future. And we cry with each other when things seem hopeless. All of the loving things that you do with each other, that is what we do. And for that, we are called misfits, and deviants, and criminals. What right do you have to punish us? What right do you have to change us? What makes you think you can dictate how people love each other?\nNoor: I congratulate you, Soren. Your decision to admit your perversion makes it much more likely that we can help you."" ', 'subreddit': 'genderqueer', 'title': 'Just discovered an interesting episode of Star Trek: TNG about an Androgenous race.', 'created': 1345953728.0}",
70,2012-08-25 22:08:46,ytpqr,18,33,"Found an interesting episode of Star Trek the Next Generation on Netflix:

""While aiding an androgynous race who lost a couple of members in an unmapped region of space, Riker falls for one of them, which can lead to trouble if detected, since the alien race does not endorse gender specificity.  http://www.imdb.com/title/tt0708815/ ""

Good Ol' Riker.  Always falling in love with everyone.  The episode does an alright job, I don't know if it is perfect, but it's interesting.  Has a few really neat bits in it.  Like how on the alien's planet people who prefer a specific gender are shunned and ""treated.""  Interesting, if not obvious, commentary.

A quote from the episode:
""Soren: I am female. I was born that way. I have had those feelings, those longings, all of my life. It is not unnatural. I am not sick because I feel this way. I do not need to be helped. I do not need to be cured. What I need, and what all of those who are like me need, is your understanding. And your compassion. We have not injured you in any way. And yet we are scorned and attacked. And all because we are different. What we do is no different from what you do. We talk, and laugh. We complain about work. And we wonder about growing old. We talk about our families, and we worry about the future. And we cry with each other when things seem hopeless. All of the loving things that you do with each other, that is what we do. And for that, we are called misfits, and deviants, and criminals. What right do you have to punish us? What right do you have to change us? What makes you think you can dictate how people love each other?
Noor: I congratulate you, Soren. Your decision to admit your perversion makes it much more likely that we can help you."" 

Why society?!  Why!?",genderqueer,Just watched an interesting episode of Star Trek: TNG that deals with an androgynous race,1345957726.0,"{'created_utc': 1345932526, 'id': 'ytpqr', 'num_comments': 18, 'score': 33, 'selftext': 'Found an interesting episode of Star Trek the Next Generation on Netflix:\n\n""While aiding an androgynous race who lost a couple of members in an unmapped region of space, Riker falls for one of them, which can lead to trouble if detected, since the alien race does not endorse gender specificity.  http://www.imdb.com/title/tt0708815/ ""\n\nGood Ol\' Riker.  Always falling in love with everyone.  The episode does an alright job, I don\'t know if it is perfect, but it\'s interesting.  Has a few really neat bits in it.  Like how on the alien\'s planet people who prefer a specific gender are shunned and ""treated.""  Interesting, if not obvious, commentary.\n\nA quote from the episode:\n""Soren: I am female. I was born that way. I have had those feelings, those longings, all of my life. It is not unnatural. I am not sick because I feel this way. I do not need to be helped. I do not need to be cured. What I need, and what all of those who are like me need, is your understanding. And your compassion. We have not injured you in any way. And yet we are scorned and attacked. And all because we are different. What we do is no different from what you do. We talk, and laugh. We complain about work. And we wonder about growing old. We talk about our families, and we worry about the future. And we cry with each other when things seem hopeless. All of the loving things that you do with each other, that is what we do. And for that, we are called misfits, and deviants, and criminals. What right do you have to punish us? What right do you have to change us? What makes you think you can dictate how people love each other?\nNoor: I congratulate you, Soren. Your decision to admit your perversion makes it much more likely that we can help you."" \n\nWhy society?!  Why!?', 'subreddit': 'genderqueer', 'title': 'Just watched an interesting episode of Star Trek: TNG that deals with an androgynous race', 'created': 1345957726.0}",
